DateTime,Title,Link,Description,PubDate
2025-12-09 15:51:22,"이광재 “GPU는 밥솥, 데이터는 쌀… 개방해야 산다”",http://www.newstomato.com/ReadNews.aspx?no=1284402&inflow=N,"데이터·조선·<b>반도체</b>·방산 생태계는 피지컬 AI에 유리하다는 점을 꼽았습니다. 마지막으로 이 전 지사는 “자신감을 가졌으면 좋겠다”고 당부했습니다. “제가 자랄 때 영화는 홍콩, 만화는 일본, 노래는 팝송이었다.... ","Wed, 10 Dec 2025 00:44:00 +0900"
2025-12-09 15:51:22,"[주식] 코스피, 미 금리인하 가능성 속에서 관망세 이어져...<b>반도체</b>주는...",http://www.biztribune.co.kr/news/articleView.html?idxno=345141,"국내 <b>반도체</b> 종목들이 차익실현세를 보이기도 했다. 이경민 대신증권 연구원은 &quot;국내 증시는 전날... 작용했고, <b>반도체</b> 업종은 기술주 상승에도 훈풍 유입이 제한됐다&quot;고 분석했다. 이번 회의에서는 미국... ","Wed, 10 Dec 2025 00:40:00 +0900"
2025-12-09 15:51:22,"“숫자 밝아야 위기 극복”… 건설사, 재무통 CEO 발탁 잇따라",https://n.news.naver.com/mnews/article/023/0003945946?sid=101,SK에코플랜트는 지난 2년여간 상장 준비 차원에서 ‘탈(脫) 건설’을 외치며 사업 포트폴리오를 성장성 높은 <b>반도체</b> 중심으로 이미 바꿨다. 따라서 이번에 SK하이닉스 내부 인사이자 재무와 전략기획 전문가인 김 대표를... ,"Wed, 10 Dec 2025 00:38:00 +0900"
2025-12-09 15:51:22,[윤성민 칼럼] 日·中 갈등이 남의 얘기가 아닌 이유,https://n.news.naver.com/mnews/article/015/0005222351?sid=110,"중국이 <b>반도체</b> 공급망을 장악하고 해상 수송로를 봉쇄하는 일은 일본으로선 좌시할 수 없는 위기 상황이다. 현재 중·일 갈등은 실제 사건에서 비롯된 게 아니다. 발언으로 촉발된 것이고, 일어날 법한 일을 가정해... ","Wed, 10 Dec 2025 00:36:00 +0900"
2025-12-09 15:51:22,"한진家 대 이은 USC 인연… 조원태 회장, 韓총동문회장에",https://n.news.naver.com/mnews/article/023/0003945942?sid=101,<b>반도체</b> 장비 기업 러셀의 권순욱 회장의 동문회장 자리를 물려받았다. USC 한국 총동문회는 “항공·물류 산업을 이끌어온 리더로서 조 회장의 경험과 비전이 앞으로 동문회를 더욱 단단하고 활기찬 공동체로 이끌어줄... ,"Wed, 10 Dec 2025 00:34:00 +0900"
2025-12-09 15:51:22,"美, 엔비디아 AI칩 ‘H200’ 中에 수출 허용",https://n.news.naver.com/mnews/article/023/0003945936?sid=105,한편 H200의 수출 재개가 고대역폭 메모리(HBM)를 개발해 엔비디아에 납품하는 국내 <b>반도체</b> 기업에도 호재라는 평가가 나온다. H200에는 HBM3E 8단 제품을 탑재한다. 하이닉스는 엔비디아에 HBM 제품을 납품 중이고... ,"Wed, 10 Dec 2025 00:32:00 +0900"
2025-12-09 15:51:22,"정부 '재생에너지 100GW' 계획, 송전망 갈등의 벽 뚫어야",https://www.esgeconomy.com/news/articleView.html?idxno=13754,용인 <b>반도체</b> 클러스터 조감도. 사진=연합뉴스 이재명 정부가 제시한 2030년 재생에너지 100GW 달성 목표는... 지역 간 불공정 구조...'에너지 식민지' 반발 용인 <b>반도체</b> 메가클러스터는 필요한 10GW 규모의 재생에너지... ,"Wed, 10 Dec 2025 00:22:00 +0900"
2025-12-09 15:51:22,"한국교통대 <b>반도체</b>신소재공학과 학부생, 국제 학술지 ‘<b>반도체</b> 자성체...",http://www.breaknews.com/1167887,국립한국교통대학교는 <b>반도체</b>신소재공학과 이지은 학생(4학년)과 구진원 학생... 차세대 <b>반도체</b> 기술의 설계 원리 제시에 기여할 수 있는 응용 가능성을 제시했다.... ,"Wed, 10 Dec 2025 00:16:00 +0900"
2025-12-09 15:51:22,원주시민 3만여명 지역 현안 해결에 동참,https://n.news.naver.com/mnews/article/087/0001160606?sid=102,"주요 현안은 원주공항 시설개선으로 국제선 유치 여건 조성, 2차 공공기관 이전 원주 유치, 원주 AI·디지털 기반 첨단의료복합단지 조성, 강원권 K-<b>반도체</b> 클러스터 집중 육성, 대도시 간주요건 완화 등 5가지다. 원은향... ","Wed, 10 Dec 2025 00:12:00 +0900"
2025-12-09 15:51:22,"LS전선, 업계 최초 UL ‘폐기물 매립 제로 인증’ 획득",https://n.news.naver.com/mnews/article/087/0001160572?sid=102,"재활용이 가능한 폴리프로필렌(PP) 절연 소재 케이블을 한국전력과의 시범사업을 통해 실증한 후 화학, <b>반도체</b> 플랜트와 데이터센터 등 다양한 산업 분야로 적용을 확대하고 있다.","Wed, 10 Dec 2025 00:10:00 +0900"
2025-12-09 15:51:22,'<b>반도체</b> 기업' 세미파이브 수요예측...상장일과 청약일정 '확인',https://www.gukjenews.com/news/articleView.html?idxno=3452401,"세미파이브 공모주 로고 <b>반도체</b> 설계기업 세미파이브는 10일부터 3일간 수요예측을 진행한다. 이번... 세미파이브는 2019년 설립된 AI <b>반도체</b> 설계 전문 기업으로, 삼성전자 파운드리의 공식 DSP로 등록된 국내 유일... ","Wed, 10 Dec 2025 00:10:00 +0900"
2025-12-09 15:51:22,1조79억원 규모 강원형 첨단산업 전략 '가동',https://n.news.naver.com/mnews/article/654/0000155892?sid=100,"사상 첫 국비 10조원 시대를 연 강원도가 <b>반도체</b>를 비롯한 첨단산업 분야에 집중 투자해 산업구조 전환을 단계적으로 추진한다. 내년도 국비 10조2600억원을 확보한 도는 <b>반도체</b>, 바이오헬스, 미래차, AI, 기후테크... ","Wed, 10 Dec 2025 00:08:00 +0900"
2025-12-09 15:51:22,강원 첨단산업 전환 가시화…‘세라믹·바이오·자율주행’ 실증 착수,https://n.news.naver.com/mnews/article/087/0001160512?sid=100,"■ <b>반도체</b>·바이오·자율주행 등 핵심 사업 '꿈틀'= <b>반도체</b> 분야에서는 강릉의 세라믹 기반 <b>반도체</b> 소재부품 공정혁신 사업이 내년 본격화된다. 국내 수요는 크면서도 국산화가 더딘 영역으로, 강릉이 세라믹 소부장 특화... ","Wed, 10 Dec 2025 00:07:00 +0900"
2025-12-09 15:51:22,&quot;시민사회 역량 결집 새로운 원주 도약&quot;,https://n.news.naver.com/mnews/article/654/0000155870?sid=102,"K-<b>반도체</b> 클러스터 집중 육성, 대도시 특례 지정 요건 완화 등 원주의 미래 성장 전략과 직결된 핵심 과제들을... (K-<b>반도체</b> 클러스터 육성) △강동철 원주시이통장연합회장(대도시 특례 완화) 등이다. 원은향 위원장은... ","Wed, 10 Dec 2025 00:07:00 +0900"
2025-12-09 15:51:22,"마지막 정기국회 '필리'로 마무리…임시국회, 사법개혁 진통 불가피",http://www.m-i.kr/news/articleView.html?idxno=1313099,민주당은 이날 본회의에서 여야가 산업통상자원중소벤처기업위원회에서 합의 처리한 '<b>반도체</b>산업 경쟁력 강화 및 지원에 관한 특별법안' 등 민생·비쟁점 법안을 처리하자는 입장인 것으로 전해졌다. 반면 국민의힘은... ,"Wed, 10 Dec 2025 00:06:00 +0900"
2025-12-09 15:51:22,"애플 <b>반도체</b> 수장 조니 스루지, 퇴사설 일축…“당분간 남는다”",https://www.tokenpost.kr/news/tech/312910,"가운데, <b>반도체</b> 개발을 이끄는 조니 스루지 수석 부사장은 최소한 당분간은 회사를 떠날 계획이 없다는 뜻을 공개적으로 밝혔다. 조니 스루지는 2008년부터 애플에 합류해 아이폰, 맥북 등에 탑재되는 자체 <b>반도체</b> 칩... ","Wed, 10 Dec 2025 00:04:00 +0900"
2025-12-09 15:51:22,전남도교육청 &quot;AI·에너지 교육밸리 구축&quot;,http://www.gjdream.com/news/articleView.html?idxno=664847,"또 AI 산업의 특성을 반영해 전기, 냉각, 정밀제조, 모빌리티, <b>반도체</b>, 클라우드 등 다양한 분야에서 학생들이 꿈을 펼칠 수 있도록 직업계고 재구조화와 마이스터고 육성을 추진한다. 이를 통해 산업 수요에 맞춘... ","Wed, 10 Dec 2025 00:02:00 +0900"
2025-12-09 15:51:22,"엔비디아 AI칩 ‘H200’, 트럼프, 중국 수출 허용…한국 HBM도 수혜 기대",https://n.news.naver.com/mnews/article/025/0003488688?sid=101,"중국은 그동안 미국의 제재 강화 속에서도 <b>반도체</b> 기술력을 발전시켜왔다. 화웨이 등 중국 기업들은... 이에 따라 미국은 옥죄는 방식에서 벗어나, 중국에 <b>반도체</b>를 판매하며 미국에 대한 의존도를 높이는 방식으로... ","Wed, 10 Dec 2025 00:02:00 +0900"
2025-12-09 15:51:22,프로젝트 성공률 100% 차량 사이버 보안 '페스카로' 오늘(10일) 코스닥 상...,http://www.newswell.co.kr/news/articleView.html?idxno=14941,"8개 <b>반도체</b>사와 56개 <b>반도체</b> 모델의 호환성을 확보하는 등 독보적인 양산 이력도 갖췄다. /자료=한국거래소 코스닥시장본부 페스카로는 지난해 매출 143억1900만원, 영업이익 13억2300만원, 순손실 78억7200만원을... ","Wed, 10 Dec 2025 00:02:00 +0900"
2025-12-09 15:51:22,“<b>반도체</b> 부품 배송량 30% 늘었다”…물류업도 ‘수퍼사이클’,https://n.news.naver.com/mnews/article/025/0003488680?sid=101,"특수 맞은 <b>반도체</b> 물류업 9일 오전 경기도 평택종합물류단지의 한 물류창고. 6500㎡(약 2000평) 규모 내부는... 이곳은 <b>반도체</b> 전문 물류기업의 창고로, 어플라이드머티어리얼즈(AMAT)와 엑셀리스(Axcelis) 등 글로벌 <b>반도체</b>... ","Wed, 10 Dec 2025 00:01:00 +0900"
2025-12-09 15:51:22,"AI 데이터센터 확충, 전력 공급 문제 해결이 우선",https://www.cbci.co.kr/news/articleView.html?idxno=544149,최경진 가천대 법과대학 교수는 &quot;AI 구동에 필수적인 데이터센터와 <b>반도체</b> 공장 건설을 가속화하기 위해 환경 영향 평가 등 인허가 절차를 간소화하고 AI 전력 수요를 충당하기 위한 인프라 확충을 국가적 우선순위로... ,"Wed, 10 Dec 2025 00:01:00 +0900"
2025-12-09 15:51:22,'150조 국민성장펀드' 신혜숙 부행장에 맡긴다…AI·<b>반도체</b>·바이오 집중...,https://www.ppss.kr/news/articleView.html?idxno=278013,"국민성장펀드는 AI, <b>반도체</b>, 바이오 등 첨단 전략산업에 집중 투자하기 위해 설립되는 정책 펀드로, 앞으로 5년간 150조원 이상의 투자를 목표로 하고 있다. 이 펀드는 10일 공식적으로 출범할 계획이다.","Tue, 09 Dec 2025 23:50:00 +0900"
2025-12-09 15:51:22,서수원 에피트 센트럴마크 M1·M2블록...중소형 인기 업고 1순위 '나름 선...,https://www.straightnews.co.kr/news/articleView.html?idxno=288691,"인근에서 진행 중인 수원R&amp;D사이언스파크(입북동 일원 35만㎡)와 탑동이노베이션밸리(탑동 일원 26만㎡) 등 <b>반도체</b>, 바이오, AI 첨단산업단지 조성사업도 호재다. 수원시는 두 산단을 묶어 '수원 경제자유구역... ","Tue, 09 Dec 2025 23:46:00 +0900"
2025-12-09 15:51:22,"[김정호의 AI시대 전략] 인공지능은 ‘오픈북 시험’으로 학습, 학교는...",https://n.news.naver.com/mnews/article/023/0003945925?sid=103,"컴퓨터에는 GPU, TPU 같은 프로세서, 그리고 HBM 같은 메모리 <b>반도체</b>가 대량으로 필요하다. 다음 단계로 ‘추론’이 있다. 인간의 요청, 즉 프롬프트(Prompt)에 맞추어 결과물인 출력을 생성한다. 이때 수만 혹은 수억 명이... ","Tue, 09 Dec 2025 23:44:00 +0900"
2025-12-09 15:51:22,"[시황 분석] 미국 뉴욕증시 장초반, FOMC 경계 '리스크 오프'… 테슬라↑...",https://www.topstarnews.net/news/articleView.html?idxno=15900849,"73% 상승했으나, <b>반도체</b> 3배 레버리지인 SOXL(디렉션 데일리 세미컨덕터 불 3X)은 2.16% 급락하며 변동성의... 특히 나스닥 100 지수가 0.16% 하락하고 필라델피아 <b>반도체</b> 지수 관련 종목들이 약세를 보이는 점은 기술주... ","Tue, 09 Dec 2025 23:42:00 +0900"
2025-12-09 15:51:22,"화성특례시, 삼성전자·㈜에이치테크노밸리와 ‘H-테크노밸리 일반산업...",https://www.geconomy.co.kr/news/article.html?no=311856,- 평택·고창 잇는 삼성전자의 3번째 대형 물류거점 조성 - ‘최첨단 자동화 CDC’ 구축으로 <b>반도체</b>·미래차... H-테크노밸리 일반산업단지는 화성시 양감면 요당리 일원에 73만 6천㎡ 규모로 조성 중인 <b>반도체</b>·자동차... ,"Tue, 09 Dec 2025 23:36:00 +0900"
2025-12-09 15:51:22,12월 2주 주요 제조업 전망,https://www.laborplus.co.kr/news/articleView.html?idxno=36726,"1주 <b>반도체</b> 가격(DRAM 12월 9일 기준, NAND 12월 1일 기준) - DRAM: DDR4 16Gb(2Gx8)3200 47.125달러(전주 대비 +0.53%), DDR4... 현지시간 지난 4일 미국 양당 상원의원들은 중국에 대한 AI <b>반도체</b> 수출 규제 완화를 방지하는 법안을... ","Tue, 09 Dec 2025 23:33:00 +0900"
2025-12-09 15:51:22,"[W 언박싱] 트럼프, 엔비디아 H200 ‘중국행’ 전격 승인…<b>반도체</b> 전쟁...",https://n.news.naver.com/mnews/article/056/0012082743?sid=104,"지금까지 미국의 대중국 <b>반도체</b> 전략은 '봉쇄'였죠. 미국 <b>반도체</b> 기업들의 대중 수출을 철저히 통제해왔었는데, 트럼프 대통령이 자신의 SNS를 통해 엔비디아의 고성능 AI칩 H200의 중국 수출을 허가한다고 밝혔습니다.... ","Tue, 09 Dec 2025 23:28:00 +0900"
2025-12-09 15:51:22,[사설]엔비디아 고성능 칩 中 수출 허용… 美도 못 막는 中 ‘AI 굴기’,https://n.news.naver.com/mnews/article/020/0003680537?sid=110,<b>반도체</b> 기업들은 이번 조치로 이득을 볼 거란 분석이 있다. 하지만 더 주목해야 할 부분은 미국이 통제를 풀어야 할 정도로 가파르게 성장한 중국의 AI 경쟁력이다. 중국은 한국이 선두인 HBM 등 첨단 메모리<b>반도체</b>... ,"Tue, 09 Dec 2025 23:25:00 +0900"
2025-12-09 15:51:22,기계에게 위로받는 시대… AI와의 감정 교류가 촉발한 ‘인지혁명 2.0’...,https://n.news.naver.com/mnews/article/020/0003680529?sid=110,문명의 대전환으로 귀착될 ‘제2 인지혁명’이 시작되고 있는 이 시점에 각국 정부는 AI <b>반도체</b> 확보와 대규모언어모델(LLM) 개발 등에 천문학적 예산을 쏟아붓고 있다. 하지만 이 혁명이 인간의 정체성에 미칠 영향에... ,"Tue, 09 Dec 2025 23:07:00 +0900"
2025-12-09 15:51:22,"전남교육청, 'AI 에너지 교육밸리 구축' 비전 선언",http://www.koreareport.co.kr/news/articleView.html?idxno=42167,"수많은 일자리 확대와 고용 창출로 이어지는 AI 산업의 특성을 반영해 전기, 냉각, 정밀제조, 모빌리티, <b>반도체</b>, 클라우드 등 다양한 분야에서 아이들이 꿈을 펼칠 수 있도록 직업계고 재구조화와 마이스터고 육성을... ","Tue, 09 Dec 2025 23:04:00 +0900"
2025-12-09 15:51:22,"[美특징주]마이크론, &quot;추가 상승 여력 충분&quot;…도이체방크 목표가 상향",https://n.news.naver.com/mnews/article/018/0006180587?sid=101,<b>반도체</b> 제조업체 도이체방크는 마이크론테크놀로지(MU)에 대한 목표가를 상향했다. 추가 상승 여력이 충분하다는 의견이다. 마이크론 주가는 올해만 193% 올랐다. 9일(현지시간) 도이체방크는 마이크론에 대한... ,"Tue, 09 Dec 2025 22:50:00 +0900"
2025-12-09 15:51:22,"뉴욕 증시 프리뷰, FOMC 앞두고 주가 선물 보합...엔비디아·인텔·워너...",https://www.newspim.com/news/view/20251209001095,"일부 <b>반도체</b> 관련주의 주가가 강세를 보였지만, 시장 전반의 경계심은 여전했다. 시카고상품거래소(CME)... 트럼프가 &quot;다른 <b>반도체</b> 업체에도 유사한 정책을 적용할 것&quot;이라고 언급한 여파다. 기술주는 전날... ","Tue, 09 Dec 2025 22:34:00 +0900"
2025-12-09 15:51:22,"전남교육청, 'AI 에너지 교육밸리 구축' 비전 선언",https://www.asiaa.co.kr/news/articleView.html?idxno=233309,"둘째, 직업계고 재설계와 산학 연계 시스템 강화를 통해 전기·정밀제조·모빌리티·<b>반도체</b>·클라우드 등 AI 기반 산업 현장에 필요한 전문 기술 인력을 양성할 방침이다. 전문대학·폴리텍대학·지역 산업체와의 협력도... ","Tue, 09 Dec 2025 22:28:00 +0900"
2025-12-09 15:51:22,"영국 테라뷰, 코스닥 첫날 공모가 두 배 급등…기술력에 뜨거운 관심",https://www.tokenpost.kr/news/market/312857,"전자기파로, <b>반도체</b>나 2차전지 등 나노기술 기반의 산업 분야에서 물질의 내부 구조를 비파괴 방식으로 정밀하게 분석할 수 있는 기술로 주목받고 있다. 테라뷰는 이러한 기술력을 바탕으로 <b>반도체</b>와 2차전지 산업... ","Tue, 09 Dec 2025 22:18:00 +0900"
2025-12-09 15:51:22,경기도 '2025년 융합기술 데모데이' 성황리 개최,https://www.jeonmae.co.kr/news/articleView.html?idxno=1210522,기업설명(IR 피칭)에는 ▲㈜베큐멕스(<b>반도체</b> 장비용 고신뢰성 부품 및 소재 검증 솔루션) ▲㈜딥페이스(AI 기반 이미지 자동 생성·가공 스마트툴) ▲주식회사 반조(손가락 절단 환자용 기능성 의수 개발) ▲그레이트웨이브... ,"Tue, 09 Dec 2025 22:06:00 +0900"
2025-12-09 15:51:22,"2026년 시장, 상반기 랠리 뒤 흔들릴까… 증권가 '중반 변동성' 경고",http://www.womentimes.co.kr/news/articleView.html?idxno=93047,"우먼타임스 = 성민 기자 국내 주요 증권사들이 2026년 금융시장을 인공지능(AI)과 <b>반도체</b>를 중심으로 한... <b>반도체</b> 수출이 성장의 절대적 동력으로 떠오르는 반면, 내수는 금리 인하에도 빠른 회복을 기대하기 어렵다는... ","Tue, 09 Dec 2025 22:02:00 +0900"
2025-12-09 15:51:22,"'해외수주 상징'한국-튀르키예 민관 프로젝트, 갈길 멀어...수익률 확보...",https://www.greened.kr/news/articleView.html?idxno=334069,"또한 <b>반도체</b> FAB·데이터센터 등 하이테크 사업 비중을 확대하고 있으며, 환경 계열사 매각·재무 리스크 조정 이후 PPP 신규투자 확대 가능성은 과거 대비 낮아진 상황으로 읽힌다. 장기 운영자산은 유지하되 확장... ","Tue, 09 Dec 2025 22:02:00 +0900"
2025-12-09 15:51:22,"브릴스, 지텍과 공동파트너 협약",https://n.news.naver.com/mnews/article/092/0002401717?sid=105,"전진 브릴스 대표(왼쪽)와 최부식 지텍 대표가 기념 촬영을 하고 있다.(사진=브릴스) 지텍은 천안·세종 등 충청권 지역을 거점으로 디스플레이, <b>반도체</b>, 이차전지 등 첨단 산업 분야에서 로봇 자동화 시스템을 구축해 온... ","Tue, 09 Dec 2025 21:54:00 +0900"
2025-12-09 15:51:22,"경기도·융기원, '2025 융합기술 데모데이' 개최",http://www.seoulwire.com/news/articleView.html?idxno=684899,IR 피칭에는 ▲㈜베큐멕스(<b>반도체</b> 장비용 고신뢰성 부품·소재 검증 솔루션) ▲㈜딥페이스(AI 기반 이미지 자동 생성·가공 스마트툴) ▲주식회사 반조(손가락 절단 환자용 기능성 의수) ▲그레이트웨이브(웹툰 공동 창작... ,"Tue, 09 Dec 2025 21:52:00 +0900"
2025-12-09 15:51:22,[아주경제 오늘의 뉴스종합] [천정부지 닥터 코퍼] ABC 리스크에 '구리 ...,https://www.ajunews.com/view/20251209214427370,슈퍼 사이클(초호황)을 맞이한 <b>반도체</b>와 캐즘(일시적 수요 정체)에서 벗어나려는 전기차 산업에 찬물을... 높은 도전율과 열전도율에 힘입어 AI 학습·추론에 필요한 <b>반도체</b>·기판과 발열 문제 해소를 위한 냉각 설비... ,"Tue, 09 Dec 2025 21:48:00 +0900"
2025-12-09 15:51:22,“용인 산단 위한 송전선로 반대”…곳곳서 ‘백지화 요구’ 봇물,https://n.news.naver.com/mnews/article/056/0012082585?sid=102,[앵커] 경기도 용인에 들어설 <b>반도체</b> 국가 산단 구축을 위해 추진 중인 신계룡~북천안 송전선로 건설을 놓고... &quot;] 해당 선로는 전북에서 신재생에너지로 생산한 전기를 신계룡 변전소를 거쳐 경기도 용인의 <b>반도체</b>... ,"Tue, 09 Dec 2025 21:36:00 +0900"
2025-12-09 15:51:22,"지멘스, 산업용 AI로 최대 30% 에너지 절감… 회피배출은 독일 연간 배출...",http://www.impacton.net/news/articleView.html?idxno=17315,"<b>반도체</b>·화학 등 감축 여력이 제한적인 제조업이 기술 기반 감축 기여도를 설명할 때 활용하는 방식으로, 지멘스는 이를 통해 자사 솔루션이 고객 감축 성과에 미치는 영향력을 강조하고 있다. 산업용 AI가 에너지 절감... ","Tue, 09 Dec 2025 21:36:00 +0900"
2025-12-09 15:51:22,“수도권 쏠림은 지역 격차가 만든 구조 문제”,http://www.knnews.co.kr/news/articleView.php?idxno=1476992,"토크콘서트 이후 김 위원장은 인제대의 의료 시뮬레이션센터, 자율주행 실험공간, <b>반도체</b> 클린룸 등 첨단 교육 기반시설을 둘러보고 “대학의 실험·교육 시설은 지역 산업경쟁력의 기반”이라고 평가했다. 이어... ","Tue, 09 Dec 2025 21:30:00 +0900"
2025-12-09 15:51:22,‘AI 투자 시대’ 이익충돌 방지 위한 기업 거버넌스 원칙 지켜야[천준...,https://n.news.naver.com/mnews/article/032/0003414207?sid=101,| 천준범 한국기업거버넌스포럼 부회장 최근 인공지능(AI)과 <b>반도체</b> 산업의 경쟁 우위를 선점하기 위한 대규모 투자가 국가적 과제가 됐다. SK하이닉스의 용인 <b>반도체</b> 클러스터 조성에 필요한 자금만 약 600조원으로... ,"Tue, 09 Dec 2025 21:29:00 +0900"
2025-12-09 15:51:22,"‘금성사’로 출발, K전자산업의 산실…LG전자 ‘가산 R&amp;D 캠퍼스’ 설립...",https://n.news.naver.com/mnews/article/032/0003414205?sid=101,"앞서 연구소는 1977년 전자식 금전등록기(POS)의 국산화 성공을 시작으로 국내 첫 전자식 한영 타자기 출시, 주문형 <b>반도체</b> 독자 개발 등 한국 전자산업에 이정표를 세웠다. LG전자는 “1981년 전자식 비디오테이프... ","Tue, 09 Dec 2025 21:27:00 +0900"
2025-12-09 15:51:22,중국 수출 빗장 풀린 고성능 H200…미국기업 위협 가능성,https://n.news.naver.com/mnews/article/056/0012082581?sid=104,"우리가 <b>반도체</b>를 중국에 판다면, 그들은 더 빨리 경쟁력을 확보할 것입니다. 이는 상식적인 이야기입니다.... 다만, 중국이 집중적인 지원 속에 자체 <b>반도체</b>와 AI 칩 개발에 성과를 내고 있는 만큼 기존 구도가 크게... ","Tue, 09 Dec 2025 21:25:00 +0900"
2025-12-09 15:51:22,"[사설] 고환율의 경고음, 더 이상 방치해서는 안 된다",https://www.idaegu.co.kr/news/articleView.html?idxno=532287,"비록 수출이 <b>반도체</b> 호황에 힘입어 선방하고 있지만 성장률은 1%대에 머물고, 소비자 물가는 상승하는 등 체감 경기는 바닥이다. 그럼에도 증시는 4,000선을 넘어 정부가 공언하는 5,000선을 향해 나아가고 있다. 이는 자칫... ","Tue, 09 Dec 2025 21:24:00 +0900"
2025-12-09 15:51:22,전남교육청 ‘AI 에너지 교육밸리 구축’ 비전 선언,https://www.thepowernews.co.kr/view.php?ud=202512091821545579caa2b7671d_7,"즉, 일자리 확대와 고용 창출로 이어지는 AI 산업의 특성을 반영해 전기, 냉각, 정밀제조, 모빌리티, <b>반도체</b>, 클라우드 등 다양한 분야에서 꿈을 펼칠 수 있도록 직업계고 재구조화와 마이스터고 육성을 추진할 계획이다.... ","Tue, 09 Dec 2025 21:18:00 +0900"
2025-12-09 15:51:22,미국 'H200 수출 허용'에 중국 &quot;양국 협력해야&quot;,https://n.news.naver.com/mnews/article/422/0000810381?sid=104,"중국이 H200칩의 판매를 허가할 것인지, 트럼프 대통령과 시진핑 주석 간 연락이 언제 있었는지 등에 관한 질문에는 즉답을 피했습니다. #AI #미국 #<b>반도체</b> #중국 #엔비디아","Tue, 09 Dec 2025 21:16:00 +0900"
