DateTime,Title,Link,Description,PubDate
2025-12-09 03:35:44,"LS전선, 업계 최초 UL '폐기물 매립 제로 인증' 획득",http://www.popcornnews.net/news/articleView.html?idxno=104883,"재활용이 가능한 폴리프로필렌(PP) 절연 소재 케이블을 한국전력과의 시범사업을 통해 실증한 후 화학, <b>반도체</b> 플랜트와 데이터센터 등 다양한 산업 분야로 적용을 확대하고 있다. [팝콘뉴스]","Tue, 09 Dec 2025 12:34:00 +0900"
2025-12-09 03:35:44,지방시대위 &quot;'서울대 10개'로 기업형 첨단도시 육성&quot;,http://news.ebs.co.kr/ebsnews/allView/60672199/N,"대통령 직속 지방시대위원회는 여기에 더해 AI·<b>반도체</b> 같은 국가 전략산업을 키울 지역에는 대학과 연구시설, 산업단지와 신도시를 묶은 '기업형 첨단도시'와 '창업도시'를 권역별로 조성해 청년이 원하는 일자리와... ","Tue, 09 Dec 2025 12:32:00 +0900"
2025-12-09 03:35:44,트럼프 &quot;중국에 엔비디아 H200 칩 수출 허용&quot;,https://www.aitimes.com/news/articleView.html?idxno=204629,"미 상무부는 세부 조건을 마무리하고 있으며, 이번 조치는 AMD·인텔 등 다른 AI <b>반도체</b> 기업에도 동일하게... 한편, H200 수출 허용은 2022년 이후 강화된 AI·<b>반도체</b> 대중 수출 통제 정책에서 중대한 전환으로 평가된다.... ","Tue, 09 Dec 2025 12:30:00 +0900"
2025-12-09 03:35:44,AI <b>반도체</b>부터 개발자 커리어까지…울산대서 ‘AI 트렌드 특강’ 개최,https://n.news.naver.com/mnews/article/138/0002211956?sid=105,"퓨리오사AI 이준원 이사와 한화시스템 ICT 이동운 프로가 참여해 AI <b>반도체</b>, 스마트 인프라 등 각자의 분야에서 경험한 기술 트렌드와 실무 환경, 커리어 전환 과정 등을 공유할 예정이다. 앞서 부산대에서 열린... ","Tue, 09 Dec 2025 12:30:00 +0900"
2025-12-09 03:35:44,AI·SW 현직자가 들려주는 생생한 현장 이야기…울산대에서 ‘2025 AI 트렌...,https://n.news.naver.com/mnews/article/029/0002998347?sid=105,"최근 AI <b>반도체</b> 시장을 선도하는 퓨리오사AI 재직 중인 이준원 이사와 스마트 인프라·융합 IT 기술을 선도하는 한화시스템 ICT의 이동운 프로가 직접 연사로 나선다. 전문가들은 실무 경험, 커리어 전환 과정, 기술... ","Tue, 09 Dec 2025 12:29:00 +0900"
2025-12-09 03:35:44,"LG전자, '가산 R&amp;D 캠퍼스' 설립 50주년",http://www.sisafocus.co.kr/news/articleView.html?idxno=351575,"연구소에서는 1977년 전자식 금전등록기(POS)의 국산화 성공을 시작으로 국내 첫 전자식 한/영 타자기 출시, 주문형 <b>반도체</b>(Custom IC) 독자 개발 등 한국 전자산업의 이정표를 세워왔다. 1981년 2만 개 이상의 부품이... ","Tue, 09 Dec 2025 12:28:00 +0900"
2025-12-09 03:35:44,[박검진의 종교·철학 여행] 개인은 집단의 시선으로 본다,https://www.koreadaily.com/article/20251208192544353,"기술경영학(MOT) 박사학위를 취득했다. LG<b>반도체</b> 특허협상팀 팀장, 하이닉스<b>반도체</b> 특허분석팀 차장, 호서대 특허관리어드바이저, 한국기술교육대 산학협력단 교수를 거쳐 현재 콜라보기술경영연구소 대표.","Tue, 09 Dec 2025 12:26:00 +0900"
2025-12-09 03:35:44,"동아·동서 글로컬 연합대학, ‘1:1:1 지산학 공동전략협의체’ 출범",https://www.cnbnews.com/news/article.html?no=766415,"4대 특화분야 6개 협의체는 △수소에너지 △전력<b>반도체</b> △휴먼케어 △첨단콘텐츠 △융합디자인 △B-헤리티지 협의체이며 지자체, 특화분야 유관 산업체, 글로컬 연합대학 특화분야 센터장 등 지자체-산업체-대학 1:1:1... ","Tue, 09 Dec 2025 12:26:00 +0900"
2025-12-09 03:35:44,"LS전선, 국내 전선업계 최초 '폐기물 매립 제로 인증' 획득",https://www.newstree.kr/newsView/ntr202512090007,"재활용이 가능한 폴리프로필렌(PP) 절연 소재 케이블을 한국전력과의 시범사업을 통해 실증한 후, 화학 및 <b>반도체</b> 플랜트와 데이터센터 등 다양한 산업 분야로 적용을 확대하고 있다.","Tue, 09 Dec 2025 12:24:00 +0900"
2025-12-09 03:35:44,[컴업스타즈 ②] “AI 주도권에 진심”… 한국 스타트업이 중국으로 향...,https://byline.network/?p=9004111222586129,중국 정부는 현재 AI·바이오·로봇·<b>반도체</b>·신소재 등의 전략산업 중심으로 스타트업을 국가성장 엔진으로... 알페스처럼 <b>반도체</b>·배터리 소재 스타트업에게도 중국은 잠재력 있는 시장이다. 한국에서는 비슷한 기술을... ,"Tue, 09 Dec 2025 12:22:00 +0900"
2025-12-09 03:35:44,"이화여대, '제1회 이화산학협력포럼' 개최",http://www.popcornnews.net/news/articleView.html?idxno=104880,"이번 포럼은 정부가 국정과제로 'AI 3대 강국 도약'을 선포하고, <b>반도체</b> 산업의 글로벌 경쟁력 강화를 위해 총 33조 원 규모의 재정 투자를 확대하는 가운데, <b>반도체</b>, AI 분야 최신 기술 동향을 공유하고 산학협력 기반의... ","Tue, 09 Dec 2025 12:22:00 +0900"
2025-12-09 03:35:44,"이화여대, 제1회 이화산학협력포럼 개최",http://www.veritas-a.com/news/articleView.html?idxno=588262,"이번 포럼은 정부가 국정과제로 'AI 3대 강국 도약'을 선포하고, <b>반도체</b> 산업의 글로벌 경쟁력 강화를 위해 총 33조 원 규모의 재정 투자를 확대하는 가운데, <b>반도체</b>, AI 분야 최신 기술 동향을 공유하고 산학협력 기반의... ","Tue, 09 Dec 2025 12:22:00 +0900"
2025-12-09 03:35:44,"LS전선, 전선업계 최조 UL '폐기물 매립 제로' 인증 획득",https://n.news.naver.com/mnews/article/374/0000479508?sid=101,"재활용이 가능한 폴리프로필렌(PP) 절연 소재 케이블을 한국전력과의 시범사업을 통해 실증한 후, 화학, <b>반도체</b> 플랜트와 데이터센터 등 다양한 산업 분야로 적용을 확대하고 있습니다.","Tue, 09 Dec 2025 12:19:00 +0900"
2025-12-09 03:35:44,"【데일리 ESG정책 브리핑】정부, 핵심광물 공급망 재정비한다",http://www.impacton.net/news/articleView.html?idxno=17313,"둘째, 정부는 정유·가스·광물 기업을 '핵심공급기관', <b>반도체</b>·자동차 등 업종별 핵심 기업을 '핵심수요기관'으로 지정해서 이상징후 발생 시 즉시 정부에 보고하도록 했다. 셋째, 정부는 해외자원개발 정책을 '프로젝트... ","Tue, 09 Dec 2025 12:16:00 +0900"
2025-12-09 03:35:44,"정부, 내년 하반기 '넥스트 AI' 연구조직 설립...AGI 연구 예산 500억 투...",https://www.techm.kr/news/articleView.html?idxno=147554,"글로벌 경쟁력 확보 방안에 대해서는 &quot;'AI 3강'을 목표로 하지만 미국, 중국을 단기간에 넘어서긴 쉽지 않다&quot;며 &quot;중동처럼 미·중 모델을 쓰기 꺼려하는 곳들이 있어 그런 시장을 대상으로 협업하고 나아가 AI <b>반도체</b>를... ","Tue, 09 Dec 2025 12:16:00 +0900"
2025-12-09 03:35:44,[아시아라운드업 20251209] 캄보디아와 재차 충돌 태국 &quot;협상은 없다&quot;,http://kor.theasian.asia/archives/396912,이는 전 세계 <b>반도체</b> 업계와 AI 업계의 판도를 뒤흔들 것으로 예상. 엔비디아는 기존의 독주 체제를 더욱... 중국은 자국 AI 산업 발전과 <b>반도체</b> 자립 사이를 저울질하며 대응을 고심할 것으로 전망.- 미국의 이번 결정에... ,"Tue, 09 Dec 2025 12:14:00 +0900"
2025-12-09 03:35:44,"트럼프, 중국에 엔비디아 H200 칩 수출 허용",https://n.news.naver.com/mnews/article/050/0000099415?sid=101,"엔비디아 CEO인 젠슨 황은 중국을 세계 최대 <b>반도체</b> 시장이라고 말하며, 중국 수출을 위해 수개월간 백악관과 긴밀한 접촉을 이어왔다. 블룸버그통신은 이번 결정이 지난주 트럼프 대통령과 젠슨 황의 회동 직후... ","Tue, 09 Dec 2025 12:14:00 +0900"
2025-12-09 03:35:44,"트럼프 &quot;H200 칩 중국 수출 허용&quot; 중국, 미국 제칠 날개 달까?",http://www.newstown.co.kr/news/articleView.html?idxno=678353,이번 트럼프의 'H200'의 중국 수출을 허용 결정은 전 세계 <b>반도체</b> 업계와 AI 업계의 판도를 뒤흔들 것으로... 기술굴기(技术崛起)를 주창하면서 정진(精進)해오고 있는 중국은 자국 AI 산업 발전과 <b>반도체</b> 독립 사이를... ,"Tue, 09 Dec 2025 12:13:00 +0900"
2025-12-09 03:35:44,&quot;엔비디아 H200 中수출 허용…기술 초격차 유지&quot;,https://n.news.naver.com/mnews/article/422/0000810168?sid=104,"도널드 트럼프 미국 대통령이 엔비디아의 고성능 인공지능, AI <b>반도체</b>를 중국에 팔 수 있도록 수출 빗장을... H200 중국 수출은 엔비디아에 고대역폭 메모리를 공급하는 삼성전자와 SK하이닉스 등 우리 <b>반도체</b> 업계에도... ","Tue, 09 Dec 2025 12:12:00 +0900"
2025-12-09 03:35:44,"LG전자, 가산 R&amp;D 캠퍼스 50년 기념 행사…반세기 성과·미래 비전 공유",http://www.womentimes.co.kr/news/articleView.html?idxno=93033,"이에 앞서 연구소에서는 1977년 전자식 금전등록기(POS)의 국산화 성공을 시작으로 국내 첫 전자식 한·영 타자기 출시, 주문형 <b>반도체</b>(Custom IC) 독자 개발 등 한국 전자산업의 이정표를 세워왔다. 특히, 1981년 2만 개... ","Tue, 09 Dec 2025 12:10:00 +0900"
2025-12-09 03:35:44,"경기혁신센터 투자기업 8개사, 팁스 프로그램 선정",https://www.venturesquare.net/1018575,딥테크 분야를 지원하는 팁스R&amp;D에는 차세대 <b>반도체</b> 패키징 솔루션을 개발하는 ㈜에피솔루션이 선정됐다. 해당 프로그램은 최대 18억 원의 연구개발비와 사업화 자금을... ,"Tue, 09 Dec 2025 12:09:00 +0900"
2025-12-09 03:35:44,"아이엘, '미래전략 빌드업 컨퍼런스' 성료... 풀스택 미래모빌리티 선언",https://n.news.naver.com/mnews/article/008/0005289311?sid=101,아이엘은 기존 소재 중심의 사업영역에서 전장·AI(인공지능)·센서·<b>반도체</b>·로봇 등 핵심 기술을 통합 설계·운영하는 플랫폼 기업으로의 전환을 발표했다. 회사가 제시한 미래 전략은 스마트 모빌리티 전장 생태계... ,"Tue, 09 Dec 2025 12:08:00 +0900"
2025-12-09 03:35:44,LG ‘가산 R&amp;D’ 50년… 신소재 혁신 메카로,https://n.news.naver.com/mnews/article/021/0002755886?sid=101,가전뿐만 아니라 주문형 <b>반도체</b> 등을 개발하며 한국 전자산업의 발전을 이끈 가산 R&amp;D 캠퍼스는 LG전자의... 주문형 <b>반도체</b> 독자 개발로 한국 전자산업의 이정표를 세워왔다. 특히 1981년 2만 개 이상의 부품이 집적된... ,"Tue, 09 Dec 2025 12:08:00 +0900"
2025-12-09 03:35:44,[광물전쟁①]中희토류 수출통제 1년 유예 &quot;협상 불확실성 더 커져&quot;,https://n.news.naver.com/mnews/article/277/0005690961?sid=104,"인공지능(AI), <b>반도체</b>, 방산, 전기차 등 각국의 전략산업을 떠받치는 핵심 자원이다. 문제는 이 필수자원이... 보여줬다&quot;며 &quot;<b>반도체</b>·배터리·첨단 기술에 필수적인 광물의 채굴·제련이 중국에 집중된 상황은 미국 산업·안보... ","Tue, 09 Dec 2025 12:07:00 +0900"
2025-12-09 03:35:44,역대 최대 규모 '컴업' 3일간 열린다…산업 트렌드 한눈에,https://n.news.naver.com/mnews/article/421/0008650732?sid=101,사우디아라비아의 AI 인프라 기업 '휴메인'의 타렉 아민 대표와 국내 AI <b>반도체</b> 유니콘 '리벨리온'의 박성현 대표가 기조 강연에 나설 예정이다. 또한 류중희 리얼월드 대표와 김병수 로보티즈 대표가 참여해 최근... ,"Tue, 09 Dec 2025 12:07:00 +0900"
2025-12-09 03:35:44,中 AI <b>반도체</b>기업 ‘상장 러시’… 자금력 앞세워 ‘韓업계 위협’,https://n.news.naver.com/mnews/article/021/0002755884?sid=101,중국 인공지능(AI) <b>반도체</b> 기업들이 미국의 강력한 제재를 뚫고 주식시장 상장을 통해 대규모 자본 확충과 기술 고도화에 속도를 내면서 K-<b>반도체</b>의 위기감이 커지고 있다. 이들은 자국 정부의 전폭적인 자금 지원과... ,"Tue, 09 Dec 2025 12:07:00 +0900"
2025-12-09 03:35:44,"동아·동서 글로컬 연합대학, ‘1:1:1 지산학 협의체’ 발족…부산시·산...",https://n.news.naver.com/mnews/article/021/0002755883?sid=102,"4대 특화분야 6개 협의체는 수소에너지, 전력<b>반도체</b>, 휴먼케어, 첨단콘텐츠, 융합디자인, B-헤리티지 분야이며, 지자체·유관 산업체·글로컬 연합대학 특화분야 센터장이 참여해 지자체–산업계–대학 간 1:1:1 협력체계를... ","Tue, 09 Dec 2025 12:07:00 +0900"
2025-12-09 03:35:44,"강원도, 첨단산업 분야 국비 1천 213억 원 확보",https://chmbc.co.kr/article/laNsaNyKmeZioXkQqyh755,"이를 통해 <b>반도체</b>와 바이오헬스, 미래차, 인공지능, 기후테크 분야의 총 48개 사업이 추진됩니다. 강원도는 그동안 주로 진행됐던 관광과 농업에서 첨단산업으로 산업 구조를 전환해 새로운 성장 사다리를 만드는 것이... ","Tue, 09 Dec 2025 12:06:00 +0900"
2025-12-09 03:35:44,강기정 시장 14일 '부강한 광주 도약' 출판기념회,https://n.news.naver.com/mnews/article/047/0002497762?sid=100,"자동차·헬스케어·에너지 등 기존 산업에 AI를 결합하고 국가AI<b>반도체</b>(NPU)컴퓨팅센터와 AX실증밸리, 규제프리 실증도시, 자율주행 실증 인프라, AI모빌리티신도시 등을 구축해 광주를 '대한민국 AI 3강, 초격차 AI 도시'로... ","Tue, 09 Dec 2025 12:06:00 +0900"
2025-12-09 03:35:44,"강원대, 지역 전략 산업 연계 '창업 전초기지' 구축",https://chmbc.co.kr/article/fo71nermas-UZP,"통합 강원대 출범을 앞두고대학의 인적·물적 자원을지역사회에 폭넓게 공유해,바이오·<b>반도체</b>·수소에너지... 신소재·해양바이오,원주는 <b>반도체</b>·디지털헬스케어 등으로특성화가 이뤄지고 있습니다. 창업 성과도... ","Tue, 09 Dec 2025 12:06:00 +0900"
2025-12-09 03:35:44,충남 최고 5억불 수출탑 '하나마이크론' 수상…제62회 무역의 날 기념식,https://n.news.naver.com/mnews/article/030/0003378641?sid=101,<b>반도체</b>패키징테스트(OSAT)기업 하나마이크론이 충남 최고의 수출탑 '5억불 수출탑'을 받았다. 도내에서 5억불 수출탑 수상기업은 <b>반도체</b> 제조용 진공펌프 기업 에드워드코리아 이후 2년 만에 등장했고 <b>반도체</b> 산업에서... ,"Tue, 09 Dec 2025 12:01:00 +0900"
2025-12-09 03:35:44,충남 빛낸 ‘무역수지 1위’ 주역 한자리에,https://n.news.naver.com/mnews/article/016/0002569393?sid=101,"이어 김 지사는 “도는 수출기업들이 더 큰 성과를 낼 수 있도록 모든 힘을 다할 것”이라며 “<b>반도체</b>, 디스플레이, 자동차부품 등 첨단산업부터 김, 화장품과 같은 소비재 산업에 이르기까지 ‘메이드 인 충남’의... ","Tue, 09 Dec 2025 12:01:00 +0900"
2025-12-09 03:35:44,"경기혁신센터 투자기업 8곳, 팁스 '전원 합격'…누적 45개사",https://n.news.naver.com/mnews/article/008/0005289303?sid=101,최대 18억원의 연구개발비와 사업화 자금을 지원받는 딥테크 팁스에는 차세대 <b>반도체</b> 패키징 솔루션을 개발하는 에피솔루션이 선정됐다. 최대 8억원을 지원받는 일반형 팁스에는 △리인벤팅 △픽셀 △택스티넘... ,"Tue, 09 Dec 2025 12:00:00 +0900"
2025-12-09 03:35:44,"트럼프, 엔비디아 칩 中 수출 허가한 이유는…&quot;통제해도 딥시크 등장, 효...",https://n.news.naver.com/mnews/article/002/0002417964?sid=104,"미국 정부는 중국의 AI 기술 추격을 막기 위해 <b>반도체</b> 칩의 엄격한 수출 제한 조치를 실시했지만, 중국이 생성형 AI인 '딥시크'를 개발하고 중국 기업인 화웨이의 하드웨어 생산도 진전을 이루는 등 제한 정책이 사실상... ","Tue, 09 Dec 2025 12:00:00 +0900"
2025-12-09 03:35:44,"GM의 노조 파괴 매뉴얼, 물류로 이어진 공급망 단결로 퇴치한다",https://newscham.net/articles/114857,"코로나19 팬데믹과 <b>반도체</b> 공급위기를 겪으면서 실마리를 찾게 된다. “물류 노동자 단결이 GM 자본을 저토록 놀라게 만들었는데, 완성차와 부품사를 아우르는 공급망 전체 노동자들의 단결을 이뤄낸다면 어떻게 될까?”... ","Tue, 09 Dec 2025 12:00:00 +0900"
2025-12-09 03:35:44,경제 불안 확산에 김민석·이창용 이례적 회동...&quot;시장 안정 공조&quot;,https://n.news.naver.com/mnews/article/053/0000054151?sid=101,"한국 경제는 내수 개선과 <b>반도체</b> 수출 호조로 회복 조짐을 보이고 있지만, 환율 급등과 물가 압력 등 위험 요인이 여전히 상존한다. 이날 면담에서도 고환율·고물가 대응책이 집중 논의된 것으로 알려졌다. 정부는 환율... ","Tue, 09 Dec 2025 12:00:00 +0900"
2025-12-09 03:35:44,"지드래곤 소속사 갤럭시코퍼레이션, 기업가치 1조 '유니콘' 등극",http://www.joynews24.com/view/1915625,"이번 프리 IPO 라운드에는 한국투자증권(공동 주관사), 신한벤처투자, 엔베스터 등 국내 주요 기관과 대만 <b>반도체</b> 상장사 에이데이터, 홍콩 증시 상장사 스타플러스 레전드홀딩스 등 해외 자본이 대거 참여했다.... ","Tue, 09 Dec 2025 12:00:00 +0900"
2025-12-09 03:35:44,트럼프 &quot;엔비디아 H200칩 수출 허용…시진핑에 통보&quot;,https://n.news.naver.com/mnews/article/374/0000479501?sid=104,"[기자] H200은 엔비디아의 AI <b>반도체</b> 가운데 블랙웰에 이어 차상위급 제품입니다. 엔비디아가 수출 규제를 피해 중국용으로 만든 저사양 칩 'H20'과 비교하면 추론 성능에서 두 배, AI 훈련 기능에서 약 6배 정도 뛰어난... ","Tue, 09 Dec 2025 11:59:00 +0900"
2025-12-09 03:35:44,"트럼프, ‘엔비디아 H200 칩’ 中 수출 허용",https://n.news.naver.com/mnews/article/021/0002755865?sid=104,중·일 갈등은 고조되고 있지만 희토류와 <b>반도체</b> 수출 규제를 해제하는 등 미·중 간 갈등은 해빙 국면이라는 관측이 나온다. 일본 언론은 중국의 대일본 위협에 대한 트럼프 대통령의 침묵으로 동아시아 질서가 흔들릴... ,"Tue, 09 Dec 2025 11:59:00 +0900"
2025-12-09 03:35:44,충남 빛낸 '무역수지 1위' 주역 한자리에,http://www.cctimes.kr/news/articleView.html?idxno=880548,"이어 김 지사는 &quot;도는 수출기업들이 더 큰 성과를 낼 수 있도록 모든 힘을 다할 것&quot;이라면서 &quot;<b>반도체</b>, 디스플레이, 자동차부품 등 첨단산업부터 김, 화장품과 같은 소비재 산업에 이르기까지 '메이드 인 충남'의 경쟁력을... ","Tue, 09 Dec 2025 11:58:00 +0900"
2025-12-09 03:35:44,제품 차별화 가능할까···분석가가 본 ‘인텔 네트워킹 사업부 매각 철...,https://www.cio.com/article/4102866/제품-차별화-가능할까···분석가가-본-인텔-네트.html,"IDC의 기반 기술 및 <b>반도체</b> 부문 연구 책임자인 짐 하인스는 인텔이 적정한 매각 제안을 받았는지에 대해 언급을 피하면서도, NEX의 시장 입지가 줄어들고 있다는 점은 분명하다고 분석했다. IDC는 인텔의 <b>반도체</b> 전체... ","Tue, 09 Dec 2025 11:54:00 +0900"
2025-12-09 03:35:44,"충남도, 민선 8기 투자유치 '43조' 돌파… &quot;수도권 인접 강점 통했다&quot;",https://www.jbnews.com/news/articleView.html?idxno=1495132,"주요 투자 업종은 <b>반도체</b>, 자동차, 석유화학, 디스플레이, 철강 등 충남의 주력 산업이 주를 이뤘다. 특히 대규모 투자가 줄을 이었다. 삼성 8조 원을 비롯해 ▷SK온 1조 5천억원 ▷HD현대오일뱅크 1조 2천262억원... ","Tue, 09 Dec 2025 11:52:00 +0900"
2025-12-09 03:35:44,‘한미 전략투자’ 특별법…美 변수 대비 ‘국회 안전장치’ 강화,https://www.tfmedia.co.kr/news/article.html?no=198804,"◇ 455조원 ‘전략투자’ 법적 근거 마련...공사 설립·3조원 자본금 이 법안은 2025년 11월 한미 양국 정부가 서명한 전략적 투자 양해각서(MOU)를 이행하기 위한 것으로, 조선, <b>반도체</b>, 의약품, 핵심광물, 에너지, AI... ","Tue, 09 Dec 2025 11:50:00 +0900"
2025-12-09 03:35:44,"이화여대, 제1회 이화산학협력포럼 개최",http://www.dailysmart.co.kr/news/articleView.html?idxno=117393,"이번 포럼은 정부가 국정과제로 'AI 3대 강국 도약'을 선포하고 <b>반도체</b> 산업의 글로벌 경쟁력 강화를 위해 총 33조원 규모의 재정 투자를 확대하는 가운데 <b>반도체</b>, AI 분야 최신 기술 동향을 공유하고 산학협력 기반의 미래... ","Tue, 09 Dec 2025 11:48:00 +0900"
2025-12-09 03:35:44,"연준, 금리인하 고삐 잡나…불안한 亞 증시 혼조세[Asia오전]",https://n.news.naver.com/mnews/article/008/0005289296?sid=104,니혼게이자이신문(닛케이)은 미국 뉴욕 증시에서 <b>반도체</b> 관련 종목을 중심으로 나타난 강세가 도쿄 증시까지 이어져 하락 폭을 줄였다고 설명했다. 지난 밤 엔비디아의 AI(인공지능) 개발 특화 GPU(그래픽처리장치)... ,"Tue, 09 Dec 2025 11:47:00 +0900"
2025-12-09 03:35:44,"LS전선, 업계 최초 ‘폐기물 매립 제로’ 인증 획득",https://weekly.cnbnews.com/news/article.html?no=199490,"재활용이 가능한 폴리프로필렌(PP) 절연 소재 케이블을 한국전력과의 시범사업을 통해 실증한 후, 화학·<b>반도체</b> 플랜트와 데이터센터 등 다양한 산업 분야로 적용을 확대하고 있다. 〈문화경제 〉","Tue, 09 Dec 2025 11:46:00 +0900"
2025-12-09 03:35:44,LG 가전의 산실 ‘가산 R&amp;D 캠퍼스’ 50주년…“AI홈 시대 여는 기술 요...,https://www.kukinews.com/article/view/kuk202512090081,"초기 전자식 금전등록기(POS), 한·영 타자기, 주문형 <b>반도체</b>(Custom IC) 등을 개발하며 국내 전자산업의 기반을 마련했고, 1981년에는 일본 기업이 독점하던 VTR의 국산화에도 성공했다. 이후 캠퍼스는 LG 가전 기술력의... ","Tue, 09 Dec 2025 11:46:00 +0900"
2025-12-09 03:35:44,"국립목포대, '<b>반도체</b>공학인의 날' 학습성과 발표회 진행",http://www.enewstoday.co.kr/news/articleView.html?idxno=2366435,"국립목포대학교(총장 송하철) <b>반도체</b>공학과는 지난 5일 '<b>반도체</b>공학인의 날' 행사를 진행했다고 9일 밝혔다. 이번 행사는 한 해 동안 학생들이 수행한 교육 및 연구 성과를 종합적으로 발표하고 평가하는 자리로, 총 27개... ","Tue, 09 Dec 2025 11:45:00 +0900"
2025-12-09 03:35:44,"LG 가전의 산실 '가산 R&amp;D 캠퍼스' 50주년, 더 새로운 고객 경험 혁신 견...",https://www.koreaittimes.com/news/articleView.html?idxno=148757,"1977년 전자식 금전등록기 국산화를 시작으로 전자식 한·영 타자기, 주문형 <b>반도체</b>(Custom IC) 개발 등 핵심 기술을 확보했으며, 1981년 일본 기업이 독점하던 VTR 기술을 국내 최초로 국산화하며 기술 자립의 전환점을... ","Tue, 09 Dec 2025 11:44:00 +0900"
2025-12-09 03:35:44,"LG이노텍, 영업이익 전망 '플러스 전환'… 대신증권 &quot;내년 톱픽 유지&quot;",https://www.newsclaim.co.kr/news/articleView.html?idxno=3051900,"그는 또 &quot;<b>반도체</b> 기판 부문은 FC BGA 거래선 확대가 예상되며, 2027년 본격적인 성장과 이익 실현이 기대된다&quot;고 밝혔다. 아울러 &quot;현재 모바일 중심 구조에서 PC용 CPU 영역 진입이 예상되며, 이를 위한 샘플 제공과... ","Tue, 09 Dec 2025 11:44:00 +0900"
