DateTime,Title,Link,Description,PubDate
2025-07-25 06:41:10,"한국건설산업연구원, 내달 '규제 개혁 대전환 세미나' 개최",https://www.youthdaily.co.kr/news/article.html?no=190762,"최근 AI, <b>반도체</b>, 바이오 등 국가 첨단산업 분야에서는 광범위한 규제 혁신을 통해 산업 성장동력을 확보하려는 노력이 활발한 반면 내수 경기의 핵심인 건설산업은 고질적인 규제산업임에도 불구하고, 산업 활력 및 기업... ","Fri, 25 Jul 2025 15:38:00 +0900"
2025-07-25 06:41:10,"SK하이닉스, 하반기 경쟁사 HBM 시장 진입 본격화...엔비디아와 물량 협...",http://www.lkp.news/news/articleView.html?idxno=67147,"여기에 메모리 <b>반도체</b> 가격이 AI 서버용 수요 강세로 인해 상승하자, 중국 모바일 업체들은 부품 가격이 더 오르기 전에 미리 재고를 확보하여 원가 상승 부담을 줄이는 전략을 취하고 있다. ◆ 3분기 영업이익 10... ","Fri, 25 Jul 2025 15:38:00 +0900"
2025-07-25 06:41:10,"용인시, 시민 삶의 질 높이는 복지·안전·교통 정책 속속 실현",https://www.newsworks.co.kr/news/articleView.html?idxno=804931,또한 원삼면 <b>반도체</b>클러스터 주변 교통 혼잡을 막기 위해 불법 주정차 단속 인력을 신규 배치하고 지방도 318호선과 국지도 57호선 등 진입도로 구간에서 집중 단속을 시행 중이다. '용인 드마크 데시앙 아파트... ,"Fri, 25 Jul 2025 15:38:00 +0900"
2025-07-25 06:41:10,"로보스타 7월 25일 장중 27,100원, 0.37% 하락",https://www.topstarnews.net/news/articleView.html?idxno=15746930,"기업으로, 최근 제조업 자동화 수요 증가와 함께 관련 산업의 성장성이 주목받고 있다. 향후 글로벌 경기 회복과 <b>반도체</b>·전기차 산업과의 연계성이 주가 향방에 영향을 미칠 것으로 보인다. [톱스타뉴스=]","Fri, 25 Jul 2025 15:38:00 +0900"
2025-07-25 06:41:10,"[한미 관세협상] 美, 韓 1년치 예산 넘는 755조 투자 요구…돌파구는?",https://www.newspim.com/news/view/20250725000516,미국 워싱턴 DC 상무부에서 러트닉 미 상무부 장관을 만난 김 장관은 조선·<b>반도체</b>·배터리 등 전략 제조업 분야에서 양국 간 협력 강화 방안을 소개한 것으로 전해졌다. 이를 고려해 자동차 등 품목별 관세 및 상호관세... ,"Fri, 25 Jul 2025 15:36:00 +0900"
2025-07-25 06:41:10,"'경영난' 인텔, 2만명 추가 감원…파운드리 건설도 취소",https://n.news.naver.com/mnews/article/015/0005162776?sid=104,경영난을 겪고 있는 미국 <b>반도체</b> 기업 인텔이 24일(현지시간) 대규모 구조조정 계획을 또 발표했다. 우선... 로이터 통신은 “인텔이 증권 보고서에서 1.4나노(14A) 공정이 외부 대형 고객을 확보하지 못할 경우 <b>반도체</b>... ,"Fri, 25 Jul 2025 15:35:00 +0900"
2025-07-25 06:41:10,"이현이, 수영복 입고 '핫보디' 뽐낸 여름 휴가 &quot;새까맣게 그을린 형제들...",https://sports.hankooki.com/news/articleView.html?idxno=6904962,"여름 분위기를 가득 담은 비주얼로 시선을 사로잡았다. 튜브 위에 앉아 물놀이를 즐기는 아이들의 모습도 눈길을 끈다. 한편, 이현이는 2012년 삼성전자 <b>반도체</b> 개발 엔지니어 홍성기와 결혼해 슬하에 2남을 두고 있다.","Fri, 25 Jul 2025 15:34:00 +0900"
2025-07-25 06:41:10,"美 수출 규제에도…中, 엔비디아 AI칩 10억달러 규모 밀반입",http://theviewers.co.kr/View.aspx?No=3725695,kr (사진=엔비디아)미국 정부의 수출 통제에도 엔비디아의 고성능 AI <b>반도체</b>가 중국으로 대규모 밀반입됐다. 24일 파이낸셜타임스 등 외신은 최근 3개월간 약 10억달러(약 1조4000억원) 규모의 AI <b>반도체</b> 칩이 중국에... ,"Fri, 25 Jul 2025 15:34:00 +0900"
2025-07-25 06:41:10,"씨이랩 ‘XPN’, <b>반도체</b>부터 바이오까지 산업 AI 실증 속도낸다",https://www.hellot.net/news/article.html?no=103657,"이들 협력사는 <b>반도체</b>, 바이오, 자동차, 금융 등 고부가가치 산업군을 중심으로 현장 실증을 빠르게 확대하고 있다. 대표적인 사례로, <b>반도체</b> 제조 공정에서는 산업용 카메라 및 AI 센서 전문 기업과의 협업을 통해... ","Fri, 25 Jul 2025 15:34:00 +0900"
2025-07-25 06:41:10,파운드리 참패한 인텔…TSMC 독주에 삼성 ‘긴장’,http://www.newstomato.com/ReadNews.aspx?no=1269663&inflow=N,뉴스토마토 = 박혜정 기자 | 올해 2분기 인텔의 <b>반도체</b> 파운드리(위탁생산) 부문 적자 폭이 확대되며... 이어 새로운 <b>반도체</b> 제조 공정인 1.4나노(14A)는 확정된 고객 주문을 기반으로 확대할 것이라고도 말했습니다.... ,"Fri, 25 Jul 2025 15:34:00 +0900"
2025-07-25 06:41:10,"넥스트칩, 로봇 <b>반도체</b> 분야 전담 조직 강화",https://n.news.naver.com/mnews/article/014/0005382621?sid=101,넥스트칩이 로봇 분야 전담 조직을 강화하고 로봇 <b>반도체</b> 시장 진출에 박차를 가한다고 25일 밝혔다. 넥스트칩은 차량용 <b>반도체</b> 개발을 통해 축적한 영상 처리 및 전송 기술력을 바탕으로 급성장하는 로봇 시장 공략에... ,"Fri, 25 Jul 2025 15:33:00 +0900"
2025-07-25 06:41:10,한미 상무장관회담도 사실상 결렬...31일 외교장관회담이 마지막 기대?...,http://thetracker.co.kr/View.aspx?No=3725701,이 자리에서 김 장관은 조선·<b>반도체</b>·배터리 등 전략 제조업 분야에서 양국 간 협력 강화 방안을 소개하고... 논의되고 있는 것으로 알려진다. 조선 등 군수 분야와 <b>반도체</b>·배터리 등의 첨단기술 산업 협력도 논의 중이다.,"Fri, 25 Jul 2025 15:32:00 +0900"
2025-07-25 06:41:10,"최종현학술원, 글로벌 복합 위기 해법 '자강·전략·생태계' 3대 축 제시",https://www.businessplus.kr/news/articleView.html?idxno=92946,"권석준 성균관대 교수는 &quot;중국은 파운드리, 그래픽처리장치(GPU), 공정장비까지 <b>반도체</b> 전 영역을 아우르며 AI... 한국은 <b>반도체</b> 생산 역량을 기반으로 미국의 전략적 기술 파트너로서 입지를 확보해야 한다&quot;고 강조했다.... ","Fri, 25 Jul 2025 15:32:00 +0900"
2025-07-25 06:41:10,"광장, 국제중재·기업범죄 포럼…&quot;헬스케어·<b>반도체</b>·전기차 분쟁 확대...",https://www.lawtimes.co.kr/news/210061,"헬스케어, <b>반도체</b>, 전기차 등 산업군에서의 분쟁 리스크가 더욱 커질 것으로 전망했다. 특히 &quot;영문 계약서를 한국법에 적용할 때 발생하는 구조적 불일치 문제는 절차적 혼선과 해석 충돌로 이어질 수 있다&quot;며... ","Fri, 25 Jul 2025 15:32:00 +0900"
2025-07-25 06:41:10,"미래산업, 무상감자 완료 후 변경상장 추진 및 HBM 테스트 솔루션 개발",https://www.job-post.co.kr/news/articleView.html?idxno=164368,인공지능(AI) 서버 수요 증가에 따른 HBM 확대 등으로 <b>반도체</b> 시장이 슈퍼사이클(초호황)에 진입한 모습이다. 고객사와의 안정적인 공급 계약을 바탕으로 하반기에도 수주가 이어지고 있어 천안 본사 공장이 풀가동... ,"Fri, 25 Jul 2025 15:32:00 +0900"
2025-07-25 06:41:10,일본처럼 관세인하 '구매' 가능하다지만...'탈 타코'에 한국 차 관세 낮...,http://www.updownnews.co.kr/news/articleView.html?idxno=313464,"산업부에 따르면 이 자리에서 김 장관은 조선·<b>반도체</b>·배터리 등 전략 제조업 분야에서 양국 간 협력 강화 방안을 소개하고, 이를 감안해 자동차 등 품목별 관세 및 상호관세 완화가 필요하다는 점을 강하게 요청했다.... ","Fri, 25 Jul 2025 15:32:00 +0900"
2025-07-25 06:41:10,[AT 산업 단신] 삼성전자·한미<b>반도체</b>·HPE,https://www.asiatime.co.kr/article/20250725500286,"한미<b>반도체</b>는 하이브리드 본딩 기술에 1000억원을 투자한다고 밝혔다. 한국 HPE는 지난 24일 서울... 한미<b>반도체</b>, 하이브리드 본더 개발 위해 1000억 투자 한미<b>반도체</b> 하이브리드 본더 팩토리 조감도. (사진... ","Fri, 25 Jul 2025 15:32:00 +0900"
2025-07-25 06:41:10,"LG이노텍, 광학 독주 '끝'···기판·전장·로보틱스 주력 새판 '시작'",http://www.enewstoday.co.kr/news/articleView.html?idxno=2308275,"통신용 <b>반도체</b> 기판 수요 확대, 전장 고부가 매출 실현이 기대된다&quot;고 밝혔다. 반면 기판소재와 전장... 업계에서는 이 기술이 AI·서버용 <b>반도체</b>와 RF‑SiP 기판 수요 확대에 긍정적으로 작용하고 있다고 분석했다. 코퍼... ","Fri, 25 Jul 2025 15:31:00 +0900"
2025-07-25 06:41:10,&quot;이념은 접고 전략을 보라&quot;… 해법은 '자강·전략·생태계' 3대 축 제시,http://www.intn.co.kr/news/articleView.html?idxno=2044995,"공정장비까지 <b>반도체</b> 전 영역을 아우르며 AI 생태계로 고속도로를 구축하고 있다&quot;며 &quot;한국은 제조업 기반의 AI 전략으로 대응해야 한다&quot;고 강조했다. 권 교수는 &quot;화웨이, 딥시크, 알리바바 등 중국 핵심 기업들이 <b>반도체</b>부... ","Fri, 25 Jul 2025 15:30:00 +0900"
2025-07-25 06:41:10,최악 피했나? … 2분기 韓경제 0.6% 반등,http://www.snmnews.com/news/articleView.html?idxno=555792,수출은 <b>반도체</b>·석유화학제품 등의 호조로 4.2% 증가했다. 수입도 원유·천연가스 등 에너지류를 중심으로... 설비투자도 <b>반도체</b> 제조용 기계 등 기계류와 선박 등 운송 장비 위주로 1.5% 감소했다. 2분기 성장률에 대한... ,"Fri, 25 Jul 2025 15:30:00 +0900"
2025-07-25 06:41:10,"신한운용, 글로벌탄소중립솔루션 펀드 4영업일로 환매주기 단축",https://www.seoulfn.com/news/articleView.html?idxno=601978,전력공급) △엔비디아(<b>반도체</b> 에너지 효율화 개선) △버티브 홀딩스(데이터센터 전력 및 냉각 시스템)가 있다. 또 빠르게 변화하는 블록체인 및 가상자산 시장에도 대응하고 있다. 재생에너지 기반의 블록체인 채굴... ,"Fri, 25 Jul 2025 15:29:00 +0900"
2025-07-25 06:41:10,"김승수 &quot;최휘영, 공직자 자격 없다&quot;…비리 연루 경고",https://www.gukjenews.com/news/articleView.html?idxno=3334640,"김 의원에 따르면, 최 후보자는 2017~2018년 용인 <b>반도체</b> 클러스터 발표 직전 해당 지역 부동산을 집중 매입한 정황이 있으며, 장남에게 재산을 증여하는 과정에서 세금 탈루 의혹도 받고 있다. 2021년에는 배우자와 장녀에게... ","Fri, 25 Jul 2025 15:28:00 +0900"
2025-07-25 06:41:10,"김태흠 충남지사, 유럽 첫 낭보…2개사 6000만$ 유치",https://www.newsfreezone.co.kr/news/articleView.html?idxno=638197,"이 기업은 첨단 소재에 대한 전문성을 바탕으로 글로벌 공급망을 보유하고 있으며, <b>반도체</b>·디스플레이·배터리·우주항공 등 핵심 산업에 필수적인 고순도 희귀가스 공급망을 지속적으로 확장하고 있다. 도와 두... ","Fri, 25 Jul 2025 15:28:00 +0900"
2025-07-25 06:41:10,"김태흠 도지사 “이미 수해복구계획 수립하고 현장 다녀왔다”…與, 정...",https://cc.newdaily.co.kr/site/data/html/2025/07/25/2025072500082.html,"또한 충남의 미래 산업 인프라에 대해서는 “<b>반도체</b>, 디스플레이, 자동차, 지하철, 고로 산업까지 충남에 집중돼 있다. 특히 수소화 전환을 추진 중이고, 탄소중립 특별도를 선포한 충남의 방향성과 프랑스 기업들의 행보가... ","Fri, 25 Jul 2025 15:26:00 +0900"
2025-07-25 06:41:10,딥시크 열풍 벌써 잦아드나…반년 만에 이용률·다운로드수 급감,https://n.news.naver.com/mnews/article/001/0015530160?sid=104,또 <b>반도체</b>·AI 분야 연구 분석 기관인 세미애널리시스(SemiAnalysis)는 딥시크의 이용률이 연초 최고 7.2%에서 크게 하락해 현재는 3%밖에 안 된다고 밝혔다. 이러한 하락 배경에는 딥시크의 최신 모델인 R1 모델이 엉뚱한... ,"Fri, 25 Jul 2025 15:26:00 +0900"
2025-07-25 06:41:10,2025년 <b>반도체</b> 재료 시장 700억 달러 전망…AI <b>반도체</b> 수요가 성장 견인,https://www.epnc.co.kr/news/articleView.html?idxno=320069,글로벌 <b>반도체</b> 재료 시장이 2025년 약 700억 달러(한화 약 93조 원) 규모로 확대될 전망이다. <b>반도체</b> 재료 시장 조사 전문기관인 TECHCET은 24일(현지시간) 2025년 시장 규모가 전년 대비 약 6% 성장할 것으로 예측했다.... ,"Fri, 25 Jul 2025 15:26:00 +0900"
2025-07-25 06:41:10,"테슬라, 미일 관세협상 수혜받나…日 전기차 보조금 개편키로",https://n.news.naver.com/mnews/article/018/0006074119?sid=101,"일본은 미국산 대두, 옥수수, 바이오에탄올, 비료 등의 농산물 수입을 확대하고, <b>반도체</b>·항공기... 아울러 미국이 향후 <b>반도체</b>나 의약품에 대한 개별 관세를 도입하더라도, 일본에는 가장 낮은 국가의 관세율을... ","Fri, 25 Jul 2025 15:25:00 +0900"
2025-07-25 06:41:10,"'<b>반도체</b> 명가' 지유투자, 성장금융에 잭팟 안겼다",https://www.newstof.com/news/articleView.html?idxno=29564,중인 '지유<b>반도체</b>성장투자조합'은 다음달 23일 만기를 맞는다. 해당 펀드는 지유투자가 2017년 회사 설립 후 처음으로 결성한 1호 블라인드펀드다. 당시 성장금융 <b>반도체</b>성장펀드 출자사업에서 6대 1의 경쟁률을 뚫어내며... ,"Fri, 25 Jul 2025 15:24:00 +0900"
2025-07-25 06:41:10,트럼프 &quot;日처럼 돈 내고 관세 사라&quot;…'2+2회의' 날짜 제안 없어,https://n.news.naver.com/mnews/article/025/0003457719?sid=104,김 장관은 조선·<b>반도체</b>·배터리 등 전략 제조업 분야에서 양국 간 협력 강화를 제시하며 자동차 등 품목별 관세와 상호관세 완화가 필요하다는 점을 강조한 것으로 알려졌다. 김 장관은 전날 크리스 라이트... ,"Fri, 25 Jul 2025 15:23:00 +0900"
2025-07-25 06:41:10,"대구본부 한미관세협상 특별강연, &quot;광복80주년 패권을 넘어 주권·평화...",http://worknworld.kctu.org/news/articleView.html?idxno=507519,"철강을 시작으로 자동차·부품, 알루미늄 외에도 <b>반도체</b>, 의약품 등 관세부과대상 품목이 늘어날 수 있기... <b>반도체</b>나 조선, 디스플레이, 배터리 등이 미국이 제대로 갖추지 못하고 있어 한국에게는 협상의 지렛대 역할을... ","Fri, 25 Jul 2025 15:22:00 +0900"
2025-07-25 06:41:10,"법무법인 광장, '제11회 국제중재 및 기업범죄 포럼' 성료",https://n.news.naver.com/mnews/article/123/0002364517?sid=101,"개회사에서 박은영 광장 국제분쟁그룹장(사법연수원 20기)은 한국 국제중재시장이 IMF 이후 가파른 성장을 거듭해왔음을 짚으며, 향후에는 글로벌 무역 갈등, 산업별 규제 강화 등에 따라 헬스케어, <b>반도체</b>, 전기차... ","Fri, 25 Jul 2025 15:22:00 +0900"
2025-07-25 06:41:10,"모선별한계가격 도입, 전력 시스템 대대적 개편 없이 어렵다…해결방안...",http://www.e-platform.net/news/articleView.html?idxno=95085,"최근 <b>반도체</b>, 배터리, AI 산업 클러스터, 데이터센터 등 에너지 다소비 시설이 늘어나면서 전력 시설의 추가... 보고서는 '송전비용을 유발하는 지역에 요금을 더 걷는 것이 AI 데이터 센터나 <b>반도체</b> 같은 미래 산업을 위한... ","Fri, 25 Jul 2025 15:20:00 +0900"
2025-07-25 06:41:10,최원준 삼성전자 사장 &quot;갤S26에 새로운 AI 에이전트 적용…엑시노스 260...,https://n.news.naver.com/mnews/article/015/0005162769?sid=101,엑시노스2600은 삼성전자 <b>반도체</b>(DS)부문이 명운을 걸고 개발 중인 차세대 AP다. 삼성의 최첨단 2나노미터(nm) 파운드리(<b>반도체</b> 수탁생산) 공정을 활용할 예정이다. MX사업부의 품질 테스트를 통과하고 갤럭시 S26에... ,"Fri, 25 Jul 2025 15:17:00 +0900"
2025-07-25 06:41:10,8월1일 관세폭탄 초읽기...한국은 막판 '워싱턴 총력전',https://www.pointdaily.co.kr/news/articleView.html?idxno=260562,"조선업, <b>반도체</b>, 배터리 등 전략 제조업 분야 협력을 제안하며 자동차 등 주요 수출품목에 대한 관세 완화를... <b>반도체</b>산업은 트럼프가 최소 25% 관세 부과 입장을 밝혀 불확실성이 높다. 관세 부과에 따른 스마트폰, 가전... ","Fri, 25 Jul 2025 15:14:00 +0900"
2025-07-25 06:41:10,'새 정부 건설산업 규제 개혁 대전환 세미나' 오는 20일 개최,https://www.koscaj.com/news/articleView.html?idxno=317861,"최근 AI, <b>반도체</b>, 바이오, 미래차 등 국가첨단산업을 중심으로 광범위한 규제 혁신을 통한 산업 성장 동력 확보의 여러 대안이 마련되고 있는 가운데 내수 경기의 핵심인 건설산업의 경우, 고질적 규제 산업임에도 산업... ","Fri, 25 Jul 2025 15:14:00 +0900"
2025-07-25 06:41:10,"시한 일주일 남은 관세협상, 초긴장 속 절치부심",https://www.straightnews.co.kr/news/articleView.html?idxno=276951,"회담에서는 관세율 조정 문제뿐 아니라 <b>반도체</b>, 조선, 배터리 등 주요 제조업 분야의 협력 확대 방안이 포괄적으로 논의된 것으로 전해졌다. 정부는 필요할 경우 고위급 인사 추가 파견도 검토하고 있다. 한미 간 '2+2... ","Fri, 25 Jul 2025 15:06:00 +0900"
2025-07-25 06:41:10,[Editorial-우리 생각엔…] 상호관세 협상보다 더 눈길 끈 미·일 자동차...,http://www.niceeconomy.co.kr/news/articleView.html?idxno=87108,우리에게도 자동차는 <b>반도체</b>와 함께 대표적 수출품목에 해당한다. 관세청에 의하면 지난해 우리나라의 전체 수출액 6836억9000만 달러(통관 기준) 중 자동차가 차지한 액수는 10%에 육박하는 683억3000만 달러였다. 대미... ,"Fri, 25 Jul 2025 15:06:00 +0900"
2025-07-25 06:41:10,"[문제적 섹터] 자동차주, 관세 뚫고 하반기 주도 가능?",https://news.mtn.co.kr/news-detail/2025072514540245231,"부품주?▶ <b>반도체</b>주 Q. SK하이닉스, 호실적에도 '신중론' 여전한 이유? Q. 李대통령, 이재용 회장 회동… 대미 추가 투자로 관세 돌파? Q. 삼성전자, 폴더블폰 신제품 출시… 관련주 지금도 매수 유효?... ","Fri, 25 Jul 2025 15:04:00 +0900"
2025-07-25 06:41:10,정장선 평택시장 &quot;KAIST 건립ㆍ평택병원 개원 전폭 지원&quot;...KAISTㆍ아주대...,http://www.paxetv.com/news/articleView.html?idxno=240230,KAIST 김경수 대외부총장은 &quot;평택 AI <b>반도체</b> 혁신캠퍼스 조성을 통해 대한민국이 글로벌 AI <b>반도체</b> 패권 경쟁에서 선도적 역할을 할 수 있도록 최선을 다하겠다&quot;라고 말했습니다. 또한 아주대학교 한상욱 의료원장은... ,"Fri, 25 Jul 2025 15:02:00 +0900"
2025-07-25 06:41:10,트럼프 2기의 글로벌 전략과 한미동맹의 미래,http://www.tongilnews.com/news/articleView.html?idxno=214057,"둘째, 대중국 견제 강화: 트럼프 2기 행정부는 중국산 제품에 대한 전면적 관세 부과를 골자로 하는 보편관세(Universal Baseline Tariff) 도입을 추진하고 있으며, <b>반도체</b>·AI·배터리 등 첨단 산업 중심의 공급망 분리를... ","Fri, 25 Jul 2025 15:00:00 +0900"
2025-07-25 06:41:10,"신한운용, 글로벌탄소중립솔루션 펀드 환매주기 4영업일로 단축",https://n.news.naver.com/mnews/article/008/0005227010?sid=101,전력공급) △엔비디아(<b>반도체</b> 에너지 효율과 개선) △버티브 홀딩스(데이터센터 전력 및 냉각시스템) 등이다. △코인베이스 △블랙록 등 재생에너지 기반 블록체인 채굴 기업에도 투자 중이다. 김주영 신한자산운용... ,"Fri, 25 Jul 2025 14:59:00 +0900"
2025-07-25 06:41:10,日 대미투자 760조원 현실성 있나…&quot;선거 공약 같은 모호한 말&quot;,https://www.widedaily.com/news/articleView.html?idxno=273494,"백악관은 설명자료에서 대미 투자가 에너지 인프라, <b>반도체</b>, 핵심 광물, 의약품, 조선 등 미국이 추진하는... 여기에 더해 일본은 트럼프 행정부가 발표 예고한 <b>반도체</b>, 의약품 등 품목 관세에 대해서도 다른 나라보다... ","Fri, 25 Jul 2025 14:58:00 +0900"
2025-07-25 06:41:10,[강성원의 현장 TALK] 내세우기보다 결과로 말하는 정장선 평택시장의 ...,http://www.fieldnews.kr/news/articleView.html?idxno=19798,"<b>반도체</b>, 미래차, AI 등 전략 산업 분야를 겨냥한 실무형 기술지원 체계는 '기업 친화 도시 평택'의 다음 단계를 의미한다. 환경 분야에서도 평택의 변화는 도드라진다. 초미세먼지 수치는 2018년 54㎍/㎥에서 2024년 36㎍/㎥로... ","Fri, 25 Jul 2025 14:58:00 +0900"
2025-07-25 06:41:10,"평택시, 브레인시티 일반산단 핵심 시설 추진 간담회 개최",https://www.kmaeil.com/news/articleView.html?idxno=602956,KAIST 김경수 대외부총장은 &quot;평택 AI <b>반도체</b> 혁신캠퍼스 조성을 통해 대한민국이 글로벌 AI <b>반도체</b> 패권 경쟁에서 선도적 역할을 할 수 있도록 최선을 다하겠다&quot;고 밝혔다. 또한 아주대학교 한상욱 의료원장은... ,"Fri, 25 Jul 2025 14:56:00 +0900"
2025-07-25 06:41:10,"한미<b>반도체</b>, 2분기 영업익 55% ↑...&quot;하이브리드 본더에 1천억 투자&quot;",https://www.pinpointnews.co.kr/news/articleView.html?idxno=363042,한미<b>반도체</b> HBM4용 'TC 본더 4'. 사진=한미<b>반도체</b> 한미<b>반도체</b>는 연결 기준 올해 2분기 영업이익이 863억원으로 지난해 동기보다 55.7% 증가한 것으로 잠정 집계됐다고 25일 공시했다. 매출은 1800억원으로 작년 동기 대비... ,"Fri, 25 Jul 2025 14:56:00 +0900"
2025-07-25 06:41:10,"충남도, 글로벌 기업 에어리퀴드·유미코아와 투자협약",https://n.news.naver.com/mnews/article/421/0008392845?sid=102,<b>반도체</b>·디스플레이·배터리·항공우주 등 핵심 산업에 필수적인 고순도 희귀가스 공급망을 지속 확장하는 기업이다. 도는 이번 외자 유치에 따라 △도내 양질 일자리 창출 및 지역경제 활성화 △수입 대체 및 수출 증대... ,"Fri, 25 Jul 2025 14:55:00 +0900"
2025-07-25 06:41:10,"마이크로컨텍솔 7월 25일 장중 20,950원, 4.99% 하락",https://www.topstarnews.net/news/articleView.html?idxno=15746847,"만큼 단기 투자자들의 변동성 대응이 필요한 상황이다. 마이크로컨텍솔은 커넥터 및 <b>반도체</b> 패키징 장비 부품 등을 생산하는 업체로, 업황 및 수급 흐름에 따라 주가 변동성이 높은 특징을 지닌다. [톱스타뉴스=]","Fri, 25 Jul 2025 14:54:00 +0900"
2025-07-25 06:41:10,"건산연, 건설산업 활력 위한 '규제 개혁 대전환 세미나' 개최",https://n.news.naver.com/mnews/article/014/0005382591?sid=101,"최근 AI, <b>반도체</b>, 바이오 등 전략산업을 중심으로 규제 혁신이 활발히 추진되고 있는 반면, 건설산업은 여전히 중층적 규제가 산업 성장을 제약하고 있다는 것이 연구원의 진단이다. 주제 발표는 △건설산업 규제 현황과... ","Fri, 25 Jul 2025 14:53:00 +0900"
2025-07-25 06:41:10,&quot;능동적이고 정교한 국가 전략 새로 짜야&quot; 글로벌 복합위기 韓 생존할 ...,https://n.news.naver.com/mnews/article/014/0005382590?sid=101,"권석준 성균관대 교수는 &quot;중국은 파운드리(<b>반도체</b> 위탁생산), 그래픽처리장치(GPU), 공정장비까지 <b>반도체</b> 전 영역을 아우르며 인공지능(AI) 생태계로 고속도로를 구축하고 있다&quot;며 &quot;한국은 제조업 기반의 AI 전략으로... ","Fri, 25 Jul 2025 14:52:00 +0900"
2025-07-25 06:41:10,"네패스아크 7월 25일 장중 13,640원, 0.44% 상승",https://www.topstarnews.net/news/articleView.html?idxno=15746844,"주가 변동성이 발생할 수 있어 수급 상황이 향후 흐름을 좌우할 가능성이 있다. 네패스아크는 시스템 <b>반도체</b> 후공정 관련 기업으로, <b>반도체</b> 업황 전반과 수요 전망에 따라 등락을 반복하고 있다. [톱스타뉴스=]","Fri, 25 Jul 2025 14:52:00 +0900"
