DateTime,Title,Link,Description,PubDate
2025-03-30 03:47:50,"“AI 홈으로 일상을 혁신”···삼성전자, 2025년형 비스포크 AI 라인업...",https://n.news.naver.com/mnews/article/144/0001028936?sid=105,"2025년형 비스포크 AI 하이브리드 냉장고는 컴프레서와 <b>반도체</b> 소자가 함께 구동하며 최적의 효율을 내는 방식의 ‘AI 하이브리드 쿨링’ 기능을 갖춘 제품으로, 탑재된 9형 스크린에서는 일정∙날씨∙추천 식단을 한... ","Sun, 30 Mar 2025 12:47:00 +0900"
2025-03-30 03:47:50,"‘리더십 공백’ 삼성전자, 한종희 부회장 후임 인선 고심",https://n.news.naver.com/mnews/article/032/0003359938?sid=101,당분간 <b>반도체</b> 사업을 총괄하는 디바이스솔루션(DS)부문장인 전영현 부회장이 1인 대표이사 체제를 지속할 가능성도 있다. 삼성전자는 지난해 5월 DS부문장을 교체한 후 이달 주주총회와 이사회를 거쳐 전 부회장을... ,"Sun, 30 Mar 2025 12:42:00 +0900"
2025-03-30 03:47:50,"이번주 국내 증시, 美 관세·공매도 재개 빅 이슈로 경계심리",https://news.mtn.co.kr/news-detail/2025033012094560730,"한국의 지난해 대미 무역수지 흑자 규모는 660억 달러로, 미국 입장에선 8번째로 적자 규모가 크다.이런 영향으로 현대차, 기아, 현대모비스 등 자동차, SK하이닉스, 한미<b>반도체</b>, 삼성전자 등 <b>반도체</b> 종목이 크게... ","Sun, 30 Mar 2025 12:32:00 +0900"
2025-03-30 03:47:50,"켐트로닉스, 자회사 제이쓰리 신규 CI 공개",https://www.topstarnews.net/news/articleView.html?idxno=15625741,"<b>반도체</b> 재생 웨이퍼 전문기업인 제이쓰리를 자회사로 인수하며 새로운 기업 이미지(CI)를 발표했다. 혁신적인 정체성과 웨이퍼 산업에서의 리더십을 강조하는 데 중점을 두었다. 제이쓰리는 6, 8, 12인치 <b>반도체</b> 웨이퍼... ","Sun, 30 Mar 2025 12:30:00 +0900"
2025-03-30 03:47:50,"&quot;비스포크 AI가 일상으로&quot; 삼성전자, AI 가전 제품 및 서비스 공개, 스마...",https://www.autodaily.co.kr/news/articleView.html?idxno=529498,"'비스포크 AI 하이브리드' 냉장고는 컴프레서와 <b>반도체</b> 기술을 접목한 AI 하이브리드 쿨링 기능을 탑재했으며, 식재료 자동 인식 기능인 'AI 비전 인사이드 2.0'과 'AI 푸드 매니저'가 적용됐다. 또 '데일리 보드... ","Sun, 30 Mar 2025 12:28:00 +0900"
2025-03-30 03:47:50,中 &quot;중한은 자유무역 수혜자…다자무역 공동 수호하자&quot;,https://n.news.naver.com/mnews/article/001/0015298400?sid=101,"'트럼프 관세' 맞서 '한중일 FTA' 등 경제통합 가속화 제안 &quot;<b>반도체</b> 등 공급망 깊이 통합돼&quot;…미 제재 속 '<b>반도체</b> 협력' 강조 &quot;일방주의, 보호무역주의에 반대해야&quot;…사실상 미 겨냥 (세종·서울=연합뉴스) 차대운 이슬기 기자... ","Sun, 30 Mar 2025 12:27:00 +0900"
2025-03-30 03:47:50,국산 AI <b>반도체</b> 넣은 온디바이스 AI로 치안관제 서비스 만들어,https://n.news.naver.com/mnews/article/277/0005569667?sid=101,"과학기술정보통신부가 국산 인공지능(AI) <b>반도체</b>를 활용한 온디바이스 AI 기반 혁신 서비스 발굴과 도시... AI <b>반도체</b>를 쓴 온디바이스 AI를 활용한 CCTV 분석, 드론 관제 등을 개발하는 것을 골자로 한다. 멀티모달... ","Sun, 30 Mar 2025 12:17:00 +0900"
2025-03-30 03:47:50,85억 투입 '온디바이스 AI ' 개발···도시 단위 실증·확산,http://www.enewstoday.co.kr/news/articleView.html?idxno=2256774,"국산 인공지능(AI) <b>반도체</b>를 활용해 일상과 도시의 안전성·편리성을 위한 혁신 서비스를 발굴한다.... 빠른 서비스, 데이터 보안, 사용자 최적화 등 장점을 통해 국산 AI <b>반도체</b>의 새로운 시장으로 주목받고 있다.... ","Sun, 30 Mar 2025 12:15:00 +0900"
2025-03-30 03:47:50,"경북 구미시, 회색 산업단지에 문화 입힌다…문화선도산단 공모 사업 선...",https://www.viva100.com/article/20250330500338,"첨단산업시설은 <b>반도체</b> 연구단지, 가상융합산업 공간 등으로 구성되며, 정주시설에는 근로자 기숙사와 청년 맞춤형 코리빙하우스를 개념을 도입한 주상복합시설이 들어설 예정이다. 시는 이번 조성을 통해 방림 부지를... ","Sun, 30 Mar 2025 12:14:00 +0900"
2025-03-30 03:47:50,"대만, <b>반도체</b> 인력 불법채용 SMIC 등 中기업 11곳 수사",https://n.news.naver.com/mnews/article/003/0013151441?sid=104,대만 사법당국은 현지 <b>반도체</b> 기술자를 불법으로 고용한 SMIC(중신국제) 등 중국기업 11곳을 적발해 조사... 조사국에 따르면 SMIC는 사모아 기업으로 위장해 대만에 불법적으로 법인을 설치하고 <b>반도체</b> 기술자를... ,"Sun, 30 Mar 2025 12:14:00 +0900"
2025-03-30 03:47:50,"‘벚꽃 특수’ 실종, 산불 추경, 美관세···韓, 대내외 경제 삼중고",https://n.news.naver.com/mnews/article/119/0002939093?sid=101,한은은 통화신용정책보고서를 통해 “최근 관세 대상으로 지목되는 자동차와 <b>반도체</b> 등은 대미수출 중 상당한 비중을 차지하고 있어 관세부과에 따른 영향이 클 수 있다”며 “글로벌 교역둔화에 따른 여타국 수출... ,"Sun, 30 Mar 2025 12:13:00 +0900"
2025-03-30 03:47:50,이상일 용인시장 &quot;지역 인력·장비 우선···함께 가는 발전&quot;,http://www.enewstoday.co.kr/news/articleView.html?idxno=2256775,'원삼중기연합회'는 처인구 원삼면에서 조성 중인 '용인<b>반도체</b>클러스터 일반산업단지' 1기 생산라인(팹·Fab)... 이 시장은 &quot;용인에는 앞으로 <b>반도체</b>클러스터 4개 생산라인과 삼성전자가 360조 원을 투자하는 국가산단의... ,"Sun, 30 Mar 2025 12:13:00 +0900"
2025-03-30 03:47:50,"정부, AI 디바이스로 우리 일상 안전하게 지킨다",http://www.metroseoul.co.kr/article/20250330500142,/과기정통부 과학기술정보통신부가 국산 AI <b>반도체</b> 기반의 온디바이스 AI 서비스를 발굴하고 도시 단위... 최근 국산 AI <b>반도체</b>와 경량화 모델의 발전으로 실시간 데이터 처리 및 개인화 서비스 구현이 용이해지며... ,"Sun, 30 Mar 2025 12:10:00 +0900"
2025-03-30 03:47:50,‘의대 쏠림’에...SKY 자연계 학과 합격선 낮아져,https://www.etoday.co.kr/news/view/2457232,"의대보다 합격선이 높은 서울·고려·연세대 최상위 학과들은 2022학년도 △서울대 컴퓨터공학부 △서울대 전기정보공학부로 꼽혔고 2023학년도에는 △서울대 수리과학부 △고려대 <b>반도체</b>공학과, 2024학년도에는... ","Sun, 30 Mar 2025 12:06:00 +0900"
2025-03-30 03:47:50,[이번주 경제] 美 상호관세 '촉각'…산업활동·수출입 영향은,https://n.news.naver.com/mnews/article/421/0008161746?sid=101,"2월에는 <b>반도체</b> 수출 실적이 3% 감소하면서 15개월 만에 마이너스로 전환했고, 미국과 중국에 대한 수출액이 100억 달러 아래로 떨어지며 수출이 감소했다. 통계청은 31일 '2월 산업활동동향'을 발표한다. 1월에는 생산... ","Sun, 30 Mar 2025 12:06:00 +0900"
2025-03-30 03:47:50,"&quot;samsung.ai.kr, 500만원에 팔아요&quot;…신규 도메인 허와 실",https://news.mtn.co.kr/news-detail/2025033010544946174,"국내 IT업계 중에선 카카오(kakao.ai)와 자체 대형언어모델(LLM)을 보유 중인 스타트업 업스테이지(upstage.ai), 메타가 1조원대에 인수 의사를 타진하며 화제가 된 AI <b>반도체</b> 설계 스타트업 퓨리오사AI(furiosa.ai) 등이... ","Sun, 30 Mar 2025 12:04:00 +0900"
2025-03-30 03:47:50,"中, 콩코드보다 50% 더 가는 여객기 개발중…미중 기술경쟁 확전",https://n.news.naver.com/mnews/article/001/0015298370?sid=104,중국의 이번 C949 세부 사항 공개는 미중 경쟁이 <b>반도체</b>·AI를 넘어 과학·기술 전 분야로 확대되는 상황에서 이뤄진 것이기도 하다. 미국 항공우주국(NASA)의 X-59 퀘스트(QueSST) 프로젝트는 2027년 75 PLdB의 초음속 여객기... ,"Sun, 30 Mar 2025 12:03:00 +0900"
2025-03-30 03:47:50,85억 국산 <b>반도체</b> 활용 '온디바이스 AI' 도시 단위 실증,https://n.news.naver.com/mnews/article/018/0005974074?sid=105,"이번 과제 공모는 국산 AI <b>반도체</b>를 활용한 온디바이스 AI 기반의 혁신 서비스를 발굴하고, 도시 단위의... 특히 AI <b>반도체</b>·모델의 발전으로 온디바이스 AI를 통한 실시간 데이터 처리와 개인화된 서비스 제공이 더욱... ","Sun, 30 Mar 2025 12:03:00 +0900"
2025-03-30 03:47:50,美관세전쟁에 흔들리는 韓경제…대책은[기재부 주간계획],https://n.news.naver.com/mnews/article/018/0005974075?sid=101,"목재, <b>반도체</b> 등 추가 품목에도 확대 적용될 전망이다. 이에 우리나라는 지난해 대미 수출 1위 품목인 자동차를 시작으로 컴퓨터, 자동차 부품, <b>반도체</b> 등의 수출 난항이 예상된다. 도널드 트럼프 미국 대통령.(사진... ","Sun, 30 Mar 2025 12:03:00 +0900"
2025-03-30 03:47:50,ICT기업 생산·수출 감소했지만…R&amp;D 투자 7.4% '증가',http://www.newstomato.com/ReadNews.aspx?no=1257552&inflow=N,"(자료=과기정통부) 업종별로는 AI 일상화 본격 추진, 국산 AI <b>반도체</b> 기술개발 착수, 6G 선행기술 확보와 밀접한 정보통신방송기기업 분야에서 가장 많은 금액의 투자가 진행됐습니다. 51조8000억원 규모였는데요.... ","Sun, 30 Mar 2025 12:02:00 +0900"
2025-03-30 03:47:50,"中 최대 <b>반도체</b> 업체, 대만 인재 빼돌리기 적발",https://n.news.naver.com/mnews/article/079/0004007909?sid=104,중국 최대 <b>반도체</b>업체가 대만에서 불법으로 인재 빼돌리기에 나선 혐의로 대만 당국에게 적발됐다고... 조사국은 특히 중국 최대 <b>반도체</b>업체로 '중국판 TSMC'로 불리는 SMIC(중신궈지)가 태평양 섬나라인 미국령... ,"Sun, 30 Mar 2025 12:02:00 +0900"
2025-03-30 03:47:50,"국내 ICT 기업, R&amp;D에 연간 56.8조원 투자",https://n.news.naver.com/mnews/article/092/0002368628?sid=105,"업종 별로는 AI 일상화 본격 추진, 국산 AI <b>반도체</b> 기술개발 착수, 6G 선행기술 확보 추진 등과 밀접한 관련이 있는 정보통신방송기기업 분야에서 가장 많은 51조8천억 원이 투자됐다. 연구단계 별로는 개발연구가... ","Sun, 30 Mar 2025 12:01:00 +0900"
2025-03-30 03:47:50,"특허청, IP사업화 참여 기업 모집",https://n.news.naver.com/mnews/article/366/0001065102?sid=105,"특히 산업 판도를 바꿀 3대 게임체인저(AI·<b>반도체</b>, 첨단바이오, 사이버보안·양자) 분야 스타트업 발굴을 위해 전문 트랙도 개설한다. 김정균 특허청 산업재산정책국장은 “올해도 민간 투자유치 확대가 IP기반의... ","Sun, 30 Mar 2025 12:01:00 +0900"
2025-03-30 03:47:50,국내 ICT 기업 연구개발비 56조8000억원…전체 기업 연구개발비 중 60%,https://n.news.naver.com/mnews/article/119/0002939082?sid=105,"업종 별로는 인공지능 일상화 본격 추진, 국산 AI <b>반도체</b> 기술개발 착수 및 6G 선행기술 확보 추진 등과 밀접한 관련이 있는 정보통신방송기기업 분야에서 가장 많은 51조 8000억원(3조 7000억원↑, 7.6%↑)이... ","Sun, 30 Mar 2025 12:01:00 +0900"
2025-03-30 03:47:50,국산 AI <b>반도체</b> 탑재 온디바이스 AI로 치안·관제 서비스 개발,https://n.news.naver.com/mnews/article/001/0015298335?sid=105,"과학기술정보통신부는 국산 인공지능(AI) <b>반도체</b>를 활용한 온디바이스 AI 기반 혁신 서비스를 발굴하고... AI <b>반도체</b>를 쓴 온디바이스 AI를 활용한 CCTV 분석, 드론 관제 등을 개발한다. 멀티모달, 생성형 AI 지원이 가능한... ","Sun, 30 Mar 2025 12:00:00 +0900"
2025-03-30 03:47:50,"우수 특허 스타트업 키우다…특허청, 민간 투자사 모집",https://n.news.naver.com/mnews/article/029/0002944493?sid=105,"특히 올해는 AI·<b>반도체</b>, 첨단 바이오, 사이버보안·양자 등 3개 전문 트랙을 신설해 이 분야에 IP 전문성을 보유한 민간 운영사 3개사를 별도 선정할 예정이다. 참여 희망 기관은 한국발명진흥회 홈페이지와... ","Sun, 30 Mar 2025 12:00:00 +0900"
2025-03-30 03:47:50,"국내 ICT 기업, 2023년 연구개발비 56.8조…전년比 7.4%↑",https://n.news.naver.com/mnews/article/003/0013151412?sid=105,"구체적으로 살펴 보면, 업종 별로는 AI 일상화 본격 추진, 국산 AI <b>반도체</b> 기술개발 착수 및 6G 선행기술 확보 추진 등과 밀접한 관련이 있는 정보통신방송기기업 분야에서 가장 많은 51조8000억원이 투자돼... ","Sun, 30 Mar 2025 12:00:00 +0900"
2025-03-30 03:47:50,트럼프 &quot;4월2일부터 외국산 車에 25% 관세&quot;…휘몰아치는 관세전쟁에 한...,https://n.news.naver.com/mnews/article/586/0000100236?sid=104,지난해 국내 전체 수출에서 자동차 비중은 10.4%로 <b>반도체</b> 다음으로 크다. 또 한국 기업의 자동차 해외 수출액 중 미국 시장 비중은 거의 절반(49.1%)에 달한다. 여기에 트럼프 정부가 '두 번 때리는' 2단계 체계 상호관세를... ,"Sun, 30 Mar 2025 12:00:00 +0900"
2025-03-30 03:47:50,과기정통부 '온디바이스 AI 서비스 실증·확산' 사업 공모,https://www.newscj.com/news/articleView.html?idxno=3251675,해당 사업은 국산 AI <b>반도체</b>를 활용한 온디바이스 AI 기반의 혁신 서비스를 발굴하고 도시 단위의 대규모... 특히 AI <b>반도체</b>·모델의 발전으로 온디바이스 AI를 통한 실시간 데이터 처리와 개인화된 서비스 제공이 더욱... ,"Sun, 30 Mar 2025 12:00:00 +0900"
2025-03-30 03:47:50,"韓 ICT 기업, 2023년 연구개발에 56.8조원 투자…전년비 7.4%↑",https://www.etoday.co.kr/news/view/2457203,"업종 별로는 인공지능 일상화 본격 추진, 국산 인공지능(AI) <b>반도체</b> 기술개발 착수 및 6G 선행기술 확보 추진 등과 밀접한 관련이 있는 정보통신방송기기업 분야에서 가장 많은 51조8000억 원이 투자됐다. 연구단계... ","Sun, 30 Mar 2025 12:00:00 +0900"
2025-03-30 03:47:50,"과기정통부, '온디바이스 AI 서비스 실증·확산 사업' 과제 공모",https://n.news.naver.com/mnews/article/003/0013151410?sid=105,"과학기술정보통신부는 국산 인공지능(AI) <b>반도체</b>를 활용한 '온디바이스 AI' 기반의 혁신 서비스를... 특히, AI <b>반도체</b>·모델의 발전으로 온디바이스 AI를 통한 실시간 데이터 처리와 개인화된 서비스 제공이 더욱... ","Sun, 30 Mar 2025 12:00:00 +0900"
2025-03-30 03:47:50,불확실성 정점 통과…공매도·관세 시행 후 2600선 지지 테스트[주간증...,https://n.news.naver.com/mnews/article/003/0013151423?sid=101,"그러면서 나 연구원은 관심 업종으로 <b>반도체</b>와 유통, 음식료, 증권, 제약·바이오 등을 꼽았다. 다만 주요... 있는 <b>반도체</b> 업종의 비중 확대 전략이 유효할 것&quot;이라고 전망했다. ◇주요 경제지표 발표 및 이벤트 일정... ","Sun, 30 Mar 2025 12:00:00 +0900"
2025-03-30 03:47:50,"과기정통부, '온디바이스AI 도시 실증사업' 86억원 투입",https://www.techm.kr/news/articleView.html?idxno=137631,온디바이스AI 서비스 실증 확산 사업 과제 예시/사진=과기정통부 제공 정부가 국내 인공지능(AI) <b>반도체</b>와... 국산 AI <b>반도체</b>를 활용해야 한다. 안전한 도시는 AI 폐쇄회로(CC)TV가 핵심이다. 편리한 도시는 자율주행... ,"Sun, 30 Mar 2025 12:00:00 +0900"
2025-03-30 03:47:50,'지역을 위한 온디바이스 AI' 정부 과제공모,https://n.news.naver.com/mnews/article/008/0005172918?sid=105,"사업은 국산 AI <b>반도체</b>를 활용한 온디바이스(기기탑재형) AI 기반 혁신서비스 발굴, 도시 단위 대규모... 공모로 선정될 3개 컨소시엄은 1단계(2025~2026년) 사업기간에 CNN(인공지능신경망) 기반의 국산 AI <b>반도체</b>를 활용한... ","Sun, 30 Mar 2025 12:00:00 +0900"
2025-03-30 03:47:50,온디바이스 AI 도시 단위 실증 추진…과제 공모에 85.5억 투입,https://n.news.naver.com/mnews/article/029/0002944495?sid=105,"이를 통해 국산 AI <b>반도체</b>를 활용한 온디바이스 AI 기반의 혁신 서비스를 발굴하고, 도시 단위의 대규모... 특히 AI <b>반도체</b>·모델의 발전으로 온디바이스 AI를 통한 실시간 데이터 처리와 개인화된 서비스 제공이... ","Sun, 30 Mar 2025 12:00:00 +0900"
2025-03-30 03:47:50,&quot;AI·6G 선점하자&quot; 2023년 ICT기업 연구개발비 7%↑,https://n.news.naver.com/mnews/article/008/0005172923?sid=105,"업종별로는 AI 일상화 추진, 국산 AI <b>반도체</b> 기술개발 착수, 6G 선행기술 확보 추진 등과 관련 있는 정보통신방송기기업 분야에서 연구개발비 투자(51조8000억원)가 가장 많았다. 연구단계 별로는 개발연구가... ","Sun, 30 Mar 2025 12:00:00 +0900"
2025-03-30 03:47:50,국산 AI<b>반도체</b>로 국민체감형 온디바이스 AI 서비스…올해 85.5억,https://n.news.naver.com/mnews/article/421/0008161742?sid=105,국산 인공지능(AI) <b>반도체</b>로 '온디바이스 AI'(오프라인 단말서 작동하는 AI) 혁신 서비스를 구현·실증하는... 특히 AI <b>반도체</b>‧모델의 발전으로 온디바이스 AI를 통한 실시간 데이터 처리와 개인화된 서비스 제공이... ,"Sun, 30 Mar 2025 12:00:00 +0900"
2025-03-30 03:47:50,"타이완, ‘인재 빼돌리기’ 중국 기업 11곳 적발",https://n.news.naver.com/mnews/article/056/0011921287?sid=104,조사국은 특히 중국 최대 <b>반도체</b>업체로 ‘중국판 TSMC’로 불리는 SMIC(중신궈지)가 태평양 섬나라인 미국령 사모아에 회사를 설립한 후 2010년 외국 자본 명의로 위장해 북부 신주 지역에 자회사를 설립했다고... ,"Sun, 30 Mar 2025 12:00:00 +0900"
2025-03-30 03:47:50,"이상일 시장 &quot;<b>반도체</b> 도시 용인, 교육도 세계 수준으로&quot;",http://www.enewstoday.co.kr/news/articleView.html?idxno=2256771,이상일 시장은 &quot;글로벌 <b>반도체</b> 중심도시로 도약하는 용인에서 미래인재 양성을 위한 교육투자는 최우선 과제 중 하나&quot;라며 &quot;학생들이 보다 나은 환경에서 보다 좋은 교육을 받을 수 있도록 그동안 각급 학교에 많은... ,"Sun, 30 Mar 2025 11:59:00 +0900"
2025-03-30 03:47:50,'4월 2일 트럼프發 상호관세’ 글로벌 무역전쟁 전면전…한국은?,https://n.news.naver.com/mnews/article/119/0002939075?sid=101,"이미 지난 12일부터 트럼프 행정부는 철강·알루미늄에 대한 25% 관세를 부과 중이고 내달 3일부터는 한국의 대미 수출 품목 1위인 자동차와 자동차 핵심부품에도 25% 관세를 부과할 예정이며 그밖에 <b>반도체</b>, 의약품 등의... ","Sun, 30 Mar 2025 11:58:00 +0900"
2025-03-30 03:47:50,"트럼프, 내달 2일 상호관세 예고… 자동차, 철강 산업 등 비상",http://www.hansbiz.co.kr/news/articleView.html?idxno=741354,"<b>반도체</b>, 배터리 업계도 글로벌 공급망 불확실성 확대 등을 인한 직간접 타격을 우려하며 현지 생산 확대를 포함한 피해 최소화 방안을 신중하게 검토하고 있다. 국내 차업계는 최근 공식화된 외국산 자동차 25% 관세율에... ","Sun, 30 Mar 2025 11:56:00 +0900"
2025-03-30 03:47:50,상호관세 맞으면 25％＋α…자동차·철강 등 韓기업들 초비상,https://www.digitaltoday.co.kr/news/articleView.html?idxno=559371,"<b>반도체</b>, 배터리 등 업계도 글로벌 공급망 불확실성 확대 등으로 인한 직간접 타격을 우려하며 현지 생산... <b>반도체</b>도 동향 예의주시…현지투자 신중 접근 <b>반도체</b> 업계는 트럼프 대통령이 미국으로 들어오는 <b>반도체</b>에... ","Sun, 30 Mar 2025 11:56:00 +0900"
2025-03-30 03:47:50,"&quot;가전이 가족을 알아본다&quot;...삼성전자, 2025년형 비스포크 AI 라인업 공개",https://www.digitaltoday.co.kr/news/articleView.html?idxno=559376,제품명 주요 기능 및 특징 성능/용량 대표 제품인 '비스포크 AI 하이브리드' 냉장고는 컴프레서와 <b>반도체</b> 소자가 함께 구동해 최적 효율을 내는 'AI 하이브리드 쿨링' 기능을 갖췄다. 올해는 9형 스크린을 탑재하고... ,"Sun, 30 Mar 2025 11:50:00 +0900"
2025-03-30 03:47:50,"대만, '인재 빼돌리기' 中기업 11곳 적발…<b>반도체</b> 포함",https://n.news.naver.com/mnews/article/448/0000517140?sid=100,조사국은 특히 중국 최대 <b>반도체</b>업체로 '중국판 TSMC'로 불리는 SMIC(중신궈지)가 태평양 섬나라인 미국령 사모아에 회사를 설립한 후 2010년 외국 자본 명의로 위장해 북부 신주 지역에 자회사를 설립했다고 설명했다.... ,"Sun, 30 Mar 2025 11:48:00 +0900"
2025-03-30 03:47:50,&quot;시장 어렵다&quot; TSMC 日공장 장비 반입 속도조절,https://n.news.naver.com/mnews/article/014/0005328257?sid=101,세대 <b>반도체</b>의 수요 부진과 도널드 트럼프 미국 행정부의 관세 정책에 대한 우려가 배경&quot;이라고 복수의 관계자의 말을 인용해 전했다. TSMC는 구마모토 제1공장의 회로선폭 12~16나노(나노는 10억분의 1m) <b>반도체</b> 생산에... ,"Sun, 30 Mar 2025 11:44:00 +0900"
2025-03-30 03:47:50,"삼성전자, 2025년형 비스포크 AI 라인업 공개",https://www.thefairnews.co.kr/news/articleView.html?idxno=44295,"'비스포크 AI 하이브리드' 냉장고는 컴프레서와 <b>반도체</b> 소자가 함께 구동하며 최적의 효율을 내는 방식의 'AI 하이브리드 쿨링' 기능을 갖춘 제품으로, 올해는 9형 스크린을 탑재하고 프리스탠드부터 키친핏까지... ","Sun, 30 Mar 2025 11:42:00 +0900"
2025-03-30 03:47:50,"&quot;일상을 혁신&quot;···삼성전자, '비스포크 AI' 생태계 본격 확장",https://www.ziksir.com/news/articleView.html?idxno=86251,"비스포크 AI 하이브리드 냉장고는 컴프레서와 <b>반도체</b> 소자가 함께 구동하며 최적의 효율을 내는 방식의 'AI 하이브리드 쿨링' 기능을 갖춘 제품으로, 올해는 9형 스크린을 탑재하고 프리스탠드부터 키친핏까지... ","Sun, 30 Mar 2025 11:42:00 +0900"
2025-03-30 03:47:50,트럼프가 극찬 쏟아낸 ‘이 남자’…‘31조’ 선물보따리 뭐길래 [이번...,https://n.news.naver.com/mnews/article/009/0005467406?sid=102,"지난 19일에도 주주총회에서 “초격차 기술 리더십으로 재도약의 기틀을 다지고, 로봇·차세대 <b>반도체</b> 등 다양한 영역에서 새로운 도전을 이어가겠다”며 삼성전자의 반등 의지를 드러내기도 했습니다. 한 부회장의... ","Sun, 30 Mar 2025 11:40:00 +0900"
2025-03-30 03:47:50,"대만, '인재 빼돌리기' 中기업 11곳 적발…<b>반도체</b> SMIC 등 포함",https://n.news.naver.com/mnews/article/001/0015298326?sid=104,조사국은 특히 중국 최대 <b>반도체</b>업체로 '중국판 TSMC'로 불리는 SMIC(중신궈지)가 태평양 섬나라인 미국령 사모아에 회사를 설립한 후 2010년 외국 자본 명의로 위장해 북부 신주 지역에 자회사를 설립했다고 설명했다.... ,"Sun, 30 Mar 2025 11:40:00 +0900"
2025-03-30 03:47:50,"두산에너빌리티, 원익IPS와 적층제조(AM) 기술 교류 및 공동 연구 MOU",http://www.ikld.kr/news/articleView.html?idxno=310570,"두산에너빌리티는 <b>반도체</b> 장비 전문회사 원익IPS와 금속 적층제조(Additive Manufacturing, 이하 'AM') 기술 교류... 또한 금속 AM 품질 관리 기준에 적합한 품질문서 개정에 협력하는 등 <b>반도체</b> 시장의 요구사항을... ","Sun, 30 Mar 2025 11:36:00 +0900"
