DateTime,Title,Link,Description,PubDate
2026-03-17 19:31:06,"삼성전자 &quot;엔비디아 협력, AI 에이전트·디지털트윈 혁신으로 확장&quot;",https://n.news.naver.com/mnews/article/374/0000498579?sid=101,진행한 <b>반도체</b> 엔지니어링 전략 발표를 통해 이같이 말했습니다. 송 센터장은 삼성전자의 <b>반도체</b> 전략에 대해 개별 단계가 아닌 설계부터 제조에 이르는 전 과정에서 에이전틱 AI를 활용해 최적화하고 있다고... ,"Wed, 18 Mar 2026 04:23:00 +0900"
2026-03-17 19:31:06,[시론] 남은 시간이 많지 않다,https://www.dnews.co.kr/uhtml/view.jsp?idxno=202603161444591990326,"우리나라에 <b>반도체</b>, 자동차 그리고 조선이라는 엄청난 산업이 없었다면 과연 우리는 지금 어느 정도 수준의 나라일까? 어떻게 생각해도 이 세 개의 산업은 우리에게는 너무나 소중하다. 만일 여기에 이에 버금가는 또 다른... ","Wed, 18 Mar 2026 04:20:00 +0900"
2026-03-17 19:31:06,"&quot;2주 만에 돈 삭제&quot; 비명, 환호로 바뀔까...현대차그룹주 다시 달린다",https://n.news.naver.com/mnews/article/008/0005331364?sid=101,임정은·태윤선·김상엽 KB증권 연구원은 &quot;유가 진정과 함께 장중 1480원대까지 하락한 원/달러 환율이 마감기준 1490원대로 되돌아갔다&quot;며 &quot;이란전쟁으로 투자심리의 불안정이 계속되지만 <b>반도체</b> 등 개별 이벤트가 있는... ,"Wed, 18 Mar 2026 04:20:00 +0900"
2026-03-17 19:31:06,"[용인 톺아보기] <b>반도체</b>산단, 왜 용인인가(?)…이상일, “국가 미래를 ...",https://www.ekn.kr/web/view.php?key=20260317021418587,"경기=에너지경제신문 송인호 기자 <b>반도체</b>는 이제 한마디로 국가안보이자 경제이며 미래 기술경쟁력의 핵심축이라 하기에 충분하다. 인공지능(AI), 자율주행, 데이터센터, 첨단방위산업까지 거의 모든 미래산업이 <b>반도체</b>... ","Wed, 18 Mar 2026 04:10:00 +0900"
2026-03-17 19:31:06,[AI 패권 경쟁] 엔비디아 '매출 1조 달러' 선언…빅테크는 AI 클라우드 임...,https://www.g-enews.com/view.php?ud=202603171736593467fbbec65dfb_1,"세계 최대 AI <b>반도체</b> 기업이 불과 3년 안에 매출을 7배 키우겠다고 선언한 날, 그 칩을 가장 많이 사들이는... AI <b>반도체</b> 시장에서 수요가 공급을 여전히 압도하는 현실을 재확인한다고 평가했다. 메타의 딜레마…자체... ","Wed, 18 Mar 2026 04:06:00 +0900"
2026-03-17 19:31:06,[GTC 2026] 송용호 삼성 AI센터장 &quot;에이전트 AI로 <b>반도체</b> 전 공정 연결&quot;…...,https://www.ajunews.com/view/20260318033920954,통한 <b>반도체</b> 공학의 혁신'을 주제로 발표하고 있다. [사진=조성준 기자] &quot;이제 우리는 에이전트(Agent) AI로 나아가고 있습니다.&quot; 17일(현지시간) 미국 새너제이에서 열린 'GTC 2026'에서 송용호 센터장은 <b>반도체</b> 설계와 제조... ,"Wed, 18 Mar 2026 04:06:00 +0900"
2026-03-17 19:31:06,GPU 이어 'LPU칩' 속도전… AI 포식자 야욕 드러낸 엔비디아,https://n.news.naver.com/mnews/article/008/0005331355?sid=101,"AI<b>반도체</b> 스타트업 '그록'의 기술을 기반으로 한 솔루션이다. 올 하반기에 출시할 예정인 차세대 AI... 세션과 별도로 전시관에서는 로봇부터 자율주행차, <b>반도체</b> 등 AI산업을 움직이는 최신 기술의 향연이... ","Wed, 18 Mar 2026 04:05:00 +0900"
2026-03-17 19:31:06,최태원 &quot;메모리 공급 부족 2030년까지 지속&quot;,https://n.news.naver.com/mnews/article/008/0005331353?sid=101,최 회장은 &quot;공급부족 문제는 웨이퍼(<b>반도체</b> 기판) 부족에서 비롯되는데 더 많은 웨이퍼를 확보하려면 최소 4~5년이 걸린다&quot;며 &quot;웨이퍼 공급이 수요보다 20% 이상 부족한 상태&quot;라고 설명했다. 이어 &quot;가격 안정화를 위해... ,"Wed, 18 Mar 2026 04:04:00 +0900"
2026-03-17 19:31:06,[출근길포인트]서울 아파트 공시가격 5년 만에 최고 상승률 18.67%,https://www.pointdaily.co.kr/news/articleView.html?idxno=296623,"◇<b>반도체</b> 호황 덕분, SK하이닉스 작년 직원 평균연봉 1억8500만원 지난 9일 충북대학교 개신문화관에서... 사진=연합뉴스 SK하이닉스 직원들의 평균 연봉이 <b>반도체</b> 슈퍼사이클과 AI 메모리 호황에 힘입어 사상 최고... ","Wed, 18 Mar 2026 04:00:00 +0900"
2026-03-17 19:31:06,[사모신용 경보] &quot;부도율 9.2% 금융위기 넘었다&quot;… 3조 달러 사모신용 '...,https://www.g-enews.com/view.php?ud=202603171730382870fbbec65dfb_1,"AI <b>반도체</b> 수요 전망도 근본적인 재검토가 불가피해진다. 9.2%의 충격, 2009년 기록을 깬 '역대 최악' 글로벌... 한국 <b>반도체</b>로 이어지는 충격 사모 신용 시장의 균열이 왜 삼성전자·SK하이닉스 주주들의 문제가... ","Wed, 18 Mar 2026 03:56:00 +0900"
2026-03-17 19:31:06,"삼성전자 &quot;엔비디아 협력, 에이전트·디지털트윈 혁신으로 확장&quot;",https://n.news.naver.com/mnews/article/001/0015965056?sid=104,"송용호 AI센터장, 엔비디아 GTC서 <b>반도체</b> 엔지니어링 전략 발표 권영전 특파원 = 삼성전자는 엔비디아와의... 진행한 <b>반도체</b> 엔지니어링 전략 발표를 통해 이처럼 말했다. 송 센터장은 삼성전자의 <b>반도체</b> 전략에 대해 개별... ","Wed, 18 Mar 2026 03:55:00 +0900"
2026-03-17 19:31:06,"기업은행, 혁신 중소기업 대상 '생산적 금융 전담심사반' 운영",https://www.apnews.kr/news/articleView.html?idxno=3046855,"'생산적금융 전담심사반'은 <b>반도체</b>와 이차전지, 바이오, 인공지능(AI) 등 혁신기업의 자금 수요에 신속히 대응하기 위해 신설됐다. 여신 심사를 위한 전문 심사역과 공인회계사, 애널리스트 등 전문 인력 40명으로 구성돼... ","Wed, 18 Mar 2026 03:52:00 +0900"
2026-03-17 19:31:06,"[테슬라 <b>반도체</b> 굴기] 테슬라, <b>반도체</b> 직접 제조 선언… TSMC·삼성전자와...",https://www.g-enews.com/view.php?ud=202603171725021755fbbec65dfb_1,"대한민국 <b>반도체</b> 산업의 저력이 수십 년간 클린룸(clean room) 안에서 축적한 '수율(收率)의 기술'에 달려... 그의 발언은 혁명적 통찰인가, 아니면 <b>반도체</b> 산업의 물리적 한계를 간과한 무지의 자신감인가. 테슬라가 세계... ","Wed, 18 Mar 2026 03:36:00 +0900"
2026-03-17 19:31:06,"방사청, 올해 9.3조 투입 '첨단전력 대전환'",https://www.goodmorningcc.com/news/articleView.html?idxno=443053,"방사청은 국방<b>반도체</b>법 제정을 추진하고, AI 유무인 체계 시험 인프라와 국방위성 발사지원시설 구축에... 수출통제(E/L), ITAR 품목, <b>반도체</b> 등 핵심 부품의 국산화를 통해 외부 의존도를 낮추고, 국산 부품 활용을... ","Wed, 18 Mar 2026 02:28:00 +0900"
2026-03-17 19:31:06,전남광주특별시장 TV토론회…20조 예산 활용처부터 '주청사 위치' 뇌관...,https://n.news.naver.com/mnews/article/002/0002432290?sid=102,"강기정 후보는 &quot;20조원의 핵심은 투자&quot;라며 &quot;3조원을 선제적으로 투입해 30조원 규모를 목표로 하는 대기업 메가펀드를 조성하고, <b>반도체</b> 등 대기업 유치에 전력하겠다&quot;고 밝혔다. 민형배 후보는 &quot;AI·<b>반도체</b>·우주·RE100산단... ","Wed, 18 Mar 2026 02:24:00 +0900"
2026-03-17 19:31:06,[6·3 지방선거] 양향자 경기도지사 경선후보① &quot;경기도 산업의 55%가 반...,https://www.polinews.co.kr/news/articleView.html?idxno=725689,양향자 국민의힘 경기도지사 경선후보가 16일 &quot;경기도 산업의 55%가 <b>반도체</b>인데 <b>반도체</b>를 모르고 경기 도정을 맡겠다는 것은 넌센스&quot;라고 설명했다. 양 후보는 이날 오후 폴리뉴스 본사에서 김능구 대표와 진행한 6·3... ,"Wed, 18 Mar 2026 01:50:00 +0900"
2026-03-17 19:31:06,이광재 “WBC 슈퍼스타 오타니의 절실함 배워야”,http://www.newstomato.com/ReadNews.aspx?no=1294620&inflow=N,"한편, 금융위원회는 공공 75조원, 민간 75조원을 매칭한 150조원 규모 국민성장펀드를 조성해서 AI, <b>반도체</b>, 배터리, 백신, 바이오, 디스플레이, 수소, 미래차, 방산, 로봇, 콘텐츠, 핵심광물 등 12개 산업과 지방소재 기업의... ","Wed, 18 Mar 2026 01:44:00 +0900"
2026-03-17 19:31:06,"정부, 50조 원 투입 'K-엔비디아 프로젝트'로 AI <b>반도체</b> 도약",https://www.tokenpost.kr/news/tech/340432,정부가 토종 AI <b>반도체</b>를 육성하기 위한 50조 원 규모의 금융 지원 계획을 발표했다. 글로벌 AI 시장에서... 이번 펀드는 AI <b>반도체</b> 특허 펀드를 포함한 대규모 모험 자본 공급을 통해 국내 AI <b>반도체</b> 산업의 생태계를... ,"Wed, 18 Mar 2026 01:38:00 +0900"
2026-03-17 19:31:06,3월 3주 주요 제조업 전망,https://www.laborplus.co.kr/news/articleView.html?idxno=40502,"인공지능·<b>반도체</b> 등 다양한 분야로의 투자를 위축시킬 가능성도 있다고 함 - 맹진규 연구원은 자동차... 구체적으로 자동차 산업의 외연 확장을 위해선 <b>반도체</b>, 디스플레이 등 산업과 협업 채널을 확대해 혁신 기술... ","Wed, 18 Mar 2026 01:24:00 +0900"
2026-03-17 19:31:06,승부수 못 띄운 오세훈의 라스트 댄스,https://www.newsverse.kr/news/articleView.html?idxno=9935,"공희준은 &quot;산업의 쌀이 <b>반도체</b>라면, 모든 콘텐츠의 쌀은 글&quot;이라고 믿으며 정치평론과 인물비평을 중심으로 PC통신 시절부터 SNS 시대인 지금까지 글쓰기에 전념해왔다. '강남좌파', 먹고사니즘' 같은 21세기 한국사회의... ","Wed, 18 Mar 2026 01:08:00 +0900"
2026-03-17 19:31:06,"&quot;광양 르네상스 선언&quot;…정인화 재선 도전, 성과냐 변화냐 '선거 쟁점화...",https://www.polinews.co.kr/news/articleView.html?idxno=725748,"▲ <b>반도체</b> 산업 유치 및 이차전지 전주기 순환망 구축, ▲ 수소 산업 활성화 및 남해안 에너지 고속도로 추진... 특히, <b>반도체</b> 산업 유치와 에너지 인프라 구축은 국가 정책과 직결되는 사안으로, 지방정부 단독 추진의... ","Wed, 18 Mar 2026 01:07:00 +0900"
2026-03-17 19:31:06,"정부, 50조 원 투입하여 한국 AI <b>반도체</b> 산업 육성 나선다",https://www.tokenpost.kr/news/economy/340422,"정부가 한국의 인공지능(AI) <b>반도체</b> 산업을 적극 육성하기 위해 5년 동안 50조 원 규모의 금융 지원을 추진하겠다고 발표했다. 이는 세계적인 <b>반도체</b> 기업 엔비디아에 대한 의존도를 줄이고, 자체적인 AI 기술 경쟁력을... ","Wed, 18 Mar 2026 00:58:00 +0900"
2026-03-17 19:31:06,‘K뷰티 열풍’ 마스크팩·‘북미 수요 확대’ 변압기… 韓수출 1위 새얼...,https://n.news.naver.com/mnews/article/005/0001837728?sid=101,"한국산 메모리 <b>반도체</b>와 변압기, 마스크팩이 2024년 기준 세계 수출 1위 품목에 새롭게 올랐다.... 메모리 <b>반도체</b>는 고대역폭메모리(HBM) 등 고부가가치 제품의 선전에 힘입어 5년 만에 중국을 제치고 왕좌 자리를... ","Wed, 18 Mar 2026 00:55:00 +0900"
2026-03-17 19:31:06,"[마켓인사이드] AI 투자 사이클 판을 바꾼 엔비디아, ‘1조 달러 수주 예...",https://www.news2day.co.kr/article/20260318500001,"엔비디아 칩에 대한 투자는 단순한 <b>반도체</b> 구매에 그치지 않고, 데이터센터 구축, 클라우드, 전력, 보안 등 다양한 산업으로 확산된다. 아이브스는 이를 두고 “1달러 투자 시 8~10배의 경제 효과가 발생한다”고... ","Wed, 18 Mar 2026 00:54:00 +0900"
2026-03-17 19:31:06,"[AI의 종목 이야기] 퀄컴, 200억달러 자사주 매입+배당금 인상",https://www.newspim.com/news/view/20260318000008,"퀄컴 로고 [사진=블룸버그] 퀄컴은 지난달 글로벌 메모리 <b>반도체</b> 부족으로 일부 고객, 특히 중국... 최근 주요 기술 기업들이 인공지능 시스템 구축을 위해 메모리 <b>반도체</b>를 대량 확보하면서, 칩 제조업체들은... ","Wed, 18 Mar 2026 00:41:00 +0900"
2026-03-17 19:31:06,AI-<b>반도체</b>-기후테크 집중 육성… “유니콘 기업 배출하겠다”,https://n.news.naver.com/mnews/article/020/0003704880?sid=101,"이와 함께 인공지능(AI)과 <b>반도체</b> 분야 스타트업도 집중 육성한다. 현재 국내에는 기후테크 분야 유니콘이... AI와 <b>반도체</b>, 기후테크 기업에 집중할 계획”이라고 17일 밝혔다. 경기창경센터는 투자 혹한기로 일컬어진... ","Wed, 18 Mar 2026 00:33:00 +0900"
2026-03-17 19:31:06,삼성 파운드리 부활… 엔비디아 AI 칩 생산,https://n.news.naver.com/mnews/article/023/0003965138?sid=105,삼성이 엔비디아의 게임칩이 아닌 AI용 <b>반도체</b> 생산에 나선 것은 이번이 처음이다. 삼성의 ‘아픈 손가락’으로 여겨졌던 파운드리가 올해 <b>반도체</b> 수퍼 사이클을 타고 부활의 기지개를 켜고 있다. 고질적 문제로... ,"Wed, 18 Mar 2026 00:33:00 +0900"
2026-03-17 19:31:06,"최태원 “<b>반도체</b> 웨이퍼 공급 부족, 2030년까지 지속될 것”",https://n.news.naver.com/mnews/article/020/0003704875?sid=101,최태원 SK그룹 회장(사진)이 인공지능(AI) 확산으로 인한 글로벌 메모리 <b>반도체</b> 공급난이 2030년까지 이어질... 그는 “<b>반도체</b>와 AI 데이터센터 모두 에너지 솔루션이 필요하다”며 “SK그룹의 에너지 관계사가 새로운... ,"Wed, 18 Mar 2026 00:33:00 +0900"
2026-03-17 19:31:06,“외롭다”에 “새 우정이 널 기다려”… 세계 첫 감정학습 AI칩 나와,https://n.news.naver.com/mnews/article/020/0003704865?sid=101,AI <b>반도체</b>를 세계 최초로 개발했다고 17일 발표했다. 이름도 영혼의 친구 ‘소울메이트’다. ● 클라우드 없는 온디바이스 AI KAIST 인공지능<b>반도체</b>대학원 유회준 교수 연구팀이 개발한 LLM 가속기 ‘소울메이트’는... ,"Wed, 18 Mar 2026 00:32:00 +0900"
2026-03-17 19:31:06,최태원 “하이닉스 美증시 상장 검토… 2030년까지 웨이퍼 부족”,https://n.news.naver.com/mnews/article/023/0003965137?sid=101,이날 <b>반도체</b> 공급난에 대해서도 거듭 경고했다. 그는 “2030년까지 전 세계적으로 20% 이상의 웨이퍼 공급 부족이 지속될 것”이라며 “HBM 공급 부족은 웨이퍼 부족에서 비롯된다”고 했다. 웨이퍼는 <b>반도체</b>의... ,"Wed, 18 Mar 2026 00:32:00 +0900"
2026-03-17 19:31:06,"스마트폰 속 ‘AI절친’ 등장… KAIST, 혁신적 AI <b>반도체</b> 개발",https://n.news.naver.com/mnews/article/023/0003965135?sid=105,KAIST는 인공지능<b>반도체</b>대학원 유회준 교수 연구팀이 외부 서버를 거치지 않고 스마트폰 같은 기기 내부에서 학습과 추론을 동시에 처리하는 초개인화 인공지능(AI) <b>반도체</b>를 개발했다고 17일 발표했다.... ,"Wed, 18 Mar 2026 00:32:00 +0900"
2026-03-17 19:31:06,"전력저장장치(ESS) 관련주, '신바람난' 신성이엔지·상아프론테크·HD현...",http://www.finomy.com/news/articleView.html?idxno=251581,"신성이엔지는 <b>반도체</b>, 디스플레이, 이차전지 산업 등 고정밀 제조환경에 필수적인 클린룸, 드라이룸 등을... 부품사업은 2차전지, 자동차, 의료기기 제품의 부품을 생산, 소재사업은 프린터 BELT, <b>반도체</b> 패키징, PCB... ","Wed, 18 Mar 2026 00:26:00 +0900"
2026-03-17 19:31:06,"이기형 김포시장 예비후보 &quot;AI 허브 유치 흐름 속 김포, 미래산업 도시...",https://www.newsfreezone.co.kr/news/articleView.html?idxno=680264,이 후보는 앞서 출마 선언에서 제시한 '양자 AI 고성능 <b>반도체</b> 클러스터 조성'과 '청년 창업 인큐베이팅 시스템 구축' 공약도 재차 강조했다. 이기형 예비후보는 &quot;김포는 인구 50만을 넘어 70만 도시로 도약하는 중요한... ,"Wed, 18 Mar 2026 00:24:00 +0900"
2026-03-17 19:31:06,젠슨 황·최태원 ‘혈맹’ 속 리사 수·이재용 ‘맞손’,https://www.dnews.co.kr/uhtml/view.jsp?idxno=202603171536193750529,HBM 2기 초격차 동맹 시작됐다…엔비디아도 ‘삼성 카드’ 병행 글로벌 AI <b>반도체</b> 시장이 새로운 ‘2기... 이로써 글로벌 AI <b>반도체</b> 시장은 ‘엔비디아?SK하이닉스’와 ‘AMD?삼성전자’ 양축이 공존하는 체제로... ,"Wed, 18 Mar 2026 00:20:00 +0900"
2026-03-17 19:31:06,"2차전지 관련주, '봄날의 햇살' 더블유씨피·파워넷·PI첨단소재·상아프...",http://www.finomy.com/news/articleView.html?idxno=251580,"한울<b>반도체</b>, 삼아알미늄, 아이티엠<b>반도체</b>, 디아이티, 펨트론, 에스켐, 알멕 등은 하락했다. 더블유씨피는 2차전지용 전해질 분리막 제조사로 현재 국책과제인 '나트륨이온 배터리용 폴리올레핀계 수계 세라믹 코팅... ","Wed, 18 Mar 2026 00:20:00 +0900"
2026-03-17 19:31:06,[장훈 칼럼] 중동 위기와 슘페터 딜레마,https://n.news.naver.com/mnews/article/025/0003509758?sid=110,"지정학의 태풍이 불 때마다, 우리의 방위산업, 조선업, <b>반도체</b> 산업을 지렛대 삼아 위기를 해결하며 살아가는... <b>반도체</b> 칩, 무기체계, 전함 건조 능력 등의 물리적 힘을 넘어 우리가 중견 협력국들의 마음을 잡아끌 무형의... ","Wed, 18 Mar 2026 00:20:00 +0900"
2026-03-17 19:31:06,"과기정통부·금융위, 국산 AI <b>반도체</b> 육성에 10조 우선 투입…국산 NPU 키...",https://www.onews.tv/news/articleView.html?idxno=276792,인공지능 <b>반도체</b> 기업 육성을 위해 올해 10조원 규모의 정책 자금을 투입한다. 과학기술정보통신부와 금융위원회는 17일 오후 서울 중구 한국프레스센터에서 한국산업은행 및 국내 AI <b>반도체</b> 팹리스 5개사 대표와 함께... ,"Wed, 18 Mar 2026 00:20:00 +0900"
2026-03-17 19:31:06,최태원 “2030년까지 메모리 부족”… SK하이닉스 美 상장도 공개 거론,https://n.news.naver.com/mnews/article/005/0001837706?sid=101,최태원 SK그룹 회장이 글로벌 메모리 <b>반도체</b> 부족 현상이 2030년까지 지속될 것이라고 전망했다. 또... SK하이닉스는 “2월 미팅에서는 HBM4를 포함해 다양한 AI <b>반도체</b> 협력 방안이 논의된 것으로 알려졌다”며 “최... ,"Wed, 18 Mar 2026 00:17:00 +0900"
2026-03-17 19:31:06,롤러코스피 주가에 지친 개미들 손 뺐다..&quot;어느 장단에 사고팔라고..&quot;,https://n.news.naver.com/mnews/article/661/0000073083?sid=101,"엔비디아의 연례 개발자 회의 결과가 긍정적으로 평가됐고, 내일(19일) 마이크론 실적 발표를 앞두고 <b>반도체</b>와 자동차 업종에 기대감이 살아난 것이 반등의 배경으로 꼽힙니다. 급등락에 지쳐 관망세로 돌아섰던... ","Wed, 18 Mar 2026 00:13:00 +0900"
2026-03-17 19:31:06,젠슨 황 “땡큐 삼성”… 엔비디아 새 추론 칩 생산 맡겼다,https://n.news.naver.com/mnews/article/005/0001837700?sid=101,삼성전자는 베라 루빈에 장착될 6세대 고대역폭메모리(HBM4)를 지난달 세계 최초로 출하한 데 이어 파운드리(<b>반도체</b> 위탁생산) 분야에서도 핵심 파트너로 자리매김하고 있다. 삼성전자 파운드리 사업부는 현재 평택... ,"Wed, 18 Mar 2026 00:12:00 +0900"
2026-03-17 19:31:06,"자율주행차 관련주, '함박웃음' 에스오에스랩·아이에이·에이스테크·슈...",http://www.finomy.com/news/articleView.html?idxno=251578,"퀄리타스<b>반도체</b> 등은 하락했다. 에스오에스랩이 현대차 로보틱스랩에 라이다(LiDAR) 센서 공급을... 아이에이는 자동차 전장 분야를 중심으로 <b>반도체</b> 및 모듈, 제어기 사업을 전개하고 있다. 다양한 전장용 <b>반도체</b> 및... ","Wed, 18 Mar 2026 00:10:00 +0900"
2026-03-17 19:31:06,'리사 수 방한' 삼성·네이버와 회동...<b>반도체</b>株 강세 예고,https://www.gukjenews.com/news/articleView.html?idxno=3531948,또 네이버 최수연 대표도 만나 AI 데이터센터 사업 협력을 모색할 것으로 전망된다. 이번 회동으로 또 다시 <b>반도체</b> 주가가 반등할지 투자자들이 촉각을 곤두세우고 있다.,"Wed, 18 Mar 2026 00:10:00 +0900"
2026-03-17 19:31:06,"안성시, <b>반도체</b> 소부장 특화단지의 정체성 확립 및 미래지향적 브랜딩을...",https://www.m-i.kr/news/articleView.html?idxno=1351822,이번 공모는 <b>반도체</b> 소부장 특화단지로서의 정체성을 확립하고 미래지향적인 브랜딩을 구축하기 위해... 양 기관은 확정된 명칭과 '<b>반도체</b> 소부장 특화단지' 타이틀을 적극 활용하여 홍보물을 제작하고 타겟 기업을... ,"Wed, 18 Mar 2026 00:10:00 +0900"
2026-03-17 19:31:06,"티웨이항공, 1분기 화물처리량 2년 만에 2.3배 증가",https://www.klnews.co.kr/news/articleView.html?idxno=320374,"특히 티웨이항공은 화장품​과 전자상거래 물량은 물론 신선식품이나 <b>반도체</b> 부품​ 등 고부가가치 특수화물까지 처리하며 품목을 다변화했다. 또한 의약품과 바이오, 신선식품 등 온도에 민감한 화물의 수요도... ","Wed, 18 Mar 2026 00:10:00 +0900"
2026-03-17 19:31:06,강원특별법 3차 개정안 무엇이 담겼나?,https://n.news.naver.com/mnews/article/087/0001180646?sid=100,"전략산업특화단지는 <b>반도체</b>, 디스플레이, 이차전지, 바이오분야 등 4대 산업, 17개 전략기술에 대해 지정 가능하며 강원자치도에선 현재 춘천·홍천 바이오 특화단지가 지정돼있다. 강원전략연구사업에 관한 특례도... ","Wed, 18 Mar 2026 00:10:00 +0900"
2026-03-17 19:31:06,"로봇·산업용·협동로봇 관련주, '싱글벙글' 앤로보틱스·아이엘·휴림로...",http://www.finomy.com/news/articleView.html?idxno=251577,"1991년 <b>반도체</b> 장비 제조·판매를 목적으로 설립돼 1996년 코스닥에 상장한 지주회사로, 현재 15개의 종속회사를 보유하고 있다. 지주회사로서 원익아이피에스, 원익피앤이, 원익큐엔씨 등 주요 자회사를 통해 <b>반도체</b>... ","Wed, 18 Mar 2026 00:10:00 +0900"
2026-03-17 19:31:06,[강경주의 테크 인사이드] 중국이 전인대에서 BCI 언급한 이유,https://n.news.naver.com/mnews/article/015/0005263576?sid=110,"인공지능(AI)과 <b>반도체</b>에 이어 BCI 분야에서도 미·중 기술 패권 전쟁이 본격화하고 있다. 중국 정부는... BCI는 단순한 의료기술이 아니라 <b>반도체</b>, 데이터, 알고리즘, 로봇이 결합한 고부가가치산업의 집약체라는 걸 왜... ","Wed, 18 Mar 2026 00:09:00 +0900"
2026-03-17 19:31:06,디지털 헬스케어 AI 융합혁신 허브 조성사업 본격 추진,https://n.news.naver.com/mnews/article/087/0001180638?sid=102,"세계적인 <b>반도체</b> 기업인 엔비디아가 참여, 엔비디아가 직접 인증하는 교육기관을 원주에 설치·운영하는 것이 핵심이다. 과학기술정보통신부를 중심으로 정보통신산업진흥원이 관리·감독을 맡고... ","Wed, 18 Mar 2026 00:09:00 +0900"
2026-03-17 19:31:06,"[사설] 50조 투입 'K엔비디아 프로젝트', AI <b>반도체</b> 주권 발판 돼야",https://n.news.naver.com/mnews/article/015/0005263573?sid=110,정부가 17일 인공지능(AI) <b>반도체</b> 기업들과 간담회를 하고 ‘K-엔비디아 육성 프로젝트’의 본격 가동을... 엔비디아가 장악한 글로벌 AI 시장의 틈새를 파고들어 한국형 AI <b>반도체</b> 생태계를 구축하겠다는 국가적... ,"Wed, 18 Mar 2026 00:08:00 +0900"
2026-03-17 19:31:06,[사설] 3500억달러 대미투자법 의결…상업성과 환율 안정이 과제,https://n.news.naver.com/mnews/article/015/0005263575?sid=110,"이 원칙에 따라 선정한 전략적 투자 분야가 조선, <b>반도체</b>, 의약품, 핵심 광물, 에너지, 인공지능(AI)·양자컴퓨팅 등이다. 대통령 훈령에도 적시한 만큼 이들 분야에서 철저한 사업성 검토를 거쳐 투자 대상을 찾을 것으로... ","Wed, 18 Mar 2026 00:08:00 +0900"
