DateTime,Title,Link,Description,PubDate
2025-09-04 07:47:44,"'AI 3강, 초격차 문화강국' 제8회 지식재산의 날",http://www.00news.co.kr/news/articleView.html?idxno=97059,"본행사인 지식재산 유공자 표창에서는 국내 최초로 데이터센터용 인공지능 <b>반도체</b>를 개발·양산하고, 고대역폭 메모리(HBM)를 통합한 차세대 추론용 칩을 선제적으로 개발한 공로로 퓨리오사에이아이 백준호 대표이사가... ","Thu, 04 Sep 2025 16:46:00 +0900"
2025-09-04 07:47:44,지난달 韓 아세안 수출 109억 달러…'관세충격' 대미 수출 추월,https://n.news.naver.com/mnews/article/658/0000118981?sid=101,아세안으로의 수출 동력은 역시 <b>반도체</b>다. 지난달 1~25일 품목별 대아세안 수출 실적을 살펴보면 <b>반도체</b>는 27억 달러로 전년 동기 대비 47.0% 급증했다. 같은 기간 선박(359.9%)과 이차전지(23.9%)의 대아세안 수출... ,"Thu, 04 Sep 2025 16:45:00 +0900"
2025-09-04 07:47:44,"유병진 전 명지대 총장, 청조근정훈장 전수",https://www.naeil.com/news/read/560225?ref=naver,사진 명지대 제공 총장 재임 중에는 △교육환경 인프라 확충 △4차 산업혁명 대응 학사제도 개편 △ICT융합대학 및 미래융합대학 설립 △<b>반도체</b>학과와 아너칼리지 신설 △명지전문대 통합 기반 마련 등 굵직한 혁신... ,"Thu, 04 Sep 2025 16:42:00 +0900"
2025-09-04 07:47:44,[데스크칼럼] 정치권력 일방주의 시대,https://n.news.naver.com/mnews/article/031/0000962755?sid=110,그는 삼성전자의 미국 텍사스 테일러 <b>반도체</b> 공장 건설에 47억 5000만달러 보조금을 주는 대신 지분을 요구하고 있다. 미국 마이크론과 대만 TSMC도 비슷한 거래를 추진한다는 보도가 이어지고 있다. 월스트리트저널(WSJ)은... ,"Thu, 04 Sep 2025 16:40:00 +0900"
2025-09-04 07:47:44,"LG전자, 美 대규모 AI 데이터센터에 냉각 솔루션 공급",https://n.news.naver.com/mnews/article/117/0003984435?sid=105,조 CEO는 “AI 확산이 데이터센터·<b>반도체</b> 장비 수요를 가속화하고 있다”며 “LG전자는 냉각 솔루션과 차세대 <b>반도체</b> 장비 두 분야에서 새로운 기회를 모색 중”이라고 말했다. 글로벌 컨설팅기업 맥킨지는... ,"Thu, 04 Sep 2025 16:40:00 +0900"
2025-09-04 07:47:44,"중국 정부 압박에도 엔비디아 'H20' 수요 강력, 화웨이 캠브리콘 성능 한...",https://www.businesspost.co.kr/BP?command=article_view&num=410547,"중국 정부가 현지 빅테크 기업에 엔비디아 대신 자국산 인공지능 <b>반도체</b> 사용을 권고하고 있다. 그러나... 알리바바와, 바이트댄스, 텐센트 등 중국 빅테크 기업의 엔비디아 인공지능(AI) <b>반도체</b> 수요가 여전히... ","Thu, 04 Sep 2025 16:38:00 +0900"
2025-09-04 07:47:44,"[4일 마감시황] 코스피, 외인 매수세에 3200선 탈환…코스닥 800선 회복",https://www.newsworks.co.kr/news/articleView.html?idxno=809986,"<b>반도체</b> 소부장 종목 강세로 HPSP(3.07%), 원익IPS(0.79%), 테크윙(2.99%) 등이 상승했다. 반면 리가켐바이오와 에이비엘바이오는 각각 1.45%, 1.44%씩 하락했다. 에코프로비엠은 0.34%, 펩트론이 0.33% 미끄러졌다. 이밖에... ","Thu, 04 Sep 2025 16:38:00 +0900"
2025-09-04 07:47:44,"UTC인베스트먼트, 대상그룹과 인연 지속…LP 가교 역할 '주목'",https://n.news.naver.com/mnews/article/293/0000072026?sid=101,"이번에 조성하는 펀드는 바이오·헬스케어뿐 아니라 뷰티, <b>반도체</b>, 인공지능(AI) 등 미래 성장성이 높은 산업의 초기 및 성장 단계 스타트업에 투자할 예정이다. UTC인베스트먼트는 각 산업에 특화된 전문 인력을... ","Thu, 04 Sep 2025 16:38:00 +0900"
2025-09-04 07:47:44,"광주광역시, 라이즈(RISE) 비전 선포… 지역 17개 대학 협력 본격화",https://news.unn.net/news/articleView.html?idxno=583473,"이들 대학은 지역산업 맞춤형 청년 혁신인재, 모빌리티·에너지·<b>반도체</b>·인공지능 등 첨단산업분야 석... 모빌리티‧에너지‧<b>반도체</b>‧인공지능(AI) 등 분야와 연계해 △석·박사 인력 1000명 배출 △창업기업 3만5000개... ","Thu, 04 Sep 2025 16:36:00 +0900"
2025-09-04 07:47:44,"국립한밭대 RISE 사업단·대전권대학 산학협의체, '<b>반도체</b> 8대 제조 공정...",http://www.kyosu.net/news/articleView.html?idxno=142995,대상으로 '<b>반도체</b> 8대 제조 공정 교육'을 진행했다고 밝혔다. ○ 대전시 RISE 사업으로 마련된 이번 과정에는... ○ 본 교육은 대전 뿌리․전후방 산업의 수요를 반영하여 ▲나노<b>반도체</b> 소자 이해 ▲<b>반도체</b> 재료 및 공학... ,"Thu, 04 Sep 2025 16:36:00 +0900"
2025-09-04 07:47:44,"LG전자, 미국 대규모 AI 데이터센터 냉각 솔루션 공급",http://www.seoulwire.com/news/articleView.html?idxno=669216,조 사장은 &quot;AI의 급속한 확장은 데이터센터와 <b>반도체</b> 장비 등 핵심 인프라에 대한 수요를 가속화하고 있다... 이어 &quot;LG전자는 데이터센터 냉각 설루션과 차세대 <b>반도체</b> 장비 등 2가지 분야에서 새로운 기회를 포착하고... ,"Thu, 04 Sep 2025 16:36:00 +0900"
2025-09-04 07:47:44,"동국대, 2026학년도 수시모집, 첨단분야 정원 확대·경영대학 단과대학...",http://www.enewstoday.co.kr/news/articleView.html?idxno=2324915,"□ 첨단분야 정원 대폭 확대 동국대는 이공계 중점 육성 전략에 따라 최근 2년간 기계로봇에너지공학과(45명 증원), 시스템<b>반도체</b>공학과(14명 증원) 등 정원 확대를 진행해왔다. 2026학년도에는 의료인공지능공학과(38명)... ","Thu, 04 Sep 2025 16:35:00 +0900"
2025-09-04 07:47:44,LG전자 조주완 &quot;미국서 대규모 AI 데이터센터 냉각 설루션 수주&quot;,https://www.delighti.co.kr/news/articleView.html?idxno=101887,조 CEO는 &quot;AI의 급속한 확장은 데이터센터와 <b>반도체</b> 장비 등 핵심 인프라에 대한 수요를 가속화하고 있다&quot;며... 이어 &quot;LG전자는 데이터센터 냉각 설루션과 차세대 <b>반도체</b> 장비 등 2가지 분야에서 새로운 기회를 포착하고... ,"Thu, 04 Sep 2025 16:34:00 +0900"
2025-09-04 07:47:44,"코스피, 사흘째 올라 3,200대 회복…코스닥 800대 회복",http://www.tjb.co.kr/sub0301/bodo/view/id/83557,"시가총액 상위 종목 중 삼성전자(0.43%), SK하이닉스(1.14%) 등 <b>반도체</b>주와 LG에너지솔루션(0.72%), POSCO홀딩스(1.43%), LG화학(2.96%) 등 이차전지주가 올랐습니다. 아울러 HD현대중공업(0.99%), 한화오션(1.02%) 등 조선주와... ","Thu, 04 Sep 2025 16:34:00 +0900"
2025-09-04 07:47:44,수출 절벽시대 오나…GDP 대비 경상수지 내년 4.4% 예상,http://www.segyebiz.com/newsView/20250904515481?OutUrl=naver,"<b>반도체</b> 중심의 수출 구조가 강화되면서 세계 교역과 한국 수출의 동행성이 과거보다 떨어졌다는 판단도... 결국 해외 IB와 한은 모두 올해 정점 이후 내년 축소를 가정하고 있는 만큼 관세 변수와 기저효과, <b>반도체</b>... ","Thu, 04 Sep 2025 16:34:00 +0900"
2025-09-04 07:47:44,"HBM 소재 수입 삼성전자 줄고 SK하이닉스 급증, HBM3E 인증 지연에 격차...",https://www.businesspost.co.kr/BP?command=article_view&num=410520,"4일 <b>반도체</b> 업계 취재를 종합하면 2025년 7월까지 HBM 생산에 핵심으로 필요한 소재 수입량에서... MR-MUF는 여러 <b>반도체</b> 칩을 쌓아 올리고, 칩과 칩 사이 회로를 보호하기 위해 공간 사이에 액체 형태의 보호재를... ","Thu, 04 Sep 2025 16:32:00 +0900"
2025-09-04 07:47:44,"코스피, 사흘째 올라 3,200대 마감...코스닥 800대 회복",https://www.slist.kr/news/articleView.html?idxno=675030,"시가총액 상위 종목 중 삼성전자[005930](0.43%), SK하이닉스[000660](1.14%) 등 <b>반도체</b>주와 LG에너지솔루션[373220](0.72%), POSCO홀딩스[005490](1.43%), LG화학[051910](2.96%) 등 이차전지주가 올랐다. 아울러 HD현대중공업[329180]... ","Thu, 04 Sep 2025 16:32:00 +0900"
2025-09-04 07:47:44,구미 전역이 확 바뀐다! 산업·문화·청년·농촌 대변신 시동,http://www.hidomin.com/news/articleView.html?idxno=591404,"랜드마크 대상지로 선정된 방림 부지에는 문화복합공간을 비롯해 디자인-<b>반도체</b>융합지원센터 등 산업... <b>반도체</b>와 방위산업 등 대규모 국책사업 기반도 속도를 내고 있으며, 구미시는 이를 통해 산단의 고도화와 함께... ","Thu, 04 Sep 2025 16:32:00 +0900"
2025-09-04 07:47:44,"코스피, 미 금리 인하 기대에···사흘째 올라 3200대 마감",https://www.ziksir.com/news/articleView.html?idxno=103005,"시가총액 상위 종목 중 삼성전자(0.43%), SK하이닉스(1.14%) 등 <b>반도체</b>주와 LG에너지솔루션(0.72%), POSCO홀딩스(1.43%), LG화학(2.96%) 등 이차전지주가 올랐다. 아울러 HD현대중공업(0.99%), 한화오션(1.02%) 등 조선주와... ","Thu, 04 Sep 2025 16:32:00 +0900"
2025-09-04 07:47:44,배경훈 과기 장관 &quot;AI 실질적 성과는 기술 산업 혁신 때 가능&quot;,https://n.news.naver.com/mnews/article/047/0002486987?sid=101,AI를 활용한 바이오·<b>반도체</b>·원자력·에너지 등 연구개발(R&amp;D) 분야의 혁신 방향을 주문하고 나선 것이다. 배... ▲바이오 신약 개발 가속화 ▲<b>반도체</b> 설계 최적화 ▲원자로 설계와 안전성 강화 ▲에너지 신기술 개발... ,"Thu, 04 Sep 2025 16:31:00 +0900"
2025-09-04 07:47:44,<b>반도체</b> 호조에 7월 경상수지 흑자 이어갔지만… 6월보다 수출 줄어,https://n.news.naver.com/mnews/article/469/0000885405?sid=101,"지난해 동월과 비교해 <b>반도체</b>(+30.6%), 승용차(+6.3%), 선박(+114.0%) 수출이 큰 폭으로 증가하며 전체 수출... 7월까지는 <b>반도체</b> 수출 호조와 미 관세 부과 전 선수요, 유럽연합(EU)·호주 등 지역으로의 자동차 수출... ","Thu, 04 Sep 2025 16:31:00 +0900"
2025-09-04 07:47:44,"삼성·SK, 中 메모리 추격에 DDR4 생산 연장·첨단 장비 도입 ‘투트랙’...",http://www.metroseoul.co.kr/article/20250904500522,4일 업계에 따르면 국내 <b>반도체</b> 기업들이 최첨단 EUV(극자외선) 장비를 도입하며 D램 기술 고도화에... 하이 NA EUV는 기존 EUV보다 해상도를 크게 향상시킨 차세대 노광 장비로 2나노 이하 시스템<b>반도체</b>와 10나노 이하... ,"Thu, 04 Sep 2025 16:30:00 +0900"
2025-09-04 07:47:44,코스닥 800 회복...삼천당제약 · 엔켐 · 레인보우로보틱스 '상승',http://www.choicenews.co.kr/news/articleView.html?idxno=153531,"코스닥 업종별로는 <b>반도체</b>, 엔터테인먼트, 통신장비주 등이 올랐고 제약바이오, 2차전지, 로봇... <b>반도체</b>주 중 이오테크닉스(1.83%), HPSP(3.07%), 원익IPS(0.79%), 솔브레인(0.25%), 동진쎄미켐(1.58%), 테크윙(2.99... ","Thu, 04 Sep 2025 16:30:00 +0900"
2025-09-04 07:47:44,조주완 LG전자 사장 &quot;美 AI 데이터센터 냉각설루션 수주&quot;,https://www.pinpointnews.co.kr/news/articleView.html?idxno=373932,급속한 확장은 데이터센터와 <b>반도체</b> 장비 등 핵심 인프라에 대한 수요를 가속화하고 있다&quot;며 &quot;LG전자는 데이터센터 냉각 설루션과 차세대 <b>반도체</b> 장비 등 2가지 분야에서 새로운 기회를 포착하고 있다&quot;고 전했다.,"Thu, 04 Sep 2025 16:30:00 +0900"
2025-09-04 07:47:44,금리인하 모멘텀 … 바이오·로봇株 심상찮다 [MBN GOLD 증시기상도],https://n.news.naver.com/mnews/article/009/0005553171?sid=101,"금리 인하 기대감을 따라갈 수 있는 제약바이오 업종과 로봇 업종, 그리고 하반기 업황 개선 기대감이 강하게 살아 있는 <b>반도체</b> 업종을 중심으로 9월 투자 전략을 준비할 필요가 있다. ▶<b>반도체</b> : 상반기 딥시크 충격에... ","Thu, 04 Sep 2025 16:29:00 +0900"
2025-09-04 07:47:44,알리바바發 충격 변압기株엔 기회 [MBN GOLD 시황저격],https://n.news.naver.com/mnews/article/009/0005553172?sid=101,"최근 중국 알리바바가 독자적으로 개발한 인공지능(AI)칩을 공개했다는 소식이 전해지면서 글로벌 증시에서 <b>반도체</b> 관련주들이 큰 영향을 받았다. 엔비디아 등 주요 AI <b>반도체</b> 기업들의 주가가 조정을 받았고, 이는 미... ","Thu, 04 Sep 2025 16:29:00 +0900"
2025-09-04 07:47:44,"&quot;中企 전문인력 함께 키워요&quot;…군포산업진흥원, 경희대와 산학협력 맞손",https://www.asiatoday.co.kr/view.php?key=20250904010002238,"정원석 테크노경영대학원장은 &quot;우리 대학원은 MBA, ESG경영, <b>반도체</b>융합 그리고 AI기술경영 교육과 같은 기업 경쟁력 제고를 위한 전문화된 교육과정을 갖추고 있다&quot;며 &quot;군포시 기업 재직자들이 전문성을 갖춘 인재로... ","Thu, 04 Sep 2025 16:28:00 +0900"
2025-09-04 07:47:44,"코스피 3,200 회복…외인 현대로템·에이피알·삼성전자 집중 매수",https://www.topstarnews.net/news/articleView.html?idxno=15793967,"그리고 <b>반도체</b> 업황 개선에 대한 전망이 강화된 삼성전자는 외국인 매수세의 최전선에 있었다. 이와 함께... 종목별로 보면 삼성전자(0.43%), SK하이닉스(1.14%) 등 <b>반도체</b>주는 <b>반도체</b> 사이클 회복 기대와 맞물려 강세를... ","Thu, 04 Sep 2025 16:28:00 +0900"
2025-09-04 07:47:44,미국 금리인하 임박 기대에 3200선 복귀…고용지표 촉각,https://n.news.naver.com/mnews/article/008/0005245808?sid=101,"국내 <b>반도체</b> 빅2로 불리는 삼성전자(+0.43%)와 SK하이닉스(+1.14%)가 함께 상승했다. LG에너지솔루션(+0.72%), 삼성바이오로직스(+0.49%), HD현대중공업(+0.99%) 등도 올랐다. 반면 한화에어로스페이스(-1.06%), KB금융(-1.54%)은... ","Thu, 04 Sep 2025 16:27:00 +0900"
2025-09-04 07:47:44,LG전자 조주완 &quot;美 대규모 데이터센터 냉각 솔루션 수주&quot;,https://n.news.naver.com/mnews/article/629/0000423044?sid=101,"데이터센터, <b>반도체</b> 장비 등 핵심 인프라에 대한 수요를 가속화하고 있다&quot;며 &quot;이들 분야는 AI 성능과 확장성, 지속성에 있어 필수적 요소&quot;라고 설명했다. 이어 &quot;LG전자는 데이터센터 냉각 솔루션과 차세대 <b>반도체</b> 장비... ","Thu, 04 Sep 2025 16:27:00 +0900"
2025-09-04 07:47:44,"임베디드 SW 강자 MDS테크, 엔비디아 성장에 올라탔다",https://www.pinpointnews.co.kr/news/articleView.html?idxno=373929,"글로벌 AI <b>반도체</b> 시장의 패권을 쥔 엔비디아의 차세대 GPU 아키텍처 '블랙웰(Blackwell)' 도입 확산에 따른... 자동차 전장, <b>반도체</b>, 국방·항공 등 고도화된 산업 현장에서 최적화된 시스템 통합 솔루션을 제공해 왔다. 특히... ","Thu, 04 Sep 2025 16:26:00 +0900"
2025-09-04 07:47:44,"수출실적은 호재, 中기술독립은 악재 … 웃다가 우는 <b>반도체</b> [빅데이터...",https://n.news.naver.com/mnews/article/009/0005553159?sid=101,관심사는 <b>반도체</b>였다. 특히 HBM(고대역폭메모리) 빅테크 납품 가능성과 파운드리(<b>반도체</b> 위탁생산)에서 추가 수주 가능성을 두고 삼성전자 주가에 대한 관심이 높았다. 리포트 중에서는 제약기업 올릭스에 대한... ,"Thu, 04 Sep 2025 16:26:00 +0900"
2025-09-04 07:47:44,'40년 제약명가' 명인제약 9일부터 수요예측 [위클리 마켓],https://n.news.naver.com/mnews/article/009/0005553161?sid=101,"엔비디아, 삼성전자, 암, 퀄컴을 비롯한 글로벌 AI <b>반도체</b> 기업과 상용화 성과를 냈다. 노타의 매출은 2021년 4억8000만원, 2024년 84억4000만원으로 연평균 160%에 달하는 성장세를 보이고 있다.","Thu, 04 Sep 2025 16:26:00 +0900"
2025-09-04 07:47:44,가을증시 '실적 모멘텀' 과실 영근다 [한국주식 원포인트 레슨],https://n.news.naver.com/mnews/article/009/0005553160?sid=101,한국은 <b>반도체</b> 수출 증가세가 본격화되며 인공지능(AI) 관련 수요 확대의 직접적인 수혜를 받고 있습니다. 글로벌 주요 <b>반도체</b> 기업들의 이익 전망 상향 조정이 이어지고 있어 국내 기업들 역시 긍정적 흐름을 지속할... ,"Thu, 04 Sep 2025 16:26:00 +0900"
2025-09-04 07:47:44,배경훈 장관 &quot;중소기업 위한 GPU 5만장 2028년까지 조기확보&quot;,https://n.news.naver.com/mnews/article/092/0002389094?sid=105,"이어 AI사례 발표에서는 ▲김정호 KAIST 전기 및 전자공학과 교수의 '<b>반도체</b> 엔지니어링을 위한 아이젠틱 AI... 김 교수는 또 대만의 <b>반도체</b> 수호 전략을 소개하며, 삼성과 <b>반도체</b> 분야 R&amp;D인력 현황을 비교해 관심을... ","Thu, 04 Sep 2025 16:26:00 +0900"
2025-09-04 07:47:44,"7월 경상수지 흑자, 역대 최대 기록…관세 충격 '불확실성' 고조",https://www.econovill.com/news/articleView.html?idxno=710143,자동차·철강 등 주요 품목에 부과된 관세 장벽이 현실화되면서 <b>반도체</b> 호황에 기댄 수출 구조에... 품목별로는 <b>반도체</b>(30.6%)와 선박(114.0%)이 수출 호조를 이끌었다. 승용차도 6.3% 증가했다. 지역별로는 미국... ,"Thu, 04 Sep 2025 16:24:00 +0900"
2025-09-04 07:47:44,"국내 태양광 기업, SPI 2025 한국관 통해 글로벌시장 진출 모색",https://www.todayenergy.kr/news/articleView.html?idxno=288312,"열전 <b>반도체</b>를 이용한 온도 제어 기술로 고효율 에너지 저장이 가능하며, 커스터마이징이 가능한 점에서 바이어의 다양한 수요에 유연하게 대응할 수 있다. 제이앤디전자는 재생에너지 및 전기 운송 분야에서의 정밀... ","Thu, 04 Sep 2025 16:24:00 +0900"
2025-09-04 07:47:44,"김동연, 민생경제 현장투어 다시 시동…12일 수원서 진행",https://n.news.naver.com/mnews/article/277/0005647125?sid=102,이어 성균관대학교를 찾아 R&amp;D 사이언스 파크 조성 추진에 따른 산학협력으로 연구개발 클러스터가 조성되는 것에 대해 <b>반도체</b>시스템공학과 재학생들과 토론회를 갖는다. 김 지사는 이날 오후에는 수원컨벤션센터에서... ,"Thu, 04 Sep 2025 16:23:00 +0900"
2025-09-04 07:47:44,"코스피, 8거래일 만에 3200선 회복…외국인 매수에 3거래일 연속 상승",https://www.etoday.co.kr/news/view/2503335,"이투데이=김범근 기자 | 외국인 '사자'에 3200선 턱걸이 <b>반도체</b>ㆍ원전株 '상승' 코스피가 4일 3200선을... 2% 초반으로 안정되자 기술주 전반이 반등했고, 알파벳과 애플 주가 상승은 국내 IT·<b>반도체</b> 투자심리에... ","Thu, 04 Sep 2025 16:22:00 +0900"
2025-09-04 07:47:44,"국립한밭대, '<b>반도체</b> 8대 제조 공정 교육' 성료",https://daily.hankooki.com/news/articleView.html?idxno=1266694,<b>반도체</b> 8대 제조 공정 교육'을 진행하고 있다. 사진=한밭대 제공  국립한밭대학교(총장 오용준) 지역혁신중심 대학지원체계(RISE) 사업단은 지난달 11일부터 27일까지 3회에 걸쳐 지역 대학생 및 청년들을 대상으로 '<b>반도체</b>... ,"Thu, 04 Sep 2025 16:22:00 +0900"
2025-09-04 07:47:44,"AWS &quot;SK그룹 협력, 한국 AI 혁신의 분수령&quot;",https://n.news.naver.com/mnews/article/092/0002389091?sid=105,"울산에 구축되는 AWS AI 존은 세계적 수준의 <b>반도체</b> 기반 서버와 전용 인프라, 초고속 학습·추론을 지원하는 울트라클러스터 네트워크를 갖춘다. 여기에 아마존 세이지메이커와 베드록은 물론 아마존 Q, 키로, 베드록... ","Thu, 04 Sep 2025 16:20:00 +0900"
2025-09-04 07:47:44,"[이격도 과열] 프로티나·헬릭스미스·메지온, 바이오株 과열 랠리 지속...",https://www.pinpointnews.co.kr/news/articleView.html?idxno=373926,"이지트로닉스 역시 전기차 및 전력<b>반도체</b> 수요 증가로 매수세가 집중됐다. 삼영엠텍은 조선 기자재 공급... 2차전지 및 <b>반도체</b> 관련주도 눈길을 끌었다. 유니테스트, 테크윙, 파인엠텍, 원익홀딩스 등 <b>반도체</b> 장비주는... ","Thu, 04 Sep 2025 16:18:00 +0900"
2025-09-04 07:47:44,"미국의 TSMC <b>반도체</b> 투자 규제 영향 제한적, 중국 파운드리 반사이익 어...",https://www.businesspost.co.kr/BP?command=article_view&num=410539,중국 SMIC <b>반도체</b> 공장. 미국 정부가 TSMC 중국 공장에 <b>반도체</b> 장비 반입을 사실상 제한하는 규제를 실시했다. 삼성전자와 SK하이닉스를 대상으로 한 제재 조치와 유사하다. 그러나 SMIC와 화훙<b>반도체</b> 등 중국 파운드리... ,"Thu, 04 Sep 2025 16:16:00 +0900"
2025-09-04 07:47:44,"상지대, 지역발전·사회공헌 기여 '상생대학' 향해 한걸음",https://n.news.naver.com/mnews/article/654/0000140211?sid=102,"핵심 사업 분야는 바이오헬스, <b>반도체</b>, 드론, 보건의료, 창업지원, 국제화 등이다. 성공적 사업 추진을 위한 강원도, 원주시, 횡성군 등 지자체 지원도 뒷받침되고 있다. 이날 사업단 발전을 응원하며 최낙준 반디의숲... ","Thu, 04 Sep 2025 16:16:00 +0900"
2025-09-04 07:47:44,"AR 글래스 출하량, 2025년 60만대→2030년 3210만대 예상",http://www.thelec.kr/news/articleView.html?idxno=40323,"비용 절감 요구가 커지면 산화성금속산화막<b>반도체</b>(CMOS) 기판 크기와 설계도 표준화될 수 있다. 트렌드포스는 &quot;까다로운 조건들이 기술 난도를 높이고, 기술 표준 통일에 기여할 것&quot;이라며 &quot;진일보한 풀컬러... ","Thu, 04 Sep 2025 16:16:00 +0900"
2025-09-04 07:47:44,"美 훈풍, 코스피 3200 탈환...철강 · 조선주 '활짝'",http://www.choicenews.co.kr/news/articleView.html?idxno=153530,"업종별로는 <b>반도체</b>, 2차전지, 철강, 조선, 해운, 원전, 화장품, 유통, 지주사 등이 상승했다. 한국거래소에 따르면 삼성전자는 전일 대비 0.43% 상승한 7만100원, SK하이닉스는 1.14% 상승한 26만5500원에 각각... ","Thu, 04 Sep 2025 16:16:00 +0900"
2025-09-04 07:47:44,"코스피, 사흘째 올라 3,200대 마감…코스닥 800대 회복(종합)",https://n.news.naver.com/mnews/article/001/0015606333?sid=101,"美 금리 인하 기대에 장초반 상승 압력…中증시 급락이 '찬물' 외인 현물 '사자'·선물 순매도…<b>반도체</b>... 시가총액 상위 종목 중 삼성전자(0.43%), SK하이닉스(1.14%) 등 <b>반도체</b>주와 LG에너지솔루션(0.72%), POSCO홀딩스(1.... ","Thu, 04 Sep 2025 16:15:00 +0900"
2025-09-04 07:47:44,한은 2차 추경에서 소비쿠폰 효과만 71%이상,https://n.news.naver.com/mnews/article/011/0004529193?sid=101,<b>반도체</b> 경기 호조와 예상보다 제한적인 미국 관세 영향으로 수출 부문이 올해 성장률을 약 0.2%포인트 높이는 효과를 가져올 것으로 평가됐다. 다만 건설투자는 지난 2분기까지 5분기 연속 역성장을 기록하며 건설경기... ,"Thu, 04 Sep 2025 16:14:00 +0900"
2025-09-04 07:47:44,"한미<b>반도체</b> 주가 9월 4일 82,600원…전일 대비 1.20% 약세 마감",https://www.job-post.co.kr/news/articleView.html?idxno=174872,"4일 장 마감 기준, 코스피 시장에서 한미<b>반도체</b> 주가는 82,600원으로 거래를 마쳤다. 전일 대비 1,000원(-1.20%) 하락했다. 출처 : 네이버페이 증권 4일 한미<b>반도체</b>는 83,700원으로 장을 시작해 장중 83,900원까지... ","Thu, 04 Sep 2025 16:14:00 +0900"
2025-09-04 07:47:44,"코스닥 기관, 테크윙·ISC 대거 매수… 코스닥 <b>반도체</b> 장비주 급부상",https://www.pinpointnews.co.kr/news/articleView.html?idxno=373924,"<b>반도체</b> 장비와 바이오, 일부 콘텐츠 종목으로 매수세가 집중된 반면, 제약·엔터테인먼트 등에서는 매도가 우위를 보였다. 이날 기관 순매수 1위 종목은 테크윙이었다. <b>반도체</b> 테스트 장비 기업으로, HBM(고대역폭 메모리)... ","Thu, 04 Sep 2025 16:14:00 +0900"
