DateTime,Title,Link,Description,PubDate
2026-02-11 19:42:35,"네덜란드 법원, 넥스페리아 조사 명령...車 업계 '촉각'",https://n.news.naver.com/mnews/article/374/0000492219?sid=104,네덜란드 법원이 현지시각 11일 중국 윙테크 소유의 네덜란드 차량용 <b>반도체</b> 기업 넥스페리아의 경영 부실을... 넥스페리아는 차량용 <b>반도체</b> 분야 세계 최상위권 기업으로 2019년 중국 <b>반도체</b> 기업 윙테크에 인수됐습니다.... ,"Thu, 12 Feb 2026 04:39:00 +0900"
2026-02-11 19:42:35,새해에도 ‘청년 취업 빙하기’… 고용률 5년새 최저,https://n.news.naver.com/mnews/article/020/0003697003?sid=101,"<b>반도체</b>, 조선을 제외한 국내 전통 제조업 부진으로 청년 취업 빙하기는 당분간 나아지기 어려울 것이란 우려가 나온다. 김정식 연세대 경제학과 명예교수는 “대미 투자와 ‘노란봉투법’(개정 노동조합법)... ","Thu, 12 Feb 2026 04:34:00 +0900"
2026-02-11 19:42:35,"金총리 “美하원, 왜곡된 정보로 쿠팡 문서 작성”",https://n.news.naver.com/mnews/article/020/0003697008?sid=100,"김 총리는 이날 민주당 이상식 의원이 ‘용인 <b>반도체</b> 클러스터가 변경될 수 있느냐’고 질문하자 “어렵다고 본다”며 “시장의 판단, 기업의 결정으로 된 부분을 정부가 인위적으로 변경시킬 일은 없을 것”이라고... ","Thu, 12 Feb 2026 04:34:00 +0900"
2026-02-11 19:42:35,"[美증시 특징주] AI 테마 또 주춤...엔비디아 상승, 팔란티어·오라클 하...",https://www.mediapen.com/news/view/1081190,"자료사진, AFP=.연합뉴스 미국 증시에서 전반적인 <b>반도체</b>주 강세 속에 엔비디아는 상승했으나 다른... 엔비디아는 마이크론테크놀로지와 TSMC 등 다른 <b>반도체</b> 업체들의 주가 급등에 편승한 것으로 보인다. 아마존닷컴과... ","Thu, 12 Feb 2026 04:34:00 +0900"
2026-02-11 19:42:35,제조업에 로봇-AI까지… 대구-경북 ‘산업지도’ 다시 그린다,https://n.news.naver.com/mnews/article/020/0003696996?sid=102,"이 자리에서는 지역의 차기 성장엔진 후보 산업으로 미래 모빌리티와 첨단 로봇, 시스템<b>반도체</b>, 이차전지... 이를 위해 대구·경북은 AI 전환(AX)을 위한 데이터 스테이션 구축과 함께 <b>반도체</b> 혁신 클러스터 조성, 방산... ","Thu, 12 Feb 2026 04:33:00 +0900"
2026-02-11 19:42:35,젠슨 황도 주시한 에이로봇 &quot;휴머노이드 내후년 투입 목표&quot;,https://n.news.naver.com/mnews/article/469/0000914214?sid=101,"한국, 휴머노이드 3요소 '배터리·AI<b>반도체</b>·액추에이터' 갖춰 그는 &quot;한국이 제조업 기반에 인구가 줄고... 엄 대표는 &quot;휴머노이드 제작에 꼭 필요한 3요소 배터리, 인공지능(AI) 칩을 만드는 <b>반도체</b>, 로봇의 팔다리 손가락... ","Thu, 12 Feb 2026 04:31:00 +0900"
2026-02-11 19:42:35,"&quot;中 바이트댄스, 자체 AI칩 생산 삼성 파운드리 맡길 듯&quot;",https://n.news.naver.com/mnews/article/374/0000492216?sid=104,(AI) <b>반도체</b>를 개발하고 삼성전자와 위탁생산을 논의 중인 것으로 알려졌습니다. 현지시간 11일 로이터통신에 따르면 바이트댄스는 3월 말까지 샘플 칩을 확보하는 것을 목표로 AI <b>반도체</b>를 개발하고 있습니다.... ,"Thu, 12 Feb 2026 04:31:00 +0900"
2026-02-11 19:42:35,[36.5℃] 산업 역군 민주 영웅 K팝,https://n.news.naver.com/mnews/article/469/0000914202?sid=110,<b>반도체</b>를 빼곤 모든 산업이 위기인 시대에 기대를 걸어 볼 '신성장동력'의 대표 선수로 뽑혔다. BTS의 서사엔 (당사자 뜻과 무관하게) 정치적 의미를 둘 여지도 크다. 신자유주의가 상상하는 &quot;모두가 평등하고 공정한 세계... ,"Thu, 12 Feb 2026 04:30:00 +0900"
2026-02-11 19:42:35,K-AI<b>반도체</b> 키운다… 5년간 1조원 투입,https://n.news.naver.com/mnews/article/008/0005317483?sid=101,정부가 앞으로 5년간 1조원의 예산을 투입해 국내 제조기업과 <b>반도체</b> 팹리스(설계) 기업을 연결하고 AI(인공지능)<b>반도체</b>(NPU) 공동개발과 상용화 사업을 시작한다. 안정적인 <b>반도체</b>산업 육성을 위해 연내 2조원 규모의... ,"Thu, 12 Feb 2026 04:13:00 +0900"
2026-02-11 19:42:35,머니투데이 오프라인 헤드라인-12일,https://n.news.naver.com/mnews/article/008/0005317464?sid=102,"민간 주도 생태계 띄운다 보스턴다이나믹스 수장 교체…'아틀라스 상업화' 역량 모은다 빚 많아 택지조성·보상 지연…李, 부채전담 자회사 설립 지시 K-AI <b>반도체</b> 키운다…5년간 1조원 투입 월가 탈출 &quot;美 해방의 날... ","Thu, 12 Feb 2026 04:00:00 +0900"
2026-02-11 19:42:35,"경북도, '민생경제 현장지원단' 출범…4000억원 규모 2026 특별대책 가동",https://www.ajunews.com/view/20260211230006164,또한 2034년까지 1조원 조성을 목표로 ‘경북 G-Star 펀드’를 결성해 바이오·백신·<b>반도체</b> 등 딥테크 분야 유망 벤처기업에 대한 과감한 투자를 확대한다. 포항·경산 일대에는 벤처·창업 타운을 조성해 ‘창업... ,"Thu, 12 Feb 2026 04:00:00 +0900"
2026-02-11 19:42:35,삼성도 하이닉스도… 메모리 병목 돌파구는 '협업',https://n.news.naver.com/mnews/article/008/0005317465?sid=101,삼성전자는 메모리·파운드리(<b>반도체</b> 위탁생산)·패키징을 아우르는 '코옵티마이제이션'(Co-Optimization) 전략으로 <b>반도체</b> 경쟁력 강화에 나서고 SK하이닉스는 AI와 결합한 <b>반도체</b> 협업생태계 구축을 주도해 기술... ,"Thu, 12 Feb 2026 04:00:00 +0900"
2026-02-11 19:42:35,쿠팡 사태에 유달리 분노하는 이유… 이 데이터가 니 데이터냐?,https://n.news.naver.com/mnews/article/053/0000055809?sid=105,"4차 산업혁명·인공지능 시대에 살아남으려면 새로운 인공지능 기술을 개발해야 하고, 데이터는 인공지능을 개발하는 데 필수적인, 마치 산업화 시대의 전기나 정보화 시대의 <b>반도체</b>와도 비슷한 역할을 한다. 필요... ","Thu, 12 Feb 2026 04:00:00 +0900"
2026-02-11 19:42:35,메모리<b>반도체</b> 가격 90% 폭등…삼성·SK하이닉스 '특수',https://www.g-enews.com/view.php?ud=202602112011042741fbbec65dfb_1,빅테크 기업들이 인공지능(AI) 인프라에 천문학적 자금을 쏟아붓고 있지만 정작 메모리<b>반도체</b> 업체들만... 메모리칩 품귀에 가격 90% 급등 시장조사업체 카운터포인트리서치에 따르면 올해 1분기 메모리<b>반도체</b>... ,"Thu, 12 Feb 2026 03:56:00 +0900"
2026-02-11 19:42:35,"'산업 대전환' 무안, 서남권 첨단 경제 허브로 비상한다",https://www.pointdaily.co.kr/news/articleView.html?idxno=292710,화합물<b>반도체</b>센터 전경. /사진=무안군 제공 또한 목포대학교 화합물<b>반도체</b>센터를 통해 15개 기업을 유치하고 114명의 취업 성과를 내는 등 실질적인 첨단 산업 생태계 조성에 착수했다. 이날 군이 발표한 4대 핵심... ,"Thu, 12 Feb 2026 03:56:00 +0900"
2026-02-11 19:42:35,"[김종구 칼럼] 월급에서 성과급까지, 그것이 민생이었다",https://n.news.naver.com/mnews/article/666/0000096147?sid=110,용인은 <b>반도체</b>산단을 가꾸고 지킨다. 1천조원이라며 ‘천조개벽’이라고 한다. 화성은 목표 20조원을 달성했다. ‘25조원+알파’로 목표를 올렸다. 여건에 맞춰가는 투자 전략이다. 꼬집어 비틀 구석도 있을 거다.... ,"Thu, 12 Feb 2026 03:02:00 +0900"
2026-02-11 19:42:35,"코트라, 수출품목·공급망 다변화로 수출 5강 굳히기 다짐",https://www.cstimes.com/news/articleView.html?idxno=693223,"무역관장들에 따르면 현지 제조업황 둔화로 기계, 철강류 수출이 줄었지만, <b>반도체</b>, 선박, 자동차 수출이 전체 수출 증가를 견인했다. FTA 효과로 콜롬비아 자동차 수출이 활성화되고 브라질 석유시추선을 수주한 것도... ","Thu, 12 Feb 2026 02:18:00 +0900"
2026-02-11 19:42:35,"갤S26 베일 벗는다…삼성전자, 26일 샌프란시스코서 언팩 개최",https://www.apnews.kr/news/articleView.html?idxno=3045800,"한편, 최근 IT 업계 전반에 영향을 미친 <b>반도체</b> 등 부품 원가 상승으로 인해 갤럭시 S26 시리즈의 출고가가 오를 가능성이 크다. 업계에서는 전작인 갤럭시 S25 울트라의 시작 가격이 169만8400원이었던 점을 고려할 때... ","Thu, 12 Feb 2026 02:16:00 +0900"
2026-02-11 19:42:35,"양승조 전 충남도지사, &quot;검증된 행정 경륜으로 통합특별시 완성&quot;",https://www.tournews21.com/news/articleView.html?idxno=129484,"서해안 신재생에너지를 충남 남부권에 공급하고 대전의 과학기술을 접목해 세계적 AI <b>반도체</b> 대기업을 유치하겠다고 밝혔다. 셋째, ▲계층별 맞춤복지로 촘촘한 사회안전망 구축 ▲꿈비채 2.0 공공아파트 1만호 공급... ","Thu, 12 Feb 2026 02:08:00 +0900"
2026-02-11 19:42:35,"강기정의 ‘<b>반도체</b> 큰 그림’, 英 Arm 유치로 ‘화룡점정’",https://www.wikitree.co.kr/articles/1117668,"온 ‘<b>반도체</b> 인재 양성 사다리’ 구축 프로젝트가 마침내 완성형에 다다랐다. 지역 대학들과 연계한 실무 교육 과정에 이어, 세계 최정상급 기업인 영국 ‘암(Arm)’의 교육 프로그램까지 유치하며 명실상부한 ‘<b>반도체</b>... ","Thu, 12 Feb 2026 01:50:00 +0900"
2026-02-11 19:42:35,&quot;수도권 전력수요 한계치...'지산지소' 패러다임 전환 시급&quot;,https://www.energy-news.co.kr/news/articleView.html?idxno=222854,특히 용인 <b>반도체</b> 클러스터의 신규 수요가 없더라도 탄소중립을 위한 에너지전환과 난방의 전력화 과정에서... 이순형 동신대 교수는 광주·전남이 15GW 규모의 재생에너지 잠재력을 보유한 <b>반도체</b> 산단의 유일한 물리적... ,"Thu, 12 Feb 2026 01:48:00 +0900"
2026-02-11 19:42:35,"네덜란드 법원, 中 소유 넥스페리아 경영 조사 착수",https://n.news.naver.com/mnews/article/003/0013765296?sid=104,네덜란드 법원이 중국 자본이 소유한 <b>반도체</b> 기업 넥스페리아의 경영 부실 의혹에 대해 본격적인 조사에... 넥스페리아는 자동차 전자장치 등에 쓰이는 범용 <b>반도체</b>의 핵심 공급처다. 지난해 중국이 이 회사 제품의 수출을... ,"Thu, 12 Feb 2026 01:47:00 +0900"
2026-02-11 19:42:35,"경기도의회 미래과학협력위, 조례 6건 의결…미래산업 기반 정비",http://www.bizwnews.com/news/articleView.html?idxno=125250,"2차 회의에서는 미래성장산업국을 상대로 스마트공장·제조로봇 사업의 질적 전환, RISE(지역혁신중심 대학지원체계) 추진 방향, AI+X 아카데미 운영, 피지컬 AI 랩 점검, 국제 전시회 지원 확대, <b>반도체</b> 클러스터 홍보 전략... ","Thu, 12 Feb 2026 01:36:00 +0900"
2026-02-11 19:42:35,"경기도의회 미래과학협력위, 2026 업무보고 심사로 의정활동 본격화",https://www.startuptoday.co.kr/news/articleView.html?idxno=585663,"확대, <b>반도체</b> 클러스터 대외 홍보 전략 등을 점검하며 정책 실효성과 현장 연계 강화를 강조했다. 제3차 회의에서는 경기도 첨단산업 인재혁신 지원 조례안과 경기도 생성형 인공지능 플랫폼 구축 및 운영에 관한... ","Thu, 12 Feb 2026 01:24:00 +0900"
2026-02-11 19:42:35,"[사설] 중국 맹추격, 일본 부활… 한국 <b>반도체</b> 안주할 때 아니다",https://n.news.naver.com/mnews/article/005/0001831809?sid=110,"인공지능(AI)과 디지털 대전환 시대에서 <b>반도체</b>는 국가 전략자산이다. 특히 한국 경제엔 생명줄이나 마찬가지다. 어제 관세청이 발표한 이달 1~10일 수출 실적을 보면, 승용차와 선박 수출이 줄었지만 <b>반도체</b>가 두 배... ","Thu, 12 Feb 2026 01:11:00 +0900"
2026-02-11 19:42:35,TSMC 1월 매출 사상 최대…“AI 수요 견조” 엔비디아에 호재,https://www.g-enews.com/view.php?ud=2026021117422240399a1f309431_1,"세계 최대 파운드리 기업 TSMC가 지난달 기준으로 사상 최대 매출을 기록하면서 인공지능(AI) <b>반도체</b>... 최첨단 <b>반도체</b> 생산의 90% 이상을 담당하는 것으로 알려져 있다. 고성능컴퓨팅(HPC)과 AI, 스마트폰용 칩을... ","Thu, 12 Feb 2026 01:02:00 +0900"
2026-02-11 19:42:35,매립도 소각도 못하는 태양광 폐패널… 정부 예상의 2배 쏟아졌다,https://n.news.naver.com/mnews/article/023/0003958774?sid=101,원자재의 95% 이상을 회수해 <b>반도체</b>나 배터리 소재로 재활용할 수 있다. 하지만 현재 국내 기술은 유리와 알루미늄을 떼어내는 저부가가치 분리 단계에 머물러 있다. 재활용 현장에서는 폐패널이 본격적으로... ,"Thu, 12 Feb 2026 00:58:00 +0900"
2026-02-11 19:42:35,‘박정희 마지막 비서관’이 청년 정치인의 고문으로,https://n.news.naver.com/mnews/article/023/0003958739?sid=100,"그는 당시 인터뷰에서 “K2 전차와 원전 수출, <b>반도체</b> 산업의 번창은 박정희의 중화학공업 위에서 탄생한 것인데도 MZ세대는 박정희에 대해 알려고도 하지 않아 서글프다”고 했다. 그 후 김민태 부대변인이 김 전... ","Thu, 12 Feb 2026 00:54:00 +0900"
2026-02-11 19:42:35,&quot;램값이 금값&quot;…중고 거래에 'PC 털이'까지,https://n.news.naver.com/mnews/article/055/0001332401?sid=101,"<b>반도체</b> 가격이 급등하면서 컴퓨터나 노트북 부품인 D램 가격도 치솟고 있습니다. 그러다 보니 중고... [김지훈/경기 하남시 : 램값도 많이 오르고 그래 가지고, 조금 이익이 될 때 좀 팔고….] D램 가격이 오른 건 <b>반도체</b>... ","Thu, 12 Feb 2026 00:52:00 +0900"
2026-02-11 19:42:35,"[심층분석] 이해찬 전 총리 後, 좌·우파의 변화와 블랙홀 부정선거",https://www.fntoday.co.kr/news/articleView.html?idxno=377257,"그러나 미국 상무부가 <b>반도체</b>·첨단 기술의 대중국 유출 우려를 공식·비공식적으로 제기하고, 쿠팡 사태... 한미일 삼각 동맹 강화, 인도태평양 전략 전면 참여, IPEF·CHIPS 동맹을 통한 <b>반도체</b> 공급망 협력, 첨단 AI·양자... ","Thu, 12 Feb 2026 00:44:00 +0900"
2026-02-11 19:42:35,"마이크론, 'HBM4 탈락' 루머 정면반박 &quot;이미 출하완료&quot;",https://n.news.naver.com/mnews/article/031/0001005322?sid=105,"마이크론이 엔비디아의 HBM4 공급망에서 이탈했다는 루머는 지난달 중순부터 <b>반도체</b> 업계에서 확산돼왔다.... 다만 마이크론과 거래해 온 국내 <b>반도체</b> 장비사 관계자는 &quot;최근 1년새 마이크론이 싱가포르, 대만... ","Thu, 12 Feb 2026 00:43:00 +0900"
2026-02-11 19:42:35,"이상일 용인특례시장, &quot;용인 <b>반도체</b> 국가산단 타당성 검토 중단해야&quot;",http://www.newstown.co.kr/news/articleView.html?idxno=694025,"정책토론에서 '용인 <b>반도체</b> 국가산단 타당성 검토'를 다루겠다고 밝힌 데 대해, &quot;이미 추진 중인 국책사업을... 언급됐던 '용인 <b>반도체</b> 국가산단 타당성 검토'가 이날 토론에서는 제외됐지만 오는 26일 부산에서 열리는 2차... ","Thu, 12 Feb 2026 00:42:00 +0900"
2026-02-11 19:42:35,"[E-로컬뉴스] 경주시, 달서구, 영남이공대, 영남대, 대구보건대, DGIST,포...",https://www.ekn.kr/web/view.php?key=20260211024478600,"◇DGIST, 네덜란드 <b>반도체</b> 사절단 방문… 글로벌 연구협력 본격화 ASML 파트너·트벤테대 등 참여… 차세대 <b>반도체</b> 공동연구·인재양성 추진 대구=에너지경제신문 손중모기자 DGIST는 지난 10일 네덜란드 <b>반도체</b> 기술혁신... ","Thu, 12 Feb 2026 00:40:00 +0900"
2026-02-11 19:42:35,"“농협·마사회·난방공사 품겠다”~전남도, 미래 산업 지도 바꿀 ‘빅...",https://www.wikitree.co.kr/articles/1117645,이는 전남이 추진 중인 AI·<b>반도체</b> 산업의 핵심 기반이 될 전망이다. ◆ 마사회 유치로 관광·레저 산업 견인 눈에 띄는 대목은 한국마사회 유치 도전이다. 전남은 2029년까지 승마 산업 기반 구축을 목표로 하고 있지만... ,"Thu, 12 Feb 2026 00:36:00 +0900"
2026-02-11 19:42:35,"[마켓인사이드] 알파벳 320억달러 ‘초대형 실탄’…AI 패권 경쟁, 자금...",https://www.news2day.co.kr/article/20260212500001,"데이터센터 건설과 <b>반도체</b> 확보에는 막대한 초기 자본이 필요하기 때문이다. 금융시장에서는 이를 두고 “데이터센터가 새로운 군비 경쟁의 전장이며, 채권시장이 탄약창 역할을 한다”는 평가가 나온다. 이는 기술... ","Thu, 12 Feb 2026 00:34:00 +0900"
2026-02-11 19:42:35,"&quot;中 바이트댄스, 자체 AI 칩 개발 추진…삼성과 위탁생산 협상&quot;",https://n.news.naver.com/mnews/article/293/0000079357?sid=105,바이트댄스는 <b>반도체</b>부터 대규모 언어모델(LLM)에 이르기까지 AI 개발에 자원을 집중한다는 전략이며... 바이트댄스는 지난 2022년부터 AI 워크로드 지원을 위한 자체 칩 개발을 추진해왔고 본격적으로 <b>반도체</b> 관련... ,"Thu, 12 Feb 2026 00:34:00 +0900"
2026-02-11 19:42:35,"대구시, 477억 투입 ‘산업AX혁신허브’ 본격 추진",https://tk.newdaily.co.kr/site/data/html/2026/02/12/2026021200009.html,"허브 내에는 로봇·모빌리티, 뇌질환 헬스케어, 지능형 <b>반도체</b> 등 3대 미래산업 분야별 AX혁신센터가... 지능형 <b>반도체</b> 분야는 자율 학습과 판단 기능을 갖춘 차세대 <b>반도체</b> 소자 설계·제작을 지원해 지역 <b>반도체</b> 산업의... ","Thu, 12 Feb 2026 00:34:00 +0900"
2026-02-11 19:42:35,"KDI, 올해 성장률 전망 1.8%→1.9%",https://n.news.naver.com/mnews/article/023/0003958703?sid=101,<b>반도체</b> 수출 호조 등으로 ‘상향’ 한국개발연구원(KDI)이 올해 경제성장률 전망치를 기존보다 0.1%포인트 올렸다. <b>반도체</b> 수출 호조와 민간 소비 회복세가 성장률 상향 조정의 배경이 됐다. 다만 건설 투자는 지방... ,"Thu, 12 Feb 2026 00:33:00 +0900"
2026-02-11 19:42:35,삼성 “HBM4 기술력 세계최고… 고객사도 만족”,https://n.news.naver.com/mnews/article/020/0003696953?sid=101,이달 말 업계 최초로 엔비디아에 출하할 것으로 예상되는 삼성 HBM4의 데이터 처리 속도는 초당 11.7Gb(기가비트)로 국제<b>반도체</b> 표준협의기구(JEDEC) 표준(초당 8Gb)을 뛰어넘는다. 송 사장은 “삼성 내부에 메모리... ,"Thu, 12 Feb 2026 00:32:00 +0900"
2026-02-11 19:42:35,<b>반도체</b> 웨이퍼 옮기는 로봇,https://n.news.naver.com/mnews/article/020/0003696955?sid=101,"11일 서울 강남구 코엑스에서 열린 ‘세미콘 코리아 2026’ 행사 부스에 <b>반도체</b> 웨이퍼 이송용 로봇이 전시돼 있다. 국제<b>반도체</b>장비재료협회(SEMI) 주관으로 13일까지 열리는 이번 행사에는 삼성전자, SK하이닉스... ","Thu, 12 Feb 2026 00:32:00 +0900"
2026-02-11 19:42:35,"‘물리적 연마’ 넘어선다… 첨파워, 웨이퍼 처리 혁신 기술 ‘차크라’...",https://www.tokenpost.kr/news/tech/330780,<b>반도체</b> 제조 공정의 핵심 단계인 표면 연마(Polishing)에 혁신을 불어넣을 기술이 등장했다. <b>반도체</b> 소재 기업 첨파워(ChEmpower)는 11일(현지시간) 웨이퍼 연마 공정의 효율성과 지속가능성을 높이기 위한 첫 상용 제품... ,"Thu, 12 Feb 2026 00:28:00 +0900"
2026-02-11 19:42:35,삼성 송재혁 “성능 4배 높은 zHBM 개발 계획… 우리 기술력 최고”,https://n.news.naver.com/mnews/article/005/0001831792?sid=101,"6세대 고대역폭메모리(HBM4)를 엔비디아에 1번 주자로 공급하게 된 삼성전자가 국내 최대 <b>반도체</b> 장비재료... 송 CTO는 삼성전자가 메모리와 파운드리(위탁생산), 패키징 역량을 모두 갖춘 종합 <b>반도체</b> 기업인 점을... ","Thu, 12 Feb 2026 00:25:00 +0900"
2026-02-11 19:42:35,"네덜란드 법원, 넥스페리아 조사 명령…중국 CEO 직무정지 유지",https://n.news.naver.com/mnews/article/056/0012123927?sid=104,네덜란드 법원이 현지시각 11일 중국 윙테크 소유의 네덜란드 차량용 <b>반도체</b> 기업 넥스페리아의 경영 부실을... 넥스페리아는 차량용 <b>반도체</b> 분야 세계 최상위권 기업으로 2019년 중국 <b>반도체</b> 기업 윙테크에 인수됐습니다.... ,"Thu, 12 Feb 2026 00:23:00 +0900"
2026-02-11 19:42:35,"마이크론, 엔비디아에 HBM4 못 넣나… 삼성·SK 지배력↑",https://n.news.naver.com/mnews/article/005/0001831791?sid=101,미국 메모리 <b>반도체</b> 기업 마이크론이 엔비디아의 차세대 인공지능(AI) 칩 초기 생산 물량에 6세대... 11일 <b>반도체</b> 업계에 따르면 <b>반도체</b> 연구업체 세미애널리시스는 최근 발간한 보고서에서 마이크론이 엔비디아 초기... ,"Thu, 12 Feb 2026 00:22:00 +0900"
2026-02-11 19:42:35,500대 기업 일자리 1년 새 6700개 이상 감소,https://n.news.naver.com/mnews/article/005/0001831790?sid=101,다만 ‘K-뷰티’ 시장 성장의 영향을 받은 CJ올리브영과 <b>반도체</b> 초호황기를 맞은 SK하이닉스에서는 2000명 이상 고용이 늘었다. 기업데이터 연구소 CEO스코어는 매출액 기준 500대 기업 가운데 분할·합병... ,"Thu, 12 Feb 2026 00:17:00 +0900"
2026-02-11 19:42:35,"수소차 관련주, '봄날의 햇살' 뉴인텍·현대차·한화솔루션·한온시스템...",http://www.finomy.com/news/articleView.html?idxno=249596,"아이에이는 자동차 전장 분야를 중심으로 <b>반도체</b> 및 모듈, 제어기 사업을 전개하고 있다. 다양한 전장용 <b>반도체</b> 및 모듈 공급을 확대하기 위한 활동을 지속적으로 추진하고 있으며, 완성차 업체 및 전장 부품업체와의... ","Thu, 12 Feb 2026 00:16:00 +0900"
2026-02-11 19:42:35,"이천시,제7기동군단과 드론분야 업무 협약 체결",http://www.seoulwire.com/news/articleView.html?idxno=706547,"의미 있는 출발점&quot;이라며 &quot;드론산업을 중심으로 지역경제 활성화와 기술 경쟁력 강화를 동시에 이끌겠다&quot;고 밝혔다. 이천시는 앞으로 드론, <b>반도체</b>, AI 등 미래 신산업 분야에서 다양한 기관과 협력을 확대해 나갈 방침이다.","Thu, 12 Feb 2026 00:16:00 +0900"
2026-02-11 19:42:35,"우주항공산업 관련주, '덩실덩실' 그린광학·컨텍·서남... '한숨' 스피어...",http://www.finomy.com/news/articleView.html?idxno=249594,"북미는 데이터센터, <b>반도체</b> 테스트, 계측·측정, 첨단 통신 인프라 등에서 고주파 케이블 수요가... mmWave 대역 기반의 케이블·커넥터·안테나를 자체 개발해 국방·항공·우주산업은 물론 차세대 이동통신과 <b>반도체</b>... ","Thu, 12 Feb 2026 00:16:00 +0900"
2026-02-11 19:42:35,급물살 타는 강원특별법 3차 개정…어떤 내용 담겼나,https://n.news.naver.com/mnews/article/087/0001174038?sid=100,"<b>반도체</b> 등 ‘강원전략기술 연구개발사업’ 을 지정할 수 있으며 강원형 카이스트인 강원과학기술원을 설립할 수 있는 근거도 신설된다. 춘천, 원주, 강릉이 국내 6번째 연구개발특구로 지정돼 큰 시너지를 낼 수 있는... ","Thu, 12 Feb 2026 00:14:00 +0900"
2026-02-11 19:42:35,[데스크 칼럼] 승부는 커브 구간에서 난다,https://n.news.naver.com/mnews/article/015/0005250309?sid=110,"<b>반도체</b>, 로봇, 에너지, 국방 등 AI와 맞물린 핵심 산업 패권을 놓고 각국은 루지 경기의 코너링처럼 숨 가쁜 경쟁을 벌이고 있다. AI 원천기술 분야에선 미국과 중국이 막대한 자본과 인프라를 앞세워 가장 짧고 효율적인... ","Thu, 12 Feb 2026 00:14:00 +0900"
