DateTime,Title,Link,Description,PubDate
2025-07-07 08:35:29,"에스엘즈 &quot;잘못된 공사, AR로 잡는다&quot;",https://n.news.naver.com/mnews/article/015/0005154568?sid=101,에스엘즈는 일반 건설 현장뿐 아니라 <b>반도체</b> 공장 등을 주요 고객군으로 보고 있다. 이 대표는 “<b>반도체</b> 공장은 제품을 고도화하기 위해 매년 최대 30%가량의 설비를 교체한다”며 “빌드 AR을 통해 1년가량 걸리는... ,"Mon, 07 Jul 2025 17:34:00 +0900"
2025-07-07 08:35:29,'크고 아름다운 법안' 발효… 전기차·태양광 수출 대전환 불가피,https://www.greenpostkorea.co.kr/news/articleView.html?idxno=302646,"◇ <b>반도체</b> 세액공제 확대… 향후 관세 불확실성은 부담 <b>반도체</b> 분야는 세액공제가 25%에서 35%로 확대됐다. 2022년 말 이후에 가동하고 2026년 말 이전에 착공한 시설에 제공하는 이 세액공제로 삼성전자, TSMC 등 미국 내... ","Mon, 07 Jul 2025 17:34:00 +0900"
2025-07-07 08:35:29,"&quot;용인<b>반도체</b> 산단 주민들, '양도소득세' 억울하오!&quot;",https://www.sejungilbo.com/news/articleView.html?idxno=53834,대규모 용인<b>반도체</b> 산업단지 조성사업이 이곳에 터잡고 살아온 지주들에게 불합리한 세법 즉 양도소득세 기산일 문제로 수용주민들과 마찰을 빚어면서 조기 발주에 차질이 우려되고 있다. 8일 용인시 등 <b>반도체</b>산업단지... ,"Mon, 07 Jul 2025 17:34:00 +0900"
2025-07-07 08:35:29,"SDT, '양자컴퓨팅 서비스 및 활용 체계 구축' 사업 합류…'플랫폼 장벽 ...",https://www.dailysecu.com/news/articleView.html?idxno=167706,"국내 대표 클라우드 기업 메가존이 사용자 지원, 기술 교육 및 컨설팅을 통해 기술 저변 확산을 이끌고, 학계에서는 숙명여대, GIST, 금오공대가 각각 하이브리드 스케줄링, 분자 물성, <b>반도체</b> 소재 등 핵심 양자... ","Mon, 07 Jul 2025 17:34:00 +0900"
2025-07-07 08:35:29,"[단독] 국정위, 삼성·하이닉스·현대차 만난다…통상 위기 속 '민관 원...",https://n.news.naver.com/mnews/article/011/0004506113?sid=100,"간담회에 참석하는 기업은 삼성전자·SK하이닉스(<b>반도체</b>), LG에너지솔루션(373220)(배터리), 두산에너빌리티(034020)(발전·플랜트), 현대차(모빌리티), 한화에어로스페이스·HD현대(267250)(방산·조선) 등이다. 이재명 정부의... ","Mon, 07 Jul 2025 17:33:00 +0900"
2025-07-07 08:35:29,"&quot;AI 데이터센터, 지방 분산 필요…정부 차원 인센티브 도입해야&quot;",https://n.news.naver.com/mnews/article/277/0005618945?sid=105,"AIDC에 포함되는 AI <b>반도체</b>와 서버, 냉각설비 등의 전력 소모량이 많기 때문이다. 하 부사장은 &quot;AI가 빠르게 발전하면서 AI 데이터센터를 돌아갈 수 있게 하는 전력 확보에 대해서 중요하게 보고 있다&quot;면서 &quot;사업적으로도 AI... ","Mon, 07 Jul 2025 17:33:00 +0900"
2025-07-07 08:35:29,"특허청, <b>반도체</b> 부품 제조 분야 명품 특허 창출을 위한 현장 소통 간담...",http://www.bizwnews.com/news/articleView.html?idxno=106685,특허청(청장 김완기)은 지난 4일 오후 <b>반도체</b> 부품 제조 기업인 ㈜포인트엔지니어링(경기도 화성시)을 방문해 지식재산 관련 현장소통 간담회를 가졌다. 김희태 <b>반도체</b>심사추진단장(왼쪽에서 세 번째)이 '특허청-(주)... ,"Mon, 07 Jul 2025 17:32:00 +0900"
2025-07-07 08:35:29,"전북대 전자공학부 대학원생 2명, 세계 최고 <b>반도체</b> 연구소 파견 기회 ...",http://www.jeollailbo.com/news/articleView.html?idxno=772064,전북대학교 '차세대 인공지능 <b>반도체</b>소자 및 회로 연구실' 소속 박민아·박서현 석사과정생이 '2025년도 <b>반도체</b> 글로벌 첨단팹 연계활용사업-해외(IMEC) 인턴십 및 기술인력교류 프로그램' 파견자로 최종 선정됐다.... ,"Mon, 07 Jul 2025 17:32:00 +0900"
2025-07-07 08:35:29,김태흠 충남도지사 &quot;투자협약 후속조치 속도&quot;,https://www.ajunews.com/view/20250707172645465,"특히 “새정부 출범 이후 인공지능(AI), <b>반도체</b> 등 첨단기술산업 분야 확대 등 예산 편성 방향을 제대로 파악하고, 관계 부처와 함께 기획재정부 심의에 총력 대응하라”고 덧붙였다. 김 지사는 이밖에 △추경 재원 마련... ","Mon, 07 Jul 2025 17:32:00 +0900"
2025-07-07 08:35:29,"&quot;'전기먹는 하마' AI 데이터센터, 전력난 심해져…정부 지원 필요&quot;",https://www.epnc.co.kr/news/articleView.html?idxno=319011,또 저전력 고효율 AI <b>반도체</b>의 필요성을 언급하며 이 같은 전략이 성공적으로 구현되면 &quot;원자력 발전소 10... 그러면서 &quot;전력에 대한 인프라는 국가적으로 잘 대비하되 AI 모델과 <b>반도체</b>는 어떤 방향으로 설계하고... ,"Mon, 07 Jul 2025 17:30:00 +0900"
2025-07-07 08:35:29,"[오늘의 ABC 뉴스룸] 트럼프, 내일 새벽 1시 각국에 관세 서한 발송 外",https://www.ajunews.com/view/20250707163413403,트럼프 대통령이 관심을 보여온 조선 분야 협력과 원전·이차전지·<b>반도체</b> 등 첨단 산업 전반의 협력 패키지에 포함될 것으로 예측됩니다. 李 지지율 60%…민주 53.8%·국힘 28.8% 이재명 대통령의 국정 지지율이 취임 한... ,"Mon, 07 Jul 2025 17:30:00 +0900"
2025-07-07 08:35:29,KCC글라스 '2024/25 ESG보고서' 발간…경영 성과·성장 전략 담아,https://www.newspim.com/news/view/20250707000954,▲투명 안테나가 적용된 차량용 유리 ▲투명도 조절이 가능한 스마트 글라스 ▲<b>반도체</b> 패키징용 유리기판 등 KCC글라스가 새로운 시장 수요에 대응하고자 첨단 기술을 접목해 개발하고 있는 주요 제품들을... ,"Mon, 07 Jul 2025 17:29:00 +0900"
2025-07-07 08:35:29,"[특징주] 싸이닉솔루션, 코스닥 상장 첫날 '따블' 직행 후 69% 상승 그쳐",https://n.news.naver.com/mnews/article/629/0000405176?sid=101,7960원 마감···장중 오름폭 축소 시스템 <b>반도체</b> 전문기업 싸이닉솔루션이 코스닥 상장 첫날 개장 직후... 2005년 설립된 시스템 <b>반도체</b> 디자인하우스 업체인 싸이닉솔루션은 국내 유일의 SK하이닉스시스템IC... ,"Mon, 07 Jul 2025 17:29:00 +0900"
2025-07-07 08:35:29,충북연구원 '민선 8기 4년 차와 미래전략 토론회' 개최,https://www.inews365.com/news/article.html?no=874735,"주제 발표자로 나선 이방무 도 기획조정실장은 민선 8기 3년의 핵심 성과로 60조 원 투자유치, 충북형 출산정책 시행, 바이오·<b>반도체</b> 전략산업 육성 등을 꼽았다. K-바이오 스퀘어 조기 착공, 청주국제공항∼김천 간... ","Mon, 07 Jul 2025 17:28:00 +0900"
2025-07-07 08:35:29,"트럼프와 결별한 머스크, 중국서도 위기…'내우외환' 빠진 테슬라",https://www.ajunews.com/view/20250707171407451,"이에 중국 내 서버를 통한 현지 데이터 학습 대안도 검토했으나, 미국의 <b>반도체</b> 수출 규제에 막혀 무산됐다. 그사이 중국 업체들은 발 빠르게 자율주행 기술을 개발 중이다. 바이두, 포니AI 등은 이미 중국 내에서 수천... ","Mon, 07 Jul 2025 17:28:00 +0900"
2025-07-07 08:35:29,"수원환경운동연합 &quot;수원 군공항, 이전이 아니라 폐쇄가 유일한 해법&quot;",http://www.newsroad.co.kr/news/articleView.html?idxno=42069,추진 ▲수원종합운동장 스포츠·문화 복합 컴팩트시티 조성 ▲화성행궁 앞 대형 지하 공영주차장 조성 ▲<b>반도체</b>·AI 초격차 혁신 클러스터 조성 ▲탄소중립 그린도시 조성 등 수원시 현안에 대한 국회 차원의 협력을 요청했다.,"Mon, 07 Jul 2025 17:28:00 +0900"
2025-07-07 08:35:29,"경산 기업 &lt;주&gt;오토노머스에이투지, 국가 R&amp;D연구비 수주 전국 2위",https://www.yeongnam.com/web/view.php?key=20250707023571737,"인공지능(AI) <b>반도체</b> 기업 딥엑스의 402억4천만원 바로 다음이다.모빌리티 분야로 좁히면 에이투지는 국가 R&amp;D 연구비 수주 1위다. 상위 20개 기업에는 아우토크립토, 카네비모빌리티, 비트센싱 등이 이름을 올렸다.... ","Mon, 07 Jul 2025 17:28:00 +0900"
2025-07-07 08:35:29,"용인시·단국대·도쿄일렉트론코리아, 초등생 '<b>반도체</b> 캠프' 열어",https://n.news.naver.com/mnews/article/417/0001087829?sid=102,"up <b>반도체</b>캠프'를 진행했다고 7일 밝혔다. 용인시에 따르면 지난 5일 열린 캠프는 <b>반도체</b> 산업을 이끌어갈 미래 인재를 양성하고, 지역사회 연계 진로체험 기회를 제공하기 위해 마련됐다. 캠프에는 사전 모집을 통해... ","Mon, 07 Jul 2025 17:25:00 +0900"
2025-07-07 08:35:29,&quot;강세장 이제 초입…우량주 '바이 앤 홀드'가 유효&quot;[인터뷰],https://n.news.naver.com/mnews/article/018/0006059636?sid=101,"김 전문가는 하반기 유망 섹터를 묻는 질문에 대해 “예측 자체는 큰 의미가 없다”며 “<b>반도체</b>가 좋을 거라 말해도, 결국 미국 <b>반도체</b> 업황이 받쳐주지 않으면 우리 <b>반도체</b>도 혼자 살아남기는 어렵다”고 잘라 말했다.... ","Mon, 07 Jul 2025 17:23:00 +0900"
2025-07-07 08:35:29,"한국폴리텍대학 구미캠퍼스, 국가 인력양성 사업 '더블 S등급' 쾌거",https://n.news.naver.com/mnews/article/088/0000957606?sid=102,한국폴리텍대학 구미캠퍼스가 정부가 주관하는 핵심 인력양성 사업 평가에서 연달아 최고 등급을 받으며 직업교육 명문임을 다시 한번 입증했다. 구미캠퍼스는 고용노동부와 한국산업인력공단이 주관한 '2024년도... ,"Mon, 07 Jul 2025 17:22:00 +0900"
2025-07-07 08:35:29,이광형 KAIST 총장 &quot;AI 3대 강국 위해 대한민국 주도의 AI 천하삼분지계...,https://www.joongdo.co.kr/web/view.php?key=20250707010002346,"이 총장은 대한민국 전략 마련이 요구되는 시점에서 특화 분야 중심의 독자 AI 모델 개발과 AI 모델을 효과적으로 구현할 수 있는 AI <b>반도체</b> 개발, 국제 연대를 통한 협력 강화가 필요하다고 조언했다. 또 AI 분야 다섯 가지... ","Mon, 07 Jul 2025 17:22:00 +0900"
2025-07-07 08:35:29,"&quot;<b>반도체</b>·車, 차기 주도주&quot;",https://n.news.naver.com/mnews/article/015/0005154534?sid=101,관세 협상 결과에 따라 <b>반도체</b>·자동차 또는 내수·금융 업종이 상승장을 이끌 것이란 전망이 나온다. 7일... 도널드 트럼프 미국 대통령이 관세 부과 시기를 기존보다 3주 늦춘 다음달 1일로 밝힌 가운데 <b>반도체</b>와... ,"Mon, 07 Jul 2025 17:20:00 +0900"
2025-07-07 08:35:29,"하나기술, <b>반도체</b> 유리기판 TGV 기술 개발",http://www.worktoday.co.kr/news/articleView.html?idxno=70664,첨단 제조장비 전문기업 하나기술은 <b>반도체</b> 유리기판의 핵심기술인 TGV(Through Glass Via) 유리 가공기술 개발에 성공했다고 7일 밝혔다. 하나기술은 자체 기술시연회를 통해 이번에 개발한 <b>반도체</b> 유리기판 솔루션을... ,"Mon, 07 Jul 2025 17:20:00 +0900"
2025-07-07 08:35:29,"KCC글라스, 지속가능경영 성과 담은 '2024/25 ESG보고서' 발간",https://www.cstimes.com/news/articleView.html?idxno=655561,▲투명 안테나가 적용된 차량용 유리 ▲투명도 조절이 가능한 스마트 글라스 ▲<b>반도체</b> 패키징용 유리기판 등 KCC글라스가 새로운 시장 수요에 대응하고자 첨단 기술을 접목해 개발하고 있는 주요 제품들을 소개했다.... ,"Mon, 07 Jul 2025 17:20:00 +0900"
2025-07-07 08:35:29,"천안시, 중소기업 박람회서 미래산업 중심지로 '주목'",https://www.thebk.co.kr/news/articleView.html?idxno=301259,"시 관계자는 &quot;천안은 AI, <b>반도체</b>, 우주항공 등 8대 전략산업을 기반으로 한 미래 산업의 중심지로 주목받고 있다&quot;며 &quot;앞으로도 우수 기업 유치를 위한 투자 홍보에 총력을 다하고, 기업과 함께 성장하는 도시로 나아가겠다... ","Mon, 07 Jul 2025 17:18:00 +0900"
2025-07-07 08:35:29,"'Dead or Alive' 美 관세 유예 종료 임박, 2가지 시나리오는",http://www.opinionnews.co.kr/news/articleView.html?idxno=120256,"및 <b>반도체</b> 장비에 대한 규제 완화 등을 협상안에 포함시켰다. 베트남은 미국산 제품에 대한 관세를 기존의 46... 선박, <b>반도체</b>, 배터리)에 대한 투자 그리고 주한미군 방위비 인상 등 크게 4가지로 정리할 수 있다. 이중... ","Mon, 07 Jul 2025 17:18:00 +0900"
2025-07-07 08:35:29,"정부, ‘AI데이터센터 투자’시 세액공제 최대 25% 확대 검토",https://n.news.naver.com/mnews/article/138/0002200152?sid=105,정부는 여기에 <b>반도체</b>와 같은 대표적 국가전략기술처럼 5%포인트를 추가로 부여하는 방안까지 고려하고 있다. 송경희 국정기획위원회 AI TF팀장은 지난 2일 서울 마포구 삼성SDS 상암 데이터센터에서 진행한 업계... ,"Mon, 07 Jul 2025 17:18:00 +0900"
2025-07-07 08:35:29,&quot;우리나라 청소년과 청년들에게 꿈을 주겠다&quot;,http://www.newsmaker.or.kr/news/articleView.html?idxno=166383,"바이오 사업은 삼성 내부에서 <b>반도체</b>에 이은 차세대 성장동력으로 평가받는다. 실제로 삼성바이오로직스는 지난해 4조 원 이상의 매출을 기록, 국내 제약·바이오 업계 최초로 '4조 클럽'에 가입하며 사상 최대 실적을... ","Mon, 07 Jul 2025 17:16:00 +0900"
2025-07-07 08:35:29,"강원특별자치도, 새 정부에 '강원 현안' 건의",http://www.m-i.kr/news/articleView.html?idxno=1257543,주요 과제로는 △수도권 <b>반도체</b> 메가 클러스터 강원권 확장 △K-연어 기반 푸드테크 산업 육성 △AI컴퓨팅·데이터센터 집적단지 조성 등이 포함됐다. 이외에도 용문~홍천 광역철도 등 교통망 구축을 통한 지역균형 발전... ,"Mon, 07 Jul 2025 17:16:00 +0900"
2025-07-07 08:35:29,취임 3주년 맞은 신상진 성남시장 &quot;3년의 변화 토대로 더 큰 도약&quot;,https://weekly.hankooki.com/news/articleView.html?idxno=7118592,"AI와 <b>반도체</b> 기술 혁신을 이끌 교육·연구 인프라도 속속 들어서고 있다. '성균관대학교 분당캠퍼스 팹리스 AI 성남연구센터'가 이미 문을 열었고, 이달에는 서강-판교 디지털혁신캠퍼스가 개관한다. KAIST AI... ","Mon, 07 Jul 2025 17:16:00 +0900"
2025-07-07 08:35:29,&quot;사람을 살리는 기술이 진짜 기술이다&quot;,http://www.newsmaker.or.kr/news/articleView.html?idxno=166342,"악천후에도 200m 이상, 야간에는 무려 1km 밖에서도 눈에 띌 정도로 높은 시인성을 갖추고 있으며, <b>반도체</b> 기반 LED를 활용하여 반영구적 사용이 가능하고 설치도 간편하다. 제품의 핵심은 '5초 이내 작동, 1km 가시성, 반영구... ","Mon, 07 Jul 2025 17:16:00 +0900"
2025-07-07 08:35:29,'온실가스 감축 시설·R&amp;D 투자' 14개 기업에 1521억 원 융자 지원,https://www.korea.kr/news/policyNewsView.do?newsId=148945591&call_from=naver_news,"이번에 선정된 기업들은 국내외 경제가 불확실한 상황에서도 시멘트, <b>반도체</b> 등 산업 부문과 수소, CCUS(탄소포집·활용·저장) 등 에너지 부문을 중심으로 다양한 탄소중립 분야에서 3930억 원 규모의 투자를... ","Mon, 07 Jul 2025 17:15:00 +0900"
2025-07-07 08:35:29,"[초점] AI산업 확산, 전력수요 폭증...&quot;지방분산·재생에너지전환 없으...",https://www.todayenergy.kr/news/articleView.html?idxno=285612,AI 산업과 <b>반도체</b> 등 첨단산업의 확산으로 전력 수요가 연평균 30% 이상 증가할 것으로 전망되는 가운데... AI <b>반도체</b> 개발 등 기술·산업 정책 전반이 연계된 전략이 필요하다&quot;고 조언했다. ◇&quot;에너지 클러스터 중심 지방... ,"Mon, 07 Jul 2025 17:14:00 +0900"
2025-07-07 08:35:29,이광형 KAIST 총장 &quot;AI 전산업 활용…일자리 창출 유도해야&quot;,https://n.news.naver.com/mnews/article/011/0004506103?sid=105,"AI <b>반도체</b> 개발, 국제 연대를 통한 협력 강화가 필요하다”고 강조했다. 이 총장은 우선“AI 분야의 다섯 가지 핵심 요소인 인력, 인프라, 데이터, 자본, 시장의 강화가 뒷받침 돼야 한다”며 대학과 대학원들의 유기적... ","Mon, 07 Jul 2025 17:13:00 +0900"
2025-07-07 08:35:29,"이재용·신동빈·김승연 회장, 현장 행보 이어가",http://www.wsobi.com/news/articleView.html?idxno=282780,"바이오사업은 <b>반도체</b>를 잇는 삼성의 미래 먹거리로 꼽힌다. 삼성바이오로직스는 지난해 연간 매출 4조원을 넘기며 사상 최대 실적을 냈고, 올해는 글로벌 제약사들과 잇따라 계약을 체결하며 1ㆍ2분기 연속 1조원대... ","Mon, 07 Jul 2025 17:12:00 +0900"
2025-07-07 08:35:29,"김해 인제대·고려대, 공동 실습 교과목 운영...차세대AI<b>반도체</b>특성화대...",https://www.gukjenews.com/news/articleView.html?idxno=3318618,"차세대AI<b>반도체</b>특성화대학사업에 참여 중인 인제대와 고려대가 지난 6월 23일부터 7월 4일까지 포항공대... 학생들은 MOS-Type <b>반도체</b> 소자를 주제로 이론 교육과 소자 모델링, 기초 공정 실습, 시뮬레이션, 측정 실험을... ","Mon, 07 Jul 2025 17:12:00 +0900"
2025-07-07 08:35:29,"강원특별자치도, <b>반도체</b> 전문인력 사업 끊임없는 도약",http://www.bzeronews.com/news/articleView.html?idxno=717644,강원특별자치도(도지사 김진태)는 7월 7일(월) 강릉 중앙고등학교 '<b>반도체</b> 교육센터' 개소식에 참석했다고 밝혔다. 강릉 중앙고는 강원형 <b>반도체</b> 전문인력 양성사업의 한 축을 담당하는 특성화 고등학교로 이번에 개소한... ,"Mon, 07 Jul 2025 17:10:00 +0900"
2025-07-07 08:35:29,"강릉중앙고 <b>반도체</b>교육센터 개소, 도내 직업계고 최대 규모",https://news.bbsi.co.kr/news/articleView.html?idxno=4037778,"도내 동해안권 최초의 강릉중앙고등학교 <b>반도체</b>교육센터가 7일, 문을 열었습니다. 강릉중앙고 <b>반도체</b>교육센터는, 도내 직업계고 최대 규모로서, 춘천·원주·강릉권 <b>반도체</b> 학과 총 7학급 112명 <b>반도체</b> 기술인재 양성을... ","Mon, 07 Jul 2025 17:10:00 +0900"
2025-07-07 08:35:29,“中 굴기·美 관세 뚫자”…한·일 新협력시대[글로벌 현장],https://n.news.naver.com/mnews/article/050/0000093328?sid=101,"“K<b>반도체</b>와 손잡아야 생존” 지난해 한국에 대한 외국인직접투자(FDI)는 신고액 기준 345억6800만 달러로... 한국엔 삼성전자, SK하이닉스, LG디스플레이 등 세계 <b>반도체</b>·디스플레이 최강자가 있다. 한국은 응용기술... ","Mon, 07 Jul 2025 17:09:00 +0900"
2025-07-07 08:35:29,"성장금융 '성장사다리펀드2', GP 선정 개시…880억 출자",https://www.topdaily.kr/articles/104361,매칭은 ▲혁신성장 ▲핀테크 ▲<b>반도체</b> 부문으로 나눠 총 9곳을 선발할 예정이다. 7곳의 GP 선발을 계획한... 성장금융이 100억원을 출자하는 <b>반도체</b> 부문은 한국산업은행 등이 참여해 총 750억원을 더할 예정이다.... ,"Mon, 07 Jul 2025 17:08:00 +0900"
2025-07-07 08:35:29,"&quot;AI 탑재 로봇 프로브 개발, 수작업의 한계 돌파&quot;... MIT 연구진, 로봇과...",https://www.aitimes.kr/news/articleView.html?idxno=35565,(A) 재료 과학 도메인 전문가는 <b>반도체</b> 필름을 측정하기 위해 프로브의 세 가지 개별 접촉점(빨간색)의... (출처:논문) 과학자들이 태양 전지 및 기타 전자 장치의 효율성을 높일 새로운 <b>반도체</b> 물질을 발견하기 위해... ,"Mon, 07 Jul 2025 17:08:00 +0900"
2025-07-07 08:35:29,하나기술 '<b>반도체</b> 유리기판 TGV 기술' 개발 완료,https://daily.hankooki.com/news/articleView.html?idxno=1239874,ⓒ하나기술 제공 첨단 제조장비 전문기업 하나기술이 <b>반도체</b> 유리기판의 핵심기술인 TGV(Through Glass Via) 유리 가공기술 개발에 성공했다고 7일 밝혔다. 하나기술은 자체 기술시연회를 통해 이번에 개발한 <b>반도체</b>... ,"Mon, 07 Jul 2025 17:08:00 +0900"
2025-07-07 08:35:29,"[청론직설] “통상 질서 패러다임 전환기, 기술·경제안보 중심 한국형...",https://n.news.naver.com/mnews/article/011/0004506096?sid=110,"정부는 먼저 <b>반도체</b>, 인공지능(AI), 배터리 등 전략산업을 중심으로 맞춤형 지원 정책 패키지를 가동해야... △중국은 희토류의 수출제한을 풀고, 미국은 <b>반도체</b> 수출 통제를 완화하고 중국 유학생을 계속 받아들이는... ","Mon, 07 Jul 2025 17:07:00 +0900"
2025-07-07 08:35:29,"김진태 강원도지사 “규제는 풀고, 산업은 키우고, 도민의 삶은 높이고...",https://www.cnbnews.com/news/article.html?no=736538,"◆ 산업은 키우고 산업 기반이 없던 <b>반도체</b> 분야를 비롯한 바이오, 수소 등 7대 미래산업 생태계가 빈틈없이 조성 중이다. 이를 위해 불모지에서 10개 사업(총 2,320억 원)이 동시 추진 ▲바이오특화단지... ","Mon, 07 Jul 2025 17:06:00 +0900"
2025-07-07 08:35:29,하반기 '퍼펙트 스톰' 온다...10개 주력업종 수출전선 초비상,https://n.news.naver.com/mnews/article/014/0005373620?sid=101,"■수출 10개 업종 수출 악화 전망 7일 산업계에 따르면 올 하반기 한국의 15개 주력 수출업종 중 <b>반도체</b>와... 장상식 한국무역협회 국제무역통상연구원장은 &quot;<b>반도체</b> 착시효과(<b>반도체</b> 수출 호조)를 제외한다면,주력... ","Mon, 07 Jul 2025 17:06:00 +0900"
2025-07-07 08:35:29,'이재명 랠리'에 2분기 상장사 시총 532조 원 급증…SK하이닉스·두산에...,http://www.queen.co.kr/news/articleView.html?idxno=437614,"이번 상승세는 인공지능 <b>반도체</b>, 원자력, 조선업 등 산업별 테마가 복합적으로 작용한 결과로 풀이된다. 특히 SK하이닉스는 고대역폭메모리(HBM) 수요 급증에 힘입어 시총이 3개월 만에 73조 원 넘게 증가하며 단일... ","Mon, 07 Jul 2025 17:06:00 +0900"
2025-07-07 08:35:29,레인보우로보틱스 주가 7월 7일 1.87% 하락 마감,https://www.joongangenews.com/news/articleView.html?idxno=432648,"레인보우로보틱스는 협동로봇 및 산업용 로봇 기술을 기반으로 한 로봇 전문 기업으로, 최근 인공지능 및 <b>반도체</b> 제조 자동화 분야에서도 사업 확장을 모색하고 있다.","Mon, 07 Jul 2025 17:06:00 +0900"
2025-07-07 08:35:29,"원주시, '나노코리아 2025' 참가...<b>반도체</b>·나노 기업 유치 박차",https://news.bbsi.co.kr/news/articleView.html?idxno=4037779,"홍보하고 <b>반도체</b>와 나노 산업 관련 기업 유치 활동을 적극 전개했습니다. 나노코리아는 산업통상자원부와... 특히 부론일반산업단지, <b>반도체</b> 소모품 실증센터, 미래차 전장부품 및 시스템 <b>반도체</b> 신뢰성 검증센터 등... ","Mon, 07 Jul 2025 17:04:00 +0900"
2025-07-07 08:35:29,"POSTECH, 국내 최초 전 과정 온라인 '경영과학전공' 석사과정 신설…2026...",https://www.idaegu.co.kr/news/articleView.html?idxno=515632,"특히 '철강경영'과 '원자력경영'과 같은 특화 트랙을 운영하고 있으며 향후에는 이차전지, 바이오, <b>반도체</b>, 방위산업 등으로 확대할 계획이다. 정광민 POSTECH 융합대학원 경영과학전공 책임교수는 &quot;경영과학전공은... ","Mon, 07 Jul 2025 17:04:00 +0900"
2025-07-07 08:35:29,"지속가능한 AI 데이터센터 구축, 산업·학계·정부 &quot;표준화·협력 로드맵...",https://www.ezyeconomy.com/news/articleView.html?idxno=216662,이동수 네이버클라우드 이사는 &quot;에이전틱 AI 시대를 대비해선 완전히 새로운 데이터센터 구조와 고효율 <b>반도체</b>가 필요하다&quot;고 강조했다. 채효근 한국데이터센터연합회 전무 역시 &quot;AI 데이터센터는 일반 데이터센터와... ,"Mon, 07 Jul 2025 17:02:00 +0900"
