DateTime,Title,Link,Description,PubDate
2025-10-21 14:50:39,김용범·김정관 또다시 미국으로…APEC 정상회의 전 협상 마무리 난항?,https://n.news.naver.com/mnews/article/008/0005266222?sid=101,"한미 양국은 △1500억달러 조선업 협력 △2000억달러 <b>반도체</b> 등 첨단 산업 투자 관련해 현금 조달 방식, 대출, 보증 규모를 둘러싸고 입장차를 보여왔던 터라 통상 수장들의 방미 이후 최종 협상 타결에 대한 기대감이... ","Tue, 21 Oct 2025 23:48:00 +0900"
2025-10-21 14:50:39,"&quot;암모니아는 원유가, 수소는 휘발유·경유가 될 것&quot;[기후전투③]",https://news.mtn.co.kr/news-detail/2025102123250522950,"설계는 아모지, 제조는 한국 플랜트 기업이 맡는 ‘에너지 파운드리 모델’, 즉 <b>반도체</b> 산업의 팹리스–파운드리 구조와 유사한 전략이다.아모지가 개발한 암모니아 추진선 전경과 선박 내부에 있는 암모니아... ","Tue, 21 Oct 2025 23:42:00 +0900"
2025-10-21 14:50:39,"국내 의약품산업, 높은 부가가치·고용창출 효과 입증",https://www.yakup.com/news/index.html?mode=view&cat=12&nid=317579,"한국 의약품산업이 <b>반도체</b>와 디스플레이 등 다른 국가첨단전략산업에 비해 생산규모는 작지만 각 산업별... 연구 보고서에 따르면 한국은행이 제시한 2020년과 2022년 산업연관표를 이용, <b>반도체</b>·디스플레이·의약품 등... ","Tue, 21 Oct 2025 23:40:00 +0900"
2025-10-21 14:50:39,"파두, 데이터센터용 고성능 PMIC 상용화 성공",http://www.lawissue.co.kr/view.php?ud=2025102123364136479817d053b9_12,데이터센터 특화 시스템<b>반도체</b> 팹리스 기업 파두가 데이터센터용 고성능 전력관리<b>반도체</b>(PMIC: Power Management Integrated Circuit)가 최상위 등급(Tier 1) 고객 인증 통과 및 양산을 통해 복수의 후속 제품 공급을... ,"Tue, 21 Oct 2025 23:40:00 +0900"
2025-10-21 14:50:39,"의약품산업, <b>반도체</b>·디스플레이보다 부가가치·고용 창출 효과↑",http://www.wikileaks-kr.org/news/articleView.html?idxno=176431,"한국 의약품산업이 <b>반도체</b>와 디스플레이 등 다른 국가 첨단전략산업보다 생산 규모는 작지만, 산업별 같은... 산업연구원 연구 보고서에 따르면 한국은행이 제시한 2020년과 2022년 산업연관표를 이용해 <b>반도체</b>... ","Tue, 21 Oct 2025 23:38:00 +0900"
2025-10-21 14:50:39,"이철우 경북지사, 'APEC' D-10…&quot;준비는 끝났다&quot;",https://ilyo.co.kr/?ac=article_view&entry_id=501666,"'과거와 현재, 대한민국이 이끄는 새로운 미래'라는 주제로 꾸며진 경제전시장은 △대한민국 산업역사관 △첨단미래산업관(이차전지·모빌리티, <b>반도체</b>, 조선·해양, 화장품·바이오, 웹툰·드라마·캐릭터)... ","Tue, 21 Oct 2025 23:36:00 +0900"
2025-10-21 14:50:39,"대만 수출 2개월 연속 한국 추월, 격차 더 확대",https://www.asiatoday.co.kr/view.php?key=20251021010007766,(AI) <b>반도체</b>의 세계적 수요 급증에 힘입어 전년 동월 대비 30.5% 증가한 702억2000만 달러(100조4777억 원)를... 9월의 수출액 대부분을 전자제품과 정보통신기기(<b>반도체</b> 포함) 분야가 차지했다면 분명 이렇게 단정할 수... ,"Tue, 21 Oct 2025 23:34:00 +0900"
2025-10-21 14:50:39,"[미국증시 개장브리핑] 나스닥 시장, 암 치료제 개발사 급등…<b>반도체</b>주...",https://www.tokenpost.kr/news/market/296319,"나스닥 약세 종목, <b>반도체</b>주 하락 두드러져 모바일 광고기술 기업 앱러빈(APP)은 규제 당국 조사 소식에 5% 하락했고, 자동차보험사 프로그레시브(PGR) 역시 투자의견 하향으로 2% 이상 하락했다. <b>반도체</b> 관련주... ","Tue, 21 Oct 2025 23:32:00 +0900"
2025-10-21 14:50:39,[사설]강경 우파 다카이치 총리 취임… ‘韓日 한배 탄 이웃’ 잊지 말...,https://n.news.naver.com/mnews/article/020/0003668798?sid=110,"가령 <b>반도체</b> 생산 능력이 강점인 한국과 <b>반도체</b> 제조 장비, 핵심 소재가 강한 일본이 협력하면 새로운 경쟁력을 키워 불확실성이 커진 글로벌 공급망에 함께 대처할 수 있다. 왜곡된 과거사 인식이 이런 미래지향적 협력의... ","Tue, 21 Oct 2025 23:28:00 +0900"
2025-10-21 14:50:39,"김태흠 충남도지사, 아산시민과 소통... 제2중앙경찰학교 유치 총력",http://www.newstown.co.kr/news/articleView.html?idxno=662299,"아산 인주지구는 디스플레이와 미래 모빌리티 위주로, 둔포지구는 <b>반도체</b>산업을 중심으로 지정 추진 중이다. 지정이 완료되면 경제자유구역청을 설치해 글로벌 기업 유치와 첨단 산업 고도화, 지역 산업의 글로벌... ","Tue, 21 Oct 2025 23:27:00 +0900"
2025-10-21 14:50:39,APEC 재무장관회의 '인천플랜' 채택...경제계도 분주,https://n.news.naver.com/mnews/article/052/0002262589?sid=101,"이재용 삼성전자 회장, 최태원 SK그룹 회장 등 우리 기업인들과 만나 <b>반도체</b>와 인공지능 협력 논의를 이어갈지 관심이 모입니다. YTN 이승은입니다. 영상기자 : 박재상 영상편집 : 김광현","Tue, 21 Oct 2025 23:20:00 +0900"
2025-10-21 14:50:39,"AI로 조 단위 칩 설계도 OK… 칩에이전츠, 2,100만 달러 투자 유치",https://www.tokenpost.kr/news/ai/296309,"<b>반도체</b> 설계의 복잡성이 기하급수적으로 증가하면서, 이를 해결하기 위한 인공지능(AI) 기반 솔루션이 각광받고 있다. 미국 캘리포니아주 산타바버라에 본사를 둔 <b>반도체</b> AI 스타트업 칩에이전츠(ChipAgents.ai)는 <b>반도체</b>... ","Tue, 21 Oct 2025 23:08:00 +0900"
2025-10-21 14:50:39,"대만, 9월 수출 역대 최대…삼성전자 메모리 회복세 3분기 영업이익 12조...",https://www.abcn.kr/news/articleView.html?idxno=83759,ABC뉴스=박정수 기자 / 대만의 9월 수출이 인공지능(AI) <b>반도체</b> 수요 급증에 힘입어 월간 기준 사상 최대를 기록했다. 한국 삼성전자 역시 같은 흐름 속에서 메모리 <b>반도체</b> 호황을 누리며 실적 반등세를 보이고 있다.... ,"Tue, 21 Oct 2025 23:08:00 +0900"
2025-10-21 14:50:39,"삼성SDS, 국가 AI컴퓨팅센터 구축 후보지에 ‘전남’ 최종 선택",https://n.news.naver.com/mnews/article/022/0004076699?sid=102,전남도 관계자는 “국가 AI컴퓨팅센터 후보지 선정과 오픈 AI 전용 데이터센터 구축 등으로 AI 강국의 초석을 닦는 기반을 마련할 수 있게 됐다”며 “데이터센터를 시작으로 <b>반도체</b> 기업까지 유치해 명실상부한... ,"Tue, 21 Oct 2025 23:02:00 +0900"
2025-10-21 14:50:39,[KES 2025]XR·미래차·스타트업 경진대회 등 부대행사,https://n.news.naver.com/mnews/article/030/0003361292?sid=105,행사 마지막 날인 24일에는 한국미래기술교육연구원이 주관하는 '첨단 AI <b>반도체</b> 패키징 및 열관리 혁신기술 세미나'가 열린다. 주한프랑스상공회의소가 주최하는 기술 세미나인 '테크 서밋'도 같은 날 열린다. 올해는... ,"Tue, 21 Oct 2025 23:01:00 +0900"
2025-10-21 14:50:39,"[사설] 中·대만에 뒤처지는 한국경제, 혁신·규제개혁 시급",https://n.news.naver.com/mnews/article/022/0004076696?sid=110,<b>반도체</b>의 나라 대만의 기세도 무섭다. 국제통화기금(IMF)에 따르면 한국의 1인당 국내총생산(GDP) 순위는... 대만이 세계 최대 파운드리(<b>반도체</b> 위탁생산) 업체 TSMC를 ‘호국신산’이라 떠받들 정도로 <b>반도체</b>와 인공지능... ,"Tue, 21 Oct 2025 23:00:00 +0900"
2025-10-21 14:50:39,"[증권소식] 채권전문가 85% &quot;10월 금통위 금리 동결&quot;디딤펀드, 평균수익...",https://www.asiatime.co.kr/article/20251021500468,"상장 기업들은 첨단 제조, <b>반도체</b> 솔루션, 자동화, 인공지능(AI) 기반 소프트웨어 플랫폼 등 하드웨어와... 김동원 리서치본부 상무는 '2026년 증시와 <b>반도체</b>, 성장의 전환점'을 주제로 메가트렌드를 제시했고... ","Tue, 21 Oct 2025 22:56:00 +0900"
2025-10-21 14:50:39,[분석] 미국 뉴욕증시 장초반 혼조…빅테크 약세·실적 랠리·CPI 대기,https://www.topstarnews.net/news/articleView.html?idxno=15846687,"11위부터 20위에선 디렉션 <b>반도체</b> 3X 불 ETF가 3,250억원 감소로 두드러진 유출을 보였고, 브로드컴·아이렌... 반면 <b>반도체</b> 3X 불 ETF와 누스케일 파워, 아이렌 등에서 10월 17일 기준 자금 유출이 확인됐고, 오늘... ","Tue, 21 Oct 2025 22:52:00 +0900"
2025-10-21 14:50:39,"재계, 원팀으로 APEC 성공 개최 힘 싣는다",http://www.ujeil.com/news/articleView.html?idxno=375336,"SK그룹 관계자는 &quot;APEC을 계기로 국가 AI 생태계 전략을 세계와 나누고, SK가 <b>반도체</b>부터 에너지, 서비스 전... 특히 APEC에서 최태원 SK그룹 회장, 이재용 삼성전자 회장 등 국내 <b>반도체</b>·메모리 업계 핵심 리더들과... ","Tue, 21 Oct 2025 22:40:00 +0900"
2025-10-21 14:50:39,"파두, 데이터센터용 고성능 PMIC 상용화 성공",https://www.newscj.com/news/articleView.html?idxno=3330531,"파두가 데이터센터용 고성능 전력관리<b>반도체</b>(PMIC) 최상위 등급(Tier 1) 고객 인증 통과 및 양산을 통해... 시스템<b>반도체</b> 기업으로 성장하기 위한 추가적인 발판을 확보했다. 데이터센터용 PMIC는 GPU, DRAM, SSD 등 서버... ","Tue, 21 Oct 2025 22:38:00 +0900"
2025-10-21 14:50:39,강기정 시장 &quot;국가 사업이 기업 경제 논리에 무너졌다&quot;,http://www.namdonews.com/news/articleView.html?idxno=836582,3차 공모에서는 1·2차 공모에서 '악조건'으로 분류된 지분 비율·국산 <b>반도체</b> 의무사용 등의 조건이 변경 또는 삭제됐다. 또 기업들은 &quot;광주는 속도와 하드웨어 등 인프라가 충분하다. 전력·부지·수(水)량·광통신 등 모든... ,"Tue, 21 Oct 2025 22:30:00 +0900"
2025-10-21 14:50:39,경남 스타트업 싱가포르서 글로벌 시장 두드린다,http://www.gnmaeil.com/news/articleView.html?idxno=572994,둔 <b>반도체</b> 기업 인피니언 테크놀로지스(Infineon Technologies) 등을 방문해 글로벌 전문가들과의 미팅을 진행하고 협력 방안을 논의한다. 이번 프로그램에는 총 5개의 도내 유망 스타트업이 참여한다. △갓테크(재사용... ,"Tue, 21 Oct 2025 22:30:00 +0900"
2025-10-21 14:50:39,"삼성SDS, 국가 AI 컴퓨팅센터 단독 응모…전남 유치 유력",http://www.tjb.co.kr/sub0301/bodo/view/id/86691,전남도 관계자는 &quot;국가 AI컴퓨팅센터 후보지 선정과 오픈 AI 전용 데이터센터 구축 등으로 AI 강국의 초석을 닦는 기반을 마련할 수 있게 됐다&quot;며 &quot;데이터센터를 시작으로 <b>반도체</b> 기업까지 유치해 명실상부한 에너지... ,"Tue, 21 Oct 2025 22:28:00 +0900"
2025-10-21 14:50:39,"국내 의약품산업, 높은 부가가치·고용창출 효과 입증",https://n.news.naver.com/mnews/article/117/0004000165?sid=102,"한국 의약품산업이 <b>반도체</b>와 디스플레이 등 다른 국가첨단전략산업에 비해 생산규모는 작지만 각 산업별... 연구 보고서에 따르면 한국은행이 제시한 2020년과 2022년 산업연관표를 이용, <b>반도체</b>·디스플레이·의약품 등... ","Tue, 21 Oct 2025 22:08:00 +0900"
2025-10-21 14:50:39,9월 대만 수출액 702억달러 '사상 최대'…AI <b>반도체</b> 수요 폭발,https://n.news.naver.com/mnews/article/421/0008553594?sid=104,"지난달 선적 물량은 <b>반도체</b>를 포함하는 전자제품과 정보통신 제품이 주도했다. 대만 경제부는 전자제품... 대만은 전 세계 <b>반도체</b> 생산량의 절반 이상을 차지하며, 거의 모든 하이엔드 칩을 생산하는 등 글로벌 시장... ","Tue, 21 Oct 2025 22:08:00 +0900"
2025-10-21 14:50:39,"고기능 전자소재 윌코, 50억 규모 시리즈A 투자 유치 성공",https://platum.kr/archives/272868,"박상원 윌코 대표는 &quot;이번 투자는 윌코의 소재 기술이 시장에서 실질적인 경쟁력을 인정받았다는 의미&quot;라며, &quot;국내를 넘어 글로벌 방산·전장·AI <b>반도체</b> 분야의 핵심 소재기업으로 도약하겠다&quot;고 포부를 밝혔다.... ","Tue, 21 Oct 2025 22:00:00 +0900"
2025-10-21 14:50:39,"희토류 앞세운 중국 기습공격에…미국, 호주와 ‘자원동맹’ 맺고 반격",https://n.news.naver.com/mnews/article/009/0005576719?sid=101,"희토류와 핵심 광물은 무기는 물론 자동차, <b>반도체</b>, 노트북 등 각종 전자기기의 핵심 부품에 쓰인다. 앞서 중국이 희토류 수출 통제를 강화하자 트럼프 대통령이 중국산 제품에 오는 12월 1일부터 100% 추가 관세를... ","Tue, 21 Oct 2025 21:53:00 +0900"
2025-10-21 14:50:39,10월 4주 주요 제조업 전망,https://www.laborplus.co.kr/news/articleView.html?idxno=36432,"대동은 농업 현장 실증과 고도화, 현장 안전 환경 인증 등 후속 절차를 진행할 계획임 □ 10월 3주 <b>반도체</b>... 지난해 동기 대비 <b>반도체</b>는 수출이 20.2% 증가한 것으로 집계됨 ▷ 전망 - <b>반도체</b>(지난해 동기 대비 +20.2%)와... ","Tue, 21 Oct 2025 21:49:00 +0900"
2025-10-21 14:50:39,&quot;APEC 성공은 기본…가시적 성과 만든다&quot;,https://www.kyongbuk.co.kr/news/articleView.html?idxno=4054657,"△대한민국 산업역사관 △첨단미래산업관(이차전지·모빌리티·<b>반도체</b>·조선해양·바이오 등) △지역기업관(55개 기업) △K-경북푸드 홍보관 △한복, 한식, 한옥, 한글, 한지 등 5한(韓)문화체험관으로 구성됐다. 정상회의... ","Tue, 21 Oct 2025 21:48:00 +0900"
2025-10-21 14:50:39,[경주 APEC D-9] 글로벌 손님맞이 &quot;준비는 끝났다&quot;,https://www.idaegu.co.kr/news/articleView.html?idxno=527084,"'과거와 현재, 대한민국이 이끄는 새로운 미래'라는 주제로 꾸며진 경제전시장은 △대한민국 산업역사관 △첨단미래산업관(이차전지·모빌리티, <b>반도체</b>, 조선·해양, 화장품·바이오, 웹툰·드라마·캐릭터)... ","Tue, 21 Oct 2025 21:44:00 +0900"
2025-10-21 14:50:39,10월 1∼20일 수출 7.8% 감소…대미 수출 24.7% '뚝',https://www.ulsanpress.net/news/articleView.html?idxno=561247,"<b>반도체</b>(20.2%)·석유제품(10.9%)·선박(11.7%) 등에서 증가하고, 승용차(-25.0%)·무선통신기기(-17.7%) 등은 감소했다. 수입은 330억달러로 작년보다 7억7,000만달러(2.3%) 감소했다. 품목별로는 원유(12.6%)·<b>반도체</b>(0.8... ","Tue, 21 Oct 2025 21:42:00 +0900"
2025-10-21 14:50:39,반칙왕,https://www.ulsanpress.net/news/articleView.html?idxno=561172,"조선, <b>반도체</b>, 자동차 등 미국 내 공장 설비를 하려면 한국의 기술자들 없이는 아무 것도 못 할 터이다. 한국인을 만만히 본 그들에게 숨겨논 우리의 실력으로 본 때를 보여줘야 한다. 상대가 아무리 반칙을 해도 그들을... ","Tue, 21 Oct 2025 21:42:00 +0900"
2025-10-21 14:50:39,"타이완, AI <b>반도체</b> 수요 급증에 9월 수출 역대 최대",https://n.news.naver.com/mnews/article/056/0012051041?sid=104,타이완의 지난달 수출액이 세계 인공지능(AI) <b>반도체</b> 수요 급증에 힘입어 월간 기준 역대 최대치를... 정보통신기기(<b>반도체</b> 포함) 분야가 차지했다고 밝혔습니다. 실제로 전자 산업 분야가 전년 동월 대비 45.9... ,"Tue, 21 Oct 2025 21:41:00 +0900"
2025-10-21 14:50:39,"충북도의회, 도립파크골프장 운영 조례안 통과",https://www.ccdailynews.com/news/articleView.html?idxno=2374117,"의원 '강원도와 용인 <b>반도체</b>를 위한 송전선로 설치 더 이상 희생할 수 없다, 제천시민 결사 반대한다' 등을 주장했다. 도의회 430회 정례회는 11월 3일 개회해 12월 15일까지 43일간 일정으로 진행한다. /배명식기자","Tue, 21 Oct 2025 21:40:00 +0900"
2025-10-21 14:50:39,코스피 3900고지서 공방,http://www.econotelling.com/news/articleView.html?idxno=18181,국내 증시도 장 초반 <b>반도체</b> 대형주가 오름세를 주도했다. 삼성전자는 9만9900원까지 오르며 '10만 전자'에 바짝 다가섰다. SK하이닉스는 사상 처음 50만원을 터치했다. 그러나 고점 부담에 차익실현 매물이... ,"Tue, 21 Oct 2025 21:40:00 +0900"
2025-10-21 14:50:39,"대만, <b>반도체</b> 앞세워 9월 수출 역대 최대…100조원 돌파",https://n.news.naver.com/mnews/article/011/0004546079?sid=104,<b>반도체</b> 호조를 앞세운 대만이 지난달 월간 기준 역대 최대 수출액을 기록했다. 21일 대만 경제부는 9월... 정보통신기기(<b>반도체</b> 포함) 분야가 차지했다고 밝혔다. 전자 산업 분야가 전년 동월 대비 45.9% 증가한... ,"Tue, 21 Oct 2025 21:38:00 +0900"
2025-10-21 14:50:39,"삼성SDS, 국가AI 컴퓨팅센터 구축 단독입찰",https://n.news.naver.com/mnews/article/014/0005422616?sid=105,"다만 입지, 요금, 일정 등의 구체적인 사업계획과 국내 산학연에 대한 첨단 GPU 지원, 국산 AI<b>반도체</b> 도입 활성화, 글로벌 기업 협력 등 정책목표 달성 방안은 향후 확정된 민간참여자가 제시한 사업참여계획서를... ","Tue, 21 Oct 2025 21:33:00 +0900"
2025-10-21 14:50:39,"“코스피 상승, 이유는 중국자본 때문?”…김민수 주장에 與 반박",https://n.news.naver.com/mnews/article/018/0006143537?sid=100,"이 정도면 망상”이라며 “코스피가 오른 이유는 <b>반도체</b> 경기 회복, 수출 증가, 연금 자금 유입 등 명백한 경제 요인 때문이다. 그런데 이를 ‘중국 자본의 불법 개입’으로 해석하다니, 어처구니가 없다. 이건 음모론이라... ","Tue, 21 Oct 2025 21:29:00 +0900"
2025-10-21 14:50:39,"대만, AI <b>반도체</b> 수요 급증에 9월 수출 역대 최대",https://n.news.naver.com/mnews/article/001/0015692575?sid=104,9월 수출액 702억달러…전년 동월 대비 30.5% ↑ 대만의 지난달 수출액이 세계 인공지능(AI) <b>반도체</b>... 정보통신기기(<b>반도체</b> 포함) 분야가 차지했다고 밝혔다. 실제로 전자 산업 분야가 전년 동월 대비 45.9... ,"Tue, 21 Oct 2025 21:26:00 +0900"
2025-10-21 14:50:39,"국립금오공대, 지역 주력산업 기술 선도할 '성장혁신 LAB 30' 출범",http://www.kyosu.net/news/articleView.html?idxno=146792,* 지역 8대 주력산업 분야: △제조혁신 △스마트시티 △첨단 모빌리티 △로봇 △<b>반도체</b> △이차전지... 이번에 지정한 5개 연구실은 제조혁신·스마티시티·첨단모빌리티·로봇·<b>반도체</b>의 5개 분야다. △제조혁신 분야 'A... ,"Tue, 21 Oct 2025 21:26:00 +0900"
2025-10-21 14:50:39,"국내 의약품산업, 부가가치·고용창출 효과 입증",https://www.medipana.com/news/articleView.html?idxno=400494,"한국 의약품산업이 <b>반도체</b>와 디스플레이 등 다른 국가첨단전략산업에 비해 생산규모는 작지만 각 산업별... 연구 보고서에 따르면 한국은행이 제시한 2020년과 2022년 산업연관표를 이용, <b>반도체</b>·디스플레이·의약품 등... ","Tue, 21 Oct 2025 21:18:00 +0900"
2025-10-21 14:50:39,전남 AI 메카로...&quot;국가컴퓨팅센터·오픈AI 들어선다&quot;,https://n.news.naver.com/mnews/article/660/0000095199?sid=102,"이 센터는 <b>반도체</b>를 비롯해 자율주행, 헬스케어 등 AI를 활용한 차세대 산업 연구의 핵심 시설이 될 전망입니다. 해남·영암 일대 솔라시도를 내세워 유치전에 나선 전남은, 98메가와트 규모의 태양광 전력과 풍부한... ","Tue, 21 Oct 2025 21:18:00 +0900"
2025-10-21 14:50:39,"과기정통부 &quot;삼성SDS, 국가 AI 컴퓨팅센터 단독 응모&quot;",http://www.hansbiz.co.kr/news/articleView.html?idxno=784713,"개소 일정과 이용 요금, GPU 산학연 지원, 국산 AI <b>반도체</b> 활용 방안 등은 민간 참여자 계획에 따라 진행된다. 앞서 1·2차 공모가 기업의 수익성이 낮다는 이유로 유찰되며 사업이 난항에 빠졌으나 삼성SDS가 단독... ","Tue, 21 Oct 2025 21:10:00 +0900"
2025-10-21 14:50:39,"통합 강원대, AI·<b>반도체</b> 인재 양성 속도",https://www.g1tv.co.kr/news?mid=1_207_6&newsid=334781,여) 특히 AI와 <b>반도체</b> 분야를 중심으로 한 미래 인재 양성에 집중하고 있습니다. 보도에 김윤지 기자입니다.... AI와 <b>반도체</b> 분야를 중심으로 한 미래산업 인재양성이 핵심입니다. 임현승 / 강원대... ,"Tue, 21 Oct 2025 21:09:00 +0900"
2025-10-21 14:50:39,'젠슨 황도 온다'...세계 경제 수장들 경주로 총집결,https://www.tbc.co.kr/news/view?pno=20251021144104AE01460&id=200107,"CEO와 회원국 정상 등 85명이 연사로 나서는데, 전 세계의 이목은 단연 AI <b>반도체</b> 시장의 절대 강자 엔비디아 CEO, 젠슨 황에 쏠려 있습니다. 젠슨 황은 국내 대기업 총수와 만나 협력 방안을 논의하고 31일에는... ","Tue, 21 Oct 2025 21:06:00 +0900"
2025-10-21 14:50:39,"[특집]춘천 바이오, AI·양자 날개 달려면…바이오 산업 대전환 심포지...",https://n.news.naver.com/mnews/article/087/0001149495?sid=102,"AI는 알고리즘, 데이터 응용 뿐만 아니라 한국의 강점인 <b>반도체</b>와 연결돼 인프라, 피지컬적인 부분까지 폭넓게 다뤄진다. 바이오는 AI, 양자 시장을 뛰어 넘는 폭넓은 시장 규모를 지녔고 AI, 양자, <b>반도체</b>와 결합했을 때... ","Tue, 21 Oct 2025 21:03:00 +0900"
2025-10-21 14:50:39,"이상일 용인특례시장, 스페인·프랑스 공식 방문...세비야와 자매결연,...",https://ilyo.co.kr/?ac=article_view&entry_id=501657,이상일 용인특례시장은 &quot;이번에 체결한 우호교류로 안달루시아 지방 국내총생산(GDP)의 25%를 차지하는 것으로 알려진 세비야와 초대형 <b>반도체</b> 프로젝트로 글로벌 <b>반도체</b> 중심지로 성장 중인 용인이 다방면으로 교류... ,"Tue, 21 Oct 2025 21:02:00 +0900"
2025-10-21 14:50:39,"홍성군, 30년 역사 자랑하는 맛의 향연",https://www.gukjenews.com/news/articleView.html?idxno=3406764,30년 역사가 빚어낸 감칠맛의 향연/홍성군청 제공  대한민국 대표 특산물인 '검은 <b>반도체</b>' 광천 조미김과 '국가중요어업유산 제15호'로 지정된 광천 토굴새우젓의 진수를 선보인 '제30회 광천조미김·광천토굴새우젓 대축제... ,"Tue, 21 Oct 2025 21:02:00 +0900"
2025-10-21 14:50:39,"“올해 초 1억 넣었으면 2.9억 됐다”…사상 첫 50만원 돌파, 64만원 간다...",https://n.news.naver.com/mnews/article/016/0002545188?sid=101,"연합뉴스 AI(인공지능)발 <b>반도체</b> 수요 확대로 급등한 SK하이닉스 주가가 64만원까지 오를 수 있다는... <b>반도체</b>가 슈퍼사이클에 들어서면서 가격이 오르는 데다, AI가 촉발한 <b>반도체</b> 수요가 꺾이지 않고... ","Tue, 21 Oct 2025 21:01:00 +0900"
2025-10-21 14:50:39,‘21세기 원유’ 제2희토류 쇼크 [스페셜리포트],https://n.news.naver.com/mnews/article/024/0000100721?sid=101,"‘희귀한 흙’ 희토류(rare earth)는 <b>반도체</b>, 전기차, 배터리 산업 등에 포괄적으로 쓰이는 핵심 소재다.... 이번 갈등이 장기화할 경우 한국 성장 동력인 AI <b>반도체</b>와 데이터센터 분야 등에서 선단 공정 지연은 물론 감산 등... ","Tue, 21 Oct 2025 21:01:00 +0900"
