DateTime,Title,Link,Description,PubDate
2025-12-11 04:38:31,"케이그라운드벤처스, NX·하이퍼비주얼AI와 '풀스택 AX 생태계' 구축 나...",https://n.news.naver.com/mnews/article/030/0003379601?sid=101,AI <b>반도체</b> 팹리스 기업 하이퍼비주얼AI와 에너지 분야 AX 사업화 협력을 위한 MOU를 체결하고 AI EMS 고도화를 위해 전용 AI <b>반도체</b>(GPNPU)와 관련 기술 공동개발 및 표준화를 추진하고 글로벌 시장 진출에도 적극... ,"Thu, 11 Dec 2025 13:37:00 +0900"
2025-12-11 04:38:31,"미래에셋, 'TIGER 미국 대표지수 ETF' 2종 개인 누적 순매수 4조 돌파",https://n.news.naver.com/mnews/article/018/0006181837?sid=101,"등 미국 대형 우량주에 안정적으로 분산 투자한다. ‘TIGER 미국나스닥100 ETF’는 미국 기술주 중심의 나스닥100 지수를 기반으로, AI·<b>반도체</b>·클라우드 등 성장 섹터 대표 기업들에 집중 투자 가능하다.","Thu, 11 Dec 2025 13:37:00 +0900"
2025-12-11 04:38:31,"박현주 회장, 국민성장펀드 자문위원장으로 첫 외부 직함…맡을 역할은",https://news.einfomax.co.kr/news/articleView.html?idxno=4388454,박현주 국민성장펀드 전략위원회 공동위원장은 &quot;150조원 국민성장펀드는 AI·로봇·<b>반도체</b>·바이오·인프라 등 기업성장의 초석이자 창업을 춤추게 할 마중물&quot;이라면서 &quot;지속가능하고 보다 더 큰 펀드로 발전할 수 있도록... ,"Thu, 11 Dec 2025 13:36:00 +0900"
2025-12-11 04:38:31,"용인시, 동백신봉선 신설·용인선 연장 국가 승인···도시철도망 구축...",https://www.smartfn.co.kr/news/articleView.html?idxno=129145,"이 시장은 &quot;동백신봉선은 플랫폼시티, <b>반도체</b>·AI 기업 집적지와 연계되는 핵심 철도망으로 미래 교통수요를... 시는 두 노선이 <b>반도체</b> 산업 인력 이동과 시민 출퇴근 수요 해소에 기여할 것으로 보고, 동백신봉선의... ","Thu, 11 Dec 2025 13:36:00 +0900"
2025-12-11 04:38:31,"ACM, 패널 제조 고객사에 '수평식 패널 전해도금' 장비 공급",https://www.datanet.co.kr/news/articleView.html?idxno=207632,<b>반도체</b> 및 첨단 웨이퍼 레벨 패키징(WLP) 애플리케이션을 위한 웨이퍼 처리 솔루션 전문 기업 ACM리서치는... 이 시스템은 기존의 원형 웨이퍼 처리와 비교할 만한 패널 처리 성능을 달성해 <b>반도체</b> 기업이 디바이스... ,"Thu, 11 Dec 2025 13:36:00 +0900"
2025-12-11 04:38:31,"원익, 2026년 임원 인사 단행…성과 중심 인재 대거 발탁",https://n.news.naver.com/mnews/article/030/0003379596?sid=105,"원익그룹은 핵심 사업 분야인 <b>반도체</b> 소재·부품·장비 분야를 비롯해 차세대 배터리 장비 개발, 로봇핸드 등에서의 기술 경쟁력을 높여 나갈 방침이다. 원익그룹 관계자는 “이번 인사 배경은 미래 준비와 글로벌... ","Thu, 11 Dec 2025 13:36:00 +0900"
2025-12-11 04:38:31,"코스텍시스, ‘블록본딩 센터’ 본격 가동…AI·데이터센터 대응력 강화",https://n.news.naver.com/mnews/article/119/0003035774?sid=101,<b>반도체</b> 패키징 열관리 솔루션 전문기업 ㈜코스텍시스(대표이사 한규진)는 제3공장인 ‘블록본딩 센터’의... 또한 미국 AI <b>반도체</b> 전문 기업 T사와의 594억 원 규모 장기 공급 계약이 2025년 하반기부터 매출에 반영되기... ,"Thu, 11 Dec 2025 13:36:00 +0900"
2025-12-11 04:38:31,"[진단_배터리업계 ②삼성SDI] 최주선 대표 체제의 삼성SDI, 2023년 정점 뒤...",http://www.newsworker.co.kr/news/articleView.html?idxno=406462,"1970년 1월 설립된 삼성SDI(대표이사 최주선)는 삼성그룹 내 에너지 저장장치와 전자소재 부문을 담당하는 핵심 계열사로, 주요 사업은 자동차·IT·ESS용 2차전지를 생산하는 에너지솔루션 부문과 <b>반도체</b>·디스플레이... ","Thu, 11 Dec 2025 13:36:00 +0900"
2025-12-11 04:38:31,"재료硏-SK이노베이션, AI·전기화 핵심소재 개발 협력 MOU",https://n.news.naver.com/mnews/article/030/0003379593?sid=102,"특히 휴머노이드, AI <b>반도체</b>, 에너지 저장·회수 등 전기화 유망 산업 분야에서 핵심 소재 개발 기회를 함께... 토의에서는 AI <b>반도체</b> 전력 변환 및 휴머노이드용 자성 소재, 전기구동용 차세대 영구자석 소재, 에너지 저장... ","Thu, 11 Dec 2025 13:34:00 +0900"
2025-12-11 04:38:31,150조 국민성장펀드 출범…“기술 패권 대응”,https://n.news.naver.com/mnews/article/056/0012083929?sid=101,"구조로, <b>반도체</b>와 지역 산업을 위한 섹터펀드도 마련해 투자 범위를 넓힐 계획입니다. 인프라투융자는... 150조 원 규모의 자금은 AI, <b>반도체</b>, 이차전지, 바이오, 수소 등 12개 산업에 탄력적으로 배분되며, 생태계 내 벤처... ","Thu, 11 Dec 2025 13:33:00 +0900"
2025-12-11 04:38:31,150조 '국민성장펀드' 출범…민관 손잡고 첨단전략산업 키운다,https://www.etoday.co.kr/news/view/2535039,이투데이=박선현 기자 | 민관공동위원장에 서정진·박현주…AI 30조·<b>반도체</b> 20.9조 등 &quot;100여건 투자 수요 접수... 재원은 앞으로 5년간 △AI(30조 원) △<b>반도체</b>(20조9000억 원) △모빌리티(15조4000억 원) △바이오·백신(11조000억... ,"Thu, 11 Dec 2025 13:32:00 +0900"
2025-12-11 04:38:31,닻 올린 150조 국민성장펀드…“국가역량 총동원”,https://n.news.naver.com/mnews/article/277/0005692268?sid=101,박현주 국민성장펀드 전략위원회 공동위원장은 &quot;150조원 국민성장펀드는 인공지능(AI)·로봇·<b>반도체</b>·바이오·인프라 등 기업 성장의 초석이자 창업을 춤추게 할 마중물&quot;이라며 &quot;지속가능하고 보다 더 큰 펀드로 발전할 수... ,"Thu, 11 Dec 2025 13:31:00 +0900"
2025-12-11 04:38:31,150조 국민성장펀드 닻 올렸다…이억원·박현주·서정진 3인 전략위 가동,https://n.news.naver.com/mnews/article/018/0006181833?sid=101,"산업계와 금융계 전문가로 구성된 투심위는 AI·로봇, 에너지·인프라, <b>반도체</b>, 모빌리티, 바이오 등 5개... 박현주 공동위원장은 “150조원 국민성장펀드는 AI·로봇·<b>반도체</b>·바이오·인프라 등 기업 성장 초석이자 창업을... ","Thu, 11 Dec 2025 13:31:00 +0900"
2025-12-11 04:38:31,"150조원 ‘이재명표’ 국민성장펀드, 인공지능에 30조원 투입된다",https://n.news.naver.com/mnews/article/023/0003946327?sid=101,"30조원, <b>반도체</b> 분야에 약 21조원을 투자하기로 했다. 이르면 내년 연말부터 이들 분야의 유망 중소·중견... 이어 <b>반도체</b>에 20조9000억원, 모빌리티 분야에 15조4000억원, 바이오·백신 분야에 11조6000억원에 각각 자금이... ","Thu, 11 Dec 2025 13:31:00 +0900"
2025-12-11 04:38:31,"기보, 대전시와 혁신기술기업 실증 및 R&amp;D 경쟁력 강화 위해 맞손",https://www.ibabynews.com/news/articleView.html?idxno=144733,"또한 양 기관은 이번 협약을 통해 우주·항공(Aerospace), 바이오헬스(Biohealth), 나노·<b>반도체</b>(Chips), 국방(Defense), 로봇(Robot) 등 미래 핵심전략기술 분야의 R&amp;D 기업이 기술개발 및 실증단계에서 필요한 자금을 안정적으로... ","Thu, 11 Dec 2025 13:30:00 +0900"
2025-12-11 04:38:31,150조 국민성장펀드 출범…&quot;첨단산업·지역에 20년 성장엔진 마련&quot;,https://n.news.naver.com/mnews/article/003/0013652412?sid=101,5년간 150조 투입…AI ·<b>반도체</b>·바이오 등 첨단산업 전방위 지원 정부는 주요 지원 방향을 ▲첨단전략산업 및... 여기에는 <b>반도체</b>·이차전지·백신·디스플레이·수소·미래차·바이오·인공지능·방산·로봇·콘텐츠... ,"Thu, 11 Dec 2025 13:30:00 +0900"
2025-12-11 04:38:31,150조 국민성장펀드 출범…전략委 '사령탑'에 박현주·서정진,https://n.news.naver.com/mnews/article/001/0015791094?sid=101,&quot;압도적 숫자에 걸맞은 성과내야&quot;…AI 30조·<b>반도체</b> 20.9조 등 배분 40% 이상은 지역 투자…'1호 투자처' 후보 여러곳 두고 협의 인공지능(AI)과 <b>반도체</b> 등 첨단산업에 150조원을 투자하는 국민성장펀드가 11일 공식 출범했다.... ,"Thu, 11 Dec 2025 13:30:00 +0900"
2025-12-11 04:38:31,"150조 성장펀드, 서정진·박현주 참여..금융-산업 최고전문가들 뭉쳤다",https://n.news.naver.com/mnews/article/008/0005290531?sid=101,"향후 20년간 AI(인공지능)·에너지·<b>반도체</b>·바이오 등 유망업종 '성장엔진'을 지원하는 국민성장펀드에... 업종별로 AI·로봇, 에너지·인프라, <b>반도체</b>, 모빌리티, 바이오 등 4개 소위원회(분과)로 구분해 심사할 예정이다.... ","Thu, 11 Dec 2025 13:30:00 +0900"
2025-12-11 04:38:31,&quot;죽기 아니면 살기&quot;…닻 올린 '150조 국민성장펀드' 1호 투자는?,https://n.news.naver.com/mnews/article/421/0008655613?sid=101,"이재명 대통령이 '죽기 아니면 살기 상황'이라고 언급할 정도로 절체절명한 국내 <b>반도체</b> 산업 경쟁력 강화를... 직접투자 수요로 차세대 AI솔루션 소프트웨어 개발업체, AI로봇 생태계를 위한 SPC 설립, 중소기업의 <b>반도체</b>... ","Thu, 11 Dec 2025 13:30:00 +0900"
2025-12-11 04:38:31,150조 국민성장펀드 출범…첨단산업 '20년 투자엔진' 가동,https://www.newsworks.co.kr/news/articleView.html?idxno=822648,간접투자는 대규모 블라인드펀드·프로젝트펀드 조성을 통해 <b>반도체</b>·AI·로봇 등 특정 산업 분야에... 박현주 공동위원장은 &quot;AI·<b>반도체</b>·로봇·바이오 등에서 창업을 활성화하는 마중물이 될 것&quot;이라며 &quot;정직·투명성... ,"Thu, 11 Dec 2025 13:30:00 +0900"
2025-12-11 04:38:31,"국민성장펀드, 벌써 153조 투자수요 몰렸다…40%는 지역에 투자",https://n.news.naver.com/mnews/article/008/0005290530?sid=101,"이어 <b>반도체</b> 20조9000억원, 모빌리티 15조4000억원, 바이오·백신 11조6000억원, 이차전지 7조9000억원, 미디어... 방식으로는 <b>반도체</b> 공장 폐수 재이용사업·첨단산업 지원을 위한 수상태양광 사업·<b>반도체</b> 클러스터 집단... ","Thu, 11 Dec 2025 13:30:00 +0900"
2025-12-11 04:38:31,150조 국민성장펀드 공식 출범…민관 전략위원회 첫 회의,https://n.news.naver.com/mnews/article/119/0003035773?sid=101,"국민성장펀드는 AI·<b>반도체</b>·이차전지·바이오 등 미래 핵심산업을 대상으로 직접지분투자, 프로젝트펀드... 금융위는 이미 차세대 AI 솔루션 개발사, AI 로봇 생태계 구축 SPC, <b>반도체</b> 공장용 폐수 재이용 인프라 등... ","Thu, 11 Dec 2025 13:30:00 +0900"
2025-12-11 04:38:31,150조 '국민성장펀드' 출범…서정진·박현주 공동전략위원장 발탁,https://n.news.naver.com/mnews/article/421/0008655612?sid=101,소위원회는 △AI·로봇(1분과) △에너지·인프라(2분과) △<b>반도체</b> 등(3분과) △모빌리티 등(4분과) △바이오 등(5분과) 등으로 잠정 분류했다. 2단계인 기금운용심의회는 첨단전략산업기금이 활용되는 부분에 대한 최종... ,"Thu, 11 Dec 2025 13:30:00 +0900"
2025-12-11 04:38:31,"[아시아르포]한-말레이 FTA 체결, 동병상련에서 '환상의 조합'으로",https://n.news.naver.com/mnews/article/277/0005692264?sid=110,"말레이시아는 글로벌 <b>반도체</b> 후공정 분야에서 중요한 생산 허브이자, 자동차 제조업 기반을 오래 유지해온... 동시에 희토류 정제, <b>반도체</b> 장비, 수소·재생에너지 등 미래산업 공급망이 풍부한 파트너이기도 하다. 2026년이... ","Thu, 11 Dec 2025 13:29:00 +0900"
2025-12-11 04:38:31,"[AI의 종목 이야기] 中 세기화통, '중국판 엔비디아' 무어스레드 지분 보...",https://www.newspim.com/news/view/20251211000719,"지난 2022년 9월에 발표한 공시에서 세기화통은 메타버스 하드웨어 생태계 구축을 위해, 산하의 산업 펀드가 광주<b>반도체</b>(光舟半導體)와 무어스레드에 소수 지분 투자를 단행했다고 밝힌 바 있다. 게임 산업의... ","Thu, 11 Dec 2025 13:29:00 +0900"
2025-12-11 04:38:31,"손경식 경총 회장 “한일 국교 60주년, <b>반도체</b>·AI 기술 협력해야”",https://n.news.naver.com/mnews/article/030/0003379583?sid=105,"일본이 △<b>반도체</b> △배터리 △인공지능(AI) △첨단 소재 △정밀기계 등 상호 강점을 지닌 분야에서 협력을 강화한다면 글로벌 시장에서 혁신과 성장을 주도할 수 있을 것”이라고 말했다. 그러면서 “이미 <b>반도체</b>, 수소차... ","Thu, 11 Dec 2025 13:27:00 +0900"
2025-12-11 04:38:31,"더불어민주당 구자열 전 강원도지사 비서실장, 원주시장 선거 출마 선언",https://n.news.naver.com/mnews/article/654/0000156206?sid=102,"구 전 실장은 이날 원주시청 브리핑룸에서 출마 회견을 열고 &quot;삼성<b>반도체</b> 공장 유치, 10만개 일자리 창출이라는 화려한 공약을 모두 제로(0)인 채 끝낸 지난 4년의 가짜 시정을 끝내고 진짜 원주시대를 열겠다&quot;고 포부를... ","Thu, 11 Dec 2025 13:27:00 +0900"
2025-12-11 04:38:31,"여주시, 용인<b>반도체</b> 클러스터 상생협약 이행상황 설명회 개최",http://www.shinailbo.co.kr/news/articleView.html?idxno=2161266,"가운데, '용인<b>반도체</b> 클러스터 상생협약 이행 추진상황 설명회'를 개최했다고 11일 밝혔다. 물이용... 추진 중인 사업으로는 ▲용수관로 설치구간 협조 ▲<b>반도체</b> 협력업체 유치 ▲<b>반도체</b> 인력양성 지원 ▲공공임대주택... ","Thu, 11 Dec 2025 13:26:00 +0900"
2025-12-11 04:38:31,"ADB, 한국 경제성장률 올해 0.9%·내년 1.7%로 0.1%p 상향 전망",https://www.koscaj.com/news/articleView.html?idxno=320893,"아시아개발은행은 한국 정부의 경기부양 조치의 소비 진작 효과, 글로벌 <b>반도체</b> 수요, 관세협상 타결 등에 따른 불확실성 감소 등을 반영해 이같이 내다봤다. 다만, 부동산시장 약세, 글로벌 무역 및 지정학적 긴장... ","Thu, 11 Dec 2025 13:26:00 +0900"
2025-12-11 04:38:31,[시장 따라잡기] &quot;AI 거품 아냐…내년에도 상승장&quot;…낙관 전망 우세,https://n.news.naver.com/mnews/article/374/0000480018?sid=101,"일각에선 유동성 장세가 이어지면 미국 기술주가 랠리를 이어갈 것이고, 국내 <b>반도체</b>주도 상승폭을 키워갈 수 있을 것이다. 이런 전망도 많았는데요. 오라클의 부진한 실적에도 국내 <b>반도체</b>주는 큰 영향이 없을지... ","Thu, 11 Dec 2025 13:26:00 +0900"
2025-12-11 04:38:31,"AI 시대, K-<b>반도체</b> 정책…라온테크 성장 모멘텀 확보",https://www.pinpointnews.co.kr/news/articleView.html?idxno=405189,"정부가 <b>반도체</b> 초격차 유지와 시스템<b>반도체</b> 생태계 강화를 위한 'K-<b>반도체</b> 비전'을 발표하면서,  장비 국산화 기대감속 수혜주로 부상하고 있다. 로봇과 <b>반도체</b> 공정 자동화 장비를 공급하는 라온테크는 정책 지원과 투자... ","Thu, 11 Dec 2025 13:26:00 +0900"
2025-12-11 04:38:31,부산시 세계 8위·아시아 2위 '스마트도시',https://n.news.naver.com/mnews/article/008/0005290527?sid=102,첨단기술 부문의 상승(12위→11위)은 △부산특화 전력<b>반도체</b> 밸리 조성 △디지털트윈 시범구역 조성 △자율주행차 시범운행지구 지정·서비스 제공 등 추진 정책의 성과로 판단한다. 금융지원 부문(13위→8위)의 큰... ,"Thu, 11 Dec 2025 13:26:00 +0900"
2025-12-11 04:38:31,[그래픽] 금산분리 완화 시 최태원의 SK 지배구조,https://www.ceoscoredaily.com/page/view/2025121111092174500,우리 기업들이 AI·<b>반도체</b> 등 대규모 투자가 수반되는 첨단 산업 경쟁력을 강화할 수 있도록 제도적... 지주회사 체제에서 손자회사로 <b>반도체</b> 사업을 영위하는 대기업은 사실상 SK뿐이다. SK그룹 지주사인 SK㈜는... ,"Thu, 11 Dec 2025 13:26:00 +0900"
2025-12-11 04:38:31,현대차그룹 50조원 '서남권 신사업' 거점 건설…전북 대대적 유치전 '다...,https://n.news.naver.com/mnews/article/002/0002418355?sid=102,"김영록 전남도지사는 지난 8일 &quot;대규모 재생에너지 확충으로 현대차그룹 투자를 준비하고, <b>반도체</b> 클러스터까지 만들겠다&quot;고 밝혔다. 이원택 의원은 &quot;현대차그룹의 피지컬AI 전진기지 건설은 폭발성이 강한... ","Thu, 11 Dec 2025 13:24:00 +0900"
2025-12-11 04:38:31,"손경식 &quot;한일, <b>반도체</b>·배터리·AI 협력 위해 양국 정부 지원 필요&quot;",https://n.news.naver.com/mnews/article/079/0004095009?sid=101,"핵심요약 한일 국교 정상화 60주년…양국 경제협력 논의 <b>반도체</b>·AI·배터리 등 첨단 분야 협력 필요성 강조... 그는 이어 &quot;<b>반도체</b>·수소차·첨단기술 분야에서 양국 기업의 공동 프로젝트가 활발히 진행되고 있고, 일본... ","Thu, 11 Dec 2025 13:22:00 +0900"
2025-12-11 04:38:31,韓 '원팀' 꾸려 美 혁신 심장부서 R&amp;D 인재 영입 박차,https://n.news.naver.com/mnews/article/030/0003379580?sid=101,"<b>반도체</b>·모빌리티·바이오·인공지능(AI)·로봇·이차전지 등 첨단 분야 기업과 4대 과기원, 정부출연연... 바이오 R&amp;D 중심지인 뉴욕과 <b>반도체</b> 산업 거점 오스틴에서는 현지 연구자·유학생과 국내 혁신 주체의 1대 1... ","Thu, 11 Dec 2025 13:20:00 +0900"
2025-12-11 04:38:31,경기도의회 예산심의서 교통·공항·안전 예산 전방위 도마,https://www.asiatime.co.kr/article/20251211500133,"그는 &quot;부지 갈등과 건설 기간을 고려하면 신공항은 <b>반도체</b> 물류 골든타임에 대응할 수 없다&quot;며, 이미 정부가 확장 계획을 확정한 청주공항과의 연계 철도망 구축이 현실적이고 신속한 해법이라고 강조했다. 임창휘 의원은... ","Thu, 11 Dec 2025 13:20:00 +0900"
2025-12-11 04:38:31,"광주시, AI·<b>반도체</b> 중심 첨단 핵심 거점도시 도약",https://www.smartfn.co.kr/news/articleView.html?idxno=129148,| 스마트에프엔 = 한민식 기자 | 광주광역시에 따르면 정부가 지난 10일 이재명 대통령 주재로 열린 '인공지능(AI) 시대의 K-<b>반도체</b> 비전과 육성전략 보고회'에서 광주를 국가대표 <b>반도체</b> 첨단패키징 거점으로 육성하는... ,"Thu, 11 Dec 2025 13:18:00 +0900"
2025-12-11 04:38:31,"SK하이닉스·SK스퀘어, 투자경고 지정에 동반 하락…과열 경고등 켜졌다",https://www.tokenpost.kr/news/market/313617,"특히 <b>반도체</b> 업황 개선에 따라 장기 상승 흐름을 그려온 SK하이닉스의 경우, 단기 조정은 오히려 향후 건전한 상승세를 위한 숨고르기로 작용할 수 있다. 이 같은 흐름은 앞으로도 고점에 도달한 종목들에 대해 감시... ","Thu, 11 Dec 2025 13:18:00 +0900"
2025-12-11 04:38:31,"수원시, 경기남부광역철도 '국가철도망 반영' 총력",https://www.asiatime.co.kr/article/20251211500149,"3기 신도시, <b>반도체</b>∙첨단산업 클러스터 등 주요 거점을 연결하는 남부권 핵심 철도망으로, 수원시가 용역 착수부터 공동 건의, 최종보고회까지 주관하며 사업을 이끌고 있다. 시는 지난해 5월 용역 결과를 바탕으로... ","Thu, 11 Dec 2025 13:18:00 +0900"
2025-12-11 04:38:31,&quot;2026년 美 독주 시장 끝나고 수익 확산 본격화할 것&quot;,https://weekly.hankooki.com/news/articleView.html?idxno=7140982,Craig는 &quot;AI는 향후 10~15년간 생산성 향상의 본체로 작용할 것&quot;이라며 &quot;데이터센터·전력 인프라·<b>반도체</b>가 직접적 수혜 업종이 될 것&quot;이라고 강조했다. Stewart도 &quot;AI 관련 기업의 설비투자 증가가 미국뿐 아니라 유럽... ,"Thu, 11 Dec 2025 13:18:00 +0900"
2025-12-11 04:38:31,"이재준 수원시장, R&amp;D사이언스 파크 조성 추진 상황 발표",http://www.paxetv.com/news/articleView.html?idxno=255158,"R&amp;D(연구&amp;개발), AI(인공지능), <b>반도체</b>, IT(정보기술), 바이오 등 첨단연구기업을 유치해 세계를 선도하는... R&amp;D사이언스 파크 주변에는 <b>반도체</b> 특화대학이자 우수한 연구 인력을 배출하는 성균관대 자연과학캠퍼스와 탑동... ","Thu, 11 Dec 2025 13:18:00 +0900"
2025-12-11 04:38:31,"산업교육연구소, ‘HBM 대응’ AI <b>반도체</b>·하이브리드 본딩 사업화 전략...",https://n.news.naver.com/mnews/article/366/0001129504?sid=105,"AI <b>반도체</b>/Hybrid Bonding 기술 혁신과 도약을 위한 사업화 전략 세미나’를 개최한다고 밝혔다. 하이브리드 본딩은 고속·고집적 패키징 구현을 가능하게 하는 핵심 공정으로, HBM 성능 경쟁이 본격화된 <b>반도체</b>... ","Thu, 11 Dec 2025 13:16:00 +0900"
2025-12-11 04:38:31,"디지트론, 구미국가산단에 새 둥지 틀다…LIG넥스원 협력 방산클러스터...",https://www.idaegu.com/news/articleView.html?idxno=653664,"이를 위해 구미시는 ADEX 2025에서 LIG넥스원과 27개 협력사 대표 등과 네트워킹을 갖고 구미국가산단과 조성 중인 하이크밸리, <b>반도체</b>특화단지, 기회발전특구 지정에 따른 세제 혜택 등을 내세워 투자 경쟁력을 강조한 바... ","Thu, 11 Dec 2025 13:16:00 +0900"
2025-12-11 04:38:31,"일론 머스크 이어 베이조스도 '우주 데이터센터' 전담팀 운영, 구글과 3...",https://www.businesspost.co.kr/BP?command=article_view&num=423272,우주 데이터센터는 인공지능(AI) <b>반도체</b>를 탑재한 인공위성을 우주 궤도에 띄워 데이터를 지구에 전송하는... 구글도 자체 개발한 AI <b>반도체</b>인 '텐서프로세스유닛(TPU)'을 위성 두 대에 탑재해서 2027년 우주 궤도에 올릴... ,"Thu, 11 Dec 2025 13:14:00 +0900"
2025-12-11 04:38:31,"용인특례시, 동백신봉선 신설·용인선 연장 '제2차 경기도 도시철도망 ...",https://www.sisamagazine.co.kr/news/articleView.html?idxno=522238,"광역 환승 허브 연결 및 <b>반도체</b> 산업 지원 동백신봉선은 수지구 신봉동에서 성복역(신분당선), 구성역(GTX-A... 이 시장은 이 철도가 신봉동, 성복동을 거쳐 <b>반도체</b> 기업들이 입주할 플랫폼시티와 연결되며, 인구가 증가하고... ","Thu, 11 Dec 2025 13:12:00 +0900"
2025-12-11 04:38:31,"LG전자, 퀄컴과 협력 확대…생성형 AI 기반 미래 'AIDV' 기술 선보인다",https://www.straightnews.co.kr/news/articleView.html?idxno=289009,LG전자 제공 LG전자가 글로벌 <b>반도체</b> 기업 퀄컴과 함께 개발한 생성형 AI(인공지능) 기반 차량용 고성능 컴퓨팅 장치(HPC)를 공개하며 AIDV(인공지능중심차량) 시대를 선도하는 앞선 기술력을 선보인다. LG전자는 내년 1월... ,"Thu, 11 Dec 2025 13:12:00 +0900"
2025-12-11 04:38:31,12월 초순 수출 17.3% 급증...역대 최대치 경신,https://www.pointe.co.kr/news/articleView.html?idxno=64812,<b>반도체</b>가 폭발적인 증가세를 보이며 수출 호조를 이끌었다. 11일 관세청이 발표한 '2025년 12월 1일... 수출 증가를 견인한 핵심 요인은 단연 <b>반도체</b>로 전년 동기 대비 무려 45.9% 급증하며 수출 상승세를 주도했다.... ,"Thu, 11 Dec 2025 13:12:00 +0900"
2025-12-11 04:38:31,"가스켐테크놀로지, 특수가스 중화처리 공주 공장 준공…‘첨단 가스 토...",http://amenews.kr/news/view.php?idx=65079,"C동에는 <b>반도체</b> 공정에서 발생하는 특수가스 잔량을 안전하게 회수·중화하는 첨단 시스템이 새롭게 구축됐다. <b>반도체</b>용 가스 사용량 증가로 잔가스 처리의 중요성이 커지는 가운데, 회사는 C동 운영을 통해 고정밀 분석... ","Thu, 11 Dec 2025 13:10:00 +0900"
2025-12-11 04:38:31,"대구보건대, 부산 오스템임플란트서 '디지털 치과산업 교원연수' 실시",http://www.veritas-a.com/news/articleView.html?idxno=588821,"사업단은 이번 연수를 계기로 AI/<b>반도체</b>/스마트 제조 등 신기술 분야 선도기업과의 협력을 확대해 교원 전문성을 강화하고, 학생들이 변화하는 산업 환경에 맞는 실무 능력을 기를 수 있도록 지원할 계획이다. 정효경... ","Thu, 11 Dec 2025 13:10:00 +0900"
