DateTime,Title,Link,Description,PubDate
2025-09-26 16:51:26,트럼프 “美공장 안 짓는 제약사에 내달부터 100% 관세”,https://n.news.naver.com/mnews/article/020/0003664159?sid=101,한편 트럼프 행정부는 미국 내 <b>반도체</b> 생산 확대를 위한 새로운 관세 부과 방안도 검토 중인 것으로 알려졌다. 월스트리트저널(WSJ)은 26일 미국 정부가 <b>반도체</b> 기업이 자국 내에서 제조한 <b>반도체</b>와 해외에서 생산한... ,"Sat, 27 Sep 2025 01:42:00 +0900"
2025-09-26 16:51:26,“코스피는 전 고점 뚫었는데 우린 왜…” 눈물짓는 코스닥 개미들,https://n.news.naver.com/mnews/article/020/0003664135?sid=101,"증권업계 관계자는 “코스피는 <b>반도체</b>나 지주사, 금융, 조선, 방산, 원자력 등이 주가 상승을 이끄는 반면에 코스닥은 매력적인 주도주가 마땅히 없다”며 “큰돈을 장기간 투자할 만한 종목이 없으니 주가가 꾸준히... ","Sat, 27 Sep 2025 01:41:00 +0900"
2025-09-26 16:51:26,로아앤코그룹 &quot;기업가치·안전 최우선&quot;…계열사별 책임 강화,https://www.nbntv.kr/news/articleView.html?idxno=337756,현재 그룹 내 주요 계열사는 ▲넥스턴&amp;롤코리아(089140·공작기계·중장비 부품) ▲이브이첨단소재(131400·전기차 배터리용 FPCB·투명LED) ▲미래산업(025560·<b>반도체</b> 테스트 핸들러·SMT 설비) ▲다이나믹디자인(145210·타이어... ,"Sat, 27 Sep 2025 01:38:00 +0900"
2025-09-26 16:51:26,"EU “트럼프 예고 의약품 100% 관세, 유럽엔 적용 안 돼” 자신",https://n.news.naver.com/mnews/article/025/0003472204?sid=104,"의약품·<b>반도체</b>·목재에 대한 관세는 15%를 넘지 않는다”고 상기시켰다. 길 대변인은 “EU 수출품에 대한... EU와 미국은 지난달 공동성명을 통해 “미국은 EU산 의약품, <b>반도체</b>, 목재에 부과되는 최혜국대우(MFN) 관세와... ","Sat, 27 Sep 2025 01:37:00 +0900"
2025-09-26 16:51:26,"[박근종 칼럼] 미래의 길목 선점하는 중국, 잠자는 '제조업 DNA' 일깨워 ...",https://www.mhns.co.kr/news/articleView.html?idxno=726554,소방준감) <b>반도체</b> 제조 기술이 중국으로 흘러 들어가는 것을 원천적으로 봉쇄하기 위한 미국 도널드 트럼프(Donald Trump) 정부의 대중(對中) 규제가 갈수록 거칠고 집요해지고 있다. 작년 말엔 인공지능(AI) <b>반도체</b>의... ,"Sat, 27 Sep 2025 01:36:00 +0900"
2025-09-26 16:51:26,"경기도, 상하이시와 우호 협력…600억 이차전지 설비 투자 유치",https://n.news.naver.com/mnews/article/353/0000053139?sid=102,"<b>반도체</b>·인공지능(AI) 클러스터 공동투자, 상호 대학 학술 교류, 청년 인적 교류 확대 등에도 뜻을 모았다. 궁정 시장은 교육 분야 협력과 관련해 아주대와 한양대를 예로 들며 “경기도에 명문대가 많고 상하이에도 29개... ","Sat, 27 Sep 2025 01:33:00 +0900"
2025-09-26 16:51:26,[미국증시 개장브리핑] 미국 증시 개장 직후 나스닥 <b>반도체</b>·제약 강세...,https://www.tokenpost.kr/news/market/289596,"오늘 나스닥 종합지수는 0.12% 상승한 22,411.54에 거래되며, <b>반도체</b>와 제약주가 상승을 주도하고 있다. 강세 섹터 분석 <b>반도체</b> 주식은 미국 정부의 해외 의존도 축소 발표에 힘입어 상승세를 나타내고 있다. 제약... ","Sat, 27 Sep 2025 01:32:00 +0900"
2025-09-26 16:51:26,李 “합리성” 거론 다음날 트럼프 “현금 선불”… 압박 수위 높이는 ...,https://n.news.naver.com/mnews/article/023/0003931695?sid=101,우리 정부는 7월 말 한미 관세 협상에서 의약품·<b>반도체</b> 품목에서 최혜국 대우를 보장받기로 구두로... 일본은 의약품·<b>반도체</b> 관세에서 최혜국 대우를 보장받는 것으로 미국과 합의하고 명문화도 마쳤다. 미국의 관세... ,"Sat, 27 Sep 2025 01:00:00 +0900"
2025-09-26 16:51:26,"美 스타트업 투자, AI·헬스케어가 싹쓸이…최대 4억 달러 유치",https://www.tokenpost.kr/news/tech/289587,"AI 프로세서 칩을 개발하는 임파워 <b>반도체</b>(Empower Semiconductor)도 1억 4,000만 달러(약 2,016억 원)의 시리즈 D 투자 라운드를 마무리했다. 이 회사는 에너지 효율 설계를 통해 데이터센터 내 AI 시스템의 성능을... ","Sat, 27 Sep 2025 00:58:00 +0900"
2025-09-26 16:51:26,오픈AI '스타게이트' 세운다… 엔비디아·오라클·트럼프까지 AI 전쟁 본...,https://www.tokenpost.kr/news/ai/289586,"인텔(INTC)이 애플(AAPL)과 신규 <b>반도체</b> 협력을 두고 물밑 접촉 중이라는 보도도 나왔으며, 오픈AI의 데이터센터 수요 폭증에 발맞춰 TSMC 등 파운드리 업체들도 긴밀히 관련돼 있다는 분석이 제기된다. 이번 주는 AI와... ","Sat, 27 Sep 2025 00:56:00 +0900"
2025-09-26 16:51:26,규제 중심 환경부가 산업정책 핵심인 에너지 총괄… “물과 기름 섞었다...,https://n.news.naver.com/mnews/article/023/0003931687?sid=102,"정부 안팎에선 이 같은 인식이 AI(인공 지능) 산업을 비롯해 데이터센터, <b>반도체</b> 클러스터 조성 등에 악영향을 미칠 것이란 비판도 제기된다. 이런 사업은 막대한 전력을 필요로 하는데, 가격이 더 비싼 재생에너지 확대로... ","Sat, 27 Sep 2025 00:54:00 +0900"
2025-09-26 16:51:26,"“美서 <b>반도체</b> 100개 만들면, 100개 무관세 수입 혜택”",https://n.news.naver.com/mnews/article/023/0003931664?sid=105,트럼프 ‘생산·수입 1대1 관세’ 시사 미국 정부가 <b>반도체</b> 기업이 미국 바깥에 있는 공장에서 수입한 <b>반도체</b> 물량이 미국 내에서 만든 <b>반도체</b> 물량을 초과할 경우 초과 물량에 대해 높은 관세를 부과하는 방안을 검토... ,"Sat, 27 Sep 2025 00:48:00 +0900"
2025-09-26 16:51:26,"[사설] 한·미 협상 파열음, 그래도 냉철함 잃지 않아야",https://n.news.naver.com/mnews/article/353/0000053118?sid=110,"제조업 르네상스를 주창하는 미국이 투자를 희망하는 산업은 <b>반도체</b>, 조선, 원전, 사회간접자본(SOC) 등이다. 한·일 외엔 대안이 없는 게 현실이다. 미·중 간 연간 군함 건조 능력이 약 200배 차이(미 해군 정보국 분석)... ","Sat, 27 Sep 2025 00:35:00 +0900"
2025-09-26 16:51:26,"[사설] 한·미 협상 파열음, 그래도 냉철함 잃지 않아야",https://n.news.naver.com/mnews/article/025/0003472202?sid=110,"제조업 르네상스를 주창하는 미국이 투자를 희망하는 산업은 <b>반도체</b>, 조선, 원전, 사회간접자본(SOC) 등이다. 한·일 외엔 대안이 없는 게 현실이다. 미·중 간 연간 군함 건조 능력이 약 200배 차이(미 해군 정보국 분석)... ","Sat, 27 Sep 2025 00:34:00 +0900"
2025-09-26 16:51:26,"[현장] 성균관대학교EMBA SM포럼 세미나, 강정수 대표 &quot;AI 경제, 비즈니...",https://www.megaeconomy.co.kr/news/newsview.php?ncode=1065539088650849,"강 센터장이 강조하는 사안은 AI 인프라(<b>반도체</b>·데이터센터·전력 수요)는 서비스와 애플리케이션에서 창출될 것으로 내다봤다. 특히 가격이 빠르게 하락하면서 AI 서비스가 대중 시장으로 확산 중이며, 이는 본격적인... ","Sat, 27 Sep 2025 00:26:00 +0900"
2025-09-26 16:51:26,전략적 韓日 연대 가능성 크다!,http://www.newstown.co.kr/news/articleView.html?idxno=654151,최태원 SK그룹 회장은 22일 요미우리신문과의 인터뷰에서 한일 간 AI와 <b>반도체</b> 협력을 예로 들면서 &quot;EU와 같은... 두 나라는 최 회장이 지적한 AI와 <b>반도체</b> 외에도 ▶북극항로 공동 개척 ▶대한해협 해저터널 건설... ,"Sat, 27 Sep 2025 00:19:00 +0900"
2025-09-26 16:51:26,"노타 공모주, 10월 수요예측·일반청약·희망 공모가는?",https://www.gukjenews.com/news/articleView.html?idxno=3388965,"엔비디아, 삼성전자, 암(Arm), 퀄컴, 소니, 르네사스 등 글로벌 AI <b>반도체</b> 선도 기업과 협업한 바 있다. 아울러 국내 최초로 상용화에 성공한 생성형 AI 기반 지능형 영상 관제 솔루션 '노타 비전 에이전트(NVA)'를... ","Sat, 27 Sep 2025 00:16:00 +0900"
2025-09-26 16:51:26,"전기차 관련주, '함박웃음' 네오티스·삼기에너지솔루션즈... '눈물이 주...",http://www.finomy.com/news/articleView.html?idxno=239973,"아이에이는 중국 합작법인을 세워 전력<b>반도체</b>에 생산에 힘쓰고 있다. 최근 중국 내 전력<b>반도체</b> 수요 증가로 공급량이 늘고 있다. 아이에이는 자동차 전장 분야를 중심으로 <b>반도체</b> 및 모듈, 제어기 사업을 전개하고... ","Sat, 27 Sep 2025 00:10:00 +0900"
2025-09-26 16:51:26,"양자암호·양자컴퓨팅 관련주, '봄날의 햇살' 포톤·라닉스... '먹구름' ...",http://www.finomy.com/news/articleView.html?idxno=239971,국내 통신보안 <b>반도체</b> 및 헬스케어 전문기업 라닉스가 수사 현장에서 활용할 수 있는 차세대 마약... 라닉스는 원래 차량용 통신 <b>반도체</b> 분야의 전문기업으로 잘 알려져 있다. 고성능 차량의 고속 통신을 위한 전용... ,"Sat, 27 Sep 2025 00:06:00 +0900"
2025-09-26 16:51:26,"경기도 용인 '고진역 대광로제비앙' 미분양 아파트, 선착순 분양...계약...",https://www.ksilbo.co.kr/news/articleView.html?idxno=1037968,- <b>반도체</b> 산업 배후 단지로 주목 '용인 고진역 대광로제비앙'은 삼성전자의 '용인 첨단시스템 <b>반도체</b> 국가산단'과 SK하이닉스의 '용인 <b>반도체</b> 클러스터'와 가까워 배후 주거 단지로 주목받고 있다. 차량으로 각각 10분대... ,"Sat, 27 Sep 2025 00:06:00 +0900"
2025-09-26 16:51:26,"미국 뉴욕증시 장초반, PCE 인라인에 혼조…테슬라↑ 엔비디아↓",https://www.topstarnews.net/news/articleView.html?idxno=15821130,"특히 <b>반도체</b>의 국내 생산과 수입 물량을 1대1로 맞추지 못하면 추가 관세를 부과하는 방안을 검토 중이라는 소식이 전해지며, <b>반도체</b> 체인에 압박이 걸린다. 실제로 ST마이크로일렉트로닉스는 약 3% 밀리고 TSMC도 2... ","Sat, 27 Sep 2025 00:06:00 +0900"
2025-09-26 16:51:26,"“진취적인 사람 필요, 샌님은 안 돼”",https://n.news.naver.com/mnews/article/353/0000053106?sid=102,"수출 산업 중심으로 조선이면 조선, 자동차면 자동차, <b>반도체</b>면 <b>반도체</b>, 각 분야에서 세계 최고가 되도록 노력해야 한다.” 이는 시작이었다. 정 회장은 이후 사장단회의 내내 연구인력 확보를 독려했다. “대외 여건이... ","Sat, 27 Sep 2025 00:04:00 +0900"
2025-09-26 16:51:26,"日, '희토류 공급망, 탈중국' 위해 남미· 아프리카 손잡아",https://www.theguru.co.kr/news/article.html?no=92299,"이시바 시게루 총리와 나렌드라 모디 총리는 지난달 말 희토류 광물과 AI, <b>반도체</b> 등 분야에 10년간 10조엔(약 94조원)을 투자하기로 합의했다. 일본은 세계 3위 구리 생산국인 페루와의 협력도 지속해서 강화하고 있다.... ","Sat, 27 Sep 2025 00:02:00 +0900"
2025-09-26 16:51:26,"걷다가 'OO' 밟은 여성, 5일 만에 숨져...뭐길래?",https://n.news.naver.com/mnews/article/119/0003008070?sid=104,"'뼈 녹이는 물질' 불산 강한 부식성을 가진 위험한 화학물질인 불산은 <b>반도체</b> 세정, 금속 가공 등 산업 현장에서 널리 쓰인다. 하지만 인체에 닿을 경우 피부나 점막을 깊게 손상시키고, 심한 경우 뼈까지 파괴할 수 있다.... ","Sat, 27 Sep 2025 00:00:00 +0900"
2025-09-26 16:51:26,[강천석 칼럼] 미국과 전쟁했던 나라만 아는 미국의 다른 얼굴,https://n.news.naver.com/mnews/article/023/0003931609?sid=110,미국은 1985년 엔(円)화 가치를 두 배로 올려 일본 수출의 허리를 부러뜨렸고 미·일 <b>반도체</b> 협정으로 일본 <b>반도체</b> 산업을 몰락시켰다. 독일과 일본에서 ‘반미자주(反美自主)’ 시위는 구경하기 어렵다. 한국은 미국의... ,"Fri, 26 Sep 2025 23:56:00 +0900"
2025-09-26 16:51:26,"뉴욕증시, PCE 소화하며 상승 출발",https://n.news.naver.com/mnews/article/001/0015652057?sid=101,특히 도널드 트럼프 행정부가 국내에서 생산하는 <b>반도체</b> 수량과 수입량을 1대1 비율로 맞추도록 미국 <b>반도체</b> 업계 경영진에 요구했으며 이를 충족하지 못할 경우 추가 관세를 부과한다는 방안을 마련 중인... ,"Fri, 26 Sep 2025 23:52:00 +0900"
2025-09-26 16:51:26,"아산시, 3200억 규모 AI데이터센터 구축 본격 추진…“도시 경쟁력 강화...",http://www.sisanews24.co.kr/16840,"시는 데이터센터가 가동되면 지역 주력 산업인 자동차·디스플레이·<b>반도체</b>와의 융합을 통한 제조혁신은 물론, 양질의 일자리 창출과 지역경제 활성화에 크게 기여할 것으로 기대하고 있다. 손태영 메타인프라... ","Fri, 26 Sep 2025 23:46:00 +0900"
2025-09-26 16:51:26,충남도 ‘베이밸리 국제 심포지엄’ 개최,https://m.skyedaily.com/news_view.html?ID=286529,김태흠 지사는 “아산만 일대는 동북아 경제벨트의 핵심이 될 잠재력을 갖고 있다”며 “<b>반도체</b>... 구축하고 <b>반도체</b> 후공정 국가첨단전략산업 특화단지 지정을 강하게 추진하겠다”라고 강조했다. 이와 함께... ,"Fri, 26 Sep 2025 23:46:00 +0900"
2025-09-26 16:51:26,의약품에도 100% 관세…‘최혜국 대우’ 어찌되나,https://n.news.naver.com/mnews/article/056/0012037982?sid=101,"<b>반도체</b> 관세 발표도 예고돼 있는데, 한미가 구두로 합의한 '최혜국 대우'가 보장되지 않으면 우리 기업들... 아직 전체 수출을 견인하고 있는 <b>반도체</b> 역시 자동차 25%보다 높은 관세가 예고돼 있습니다. [트럼프/미 대통령... ","Fri, 26 Sep 2025 23:36:00 +0900"
2025-09-26 16:51:26,"'속도 2.5배↑ 비용 절반' 스퀴즈비츠, 생성형 AI API 서비스 '예터' 출시",https://n.news.naver.com/mnews/article/014/0005413001?sid=105,"또한 다양한 AI <b>반도체</b> 환경을 폭넓게 지원한다는 점도 타사와 차별된다. GPU는 물론 최신 NPU에서도 동일한 API 환경을 제공해, 고객사가 특정 하드웨어에 얽매이지 않고 최적의 성능을 활용할 수 있도록 했다. 현재... ","Fri, 26 Sep 2025 23:18:00 +0900"
2025-09-26 16:51:26,일본 이어 대만까지 ‘인텔 일병 구하기’…TSMC에도 구조요청,https://n.news.naver.com/mnews/article/009/0005565776?sid=101,"WSJ “인텔, 지분투자 요청” 보도 엔비디아 이어 TSMC 참여땐 지각변동 위기에 빠진 미국 <b>반도체</b> 업체 인텔이 세계 1위 파운드리인 대만 TSMC에 투자를 요청하면서 <b>반도체</b> 시장 구도가 급변하고 있다. 25일(현지시간)... ","Fri, 26 Sep 2025 23:14:00 +0900"
2025-09-26 16:51:26,"AI 거품론에 대미협상 난항까지…제동걸린 코스피, 조정 길어지나요?",https://n.news.naver.com/mnews/article/009/0005565775?sid=101,원화값 폭락 등 악재 겹치고 외인 <b>반도체</b> 집중매수 주춤 하루만에 2.45% 큰폭 하락 파죽지세로 3500 선을... 원화값 하락과 함께 인공지능(AI) 거품론이 나오며 그동안 <b>반도체</b> 업종을 집중 매수하던 외국인 투자자가... ,"Fri, 26 Sep 2025 23:14:00 +0900"
2025-09-26 16:51:26,[인사] 대전시,https://www.ggilbo.com/news/articleView.html?idxno=1115773,"권순범 △<b>반도체</b>바이오산업과 이도원 △운영지원과 김태현 △정보화정책과 이수아 △문화유산과 조유선 △노인복지과 김유나 △장애인복지과 민희정 △수질개선과 류정아, 류하림 △산림녹지정책과 김준섭... ","Fri, 26 Sep 2025 23:06:00 +0900"
2025-09-26 16:51:26,[신간] AI 혁명을 이끈 천재들...&quot;AI를 만든 천재들의 생각을 따라가는 ...,http://www.newsroad.co.kr/news/articleView.html?idxno=46495,"이 책은 인물 중심으로 이야기를 풀어내며, 딥러닝·강화학습·챗GPT·AI <b>반도체</b> 등 난해한 개념들을 '누가, 왜, 어떻게' 만들어냈는지를 통해 쉽게 설명한다. 책 속에는 힌튼 교수가 GPU를 처음 인공지능 학습에 도입하게... ","Fri, 26 Sep 2025 22:54:00 +0900"
2025-09-26 16:51:26,미국 뉴욕증시 장초반 상승…나스닥·테슬라↑ 엔비디아↓,https://www.topstarnews.net/news/articleView.html?idxno=15821078,"둘째, <b>반도체</b> 체인의 경우, 브로드컴 보관 확대가 관찰되지만, 오늘 장초반에는 브로드컴이 335.41달러로 0.21% 하락하고, SOXL로 대표되는 <b>반도체</b> 레버리지 ETF도 33.75달러로 0.3% 내리며, 단기 조정의 꼬리를 아직 떼지... ","Fri, 26 Sep 2025 22:50:00 +0900"
2025-09-26 16:51:26,"트럼프 '100% 의약품 관세' 충격…아시아 제약주 급락, 유럽은 '미미'",https://www.newspim.com/news/view/20250926001029,"◆ EU, '15% 상한' 협정으로 방어막 유럽연합(EU)은 올여름 미국과 체결한 무역 협정을 통해 EU산 의약품·<b>반도체</b>·목재에 부과되는 관세율이 15%를 넘지 않도록 보장받았다. EU 집행위는 성명을 통해 &quot;유럽은 유일하게... ","Fri, 26 Sep 2025 22:43:00 +0900"
2025-09-26 16:51:26,"뉴욕증시 개장 전 특징주...트럼프 관세 여파에 트럭·제약주 강세, 가구...",https://www.newspim.com/news/view/20250926001009,"파카와 인텔, 제약주는 각각 관세 수혜와 투자 협상 소식에 급등했지만, 가구주와 <b>반도체</b>주는 약세를... ◆ <b>반도체</b>주 약세: ST마이크로일렉트로닉스(EPA:STM) / 마벨 테크놀로지(NASDAQ:MRVL) / TSMC(TSM) / 테라다인... ","Fri, 26 Sep 2025 22:31:00 +0900"
2025-09-26 16:51:26,트럼프 '의약품 100% 관세' 예고…EU는 피해 면했지만 한국 제약업계 긴...,https://www.abcn.kr/news/articleView.html?idxno=82924,"한국산 의약품과 <b>반도체</b>, 목재 등 주요 수출품이 미국의 고율 관세 압박에 노출될 가능성이 제기된다.... 지난달 발표된 미·EU 공동성명에는 유럽산 의약품·<b>반도체</b>·목재에 대해 최혜국대우(MFN) 관세와 무역확장법 232조... ","Fri, 26 Sep 2025 22:20:00 +0900"
2025-09-26 16:51:26,산책 중 ‘이것’ 밟았다 닷새 만에 사망…피부 뚫고 뼈까지 손상시키는...,https://n.news.naver.com/mnews/article/296/0000093335?sid=103,<b>반도체</b> 공정에서는 실리콘 웨이퍼의 불순물을 제거하는 데 활용된다. 그만큼 독성이 강하다. 인체에... 국내 <b>반도체</b> 공장에서 불산이 누출돼 발생해 인명이 희생된 사고가 몇 차례 발생한 바 있다. 중국에서는 농도 30... ,"Fri, 26 Sep 2025 22:06:00 +0900"
2025-09-26 16:51:26,유니스트 ‘창의 설계 축전’ 내일까지 열려,https://n.news.naver.com/mnews/article/056/0012037955?sid=102,"이번 축전에는 인공지능과 재생에너지, <b>반도체</b> 등 과학 전시와 연구 성과를 체험하는 공간을 마련하고 울산지역 중·고교 학생들의 창작물도 전시됩니다. 또, 이세돌, 이지영 유니스트 특임교수와 인기 유튜버 정재형의... ","Fri, 26 Sep 2025 22:00:00 +0900"
2025-09-26 16:51:26,'베이밸리' 글로벌 도약 선언…초광역 혁신 전략 본격화,https://www.bzeronews.com/news/articleView.html?idxno=801968,"김 지사는 개회사를 통해 &quot;아산만은 <b>반도체</b>·디스플레이·수소 등 미래 산업과 자동차·석유화학 등 주력... 이어 &quot;자율주행 모빌리티와 AI 산업 기반을 강화하고 <b>반도체</b> 후공정 특화단지 지정, 무기발광 디스플레이... ","Fri, 26 Sep 2025 22:00:00 +0900"
2025-09-26 16:51:26,"경북도의회 기획경제위, 구미 산업·연구기관 현장 점검 실시",http://www.metroseoul.co.kr/article/20250925500775,"이어 구미전자정보기술원(GERI)을 방문해 <b>반도체</b>·전자산업 신기술 개발과 강소기업 육성 전략을 청취했다. 기술원이 구미시 출연기관임에도 경북도의 수탁사업을 다수 수행하고 있는 만큼, 경북 전체 발전을 위해 보다... ","Fri, 26 Sep 2025 21:58:00 +0900"
2025-09-26 16:51:26,"구미시, 항공·방위·물류기업 대상 투자환경 설명회 개최",http://www.metroseoul.co.kr/article/20250925500779,"또한 <b>반도체</b> 특화단지, 방산혁신클러스터, 기회발전특구 지정으로 인한 세제 혜택과 규제 완화, 다양한 기업 지원 정책 등을 통해 타 지역과 차별화된 투자 경쟁력을 확보했음을 강조했다. 설명회는 기업 지원 정책 발표... ","Fri, 26 Sep 2025 21:58:00 +0900"
2025-09-26 16:51:26,"대구 달성군, 시교육청·대구과학기술원·대구공고와 디지털 기술 인재...",https://www.sisamagazine.co.kr/news/articleView.html?idxno=518547,"'AI모빌리티과'의 주요 교육과정으로는 프로그래밍, 기계소프트웨어 개발, <b>반도체</b> 장비, 빅데이터 분석, 자율주행 시스템 제작 등이 있다. 대구경북과학기술원 연구진은 특강, 실습, 멘토링, 캡스톤 디자인 프로젝트, 자율... ","Fri, 26 Sep 2025 21:53:00 +0900"
2025-09-26 16:51:26,"‘초광역 혁신’과 ‘첨단 산업’ 결집…베이밸리, ‘세계 경제허브’...",https://cc.newdaily.co.kr/site/data/html/2025/09/26/2025092600396.html,김 지사는 “아산만은 <b>반도체</b>·디스플레이·수소 경제와 자동차·석유화학 산업이 집적된 경제의 심장부”... 이어 “자율주행 모빌리티와 AI 산업 기반을 강화하고 <b>반도체</b> 후공정 국가첨단전략산업 특화단지 지정... ,"Fri, 26 Sep 2025 21:52:00 +0900"
2025-09-26 16:51:26,"KOTRA, AI 생태계 글로벌화 지원 위해 중동 국가들과 협력",https://www.newscj.com/news/articleView.html?idxno=3322548,사우디 국영 석유기업 아람코(Aramco)도 디지털 전환을 담당하는 자회사인 아람코 디지털(Aramco Digital)을 통해 지난 2024년부터 우리 AI <b>반도체</b> 기업과 기술 협력을 진행 중이다. 26일 '한-사우디 AI 미래협력... ,"Fri, 26 Sep 2025 21:52:00 +0900"
2025-09-26 16:51:26,트럼프 &quot;일부 의약품·대형 트럭에 관세&quot;...<b>반도체</b> 임박?,https://n.news.naver.com/mnews/article/052/0002252530?sid=104,"의약품 관세가 공식적으로 발표된 만큼, 지난 4월 함께 조사에 들어간 <b>반도체</b> 관세도 조만간 발표될 가능성이 크다는 관측이 나오고 있습니다. YTN 유투권입니다. 영상편집 : 임현철","Fri, 26 Sep 2025 21:52:00 +0900"
2025-09-26 16:51:26,2년간 60억 불린 아흔살 슈퍼개미…“재산 80% 날려도 이 원칙 지켜”,https://n.news.naver.com/mnews/article/009/0005565760?sid=102,실제로 후지모토 씨는 평소 좋아하는 자동차·<b>반도체</b> 위주로 80여 개 종목을 트레이딩하고 있다. 이는 ‘가치투자의 전설’ 버핏의 투자 원칙과도 맞닿아 있다. 버핏 역시 ①내재가치가 높고 ②잘 아는 분야 위주로... ,"Fri, 26 Sep 2025 21:51:00 +0900"
2025-09-26 16:51:26,"인하대, 제조혁신 리더스 포럼 2025 성황리 개최",https://www.kmaeil.com/news/articleView.html?idxno=611494,"박재현 인하대 지역지능화혁신인재양성사업단장의 개회사를 시작으로 인하대 조명우 총장, 백성현 교학부총장과 조소영 인천시 <b>반도체</b>바이오과장의 축사가 이어지면서 산·학·관 협력의 의미를 더했다. 포럼 세션은... ","Fri, 26 Sep 2025 21:48:00 +0900"
2025-09-26 16:51:26,체감경기 반짝 상승세… 내수 부진과 관세 불확실성 ‘먹구름’,https://n.news.naver.com/mnews/article/123/0002369033?sid=101,<b>반도체</b> 수출이 호조를 보이며 제조업 경기가 소폭 개선됐고 명절 소비와 민생회복 소비쿠폰 효과로... 한국은행 경제통계1국 경제심리조사팀 이혜영 팀장은 &quot;<b>반도체</b> 수출 호조가 기업심리를 이끌었지만 관세 협상... ,"Fri, 26 Sep 2025 21:47:00 +0900"
