DateTime,Title,Link,Description,PubDate
2025-09-30 11:47:50,"“데이터로 배우는 로봇, 산업은 갈라진다”...휴머노이드 앞의 세 문턱...",https://www.hellot.net/news/article.html?no=105951,"삼성전자가 전자·가전·<b>반도체</b>·물류 등 다각적 사업군을 보유한 만큼, 이러한 단계적 상용화 과정에서... 전자·가전·<b>반도체</b>·물류·건설·바이오 등 다각 사업군은 로봇 연구에 필요한 핵심 부품 기술, 대규모... ","Tue, 30 Sep 2025 20:42:00 +0900"
2025-09-30 11:47:50,"&quot;미래에셋벤처투자, 세미파이브 상장 기대감에 순익·배당 확대 전망&quot; -...",http://www.biztribune.co.kr/news/articleView.html?idxno=341117,그는 &quot;지난 7월 <b>반도체</b> 디자인하우스 세미파이브가 상장 예비심사 청구서를 제출했다. 예비심사는 통상 2~3개월이 소요되므로 올해 하반기 내 상장이 가능할 것으로 보인다. 이에 따라 세미파이브 관련 평가차익이... ,"Tue, 30 Sep 2025 20:40:00 +0900"
2025-09-30 11:47:50,"달서구 청년창업지원센터, 청년창업 해커톤 경진대회 성료",https://www.ksmnews.co.kr/news/view.php?idx=567215,"최우수상은 플라스트의 시스템<b>반도체</b> 공정 활성화를 위한 모듈형 통합 진공 플라즈마 솔루션, 우수상은 윈더즈의 AI 기반 중고의류 위탁 판매 플랫폼 ‘리웨어’가 각각 수상했다. 장려상은 퀵실버의 시니어 생활심부름... ","Tue, 30 Sep 2025 20:36:00 +0900"
2025-09-30 11:47:50,2나노 장비투자도 대만이 韓 추월 … 파운드리 격차 더 벌어지나,https://n.news.naver.com/mnews/article/009/0005567684?sid=101,"대만, <b>반도체</b>는 주40시간 예외 韓, 근로시간·환경규제 발목 대만 TSMC가 2나노(㎚) 제품을 양산하기 위해... 이곳에서는 엔비디아, 애플, AMD, 퀄컴 등 빅테크 기업들이 주문한 미세공정 <b>반도체</b>가 올해 하반기부터... ","Tue, 30 Sep 2025 20:35:00 +0900"
2025-09-30 11:47:50,"고려아연, 전략광물 게르마늄 생산공장 신설 속도",https://www.ulsanpress.net/news/articleView.html?idxno=560186,"이번 방문은 온산제련소의 게르마늄 공장 신설 준비 현황을 점검하고, 전략광물 및 귀금속, <b>반도체</b> 황산 등 생산 현장의 애로사항 등을 청취하기 위해 이뤄졌다. 고려아연이 신규 생산을 추진하고 있는 게르마늄은... ","Tue, 30 Sep 2025 20:32:00 +0900"
2025-09-30 11:47:50,"한국공학대-한국기술교육대-한국핵융합에너지硏, 공동연구·인재양성 협...",http://www.kyosu.net/news/articleView.html?idxno=145473,"이를 통해 바이오소재 <b>반도체</b> 분야 연구개발은 물론, 플라즈마 활용 기반의 융합연구가 활발히 전개될... * '5T'는 <b>반도체</b>(Semiconductor), 소재(Material), 바이오(Bio), 탄소(Carbon), 에너지(Energy) 등 특정 산업 기술 분야 5가지를... ","Tue, 30 Sep 2025 20:30:00 +0900"
2025-09-30 11:47:50,"[뉴스하이킥] 하정우 &quot;韓, 美中과 경쟁해 AI 3강 가능.. AI에선 日도 연...",https://n.news.naver.com/mnews/article/214/0001452695?sid=100,"아래로는 에너지부터 시작해서 데이터센터, <b>반도체</b>, 그리고 AI 만드는 기술, 그리고 활용하는 부분까지... 아까 말씀드렸던 것처럼 <b>반도체</b>, 데이터 센터, 기술 그리고 활용하는 능력 전체를 다 할 수 있는 몇 안 되는... ","Tue, 30 Sep 2025 20:29:00 +0900"
2025-09-30 11:47:50,AI 스타트업 붐의 그늘… 클라우드 요금 폭탄에 '수익성 쇼크',https://www.tokenpost.kr/news/ai/290459,"특히 엔비디아(NVDA)의 고성능 <b>반도체</b>, 구글(GOOGL)과 아마존(AAPL)의 클라우드 GPU, 오픈AI(OpenAI) 및 앤스로픽(Anthropic)과 같은 모델 제공사의 가격 정책 변화가 창업 생태계의 지속 가능성을 위협하고 있다. 이에 대해... ","Tue, 30 Sep 2025 20:22:00 +0900"
2025-09-30 11:47:50,"충북도, '지능형<b>반도체</b>·IT 소부장 지원센터' 개소",http://www.cctimes.kr/news/articleView.html?idxno=869042,"충북도는 30일 청주시 흥덕구 봉명동 일원에서 미래 <b>반도체</b> 소부장 산업의 거점역할을 수행할 '지능형<b>반도체</b>·IT 소부장 지원센터' 개소식을 열었다. 센터는 214억원을 들여 지상 3층, 연면적 1110㎡ 규모로 건립됐다.... ","Tue, 30 Sep 2025 20:20:00 +0900"
2025-09-30 11:47:50,"부산에서는 정상회담, 도쿄에서는 '한·일 무역진흥기관' 회의",https://www.dongponews.net/news/articleView.html?idxno=54125,"산업구조 전환기, 미래산업 협력 확대 방안에서 KOTRA는 <b>반도체</b>, 자동차, 조선 등 주요 산업 분야에서의... 양 기관은 각 산업에서 양국 기업의 강점을 연계할 수 있는 구조적 접점을 모색하고, AI·수소·<b>반도체</b> 등... ","Tue, 30 Sep 2025 20:20:00 +0900"
2025-09-30 11:47:50,해외에 공장 짓는 충북 기업들 … 脫한국 왜?,http://www.cctimes.kr/news/articleView.html?idxno=869026,"지역경제 관계자는 &quot;충북의 핵심산업인 이차전지가 캐즘(일시적 수요정체) 극복을 위해 해외투자를 늘리고 있고 <b>반도체</b>, 바이오 등 다른 분야도 해외로 눈을 돌리고 있다&quot;며 &quot;당장은 아니지만 탈한국 현상이 지속되면... ","Tue, 30 Sep 2025 20:20:00 +0900"
2025-09-30 11:47:50,[미리 보는 이데일리 신문] 노봉법發 분쟁 쓰나미…노동위는 일손 없어...,https://n.news.naver.com/mnews/article/018/0006129971?sid=102,"△MICE -20년새 2400배 커진 대만 마이스… AI·<b>반도체</b> 연계 ‘아시아 허브’ 꿈 -“혁신은 투자에서 싹터… 도전에 과감하게 베팅해야” -“대만 방문 3일전, 온라인 입국신고하세요” △이데일리가 만났습니다 -상법 개정... ","Tue, 30 Sep 2025 20:11:00 +0900"
2025-09-30 11:47:50,"“자율주행에 방산드론”…모빌리티 스타트업, ‘AI 바람’ 타고 상장 ...",https://n.news.naver.com/mnews/article/029/0002985388?sid=105,"IPO 시장은 2023년 데이터센터 <b>반도체</b> 기업 파두의 ‘뻥튀기 상장’ 이후 심사 기준이 까다로워진 것으로 알려졌다. 이전에는 기술력 검증이 핵심이었다면, 현재는 확실한 기술력과 함께 사업성과, 매출 규모 등 재무... ","Tue, 30 Sep 2025 20:07:00 +0900"
2025-09-30 11:47:50,[여기는 충주] 중원진미 첫 수확…“충주 주력 벼 품종으로”,https://n.news.naver.com/mnews/article/056/0012039921?sid=101,"특히 충청북도, 충북에너지산학융합원과 협업해 <b>반도체</b> 일자리 사업을 추진하면서 지역 투자기업의 성공적인 안착을 돕고 청년 일자리 창출을 지원한 점이 높은 평가를 받았습니다. 지금까지 충주에서 전해드렸습니다.... ","Tue, 30 Sep 2025 20:05:00 +0900"
2025-09-30 11:47:50,"광주, 도시형 AX 실증·제조AI 테스트 베드로",http://www.kwangju.co.kr/article.php?aid=1759230000790059277,"또한 K-<b>반도체</b>벨트 등 권역 전략산업과의 연계를 통해 제조 공정의 디지털 전환(AX)을 가속한다. AI 특화 계약학과·부트캠프 확대로 인재 파이프라인을 강화하고, 광주과기원과 전남대 등 지역 연구역량을 결집해 글로벌... ","Tue, 30 Sep 2025 20:04:00 +0900"
2025-09-30 11:47:50,"구미시, 지역현안 해결·국비 확보 위해 국회의원 간담회 개최",https://www.nspna.com/news/?mode=view&newsid=780173,주요 국비사업으로 △구미시 제조창업 인큐베이팅 센터 구축 △AX 실증산단 구축 사업 △지역 주력 중소기업형 인공지능 데이터 스페이스 구축 △차세대 디스플레이 핵심부품·소재 기술개발 △<b>반도체</b> 장비 챔버용... ,"Tue, 30 Sep 2025 20:04:00 +0900"
2025-09-30 11:47:50,[위험한 머니게임] KH그룹 유일 상장사 '빛과전자' 본업 대신 리조트에...,https://www.ajunews.com/view/20250930151646370,본업과 무관한 리조트 사업에 진출한 데 이어 2년 전 야심차게 인수했던 이차전지 검사장비 업체 한울<b>반도체</b>도 매각할 예정이다. 빛과전자는 한울<b>반도체</b> 지분 전량을 매각해 80억원의 실탄을 확보한다. 이 자금은... ,"Tue, 30 Sep 2025 20:02:00 +0900"
2025-09-30 11:47:50,"충북도, '25년 전국 지방자치단체 일자리대상 ‘대통령상’ 수상",http://www.breaknews.com/1151718,"2024년도 주요 성과로는 △<b>반도체</b> 투자 집적화 및 인력 양성 등 핵심 거점 클러스터 구축으로 1,274명의 고용 창출 △대·중소기업간 상생협력 확산을 통한 노동시장... ","Tue, 30 Sep 2025 20:00:00 +0900"
2025-09-30 11:47:50,"LS, '1조 투입' 새만금 배터리 전구체 공장 준공",https://n.news.naver.com/mnews/article/469/0000890211?sid=101,LS그룹은 전력·소재 등 기존 주력 산업을 강화하는 동시에 배·전·반(배터리·전기차·<b>반도체</b>) 관련 사업을 미래 성장 사업으로 낙점해 주력하고 있다. 구 회장은 &quot;전 세계 80%에 달하는 전구체 시장의 중국 의존도를... ,"Tue, 30 Sep 2025 20:00:00 +0900"
2025-09-30 11:47:50,&quot;압도적 수익률&quot;…<b>반도체</b> '투톱' 슈퍼사이클 맞았다,https://n.news.naver.com/mnews/article/215/0001225937?sid=101,글로벌 <b>반도체</b> 시장에 '메모리 슈퍼사이클'이 본격적으로 도래하면서 삼성전자와 SK하이닉스에 대한 실적... 증권가에서는 <b>반도체</b>주 상승세가 한동안 지속될 것이라는 전망을 내놓고 있다. 인공지능(AI) 인프라 투자... ,"Tue, 30 Sep 2025 20:00:00 +0900"
2025-09-30 11:47:50,"음성군, '25 전국 지자체 일자리대상‘최우수상’수상",http://www.breaknews.com/1151712,통한 <b>반도체</b> 일자리 사업 추진으로 지방 투자기업의 성공적 안착과 청년 일자리 창출을 지원한 점이 호평을 받았다. 또 일자리 핵심 지표라 할 수 있는 고용지표... ,"Tue, 30 Sep 2025 20:00:00 +0900"
2025-09-30 11:47:50,"코스피, 美 '셧다운' 경계감에 보합권 내 등락…3400선 하락 마감",https://www.thepublic.kr/news/articleView.html?idxno=278665,그러나 장중 1.6% 넘게 올랐던 필라델피아 <b>반도체</b>지수가 오후장에서 상승분을 대부분 반납하고 0.16% 상승으로 마감하는 등 셧다운을 앞두고 경계심리도 상존했다. 도널드 트럼프 미국 대통령은 같은 날... ,"Tue, 30 Sep 2025 19:56:00 +0900"
2025-09-30 11:47:50,﻿9월 DDR4 가격 6개월 연속 상승...6달러 돌파,http://www.thelec.kr/news/articleView.html?idxno=41684,인공지능(AI) 데이터센터 수요 급증으로 <b>반도체</b> 수퍼사이클이 재현될 것이라는 기대감이 나온다. 30일 시장조사업체 D램익스체인지에 따르면 PC용 D램 범용제품(DDR4 8Gb 1Gx8)의 9월 평균 고정거래가격은 6.... ,"Tue, 30 Sep 2025 19:50:00 +0900"
2025-09-30 11:47:50,"[이왕휘의 세계는 지금] 한미 관세협상, 동맹 강화 차원서 접근을",https://n.news.naver.com/mnews/article/666/0000084580?sid=110,"군사 동맹은 한반도의 평화 정착 및 비핵화, 경제 동맹은 미국 최고의 ‘그린필드 투자국’, 첨단기술 동맹은 조선, 인공지능(AI), <b>반도체</b>, 퀀텀, 원자력 협력을 각각 추구한다. 대미 투자는 경제 동맹을 구축하는 하나의... ","Tue, 30 Sep 2025 19:50:00 +0900"
2025-09-30 11:47:50,D램 가격 상승세…범용 DDR4 6달러 넘었다,https://n.news.naver.com/mnews/article/215/0001225935?sid=101,메모리 <b>반도체</b> D램과 낸드 플래시의 월평균 가격이 6개월 연속 상승세를 이어가고 있다. 30일 시장조사업체 D램익스체인지에 따르면 9월 PC용 D램 범용 제품인 DDR4(8Gb 1Gx8)의 평균 고정거래가격이 전달 대비 10.5... ,"Tue, 30 Sep 2025 19:47:00 +0900"
2025-09-30 11:47:50,경주 APEC 정상회의 관련 시설 준공 잇따라,https://n.news.naver.com/mnews/article/056/0012039915?sid=101,"최근 경주엑스포대공원에는 연 면적 2천700㎡에 지상 1층 건물로 이차전지와 <b>반도체</b>, 자동차와 바이오 등 다양한 우리나라 첨단 산업 제품을 소개할 경제전시장이 준공됐습니다. 또 국립경주박물관 중앙 마당에는 APEC... ","Tue, 30 Sep 2025 19:45:00 +0900"
2025-09-30 11:47:50,"&quot;이억원 위원장·은행장 만남&quot;…금융당국·은행권, 생산적·포용적 금융...",http://www.bizwnews.com/news/articleView.html?idxno=112925,"이에 대해 간담회에 참석한 은행장들은 &quot;AI(인공지능), <b>반도체</b> 등 미래 전략 산업과 혁신 벤처기업 발굴에 적극 나서 생산적 금융을 뒷받침하겠다&quot;고 말했다. 또 &quot;자본규제 합리화가 이뤄진 만큼 적시에 맞는 적극적인 자금... ","Tue, 30 Sep 2025 19:44:00 +0900"
2025-09-30 11:47:50,"“‘AI 기본 사회’로 간다”…'AI 페스타 2025', G3 도약 청사진 공개",https://kidd.co.kr/news/243413,"코어존에서는 LLM·AI <b>반도체</b>·클라우드 등 핵심 기술과 독자 파운데이션 모델 성과를, 융합존에서는 제조... 이어 “생성형 AI, 소프트웨어, <b>반도체</b>, 인프라, 윤리·규제 등 AI 생태계 전반에서 논의가 이뤄지고, 국내... ","Tue, 30 Sep 2025 19:36:00 +0900"
2025-09-30 11:47:50,충북도 일자리 정책 '대통령상'…3년 연속 수상,https://www.ccdn.co.kr/news/articleView.html?idxno=1042611,△<b>반도체</b> 투자 집적화 등 핵심 거점 클러스터 구축으로 1천274명 고용 창출 △대·중소기업 간 상생 협력 확산을 통한 노동시장 여건 개선 △청년 인구 유입 △연간 합계율 출산율 0.88% 유지 등의 성과를 거뒀다. 올해는... ,"Tue, 30 Sep 2025 19:36:00 +0900"
2025-09-30 11:47:50,"충북, <b>반도체</b> 소부장 지원 허브 가동…'지능형<b>반도체</b>·IT 소부장 지원센...",https://www.ccdn.co.kr/news/articleView.html?idxno=1042618,충북 <b>반도체</b> 산업을 이끌어 나갈 원동력인 '지능형<b>반도체</b>·IT 소부장 지원센터'가 공식 가동했다. 충북도는 30일 청주시 봉명동 '지능형<b>반도체</b>·IT 소부장 지원센터' 개소식을 열고 <b>반도체</b> 소재·부품·장비(소부장)... ,"Tue, 30 Sep 2025 19:36:00 +0900"
2025-09-30 11:47:50,"폴리텍IV 대전, 신중년특화과정 수료식...전기기능사 필기 전원 합격",https://www.newspim.com/news/view/20250930001264,"한편 한국폴리텍Ⅳ대학 대전캠퍼스는 9개 학과(메타버스콘텐츠과, <b>반도체</b>융합기계과, <b>반도체</b>장비제어과, 산업설비과, 스마트소프트웨어과, 영상크리에이터과, 인공지능과, 전기전자제어과, 클라우드보안과)를 운영... ","Tue, 30 Sep 2025 19:30:00 +0900"
2025-09-30 11:47:50,범용 D램 가격 6달러 돌파…6년 8개월만,https://n.news.naver.com/mnews/article/016/0002537422?sid=105,[삼성전자 제공] [헤럴드경제=한영대 기자] 메모리 <b>반도체</b> D램과 낸드 플래시 가격이 상승세를 타고 있는 가운데 D램 범용 제품인 DDR4 가격이 6년 8개월만에 6달러를 넘어섰다. 30일 시장조사업체... ,"Tue, 30 Sep 2025 19:29:00 +0900"
2025-09-30 11:47:50,"김정관 장관, 차량용 <b>반도체</b> 팹리스 기업인 텔레칩스 현장방문",https://n.news.naver.com/mnews/article/003/0013516514?sid=100,"김정관 산업통상자원부 장관이 30일 오후 경기도 성남시에 소재한 차량용 <b>반도체</b> 설계 전문 팹리스 기업인 텔레칩스를 방문하여, 이장규 텔레칩스 대표이사로부터 운영현황 및 애로사항을 청취하고, 제품시연... ","Tue, 30 Sep 2025 19:25:00 +0900"
2025-09-30 11:47:50,"김정관 장관, 차량용 <b>반도체</b> 팹리스 기업인 텔레칩스 현장방문",https://n.news.naver.com/mnews/article/003/0013516513?sid=100,"김정관 산업통상자원부 장관이 30일 오후 경기도 성남시에 소재한 차량용 <b>반도체</b> 설계 전문 팹리스 기업인 텔레칩스를 방문하여, 이장규 텔레칩스 대표이사로부터 운영현황 및 애로사항을 청취하고, 제품시연... ","Tue, 30 Sep 2025 19:25:00 +0900"
2025-09-30 11:47:50,"김정관 장관, 차량용 <b>반도체</b> 팹리스 기업인 텔레칩스 현장방문",https://n.news.naver.com/mnews/article/003/0013516517?sid=100,"김정관 산업통상자원부 장관이 30일 오후 경기도 성남시에 소재한 차량용 <b>반도체</b> 설계 전문 팹리스 기업인 텔레칩스를 방문하여, 이장규 텔레칩스 대표이사로부터 운영현황 및 애로사항을 청취하고, 제품시연... ","Tue, 30 Sep 2025 19:25:00 +0900"
2025-09-30 11:47:50,"김정관 장관, 차량용 <b>반도체</b> 팹리스 기업인 텔레칩스 현장방문",https://n.news.naver.com/mnews/article/003/0013516515?sid=100,"김정관 산업통상자원부 장관이 30일 오후 경기도 성남시에 소재한 차량용 <b>반도체</b> 설계 전문 팹리스 기업인 텔레칩스를 방문하여, 이장규 텔레칩스 대표이사로부터 운영현황 및 애로사항을 청취하고, 제품시연... ","Tue, 30 Sep 2025 19:25:00 +0900"
2025-09-30 11:47:50,"김정관 장관, 차량용 <b>반도체</b> 팹리스 기업인 텔레칩스 현장방문",https://n.news.naver.com/mnews/article/003/0013516512?sid=100,"김정관 산업통상자원부 장관이 30일 오후 경기도 성남시에 소재한 차량용 <b>반도체</b> 설계 전문 팹리스 기업인 텔레칩스를 방문하여, 이장규 텔레칩스 대표이사로부터 운영현황 및 애로사항을 청취하고, 제품시연... ","Tue, 30 Sep 2025 19:25:00 +0900"
2025-09-30 11:47:50,청년이 곧 미래… 지역 정착 든든한 뒷받침,https://n.news.naver.com/mnews/article/656/0000149977?sid=004,"여기에 535만 평 규모의 우주산업클러스터, 나노·<b>반도체</b> 국가산단 등을 조성하려고 하면서 미래산업 육성을 통한 젊은 과학기술인들의 정착을 유도하고 있다. 무엇보다 대전 정착형 청년일자리 종합 프로젝트를... ","Tue, 30 Sep 2025 19:25:00 +0900"
2025-09-30 11:47:50,美상무장관 “대만과 <b>반도체</b> 생산 50% 미국 이전 논의중”,https://n.news.naver.com/mnews/article/018/0006129959?sid=101,그는 “대만이 <b>반도체</b> 생산의 95%를 쥐고 있다면 위기 발생 시 미국이 어디서 <b>반도체</b>를 조달해서 대만을 방어할 수 있겠느냐?”고 반문했다. 현재 미국의 첨단 칩 수요의 90~95%가 대만 TSMC 공장에 의존하고 있는 것으로... ,"Tue, 30 Sep 2025 19:23:00 +0900"
2025-09-30 11:47:50,<b>반도체</b> D램 가격 6개월 연속 상승…수퍼 사이클 기대감,https://n.news.naver.com/mnews/article/374/0000466632?sid=101,메모리 <b>반도체</b> D램과 낸드 플래시의 월평균 가격이 6개월 연속 상승세를 이어간 가운데 범용 제품인 DDR4 가격도 6달러를 넘어선 것으로 나타났습니다. 또 지난달 소폭 상승세를 기록하는 데 그쳤던 낸드플래시... ,"Tue, 30 Sep 2025 19:23:00 +0900"
2025-09-30 11:47:50,충북 지능형<b>반도체</b>·IT 소부장 지원센터 개소,https://www.ccdailynews.com/news/articleView.html?idxno=2371350,충북도는 지난 30일 <b>반도체</b> 관련 소재·부품·장비 연구개발을 위한 '지능형<b>반도체</b>·IT 소부장 지원센터'가 청주산업단지에 문을 열었다고 밝혔다. 센터는 2023년 산업통상자원부 스마트그린 산단 촉진 공모사업에... ,"Tue, 30 Sep 2025 19:20:00 +0900"
2025-09-30 11:47:50,한국공학대-한국기술교육대-한국핵융합에너지硏 공동연구/인재양성 협...,http://www.veritas-a.com/news/articleView.html?idxno=575441,"이를 통해 바이오소재 <b>반도체</b> 분야 연구개발은 물론, 플라즈마 활용 기반의 융합연구가 활발히 전개될... * '5T'는 <b>반도체</b>(Semiconductor), 소재(Material), 바이오(Bio), 탄소(Carbon), 에너지(Energy) 등 특정 산업 기술 분야 5가지를... ","Tue, 30 Sep 2025 19:20:00 +0900"
2025-09-30 11:47:50,범용 D램 가격 6달러 넘었다…이례적 6달 연속 두 자릿수 상승,https://n.news.naver.com/mnews/article/421/0008519470?sid=101,"특히 DDR4의 평균 고정거래가는 4월 이후 6개월 연속 두 자릿수 상승 중인데, 2016~2018 <b>반도체</b>... 가격 자체는 <b>반도체</b> 최대 호황기였던 2018년 가격(7.19~8.19달러)에는 아직 미치지 못하지만, 과거 슈퍼사이클... ","Tue, 30 Sep 2025 19:18:00 +0900"
2025-09-30 11:47:50,<b>반도체</b> 설계 전문 기업 찾은 김정관 장관,https://n.news.naver.com/mnews/article/001/0015659684?sid=101,"김정관 산업통상자원부 장관이 30일 경기도 성남시에 소재한 차량용 <b>반도체</b> 설계 전문 팹리스 기업인 텔레칩스를 방문하여, 이장규 텔레칩스 대표이사로부터 운영현황을 듣고 있다. 2025.9.30 [산업통상자원부 제공.... ","Tue, 30 Sep 2025 19:15:00 +0900"
2025-09-30 11:47:50,<b>반도체</b> 설계 전문 기업 찾은 김정관 장관,https://n.news.naver.com/mnews/article/001/0015659682?sid=101,"김정관 산업통상자원부 장관이 30일 경기도 성남시에 소재한 차량용 <b>반도체</b> 설계 전문 팹리스 기업인 텔레칩스를 방문하여, 이장규 텔레칩스 대표이사로부터 운영현황을 듣고 있다. 2025.9.30 [산업통상자원부 제공.... ","Tue, 30 Sep 2025 19:15:00 +0900"
2025-09-30 11:47:50,<b>반도체</b> 설계 전문 기업 찾은 김정관 장관,https://n.news.naver.com/mnews/article/001/0015659683?sid=101,"김정관 산업통상자원부 장관이 30일 경기도 성남시에 소재한 차량용 <b>반도체</b> 설계 전문 팹리스 기업인 텔레칩스를 방문하여, 이장규 텔레칩스 대표이사로부터 운영현황을 듣고 있다. 2025.9.30 [산업통상자원부 제공.... ","Tue, 30 Sep 2025 19:15:00 +0900"
2025-09-30 11:47:50,경남신보 포용금융 '지역경제 활성화' 우수상 수상,https://www.kukinews.com/article/view/kuk202509300221,"◆경남테크노파크, 전력<b>반도체</b> 인재 심화 교육 경남테크노파크(원장 김정환)는 전력<b>반도체</b> 소자·패키징 및 신뢰성 평가 분야 실무인재 양성을 위한 심화과정 교육생 모집에 나섰다. 지난 8월 진행된 기초과정 모집에는... ","Tue, 30 Sep 2025 19:12:00 +0900"
2025-09-30 11:47:50,"LS-엘앤에프 배터리솔루션, 새만금 배터리 소재 공장 준공",http://www.e-platform.net/news/articleView.html?idxno=96812,앞서 LS그룹은 전기·전력·소재 등 기존 주력 산업을 강화하는 동시에 배·전·반(배터리·전기차·<b>반도체</b>) 관련 사업을 미래 성장동력으로 낙점해 구 회장의 '양손잡이 경영' 전략에 속도를 내고 있다. 이러한 경영... ,"Tue, 30 Sep 2025 19:12:00 +0900"
2025-09-30 11:47:50,"DN솔루션즈, 하반기 신입사원 공개채용…10월 13일 접수마감",https://www.kukinews.com/article/view/kuk202509300225,"DN솔루션즈는 터닝센터, 머시닝센터 등 400여 종의 제품 라인업을 보유한 글로벌 대표 공작기계 기업으로 전 세계 66개국 140여개 해외 딜러망을 통해 자동차, IT·<b>반도체</b>, 항공우주, 의료, 에너지 등 다양한 산업에 제품을... ","Tue, 30 Sep 2025 19:10:00 +0900"
2025-09-30 11:47:50,&quot;용인 <b>반도체</b> 건설현장은 무법지대&quot;,https://www.labortoday.co.kr/news/articleView.html?idxno=230507,▲ 건설노조 &quot;용인 SK<b>반도체</b> 클러스터 현장 건설사에서 안전교육과 함께 근로계약서를 작성하고 출근을 하루... 노조는 기자회견에서 용인 <b>반도체</b> 클러스터 건설현장에 불법이 만연하다고 주장했다. 홍씨 같은 부당한... ,"Tue, 30 Sep 2025 19:10:00 +0900"
