DateTime,Title,Link,Description,PubDate
2025-08-04 19:24:22,[시론] 피츠버그 항저우 같은 AI 혁신 지역 만들자,https://www.dnews.co.kr/uhtml/view.jsp?idxno=202508031027228830145,이 두 사례는 한국의 수도권 <b>반도체</b> 벨트에 귀중한 교훈을 주고 있다. 우리도 긴밀한 정부-민간 협력과 인프라 투자로 AI-<b>반도체</b> 클러스터를 강화할 수 있기 때문이다. 피츠버그(펜실베니아주)는 19~20세기 '스틸 시티... ,"Tue, 05 Aug 2025 04:20:00 +0900"
2025-08-04 19:24:22,창업 기업 ‘넘사벽’ 임상시험...체계적·전문적 교육 통해 극복한다,https://www.yakup.com/news/index.html?mode=view&cat=12&nid=314183,"초격차 스타트업 1000+ 프로젝트는 바이오헬스, 시스템<b>반도체</b>, 친환경·에너지, 10대 초격차 분야 기술기반 창업기업을 선정해 글로벌 수준 성장을 지원하는 중소벤처기업부 유망창업기업 지원사업으로... ","Tue, 05 Aug 2025 04:12:00 +0900"
2025-08-04 19:24:22,"[속보]미국증시, 금리인하 기대 엔비디아 등 빅테크 급등 나스닥-S&amp;P-다...",https://www.socialvalue.kr/news/view/1065549667550540,"필라델피아 <b>반도체</b>지수는 전장보다 91포인트(1.65%) 상승한 5,618을 기록하고 있다. 주요 종목으로는 엔비디아가 3.4% 급등한 것을 비롯해 마이크로소프트 2.5%, 애플 0.7%, 메타 3.2%, 브로드컴 3.1%, 구글의 알파벳 2.9... ","Tue, 05 Aug 2025 03:18:00 +0900"
2025-08-04 19:24:22,"‘국가대표 AI’ 개발 사업, 정부 지원 5개팀 뽑았다",https://n.news.naver.com/mnews/article/020/0003652373?sid=101,"통신사인 SK텔레콤 컨소시엄에는 게임사인 크래프톤과 포티투닷, 추론형 AI <b>반도체</b>(NPU) 제작사인 리벨리온, 라이너, 셀렉트스타 등이 참여했다. 기존 국내 거대언어모델(LLM) 규모를 뛰어넘는 초거대 AI 모델 개발에... ","Tue, 05 Aug 2025 03:05:00 +0900"
2025-08-04 19:24:22,벼랑끝 철강-석유화학… 제조업체 84% “주력제품 경쟁력 잃어”,https://n.news.naver.com/mnews/article/020/0003652349?sid=101,<b>반도체</b>와 자동차 이후 한동안 대(代)가 끊겼던 한국 제조업의 새로운 ‘주력 산업’이 될 것으로 기대를 모았던 이차전지는 중국에 밀리고 있다. 인공지능(AI) 등 후속 산업 발굴은 지체되는 중이다. 우리 기업들이... ,"Tue, 05 Aug 2025 03:04:00 +0900"
2025-08-04 19:24:22,"빅테크 주가, 고용 충격 후 반등…'엔비디아' 2.8%↑‧<b>반도체</b>주 강세",https://www.topstarnews.net/news/articleView.html?idxno=15758281,"같은 시간 '브로드컴'(3.25%↑), 'TSMC'(1.02%↑), 'AMD'(3.14%↑) 등 대표 <b>반도체</b>주도 동반 강세를 나타냈다. <b>반도체</b> 중심의 '필라델피아 <b>반도체</b> 지수'도 1.61% 상승하며 시장 전반의 긍정적 흐름을 뒷받침했다. 시장 전문가들은... ","Tue, 05 Aug 2025 02:24:00 +0900"
2025-08-04 19:24:22,"가천대, IT·바이오 중점 '청년 취업 Jump-Up' 프로그램 운영",https://n.news.naver.com/mnews/article/030/0003337928?sid=102,"이 프로그램은 정보기술(IT), <b>반도체</b>, 바이오 등 가천대 특성화 분야를 중심으로 구성됐으며, 지난 5월부터... IT·<b>반도체</b>·구직스킬 관련 직무 특강이 총 12회 예정돼 있다. 이와 함께 오는 11~13일에는 하반기 채용 전략... ","Tue, 05 Aug 2025 02:16:00 +0900"
2025-08-04 19:24:22,"빅테크 주가, '고용 충격'서 반등…美 엔비디아 2.8%↑",https://n.news.naver.com/mnews/article/001/0015548555?sid=104,"미국 <b>반도체</b> 기업 브로드컴과 세계 최대 파운드리(<b>반도체</b> 위탁생산) 업체 대만 TSMC 주가는 각각 3.25%와 1.02%, AMD는 3.14% 오르는 등 <b>반도체</b>주들도 대부분 상승 중이다. <b>반도체</b> 관련 종목으로 구성된 필라델피아 <b>반도체</b>... ","Tue, 05 Aug 2025 01:48:00 +0900"
2025-08-04 19:24:22,"美, 엔비디아 H20칩 中 수출 허용했지만…&quot;점유율 하락 불가피&quot; 경고",https://n.news.naver.com/mnews/article/293/0000070692?sid=105,최근 미국 정부가 대중 <b>반도체</b> 수출 규제를 일부 완화하면서 엔비디아가 중국 시장 전용 인공지능(AI) 칩인... 번스타인은 그 배경으로 H20 공급 재개 지연뿐만 아니라 중국의 AI <b>반도체</b> 생산업체들이 빠르게 성장하며 현지... ,"Tue, 05 Aug 2025 01:46:00 +0900"
2025-08-04 19:24:22,"충남도, 17개국 연수 참가 외교관들 접견...관광 자원·투자 환경 소개",http://www.globalepic.co.kr/view.php?ud=20250804230245474247f28d89cf_29,전형식 정무부지사는 “도는 최근 3년간 누적 39억달러 외자유치를 기록하는 등 외국의 선도 기업들로부터 러브콜을 많이 받는 지역” 이라며 “디스플레이·<b>반도체</b>·자동차 등 첨단산업을 비롯한 스마트팜·바이오헬스... ,"Tue, 05 Aug 2025 01:16:00 +0900"
2025-08-04 19:24:22,‘100조 미국시장’의 초대장? K원전 기대감,https://n.news.naver.com/mnews/article/025/0003459891?sid=101,정부는 “투자펀드가 <b>반도체</b>·원전·2차전지·바이오 등 한국 기업들이 경쟁력을 보유한 전략산업에 활용될 것”이라고 설명했다. 한국원자력산업협회는 “원자력 산업을 전략산업에 포함한 투자펀드 조성에 대해... ,"Tue, 05 Aug 2025 00:49:00 +0900"
2025-08-04 19:24:22,"딥시크 배출한 저장대, 원숭이 뇌 유사한 뉴런 수퍼컴 개발",https://n.news.naver.com/mnews/article/025/0003459887?sid=104,다윈 몽키에는 저장대와 저장랩이 공동 개발한 뉴로모픽 <b>반도체</b> ‘다윈 3’가 960개 탑재됐다. <b>반도체</b> 1개가 235만개 이상의 뉴런과 수억 개의 시냅스를 지원하는 셈이다. 다윈 몽키는 20억 개의 인공 뉴런을 기반으로... ,"Tue, 05 Aug 2025 00:36:00 +0900"
2025-08-04 19:24:22,산업硏 “車 관세 멕시코보다 부담 커”… 최태원 “협상 마무리? 아직...,https://n.news.naver.com/mnews/article/023/0003921152?sid=101,"회의에는 자동차, <b>반도체</b>, 철강 등 업종별 협회와 대한상의, 한국무역협회, 산업연구원 등 경제단체와 국책연구원 관계자가 참여했다. 산업연구원의 경우, 이번 합의로 수출 감소 충격이 3분의 1 정도 완화되고, 타국 대비... ","Tue, 05 Aug 2025 00:32:00 +0900"
2025-08-04 19:24:22,車 수리 때 순정 부품 대신 ‘대체 부품’ 쓰라고?,https://n.news.naver.com/mnews/article/023/0003921151?sid=101,"차량용 <b>반도체</b>와 SW(소프트웨어) 중심으로 차량 기능을 제어하는 일이 늘고 있는데, 부품 간 호환이 제대로 되지 않으면 예측하기 어려운 오작동이 생길 수 있다는 것이다. 이런 점 때문에 상당수 국산·수입 자동차 브랜드... ","Tue, 05 Aug 2025 00:32:00 +0900"
2025-08-04 19:24:22,"[송호근의 세사필담] 제국의 횡포, 관세",https://n.news.naver.com/mnews/article/025/0003459881?sid=110,"한국은 조선, 자동차, <b>반도체</b>와 바이오에 사활을 걸었기에 저항동맹에 끼지는 않겠지만, 자존심이 상한 EU가 러시아나 중국 쪽으로 조금이라도 선회한다면 국제정세는 하루아침에 바뀐다. 전운이 피어오른다.... ","Tue, 05 Aug 2025 00:30:00 +0900"
2025-08-04 19:24:22,로봇·산업용·협동로봇 관련주 '함박웃음' 원익홀딩스·오늘이엔엠·스...,http://www.finomy.com/news/articleView.html?idxno=235572,"1991년 <b>반도체</b> 장비 제조·판매를 목적으로 설립돼 1996년 코스닥에 상장한 지주회사로, 현재 15개의 종속회사를 보유하고 있다. 지주회사로서 원익아이피에스, 원익피앤이, 원익큐엔씨 등 주요 자회사를 통해 <b>반도체</b>... ","Tue, 05 Aug 2025 00:26:00 +0900"
2025-08-04 19:24:22,DB하이텍 2분기 영업이익 739억원,https://n.news.naver.com/mnews/article/009/0005536107?sid=101,파운드리(<b>반도체</b> 위탁생산) 전문기업 DB하이텍이 올해 2분기 호실적을 거뒀다. 4일 회사는 연결기준... 이번 호실적은 전력<b>반도체</b> 수요 확대와 함께 통신·자동차·산업 등의 응용 분야에서 매출이 증가한 영향이다.... ,"Tue, 05 Aug 2025 00:14:00 +0900"
2025-08-04 19:24:22,[다산칼럼] 관세 협상과 한·미 원자력 협력의 새 전환기,https://n.news.naver.com/mnews/article/015/0005166735?sid=110,"대미 투자액 중 약 2000억달러가 원자력, 배터리, <b>반도체</b>, 바이오 분야에 할당됐다. 100억달러만 해도 웨스팅하우스 규모의 기업을 통째로 인수해버릴 수도 있는 액수다. 여기서 의문이 생긴다. “그런 큰돈을 미국에... ","Tue, 05 Aug 2025 00:13:00 +0900"
2025-08-04 19:24:22,"코트라, '중국 자동차 산업 최신 동향 및 시사점' 발간",https://www.cstimes.com/news/articleView.html?idxno=660255,"특히 차량용 <b>반도체</b>, 초경량 소재, 전기차용 SW·솔루션, 감속·변속 기술 등 고성능, 고효율 분야에서 해외와의 협력 수요가 있는 것으로 분석했다. 이지형 KOTRA 부사장 겸 경제통상협력본부장은 &quot;중국 자동차 시장... ","Tue, 05 Aug 2025 00:08:00 +0900"
2025-08-04 19:24:22,[사설] 광산 산업 '제2 전성기' 기대,https://n.news.naver.com/mnews/article/654/0000135072?sid=110,텅스텐은 높은 밀도와 경도·내열성을 바탕으로 <b>반도체</b>와 우주항공·국방산업 등 첨단산업의 핵심 원자재로 꼽힙니다. 광산 자원 개발사업이 새로운 일자리를 창출하고 폐광지역 경제 규모를 확대할 수 있도록 치밀한... ,"Tue, 05 Aug 2025 00:07:00 +0900"
2025-08-04 19:24:22,"[의정칼럼] 도민과 함께한 경제산업 1년, 그리고 앞으로",https://n.news.naver.com/mnews/article/654/0000135070?sid=110,"이에 따라, <b>반도체</b>·바이오헬스·미래모빌리티·수소에너지 등 미래 유망산업을 전략적으로 육성하고 있습니다. <b>반도체</b> 분야는 원주를 중심으로 <b>반도체</b>교육원과 테스트베드 설치가 진행 중이며, 바이오헬스는 춘천·강릉... ","Tue, 05 Aug 2025 00:07:00 +0900"
2025-08-04 19:24:22,[지금 일본에선(822)] 미일 관세협상 타결에 불만 커지는 일본 직장인들,https://www.news2day.co.kr/article/20250805500003,"미국은 자국 산업 보호가 시급한 <b>반도체</b>·항공기 부품·의약품을 대부분 예외로 두는 반면, 일본의 주력 산업인 자동차 부품, 가전 부품, 농산물은 상당수가 예외에서 제외됐다. 히타치 계열의 전자부품 제조사에 근무하는... ","Tue, 05 Aug 2025 00:06:00 +0900"
2025-08-04 19:24:22,[사설] 제조업 8할이 레드오션…신산업 점화 위해 기업 활력 높여야,https://n.news.naver.com/mnews/article/011/0004517269?sid=110,"우리 경제는 지난 20년 동안 신성장 동력을 만들지 못한 채 허송세월하다 <b>반도체</b>를 제외한 모든 핵심 산업이 중국에 추월당했다. 낡은 규제, 경직적 노사관계, 반기업 정서 등으로 인해 기업 활력이 떨어진 탓이 크다. 반면... ","Tue, 05 Aug 2025 00:06:00 +0900"
2025-08-04 19:24:22,"울산직업교육복합센터, 진로·직업 체험 인기",https://www.ksilbo.co.kr/news/articleView.html?idxno=1033592,"센터 소개를 듣고 1층 직업계고 홍보관, 직업교육 미래관을 차례로 둘러보고, <b>반도체</b>·이차전지... 인공지능 실습실과 다목적실에서는 인공지능 모형을 직접 설계하며 기초 실습을 경험하고, <b>반도체</b>·스마트 팩토리... ","Tue, 05 Aug 2025 00:02:00 +0900"
2025-08-04 19:24:22,울산 해상풍력 '정부 핵심전략 산업' 지정,https://www.ksilbo.co.kr/news/articleView.html?idxno=1033651,또 분산에너지 활성화 특별법에 따라 전기요금 차등제가 가능해지면서 청정 전력을 활용한 데이터센터·이차전지·<b>반도체</b> 등 전력 다소비 산업의 유치 경쟁력도 한층 높아질 것으로 기대된다. 특히 수출기업의 RE100... ,"Tue, 05 Aug 2025 00:02:00 +0900"
2025-08-04 19:24:22,"연준 금리인하 기대↑… 뉴욕 증시, ‘고용쇼크’에서 반등",https://n.news.naver.com/mnews/article/022/0004057284?sid=104,"이와 함께 시장은 이번 주 예정된 주요 기업 실적 발표에도 주목하고 있다. 빅데이터 기업 팰런티어는 이날 장 마감 후 실적을 발표하며, <b>반도체</b> 기업 AMD는 5일 실적을 내놓을 예정이다.","Tue, 05 Aug 2025 00:01:00 +0900"
2025-08-04 19:24:22,“접경에서 내륙까지…권역별로 쪼개 설계한 강원의 국가전략”,https://n.news.naver.com/mnews/article/087/0001134014?sid=100,"■ 바이오·<b>반도체</b>·수소 기반 첨단산업 육성 전면화(중부·동해안권)= 춘천, 원주, 강릉 등은 △<b>반도체</b> 소재·부품 생산거점 △AI 기반 첨단의료단지 △바이오·의약 특화단지 등 첨단산업 인프라 확충에 집중했다.... ","Tue, 05 Aug 2025 00:01:00 +0900"
2025-08-04 19:24:22,'트럼프 관세' 이후의 혼돈에 대비할 때 [아침을 열며],https://n.news.naver.com/mnews/article/469/0000879843?sid=110,"우선, 상호관세 협상과 별도로, 철강·알루미늄·구리 등에 대한 50% 관세에 이어, <b>반도체</b>·의약품·목재·중대형 트럭 등 주요 품목별 관세도 계속 추가될 예정이다. 미중 관세협상도 ‘제네바 실행 프레임 워크’를... ","Tue, 05 Aug 2025 00:01:00 +0900"
2025-08-04 19:24:22,"전북도, 양자기술 국가사업 첫 공모 선정…28억원 투입",http://www.hansbiz.co.kr/news/articleView.html?idxno=766354,"전북대 <b>반도체</b>과학기술학과 김희대 교수팀이 주관하며, 기술 상용화 및 실증을 담당할 한솔케미칼과 양자기술의 지역 확산과 수요기업을 매칭할 전북테크노파크가 참여하는 산학연 컨소시엄이 협력한다. 특히 '에너지... ","Mon, 04 Aug 2025 23:50:00 +0900"
2025-08-04 19:24:22,"김정관 산업부 장관, '대미 통상 전략 라운드 테이블' 회의 개최…&quot;세제...",http://www.econonews.co.kr/news/articleView.html?idxno=399083,김정관 장관은 &quot;한미 관세협상 타결로 우리 기업의 단기적 수출 불확실성이 해소되고 주요국 대비 불리하지 않은 경쟁조건을 확보했다&quot;며 &quot;조선·자동차·<b>반도체</b>·바이오 등 전략산업 분야에서 미국 측과 협력을 강화하고... ,"Mon, 04 Aug 2025 23:30:00 +0900"
2025-08-04 19:24:22,[신문과 놀자!/디지털 세상과 정보]AI 시대엔 ‘문제해결-생각하는 힘’...,https://n.news.naver.com/mnews/article/020/0003652287?sid=110,"미국과 중국은 <b>반도체</b> 제재와 기술 이전 금지로 서로를 견제하고, 유럽 각국도 자국 AI 모델 개발에 천문학적 투자를 쏟고 있습니다. 이런 가운데 우리나라 최고의 AI 전문가들이 해외로 떠나고 있습니다. 2024년 미국... ","Mon, 04 Aug 2025 23:10:00 +0900"
2025-08-04 19:24:22,'고용쇼크'서 회복 나선 뉴욕증시…기술주 강세에 나스닥 1.6%↑,https://n.news.naver.com/mnews/article/018/0006081718?sid=101,"빅데이터 분석업체 팔란티어는 이날 장 마감 후 실적을 발표하며, <b>반도체</b> 기업 AMD는 6일 실적을 내놓는다. 8월은 계절적으로 증시가 부진한 시기로 꼽힌다. 투자정보업체 스톡 트레이더스 알마낙에 따르면 8월은... ","Mon, 04 Aug 2025 23:02:00 +0900"
2025-08-04 19:24:22,"세종대, 전국 교육용 부지 개발 본격 추진",https://www.kfenews.co.kr/news/articleView.html?idxno=643626,세종대는 2021년 경충대로에서 부지로 연결되는 도로 공사를 마치고 지난해 12월 성남시와 <b>반도체</b>(AI) 클러스터 조성 협약을 체결했다. 경기도 광주시 도척면 부지는 국방 항공우주 첨단바이오 산업이 융합된... ,"Mon, 04 Aug 2025 22:58:00 +0900"
2025-08-04 19:24:22,"SKT 컨소시엄, 산학 전문가 연합...글로벌 최고 수준, 독자 AI 모델 구현",https://www.aitimes.kr/news/articleView.html?idxno=35933,"SKT 컨소시엄은 <b>반도체</b>, 모델, 데이터, 서비스로 이어지는 독자 기술 기반의 풀스택 AI를 구현하고... 인공지능 <b>반도체</b>(신경망처리장치/NPU) 제작사인 리벨리온, 전문 지식·정보 검색에 특화된 AI 에이전트인 라이너... ","Mon, 04 Aug 2025 22:50:00 +0900"
2025-08-04 19:24:22,관세 협상 이제 2라운드…'디테일'이 성패 좌우,https://n.news.naver.com/mnews/article/422/0000767339?sid=101,"이 중 1,500억 달러는 조선업에, 나머지 2천억 달러는 <b>반도체</b>·2차전지·원전·바이오 같은 전략산업에 투자할 예정입니다. 여기에 더해 4년 동안 1천억 달러 규모의 미국산 에너지를 사기로 했습니다. 다만 협상의 큰 틀만... ","Mon, 04 Aug 2025 22:46:00 +0900"
2025-08-04 19:24:22,"EU, 금주 중 미국측 관세 세부 사항 발표 기대",https://n.news.naver.com/mnews/article/015/0005166728?sid=101,"양측 관계자들은 이 관세율이 자동차에도 적용될 것이며, 향후 제약 및 <b>반도체</b>를 겨냥한 모든 부문별... 또 조만간 의약품과 <b>반도체</b>를 표적으로 삼겠다고 위협했다. 블룸버그는 앞서 양측이 와인과 주류 등 다른 품목뿐... ","Mon, 04 Aug 2025 22:46:00 +0900"
2025-08-04 19:24:22,"뤼튼·퓨리오사, AI 추론 인프라 국산화 신호탄 쐈다",https://www.hellot.net/news/article.html?no=103921,퓨리오사 백준호 대표는 “국가 차원의 AI 풀스택 경쟁력 확보를 위한 협업이 본격화됐다”며 “실제 서비스와 결합된 AI <b>반도체</b> 성능 고도화는 글로벌 경쟁력 측면에서도 중요한 진전”이라고 말했다. 양사는 향후 AI... ,"Mon, 04 Aug 2025 22:38:00 +0900"
2025-08-04 19:24:22,"[헬로AI] AI 추론 최적화 한계 돌파하는 에너자이 “오라, 온디바이스 시...",https://www.hellot.net/news/article.html?no=103920,"학습보다 추론이 중심이 되는 시대, 에너자이의 기술은 주요 <b>반도체</b> 팹리스·IP 기업과의 협업을 기반으로... 수상 이후 에너자이는 주요 <b>반도체</b> 기업 및 디바이스 제조사와 기술 협업 요청을 받으며, 이를 계기로 북미... ","Mon, 04 Aug 2025 22:34:00 +0900"
2025-08-04 19:24:22,엔비디아도 반한 K로봇의 충격적인 ‘무브’…조선소·건설현장 투입도...,https://n.news.naver.com/mnews/article/009/0005536093?sid=101,"한 CTO는 “K-휴머노이드 연합의 핵심은 부품부터 플랫폼, AI까지 휴머노이드를 개발·제조할 수 있는 생태계를 조성하는 것”이라며 “휴머노이드 제조를 위해서는 가볍고 전력 소모가 적은 임베디드 AI <b>반도체</b>와 가볍고... ","Mon, 04 Aug 2025 22:31:00 +0900"
2025-08-04 19:24:22,대기 상태 감시 휴머노이드용 <b>반도체</b> 기술 개발,http://www.gnmaeil.com/news/articleView.html?idxno=568551,"(생체모방 <b>반도체</b> 연구실)와 남상용 교수(기능성 나노고분자 연구실) 공동연구팀은, 인간의 후각과 두뇌를 모방해 대기상 존재하는 극미량의 유해 분자의 상태를 인식하고 학습하는 뉴로모픽 <b>반도체</b> 기술을 개발했다.... ","Mon, 04 Aug 2025 22:30:00 +0900"
2025-08-04 19:24:22,"한미 관세 타결 급한 불은 껐지만, 시험은 지금부터…",http://www.gnmaeil.com/news/articleView.html?idxno=568614,"이는 단순한 자본 유출을 넘어 미국의 핵심 산업인 조선, <b>반도체</b>, 배터리, 바이오 등 미래 전략 분야에 대한 협력을 강화하는 기회로 활용되어야 한다. 동시에, 과도한 해외 투자로 인해 국내 산업 공동화가 발생하지... ","Mon, 04 Aug 2025 22:28:00 +0900"
2025-08-04 19:24:22,"DB하이텍, 2분기 매출 3374억·영업이익 739억 실적 잠정 집계",http://www.econonews.co.kr/news/articleView.html?idxno=399030,전력<b>반도체</b> 수요 확대가 긍정적인 영향을 미쳤으며 응용 분야로는 통신·자동차·산업 등에서의 매출이... 전력<b>반도체</b>를 중심으로 기술 경쟁력을 강화하고 신사업 추진에 집중해 사업 성장 기반을 지속 확보할 계획... ,"Mon, 04 Aug 2025 22:10:00 +0900"
2025-08-04 19:24:22,울산 해상풍력 전략산업으로…투자 유치 속도,https://n.news.naver.com/mnews/article/056/0012002588?sid=101,지역에서 에너지 자립의 기반을 갖춰 데이터센터와 <b>반도체</b> 공장 등 전력을 많이 쓰는 기업을 유치하겠다는 전략입니다. 친환경 에너지 산업지구에서 향후 20년간 30조 원의 생산 유발과 5만 3천 명의 고용 창출 효과를 낼... ,"Mon, 04 Aug 2025 22:10:00 +0900"
2025-08-04 19:24:22,"NC AI 컨소시엄, 독자AI를 위한 최고의 국가대표...54개 기관 '그랜드 컨...",https://www.aitimes.kr/news/articleView.html?idxno=35930,"컨소시엄은 실제로 데이터 수집, 전처리, 사전학습, 알고리즘 설계, 산업 적용, AI <b>반도체</b>(NPU) 연동, 오픈소스 공개, 글로벌 상용화까지 전 주기를 포괄한다. NC AI는 해당 컨소시엄의 기술적 총괄 리더로서 각... ","Mon, 04 Aug 2025 22:10:00 +0900"
2025-08-04 19:24:22,[쿼바디스 한국 AI] 이성엽 “G3? 경쟁력 직시해야…세계 최초 규제국은...,https://byline.network/?p=9004111222573069,AI 투자의 경우 <b>반도체</b>-모델-플랫폼-서비스로 이어지는 밸류 체인(Value Chain) 생태계 조성에 투자하여 시너지 효과를 창출할 수 있어야 합니다. 한국은 AI 메모리 <b>반도체</b>와 AI 모델을 제외하면 어느 분야도 경쟁력을... ,"Mon, 04 Aug 2025 22:04:00 +0900"
2025-08-04 19:24:22,"충남 찾은 17개국 외교관, &quot;문화와 산업 두 마리 토끼 잡은 지역&quot;",http://www.aflnews.co.kr/news/articleView.html?idxno=301431,"전형식 충남도 정무부지사 전형식 부지사는 &quot;충남은 최근 3년간 누적 39억 달러 규모의 외자유치를 달성한 투자 중심 지역으로, 디스플레이·<b>반도체</b>·자동차 등 첨단 제조업뿐 아니라 스마트팜, 바이오헬스, 신재생에너지... ","Mon, 04 Aug 2025 21:54:00 +0900"
2025-08-04 19:24:22,“전력 소비 1.5배 늘어도 재생에너지로 충당 가능”,http://www.kwangju.co.kr/article.php?aid=1754307900787657277,"한 책임연구원은 이날 ‘대한민국의 재생에너지 확대를 위한 방안’을 주제로한 기조 발제에서 기존 전력수요와 <b>반도체</b> 클러스터 등 첨단산업, 데이터 센터의 확충으로 2038년 전력소비량은 735.1TWh(테라와트시)로... ","Mon, 04 Aug 2025 21:44:00 +0900"
2025-08-04 19:24:22,상반기 中企 수출 3% 증가…화장품·중고차 견인,https://www.ulsanpress.net/news/articleView.html?idxno=556379,"대만은 <b>반도체</b> 및 관련 장비 수요 증가로 총 15억8,000만달러의 수출 실적을 올리며 23.3% 성장했다. 반면, 베트남은 <b>반도체</b>, 플라스틱 제품 등 대부분의 주력 품목 수출이 감소하면서 5.0% 역성장했다. 온라인... ","Mon, 04 Aug 2025 21:42:00 +0900"
2025-08-04 19:24:22,울산직업교육복합센터 '주말 체험' 호응,https://www.ulsanpress.net/news/articleView.html?idxno=556331,"센터 소개를 듣고 1층 직업계고 홍보관, 직업교육 미래관을 차례로 둘러보고 <b>반도체</b>·이차전지... 인공지능 실습실과 다목적실에서는 인공지능 모형을 직접 설계하며 기초 실습을 경험하고 <b>반도체</b>·첨단 자동 공장... ","Mon, 04 Aug 2025 21:42:00 +0900"
2025-08-04 19:24:22,"충남도, 17개국 외교관들에게 충남 홍보",https://weekly.hankooki.com/news/articleView.html?idxno=7122836,전형식 정무부지사는 &quot;도는 최근 3년간 누적 39억달러 외자유치를 기록하는 등 외국의 선도 기업들로부터 러브콜을 많이 받는 지역&quot;이라며 &quot;디스플레이·<b>반도체</b>·자동차 등 첨단산업을 비롯한 스마트팜·바이오헬스... ,"Mon, 04 Aug 2025 21:32:00 +0900"
