DateTime,Title,Link,Description,PubDate
2025-09-25 06:53:38,원달러 환율 상승에 코스피 약보합 AI 우려 지속 SK하이닉스 0.3%↓,http://www.smedaily.co.kr/news/articleView.html?idxno=339104,필라델피아<b>반도체</b>지수(-0.18%)도 2거래일 연속 고꾸라졌다. 이날 국내 증시는 고점 부담이 지속되는 가운데 1400원을 넘어선 원달러 환율이 투자심리를 위축시키면서 약세를 이어갔으나 삼성전자와 네이버... ,"Thu, 25 Sep 2025 15:52:00 +0900"
2025-09-25 06:53:38,"용인시 &quot;용인~충주 고속道, 용인<b>반도체</b>클러스터 산단 연계성 높일 것&quot;",https://n.news.naver.com/mnews/article/277/0005657806?sid=102,<b>반도체</b> 벨트 조성으로 철도·도로 인프라 확충이 잇따르고 있는 경기도 용인지역이 또 다른 교통 호재를... 특히 시는 도로가 건설되면 처인구 원삼면에 SK하이닉스가 122조원을 투자해 생산라인을 짓는 '용인 <b>반도체</b>클러스... ,"Thu, 25 Sep 2025 15:52:00 +0900"
2025-09-25 06:53:38,"중국 빅테크 AI <b>반도체</b> 자급체제 '동맹' 구축, 엔비디아 설 자리 더 좁아...",https://www.businesspost.co.kr/BP?command=article_view&num=413553,중국 알리바바와 텐센트 등 빅테크 기업들이 자국산 인공지능 <b>반도체</b> 활용에 적극 동참하며 동맹을 강화하고... &lt;연합뉴스&gt; 알리바바와 텐센트 등 중국 빅테크 업체들이 잇따라 자국산 인공지능(AI) <b>반도체</b>로 엔비디아... ,"Thu, 25 Sep 2025 15:52:00 +0900"
2025-09-25 06:53:38,"&quot;안 싸우고 어떻게 이겨유? 잘할게유~&quot;…장동혁, 중원 민심 공략",https://n.news.naver.com/mnews/article/008/0005255961?sid=100,그러면서 &quot;대전 혁신도시의 공공기관 2차 이전이 조속히 확정되고 대전 충남이 우선 배려될 수 있게 최선을 다하겠다&quot;며 &quot;대전의 체계적 발전을 저해하는 대전교도소 조속 이전과 새 미래를 이끌 나노·<b>반도체</b>... ,"Thu, 25 Sep 2025 15:51:00 +0900"
2025-09-25 06:53:38,"KB금융, '생산적 금융' 협의회 출범…&quot;성장 동력 프레임워크 가동&quot;",https://n.news.naver.com/mnews/article/629/0000429902?sid=101,연내 1500억원 규모의 펀드를 조성해 △시스템<b>반도체</b> △바이오·헬스 △미래 모빌리티 △친환경·에너지 △로봇 △사이버보안·네트워크 △우주항공·해양 △차세대 원전 △양자기술 등 차세대 핵심산업에... ,"Thu, 25 Sep 2025 15:51:00 +0900"
2025-09-25 06:53:38,"野, 대전에서 ‘충청’ 민심 공략…“새로운 성장 동력 만들 것”",https://www.kukinews.com/article/view/kuk202509250126,이어 “대전의 발전을 저해하는 대전교도소와 향후 미래를 이끌어 갈 나노·<b>반도체</b> 국가산업단지 이전에 당이 앞장서 힘을 모으겠다”고 덧붙였다. 송언석 국민의힘 원내대표도 “대전 현장 최고위는 충청의 비전을... ,"Thu, 25 Sep 2025 15:50:00 +0900"
2025-09-25 06:53:38,"시장조사업체 &quot;4분기 낸드플래시 가격 5~10% 상승, eSSD 주문 증가&quot;",https://www.businesspost.co.kr/BP?command=article_view&num=413555,&lt;트렌드포스&gt; 올해 4분기 낸드플래시 메모리<b>반도체</b> 가격이 평균 5~10% 증가할 것이란 전망이 나왔다. 클라우드서비스업체(CSP)들이 기업용 솔리드스테이트드라이브(eSSD)의 주문을 늘리며 가격이 상승하고 있다. 25일... ,"Thu, 25 Sep 2025 15:50:00 +0900"
2025-09-25 06:53:38,"KB금융, '생산적 금융 협의회' 출범…성장 동력 프레임워크 마련 목표",https://www.newsquest.co.kr/news/articleView.html?idxno=253688,연내 1500억원 규모의 펀드를 조성해 ▲시스템<b>반도체</b> ▲바이오·헬스 ▲미래 모빌리티 ▲친환경·에너지 ▲로봇 ▲사이버보안·네트워크 ▲우주항공·해양 ▲차세대 원전 ▲양자기술 등 차세대 핵심산업에 모험자본을... ,"Thu, 25 Sep 2025 15:50:00 +0900"
2025-09-25 06:53:38,"용인시, '용인~충주 민자고속도로' 적격성 조사 통과 환영",http://www.suwonilbo.kr/news/articleView.html?idxno=312215,"이상일 시장은 지난 4월 29일 국토교통부장관에게 <b>반도체</b>산업의 발전과 '용인 <b>반도체</b>클러스터 일반산업단지', '용인 첨단시스템<b>반도체</b> 클러스터 국가산업단지'와의 연계 중요성을 강조하면서, 용인에서 추진 중인... ","Thu, 25 Sep 2025 15:50:00 +0900"
2025-09-25 06:53:38,"SK AX, '클라우드 MSP'로 글로벌 공략 가속",https://www.mediapen.com/news/view/1045491,미국의 한 <b>반도체</b> 장비 제조기업은 SK AX의 서비스를 도입해 인프라 구축 기간을 단축하고 운영 비용을 약 30% 절감했다. 신장수 SK AX 클라우드 부문장은 &quot;글로벌 제조기업이 생산성과 유연성을 높이고 리스크를... ,"Thu, 25 Sep 2025 15:48:00 +0900"
2025-09-25 06:53:38,"&quot;세계 디지털자산 패권 경쟁…韓, 종합 플랫폼 기업 육성 절실&quot;",https://www.newspim.com/news/view/20250925000894,이정문 국회의원은 개회사를 통해 &quot;<b>반도체</b> 등 첨단 산업에서 시작된 글로벌 패권 경쟁이 이제는 제조업을 넘어 디지털자산 등 신산업으로 확대되고 있다&quot;며 &quot;산업 경쟁력이 곧 국력으로 이어지는 시대를 맞아... ,"Thu, 25 Sep 2025 15:48:00 +0900"
2025-09-25 06:53:38,"포스코, 포항 영일만산단 산소공장 ‘준공’…산업가스 시장 진출 ‘본...",https://www.kukinews.com/article/view/kuk202509250153,"포스코는 철강, 이차전지, <b>반도체</b>, 조선, 화학, 자동차 등 다양한 산업 분야로 공급을 확대할 계획이다. 신성원 경영기획본부장은 “안전을 최우선 가치로 삼아 모두가 안심하고 일할 수 있는 환경을 만들겠다”고... ","Thu, 25 Sep 2025 15:48:00 +0900"
2025-09-25 06:53:38,"트럼프 美정부, 로봇·의료기기·산업기계 조사 착수…품목별 관세 또 ...",https://www.etoday.co.kr/news/view/2510346,또 의약품·<b>반도체</b>·항공기 등에도 품목별 관세를 염두에 둔 조사를 진행 중이다. 이번 조사를 통해 부과될 수 있는 추가 관세는 트럼프 대통령이 ‘국제비상경제권법(IEEPA)’에 따라 수십 개국에 부과한 국가별... ,"Thu, 25 Sep 2025 15:48:00 +0900"
2025-09-25 06:53:38,"용인시, ‘용인~충주 민자고속도로’ 적격성 조사 통과 환영",https://www.nspna.com/news/?mode=view&newsid=779266,이상일 시장은 지난 4월 29일 국토교통부장관에게 <b>반도체</b>산업의 발전과 ‘용인 <b>반도체</b>클러스터 일반산업단지’ ‘용인 첨단시스템<b>반도체</b> 클러스터 국가산업단지’와의 연계 중요성을 강조하면서 용인에서 추진 중인... ,"Thu, 25 Sep 2025 15:48:00 +0900"
2025-09-25 06:53:38,서울시 '이공계 전성시대' 선언...장학금·연구지원·성장주택 제공,https://n.news.naver.com/mnews/article/030/0003354617?sid=102,"그는 학비·연구비·주거비 부담을 없애고(3NO), 과학기술인의 자긍심을 높이는(1YES) 환경을 구축, '의대 쏠림'으로 흔들리는 과학·공학 인재 공급 구조를 <b>반도체</b>·인공지능(AI)·모빌리티 등 첨단산업 중심으로 전환하는... ","Thu, 25 Sep 2025 15:48:00 +0900"
2025-09-25 06:53:38,SK하이닉스 목표주가 상향…AI·HBM 수요 견인,https://www.jbnews.com/news/articleView.html?idxno=1491083,엔비디아 등 글로벌 빅테크 기업들이 차세대 AI <b>반도체</b> 성능 강화를 위해 HBM 채택을 늘리는 가운데 SK하이닉스는 HBM3E·12단 제품 공급 능력에서 경쟁사 대비 우위를 확보했다는 평가다. 이 같은 고부가가치 제품 판매... ,"Thu, 25 Sep 2025 15:46:00 +0900"
2025-09-25 06:53:38,"서울시, 의대 쏠림 막고 <b>반도체</b>·AI 인재 육성…‘3NO 1YES’ 전략 발표",http://www.metroseoul.co.kr/article/20250925500521,"서울시청/메트로신문 서울시가 '이제는 이공계 전성시대'를 선언하며, 의대 쏠림으로 흔들리는 과학·공학 인재 공급 구조를 <b>반도체</b>·AI·모빌리티 등 첨단산업 중심으로 전환하기 위한 정책을 펼친다. 학비·연구비... ","Thu, 25 Sep 2025 15:46:00 +0900"
2025-09-25 06:53:38,신한자산운용 TDF 120% 성장…“시장 평균 웃도는 성장세”,https://www.etoday.co.kr/news/view/2510345,특히 시장 상황에 따라 미국 <b>반도체</b> 및 기술주 비중을 조정하고 금융 및 고배당주 비중을 확대하는 등 적극적인 리밸런싱 전략으로 안정성과 성장성을 동시에 추구한다. ‘신한마음편한TDF2050’은 22일 기준 최근... ,"Thu, 25 Sep 2025 15:46:00 +0900"
2025-09-25 06:53:38,"용인시, 용인~충주 민자고속도로 적격성 조사 통과 '환영'",https://www.newscj.com/news/articleView.html?idxno=3322008,"이상일 시장은 지난 4월 29일 국토교통부장관에게 <b>반도체</b>산업의 발전과 용인 <b>반도체</b>클러스터 일반산업단지, 용인 첨단시스템<b>반도체</b> 클러스터 국가산업단지와의 연계 중요성을 강조하면서 용인에서 추진 중인... ","Thu, 25 Sep 2025 15:46:00 +0900"
2025-09-25 06:53:38,"KB금융, 생산적 금융 전환 견인 위한 ‘성장 동력 프레임워크’ 마련",https://www.seoultimes.news/news/article.html?no=2000081458,"이를 통해 시스템<b>반도체</b>, 바이오·헬스, 미래 모빌리티, 친환경·에너지, 로봇, 사이버보안, 우주항공, 차세대 원전, 양자기술 등 차세대 핵심 산업에 모험자본을 공급할 계획이다. KB자산운용도 지난 7월 정부가... ","Thu, 25 Sep 2025 15:46:00 +0900"
2025-09-25 06:53:38,"인텔, 애플에 투자 요청…미 ‘인텔 살리기’ 계속",http://www.newstomato.com/ReadNews.aspx?no=1276207&inflow=N,뉴스토마토 = 이명신 기자 |  경영난을 겪고 있는 미국 <b>반도체</b> 기업 인텔이 애플에 투자를 요청한 것으로... 하지만 5년 전부터 애플은 자체 프로세서를 개발해 세계 최대 파운드리(<b>반도체</b> 위탁생산) 업체인 대만 TSMC에... ,"Thu, 25 Sep 2025 15:46:00 +0900"
2025-09-25 06:53:38,[포토] <b>반도체</b> 패키징 발전 정책 포럼,https://n.news.naver.com/mnews/article/030/0003354614?sid=105,<b>반도체</b> 패키징 발전 정책 포럼이 25일 서울 강남구 SC컨벤션센터에서 열렸다. 조태제 DGIST 센소리움연구소장을 좌장으로 열린 패널토론에서 이승우 유진투자증권 상무가 발언하고 있다. 왼쪽부터 안기현 한국<b>반도체</b>산... ,"Thu, 25 Sep 2025 15:44:00 +0900"
2025-09-25 06:53:38,HBM4 임박·범용 D램 꿈틀…다가 온 삼성전자 반등 신호탄 [소부장반차장...,https://n.news.naver.com/mnews/article/138/0002205881?sid=105,인공지능(AI) 인프라 적기 대응 실패로 쓴맛을 봤던 삼성전자 <b>반도체</b>(DS) 부문의 실적에 파란 불이 켜졌다.... '<b>반도체</b> 저승사자'로 불렸던 미국 투자은행 모건스탠리도 지난 21일(현지시간) 발표한 보고서를 통해 HBM의... ,"Thu, 25 Sep 2025 15:44:00 +0900"
2025-09-25 06:53:38,[박항준 칼럼] 초국가(Hyper-State) 시대의 도래,http://www.mhj21.com/169613,중국 역시 미국의 <b>반도체</b> 수출 통제에 맞서 독자적인 AI 칩 개발에 박차를 가하고 있다. 이는 각국이 ‘국제분업의 사슬’에서 벗어나 자립적 역량을 축적하며 초국가적 존재로 변모하고 있음을 보여준다. 이 새로운... ,"Thu, 25 Sep 2025 15:44:00 +0900"
2025-09-25 06:53:38,'AI 올인' 손정의 재산 54조원으로 껑충,https://n.news.naver.com/mnews/article/001/0015649141?sid=104,또한 서버 및 데이터센터용 중앙처리장치(CPU) 설계를 전문으로 하는 미국 <b>반도체</b> 설계업체 암페어컴퓨팅을 65억달러에 인수하기로 했다. 2016년에는 3조3천억엔을 들여 영국 <b>반도체</b> 설계업체 Arm을 인수했다. 앞서... ,"Thu, 25 Sep 2025 15:44:00 +0900"
2025-09-25 06:53:38,"포스코, 영일만4산업단지에 '산소공장' 준공···산업가스 시장 진출 본...",http://www.newsprime.co.kr/news/article.html?no=705909,"이를 통해 이차전지, <b>반도체</b>, 조선 등 전방산업의 산업가스 수급 안정화와 지역 경제 활성화에 기여할... 한편, 포스코는 향후 철강, 이차전지, <b>반도체</b>, 조선, 화학, 자동차 등 다양한 산업에 산업가스를 안정적으로... ","Thu, 25 Sep 2025 15:44:00 +0900"
2025-09-25 06:53:38,"한국폴리텍대학 포항캠퍼스, 원익QnC 채용연계 협약반 면접 진행",https://www.kbmaeil.com/article/20250925500487,채용연계과정은 <b>반도체</b> 쿼츠웨어 세계 1위 기업인 원익QnC와 포항캠퍼스가 2020년부터 공동 운영해온 대표 산학협력 프로그램이다. 선발된 학생들은 약 6개월간 기업 맞춤형 실무 교육을 받은 뒤 원익QnC 채용과... ,"Thu, 25 Sep 2025 15:44:00 +0900"
2025-09-25 06:53:38,원·달러 환율 다시 1400원대로···증시 부담 요인 될까,https://www.sisajournal-e.com/news/articleView.html?idxno=415560,<b>반도체</b> 업황 회복과 한국 경제 성장률 전망치 상향도 우려를 낮추는 요소로 분류된다. 한 투자업계 관계자는 &quot;외국인 투자자들이 환율만을 기준으로 매매를 결정하는 것은 아니다&quot;며 &quot;메모리 <b>반도체</b> 사이클이 반등... ,"Thu, 25 Sep 2025 15:44:00 +0900"
2025-09-25 06:53:38,[포토] <b>반도체</b> 패키징 발전 정책 포럼,https://n.news.naver.com/mnews/article/030/0003354612?sid=105,<b>반도체</b> 패키징 발전 정책 포럼이 25일 서울 강남구 SC컨벤션센터에서 열렸다. 조태제 DGIST 센소리움연구소장을 좌장으로 열린 패널토론에서 이승우 유진투자증권 상무가 발언하고 있다. 왼쪽부터 안기현 한국<b>반도체</b>산... ,"Thu, 25 Sep 2025 15:44:00 +0900"
2025-09-25 06:53:38,"DN솔루션즈, EMO 2025서 '비전 2032' 성과 발표…글로벌 톱 리더 입지 강...",https://www.straightnews.co.kr/news/articleView.html?idxno=282510,"지난 2년간 전 세계 30만 대 이상의 공작기계 공급을 달성했고, <b>반도체</b>·자동차 중심에서 항공우주·방위 산업 등으로 수요처를 다변화했다. 또 독일 R&amp;D 센터 안정화, 인도 신공장 착공, 미국 시카고 테크센터 개소... ","Thu, 25 Sep 2025 15:42:00 +0900"
2025-09-25 06:53:38,"포스코, 영일만산단에 산업가스공장 준공…이차전지 기업에 공급",https://n.news.naver.com/mnews/article/001/0015649131?sid=101,"앞으로 철강, 이차전지, <b>반도체</b>, 조선, 화학, 자동차 등 다양한 산업체에 산업가스를 공급할 계획이다. 신성원 포스코 경영기획본부장은 &quot;이 공장은 여러 협력사 및 고객사의 신뢰와 협력의 결실&quot;이라며 &quot;안전을 최우선... ","Thu, 25 Sep 2025 15:42:00 +0900"
2025-09-25 06:53:38,현대엔지니어링 '힐스테이트 용인포레' 25일 그랜드 오픈,https://www.dnews.co.kr/uhtml/view.jsp?idxno=202509251513586870131,더불어 지난 2월 착공을 알린 SK하이닉스 용인 <b>반도체</b> 클러스터와 세계 최대 규모로 조성될 용인 첨단 시스템<b>반도체</b> 국가산업단지가 인접해 미래가치 상승도 예상된다. 힐스테이트 용인포레의 주택홍보관은 경기도... ,"Thu, 25 Sep 2025 15:42:00 +0900"
2025-09-25 06:53:38,"포스코, 산업용가스 생산설비 25일 준공…제철소 외부에는 첫 준공 사례",https://n.news.naver.com/mnews/article/088/0000972399?sid=101,"이를 통해 2차전지, <b>반도체</b>, 조선 등 전방산업의 산업가스 수급 안정화와 지역 경제 활성화에 기여할... 한편, 포스코는 향후 철강, 2차전지, <b>반도체</b>, 조선, 화학, 자동차 등 다양한 산업에 산업가스를 안정적으로 공급할... ","Thu, 25 Sep 2025 15:42:00 +0900"
2025-09-25 06:53:38,[증권가로수] 신한운용/두나무/한공회,https://www.dnews.co.kr/uhtml/view.jsp?idxno=202509251529565110138,"이는 2분기 67 대비 26포인트 상승한 수치로, 새정부 출범과 한·미 관세협상, <b>반도체</b> 수출 증가, 국내총생산(GDP) 성장 등 긍정적 요인이 반영된 결과다. 4분기 전망 BSI도 94로 개선세가 지속될 것으로 조사됐다.... ","Thu, 25 Sep 2025 15:42:00 +0900"
2025-09-25 06:53:38,"미국 아리조나주 한인회, 이재준 수원시장 방문해 감사패 전달",https://n.news.naver.com/mnews/article/119/0003007514?sid=102,"이어 &quot;수원은 세계적인 혁신과 산업의 중심지로 인정받고 있으며, 아리조나 역시 첨단 제조와 <b>반도체</b> 분야에서 주도적 역할을 담당하고 있다&quot;며 &quot;이러한 공통의 강점을 바탕으로 양 지역사회가 새로운 기회를 함께... ","Thu, 25 Sep 2025 15:42:00 +0900"
2025-09-25 06:53:38,포스코퓨처엠 주가 다시 일어서나... &quot;기업가치에 비해 지나치게 하락&quot;,https://www.pinpointnews.co.kr/news/articleView.html?idxno=380286,아이티엠<b>반도체</b> 고려아연 엘앤에프 알루코 쎄노텍 대한유화 알엔투테크놀로지 유진테크놀로지도 시장의 주목을 받고 있다. 포스코퓨처엠의 도전은 위기를 기회로 전환하는 인내의 과정이다. 어려운 시기에도 흔들림... ,"Thu, 25 Sep 2025 15:42:00 +0900"
2025-09-25 06:53:38,"용인특례시, 산업단지와 지역 간 연결 도로망 대규모 확충",https://www.pointdaily.co.kr/news/articleView.html?idxno=271832,"용인특례시는 초대형 <b>반도체</b> 클러스터 조성사업이 진행됨에 따라 도로망 대폭 확충을 통한 시민... 이로써 인근 지역 교통 흐름이 개선되고, 향후 <b>반도체</b> 산업단지 간 물류 흐름과 지역 간 이동 편의도 증대될 것으로... ","Thu, 25 Sep 2025 15:42:00 +0900"
2025-09-25 06:53:38,"미국 아리조나주 한인회, 이재준 수원시장에 감사패 전달",https://www.kgnews.co.kr/news/article.html?no=866902,이어 &quot;수원은 세계적인 혁신과 산업의 중심지로 인정받고 있으며 아리조나 역시 첨단 제조와 <b>반도체</b> 분야에서 주도적 역할을 담당하고 있다&quot;며 &quot;공통의 강점을 바탕으로 양 지역사회가 새로운 기회를 함께 창출하길... ,"Thu, 25 Sep 2025 15:40:00 +0900"
2025-09-25 06:53:38,<b>반도체</b> 실험실 살펴보는 오세훈 시장,https://n.news.naver.com/mnews/article/003/0013505824?sid=100,오세훈 서울시장과 김동원 고려대학교 총장이 25일 오후 서울 성북구 고려대학교 미래융합기술관 대강당에서 열리는 이제는 이공계 전성시대 포럼 참석에 앞서 정운오IT교양관을 찾아 <b>반도체</b>공학과... ,"Thu, 25 Sep 2025 15:40:00 +0900"
2025-09-25 06:53:38,"KB금융, '생산적 금융 협의회' 출범",http://www.newswell.co.kr/news/articleView.html?idxno=13353,연내 1500억원 규모의 펀드를 조성해 △시스템<b>반도체</b> △바이오·헬스 △미래 모빌리티 △친환경·에너지 △로봇 △사이버보안·네트워크 △우주항공·해양 △차세대 원전 △양자기술 등 차세대 핵심산업에 모험자본을... ,"Thu, 25 Sep 2025 15:40:00 +0900"
2025-09-25 06:53:38,정운오IT교양관 찾은 오세훈-김동원,https://n.news.naver.com/mnews/article/003/0013505825?sid=100,오세훈 서울시장과 김동원 고려대학교 총장이 25일 오후 서울 성북구 고려대학교 미래융합기술관 대강당에서 열리는 이제는 이공계 전성시대 포럼 참석에 앞서 정운오IT교양관을 찾아 <b>반도체</b>공학과... ,"Thu, 25 Sep 2025 15:40:00 +0900"
2025-09-25 06:53:38,'<b>반도체</b>가 우리의 미래다',https://n.news.naver.com/mnews/article/003/0013505831?sid=100,오세훈 서울시장이 25일 오후 서울 성북구 고려대학교 미래융합기술관 대강당에서 열리는 이제는 이공계 전성시대 포럼 참석에 앞서 정운오IT교양관을 찾아 <b>반도체</b>공학과 FAB실험실을 살펴본 뒤 직접... ,"Thu, 25 Sep 2025 15:40:00 +0900"
2025-09-25 06:53:38,정운오IT교양관 찾은 오세훈-김동원,https://n.news.naver.com/mnews/article/003/0013505821?sid=100,오세훈 서울시장과 김동원 고려대학교 총장이 25일 오후 서울 성북구 고려대학교 미래융합기술관 대강당에서 열리는 이제는 이공계 전성시대 포럼 참석에 앞서 정운오IT교양관을 찾아 <b>반도체</b>공학과... ,"Thu, 25 Sep 2025 15:40:00 +0900"
2025-09-25 06:53:38,한-체코 경제협력 강화…원전부터 전기차까지 협력 확대,https://www.gokorea.kr/news/articleView.html?idxno=840886,"또한, 전통적인 자동차 산업뿐만 아니라 <b>반도체</b>, 전기차 및 배터리 등 첨단산업 영역으로 협력을 확대할 방침이다. 방산, 에너지 전환 및 수소 기술 분야에서도 협력을 추진하기로 결정했다. 주 7회로 직항 노선이... ","Thu, 25 Sep 2025 15:40:00 +0900"
2025-09-25 06:53:38,<b>반도체</b> 웨이퍼 감사패 받은 오세훈 시장,https://n.news.naver.com/mnews/article/003/0013505823?sid=100,오세훈(오른쪽 두 번째) 서울시장이 25일 오후 서울 성북구 고려대학교 미래융합기술관 대강당에서 열리는 이제는 이공계 전성시대 포럼 참석에 앞서 정운오IT교양관을 찾아 <b>반도체</b>공학과 FAB실험실을... ,"Thu, 25 Sep 2025 15:40:00 +0900"
2025-09-25 06:53:38,SK하이닉스·GC녹십자도 VM웨어 대신 뉴타닉스 선택…제조 현대화 꾀해,https://n.news.naver.com/mnews/article/138/0002205874?sid=105,향후 용인 <b>반도체</b> 클러스터 신규 라인에서도 대규모 가상화와 자동화 수요가 예상돼 장기적 관점에서 전환 검토가 불가피했다는 설명이다. 그는 또 “<b>반도체</b> 산업은 라인이 잠깐만 멈춰도 하루 수백억~수천억원 손실이... ,"Thu, 25 Sep 2025 15:40:00 +0900"
2025-09-25 06:53:38,"탄소나노산업협회, 베트남 시장개척단 584억 규모 수출상담",http://amenews.kr/news/view.php?idx=63991,"특히 <b>반도체</b>, 전기·전자, 배터리, 신재생에너지 분야에서 글로벌 기업의 투자가 확대되며, 부품·소재의 현지 조달 수요가 빠르게 늘어나고 있어 한국 소부장 기업들이 전략적으로 공급망에 진입할 기회가 크다고... ","Thu, 25 Sep 2025 15:40:00 +0900"
2025-09-25 06:53:38,웨이퍼 살펴보는 오세훈 시장,https://n.news.naver.com/mnews/article/003/0013505820?sid=100,오세훈 서울시장과 김동원 고려대학교 총장이 25일 오후 서울 성북구 고려대학교 미래융합기술관 대강당에서 열리는 이제는 이공계 전성시대 포럼 참석에 앞서 정운오IT교양관을 찾아 <b>반도체</b>공학과... ,"Thu, 25 Sep 2025 15:40:00 +0900"
2025-09-25 06:53:38,"삼성전자, XR기기 '무한' …수익성보단 시장 확보 차원",https://www.newstopkorea.com/news/articleView.html?idxno=40012,핵심 부품인 애플리케이션 프로세서(AP) <b>반도체</b>는 퀄컴의 '스냅드래곤 XR2+ 2세대(Gen2)' 칩셋을 삼성전자 파운드리 사업부에서 만들어 공급한다. 마이크로 유기발광다이오드(OLED) 패널은 계열사 삼성디스플레이로부터... ,"Thu, 25 Sep 2025 15:40:00 +0900"
2025-09-25 06:53:38,"신한자산 TDF, 시장 100% 커질 때 120% 성장",https://www.straightnews.co.kr/news/articleView.html?idxno=282509,특히 시장 상황에 따라 미국 <b>반도체</b> 및 기술주 비중을 조정하고 금융 및 고배당주 비중을 확대하는 등 적극적인 리밸런싱 전략으로 안정성과 성장성을 동시에 추구한다. 이러한 전략적 운용 덕분에... ,"Thu, 25 Sep 2025 15:40:00 +0900"
