DateTime,Title,Link,Description,PubDate
2025-08-24 23:21:57,"'설비감축 지상과제' 석호, 신사업 멈추고 생존 올인…中, 로봇페스티벌...",https://n.news.naver.com/mnews/article/011/0004524560?sid=101,AI·<b>반도체</b>·자율주행·로봇 등 차세대 산업이 부상하고 있다. 상하이종합지수는 올해 15% 이상 상승해... AI·<b>반도체</b>·자율주행·로봇 등이 차세대 수혜 산업으로 부상하고 있다”고 설명했다. 상하이종합지수는 올해 15... ,"Mon, 25 Aug 2025 08:20:00 +0900"
2025-08-24 23:21:57,"삼정KPMG, '소프트웨어 업종 상장예비기업 세미나' 27일 개최",https://www.etoday.co.kr/news/view/2499634,"올해 상반기 기업공개(IPO) 기업 수는 40개사로, 최근 5개년 평균(48개사) 대비 다소 낮았으나, 하반기에는 미국의 금리 인하 가능성, 글로벌 M&amp;A 활동 재개, AI·<b>반도체</b> 산업 중심의 투자 확대 등으로 IPO 시장의 회복세가... ","Mon, 25 Aug 2025 08:20:00 +0900"
2025-08-24 23:21:57,[오늘의 투자전략] &quot;매크로 불확실성 여전…엔비디아 실적 주목해야&quot;,https://www.etoday.co.kr/news/view/2499627,"국내 <b>반도체</b>주 전반에 걸쳐 영향력을 행사할 것이기에 주 후반에는 해당 기업 실적 이벤트가 증시 중심에... 더해 <b>반도체</b>, 의약품 등 개별 품목 관세율 협상이 의제로 등장할지가 또 다른 관전 포인트”라고 밝혔다.... ","Mon, 25 Aug 2025 08:20:00 +0900"
2025-08-24 23:21:57,"[Y인사이트] 싸이프, &quot;국산 모델링 툴 가격·기술 경쟁력 확보&quot;",http://www.thelec.kr/news/articleView.html?idxno=39795,김대용 싸이프 CEO [사진=한지영 프로] 국내 스타트업 싸이프가 <b>반도체</b> 설계 소프트웨어(EDA) 분야에 도전장을 냈다. 2023년 설립된 이 회사는 <b>반도체</b> 소자의 전기적 특성을 시뮬레이션하는 모델링 툴을 자체 기술로... ,"Mon, 25 Aug 2025 08:18:00 +0900"
2025-08-24 23:21:57,"소프트뱅크, 'AI 붐' 타고 기술 랠리… 인텔 투자·OpenAI 협력 '승부수...",http://www.g-enews.com/ko-kr/news/article/news_all/2025082508111383090c8c1c064d_1/article.html,"손정의(Masayoshi Son) 회장은 &quot;인텔에 대한 전략적 투자는 첨단 <b>반도체</b> 제조 및 공급이 미국에서 더욱 확대될 것이라는 우리의 믿음을 반영한다&quot;고 말했다. 소프트뱅크는 인텔 외에도 영국 칩 설계사 Arm, AI 칩... ","Mon, 25 Aug 2025 08:14:00 +0900"
2025-08-24 23:21:57,[뉴욕마켓워치] 파월의 비둘기 매직쇼에 기립박수…주식·채권↑달러↓,https://news.einfomax.co.kr/news/articleView.html?idxno=4371154,미국 <b>반도체</b> 기업 인텔은 미국 정부가 10%의 지분을 투자할 것이라는 소문에 대해 도널드 트럼프 미국 대통령이 인정하면서 주가가 5% 이상 상승했다. 노스라이트자산운용의 크리스 자카렐리 최고투자책임자(CIO)는... ,"Mon, 25 Aug 2025 08:12:00 +0900"
2025-08-24 23:21:57,"대전시, 2026년 '대전 우수과학기술인상' 제정…과학수도 위상 강화",https://www.ccdailynews.com/news/articleView.html?idxno=2363321,"기초과학은 물리·화학·생명·수학·지구과학 등 학문적 성취를, 산업기술은 ICT·<b>반도체</b>·바이오헬스·소부장 등에서의 기술 혁신을, 창업·사업화는 투자 유치, 매출, 고용 창출 같은 지표를 중심으로 평가한다. 선발... ","Mon, 25 Aug 2025 08:10:00 +0900"
2025-08-24 23:21:57,"&quot;주간 코스피, 3,200선 안착 시도…엔비디아 실적·한미 정상회담·파월...",https://www.news2day.co.kr/article/20250825500006,"엔비디아 실적 발표…국내 <b>반도체</b>주 향방 한미 정상회담, 금통위 국내 변수도 주목 키움증권(039490)은... 특히 엔비디아 실적은 SK하이닉스(000660)와 삼성전자(005930) 등 국내 <b>반도체</b>주 전반에 영향력을 행사할 것으로... ","Mon, 25 Aug 2025 08:08:00 +0900"
2025-08-24 23:21:57,"[더벨]'엠피닉스 인수' bnw인베, 첨단 제조 스케일업 꾀한다",https://www.thebell.co.kr/free/content/ArticleView.asp?key=202508211609262200106237,bnw인베는 2013년 삼성전자 <b>반도체</b> 제조부문 사장 출신 김재욱 대표가 설립한 사모펀드 운용사로 <b>반도체</b>·배터리 등 첨단 제조 분야에서 두각을 나타내고 있다. 지난해에는 4680억원 규모의 3호 블라인드 펀드를... ,"Mon, 25 Aug 2025 08:08:00 +0900"
2025-08-24 23:21:57,"한투증권 &quot;中, 신흥국 투자 핵심 부상…홍콩·성장 업종 선호&quot;",https://n.news.naver.com/mnews/article/001/0015583827?sid=101,"그러면서 &quot;본토보다 홍콩 증시를, 가치보다 성장 업종을 선호한다&quot;며 관심 업종으로 AI(<b>반도체</b>), 휴머노이드 로봇, 플라잉카(UAM), 항공우주, 신소재, 바이오 등을 제시했다. 아울러 향후 12개월 상해종합지수는 3,260∼4... ","Mon, 25 Aug 2025 08:06:00 +0900"
2025-08-24 23:21:57,"[미리보는 증시재료] '한미 정상회담·잭슨홀' 변수 등장, 코스피 조정장...",https://www.newspim.com/news/view/20250822000893,오는 27일에는 미국 <b>반도체</b> 기업 엔비디아의 2분기 실적 발표도 예정돼 있다. 생성형 인공지능(AI) 수요... 국내 증시에서도 관련 <b>반도체</b>·AI주는 이미 실적 기대감을 선반영한 상태로 발표 결과에 따라 단기 수급이 갈릴... ,"Mon, 25 Aug 2025 08:05:00 +0900"
2025-08-24 23:21:57,"SK에코, 환경사업 털고 건전성 개선 효과 '톡톡'",https://dealsite.co.kr/articles/146828,우선 <b>반도체</b>·AI 데이터센터 등 첨단산업을 중심으로 한 사업 포트폴리오를 강화한다는 방침만 알렸다.... SK에코플랜트 관계자는 &quot;이번 리밸런싱을 통해 재무건전성을 높이고 <b>반도체</b>·AI 등 첨단산업 중심의 사업... ,"Mon, 25 Aug 2025 08:02:00 +0900"
2025-08-24 23:21:57,[더벨][엘에스이 IPO]모회사 주주환원책 확대에도 의견차 여전,https://www.thebell.co.kr/free/content/ArticleView.asp?key=202508221655234760106837,한편 회사 측은 엘에스이 실적 비중의 경우 올해 연말에는 50% 수준으로 낮아질 것이며 내년에는 차세대 <b>반도체</b> 소재 매출 등으로 인해 비중은 더욱 줄어들 것이라고 밝혔다.,"Mon, 25 Aug 2025 08:02:00 +0900"
2025-08-24 23:21:57,"[더벨]'세컨더리 명가' 얼머스인베, 후속펀드 청신호",https://www.thebell.co.kr/free/content/ArticleView.asp?key=202508221412080320107547,이외에 △<b>반도체</b> 칩 검사기업 테라뷰 △빅데이터보안기업 S2W △맞춤형 <b>반도체</b> 설계전문기업 세미파이브 등의 포트폴리오가 IPO를 추진 중이다. 2024 세컨더리펀드는 얼머스인베스트먼트 창업자인 손양철 대표이사가... ,"Mon, 25 Aug 2025 08:02:00 +0900"
2025-08-24 23:21:57,과학수도 대전시 ‘대전 우수과학기술인상’ 제정,https://www.kukinews.com/article/view/kuk202508250009,"기초과학은 물리·화학·생명·수학·지구과학 등 학문적 성과를, 산업기술은 ICT·바이오헬스·<b>반도체</b>·소부장 등 기술혁신과 사업화 성과를, 창업·사업화는 스핀오프·투자유치·매출성과·고용창출 등 지표를 중점... ","Mon, 25 Aug 2025 08:00:00 +0900"
2025-08-24 23:21:57,"불황 속 영토 확장 나선 K방산, 글로벌 시장 사로잡은 무기는?",https://n.news.naver.com/mnews/article/586/0000110090?sid=101,또 조선·자동차·<b>반도체</b> 등 민간 산업 기술력을 접목해 원가를 절감한다. 서방국에 비해 낮은 인건비도 가격 경쟁력을 뒷받침한다. 빠른 납기가 가능한 배경으로는 국내 방산 업체들의 수직계열화된 생산구조가... ,"Mon, 25 Aug 2025 08:00:00 +0900"
2025-08-24 23:21:57,[주간증시전망] 매크로 이슈 해소···다시 우상향 기대감↑,https://www.seoulfn.com/news/articleView.html?idxno=604662,"<b>반도체</b> 관련주들도 오는 28일 엔비디아의 실적발표를 앞두고 소폭 상승했다. 다만, 제롬 파월 미국 연방준비제도(연준, Fed) 의장의 잭슨홀 연설을 앞두고 경계감이 나타나면서 반등은 제한됐다. 외국인은 지난주 9839억원... ","Mon, 25 Aug 2025 08:00:00 +0900"
2025-08-24 23:21:57,[박상욱의 기후 1.5] 줄긴 줄었는데…갈 길 먼 온실가스 감축,https://n.news.naver.com/mnews/article/437/0000454050?sid=102,"철강과 석유화학, 시멘트, 정유, <b>반도체</b> 등 주요 다배출 업종 가운데 철강 배출량은 2023년의 1억... <b>반도체</b> 및 디스플레이 부문의 배출은 전년 대비 약 90만톤 감소한 270만톤을 기록했고요. 수송부문 또한 지난해... ","Mon, 25 Aug 2025 08:00:00 +0900"
2025-08-24 23:21:57,"한일 경제협력 복원, <b>반도체</b>·배터리 동맹 시동",https://www.ziksir.com/news/articleView.html?idxno=101602,"한국과 일본이 <b>반도체</b>와 배터리를 중심으로 한 경제안보 동맹을 본격화하며 공급망 불안과 기술 경쟁 심화에 공동 대응하기로 했다.  [삼성전자, 삼성SDI] 한국과 일본이 <b>반도체</b>와 배터리를 중심으로 한 경제안보 동맹을... ","Mon, 25 Aug 2025 08:00:00 +0900"
2025-08-24 23:21:57,"대전시, ‘대전 우수과학기술인상’ 제정…과학수도 위상 UP",https://n.news.naver.com/mnews/article/016/0002518620?sid=101,"기초과학은 물리·화학·생명·수학·지구과학 등 학문적 성과를, 산업기술은 ICT·바이오헬스·<b>반도체</b>·소부장 등 기술혁신과 사업화 성과를, 창업·사업화는 스핀오프·투자유치·매출성과·고용창출 등 지표를 중점... ","Mon, 25 Aug 2025 08:00:00 +0900"
2025-08-24 23:21:57,"&quot;동맹인가 종속인가&quot;···한미 정상회담, <b>반도체</b> 협력 '빅게임'",http://www.enewstoday.co.kr/news/articleView.html?idxno=2319465,"핵심 의제는 첨단 제조업과 공급망, 특히 <b>반도체</b> 협력. 미·중 전략 경쟁이 격화하는 가운데, 한국이 메모리 <b>반도체</b> 강점을 유지하며 미국과 안정적 협력 틀을 마련할 수 있을지가 주목된다. 회담이 '동맹 현대화'로... ","Mon, 25 Aug 2025 08:00:00 +0900"
2025-08-24 23:21:57,'비둘기' 파월에 美 증시 환호…한미 정상회담 임박[뉴스새벽배송],https://n.news.naver.com/mnews/article/018/0006097940?sid=101,"미국 정부가 <b>반도체</b> 대기업 인텔 지분 약 10%를 확보하는 이례적 합의를 체결했다. 트럼프 대통령은 2주... 美 정부, 인텔 지분 10% 확보…트럼프 “인텔 되살릴 좋은 거래” -미국 정부가 <b>반도체</b> 대기업 인텔 지분 약 10... ","Mon, 25 Aug 2025 07:59:00 +0900"
2025-08-24 23:21:57,"&quot;신사업 멈추고 생존 올인&quot; 석화, 설비감축 ‘지상과제’…“스테이블...",https://n.news.naver.com/mnews/article/011/0004524549?sid=101,임성호 종로학원 대표는 “자사고·특목고·영재학교 출신 학생들의 대학 선호도를 보면 의대에 집중돼 있다”며 “<b>반도체</b> 등 첨단학과 같은 대기업 계약학과도 생각한 것으로 보인다”고 설명했다. 6. 금융AX 정조준... ,"Mon, 25 Aug 2025 07:58:00 +0900"
2025-08-24 23:21:57,"&quot;산업밀착형 특화인재 양성&quot; LG, 국내 첫 사내 AI대학원 만든다…“은행...",https://n.news.naver.com/mnews/article/011/0004524547?sid=101,있다”며 “<b>반도체</b> 등 첨단학과 같은 대기업 계약학과도 생각한 것으로 보인다”고 설명했다. 4. 금융AX... 행정부가 <b>반도체</b> 기업 인텔의 지분 약 10%를 확보하며 최대주주가 됐다. 미 정부가 획득한 인텔 지분율은 9.9... ,"Mon, 25 Aug 2025 07:56:00 +0900"
2025-08-24 23:21:57,"삼성 <b>반도체</b>, AI 설계 에이전트 도입…‘초격차 재건' 신무기",https://n.news.naver.com/mnews/article/011/0004524546?sid=101,삼성전자가 <b>반도체</b> 설계 역량을 강화하기 위해 인공지능(AI) 에이전트 기술을 도입한다.방대한 양의 데이터를 빠르게 처리하기 위해 복잡해지고 있는 첨단 <b>반도체</b> 설계 역량을 AI 기술을 통해 비약적으로 키우는... ,"Mon, 25 Aug 2025 07:56:00 +0900"
2025-08-24 23:21:57,대신證 “그린라이트 켜진 <b>반도체</b>株…삼성전자·하이닉스 매수 적기”,https://www.etoday.co.kr/news/view/2499620,이투데이=김범근 기자 | 대신증권이 2026년 HBM(고대역폭메모리) 물량 협상이 구체화되고 AI 수요가 일반 서버로 확산되고 있다며 <b>반도체</b> 업종에 ‘그린라이트’가 켜졌다고 평가했다. 업황 불확실성이 줄어드는 만큼... ,"Mon, 25 Aug 2025 07:56:00 +0900"
2025-08-24 23:21:57,"&quot;PCE 지표 첫 관문&quot; 美연준, 금리인하 폭은 '신중론'…&quot;데이터센터 블루...",https://n.news.naver.com/mnews/article/011/0004524545?sid=101,■ 미국 <b>반도체</b> 정책 리스크 확대와 아시아 공급망 재편: 트럼프 행정부가 인텔 지분 9.9%를 확보해 최대주주가 되며 정부 주도 <b>반도체</b> 정책이 본격화되고 있어 TSMC와 삼성전자 등 대미 투자기업들의 지분 인수 압박... ,"Mon, 25 Aug 2025 07:54:00 +0900"
2025-08-24 23:21:57,대전시 ‘우수과학기술인상’ 제정…과학수도 위상 높인다,https://n.news.naver.com/mnews/article/421/0008445223?sid=102,"기초과학은 물리·화학·생명·수학·지구과학 등 학문적 성과, 산업기술은 ICT·바이오헬스·<b>반도체</b>·소부장 등 기술혁신과 사업화 성과, 창업·사업화는 스핀오프·투자유치·매출성과·고용창출 등 지표를 중점 평가한다.... ","Mon, 25 Aug 2025 07:52:00 +0900"
2025-08-24 23:21:57,"[더벨]김종복 태성 전 부사장, 블록딜로 400억 확보",https://www.thebell.co.kr/free/content/ArticleView.asp?key=202508201641280200103247,회사는 <b>반도체</b>용 인쇄회로기판(PCB) 공정 설비를 메인 아이템으로 갖추고 있는데 지난 4월을 기점으로 주가가 상승 국면에 놓여 있는 상태다. 4월 초 1만7000원대를 횡보하던 태성의 주가는 이후 상승 곡선을 그리면서... ,"Mon, 25 Aug 2025 07:52:00 +0900"
2025-08-24 23:21:57,"EU, 美와 합의 옹호 &quot;무역 전쟁하면 러시아-중국만 기뻐&quot;",https://n.news.naver.com/mnews/article/014/0005395875?sid=104,아울러 양국은 항공기와 <b>반도체</b> 등 전략 품목에 대해 서로 관세를 부과하지 않기로 합의했다. 폰 데어... 미국과 EU는 지난 21일 공동성명을 내고 미국이 유럽산 의약품과 <b>반도체</b>에 15%를 초과하는 관세를 부과하지... ,"Mon, 25 Aug 2025 07:52:00 +0900"
2025-08-24 23:21:57,美 대러 제재 '구멍투성이'…손 못댄 中금융기관이 돈줄 우회로,https://n.news.naver.com/mnews/article/421/0008445217?sid=104,NYT는 올해 4월 모스크바에서 열린 전자 박람회에 미국의 제재 대상인 홍콩 <b>반도체</b>기업 올칩스가 있었다고 전했다. 올칩스는 러시아의 순항미사일에 들어가는 부품을 판매한다. 대금 결제 방법을 묻자 올칩스 측은... ,"Mon, 25 Aug 2025 07:47:00 +0900"
2025-08-24 23:21:57,[뉴욕증시] 27일 엔비디아 2분기 실적 발표…이번 주 주요 일정,https://n.news.naver.com/mnews/article/055/0001286597?sid=101,"AI와 <b>반도체</b> 업종의 방향성을 가늠해볼 수 있기 때문입니다. 또, 곧이어 발표될 7월 근원 PCE 물가지수는 전년 동기 대비 2.9% 상승할 것으로 예상되고 있습니다. 지난 금요일 미국 시장에선 파월 의장의 발언으로 빅테크... ","Mon, 25 Aug 2025 07:47:00 +0900"
2025-08-24 23:21:57,<b>반도체</b> 지분 가진 미 정부‥삼성·SK에도 요구? [뉴스 속 경제],https://n.news.naver.com/mnews/article/214/0001444798?sid=101,"◀ 앵커 ▶ 한때 세계 최고 <b>반도체</b> 회사였던 인텔이, 미국 정부에 지분 10%를 넘기기로 했습니다. 미국 정부가 상징적 <b>반도체</b> 기업의 최대 주주가 된 사건. 어떤 파장이 있을지, 우리에겐 어떤 영향이 있을지. 이성일 경제... ","Mon, 25 Aug 2025 07:46:00 +0900"
2025-08-24 23:21:57,"인하대학교, <b>반도체</b> 교육동 착공… 미래 인재 양성 본격화",https://www.lecturernews.com/news/articleView.html?idxno=185486,<b>반도체</b> 교육동 착공식에서 주요 내외빈이 테이프 커팅식에서 기념사진을 촬영하고 있다. [사진출처=인하대학교] 인하대학교(총장 조명우)는 본교는 20일 <b>반도체</b> 교육동 착공식을 개최했다고 밝혔다. 2026년 초 완공을... ,"Mon, 25 Aug 2025 07:46:00 +0900"
2025-08-24 23:21:57,"FT “트럼프와 첫 회담 이재명 대통령, 주한미군·무역·북핵 '삼중 과제...",http://www.g-enews.com/ko-kr/news/article/news_all/2025082507425755319a1f309431_1/article.html,"이 대통령은 이번 회담에서 지난달 타결된 한·미 무역협정을 확정 짓는 동시에, <b>반도체</b>·조선·원자력 등 제조업 분야의 대미 투자 확대 구상을 제시할 계획이다. FT는 대통령실 고위 관계자가 이번 회담의 중요한 목표 중... ","Mon, 25 Aug 2025 07:46:00 +0900"
2025-08-24 23:21:57,"대전시, '대전 우수과학기술인상' 제정… 과학수도 위상 더 높인다",https://daily.hankooki.com/news/articleView.html?idxno=1261423,"기초과학은 물리·화학·생명·수학·지구과학 등 학문적 성과를, 산업기술은 ICT·바이오헬스·<b>반도체</b>·소부장 등 기술혁신과 사업화 성과를, 창업·사업화는 스핀오프·투자유치·매출성과·고용창출 등 지표를 중점... ","Mon, 25 Aug 2025 07:44:00 +0900"
2025-08-24 23:21:57,"삼성, 올 상반기 中 매출 1년새 3.5조 감소",https://dealsite.co.kr/articles/146965,"美, 대중국 <b>반도체</b> 제재 여파…미국 매출은 4.1조 늘어 삼성전자가 올해 상반기 중국에서 거둔 매출이 1년 전보다 3조5000억원 줄어든 것으로 나타났다. 글로벌 경기 둔화에 더해 미국의 대중 <b>반도체</b> 규제와 현지... ","Mon, 25 Aug 2025 07:42:00 +0900"
2025-08-24 23:21:57,"하나증권 &quot;펨트론, 새로운 전환점 기대..기초 체력 강화 예상&quot;",http://kpenews.com/View.aspx?No=3756703,펨트론의 8800WI-HBM(고대역폭메모리) 장비가 국내 IDM(종합<b>반도체</b>회사)을 대상으로 한 품질 테스트를... 펨트론은 1분기 SMT(표면실장기술) 장비 수주 둔화로 외형 축소와 적자가 불가피했지만 2분기에는 <b>반도체</b> 장비... ,"Mon, 25 Aug 2025 07:38:00 +0900"
2025-08-24 23:21:57,“HBM 물량 협상 마무리…<b>반도체</b> 업황 긍정적”,https://n.news.naver.com/mnews/article/018/0006097922?sid=101,"고대역폭메모리(HBM) 물량 협상이 마무리 단계에 접어들고 있고, 일반 서버의 수요도 상향되고 있어 <b>반도체</b>주에 ‘그린라이트’가 들어왔다는 평가가 나왔다. 류형근 대신증권 연구원은 26일 보고서를 통해 “<b>반도체</b>... ","Mon, 25 Aug 2025 07:38:00 +0900"
2025-08-24 23:21:57,"폰데어라이엔 “EU-美 관세 합의, 완벽하진 않아도 안정성 확보”",http://www.g-enews.com/ko-kr/news/article/news_all/2025082507304426559a1f309431_1/article.html,이번 합의는 도널드 트럼프 미국 대통령과 지난달 체결한 내용으로 자동차·의약품·<b>반도체</b>·목재 등 다양한 품목에 대한 미국의 관세를 최대 15%로 제한하는 것이 핵심이다. 폰데어라이엔 위원장은 이에 대해 “좋지만... ,"Mon, 25 Aug 2025 07:32:00 +0900"
2025-08-24 23:21:57,[뉴스타트] 한미 정상회담 D-1...최대 변수는 '트럼프의 입'?,https://n.news.naver.com/mnews/article/052/0002237411?sid=101,아직 <b>반도체</b> 품목관세를 발표하지 않았습니다. 그러다 보니까 기존에 우리 정부에서 발표한 3500억 달러 투자의 구체적인 실행 계획뿐만 아니라 추가 투자 여부를 발표할 가능성이 크다고 보고 있는데 <b>반도체</b> 같은 경우는... ,"Mon, 25 Aug 2025 07:32:00 +0900"
2025-08-24 23:21:57,[자막뉴스] '조선업을 위대하게' 외치는 미국...최대 경쟁자 마주한 한...,https://n.news.naver.com/mnews/article/052/0002237410?sid=104,<b>반도체</b>의 경우에도 관세로 인한 타격이 임박해 한미 정상회담에서 선제 대응이 절실합니다. [매튜 말리... 시장은 어느 정도 변동성을 보이고 있습니다.] 트럼프 대통령이 조만간 발표할 <b>반도체</b>에 대한 관세가... ,"Mon, 25 Aug 2025 07:31:00 +0900"
2025-08-24 23:21:57,"[더벨][한미 정상회담 경제사절단]'재계 1순위' 이재용, 오랜 침묵 끝 '...",https://www.thebell.co.kr/free/content/ArticleView.asp?key=202508220958154160105774,우선 국내 핵심 산업이자 삼성전자의 핵심 사업 <b>반도체</b>와 맞물린 전략적 결정이 한미 정상회담 후 어떻게 전개될 지 초미의 관심을 끌고 있기 때문이다. 최근 정상회담을 앞두고 트럼프 행정부는 글로벌 <b>반도체</b> 기업의... ,"Mon, 25 Aug 2025 07:28:00 +0900"
2025-08-24 23:21:57,[마켓 프리뷰] 박스권 갇힌 코스피…이번 주 한·미 정상회담 대기,https://n.news.naver.com/mnews/article/374/0000459220?sid=101,"- 한미 정상회담 통상의제, 마스가·대미 투자·원전 협력 - <b>반도체</b>·배터리·조선업 등 제조업 및 첨단기술... 주목 - <b>반도체</b>·배터리·차·바이오 등 전략 산업 협력 강화 논의 - 美 &quot;대미 투자 수익 90% 내놔야&quot;…韓... ","Mon, 25 Aug 2025 07:27:00 +0900"
2025-08-24 23:21:57,"파월 '금리인하' 발언에 시장 환호…美정부, 인텔 지분 10% 인수 '빅딜' ...",https://n.news.naver.com/mnews/article/215/0001221150?sid=101,행정부는 <b>반도체</b> 기업 인텔의 지분 10%를 인수하는 전례 없는 결정을 발표했다. 통화정책의 전환과 산업... 트럼프 행정부가 <b>반도체</b> 기업 인텔의 지분 10%를 89억 달러(약 12조 원)에 인수하며 2대 주주로 등극한 것이다.... ,"Mon, 25 Aug 2025 07:24:00 +0900"
2025-08-24 23:21:57,"美 정부, 인텔에 89억 달러 투자…지분 약 10% 확보 -[美증시 특징주]",https://n.news.naver.com/mnews/article/215/0001221148?sid=101,"트럼프 행정부가 <b>반도체</b> 지원법, 즉 칩스법 자금을 받는 일부 기업에 대해서는 지분 참여를 검토하고 있지만, TSMC와 마이크론 같은 미국 내 투자를 늘리고 있는 기업들의 지분은 취득하지 않을 것이라고 밝혔습니다.... ","Mon, 25 Aug 2025 07:21:00 +0900"
2025-08-24 23:21:57,[Who Is ?] 김종훈 한미글로벌 회장,https://www.businesspost.co.kr/BP?command=article_view&num=408835,"국내 건설경기 침체에도 해외사업 호조와 <b>반도체</b>, 2차전지 등 하이테크 분야 매출 확대 등에 힘입어 안정적인 실적 성장세를 이어가고 있다. 한미글로벌은 지속적인 해외 수주가 실적 성장의 핵심으로 작용했다.... ","Mon, 25 Aug 2025 07:16:00 +0900"
2025-08-24 23:21:57,[Who Is ?] 곽노정 SK하이닉스 대표이사 사장,https://www.businesspost.co.kr/BP?command=article_view&num=408836,메모리<b>반도체</b> 선두를 이어가고자 차세대 HBM 기술과 대규모 생산시설 투자를 진행하고 있다. 1965년... SK하이닉스의 대표적 <b>반도체</b> 기술 전문가로 꼽힌다. 직원들과 적극적 소통을 시도하고 있다. ◆ 경영활동의... ,"Mon, 25 Aug 2025 07:16:00 +0900"
2025-08-24 23:21:57,"대전시 우수과학기술인상 제정, 2026년부터 시상",https://www.goodmorningcc.com/news/articleView.html?idxno=428860,"기초과학은 물리·화학·생명·수학·지구과학 등 학문적 성과를, 산업기술은 ICT·바이오헬스·<b>반도체</b>·소부장 등 기술혁신과 사업화 성과를, 창업·사업화는 스핀오프·투자유치·매출 성과·고용 창출 등 지표를 중점... ","Mon, 25 Aug 2025 07:12:00 +0900"
2025-08-24 23:21:57,"[더벨][한미 정상회담 경제사절단]SK, <b>반도체</b>·에너지 '美 요구' 총망라...",https://www.thebell.co.kr/free/content/ArticleView.asp?key=202508211515038360102715,"SK는 <b>반도체</b>와 배터리, 바이오, 에너지 등 도널드 트럼프 행정부가 주목하는 핵심 분야를 모두 영위하고... 한미 협력 분야는 크게 조선과 <b>반도체</b>, 배터리, 바이오, 에너지 등이다. SK그룹은 조선을 제외한 4개 사업을... ","Mon, 25 Aug 2025 07:12:00 +0900"
