DateTime,Title,Link,Description,PubDate
2026-06-30 05:54:29,[인사] 구미시,https://www.cnbnews.com/news/articleView.html?idxno=1006248,우정현 ▲<b>반도체</b>방산과장 직무대리 시병연 ▲민원봉사과장 직무대리 김율자 ▲양포동장 직무대리 김영찬 ▲투자유치과장 직무대리 김정욱 ▲옥성면장 직무대리 김귀숙 ▲장천면장 직무대리 위상열 ▲종합허가과장... ,"Tue, 30 Jun 2026 14:52:00 +0900"
2026-06-30 05:54:29,"삼성 초기업노조, 최승호 위원장 재신임…내년 '<b>반도체</b> 분리교섭' 본격",http://www.metroseoul.co.kr/article/20260630500315,압도적 찬성으로 재신임된 최 위원장은 2027년 교섭에서 <b>반도체</b>(DS·디바이스솔루션) 부문을 앞세운... 현재 삼성전자 노사 교섭은 전사 단위로 이뤄지지만 <b>반도체</b> 사업의 특수성을 고려한 별도 교섭 체계가 필요하다는... ,"Tue, 30 Jun 2026 14:52:00 +0900"
2026-06-30 05:54:29,광주시민단체협의회 &quot;896조 <b>반도체</b> 투자 환영…호남 도약 전환점&quot;,https://news.dealsitetv.com/articles/172609,전남광주 <b>반도체</b> 클러스터 조성 계획을 환영하며 지역 산업 대전환의 계기가 될 것으로 기대했다. 지역 시민사회 26개 단체로 구성된 광주시민단체협의회는 30일 성명을 내고 “호남지역 <b>반도체</b> 클러스터 구축 등을 담은... ,"Tue, 30 Jun 2026 14:52:00 +0900"
2026-06-30 05:54:29,"[데스크 칼럼] AI 금융의 질주, ‘포모’와 거버넌스 부재",https://www.viva100.com/article/20260630500356,"최근 글로벌 자본시장을 지배한 키워드는 인공지능(AI)과 이 기술에 올라탄 <b>반도체</b> 랠리였다. 데이터센터·전력망·<b>반도체</b>로 자금이 쏠리고, AI 서사에서 소외된 기업의 주가는 저평가되는 구조가 고착화됐다. 빅테크들의... ","Tue, 30 Jun 2026 14:52:00 +0900"
2026-06-30 05:54:29,"이 대통령, 호남·충청·영남에서 ‘첨단산업 발전비전 국민보고회’ 연...",https://n.news.naver.com/mnews/article/032/0003455180?sid=100,전날 4700조원 규모의 인공지능(AI)·<b>반도체</b> 투자 계획을 발표한 삼성전자와 SK하이닉스 등이 호남 투자... 호남권 <b>반도체</b> 팹 4기 건설 등 4700조원 규모의 투자 계획을 공개했다. 이중 3500조원이 <b>반도체</b> 분야에 투입된다.... ,"Tue, 30 Jun 2026 14:52:00 +0900"
2026-06-30 05:54:29,“광주 전근 땐 5억 지원?” 삼성 <b>반도체</b> 투자설에 내부 술렁...회사 “...,https://n.news.naver.com/mnews/article/023/0003984917?sid=105,"삼성전자의 호남 <b>반도체</b> 투자 계획과 맞물려, 내부에서 ‘광주 전근 직원에게 수억 원대 지원을 해준다’는... 해당 글은 광주 <b>반도체</b> 거점에 투입될 인력으로 삼성디스플레이, 삼성SDI, 삼성전기 등 계열사 실무진을... ","Tue, 30 Jun 2026 14:51:00 +0900"
2026-06-30 05:54:29,수도권-영남권 기업들이 집중적으로 정부지원 받았던 이유,https://n.news.naver.com/mnews/article/047/0002520977?sid=101,"한국 경제를 주도하는 산업이 지금은 <b>반도체</b>·자동차·조선업 등이지만, ICA 자금이 대거 투입된 1950년대 중후반에는 이른바 삼백산업(三百)이었다. 흰색의 이미지를 띠는 제분·제당·면방직업이 이 시기 한국 경제를... ","Tue, 30 Jun 2026 14:51:00 +0900"
2026-06-30 05:54:29,민형배 &quot;전력·용수 문제없다&quot;…신장성변전소·동복댐 점검,https://www.namdonews.com/news/articleView.html?idxno=915252,민형배 전남광주통합특별시장 당선인이 <b>반도체</b> 클러스터 조성에 필요한 전력·용수 공급에 문제가 없다고... 앞서 정부와 기업은 호남 <b>반도체</b>에 800조 원을 투자하겠다고 발표하면서 서남권 <b>반도체</b> 공장에 필요한 6.3GW... ,"Tue, 30 Jun 2026 14:50:00 +0900"
2026-06-30 05:54:29,<b>반도체</b> 랠리에 웃은 국민연금… 누적 수익률 14.18%,http://www.biztribune.co.kr/news/articleView.html?idxno=355321,"<b>반도체</b>를 중심으로 국내 주식이 큰 폭으로 오르며 전체 성과를 견인한 반면, 국내 채권은 금리 상승... 기금운용본부는 중동 지정학적 리스크가 일부 완화한 가운데 인공지능(AI) 수요 확대와 <b>반도체</b> 업종의 견조한... ","Tue, 30 Jun 2026 14:50:00 +0900"
2026-06-30 05:54:29,동탄·기흥·구리 묶은 '삼중 자물쇠' &quot;최대 1년 간 거래량 눈에 띄게 줄...,https://www.theguru.co.kr/news/article.html?no=103770,"교통·<b>반도체</b> 호재 건재, 실수요 지지… 남양주·수원 풍선효과 경계 [더구루=김수현 기자] 최근 과열 양상을... 이들 지역은 그동안 <b>반도체</b> 산업 벨트 확장 기대감과 GTX-A 노선 개통 등 대형 교통 호재, 뛰어난 서울 접근성... ","Tue, 30 Jun 2026 14:50:00 +0900"
2026-06-30 05:54:29,韓 한계기업 증가 속도 주요국보다 빨라…8년간 15.8%p 상승,https://www.industrynews.co.kr/news/articleView.html?idxno=82707,"이상호 한경협 경제본부장은 &quot;우리나라 상장사의 한계기업 비중이 빠르게 증가하고 있는 것은 교역 여건 악화, 환율·원자재·인건비 등 비용 상승, 내수 부진 등 요인들이 겹치면서, <b>반도체</b>를 제외한 주력... ","Tue, 30 Jun 2026 14:50:00 +0900"
2026-06-30 05:54:29,"과열 조짐…경기도, 기흥·동탄·구리 허가구역 지정",https://n.news.naver.com/mnews/article/629/0000511850?sid=102,"국토부 투기과열지구와 연계…내년 말까지 170.5㎢ 묶어 <b>반도체</b>·교통 호재에 매수세 유입 차단…아파트만... 도는 최근 이 지역에서 주택가격 상승과 거래량이 증가하고 있고, 서울 접근성 개선과 교통망 확충, <b>반도체</b>... ","Tue, 30 Jun 2026 14:50:00 +0900"
2026-06-30 05:54:29,"윤병태 나주시장, 중앙부처 연쇄 방문…국비 확보 총력",https://n.news.naver.com/mnews/article/003/0014037339?sid=102,"기획예산처에는 내년 국고 반영이 필요한 사용후 배터리 종합관리센터 구축, 고전력 <b>반도체</b> 모듈 인프라 구축, 노안지구 배수개선사업 등 핵심 사업의 필요성을 설명하고 지원을 요청했다. 국토교통부에는 경전선 나주... ","Tue, 30 Jun 2026 14:50:00 +0900"
2026-06-30 05:54:29,서울파이낸스 독자권익편집위원회 개최···AI 시대 언론 경쟁력 해법...,https://www.seoulfn.com/news/articleView.html?idxno=632285,이날 회의에서는 서울파이낸스 편집국의 올해 3대 중점 과제인 'K자 성장' 극복(<b>반도체</b>·조선·방산 등과 타... 이은경 위원은 &quot;최근 발표된 <b>반도체</b> 투자도 결국 산업을 뒷받침할 에너지 인프라 확보가 전제돼야 하는 만큼... ,"Tue, 30 Jun 2026 14:50:00 +0900"
2026-06-30 05:54:29,&quot;수도권엔 물·전기가 없다&quot;… 삼성·SK가 호남 가는 이유,http://www.the-biz.co.kr/news/articleView.html?idxno=723540,"AI <b>반도체</b> 시대를 맞아 안정적인 전력과 산업용수, 친환경 에너지 확보가 생산 경쟁력의 핵심 변수로... 삼성전자는 광주를 신규 생산 거점 후보지로 제시했고, SK하이닉스는 서남권에 새로운 <b>반도체</b> 클러스터를... ","Tue, 30 Jun 2026 14:50:00 +0900"
2026-06-30 05:54:29,"윤병태 나주시장, 중앙부처 찾아 민선 9기 미래성장동력 확보 '박차'",https://n.news.naver.com/mnews/article/002/0002446698?sid=102,"기획예산처에서는 임기근 차관과 조용범 예산실장, 박창환 예산총괄국장을 만나 사용 후 배터리 종합관리센터 구축(총사업비 245억원), 고전력 <b>반도체</b> 모듈 인프라 구축(총사업비 400억원), 노안지구 배수개선사업... ","Tue, 30 Jun 2026 14:50:00 +0900"
2026-06-30 05:54:29,삼성전자 초기업노조 최승호 위원장 재신임… “DS부문 분리 교섭 추진...,https://n.news.naver.com/mnews/article/082/0001387644?sid=101,최 위원장은 <b>반도체</b> 담당 부문의 분리 교섭을 통해 회사와 단독 교섭에 나서겠다는 계획을 공식화했다.... 그러나 <b>반도체</b>를 담당하는 디바이스솔루션(DS)부문 중심의 성과급 배분 등을 둘러싼 불만이 이어지며 조합원... ,"Tue, 30 Jun 2026 14:50:00 +0900"
2026-06-30 05:54:29,S&amp;P &quot;AI가 끌어올린 한국 경제&quot;…<b>반도체</b> 쏠림은 숙제,http://www.metroseoul.co.kr/article/20260630500312,"아울러 성장이 <b>반도체</b> 등 일부 산업에 집중되고 있는 만큼 공급 확대 이후 업황 변화와 금융시장 변동성은... 그래프/S&amp;P글로벌레이팅스 ◆성장은 <b>반도체</b> 쏠림, 변동성↑…'AI 슈퍼사이클' 2028년까지 예상 기업 부문을... ","Tue, 30 Jun 2026 14:50:00 +0900"
2026-06-30 05:54:29,"백준호 퓨리오사AI 대표 &quot;AI <b>반도체</b>는 차량 '엔진', 국산 MPU 선제 투자해...",https://www.fetv.co.kr/news/articleView.html?idxno=305431,"&quot;대규모 데이터센터 구축이 자동차 산업이라면, AI <b>반도체</b>는 차량의 생사고락을 결정하는 '엔진'이다. 엔진... AI <b>반도체</b> 인프라를 선제적으로 구축해야 한다는 지적이다. 이날 백 대표는 자본시장과 업계의 시선이... ","Tue, 30 Jun 2026 14:50:00 +0900"
2026-06-30 05:54:29,&quot;동탄1·2 나눠 규제 어려워…구 단위 통계로 판단&quot;[일문일답],https://n.news.naver.com/mnews/article/018/0006319022?sid=101,△<b>반도체</b> 영향이나 성과급 등으로 자산이 늘어나 주택 구매 수요가 증가하는 영향은 있을 수밖에 없는... 지금은 동탄과 <b>반도체</b> 라인을 중심으로 상승세가 높은 상황이다. 당시 규제 이후 대출을 통한 주택 구입과 갭투자... ,"Tue, 30 Jun 2026 14:50:00 +0900"
2026-06-30 05:54:29,"S&amp;P &quot;韓, AI 거품 꺼지면 '빚투'에 은행권 충격…GDP 전망치는 2.9% 상향&quot;...",https://n.news.naver.com/mnews/article/003/0014037337?sid=101,글로벌 신용평가사 S&amp;P글로벌이 글로벌 인공지능(AI) 기업들의 신용 위험이 현실화될 경우 AI <b>반도체</b> 업종... AI <b>반도체</b> 호황을 반영해 올해 한국 경제 성장률 전망치도 큰 폭으로 상향 조정했다. S&amp;P글로벌은 30일 서울 중구... ,"Tue, 30 Jun 2026 14:50:00 +0900"
2026-06-30 05:54:29,"팬스타그룹, 한국근해수송협의회 정식 공동운항 선사 선정 7월부터 참여",https://n.news.naver.com/mnews/article/082/0001387642?sid=101,"메모리 <b>반도체</b> 기업의 핵심 물류 협력사로 오랜 기간 역할을 해 왔다. 20여 년간 이 기업의 주요 핵심 생산장비 해상 운송을 대부분 담당해 온 유일한 국적 선사다. <b>반도체</b> 생산장비는 충격, 염분, 온·습도 변화에... ","Tue, 30 Jun 2026 14:49:00 +0900"
2026-06-30 05:54:29,"수원 매탄동 영통구청 부지, '도시재생 혁신지구' 후보지 선정",https://n.news.naver.com/mnews/article/417/0001149642?sid=102,(AI)과 <b>반도체</b>를 중심으로 한 미래 혁신 거점 조성 사업이 본격적인 궤도에 오르게 됐다. 경기도는... 수원시는 이곳에 AI·<b>반도체</b> 등 최첨단 산업 기능과 주민들을 위한 생활문화 기능을 유기적으로 결합한 다목적... ,"Tue, 30 Jun 2026 14:48:00 +0900"
2026-06-30 05:54:29,삼성자산운용 &quot;하반기 ETF 키워드는 'AI 병목'&quot;,http://www.biztribune.co.kr/news/articleView.html?idxno=355329,"회사는 AI 산업의 핵심 병목 요인을 △<b>반도체</b> △전력 △네트워크 △우주·공간 네 가지로 구분했다. <b>반도체</b> 연산 능력을 비롯해 AI 데이터센터 확대에 따른 전력 인프라, 광통신 기반 네트워크, 데이터센터... ","Tue, 30 Jun 2026 14:48:00 +0900"
2026-06-30 05:54:29,"삼성증권, <b>반도체</b> 유망기업 투자설명회 개최… AI <b>반도체</b> 성장기업 투자...",https://www.koreaittimes.com/news/articleView.html?idxno=154814,삼성증권은 지난 24일 서울 서초구 삼성금융캠퍼스에서 <b>반도체</b> 유망기업을 대상으로 'KSS IR Day(Korea SME's &amp; Startup Scaleup IR Day)'를 개최했다/ 삼성증권 제공 삼성증권이 인공지능(AI) 시대 핵심 산업으로 주목받는 <b>반도체</b>... ,"Tue, 30 Jun 2026 14:48:00 +0900"
2026-06-30 05:54:29,삼성전자 초기업노조 최승호 위원장 87% 재신임,http://www.globalepic.co.kr/view.php?ud=20260630144511805748439a4874_29,"다만 <b>반도체</b>와 완제품 부문의 성과급 격차에 따른 조합원 대량 이탈로 7만6000명의 위상을 상실한... 올 상반기 임금협상 과정에서 <b>반도체</b>(DS) 부문 중심의 합의안이 도출된 뒤, 완제품(DX) 부문 직원들의 반발이 확산했기... ","Tue, 30 Jun 2026 14:48:00 +0900"
2026-06-30 05:54:29,"[아유경제_부동산] 정부, 경기 동탄ㆍ용인ㆍ구리 규제지역ㆍ토지거래허...",http://www.areyou.co.kr/news/articleView.html?idxno=94319,"동탄구와 기흥구는 최근 <b>반도체</b> 업계 특수에 따른 집값 상승 기대감과 수도권광역급행철도(GTX)-A 개통 등 교통 인프라 개선으로, 구리시는 서울과 인접한 역세권이라는 이점으로 가격이 계속 상승하고 있다.... ","Tue, 30 Jun 2026 14:48:00 +0900"
2026-06-30 05:54:29,행정통합에 '삼전닉스'까지 패싱?…'낙동강 오리알' 된 대구·경북,https://n.news.naver.com/mnews/article/079/0004163284?sid=102,<b>반도체</b> 투자에서까지 잇따라 홀대 받으면서 지역 내 위기감이 고조되고 있다. 30일 지역 정치권 등에 따르면 정부와 삼성·SK 총수가 발표한 '대한민국 대도약 3대 메가프로젝트'에서 대구·경북 지역에 대한 <b>반도체</b> 투자... ,"Tue, 30 Jun 2026 14:48:00 +0900"
2026-06-30 05:54:29,靑 ‘800조원 규모 서남권 <b>반도체</b> 산업 투자 프로젝트’ 주도에,https://www.siminilbo.co.kr/news/newsview.php?ncode=1160285747846000,입지 선정 의사결정 과정 검증하겠다” 최보윤 “‘언제’는 없고 ‘숫자’만 가득한 정치 <b>반도체</b> 쇼의 민낯” ‘800조원 규모의 서남권 <b>반도체</b> 산업 투자’ 결정과 관련해 국민의힘이 30일 “이재명 대통령이 대기업... ,"Tue, 30 Jun 2026 14:48:00 +0900"
2026-06-30 05:54:29,"타이완, 한국 '3대 메가 프로젝트'에 &quot;한국과 직접 경쟁 격화될 것&quot;",https://n.news.naver.com/mnews/article/055/0001368478?sid=104,세계 최대 파운드리(<b>반도체</b> 위탁생산) 기업 TSMC의 본사가 위치한 타이완에서 한국의 대규모 <b>반도체</b> 및 인공지능(AI) 투자 계획과 관련해 경계의 목소리가 나오고 있습니다. 30일 연합보와 중국시보 등 타이완 언론에... ,"Tue, 30 Jun 2026 14:48:00 +0900"
2026-06-30 05:54:29,이원택 &quot;메가프로젝트 실망&quot;,https://news.skbroadband.com/news/articleView.html?idxno=230710,발표로 도민들이 상실감과 실망을 느끼고 있다고 밝혔습니다. 또 <b>반도체</b> 클러스터의 분산 배치를 지속적으로 요구해 왔지만 발표에 반영되지 않았다며 정부와 더불어민주당에 전북에 대한 추가 분산 투자를 촉구했습니다.,"Tue, 30 Jun 2026 14:48:00 +0900"
2026-06-30 05:54:29,"바이브컴퍼니, AI 데이터 플랫폼 영토 확장… 첨단 기술 시장 선점 시동",https://www.pinpointnews.co.kr/news/articleView.html?idxno=464238,롯데이노베이트는 AI 기반 디지털 전환 사업 확대가 관심을 받고 있으며 네패스는 보합권에서 <b>반도체</b>와 AI... AI <b>반도체</b>와 데이터센터 투자 확대도 국내 AI·로봇 산업에는 긍정적인 요인이다. 데이터 처리 능력이... ,"Tue, 30 Jun 2026 14:48:00 +0900"
2026-06-30 05:54:29,"조국혁신당 지방의원협의회, &quot;'견제와 균형'의 효능감 증명하겠다&quot;",https://news.cpbc.co.kr/article/1174002?division=NAVER,아울러 협의회는 &quot;어제 전남광주를 중심으로 800조 원 규모의 <b>반도체</b> 육성 프로젝트가 발표됐다&quot;면서 &quot;호남 대도약의 서막이 열리고 있다. 막대한 예산이 집행되는 만큼 지방의회의 협조와 대응이 어느 때보다 절실한 시기... ,"Tue, 30 Jun 2026 14:48:00 +0900"
2026-06-30 05:54:29,핵심 빠진 삼성 투자 약속?...이재용 발표에 빠진 '금액·기한·조건' [이...,https://n.news.naver.com/mnews/article/052/0002372811?sid=100,<b>반도체</b> 산업이라는 거는 국가의 생존과 번영을 담보하는 중추이자 안보의 핵심 축이라고 할 수 있습니다. 그렇다면 이 부분에 있어서 왜 호남인가에 대한 얘기를 하지 마시고 이걸 말씀을 하셔야 되는데 말을 못하고... ,"Tue, 30 Jun 2026 14:47:00 +0900"
2026-06-30 05:54:29,AI 심장에 550조…데이터센터 국가 인프라로 키운다,https://www.mstoday.co.kr/news/articleView.html?idxno=102000,"열고 <b>반도체</b>, 피지컬 AI, AI 데이터센터를 차세대 성장축으로 제시했다. 이 가운데 AI 데이터센터(AIDC)는... 단순히 서버 건물을 짓는 사업이 아니라, 지역 전력망·냉각 설비·클라우드 운영 기업·AI <b>반도체</b> 수요를 함께... ","Tue, 30 Jun 2026 14:46:00 +0900"
2026-06-30 05:54:29,'메가프로젝트'發 이익모멘텀 연장…<b>반도체</b> 소부장 초강세[핫종목],https://n.news.naver.com/mnews/article/421/0009032002?sid=101,<b>반도체</b> 소부장 기업 주가가 강세다. 정부의 '메가프로젝트'발 <b>반도체</b> 투자 확대로 소부장 업체들의 이익 가시성이 연장됐다는 분석 영향이다. 30일 오후 2시24분 미래산업(025560)(상한가)... ,"Tue, 30 Jun 2026 14:46:00 +0900"
2026-06-30 05:54:29,한국 ‘3대 메가 프로젝트’에 대만 “직접 경쟁 격화할 것”,https://n.news.naver.com/mnews/article/056/0012208827?sid=104,세계 최대 파운드리 기업 TSMC의 본사가 있는 대만에서 한국의 대규모 <b>반도체</b> 및 인공지능(AI) 투자 계획과... 그럼에도 류 연구원은 대만의 <b>반도체</b> 허브로서의 대체 불가능한 가치는 유지될 거라고 봤습니다. 대만 폭스콘... ,"Tue, 30 Jun 2026 14:46:00 +0900"
2026-06-30 05:54:29,"환경단체 &quot;SK하이닉스 청주 100조 투자, 환경 비용 공론화부터&quot;",https://n.news.naver.com/mnews/article/374/0000519088?sid=103,"청주충북운동연합은 성명을 내고 &quot;<b>반도체</b> 공장은 막대한 전력을 상시 소비한다&quot;며 &quot;SK하이닉스 청주 공장과 용인 <b>반도체</b> 산업단지 등에 필요한 전력 공급을 위해 호남에서 전기를 끌어오는 송전망이 확충되고 있으며, 이... ","Tue, 30 Jun 2026 14:46:00 +0900"
2026-06-30 05:54:29,&quot;해외선 싼데 국내선 비싸&quot;…ADR 상장 앞두고 하이닉스 '액분론' 솔솔,https://www.newsway.co.kr/news/view?ud=2026063013542555579,"미국 시장에서 거래되면 SK하이닉스는 마이크론을 비롯한 미국 <b>반도체</b>주와 같은 시장에서 평가를 받게 된다. 미국 <b>반도체</b>주와 비교할 수 있는 투자자층이 넓어지고, 지수와 상장지수펀드(ETF) 편입 가능성도 열린다.... ","Tue, 30 Jun 2026 14:46:00 +0900"
2026-06-30 05:54:29,'동탄·기흥·구리'도 규제…전세난·풍선효과 '우려',http://www.newstomato.com/ReadNews.aspx?no=1305635&inflow=N,"삼성전자 성과급 지급 합의로 풀린 유동성과 <b>반도체</b> 업황 기대감, GTX-A 개통 등 교통 호재가 맞물린 영향으로... 함 랩장은 &quot;동탄·기흥은 <b>반도체</b> 산업과 GTX-A·용인 플랫폼시티 등 중장기 개발 호재가, 구리는 서울 동북권... ","Tue, 30 Jun 2026 14:46:00 +0900"
2026-06-30 05:54:29,"인천항만공사, AI·신소재 등 신기술 활용해 인천항 관리·운영",https://www.ngonews.kr/news/articleView.html?idxno=231945,"특수 소재 <b>반도체</b>가 삽입된 장치가 현장의 후각데이터를 수집·분석하여 화재, 가스누출을 초기에 파악하고 주변 근로자에게 경보를 알려 인명피해와 사고를 막아준다. 인천항 여객터미널에서는 여객들이 더 이상 조류... ","Tue, 30 Jun 2026 14:46:00 +0900"
2026-06-30 05:54:29,"AI 메모리 슈퍼사이클에도…삼성·SK, 마이크론보다 낮은 평가",https://www.mstoday.co.kr/news/articleView.html?idxno=101998,"<b>반도체</b>를 담당하는 DS부문은 매출 81조7000억원, 영업이익 53조7000억원을 냈다. 회사는 고부가 AI 수요... 정부는 29일 <b>반도체</b>·피지컬 AI·AI 데이터센터를 축으로 한 3대 메가프로젝트를 공개했다. 삼성전자와... ","Tue, 30 Jun 2026 14:46:00 +0900"
2026-06-30 05:54:29,"&quot;RE100 시대, 호남이 답이다&quot;… 대통령 &quot;임기 내 호남 <b>반도체</b> 클러스터 ...",https://news.bbsi.co.kr/news/articleView.html?idxno=4092207,"정부가 대한민국 대도약의 마중물이 될 '3대 메가 프로젝트'를 전격 발표하며, 핵심 축인 '호남권 <b>반도체</b> 클러스터'를 이 대통령 임기 내에 완공하겠다고 공언했다. 글로벌 AI <b>반도체</b> 시장의 주도권을 굳히기 위한 과감한... ","Tue, 30 Jun 2026 14:46:00 +0900"
2026-06-30 05:54:29,엔비디아도 우주 AI 데이터센터 구축 박차...연봉 6억대 채용 공고,https://n.news.naver.com/mnews/article/052/0002372805?sid=104,"인공지능(AI) <b>반도체</b> 선두 주자인 엔비디아가 본격적으로 우주 데이터센터 구축 준비에 나섰습니다. 현지 시간 29일, 회사 홈페이지에 채용 공고를 보면 엔비디아는 '스페이스-1'의 시스템 소프트웨어(SW) 수석 설계자를... ","Tue, 30 Jun 2026 14:45:00 +0900"
2026-06-30 05:54:29,"대만, 韓과 일전 불가피…&quot;메가 프로젝트, 대만 성공 모방&quot;",https://n.news.naver.com/mnews/article/374/0000519087?sid=104,"대규모 <b>반도체</b> 및 인공지능(AI) 투자 계획과 관련해 경계의 목소리가 나오고 있습니다. 30일 연합보와 중국시보 등 대만 언론에 따르면 류페이전 대만경제연구원(TIER) 연구원은 한국의 '3대 메가 프로젝트'(<b>반도체</b>, AI... ","Tue, 30 Jun 2026 14:45:00 +0900"
2026-06-30 05:54:29,"국민연금, 4월까지 국내주식 수익률 60% 근접…기금 1670조원대로",http://www.fntimes.com/html/view.php?ud=202606301440435119179ad43907_18,국민연금은 &quot;중동 지정학적 리스크가 일부 완화된 가운데 AI(인공지능) 수요 등에 따른 <b>반도체</b> 중심의 견고한 펀더멘탈로 주식시장은 상승했다&quot;며 &quot;특히 국내 주식시장은 두 자릿수 상승세를 이어가며 전체 수익률을... ,"Tue, 30 Jun 2026 14:44:00 +0900"
2026-06-30 05:54:29,"삼성전자, 내달 5일까지 '감사 페스티벌'…구매액 최대 30% 온누리상품권...",https://www.public25.com/news/articleView.html?idxno=49572,"지난 8일부터 4주간 진행 중인 이번 행사는 인공지능(AI) 시대를 맞아 <b>반도체</b> 사업 등에서 거둔 성과를 국민들과 공유하고, 지역경제 활성화에 기여하기 위해 마련됐다. 삼성전자는 행사 혜택과 디지털 온누리상품권... ","Tue, 30 Jun 2026 14:44:00 +0900"
2026-06-30 05:54:29,"삼성전기, 글로벌 빅테크에 AI 서버용 MLCC 공급…&quot;4500억 규모&quot;",https://www.pinpointnews.co.kr/news/articleView.html?idxno=464239,MLCC는 전기를 저장했다가 <b>반도체</b>에 안정적으로 공급하는 핵심 전자부품이다. 전자제품 내부의 신호 간섭을 줄여 제품의 성능과 안정성을 높이는 역할도 한다. AI 서버는 순간적인 전력 변동이 성능 저하로 이어질... ,"Tue, 30 Jun 2026 14:44:00 +0900"
2026-06-30 05:54:29,"하닉은 과자, 현대차는 빙과…첨단기업 '이색 마케팅' 활발",http://www.the-biz.co.kr/news/articleView.html?idxno=723547,"<b>반도체</b>, 자동차, 산업장비 등 국내 첨단 기업들이 과자, 아이스크림, 굿즈 등 일상 소비재를 앞세워 대중과의... 메모리 <b>반도체</b>업계도 다양한 마케팅 수단을 선보이고 있다. SK하이닉스는 세븐일레븐과 협업해 <b>반도체</b>... ","Tue, 30 Jun 2026 14:44:00 +0900"
2026-06-30 05:54:29,"李 대통령 &quot;AI·<b>반도체</b>, 국가 성장 핵심축으로 육성&quot;",http://www.newsbrite.net/news/articleView.html?idxno=198941,"이 대통령은 이날 <b>반도체</b>와 인공지능(AI) 등 첨단 산업을 중심으로 한 초격차 전략을 제시하며, 올해를 '대체... 이 대통령은 &quot;대한민국은 새로운 전환점에 서 있다&quot;며 &quot;<b>반도체</b>와 AI 등 첨단 기술 분야에서 경쟁력을... ","Tue, 30 Jun 2026 14:44:00 +0900"
