DateTime,Title,Link,Description,PubDate
2026-01-01 07:50:11,[신년 기획] 원전·재생에너지 등 무탄소 전원 NDC 핵심,https://www.todayenergy.kr/news/articleView.html?idxno=292741,"전환 부문은 '제9차 전력수급기본계획'의 목표 수요를 바탕으로, K-<b>반도체</b> 전략 등 GDP 상승효과와 전기차... 2025년 2월 21일에 확정된 '제11차 전력수급기본계획'(2024~2038년)은 AI와 <b>반도체</b> 등 새롭게 늘어나는 전력... ","Thu, 01 Jan 2026 16:48:00 +0900"
2026-01-01 07:50:11,"최태원 SK 회장, 2026년 신년사 &quot;AI 시대 흐름 타고 글로벌 도전 나서야...",https://www.eroun.net/news/articleView.html?idxno=70203,"아울러 &quot;그간 쌓아온 시간과 역량을 토대로 지난해 AI <b>반도체</b> 분야에서 글로벌 시장의 높은 신뢰를 다시 한... 최 회장은 AI라는 거대한 혁신은 <b>반도체</b>만의 과제가 아님을 강조하고 &quot;에너지, 통신, 건설, 바이오 등 SK... ","Thu, 01 Jan 2026 16:48:00 +0900"
2026-01-01 07:50:11,[신년사] 최태원 회장 “법고창신 자세로 승풍파랑 도전 나서자”,https://n.news.naver.com/mnews/article/117/0004022585?sid=103,"이어 “메모리, ICT, 에너지 솔루션, 배터리, 그리고 이를 잇는 서비스에 이르기까지 SK가 수십 년간 묵묵히 걸어온 길은 결국 오늘의 AI 시대를 준비해 온 여정이었다”며 “이를 토대로 지난해 AI <b>반도체</b> 분야에서... ","Thu, 01 Jan 2026 16:47:00 +0900"
2026-01-01 07:50:11,"지난해 원유 수입액 61%, 석유로 정제·재수출",http://www.e-platform.net/news/articleView.html?idxno=99200,"국가 주력 수출 품목 중에서는 1734억불을 수출한 <b>반도체</b>, 720억불을 달성한 자동차, 469억불을 해외 판매한 일반기계에 이어 4위에 랭크됐다. 지난해 에너지 수입액은 유가 등 에너지 국제가격이 하향하면서 전년... ","Thu, 01 Jan 2026 16:46:00 +0900"
2026-01-01 07:50:11,'전북 3중소외' 답은 치열한 경쟁에 있다,http://www.jjn.co.kr/news/articleView.html?idxno=1028185,"여기에 송전선탑 건설을 둘러싼 갈등, 용인<b>반도체</b> 클러스터의 새만금 이전 촉구가 이슈화되면서 3중소외론 확산과 탈피에 대한 해법이 필요해졌다. 광주전남과의 경쟁, 영남권과의 경쟁, 수도권과의 이른바 '3중 경쟁... ","Thu, 01 Jan 2026 16:46:00 +0900"
2026-01-01 07:50:11,2026 병오년(丙午年) 국운(國運),http://www.kjdaily.com/article.php?aid=1767252665670620127,"주식시장은 <b>반도체</b>, 에너지, 로봇 공학 등 화(火) 기운의 섹터가 주도하며, 특히 에이전틱 AI(Agentic AI)가... 삼성을 비롯한 <b>반도체</b> 기업들은 AI 전용 칩과 차세대 메모리 시장을 석권하며 제2의 전성기를 맞이할 것이며, K... ","Thu, 01 Jan 2026 16:44:00 +0900"
2026-01-01 07:50:11,삼성의 새해 첫 승부수 '구미 AI 심장'… 2일 임시 이사회서 투자 공식화,https://n.news.naver.com/mnews/article/088/0000989987?sid=101,"삼성은 갤럭시AI부터 <b>반도체</b> 설계, 스마트가전, 경영 시스템에 이르기까지 그룹 전반의 AI 연산을 자체 인프라로 해결해 보안을 강화하고, 장기적 비용 효율성을 높일 계획이다. 투자 규모는 '조 단위'에 이를 것으로... ","Thu, 01 Jan 2026 16:43:00 +0900"
2026-01-01 07:50:11,"[2026 지선-충북] 중원의 저울추, 충북 민심 흐름은 어디로",https://www.ggilbo.com/news/articleView.html?idxno=1133467,"이재명정부가 국정과제로 확정한 청주공항 민간 전용 활주로 신설, 오창 시스템<b>반도체</b> 첨단 패키징 플랫폼 구축, 중부권 동서횡단철도 조기 확정은 물론, 청주 시민의 숙원인 청주교도소 이전까지 충북 7대 공약에... ","Thu, 01 Jan 2026 16:42:00 +0900"
2026-01-01 07:50:11,"<b>반도체</b>에 기대 작년 수출액 역대 최대, 7097억 달러 기록",https://www.ggilbo.com/news/articleView.html?idxno=1133464,AI 열풍에 힘입어 <b>반도체</b> 수출이 1734억 달러로 역대 최대치를 경신한 영향이 컸다. 일평균 수출도 4.6... 최대 수출품인 <b>반도체</b>는 AI·데이터센터 투자 열풍에 DDR5·고대역폭 메모리(HBM) 등 고부가제품 수요 강세에... ,"Thu, 01 Jan 2026 16:42:00 +0900"
2026-01-01 07:50:11,"日 대표 IT 기업 ‘후지쓰’, AI 앞세워 대변혁… 입사 2년된 사원도 관...",https://n.news.naver.com/mnews/article/023/0003950366?sid=101,AI용 <b>반도체</b>를 공동 개발한다고 발표하며 이같이 말했다. 공동 개발하는 <b>반도체</b>는 후지쓰의 기술과 엔비디아의 칩을 융합해 AI 데이터센터는 물론 로봇·자동차·드론·산업기계 등 실제 기기를 구동하는 ‘피지컬 AI’... ,"Thu, 01 Jan 2026 16:42:00 +0900"
2026-01-01 07:50:11,李 대통령 “대전환 통한 대도약 원년 열겠다”,https://n.news.naver.com/mnews/article/029/0003002506?sid=100,남부권에는 <b>반도체</b>·AI 등 첨단 산업을 집중 배치하여 ‘지방 주도 성장’을 실현하겠다는 구상도 내놨다. 경제 분야에서는 ‘낙수효과의 폐기’를 직·간접적으로 드러냈다. 이 대통령은 관세 협상 타결과 방산·원전... ,"Thu, 01 Jan 2026 16:40:00 +0900"
2026-01-01 07:50:11,무역 갈등 진정 국면...글로벌 기업 경영진 63% “2026년 수익 증가할 것...,https://n.news.naver.com/mnews/article/023/0003950365?sid=101,"<b>반도체</b>·항공우주·전자기기 등 첨단 산업은 지난해 매출 성과가 양호했던 만큼 올해 추가 상승에 대해선... “AI·<b>반도체</b>와 같은 첨단 기술 산업에 속하는지에 따라 희비가 엇갈리고, 현재 수익성이 악화되고 있는... ","Thu, 01 Jan 2026 16:38:00 +0900"
2026-01-01 07:50:11,[인사]경기 용인시,https://n.news.naver.com/mnews/article/030/0003385998?sid=102,◆용인시 ◇지방서기관 △문화체육관광국장 임영선 △<b>반도체</b>경쟁력강화국장 허전 △안전정책관 강창묵... 최순필 △<b>반도체</b>정책과장 김시봉 △<b>반도체</b>국가산단과장 이종익 △<b>반도체</b>일반산단과장 서민철... ,"Thu, 01 Jan 2026 16:37:00 +0900"
2026-01-01 07:50:11,싱가포르 총리 &quot;작년 4.8% '깜짝' 성장…올해는 유지 어려울 것&quot;,https://n.news.naver.com/mnews/article/277/0005701050?sid=104,이어 그는 &quot;우리는 인공지능(AI) 관련 <b>반도체</b>·전자제품 수요 급증의 혜택도 누렸다&quot;면서 &quot;그 결과 실업률과... 의약품과 <b>반도체</b>에 대한 부문별 관세가 어떤 영향을 미칠지는 아직 불확실한 상황이다. 웡 총리는 싱가포르... ,"Thu, 01 Jan 2026 16:37:00 +0900"
2026-01-01 07:50:11,지난해 한국 수출 7천만 달러 돌파,https://www.obsnews.co.kr/news/articleView.html?idxno=1509127,최대 수출 품목인 <b>반도체</b>는 22.2% 증가한 1천734억달러로 전년에 이어 역대 최대 실적을 기록했습니다. 2025년 수입액은 전년보다 0.02% 감소한 6천317억달러였고 무역수지는 780억달러 흑자를 기록했습니다.,"Thu, 01 Jan 2026 16:34:00 +0900"
2026-01-01 07:50:11,"이상일 “용인 <b>반도체</b> 지방이전론, 대통령이나 총리 공식 입장 표명해야...",https://www.kgnews.co.kr/news/article.html?no=879894,"“용인 <b>반도체</b> 클러스터 흔드는 건 나라 망치자는 것” 용인특례시는 이상일 시장이 지난달 31일 시청 컨벤션홀에서 긴급 기자회견을 열고 <b>반도체</b> 메가 클러스터 조성을 방해하려는 일부 지역, 일부 여권의 정치인과 일부... ","Thu, 01 Jan 2026 16:32:00 +0900"
2026-01-01 07:50:11,"마침내 1000조 돌파, 한국 세계 6번째로 7000억 달러 수출 기록",https://n.news.naver.com/mnews/article/241/0003486317?sid=101,최대 수출품인 <b>반도체</b>는 AI·데이터센터 투자 열풍에 DDR5·고대역폭 메모리(HBM) 등 고부가제품 수요... <b>반도체</b> 수출은 작년 4월부터 9개월 연속으로 월 기준 역대 최대 실적 경신 행진을 이어가고 있다. '수출 효자... ,"Thu, 01 Jan 2026 16:30:00 +0900"
2026-01-01 07:50:11,"싱가포르, 작년 4.8% '깜짝' 성장…&quot;올해는 유지 어려워&quot;",https://n.news.naver.com/mnews/article/001/0015824481?sid=104,"이어 &quot;우리는 인공지능(AI) 관련 <b>반도체</b>·전자제품 수요 급증의 혜택도 누렸다&quot;면서 &quot;그 결과 실업률과... 싱가포르는 미국으로부터 최저 수준인 10%의 상호관세율을 적용받고 있지만, 주요 수출품목인 의약품과 <b>반도체</b>에... ","Thu, 01 Jan 2026 16:29:00 +0900"
2026-01-01 07:50:11,SKY 정시 경쟁률 4.11대 1…‘불수능’에도 예년 수준 소신 지원,https://n.news.naver.com/mnews/article/119/0003043687?sid=102,"<b>반도체</b> 계약학과 중에서는 한양대 <b>반도체</b>공학과가 11.80대 1로 가장 높은 경쟁률을 기록했다. 이어 서강대 시스템<b>반도체</b>공학과(9.00대 1), 고려대 <b>반도체</b>공학과(7.47대 1) 등 SK하이닉스와 협약을 맺은 대학들이 높은... ","Thu, 01 Jan 2026 16:26:00 +0900"
2026-01-01 07:50:11,"거제시의회 김선민 의원, 외국인 근로자 급증 문제 제기해",https://www.newsgn.com/news/articleView.html?idxno=526931,"또한 김 의원은 &quot;거제는 대한민국을 대표하는 조선업 전문가 도시&quot;라며, &quot;<b>반도체</b>특별법처럼 조선산업지원특별법에 근로시간 유연화 등 종합적인 제도 개선 방안을 담아 실질적인 대책이 마련돼야 한다&quot;고 주문했다.... ","Thu, 01 Jan 2026 16:26:00 +0900"
2026-01-01 07:50:11,"이준석 &quot;보수, 尹에 미련 내려놓아야…새로운 인물과 정책 필요&quot;",https://n.news.naver.com/mnews/article/018/0006193332?sid=100,"이어 “경제에는 삼성과 하이닉스가 이끄는 <b>반도체</b> 호황이 있고, IMF와 금융위기를 넘겼고, 팬데믹 속에서도 일어섰다”며 “정치가 제 역할만 한다면 이 나라는 반드시 다시 도약할 수 있다”고 목소리를 높였다. 그러면서... ","Thu, 01 Jan 2026 16:26:00 +0900"
2026-01-01 07:50:11,&quot;산업평화 정착…'기업하기 좋은 광주' 조성&quot;,https://www.jnilbo.com/news/articleView.html?idxno=90000018367,"AI와 <b>반도체</b> 등 첨단 제조역량을 갖추고 있으며, 전남 또한 에너지와 우주·항공 분야 등에 대한 강점을... 한 회장은 &quot;민주화의 도시 광주를 이제는 AI, 미래 모빌리티, <b>반도체</b> 등 삼각 축으로 재무장해 경제적으로 풍요롭고... ","Thu, 01 Jan 2026 16:25:00 +0900"
2026-01-01 07:50:11,디지털 보안 흔드는 양자컴…휴머노이드 시대 이끌 '넥스트 G',https://n.news.naver.com/mnews/article/015/0005231576?sid=105,"전력<b>반도체</b>를 전력망 곳곳에 적용해 수요 변화에 맞춰 공급을 실시간으로 조절하는 방식이다. 분산 전력망이 구축되면 태양광, 풍력, 에너지저장장치(ESS) 같은 분산 자원을 전력 계통에 효율적으로 연결하고, AI를... ","Thu, 01 Jan 2026 16:25:00 +0900"
2026-01-01 07:50:11,한국 수출 7000억 시대 열려…<b>반도체</b> 1734억달러 '역대 최대',https://www.newsworks.co.kr/news/articleView.html?idxno=825428,"글로벌 통상 환경의 불확실성 속에서도 AI 데이터센터 확산에 따른 <b>반도체</b> 수요 증가, 자동차·선박 등... 품목인 <b>반도체</b> 수출은 AI 서버용 메모리 수요 확대와 가격 상승에 힘입어 전년대비 22.2% 늘며 1734억달러로... ","Thu, 01 Jan 2026 16:24:00 +0900"
2026-01-01 07:50:11,세계 각국 정상 신년 메시지는?…트럼프 새해 결심은 ‘지구의 평화’,https://www.etoday.co.kr/news/view/2541441,"이투데이=이진영 기자 | 시진핑, AI·<b>반도체</b> 등 과학기술 성과 자신감 다카이치 “일본, 강하고 풍요롭게... 그러면서 인공지능(AI)과 <b>반도체</b> 산업 분야에서 중국이 이룬 성과를 강조했다. 이번 연설은 최근 몇 년간 시... ","Thu, 01 Jan 2026 16:24:00 +0900"
2026-01-01 07:50:11,"<b>반도체</b>는 기본…'K뷰티, K바이오'가 수출 이끌었다",https://n.news.naver.com/mnews/article/018/0006193331?sid=101,"우리나라 연간 수출이 사상 처음으로 7000억 달러를 돌파한 가운데 <b>반도체</b>와 자동차 등 양대 주력 수출 품목... 이 같은 우려를 깨고 거둔 성과의 뒤에는 꾸준히 수출을 확대하며 <b>반도체</b>와 자동차, 선박 등 주요 품목을... ","Thu, 01 Jan 2026 16:24:00 +0900"
2026-01-01 07:50:11,"2026년 수출, 국제 정치·금융 불확실성 ‘트럼프 변수’ 관건",https://n.news.naver.com/mnews/article/029/0003002504?sid=101,"에너지·원전·<b>반도체</b>·배터리·방산·광물 등 핵심 산업의 미국 유치가 우선 과제로 떠오른 만큼, 올해 우리... 염명배 충남대 경제학과 명예교수는 “<b>반도체</b>와 조선은 미국이 스스로 취약하다고 느끼는 분야”라며... ","Thu, 01 Jan 2026 16:23:00 +0900"
2026-01-01 07:50:11,"용인특례시, <b>반도체</b> 클러스터 진입로 ‘보개원삼로’ 임시 개통",https://www.kgnews.co.kr/news/article.html?no=879887,용인특례시는 지난달 31일 처인구 원삼면 국도17호선 가재월사거리와 용인 <b>반도체</b> 클러스터를 잇는 ‘보개원삼로’를 왕복 4차로로 임시 개통한다고 1일 밝혔다. 이번 도로 확장 개통은 SK하이닉스의 <b>반도체</b> 팹(fab) 착공... ,"Thu, 01 Jan 2026 16:22:00 +0900"
2026-01-01 07:50:11,"유니셈, 메모리 3사 장비 공급 확대…내년 실적 기대감↑",https://www.pinpointnews.co.kr/news/articleView.html?idxno=412728,"유니셈이 메모리 <b>반도체</b> 장비 시장에서 강세를 보이며 내년 실적 성장 기대감을 높이면서 주가에 훈풍을 불어 넣고 있는 것으로 보인다. 메모리 3사에 스크러버와 칠러 장비를 공급하며, <b>반도체</b> 인프라 투자 확대와 낸드... ","Thu, 01 Jan 2026 16:20:00 +0900"
2026-01-01 07:50:11,[신년사] 이재명 대통령 &quot;2026년은 대한민국 대도약의 원년…5대 성장 대...,http://www.newsroad.co.kr/news/articleView.html?idxno=51858,"에너지가 풍부한 남부의 <b>반도체</b> 벨트부터 인공지능 실증도시와 재생에너지 집적단지까지, 첨단산업 발전이 지역의 발전으로 연결되는 구조를 설계할 것입니다. 인재와 기술 양성을 위한 교육투자, 삶의 질을 높여줄... ","Thu, 01 Jan 2026 16:20:00 +0900"
2026-01-01 07:50:11,"코스피 5000까지…馬, 달리자",https://n.news.naver.com/mnews/article/015/0005231565?sid=101,"정부의 증시 부양 정책이 ‘코리아 디스카운트’(한국 증시 저평가) 해소의 신호탄을 쐈고, <b>반도체</b> 업종... AI 관련주에 대해선 엇갈린 전망 올해 시장을 이끌 업종으로는 <b>반도체</b>를 꼽은 응답자가 많았다. 작년 하반기... ","Thu, 01 Jan 2026 16:18:00 +0900"
2026-01-01 07:50:11,"&quot;지주사, 상법 개정 수혜주…AI 사이클, 타 업종으로 확산&quot;",https://n.news.naver.com/mnews/article/015/0005231563?sid=101,"지난해 <b>반도체</b>에 집중된 인공지능(AI) 사이클이 다른 업종으로 확산할 것이라는 의견도 나온다. 목대균 KCGI자산운용 대표는 “지난해 AI 인프라에 관심이 집중됐다면, 올해는 AI를 실제로 활용하는 소프트웨어로 흐름이... ","Thu, 01 Jan 2026 16:17:00 +0900"
2026-01-01 07:50:11,"삼성전자, 14만원 넘는다…SK하이닉스, 115만원 가능",https://n.news.naver.com/mnews/article/015/0005231564?sid=101,‘<b>반도체</b> 투톱’ 삼성전자와 SK하이닉스가 나란히 국내 10개 증권사가 꼽은 2026년 최고의 유망주로... 증권사들은 올해도 인공지능(AI) 투자가 이어지며 메모리 <b>반도체</b> 가격 상승세가 가파를 것으로 전망했다.... ,"Thu, 01 Jan 2026 16:17:00 +0900"
2026-01-01 07:50:11,기술 우위가 곧 경쟁력…알파벳·엔비디아 집중,https://n.news.naver.com/mnews/article/015/0005231562?sid=101,"양지환 대신증권 리서치센터장은 “브로드컴은 주문형<b>반도체</b>(ASIC) 사업 성장세가 기대된다”며 “주가가 420달러까지 갈 수 있다”고 예상했다. “미·중 기술 패권 경쟁 수혜주도 주목” 우주, 바이오, 로봇 등 미·중... ","Thu, 01 Jan 2026 16:16:00 +0900"
2026-01-01 07:50:11,"美, 삼성·SK 이어 TSMC에도 中공장 美<b>반도체</b>장비 반입 허가",https://www.ajunews.com/view/20260101154853167,com 대만 TSMC [사진=AFP·연합뉴스] 미국 정부가 삼성전자와 SK하이닉스에 이어 TSMC에도 중국 소재 <b>반도체</b>... 부여해 <b>반도체</b> 장비 수출 제한에 포괄적 예외를 적용해 왔다. VEU는 일정한 보안 요건을 충족하면 별도의... ,"Thu, 01 Jan 2026 16:16:00 +0900"
2026-01-01 07:50:11,정부 ICT·AI에 8조 1000억여원 투입,https://www.ggilbo.com/news/articleView.html?idxno=1133432,"확대하고, <b>반도체</b>·디스플레이·이차전지 등 초격차 달성을 위한 원천기술 개발에 집중한다. AI-네이티브 첨단바이오 자율실험실(135억 원), 양자과학기술 플래그십 프로젝트(500억 원), 차세대 광기반 연산<b>반도체</b>... ","Thu, 01 Jan 2026 16:14:00 +0900"
2026-01-01 07:50:11,김보라 안성시장 &quot;승세도약으로 지속가능 도시 실현&quot;[신년사],https://n.news.naver.com/mnews/article/003/0013687769?sid=102,"김 시장은 &quot;산업진흥원을 중심으로 <b>반도체</b>와 소부장, 제조업 육성에 속도를 내고 RE100 기반 분산에너지와 태양광 확대로 에너지가 경쟁력이 되는 도시를 만들겠다&quot;며 &quot;안성다움을 살린 문화·관광 활성화로 머무는 도시... ","Thu, 01 Jan 2026 16:14:00 +0900"
2026-01-01 07:50:11,[인사] 지식재산처,https://www.ggilbo.com/news/articleView.html?idxno=1133437,송대종 △<b>반도체</b>제조장비심사팀장 최훈영 △특허심판원 심판장 조지훈 △특허심판원 심판장 신순호 △특허심판원 심판장 신원혜 △특허심판원 심판장 전범재 △특허심판원 심판장 제승호 △특허심판원 심판장 목승균... ,"Thu, 01 Jan 2026 16:14:00 +0900"
2026-01-01 07:50:11,메모리값 급등 여파…출하량 줄어들듯,https://n.news.naver.com/mnews/article/009/0005615026?sid=101,스마트폰의 필수 부품인 메모리 <b>반도체</b> 가격이 급등하면서 기업들의 원가 부담이 커지고 있기 때문이다.... 인공지능(AI) 수요 증가로 메모리 <b>반도체</b> 몸값이 오르면서 스마트폰 시장에 공급되는 메모리 가격도 상승세를... ,"Thu, 01 Jan 2026 16:13:00 +0900"
2026-01-01 07:50:11,슈퍼사이클 올라탄 <b>반도체</b>…HBM·D램 쌍끌이 실적 기대,https://n.news.naver.com/mnews/article/009/0005615025?sid=101,<b>반도체</b> 2026년 전 세계 <b>반도체</b> 시장은 인공지능(AI) 인프라스트럭처에 대한 대규모 투자로 고속 성장을 계속할 것으로 예상된다. 특히 한국 기업들이 비중이 큰 메모리 <b>반도체</b> 시장은 D램과 고대역폭메모리(HBM)... ,"Thu, 01 Jan 2026 16:13:00 +0900"
2026-01-01 07:50:11,'삼전닉스' 질주 계속하면…'꿈의 5천피' 꿈이 아니다,https://n.news.naver.com/mnews/article/009/0005615020?sid=101,증시 올해 증시 핵심동력도 <b>반도체</b> 美 빅테크 실적·AI 거품론 등 외부변수 따른 변동성은 주의 조선업... <b>반도체</b> 등 주력 업종의 호황이 이어질 전망이지만 외부 변수 영향이 여전히 크고 단기 급등에 따른 부담도... ,"Thu, 01 Jan 2026 16:12:00 +0900"
2026-01-01 07:50:11,수출 7000억弗 사수할까…'<b>반도체</b> 가격' 에 달렸다,https://n.news.naver.com/mnews/article/009/0005615016?sid=101,고부가 <b>반도체</b> 수요 계속늘듯 작년 한국 수출이 사상 처음으로 7000억달러를 달성했지만 올해 수출 전망을 두고는 주요 기관들 사이에서도 엇갈린 평가가 나오고 있다. <b>반도체</b> 산업 호조가 이어질 것이라는 기대와 함께... ,"Thu, 01 Jan 2026 16:12:00 +0900"
2026-01-01 07:50:11,성장률 반등 韓경제 뜨겁게 질주하라,https://n.news.naver.com/mnews/article/009/0005615015?sid=101,대체로 기관들은 &quot;설비투자는 비정보기술(IT) 부문에서 부진이 지속되겠으나 <b>반도체</b> 등 IT 부문 투자가 확대되며 전체적으로는 증가 흐름을 올해 이어갈 전망&quot;이라고 내다봤다. 다만 현대경제연은 미국 관세 부과에... ,"Thu, 01 Jan 2026 16:11:00 +0900"
2026-01-01 07:50:11,"국채금리 단기 고점…&quot;채권개미, 방망이는 짧게&quot;",https://n.news.naver.com/mnews/article/015/0005231554?sid=101,"다만 <b>반도체</b> 수출이 증가하고 있고, 내수 소비 역시 견조해 하반기엔 0.2~0.3%포인트 금리가 오를 수 있다는 전망이 많다. 김재정 신한자산운용 채권투자운용본부장은 “<b>반도체</b> 수출 증가율 궤적이 2017~2018년 슈퍼사이클... ","Thu, 01 Jan 2026 16:10:00 +0900"
2026-01-01 07:50:11,"탄소중립 압박 속 철강 대전환…수소환원제철, 선택 아닌 생존",https://www.kyongbuk.co.kr/news/articleView.html?idxno=4060780,산업계는 온실가스 배출량을 53%로 줄일 경우 국내 철강업계(약 8조원)·<b>반도체</b>업계(약 2조원)·자동차업계(약 1조원)는 연간 11조원 정도의 경제적 부담이 있을 것으로 추산했다. 수십조원의 수소환원제철 전환비용과는... ,"Thu, 01 Jan 2026 16:10:00 +0900"
2026-01-01 07:50:11,[울산 국회의원 신년사],https://www.iusm.co.kr/news/articleView.html?idxno=1058094,지난해 석유화학·철강·<b>반도체</b> 등 대한민국과 울산 산업의 재도약을 위한 특별법 3건 통과를 주도했습니다. 특별법 3건은 우리 산업이 다시 뛸 수 있게 길을 넓히는 법안입니다. 길이 넓어지면 기업이 투자할 힘이 생기고... ,"Thu, 01 Jan 2026 16:10:00 +0900"
2026-01-01 07:50:11,"안호영 의원, 민주당 전북 현장 최고위서 '용인 <b>반도체</b> 새만금 이전' 촉...",http://www.domin.co.kr/news/articleView.html?idxno=1540956,"위원장이 '용인 <b>반도체</b> 클러스터의 새만금 이전'에 당이 적극 관심을 가져달라고 제안했다. 이번 현장... 이어, 안호영 의원은 송전탑 갈등의 근본 해법으로 '용인 <b>반도체</b> 클러스터의 지방 이전'을 제시했다. 안 의원은... ","Thu, 01 Jan 2026 16:08:00 +0900"
2026-01-01 07:50:11,[신년사] 김석필 천안시장 권한대행 “지속 가능한 도시경쟁력 확고히”,http://www.sisanews24.co.kr/17719,"아울러, 정부의 ‘AI 고속도로’ 정책 방향에 맞추어 인공지능을 비롯한 <b>반도체</b>와 미래모빌리티 등 미래... 대기업과 첨단 우수기업을 적극 유치하는 한편, 노후 산업단지 개선과 <b>반도체</b> 인력양성, ESG 경영지원과 글로벌... ","Thu, 01 Jan 2026 16:08:00 +0900"
2026-01-01 07:50:11,"실감 나는 AI 세상 예고한 CES... 키워드, '공간컴퓨팅'과 '인터랙티브'",https://n.news.naver.com/mnews/article/469/0000906465?sid=105,"리사 수 AMD CEO도 데이터센터(DC), 클라우드, 개인용컴퓨터(PC)에 고루 적용될 수 있는 통합 AI <b>반도체</b>를 소개할 예정이다. 양 위안칭 레노버 회장은 '모두를 위한 스마트 AI'를 주제로 하이브리드 AI 비전을 발표하고... ","Thu, 01 Jan 2026 16:07:00 +0900"
2026-01-01 07:50:11,"美, 삼성·SK 이어 TSMC에도 <b>반도체</b> 장비 中 반입 허가",https://n.news.naver.com/mnews/article/014/0005456908?sid=101,"미국 정부가 삼성전자, SK하이닉스뿐 아니라 대만 TSMC에도 중국 소재 <b>반도체</b> 공장에 미국산 장비를 쉽게... 부여해 <b>반도체</b> 관련 장비 수출 제한에서 포괄적 예외를 인정해왔다. VEU는 일정한 보안 조건만 충족하면... ","Thu, 01 Jan 2026 16:07:00 +0900"
