DateTime,Title,Link,Description,PubDate
2025-03-05 12:44:23,[이시각헤드라인] 3월 5일 뉴스투나잇,https://n.news.naver.com/mnews/article/422/0000718670?sid=102,"■트럼프 &quot;한국 관세 4배&quot;…<b>반도체</b>법 폐지 시사■ 트럼프 미국 대통령이 첫 의회 연설에서, 우리나라를 콕 집어 미국보다 4배 높은 관세를 부과하고 있다며 불공정함을 주장했습니다. <b>반도체</b> 기업에 보조금을 지급하는... ","Wed, 05 Mar 2025 21:42:00 +0900"
2025-03-05 12:44:23,美정치권서 MBK의 고려아연 M&amp;A 우려 잇따라 제기,https://www.getnews.co.kr/news/articleView.html?idxno=810027,"중국이 수출 통제하는 안티모니, 인듐, 비스무트, 텔루륨 등은 미국의 안보와 직결되는 <b>반도체</b>와 재생... 또 전자부품과 <b>반도체</b> 분야에 쓰이는 인듐은 연간 90톤 이상 생산해 전 세계 생산량의 8.5%를 차지한다. 전 세계... ","Wed, 05 Mar 2025 21:42:00 +0900"
2025-03-05 12:44:23,외국 고급인재에 ‘파격 비자’... 가족들도 영주권 준다,https://n.news.naver.com/mnews/article/023/0003891683?sid=100,정부가 인공지능(AI)·<b>반도체</b>·바이오·방위산업 등 분야의 외국인 기술 인력을 한국으로 유치하겠다며 ‘반값 소득세’와 ‘가족 전체 동반 이주 허용’이라는 파격적인 조건을 내걸었다. 정부가 5일 정부서울청사에서... ,"Wed, 05 Mar 2025 21:42:00 +0900"
2025-03-05 12:44:23,美 관세 리스크… 지역기업 수출 다변화 총력,http://www.ujeil.com/news/articleView.html?idxno=363243,"이날 회의는 이달부터 시행된 미국의 철강·알루미늄 25% 관세 부과와 자동차, <b>반도체</b> 추가 관세 조치에 따른 지역 수출중소기업의 피해를 최소화하고 지원방안을 논의하기 위해 마련됐다. 회의에는 울산시 이영환... ","Wed, 05 Mar 2025 21:38:00 +0900"
2025-03-05 12:44:23,"울산시교육청, 맞춤형 기술인재 양성 가속도",http://www.ujeil.com/news/articleView.html?idxno=363233,"올해부터 <b>반도체</b>, 이차전지, 첨단 자동 공장(스마트 팩토리), 인공지능(AI) 등 첨단 산업 분야 학생 기술 교육과 교원 직무연수로 직업계고 구성원의 역량을 높일 계획이다. 또 직업계고 진학을 희망하는 중학생을 대상으로... ","Wed, 05 Mar 2025 21:38:00 +0900"
2025-03-05 12:44:23,"[미리보는 이데일리 신문]트럼프 “韓 관세, 美의 4배”…상호관세 부과...",https://n.news.naver.com/mnews/article/018/0005956392?sid=102,했지만…상법개정·<b>반도체</b>법 입장차 여전 -진영 초월 개헌 압박에도 길어지는 李의 침묵 -한동훈 이어 오세훈·홍준표…여권 잠룡들 ‘출판 정치’ -탄핵 반대 필리버스터 vs 파면 촉구 의견서…갈라진 청년층 △경제... ,"Wed, 05 Mar 2025 21:37:00 +0900"
2025-03-05 12:44:23,‘EBS 강사’ 주혜연 “증권사 다니다 3개월만 임용 합격” (유퀴즈),https://m.entertain.naver.com/article/144/0001023237,"이날 ‘어떻게 아이들을 가르치게 되었나’라는 질문에 주혜연은 “대학 졸업하고 나서 <b>반도체</b> 회사, 증권사에서 일했다. 직장 생활을 좀 했다. 근데 내가 숫자랑 안 친하다 보니까 증권사에서 어려움이 많았다”고 했다.... ","Wed, 05 Mar 2025 21:37:00 +0900"
2025-03-05 12:44:23,&quot;첨단전략산업기금 50조…은행 연계 100조 지원&quot;,https://www.idaegu.co.kr/news/articleView.html?idxno=502353,"정부가 <b>반도체</b>와 인공지능(AI), 배터리 등 경쟁력을 강화하기 위해 50조원 규모의 첨단전략산업기금을... 첨단전략산업과 국가전략기술 보유 생태계 전반을 구성하는 대기업, 중견·중소기업의 <b>반도체</b>와 배터리(이차전지)... ","Wed, 05 Mar 2025 21:34:00 +0900"
2025-03-05 12:44:23,"경제계, 李에 &quot;<b>반도체</b> 52시간 예외 대타협을&quot;…상법 우려도 전달",http://mbnmoney.mbn.co.kr/news/view?news_no=MM1005486628,한국경제인협회(한경협)을 비롯한 경제단체 관계자들이 5일 더불어민주당 이재명 대표를 만나 '<b>반도체</b> 산업... 우선 <b>반도체</b> 특별법에 '주 52시간 예외'를 명시하는 문제와 관련해 한경협은 &quot;일부 쟁점이 있지만 대타협의... ,"Wed, 05 Mar 2025 21:34:00 +0900"
2025-03-05 12:44:23,"베트남 총리, 한국 기업에 <b>반도체</b> 등 투자확대 요청",https://www.ajunews.com/view/20250305212206271,아주경제=윤주혜 기자 jujusun@ajunews.com 팜 민 찐 베트남 총리 [사진=로이터] 베트남 총리가 한국 기업들에 <b>반도체</b>·인공지능(AI) 등 첨단기술 분야 투자를 늘려달라고 요청했다. 5일(현지시간) 주베트남 한국상공인연합회... ,"Wed, 05 Mar 2025 21:30:00 +0900"
2025-03-05 12:44:23,"경과원, 평택형 히든챔피언 모집···최대 9천만원 R&amp;D 지원",http://www.enewstoday.co.kr/news/articleView.html?idxno=2245523,"특히, <b>반도체</b>, 미래자동차, 수소에너지 관련 기업과 에너지효율 개선과제에는 우대 가점을 부여한다. 강지훈 경제부문 상임이사는 &quot;급변하는 기술환경 속에서 기업이 지속 성장하려면 끊임없이 기술개발에 매진해야 한다... ","Wed, 05 Mar 2025 21:30:00 +0900"
2025-03-05 12:44:23,LS 구자은 회장 &quot;배터리 소재 투자 축소 없어…캐즘 걱정 안 해 &quot;,http://www.whitepaper.co.kr/news/articleView.html?idxno=243834,늘어나고 있어 큰 걱정은 하지 않는다&quot;고 설명했다. 앞서 구 회장은 2023년 LS 사업의 큰 축으로 배터리·전기차·<b>반도체</b> 관련 사업 등 미래 성장 분야에서 성과를 창출한다는 내용을 포함한 '비전 2030'을 발표했다.,"Wed, 05 Mar 2025 21:28:00 +0900"
2025-03-05 12:44:23,바이오 고학력·대기업 외국인 인재 유치 위한 '탑티어 비자' 신설,http://www.bosa.co.kr/news/articleView.html?idxno=2243334,"정부는 3월 중 탑티어 비자를 신설해 세계 최고 수준의 첨단산업(<b>반도체</b>, 디스플레이, 이차전지, 바이오, 로봇, 방산 등) 인재가 우리나라를 선택할 수 있도록 한다는 계획이다. 탑티어 비자 발급 대상은 세계순위 100위... ","Wed, 05 Mar 2025 21:28:00 +0900"
2025-03-05 12:44:23,"여, 포항 찾아 “철강 산업 지원”…야, 업계 만나 “기업 우려 최소화...",https://n.news.naver.com/mnews/article/056/0011905216?sid=100,&quot;] 민주당을 향해 최대 15조 원 규모의 추경 편성과 <b>반도체</b> 특별법 처리 등을 거듭 압박했습니다. [권영세... [류진/한국경제인협회 회장 : &quot;마치 옛날 차였던 여자 친구를 만나는 것 같은 느낌입니다.&quot;] 한경협은 <b>반도체</b>... ,"Wed, 05 Mar 2025 21:28:00 +0900"
2025-03-05 12:44:23,"유재석, 일타강사 카이스트 조기졸업→임용 3개월만 합격 이력에 입이 ...",https://m.entertain.naver.com/article/609/0000960339,"주혜연은 &quot;저는 대학 졸업하고 <b>반도체</b> 회사, 증권사에도 있었다. 직장생활을 했는데 제가 숫자랑 안 친하다보니 증권사에서 어려움이 많았다. 당시 남친이 지금 회사에서 최고 자리까지 올라갈 수 있겠나'하더라. 그러면... ","Wed, 05 Mar 2025 21:21:00 +0900"
2025-03-05 12:44:23,"뉴욕증시 프리뷰, 미 주가 선물 사흘만 반등...포드·엔비디아·테슬라...",https://www.newspim.com/news/view/20250305001033,▲엔비디아(NVDA) ▲브로드컴(AVGO) ▲인텔(INTC) 등 <b>반도체</b> 관련 기업들의 주가도 일제히 오름세다. 조 바이든 정부 때 의회를 통과한 '<b>반도체</b> 지원법(CHIPs ACT)'을 폐지하겠다는 트럼프 대통령의 발언의 영향이다. 반면... ,"Wed, 05 Mar 2025 21:20:00 +0900"
2025-03-05 12:44:23,경북도의회 기획경제위원회 실질적 성과로 지역경제 새로운 지평을 열다,http://www.enewstoday.co.kr/news/articleView.html?idxno=2244881,"특히, 양자기술은 초고속 연산, 초신뢰 통신, 초정밀 계측 등 4차 산업혁명의 핵심 기술로서, 경북도는 차세대 <b>반도체</b> R&amp;D(149억원), 양자대학원 운영(242억원), 국제포럼 개최 등의 사업을 추진하며 양자산업의 거점화를... ","Wed, 05 Mar 2025 21:20:00 +0900"
2025-03-05 12:44:23,<b>반도체</b>산업協 새 회장에 송재혁,https://n.news.naver.com/mnews/article/022/0004016362?sid=101,송재혁(사진) 삼성전자 DS(디바이스솔루션)부문 최고기술책임자(CTO) 사장이 한국<b>반도체</b>산업협회 신임 회장으로 선임됐다. 한국<b>반도체</b>산업협회는 5일 2025년도 정기총회를 열어 제14대 협회장으로 송 사장을 선출했다.... ,"Wed, 05 Mar 2025 21:19:00 +0900"
2025-03-05 12:44:23,여야 협의회 내일 개최…추경·연금·<b>반도체</b>법 논의 주목,https://n.news.naver.com/mnews/article/422/0000718663?sid=100,"여야 원내대표와 원내수석부대표, 정책위의장이 참석하는 '3+3' 형식으로, 추경과 연금개혁, <b>반도체</b>특별법 등의 현안이 논의될 예정입니다. 현안별로 여야 간 의견 차가 큰 데다, 사전 실무협의도 제대로 이뤄지지 않은... ","Wed, 05 Mar 2025 21:17:00 +0900"
2025-03-05 12:44:23,"청주대, 드론쇼코리아에서 항공우주 R&amp;D 홍보 진행",http://www.enewstoday.co.kr/news/articleView.html?idxno=2245509,"충북드론UAM연구센터장 문정호 교수는 &quot;<b>반도체</b>와 이차전지 산업이 현재 충북의 주력 산업이라면, 항공모빌리티 산업은 수송기계산업과 청주공항의 항공산업이 융합된 미래 전략 산업&quot;이라고 말했다. 이어 청주대는... ","Wed, 05 Mar 2025 21:15:00 +0900"
2025-03-05 12:44:23,여 “방위비·통상 연계 차단 필요”…야 “상호 동맹 굳건하게”,https://n.news.naver.com/mnews/article/032/0003354906?sid=100,도널드 트럼프 미국 대통령이 4일(현지시간) 미 의회 상·하원 합동회의 연설에서 한국에 대한 상호관세 부과와 <b>반도체</b>법 폐기 방침 등을 밝히자 국내 정치권도 대응책 마련에 분주한 모습이다. 국민의힘은 통상 문제와... ,"Wed, 05 Mar 2025 21:14:00 +0900"
2025-03-05 12:44:23,"베트남 총리, 한국 기업에 <b>반도체</b>·AI 등 투자확대 요청",https://n.news.naver.com/mnews/article/001/0015248052?sid=104,"만나 <b>반도체</b>·인공지능(AI) 등 첨단기술 분야 투자를 늘려달라고 요청했다. 5일(현지시간) 주베트남... 고태연 하노이 코참 회장은 <b>반도체</b>·AI 등 첨단기술 산업 투자 확대를 위한 법·제도·정책 개선, 수출입 물류 시스템... ","Wed, 05 Mar 2025 21:13:00 +0900"
2025-03-05 12:44:23,통상·안보 엮어 고강도 압박 예고…방위비로 무역적자 메우나,https://n.news.naver.com/mnews/article/032/0003354904?sid=104,또한 전임 조 바이든 행정부에서 제정된 <b>반도체</b>법 폐기를 공식화함에 따라 미국에 대규모 투자를 한 한국... <b>반도체</b> 관세를 예고한 트럼프 대통령이 이날 <b>반도체</b>법을 폐기하겠다고 한 것도 우려스러운 대목이다. 바이든... ,"Wed, 05 Mar 2025 21:12:00 +0900"
2025-03-05 12:44:23,트럼프 ‘<b>반도체</b>법 폐지’ 시사 속내는…삼성·SK의 ‘추가 투자’,https://n.news.naver.com/mnews/article/032/0003354903?sid=101,연설에서 ‘<b>반도체</b>법 폐지’ 방침을 밝히면서 삼성전자와 SK하이닉스가 미국 투자에 따른 보조금을 못 받을... <b>반도체</b>법은 미국 내 <b>반도체</b> 산업을 육성하고 중국을 견제하기 위해 조 바이든 행정부 시절인 2022년 초당적... ,"Wed, 05 Mar 2025 21:12:00 +0900"
2025-03-05 12:44:23,"“한국 관세, 미국의 4배”…동맹 때린 트럼프",https://n.news.naver.com/mnews/article/032/0003354902?sid=104,‘무관세’ 사실 외면한 억지 주장 상호관세 내달부터 부과 확인 <b>반도체</b>법도 폐기…기업 ‘타격’ 정부... 트럼프 대통령은 또 <b>반도체</b>법을 폐기하겠다고 밝혀 대미 투자를 결정한 삼성전자와 SK하이닉스 등 한국 기업들이... ,"Wed, 05 Mar 2025 21:11:00 +0900"
2025-03-05 12:44:23,"경북도의회 기획경제위원회, 입법 활동 속속 성과",http://www.ksmnews.co.kr/news/view.php?idx=527667,"특히 양자기술은 초고속 연산, 초신뢰 통신, 초정밀 계측 등 4차 산업혁명의 핵심 기술로서, 경북도는 차세대 <b>반도체</b> R&amp;D(149억원), 양자대학원 운영(242억원), 국제포럼 개최 등의 사업을 추진하며 양자산업의 거점화를... ","Wed, 05 Mar 2025 21:08:00 +0900"
2025-03-05 12:44:23,"충북도, 1천3백50억 원 규모 창업펀드 추가 조성",https://n.news.naver.com/mnews/article/655/0000023876?sid=101,"조성될 펀드는 첨단모빌리티와 거점제조업체, AI, 문화관광과 <b>반도체</b>소부장 등 충북지역 전략산업 기업에 투입됩니다. 한편 지금까지 도내에서는 1천2백41억 원 규모의 6개 창업 펀드가 운용 중입니다.","Wed, 05 Mar 2025 21:07:00 +0900"
2025-03-05 12:44:23,‘산단 조성~사후 지원’ 기업 위한 경북도,http://www.ksmnews.co.kr/news/view.php?idx=527808,"도는 설명회를 통해 이차전지, <b>반도체</b>, 자동차부품 등의 산업 클러스터가 형성돼 있는 경북의 투자 환경을 소개하고, 다양한 산업 생태계를 통해 투자 기업들이 서로 협력하고 시너지 효과를 낼 수 있는 우수한 환경임을... ","Wed, 05 Mar 2025 21:06:00 +0900"
2025-03-05 12:44:23,&quot;한국산 철강 25% 관세 부과하면 경북 수출 2.5조 감소&quot;,https://www.tbc.co.kr/news/view?pno=20250305151533AE02521&id=193967,"특히 트럼프 행정부가 수입 자동차에 대한 관세를 부과하면 후방산업인 지역 자동차 부품업계의 타격은 훨씬 크고, <b>반도체</b> 업계도 악영향이 불가피해 보입니다. 트럼프 대통령은 취임 후 첫 의회연설에서 한국의 평균... ","Wed, 05 Mar 2025 21:06:00 +0900"
2025-03-05 12:44:23,압박과 채찍…“알래스카 투자 OK·<b>반도체</b> 보조금은 NO”,https://n.news.naver.com/mnews/article/056/0011905202?sid=101,"트럼프 대통령은 알래스카 가스 개발에 투자하라고 압박하면서, 미국이 투자 대가로 약속한 <b>반도체</b>... 트럼프는 <b>반도체</b> 업체엔 '채찍'을 휘둘렀습니다. 미국에 <b>반도체</b> 공장을 짓는 대신 삼성전자와 SK하이닉스에... ","Wed, 05 Mar 2025 21:05:00 +0900"
2025-03-05 12:44:23,2025 PID 개막...첨단섬유 한자리에,https://www.tbc.co.kr/news/view?pno=20250305160336AE02530&id=193966,한국 원단은 기능성이 뛰어나고 시장 트렌드에 맞아 좋습니다.&quot;] <b>반도체</b> 기판에 들어가는 특수소재와 모빌리티용 탄소섬유. 웨어러블 로봇용 원단 같은 고부가가치 산업용 섬유도 잇따라 선보였습니다. AI를 활용한 제품... ,"Wed, 05 Mar 2025 21:04:00 +0900"
2025-03-05 12:44:23,타깃 CEO &quot;관세 인상 영향… 일부 인기 상품 다음주부터 가격 상승&quot;,https://www.tokenpost.kr/article-225843,"미국 정부는 최근 중국산 제품에 대한 추가 관세 정책을 발표하며, <b>반도체</b>, 전기차 배터리, 철강 등 광범위한 품목에 대한 관세율을 인상한 바 있다. 이에 따라 주요 유통업체들은 공급망 비용 증가와 물가 상승에 대한... ","Wed, 05 Mar 2025 21:04:00 +0900"
2025-03-05 12:44:23,"트럼프 &quot;한국 관세 4배 높다, <b>반도체</b>법 폐지&quot;…韓 경제 '초비상'",https://n.news.naver.com/mnews/article/448/0000511952?sid=101,"재집권 후 처음으로 상.하원 합동연설을 한 트럼프는, 이전 정부가 이미 약속했던 <b>반도체</b> 기업 지원도... <b>반도체</b> 시설 투자에 보조금을 지급하는 '<b>반도체</b>법'도 폐지하겠다고 말했습니다. 도널드 트럼프 / 美 대통령... ","Wed, 05 Mar 2025 21:02:00 +0900"
2025-03-05 12:44:23,임시국회 또 빈손?..현안 뒷전,https://www.g1tv.co.kr/news?mid=1_207_6&newsid=324469,"추경 예산부터 연금 개혁, <b>반도체</b> 특별법 등 쟁점은 접점이 없습니다. 강원 특별법 개정안 등 지역 현안은... ◀S Y N▶ 이양수 국민의힘 사무총장 &quot;추경, 연금 개혁, <b>반도체</b> 주 52시간 근무 예외, 상속세법 개정 문제 등... ","Wed, 05 Mar 2025 21:02:00 +0900"
2025-03-05 12:44:23,"트럼프, 한국 특정해 “군사 지원하는데도 미국 4배 관세”",https://n.news.naver.com/mnews/article/056/0011905200?sid=104,"트럼프 대통령은 한국의 관세는 불공정하고, <b>반도체</b> 기업에 약속한 보조금은 끔찍하다면서, 전방위 압박을... &quot;] 트럼프는 또, <b>반도체</b> 회사에 보조금을 주는 <b>반도체</b>법을 폐지하겠다고 공언했습니다. 현실화되면 보조금을... ","Wed, 05 Mar 2025 21:01:00 +0900"
2025-03-05 12:44:23,SK해운 인수하는 HMM…엇갈린 시선,https://n.news.naver.com/mnews/article/024/0000095401?sid=101,"트럼프 대통령이 자동차, <b>반도체</b> 등 주요 산업 관세 도입을 예고하면서 물동량 둔화 우려가 커진 탓이다. HMM 실적이 다시 고꾸라질 경우 인수 메리트가 떨어져 매각이 더욱 난항을 겪을 가능성도 높다. “HMM... ","Wed, 05 Mar 2025 21:01:00 +0900"
2025-03-05 12:44:23,투자회사 맞나…정체성 흐려진 SK스퀘어,https://n.news.naver.com/mnews/article/024/0000095402?sid=101,SK스퀘어는 지난 2021년 SK텔레콤에서 분할하며 <b>반도체</b>·정보통신기술(ICT) 투자전문 중간지주사를... 고대역폭메모리(HBM) 등 인공지능(AI) <b>반도체</b> 고도화로 SK하이닉스와 시너지를 낼 만한 빅딜을 위해서는 최소 수조원... ,"Wed, 05 Mar 2025 21:01:00 +0900"
2025-03-05 12:44:23,"울산직업교육복합센터, 올해부터 본격 운영",https://www.usmbc.co.kr/article/GfIbkRtnGvqk0kKmRZ_,"울산직업교육복합센터는 울산공고에 지상 4층 규모로 조성됐으며 올해부터 <b>반도체</b>와 이차전지, 인공지능 등 첨단 산업 분야 학생 기술 교육을 시행할 예정입니다. 또 직업계고 진학을 희망하는 중학생을 대상으로 체험... ","Wed, 05 Mar 2025 21:00:00 +0900"
2025-03-05 12:44:23,퓨리오사AI 백준호 &quot;국내 모험자본 크게 부족…최근 어려움 직면&quot;,https://n.news.naver.com/mnews/article/031/0000913707?sid=105,(AI) <b>반도체</b> 설계 회사다. 메타는 자체 AI 칩 개발을 위해 퓨리오사AI 인수를 타진한 것으로 알려졌다. 최근에는 세계 최대 <b>반도체</b> 위탁생산(파운드리)업체 대만 TSMC까지 퓨리오사AI에 전략적 투자를 검토 중인 것으로... ,"Wed, 05 Mar 2025 21:00:00 +0900"
2025-03-05 12:44:23,[3월6일자] 비즈니스포스트 아침의 주요기사,https://www.businesspost.co.kr/BP?command=article_view&num=385839,"대만과 '<b>반도체</b> 협상' 서막 올라, TSMC 투자 확대에 더욱 불안한 시선 &quot; ● 배터리 소재로 활로 찾는 화학사... 증가에 <b>반도체</b>기판 실적 반등 전망, 김영구 3년만에 '흑자전환'하나 ● 위메이드 신작 흥행에 샴페인 축배... ","Wed, 05 Mar 2025 21:00:00 +0900"
2025-03-05 12:44:23,"경기도, 시스템<b>반도체</b> 후공정 분야 기술개발 지원사업 참여기업 모집",https://n.news.naver.com/mnews/article/031/0000913709?sid=004,경기도가 시스템<b>반도체</b> 산업 생태계 강화 지원을 위해 '2025년도 경기도 시스템<b>반도체</b> 후공정(OSAT)분야 기술개발 지원사업'에 참여할 도내 창업 기업을 다음달 1일까지 모집한다. 이 사업은 시스템<b>반도체</b> 관련... ,"Wed, 05 Mar 2025 21:00:00 +0900"
2025-03-05 12:44:23,&quot;마은혁 임명 거부는 범죄&quot;...&quot;한덕수 탄핵안 신속 각하&quot;,https://n.news.naver.com/mnews/article/422/0000718656?sid=161,"추경, 연금 개혁, <b>반도체</b> 특별법, 상속세 등 각종 안건을 놓고 여야가 평행선만 달리는 가운데 6일 국정협의회는 민주당 요구로 최상목 대행 없이 열리게 됐습니다. 연합뉴스TV 장윤희입니다. #헌법재판소 #최상목 #마은혁... ","Wed, 05 Mar 2025 20:59:00 +0900"
2025-03-05 12:44:23,"생산도 출하도 뚝...충북 경제, 연초부터 '흔들'",https://n.news.naver.com/mnews/article/655/0000023872?sid=101,"특히 내수부진에 <b>반도체</b> 수요 둔화, 미국발 관세전쟁 등으로 앞으로도 걱정입니다. 채현석기잡니다.... 1년 전보다는 8.8% 떨어졌습니다.// //충북의 주력 품목인 <b>반도체</b>와 전기차 수요 둔화로 전자제품과 화학제품... ","Wed, 05 Mar 2025 20:57:00 +0900"
2025-03-05 12:44:23,"이재명, 이재용과 청년 사회진출 논의... <b>반도체</b> 특별법·AI 개발 드디어...",https://www.ggilbo.com/news/articleView.html?idxno=1077054,"이번 회동에서 <b>반도체</b> 특별법이 논의될 전망이다. 당 관계자는 &quot;삼성전자는 <b>반도체</b> 수출에 중추적 역할을 하는 기업이다. 대미 통상 문제와 국내 경제 현안 등이 토론 주제로 잡혀 있진 않지만, 논의 소재로 열려 있다... ","Wed, 05 Mar 2025 20:56:00 +0900"
2025-03-05 12:44:23,김해시 2026년도 국비 약 1조원 확보한다,https://www.gnnews.co.kr/news/articleView.html?idxno=605892,시는 미래전략산업 경쟁력 강화를 위해 △수소액화 플랜트용 압축기 개발 테스트베드 구축 △김해 오픈이노베이션 지식산업센터 건립 △차세대 고효율 전력<b>반도체</b> 실증 인프라 구축 △고중량물 이송 자율이동체... ,"Wed, 05 Mar 2025 20:54:00 +0900"
2025-03-05 12:44:23,"[사설] 내우외환 한국경제, 오늘 여야협의회 추경 마지막 기회다",https://n.news.naver.com/mnews/article/028/0002734227?sid=110,최대 수출 품목인 <b>반도체</b> 수출도 15개월 만에 감소세로 돌아섰다. 미국의 통상 압박이 본격화하면서 수출도... 여야는 이번 회의에서 추경 외에도 연금개혁과 <b>반도체</b>특별법도 중점 논의하기로 했다. 연금개혁과... ,"Wed, 05 Mar 2025 20:54:00 +0900"
2025-03-05 12:44:23,<b>반도체</b>·AI·배터리 집중 지원…첨단전략산업기금 50조원 조성,https://n.news.naver.com/mnews/article/422/0000718652?sid=161,"정부가 <b>반도체</b>, 인공지능, 이차전지 등 국내 첨단전략산업을 대상으로 하는 50조원 규모의 지원책을... <b>반도체</b>, 바이오, 이차전지, 인공지능 AI와 같은 업종이 여기에 해당합니다. 재원 규모는 5년간 최대 50조원 수준.... ","Wed, 05 Mar 2025 20:52:00 +0900"
2025-03-05 12:44:23,트럼프 &quot;미국 황금기 도래&quot; 선언…'미국 우선주의' 강력 추진,https://www.ajunews.com/view/20250305204910260,"또한, 바이든 행정부가 추진한 <b>반도체</b>법 폐지를 예고하면서 ”<b>반도체</b> 기업들이 미국에서 공장을 세우려는 이유는 보조금이 아니라 관세 덕분“이라고 주장했다. 트럼프 대통령은 우크라이나 전쟁과 관련해 볼로디미르... ","Wed, 05 Mar 2025 20:52:00 +0900"
2025-03-05 12:44:23,충북 창업펀드 1350억원 추가 조성,http://www.dynews.co.kr/news/articleView.html?idxno=791611,"도는 지역 문화 콘텐츠를 지원하는 250억원 규모 '문화·관광 펀드'와 <b>반도체</b>·첨단산업 소부장 기업에 투자하는 200억원 규모 '소부장 펀드'도 조성한다. 현재 도내에서는 국비 545억원, 도비 130억원, 시군비 8억원, 기타... ","Wed, 05 Mar 2025 20:48:00 +0900"
2025-03-05 12:44:23,'대전형 라이즈' 교육혁신 본격화…올해 시행계획 심의·의결,http://www.dynews.co.kr/news/articleView.html?idxno=791623,"대전의 6대 전략산업(우주항공·바이오·나노 <b>반도체</b>·국방·양자·로봇) 및 특화산업과 연계한 교육과정 개편, 연구 협력, 취·창업 지원 등 지역 정주를 촉진할 핵심 사업을 집중 추진한다. 이장우 대전시장은 &quot;대전의 우수... ","Wed, 05 Mar 2025 20:48:00 +0900"
