DateTime,Title,Link,Description,PubDate
2025-08-27 19:47:54,[글로벌 비즈 브리핑] 테일러 스위프트 약혼소식에...보석주 '껑충' 外,https://n.news.naver.com/mnews/article/374/0000459872?sid=104,주가도 고공행진 중국의 <b>반도체</b> 설계업체(팹리스) 캠브리콘 테크놀로지스가 중국 내 인공지능(AI) 칩 수요... 캠브리콘은 인공지능(AI) <b>반도체</b>를 개발하는 중국의 선도적인 <b>반도체</b> 기업입니다. 2016년 설립된 이 회사는... ,"Thu, 28 Aug 2025 04:45:00 +0900"
2025-08-27 19:47:54,"미 재무, 조선업체 지분 확보 가능성 시사…“자급자족 필요”",https://n.news.naver.com/mnews/article/056/0012017650?sid=104,스콧 베센트 미국 재무부 장관은 트럼프 행정부가 <b>반도체</b> 다음으로 기업 지분을 인수할 가능성이 있는 산업으로 조선업을 지목했습니다. 베센트 장관은 현지시각 27일 폭스비즈니스 인터뷰에서 트럼프 대통령이 <b>반도체</b>... ,"Thu, 28 Aug 2025 04:38:00 +0900"
2025-08-27 19:47:54,"미 재무, 조선업체 지분 확보 가능성 시사",https://n.news.naver.com/mnews/article/214/0001445520?sid=104,스콧 베선트 미국 재무부 장관이 트럼프 행정부가 <b>반도체</b> 다음으로 기업 지분을 인수할 가능성이 있는... 앞서 미국 정부는 인텔에 <b>반도체</b>법에 근거한 보조금을 비롯해 모두 111억달러를 투자하고 인텔 지분 10%를... ,"Thu, 28 Aug 2025 04:38:00 +0900"
2025-08-27 19:47:54,[기자수첩]'안미경중' 불가능 시대의 에너지 산업,https://n.news.naver.com/mnews/article/008/0005241961?sid=101,"조선, <b>반도체</b>, 자동차, 인공지능(AI) 같은 주력산업은 에너지 기반이 뒷받침돼야 성장 모멘텀을 확보할 수 있다. 이 대통령이 강조한 '제조업 르네상스'도, '안미경중'(안보는 미국, 경제는 중국) 탈피도 첨단산업과 에너지... ","Thu, 28 Aug 2025 04:28:00 +0900"
2025-08-27 19:47:54,"'中판 엔비디아' 캠프리콘, 매출 4300% 폭증...주가도 고공행진",https://n.news.naver.com/mnews/article/374/0000459861?sid=104,중국의 <b>반도체</b> 설계업체(팹리스) 캠브리콘 테크놀로지스가 중국 내 인공지능(AI) 칩 수요 급증에 힘입어... 캠브리콘은 인공지능(AI) <b>반도체</b>를 개발하는 중국의 선도적인 <b>반도체</b> 기업입니다. 2016년 설립된 이 회사는... ,"Thu, 28 Aug 2025 04:28:00 +0900"
2025-08-27 19:47:54,"美재무, 美 조선업체 지분 확보 가능성 시사…&quot;자급자족 필요&quot;",https://n.news.naver.com/mnews/article/001/0015590711?sid=104,행정부가 <b>반도체</b> 다음으로 기업 지분을 인수할 가능성이 있는 산업으로 조선업을 지목했다. 베선트 장관은 이날 폭스비즈니스 인터뷰에서 트럼프 대통령이 <b>반도체</b> 기업인 엔비디아의 지분 확보도 고려하냐는 질문에... ,"Thu, 28 Aug 2025 04:26:00 +0900"
2025-08-27 19:47:54,"미국증시 마감 60분전...4대지수 '상승', 몽고DB '폭등', 엔비디아는?",http://www.choicenews.co.kr/news/articleView.html?idxno=152998,장중(한국시각 28일 새벽 4시 12분 기준) 이날 정규장 거래 마감 후 실적을 발표할 AI<b>반도체</b> 대장주 엔비디아의 주가는 181.30 달러로 0.26% 하락한 채로 거래가 이뤄지고 있다. 엔비디아는 미국증시 정규장 마감... ,"Thu, 28 Aug 2025 04:26:00 +0900"
2025-08-27 19:47:54,[사설]건설산업이 다시 대한민국 경제의 희망이 되려면,https://www.dnews.co.kr/uhtml/view.jsp?idxno=202508271540057700328,"건설은 <b>반도체</b>, 자동차에 이어 수출분야에서 세번째로 1조 달러를 달성했다. 종합하면 건설은 대한민국 경제를 위해, 그리고 지속성장을 위해 해야할 역할이 아직 많다. 한승구 회장은 이날 “건설인 모두는 건설산업이... ","Thu, 28 Aug 2025 04:20:00 +0900"
2025-08-27 19:47:54,美상무 &quot;韓日 투자금으로 인프라 짓겠다&quot;,https://n.news.naver.com/mnews/article/374/0000459860?sid=104,이날 러트닉 장관은 트럼프 행정부가 <b>반도체</b> 기업인 인텔의 지분 확보와 비슷한 방식으로 미국 방산업체의... 트럼프 정부는 최근 <b>반도체</b>법에 따라 지급하는 보조금을 &quot;대기업에 무료로 돈을 주는 것&quot;이라고 비판하며... ,"Thu, 28 Aug 2025 04:16:00 +0900"
2025-08-27 19:47:54,"'중국판 엔비디아' 캄브리콘, AI 수요에 매출 4000% 급증",https://n.news.naver.com/mnews/article/293/0000071705?sid=105,엔비디아의 중국 사업을 둘러싼 불확실성이 부각되고 있는 가운데 중국 인공지능(AI) <b>반도체</b> 업체인... 이는 미국의 대중 <b>반도체</b> 수출통제 조치를 준수하기 위해 엔비디아가 성능을 낮춰 출시한 H20보다 우수할 수... ,"Thu, 28 Aug 2025 04:05:00 +0900"
2025-08-27 19:47:54,"美재무 &quot;조선업, 지분 인수 필요&quot;…韓 '마스가' 투자 제약 우려(종합)",https://n.news.naver.com/mnews/article/421/0008452038?sid=104,'조선업체나 <b>반도체</b> 기업이 정치적 영향력이나 인텔과 같이 정부 지분 참여 기업이 우대받는 상황에 대해 우려해야 하느냐'는 질문에 베선트 장관은 대만 파운드리(<b>반도체</b> 위탁 생산) 업체 TSMC가 <b>반도체</b> 생산에서... ,"Thu, 28 Aug 2025 04:04:00 +0900"
2025-08-27 19:47:54,머니투데이 오프라인 헤드라인-28일,https://n.news.naver.com/mnews/article/008/0005241950?sid=101,"SK리비오에 400억 또 '수혈' &quot;車<b>반도체</b>·로보틱스 양대 성장축...미래차 전환기, 기술경쟁력 강화&quot; 3조3교대로.... 차세대 <b>반도체</b> 美서 공개 [ICT·과학] &quot;스타트업 최적, 국산 AI 레시피 찾을 것&quot; 삼성 태블릿 PC '투트랙... ","Thu, 28 Aug 2025 04:00:00 +0900"
2025-08-27 19:47:54,이재명 정부 '에너지 고속도로'의 불편한 진실,https://n.news.naver.com/mnews/article/053/0000051980?sid=105,"경기 남동부에 RE100 <b>반도체</b> 클러스터를 조성하고, 예고된 전남 RE100 산단을 조기에 구축하겠다는 대선 공약을 실행에 옮기겠다고 한다. 하루 24시간 1년 365일 연속 가동이 필수인 <b>반도체</b> 생산 설비는 간헐적인... ","Thu, 28 Aug 2025 04:00:00 +0900"
2025-08-27 19:47:54,[광화문] 광복 80주년과 소버린AI,https://n.news.naver.com/mnews/article/008/0005241952?sid=110,한국은 IT(정보기술) 강국이자 <b>반도체</b> 제조강국으로 불리지만 정작 초거대 AI 모델과 클라우드 인프라는 해외 빅테크 의존도가 높은 게 현실이다. 공공기관의 클라우드 전환 역시 아마존(AWS)·마이크로소프트(MS) 등... ,"Thu, 28 Aug 2025 04:00:00 +0900"
2025-08-27 19:47:54,"일본, 라피더스 지원 위해 '홋카이도 물류 룰' 만든다",http://www.g-enews.com/ko-kr/news/article/news_all/202508271812328969fbbec65dfb_1/article.html,"일본 정부가 차세대 <b>반도체</b> 기업 라피더스의 안정적인 양산 체계 구축을 위해 발 벗고 나섰다고 닛케이가 27일(현지시각) 보도했다. 보도에 따르면 <b>반도체</b> 생산에 필수적인 위험물 자재의 해상 운송 규정을 손질해, 이른바... ","Thu, 28 Aug 2025 03:36:00 +0900"
2025-08-27 19:47:54,"충청북도, 'AI 전략과' 신설 추진…미래산업 대전환 청사진 공개",https://www.tokenpost.kr/news/ai/280704,"이 전략은 AI 기술을 산업 전반에 융합하는 방향으로 설정돼, 특히 바이오와 <b>반도체</b> 등 충북의 기존 강점을... 또한, 충북 특화 산업(예: 바이오·<b>반도체</b>)과의 AI 융복합을 통해 경쟁력을 강화하겠다는 구상도 병행되고... ","Thu, 28 Aug 2025 03:32:00 +0900"
2025-08-27 19:47:54,"애플, AI 인수보다 협력 선택하나…팀 쿡 “무리한 베팅 안 한다”",http://www.g-enews.com/ko-kr/news/article/news_all/202508271804208002fbbec65dfb_1/article.html,애플 역시 2008년 <b>반도체</b> 설계 스타트업 PA세미(P.A. Semi)를 소규모로 인수한 것이 훗날 자사 <b>반도체</b> 칩 개발을 가능하게 한 핵심 자산이 됐다. ◇ “인수보다 협력”…AI 경쟁 비용이 걸림돌 현재 글로벌 IT... ,"Thu, 28 Aug 2025 03:16:00 +0900"
2025-08-27 19:47:54,이상일 용인특례시장 &quot;용인와 함께 비즈니스 성공 거둘 수 있도록 적극...,https://ilyo.co.kr/?ac=article_view&entry_id=498644,"이상일 용인시장은 환영사에서 &quot;용인특례시는 지난 한 해 동안 세계 최대 <b>반도체</b> 메가 클러스터 중심도시로 나아가기 위한 눈부신 성과를 이뤘다&quot;며 &quot;세계적인 <b>반도체</b> 장비 기업인 ASML, 램리서치, 도쿄일렉트론을... ","Thu, 28 Aug 2025 03:06:00 +0900"
2025-08-27 19:47:54,中 수출 200억 달러 달성 거점 생겼다,https://n.news.naver.com/mnews/article/020/0003657114?sid=102,김 지사는 “한국과 중국이 수교를 맺은 지 33년이 됐다”며 “도내 주요 수출품인 <b>반도체</b>와 디스플레이의 공급망이자 안정적인 시장으로서 중국은 핵심 교역국이다. 중국사무소를 거점으로 대중국 산업 투자... ,"Thu, 28 Aug 2025 03:05:00 +0900"
2025-08-27 19:47:54,현대모비스 ‘로봇 부품 개발’ 본격 질주,https://n.news.naver.com/mnews/article/020/0003657093?sid=101,"SDV 제어에 필요한 차량용 <b>반도체</b> 개발에도 박차를 가하겠다고 이 사장은 밝혔다. 자동차 안에서 내·외부 데이터를 주고받게 하는 핵심 <b>반도체</b> 칩인 ‘통신용 SoC(System on Chip)’, 전기차 배터리 상태를 감시하는 <b>반도체</b>... ","Thu, 28 Aug 2025 03:04:00 +0900"
2025-08-27 19:47:54,美관세 타결-소비쿠폰에… 기업체감경기 석달만에 상승,https://n.news.naver.com/mnews/article/020/0003657087?sid=101,"이혜영 한은 경제심리조사팀장은 “관세 협상 타결로 통상 관련 불확실성이 낮아진 가운데 <b>반도체</b>와 자동차를 중심으로 수출이 호조세를 나타냈다”며 “비제조업도 휴가철, 민생회복 소비쿠폰 등의 영향으로... ","Thu, 28 Aug 2025 03:04:00 +0900"
2025-08-27 19:47:54,‘나노급 분체 생산 기술’로 이차전지-<b>반도체</b> 소재 시장 선도,https://n.news.naver.com/mnews/article/020/0003657071?sid=101,"시대, <b>반도체</b>와 이차전지는 미래 산업의 핵심 동력으로 자리 잡고 있다. 이들 첨단산업의 경쟁력을 좌우하는 것은 바로 초미세 분체 처리 기술이다. 나노 단위까지 정밀하게 제어된 소재만이 고성능 배터리와 <b>반도체</b>의... ","Thu, 28 Aug 2025 03:03:00 +0900"
2025-08-27 19:47:54,"[김종구 칼럼] 세계 7대 부자도시 화성시, 교육환경이 완성한다",https://n.news.naver.com/mnews/article/666/0000082171?sid=110,<b>반도체</b>·자동차 산업의 본산을 교육과 연계했다. 방향이 좋다. 잘 잡은 거 같다. 신도시 성공은 늘 교육이 좌우했다. 모래 벌판 강남을 완성한 게 ‘경기高’다. 분당을 끌어올린 것도 교육이다. 현실적으로 보면... ,"Thu, 28 Aug 2025 03:02:00 +0900"
2025-08-27 19:47:54,미 상무장관 &quot;한일 투자금으로 제조업·인프라 재건 위한 펀드 조성&quot;,https://n.news.naver.com/mnews/article/293/0000071704?sid=101,최근 트럼프 행정부가 인텔에 <b>반도체</b> 보조금을 지급하는 대가로 10%의 지분을 취득하고 록히드마틴과 같은 방산업체 지분 확보를 검토하는 등 민간기업 지분 확대에 나서고 있다. 여기에 무역협상에 따라 확보한 투자금이... ,"Thu, 28 Aug 2025 02:49:00 +0900"
2025-08-27 19:47:54,‘2025 차세대 <b>반도체</b> 패키징 산업전’ 개막…국내외 183개 기업 참여,https://n.news.naver.com/mnews/article/382/0001219602?sid=102,"경기도와 수원시가 공동 개최하는 ‘2025 차세대 <b>반도체</b> 패키징 산업전’이 27일 수원컨벤션센터에서 개막했다. 이번 행사는 오는 29일까지 3일간 열리며, 국내외 183개 <b>반도체</b> 기업이 350여 개 부스를 운영한다.... ","Thu, 28 Aug 2025 02:37:00 +0900"
2025-08-27 19:47:54,"[속보]미국증시, 엔비디아 실적 기대하며 다우-S&amp;P-나스닥-<b>반도체</b> 0.2% 안...",https://www.socialvalue.kr/news/view/1065546967919752,"필라델피아 <b>반도체</b>지수는 전장보다 12포인트(0.21%) 오른 5,820을 나타내고 있다. 주요 종목으로는 엔비디아가 0.1% 상승한 것을 비롯해 마이크로소프트 0.6%, 애플 0.2%, 아마존닷컴 0.01%, 브로드컴 0.3%, 구글의 알파벳 0.... ","Thu, 28 Aug 2025 02:34:00 +0900"
2025-08-27 19:47:54,"“중, AI <b>반도체</b> 생산 3배 확대한다” FT",https://n.news.naver.com/mnews/article/014/0005397810?sid=101,중국 <b>반도체</b> 업체들이 내년에는 인공지능(AI) <b>반도체</b> 생산량을 지금의 3배로 확대하려 하고 있다고 파이낸셜타임스(FT)가 27일(현지시간) 보도했다. AI <b>반도체</b>에 필수적인 HBM(고대역폭 메모리) <b>반도체</b>도 현재 개발을... ,"Thu, 28 Aug 2025 02:33:00 +0900"
2025-08-27 19:47:54,"이상일, “경기도내 무역수지 흑자 2위 차지...지난해 84억 달러 이상 기...",https://www.ekn.kr/web/view.php?key=20250827023471090,"이상일 시장은 환영사를 통해 “용인특례시는 지난 한 해 동안 세계 최대 <b>반도체</b> 메가 클러스터 중심도시로 나아가기 위한 눈부신 성과를 이뤘다&quot;며 “세계적인 <b>반도체</b> 장비 기업인 ASML, 램리서치, 도쿄일렉트론을... ","Thu, 28 Aug 2025 02:30:00 +0900"
2025-08-27 19:47:54,"대만 검찰, TSMC 기밀유출 엔지니어 3명 기소…최고 14년 구형",https://n.news.naver.com/mnews/article/003/0013446360?sid=104,대만 검찰은 세계 1위 파운드리(<b>반도체</b> 위탁생산) 업체 TSMC의 최첨단 2㎚(나노미터·10억분의 1m) 공정... 이들 3명 가운데에는 일본 <b>반도체</b> 업체 도쿄일렉트론의 대만 자회사에서 근무하던 전 TSMC 엔지니어도 포함됐다.... ,"Thu, 28 Aug 2025 02:22:00 +0900"
2025-08-27 19:47:54,"[MT시평]험난했던 무역합의, 이제 기업 보살필 때",https://n.news.naver.com/mnews/article/008/0005241945?sid=110,<b>반도체</b>와 의약품은 최혜국대우(MFN)를 보장받았고 3500억달러 규모의 대미투자와 4년간 1000억달러 상당의... 자동차와 <b>반도체</b> 등 주력 품목의 수출이 급격히 위축되는 것을 막아낸 점도 성과다. 다만 이번 합의는 의회의... ,"Thu, 28 Aug 2025 02:05:00 +0900"
2025-08-27 19:47:54,"AI 확산에 에너지 대전환 가속…청정에너지 투자, 화석연료 2배 넘었다",https://www.tokenpost.kr/news/tech/280683,"에너지 수요 증가의 배경에는 AI, 배터리, <b>반도체</b> 등 고속 연산과 대용량 저장이 필요한 기술 산업 확장이... AI, 배터리, <b>반도체</b> 생산에 필수적인 리튬, 코발트, 희토류 등 주요 광물 자원이 특정 국가에 지나치게... ","Thu, 28 Aug 2025 02:02:00 +0900"
2025-08-27 19:47:54,[미국증시 개장브리핑] 실적과 분석가 평가 따라 나스닥 종목 희비 엇갈...,https://www.tokenpost.kr/news/market/280675,"<b>반도체</b> 업종과 크리스피 크림 '부진' 국채 수익률 상승은 <b>반도체</b> 업종 전반에 압박을 가하며 약세를 보이게 했다. 엔비디아(NVDA)는 실적 발표를 앞두고 주목받고 있으며, MSFT, AAPL은 소폭 상승세를 보이고... ","Thu, 28 Aug 2025 01:32:00 +0900"
2025-08-27 19:47:54,"수원시의회, 2025 차세대 <b>반도체</b> 패키징 산업전 개막식 참가",https://www.thereport.co.kr/news/articleView.html?idxno=69851,경기 수원특례시의회는 27일 수원컨벤션센터에서 열린 '2025 차세대 <b>반도체</b> 패키징 산업전 개막식' 에... 이재식 의장은 축사에서 &quot;<b>반도체</b> 패키징은 이제 미래 산업을 이끄는 핵심 기술&quot;이라며 &quot;우리나라 역시 메모리... ,"Thu, 28 Aug 2025 01:24:00 +0900"
2025-08-27 19:47:54,"이권재 오산시장, “사전협의 없는 불도저식 행정 용납 못해...정치권·...",https://www.ekn.kr/web/view.php?key=20250827021341112,이에 시는 인근 용인 <b>반도체</b> 국가산단까지 가동되면 수도권 남부 교통망이 마비될 수 있다는 걸 예측했음에도 경기도 교평위가 향후 교통대란에 대한 정확한 해결방안을 마련하지 않은 상태에서 원안 가결했다는 것을... ,"Thu, 28 Aug 2025 01:20:00 +0900"
2025-08-27 19:47:54,"용인시, 해외 바이어 초청 'Y-Trade 수출상담회' 성황리 개최",https://n.news.naver.com/mnews/article/030/0003344555?sid=101,이상일 시장은 “용인은 세계 최대 <b>반도체</b> 메가클러스터 중심도시로 도약하기 위해 성과를 이어가고... 원삼면 <b>반도체</b> 클러스터에서는 첫 번째 팹이 2027년 상반기 가동돼 고대역폭 메모리(HBM)을 생산할 계획”이라고... ,"Thu, 28 Aug 2025 01:16:00 +0900"
2025-08-27 19:47:54,시티은행 추천 주식 6종목 &quot;기술주 대신 우버·캐피털원 투자 추천&quot;,http://www.g-enews.com/ko-kr/news/article/news_all/202508271750347624fbbec65dfb_1/article.html,엔비디아 등 <b>반도체</b> 제조업체의 인공지능(AI) 칩 수요 급증과 마이크로소프트 등 소프트웨어 업체의 AI 제품 성장에 대한 기대감이 반영된 결과다. 현재 기술주는 앞으로 12개월 예상 수익의 27배를 넘는 주가수익비율... ,"Thu, 28 Aug 2025 01:16:00 +0900"
2025-08-27 19:47:54,"러트닉 “한·일 등의 자금으로, 미 경제안보기금 만들겠다”",https://n.news.naver.com/mnews/article/025/0003464911?sid=104,러트닉 장관은 <b>반도체</b> 기업 인텔에 이어 방산 기업 지분 확보에도 관심이 있다고 밝혔다. 그는 “방위산업(지분 확보)에 관해 엄청난 논의가 있다”며 “록히드마틴은 매출 97%를 미국 정부에서 만드는 사실상 미 정부의... ,"Thu, 28 Aug 2025 01:06:00 +0900"
2025-08-27 19:47:54,"IBM·AMD, 양자 컴퓨팅 시대 여나…차세대 슈퍼컴 아키텍처 개발 박차",https://www.tokenpost.kr/news/tech/280668,"IBM과 미국 <b>반도체</b> 기업 AMD가 손잡고 ‘양자 중심 슈퍼컴퓨팅’이라는 차세대 컴퓨팅 아키텍처 개발에 나섰다. 두 회사는 양자 컴퓨팅 기술과 고성능 컴퓨팅(HPC)을 결합해, 기존 컴퓨터가 처리하기 어려운 복잡한 문제를... ","Thu, 28 Aug 2025 01:02:00 +0900"
2025-08-27 19:47:54,"[ASPS 2025]칩부터 패키징까지…서현옥 경기도의원, <b>반도체</b> 혁신 무대 동...",https://n.news.naver.com/mnews/article/030/0003344554?sid=105,"차세대 <b>반도체</b> 패키징 산업전' 개막식에 참석했다. 이 산업전은 경기도와 수원시가 공동 주최하고... 183개 기업이 참여해 350개 부스를 운영하며, 패키징 공정 장비와 소재·부품, 기술 솔루션 등 <b>반도체</b> 후공정 전반의... ","Thu, 28 Aug 2025 01:00:00 +0900"
2025-08-27 19:47:54,"이민근 안산시장, <b>반도체</b> 소재기업 인테그리스 방문…&quot;적극 지원&quot;",http://www.newstown.co.kr/news/articleView.html?idxno=649174,이민근 안산시장(왼쪽)이 지난 26일 글로벌 <b>반도체</b> 소재 전문기업 '인테그리스 코리아 테크놀로지(KTC)'를... 시는 지난 26일 이민근 시장이 글로벌 <b>반도체</b> 소재 전문기업인 '인테그리스 코리아 테크놀로지(KTC)'를 방문해... ,"Thu, 28 Aug 2025 00:59:00 +0900"
2025-08-27 19:47:54,경제 동력 떨어지자… 계층 이동도 멈춰서,https://n.news.naver.com/mnews/article/023/0003925740?sid=101,"핵심 산업이 10년 넘게 <b>반도체</b>, 자동차 등으로 고정된 채 변화가 없었다는 것이다. 실제 지난 2011년에 새롭게 300인 이상을 고용하게 된 기업은 39곳이었지만, 12년 뒤인 2023년에는 19곳에 그쳤다. 그러다 보니 국민... ","Thu, 28 Aug 2025 00:58:00 +0900"
2025-08-27 19:47:54,“주한미군 전략적 유연성 대가로 핵농축·재처리 권한 확보해야”,https://n.news.naver.com/mnews/article/023/0003925734?sid=100,"미국이 바라는 30개월 이상의 소고기 수입 문제를 풀어주면서 <b>반도체</b> 품목 관세 협상에서도 보다 유리한 조건을 확보할 수 있다. 또 디지털 플랫폼 법안도 데이터 주권을 내세우지만, 해외에서는 가능한 서비스가... ","Thu, 28 Aug 2025 00:57:00 +0900"
2025-08-27 19:47:54,"웃으며 끝났지만… 문서 없는 약속, 언제 뒤집힐지 모른다",https://n.news.naver.com/mnews/article/023/0003925733?sid=104,우리 정부는 <b>반도체</b>·의약품 등과 관련해 “품목별 관세 부과 시 최혜국 대우(MFN)를 약속받았다”고 주장하고 있으나 미국 측이 이를 공신력 있는 문서로 명시한 것은 없다. 또 3500억달러 투자 펀드의 성격과 구성 같은... ,"Thu, 28 Aug 2025 00:56:00 +0900"
2025-08-27 19:47:54,"車관세 볼모 삼아, 美 추가 압박 이어질 듯",https://n.news.naver.com/mnews/article/023/0003925729?sid=101,"우리 정부는 현재 25%가 매겨지는 차·부품 관세 인하를 확실히 하고, 추후 <b>반도체</b> 등에 대한 관세 역시 15%로 고정하길 원하지만, 미 측은 인하 시기를 못 박지 않고 추가 조건을 다는 모양새다. 또 자국에 유리한 구조로... ","Thu, 28 Aug 2025 00:56:00 +0900"
2025-08-27 19:47:54,"新 한미동맹 시대, 李 앞에 줄줄이 난제",https://n.news.naver.com/mnews/article/023/0003925725?sid=100,"한미 관세 협상은 타결됐지만 3500억달러 규모 대미 투자 펀드의 운용 방식, 자동차 관세의 인하 시점, <b>반도체</b>·의약품 최혜국 대우 이행 여부 등도 아직 불확실하다. 대중 억제를 위한 주한 미군의 전략적 유연성 확대... ","Thu, 28 Aug 2025 00:56:00 +0900"
2025-08-27 19:47:54,"안성시, 2025 제3회 글로벌 도시대상 'CEO 부문' 수상",http://www.newstown.co.kr/news/articleView.html?idxno=649180,"수상은 <b>반도체</b> 특화단지 조성, 산업단지 기반 확충, 전통시장 혁신, 문화도시 및 동아시아 문화도시 지정... 시는 2023년 산업통상자원부 공모를 통해 동신일반산업단지가 <b>반도체</b> 소재·부품·장비 특화단지로 지정되며... ","Thu, 28 Aug 2025 00:53:00 +0900"
2025-08-27 19:47:54,"현대모비스, 전동화·SDV 분야 혁신 속도…<b>반도체</b>·로보틱스 사업 본격...",http://www.rpm9.com/news/article.html?id=20250828090002,"이와 함께 신성장 먹거리인 차량용 <b>반도체</b>와 로보틱스 사업 분야에서의 독자 역량 확보에도 나선다.... 현대모비스는 행사장 외부에 있는 일부 공간을 활용해 전동화와 전장, 섀시/안전, 차량용 <b>반도체</b> 등 분야 10종의... ","Thu, 28 Aug 2025 00:50:00 +0900"
2025-08-27 19:47:54,"한미정상회담, '실용' 외교인가 '예속' 외교인가",http://www.tongilnews.com/news/articleView.html?idxno=214350,AI·<b>반도체</b>·바이오 등 첨단 산업부터 조선·원자력·LNG·핵심 광물까지 포괄하여 총 11건의 계약 및 양해각서(MOU)를 체결했다. 국내 핵심 산업 공동화로 청년 일자리를 다 빼앗아가는 '한·미 제조업 르네상스'가 진정 '국익... ,"Thu, 28 Aug 2025 00:48:00 +0900"
2025-08-27 19:47:54,"오산시, 동탄2 물류센터 교평위 통과에 &quot;강력 대응&quot; 예고",http://www.newstown.co.kr/news/articleView.html?idxno=649158,오산시는 여기에 용인 <b>반도체</b> 국가산단까지 가동되면 수도권 남부 교통망 전체가 마비될 수 있다고 경고한다. 그러나 사업시행자 측의 교통대책 마련과 비용 부담 원칙이 제대로 적용되지 않았다는 점도 문제로 꼽았다.... ,"Thu, 28 Aug 2025 00:44:00 +0900"
2025-08-27 19:47:54,현대모비스 “글로벌 로봇 부품 시장 진출”,https://n.news.naver.com/mnews/article/023/0003925680?sid=101,"현대모비스는 차세대 차량용 <b>반도체</b> 설계 역량을 더욱 키워 신성장 동력으로 삼겠다는 계획도 내놨다. 현재 에어백용 <b>반도체</b>와 모터 제어, 전장(차량용 전자 장비)용 전원 <b>반도체</b> 등 16종의 <b>반도체</b>를 자체 개발, 외부에... ","Thu, 28 Aug 2025 00:35:00 +0900"
