DateTime,Title,Link,Description,PubDate
2025-03-30 10:21:59,[이슈&amp;경제] AI 혁신이 이끄는 산업 변화·미래 성장 전략,https://n.news.naver.com/mnews/article/666/0000068455?sid=110,또 공공 부문과 중소·중견기업을 위한 보안 강화 특화 클라우드를 구축해 민감 데이터 공유로 인한 문제를 해결하고 추론형 AI 신경망처리장치(NPU)를 도입해 AI <b>반도체</b> 기술 경쟁력도 강화해야 한다. 1964년 시작된... ,"Sun, 30 Mar 2025 19:20:00 +0900"
2025-03-30 10:21:59,미국 '관세전쟁' 속 한중일 맞손…&quot;보호무역 정답 아냐&quot;,https://n.news.naver.com/mnews/article/422/0000726212?sid=161,한중 통상장관 회의 이후 중국은 우리나라와 중국을 &quot;다자주의 수혜자이자 수호자&quot;라고 표현하며 '<b>반도체</b>' 분야 협력을 강조하기도 했습니다. 미국의 대중 <b>반도체</b> 제재 속에서 한국과 중국이 <b>반도체</b> 분야에서 떼려야 뗄... ,"Sun, 30 Mar 2025 19:18:00 +0900"
2025-03-30 10:21:59,가족별 목소리 구분도…진화한 비스포크AI 가전제품,https://n.news.naver.com/mnews/article/658/0000102170?sid=101,이날 소개된 ‘비스포크 AI 하이브리드’ 냉장고는 컴프레서와 <b>반도체</b> 소자가 함께 구동하며 최적의 효율을 내는 방식의 ‘AI 하이브리드 쿨링’ 기능을 갖췄다. 냉장고의 9형 스크린에서는 일정·날씨·추천... ,"Sun, 30 Mar 2025 19:12:00 +0900"
2025-03-30 10:21:59,"[미리보는 이데일리 신문] &quot;HBM 지렛대, 정부가 GPU 확보 나서야&quot;",https://n.news.naver.com/mnews/article/018/0005974262?sid=102,"이어…K<b>반도체</b>도 관세폭탄 위기 더 쉬워진 제어, 더 강력해진 보안…삼성 ‘AI 가전 솔루션’ 공개 특허청 손잡고…LG전자, 장애인 가전 접근성 개선 아이디어 발굴 제네시스. 美서 ‘프리미엄 입지’ 굳힌다 허태수... ","Sun, 30 Mar 2025 19:11:00 +0900"
2025-03-30 10:21:59,공급망 협력 강화로 위기 돌파해야[제14회 IBFC],https://n.news.naver.com/mnews/article/018/0005974259?sid=101,"조 원장은 “<b>반도체</b>, IT, 전기차 배터리 등 한국과 베트남 공동의 미래 성장 동력을 확보할 필요가 있다”며 “베트남을 단순 제조 기지에서 기술 파트너로 격상하고, 미래 전략 산업을 중심으로 공급망 협력을 전환할... ","Sun, 30 Mar 2025 19:05:00 +0900"
2025-03-30 10:21:59,"&quot;한·베, 첨단제조 손잡고 美 관세장벽 함께 넘어야&quot;[제14회 IBFC]",https://n.news.naver.com/mnews/article/018/0005974254?sid=101,"전환, <b>반도체</b> 등 첨단 제조업 분야에서 양국 간 협력을 고도화해 나가야 합니다. 베트남이 원하는 분야이고 동시에 우리나라도 다변화 측면에서 첨단 제조 분야 협력이 필요합니다.”(유명희 전 산업통상자원부... ","Sun, 30 Mar 2025 19:04:00 +0900"
2025-03-30 10:21:59,[AI 초격차 K가전] 원팀이자 경쟁자로…중국 압도한다,https://www.econovill.com/news/articleView.html?idxno=688577,"인공지능(AI), <b>반도체</b>, 전기차 등 자국의 지원을 등에 업고 관련 시장에 공격적으로 진출하고 있기... 살아나면서 <b>반도체</b> 수요도 함께 늘었다는 분석이다. 코트라에 따르면 이구환신 정책으로 지난해 중국 내 자동차... ","Sun, 30 Mar 2025 19:00:00 +0900"
2025-03-30 10:21:59,[AI 이슈] &quot;단일 트랜지스터로 인간 두뇌 모방&quot;… &quot;단일 트랜지스터로 ...,https://www.aitimes.kr/news/articleView.html?idxno=34407,"이를 통해 인공지능(AI) <b>반도체</b> 기술에 혁신을 가져올 것으로 기대된다. NUS 공과대학 재료공학과 마리오... 금속산화물 <b>반도체</b>(Complementary Metal Oxide Semiconductor, CMOS) 기술을 사용합니다.&quot;라며, &quot;이는 확장 가능하고... ","Sun, 30 Mar 2025 18:56:00 +0900"
2025-03-30 10:21:59,외국인 판 조선주 산 개미…1분기 쓴잔,https://n.news.naver.com/mnews/article/658/0000102148?sid=101,"레거시 <b>반도체</b> 업황 개선 기대가 번진 데다, 그간 국내 <b>반도체</b>주에 대해 부정적 전망을 고수했던 모건스탠리가 목표주가를 상향하며 입장을 선회한 영향이다. 한화에어로스페이스와 NAVER를 각각 7330억 원, 4340억... ","Sun, 30 Mar 2025 18:55:00 +0900"
2025-03-30 10:21:59,"립부 탄 인텔 CEO, 31일 '새로운 인텔' 발표",https://n.news.naver.com/mnews/article/215/0001203861?sid=101,"세계 1위 파운드리 업체인 대만 TSMC가 AMD 등 미국 <b>반도체</b> 기업에 인텔에 대한 합작 투자를 제안하고, 브로드컴은 인텔의 칩 설계 및 마케팅 사업 부문을 면밀히 검토하고 있는 것으로 알려졌다. 탄 CEO는 지난 12월... ","Sun, 30 Mar 2025 18:54:00 +0900"
2025-03-30 10:21:59,"두산에너빌리티, 원익IPS와 금속 적층제조 협력...<b>반도체</b> 시장 공략",https://www.joongangenews.com/news/articleView.html?idxno=415136,[사진=두산에너빌리티]  두산에너빌리티는 <b>반도체</b> 장비 전문회사 원익IPS와 금속 적층제조(Additive... 또한 금속 AM 품질 관리 기준에 적합한 품질문서 개정에 협력하는 등 <b>반도체</b> 시장의 요구사항을 계속적으로... ,"Sun, 30 Mar 2025 18:46:00 +0900"
2025-03-30 10:21:59,"삼성전자·LG엔솔·에코프로, 대차잔고 급증… 공매도 타깃 되나?",https://n.news.naver.com/mnews/article/029/0002944583?sid=101,"특히 삼성전자, LG에너지솔루션, 에코프로 등 <b>반도체</b>, 2차전지 관련 종목에 대차거래가 집중된 것으로... 삼성증권은 최근 1개월 동안 대차잔고가 크게 증가한 포스코퓨처엠, 한미<b>반도체</b>를 사례로 들어 2021년 5월... ","Sun, 30 Mar 2025 18:45:00 +0900"
2025-03-30 10:21:59,[fn사설] 관세 전면전 치닫는데 끝없는 정쟁 한심한 정치권,https://n.news.naver.com/mnews/article/014/0005328494?sid=110,"철강, <b>반도체</b>, 배터리, 가전업계도 속이 새카맣게 타고 있다. 정의선 회장은 지난주 직접 미국 백악관에서 대규모 대미투자 선물 보따리를 풀었다. 향후 정부가 관세 면제나 유예를 협상하는 데 요긴한 카드가 될 수 있다.... ","Sun, 30 Mar 2025 18:44:00 +0900"
2025-03-30 10:21:59,[주간증시전망] <b>반도체</b>업종 비중확대 전략이 유효,https://www.jjan.kr/article/20250330580201,"삼성전자에 대한 눈높이가 낮아진 상황이고, <b>반도체</b> 가격은 최근 들어 올라가고 있어 실적이 좋지 않아도... 불확실성 해소 뒤 외국인 수급이 가장 집중될 수 있는 <b>반도체</b>업종 비중확대 전략이 유효할 것으로 보인다.","Sun, 30 Mar 2025 18:42:00 +0900"
2025-03-30 10:21:59,삼성전자 혁신 초강수… 디자인 조직 대수술[혁신으로 위기 돌파],https://n.news.naver.com/mnews/article/014/0005328488?sid=101,"삼성전자는 지난해부터 <b>반도체</b>(DS) 부문을 중심으로 조직 전반에 대한 경영진단을 진행하며, '아픈 손가락'을 살펴보고 있다. 디자인 조직 역시 이 같은 기조에 따라 내부적으로 진단을 진행, 인력 구조와 기능을... ","Sun, 30 Mar 2025 18:41:00 +0900"
2025-03-30 10:21:59,"증평3일반산업단지, 중토위 공익성 심의 통과",http://www.dynews.co.kr/news/articleView.html?idxno=795422,"이재영 군수는 &quot;증평3일반산업단지 조성을 통해 바이오(BT), <b>반도체</b>(IT), 2차전지(GT) 등 지역전략산업을 유치하고 탄탄한 산업생태계를 구축함으로써 증평 100년 미래 먹거리를 창출해 나아갈 것&quot;이라며 &quot;이를 통해 인구... ","Sun, 30 Mar 2025 18:38:00 +0900"
2025-03-30 10:21:59,"의대 정시 합격점, SKY 자연계보다 높다",http://www.dynews.co.kr/news/articleView.html?idxno=795312,"의대보다 합격선이 높은 서연고 최상위 학과들은 2022학년도에는 서울대 컴퓨터공학부, 서울대 전기정보공학부, 2023학년도에는 서울대 수리과학부, 고려대 <b>반도체</b>공학과, 2024학년도에는 서울대 수리과학부... ","Sun, 30 Mar 2025 18:38:00 +0900"
2025-03-30 10:21:59,"[논현로] ‘트럼프 독트린’ 대비, 2트랙 전략을",https://www.etoday.co.kr/news/view/2457294,"현대의 전략품목인 철강, 알루미늄, <b>반도체</b>에 대한 보편관세 부과와 국가별 상호관세 부과계획은 현대의 금 역할을 하는 고용 탈취의 주범이 미국과의 관세 격차에 있다고 인식한 결과라고 볼 수 있다. 결국 전략품목에... ","Sun, 30 Mar 2025 18:38:00 +0900"
2025-03-30 10:21:59,이재용은 시진핑·정의선은 트럼프… 국가 대신 뛰는 총수들,https://n.news.naver.com/mnews/article/005/0001766394?sid=101,사업 부문별로 보면 삼성전자 <b>반도체</b>와 TV 등 가전 사업은 중국에서 비교적 순항 중이지만 스마트폰은... 지난 19일 삼성전자 정기 주주총회에서 노태문 MX사업부장(사장)은 ‘<b>반도체</b>도 중요하지만 스마트폰 경쟁력이... ,"Sun, 30 Mar 2025 18:35:00 +0900"
2025-03-30 10:21:59,中 “중한은 자유무역 수혜자…다자무역 공동 수호하자”...한중일 3국간...,https://n.news.naver.com/mnews/article/021/0002699666?sid=104,왕 부장은 &quot;중한은 서로에게 중요한 경제·통상 협력 파트너로서 <b>반도체</b> 등 분야에서 산업·공급망이 깊이 통합돼 있다&quot;면서 <b>반도체</b> 부문에서의 협력을 강조하기도 했다. 그의 발언은 ‘아메리카 퍼스트(미국 우선주의)’를... ,"Sun, 30 Mar 2025 18:33:00 +0900"
2025-03-30 10:21:59,"두산에너빌리티, 원익IPS와 적층제조 기술 공동 연구",http://www.g-enews.com/ko-kr/news/article/news_all/2025033011263966807bdb7041ec_1/article.html,두산에너빌리티가 <b>반도체</b> 장비 성능 개선을 위해 <b>반도체</b> 장비 전문 업체 원익IPS와 손잡는다. 두산에너빌리티는 원익IPS와 금속 적층제조(AM) 기술 교류와 공동 연구를 위한 양해각서(MOU)를 체결했다고 30일 밝혔다.... ,"Sun, 30 Mar 2025 18:30:00 +0900"
2025-03-30 10:21:59,"‘스크린·빅스비·보안 강화’…삼성전자, 2025년형 비스포크 AI 라인업...",http://www.g-enews.com/ko-kr/news/article/news_all/2025033010333243886ed0c62d49_1/article.html,삼성전자가 선보인 2025년형 '비스포크 AI 하이브리드' 냉장고는 컴프레서와 <b>반도체</b> 소자가 함께 구동해 최적의 효율을 내는 방식의 'AI 하이브리드 쿨링' 기능을 갖췄다. 9형 스크린을 탑재하고 프리스탠드부터... ,"Sun, 30 Mar 2025 18:30:00 +0900"
2025-03-30 10:21:59,[1분컷] 트럼프발 '25%+α' 관세 코앞… 韓 대미 수출 줄줄이 '적색경보...,https://www.newscj.com/news/articleView.html?idxno=3251774,"<b>반도체</b>와 배터리, 가전 업계도 관세 영향권에 들어서면서 피해 최소화 방안을 고심 중입니다. 미국이... <b>반도체</b> 업계 역시 트럼프 대통령의 관세 예고로 긴장을 늦추지 않고 있습니다. 지난해 기준 한국의 대미 <b>반도체</b>... ","Sun, 30 Mar 2025 18:30:00 +0900"
2025-03-30 10:21:59,신축 오피스텔 호가 3억 뛴 '평택 고덕 유보라',https://n.news.naver.com/mnews/article/014/0005328466?sid=101,"업계 관계자는 &quot;<b>반도체</b> 산업이 국가 경제에서 차지하는 비중이 큰 만큼, 경기도 차원에서도 삼성전자를... 삼성전자 평택캠퍼스는 세계 최대 규모의 <b>반도체</b> 생산 단지로 100조원 규모 투자가 예정됐다. 특히 삼성 <b>반도체</b>... ","Sun, 30 Mar 2025 18:29:00 +0900"
2025-03-30 10:21:59,NIPA 신임 원장에 박윤규 前 과기부 제2차관,https://n.news.naver.com/mnews/article/014/0005328457?sid=105,박 전 차관은 과기정통부 재직 당시 전 국민의 AI 일상화를 이끄는 데 주력했다. AI <b>반도체</b>와 융합 등 AI 학습과 추론을 위한 인프라부터 수요 기업까지 AI 생태계 전반에서 높은 이해도를 가진 것으로 평가받는다.,"Sun, 30 Mar 2025 18:26:00 +0900"
2025-03-30 10:21:59,과기부 &quot;85억 투입 온디바이스AI 발굴&quot;,https://n.news.naver.com/mnews/article/014/0005328458?sid=105,"이 사업은 국산 AI <b>반도체</b>를 활용한 온디바이스 AI 기반의 혁신 서비스를 발굴하고, 도시 단위의 대규모... 선정된 3개의 컨소시엄은 1단계 기간 동안 합성곱신경망(CNN) 기반의 국산 AI <b>반도체</b>를 활용한 AI 비전을... ","Sun, 30 Mar 2025 18:26:00 +0900"
2025-03-30 10:21:59,정의선 회장 트럼프 만난 사이…이재용 회장 시진핑 만나,http://www.g-enews.com/ko-kr/news/article/news_all/202503301004524684112616b072_1/article.html,"(SGBAC)에서 '중국 출장 잘 다녀오셨냐'는 취재진 질문에 &quot;네&quot;라고 짧게 답했다. 이후 '시진핑 중국 국가주석과의 회동 소감', '<b>반도체</b> 위기론' 등에 대한 물음에는 말을 아꼈다. 김태우 글로벌이코노믹 기자","Sun, 30 Mar 2025 18:26:00 +0900"
2025-03-30 10:21:59,&quot;주물생산 중단땐 韓 모든 산업 문 닫을 판&quot;,https://n.news.naver.com/mnews/article/015/0005112640?sid=101,주물 제조용인 쇳물을 녹이려면 보통 5~6시간 전기로를 가열해야 하는데 함부로 전기로를 껐다가는 더 많은 전기가 들어 하는 수 없이 <b>반도체</b> 공장처럼 24시간 전기를 공급해야 한다는 설명이다. 서 이사장은 이런... ,"Sun, 30 Mar 2025 18:25:00 +0900"
2025-03-30 10:21:59,빅테크株 저점 노려라… 상호관세 발표 전 테슬라ETF 반등[ETF 스퀘어],https://n.news.naver.com/mnews/article/014/0005328443?sid=101,"반면 <b>반도체</b>와 방산 ETF는 조정세를 보였다. 특히 방산 ETF는 한화에어로스페이스의 유상증자 이슈 등... 반면, <b>반도체</b> 및 방위산업 테마 ETF는 조정세를 보였다. 'ACE 포스코그룹포커스'는 9.37% 하락하며 가장 큰... ","Sun, 30 Mar 2025 18:22:00 +0900"
2025-03-30 10:21:59,"광주광역시, 5개년 인구정책 종합계획 확정",https://www.newscj.com/news/articleView.html?idxno=3251772,모빌리티·에너지·<b>반도체</b>·인공지능(AI) 등 지역 전략산업과 연계한 대학지원체계(RISE)를 강화한다. 인공지능·문화산업·<b>반도체</b> 분야 인재 양성 사다리를 통한 고급 인재 양성과 청년 일경험 기회 제공을 위한... ,"Sun, 30 Mar 2025 18:22:00 +0900"
2025-03-30 10:21:59,"&quot;AI 홈으로 일상을 혁신&quot;…삼성전자, 2025년형 '비스포크 AI' 라인업 공개",http://www.efnews.co.kr/news/articleView.html?idxno=118925,"'비스포크 AI 하이브리드' 냉장고는 컴프레서와 <b>반도체</b> 소자가 함께 구동하며 최적의 효율을 내는 방식의 'AI 하이브리드 쿨링' 기능을 갖춘 제품으로, 올해는 9형 스크린을 탑재하고 프리스탠드부터 키친핏까지... ","Sun, 30 Mar 2025 18:22:00 +0900"
2025-03-30 10:21:59,‘공매도·관세 이중압박’에 국내증시 휘청[주간 증시 전망],https://n.news.naver.com/mnews/article/014/0005328445?sid=101,짓눌렀다&quot;며 &quot;특히 <b>반도체</b>와 자동차 등 품목별 관세 업종들 중심으로 대형주가 부진했다&quot;고 진단했다.... 있다&quot;면서 &quot;<b>반도체</b> 등 부문별 관세까지 병행될 경우 주가 변동성이 커질 수 있다&quot;고 내다봤다. 경기 침체 우려도... ,"Sun, 30 Mar 2025 18:22:00 +0900"
2025-03-30 10:21:59,美 '25%+α' 관세 코앞… 韓 대미 수출 줄줄이 '적색경보',https://www.newscj.com/news/articleView.html?idxno=3251773,"<b>반도체</b>와 배터리, 가전 업계도 관세 영향권에 들어서면서 피해 최소화 방안을 고심 중이다. ◆현대차그룹... ◆ <b>반도체</b> 관세 예고… &quot;직접 타격 적지만 상황 주시&quot; <b>반도체</b> 업계 역시 트럼프 대통령의 관세 예고로 긴장을... ","Sun, 30 Mar 2025 18:20:00 +0900"
2025-03-30 10:21:59,"중국, 콩코드보다 50% 더 가는 여객기 개발중…미중 기술경쟁 확전",https://n.news.naver.com/mnews/article/021/0002699664?sid=104,중국의 이번 C949 세부 사항 공개는 미중 경쟁이 <b>반도체</b>·AI를 넘어 과학·기술 전 분야로 확대되는 상황에서 이뤄진 것이기도 하다. 미국 항공우주국(NASA)의 X-59 퀘스트(QueSST) 프로젝트는 2027년 75 PLdB의 초음속 여객기... ,"Sun, 30 Mar 2025 18:18:00 +0900"
2025-03-30 10:21:59,&quot;1등 자존심 되찾자&quot; 이 악문 삼성... 시스템LSI 등 내부조직 뜯어본다[...,https://n.news.naver.com/mnews/article/014/0005328426?sid=101,"30일 업계에 따르면 삼성전자는 현재 <b>반도체</b>(DS) 부문 내 시스템LSI 사업부를 대상으로 정밀진단을 하고 있다.... 시스템LSI 사업부는 이미지센서, 모바일 애플리케이션프로세서(AP) 등 <b>반도체</b> 설계를 담당하고 있는데, 최근... ","Sun, 30 Mar 2025 18:15:00 +0900"
2025-03-30 10:21:59,내란 중에 수도권 일극집중 강화? 전면 재검토돼야,http://www.ikpnews.net/news/articleView.html?idxno=66759,특히 용인에 추진한다는 <b>반도체</b> 산업단지가 초고압 송전선 문제를 낳는 원인으로 지목되고 있다. <b>반도체</b>는 기본적으로 전기와 물을 많이 필요로 하는 사업이다. 따라서 <b>반도체</b> 공장이 필요하다면 전기와 물이 있는 곳에... ,"Sun, 30 Mar 2025 18:14:00 +0900"
2025-03-30 10:21:59,"트럼프 상호관세, 이번주 발표... 車·철강 '25％＋α' 예의주시[한일중...",https://n.news.naver.com/mnews/article/014/0005328423?sid=101,<b>반도체</b>와 배터리 업계도 직간접 타격을 우려하며 현지생산 확대를 포함한 피해 최소화 방안을 신중하게... <b>반도체</b> 업계는 이미 트럼프가 최소 25%의 관세를 물리겠다고 예고한 만큼 정책 동향을 예의주시하고 있다.... ,"Sun, 30 Mar 2025 18:13:00 +0900"
2025-03-30 10:21:59,TSMC 日공장 장비 반입 '속도조절',https://n.news.naver.com/mnews/article/014/0005328418?sid=101,세대 <b>반도체</b>의 수요 부진과 도널드 트럼프 미국 행정부의 관세 정책에 대한 우려가 배경&quot;이라고 복수의 관계자의 말을 인용해 전했다. TSMC는 구마모토 제1공장의 회로선폭 12~16나노(나노는 10억분의 1m) <b>반도체</b>... ,"Sun, 30 Mar 2025 18:11:00 +0900"
2025-03-30 10:21:59,[박정일 칼럼] 트럼프와 강성노조가 만든 `新자본론`,https://n.news.naver.com/mnews/article/029/0002944569?sid=110,"대표적으로 단일 수출 1위 <b>반도체</b>가 그렇고 석유화학도 마찬가지다. 수출 상위 10개 품목의 대부분이... 먼저 <b>반도체</b>와 석유화학, 철강 등 자본집약적인 산업이 주류를 이루는 구조에서 자본은 더 이상 노동으로 잉여가치를... ","Sun, 30 Mar 2025 18:10:00 +0900"
2025-03-30 10:21:59,[강현철의 뉴스 솎아내기] 대한민국 먹여살릴 10대 미래 산업,https://n.news.naver.com/mnews/article/029/0002944567?sid=110,먼저 용도에 맞춰 전력을 효율적으로 사용할 수 있도록 전력의 변환·분배·제어 등의 기능을 수행하는 고효율·저손실 '전력<b>반도체</b> 산업'이다. 현재 전력<b>반도체</b>는 실리콘 소재가 대부분이나 칩 집적도가 높아지고... ,"Sun, 30 Mar 2025 18:10:00 +0900"
2025-03-30 10:21:59,트럼프 발 위기 지역기업 지원 절실,http://www.jndn.com/article.php?aid=1743325364406777008,36.2%는 자동차·<b>반도체</b>·의약품 대상 25% 관세 부과가 가장 큰 영향을 받을 것으로 전망했으며 철강·알루미늄 제품 대상 25% 관세 추가 부과와 캐나다·멕시코산 제품 대상 25% 관세 부과도 지역 경제에 부정적으로 작용할... ,"Sun, 30 Mar 2025 18:06:00 +0900"
2025-03-30 10:21:59,광주 인구정책 실현 가능성이 중요,http://www.jndn.com/article.php?aid=1743325356406778008,또 광주역 창업 밸리를 청년 창업 기업 발굴 거점으로 육성하고 모빌리티·에너지·<b>반도체</b>·인공지능 등 지역 전략 산업과 연계한 대학 지원도 강화한다. 광주시가 장기적인 인구 정책을 세우고 추진하는 것은 바람직... ,"Sun, 30 Mar 2025 18:06:00 +0900"
2025-03-30 10:21:59,"美 변동성 커지고, 유럽은 이미 급등…韓, 공매도 재개로 저평가 매력 ...",https://n.news.naver.com/mnews/article/015/0005112603?sid=101,"대신증권은 <b>반도체</b> 자동차 유통 유틸리티 등을 공매도 ‘안전지대’로, 조선 방산 화학 건강관리 등을 ‘위험지대’로 분류했다. 한편 31일부터 대체거래소(넥스트레이드) 거래 종목이 기존 348개에서 794개로 두 배... ","Sun, 30 Mar 2025 18:01:00 +0900"
2025-03-30 10:21:59,드디어 공매도 전면 재개…'코스피야 떨고 있니',https://n.news.naver.com/mnews/article/015/0005112602?sid=101,"대신증권은 <b>반도체</b> 자동차 유통 유틸리티 등을 공매도 ‘안전지대’로, 조선 방산 화학 건강관리 등을 ‘위험지대’로 분류했다. 한편 31일부터 대체거래소(넥스트레이드) 거래 종목이 기존 348개에서 794개로 두 배... ","Sun, 30 Mar 2025 18:00:00 +0900"
2025-03-30 10:21:59,"분할 20년, 성장 길 닦은 GS… 이제 '과감한 도전' 택한 허태수",https://www.asiatoday.co.kr/view.php?key=20250331010016583,"지난달 열린 AI 디지털 협의회에서 그는 &quot;우리는 AI <b>반도체</b>와 같은 제품을 개발하는 사업을 하지 않지만, 우리가 가진 데이터를 자산으로 삼아 제대로 관리하고, AI를 활용해 비즈니스 전환을 이뤄내 새로운 가치를... ","Sun, 30 Mar 2025 17:56:00 +0900"
2025-03-30 10:21:59,[패트롤] 남양주시-동두천시-양주시-양평군-파주시,https://www.ekn.kr/web/view.php?key=20250330026541911,"빅데이터, <b>반도체</b> 등) 교육훈련 지원을 통해 기업 맞춤형 전문인력을 양성하고 지역 일자리 창출을 추진하기... 파주시는 미래기술학교 운영 지원 공모사업 첫해인 작년에 '시스템 온 칩(SoC) <b>반도체</b> 회로설계 아카데미... ","Sun, 30 Mar 2025 17:56:00 +0900"
2025-03-30 10:21:59,"충북도·청주시, 네패스와 1600억 규모 투자협약",http://www.cctimes.kr/news/articleView.html?idxno=838445,충북도와 청주시는 지난 28일 시스템 <b>반도체</b> 첨단 패키징 전문기업인 네패스와 1600억원 규모의 투자협약을 했다. 네패스는 고성능 인공지능(AI) <b>반도체</b> 수요 증가에 대응하기 위해 청주시 오창읍 오창2공장 내 생산설비를... ,"Sun, 30 Mar 2025 17:52:00 +0900"
2025-03-30 10:21:59,역대최대 산불에 미루던 추경 '속도'…재해·통상·민생 10조 추진,https://n.news.naver.com/mnews/article/009/0005467596?sid=101,"자동차·자동차 부품, <b>반도체</b> 등에 대해서도 25% 관세를 부과할 계획이다. 미국의 모든 교역국이 상호관세와 품목관세 피해 사정권에 놓였다. 특히 한국의 대미 수출품 1위가 자동차라는 점에서 현재 0%인 관세율이 25%로... ","Sun, 30 Mar 2025 17:46:00 +0900"
2025-03-30 10:21:59,"Z세대, 연봉과 안정성 중시…블루칼라 직종에 대한 인식 변화",https://www.kyongbuk.co.kr/news/articleView.html?idxno=4036159,특히 인기 있는 업계는 'IT·배터리·<b>반도체</b>'와 '자동차·조선·항공'이었다. 30일 상위권 채용 플랫폼 캐치에... 블루칼라 중 관심 있는 기술직종은 'IT·배터리·<b>반도체</b>(29%)'와 '자동차·조선·항공(29%)'이 공동 1위를... ,"Sun, 30 Mar 2025 17:44:00 +0900"
2025-03-30 10:21:59,"부산시, 청년 월드클래스 육성 사업 청년 인재 내달 1일부터 모집",https://m.skyedaily.com/news_view.html?ID=267904,"미래신산업 분야는 블록체인·이차전지·인공지능(AI)·<b>반도체</b>·디지털 건강관리(헬스케어), 바이오 등이다. 시는 공정하고 체계적인 선발을 위해 1차 서류심사·2차 발표심사·3차 공개심사를 거쳐 최종 3명을 선정할... ","Sun, 30 Mar 2025 17:42:00 +0900"
