DateTime,Title,Link,Description,PubDate
2025-02-24 23:20:34,뉴욕증시 혼조세 마감…나스닥 1.21% 하락,https://news.mtn.co.kr/news-detail/2025022508060838786,"<b>반도체</b> 업종도 약세를 보였다. 브로드컴이 4.91%, 대만<b>반도체</b>제조회사(TSMC) 3.32%, AMD 2.46%, 인텔 2.41%, 퀄컴 2.62% 각각 하락했다. 필라델피아 <b>반도체</b> 지수는 2.59% 내렸다오는 26일(현지시간) 실적 발표를 앞둔... ","Tue, 25 Feb 2025 08:18:00 +0900"
2025-02-24 23:20:34,<b>반도체</b>도시 용인 '용인 둔전역 에피트' 완판 앞둬,https://www.getnews.co.kr/news/articleView.html?idxno=808381,부동산 경기 침체에도 불구하고 경기 용인특례시 신규 공급한 아파트가 '<b>반도체</b> 프리미엄'에 힘입어 100% 계약에 성공하는 등 좋은 분양 성적을 거두고 있다. 새로 조성될 <b>반도체</b> 산업단지와 가까울 뿐 아니라 교통... ,"Tue, 25 Feb 2025 08:18:00 +0900"
2025-02-24 23:20:34,"구미시, 문화선도산단 공모 '청년·문화 융합 모델 제시'",https://n.news.naver.com/mnews/article/003/0013085780?sid=102,"구미시는 대규모 산업단지 내 유휴부지(12만9000㎡)를 활용해 첨단 <b>반도체</b> 연구단지, 청년문화센터, 청년근로자 기숙사 등을 집적시킬 계획이다. 이를 통해 일자리 창출 뿐만 아니라 청년들이 ‘먹고, 놀고, 자고’ 할 수... ","Tue, 25 Feb 2025 08:17:00 +0900"
2025-02-24 23:20:34,"[손병관의 뉴스프레소] 계엄군 철수, 윤석열 아닌 지휘관들의 독자 판단...",https://n.news.naver.com/mnews/article/047/0002463715?sid=102,트럼프에 민노총… 4조 공장 문 닫았다 ▲ 중앙일보 = 일본 <b>반도체</b> 드림팀 법까지 바꿔 돕는다 ▲ 한겨레 = 군 철수는 '윤 지시'라는데 들은 사령관이 없다 ▲ 한국일보 = '소득대체율 44%' 與野 연금개혁 이견 좁혔다,"Tue, 25 Feb 2025 08:16:00 +0900"
2025-02-24 23:20:34,&quot;美 AI주 투매 지속에 증시 투자 심리 위축…금통위 주목&quot;,https://news.einfomax.co.kr/news/articleView.html?idxno=4344426,iM증권도 &quot;미 증시는 마이크로소프트 데이터센터에서 수백메가와트 용량 전력 공급 계약 취소 소식 발표와 AI 투자 및 성장성 둔화 이슈로 하락 마감했다&quot;며 &quot;그간 AI가 주요 상승 기점이었던 <b>반도체</b> 업종 필두로... ,"Tue, 25 Feb 2025 08:16:00 +0900"
2025-02-24 23:20:34,IBK투자 &quot;이녹스첨단소재 올해 수익성 개선 기대…목표가↑&quot;,https://n.news.naver.com/mnews/article/001/0015231299?sid=101,IBK투자증권은 25일 디스플레이·<b>반도체</b> 소재 업체인 이녹스첨단소재에 대해 &quot;올해 수익성이 개선될 것&quot;이라며 목표주가를 3만7천원에서 4만원으로 상향 조정했다. 투자 의견은 '매수'를 유지했다. 이녹스첨단소재는... ,"Tue, 25 Feb 2025 08:16:00 +0900"
2025-02-24 23:20:34,[더벨][IPO 모니터]엠디바이스 공모가 밴드상단 '유력'…투심 바뀌나,https://www.thebell.co.kr/free/content/ArticleView.asp?key=202502201002229680106263,"<b>반도체</b>주에 대한 컨센서스가 조정되는 가운데 엠디바이스가 등판하면서 수요예측 마지막 날까지 기관의... 엠비다이스는 솔리드스테이트드라이브(SSD) <b>반도체</b>를 주력으로 하고 있다. 설계부터 제조, 조립 및 검사... ","Tue, 25 Feb 2025 08:12:00 +0900"
2025-02-24 23:20:34,'도시정비사업 독주' 삼성물산···올 수주 벌써 2조 넘겨,https://www.womaneconomy.co.kr/news/articleView.html?idxno=231600,경기 불확실성에 <b>반도체</b> 설비 투자 등이 위축될 것으로 예상되자 주택 사업을 공격 확대하고 나선 것으로... 삼성물산이 이처럼 공격적인 정비사업 수주 목표를 설정한 것은 삼성전자의 <b>반도체</b> 설비 등 하이테크... ,"Tue, 25 Feb 2025 08:12:00 +0900"
2025-02-24 23:20:34,빅테크 업고 '투자 확대' 나선 전력기기 업체들…&quot;연평균 22% 성장&quot;,https://n.news.naver.com/mnews/article/008/0005157655?sid=101,최근엔 국내 최대 규모 스마트 전력·에너지 전시회 '일렉스 코리아 2025'와 '코리아스마트그리드엑스포 2025'에서 △초전도 전류제한기 △스마트배전반 △<b>반도체</b> 변압기(SST) △<b>반도체</b> 차단기(SSCB) △공조시스템 등... ,"Tue, 25 Feb 2025 08:11:00 +0900"
2025-02-24 23:20:34,[초점] 힘 빠진 달러화 랠리....트럼프 집권 1기 하락세 반복되나,http://www.g-enews.com/ko-kr/news/article/news_all/2025022505234943493bc914ac71_1/article.html,"트럼프 대통령은 지난주 미국으로 들어오는 자동차, <b>반도체</b>, 의약품에 최소 25%의 관세를 부과하겠다고 공언하면서 이르면 오는 4월2일 구체적 내용을 발표할 것이라고 밝혔다. 트럼프 대통령은 이에 앞서 캐나다와... ","Tue, 25 Feb 2025 08:10:00 +0900"
2025-02-24 23:20:34,[마켓뷰] 깊어지는 美증시 조정…시험대 오른 코스피 지지력,https://n.news.naver.com/mnews/article/001/0015231288?sid=101,한국시간으로 27일 오전 4분기(11~1월) 실적 발표를 앞둔 엔비디아도 3.09% 하락한 결과 필라델피아<b>반도체</b>지수는 2.59% 급락했다. 대형 기술주 그룹 매그니피센트7(M7)도 애플(0.66%)을 제외한 전 종목이 약세일 정도로... ,"Tue, 25 Feb 2025 08:09:00 +0900"
2025-02-24 23:20:34,"SK하이닉스, 용인 <b>반도체</b> 클러스터 1기 팹 본격 착공",https://n.news.naver.com/mnews/article/422/0000716240?sid=101,SK하이닉스가 경기도 용인 <b>반도체</b> 클러스터 내 1기 팹(fab·<b>반도체</b> 생산공장)의 첫 삽을 떴습니다. SK하이닉스에 따르면 어제(24일)부터 용인 <b>반도체</b> 클러스터 1기 팹이 착공에 들어갔습니다. 당초 다음 달 착공... ,"Tue, 25 Feb 2025 08:09:00 +0900"
2025-02-24 23:20:34,"[더벨][IPO 모니터]'퓨리오사AI 수혜' 소테리아, 상장 몸만들기 '가속도...",https://www.thebell.co.kr/free/content/ArticleView.asp?key=202502201630460280108948,0.3V라는 초저전력 환경에서 구동될 수 있는 고사양컴퓨팅(HPC) 가속기 제품으로 국내 AI <b>반도체</b> 팹리스 가운데 양산에 들어가는 첫 사례로 기록될 예정이다. 아르테미스에서 발생하는 매출은 조단위 밸류가 거론되는 AI... ,"Tue, 25 Feb 2025 08:08:00 +0900"
2025-02-24 23:20:34,"‘엑시노스 2500 양산’⋯ 삼성전자, 이미지 개선책 있나",https://www.viva100.com/article/20250224501242,"<b>반도체</b> 위기론에 휩싸인 삼성전자가 모바일 AP(어플리케이션 프로세서) 엑시노스 2500 양산 초읽기에 들어갔다. 엑시노스 2500은 삼성전자 파운드리(<b>반도체</b> 위탁생산) 3nm(나노미터, 10억분의 1m) 공정으로 양산되며... ","Tue, 25 Feb 2025 08:08:00 +0900"
2025-02-24 23:20:34,"[종합] 나스닥, 기술주 약세에 1.2%↓…실적 앞둔 엔비디아 3%↓",https://www.etoday.co.kr/news/view/2447727,"필라델피아 <b>반도체</b>지수, 2.59%↓ 뉴욕증시는 24일(현지시간) 혼조세로 장을 마쳤다. 이날 뉴욕증권거래소... 브로드컴(-4.91%), AMD(-2.46%), 인텔(-2.41%), 퀄컴(-2.62%) 등 <b>반도체</b>주가 일제히 마이너스를 나타냈다. 이에... ","Tue, 25 Feb 2025 08:08:00 +0900"
2025-02-24 23:20:34,"[3분증시] 미 증시 혼조·기술주 투매…코스피, 미 경기침체 우려에 약...",https://n.news.naver.com/mnews/article/422/0000716239?sid=101,"엔비디아 외에 <b>반도체</b>주들도 대부분 하락하면서 필라델피아<b>반도체</b>지수는 2.6% 급락했고요. 테슬라는 2%, 니콜라는 32% 폭락하면서 전기차도 일제히 약세였습니다. 마이크로소프트는 AI 데이터센터 투자를 취소한다는... ","Tue, 25 Feb 2025 08:07:00 +0900"
2025-02-24 23:20:34,"SK하이닉스, 용인 클러스터 1기 팹 첫 삽··· &quot;2027년 5월 준공 목표&quot;",https://www.ajunews.com/view/20250225080113250,아주경제=이효정 기자 hyo@ajunews.com SK하이닉스 용인 <b>반도체</b> 클러스터 1기 팹 건설 현장. [사진=SK하이닉스] SK하이닉스가 경기도 용인 <b>반도체</b> 클러스터 내 1기 팹(fab·<b>반도체</b> 생산공장)의 착공에 들어갔다. 용인... ,"Tue, 25 Feb 2025 08:06:00 +0900"
2025-02-24 23:20:34,"얼어붙은 기술주 투심, 팔란티어 10% 뚝[뉴욕마감]",https://n.news.naver.com/mnews/article/008/0005157652?sid=101,"<b>반도체</b> 설계기업 브로드컴 주가는 4.91%, 세계 최대 파운드리 대만<b>반도체</b>제조회사(TSMC)는 3.32%, AMD 2.46%, 인텔 2.41%, 퀄컴 2.62% 각각 밀렸다. 필라델피아 <b>반도체</b>지수는 2.59% 하락했다. 애플은 향후 4년 동안 미국에 총... ","Tue, 25 Feb 2025 08:05:00 +0900"
2025-02-24 23:20:34,[오늘의 이슈체크] 2월25일 조간 사설 팩트·논조 분석,https://www.newsverse.kr/news/articleView.html?idxno=7136,"中은 <b>반도체</b> 추월… 韓 정치는 '태평' ▣세계일보 美 &quot;10억달러 투자 시 신속지원&quot;, 우리 기업 겁박 지나치다... 정부의 '관세폭탄'과 <b>반도체</b>지원법·인플레이션감축법(IRA) 축소 예고 등 악재 속에서 '대미 투자 기준'까지... ","Tue, 25 Feb 2025 08:04:00 +0900"
2025-02-24 23:20:34,MZ인턴의 야근 이야기 [세상읽기],https://n.news.naver.com/mnews/article/028/0002732737?sid=110,<b>반도체</b>산업 신기술 연구개발 종사자에겐 주 52시간 상한을 적용하지 않겠다는 <b>반도체</b> 특별법안이 대표적인 예다. 노동의 질이 아닌 양을 늘려서 경쟁력을 확보하겠다는 건 철 지난 주장인 줄 알았는데 여당과 대통령... ,"Tue, 25 Feb 2025 08:02:00 +0900"
2025-02-24 23:20:34,"SK하이닉스, 용인 클러스터 1기 팹 첫 삽…2027년 5월 준공 목표",https://n.news.naver.com/mnews/article/448/0000510241?sid=101,SK하이닉스가 경기도 용인 <b>반도체</b> 클러스터 내 1기 팹(fab·<b>반도체</b> 생산공장)의 첫 삽을 떴다. SK하이닉스는 당초 다음 달부터 1기 팹 착공에 들어갈 계획이었으나 용인시가 예정보다 신속하게 인허가 절차를 진행해... ,"Tue, 25 Feb 2025 08:02:00 +0900"
2025-02-24 23:20:34,구미시 내년 국비 확보 목표 1조원 육박,https://www.yeongnam.com/web/view.php?key=20250224010002970,주요 사업은 △강소형 스마트도시 조성사업 △국립 청소년 디지털 통합지원센터 건립 △임산부 디지털 헬스케어 플랫폼 구축 △<b>반도체</b> 웨이퍼 공정장비용 소재부품 테스트베드 구축 △펫테크 산업화 지원센터... ,"Tue, 25 Feb 2025 08:02:00 +0900"
2025-02-24 23:20:34,[주요 신문 사설](25일 조간),https://n.news.naver.com/mnews/article/001/0015231277?sid=110,"中은 <b>반도체</b> 추월… 韓 정치는 '태평' 연금개혁 野 강행 안 될 말… 與 어깃장만 말고 협의하라 국민 92% &quot;연명의료 중단&quot;… '품위 있는 죽음' 본격 논의를 ▲ 세계일보 = 美 &quot;10억달러 투자 시 신속지원&quot;, 우리 기업 겁박... ","Tue, 25 Feb 2025 08:00:00 +0900"
2025-02-24 23:20:34,트럼프 '25% 車관세 부과' 예고…'한국GM 철수설' 또 다시 솔솔,https://www.cstimes.com/news/articleView.html?idxno=634313,"트럼프 대통령은 지난 19일(현지시간) 미국 플로리다주 마이애미에서 열린 '미래투자이니셔티브(FII) 서밋'에서 &quot;다음 한 달 안에 자동차, <b>반도체</b>, 의약품, 목재 등에 대해 관세를 발표할 것&quot;이라고 밝혔다. 앞서 그는... ","Tue, 25 Feb 2025 08:00:00 +0900"
2025-02-24 23:20:34,&quot;전문가 영입·주주환원&quot; 압축...주요 상장사 정기 주총 '임박',https://www.youthdaily.co.kr/news/article.html?no=178764,"삼성전자, 내달 19일 정기 주총 개최…<b>반도체</b> 전문가 3명 영입 국내 주요 상장기업들이 다음 달부터 정기... 가장 눈에 띄는 점은 현재 삼성전자 이사회에 1명뿐인 <b>반도체</b> 전문가를 3명으로 늘렸다는 것이다. 최근... ","Tue, 25 Feb 2025 08:00:00 +0900"
2025-02-24 23:20:34,"골드만삭스 “헤지펀드, 하이테크 주식 매도 가속화”",http://www.g-enews.com/ko-kr/news/article/news_all/202502250753553462e7e8286d56_1/article.html,"한편, 미국 <b>반도체</b> 대기업 엔비디아는 이번 주 실적 발표를 앞두고 있어 AI 관련 산업 동향을 보여주는 지표로 관심이 집중되고 있다. LSEG에 따르면 엔비디아는 S&amp;P500 종합지수 구성 종목 중 6.3%의 비중을 차지하며... ","Tue, 25 Feb 2025 08:00:00 +0900"
2025-02-24 23:20:34,[전국 주요 신문 톱뉴스](25일 조간),https://n.news.naver.com/mnews/article/001/0015231278?sid=102,0% ▲ 조선일보 = 트럼프에 민노총… 4조 공장 문 닫았다 ▲ 중앙일보 = 일본 <b>반도체</b> 드림팀 법까지 바꿔 돕는다 ▲ 한겨레 = 군 철수는 '윤 지시'라는데 들은 사령관이 없다 ▲ 한국일보 = '소득대체율 44%' 與野 연금개혁... ,"Tue, 25 Feb 2025 08:00:00 +0900"
2025-02-24 23:20:34,[뉴욕증시]기술주 투매 속…나스닥 1.21%↓,https://n.news.naver.com/mnews/article/277/0005551278?sid=101,"주요 <b>반도체</b> 주가도 부진했다. <b>반도체</b> 설계기업 브로드컴 주가는 4.91%, 세계 최대 파운드리 대만<b>반도체</b>제조회사(TSMC)는 3.32%, AMD 2.46%, 인텔 2.41%, 퀄컴 2.62% 각각 하락했다. 이에 필라델피아 <b>반도체</b>지수는 2.59... ","Tue, 25 Feb 2025 07:59:00 +0900"
2025-02-24 23:20:34,"美 증시, 기술주 약세에 '휘청'…트럼프 “관세부과 예정대로”[뉴스새...",https://n.news.naver.com/mnews/article/018/0005950316?sid=101,"-엔비디아가 약세를 보이면서 브로드컴(-4.91%), AMD(-2.46%), 마이크론(-3.47%), TSMC(-3.32%) 등의 <b>반도체</b>주도 약세. -GE버노바(-3.65%), 컨스털레이션 에너지(-5.88%) 등의 전력망 관련 기업들도 주가 하락. -테슬라는 주식시장이... ","Tue, 25 Feb 2025 07:56:00 +0900"
2025-02-24 23:20:34,[이슈분석] 트럼프 '관세 폭탄·영토 야욕'…각국 눈치만 본다?,https://n.news.naver.com/mnews/article/374/0000426973?sid=104,"- 美, 멕시코·캐나다·중국에 대한 보편관세 계획 - 트럼프, 철강·알루미늄·자동차·<b>반도체</b> 관세 계획 - 美, 연방 보조금 및 대출금 집행, 일시 중단 단행 - 하마스-이스라엘 휴전·우크라이나 전쟁 종전 협상 - 백악관... ","Tue, 25 Feb 2025 07:56:00 +0900"
2025-02-24 23:20:34,[오늘의 증시리포트] &quot;한화에어로스페이스 지상방산 실적 상향 조정&quot;,https://www.etoday.co.kr/news/view/2447724,"연구원 ◇아이티엠<b>반도체</b> 3년 만의 연간 흑자 달성 목표주가 18,000원으로 하향하나 투자의견 Buy 유지 2021년 이후 3년 만의 연간 흑자 달성, 일회성 비용 제외하면 4Q24 실적도 흑자 보호회로 채택 모델 수 증가 및... ","Tue, 25 Feb 2025 07:54:00 +0900"
2025-02-24 23:20:34,"티에스이, 올해도 호실적 기대…목표가↑-신한",https://n.news.naver.com/mnews/article/018/0005950315?sid=101,오강호 연구원은 “프로브카드(<b>반도체</b> 칩과 테스트 장비 연결 부품) 매출액은 330억원으로 전년 동기 대비 186% 늘어(기존 추정치 203억원) 서프라이즈를 기록했다”며 “디램용 프로브카드 매출 확대가 실적... ,"Tue, 25 Feb 2025 07:54:00 +0900"
2025-02-24 23:20:34,"뉴욕증시, 트럼프 정권 관세폭탄 위협 등 영향 혼조세⋯엔비디아 3%대, ...",http://www.econonews.co.kr/news/articleView.html?idxno=376661,"<b>반도체</b> 설계기업 브로드컴 주가는 4.91%, 세계 최대 파운드리업체 TSMC는 3.32%, AMD 2.46%, 인텔 2.41%, 퀄컴 2.62% 각각 하락했다. 지난해 주가가 340% 이상 뛰었던 'AI 방산주' 팔란티어 주가는 이날 10.53% 떨어졌다. 테슬라는... ","Tue, 25 Feb 2025 07:52:00 +0900"
2025-02-24 23:20:34,"SK, 폐플라스틱 재활용 기술 독립 벤처로 분사 추진",http://www.g-enews.com/ko-kr/news/article/news_all/202502250719588893fbbec65dfb_1/article.html,"SK그룹은 한국의 대표적 재벌 기업 중 하나로, 화학, 석유화학, <b>반도체</b>, 통신 서비스 등 다양한 사업을 영위하고 있다. 지난 4년간 개발해온 재활용 기술을 통해 재활용이 어려운 플라스틱 제품을 처리하기 위한 시범... ","Tue, 25 Feb 2025 07:52:00 +0900"
2025-02-24 23:20:34,나스닥 1% 이상 하락… 대형 기술주 부진,https://www.newstof.com/news/articleView.html?idxno=26754,"AI(인공지능) 기술을 지원하는 기술 수요에 대한 우려가 커지는 가운데, 투자자들이 <b>반도체</b> 대장주인... 투자자들은 엔비디아의 고가 AI <b>반도체</b>에 대한 미래 수요 둔화를 우려하며 긴장하고 있다. AI 기술 투자... ","Tue, 25 Feb 2025 07:52:00 +0900"
2025-02-24 23:20:34,"미국증시 '혼조' 속...나스닥 1.21% '뚝', AI주 '급락'",http://www.choicenews.co.kr/news/articleView.html?idxno=143244,"이와 함께 인공지능(AI) <b>반도체</b> 대장주인 엔비디아의 주가도 3.09%, 테슬라도 2.15% 뚝 떨어졌고, 메타 플랫폼스와 아마존닷컴 역시 각각 2.26%, 1.79% 급락하는 등 대형 기술주 그룹인 '매그니피센트 7(M7)'의 주가는 0.63... ","Tue, 25 Feb 2025 07:52:00 +0900"
2025-02-24 23:20:34,"삼성전기, 中 쿤산 '모바일 기판' 공장 청산 완료",https://www.ebn.co.kr/news/articleView.html?idxno=1652946,"AI, 전장, 고성능 컴퓨팅(HPC) 등 고부가 시장 확대에 맞춰 사업 구조를 개편하고 있다. 플립칩 볼그리드 어레이(FC-BGA), 전장용 MLCC, 유리기판 등 차세대 <b>반도체</b> 기판 사업을 강화해 경쟁력을 높인다는 전략이다.","Tue, 25 Feb 2025 07:50:00 +0900"
2025-02-24 23:20:34,"[클릭 e종목]&quot;아이티엠<b>반도체</b>, 전자담배 수요 회복 기대…목표가↓&quot;",https://n.news.naver.com/mnews/article/277/0005551273?sid=101,"KB증권은 25일 아이티엠<b>반도체</b>에 대해 보호회로 채택 모델 수 증가 및 러시아·우크라이나 전쟁 종결에 따른... 아이티엠<b>반도체</b>의 지난해 4분기 실적은 매출액 전년 동기 대비 9% 증가한 1786억원, 영업손실 1억원을 기록해... ","Tue, 25 Feb 2025 07:49:00 +0900"
2025-02-24 23:20:34,"&quot;KT&amp;G, 국내 250대 기업 중 ESG 종합평가 1위&quot; 등극",http://www.issuenbiz.com/news/articleView.html?idxno=56358,"15개 업종별 종합 등급을 보면 IT·<b>반도체</b>에서 카카오, 건설·조선에서 HD현대건설기계, 금융지주에서 신한지주, 물류·무역에서 현대백화점, 보험에서 삼성화재, 식음료에서 KT&amp;G, 엔터·전문서비스에서 CJ ENM, 은행... ","Tue, 25 Feb 2025 07:48:00 +0900"
2025-02-24 23:20:34,&quot;지난해 <b>반도체</b> 시장 삼성전자 1위...하이닉스·퀄컴 2·3위&quot;,https://n.news.naver.com/mnews/article/031/0000911365?sid=105,"지난해 삼성전자가 세계 <b>반도체</b> 시장에서 매출 기준으로 점유율 1위를 유지했을 것으로 추정됐다. 24일 시장조사업체 카운터포인트리서치에 따르면, 지난해 매출 기준으로 삼성전자의 <b>반도체</b> 시장 점유율은 11.8... ","Tue, 25 Feb 2025 07:48:00 +0900"
2025-02-24 23:20:34,"SK하이닉스, 용인 <b>반도체</b> 클러스터 1기 팹 첫 삽…2027년 5월 준공",https://n.news.naver.com/mnews/article/032/0003353016?sid=101,SK하이닉스가 경기도 용인 <b>반도체</b> 클러스터 내 1기 팹(fab·<b>반도체</b> 생산공장)의 첫 삽을 떴다. 25일 SK하이닉스 뉴스룸에 따르면 SK하이닉스는 지난 21일 용인시의 건축 허가 승인에 따라 용인 <b>반도체</b> 클러스터 1기 팹이... ,"Tue, 25 Feb 2025 07:46:00 +0900"
2025-02-24 23:20:34,"뉴욕증시, 성장·물가 불확실성에 혼조 마감…나스닥 1.2%↓",https://n.news.naver.com/mnews/article/310/0000123286?sid=104,"<b>반도체</b> 설계기업 브로드컴 주가는 4.91%, 세계 최대 파운드리 대만<b>반도체</b>제조회사(TSMC)는 3.32%, AMD 2.46%, 인텔 2.41%, 퀄컴 2.62% 각각 밀렸다. 필라델피아 <b>반도체</b>지수는 2.59% 하락했다. 또 전력 공급업체 비스트라... ","Tue, 25 Feb 2025 07:44:00 +0900"
2025-02-24 23:20:34,"SK하이닉스, 용인 클러스터 1기 팹 첫 삽..차세대 D램 메모리 생산 거점...",http://kpenews.com/View.aspx?No=3552601,<b>반도체</b> 클러스터 내 1기 팹의 본격 착공에 들어갔다. 이로써 차세대 D램 메모리 생산 거점 구축이 본격화된다.25일 SK하이닉스 뉴스룸에 따르면 용인시가 예정보다 신속하게 인허가 절차를 진행하면서 용인 <b>반도체</b>... ,"Tue, 25 Feb 2025 07:44:00 +0900"
2025-02-24 23:20:34,"애플, 4년 동안 미국에 714조원 투자… 트럼프 압박 통했나",https://n.news.naver.com/mnews/article/417/0001060192?sid=104,"등 <b>반도체</b> 설계에서 미국 내 연구개발(R&amp;D) 투자를 확대할 생각이다. 애플은 미국에서 생산 확대로 인해 2만명 신규 고용을 창출한다고 발표했다. 대부분이 <b>반도체</b>와 기계학습, 소프트웨어 개발 등 R&amp;D 관련으로 AI 분야에... ","Tue, 25 Feb 2025 07:44:00 +0900"
2025-02-24 23:20:34,"트럼프 “캐나다·멕시코 25% 관세, 예정대로 진행할것”",https://n.news.naver.com/mnews/article/018/0005950305?sid=101,"알루미늄에 대한 25% 관세는 3월부터 발효될 예정이다. 트럼프 대통령은 또한 자동차, 목재, <b>반도체</b>, 의약품 수입품에 대해 약 25%의 관세를 부과할 것이라고 예고했다. 이에 대한 발표는 빠르면 4월 2일에 있을 예정이다.","Tue, 25 Feb 2025 07:43:00 +0900"
2025-02-24 23:20:34,"[더벨]HPSP 매각, 딜메이커 '김앤장' 독보적 활약 주목",https://www.thebell.co.kr/free/content/ArticleView.asp?key=202502240952487320106472,<b>반도체</b> 전공정 장비사 에이치피에스피(HPSP) 매각 절차에서 김·장법률사무소(김앤장)의 행보가 주목을... 24일 <b>반도체</b> 및 투자업계에 따르면 김·장은 HPSP를 매각하는 크레센도에쿼티파트너스(이하 크레센도)에... ,"Tue, 25 Feb 2025 07:42:00 +0900"
2025-02-24 23:20:34,"이상일 용인시장, 재선출마OK, 경기도지사출마 NO",https://n.news.naver.com/mnews/article/016/0002433466?sid=100,통해 <b>반도체</b>산업 초대형 프로젝트를 포함해 시정 전반에 속도를 내겠다는 의지를 밝혔다. 이 시장은 24일 ‘Btv뉴스 특집대담’에서 올해 시정 방향을 묻는 사회자의 질문에 “<b>반도체</b>뿐 아니라 시정의 모든 분야를... ,"Tue, 25 Feb 2025 07:42:00 +0900"
2025-02-24 23:20:34,"KT&amp;G, ESG 평가에서 국내 시총 250대 기업 중 종합 1위 차지",https://www.cbci.co.kr/news/articleView.html?idxno=486940,"15개 업종별 종합 등급에서는 IT·<b>반도체</b> 부문에서 카카오, 건설·조선 부문에서 HD현대건설기계, 금융지주 부문에서 신한지주 등이 최상위를 기록했다. 자동차부품에서는 기아, 전기·전자에서는 삼성전자가 1위를... ","Tue, 25 Feb 2025 07:42:00 +0900"
2025-02-24 23:20:34,"뉴욕증시, 기술주 사흘째 투매 '다우 나홀로 반등'···팔란티어 10%↓...",http://www.seoulfn.com/news/articleView.html?idxno=549271,필라델피아 <b>반도체</b>지수는 2.59% 급락했다. 트럼프 미국 대통령의 관세 전쟁 위협이 여전히 주식시장을 압박했다. 이날 트럼프 대통령은 예정대로 오는 3월 4일부터 멕시코와 캐나다산 수입품에 대한 관세를... ,"Tue, 25 Feb 2025 07:39:00 +0900"
2025-02-24 23:20:34,美 재무부 &quot;불공정 무역엔 상호 관세 인상&quot;,https://www.newswhoplus.com/news/articleView.html?idxno=21665,"한국은 <b>반도체</b>, 자동차, 전자 제품 등 주요 수출 품목에서 미국 시장 의존도가 높기 때문이다. 미국이 유럽연합(EU)이나 중국과의 무역 협상에서 상호 관세 카드를 꺼낼 경우 한국도 간접적인 영향을 받을 수 있다. 특히... ","Tue, 25 Feb 2025 07:36:00 +0900"
