DateTime,Title,Link,Description,PubDate
2026-02-24 09:33:49,"전남도, 2027년 국고 확보 시동…신규사업 153건 발굴",http://www.jndn.com/article.php?aid=1771925362427709001,"인공지능·<b>반도체</b>·첨단전략, 농수축산 등 핵심 분야 예산확보 전략을 구체화했다. 또 전남광주 통합... 전남도는 더불어 AI·<b>반도체</b> 및 분산에너지 특화지역 등 비교우위 강점을 활용한 국가 공모사업 선정에도... ","Tue, 24 Feb 2026 18:32:00 +0900"
2026-02-24 09:33:49,"최원용 평택시장 예비후보, 국회 소통관에서 평택시장 출마 선언",https://www.kihoilbo.co.kr/news/articleView.html?idxno=3014401,그는 평택 발전을 위한 3대 핵심 비전인 ▶K-<b>반도체</b> 중심의 첨단산업 핵심거점 육성을 통한 AI 미래도시 구현 ▶도시 전역의 유기적 이동체계 구축을 통한 '30분 생활권 도시' 실현 ▶지역 내 완결형 교육 시스템 구축을... ,"Tue, 24 Feb 2026 18:32:00 +0900"
2026-02-24 09:33:49,삼성·SK 입주 용인시 &quot;<b>반도체</b> 소부장 AX 센터 만들자&quot;,https://n.news.naver.com/mnews/article/031/0001007991?sid=105,&quot;용인시 안에 <b>반도체</b> 소부장 인공지능 대전환(AX) 센터를 만들어야 합니다.&quot; 박재근 한양대 융합전자공학부 석학 교수는 24일 용인시 문화예술원 국제회의실에서 열린 '용인특례시 <b>반도체</b> 소부장(소재·부품·장비) AIX... ,"Tue, 24 Feb 2026 18:32:00 +0900"
2026-02-24 09:33:49,"'육천피'가 코앞…코스피, 美관세 불안에도 또 최고가 경신",https://www.ccdn.co.kr/news/articleView.html?idxno=1064743,"듯했으나 <b>반도체</b> '투톱'이 되살아나면서 전체 지수를 끌어 올렸다. 삼성전자와 SK하이닉스는 각각 20만원, 100만원대를 기록하며 사상 최고가를 다시 썼다. 삼성전자는 3.63% 오른 20만원, SK하이닉스는 5.68% 뛴... ","Tue, 24 Feb 2026 18:32:00 +0900"
2026-02-24 09:33:49,"이상일 용인시장, 동계올림픽 메달리스트 초청 격려",https://www.discoverynews.kr/news/articleView.html?idxno=1085799,"아울러 삼성전자와 SK하이닉스가 추진 중인 대규모 <b>반도체</b> 산업 프로젝트가 본격화될 경우 향후 세수 확대가 기대되는 만큼, 도시 인프라 확충과 함께 체육 분야 투자도 단계적으로 확대하겠다는 계획을 밝혔다. 김상겸... ","Tue, 24 Feb 2026 18:30:00 +0900"
2026-02-24 09:33:49,[다시보기] 헬로tv뉴스 강원 2026년 2월 24일,http://news.lghellovision.net/news/articleView.html?idxno=535727,"1. 수소 충전소 설치 잇따라…수소 대란 해소되나 2. &quot;정년까지 다녀요&quot;…<b>반도체</b> 취업문 '활짝' 3. 정선아리랑 해외 러브콜…세계화 가속 4. 춘천시, 축구문화도시 종합계획 발표","Tue, 24 Feb 2026 18:30:00 +0900"
2026-02-24 09:33:49,"‘일단 10%’ 트럼프, 글로벌 관세 발효… 6개 산업 추가 검토",https://n.news.naver.com/mnews/article/014/0005482217?sid=101,"트럼프 행정부는 이미 <b>반도체</b>, 의약품, 드론, 산업용 로봇, 태양광 패널용 폴리실리콘 등 9개 산업에 대해서도 232조 조사를 진행 중이다. 일부 조사는 약 1년 전 시작됐으며 이번 판결을 계기로 속도를 낼 전망이다.... ","Tue, 24 Feb 2026 18:30:00 +0900"
2026-02-24 09:33:49,&quot;양자기술이 제조 혁신 열쇠&quot;…구미시의회 제조업 혁신 정책토론회,https://n.news.naver.com/mnews/article/421/0008790981?sid=102,"이어진 토론에서 이지연·정지원 시의원과, 남병국 구미시 첨단산업국장, 이왕훈 GERI<b>반도체</b>·방산연구센터장 등은 산·학·연 협력체계 구축과 전문인력 양성 필요성을 강조하며 양자 클러스터 유치와 지역특화 산업... ","Tue, 24 Feb 2026 18:29:00 +0900"
2026-02-24 09:33:49,용인 <b>반도체</b>산단 두고 한준호·강위원 설전,https://n.news.naver.com/mnews/article/005/0001833668?sid=100,"한준호 더불어민주당 의원과 강위원 전남도 경제부지사가 <b>반도체</b> 국가산업단지 조성을 놓고 공개적으로 맞붙었다. 경기도지사 선거에 출사표를 낸 한 의원이 용인 <b>반도체</b> 산단의 신속한 조성을 촉구하자, 강 부지사는... ","Tue, 24 Feb 2026 18:28:00 +0900"
2026-02-24 09:33:49,코스피 장중·종가 모두 최고치 경신…'6000피' 눈 앞,https://www.industrynews.co.kr/news/articleView.html?idxno=78404,인더스트리뉴스 김은경 기자  코스피가 <b>반도체</b> 대장주의 강세에 힘입어 사상 최고치를 경신하며... 시장을 끌어올린 것은 <b>반도체</b>주였다. 삼성전자는 20만원대를 기록하며 사상 최고가를 다시 썼고... ,"Tue, 24 Feb 2026 18:28:00 +0900"
2026-02-24 09:33:49,"&quot;카피 제품은 발 못 붙인다&quot;... 서울<b>반도체</b>, 철벽 특허로 고객 보호하는...",https://www.pinpointnews.co.kr/news/articleView.html?idxno=431924,세계적인 LED 전문 기업 서울<b>반도체</b> 역시 29.88% 치솟으며 9520원으로 상한가 대열에 합류했다. 서울<b>반도체</b>가 전 세계 LED 시장의 판도를 바꾸는 '지식재산권의 거인'으로 우뚝 섰다. 코스닥 상장 이후 매년 매출의 10%에... ,"Tue, 24 Feb 2026 18:28:00 +0900"
2026-02-24 09:33:49,"SK스퀘어, 작년 사상 최대 영업익 달성…시총 5위 올랐다",https://n.news.naver.com/mnews/article/014/0005482204?sid=105,인공지능(AI)·<b>반도체</b> 포트폴리오에 집중하고 수익성 중심 경영 성과를 거뒀다는 분석이다. 시가총액도... 또 미국·일본 AI·<b>반도체</b> 성장기업 7곳에 300억원을 공동 투자해 최대 7배의 투자성과를 거뒀다.... ,"Tue, 24 Feb 2026 18:27:00 +0900"
2026-02-24 09:33:49,신고가 갈아치운 <b>반도체</b> 투톱…‘육천피’ 단 31p 남았다,https://n.news.naver.com/mnews/article/014/0005482206?sid=101,<b>반도체</b> 투톱이 동시에 역사적 가격대로 올라서면서 코스피지수가 6000선 턱밑까지 올라섰다. 현재 '육천피... 최근까지 차익실현에 나섰던 외국인 자금이 <b>반도체</b> 중심으로 재유입되면서 지수 상단을 열고 있다는... ,"Tue, 24 Feb 2026 18:27:00 +0900"
2026-02-24 09:33:49,"코스피, '육천피' 코앞 5969선 마감…코스닥도 반등 성공",https://www.thepublic.kr/news/articleView.html?idxno=295305,"국내 증시도 장 초반 주춤하는 듯했으나 <b>반도체</b> '투톱'이 되살아나면서 전체 지수를 끌어 올렸다. 삼성전자와 SK하이닉스는 각각 '20만 전자', '100만 닉스'의 고지에 오르며 사상 최고가를 다시 썼다.... ","Tue, 24 Feb 2026 18:26:00 +0900"
2026-02-24 09:33:49,'20만 전자·100만 닉스' 고지 달성…육천피 달성 위해 엔비디아 실적 '...,https://www.thepublic.kr/news/articleView.html?idxno=295297,한국시간으로 26일 오전 예정된 인공지능(AI) <b>반도체</b> 대장주 미국 엔비디아의 지난해 4분기(2025년 11월~2026년 1월) 실적 발표가 국내 증시 향방의 분수령이 될 전망이다. <b>반도체</b> '투톱'인 삼성전자와 SK하이닉스가... ,"Tue, 24 Feb 2026 18:26:00 +0900"
2026-02-24 09:33:49,&quot;글로벌 관세 15%&quot; 전면전 선포한 美… 韓 제외 경쟁국들만 숨 돌리나,https://www.thepublic.kr/news/articleView.html?idxno=295272,"지난해 기준 자동차(24.5%), <b>반도체</b>(11.2%), 자동차 부품(6.2%)이 전체 대미 수출의 상당 부분을 차지했다. 이 가운데 자동차·자동차 부품은 무역확장법 232조에 따라 이미 15% 관세가 적용되고 있고, <b>반도체</b>·컴퓨터는 면제... ","Tue, 24 Feb 2026 18:26:00 +0900"
2026-02-24 09:33:49,"전남도, ‘국비 10조 시대’ 굳히기 돌입… 2027년 신규사업 153건 발굴",http://www.breaknews.com/1187223,"특히 이번 보고회에서는 사회간접자본(SOC), 미래 에너지, AI·<b>반도체</b>, 농수축산 등 4대 핵심 분야의 전략을 구체화했다. 주요 신규 사업을 살펴보면 SOC 분야에서는... ","Tue, 24 Feb 2026 18:26:00 +0900"
2026-02-24 09:33:49,‘김동연의 달달버스2’ 출발…키워드 ‘집중·속도·체감’,https://n.news.naver.com/mnews/article/081/0003620479?sid=102,"이어 “주거, <b>반도체</b>, 생활 SOC, 노동, 기후, 돌봄 등 6개 주제를 가지고 달달버스를 열심히 달려보도록 하겠다”면서 “새로운 경기도의 모토가 ‘내 생활의 플러스’다. 생활비 절감이나 격차 해소, 일자리 문제를 해결해... ","Tue, 24 Feb 2026 18:25:00 +0900"
2026-02-24 09:33:49,"‘AI로 2028년엔 고용, 소비, 부동산, 주식 모두 무너진다’···월가 뒤...",https://n.news.naver.com/mnews/article/032/0003429490?sid=101,다만 <b>반도체</b> 생산국인 한국과 대만 등은 AI 투자가 지속되면서 오히려 수혜를 볼 수 있다고 전망했다. 시장에선 시트리니의 시나리오가 현실화되긴 어려울 것이란 전망이 나온다. 한지영 키움증권 연구원은 “보고서로... ,"Tue, 24 Feb 2026 18:24:00 +0900"
2026-02-24 09:33:49,"역대급 실적낸 전력기기 업체들, 성과급도 사상최대",https://n.news.naver.com/mnews/article/014/0005482200?sid=101,"최근 <b>반도체</b> 업계의 성과급 잔치와 맞물려, 전력기기 업계에서도 보상 확대 흐름이 본격화하는 모습이다. ■HD현대일렉 1195% 성과급 24일 파이낸셜뉴스 취재를 종합하면, LS일렉트릭은 이달 중순 임직원들에게 평균... ","Tue, 24 Feb 2026 18:24:00 +0900"
2026-02-24 09:33:49,[위클리AI] 앤스로픽·구글 연달아 새 모델 출시···엔비디아·메타 다...,https://it.donga.com/108450/,"엔비디아·메타, 전략적 파트너십 체결 'AI 산업 판도 전환' 글로벌 AI <b>반도체</b> 전문기업 엔비디아(NVIDIA)와 글로벌 IT 기업 메타(Meta)가 차세대 AI 인프라 구축을 위한 장기 전략적 파트너십을 체결했습니다. 엔비디아는... ","Tue, 24 Feb 2026 18:24:00 +0900"
2026-02-24 09:33:49,SK스퀘어 지난해 영업익 8.8조…2023년 출범 후 최대,https://n.news.naver.com/mnews/article/008/0005321726?sid=105,SK스퀘어는 지난해 AI·<b>반도체</b> 포트폴리오에 집중하고 수익성 중심으로 경영한 결과 24일 종가 기준... 또 미국과 일본 AI·<b>반도체</b> 성장기업 7곳에 300억원을 공동 투자해 최대 7배의 투자성과를 거뒀다. 회사는 AI... ,"Tue, 24 Feb 2026 18:23:00 +0900"
2026-02-24 09:33:49,AI 파괴론이 호재 된 <b>반도체</b> 랠리…“코스피 레벨업 지속”,https://n.news.naver.com/mnews/article/011/0004593037?sid=101,미국 뉴욕 증시를 흔든 인공지능(AI) 파괴론이 오히려 국내 <b>반도체</b> 기업에 호재로 작용하면서 일제히... AI <b>반도체</b> 수요 확대와 함께 범용 D램과 낸드(NAND) 가격 급등에 따른 실적 개선 기대감이 <b>반도체</b> 종목들의 동반... ,"Tue, 24 Feb 2026 18:22:00 +0900"
2026-02-24 09:33:49,"오하근, 순천시장 출마 공식 선언…순천 민주주의 회복",https://www.dnews.co.kr/uhtml/view.jsp?idxno=202602241445445650811,5대 핵심 공약으로는 △제2기 혁신도시 유치 △<b>반도체</b> 클러스터 구축 △전 시민 민생회복지원금 지급 △시민주주형 국가정원 리조트 건립 △청년·신혼부부 만원 기본주택 제공 등을 제시했다. 3대 맞춤 특구로는 △읍면... ,"Tue, 24 Feb 2026 18:22:00 +0900"
2026-02-24 09:33:49,"SK스퀘어, 지난해 영업익 8조7974억원 '사상 최대' … SK하이닉스 효과",https://biz.newdaily.co.kr/site/data/html/2026/02/24/2026022400444.html,"지난 한 해 AI·<b>반도체</b> 포트폴리오에 집중하고 수익성 중심 경영 성과를 거둔 결과, 24일 종가 기준 코스피 시총 5위에 올랐다. SK스퀘어는 AI·<b>반도체</b> 포트폴리오에 집중하며 기업가치를 높였다. SK하이닉스의... ","Tue, 24 Feb 2026 18:22:00 +0900"
2026-02-24 09:33:49,"SK스퀘어, 작년 영업이익 8조 7974억원...사상 최대이익",https://n.news.naver.com/mnews/article/092/0002411679?sid=105,"지난 한 해 AI, <b>반도체</b> 포트폴리오에 집중하고 수익성 중심 경영 성과를 거둔 결과 2월24일 종가 기준... 먼저 SK스퀘어는 AI <b>반도체</b> 포트폴리오에 집중하며 기업가치를 크게 높였다. SK하이닉스의 지분법 이익을... ","Tue, 24 Feb 2026 18:22:00 +0900"
2026-02-24 09:33:49,"20만전자·100만닉스 넘었다… “<b>반도체</b> 슈퍼싸이클, AI 확장에 장기화...",https://www.asiatoday.co.kr/view.php?key=20260224010007141,메모리<b>반도체</b>를 빨아들인 HBM 시장의 성장 등을 배경으로 실적과 주가가 치솟고 있다. 24일... <b>반도체</b>업계에서는 이번 슈퍼 싸이클은 기존과 양상이 다르다는 시각이다. 기존에는 전방산업인 스마트폰과 TV 등에... ,"Tue, 24 Feb 2026 18:22:00 +0900"
2026-02-24 09:33:49,이상일 시장 &quot;정부는 용인 <b>반도체</b> 산단에 대한 전력ㆍ용수 공급을 계획...,https://www.dnews.co.kr/uhtml/view.jsp?idxno=202602241701208440872,"“총리실, 26일 부산 토론회서 용인 <b>반도체</b> 국가산단에 대한 시비가 생기지 않도록 조치 취해 달라&quot; 이상일 시장, 24일 국회 소통관서 기자회견…&quot;용인 <b>반도체</b> 생산라인 지방이전 논란 종식시켜야&quot; 강조 이상일... ","Tue, 24 Feb 2026 18:22:00 +0900"
2026-02-24 09:33:49,7632억원 규모 '1호 과학기술혁신펀드' 출범…목표액 3배 초과,https://n.news.naver.com/mnews/article/082/0001368158?sid=101,"각 중점 투자분야 운용사 공모 결과 △<b>반도체</b>·디스플레이(4010억 원) △인공지능(AI, 1440억 원) △첨단모빌리티(490억 원) △첨단바이오(1076억 원) △양자(616억 원) 등 총 7632억 원 규모 자펀드가 결성됐다. 이는 당초... ","Tue, 24 Feb 2026 18:20:00 +0900"
2026-02-24 09:33:49,"SK스퀘어, 작년 영업익 8조7974억원…사상 최대 이익",http://www.newsprime.co.kr/news/article.html?no=725257,"지난 한 해 AI·<b>반도체</b> 포트폴리오에 집중하고 수익성 중심 경영 성과를 거둔 결과, 24일 종가 기준... 먼저 SK스퀘어는 AI·<b>반도체</b> 포트폴리오에 집중하며 기업가치를 크게 높였다. SK하이닉스(000660)의 지분법... ","Tue, 24 Feb 2026 18:20:00 +0900"
2026-02-24 09:33:49,"피지컬 AI·휴머노이드 로봇 관련주, '웃음꽃' 나인테크·유니테크노·M...",http://www.finomy.com/news/articleView.html?idxno=250209,"<b>반도체</b>·디스플레이·스마트팩토리 등 다양한 산업 분야에 제품을 공급하고 있다. 반기보고서에 따르면 2025년 2분기 매출은 로봇모션제어기 1798억원, 에너지제어장치 1188억원 수준을 기록했다. 특히 <b>반도체</b> 설비용... ","Tue, 24 Feb 2026 18:20:00 +0900"
2026-02-24 09:33:49,"태양광에너지 관련주, '맑고 화창' 다원시스·지투파워·신성이엔지·레...",http://www.finomy.com/news/articleView.html?idxno=250210,"기술로 <b>반도체</b> 및 첨단 산업 소재 시장에서 두각을 나타내고 있다. 회사는 국내 유일의 TMA(트리메틸알루미늄) 제조 기술을 보유한 유기금속 화합물 전문 기업으로, <b>반도체</b>·태양열·LED·디스플레이 등 첨단 전자산업... ","Tue, 24 Feb 2026 18:20:00 +0900"
2026-02-24 09:33:49,['클릭' 증시] '100만닉스·20만전자' 시대 개막..거침 없는 질주,http://www.00news.co.kr/news/articleView.html?idxno=102106,뒷받침할 <b>반도체</b> 인프라 수요가 늘어날 것이라는 논리가 작용했다&quot;고 설명했다. 이어 이 연구원은... 이날 시장은 AI 수혜가 기대되는 <b>반도체</b> 장비주와 미국의 중국산 ESS 규제 반사이익이 예상되는 2차전지 제조 및... ,"Tue, 24 Feb 2026 18:20:00 +0900"
2026-02-24 09:33:49,[N2 특징주] <b>반도체</b>가 연 '육천피' 목전…삼성 20만·하이닉스 100만 현실...,https://www.news2day.co.kr/article/20260224500256,"인공지능(AI) 열풍이 <b>반도체</b> 산업을 단순 경기순환주에서 구조적 성장주로 탈바꿈시키며, 코스피 지수는 ‘육천피(6,000포인트)’ 돌파를 단 30포인트 남겨두게 됐다. ■ <b>반도체</b> 형제…삼성 20만·SK하이닉스 100만... ","Tue, 24 Feb 2026 18:20:00 +0900"
2026-02-24 09:33:49,"[김창묵의 입시 돋보기] 2027 대입, '이름값'보다 '실리'에 주목하라",https://news.unn.net/news/articleView.html?idxno=590175,"특히 간호·보건 계열이나 AI 소프트웨어, <b>반도체</b>, 이차전지 등 신산업 맞춤형 학과들은 불황 속에서도 흔들리지 않는 합격선과 취업률을 자랑한다. 과거 전문대학이 일반대학 다음의 차선책이었다면, 이제는 일반대... ","Tue, 24 Feb 2026 18:20:00 +0900"
2026-02-24 09:33:49,[이현석의 건강수명 연장하기] 에너지 절제가 곧 건강 관리,https://n.news.naver.com/mnews/article/029/0003012426?sid=110,"그리고 2040년에는 전세계에서 전기 자동차가 소비하는 전력량만 1GW(기가와트)급 원자력발전소 40개가 필요한 수준으로 늘어날 것이란 전망도 있다.전기차, 데이터센터를 비롯해 AI, <b>반도체</b>, 이차전지 등 미래 먹거리로... ","Tue, 24 Feb 2026 18:19:00 +0900"
2026-02-24 09:33:49,"한준호 경기지사 예비후보, 용인 <b>반도체</b> 산단 신속 추진 위해 5자 협의체...",https://n.news.naver.com/mnews/article/030/0003401643?sid=100,경기도지사 선거 출마를 선언한 한준호 더불어민주당 국회의원(고양시을)은 24일 용인 <b>반도체</b>... 한 의원은 “대한민국 <b>반도체</b>가 지금 용인에서 멈춰 서 있다”며 “더 이상의 지연은 국가 경쟁력 약화로 이어질 수 있다”... ,"Tue, 24 Feb 2026 18:19:00 +0900"
2026-02-24 09:33:49,"신한자산운용, <b>반도체</b> 메모리 3사·TSMC 집중 투자 ETF 공개",http://www.segyebiz.com/newsView/20260224517187?OutUrl=naver,신한자산운용은 24일 메모리와 파운드리 비중을 확대한 ‘SOL 한국형글로벌<b>반도체</b>액티브’ ETF(423170)를 <b>반도체</b> 시장의 흐름을 따라갈 수 있는 대표상품으로 출시했다고 밝혔다. 최근 <b>반도체</b> 시장은 인공지능(AI)... ,"Tue, 24 Feb 2026 18:18:00 +0900"
2026-02-24 09:33:49,현대차 &quot;자동차 관세 압박 커질 것&quot;…대미투자법 처리 촉구,https://n.news.naver.com/mnews/article/422/0000837251?sid=101,"트럼프 대통령은 상호관세 무효 판결 이후 15%의 새로운 보편적 수입 관세를 도입하고 새로운 조사를 지시해 자동차, <b>반도체</b> 등 주요 산업에 대한 관세 우려를 다시 점화했습니다. 한국 자동차 업계는 미국 시장에서 일본... ","Tue, 24 Feb 2026 18:18:00 +0900"
2026-02-24 09:33:49,"SK스퀘어, 영업익 8조7974억원…2배 이상 확대",http://www.newswatch.kr/news/articleView.html?idxno=77963,"지난 한 해 AI·<b>반도체</b> 포트폴리오에 집중하고 수익성 중심 경영 성과를 거둔 결과, 이날 종가 기준... SK스퀘어는 AI·<b>반도체</b> 포트폴리오에 집중하며 기업가치를 크게 높였다. SK하이닉스의 지분법 이익을 확대하는... ","Tue, 24 Feb 2026 18:18:00 +0900"
2026-02-24 09:33:49,친명 내부 다툼? 한준호 저격한 강위원 “<b>반도체</b> 심장은 전남광주”,https://n.news.naver.com/mnews/article/023/0003960821?sid=100,용인 <b>반도체</b> 클러스터 호남 이전 두고 한준호는 “무책임한 지역 이기주의” 이재명 대통령이 경기도지사... 용인 <b>반도체</b> 클러스터의 호남 이전론을 두고 전남의 강 부지사가 경기도지사 출마 예정인 한준호 더불어민주당... ,"Tue, 24 Feb 2026 18:18:00 +0900"
2026-02-24 09:33:49,김민석 총리 &quot;충북을 미래산업의 심장으로 육성 지원&quot;,https://www.goodmorningcc.com/news/articleView.html?idxno=441637,"김 총리는 &quot;충북은 국가 균형발전 핵심축이자 <b>반도체</b>·바이오 등 K-미래산업의 심장&quot;이라며 &quot;K-싱크론트론밸리(방사광가속기), K-바이오헬스 거점, K-광역교통 허브로 연계 발전할 수 있도록 정부도 지원해 나가겠다&quot;고... ","Tue, 24 Feb 2026 18:16:00 +0900"
2026-02-24 09:33:49,"증시 호황에 증권사 수수료 수익 급증…국내는 미래에셋, 해외는 토스증...",https://www.industrynews.co.kr/news/articleView.html?idxno=78402,지난해 증권시장은 글로벌 인플레이션 둔화에 따른 금리 인하 기대감 확산과 함께 AI·<b>반도체</b> 등 첨단 산업 중심의 성장주 강세가 이어지며 전반적인 상승 흐름을 보였다. 여기에 금융위원회와 기획재정부를... ,"Tue, 24 Feb 2026 18:16:00 +0900"
2026-02-24 09:33:49,"김동연 경기도지사, 민생경제 현장투어 시즌2 출정…&quot;달라질 때까지 달...",http://www.bizwnews.com/news/articleView.html?idxno=126508,"이어 두 번째 일정으로는 <b>반도체</b> 산업 현안을 다루기 위해 용인을 방문한다. 국가 <b>반도체</b> 산업단지와 관련한 전력 공급망 확충 등 기반시설 문제를 점검하고, 산업 경쟁력과 직결된 사안에 대해 현장 중심의 해법을... ","Tue, 24 Feb 2026 18:16:00 +0900"
2026-02-24 09:33:49,'글로컬대학' 발(發) 통합… 충청·전남 '메가 국립대' 재편 속도,https://news.unn.net/news/articleView.html?idxno=590208,충북 지역의 국가 전략 산업인 <b>반도체</b>와 이차전지 분야를 선도할 '글로벌 허브 대학'으로 거듭나겠다는 전략이다. 대전·충남권의 움직임도 심상치 않다. 충남대학교와 국립공주대학교는 충남 지역을 아우르는 모델을... ,"Tue, 24 Feb 2026 18:16:00 +0900"
2026-02-24 09:33:49,"의료AI 관련주, '으쓱으쓱 어깨춤' 모아데이타·젠큐릭스·셀바스헬스케...",http://www.finomy.com/news/articleView.html?idxno=250206,"스피어는 특수합금 및 고강도 소재 전문 제조사로, 항공우주·<b>반도체</b>·방산 분야에 초고강도 티타늄 합금, 니켈 기반 초합금 등 맞춤형 소재를 공급하는 중견기업이다. 고온·고압 환경에 견디는 특수합금 생산... ","Tue, 24 Feb 2026 18:16:00 +0900"
2026-02-24 09:33:49,김동연의 달달버스 시즌2 출정 &quot;달라질 때까지 달린다&quot;,https://www.kihoilbo.co.kr/news/articleView.html?idxno=3014396,"주거, <b>반도체</b>, 생활SOC, 노동, 기후, 돌봄 등 6가지 테마를 중심으로 민생 현안을 점검·해결한다. 김 지사는... 이어 &quot;27일에는 용인시를 방문해 K-<b>반도체</b> 메가클러스터 건설 및 조성을 위한 타운홀 미팅을 진행할 계획... ","Tue, 24 Feb 2026 18:16:00 +0900"
2026-02-24 09:33:49,"&quot;집중·속도·체감&quot;… 김동연, '달라질 때까지' 다시 달린다",https://n.news.naver.com/mnews/article/047/0002505902?sid=100,"두 번째는 '<b>반도체</b>'… 국가산단 현안 정면 돌파 두 번째 방문은 27일 용인에서 진행된다. 주제는 '<b>반도체</b>'다. 단국대에서 'K-<b>반도체</b> 메가클러스터 상생 타운홀 미팅'을 개최한다. 국회의원, 지자체 관계자, 삼성, SK하이닉스... ","Tue, 24 Feb 2026 18:16:00 +0900"
2026-02-24 09:33:49,"&quot;버려지는 게 없다&quot;... 더블유씨피, 독보적 트리밍 기술로 이차전지 수...",https://www.pinpointnews.co.kr/news/articleView.html?idxno=431923,"배터리 진단 시스템의 민테크, 원통형 배터리 부품 전문 상신이디피, 레이저 응용 장비의 한빛레이저, <b>반도체</b> 및 배터리 장비 전문 디이엔티는 3%대 오름세를 기록하며 상승 마감했다. 검사 장비 전문 이노메트리와... ","Tue, 24 Feb 2026 18:16:00 +0900"
2026-02-24 09:33:49,"“민생, 달라질 때까지 달린다”…김동연의 ‘달달버스’ 시즌2 시동",https://n.news.naver.com/mnews/article/020/0003699360?sid=102,● ‘주거’에서 ‘<b>반도체</b>’까지…6대 민생 키워드 선정 김 지사는 이날 출정식에서 지난 시즌과의 차별성을... 경기도는 △주거 △<b>반도체</b> △생활SOC △노동 △기후 △돌봄 등 6개 분야를 민생의 핵심 주제로 꼽았다. 김... ,"Tue, 24 Feb 2026 18:16:00 +0900"
