DateTime,Title,Link,Description,PubDate
2026-07-19 17:28:06,"[중국증시 주간 포인트] ②AMD '어드밴싱 AI' 컨퍼런스, 딥시크 V4 출시,...",https://www.newspim.com/news/view/20260720000005,"◆ AI∙<b>반도체</b> 테마 촉매제가 될 이슈 금주 AI 산업 관련 촉매도 집중적으로 이어진다. AMD의 연례 대형... 전통 <b>반도체</b> 업황 회복 여부를 종합적으로 확인하게 된다. 구체적으로 구글, 테슬라, IBM... ","Mon, 20 Jul 2026 02:11:00 +0900"
2026-07-19 17:28:06,[오늘의 경제뉴스] 월요일 코스피에 쏠린 세계의 눈…중국 AI발 충격 '흡...,https://www.newsverse.kr/news/articleView.html?idxno=10968,"주요국 <b>반도체</b>주가 동반 급락했기 때문이다. 20일 블룸버그통신 등에 따르면 런던과 뉴욕, 도쿄의... AI·<b>반도체</b>주의 방향을 가늠하는 시장으로 탈바꿈했다는 분석이 나온다. 두 회사의 주가 변동이 코스피에 그치지... ","Mon, 20 Jul 2026 02:10:00 +0900"
2026-07-19 17:28:06,고점론 지운 한은… “<b>반도체</b> 가격 상승이 내수회복 이끈다”,https://n.news.naver.com/mnews/article/005/0001861871?sid=101,실물 <b>반도체</b> 경기가 상당 기간 확장세를 이어갈 가능성이 크다는 분석이 연일 나오고 있다. 주식시장에서 ‘<b>반도체</b> 고점론’이 가라앉지 않고 있지만 산업 측면에선 성장 관측이 지배적이다. <b>반도체</b> 가격 상승이 기업... ,"Mon, 20 Jul 2026 02:06:00 +0900"
2026-07-19 17:28:06,글로벌 증시까지 흔든 레버리지… 3000만원으로 진정될까,https://n.news.naver.com/mnews/article/005/0001861870?sid=101,<b>반도체</b> 쏠림에 레버리지까지 더해진 한국 증시의 급격한 변동성 장세는 최근 해외 증시에까지 영향을... 니혼게이자이신문은 지난 17일 “최근 한국 <b>반도체</b>주의 움직임이 도쿄 증시에 영향을 미치는 장면이... ,"Mon, 20 Jul 2026 02:06:00 +0900"
2026-07-19 17:28:06,"美CIA, 'AI패권' 작전…UAE 기업의 '中유착 의혹' 비밀조사",https://n.news.naver.com/mnews/article/001/0016202420?sid=104,AI <b>반도체</b> 확보를 지원한 것으로 드러났다고 월스트리트저널(WSJ)이 19일(현지시간) 보도했다. 보도에... 당시 미국 정부에서는 G42가 중국과 밀접한 관계를 맺고 있어 AI <b>반도체</b> 수출을 승인할 경우 미국 기술이 유출될... ,"Mon, 20 Jul 2026 01:48:00 +0900"
2026-07-19 17:28:06,[김시래 대기자의 시선] 워싱턴이 탐내는 한국 <b>반도체</b>의 ‘AI 세금’,https://weeklytrade.co.kr/news/view.html?section=1&category=160&item=&no=100681,"미일 <b>반도체</b> 전쟁의 짙은 향기를 맡는다. 당시 워싱턴은 자국 산업의 무능을 뒤로한 채, 미국 시장을 장악해 가던 일본 기업들에게 불공정 무역 프레임을 씌웠다. 슈퍼 301조와 <b>반도체</b> 협정을 통한 강제 점유율 할당으로... ","Mon, 20 Jul 2026 01:26:00 +0900"
2026-07-19 17:28:06,"[사설] 국민 대다수가 기술 유출에 경각심, 제도 강화 서둘러야",https://n.news.naver.com/mnews/article/005/0001861861?sid=110,"세계시장을 석권한 우리의 메모리 <b>반도체</b>는 AI 시대의 핵심 역량이 되고 있다. 조선, 방산, 원자력 등은 탁월한 제조기술로 서방의 러브콜이 쇄도 중이다. 이런 환경에서 자칫 선도적 기술이 새나가면 기업의 흥망을 떠나... ","Mon, 20 Jul 2026 01:21:00 +0900"
2026-07-19 17:28:06,"中알리바바, AI칩 소프트웨어 무료 공개…엔비디아 쿠다 대항마",https://www.tfmedia.co.kr/news/article.html?no=205851,"(AI) <b>반도체</b>(칩)용 소프트웨어를 무료로 공개했다. 전 세계 AI 시장을 지배하고 있는 엔비디아의 소프트웨어... 19일 연합뉴스는 홍콩 사우스차이나모닝포스트(SCMP) 보도를 인용, 알리바바의 <b>반도체</b> 자회사인 티헤드(T-Head... ","Mon, 20 Jul 2026 01:18:00 +0900"
2026-07-19 17:28:06,한은 &quot;<b>반도체</b>가 교역조건 개선...내수 파급효과 과거보다 클 것&quot;,https://www.tfmedia.co.kr/news/article.html?no=205850,&quot;수출물가 상승이 견인…<b>반도체</b> 초과수요에 개선세 상당기간 지속&quot; &quot;<b>반도체</b>가 여타 부문 인력·투자 흡수하는 '네덜란드병' 유의해야&quot; 한국은행이 '<b>반도체</b> 가격 상승이 최근 우리나라 교역조건 개선을 이끌면서 소비... ,"Mon, 20 Jul 2026 01:12:00 +0900"
2026-07-19 17:28:06,"“<b>반도체</b>값 더 오를까 걱정, 주요국이 가만 안둘 것”",https://n.news.naver.com/mnews/article/023/0003988476?sid=101,"최태원, 칩플레이션 역풍 우려 “마진이 좀 떨어져도 공급 늘려야 공장 빨리 짓는게 <b>반도체</b> 생명줄” 최태원 대한상공회의소 회장 겸 SK그룹 회장이 “지금 메모리 <b>반도체</b> 가격은 비정상적으로 높은 수준”이라며... ","Mon, 20 Jul 2026 00:54:00 +0900"
2026-07-19 17:28:06,‘3중 규제’ 비웃듯 뛴 집값… 구로·관악·은평 국평도 15억,https://n.news.naver.com/mnews/article/023/0003988475?sid=101,"이창무 한양대 교수는 “공급 절벽과 <b>반도체</b> 머니 같은 수급 요인도 큰 변수지만, 최근 집값 급등세는 정부의 과도한 규제가 시장 참여자들의 불안 심리를 증폭시킨 영향도 간과할 수 없다”고 말했다. 이 교수는 또... ","Mon, 20 Jul 2026 00:53:00 +0900"
2026-07-19 17:28:06,“용수·전기·중대재해법… 용인 클러스터 12년 단축 쉽지 않다”,https://n.news.naver.com/mnews/article/023/0003988472?sid=101,"최태원, 속도전 강조 속 난관 토로 최태원 대한상공회의소 회장 겸 SK그룹 회장은 지난 15일 호남 <b>반도체</b>... <b>반도체</b> 초과이익을 협력사·비정규직과의 임금 격차 해소에 쓰자는 김영훈 고용노동부 장관의 ‘사회연대임금’... ","Mon, 20 Jul 2026 00:52:00 +0900"
2026-07-19 17:28:06,"<b>반도체</b> 쏠림 한국 경제에… 한은, ‘네덜란드 병’ 경고",https://n.news.naver.com/mnews/article/023/0003988473?sid=101,"다른 핵심 산업 기반 약화 우려 글로벌 인공지능(AI) 열풍으로 한국 경제는 <b>반도체</b> 호황을 누리고 있지만, 특정 산업만 비정상적으로 성장해 다른 산업을 위축시키는 이른바 ‘<b>반도체</b>판 네덜란드병’에 걸릴 수 있다는... ","Mon, 20 Jul 2026 00:52:00 +0900"
2026-07-19 17:28:06,"입구엔 3m 변신 로봇, 옆엔 중국산 AI칩 수천장 묶은 ‘수퍼포드’",https://n.news.naver.com/mnews/article/023/0003988470?sid=104,"<b>반도체</b>와 AI 모델부터 AI 로봇, 산업 적용 현장까지 중국의 AI 역량을 한자리에서 보여주는 쇼케이스에 가깝다. 2018년 시작된 WAIC에 올해 처음 시진핑 중국 국가주석이 참석했다. 시진핑은 개막식에서 “AI는 한 국가의... ","Mon, 20 Jul 2026 00:51:00 +0900"
2026-07-19 17:28:06,“입틀막·꼰대 기득권… 이게 2030이 보는 與”,https://n.news.naver.com/mnews/article/023/0003988462?sid=100,"정책적으로는 AI, <b>반도체</b>, 로봇 등 3대 메가 프로젝트가 잘 돌아갈 수 있도록 정부 지원을 제대로 해야 한다. 검사 탄핵 등 과거로 회귀하는 이슈는 청년들에게 중요하지 않고, 관심도 없다.” ☞김보미는 누구 전남 강진... ","Mon, 20 Jul 2026 00:48:00 +0900"
2026-07-19 17:28:06,[부음] 권옥심 별세 외,https://n.news.naver.com/mnews/article/023/0003988453?sid=102,"황보춘자 약사 남편상, 이은영 RMI보험경영연구소 연구위원·이규환 국토교통부 항공교통본부 주무관 부친상, 노진서 가천대 <b>반도체</b>물리학과 교수 장인상=18일9시7분 서울성모병원, 발인 21일9시30분, (02)2258-5940","Mon, 20 Jul 2026 00:46:00 +0900"
2026-07-19 17:28:06,"[김필수 칼럼] “이젠, 미래 모빌리티 융합”..현대차그룹의 변신 배경...",https://www.dailycar.co.kr/content/news.html?type=view&autoId=62070,"최근 국내를 관통하는 이슈는 인공지능을 필두로 이를 움직이는 GPU와 이를 구성하는 HBM 등 <b>반도체</b>일 것이다. 여기에 자율주행 기능이 부가된 미래 모빌리티와 배터리 등도 화두이다. 올해 세계가전전시회(CES, 이하 CES라고... ","Mon, 20 Jul 2026 00:46:00 +0900"
2026-07-19 17:28:06,기술유출 피해 23조… 국민 91% “경제안보 법체계 필요”,https://n.news.naver.com/mnews/article/005/0001861855?sid=101,"<b>반도체</b>를 비롯한 국가핵심기술의 해외 유출로 인한 우리 기업들의 피해가 날로 커지면서 기술 유출 범죄의... 특히 최근에는 <b>반도체</b>, 디스플레이, 이차전지 등 한국이 세계 시장에서 우위를 점하는 첨단 분야가 집중... ","Mon, 20 Jul 2026 00:43:00 +0900"
2026-07-19 17:28:06,"“증시 널뛸 땐 일부 수익 실현, 여름 조정장 대비 현금 보유”",https://n.news.naver.com/mnews/article/023/0003988435?sid=101,부분 <b>반도체</b> 산업에 힘입은 것”이라며 “삼성전자와 SK하이닉스 두 기업이 상장사 영업이익의 70~80%를 차지하는 편중된 구조”라고 지적했다. 이어 “<b>반도체</b>를 제외하면 뚜렷한 개선이 보이지 않는 만큼 저성장이... ,"Mon, 20 Jul 2026 00:38:00 +0900"
2026-07-19 17:28:06,게임·OTT도 ‘펀플레이션’… 집콕 비용 비싸진다,https://n.news.naver.com/mnews/article/023/0003988429?sid=105,인공지능(AI) 서버 투자 확대에 따른 메모리 <b>반도체</b> 가격 상승과 부품 조달 비용 증가가 인상 배경으로 꼽힌다. 여기에 미국 전기 요금도 2019년 이후 45% 올라 게임기와 전자기기 사용 비용을 끌어올리고 있다. 구독... ,"Mon, 20 Jul 2026 00:35:00 +0900"
2026-07-19 17:28:06,<b>반도체</b> 기술 해외로 빼돌렸는데 징역 6년 4개월… 국민 90% “국가 핵심...,https://n.news.naver.com/mnews/article/023/0003988425?sid=101,"예컨대 미국은 중국 정부 측 인사가 GE에어로스페이스의 항공기 엔진 기술을 유출한 사건에 대해 지난 2024년 징역 20년 확정 판결을 내렸고, 대만에선 지난 4월 TSMC의 2나노 <b>반도체</b> 공정 기술을 외부로 유출하려 한... ","Mon, 20 Jul 2026 00:34:00 +0900"
2026-07-19 17:28:06,"알리바바, 엔비디아에 도전장… AI 소프트웨어 무료 공개",https://n.news.naver.com/mnews/article/023/0003988414?sid=105,"(AI) <b>반도체</b>(칩)용 구동 소프트웨어를 18일 전 세계에 전격 개방했다. AI 칩뿐 아니라 이를 구동하는 소프트웨어 ‘쿠다(CUDA)’로 세계 AI 시장을 장악한 엔비디아에 맞서, 중국산 AI <b>반도체</b>의 확산을 가로막아온... ","Mon, 20 Jul 2026 00:32:00 +0900"
2026-07-19 17:28:06,중국 AI ‘키미 K3’ 충격… 증시 더 흔들리나,https://n.news.naver.com/mnews/article/023/0003988416?sid=101,"美 <b>반도체</b>주 일제히 하락 중국 인공지능(AI) 스타트업 문샷AI가 공개한 오픈소스 모델 ‘키미 K3’가 미국 기술주, 특히 <b>반도체</b> 종목 하락세를 촉발하며 20일 삼성전자·SK하이닉스의 주가 흐름에 관심이 쏠리고 있다.... ","Mon, 20 Jul 2026 00:32:00 +0900"
2026-07-19 17:28:06,“<b>반도체</b> 부품도 처음과 끝은 기술… R&amp;D투자에 미래 걸어”,https://n.news.naver.com/mnews/article/020/0003734906?sid=101,<b>반도체</b> 호황기인 현 상황에서는 부품도 가격 경쟁력만큼이나 기술이 뒷받침되어야 선택받을 수... ●슈퍼사이클에 <b>반도체</b> 부품도 호황 CMTX는 <b>반도체</b>를 만드는 여러 공정 중 웨이퍼에 회로 패턴을 새기는 식각... ,"Mon, 20 Jul 2026 00:31:00 +0900"
2026-07-19 17:28:06,"최신 AI칩 없이도 고성능… 中 AI ‘키미 K3’, 美 아성 위협",https://n.news.naver.com/mnews/article/020/0003734907?sid=101,미국의 첨단 <b>반도체</b> 대중 수출 규제에도 불구하고 미국 선두 모델에 버금가는 성능을 냈다는 평가가... 17일(현지 시간) 미국 나스닥이 발표한 필라델피아<b>반도체</b>지수(SOX)는 1만1673.89포인트로 마감했다. 이는 지난달... ,"Mon, 20 Jul 2026 00:31:00 +0900"
2026-07-19 17:28:06,기술유출 ‘美징역 20년 vs 韓 6년’… 국민 91% “처벌 약하다”,https://n.news.naver.com/mnews/article/020/0003734898?sid=101,● <b>반도체</b> 기술 유출 대만 10년 형 vs 韓 6년 형 경총 조사에 따르면 응답자 중 90.7%는 핵심 기술을 해외로... 서울고등법원은 올해 4월 <b>반도체</b> 핵심 기술을 중국에 유출한 혐의로 기소된 삼성전자 전직 직원에 대해 징역... ,"Mon, 20 Jul 2026 00:31:00 +0900"
2026-07-19 17:28:06,2차 공공기관 유치전 총력 대응으로 성과 내길,http://www.kwangju.co.kr/article.php?aid=1784474400801356074,광역자치단체들마다 좋은 기관 유치에 사활을 걸고 있는 터라 어떤 자치단체가 호남권 <b>반도체</b> 클러스터 사업에서 보듯 ‘호남 퍼주기’라는 논리로 정부를 압박할지 알 수 없다. 빅 10 유치 리스트를 포함해 전남광주시가... ,"Mon, 20 Jul 2026 00:24:00 +0900"
2026-07-19 17:28:06,월가 암살자 콰디르…새 투자무대는 한국,https://n.news.naver.com/mnews/article/025/0003538618?sid=104,콰디르가 한국을 선택한 건 <b>반도체</b> 등 인공지능(AI) 기술 경쟁력보다 주식시장이 저평가됐다고 판단해서다. 그는 WSJ에 “나의 경력은 잘못된 거버넌스(지배구조)로 실패한 기업을 찾는 데 집중돼 있었다”며... ,"Mon, 20 Jul 2026 00:23:00 +0900"
2026-07-19 17:28:06,"중국 AI, 이번엔 ‘키미 쇼크’…“미국과 격차 2개월로 줄어”",https://n.news.naver.com/mnews/article/025/0003538617?sid=105,"문샷AI가 키미 K3를 공개한 당일, 뉴욕증시에서 주요 <b>반도체</b>주는 일제히 약세를 보였다. 대장주인 엔비디아는 2.21%나 하락했고, 마이크론(-0.5%), AMD(-1.03%), 인텔(-2%) 등도 모두 하락세로 장을 마감했다. 이날... ","Mon, 20 Jul 2026 00:22:00 +0900"
2026-07-19 17:28:06,[趙甲濟 칼럼] 73세 이병철 회장의 마지막 승부수,https://n.news.naver.com/mnews/article/025/0003538616?sid=110,"당시 73세이던 이 회장은 <b>반도체</b> 사업을 벌여 놓은 직후였다. 노년(老年)의 무모한 도박이란 회의론을... 지금 시작한 <b>반도체</b>처럼 처음 사업을 할 때는 저녁에도 그 생각, 자고 일어나서도 그 생각, 뭣이 부족한 것이 없나... ","Mon, 20 Jul 2026 00:22:00 +0900"
2026-07-19 17:28:06,환율 더 떨어지면… 韓 올해 1인당 GDP 4만 달러 초읽기,https://n.news.naver.com/mnews/article/005/0001861847?sid=101,한국과 함께 <b>반도체</b> 호황을 누리고 있는 대만은 올해 1인당 GDP가 4만5000달러를 돌파할 전망이다. 대만 통계 당국인 주계총처는 지난 5월 말 경제전망에서 올해 1인당 GDP 전망치를 4만4000달러에서... ,"Mon, 20 Jul 2026 00:20:00 +0900"
2026-07-19 17:28:06,"블룸버그 “거래 전 한국증시 확인, 월가의 새 아침 의식”",https://n.news.naver.com/mnews/article/025/0003538613?sid=104,"<b>반도체</b> 등 인공지능(AI) 관련주 비중이 큰 코스피가 글로벌 투자 심리를 가늠하는 선행지표로 떠오르고... 엔비디아가 3.5%, 인텔이 6.1% 하락했고, 필라델피아 <b>반도체</b>지수도 4.7% 내렸다. 양국 증시의 연계성은... ","Mon, 20 Jul 2026 00:17:00 +0900"
2026-07-19 17:28:06,"SK이노베이션 주가 강세 유지, 코스피·코스닥 급락 속 '선방'…새 주장...",https://www.cbci.co.kr/news/articleView.html?idxno=590200,"17일(현지시간) 미국 뉴욕증시는 <b>반도체</b>주를 중심으로 매도세가 확대되며 주요 지수가 일제히 하락했다. 일각에서는 20일 국내 증시는 미국 증시 흐름과 수급동향, 최근 고조된 고조된 지정학적 리스크 및 글로벌... ","Mon, 20 Jul 2026 00:16:00 +0900"
2026-07-19 17:28:06,"최태원 “N% 성과급, 이해관계자 행복 해치면 손봐야”",https://n.news.naver.com/mnews/article/025/0003538611?sid=101,글로벌 메모리 <b>반도체</b> 시장에 대해선 “내년 인공지능(AI) <b>반도체</b> 수요는 올해보다 60~100% 늘어날 것으로 보지만 공급은 거의 늘지 않는다”며 “메모리 확보는 기업 간 경쟁을 넘어 각국의 경제안보 이슈가 됐다”고 했다.... ,"Mon, 20 Jul 2026 00:15:00 +0900"
2026-07-19 17:28:06,"<b>반도체</b> 호황이 던지는 역설, 그 화려한 장막에 가린 서민의 고통",https://www.ngonews.kr/news/articleView.html?idxno=233266,인공지능(AI) 특수로 촉진된 <b>반도체</b> 가격의 고공행진은 국민경제에 명확한 명(明)과 암(暗)을 동시에 던지고 있다. 거시경제적 관점에서 <b>반도체</b> 호황의 '명(明)'은 한국 경제의 무너진 자존심을 버티는 방파제다. <b>반도체</b>... ,"Mon, 20 Jul 2026 00:14:00 +0900"
2026-07-19 17:28:06,"[홍성주의 혁신의 길] 과학기술, ‘국민 기본권’으로 다뤄야",https://n.news.naver.com/mnews/article/025/0003538609?sid=110,"<b>반도체</b>에서 로봇·바이오에 이르기까지 한국 과학기술의 질주가 거침이 없다. 그러나 화려한 성장의 이면에서, 한국인의 삶도 함께 나아지고 있을까. 무인상점 앞에서 머뭇거리는 노인, 플랫폼 알고리즘에 쫓겨 밤길을... ","Mon, 20 Jul 2026 00:14:00 +0900"
2026-07-19 17:28:06,"[사설] AI 시대 중요도 커진 숙련공, 청년 일자리로 키워볼만",https://n.news.naver.com/mnews/article/015/0005311463?sid=110,최첨단 AI 데이터센터를 떠받치는 전력 설비와 <b>반도체</b> 부품 생산 현장에서 인간 숙련공의 가치가 커지고 있다는 것이다. 일례로 초고압 변압기에 들어가는 구리 선을 감는 작업이나 <b>반도체</b> 웨이퍼를 감싸는 석영유리... ,"Mon, 20 Jul 2026 00:12:00 +0900"
2026-07-19 17:28:06,[사설] 중동전쟁 다시 격화하는데…여전한 에너지 위기 불감증,https://n.news.naver.com/mnews/article/015/0005311461?sid=110,<b>반도체</b> 수출 호황이 우리 경제를 떠받치고 있다지만 대외 대형 악재까지 상쇄할 정도는 아닐 것이다. 정부는 지금이라도 중동발 물가·환율 쇼크를 상시 위험으로 인식하고 선제적인 방어벽을 구축해야 한다. 글로벌... ,"Mon, 20 Jul 2026 00:11:00 +0900"
2026-07-19 17:28:06,[다산칼럼] 기업의 본성,https://n.news.naver.com/mnews/article/015/0005311458?sid=110,<b>반도체</b> 경기가 갑자기 좋아져 큰 이익이 나자 해당 부문 종업원들이 미리 자신이 받을 엄청난 상여금을 제시하고 파업으로 경영진을 위협해 뜻을 이뤘다. 그러자 다른 부서 종업원들이 반발해 회사의 일체성이 깨졌고... ,"Mon, 20 Jul 2026 00:11:00 +0900"
2026-07-19 17:28:06,"강원대 강릉캠퍼스, 전국 창업대회서 잇따라 수상",https://n.news.naver.com/mnews/article/087/0001205918?sid=102,"안현준(전자공학과 20학번), 오상우(전자<b>반도체</b>공학부 24학번), 박선영(경영학과 24학번)으로 구성된... 윤재진(전자<b>반도체</b>공학부 21학번), 이선우(전자<b>반도체</b>공학부 21학번) 팀은 ‘J-RUN’ 아이템으로 우수상을... ","Mon, 20 Jul 2026 00:09:00 +0900"
2026-07-19 17:28:06,로봇 제국의 무료 급식소,https://n.news.naver.com/mnews/article/243/0000100597?sid=101,엔비디아의 AI <b>반도체</b>·소프트웨어 기술과 LG의 로봇·스마트팩토리·물류자동화 역량이 결합한 결과다. 5년 전인 2031년 미국 라스베이거스에서 열린 CES에서 공개된 상용 로봇은 공장과 물류센터를 넘어 호텔과 병원... ,"Mon, 20 Jul 2026 00:07:00 +0900"
2026-07-19 17:28:06,글로벌 <b>반도체</b> 권력 이동과 3년 후의 경고등,https://www.ngonews.kr/news/articleView.html?idxno=233265,"미국발 HBM 증설이 가져올 동태적 격변, 인공지능(AI) 혁명이 촉발한 <b>반도체</b> 공급 부족 사태 이른바 '램마게돈(RAMmageddon <b>반도체</b>칩 부족사태 대재앙)' 열기가 전 세계 공급망을 흔들고 있다. 가공할 만한 속도로 확장... ","Mon, 20 Jul 2026 00:06:00 +0900"
2026-07-19 17:28:06,A/S 부품이 살렸다…현대모비스 2분기 호실적 전망,https://www.pinpointnews.co.kr/news/articleView.html?idxno=469453,메모리와 <b>반도체</b> 등 주요 원재료 가격 상승이 이어지는 가운데 완성차 판매 회복 속도가 둔화될 경우 수익성 개선 폭이 제한될 가능성이 있다. 관세 관련 효과 역시 반기 단위 정산 성격이 강한 만큼 일회성 효과가 상당... ,"Mon, 20 Jul 2026 00:06:00 +0900"
2026-07-19 17:28:06,"두산에너빌리티, 제헌절·주말 연휴 이후 첫장 향방은? 7만원선 회복 여...",https://www.cbci.co.kr/news/articleView.html?idxno=590196,<b>반도체</b> 업종의 약세도 이어졌다. 필라델피아 <b>반도체</b>지수는 1.63% 하락했고 나스닥100지수 역시 1.49% 내리며 기술주 전반의 투자심리가 위축되는 모습을 보였다. 다만 미국 원전 관련 종목은 엇갈린 흐름을 보였다.... ,"Mon, 20 Jul 2026 00:06:00 +0900"
2026-07-19 17:28:06,삼성 파운드리發 인력 대이동 조짐…<b>반도체</b> 채용시장 들썩,https://www.wolyo.co.kr/news/articleView.html?idxno=315228,"공개되면서 <b>반도체</b> 채용시장이 달아오르고 있다. 경쟁사들이 비메모리 직무를 겨냥한 경력 채용에 나서고 삼성전자도 방어적 채용 확대로 맞서면서, 인공지능(AI) 슈퍼사이클 속 <b>반도체</b> 인력 쟁탈전이 전면전으로... ","Mon, 20 Jul 2026 00:06:00 +0900"
2026-07-19 17:28:06,[사설] <b>반도체</b>발 고성장에도 대졸 실업자는 5년래 최악 수준,https://n.news.naver.com/mnews/article/011/0004642917?sid=110,우리 경제가 <b>반도체</b> 수출 호조에 힘입어 큰 폭으로 성장하고 있지만 대졸 청년들의 일자리는 줄고 있다.... 그러나 <b>반도체</b>발(發) 경제 고성장의 이면에 드리운 청년 실업 실태를 보면 들떠 있을 때가 아니다.... ,"Mon, 20 Jul 2026 00:06:00 +0900"
2026-07-19 17:28:06,'배움에서 취업·정주까지' 강원형 인재 함께 키운다,https://n.news.naver.com/mnews/article/654/0000190966?sid=100,"정밀의료, 공공건강보험, 강원형 <b>반도체</b>, 헬스케어, 스마트 수소에너지, 공공인재 등 6개 분야에서 모두 116개 과목이 운영된다. 교육과정은 산업체와 공공기관의 의견을 반영해 설계됐으며 현직 전문가들이 겸임교원과... ","Mon, 20 Jul 2026 00:05:00 +0900"
2026-07-19 17:28:06,상반기 울산 수출 15.9%↑…석유류 견인,https://www.ksilbo.co.kr/news/articleView.html?idxno=1062467,비철금속 수출액은 인공지능(AI) 등으로 <b>반도체</b>와 전기공사 수요가 증가하며 57.0% 증가한 31억5000만달러를 기록했다. 울산의 올해 상반기 수입액은 346억9000만달러로 8.2% 증가했다. 원유(2.5%)와 정광(32.7... ,"Mon, 20 Jul 2026 00:04:00 +0900"
2026-07-19 17:28:06,"지방어항, 전남광주시 미래를 여는 바다의 거점",http://www.kwangju.co.kr/article.php?aid=1784473200801351131,통합 논의가 <b>반도체</b>·AI 등 첨단산업과 도시개발에 집중되는 것은 자연스러운 흐름이다. 그러나 그 과정에서... <b>반도체</b>와 자동차 산업이 경제적 부가가치를 창출한다면 농업과 수산업은 지역 공동체와 삶을 지탱하는 생명... ,"Mon, 20 Jul 2026 00:04:00 +0900"
2026-07-19 17:28:06,"[제7기 차세대CEO 아카데미 (8강)]&quot;AI 시대 전환기, 산업 흐름 정확히 읽...",https://www.ksilbo.co.kr/news/articleView.html?idxno=1062466,"또 AI 운영을 위한 인프라로 <b>반도체</b>, 에너지, 통신 산업이 있으며, 양자컴퓨팅은 이를 가속하는 역할을... <b>반도체</b> 분야에서는 파운드리의 TSMC-삼성, 메모리의 SK하이닉스-삼성의 경쟁 구도를 설명하며, 최근 구글이... ","Mon, 20 Jul 2026 00:04:00 +0900"
