DateTime,Title,Link,Description,PubDate
2025-07-27 09:26:49,[EBN 오늘(27일) 이슈 종합] '美 관세 폭탄' 대기업 비상경영…현지 생산...,https://www.ebn.co.kr/news/articleView.html?idxno=1672081,"기존의 <b>반도체</b> 수출 제한을 통한 중국 견제 전략에서 벗어나, 아예 AI 생태계에서 중국을 고립시키는 방향으로 전환하는 모양새다. 이에 따라 '소버린 AI'를 외치며 독자 노선을 강화하고 있는 한국의 대응이 시험대에... ","Sun, 27 Jul 2025 18:24:00 +0900"
2025-07-27 09:26:49,"경북도, ‘행복경제정책회의’ 개최…통상 현안·민생경제 대응 논의",http://www.metroseoul.co.kr/article/20250727500361,중소벤처기업진흥공단은 AI·<b>반도체</b> 등 초격차 창업기업에 대한 펀드 및 자금 지원과 함께 보호무역 피해를 반영한 정책자금 확대를 알렸다. 소상공인시장진흥공단은 연 매출 3억원 이하 소상공인을 대상으로 공과금·4대... ,"Sun, 27 Jul 2025 18:20:00 +0900"
2025-07-27 09:26:49,"[열린칼럼]대한민국 산업의 근간 제조업, 안녕하십니까",https://www.gnnews.co.kr/news/articleView.html?idxno=615051,"김용주 독자위원 챗GPT에게 물었더니 대한민국의 제조업은 '<b>반도체</b> 분야의 세계적인 기술력, 자동차 산업의 정밀하고 빠른 생산 시스템, 스마트팩토리 도입, 글로벌 수출 경쟁력, 정부의 R&amp;D 지원'이라는 장점이 있다고... ","Sun, 27 Jul 2025 18:20:00 +0900"
2025-07-27 09:26:49,"'칩 보조금' 지고 '전력, 데이터센터' 뜬다... 인텔 몰락과 美 정책 급변",https://n.news.naver.com/mnews/article/025/0003457934?sid=101,"미국 첨단 <b>반도체</b> 정책에 지각 변동이 일어나고 있다. 미국 정부는 ‘칩 제조’보다 ‘인프라 확보’에 방점을 찍은 AI 정책을 발표했고, 미국 기업 인텔은 첨단 <b>반도체</b> 파운드리(위탁생산) 경쟁을 사실상 포기했다.... ","Sun, 27 Jul 2025 18:19:00 +0900"
2025-07-27 09:26:49,[기획]트럼프 “미국 것 써라”…李대통령 ‘AI 주권’도 시험대,https://n.news.naver.com/mnews/article/029/0002971279?sid=105,"미국 내 AI규제 완화, 데이터센터·<b>반도체</b>·에너지 시설 인허가 간소화 등과 함께 미국 AI 기술의 수출을... 김형철 소프트웨어정책연구소장은 “국산 AI <b>반도체</b>의 경쟁력을 위해서라도 모델과 운영SW, 시스템SW의... ","Sun, 27 Jul 2025 18:17:00 +0900"
2025-07-27 09:26:49,'<b>반도체</b> 제어 장비 1위' 워트…&quot;中 공략 이어 대만 진출할 것&quot;,https://n.news.naver.com/mnews/article/015/0005163235?sid=101,워트는 <b>반도체</b>·디스플레이를 생산하는 데 필요한 초정밀 온·습도 제어장비(THC)를 판매하는 회사다. 워트는 <b>반도체</b> 원료인 웨이퍼에 회로를 그려 넣는 포토 공정에 쓰이는 THC 시장에서 국내 1위 업체다. 웨이퍼... ,"Sun, 27 Jul 2025 18:17:00 +0900"
2025-07-27 09:26:49,[주간증시전망] 대외 변수가 겹쳐 시장이 관망세 보일 가능성 높아,https://www.jjan.kr/article/20250727580253,수급적으로 보면 외국인투자자들은 <b>반도체</b> 대형주에 집중됐으나 관세협상 연기와 정책 불확실성이 시장... 특히 8월1일은 한미 간 관세 유예 시한이 종료되는 날로 자동차 및 <b>반도체</b> 관련 수출주를 중심으로 영향이 미칠... ,"Sun, 27 Jul 2025 18:16:00 +0900"
2025-07-27 09:26:49,"미국내 기술 이전, 현지 건조…‘조선 협력’ 막판 조커로 급부상",https://n.news.naver.com/mnews/article/028/0002758179?sid=101,중국에 이어 세계 시장 수주 점유율 2위를 차지하고 있는 국내 조선업은 양국 간 제조업 협력을 논의할 때 <b>반도체</b> 등과 함께 거론되는 핵심 산업이다. 중국을 견제하기 위한 해군력을 강화하기 위해선 미국 조선업을... ,"Sun, 27 Jul 2025 18:16:00 +0900"
2025-07-27 09:26:49,"中, 韓 포함 40개국에 'AI 협의체' 제안...美 'AI 우위'와 격돌 예고",https://www.ajunews.com/view/20250727145344679,"도널드 트럼프 대통령이 서명한 행정명령을 기반으로 한 이 계획은 △과도한 민간 규제 철폐 △AI 인프라 및 <b>반도체</b> 생산능력 증강 △AI 기술 수출통제 강화 등을 핵심으로 한다. 미국은 동맹국과의 AI 기술 협력, 표준... ","Sun, 27 Jul 2025 18:14:00 +0900"
2025-07-27 09:26:49,"&quot;돈 마른 대학, 경쟁력 추락 당연…고등교육재정법 제정이 살 길&quot;",https://n.news.naver.com/mnews/article/015/0005163225?sid=102,"부산대는 제조·기계, 경북대는 <b>반도체</b>, 충북대는 바이오·의료 등 각 대학이 지역 산업 특성에 맞춰 연계하면 해당 분야에서 충분한 경쟁력을 확보할 수 있습니다.” ▷대학 구조조정은 피할 수 없는 흐름입니다.... ","Sun, 27 Jul 2025 18:11:00 +0900"
2025-07-27 09:26:49,수시 합격생 '평균 2.4개' 대학 붙었다…교과 2.7개·학종 1.9개,https://n.news.naver.com/mnews/article/015/0005163222?sid=102,"상위권 대학의 경우 경영학과는 수시 모집 인원 대비 충원 인원이 700%, <b>반도체</b>학과 등은 990%에 달한 사례도 있었다. 임성호 종로학원 대표는 “추가 합격 인원이 많더라도 지원자군 자체가 내신 최상위권 학생들이... ","Sun, 27 Jul 2025 18:10:00 +0900"
2025-07-27 09:26:49,AI에 국가 명운 거는 美…한국은 어디쯤 있나[이태규의 워싱턴 인사이드...,https://n.news.naver.com/mnews/article/011/0004514034?sid=104,‘<b>반도체</b>법에 따른 보조금=예산 낭비’라고 주장하던 트럼프 대통령이었지만 의회를 통과한 감세안에 <b>반도체</b> 세액공제 비율이 당초 25%에서 35%로 올라가는 데도 사실상 동의했다. 이런 가운데 우리 정부는 미국과의... ,"Sun, 27 Jul 2025 18:10:00 +0900"
2025-07-27 09:26:49,"트럼프식 테크 압박, 소버린 AI 시작부터 시험대… &quot;자립 생태계 구축 속...",https://n.news.naver.com/mnews/article/469/0000878349?sid=105,"특히 우방국들에 서버와 <b>반도체</b> 등 미국 AI 인프라 전반을 도입하라는 'AI 풀스택 수출 패키지' 이행 압박이... 이주석 연세대 AI<b>반도체</b>학부 교수는 &quot;국내 기업들이 그래픽처리장치(GPU), 데이터센터 같은 핵심 인프라를... ","Sun, 27 Jul 2025 18:07:00 +0900"
2025-07-27 09:26:49,"[사설] 닷새 남은 한-미 관세협상, 노련하게 맞서야",https://n.news.naver.com/mnews/article/028/0002758177?sid=110,"이 극악의 조건 속에서 합의를 이뤄내려면, 지난 미-일 합의(22일) 때처럼 명백한 양보는 피하되, 우리가 강점을 갖는 <b>반도체</b>·조선 산업 등에 대한 투자 약속 등으로 승부를 볼 수밖에 없다. 이를 통해 큰 틀의 합의안을... ","Sun, 27 Jul 2025 18:06:00 +0900"
2025-07-27 09:26:49,“한국 제조업 비중 OECD 2위…관세 협상 결렬시 직격탄”,http://www.newstomato.com/ReadNews.aspx?no=1269767&inflow=N,한국은 <b>반도체</b>·디스플레이·이차전지 등 첨단 제조업뿐만 아니라 자동차·조선·철강 등 전통 제조업... 이에 따라 <b>반도체</b>·자동차·이차전지 등 주요 수출 품목에 고율의 관세가 부과되면 가격 경쟁력이 급격히... ,"Sun, 27 Jul 2025 18:06:00 +0900"
2025-07-27 09:26:49,[강현철의 뉴스 솎아내기] ‘피지컬 AI’ 압도적 강자 테슬라,https://n.news.naver.com/mnews/article/029/0002971275?sid=110,"테슬라는 나아가 AI <b>반도체</b> 분야에서도 두각을 나타내고 있다. ‘AI4’ 칩이 그 주인공이다. 테슬라가... 테슬라는 그동안 테슬라 컴퓨터(<b>반도체</b>)에 대해 HW라는 이름을 붙여 HW 1, 2, 3을 선보였다가 최근 들어 AI로... ","Sun, 27 Jul 2025 18:04:00 +0900"
2025-07-27 09:26:49,"[김화균 칼럼] 관세전쟁 해법, ‘한국판 엔비디아’가 답이다",https://n.news.naver.com/mnews/article/029/0002971274?sid=110,"<b>반도체</b> 패권은 엔비디아가 쥐고 있지만, 메모리 <b>반도체</b>의 80%는 삼성전자와 SK하이닉스가 공급한다. 엔비디아 칩처럼 ‘절대 패’는 아니지만, 트럼프로서는 ‘고려하지 않을 수 없는 패’는 분명하다. 조선도 마찬가지다.... ","Sun, 27 Jul 2025 18:03:00 +0900"
2025-07-27 09:26:49,올 수시 ‘안정지원’ 대세… &quot;상위권 합격점수 이변 적을듯&quot;,https://n.news.naver.com/mnews/article/014/0005382975?sid=102,"인문계열에서는 경영학과가 모집인원 대비 최대 700%의 충원율을 보였으며, 자연계열에서는 <b>반도체</b> 관련 학과 등 최상위권 학과에서 무려 990%에 달하는 충원율이 발생하기도 했다. 이는 한 학생이 여러 대학에 합격하며... ","Sun, 27 Jul 2025 18:03:00 +0900"
2025-07-27 09:26:49,"美-EU, 스코틀랜드 ‘관세 담판’…3차 미중협상도 앞둬",https://n.news.naver.com/mnews/article/011/0004514031?sid=104,"또 미국과 경제안보 측면에서 협력하고 에너지, 인공지능(AI) <b>반도체</b> 등 분야에서 미국산 구매를 늘릴... 최근 FT가 중국이 미국의 수출 금지 대상인 엔비디아의 최신형 AI <b>반도체</b> B200을 3개월간 최소 10억 달러(약 1조... ","Sun, 27 Jul 2025 18:03:00 +0900"
2025-07-27 09:26:49,"[기고] 공급망 전쟁 시대, 전략형 R&amp;D가 해법",https://n.news.naver.com/mnews/article/029/0002971273?sid=110,"캘리포니아주 마운틴 뷰에 설립된 ‘페어차일드 <b>반도체</b>’는 CIA의 스파이 위성에 정찰 장비를 납품했고, 아폴로 계획에 참여해 핵심 칩을 공급했다. 이 회사의 <b>반도체</b> 매출 중 80%가 펜타곤을 통한 정부 조달에서... ","Sun, 27 Jul 2025 18:02:00 +0900"
2025-07-27 09:26:49,M&amp;A로 진격하는 日 성장동력 못 찾는 韓,https://n.news.naver.com/mnews/article/009/0005531871?sid=101,"올해 일본 내 기업 주도 주요 M&amp;A로는 소프트뱅크그룹의 미국 <b>반도체</b> 설계 기업 암페어컴퓨팅 인수(65억달러), 할인마트 대기업 트라이얼홀딩스의 대형 슈퍼마켓 세이유 인수(25억달러), 메이지야스다생명보험의 미국... ","Sun, 27 Jul 2025 18:02:00 +0900"
2025-07-27 09:26:49,"美 25% 관세, 韓 제조업에 직격탄…GDP 손실도 명약관화",https://www.ajunews.com/view/20250727150750686,"정부, 관세 협상 막판 총력전…타결 가능성 낮아 자동차·<b>반도체</b> 등 주요 산업 수출 악영향 전망 아주경제... 자동차부터 <b>반도체</b> 등 주요 수출 품목에 25%의 관세가 부과된다면 이는 가격경쟁력 하락으로 이어진다.... ","Sun, 27 Jul 2025 18:02:00 +0900"
2025-07-27 09:26:49,"&quot;철강도시 포항, 뿌리 깊은 연대로 위기 넘어서야&quot;",http://www.hidomin.com/news/articleView.html?idxno=587672,"이미 자동차, <b>반도체</b>, 조선산업 등 국가기간산업에 대한 별도 특별법이 만들어져 보호와 지원을 받고 있지만 철강산업은 체계적인 지원이 되지 않고 있어 정부 차원의 지원법이 절실히 요구되고 있는 현실입니다. 이제... ","Sun, 27 Jul 2025 18:02:00 +0900"
2025-07-27 09:26:49,한미 통상협상 막판 총력전…투자보따리 압박 속 '조선' 게임 체인저 되...,https://www.ajunews.com/view/20250727150521685,이와 함께 우리 정부는 조선·<b>반도체</b>·배터리 등 '제조업 분야 협력 강화' 카드를 제시하며 전략 산업과의 연계 협력안도 병행 추진 중이다. 김정관 장관은 &quot;우리 기업들이 경쟁국 대비 불리한 대우를 받지 않도록 총력을... ,"Sun, 27 Jul 2025 18:02:00 +0900"
2025-07-27 09:26:49,벼랑 끝 협상…'수출 한국' 운명의 4일,https://n.news.naver.com/mnews/article/015/0005163209?sid=101,"정부는 미국이 ‘자국 제조업 부활’을 관세 전쟁 목표로 삼은 만큼 조선업과 <b>반도체</b>를 포함한 한·미... 최악 관세 피하려면…&quot;<b>반도체</b>·조선 지렛대, 美제조업 부활 기여 강조&quot; 막판까지 몰린 관세 협상 스콧 베선트... ","Sun, 27 Jul 2025 18:01:00 +0900"
2025-07-27 09:26:49,"최악 관세 피하려면…&quot;<b>반도체</b>·조선 지렛대, 美제조업 부활 기여 강조&quot;",https://n.news.naver.com/mnews/article/015/0005163208?sid=101,"분야가 <b>반도체</b>·배터리·전기차·조선 등 한국이 강점을 갖고 있는 업종이라는 점을 알 수 있다”며... 현대화, <b>반도체</b> 제조 및 연구, 배터리·전자에 필요한 희소 광물 설비투자 등을 꼽고 있다. 최병일 태평양 국제통상... ","Sun, 27 Jul 2025 18:01:00 +0900"
2025-07-27 09:26:49,"일본 &quot;대미 투자액 중 출자 1~2%, 수익 90% 줘도 손해 미미&quot;",https://n.news.naver.com/mnews/article/469/0000878345?sid=104,"하워드 러트닉 미 상무장관은 지난 23일(현지시간) 블룸버그TV 인터뷰에서 &quot;1,000억 달러(약 138조 원) 규모의 <b>반도체</b> 공장을 짓자고 하면 일본이 전체를 부담하고 이익의 90%는 미국에 온다&quot;고 말했다. 마치 일본이 막대한... ","Sun, 27 Jul 2025 18:01:00 +0900"
2025-07-27 09:26:49,"[여의대로] +82와 개굴개굴, 그리고 4.5",https://www.asiatoday.co.kr/view.php?key=20250727010015406,엔비디아가 세계 <b>반도체</b>시장을 좌지우지하고 있고 미국 테슬라와 중국 BYD 등 전기차들이 전 세계 시장을 장악하고 있다. 국민 기업 삼성전자와 그 뒤를 잇는 SK하이닉스가 주문생산자로 전락할 가능성도 크다. 중국산 저가... ,"Sun, 27 Jul 2025 17:58:00 +0900"
2025-07-27 09:26:49,충북 6월 수출 성장률 전국 1위,https://www.cctoday.co.kr/news/articleView.html?idxno=2216289,"<b>반도체</b> 호조 효과… 29.8% 껑충뛰어 전체 제조업 기업심리지수까지 개선 [충청투데이 ] 6월 충북 수출이... 2025년 상반기 수출을 품목별로 살펴보면, <b>반도체</b> 수출이 전년동기대비 82.2% 증가하면서 지역 수출을... ","Sun, 27 Jul 2025 17:58:00 +0900"
2025-07-27 09:26:49,신성장동력 수혈 못받는 韓 … 日은 M&amp;A로 기업체질 확 바꿔,https://n.news.naver.com/mnews/article/009/0005531837?sid=101,미국 <b>반도체</b> 설계사 암페어컴퓨팅을 약 65억달러를 들여 인수한다고 밝혔다. 암페어컴퓨팅은 Arm 기반 데이터센터 중앙처리장치(CPU)를 설계하고 있어 향후 차세대 인공지능(AI) 인프라스트럭처의 주도권을 차지하기... ,"Sun, 27 Jul 2025 17:56:00 +0900"
2025-07-27 09:26:49,"상하이 증시, 中 제조업 PMI 공개…무역협상도 관심",https://n.news.naver.com/mnews/article/015/0005163201?sid=101,최근 양국이 희토류 수출 재개와 <b>반도체</b> 규제 완화 등으로 화해 분위기를 보이는 데다 무역 협상을 재개하기 때문이다. 중국과 미국은 28~29일(현지시간) 스웨덴 스톡홀름에서 3차 고위급 무역 협상을 한다. 양국은 지난... ,"Sun, 27 Jul 2025 17:55:00 +0900"
2025-07-27 09:26:49,외국인 입맛 변했나…車·조선·바이오 집중매수,https://n.news.naver.com/mnews/article/015/0005163199?sid=101,"<b>반도체</b>주만 집중 매수하던 패턴에서 벗어나 자동차, 조선, 바이오, 방위산업 등으로 매수 범위를 넓히는... <b>반도체</b> 투톱에 사실상 ‘올인’했던 것이다. 하지만 최근엔 <b>반도체</b> 편식에서 벗어나 다양한 종목으로... ","Sun, 27 Jul 2025 17:54:00 +0900"
2025-07-27 09:26:49,"리창 “AI, 특정국가 전유물 돼선 안돼”…美겨냥 ‘세계AI협력기구’ ...",https://n.news.naver.com/mnews/article/011/0004514002?sid=104,중국을 상대로 AI 기술과 고성능 <b>반도체</b> 수출을 통제하는 미국을 겨냥하는 동시에 국제사회에 ‘포용의 중국’을 내세우려는 의도로 읽힌다. 리창 중국 국무원 총리는 26일 중국 상하이 엑스포센터에서 열린 2025... ,"Sun, 27 Jul 2025 17:51:00 +0900"
2025-07-27 09:26:49,[만파식적] 인텔의 구조조정,https://n.news.naver.com/mnews/article/011/0004514000?sid=110,1968년 7월 로버트 노이스와 고든 무어는 기존의 직장인 페어차일드<b>반도체</b>를 떠나 새 회사를 차렸다.... 무어는 <b>반도체</b> 집적회로 성능이 2년마다 2배 증가한다는 ‘무어의 법칙’을 만든 것으로 유명하다. 인텔은... ,"Sun, 27 Jul 2025 17:50:00 +0900"
2025-07-27 09:26:49,촘촘한 로봇 생태계 구축…화웨이엔 “기술력 엔비디아급” 호평 [中 휴...,https://n.news.naver.com/mnews/article/011/0004513995?sid=104,최근 중국을 찾은 젠슨 황 엔비디아 최고경영자(CEO)도 “엔비디아의 부재에도 중국 본토의 혁신 기업들이나 화웨이와 같은 <b>반도체</b> 업체들이 시장 수요를 충족할 수 있을 것”이라며 화웨이의 기술력을 공개적으로... ,"Sun, 27 Jul 2025 17:48:00 +0900"
2025-07-27 09:26:49,중국도 글로벌 AI 행동계획 발표…트럼프에 맞불,https://n.news.naver.com/mnews/article/018/0006074906?sid=101,"아울러 미국은 중국에 대한 AI <b>반도체</b> 수출 통제, 기술이전 차단 등 대중 견제 강도를 높이고 있다. 이에 중국은 독자 AI <b>반도체</b>·대형언어모델(LLM) 개발 투자를 가속화하고 있다. 전문가들은 “양국이 각각 다자협력... ","Sun, 27 Jul 2025 17:48:00 +0900"
2025-07-27 09:26:49,"[단독]방산 레버리지 ETF, 3분기 내 첫선",https://n.news.naver.com/mnews/article/011/0004513996?sid=101,<b>반도체</b>·2차전지·조선에 이은 국내 테마형 레버리지 ETF가 될 것으로 전망된다. ★관련 기사 18면 27일 금융투자 업계에 따르면 국내 ETF 업계 1위 삼성자산운용은 올 9월을 목표로 방산 레버리지 ETF 출시를 준비하고... ,"Sun, 27 Jul 2025 17:48:00 +0900"
2025-07-27 09:26:49,하청업체 수천 곳 '파업면죄부' 받나,https://n.news.naver.com/mnews/article/011/0004513994?sid=101,한국경영자총협회를 필두로 경제 8단체는 노조법이 지금대로 바뀌면 미국과 전략적 협업이 구체화하는 조선업은 물론 주력 산업인 자동차와 <b>반도체</b>·철강 등 제조 현장에서 파업이 확산하며 공급망이 붕괴될 수 있다며... ,"Sun, 27 Jul 2025 17:47:00 +0900"
2025-07-27 09:26:49,HBM 세계 1등 꿈 이루려 구성원 똘똘 뭉쳤죠,https://n.news.naver.com/mnews/article/009/0005531818?sid=101,SK하이닉스 전직 임원들 '신뢰 게임' 책 출간 화제 SK <b>반도체</b> '톱팀' 출신 3인방 하이닉스 성공 비결 직접... 현 전 부사장은 &quot;20여 명으로 구성된 톱팀은 <b>반도체</b>를 만드는 각 부문의 수장들&quot;이라면서 &quot;SK하이닉스에는... ,"Sun, 27 Jul 2025 17:42:00 +0900"
2025-07-27 09:26:49,&quot;전북에 투자하면 원전-철탑 불필요&quot;,http://sjbnews.com/news/news.php?number=856109,앞서 정부는 전북과 전남에서 생산한 재생에너지를 경기도 용인 <b>반도체</b> 클러스터 등 수도권 산업단지에 공급하겠다며 호남과 충청권 곳곳에 초고압 철탑을 세우겠다고 나서 거센 항의를 받고 있다. 현재 전북과 충남... ,"Sun, 27 Jul 2025 17:42:00 +0900"
2025-07-27 09:26:49,&quot;AI·<b>반도체</b> 100조 투자&quot; 産銀펀드 국정과제 선정,https://n.news.naver.com/mnews/article/009/0005531805?sid=101,"이 재원은 AI 등 첨단산업 인프라스트럭처, <b>반도체</b> 설비 직접투자, 바이오 등 초장기 기술투자펀드를 지원하는 데 투입된다. 한편 금융위는 부동산에 쏠린 시중 자금을 첨단산업 등 생산적인 분야로 끌어오는 정책에... ","Sun, 27 Jul 2025 17:40:00 +0900"
2025-07-27 09:26:49,한미 관세 협상 막판 총력전…조선 산업 협력 카드로 막판 총력전,https://www.dkilbo.com/news/articleView.html?idxno=507087,"이에 한국 정부는 조선·<b>반도체</b>·배터리 등 전략 산업 전반의 협력 패키지를 제안하며, 미국이 중시하는 제조업 부흥 기조에 발맞춘 '제조 동맹' 이미지 구축에 집중하고 있다. 대통령실은 &quot;조선 분야에서 미국 측의 높은... ","Sun, 27 Jul 2025 17:40:00 +0900"
2025-07-27 09:26:49,“초격차 지킬 시간이 없다...K<b>반도체</b>에 300mm 공공팹 단비를”,https://n.news.naver.com/mnews/article/009/0005531803?sid=105,첨단 <b>반도체</b> 제조역량을 자국 내에 확보하려는 움직임이 매우 뚜렷합니다. <b>반도체</b>는 단순한 부품이 아니라 국가 안보와 직결된 전략자산이기 때문입니다.” <b>반도체</b> 분야 세계적 석학인 윤의준 한국공학한림원 회장... ,"Sun, 27 Jul 2025 17:38:00 +0900"
2025-07-27 09:26:49,"美 관세협상 ‘운명의 주’…美 소고기·쌀 압력, ’조선업 협력’으로...",https://n.news.naver.com/mnews/article/025/0003457920?sid=100,여기에 더해 미국이 자국 제조업 부흥을 목표로 한 만큼 한국은 <b>반도체</b>·배터리 등 전략 산업 투자 등을 포함한 산업 협력 패키지도 미국 측에 제시하고 있다. 대통령실은 협상 시한 하루 전날인 오는 31일 한·미 재무·외교... ,"Sun, 27 Jul 2025 17:11:00 +0900"
2025-07-27 09:26:49,미국 상호관세 발효 임박···제조업 OECD 2위 韓 타격 우려,https://www.sisajournal-e.com/news/articleView.html?idxno=413786,"국회예산정책처는 &quot;한국은 <b>반도체</b>, 디스플레이, 이차전지 등 첨단 제조업과 자동차, 조선, 철강 등 전통... <b>반도체</b>, 자동차, 이차전지 등 주요 품목의 가격 경쟁력 약화는 수출 감소로 이어지고, 이는 제조업 생산... ","Sun, 27 Jul 2025 17:06:00 +0900"
2025-07-27 09:26:49,목표가 올렸다가 3주도 안 돼 하향…씨티의 ‘오락가락’ SK하닉 전망,https://n.news.naver.com/mnews/article/011/0004513972?sid=101,"HBM 공급 과잉을 우려한 골드만삭스의 전망과 달리, BofA는 신규 그래픽처리장치(GPU)와 주문형<b>반도체</b>(ASIC) 출시로 공급 부족 현상이 오히려 지속될 수 있다고 봤다. 국내 한 증권업계 관계자는 “시장 예측은 바뀔 수... ","Sun, 27 Jul 2025 17:04:00 +0900"
2025-07-27 09:26:49,"경북도, 새 정부 기조에 맞게 지역경제 정책 대응 방안 논의",https://www.tournews21.com/news/articleView.html?idxno=110311,"중소벤처기업진흥공단은 정부의 인공지능, <b>반도체</b> 산업 집중지원 정책에 따라 관련 분야의 초격차 창업기업 지원을 위한 사업화 자금 및 'AI 딥테크 펀드 조성', 지역경제 활성화를 위한'지역주도형 AI 대전환'사업을... ","Sun, 27 Jul 2025 17:02:00 +0900"
2025-07-27 09:26:49,"코스피, 3200 문턱에서 주춤…관세·세법 불확실성에 투자심리 ‘경직’",https://www.asiatoday.co.kr/view.php?key=20250727010015545,"이날 LX세미콘(-8.17%), 에스엘(-3.53%), 서연이화(-1.42%) 등 <b>반도체</b> 및 자동차 부품주에서 일부 하락세가 두드러졌고, 포스코퓨처엠(-1.07%), SFA<b>반도체</b>(-1.13%) 등 2차전지 소재와 <b>반도체</b> 장비주도 약세를 보였다. 관세 협상... ","Sun, 27 Jul 2025 17:00:00 +0900"
2025-07-27 09:26:49,"'중립' 한마디에 주가 급락…외국계 증권사 보고서, 이대로 괜찮나 [김...",https://n.news.naver.com/mnews/article/586/0000108208?sid=101,당시는 삼성전자가 <b>반도체</b> 사업에 뛰어든 이후 최대 호황을 구가하던 시기였다. 13만원대였던 삼성전자 주가는 메릴린치가 <b>반도체</b> 공급 과잉을 우려하는 보고서를 발표한 뒤 8만원대로 추락했다. 그러나 다음 해... ,"Sun, 27 Jul 2025 17:00:00 +0900"
2025-07-27 09:26:49,관세 협상 막판 타결 가능성 남아...&quot;실패 땐 GDP 최대 0.4%↓&quot;,https://n.news.naver.com/mnews/article/052/0002225237?sid=101,"[김용범 / 대통령실 정책실장(25일) : 양측은 조선, <b>반도체</b>를 비롯한 전략 제조업 분야에서 상호 협력의 중요성을 재차 확인하고, 앞으로 그 협력 방안을 구체화하기로 했으며 8월 1일 이전 상호 호혜적 타결방안 도출에... ","Sun, 27 Jul 2025 16:58:00 +0900"
