DateTime,Title,Link,Description,PubDate
2025-11-13 17:49:53,"SK스퀘어, 3분기 영업이익 2.6조로 창사 이래 최대 실적",https://www.tokenpost.kr/news/economy/303603,이번 실적은 자회사인 SK하이닉스의 <b>반도체</b> 업황 반등에 따른 실적 개선과 주요 포트폴리오 기업들의 손익 구조 개선이 복합적으로 작용한 결과다. <b>반도체</b> 산업이 글로벌 기술 패권 경쟁 속에서 중요성이 커지며... ,"Fri, 14 Nov 2025 02:40:00 +0900"
2025-11-13 17:49:53,코투 헤지펀드 &quot;AI 시장 수조 달러 규모...비기술 섹터가 새 기회&quot;,https://www.g-enews.com/view.php?ud=202511131643046765fbbec65dfb_1,"평가하며, <b>반도체</b>와 클라우드를 넘어 모기지·트럭운송·농업 등 비기술 분야의 AI 활용 기업으로 투자를... 대만<b>반도체</b>(TSMC), 메타 플랫폼스가 포함됐다. GPU·전력 부족 지속...&quot;AI 사이클은 아직 초기&quot; 랑왈라 CIO는 &quot;가장... ","Fri, 14 Nov 2025 02:36:00 +0900"
2025-11-13 17:49:53,"뉴욕 증시, 셧다운 해제됐지만 금리 인하 기대감 내려가며 동반 하락 출...",https://n.news.naver.com/mnews/article/052/0002272929?sid=104,"인공지능과 <b>반도체</b> 관련 주가 고점이라는 'AI 거품론'이 시장을 맴돌면서 필라델피아 <b>반도체</b> 지수는 1% 넘게, 엔비디아와 브로드컴, TSMC도 2% 넘게 하락 중입니다. 엔터테인먼트 제국 월트디즈니가 3분기에 엇갈린 실적... ","Fri, 14 Nov 2025 02:23:00 +0900"
2025-11-13 17:49:53,&quot;미·중 무역 전쟁에 다국적 기업 무방비 노출&quot;...美 명문대 교수 8대 위...,https://www.g-enews.com/view.php?ud=202511131640588878fbbec65dfb_1,"중국은 <b>반도체</b>와 전기차 배터리 제조에 핵심인 희토류 수출도 통제하고 있다. 브랜즈 교수는 &quot;탈냉전 시대... 우크라이나 전쟁이 식량·에너지 시장을 뒤흔들었고, 대만을 둘러싼 긴장이 글로벌 <b>반도체</b> 공급망을 재편하고... ","Fri, 14 Nov 2025 02:16:00 +0900"
2025-11-13 17:49:53,"[투데이 窓]대미 투자, 스타트업 '전략적 투자금' 돼야",https://n.news.naver.com/mnews/article/008/0005277997?sid=110,"현재 이 막대한 자본투입은 주로 <b>반도체</b>, 배터리, 자동차 같은 첨단 제조업 분야 대기업 중심의 현지 생산시설 및 공급망 안정화에 집중된다. 대미투자의 일부를 스타트업의 글로벌 스케일업을 확보하는 전략으로 활용할... ","Fri, 14 Nov 2025 02:05:00 +0900"
2025-11-13 17:49:53,"&quot;AI로 진화하는 60년 물관리 경험&quot; 수자원공사, 'AI 물관리 세계 1위' 비...",https://www.cstimes.com/news/articleView.html?idxno=677795,안전과 미래 경쟁력으로 바꾸는 도전&quot;이라며 &quot;AI 기반 물관리로 <b>반도체</b> 등 국가 전략산업을 지원하고 2030년까지 AI 물관리 분야 세계 1위 기업으로 도약해 대한민국이 AI 3대 강국으로 나아가는 데 기여하겠다&quot;고 말했다.,"Fri, 14 Nov 2025 01:24:00 +0900"
2025-11-13 17:49:53,"인천대, 조지아 쿠타이시 국제대학과 '글로벌 산학협력' 강화",https://www.cstimes.com/news/articleView.html?idxno=677838,이번 교류는 인천대학교 산학협력단과 CBA파트너스(대표 이웅천)의 협력을 통해 추진됐으며 <b>반도체</b>·스마트시티·인공지능·첨단소재 등 첨단 산업분야의 공동연구 및 기술교류 기반을 마련하는 것을 목표로... ,"Fri, 14 Nov 2025 01:24:00 +0900"
2025-11-13 17:49:53,"소프트뱅크, 엔비디아 지분 전량 매각",https://www.radiokorea.com/news/article.php?uid=486585,소프트뱅크가 <b>반도체</b> 기업 엔비디아(Nvidia)의 보유 지분 전량을 58억 3천만 달러(약 7조 6천억 원)에 매각했다고 오늘(11월11일) 발표했다. 이는 일본의 거대 기술 투자 기업인 소프트뱅크가 챗GPT 개발사 OpenAI에... ,"Fri, 14 Nov 2025 01:20:00 +0900"
2025-11-13 17:49:53,"뉴욕증시, 셧다운 해제에 오히려 투매…하락 출발",https://n.news.naver.com/mnews/article/001/0015741568?sid=101,"AI 및 <b>반도체</b> 관련주가 고점이라는 분석이 이어지면서 필라델피아 <b>반도체</b>지수는 1% 넘게 떨어지고 있고 엔비디아와 브로드컴, TSMC도 2% 넘게 하락 중이다. 최근 기술주와 달리 견고하게 올랐던 우량주도 이날은... ","Fri, 14 Nov 2025 01:17:00 +0900"
2025-11-13 17:49:53,ETF 이제라도 시작해볼까 / 국민 재테크 수단 된 ETF,http://topclass.chosun.com/news/articleView.html?idxno=35505,"투자 관점에서는 AI 구동에 필수적인 <b>반도체</b>, 급증하는 전력 수요를 감당할 전력 인프라, 그리고 소프트웨어 및 로봇 등 AI 밸류체인 전반에 대한 투자가 유망하다. 도널드 트럼프 2기 행정부의 자국 제조업 부흥... ","Fri, 14 Nov 2025 01:02:00 +0900"
2025-11-13 17:49:53,에쓰오일 CEO ‘금탑산업훈장’,https://n.news.naver.com/mnews/article/023/0003940875?sid=101,은탑산업훈장은 실리콘카바이드(SiC) <b>반도체</b> 국내 양산을 이끈 온세미컨덕터코리아 노성 전무에게 수여됐다. 이날 행사에선 이들을 포함해 총 40명이 정부 포상을 받았다.,"Fri, 14 Nov 2025 00:52:00 +0900"
2025-11-13 17:49:53,"삼성·LG, 벤츠와 미래車 손잡기 ‘경쟁’",https://n.news.naver.com/mnews/article/005/0001814421?sid=101,"삼성은 <b>반도체</b>와 디스플레이 등 기존 파트너십 강화와 동시에 차세대 전기차용 배터리, 자율주행 등 미래 모빌리티 분야 공조 범위가 확대할 것으로 기대하고 있다.","Fri, 14 Nov 2025 00:49:00 +0900"
2025-11-13 17:49:53,"이재용, 벤츠 회장과 만찬 회동…&quot;삼성SDI·하만 협력 방안 논의&quot;",https://www.apnews.kr/news/articleView.html?idxno=3042308,"<b>반도체</b>, 디스플레이, 전장 등 기존 파트너십을 강화하는 동시에 차세대 전기차용 배터리, 자율주행 등 미래 모빌리티 분야의 공조 범위를 확대할 것이란 기대다. 13일 삼성전자에 따르면, 이재용 회장은 서울 한남동... ","Fri, 14 Nov 2025 00:42:00 +0900"
2025-11-13 17:49:53,"FT &quot;넥스페리아 차량용 칩 공급난 지속… 유럽車 업계, 몇 주내 생산 중...",https://www.newspim.com/news/view/20251114000001,"장일현 특파원 = 차량용 <b>반도체</b> 칩 생산업체인 넥스페리아의 경영권 분쟁이 촉발한 네덜란드와 중국 간... 넥스페리아는 지난 2017년 옛 '필립스 <b>반도체</b>'의 후신인 NXP에서 분사한 뒤, 이듬해 중국 국유펀드 컨소시엄에... ","Fri, 14 Nov 2025 00:41:00 +0900"
2025-11-13 17:49:53,[강광우의 혁신창업의 길] 엔비디아 GPU보다 5배 빠른 LPU로 150조원 시장...,https://n.news.naver.com/mnews/article/025/0003482579?sid=110,"GPU의 약점을 보완한 인공지능(AI) <b>반도체</b> 개발에 도전하는 스타트업이 속속 등장하면서다. 마이크로소프트(MS) <b>반도체</b> 엔지니어, KAIST 교수에서 창업가로 변신한 김주영 대표가 이끄는 하이퍼엑셀이 대표적인... ","Fri, 14 Nov 2025 00:25:00 +0900"
2025-11-13 17:49:53,"“민생 안정·경제위기 극복 최우선”… 경북도, 내년 예산 14조363억원...",https://n.news.naver.com/mnews/article/005/0001814395?sid=102,"또 수소연료전지 산업클러스터, 첨단 제조혁신 테스트베드, <b>반도체</b> 소재부품 시험평가센터 구축 등 미래 성장동력 확보 예산도 마련했다. 초대형 산불피해 특별법을 뒷받침하기 위한 사업과 디지털 농업·스마트팜... ","Fri, 14 Nov 2025 00:22:00 +0900"
2025-11-13 17:49:53,"벤츠 회장, 삼성ㆍLGㆍHS효성 연쇄 회동…승지원서 이재용과 만찬",https://www.dnews.co.kr/uhtml/view.jsp?idxno=202511140001217940764,"배터리ㆍ<b>반도체</b>ㆍ디스플레이 총망라…미래 모빌리티 논의 올라 칼레니우스 메르세데스-벤츠 그룹 회장이 13일 서울에서 이재용 삼성전자 회장, 조현상 HS효성 부회장, LG그룹 주요 계열사 최고경영자(CEO) 등과 잇따라... ","Fri, 14 Nov 2025 00:22:00 +0900"
2025-11-13 17:49:53,"이상일 시장, 수지구 공동주택 입주자대표들과 소통의 시간 가져",https://www.thereport.co.kr/news/articleView.html?idxno=74216,"이 시장은 &quot;영동고속도로 동백IC 신설과 관련해 지난해 정부 승인을 받은 데 이어 최근에는 세종포천고속도로 동용인IC 신설 승인도 받았고, <b>반도체</b>고속도로 건설 민자적격성 조사 통과도 이뤄지는 등 시가 중점적으로... ","Fri, 14 Nov 2025 00:20:00 +0900"
2025-11-13 17:49:53,"의료기기 관련주, '웃음' 로킷헬스케어·엘앤케이바이오·더블유에스아...",http://www.finomy.com/news/articleView.html?idxno=242974,이번 협약을 통해 양사는 자율주행로봇(AMR) 기반 모바일 매니퓰레이션 로봇과 <b>반도체</b> 이송로봇 분야에서 기술 협력을 강화할 계획이다. 티로보틱스는 이번 제휴를 통해 유아이봇이 보유한 중국 내 <b>반도체</b> 기업... ,"Fri, 14 Nov 2025 00:16:00 +0900"
2025-11-13 17:49:53,"허영 수석, 김진태 지사에 “강원도정과 민생 위해 책임진 게 뭐가 있나...",https://n.news.naver.com/mnews/article/087/0001154699?sid=100,"미래 먹거리인 <b>반도체</b>와 AI 역시 입법적으로 충실히 뒷받침해져야 하는 상황&quot;이라고 했다. 그러면서 &quot;당에서 21대 대선 공통 공약을 분석한 결과, 74건 정도의 공통 공약이 정리돼 있다. 이외에도 스토킹범죄처벌법... ","Fri, 14 Nov 2025 00:11:00 +0900"
2025-11-13 17:49:53,세금만 축낸다고?… ‘쓸모없음’이 세상을 바꿨다,https://n.news.naver.com/mnews/article/005/0001814392?sid=103,"“원자의 구조를 이해하려는 보어의 호기심이 현대 <b>반도체</b> 산업을 낳았고, 시공간을 통합한 아인슈타인의 상대성이론이 GPS 기술을 일상생활에 쓸 수 있게 했다.” ⊙ 세·줄·평 ★ ★ ★ ·20세기 이후 과학의 역사는 곧... ","Fri, 14 Nov 2025 00:11:00 +0900"
2025-11-13 17:49:53,"2차전지 관련주, '어깨춤 으쓱으쓱' KG케미칼·엘앤에프·후성·유일에너...",http://www.finomy.com/news/articleView.html?idxno=242972,"13일 한국거래소에 따르면 한울<b>반도체</b>, KG케미칼, 엘앤에프, 후성, 유일에너테크, 자비스, 강원에너지, 에코프로는 상승했다. 한울<b>반도체</b>와 KG케미칼은 전 거래일 대비 각각 262원, 480원 오른 2200원과 5640원에 거래를... ","Fri, 14 Nov 2025 00:10:00 +0900"
2025-11-13 17:49:53,이 대통령 '지방 우대' 힘 싣는 민주당…균형성장특위 출범,https://n.news.naver.com/mnews/article/654/0000151426?sid=100,김태년 위원장은 &quot;수도권 과밀을 해소하고 대학·산업·지자체가 함께 성장하는 정주형 지역사회를 만들며 AI·첨단바이오·<b>반도체</b> 등 미래산업이 전국으로 뻗어가는 혁신 생태계를 조성하겠다&quot;며 &quot;수도권에 집중된 산업... ,"Fri, 14 Nov 2025 00:09:00 +0900"
2025-11-13 17:49:53,공공기관 2차 이전 로드맵 내년 상반기 나온다…지방선거 ‘태풍의 눈’,https://n.news.naver.com/mnews/article/087/0001154667?sid=100,"하지만 <b>반도체</b>·바이오·수소·미래차·K-연어·방위·기후테크 등 7대 전략산업과의 정합성, 고용규모, 정부 정책환경 변화 등을 고려해 일부 기관은 추가, 제외하는 작업을 거쳤다. 이에 따라 33개 기관을 유치 대상으로... ","Fri, 14 Nov 2025 00:09:00 +0900"
2025-11-13 17:49:53,[사설] 고리 2호기 “계속운전”…‘제2의 탈원전’ 불안도 잠재워야,https://n.news.naver.com/mnews/article/011/0004555685?sid=110,"정부가 100조 원을 쏟아붓겠다는 AI 분야와 <b>반도체</b> 등 첨단산업, 자동차·철강 등 주력 산업의 경쟁력 제고는 원전 육성 없이는 불가능하다. 원전 가동 연한을 합리적으로 연장할 수 있도록 계속운전 제도를 개선하고... ","Fri, 14 Nov 2025 00:08:00 +0900"
2025-11-13 17:49:53,[사설] ‘빚투’로 가계대출 리스크 커지는데 “문제 없다”는 금융위,https://n.news.naver.com/mnews/article/011/0004555684?sid=110,"미국 증시에서 강세장을 견인하는 인공지능(AI), <b>반도체</b>에 대한 ‘거품론’이 제기되는 것도 불안 요인이다. 금융 시스템 불안 수준을 나타내는 금융취약성지수도 3분기 기준 32.9로 전 분기 대비 1포인트 올랐다. 이처럼... ","Fri, 14 Nov 2025 00:06:00 +0900"
2025-11-13 17:49:53,"전력저장장치(ESS) 관련주, '봄꽃만개' 유니테크노·SK이터닉스·유일에...",http://www.finomy.com/news/articleView.html?idxno=242962,"신성이엔지는 <b>반도체</b>, 디스플레이, 이차전지 산업 등 고정밀 제조환경에 필수적인 클린룸, 드라이룸 등을... 알에스오토메이션은 로봇 모션 제어와 에너지 제어 장치를 주력으로 하는 기업으로, <b>반도체</b>·디스플레이... ","Fri, 14 Nov 2025 00:06:00 +0900"
2025-11-13 17:49:53,"한국수자원공사, AI 중심의 물관리 비전 선포",http://www.globalepic.co.kr/view.php?ud=2025111316353679465f69d33b22_29,"미래 경쟁력으로 바꾸는 도전”이라며, “AI 기반 물관리로 <b>반도체</b> 등 국가 전략산업을 지원하고, 2030년까지 AI 물관리 분야 세계 1위 기업으로 도약해 대한민국이 AI 3대 강국으로 나아가는 데 기여하겠다”고 밝혔다.","Fri, 14 Nov 2025 00:04:00 +0900"
2025-11-13 17:49:53,"[조원경의 돈의 세계] 초단기 미국 채권, 시장의 발작",https://n.news.naver.com/mnews/article/025/0003482569?sid=110,<b>반도체</b> 업황이 구조적 상승 국면이라 주식 시장의 급락은 제한적으로 예상된다. 금융시장은 언제나 유동성의 심장박동에 반응한다. 우리는 ‘돈의 방향’이 바뀌는 순간을 시시각각 목격한다. 중요한 질문이 있다.... ,"Fri, 14 Nov 2025 00:04:00 +0900"
2025-11-13 17:49:53,"이상일 용인특례시장, 수지구 공동주택 입주자대표들과 소통의 시간 가...",http://www.globalepic.co.kr/view.php?ud=2025111316000276665f69d33b22_29,"이 시장은 “영동고속도로 동백IC 신설과 관련해 지난해 정부 승인을 받은 데 이어 최근에는 세종포천고속도로 동용인IC 신설 승인도 받았고, <b>반도체</b>고속도로 건설 민자적격성 조사 통과도 이뤄지는 등 시가 중점적으로... ","Fri, 14 Nov 2025 00:04:00 +0900"
2025-11-13 17:49:53,[기고] ‘치맥 회동’은 단순히 친목을 위한 자리였을까?,https://www.joongdo.co.kr/web/view.php?key=20251114010003856,"이들의 만남을 관통하는 키워드는 결국 'AI <b>반도체</b> 모빌리티'다. 엔비디아는 AI의 두뇌를 설계하는 기업으로... 지금까지 <b>반도체</b>, 디스플레이, 자동차 산업은 정밀한 하드웨어와 숙련된 인력으로 세계 시장을 지배해... ","Fri, 14 Nov 2025 00:02:00 +0900"
2025-11-13 17:49:53,[사설] 원화값 급락… 생산성 제고할 구조개혁 시급,https://www.asiatoday.co.kr/view.php?key=20251113010007156,최근 <b>반도체</b> 슈퍼사이클 도래로 외환보유고가 견조하게 늘어나는 데도 이런 현상이 나타나고 있다. 이는 우리 경제에 대한 강력한 경고 신호다. <b>반도체</b> 호경기가 끝나고 나면 이를 대신한 대안이 없다는 데 대해 해외... ,"Fri, 14 Nov 2025 00:02:00 +0900"
2025-11-13 17:49:53,지산학 손잡고 '울산형 AI 생태계' 구축,https://www.ksilbo.co.kr/news/articleView.html?idxno=1041670,AI<b>반도체</b> 기반 AI산업 육성 협력 MOU를 체결하고 기념촬영을 하고 있다. 김도현기자 do@ksilbo.co.kr울산시가 인공지능(AI) 산업 경쟁력 강화를 위해 국내 AI<b>반도체</b> 기업과 지역 대학들과의 협력체계를 본격 가동한다. 시는... ,"Fri, 14 Nov 2025 00:02:00 +0900"
2025-11-13 17:49:53,"“미래 전장 주도권 함께 키우자” 삼성·LG, 벤츠 만났다",https://n.news.naver.com/mnews/article/025/0003482556?sid=101,"삼성과 벤츠는 현재 하만을 중심으로 차량용 인포테인먼트(MBUX), 오디오, 디지털키 등 전장과 <b>반도체</b>·디스플레이 등의 분야에서 협력하고 있다. 다만 전기차 배터리(삼성SDI)는 벤츠에 공급하지 않고 있다. 삼성SDI가... ","Fri, 14 Nov 2025 00:01:00 +0900"
2025-11-13 17:49:53,美 뉴욕 3대 지수 하락 출발… 나스닥 1.33% 내려,https://n.news.naver.com/mnews/article/366/0001122832?sid=104,"AI 및 <b>반도체</b> 관련주가 고점이라는 분석이 이어지면서 필라델피아 <b>반도체</b>지수는 1% 넘게 떨어지고 있고 엔비디아와 브로드컴, TSMC도 2% 넘게 하락하고 있다. 최근 상승했던 우량주도 이날은 약세다. 월트디즈니는... ","Thu, 13 Nov 2025 23:59:00 +0900"
2025-11-13 17:49:53,"경북도, 내년 예산 14조363억 편성…민생·미래 먹거리 사업 투자 확대",https://www.gukjenews.com/news/articleView.html?idxno=3427613,"원) ▶<b>반도체</b> 시험평가센터(15억 원) 등 미래산업에도 투자한다. 농림·해양…산불피해 재창조, 농정 대전환 지난달 제정된 '초대형 산불피해 특별법'을 뒷받침하기 위해 ▶산불피해지역 복구재생(148억 원)... ","Thu, 13 Nov 2025 23:54:00 +0900"
2025-11-13 17:49:53,"[시황 분석] 미국 뉴욕증시 장초반, AI 투자 부담·지표 공백에 빅테크...",https://www.topstarnews.net/news/articleView.html?idxno=15874236,"<b>반도체</b> 3배 레버리지 ETF인 디렉션 데일리 세미컨덕터 불 3X 셰어즈 ETF 역시 41.58달러로 4.87% 하락하며, AI <b>반도체</b> 랠리의 피로감을 단적으로 드러내고 있다. 서학개미 보관금액을 통해 보면, 이번 가격 조정이... ","Thu, 13 Nov 2025 23:52:00 +0900"
2025-11-13 17:49:53,"한국산업기술진흥원, 미래 <b>반도체</b> 인재들과 소통...현장 목소리 청취",http://www.lawissue.co.kr/view.php?ud=202511132331138318f4ab64559d_12,"한국산업기술진흥원(원장 민병주, 이하 KIAT)은 지난 13일 경기도 용인시 서플러스글로벌에 구축된 <b>반도체</b>아카데미 교육장을 찾아 현장 간담회를 열고 애로사항을 청취했다고 14일 밝혔다. <b>반도체</b>아카데미는 KIAT와... ","Thu, 13 Nov 2025 23:32:00 +0900"
2025-11-13 17:49:53,[사설]“6대 분야 구조개혁 추진”… 잠재성장률 높여야 진짜 성공,https://n.news.naver.com/mnews/article/020/0003674314?sid=110,"실제로 한국개발연구원(KDI)이 <b>반도체</b> 경기 호조, 소비 회복을 반영해 올해 성장률 전망치를 0.8%에서 0.9%로... 다만 여전히 풀리지 않는 <b>반도체</b> 연구개발(R&amp;D) 인력 ‘주 52시간 근무제’ 적용 예외 문제 등에서 경험한 것처럼... ","Thu, 13 Nov 2025 23:31:00 +0900"
2025-11-13 17:49:53,2025년 1~3분기 벤처투자 9.8조원 돌파…펀드 결성도 9.7조원으로 '반등...,https://www.aitimes.kr/news/articleView.html?idxno=37201,"한편, 중소벤처기업부는 지난 8월, 글로벌 시장에 도전하는 인공지능(AI)·빅데이터, 시스템<b>반도체</b>, 로봇, 모빌리티, 클라우드·네트워크, 우주항공, 친환경기술, 양자기술, 바이오헬스케어, 차세대원전 등 딥테크... ","Thu, 13 Nov 2025 23:28:00 +0900"
2025-11-13 17:49:53,"삼성-벤츠, 전고체 배터리·전장부품 협력 확대 전망",https://www.digitaltoday.co.kr/news/articleView.html?idxno=604722,"양사는 <b>반도체</b>, 디스플레이, 전장 등 기존 협력관계를 강화하면서 차세대 전기차용 배터리와 자율주행 등 미래 모빌리티 분야로 협업 범위를 확대할 계획이다. 메르세데스-벤츠가 전기차 라인업 강화에 나선 가운데... ","Thu, 13 Nov 2025 23:26:00 +0900"
2025-11-13 17:49:53,"수자원공사, AI 중심의 물관리 비전 선포",http://www.lawissue.co.kr/view.php?ud=202511132322417329f4ab64559d_12,"“AI 기반 물관리로 <b>반도체</b> 등 국가 전략산업을 지원하고, 2030년까지 AI 물관리 분야 세계 1위 기업으로 도약해 대한민국이 AI 3대 강국으로 나아가는 데 기여하겠다”고 밝혔다. 전여송 로이슈(lawissue) 기자","Thu, 13 Nov 2025 23:24:00 +0900"
2025-11-13 17:49:53,"이재용, 벤츠 회장과 승지원서 만찬…미래 모빌리티 협력 강화",http://www.whitepaper.co.kr/news/articleView.html?idxno=254493,"이날 회동을 계기로 삼성과 벤츠는 <b>반도체</b>, 디스플레이, 전장 등 기존 파트너십을 강화하는 동시에 차세대... 앞서 지난 2023년에는 일론 머스크 테슬라 CEO와 삼성전자 북미 <b>반도체</b> 연구소에서 만나 협업 가능성을... ","Thu, 13 Nov 2025 23:22:00 +0900"
2025-11-13 17:49:53,[오늘과 내일/김현수]두 개의 경제가 따로 도는 나라,https://n.news.naver.com/mnews/article/020/0003674310?sid=110,“<b>반도체</b> 경기가 풀리면 하반기 회복 여력이 있고….” 전망치가 오르든 내리든 한국 경제를 설명할 때 <b>반도체</b>가 빠지는 경우는 거의 없다. <b>반도체</b> 보릿고개가 오자 지난해 세수는 펑크가 났다. 지난달 수출에서 <b>반도체</b>... ,"Thu, 13 Nov 2025 23:19:00 +0900"
2025-11-13 17:49:53,"&quot;엄마, 나만 빼고 다 있어&quot;…역대급 돌풍에 없어서 못 판다는 '이것', 뭐...",https://n.news.naver.com/mnews/article/011/0004555681?sid=105,"닌텐도는 물론 국내 총판을 맡은 신세계아이앤씨, 핵심 <b>반도체</b>를 공급하는 삼성전자까지 수혜를 입으며... 삼성전자는 스위치2의 핵심 <b>반도체</b>인 엔비디아 설계 시스템온칩(SoC) '테그라'를 8나노 공정으로 생산하며... ","Thu, 13 Nov 2025 23:11:00 +0900"
2025-11-13 17:49:53,"IBM, 양자컴퓨터 상용화 4년 앞당긴다…'룬' 칩으로 오류 수정 돌파",https://www.tokenpost.kr/news/tech/303474,"IBM은 미국 뉴욕에 위치한 최첨단 <b>반도체</b> 생산시설인 올버니 나노테크 콤플렉스를 활용함으로써 이 같은 제조상의 어려움을 극복해나가고 있다. ‘룬’ 칩은 아직 실험 단계에 머물러 있으며, 구체적인 시험 결과나 성능... ","Thu, 13 Nov 2025 23:10:00 +0900"
2025-11-13 17:49:53,호남·충청 몰린 ‘초고압 송전탑’ 추진…주민들 “수도권 에너지 식민...,https://n.news.naver.com/mnews/article/028/0002776344?sid=102,"환경단체에선 “용인에 삼성 <b>반도체</b> 국가산단을 건설하는 계획을 전면 재검토해야 한다”고 강조했다. 이에 한국전력은 “국가전력망 확충에 필요한 인허가 관련 사항이 국가전력망 특별법에 반영됐지만, 사업 추진... ","Thu, 13 Nov 2025 23:08:00 +0900"
2025-11-13 17:49:53,"NH아문디자산운용, ‘성장주도 코리아 펀드’ 시리즈 순자산 1000억 돌파",http://www.thevaluenews.co.kr/news/view.php?idx=193858,"인공지능(AI) <b>반도체</b>, 방산, 조선, 원자력, 신재생 에너지 등 정부 정책과 성장 가능성이 맞물린 산업을 주요 투자 대상으로 삼고 있다. 펀드 운용은 운용조직과 리서치조직이 협업해 진행하며, 벤치마크를 따르지... ","Thu, 13 Nov 2025 23:04:00 +0900"
2025-11-13 17:49:53,"이재용 삼성전자 회장, 벤츠 칼레니우스 회장 미팅",https://www.siminilbo.co.kr/news/newsview.php?ncode=1160316011072562,"삼성에 따르면 이날 회동을 계기로 삼성과 메르세데스-벤츠는 <b>반도체</b>, 디스플레이, 전장 등 기존 파트너십을 강화하는 동시에 차세대 전기차용 배터리, 자율주행 등 미래 모빌리티 분야의 공조 범위를 확대할 것으로... ","Thu, 13 Nov 2025 23:02:00 +0900"
2025-11-13 17:49:53,"경북도, 내년도 본예산 14조 363억 원 편성",https://www.cnbnews.com/news/article.html?no=761145,"아울러, △수소연료전지 산업클러스터 구축(150억 원), △첨단 제조혁신 테스트베드 구축(49억 원), △<b>반도체</b> 소재부품 시험평가센터 구축(15억원) 등 에너지·소재·<b>반도체</b> 신산업 선점을 통한 미래 성장동력 확보에도... ","Thu, 13 Nov 2025 22:48:00 +0900"
