DateTime,Title,Link,Description,PubDate
2026-03-13 09:48:42,"세미파이브, 삼성 4나노 기반 AI NPU 턴키 설계 수주…180억원 규모",https://www.econovill.com/news/articleView.html?idxno=733160,맞춤형 <b>반도체</b>(ASIC) 전문기업 세미파이브가 AI <b>반도체</b> 팹리스 기업과 협력해 삼성전자 4나노(SF4X) 공정 기반 AI 신경망처리장치(NPU)를 개발하는 약 180억원(미화 1250만달러) 규모의 턴키 설계 계약을 체결했다고 13일... ,"Fri, 13 Mar 2026 18:44:00 +0900"
2026-03-13 09:48:42,오하근 예비후보 &quot;이재명 정부의 순천시장 되겠다&quot;[인터뷰],https://n.news.naver.com/mnews/article/018/0006234642?sid=102,"이 외에도 오 예비후보는 순천만국가정원 노인 유료화와 지역화폐 제공, <b>반도체</b> 펩(제조공장) 클러스터... 있어 <b>반도체</b> 국가산업단지 입지로 최적”이라며 “이재명 정부의 <b>반도체</b> 2차 국가산업단지 조성 계획에 순천이... ","Fri, 13 Mar 2026 18:41:00 +0900"
2026-03-13 09:48:42,'벚꽃추경' 속도전…&quot;초과세수로 최대한 신속히&quot;,https://n.news.naver.com/mnews/article/422/0000843750?sid=101,"지난해 걷힌 세금은 약 490조 원 규모로 추산되는데, <b>반도체</b> 호황에 따른 세수 개선도 예상되면서 추가 재정 여력도 커졌다는 평가입니다. 이번 추경엔 지난해 7월과 마찬가지로 '소비쿠폰' 지급이 포함될 가능성도... ","Fri, 13 Mar 2026 18:40:00 +0900"
2026-03-13 09:48:42,"순천시-제너시스BBQ, 특급호텔 건립 등 황금빛 투자협약 체결",http://www.netongs.com/news/articleView.html?idxno=331547,순천시가 구상하는 'RE100 <b>반도체</b> 국가산업단지'와 연계해 글로벌 기업과 투자자를 수용할 비즈니스 인프라 구축에도 힘이 실릴 전망이다. 국제 수준의 숙박·비즈니스 환경이 마련되면 체류형 관광 기반 순천의 투자... ,"Fri, 13 Mar 2026 18:38:00 +0900"
2026-03-13 09:48:42,"이재명 대통령, 충북서 충청권 전체 통합 진지한 고민 당부",https://n.news.naver.com/mnews/article/079/0004124671?sid=102,"또 <b>반도체</b>와 이차전지, 바이오 등 첨단 산업 삼각 벨트의 글로벌 경쟁력 확보를 위한 투자와 재정 지원, 규제 완화를 비롯해 K-바이오스퀘어 등 클러스터 육성과 K-뷰티 산업 경쟁력 강화 등을 통한 바이오 혁신 허브... ","Fri, 13 Mar 2026 18:38:00 +0900"
2026-03-13 09:48:42,'유가 쇼크'에 코스피 연이틀 하락…환율은 '쑥',https://n.news.naver.com/mnews/article/422/0000843749?sid=101,<b>반도체</b> 기업의 호실적 전망에도 불구하고 국내증시가 펀더멘털보다 투자 심리에 좌우되는 모습이 지속되고 있습니다. 연합뉴스TV 양현주입니다. [영상취재 임예성] [영상편집 진화인],"Fri, 13 Mar 2026 18:38:00 +0900"
2026-03-13 09:48:42,&quot;원래 소리가 빵빵한데&quot; 김정관 당황…李 대통령 웃으며 한 말이[노컷브...,https://n.news.naver.com/mnews/article/079/0004124670?sid=100,이 자리에서 김정관 산업통상부 장관은 충청에서 생산된 <b>반도체</b>가 들어간 AI툴로 제작한 영상을 상영하며 첨단산업 혁신 구상을 밝혔습니다. 그런데 소리가 나오지 않았고 김 장관은 당황한 모습을 보였습니다. 이... ,"Fri, 13 Mar 2026 18:37:00 +0900"
2026-03-13 09:48:42,"에이직랜드, 작년 매출 728억 ··· 양산 매출 증가로 실적 개선 기대",https://www.datanet.co.kr/news/articleView.html?idxno=210070,"주문형 <b>반도체</b>(ASIC) 디자인 솔루션 전문기업 에이직랜드(대표 이종민)는 2025년 연결기준 매출 728억원, 영업손실 276억원을 기록했다고 공시했다. 글로벌 <b>반도체</b> 시장 대응을 위한 선단공정 설계 역량과 AI <b>반도체</b> 설계... ","Fri, 13 Mar 2026 18:36:00 +0900"
2026-03-13 09:48:42,울산에 국가 양자 연구 인프라… UNIST 양자나노팹 개소,https://www.newscj.com/news/articleView.html?idxno=3384295,이를 바탕으로 울산을 양자·<b>반도체</b> 산업을 연결하는 동남권 혁신 허브로 육성한다는 계획이다. 산업수도 울산은 자동차·조선·석유화학을 중심으로 성장했지만 첨단 <b>반도체</b> 분야 기반은 상대적으로 부족한... ,"Fri, 13 Mar 2026 18:34:00 +0900"
2026-03-13 09:48:42,23개 부처 8조6000억 투입→韓 기술주권 확대,https://n.news.naver.com/mnews/article/031/0001013264?sid=105,"지난 2월에는 <b>반도체</b>·디스플레이, AI 등 5개 국가전략기술 분야를 대상으로 하는 7632억원 규모의 제1호 과학기술혁신펀드도 새롭게 출범했다. 급변하는 대내외 정세에 대응하기 위해 기술·산업 패러다임 전환과... ","Fri, 13 Mar 2026 18:31:00 +0900"
2026-03-13 09:48:42,"개혁신당 전성균, 화성시장 출마…&quot;시민 삶 실제로 바꾸겠다&quot;",https://n.news.naver.com/mnews/article/053/0000056592?sid=162,"화성을 경제자유구역으로 추진하고 경기 남부 <b>반도체</b> 벨트에 '첨단 <b>반도체</b> 기술 센터'를 조성하는 한편, 서해안 AI·모빌리티 벨트에 새만금의 로봇 산업을 더하겠다는 공약을 밝혔다. 교통 문제 해결에 대해서도 &quot;교통... ","Fri, 13 Mar 2026 18:30:00 +0900"
2026-03-13 09:48:42,"[이슈] 배터리 소재부터 핵심광물까지…고려아연, '제련 기술'로 미래 먹...",http://www.paxetv.com/news/articleView.html?idxno=265212,"갈륨은 <b>반도체</b>와 LED, 고순도 집적회로(IC) 등 주요 첨단 산업에 사용된다. 이와 함께 고려아연은 방위산업... 광물과 <b>반도체</b>용 황산 등을 생산할 계획이다. 해당 제련소에서는 총 13종의 비철금속을 생산할 예정이다. 이... ","Fri, 13 Mar 2026 18:30:00 +0900"
2026-03-13 09:48:42,김영록 전남지사 &quot;대통령이 원하는 통합특별시장...광주·전남 400만 특별...,https://n.news.naver.com/mnews/article/660/0000105217?sid=100,특히 우리 양 시도가 나서서 통합이 돼야 대통령께서 말씀하신 남부권 <b>반도체</b> 벨트. 그건 대통령이 후하게... 저는 <b>반도체</b> 산업. 대통령께서 '남부권 <b>반도체</b> 클러스터를 해야 된다. 그리고 용수와 전력이 풍부한 지역으로... ,"Fri, 13 Mar 2026 18:29:00 +0900"
2026-03-13 09:48:42,"김양권 LED융합조명조합 이사장, &quot;조명산업, AI 기반 융합산업으로 도약...",https://www.electimes.com/news/articleView.html?idxno=366022,"또 &quot;LED 산업은 <b>반도체</b> 기술 기반과 전자 산업 생태계, 우수한 제조 경쟁력을 갖춘 강점을 지니고 있다&quot;며 &quot;이를 바탕으로 세계적인 광융합 산업으로 성장할 수 있도록 조합이 앞장서겠다&quot;고 덧붙였다.","Fri, 13 Mar 2026 18:28:00 +0900"
2026-03-13 09:48:42,"[올댓차이나] 홍콩 증시, 중동전쟁 장기화 우려에 사흘째 하락 마감…H...",https://n.news.naver.com/mnews/article/003/0013821274?sid=104,"물류주 둥팡해외 국제가 7.46%, 결산 발표로 재료 소진한 지하철주 MTR 6.42%, 화훙<b>반도체</b> 7.37%, 인공지능(AI) 기술주 미니맥스 6.83%, 스마트폰 위탁생산 비야디전자 4.98%, 안면인식주 상탕 3.32%, 영국 대형은행 HSBC... ","Fri, 13 Mar 2026 18:27:00 +0900"
2026-03-13 09:48:42,"이우현 전 의원, 용인특례시장 선거 불출마 선언",https://n.news.naver.com/mnews/article/002/0002431789?sid=102,"그는 &quot;용인은 글로벌 <b>반도체</b> 중심도시로 도약하는 역사적 전환점에 서 있는 중요한 시기로, 시민이 결집을... 앞서 이 전 의원은 지난 8일 ‘용인 <b>반도체</b> 클러스터 사수’를 제시하며 국민의힘 용인특례시장 후보 공천을... ","Fri, 13 Mar 2026 18:25:00 +0900"
2026-03-13 09:48:42,[인사] 한국재료연구원,https://www.pinpointnews.co.kr/news/articleView.html?idxno=436624,▲ 항공우주재료연구센터장 도정현 ▲ 지능형<b>반도체</b>재료연구센터장 김용훈 ▲ 산업기술솔루션센터장 박이호 ▲ 재료데이터연구센터장 김세종 ▲ 전략연구실장 조효진 ▲ 연구운영실장 김동현 ▲ 재무실장 이동윤... ,"Fri, 13 Mar 2026 18:24:00 +0900"
2026-03-13 09:48:42,"[산업공시] HD현대중공업, 에코프라임마린퍼시픽에 군산조선소 매각 등",https://www.econovill.com/news/articleView.html?idxno=733152,▲테스는 SK하이닉스와 <b>반도체</b> 제조장비 공급 계약을 체결했다. 계약 규모는 485억원이다. ▲JW홀딩스는 바이오 벤처캐피털 솔리더스인베스트먼트 지분을 취득하기로 결정했다. 취득 금액은 306억원이다. ▲KTcs는... ,"Fri, 13 Mar 2026 18:24:00 +0900"
2026-03-13 09:48:42,"이재용, 獨서 완성차 CEO 연쇄 회동…배터리·<b>반도체</b> '투트랙 세일즈'",http://www.4th.kr/news/articleView.html?idxno=2109038,"삼성전자는 차량용 <b>반도체</b>와 전장, 배터리 등 미래 모빌리티 관련 사업을 그룹 차원의 핵심 성장 축으로 보고 완성차 업체들과 협력 네트워크 확대에 나서고 있다. <b>반도체</b> 협력 행보도 이어질 전망이다. 이 회장은 18일... ","Fri, 13 Mar 2026 18:22:00 +0900"
2026-03-13 09:48:42,"“벌써 1조원 싹쓸이” 개미들, 코스닥 액티브 ETF 쓸어담았다…코스닥...",https://n.news.naver.com/mnews/article/016/0002613350?sid=101,"동시에 로봇 기업인 레인보우로보틱스를 비롯해 파두, 리노공업 등 <b>반도체</b> 및 첨단 기술주도 배치했다. 액티브 펀드가 인기를 끌면서 패시브 펀드는 매도세가 생겨나는 현상도 나타났다. 같은 기간 개인 순매도... ","Fri, 13 Mar 2026 18:21:00 +0900"
2026-03-13 09:48:42,"태양광에너지 관련주, '껑충껑충' 씨엔플러·다스코·캐리·지투파워......",http://www.finomy.com/news/articleView.html?idxno=251380,"신성이엔지는 <b>반도체</b>, 디스플레이, 이차전지 산업 등 고정밀 제조환경에 필수적인 클린룸, 드라이룸 등을... 회사는 <b>반도체</b> 클린룸 사업으로 확보한 온·습도, 미세먼지, 공기정화 제어 기술을 데이터센터 인프라... ","Fri, 13 Mar 2026 18:20:00 +0900"
2026-03-13 09:48:42,"생명연, 퓨리오사AI와 NPU기반 AI 신약개발 나선다",https://n.news.naver.com/mnews/article/092/0002414335?sid=105,백준호 퓨리오사AI 대표는 “AI <b>반도체</b>와 바이오 연구 결합으로 신약개발 패러다임이 빠른 변화를 보이고 있다”며 “디지털바이오 시대에 필요한 차세대 AI 컴퓨팅 기반 구축에 기여할 것&quot;으로 기대했다.,"Fri, 13 Mar 2026 18:20:00 +0900"
2026-03-13 09:48:42,"이우현 전 의원, 용인시장 불출마 선언…&quot;이상일과 미래 만들어 달라&quot;",https://n.news.naver.com/mnews/article/421/0008825214?sid=102,이 전 의원은 “지금 용인은 대한민국 글로벌 <b>반도체</b> 중심도시로 도약하는 중대한 기회를 맞고 있다. 투자규모가 약 1000조원으로 확대된 <b>반도체</b> 초대형 프로젝트들은 나라와 용인을 위해 흔들림 없이 진행돼야 한다”고... ,"Fri, 13 Mar 2026 18:18:00 +0900"
2026-03-13 09:48:42,[인사] 한국재료연구원,https://n.news.naver.com/mnews/article/031/0001013262?sid=102,△항공우주재료연구센터장 도정현 △지능형<b>반도체</b>재료연구센터장 김용훈 △산업기술솔루션센터장 박이호 △재료데이터연구센터장 김세종 △전략연구실장 조효진 △연구운영실장 김동현△재무실장 이동윤... ,"Fri, 13 Mar 2026 18:18:00 +0900"
2026-03-13 09:48:42,"&quot;대기업 AI 기술로 중소 제조업 스마트전환 이끈다&quot;...한성숙 장관, AI+제...",https://www.aitimes.kr/news/articleView.html?idxno=39054,"가전조립·이차전지·디스플레이·<b>반도체</b> 등 다양한 영역에서 공정·조립·검사·물류 자동화 기술을 다수 보유하고 있다. 한성숙 중소벤처기업부 장관이 13일 경기도 평택에서 열린 AI+제조, 상생형 AI 스마트제조... ","Fri, 13 Mar 2026 18:18:00 +0900"
2026-03-13 09:48:42,"젬백스, 지난해 영업익 38억...흑자전환",https://n.news.naver.com/mnews/article/018/0006234632?sid=101,젬백스 측은 “<b>반도체</b> 산업 호황에 따른 매출 증가와 판매관리비 절감으로 영업이익이 흑자 전환했다”며 “영업외 비용 감소로 당기순손실도 개선됐다”고 설명했다.,"Fri, 13 Mar 2026 18:17:00 +0900"
2026-03-13 09:48:42,[중국증시-마감] 100달러대 유가 지속에 이틀째 하락…<b>반도체</b>주·자원주...,https://news.einfomax.co.kr/news/articleView.html?idxno=4403623,"원유 가격 상승이 중국 경제와 기업 실적에 악영향을 미칠 것이란 우려가 커지면서 중국 증시에서는 소프트웨어와 <b>반도체</b>주를 중심으로 매도세가 두드러졌다. 금광과 희토류 관련주도 하락했으나, 은행, 부동산... ","Fri, 13 Mar 2026 18:16:00 +0900"
2026-03-13 09:48:42,"이재용, 유럽서 배터리 세일즈...최주선 “고객사 만났다”",https://www.asiatime.co.kr/article/20260313500251,이를 두고 재계에선 <b>반도체</b>에 이어 배터리 사업을 직접 챙기며 경영 보폭을 넓히고 있다는 해석이 뒤따른다. 실제 이 회장은 이날 낮 12시 45분께 서울 강서구 서울김포비즈니스항공센터(SGBAC)를 통해 입국해 출장 기간... ,"Fri, 13 Mar 2026 18:16:00 +0900"
2026-03-13 09:48:42,"수소에너지·수소차·연료전지 관련주, '맑음' 아이에이·폴라리스세원...",http://www.finomy.com/news/articleView.html?idxno=251379,"아이에이는 중국 합작법인을 세워 전력<b>반도체</b>에 생산에 힘쓰고 있다. 아이에이는 자동차 전장 분야를 중심으로 <b>반도체</b> 및 모듈, 제어기 사업을 전개하고 있다. 다양한 전장용 <b>반도체</b> 및 모듈 공급을 확대하기 위한... ","Fri, 13 Mar 2026 18:16:00 +0900"
2026-03-13 09:48:42,"산업용 전기요금, 낮엔 싸게 밤엔 비싸게 개편…태양광 공급능력에 맞춰",https://n.news.naver.com/mnews/article/028/0002795847?sid=102,"이러한 단가조정은 <b>반도체</b>, 철강, 자동차 사업장 등 계약 전력이 300킬로와트(kW) 이상인 산업용(을)에 적용된다. 산업용(을) 요금 개편안은 다음달 16일부터 적용된다. 다만, 변경된 요금체계에 맞춘 준비기간이 필요해... ","Fri, 13 Mar 2026 18:12:00 +0900"
2026-03-13 09:48:42,"&quot;AI 메모리 수요 폭발&quot;…증권가, SK하이닉스 목표주가 대폭 상향",http://www.bizwnews.com/news/articleView.html?idxno=128862,공지능(AI) 산업 확산에 따른 메모리 <b>반도체</b> 수요 증가가 이어지면서 증권가가 SK 하이닉스의 실적 전망을 크게 상향 조정하고 있다. SK하이닉스 이천 M16. 사진=SK하이닉스 인공지능(AI) 산업 확산에 따른 메모리 <b>반도체</b>... ,"Fri, 13 Mar 2026 18:12:00 +0900"
2026-03-13 09:48:42,로베코운용 “변동성 장세에도 韓 기업 펀더멘털 견조… 매력적인 투자...,https://n.news.naver.com/mnews/article/366/0001148366?sid=101,"<b>반도체</b>·자동차·전기차 배터리 등 주요 대형주의 경우, 최근 주가 하락에도 불구하고 기업의 펀더멘털에는 큰 변화가 없었기에 장기 투자 관점에선 오히려 위험 대비 기대수익률이 개선됐다. 이에 저가 매수 기회를... ","Fri, 13 Mar 2026 18:12:00 +0900"
2026-03-13 09:48:42,"코스피, 5500선 무너져 5487.24 마감…코스닥은 올라",https://www.thepublic.kr/news/articleView.html?idxno=297379,"엔비디아(-1.55%), 마이크론 테크놀로지(-3.19%), TSMC(-5.03%) 등이 내리면서 필라델피아<b>반도체</b>지수도 3.43% 급락했다. 이란의 새 최고지도자로 선출된 아야톨라 세예드 모즈타바 하메네이가 호르무즈 해협 봉쇄를... ","Fri, 13 Mar 2026 18:12:00 +0900"
2026-03-13 09:48:42,"순천시-제너시스BBQ, 특급호텔 건립 등 MOU 체결",https://n.news.naver.com/mnews/article/031/0001013254?sid=102,시가 구상하는 ‘RE100 <b>반도체</b> 국가산업단지’와 연계해 글로벌 기업과 투자자를 수용할 비즈니스 인프라 구축에도 힘이 실릴 전망이다. 또한 시는 특급 호텔 등 관광 인프라와 대형 쇼핑몰 코스트코를 양대 축으로... ,"Fri, 13 Mar 2026 18:10:00 +0900"
2026-03-13 09:48:42,"제약업체 관련주, '웃음꽃' 폴라리스AI파마·국전약품·부광약품·엔지...",http://www.finomy.com/news/articleView.html?idxno=251378,"국전약품이 생산하는 HBM(고대역폭메모리) 공정용 소재가 글로벌 <b>반도체</b> 기업의 공정 라인 평가를 통과하면서, AI <b>반도체</b> 공급망에서 새롭게 '국산 소재 변수'로 떠오르고 있다. 이번에 상용화되는 제품은 HBM 패키징... ","Fri, 13 Mar 2026 18:10:00 +0900"
2026-03-13 09:48:42,[인사] 산업통상부 외,https://n.news.naver.com/mnews/article/469/0000919322?sid=102,도정현 △지능형<b>반도체</b>재료연구센터장 김용훈 △산업기술솔루션센터장 박이호 △재료데이터연구센터장 김세종 △전략연구실장 조효진 △연구운영실장 김동현 △재무실장 이동윤 △안전보건실장 하상윤 ◆KBS... ,"Fri, 13 Mar 2026 18:08:00 +0900"
2026-03-13 09:48:42,김동연 &quot;김용 전 부원장께 공식 사과…개인 스토리가 극적 승리를 거둔...,https://n.news.naver.com/mnews/article/119/0003068906?sid=100,"지난 4년간 투자유치 100조원, 용인 <b>반도체</b> 클러스터 전력 문제 해결, 소방관 초과수당 미지급 문제 해결, 지하철 5호선 김포 연장 예타 통과 등 '해결사' 역할을 평가해주시는 것 같다&quot;고 말했다. &quot;희망의 끈을 놓지 않았으면... ","Fri, 13 Mar 2026 18:07:00 +0900"
2026-03-13 09:48:42,계획인구 105만4천 명 확정…평택특례시 도약 본격화,https://www.newsfreezone.co.kr/news/articleView.html?idxno=679703,"특히 평택의 산업 구조를 이끄는 <b>반도체</b> 산업, 미래 에너지 산업인 수소 산업, 그리고 평택항을 중심으로 한 항만·물류 산업을 핵심 성장 축으로 설정했다. 여기에 광역교통망 확충과 생활 인프라 확대 방향을 함께... ","Fri, 13 Mar 2026 18:06:00 +0900"
2026-03-13 09:48:42,"[기획] 평택, 2040년 인구 105만 도시로…<b>반도체</b>·항만 축으로 '100만 특...",http://www.joongang.tv/news/articleView.html?idxno=207440,"<b>반도체</b> 산업 확대와 평택항 물류 기능 강화, 광역교통망 확충 등 최근 급변하는 도시 여건을 반영해 도시... 2040년 계획인구 105만4000명 설정 <b>반도체</b> 산업·평택항 물류축 중심 성장 '2도심 3지역중심' 도시 구조로 개편... ","Fri, 13 Mar 2026 18:06:00 +0900"
2026-03-13 09:48:42,"“원전 르네상스 기대” 두산에너빌리티, 외국인·기관 순매수 1위",https://n.news.naver.com/mnews/article/037/0000037823?sid=101,"한미<b>반도체</b>, 삼성전자우였다. 기관의 순매수 1위 종목은 두산에너빌리티였다. 에임드바이오, 삼성전자우, 포스코인터네셔널, 한미<b>반도체</b>, 기아, 삼성중공업, 성호전자, 파두, 큐리언트가 뒤를 이었다. 기관이... ","Fri, 13 Mar 2026 18:05:00 +0900"
2026-03-13 09:48:42,[ETF 줌인] 변동성 장세 방어 전략…한국 대형주 ‘압축 투자’,https://n.news.naver.com/mnews/article/011/0004599119?sid=101,"유가증권시장과 코스닥 시장에서 유동시가총액 기준 상위 10개 핵심 종목에 투자하는 구조로, <b>반도체</b>... 동시에 <b>반도체</b>·금융·방산·모빌리티 등 다양한 산업의 국내 1등 기업을 고르게 편입해 특정 업종 쏠림... ","Fri, 13 Mar 2026 18:04:00 +0900"
2026-03-13 09:48:42,김동연 &quot;김용 전 부원장에 소홀히 해 많이 후회&quot;,https://n.news.naver.com/mnews/article/417/0001134097?sid=102,"김 지사는 100조원 이상의 투자 유치, 용인 <b>반도체</b> 클러스터 전력 문제 해결, 소방관 초과근무 수당 지급, 지하철 5호선 김포·검단 연장 예타 통과 등을 주요 성과로 소개하며 &quot;도민들의 평가가 비교적 높기 때문&quot;이라고... ","Fri, 13 Mar 2026 18:04:00 +0900"
2026-03-13 09:48:42,알루미늄·요소·헬륨 등 원자재 가격 폭등...국내 기업 '비상',https://www.econovill.com/news/articleView.html?idxno=733128,있어 <b>반도체</b>·자동차·가전 등 제조 기반의 국내 수출 기업들에 비상이 걸렸다. 알루미늄 4년 만에 최고가... 헬륨 생산·공급 중단…<b>반도체</b> 기업 어쩌나 헬륨 공급에도 차질이 빚어질 전망이다. 카타르는 지난해 전 세계... ,"Fri, 13 Mar 2026 18:04:00 +0900"
2026-03-13 09:48:42,순천시-BBQ 투자협약…2031년까지 특급호텔 등 복합관광단지 조성,https://n.news.naver.com/mnews/article/079/0004124653?sid=102,"이번 투자는 순천시가 추진 중인 RE100 <b>반도체</b> 국가산업단지 조성과도 연계돼, 글로벌 기업과 투자자를 수용할 국제 수준의 숙박·비즈니스 인프라 구축에 힘을 보탤 전망이다. 체류형 관광 기반이 강화되면서 순천의... ","Fri, 13 Mar 2026 18:03:00 +0900"
2026-03-13 09:48:42,차세대 AI 슈퍼클러스터용 '광 인터커넥트' 표준 추진에 엔비디아 등 협...,https://www.aitimes.com/news/articleView.html?idxno=207858,"초대형 AI 클러스터 확산에 대응하기 위해 주요 하이퍼스케일러와 <b>반도체</b> 기업들이 차세대 광... 일반적인 표준화 기구는 <b>반도체</b> 업체나 네트워크 장비 업체가 주도하는 경우가 많지만, 이번 협력체는 클라우드... ","Fri, 13 Mar 2026 18:02:00 +0900"
2026-03-13 09:48:42,이재용 유럽 출장 후 귀국…'배터리' 직접 챙겼다,https://www.newsway.co.kr/news/view?ud=2026031314285986589,"업계에서는 두 사람이 <b>반도체</b> 사업 협력 방안을 논의할 가능성도 거론된다. AMD는 최근 오픈AI, 메타 등 빅테크를 고객사로 확보하는 데 주력하고 있으며, 인공지능(AI) 가속기 핵심 부품인 고대역폭 메모리(HBM) 공급... ","Fri, 13 Mar 2026 18:02:00 +0900"
2026-03-13 09:48:42,"로봇신문, '<b>반도체</b> 및 전자 제조 공정 로봇 컨퍼런스' 개최… 스마트 제...",https://www.irobotnews.com/news/articleView.html?idxno=45333,"로봇신문은 오는 4월 1일 경기 수원컨벤션센터에서 '<b>반도체</b> 및 전자 제조 공정 로봇 컨퍼런스'를 개최한다. 이번 행사는 4월 1일부터 3일까지 열리는 '스마트 SMT &amp; PCB 어셈블리 2026' 전시회 부대행사로 마련되며, <b>반도체</b> 및... ","Fri, 13 Mar 2026 18:02:00 +0900"
2026-03-13 09:48:42,"지식재산처, ㈜탑엔지니어링 현장방문과 간담회 개최",http://www.bizwnews.com/news/articleView.html?idxno=128882,지식재산처(처장 김용선)는 13일 오후 <b>반도체</b>·디스플레이 장비 기업인 ㈜탑엔지니어링 R&amp;D센터(경기 성남시)를 방문해 지식재산 관련 현장소통 간담회를 가진다고 밝혔다. 김희태 지식재산처 <b>반도체</b>심사추진단장(왼쪽에서... ,"Fri, 13 Mar 2026 18:02:00 +0900"
2026-03-13 09:48:42,"치킨기업 BBQ, 순천에 '1000실 특급호텔' 투자",https://www.newspim.com/news/view/20260313000901,"순천시는 이번 특급호텔 투자가 추진 중인 RE100 <b>반도체</b> 국가산업단지, 우주항공·문화콘텐츠·치유·바이오 산업과 연계돼 글로벌 기업과 투자자를 수용할 비즈니스 인프라 확충에 도움이 될 것으로 기대하고 있다.... ","Fri, 13 Mar 2026 18:01:00 +0900"
2026-03-13 09:48:42,김동연 지사 &quot;김용 부원장에게 가장 미안…도지사 되고 함께 못했다&quot;,https://n.news.naver.com/mnews/article/629/0000481301?sid=102,"김동연 지사는 그동안 투자 100조 원 유치, 용인 <b>반도체</b> 클러스터 전력 문제 해결, 16년 미결 소방관 미지급 초과수당 해소, 서울 지하철 5호선 김포 연장 예비타당성 통과 등의 성과로 '해결사'라는 별칭을 얻기도 했다. 그는... ","Fri, 13 Mar 2026 18:01:00 +0900"
