DateTime,Title,Link,Description,PubDate
2025-04-27 22:47:46,"SK하이닉스, 단기 호재로 주가 반등 전망-키움",https://n.news.naver.com/mnews/article/018/0005999706?sid=101,"그는 “2분기 글로벌 테크 업종의 실적 시즌 동안에는 우려보다 양호한 실적 가이던스와 AI에 대한 강한 수요가 재확인되면서, <b>반도체</b> 업종의 주가 반등이 나타날 것”이라며 “2분기 실적 호조가 예상되는... ","Mon, 28 Apr 2025 07:46:00 +0900"
2025-04-27 22:47:46,"&quot;회식 중 소주병으로 폭행, 45바늘 꿰매&quot;… 돌아온 건 해고? '억울'",https://n.news.naver.com/mnews/article/417/0001073617?sid=102,경기 평택시 한 <b>반도체</b> 건설 현장에서 일하던 20대 남성이 회식 자리에서 아버지뻘인 고참에게 소주병으로... 최근 JTBC '사건반장'에 따르면 20대 남성 A씨는 2023년 6월 전역 후 <b>반도체</b> 공사 현장에서 여러 회사와 근무해... ,"Mon, 28 Apr 2025 07:42:00 +0900"
2025-04-27 22:47:46,【오늘의 국회일정】 2025년 4월 28일,https://www.lawtimes.co.kr/news/207574,"등, <b>반도체</b> 산업경쟁력 강화를 위한 '한국형 <b>반도체</b> 지원정책의 방향과 과제' 토론회(의원회관 제2소회의실) 11:00 박정 의원실 등, (중소·벤처·스타트업 지원을 위한) 68개 법정기금 법 개정 국회토론회(의원회관... ","Mon, 28 Apr 2025 07:40:00 +0900"
2025-04-27 22:47:46,"이재명, 오늘 이승만·박정희 등 묘역 참배…국민통합 강조",https://n.news.naver.com/mnews/article/015/0005124688?sid=154,오후에는 경기도 이천시에 있는 SK하이닉스 이천 캠퍼스를 방문해 '인공지능(AI) 메모리 <b>반도체</b> 간담회'를 열고 기술 발전과 경제 성장에 초점을 둔 대선 행보를 이어간다. 간담회에는 SK하이닉스에서 곽노정 최고경영자... ,"Mon, 28 Apr 2025 07:39:00 +0900"
2025-04-27 22:47:46,"현대차·기아·현대모비스, 선임사외이사 제도 도입 ‘이사회 거버넌스...",https://n.news.naver.com/mnews/article/144/0001035812?sid=103,"(GIC) 아시아 포트폴리오 매니저를 역임한 재무·회계 및 자본시장 전문가다. 도진명(Jim Myong Doh) 사외이사는 퀄컴 아시아 부회장 출신으로, <b>반도체</b>와 더불어 AI와 수소 등에도 폭넓은 경험과 역량을 보유한 것으로 평가받는다.","Mon, 28 Apr 2025 07:39:00 +0900"
2025-04-27 22:47:46,[시사금융용어] 핵심광물 재자원화,https://news.einfomax.co.kr/news/articleView.html?idxno=4353215,"전기차·<b>반도체</b> 등 첨단산업에 필수적인 핵심 원자재 공급망을 내재화해야 하기 때문이다. 또, 세계 재자원화 시장 규모가 지난해부터 2040년까지 5배 확대될 것으로 전망되니 국내 관련 산업을 육성해 미래 유망시장을... ","Mon, 28 Apr 2025 07:36:00 +0900"
2025-04-27 22:47:46,"이재명, 대선후보 첫 일정 이승만·박정희·김영삼·김대중 전 대통령 묘...",http://www.issuenbiz.com/news/articleView.html?idxno=59739,이 후보는 이어 오후에는 경기도 이천시에 있는 SK하이닉스 이천 캠퍼스를 방문해 'AI(인공지능) 메모리 <b>반도체</b> 간담회'를 갖는다. 간담회에는 SK하이닉스에서 곽노정 최고경영자(CEO) 등이 참석할 것으로 보인다. 앞서... ,"Mon, 28 Apr 2025 07:36:00 +0900"
2025-04-27 22:47:46,"[대선 일정] 이재명, 오늘 이승만·박정희 등 묘역 참배…대선후보 첫 ...",https://www.lecturernews.com/news/articleView.html?idxno=177007,이 후보는 이어 오후에는 경기도 이천시에 있는 SK하이닉스 이천 캠퍼스를 방문해 'AI(인공지능) 메모리 <b>반도체</b> 간담회'를 열고 기술 발전과 경제 성장에 초점을 대선 행보를 이어간다. 간담회에는 SK하이닉스에서... ,"Mon, 28 Apr 2025 07:34:00 +0900"
2025-04-27 22:47:46,"이재명, 오늘 이승만·박정희 등 묘역 참배… 통합 행보",https://n.news.naver.com/mnews/article/081/0003536981?sid=100,이 후보는 이어 오후에는 경기도 이천시에 있는 SK하이닉스 이천 캠퍼스를 방문해 ‘AI(인공지능) 메모리 <b>반도체</b> 간담회’를 열고 기술 발전과 경제 성장에 초점을 대선 행보를 이어간다. 간담회에는 SK하이닉스에서... ,"Mon, 28 Apr 2025 07:31:00 +0900"
2025-04-27 22:47:46,[마켓 프리뷰] 관세 불안 '정점'…상호관세 충격 이후 낙폭 만회 성공,https://n.news.naver.com/mnews/article/374/0000437493?sid=101,"큰 <b>반도체</b>·차·에너지 등 기업 우선순위 - 방한 전 헝가리 방문…&quot;경제 파트너, 중국보다는 미국&quot; - 헝가리... 유통·음식료·<b>반도체</b>·증권·자동차 등 내수주 등 관심 - 산업생산·물가 지표 주목…미국 관세 충격 확인... ","Mon, 28 Apr 2025 07:30:00 +0900"
2025-04-27 22:47:46,대선 주자들의 '개헌·복지·AI·국방' 공약 살펴보니,https://weekly.hankooki.com/news/articleView.html?idxno=7110622,"김문수 후보는 AI와 <b>반도체</b> 등 10대 신기술을 국가전략 프로젝트로 지정하고 규제개혁 패스트트랙을 도입하겠다고 밝혔다. 한동훈 후보는 전체 200조원 투자를 약속한 가운데 그중 데이터센터, 컴퓨팅, <b>반도체</b> 등의... ","Mon, 28 Apr 2025 07:30:00 +0900"
2025-04-27 22:47:46,메모리 '고성능 대세론' 확산…&quot;AI가 구조적 변화 이끈다&quot;,https://www.digitaltoday.co.kr/news/articleView.html?idxno=563529,삼성전자 LPDDR5X D램 [사진: 삼성전자] AI <b>반도체</b> 시장의 급성장으로 HBM 수요는 올해에도 공급 부족 상황이 계속될 전망이다. 하반기에는 공급 업체 간 수주 경쟁이 심화될 가능성도 있다. 시장조사기관... ,"Mon, 28 Apr 2025 07:30:00 +0900"
2025-04-27 22:47:46,"韓 경제, 또 역성장...'0%대 성장' 공포 확산",https://www.newswhoplus.com/news/articleView.html?idxno=25794,"건설투자는 건물건설 중심으로 3.2% 급감했고, 설비투자도 <b>반도체</b> 제조 장비 등 기계류 위주로 2.1% 줄었다.... 여기에 고성능 <b>반도체</b>(HBM) 수요 이연, 일부 건설현장 공사 중단, 대형 산불 등 비정상적 요인도 겹치며 성장... ","Mon, 28 Apr 2025 07:30:00 +0900"
2025-04-27 22:47:46,"김문수 “노사·좌우·빈부 아우른 삶…공무원 한덕수, 선거전 완주할까...",https://n.news.naver.com/mnews/article/016/0002463381?sid=100,"당시 열악한 정치환경 속에서도 수도권광역급행철도(GTX), 평택 삼성<b>반도체</b> 단지와 판교 테크노밸리, 파주 LCD 단지 등을 추진해 냈다. 192석의 거대 야권의 협조 없이는 그 어떤 것도 성취할 수 없는 게 현실이다. 제가... ","Mon, 28 Apr 2025 07:30:00 +0900"
2025-04-27 22:47:46,"[더벨][HB그룹은 지금]HB테크놀러지·솔루션, 신성장동력 가시화 언제쯤",https://www.thebell.co.kr/free/content/ArticleView.asp?key=202504231426059960106649,비롯한 <b>반도체</b> 관련 장비를 개발했다. 다만 성과가 아직 미진하다. 고객사에 일부 납품을 진행해 시장에서 큰 기대가 나왔지만 본격적인 매출 증대는 요원한 상태다. HB솔루션의 경우 <b>반도체</b> 제조공정에 활용... ,"Mon, 28 Apr 2025 07:28:00 +0900"
2025-04-27 22:47:46,"[더벨]트럼프 시대, 삼성에 필요한 단어 '그룹'",https://www.thebell.co.kr/free/content/ArticleView.asp?key=202504231644169480106853,"<b>반도체</b>, 스마트폰, 가전만 하는 게 아니라 바이오, 조선, 건설 등의 기업도 식구로 있다는 점을 어필해야 한다. 민관 원팀 대응에 도움 되는 차원을 떠나 삼성 스스로를 위해서도 실리적으로 중요한 문제다. 여러... ","Mon, 28 Apr 2025 07:28:00 +0900"
2025-04-27 22:47:46,"[더벨][하이테크 소부장 리포트]'배터리 침체' 원익피앤이, 늘어난 단기...",https://www.thebell.co.kr/free/content/ArticleView.asp?key=202504231624028960108566,"원익그룹의 <b>반도체</b> 소부장 계열사들은 함박웃음을 짓고 있다. 삼성전자, SK하이닉스의 마이그레이션 수요 증가로 실적 반등이 시작된 덕분이다. 반면 배터리 장비 계열사는 전혀 다른 양상이다. 관련 사업체 중... ","Mon, 28 Apr 2025 07:28:00 +0900"
2025-04-27 22:47:46,"이재명, 오늘 이승만·박정희 등 전 대통령 묘역 참배…첫 일정",https://n.news.naver.com/mnews/article/656/0000130205?sid=100,이날 오후에는 경기도 이천시에 있는 SK하이닉스 이천 캠퍼스를 방문해 'AI(인공지능) 메모리 <b>반도체</b> 간담회'를 연다. 간담회에는 SK하이닉스에서 곽노정 최고경영자(CEO) 등이 참석할 것으로 보인다.,"Mon, 28 Apr 2025 07:26:00 +0900"
2025-04-27 22:47:46,"이재명, 현충원 참배로 첫 대선 후보 행보… AI 업계 간담회도",https://n.news.naver.com/mnews/article/449/0000306999?sid=100,힘을 모아 통합의 길로 가지 않을까라는 기대를 가질 수 있도록 노력하겠다&quot;고 밝혔습니다. 이날 오후에는 경기 이천 SK하이닉스 이천캠퍼스를 방문해 'K-<b>반도체</b>'를 주제로 AI 메모리<b>반도체</b> 기업들과 간담회를 가집니다.,"Mon, 28 Apr 2025 07:25:00 +0900"
2025-04-27 22:47:46,“나라 발전하려면 이공계 키워야한다”...‘K방산 아버지’ 이름 딴 장...,https://n.news.naver.com/mnews/article/009/0005483469?sid=101,"AI·<b>반도체</b> 분야 인재 전폭 지원 홍난파 공로 재조명 나서기도 지난 19일 경기도 화성시 남양도서관에는 한국... 있다”며 “<b>반도체</b>와 배터리, 로봇 같은 분야가 대표적”이라고 부연했다. 이어 “김 박사가 뿌린 씨앗으로... ","Mon, 28 Apr 2025 07:23:00 +0900"
2025-04-27 22:47:46,이재명 대선 공약 관통하는 ‘K이니셔티브'…&quot;국가 차원 대대적 투자할...,https://n.news.naver.com/mnews/article/011/0004479030?sid=100,<b>반도체</b>와 인공지능(AI) 등 주요 산업 생태계가 단순한 기업 간의 경쟁이 아니라 ‘국가 대항전’ 양상으로 치닫고 있는 만큼 정부가 직접 나서서 범정부 차원의 대대적인 투자를 통해 경제성장을 이끌어야 한다는... ,"Mon, 28 Apr 2025 07:21:00 +0900"
2025-04-27 22:47:46,"이재명, 89.77%압도적 기세…&quot;반드시 정권 탈환&quot;",https://n.news.naver.com/mnews/article/011/0004479028?sid=100,찾아 <b>반도체</b> 간담회를 갖는다. '경제'만 10번 언급한 이재명 &quot;먹고 사는 일이 중요하다&quot; 더불어민주당 대선... 후 <b>반도체</b> 기업을 방문한다. 후보 수락 연설에서 거듭 강조한 국민 통합과 경제성장에 대한 의지를 드러내는... ,"Mon, 28 Apr 2025 07:16:00 +0900"
2025-04-27 22:47:46,"이재명, 대선후보 첫 일정…이승만·박정희 등 묘역 참배",https://n.news.naver.com/mnews/article/057/0001883662?sid=100,이 후보는 이어 오후에는 경기도 이천시에 있는 SK하이닉스 이천 캠퍼스를 방문해 'AI(인공지능) 메모리 <b>반도체</b> 간담회'를 개최합니다. 간담회에는 SK하이닉스에서 곽노정 최고경영자(CEO) 등이 참석할 것으로 보입니다.,"Mon, 28 Apr 2025 07:15:00 +0900"
2025-04-27 22:47:46,"이재용, '이건희 계승' 삼성 공채 'GSAT 30년'...&quot;창업 이래 가장 중시한...",https://www.greened.kr/news/articleView.html?idxno=326047,"이번 GSAT 문제 중에는 인공지능(AI), <b>반도체</b>, 스마트폰, 바이오 등 삼성의 주요 사업과 관련된 문항도 포함된 것으로 알려졌다. 일명 '삼성 고시'로 불리는 GSAT는 종합적 사고 역량과 유연한 문제 해결 능력을 갖춘... ","Mon, 28 Apr 2025 07:15:00 +0900"
2025-04-27 22:47:46,"[N2 모닝 경제 브리핑-4월 28일] 美 증시, 미·중 협상 기대에 ‘안도랠...",https://www.news2day.co.kr/article/20250425500246,"필라델피아<b>반도체</b>지수는 전일 대비 43.42포인트(1.03%) 오른 4,251.61을 기록했다. 엔비디아와 함께 브로드컴(2.21%), TSMC(0.56%), ASML(0.34%) 등이 지수 상승을 이끌었다. 한편 뉴욕상업거래소(NYMEX)에서 6월물 미국... ","Mon, 28 Apr 2025 07:14:00 +0900"
2025-04-27 22:47:46,"서울<b>반도체</b>, 전문경영인 체제 고수한다",https://dealsite.co.kr/articles/140497,서울<b>반도체</b>는 현재 전문경영인 체제를 유지하겠다는 기조를 고수하고 있다. 현재 장남과 장녀 모두 서울<b>반도체</b>의 본업인 광<b>반도체</b>와 거리가 먼 분야에서 활동하는 것으로 전해진다. 지난 2023년에는 이들을 이사진에... ,"Mon, 28 Apr 2025 07:14:00 +0900"
2025-04-27 22:47:46,"IMF &quot;韓, 고환율 저성장으로 국민소득 4만달러대 4년 후에나 가능할 듯&quot;",https://www.getnews.co.kr/news/articleView.html?idxno=818347,"이어 &quot;일본이 우리나라에 한번 역전당한 뒤 계속 뒤쳐지는 상황처럼, 우리도 대만에 앞으로 계속 뒤쳐질 수 있다는 경각심이 필요하다&quot;며 &quot;국가 브랜드 이미지 차원에서라도 <b>반도체</b> 제조업 경쟁력을... ","Mon, 28 Apr 2025 07:12:00 +0900"
2025-04-27 22:47:46,"&quot;中화웨이, 엔비디아 대체할 고성능 AI 칩 개발 중&quot;",https://n.news.naver.com/mnews/article/123/0002357936?sid=104,"이번 소식은 미국이 중국에 대한 <b>반도체</b> 장비 및 기술 수출을 제한하며 제재를 강화하는 상황에서 나온 것으로, 화웨이의 신제품 개발은 중국 <b>반도체</b> 산업의 견고한 생존력과 기술 진보를 보여준다는 평가다. WSJ은... ","Mon, 28 Apr 2025 07:07:00 +0900"
2025-04-27 22:47:46,"호실적에도 목표가 '뚝'…관세 전쟁, K-기업 발목 잡나",http://www.metroseoul.co.kr/article/20250428500001,"특히 관세 리스크에 노출된 기업들이 코스피 시가총액 상위주인 <b>반도체</b>, 자동차 기업 등으로 구성돼 있다는 점도 우려된다. 이화진 현대차증권 연구원은 &quot;수출의존도가 높고, 대중 무역 흑자가 큰 우리나라 기업들은... ","Mon, 28 Apr 2025 07:06:00 +0900"
2025-04-27 22:47:46,"[AM-PM] 민주당 이재명, 현충원 참배로 대선 후보 일정 시작 外",https://n.news.naver.com/mnews/article/422/0000735273?sid=102,"또 SK하이닉스 이천캠퍼스를 방문해 'AI 메모리 <b>반도체</b> 간담회'도 가질 예정입니다. ▶ '해킹 사고' SK텔레콤, 오늘부터 유심 무상 교체 (AM 10:00 전국 대리점 및 공항 로밍센터) 해킹 사고가 발생한 SK텔레콤이 오늘(28일)... ","Mon, 28 Apr 2025 07:05:00 +0900"
2025-04-27 22:47:46,[4월28일 주요일정] 유동규 김만배 등 '대장동 개발 의혹' 공판,https://www.safetimes.co.kr/news/articleView.html?idxno=229118,"후보, 'K-<b>반도체</b>' AI메모리<b>반도체</b> 기업 간담회(15:00 SK하이닉스 이천캠퍼스 / 경기 이천시 부발읍 경충대로 2091) 박찬대 당대표 직무대행 겸 원내대표, 국립서울현충원 참배(09:00) 박찬대 당대표 직무대행 겸... ","Mon, 28 Apr 2025 07:04:00 +0900"
2025-04-27 22:47:46,[이번주 기획재정부 및 경제부처 일정],https://news.einfomax.co.kr/news/articleView.html?idxno=4353213,"(국회) ※AI·<b>반도체</b>·로봇, 차세대 방산기술 개발에 박차 가한다(30일 석간) ※호남·제주 출력제어 완화를 위해 대규모 배터리 에너지저장장치(BESS) 구축(30일 석간) ※산업부, <b>반도체</b> 첨단소재기업 방문(30일... ","Mon, 28 Apr 2025 07:02:00 +0900"
2025-04-27 22:47:46,[1분컷] [전국인사이드┃충북(1)] 첨단도시 충북의 씁씁한 추락… &quot;청년...,https://www.newscj.com/news/articleView.html?idxno=3262796,"<b>반도체</b>, 전기차 부품 등 수출 주력 산업 부진이 주된 원인으로 분석된다. 충북 수출은 전년 대비 15.2% 감소했고 특히 <b>반도체</b> 수출은 26% 급감했다. 수출 감소 여파로 내수 시장도 얼어붙었다. 청주·충주 등 도심 상권은... ","Mon, 28 Apr 2025 07:02:00 +0900"
2025-04-27 22:47:46,[전국인사이드┃충북(1)] 첨단도시 충북의 씁씁한 추락… &quot;청년 잡을 인...,https://www.newscj.com/news/articleView.html?idxno=3262714,"<b>반도체</b>·전기차 등 수출 주력 산업의 부진과 청년 유출, 내수 침체 등 복합적 위기가 겹치며 성장 동력이... (4) '<b>반도체</b>‧전기차' 첨단산업기지 품은 충북 수출 부진으로 2023년 성장률 꼴찌 '충격' &quot;청년 살기엔 매력 부족... ","Mon, 28 Apr 2025 07:02:00 +0900"
2025-04-27 22:47:46,"'민주당 대선후보' 이재명, 광주전남 주요 공약은?",https://n.news.naver.com/mnews/article/421/0008217787?sid=154,이 후보는 광주 주요 공약으로 고성능 <b>반도체</b>를 집적한 국가 AI 컴퓨팅센터 광주 유치를 약속했다. AI 집적단지와 미래 모빌리티 부품 클러스터를 조성해 첨단산업 생태계를 구축하겠다는 것이다. 지역 최대 현안인 '민·군... ,"Mon, 28 Apr 2025 07:01:00 +0900"
2025-04-27 22:47:46,관세·탄핵 정국에도 1Q 기업 성적표 '양호'…진짜 폭풍은 2Q부터,https://n.news.naver.com/mnews/article/421/0008217781?sid=101,"'HBM 힘' SK하이닉스, 최대 실적…삼성·LG전자 '선방' 전자·<b>반도체</b> 기업들도 1분기 눈에 띄는 성과를 냈지만, 불안감을 숨기지 않았다. SK하이닉스는 올해 1분기 연결 기준 매출 17조6391억 원, 영업이익 7조 4405억 원으로... ","Mon, 28 Apr 2025 07:00:00 +0900"
2025-04-27 22:47:46,[오늘의 국회일정](28일·월),https://n.news.naver.com/mnews/article/001/0015355305?sid=100,"등, <b>반도체</b> 산업경쟁력 강화를 위한 '한국형 <b>반도체</b> 지원정책의 방향과 과제' 토론회(10:00 의원회관 제2소회의실) 박정 의원실 등, (중소·벤처·스타트업 지원을 위한) 68개 법정기금 법 개정 국회토론회(11:00... ","Mon, 28 Apr 2025 07:00:00 +0900"
2025-04-27 22:47:46,[주간IPO] 쎄크 코스닥 상장,https://www.newspim.com/news/view/20250426000110,"이를 통해 <b>반도체</b>용 고정밀 X-ray 시스템, 방산용 고에너지 X-ray 시스템(LINAC 시스템), 배터리용 고속 X-ray... 특히 HBM <b>반도체</b>와 전기차 배터리(테슬라향 46파이 원통형 포함) 검사 수요 증가로 매출 성장이 기대된다.... ","Mon, 28 Apr 2025 07:00:00 +0900"
2025-04-27 22:47:46,"[Digital대전환] 삼성SDI, '차세대MES·디지털트윈'으로 스마트팩토리 고...",https://weekly.hankooki.com/news/articleView.html?idxno=7110594,그래픽=삼성SDI AI 시대에 고성능 <b>반도체</b> 중요 AI 시대가 도래함에 따라 대용량의 데이터를 빠르게 읽고 쓸 수 있는 고성능 <b>반도체</b>가 중요해지고 있다. 고성능 <b>반도체</b>는 같은 면적의 웨이퍼에 회로를 겹겹이 쌓아... ,"Mon, 28 Apr 2025 07:00:00 +0900"
2025-04-27 22:47:46,과기정통부 &quot;AI 3대 강국 목표&quot;…1643억 신규 ICT 연구 과제 착수,https://n.news.naver.com/mnews/article/277/0005584398?sid=105,AI 3대 강국 도약을 목표로 ▲AI ▲AI <b>반도체</b> ▲양자 ▲차세대통신 ▲사이버보안 ▲방송·콘텐츠 ▲디지털 융합 ▲디지털 사회혁신 등 이번에 선정한 주요 분야별 신규사업 및 과제는 다음과 같다. 먼저 핵심 전략... ,"Mon, 28 Apr 2025 06:58:00 +0900"
2025-04-27 22:47:46,"이재명, 오늘 이승만·박정희 등 묘역 참배…대선후보 첫 일정",https://www.ngonews.kr/news/articleView.html?idxno=205994,이 후보는 묘역 참배에 이어 오후에는 SK하이닉스 이천 캠퍼스를 방문해 'AI(인공지능) 메모리 <b>반도체</b> 간담회'를 연다. 간담회에는 SK하이닉스에서 곽노정 최고경영자(CEO) 등이 참석할 것으로 보인다.,"Mon, 28 Apr 2025 06:58:00 +0900"
2025-04-27 22:47:46,'이재명 대선 후보' 첫 행보는 이승만·박정희 등 묘역 참배,https://n.news.naver.com/mnews/article/002/0002385716?sid=100,이 후보는 이날 오후에는 경기도 이천시의 SK하이닉스 이천 캠퍼스를 방문해 '인공지능(AI) 메모리 <b>반도체</b> 간담회'를 연다. 경제 성장에 중점을 둔 그간 발언을 뒷받침하는 행보다. 이 간담회에는 곽노정 SK하이닉스... ,"Mon, 28 Apr 2025 06:58:00 +0900"
2025-04-27 22:47:46,“화웨이 엔비디아에 필적할 AI칩 개발중”-WSJ,https://n.news.naver.com/mnews/article/421/0008217775?sid=104,중국 화웨이가 미국 정부의 <b>반도체</b> 수출규제에 맞서 엔비디아의 고성능 인공지능(AI) 칩을 대체할 자체... 미국 정부는 지난 수년 동안 중국에 대한 첨단 <b>반도체</b> 수출을 규제해 왔다. 대량 생산되는 최고 성능의 AI... ,"Mon, 28 Apr 2025 06:54:00 +0900"
2025-04-27 22:47:46,[유신모의 외교포커스] '트럼프 100일'이 보여준 한·미 동맹 변화 필요...,https://www.newspim.com/news/view/20250428000005,"한국은 <b>반도체</b> 등 첨단산업과 방산, 조선업 등에서 세계적인 경쟁력을 갖고 있다. 또한 한국은 막대한 대미 투자를 통해 미국 내 일자리 창출에 기여하고 있는 국가이며 한·미 경제관계는 제로섬이 아닌 상호 보완적... ","Mon, 28 Apr 2025 06:48:00 +0900"
2025-04-27 22:47:46,&quot;소득 4만달러 멀어지고 대만이 추월&quot;...IMF의 경고,https://n.news.naver.com/mnews/article/215/0001207349?sid=101,"이어 &quot;일본이 우리나라에 한번 역전당한 뒤 계속 뒤쳐지는 상황처럼, 우리도 대만에 앞으로 계속 뒤쳐질 수 있다는 경각심이 필요하다&quot;며 &quot;국가 브랜드 이미지 차원에서라도 <b>반도체</b> 제조업 경쟁력을... ","Mon, 28 Apr 2025 06:44:00 +0900"
2025-04-27 22:47:46,"이재명, ‘통합 행보’로 첫 일정…이승만·박정희 묘역도 참배",https://n.news.naver.com/mnews/article/016/0002463369?sid=100,이 자리에서 이 후보는 ‘K-<b>반도체</b>’ AI(인공지능) 메모리<b>반도체</b> 기업 간담회를 열고 관계자들의 의견을 들을 예정이다. 이 후보는 앞서 대선 출마를 공식 선언한 후 첫 번째 정책 방향으로 ‘AI 지원·성장’을 꺼냈다.... ,"Mon, 28 Apr 2025 06:39:00 +0900"
2025-04-27 22:47:46,"한국, 1인당 GDP 4만 달러 달성 시점 2029년으로 늦춰져",https://www.ebn.co.kr/news/articleView.html?idxno=1660800,"그는 &quot;일본이 한국에 한번 역전당한 뒤 계속 뒤처지는 상황처럼, 한국도 대만에 계속 뒤처질 수 있다는 경각심이 필요하다&quot;며 &quot;국가 브랜드 이미지 차원에서라도 <b>반도체</b> 제조업 경쟁력을 끌어올리는 데... ","Mon, 28 Apr 2025 06:38:00 +0900"
2025-04-27 22:47:46,"中화웨이, AI칩 개발중…&quot;엔비디아 H100보다 강력할것&quot;",https://www.goodnews1.com/news/articleView.html?idxno=446968,"미국 정부는 지난 수년간 첨단 <b>반도체</b>에 대한 중국의 접근을 막아 왔으며, 엔비디아의 H100의 경우에는... 워싱턴의 <b>반도체</b> 제조 장비 접근 차단 등 방해 노력에도 불구하고 중국 <b>반도체</b> 산업의 탄력성을 보여준다... ","Mon, 28 Apr 2025 06:38:00 +0900"
2025-04-27 22:47:46,"[주간팩트체크] '세종 집무실', 'AI는 기후악당', '의대생 정원'",https://www.newstof.com/news/articleView.html?idxno=27880,전문가들은 우리도 <b>반도체</b> 클러스터 개발 과정부터 재생에너지를 사용하도록 노력해야한다고 지적했습니다. 장기적으로 AI 빅테크 기업들이 100% 재생에너지를 쓰도록 목표를 세워야한다고 봤습니다. 3. 의대생 2000명... ,"Mon, 28 Apr 2025 06:34:00 +0900"
2025-04-27 22:47:46,"[증시전략] 1기 때와 똑같은 패턴…트럼프 대통령, 향후 행보는?",https://n.news.naver.com/mnews/article/374/0000437472?sid=104,"- 여당·야당 대선 후보 확정 예정…조기 대선 국면 진입 - 1분기 GDP 역성장, 강한 내수 부양책 필요성 역설 - 국내 조기 대선 레이스 집중…내수주 관심 지속될 것 - 국내증시 관심 업종 : 유통·음식료·<b>반도체</b>·증권... ","Mon, 28 Apr 2025 06:34:00 +0900"
