DateTime,Title,Link,Description,PubDate
2025-10-27 04:45:05,"대상, 서울고용노동청과 함께한 '취업준비콘서트 일자리톡톡' 성료",https://www.polinews.co.kr/news/articleView.html?idxno=711630,"올해는 식품, AI, 금융, <b>반도체</b>, 게임, 문화콘텐츠 등 다양한 분야의 기업들이 참여해 더욱 폭넓은 취업 정보를 제공하고 있다. 대상도 국내를 넘어 글로벌 시장을 선도하는 식품업계 대표 기업으로서 지난 24일 서울시 중구... ","Mon, 27 Oct 2025 13:44:00 +0900"
2025-10-27 04:45:05,[채권-오전] 금리 상승…코스피 4천선도 돌파,https://news.einfomax.co.kr/news/articleView.html?idxno=4380388,그는 &quot;반면 코스피가 4천도 넘어서는 등 강세인 것은 바꿔 보면 <b>반도체</b> 경기가 한은이 예상한 것보다 좋을 수 있다는 것&quot;이라면서 &quot;경기도 예상보다 더 좋다면 금리 인하의 근거는 더 약해진다&quot;고 덧붙였다. 다른... ,"Mon, 27 Oct 2025 13:44:00 +0900"
2025-10-27 04:45:05,[시장 따라잡기] 새 역사 쓴 코스피…사상 첫 4000선 돌파,https://n.news.naver.com/mnews/article/374/0000470818?sid=101,"지난주도 <b>반도체</b>주 움직임이 컸습니다. SK하이닉스는 연초만 해도 상상하기 어려웠던, 50만원선을... 이들 종목 실적이 탄탄하게 나온다면, 국내 <b>반도체</b>주들도 힘을 받아 더 갈지, 아니면 많이 오른만큼 쉬었다가 갈지요? Q.... ","Mon, 27 Oct 2025 13:44:00 +0900"
2025-10-27 04:45:05,"교육부, '2025년 대학규제혁신 우수사례' 공모",https://news.unn.net/news/articleView.html?idxno=585450,"또한 경상국립대는 2022학년도부터 교육 혁신을 위한 마이크로디그리(소단위과정) 제도를 도입하고 빅데이터, 항공·드론, <b>반도체</b> 등 12개 분야 55개 소단위 전공과정을 신설해 미래전략산업 인재 양성에 힘을 기울이는 등... ","Mon, 27 Oct 2025 13:44:00 +0900"
2025-10-27 04:45:05,"LG전자, ‘Future 2030 서밋’ 개최… 6G·AI·양자·우주산업 기술 주도...",https://www.thepowernews.co.kr/view.php?ud=202510271343146389de3f0aa1be_7,KAIST와 KRISS도 ▲AI <b>반도체</b> 기반 로봇 ▲6G 무선 전파 측정 및 공간 다중 모드 송수신 시스템 ▲양자 컴퓨터 및 소재 개발용 소프트웨어 솔루션 등을 선보이며 주목을 받았다. LG전자는 2019년 국내 최초로... ,"Mon, 27 Oct 2025 13:44:00 +0900"
2025-10-27 04:45:05,"미래에셋증권, '대만CORE 3 코퍼레이트 데이 2025' 성료",https://www.digitaltoday.co.kr/news/articleView.html?idxno=599957,IT·<b>반도체</b> 기업과 국내 기관투자자들이 참석해 글로벌 공급망 변화와 산업 트렌드에 대한 심도 있는 논의를 진행했다.  한국계 증권사 중 대만 주요 IT·<b>반도체</b> 기업들을 공식 초청해 국내 기관투자자들과... ,"Mon, 27 Oct 2025 13:42:00 +0900"
2025-10-27 04:45:05,"[위클리오늘] 이천시, 제27회 <b>반도체</b>대전 참가… 첨단산업도시 위상 강...",http://www.weeklytoday.com/news/articleView.html?idxno=733897,이천시는 10월 22일부터 24일까지 서울 삼성동 코엑스에서 열린 '제27회 <b>반도체</b>대전(SEDEX 2025)'에 참가해 첨단산업도시로서의 경쟁력과 우수한 투자 환경을 적극적으로 홍보했다. 국내 최대 규모의 <b>반도체</b> 전시회인 이번... ,"Mon, 27 Oct 2025 13:42:00 +0900"
2025-10-27 04:45:05,"코나아이, 3분기 영업익 302억원...전년 동기비 198% 증가",http://www.hansbiz.co.kr/news/articleView.html?idxno=786002,코로나19 여파로 지연됐던 <b>반도체</b> 수급 문제가 해소되면서 메탈카드 생산 여건이 개선된 것도 실적 개선에 도움을 줬다. 국내 결제플랫폼 사업도 회복세를 탔다. 정부의 민생회복 소비쿠폰 정책에 따라 지역사랑상품권... ,"Mon, 27 Oct 2025 13:42:00 +0900"
2025-10-27 04:45:05,"안성시, <b>반도체</b>대전 참가⋯ 강소기업 유치 박차",https://www.asiatime.co.kr/article/20251027500302,안성시가 서울 코엑스에서 열린 SEDEX 2025(<b>반도체</b>대전)에 참가해 <b>반도체</b> 소부장 특화단지와 맞춤형 기업 지원 사업을 홍보하며 <b>반도체</b> 강소기업 유치에 나섰다. 안성시가 지난 22일부터 24일까지 서울 코엑스에서 열린... ,"Mon, 27 Oct 2025 13:42:00 +0900"
2025-10-27 04:45:05,"한국수자원공사, '물 주권' 뚝심 보여줬다...국내 기술로 '초순수' 상용...",https://www.startuptoday.co.kr/news/articleView.html?idxno=529688,"초순수는 <b>반도체</b> 세정에 쓰이는 물로, 생산 품질과 수율을 좌우하는 핵심 자원이다. 이번 공급은 외국 기업, 특히 일본에 의존하던 초순수 기술을 한국이 처음으로 자립화한 사례다. 정부의 'K-<b>반도체</b> 전략'에서 물... ","Mon, 27 Oct 2025 13:42:00 +0900"
2025-10-27 04:45:05,[주간 ETF]&quot;나스닥으로 자금 몰린다&quot;...한국은 AI 전력·2차전지 강세,http://www.globalepic.co.kr/view.php?ud=2025102713290178945ebfd494dd_29,"자금 유입 측면에서는 KODEX 머니마켓액티브에 2,986억원이 유입되며 1위를 기록했으며, TIGER <b>반도체</b> TOP10에 2,709억원, ACE KRX 금현물에 2,082억원이 각각 유입됐다. 반면 KODEX 국고채 3년에서는 1,589억원이... ","Mon, 27 Oct 2025 13:42:00 +0900"
2025-10-27 04:45:05,"DHB그룹, 중동·아시아 거점 확장… 글로벌 할랄 시장을 新성장축으로",https://www.ppss.kr/news/articleView.html?idxno=272674,"DHB그룹은 전체 할랄 산업 규모를 원화 기준 약 3,000조 원으로 추산하며, &quot;AI·<b>반도체</b> 산업에 견줄 차세대 신성장 동력&quot;으로 평가하고 있다. 김 회장은 &quot;한국은 기술력과 신뢰도를 바탕으로 할랄 경제의 허브가 될... ","Mon, 27 Oct 2025 13:41:00 +0900"
2025-10-27 04:45:05,"안성시, <b>반도체</b>대전(SEDEX 2025) 참가",http://www.m-i.kr/news/articleView.html?idxno=1295674,안성시 <b>반도체</b>대전(SEDEX 2025) 참가(가운데 김보라 안성시장) 사진=안성시 제공 매일일보 = 한철희 기자  |  안성시는 지난 10월 22일부터 24일까지 서울 코엑스(3층)에서 열린 SEDEX 2025(<b>반도체</b>대전)에 참가해 <b>반도체</b> 소부장... ,"Mon, 27 Oct 2025 13:40:00 +0900"
2025-10-27 04:45:05,코스피 4000·10만 전자 돌파... &quot;추위조차 잊게 만드는 상승폭&quot;,https://www.ilyoseoul.co.kr/news/articleView.html?idxno=508720,"특히 AI·<b>반도체</b> 테마에 자금이 몰리는 현상이 1999~2000년 닷컴 열풍과 유사하다는 지적이 제기된다. 연초... 핵심 업종인 <b>반도체</b>를 중심으로 기업 이익이 실제 개선되고 있고, 주가 역시 이를 반영하는 재평가... ","Mon, 27 Oct 2025 13:40:00 +0900"
2025-10-27 04:45:05,이재용 취임 3주년에 '10만전자'… 뉴삼성 본격 개막,http://www.seoulwire.com/news/articleView.html?idxno=676974,"<b>반도체</b> 경쟁력 회복과 인공지능(AI) 확산에 따른 우호적 시장 환경, 대형 고객사 수주 등이 복합적으로... ◆HBM·파운드리 초격차 '재가동'… <b>반도체</b> 명가 위상 탈환 업계에서는 삼성전자의 주가가 긍정적 흐름을 탄... ","Mon, 27 Oct 2025 13:40:00 +0900"
2025-10-27 04:45:05,3분기 외화증권 보관액 19% 증가…美 주식 보관액 상위권 싹쓸이,https://n.news.naver.com/mnews/article/421/0008565074?sid=101,"1위 종목은 스탠더드앤드푸어스(S&amp;P)500 지수를 추종하는 'SPY'(SPDR S&amp;P 500 ETF TRUST)였고, <b>반도체</b> 지수를 3배 따르는 'SOXL'(DIREXION DAILY SEMICONDUCTORS BULL 3X ETF)과 테슬라가 그 뒤를 이었다.","Mon, 27 Oct 2025 13:39:00 +0900"
2025-10-27 04:45:05,AI 13시 시보뉴스_국토부 부동산 '불법 거래' 집중 조사,https://news.skbroadband.com/news/articleView.html?idxno=210563,안성시는 용인 <b>반도체</b> 단지의 남부와 연결하는 핵심 도로망이 될 것으로 기대하고 있습니다. 화성시와 안성시는 오는 2030년 착공을 목표로 하고 있습니다. 김동연 경기도지사가 투자 유치를 위해 미국 출장길에... ,"Mon, 27 Oct 2025 13:38:00 +0900"
2025-10-27 04:45:05,"오산시, 제37회 시민의 날 ‘드론라이트 쇼’ 개최",https://www.asiatime.co.kr/article/20251027500298,"해피 산타마켓’, 교통 인프라(KTX·GTX-C·트램), AI <b>반도체</b> 산업 등을 상징하는 장면이 연출되며‘미래도시 오산’의 비전을 시각적으로 표현했다. 이와 함께 진행된 경관조명 점등식에서는 오산시장과 시의회 의장... ","Mon, 27 Oct 2025 13:38:00 +0900"
2025-10-27 04:45:05,"&quot;달러 패권 흔들린다&quot;…한경협, 글로벌 질서 재편 해법 모색",https://www.newspim.com/news/view/20251027000712,"그는 &quot;AI는 미중 전략경쟁의 핵심이며, 한국은 AI 응용 분야에서 기회를 창출할 수 있지만 <b>반도체</b> 생산국으로서 양측 압박 속에서 전략적 균형을 모색해야 한다&quot;고 진단했다. 이어 OECD 무역전문가 존 드럼몬드와 하비에르... ","Mon, 27 Oct 2025 13:36:00 +0900"
2025-10-27 04:45:05,"대상, 서울고용노동청 주최 '취업준비콘서트 일자리톡톡' 참여",https://sports.hankooki.com/news/articleView.html?idxno=6914068,"올해는 식품, AI, 금융, <b>반도체</b>, 게임, 문화콘텐츠 등 다양한 분야의 기업들이 참여했다. 대상도 지난 24일 서울시 중구 장교동에 위치한 서울고용복지플러스센터에서 진행된 행사에 참여했다. 이날 행사에서 대상은 청년... ","Mon, 27 Oct 2025 13:36:00 +0900"
2025-10-27 04:45:05,"코스피 4,000 시대 열렸다...첫 '10만 전자' 기록",https://n.news.naver.com/mnews/article/052/0002264894?sid=101,"<b>반도체</b> 투톱이 코스피 강세를 주도하고 있습니다. 증권가에서는 이 기세라면 연말에 코스피가 4,100까지 갈 수 있다는 전망을 내놓고 있습니다. 코스닥도 0.8% 오른 890으로 출발해 1%대 상승세를 보이며 900을... ","Mon, 27 Oct 2025 13:36:00 +0900"
2025-10-27 04:45:05,"두산 최선호, SK·LG·HD 차선호... 지주사 기업가치 재평가",https://www.ilovepc.co.kr/news/articleView.html?idxno=56553,"두산은  AI와 <b>반도체</b> 산업 호황에 따른 직접 수혜가 예상되며, 자회사인 두산에너빌리티와 두산로보틱스를... 최근 AI, <b>반도체</b>, 조선, 방산, 원전 등 주식시장 상승 국면에도 자회사 부재로 빛을 보지 못했지만, 최근 ESS... ","Mon, 27 Oct 2025 13:36:00 +0900"
2025-10-27 04:45:05,APEC 핵심이슈·기업 대응전략은…삼일PwC 보고서 발간,https://n.news.naver.com/mnews/article/008/0005268618?sid=101,"CEO 서밋에선 AI·<b>반도체</b>·클라우드 등 혁신기술 기업간 글로벌 협력기회가 본격 논의한다. 한국과 글로벌 빅테크 기업 간 공동 연구·투자, 기술교류 등이 구체화할 것이라고 연구진은 설명했다. 연구진은 &quot;<b>반도체</b>... ","Mon, 27 Oct 2025 13:36:00 +0900"
2025-10-27 04:45:05,"화성특례시, 화성~안성 민자고속도로 'KDI' 통과...남부권 개발 '청신호...",https://www.ilyoseoul.co.kr/news/articleView.html?idxno=508707,"이번 민자고속도로는 평택·용인·이천 등 인근 <b>반도체</b> 및 첨단 소재·부품·장비 산업 거점과의 접근성을 높여 관련 산업의 경쟁력을 강화하고, 기업 투자 여건 개선에도 긍정적인 영향을 미칠 것으로 전망된다. 아울러... ","Mon, 27 Oct 2025 13:36:00 +0900"
2025-10-27 04:45:05,김진태 지사 &quot;미래산업은 현재완료형&quot;…3대 핵심 산업 8874억 투자 집중,https://n.news.naver.com/mnews/article/277/0005670034?sid=102,강원특별자치도(도지사 김진태)는 <b>반도체</b>·바이오헬스·미래차 등 강원의 3대 미래산업에 총 58개 사업 8874억원이 투자되며 미래산업 성장을 위한 투자가 계속 이어지고 있다고 27일 밝혔다. 도는 <b>반도체</b> 산업 육성을... ,"Mon, 27 Oct 2025 13:35:00 +0900"
2025-10-27 04:45:05,[위클리오늘] 화성시 남부권 개발 '청신호'... 화성~안성 민자고속도로...,http://www.weeklytoday.com/news/articleView.html?idxno=733893,"이번 민자고속도로는 평택·용인·이천 등 인근 <b>반도체</b> 및 첨단 소재·부품·장비 산업 거점과의 접근성을 높여 관련 산업의 경쟁력을 강화하고, 기업 투자 여건 개선에도 긍정적인 영향을 미칠 것으로 전망된다. 아울러... ","Mon, 27 Oct 2025 13:34:00 +0900"
2025-10-27 04:45:05,"미래에셋증권, ‘대만 CORE3 코퍼레이트데이 2025’ 성료",https://www.kgnews.co.kr/news/article.html?no=870890,"국내 기관투자자와 글로벌 교류의 장 열어 미래에셋증권이 대만 주요 IT·<b>반도체</b> 기업을 초청해 국내... 대만의 주요 IT·<b>반도체</b> 기업인 Hon Hai(폭스콘), ASPEED Technology, Compal Electronics 등 ‘대만 CORE 3’ 기업이... ","Mon, 27 Oct 2025 13:34:00 +0900"
2025-10-27 04:45:05,"SK하이닉스, HBM 전용 팹 M15X 가동 준비 박차",http://www.whitepaper.co.kr/news/articleView.html?idxno=253673,"화이트페이퍼, WHITEPAPERSK하이닉스가 24일 이사회 결의를 거쳐 충북 청주시에 건설할 신규 팹(fab·<b>반도체</b>... SK하이닉스는 청주 M15X 외에도 용인 <b>반도체</b> 클러스터와 미국 인디애나주 어드밴스드 패키징 공장 건설을... ","Mon, 27 Oct 2025 13:34:00 +0900"
2025-10-27 04:45:05,"DHB그룹, 중동·아시아 거점 확대로 글로벌 네트워크 강화",https://www.mhns.co.kr/news/articleView.html?idxno=729229,"그룹은 &quot;할랄 산업은 AI·<b>반도체</b>에 버금가는, 혹은 그 이상으로 성장 잠재력을 가진 신성장 동력&quot;이라고 평가했다. DHB그룹은 향후 UAE·사우디·카타르·오만·싱가포르 등 중동·아시아 주요 파트너와의 협력을... ","Mon, 27 Oct 2025 13:34:00 +0900"
2025-10-27 04:45:05,"화성~안성 민자고속道, 조성 추진…KDI 적격성조사 통과",https://n.news.naver.com/mnews/article/003/0013560333?sid=102,특히 화성시는 평택·용인·이천 등 중부내륙을 연결하는 교통인프라 확충으로 <b>반도체</b> 및 첨단 소재·부품·장비 산업 거점과 연결된다는 점을 들어 관련 산업 경쟁력 강화와 투자여건 개선 효과를 기대하고 있다. 정명근... ,"Mon, 27 Oct 2025 13:33:00 +0900"
2025-10-27 04:45:05,"삼성그룹, 입사지원자 대상 직무적성검사 실시",https://hbnpress.com/news/view/1065587190412736,"<b>반도체</b>를 중심으로 한 주요 부품사업, 미래 먹거리로 자리 잡은 바이오 산업, 핵심기술로 급부상한 인공지능(AI) 분야를 위주로 채용을 늘려나갈 예정이다. 삼성은 인재 제일의 경영 철학을 실천하고 청년들에게 공정한... ","Mon, 27 Oct 2025 13:32:00 +0900"
2025-10-27 04:45:05,"(특징주)삼성전자, '10만전자' 달성…이재용 3주년날 시총 600조원 돌파",http://www.newstomato.com/ReadNews.aspx?no=1279158&inflow=N,"<b>반도체</b> 슈퍼사이클에 대한 기대감과 인공지능(AI) 산업 확대, 자사주 매입 효과가 맞물리며 주가가 사상... 또한 오픈AI의 700조원 규모 초거대 AI 프로젝트 '스타게이트'에도 참여해 글로벌 AI <b>반도체</b> 생태계의 핵심... ","Mon, 27 Oct 2025 13:32:00 +0900"
2025-10-27 04:45:05,"관세청, 입국 편의 높이고 면세점 설치 늘린다",https://n.news.naver.com/mnews/article/003/0013560330?sid=102,"수도·중부권(서울·경기·인천·대전·충청)에서는 송도 바이오 클러스터, 인천공항 항공기 첨단복합항공단지(MRO), 용인 <b>반도체</b> 클러스터 구축을 지원해 첨단산업 중심 성장 기반을 강화한다. 동남권(부산·울산·경남)... ","Mon, 27 Oct 2025 13:32:00 +0900"
2025-10-27 04:45:05,APEC CEO 서밋 '슈퍼위크' … 젠슨 황·최태원·이재용 경주서 만난다,http://www.globalepic.co.kr/view.php?ud=20251027132851415648439a4874_29,"AI 업계를 주도하고 있는 엔비디아와 고대역폭메모리(HBM) 시장을 이끄는 SK하이닉스, 삼성전자의 <b>반도체</b> 협업 방안 등에 이목이 집중되고 있기 때문이다. 정기선 HD현대 회장은 27일 APEC CEO 서밋 부대행사로 열리는... ","Mon, 27 Oct 2025 13:32:00 +0900"
2025-10-27 04:45:05,"삼성전자, 이재용 3주년에 10만 고지… AI·<b>반도체</b> ‘투톱 엔진’ 기대감",https://www.etoday.co.kr/news/view/2518718,"이투데이=송영록 기자 | <b>반도체</b> 실적 반등·AI 수요 확대가 ‘10만원 랠리’ 이끌어 갤럭시 판매 호조... <b>반도체</b> 업황 반등과 인공지능(AI) 수요 확대, 주주가치 제고 정책이 동시에 맞물리며 ‘10만전자’의 서막을... ","Mon, 27 Oct 2025 13:32:00 +0900"
2025-10-27 04:45:05,이재용 '취임 3주년'에 '10만 전자' 돌파,https://n.news.naver.com/mnews/article/448/0000566281?sid=101,"<b>반도체</b> 업황 회복에 대한 기대감과 고대역폭 메모리(HBM) 경쟁력, 주가 부양을 위한 자사주 매입 노력 등이... 이 같은 주가 하락의 배경에는 <b>반도체</b> 사업이 부진했다는 점이 꼽힌다. 이후 삼성전자의 잇따른 수주 소식... ","Mon, 27 Oct 2025 13:32:00 +0900"
2025-10-27 04:45:05,"'개미 무덤' 오명 벗나…2차전지주, 10월 들어 '폭풍 반등'",https://n.news.naver.com/mnews/article/629/0000437615?sid=101,"KRX 2차전지 TOP 10 지수는 '코스피 4000 시대' 돌파를 이끈 삼성전자, SK하이닉스 등 <b>반도체</b> 종목이 포함된 'KRX AI <b>반도체</b> 지수'와 'KRX <b>반도체</b> Top 15' 지수 등보다 상승률이 10%포인트 이상 높아 이목을 끈다. 동기간 KRX... ","Mon, 27 Oct 2025 13:31:00 +0900"
2025-10-27 04:45:05,"뉴로메카, 김경수 지방시대위원장 포항지사 방문",https://www.newspim.com/news/view/20251027000583,"뉴로메카는 &quot;<b>반도체</b> 산업이 파운드리 체계를 통해 글로벌 경쟁력을 확보했듯, 로봇산업도 제조기반을 집적화하여 중소 혁신기업이 성장할 수 있는 기반을 갖춰야 한다&quot;고 설명했다. 이에 대해 김 위원장은 &quot;미래지향적인... ","Mon, 27 Oct 2025 13:30:00 +0900"
2025-10-27 04:45:05,충북 마이스터고 3곳 모두 신입생 경쟁률 상승,https://www.newspim.com/news/view/20251027000677,"충북에너지고등학교는 1.11 대 1에서 1.56 대 1로 0.45p(포인트), 충북<b>반도체</b>고등학교는 1.51 대 1에서 2.26 대 1로 0.75p, 한국바이오마이스터고등학교도 1.26 대 1에서 1.42 대 1로 0.16p 각각 경쟁률이 올랐다. 충북교육청. [사진... ","Mon, 27 Oct 2025 13:30:00 +0900"
2025-10-27 04:45:05,"[그래픽] 이재용 취임 3주년, 삼성 재도약의 ‘원년'",https://www.ceoscoredaily.com/page/view/2025102710552744229,"그러나 지난 7월 ‘부당합병·회계부정’ 상고심에서 무죄 판결로 사법 리스크에서 벗어나고, AI(인공지능) 시대 ‘<b>반도체</b> 슈퍼사이클’ 훈풍에 올라타면서 다시 역대급의 실적으로 복귀했다. 오랜 기간 발목을 잡아 온... ","Mon, 27 Oct 2025 13:30:00 +0900"
2025-10-27 04:45:05,<b>반도체</b> 공정! 국립금오공대서 미리 배워요.,http://www.kyosu.net/news/articleView.html?idxno=147262,"국립금오공과대학교(총장 곽호상)가 구미지역 고등학생을 대상으로 10월부터 12월까지 '<b>반도체</b> 공정 실습 교육'을 진행한다. 국립금오공대 RISE사업단(K-U시티), 지역 고교생 대상 <b>반도체</b> 교육 추진 국립금오공대... ","Mon, 27 Oct 2025 13:30:00 +0900"
2025-10-27 04:45:05,"이재용 취임 3주년 날, 삼성전자 주가 10만원 돌파",https://www.socialvalue.kr/news/view/1065587061047783,"이재용 회장 취임 3주년을 맞은 날 기록한 상징적인 성과로, <b>반도체</b> 업황 회복과 글로벌 빅테크 협력... 삼성전자는 2023년 말 5만원대에 머물며 ‘국민주’의 상징이 흔들렸지만, <b>반도체</b> 불황이 저점을 지나고 HBM... ","Mon, 27 Oct 2025 13:28:00 +0900"
2025-10-27 04:45:05,"화성~안성 민자고속도로, KDI 적격성 조사 통과",https://www.asiatoday.co.kr/view.php?key=20251027010010405,장기적으로는 시 전역을 연결하는 내부순환도로망의 완성도 역시 한층 높아질 것으로 기대된다.아울러 화성~안성 민자고속도로는 평택·용인·이천 등 인근 <b>반도체</b> 및 첨단 소재·부품·장비 산업 거점과의 접근성을 높여... ,"Mon, 27 Oct 2025 13:28:00 +0900"
2025-10-27 04:45:05,"대상, 서울고용노동청 함께 '취업준비콘서트 일자리톡톡' 마쳐",https://www.newsfreezone.co.kr/news/articleView.html?idxno=654032,"올해는 식품, AI, 금융, <b>반도체</b>, 게임, 문화콘텐츠 등 다양한 분야의 기업들이 참여해 더욱 폭넓은 취업 정보를 제공하고 있다. 대상도 국내를 넘어 글로벌 시장을 선도하는 식품업계 대표 기업으로서 지난 24일 서울시 중구... ","Mon, 27 Oct 2025 13:28:00 +0900"
2025-10-27 04:45:05,"코스피, 4010선서 등락…코스닥도 1%대 강세 지속",https://n.news.naver.com/mnews/article/018/0006148338?sid=101,사상 처음으로 4000포인트를 넘긴 코스피가 4010선에서 등락 중이다. 장중 일제히 사상 최고가를 기록한 삼성전자(005930)와 SK하이닉스(000660)도 상승 흐름을 지키고 있다. 27일 엠피닥터에 따르면 이날... ,"Mon, 27 Oct 2025 13:27:00 +0900"
2025-10-27 04:45:05,[인터뷰] 정은미 선임연구위원 “탄소중립 이행 통해 산업 성장 동력화...,https://www.viva100.com/article/20251026500485,"특히 코로나 팬데믹 당시 글로벌 공급망 차질로 자동차 <b>반도체</b> 수급이 안 돼 자동차를 생산하지 못하고... 한국 산업 경쟁력과 위상을 보면 <b>반도체</b>와 자동차 등 주력제품은 상위권 수준이지만 첨단 기술은 미국, 일본... ","Mon, 27 Oct 2025 13:26:00 +0900"
2025-10-27 04:45:05,[테크M 리포트] 지수상승 랠리서 소외된 게임주…신작 앞세워 다시 뛴다,https://www.techm.kr/news/articleView.html?idxno=145761,"<b>반도체</b>, 2차전지 등 대표 성장 섹터에 자금이 쏠린 가운데 게임주는 실적 부진과 신작 지연 등으로 주가가 길게 눌려 있었기 때문이다. 그러나 연말을 앞두고 주요 대형 게임사들이 대작 신작을 잇따라 공개하거나 출시... ","Mon, 27 Oct 2025 13:26:00 +0900"
2025-10-27 04:45:05,[투자 알고리즘] 삼성전자 10만원 매도? 오히려 추격 매수 기회?,https://news.mtn.co.kr/news-detail/2025102713083537019,"<b>반도체</b> 대장 대비 잠잠한 소부장주… 오히려 기회?Q. 아직도 호재 한가득… 조선주, 신고가 행진 이어진다?Q. HD현대 vs 한화오션 vs 삼성중공업… 주가 매력도는?Q. 덩달아 돌풍부는 조선기자재주… 가장 관심있게 볼... ","Mon, 27 Oct 2025 13:26:00 +0900"
2025-10-27 04:45:05,[생생뉴스] 정상외교 ‘슈퍼위크’…‘트럼프·시진핑’ 맞이,https://n.news.naver.com/mnews/article/056/0012054368?sid=100,그러한 부분에서 만약에 계속 이 상황이 길어지게 되면 뭐 눈에 띄게 국내 기업들 특히 자동차 <b>반도체</b> 철강 기업들은 그 타격이 꽤 클 것이고요. 당연히 그렇게 되면은 우리는 국가 경쟁력 환율 이런 것들 투자 문제에서... ,"Mon, 27 Oct 2025 13:25:00 +0900"
2025-10-27 04:45:05,[머닝(Money-Ing)] <b>반도체</b> 다음은 2차전지 ESS 제2 전성기가 온다,https://news.mtn.co.kr/news-detail/2025102711551180814,시 <b>반도체</b> 필두 대형주 장세 지속- 수출 섹터 대장주 관심 APEC 관심 섹터 : <b>반도체</b> - <b>반도체</b> 섹터· 삼성전자· SK하이닉스 관심- 외국인 9월 삼성전자 4.6조· SK하이닉스 1.3조 매수- 트럼프의 관세 압박에도... ,"Mon, 27 Oct 2025 13:24:00 +0900"
