DateTime,Title,Link,Description,PubDate
2026-06-10 10:36:14,"‘만년 적자’ 대일본 수출, 올해는 판 뒤집히나 [강기자의 세종실록]",https://n.news.naver.com/mnews/article/081/0003651384?sid=102,대일본 수출 53년 만에 39%→3% <b>반도체</b> 소재·기술 국산화·수출 다변화 韓 <b>반도체</b> 수출 늘면 日도 덩달아 성장 “한일 <b>반도체</b> 밸류체인 연결돼 있어” 日 <b>반도체</b> 소부장 강해…비메모리 우세 ‘한류 열풍’ 화장품 K뷰티... ,"Wed, 10 Jun 2026 19:34:00 +0900"
2026-06-10 10:36:14,"개원 43주년 건설연, 미래 성장전략 확보 본격화...“2050 국토·도시 혁...",https://n.news.naver.com/mnews/article/030/0003436523?sid=105,건설연은 국가 미래 성장동력과 연계한 기술주도 성장 기반 마련에 기여하기 위해 <b>반도체</b>·AI·소형모듈러원자로(SMR) 등 국가전략산업을 뒷받침하는 핵심 인프라 분야에 연구 역량을 집중할 계획이다. 아울러 재난·재해... ,"Wed, 10 Jun 2026 19:34:00 +0900"
2026-06-10 10:36:14,"李대통령, 벨기에 정상회담서 <b>반도체</b>·교육 협력 강화",https://n.news.naver.com/mnews/article/079/0004156512?sid=100,"&quot;연구협력 확대로 미래 <b>반도체</b>기술 혜택 함께 누리길&quot; '중소기업, 스타트업 협력 MOU&quot; 체결로 동반성장 모색... 열고 <b>반도체</b>와 중소기업 등의 분야에 대한 협력 방안을 모색했다. 청와대 강유정 수석대변인은 이날 브뤼셀... ","Wed, 10 Jun 2026 19:32:00 +0900"
2026-06-10 10:36:14,"SKT·NTT·중화텔레콤 5억弗 펀드 조성… AI생태계 투자 [한·일 협력, 새...",https://n.news.naver.com/mnews/article/014/0005533372?sid=105,"전 세계 AI 데이터센터 인프라·AI <b>반도체</b>·서비스 기술 기업에 공동투자하는 방식이다. 최태원 SK그룹... 한국, 일본 등 동아시아 각국이 보유한 AI, 정보통신기술(ICT), <b>반도체</b> 및 네트워크 기술 역량을 글로벌 혁신... ","Wed, 10 Jun 2026 19:31:00 +0900"
2026-06-10 10:36:14,"인천 중구보건소, 물류센터·생산기지 말라리아 예방 활동",https://www.gukjenews.com/news/articleView.html?idxno=3605107,인천시 중구보건소가 관내 대형 물류센터와 글로벌 첨단 <b>반도체</b> 생산시설을 대상으로 말라리아 유입 차단을 위한 예방 활동을 강화했다. 사진=중구  인천시 중구보건소가 관내 대형 물류센터와 글로벌 첨단 <b>반도체</b>... ,"Wed, 10 Jun 2026 19:30:00 +0900"
2026-06-10 10:36:14,&quot;AI수요 폭증에 <b>반도체</b> 팹 신설… 전력·땅·사람·물 다 갖춰야&quot; [한·일...,https://n.news.naver.com/mnews/article/014/0005533370?sid=101,최태원 SK그룹 회장이 인공지능(AI) 확산에 따른 <b>반도체</b> 수요 급증에 대응해 용인 <b>반도체</b> 클러스터 이후 추가적인 <b>반도체</b> 생산거점 확보 필요성을 공식 언급했다. 글로벌 <b>반도체</b> 패권 경쟁에서 우위를 확보하기 위한... ,"Wed, 10 Jun 2026 19:30:00 +0900"
2026-06-10 10:36:14,이종화 충남도의원 &quot;충남은 전기 통로 아냐&quot;…송전탑 설치 우려 표명,https://www.gukjenews.com/news/articleView.html?idxno=3605108,이종화 충남도의원  충남도의회 이종화 의원이 용인 <b>반도체</b> 국가산단과 연계된 초고압 송전선로 건설과 관련해 충남도의 적극적인 대응을 촉구했다. 이종화 의원은 제368회 정례회 5분발언에서 충남이 이미 발전·송전... ,"Wed, 10 Jun 2026 19:30:00 +0900"
2026-06-10 10:36:14,"전남광주특별시의 성공, ‘기업 유치’가 결정 / 주정민",http://www.kjdaily.com/article.php?aid=1781087184680167028,"아울러 인공지능(AI), <b>반도체</b>, 에너지, 모빌리티 등 미래 신산업 분야에서는 기존 규제를 과감히 철폐하는 ‘규제 프리존’을 제공해야 한다. 지방정부 역시 규제 완화에만 머무르지 않고, 대학과 연계한 맞춤형 인재... ","Wed, 10 Jun 2026 19:30:00 +0900"
2026-06-10 10:36:14,"이 대통령, 벨기에 총리와 정상회담…&quot;<b>반도체</b> 발전 혜택 함께&quot;",https://n.news.naver.com/mnews/article/055/0001363330?sid=100,<b>반도체</b> 분야의 협력도 논의됐습니다. 이 대통령은 벨기에가 설립한 유럽 최대 규모의 비영리 종합 <b>반도체</b> 연구소인 아이멕(IMEC)에 150여 명의 한국인 연구진이 나노·<b>반도체</b> 분야에서 협력하고 있다는 점을 언급하며... ,"Wed, 10 Jun 2026 19:28:00 +0900"
2026-06-10 10:36:14,"오픈AI, 762조원 규모 초대형 AI 데이터센터 장기 임대 막바지 협상",https://www.ebn.co.kr/news/articleView.html?idxno=1712052,"<b>반도체</b>, 전력 인프라, 인건비 등을 포함한 총 사업비는 최소 5000억 달러(약 762조원) 수준으로 추산된다.... 이는 AI <b>반도체</b> 시장 경쟁사인 구글을 견제하기 위한 전략적 행보로 해석된다. 앞서 구글은 자사 텐서처리장치... ","Wed, 10 Jun 2026 19:28:00 +0900"
2026-06-10 10:36:14,"&quot;소버린 AI, 소버린 네트워크가 전제&quot;…장비업계 &quot;통신 투자 유인책 필...",https://n.news.naver.com/mnews/article/138/0002230510?sid=105,"제조, <b>반도체</b>, 에너지 분야가 대부분이고 통신 분야는 찾아보기 어려운 상황&quot;이라고 말했다.... 유성현 KMW 사장은 &quot;정부가 네트워크 투자 활성화를 위한 정책적 유인책을 통신사에 마련해 줄 필요가 있다&quot;며 &quot;<b>반도체</b>... ","Wed, 10 Jun 2026 19:28:00 +0900"
2026-06-10 10:36:14,"李 대통령, 벨기에 총리와 정상회담…배터리소재·에너지 투자 확대",https://n.news.naver.com/mnews/article/629/0000506639?sid=100,이 대통령은 벨기에에 위치한 세계 최고 수준의 <b>반도체</b> 연구기관인 IMEC에 120여 명의 한국 연구진들이 나노 <b>반도체</b> 분야에서 협력하고 있음을 언급하며 IMEC을 통한 연구 협력이 지속 확대돼되어 미래 <b>반도체</b> 기술 발전에... ,"Wed, 10 Jun 2026 19:27:00 +0900"
2026-06-10 10:36:14,&quot;빅테크는 산타 아냐&quot; 젠슨 황의 'AI <b>반도체</b> 선물'에 남겨진 숙제,https://www.thepublic.kr/news/articleView.html?idxno=307279,"<b>반도체</b>, 인공지능(AI) 데이터 센터, 로보틱스 등 주요 분야에서 협력 논의가 이어지면서 산업계 기대도... 가장 주목받은 분야는 AI <b>반도체</b>였다. 삼성전자와 SK하이닉스는 엔비디아 AI 가속기에 들어가는 고대역폭 메모리... ","Wed, 10 Jun 2026 19:26:00 +0900"
2026-06-10 10:36:14,메모리 수요 폭증에 1분기 세계 <b>반도체</b> 매출 '3000억달러' 돌파,https://it.chosun.com/news/articleView.html?idxno=2023092163658,세계 <b>반도체</b> 시장의 분기 매출이 메모리 <b>반도체</b>의 기록적인 성장세에 힘입어 사상 처음 3000억달러를 돌파했다. 10일 시장조사업체 옴디아에 따르면 2026년 1분기 세계 <b>반도체</b> 매출은 전 분기 대비 27% 증가한 3190억달러... ,"Wed, 10 Jun 2026 19:26:00 +0900"
2026-06-10 10:36:14,코스피 -8%→+8%→-4% 롤러코스터…화장품은 '상대적 견조',https://www.thebk.co.kr/news/articleView.html?idxno=310018,"이날 증시는 전일 미국 <b>반도체</b>를 중심으로 한 기술주 약세의 영향으로 하락 출발한 이후, 장중 중동 지역의 지정학적 갈등과 일본 금리 인상 우려가 겹치며 낙폭을 확대했다. 특히 전기전자와 운송장비 업종을... ","Wed, 10 Jun 2026 19:24:00 +0900"
2026-06-10 10:36:14,[생의 한가운데]나는 전북에 살고 있다,https://sjbnews.com/news/news.php?number=880361,"삼성<b>반도체</b>처럼 당사자들만을 위한 축배가 아닌, 도민들에게 새만금은 지도 위에 그려진 가상의 낙원이 아니라 공장과 데이터센터가 들어서고, 청년들이 일자리를 찾아 모여들며, 대한민국의 미래 먹거리를 생산하는... ","Wed, 10 Jun 2026 19:22:00 +0900"
2026-06-10 10:36:14,&quot;공장만 옮긴다고 전부 아냐…인력·인프라 지원 뒷받침해야&quot;,https://n.news.naver.com/mnews/article/018/0006302506?sid=101,삼성전자와 SK하이닉스의 호남·충청권 신규 투자안이 검토되면서 <b>반도체</b> 산업의 지역 분산이 현실화할지... “지역 균형발전 효과 기대…위험 분산도 필요” 전문가들은 <b>반도체</b> 산업의 지역 분산 자체는 긍정적으로... ,"Wed, 10 Jun 2026 19:21:00 +0900"
2026-06-10 10:36:14,"앰코, 광주에 1조 투자 검토…<b>반도체</b> 후공정 공장 증설",https://n.news.naver.com/mnews/article/001/0016131656?sid=105,<b>반도체</b> 후공정 기업인 앰코테크놀로지코리아가 광주사업장에 1조원 규모의 투자를 검토 중이다. 10일 광주시... 앰코코리아가 광주공장 증설에 나선 것은 세계 최대 <b>반도체</b> 위탁 생산(파운드리) 기업인 대만TSMC에서... ,"Wed, 10 Jun 2026 19:21:00 +0900"
2026-06-10 10:36:14,한-벨기에 정상회담…李대통령 &quot;<b>반도체</b> 혜택 함께 누릴 수 있길&quot;,https://www.shinailbo.co.kr/news/articleView.html?idxno=5029330,"갖고, <b>반도체</b>·배터리 등 전략산업과 중소기업·교육·문화 등 분야에서 양국 간 실질적 협력 방안을 폭넓게... 첨단 첨단기술 분야에서는 벨기에에 위치한 세계 최고 수준의 비영리 종합 <b>반도체</b> 연구기관인 '아이멕(IMEC)'을... ","Wed, 10 Jun 2026 19:20:00 +0900"
2026-06-10 10:36:14,[亞증시-종합] 중동 지정학적 긴장 고조 속 일제히 하락,https://news.einfomax.co.kr/news/articleView.html?idxno=4419344,특히 인공지능(AI) 및 <b>반도체</b> 관련 종목을 중심으로 매도세가 집중됐다. 이날 밤 발표되는 미국의 5월... 세계 최대 <b>반도체</b> 위탁생산(파운드리) 업체인 대만 TSMC의 올해 5월 매출은 전년 동기 대비 30% 이상 증가한... ,"Wed, 10 Jun 2026 19:16:00 +0900"
2026-06-10 10:36:14,"'27년도 병역지정업체 선정 및 인원배정 기준 고시...AI, 방산, <b>반도체</b> ...",https://www.aitimes.kr/news/articleView.html?idxno=40441,"2027년에는 인공지능(AI), 방산, <b>반도체</b>, 이차전지 등 국가첨단전략산업 분야에 대한 지원을 강화하고... 소재·부품·장비 전문기업, 저탄소 인증기업 및 <b>반도체</b>, 이차전지 등 국가첨단전략산업법에 따라... ","Wed, 10 Jun 2026 19:14:00 +0900"
2026-06-10 10:36:14,청주 SK하이닉스 사업장서 화학물질 접촉사고…2명 병원 이송,https://n.news.naver.com/mnews/article/025/0003529533?sid=102,이 물질은 <b>반도체</b> 제조 공정에서 회로 패턴을 형성하는 데 쓰이며 체내에 흡수되면 신경계와 호흡계에 영향을 줄 수 있는 독성을 갖고 있다. SK 하이닉스 관계자는 “장비 담당자가 트럭 문을 열고 하역을 하려는데 손에... ,"Wed, 10 Jun 2026 19:14:00 +0900"
2026-06-10 10:36:14,삼전·하닉 호남행 소식에…“비효율 커질까 우려” vs “필요한 요건 ...,https://n.news.naver.com/mnews/article/020/0003725906?sid=101,"삼성전자와 SK하이닉스 등 국내 <b>반도체</b> 기업들은 지금까지 미래 경쟁력 강화를 위해 경기 평택, 용인과 충북... 이 때문에 <b>반도체</b> 업계에선 <b>반도체</b> 공장의 호남 건설에 대해 “신중하게 접근해야 한다”는 목소리가 적지... ","Wed, 10 Jun 2026 19:14:00 +0900"
2026-06-10 10:36:14,갤럭시 S27 첫 포착… 삼성 차세대 플래그십 개발 시작됐나,https://news.appstory.co.kr/daily19215,"업계에서는 갤럭시 S27 시리즈가 차세대 갤럭시 AI 기능과 카메라 성능 향상, 새로운 <b>반도체</b> 플랫폼 등을 탑재할 것으로 전망하고 있다. 다만 삼성이 아직 제품을 공식 발표하지 않은 만큼 구체적인 사양과 기능에... ","Wed, 10 Jun 2026 19:14:00 +0900"
2026-06-10 10:36:14,"李대통령 &quot;AI 초과이익, 국민에 돌려주기 위해 새 매커니즘 필요&quot;",https://n.news.naver.com/mnews/article/015/0005297409?sid=100,이재명 대통령은 10일 <b>반도체</b> 호황 등으로 창출된 이윤과 관련해 &quot;초과 이익(excess profits)의 일부를 국민들에게 배분하기 위해 기본소득과 같은 새로운 메커니즘이 필요하다&quot;고 밝혔다. 영국 시사지 이코노미스트는 이... ,"Wed, 10 Jun 2026 19:14:00 +0900"
2026-06-10 10:36:14,"온세미, ‘부품 궁합’ 한눈에 찾는다…전력 설계 혁신 도구 첫 공개",https://www.venturesquare.net/1090457/,"글로벌 <b>반도체</b> 기업 온세미가 전력전자 설계 과정을 간소화할 수 있는 새로운 온라인 설계 도구를... 온세미는 자동차, 산업, AI 데이터센터 등 다양한 산업 분야에 전력 및 센싱 기술을 공급하는 글로벌 <b>반도체</b>... ","Wed, 10 Jun 2026 19:13:00 +0900"
2026-06-10 10:36:14,"'중동 긴장·외인 매도' 원·달러 환율, 다시 1,520원대 마감...코스피는...",https://www.betanews.net/article/view/beta202606100130,이에 간밤 미국 뉴욕장에서 필라델피아 <b>반도체</b> 지수는 장중 8% 넘게 급락하기도 했다. 여기에 외국인 투자자의 국내 주식 순매도도 환율을 끌어올렸다. 이날 국내 유가증권시장에서 외국인들은 2조7천717억원을... ,"Wed, 10 Jun 2026 19:12:00 +0900"
2026-06-10 10:36:14,"李대통령, '수교 125주년' 벨기에 정상회담…배터리·소재·에너지 협력...",https://www.newsworks.co.kr/news/articleView.html?idxno=843535,"경제·통상, <b>반도체</b>, 교육·인적교류 등 협력 확대 방안을 논의했다. 강유정 청와대 수석대변인은 이날... <b>반도체</b> 분야 협력도 주요 의제로 다뤄졌다. 이 대통령은 벨기에에 위치한 세계적 <b>반도체</b> 연구기관 아이멕(imec)에... ","Wed, 10 Jun 2026 19:12:00 +0900"
2026-06-10 10:36:14,"李, 벨기에와 첫 정상회담…“베터리·소재·에너지 협력 확대”",https://n.news.naver.com/mnews/article/025/0003529532?sid=100,<b>반도체</b> 분야 협력 방안도 논의됐다. 이 대통령은 벨기에에 위치한 국제 <b>반도체</b>·나노 공동 연구기관인 아이멕(IMEC)에 120여 명의 한국인 연구자가 첨단 분야 연구에 협력하고 있는 걸 언급하면서 “아이멕을 통한 양국 연구... ,"Wed, 10 Jun 2026 19:11:00 +0900"
2026-06-10 10:36:14,"[사설]<b>반도체</b> 이전, 균형발전책이라도 결정권은 기업에",https://n.news.naver.com/mnews/article/014/0005533355?sid=110,정부와 일부 대기업들이 수도권에 집중된 <b>반도체</b> 생산거점을 충청·호남권으로 분산하는 방안을 논의... 업계에 따르면 삼성전자와 SK하이닉스는 <b>반도체</b> 수요 급증에 따라 <b>반도체</b> 공장을 신설 또는 증설할 계획인데 광주... ,"Wed, 10 Jun 2026 19:10:00 +0900"
2026-06-10 10:36:14,‘광주·전남 <b>반도체</b> 공장’ 재촉하는 정치권…기업·학계는 신중론,https://n.news.naver.com/mnews/article/020/0003725905?sid=101,"삼성전자와 SK하이닉스가 광주, 전남에 <b>반도체</b> 생산기지 건설을 추진하고 있다는 사실이 알려지면서 찬반 논란이 커지고 있다. 지역 균형발전 차원에선 긍정적이지만 자칫 한국 <b>반도체</b> 산업의 근본적인 경쟁력 저하를... ","Wed, 10 Jun 2026 19:10:00 +0900"
2026-06-10 10:36:14,"KIC중국, 청두서 한국혁신기업 로드쇼 개최",https://www.dongponews.net/news/articleView.html?idxno=58663,"행사에는 한국의 바이오와 <b>반도체</b> 분야 혁신기업 12개사(알트메디칼, 레디큐어, 니어브레인, 트루픽셀... 선도할 <b>반도체</b>·초정밀 부품의 시장 확장 가능성과 미래 첨단 ICT 전략을 심도 있게 논의했다. '2026 한국혁신기업... ","Wed, 10 Jun 2026 19:10:00 +0900"
2026-06-10 10:36:14,"SKT, 일본·대만 기업과 손잡고 5억 달러 규모 'AI 광통신' 투자",https://n.news.naver.com/mnews/article/448/0000618555?sid=101,"아이온 AI 펀드는 AI 데이터센터 인프라·<b>반도체</b>·소프트웨어, AI 서비스 애플리케이션, 클라우드 분산 시스템, 광통신 등 영역에서 유망 스타트업에 투자를 목표로 하고 있다. 북미와 더불어 아시아, 유럽 지역의... ","Wed, 10 Jun 2026 19:10:00 +0900"
2026-06-10 10:36:14,TSMC &quot;인플레로 비용 상승&quot;…<b>반도체</b> 가격 인상 시사,https://www.obsnews.co.kr/news/articleView.html?idxno=1527118,세계 최대 <b>반도체</b> 위탁생산 업체인 타이완 TSMC가 <b>반도체</b> 가격 인상 가능성을 시사했습니다. 웬델 황 TSMC 최고재무책임자는 BBC 방송과의 인터뷰에서 인플레이션으로 인한 비용 상승 압박에 따른 <b>반도체</b> 가격 인상... ,"Wed, 10 Jun 2026 19:08:00 +0900"
2026-06-10 10:36:14,"李대통령, 벨기에와 <b>반도체</b>·배터리 협력 확대한다…유럽 경제외교 시동",https://n.news.naver.com/mnews/article/277/0005774696?sid=100,"올해 수교 125주년을 맞은 양국은 6·25전쟁 참전으로 맺어진 역사적 유대를 토대로 <b>반도체</b>, 배터리, 에너지... <b>반도체</b> 협력도 주요 의제로 다뤄졌다. 이 대통령은 벨기에에 위치한 세계적 <b>반도체</b> 연구기관 IMEC에서 120여명의... ","Wed, 10 Jun 2026 19:08:00 +0900"
2026-06-10 10:36:14,한 달 새 화재·대피·화학물질 사고…SK하이닉스 청주공장 '비상',https://daily.hankooki.com/news/articleView.html?idxno=1375429,TMAH는 <b>반도체</b>와 디스플레이 제조 공정에서 실리콘 웨이퍼 세정과 현상 공정에 사용되는 강알칼리성... 이어 지난달 27일에는 M11 공장 내 <b>반도체</b> 설비에서 불꽃이 발생해 직원들이 약 1시간 동안 대피했다. 앞서 올해... ,"Wed, 10 Jun 2026 19:08:00 +0900"
2026-06-10 10:36:14,삼성·SK <b>반도체</b> 전남·광주 오나…투자 가시화,https://n.news.naver.com/mnews/article/056/0012197620?sid=101,[앵커] 전남광주통합특별시의 최우선 과제로 꼽히는 <b>반도체</b> 생산 시설 유치가 가시화하는 분위깁니다.... &quot;] 정부의 약속을 등에 업은 첫 번째 투자는 <b>반도체</b> 공장이 될 가능성이 커졌습니다. 삼성전자의 경우 <b>반도체</b> 제조의... ,"Wed, 10 Jun 2026 19:07:00 +0900"
2026-06-10 10:36:14,"TMAH부터 불소까지…SK하이닉스 청주공장, 반복되는 사고는 우연인가",https://www.sjsori.com/news/articleView.html?idxno=86525,다행히 이송 당시 특이 증세는 없었던 것으로 전해졌지만 TMAH 자체가 <b>반도체</b> 업계에서 고위험 화학물질로 분류되는 만큼 긴장감은 컸다. TMAH는 <b>반도체</b> 포토공정에서 사용되는 현상액의 핵심 원료다. 강한 알칼리성을... ,"Wed, 10 Jun 2026 19:06:00 +0900"
2026-06-10 10:36:14,"벨기에 총리 만난 이 대통령 &quot;<b>반도체</b> 연구 협력 확대, 미래 혜택 함께 누...",https://n.news.naver.com/mnews/article/047/0002518980?sid=100,또한 <b>반도체</b> 연구 분야에서의 협력 강화에 대한 의견도 나누었다. 강유정 청와대 수석대변인은 이날... 이 대통령은 베버르 총리에게 <b>반도체</b> 연구 관련 협력도 제안했다. 이 대통령은 벨기에 <b>반도체</b> 연구기관인 IMEC... ,"Wed, 10 Jun 2026 19:06:00 +0900"
2026-06-10 10:36:14,[자막뉴스] 시도 때도 없이 울리는 '사이드카'...난생 처음보는 막장 코...,https://n.news.naver.com/mnews/article/052/0002364728?sid=101,"밤사이 데이터센터 개발사 크루소의 데이터센터 건설 중단 소식에 미국 기술주가 전반적으로 약세를 보이면서, 국내 <b>반도체</b> 업종 투자심리에도 부정적 요인으로 작용한 것으로 풀이됩니다. 코스닥은 등락을 오가며... ","Wed, 10 Jun 2026 19:05:00 +0900"
2026-06-10 10:36:14,['클릭' 증시] 지정학적 리스크 재부상에 코스피 4%대 급락,http://www.00news.co.kr/news/articleView.html?idxno=104372,또한 &quot;데이터센터 건설 중단 소식 등 AI 수요에 대한 의구심이 부각되면서 미국 기술주가 전반적으로 약세를 보인 점이 국내 <b>반도체</b> 업종 투자심리에 부정적인 요인으로 작용했다&quot;고 덧붙였다. 이어 &quot;오늘 밤 발표될... ,"Wed, 10 Jun 2026 19:04:00 +0900"
2026-06-10 10:36:14,'2차전지 허위 홍보'로 수백억 가로챈 주가조작 일당 구속기소,https://n.news.naver.com/mnews/article/214/0001504643?sid=102,허위 공시로 주가를 조작하는 등 혐의를 받는 <b>반도체</b> 소자 제조 업체 '알에프세미'의 전현직 대표가 구속 상태로 재판에 넘겨졌습니다. 서울남부지검 금융·증권범죄합동수사부는 자본시장법상 사기적 부정거래 등... ,"Wed, 10 Jun 2026 19:04:00 +0900"
2026-06-10 10:36:14,"[올댓차이나] 홍콩 증시, 美·이란 군사충돌 격화에 엿새째 속락 마감…...",https://n.news.naver.com/mnews/article/003/0013999331?sid=104,"78%, <b>반도체</b>주 중신국제 3.53%, 음향부품주 루이성 과기 3.52%, 스마트폰주 샤오미 3.23%, 중국해양석유 4.... 58%, <b>반도체</b>주 화훙훙리 2.00%, 전기차주 리샹 2.06%, 비야디 2.04%, 뤄양 몰리브덴 1.99%, 석탄주 중국선화 1.... ","Wed, 10 Jun 2026 19:04:00 +0900"
2026-06-10 10:36:14,"충청권, 삼성·SK <b>반도체</b> 투자 후보지 부상",https://www.jbnews.com/news/articleView.html?idxno=1505758,"［중부매일 박상철 기자］ 충청권이 삼성전자와 SK하이닉스의 지방 <b>반도체</b> 투자 확대 후보지로 주목받고 있다. 삼성전자가 천안·온양에 패키징 시설을, SK하이닉스가 청주에 <b>반도체</b> 생산기지를 운영하고 있어 정부의... ","Wed, 10 Jun 2026 19:04:00 +0900"
2026-06-10 10:36:14,"WISeKey, 보안 <b>반도체</b>·위성·디지털 신원 묶어 ‘양자내성’ 생태계 키...",https://www.tokenpost.kr/news/tech/367780,"암호 <b>반도체</b>, 우주 인프라를 아우르는 사업 확장에 속도를 내고 있다. 회사 관련 최근 업데이트는 단순한... 와이즈키는 최근 실적과 함께 자회사 실스큐(SEALSQ)를 중심으로 한 <b>반도체</b> 사업, 공개키기반구조(PKI) 인증... ","Wed, 10 Jun 2026 19:04:00 +0900"
2026-06-10 10:36:14,고졸도 대졸과 '동일'…2000명 몰린 '초봉 4300만원' 회사,https://n.news.naver.com/mnews/article/015/0005297407?sid=102,"<b>반도체</b>발(發) 훈풍에 직업계고 인재에 대한 관심도 함께 높아졌기 때문이다. 한국전력, 한국항공우주산업(KAI), SK쉴더스, 현대그린푸드, 조선호텔앤리조트, 쿠팡풀필먼트서비스 등 국내 기업은 물론 자라, 랄프로렌 등... ","Wed, 10 Jun 2026 19:02:00 +0900"
2026-06-10 10:36:14,"李 대통령, 벨기에 총리와 회담 … <b>반도체</b> 협력 확대 논의",https://www.newdaily.co.kr/site/data/html/2026/06/10/2026061000283.html,이 대통령은 벨기에에 위치한 세계 최고 수준의 <b>반도체</b> 연구기관인 아이멕(IMEC)에 120여 명의 한국인 연구진들이 나노 <b>반도체</b> 분야에서 협력하고 있다는 점도 언급했다. 그러면서 &quot;아이멕을 통한 양국 간 연구 협력이 지속... ,"Wed, 10 Jun 2026 19:02:00 +0900"
2026-06-10 10:36:14,<b>반도체</b>·배터리 손잡은 한-벨기에… 수교 125주년 맞아 ‘경제·안보 동...,https://n.news.naver.com/mnews/article/029/0003031143?sid=100,첨단 <b>반도체</b> 분야에서의 기술 동맹도 구체화됐다. 이 대통령은 벨기에의 세계적인 비영리 종합 <b>반도체</b> 연구소인 아이멕(IMEC)에 한국인 연구진 150여 명이 참여하고 있다는 점을 짚으며 “아이멕을 통한 양국 간 연구 협력이... ,"Wed, 10 Jun 2026 19:02:00 +0900"
2026-06-10 10:36:14,레미콘 운송비 5.5% 인상안 노조 투표서 부결…재협상 예정(종합),https://n.news.naver.com/mnews/article/003/0013999330?sid=101,이에 따라 파업이 장기화될 경우 삼성전자 평택캠퍼스와 SK하이닉스 용인 <b>반도체</b> 클러스터 등 주요 공사 현장도 레미콘 공급 차질로 공정 중단 압박을 받을 것으로 보인다. 10일 레미콘 업계에 따르면 전운련 소속... ,"Wed, 10 Jun 2026 19:02:00 +0900"
2026-06-10 10:36:14,직업계고 변화 이끄는 정부…'新산업' AI·<b>반도체</b> 학과 확대,https://n.news.naver.com/mnews/article/015/0005297405?sid=102,"인력 수요가 줄어든 기존 학과는 축소하고 인공지능(AI), <b>반도체</b>, 콘텐츠, 디자인 등 기업 수요가 많은 신산업·신기술 분야로의 학과 개편을 지원하는 사업이다. 고용노동부는 고교 단계부터 다양한 직무 경험과 진로 탐색... ","Wed, 10 Jun 2026 19:01:00 +0900"
