DateTime,Title,Link,Description,PubDate
2025-11-12 10:52:38,'메모리 표준' 만든 한국 … 이젠 AI·로봇 국제표준 만들 때,https://n.news.naver.com/mnews/article/009/0005589244?sid=101,"로봇·센서·<b>반도체</b> 분야 민관 힘합쳐 표준 개발 추진 WWW·와이파이·바코드 등 세상을 바꾼 10대 표준 발표... 메모리 <b>반도체</b>, 와이파이(WiFi), 바코드 및 QR코드, 한글 자판, A4 용지, KF94 마스크, USB, 교통카드 등이... ","Wed, 12 Nov 2025 19:51:00 +0900"
2025-11-12 10:52:38,"성신여대 이윤호 교수 연구팀, 친환경 초고성능 투명 전자기기 보호막 ...",http://www.beyondpost.co.kr/view.php?ud=20251112193903712992e75d13a3_30,"성신여대 이윤호 교수는 “이번 연구는 친환경 소재로도 세계 최고 수준의 전자 보호막 성능을 구현할 수 있음을 입증했다”며, “대면적 제작이 가능한 이번 기술은 <b>반도체</b> 소자, 센서, 태양전지... ","Wed, 12 Nov 2025 19:44:00 +0900"
2025-11-12 10:52:38,"강원도, 내년도 국비 10조 원 사수 총력",https://n.news.naver.com/mnews/article/003/0013596928?sid=102,"이에 포천~철원 고속도로 10억 등 SOC사업과 <b>반도체</b> K-소재 부품 생산거점 구축 17억, 디지털 의료데이터 산업 활용 촉진사업 28억원 등 미래산업 관련 미반영 주요 국비확보 사업에 대한 필요성과 당위성을 설명하고 국비... ","Wed, 12 Nov 2025 19:42:00 +0900"
2025-11-12 10:52:38,[주식마감기사] 'AI 플랫폼 기반 치료제' 개발 추진 소식에 신테카바이...,https://www.ggilbo.com/news/articleView.html?idxno=1123861,"TIGER <b>반도체</b>TOP10, 미래에셋증권, KODEX 200타겟위클리커버드콜, 삼성 인버스 2X 코스닥150 선물 ETN, 한온시스템, 삼성 인버스 2X WTI원유 선물 ETN, TIMEFOLIO K바이오액티브, 대한전선, 서울식품, 삼성 레버리지 WTI원유 선물... ","Wed, 12 Nov 2025 19:40:00 +0900"
2025-11-12 10:52:38,용인 <b>반도체</b> 국가 산단 “지역균형발전 시금석”,https://n.news.naver.com/mnews/article/056/0012065132?sid=101,<b>반도체</b> 공장 10개를 짓는 산업단지를 조성하고 있습니다. 중앙집중형 전력 체계를 지역분산형으로 전환해야 할 필요성과 과제를 살펴보는 기획보도. 오늘은 세 번째로 지역균형발전의 시금석이 될 용인 <b>반도체</b>... ,"Wed, 12 Nov 2025 19:39:00 +0900"
2025-11-12 10:52:38,[김대식 칼럼] 삼성동 디지털 도원결의,https://www.iusm.co.kr/news/articleView.html?idxno=1055917,전 세계 AI(인공 지능) <b>반도체</b> 시장의 90%를 장악하고 있는 젠슨 황 엔비디아(NVIDIA) 회장이 제안한 이재용... 삼성에 공급되는 5만장의 GPU는 AI와 디지털 트윈(엔비디아 옴니버스)을 활용한 '<b>반도체</b> AI 팩토리'를... ,"Wed, 12 Nov 2025 19:38:00 +0900"
2025-11-12 10:52:38,[2025 표준포럼] 치열해진 글로벌 표준 전쟁… 韓 마주한 ‘골든 타임’,https://n.news.naver.com/mnews/article/366/0001122465?sid=101,"자판 ▲CDMA ▲메모리 <b>반도체</b> ▲컬러 TV ▲김치 냉장고 ▲마스크 ▲교통카드 ▲평→㎡ ▲사이즈 코리아 등이... 국표원은 AI, <b>반도체</b>, 로봇 등 중점 표준화가 필요한 산업별로 운영되고 있는 ‘국제표준 대응 포럼’과... ","Wed, 12 Nov 2025 19:37:00 +0900"
2025-11-12 10:52:38,"방산주 조정에 '곱버스' 쏠림, 증권가 전망은?",http://theviewers.co.kr/View.aspx?No=3851785,"수익률 2위인 '키움 레버리지 조선TOP10 ETN' 수익률(305.1%)은 물론 3~7위를 차지한 IT·<b>반도체</b> 테마 레버리지... 이재원 신한투자증권 애널리스트는 &quot;외국인이 3일부터 코스피 현물 순매도를 이어가며 <b>반도체</b>, 방산 등... ","Wed, 12 Nov 2025 19:36:00 +0900"
2025-11-12 10:52:38,"현대자산운용, ‘SK하이닉스밸류체인 액티브ETF’ 출시 1년...올해 145% 급...",https://www.g-enews.com/view.php?ud=202511121909597455edf69f862c_1,조상현 현대자산운용 주식운용본부장은 “D램과 낸드(NAND) 가격 상승으로 <b>반도체</b> 업황 회복 기대가... 타 <b>반도체</b> ETF 대비 우수한 성과를 이끌었다”고 말했다. 그는 또 “SK하이닉스는 단순한 테마주가 아닌... ,"Wed, 12 Nov 2025 19:36:00 +0900"
2025-11-12 10:52:38,이상일 용인특례시장 “용인 철도망 확충은 <b>반도체</b> 산업의 생명선…정...,https://www.etoday.co.kr/news/view/2524969,대한민국 <b>반도체</b>산업의 경쟁력을 지탱하는 생명선”이라며 중앙정부의 적극적인 지원을 요청했다. 이... 이 시장은 “용인은 삼성전자와 SK하이닉스가 총 482조원을 투자해 세계 최대 규모의 <b>반도체</b> 메가클러스터를 조성... ,"Wed, 12 Nov 2025 19:36:00 +0900"
2025-11-12 10:52:38,"동의대-부산대, <b>반도체</b> 등 미래 인재양성 업무협약",https://n.news.naver.com/mnews/article/658/0000125795?sid=102,"바이오헬스 <b>반도체</b> 이차전지 소재부품 분야의 미래형 전문 인재 양성을 위해 손을 잡았다. 동의대의 바이오헬스 혁신융합대학사업단, 첨단산업 인재양성 부트캠프 <b>반도체</b>사업단, 융합부품소재 핵심연구지원센터는 지난... ","Wed, 12 Nov 2025 19:35:00 +0900"
2025-11-12 10:52:38,한국 온 벤츠 회장의 광폭 행보…삼성·LG·HS효성과 연쇄 회동,https://n.news.naver.com/mnews/article/011/0004555143?sid=101,"차량용 <b>반도체</b>와 센서, 디스플레이, 배터리에 대한 협업 논의가 이뤄질 것으로 보인다. 특히 주목되는 건 배터리 분야다. 국내 배터리 3사 중 벤츠에 아직 납품을 하지 않고 있는 건 삼성SDI가 유일하다. 이 회장이... ","Wed, 12 Nov 2025 19:32:00 +0900"
2025-11-12 10:52:38,"충북도, <b>반도체</b> 산업 역량강화 전문가 포럼 개최",https://www.gukjenews.com/news/articleView.html?idxno=3425503,"충북도와 충북테크노파크, 충북<b>반도체</b>산업육성협의회는 12일 청주오스코에서 도내․외 <b>반도체</b> 기업인과 <b>반도체</b> 산‧학‧연 관계자, 충북<b>반도체</b>산업육성협의회원 등 170여 명이 참석한 가운데 '2025 <b>반도체</b>전문가 포럼'을... ","Wed, 12 Nov 2025 19:30:00 +0900"
2025-11-12 10:52:38,GM &quot;중국서 공급망 철수하라&quot;…부품 공급업체에 요구,https://n.news.naver.com/mnews/article/015/0005210633?sid=101,트럼프 대통령의 관세가 오락가락하고 있는데다 희토류 자원의 병목 현상과 자동차용 <b>반도체</b> 부복까지... 지난달에는 중국과 네덜란드간 지식재산권 분쟁으로 중국이 자동차 전장 부품에 들어가는 저가 <b>반도체</b>... ,"Wed, 12 Nov 2025 19:26:00 +0900"
2025-11-12 10:52:38,"벤츠 회장, LG 사장단·삼성·효성 연쇄 회동..전장 협력 강화",https://n.news.naver.com/mnews/article/014/0005433622?sid=101,"이재용 삼성전자 회장과 최주선 삼성SDI 대표, 이청 삼성디스플레이 대표 등이 칼레니우스 회장의 회동에 참석하면서, 전기차 배터리 협력과 함께 디스플레이 공급 확대, 차량용 <b>반도체</b> 등 전장 부문 협업에 대한 논의가... ","Wed, 12 Nov 2025 19:25:00 +0900"
2025-11-12 10:52:38,"국립한국교통대, 충북 미래 혁신 이끈다!",https://www.ccdn.co.kr/news/articleView.html?idxno=1048068,"확정된 과제는 지능형<b>반도체</b>(11건), 차세대이차전지(11건), 첨단바이오(10건), AI·모빌리티(6건), AI첨단제조(5건) 등이다. 이번 공동 연구는 충북 지역 중소·중견기업을 중심으로 현장 기술 발굴, 검증에 초점을 맞췄다.... ","Wed, 12 Nov 2025 19:24:00 +0900"
2025-11-12 10:52:38,&quot;미국 제재에 中 AI칩 품귀 심각…정부가 나서서 분배 통제&quot;,https://n.news.naver.com/mnews/article/421/0008600672?sid=104,미국의 수출 제한으로 중국 내 인공지능(AI) <b>반도체</b> 부족 현상이 극심해지자 중국 정부가 나서서 AI 칩... 중국 정부의 이 같은 시장 개입은 AI <b>반도체</b> 부족이 그만큼 극심하다는 뜻이다. 중국 유망 AI 스타트업 딥시크는... ,"Wed, 12 Nov 2025 19:24:00 +0900"
2025-11-12 10:52:38,"헬스케어스파산업진흥원, ETRI 제주AX융합연구실 지역특화 AI 인프라 벤...",https://www.ccdn.co.kr/news/articleView.html?idxno=1048026,한국전자통신연구원(ETRI)은 대한민국의 정보통신기술(ICT) 분야를 선도하는 정부 출연 연구기관으로 제주AX융합연구실은 △AX 기반 기후테크 개발 △소버린 관광 AX 서비스 기술 개발 △인공지능 및 <b>반도체</b> 분야... ,"Wed, 12 Nov 2025 19:24:00 +0900"
2025-11-12 10:52:38,아산-천안 연결축 624호선의 대변신,https://www.ccdn.co.kr/news/articleView.html?idxno=1048024,"그는 또 &quot;오늘 착공이 <b>반도체</b>·디스플레이·전기차 등 대한민국 미래산업의 중심으로 빠르게 성장하는 아산의 새로운 날개가 될 것으로 믿는다&quot;면서, &quot;도와 천안시와 긴밀히 협력해 차질 없이 추진되도록 최선을... ","Wed, 12 Nov 2025 19:24:00 +0900"
2025-11-12 10:52:38,"[이슈플러스] 국토부, 집값 상승론 일축...10·15 부동산 규제 이후 시장...",https://n.news.naver.com/mnews/article/052/0002272271?sid=101,"대형주, <b>반도체</b>주 외에는 거의 마이너스였거든요. 그런데 오늘은 시장이 반전되고 있습니다. 오늘은 코스닥의 날인데요. 코스닥은 2.5%나 올랐고 지금 코스피는 1% 정도 올랐는데 <b>반도체</b>가 주춤하니까 오늘은 바이오주의... ","Wed, 12 Nov 2025 19:23:00 +0900"
2025-11-12 10:52:38,한국기술교육대 학생들 '2025 캠퍼스 특허 유니버시아드' 대통령상 쾌거,https://www.ccdn.co.kr/news/articleView.html?idxno=1048189,"이 과제는 이번 대회 30개 과제 중 가장 높은 지원 경쟁률을 보였으며, 메모리 <b>반도체</b> 선도기업... 작년 12월부터 외부 방문객을 대상으로 최첨단 랩(lab) 투어를 기획·운영하며 발표력을 키웠고, 4명 모두 <b>반도체</b> 분야... ","Wed, 12 Nov 2025 19:23:00 +0900"
2025-11-12 10:52:38,"청주시, 일자리 정책 모범 도시로 우뚝",https://www.ccdn.co.kr/news/articleView.html?idxno=1048251,"청주시는 <b>반도체</b>·이차전지·바이오 등 BIG3 첨단산업 중심의 투자 확대와 클러스터 조성, 청년층 맞춤형 취·창업 및 주거안정 지원, 생활현장형 ESG 일자리 확대등 산업·청년·환경이 균형을 이루는 고용정책을 추진해... ","Wed, 12 Nov 2025 19:22:00 +0900"
2025-11-12 10:52:38,천안시 기업인의 날 종합대상에 미래산업,https://www.ccdn.co.kr/news/articleView.html?idxno=1048246,"종합대상에 선정된 미래산업㈜는 <b>반도체</b>(Test Handler), MAI(이형자동 삽입기)를 제작 납품하는 업체로, 심사 분야에서 높은 평가를 받았다. 부문별로는 ▲경영대상 ㈜상신종합식품 ▲기술대상 하나네트웍스 주식회사... ","Wed, 12 Nov 2025 19:22:00 +0900"
2025-11-12 10:52:38,"부산진해경자청, 중국 현지 네트워크 구축 계획 수립",https://www.gnnews.co.kr/news/articleView.html?idxno=623314,경자청은 최근 IMF가 2025년 중국 성장률 전망치를 4.8%로 상향 조정하고 중국 자체도 'Made in China 2025'를 축으로 전기차·2차전지·<b>반도체</b>·로봇·바이오·5G 등 전략 산업의 경쟁력을 끌어올리고 있어 변별력을 갖는데... ,"Wed, 12 Nov 2025 19:20:00 +0900"
2025-11-12 10:52:38,정동영 &quot;산학연 컨소시엄으로 산업 AX파운데이션 모델 개발해야&quot;,https://www.newsworks.co.kr/news/articleView.html?idxno=818511,"이 전무는 &quot;AI 산업은 인프라에서 <b>반도체</b>, 데이터, 모델, 서비스까지 이어지는 다층 구조를 가지고 있다&quot;며... 그러면서 &quot;피지컬 AI를 방대한 데이터를 LLM 그룹만으로 실행하는 것은 불가능하다&quot;며 &quot;시스템 <b>반도체</b>, SW를... ","Wed, 12 Nov 2025 19:18:00 +0900"
2025-11-12 10:52:38,김정관 산업장관 “관세 불확실성 해소…근원적 경쟁력 강화할 때”,http://www.segyebiz.com/newsView/20251112517315?OutUrl=naver,"특히 최근 타결된 대미 관세 협상 결과 및 <b>반도체</b> 산업전략 등에 대한 전문가 의견을 수렴했다. 산업부는 이날 제안된 자문위원들의 의견을 정책에 적극 반영하고, 분야별 정책자문위 회의를 정례화해 주요 정책·현안에... ","Wed, 12 Nov 2025 19:18:00 +0900"
2025-11-12 10:52:38,중국 과학발전 공습 경보차이나테크의 역습,http://www.hellodd.com/news/articleView.html?idxno=109865,"<b>반도체</b>를 둘러싼 트럼프의 대중 제재 조처와 중국의 국산화 대응에서 보듯이 기업들이 이제는 세계 정세를... 그 가운데 기술 관련해서는 AI, 에너지, 2차 전지, 우주 등 군민 융합 기술, 통신 기술, 바이오, <b>반도체</b> 및 소재... ","Wed, 12 Nov 2025 19:16:00 +0900"
2025-11-12 10:52:38,"'ASML 화성 캠퍼스 준공' …경기도, ‘세계 최대 <b>반도체</b> 허브’ 조성",https://n.news.naver.com/mnews/article/119/0003024381?sid=102,경기도는 세계 최대 <b>반도체</b> 노광장비 기업 네덜란드 에이에스엠엘(ASML)의 화성 캠퍼스를 12일... 국내 <b>반도체</b> 기업에 노광장비 수리 부품을 공급할 계획이다. 또 도내 중소기업과의 협력을 통해 <b>반도체</b>산업 내... ,"Wed, 12 Nov 2025 19:16:00 +0900"
2025-11-12 10:52:38,"몸에 붙이는 초음파 센서 개발···KAIST, 영상·치료 동시 구현",http://www.hellodd.com/news/articleView.html?idxno=109856,KAIST 연구팀이 <b>반도체</b> 공정을 활용해 자유롭게 조절할 수 있는 유연한 초음파 센서를 개발했다. [사진=KAIST]... KAIST(총장 이광형)는 이현주 전기및전자공학부 교수 연구팀이 <b>반도체</b> 웨이퍼 공정을 활용해 유연함과... ,"Wed, 12 Nov 2025 19:16:00 +0900"
2025-11-12 10:52:38,"위드텍, SK하이닉스에 AMCs·가스 모니터링 장비 공급···총 75억 규모",http://www.hellodd.com/news/articleView.html?idxno=109871,"위드텍은 지난 10일 SK하이닉스와 <b>반도체</b> 제조환경 모니터링 장비 공급계약을 맺었다고 12일 밝혔다.... TM200L은 <b>반도체</b> 제조 공정 중 공기 중 분자오염(AMC)을 실시간 측정하는 장비로, 미세 먼지나 에어로졸 형태의... ","Wed, 12 Nov 2025 19:16:00 +0900"
2025-11-12 10:52:38,"산골짝을 세계 산업 중심지로 만드는 '마법', R&amp;D 네트워크",http://www.hellodd.com/news/articleView.html?idxno=109866,"선전은 IT와 전자, 상하이는 금융과 디자인, 시안은 <b>반도체</b>와 항공우주, 청두는 소프트웨어, 항저우는... 시안의 시안교통대는 기계·전자에 강하고, 청두의 쓰촨대학과 전자과기대는 <b>반도체</b>·통신 분야에서 두각을... ","Wed, 12 Nov 2025 19:16:00 +0900"
2025-11-12 10:52:38,"&quot;고경력 과기인 77명, 스타트업 성장위해 팔 걷었다&quot;···대전시, 기술...",http://www.hellodd.com/news/articleView.html?idxno=109870,"이날 현장에는 77명의 고경력 과학기술인이 바이오헬스, 정보통신·<b>반도체</b>, 에너지·자원, 양자·AI·빅데이터, 기계·소재·화학, 우주·국방 분야 스타트업과 함께 했다. 이번 행사는 대전시가 추진 중인 '고경력 과학기술인... ","Wed, 12 Nov 2025 19:16:00 +0900"
2025-11-12 10:52:38,"성취와 자부심의 대한민국 80년, 그 뒷 이야기 1 표준이 된 한국, <b>반도체</b>...",http://www.hellodd.com/news/articleView.html?idxno=109859,"<b>반도체</b>, K-방산, 철강, 자동차, 고속도로, KTX 등등 대한민국의 성장 스토리를 돌아보고, 미래를 설계하는... 64K D램의 기적: 대한민국 <b>반도체</b> 신화의 서막 영상 링크: https://youtu.be/zSXEmu5sX9I?si=H5qsZ_5lATPNY8dR 1. 대한민국... ","Wed, 12 Nov 2025 19:16:00 +0900"
2025-11-12 10:52:38,“금산분리 완화” 운 띄운 정부에…재계 ‘청구서’,https://n.news.naver.com/mnews/article/028/0002776080?sid=101,그러나 이 사안이 최근 다시 쟁점으로 떠오른 것은 인공지능(AI) 투자붐으로 국내 <b>반도체</b> 기업의 자금 조달... 그가 삼성전자와 에스케이(SK)하이닉스에 웨이퍼(<b>반도체</b> 소재 기판) 월 최대 90만장 규모의 인공지능 메모리... ,"Wed, 12 Nov 2025 19:14:00 +0900"
2025-11-12 10:52:38,"[온누리]GPU 26만장, 대한민국 AI의 판을 바꾸다",http://sjbnews.com/news/news.php?number=864463,<b>반도체</b>·제조 강국인 한국이 이 GPU 물량을 기반으로 ‘물리적 AI(Physical AI)’ 즉 스마트공장·디지털트윈·자율주행·물류로봇 등에 적용할 기반을 갖추겠다는 전략이 가능하다. 이와 맞물려 정부·기업·연구기관이... ,"Wed, 12 Nov 2025 19:12:00 +0900"
2025-11-12 10:52:38,"충남대, 지역 기업과 함께 'CNU 금요컴퍼니' 운영",http://www.newstnt.com/news/articleView.html?idxno=553642,올 하반기에는 ▲두산퓨어셀(수소연료전지) ▲아이쓰리시스템㈜(나노<b>반도체</b>) ▲㈜신테카바이오(AI·빅데이터) 등 지역 첨단 산업을 대표하는 5개 기업이 참여했다. 참가자들은 기업의 연구소와 생산 현장을 둘러보고... ,"Wed, 12 Nov 2025 19:06:00 +0900"
2025-11-12 10:52:38,"“중국산, 2년내 공급망서 배제해야”…GM, 공급업체에 지시",https://n.news.naver.com/mnews/article/018/0006162829?sid=101,GM은 이미 배터리 소재나 <b>반도체</b> 부문에서 중국 의존도를 줄이기 위한 노력을 해왔다. 미국 희토류 업체와... 도널드 트럼프 대통령의 강경한 관세 정책과 중국의 희토류 무기화·<b>반도체</b> 칩 공급 차질 가능성에 대한... ,"Wed, 12 Nov 2025 19:06:00 +0900"
2025-11-12 10:52:38,실업률 역설… 경력직 선호·제조업 부진에… ‘취업포기자’ 13만명 늘...,https://n.news.naver.com/mnews/article/005/0001814098?sid=101,"<b>반도체</b> 등 주요 업종을 제외한 나머지 업종과 중소기업의 고용 여건이 좋지 않다. 20, 30대의 취업 의욕이 꺾일 수 있는 것이다. 인구 구조 역시 문제다. 공 국장은 &quot;청년층이 많이 종사하는 산업인 제조업 분야 업황이... ","Wed, 12 Nov 2025 19:02:00 +0900"
2025-11-12 10:52:38,KAIS “입어도 되고 수술없이 치료도 되는 초음파 센서 나왔다”,https://n.news.naver.com/mnews/article/082/0001353398?sid=101,KAIST(총장 이광형)는 전기및전자공학부 이현주 교수 연구팀이 <b>반도체</b> 웨이퍼 공정(MEMS)을 활용해... 이 기술은 <b>반도체</b> 공정과 호환돼 대량 생산이 가능하므로 웨어러블 및 재택 의료용 초음파 시스템으로 확장될... ,"Wed, 12 Nov 2025 19:01:00 +0900"
2025-11-12 10:52:38,노영민 전 비서실장 &quot;충북 바이오·<b>반도체</b>산업 세계 이끌게 될 것&quot;,https://www.cctoday.co.kr/news/articleView.html?idxno=2221514,"그는 &quot;충북은 이 기간 오송분기역 유치, 방사광가속기 유치, 혁신도시 건설, SK하이닉스 청주공장 증설 등 획기적인 발전의 토대를 마련했다&quot;고 평가한 뒤 &quot;앞으로 충북은 바이오와 <b>반도체</b>산업 등에서 세계를 이끌게 될... ","Wed, 12 Nov 2025 19:00:00 +0900"
2025-11-12 10:52:38,[데스크칼럼] '닥터 둠'이 사라진 한국 증시,https://www.ajunews.com/view/20251111173203519,"코스피 상승분 중 30%가량이 <b>반도체</b> 등 일부 대형주 몫이라는 점, 사천피 시대에도 절반에 가까운 종목 주가는 하락하고 있다는 사실, 우리 기업들의 수익성(총자산영업이익률)이 20년 새 절반으로 줄었다는 통계를... ","Wed, 12 Nov 2025 19:00:00 +0900"
2025-11-12 10:52:38,"코오롱인더, 3분기 영업익 269억원… 전년比 12.76% 감소",https://n.news.naver.com/mnews/article/366/0001122460?sid=101,자동차 소재 부품 사업 매출과 페놀수지 및 인공지능(AI) <b>반도체</b>용 소재 판매 확대가 전체 매출 증가를 이끌었다. 영업이익은 패션 비수기 및 기타 부문 실적 하락 등에 의해 소폭 영향을 받았다고... ,"Wed, 12 Nov 2025 19:00:00 +0900"
2025-11-12 10:52:38,&quot;유성과 썸타는 남자&quot; 조원휘 대전시의장 '구민에 드리는 의정보고회' ...,https://www.newscj.com/news/articleView.html?idxno=3339181,"조 의장은 &quot;유성지역에 산업단지 조성 계획만해도 안산국방산업단지, 하기지구산업단지, 장대도시첨단산업단지, 나노<b>반도체</b>산업단지, 탑립전민지구첨단산업단지 등 5개 사업에 이른다&quot;며 &quot;이와 함께 첨단바이오메디컬... ","Wed, 12 Nov 2025 18:58:00 +0900"
2025-11-12 10:52:38,[2025 표준포럼] 국표원 “韓 제안 표준 2배로 늘어… 한국인 임원 300명...,https://n.news.naver.com/mnews/article/366/0001122459?sid=101,"우리나라가 제안한 국제 표준은 <b>반도체</b>와 미래선박, 인공지능(AI) 등 다양한 분야에 걸쳐있다. <b>반도체</b> 분야에서는 극자외선(EUV) 펠리클(<b>반도체</b> 미세화 공정에서 마스크가 오염되지 않도록 보호해주는 얇은 막)... ","Wed, 12 Nov 2025 18:58:00 +0900"
2025-11-12 10:52:38,트럼프 '조지아 한국인 구금' 거론하며 H-1B 비자 필요성 주장,https://n.news.naver.com/mnews/article/008/0005277361?sid=104,나는 (이번 단속에) 매우 반대했다&quot;며 &quot;그들은 믿을 수 없을 정도로 복잡한 <b>반도체</b>와 컴퓨터를 만드는 사람들이다. 5년 동안 일한 적이 없는 실업자들을 데려다가 일을 시킬 수는 없다&quot;고 말한 바 있다.,"Wed, 12 Nov 2025 18:57:00 +0900"
2025-11-12 10:52:38,"[정치돋보기] 경기북부 대전환, 평화경제로 나아가야 한다",https://www.joongboo.com/news/articleView.html?idxno=363708482,"그 사이 수원·용인·성남은 <b>반도체</b> 등 첨단산업과 기업투자로 성장의 엔진을 달았지만, 의정부·동두천·포천·연천 등은 여전히 낙후된 기반시설과 미군기지 반환부지 방치라는 이중고를 겪고 있다. 접경지역인 파주·고양... ","Wed, 12 Nov 2025 18:56:00 +0900"
2025-11-12 10:52:38,"&quot;MAGA가 코스피를 흔들었다&quot;… 美 공급망 재편, 韓 기술 동맹 부상",https://www.thepublic.kr/news/articleView.html?idxno=283360,"랠리를 이끈 주역은 <b>반도체</b>·조선·방산·원전·전력기기 등 'MAGA 수혜 업종'이었다. KRX<b>반도체</b>지수는 연초 이후 109.56% 상승했고, 코스피 200 중공업 지수는 161.68% 급등했다. 삼성전자(93.82%), SK하이닉스(261.57... ","Wed, 12 Nov 2025 18:54:00 +0900"
2025-11-12 10:52:38,[이슈포커스-인공태양 유치전]'수소 1g=석유 8t'…미래 에너지 산업 '중...,http://www.namdonews.com/news/articleView.html?idxno=839027,"또한 '중성입자빔 연구설비'는 의료·바이오 산업은 물론, 수입에 의존하는 대면적 <b>반도체</b> 및 디스플레이 이온빔의 국산화 연구에도 활용될 수 있어 첨단 산업 전반의 동반 성장이 예상된다. 인공태양 연구시설 하나가... ","Wed, 12 Nov 2025 18:54:00 +0900"
2025-11-12 10:52:38,[사설] ‘빚투’ 26조 돌파…증시 안정화 대책도 필요하다,https://n.news.naver.com/mnews/article/658/0000125778?sid=110,<b>반도체</b> 조선 방산 원전 등에 투자금이 몰리고 다른 업종과 코스닥 시장은 상승폭이 크지 않다. 현재 코스피는 5대 그룹 시가총액이 전체의 45.9%를 차지할 정도로 대형주 쏠림이 심각하다. 정부와 여당의... ,"Wed, 12 Nov 2025 18:51:00 +0900"
