DateTime,Title,Link,Description,PubDate
2026-03-03 08:54:37,"톱티어 비자, 교수·연구원까지 넓힌다",https://n.news.naver.com/mnews/article/011/0004595310?sid=102,발표 내용을 보면 우선 최고 우수 인재를 대상으로 한 ‘톱티어 비자’ 발급 대상을 <b>반도체</b>·AI·로봇·2차전지·미래차 등 8개 첨단산업 기업체 인력 외에도 과학기술 분야의 교수와 연구원까지 확대했다. 이를 통해... ,"Tue, 03 Mar 2026 17:53:00 +0900"
2026-03-03 08:54:37,전쟁發 외인 투매…韓만 검은 화요일,https://n.news.naver.com/mnews/article/011/0004595307?sid=101,국내 증시를 견인해온 <b>반도체</b>가 급락한 점도 코스피지수를 주저앉게 만든 배경으로 꼽힌다. 시가총액 1·2위인 삼성전자와 SK하이닉스는 이날 ‘20만 전자’와 ‘100만 닉스’ 타이틀을 모두 내줬다. 삼성전자는 9.... ,"Tue, 03 Mar 2026 17:52:00 +0900"
2026-03-03 08:54:37,코스피 고공행진에도…미국주식 투자 열기 여전,https://www.ajunews.com/view/20260303161325227,"종목별로는 마이크로소프트(5억5179만달러), 샌디스크(4억4373만달러), 알파벳(4억3415만달러), 아이온큐(3억1818만달러) 등 AI·<b>반도체</b> 관련주 중심으로 매수세가 유입됐다. ETF(상장지수펀드) 상품 가운데서는 미국... ","Tue, 03 Mar 2026 17:52:00 +0900"
2026-03-03 08:54:37,안교재 예비후보 &quot;수원을 세계의 No.1 도시로 만들겠습니다&quot;,https://n.news.naver.com/mnews/article/002/0002430107?sid=102,‘<b>반도체</b> 생태계 1시간 생활권 구축’·‘공군 비행장 이전’·‘중학(구)군 현실화’ 등 공약 안교재... 그는 가장 먼저 ‘<b>반도체</b> 생태계 1시간 생활권 구축’을 제시했다. 이는 수원에 위치한 삼성전자 본사와 화성의... ,"Tue, 03 Mar 2026 17:52:00 +0900"
2026-03-03 08:54:37,"순천시의회, 전남광주통합특별시 설치 특별법 국회 통과 환영",https://www.joongdo.co.kr/web/view.php?key=20260303010000750,"강 의장은 전남 동부권 RE100 <b>반도체</b> 국가산단 지정, 권역별 재정 쿼터제 마련, 국립의과대학의 조속한 설치 및 의료인력 양성체계 구축, 동부청사 증축 등 인사·예산 권한 실질적 강화 그리고 도농복합시 읍·면 지역 보호... ","Tue, 03 Mar 2026 17:52:00 +0900"
2026-03-03 08:54:37,"민형배 의원, '삼성·SK 유치' 시민 공유자본 펀드 제안",https://www.newspim.com/news/view/20260303001091,이 모델은 데이터센터·발전소·<b>반도체</b> 팹 등 대규모 산업 프로젝트 전반에 적용할 계획이다. 민 의원은 &quot;AI 시대에는 임금소득만으로 한계가 있다&quot;며 &quot;지역 공동체가 배당소득과 자산소득을 공유하는 구조로 전환해야... ,"Tue, 03 Mar 2026 17:51:00 +0900"
2026-03-03 08:54:37,치솟는 메모리 값에도…&quot;전략폰은 가격동결&quot; 승부수,https://n.news.naver.com/mnews/article/009/0005644589?sid=101,메모리 <b>반도체</b> 가격 급등에도 주요 스마트폰 업체들이 전략 모델의 글로벌 가격을 잇달아동결하고 있다. 메모리 <b>반도체</b> 가격이 올라 스마트폰 시장이 역대 최대 규모로 위축될 것이라는 예상이 나오는 가운데 중... ,"Tue, 03 Mar 2026 17:51:00 +0900"
2026-03-03 08:54:37,‘빚투’ 32조 사상 최대...반대매매 공포 커지나,https://n.news.naver.com/mnews/article/011/0004595305?sid=101,개인은 이날 ‘KODEX 레버리지(4624억 원)’를 가장 많이 순매수했으며 ‘KODEX 코스닥150레버리지(2325억 원)’ ‘KODEX 200(1828억 원)’ ‘TIGER <b>반도체</b>TOP10레버리지(1346억 원)’ 등도 대거 사들였다. 반면 ‘KODEX... ,"Tue, 03 Mar 2026 17:51:00 +0900"
2026-03-03 08:54:37,&quot;삼성전자·하이닉스 집중편입·수익률 79.46%&quot; 미래에셋 'TIGER <b>반도체</b>TO...,https://www.catchnews.kr/news/articleView.html?idxno=121199,미래에셋자산운용은 'TIGER <b>반도체</b>TOP10 상장지수펀드(ETF)'가 연초 이후 개인 투자자 순매수 1조 원을 돌파했다고 3일 밝혔다. [사진 미래에셋운용] 미래에셋자산운용은 'TIGER <b>반도체</b>TOP10 상장지수펀드(ETF)'가... ,"Tue, 03 Mar 2026 17:50:00 +0900"
2026-03-03 08:54:37,"[위클리오늘] 김태균 전남도의장, 통합 전남․광주가 &quot;국가균형발전 중...",http://www.weeklytoday.com/news/articleView.html?idxno=762700,"그는 이번 특별법이 기존 기반산업뿐 아니라 2차전지, AI, <b>반도체</b> 등 첨단 산업 중심의 미래 성장 동력 재편을 가능하게 해, 국가균형발전을 이끄는 중심축으로 도약할 출발점이 될 것이라고 강조했다. 또한 김 의장은... ","Tue, 03 Mar 2026 17:50:00 +0900"
2026-03-03 08:54:37,"동진쎄미켐 주주 미래에셋자산운용, 동진쎄미켐 주식등의 수 89만4893주 ...",https://www.digitaltoday.co.kr/news/articleView.html?idxno=636386,<b>반도체</b>·디스플레이 소재 기업 동진쎄미켐(005290) 주식등 보유 상황을 3일 공시했다. 동진쎄미켐의 주주인 미래에셋자산운용이 동진쎄미켐 주식등의 수를 89만4893주 늘렸다고 보고했다. 이번 보고서 기준... ,"Tue, 03 Mar 2026 17:50:00 +0900"
2026-03-03 08:54:37,"[위클리오늘] 광주시·전남도, 특별법 통과 기념 시도민보고회 개최",http://www.weeklytoday.com/news/articleView.html?idxno=762696,"투표 결과, 일자리 확대, 기업 유치, 청년 정착 확대가 주요 과제로 나타났고, 시도민 대표 10명이 참여한 희망 메시지에서는 AI·<b>반도체</b> 등 첨단산업 육성과 균형발전, 골목상권 활성화에 대한 기대가 높았다.... ","Tue, 03 Mar 2026 17:50:00 +0900"
2026-03-03 08:54:37,"영진전문대, '취업 1번지' 다시 증명하다",https://www.dkilbo.com/news/articleView.html?idxno=535625,특히 <b>반도체</b>·AI·보건의료 등 산업 수요가 빠르게 늘어나는 분야에 집중 투자하며 학과 개편과 실습 인프라 고도화를 동시에 추진한 점이 주효했다. 영진전문대는 수년째 '기업이 먼저 찾는 대학'을 목표로 산업체 연계... ,"Tue, 03 Mar 2026 17:50:00 +0900"
2026-03-03 08:54:37,[전문]‘노인과 바다’에서 ‘윤석열과 증오정치’까지···권명아 인터...,https://n.news.naver.com/mnews/article/032/0003430911?sid=103,"용인 <b>반도체</b> 클러스터 호남 이전 문제 논쟁 때 영남이랑 비교하는 이야기도 많았는데, 영남에는 그래도 유관 산업의 산단 인프라가 있지만 호남은 없다가 그중 하나죠, 거꾸로 얘기해 보면 호남에 왜 산단 같은 인프라가... ","Tue, 03 Mar 2026 17:49:00 +0900"
2026-03-03 08:54:37,[도쿄증시-마감] 중동發 리스크 확산에 닛케이 3% 넘게 하락,https://news.einfomax.co.kr/news/articleView.html?idxno=4401473,"일본 증시에서는 IHI, 가와사키 중공업, 미쓰비시 중공업 등 방산주와 키옥시아, 도쿄 일렉트론, 어드밴테스트 등 <b>반도체</b>주가 약세를 보였다. 미국 자산운용사 퍼스트 이글 인베스트먼트의 포트폴리오 매니저인... ","Tue, 03 Mar 2026 17:48:00 +0900"
2026-03-03 08:54:37,"외국인 '패닉셀'…코스피, 亞 최대 낙폭",https://n.news.naver.com/mnews/article/015/0005257621?sid=101,"올해 증시 랠리를 주도한 <b>반도체</b>, 자동차, 금융 등 대형주에 차익 실현 매물이 집중됐다. 삼성전자는 9.88% 급락한 19만5100원에 거래를 마쳐 4거래일 만에 ‘20만 전자’를 내줬다. SK하이닉스 역시 11.50% 밀린... ","Tue, 03 Mar 2026 17:48:00 +0900"
2026-03-03 08:54:37,"&quot;땡큐 AI&quot;…삼성전자·SK하이닉스, 낸드 매출 급증",https://weekly.hankooki.com/news/articleView.html?idxno=7152587,"사진=SK하이닉스  삼성전자와 SK하이닉스 등 주요 메모리<b>반도체</b> 기업의 낸드플래시 매출이 최근 급등한... K<b>반도체</b>의 뒤를 일본 키옥시아와 미국의 마이크론 테크놀로지, 그리고 샌디스크 등이 잇고 있다.... ","Tue, 03 Mar 2026 17:48:00 +0900"
2026-03-03 08:54:37,미·이란 충돌에 유가 폭등… 충북 휘발윳값 고공행진,https://www.inews365.com/news/article.html?no=908966,"김희영 한국무역협회 충북지역본부장은 &quot;충북 수출의 주력 품목인 <b>반도체</b>, 이차전지, 바이오는 항공물류 비중이 높아 해상물류 교란의 직접 영향권에서는 다소 벗어나 있지만, 국제유가 급등에 따른 원가 상승은... ","Tue, 03 Mar 2026 17:48:00 +0900"
2026-03-03 08:54:37,'전남광주특별시' 시대 열린다…특별법 통과 시도민보고회 개최,https://n.news.naver.com/mnews/article/015/0005257618?sid=102,"시도민 대표 10명이 참여한 내가 바라는 전남광주통합특별시에서는 인공지능(AI)·<b>반도체</b> 등 첨단산업 육성, 균형발전, 골목상권 활성화에 대한 염원이 주를 이뤘다. 전남광주통합특별법은 지난 1월 2일 국립 5·18민주묘지... ","Tue, 03 Mar 2026 17:47:00 +0900"
2026-03-03 08:54:37,정부 2조원대 GPU 확보 사업 공고 임박…CSP 수주 경쟁 재점화,https://n.news.naver.com/mnews/article/138/0002219400?sid=105,3일 업계에 따르면 과학기술정보통신부는 이르면 이번 주 ‘첨단 AI<b>반도체</b> 서버 확충 및 통합 운영환경 구축’ 사업 공고를 낼 예정이다. 이번 사업은 총 2조831억원 예산을 투입해 1만5000장 이상 첨단 GPU를 확보... ,"Tue, 03 Mar 2026 17:47:00 +0900"
2026-03-03 08:54:37,"한국공학대, 5년 연속 신입생 충원율 100% 달성",https://edu.donga.com/news/articleView.html?idxno=104086,"이를 기반으로 <b>반도체</b> 전 공정을 실습할 수 있는 국내 최고 수준의 '<b>반도체</b>종합교육센터'를 구축했으며, 기업과 공동으로 연구와 교육을 수행하는 연구단지 'TU리서치파크'를 조성해 산학연 협력의 거점을 마련했다.... ","Tue, 03 Mar 2026 17:46:00 +0900"
2026-03-03 08:54:37,코스피 6000 고지 정복과 중동전쟁 '포화' 내 자산 '방탄 포트폴리오'는...,https://www.ccreview.co.kr/news/articleView.html?idxno=343747,"글로벌 투자은행 모간스탠리가 &quot;한국 증시의 재평가가 시작되었다&quot;며 상반기 코스피 7500선 달성이라는 장밋빛 전망까지 내놓자, A씨는 &quot;드디어 미국보다 한국 주식의 시대가 왔다&quot;며 여유 자금을 모두 털어 <b>반도체</b>와 AI... ","Tue, 03 Mar 2026 17:46:00 +0900"
2026-03-03 08:54:37,"HPSP 주주 미래에셋자산운용, HPSP 주식등의 수 149만3121주 증가…총 지...",https://www.digitaltoday.co.kr/news/articleView.html?idxno=636384,<b>반도체</b> 전공정 장비 업체 HPSP(403870) 주식등 보유 상황을 3일 공시했다. HPSP의 주주인 미래에셋자산운용이 주식등의 수를 149만3121주 늘렸다고 보고했다. 미래에셋자산운용의 2026년 2월 27일 기준 HPSP 보유 주식등의... ,"Tue, 03 Mar 2026 17:46:00 +0900"
2026-03-03 08:54:37,외국 교수님 이민 환영합니다…톱티어 비자 발급대상 확대[세상&amp;],https://n.news.naver.com/mnews/article/016/0002607757?sid=102,법무부는 기존 <b>반도체</b>·인공지능(AI)·로봇 등 8개 첨단산업의 기업체 인력에 한정됐던 톱티어 비자 발급 대상을 과학기술 분야의 교수·연구원까지 확대하기로 했다. 해외 우수 인재를 적극 유치하기 위한 방안이다.... ,"Tue, 03 Mar 2026 17:46:00 +0900"
2026-03-03 08:54:37,전 세계 덮친 ‘이란 공습’ 후폭풍…유가·금값 들썩,https://www.kukinews.com/article/view/kuk202603030238,김진욱 씨티 이코노미스트가 발표한 ‘유가 상승이 한국 경제에 미치는 영향 점검 및 2월 <b>반도체</b> 수출... 이는 한국은행이 <b>반도체</b> 수출 호조를 반영해 제시했던 ‘2.0% 성장 전망’을 정면으로 위협하는 수치다. 한국은... ,"Tue, 03 Mar 2026 17:46:00 +0900"
2026-03-03 08:54:37,늘려도 선명한 세계 최고'스트레처블 OLED' 구현,https://www.koit.co.kr/news/articleView.html?idxno=205894,"한편, 이번 연구는 과학기술정보통신부/한국연구재단의 나노및소재기술개발사업 (기여도 50%), 선도연구센터지원사업, 차세대지능형<b>반도체</b>기술개발사업, 신진연구자 인프라지원 사업, 산업통상부의... ","Tue, 03 Mar 2026 17:46:00 +0900"
2026-03-03 08:54:37,"애플, 메모리값 3배 뛰었는데 가격은 '동결'···보급형으로 1위 굳히기",http://www.enewstoday.co.kr/news/articleView.html?idxno=2400842,"][이뉴스투데이 김진영 기자] 애플이 메모리<b>반도체</b> 가격 급등 국면에서 보급형 신제품 '아이폰17e'를 99만원에 내놓으며 가격 동결 승부수를 던졌다. 저장 용량은 두 배로 늘리고 가격은 유지한 가운데, 하드웨어... ","Tue, 03 Mar 2026 17:45:00 +0900"
2026-03-03 08:54:37,샤프 공장 터부터 홋카이도까지…日 ‘AI 데이터 열도’로 변신중,https://n.news.naver.com/mnews/article/011/0004595299?sid=104,엔비디아의 최신 <b>반도체</b>를 탑재한 이 데이터센터는 주요 제약사와 경제연구소 등이 AI 분석과 개발을 위해... 많은 전력이 확보되면 AI의 학습과 운용에 필요한 <b>반도체</b>를 더 많이 가동할 수 있기 때문이다.,"Tue, 03 Mar 2026 17:45:00 +0900"
2026-03-03 08:54:37,통합일까? 통한일까!,http://www.jndn.com/article.php?aid=1772527250428021130,전남광주통합의 핵심 조건은 재생에너지를 기반으로 하는 산업 대전환의 전초 기지구상으로 <b>반도체</b>클러스터 지정을 먼저 받아내야 한다. 수년 내 대기업이 오는 것은 어렵겠지만 신안군을 중심으로 한 전남권은 해상풍력... ,"Tue, 03 Mar 2026 17:44:00 +0900"
2026-03-03 08:54:37,"중동사태 속 코스피 7% 급락, 금값은 강세",https://www.inews365.com/news/article.html?no=908992,"<b>반도체</b>와 자동차 관련 종목도 수출에 차질이 빚어질 수 있다는 우려에 영향을 받았다. 이날 삼성전자는 19만5천100원으로 전장보다 9.88% 하락했고, SK하이닉스는 11.50% 떨어진 93만9천 원으로 거래를 마쳤다. 반면... ","Tue, 03 Mar 2026 17:44:00 +0900"
2026-03-03 08:54:37,中 국책펀드도 투자…휴머노이드 굴기 중심에 선 갤봇,https://n.news.naver.com/mnews/article/011/0004595296?sid=104,이 펀드는 중국 정부가 <b>반도체</b> 산업 활성화를 위해 2024년 5월 3440억 위안(약 73조 원) 규모로 조성한 것으로 체화지능(피지컬 AI의 중국식 표현) 분야에 투자한 것은 이번이 처음이다. 같은 날 다른 휴머노이드 로봇... ,"Tue, 03 Mar 2026 17:44:00 +0900"
2026-03-03 08:54:37,"디노티시아, 장기기억 AI 구현 위한 'AI Storage' 전략 공식화...추론 특...",https://www.aitimes.kr/news/articleView.html?idxno=38885,"벡터 데이터베이스 '씨홀스(Seahorse)'와 전용 데이터 연산 가속 <b>반도체</b>(VDPU: Vector Data Processing Unit)를 자체... 디노티시아는 벡터 데이터베이스, 전용 가속 <b>반도체</b>, 장기기억 기술에 더해 생성형 AI의 단기 작업... ","Tue, 03 Mar 2026 17:44:00 +0900"
2026-03-03 08:54:37,"&quot;美, 엔비디아 H200 칩…中기업당 7.5만개 제한&quot;",https://n.news.naver.com/mnews/article/015/0005257609?sid=104,미국 정부가 엔비디아 인공지능(AI) <b>반도체</b> ‘H200’의 중국 수출 물량을 업체당 7만5000개로 제한하는... 이 같은 수출 제한이 장기화하면 중국이 대체 <b>반도체</b> 개발에 속도를 내면서 미국의 AI 주도권 유지에 오히려... ,"Tue, 03 Mar 2026 17:43:00 +0900"
2026-03-03 08:54:37,‘1% 미만 vs 7% 폭락’… 과거와 다른 중동발 쇼크의 무게,https://n.news.naver.com/mnews/article/366/0001145593?sid=101,"강 위원은 “<b>반도체</b> 호조로 경상수지가 개선되는 흐름이었으나, 환율 불안이 수입 물가를 자극해 부정적 영향이 불가피하다”며 “이날 현대차를 비롯한 자동차·운송장비 섹터의 조정은 수출 경쟁력 악화를 우려한... ","Tue, 03 Mar 2026 17:42:00 +0900"
2026-03-03 08:54:37,"광주광역시·전남도, 통합 특별법 통과 기념 시도민보고회 개최",https://n.news.naver.com/mnews/article/014/0005485557?sid=102,"시도민 대표 10명이 참여하는 '내가 바라는 전남광주통합특별시'에서는 인공지능(AI)·<b>반도체</b> 등 첨단 산업 육성, 균형 발전, 골목상권 활성화에 대한 염원이 주를 이뤘다. 향후 통합특별시의 핵심 과제가 경제와 산업... ","Tue, 03 Mar 2026 17:42:00 +0900"
2026-03-03 08:54:37,"중동발 포성에 '화들짝'…美-이란 전쟁, 韓경제 '퍼펙트 스톰' 되나",https://n.news.naver.com/mnews/article/008/0005324762?sid=101,씨티는 이날 '유가 상승이 한국 경제에 미치는 영향 점검 및 2월 <b>반도체</b> 수출 호조' 보고서에서 브렌트유... 글로벌 경기가 위축되면 우리 주력 수출 품목인 <b>반도체</b>와 자동차 등의 수요가 줄어들 수밖에 없다. 물류비 및... ,"Tue, 03 Mar 2026 17:42:00 +0900"
2026-03-03 08:54:37,전남광주 행정통합 시도민보고회 개최…통합특별시 출범 공감대 확인,https://n.news.naver.com/mnews/article/079/0004120706?sid=102,"시도민 대표 10명이 참여한 희망 메시지 발표에서는 인공지능과 <b>반도체</b> 등 첨단산업 육성, 균형발전, 골목상권 활성화에 대한 염원이 이어졌다. 통합특별시의 핵심 과제가 경제와 산업 경쟁력 강화에 있다는 점을... ","Tue, 03 Mar 2026 17:42:00 +0900"
2026-03-03 08:54:37,변동성 큰 원화값…남미보다 더 흔들렸다,https://n.news.naver.com/mnews/article/009/0005644574?sid=101,"<b>반도체</b> 슈퍼사이클 진입에 따라 지난해 한국의 경상수지는 1230억5000만달러 흑자로, 역대 최대 기록을 세웠다. 올 2월 수출도 전년 동기보다 29% 늘어난 674억5000만달러를 기록한 바 있다. 김정식 연세대 경제학과... ","Tue, 03 Mar 2026 17:41:00 +0900"
2026-03-03 08:54:37,&quot;임원 승진 탈락에 앙심&quot;...중국에 '韓 <b>반도체</b> 기술' 넘긴 50대 최후,https://n.news.naver.com/mnews/article/008/0005324761?sid=102,승진 탈락에 앙심을 품고 국내 <b>반도체</b> 기술과 인력을 중국 업체에 유출한 50대가 실형을 선고받았다. 3일... A씨는 2019년 8월부터 2020년 1월까지 자신이 근무하던 국내 <b>반도체</b> 회사의 <b>반도체</b> 연마제(CMP 슬러리) 및 장치... ,"Tue, 03 Mar 2026 17:41:00 +0900"
2026-03-03 08:54:37,&quot;미·이란 사태 충북 수출입 영향 제한적…비중 1% 미만&quot;,https://n.news.naver.com/mnews/article/421/0008803978?sid=102,"김희영 본부장은 &quot;<b>반도체</b>, 이차전지, 바이오는 항공 물류 비중이 높아 해상물류 교란의 직접 영향권에서는 다소 벗어나 있지만, 국제유가 급등에 따른 원가 상승은 모든 제조기업에 위협 요인이 될 수 있다&quot;고 했다.","Tue, 03 Mar 2026 17:41:00 +0900"
2026-03-03 08:54:37,"용인산업진흥원, <b>반도체</b> R&amp;D 기획 밀착지원",http://www.enewstoday.co.kr/news/articleView.html?idxno=2400819,용인시산업진흥원(이사장 이상일)은 한국전자통신연구원(ETRI)과 협력해 '<b>반도체</b> 기업 R&amp;D 과제기획 지원사업' 참여기업을 모집한다고 3일 밝혔다. 이번 사업은 지난해 조성한 YPA-ETRI 시스템<b>반도체</b> 오픈랩을 기반으로... ,"Tue, 03 Mar 2026 17:40:00 +0900"
2026-03-03 08:54:37,2026년 태국 경제 전망,http://dream.kotra.or.kr/kotranews/cms/news/actionKotraBoardDetail.do?SITE_NO=3&MENU_ID=80&CONTENTS_NO=2&bbsGbn=242&bbsSn=242&pNttSn=239245,"품목별로는 자동 데이터 처리 기계, 통신기기, 전자집적회로 등 전자·IT 중심 품목이 수출을 견인했으며 수입 역시 <b>반도체</b>와 에너지 관련 품목 비중이 높은 구조를 보였다. 이러한 교역 구조는 최근... ","Tue, 03 Mar 2026 17:40:00 +0900"
2026-03-03 08:54:37,[ABC 뉴스룸] 개장 70주년…'코리아 프리미엄' 출발선에 선 韓증시,https://www.ajunews.com/view/20260303165444303,"이는 이번 정부 출범 후 주주가치 보호를 위해 지속적으로 추진하고 있는 상법 개정, 세법 개정 제반 정책과 <b>반도체</b>·조선·방산 등 주력 산업의 경쟁력이 확대되면서 대내외 신뢰 회복으로 이어진 데 따른 것입니다.... ","Tue, 03 Mar 2026 17:40:00 +0900"
2026-03-03 08:54:37,[줌인뉴스룸] 환율·유가·물가 '3각 파도' 덮쳤다…&quot;지수 방어보다 서민...,https://www.pennmike.com/news/articleView.html?idxno=116076,이 평론가는 <b>반도체</b>와 같은 핵심 품목의 수출 비용이 유가 상승과 연동되어 있다고 강조했다. 그는 &quot;삼성전자랑 하이닉스가 우리나라에서 만든 후 수출을 하려면 보통 비행기로 보낸다&quot;라고 설명했다. 지정학적 리스크가... ,"Tue, 03 Mar 2026 17:40:00 +0900"
2026-03-03 08:54:37,뉴욕 버텼는데 코스피는 붕괴···'3일치 매' 한번에 맞았다,https://www.womaneconomy.co.kr/news/articleView.html?idxno=250577,특히 <b>반도체</b> 대형주 급락이 지수 낙폭을 키웠다. 삼성전자는 9.88% 하락한 19만5100원 SK하이닉스는 11.50% 내린 93만9000원에 마감했다. 최근 엔비디아 실적 발표 이후 제기된 인공지능 투자 피크아웃 우려가 겹치며... ,"Tue, 03 Mar 2026 17:40:00 +0900"
2026-03-03 08:54:37,[리포트] '韓증시 70년' 정은보 거래소 이사장 &quot;목표는 세계 최고 자본시...,http://www.paxetv.com/news/articleView.html?idxno=263742,정은보 이사장은 이 같은 성과의 배경으로 새 정부의 주주가치 강화 정책과 함께 <b>반도체</b>·조선·방산 등 주력 산업의 실적 개선을 꼽았습니다. 여기에 더 힘들 싣기 위한 방안들도 제시했습니다. [싱크] 정은보... ,"Tue, 03 Mar 2026 17:40:00 +0900"
2026-03-03 08:54:37,"평택시, '<b>반도체</b> 공정 가스 저감 실증사업' 참여기업 모집",http://www.paxetv.com/news/articleView.html?idxno=263737,평택시청 전경/[사진=평택시] 평택시와 평택산업진흥원은 <b>반도체</b> 핵심 공정에서 사용되는 공정 가스 저감 기술의 실증과 사업화를 지원하기 위해 '2026년 <b>반도체</b> 공정 가스 저감 실증사업' 참여기업을 오는 6일까지... ,"Tue, 03 Mar 2026 17:40:00 +0900"
2026-03-03 08:54:37,사우디·카타르 석유·가스시설 '셧다운'…LNG값 50% 치솟아,https://n.news.naver.com/mnews/article/015/0005257606?sid=104,LNG 공급에 차질이 빚어진다면 정부는 산업용 전력 등에 대한 절전 시나리오를 가동해야 한다. <b>반도체</b> 등 정밀 공정 라인의 손실이 불가피하다. 가스공사는 “비축의무량 이상 LNG 재고를 확보해 대응 중”이라고 밝혔다.,"Tue, 03 Mar 2026 17:40:00 +0900"
2026-03-03 08:54:37,"중동향 수출 과반 이상 기업 1063곳…정부, 바우처·유동성 지원 준비",https://www.kukinews.com/article/view/kuk202603030269,"<b>반도체</b> 측정·검사기기와 브롬·헬륨 등 일부 품목은 중동 의존도가 높지만, 미국 등 대체 수입선 확보나 국내 생산·재고 활용을 통해 공급망 영향을 최소화할 수 있을 것으로 정부는 보고 있다. 다만 수입 납사의 54%가... ","Tue, 03 Mar 2026 17:38:00 +0900"
2026-03-03 08:54:37,"정성호 “인구감소지역 노동자 확대, 첨단인력 확보 위한 이민정책 마련...",https://n.news.naver.com/mnews/article/025/0003506538?sid=102,'육성형 전문기술인력 비자' 신설 구체적으로 정 장관은 “<b>반도체</b>·인공지능(AI)·로봇 등 8개 첨단 산업의 기업체 인력에만 한정됐던 ‘톱티어(Top-Tier) 비자’ 발급 대상을 과학기술 분야 교수·연구원까지 확대해 해외... ,"Tue, 03 Mar 2026 17:37:00 +0900"
