DateTime,Title,Link,Description,PubDate
2026-01-17 04:19:06,러트닉 “미국에 투자하지 않으면 <b>반도체</b> 100% 관세”…한국 등 압박,https://n.news.naver.com/mnews/article/056/0012107089?sid=104,"하워드 러트닉 미국 상무장관이 현지 시각 16일 한국 등 주요 <b>반도체</b> 생산국을 향해 미국에 투자하지 않을 경우 ‘100% <b>반도체</b> 관세’에 직면할 수 있다고 재차 경고했습니다. 블룸버그 통신에 따르면, 러트닉 장관은 이날... ","Sat, 17 Jan 2026 13:15:00 +0900"
2026-01-17 04:19:06,러트닉 &quot;미에 투자 안 하면 <b>반도체</b> 100% 관세&quot;…한국 등 압박,https://n.news.naver.com/mnews/article/055/0001325194?sid=104,▲ 하워드 러트닉 미국 상무장관 하워드 러트닉 미국 상무장관이 한국 등 주요 <b>반도체</b> 생산국을 향해 미국에 투자하지 않을 경우 '100% <b>반도체</b> 관세'에 직면할 수 있다고 재차 경고했습니다. 블룸버그 통신에 따르면... ,"Sat, 17 Jan 2026 13:14:00 +0900"
2026-01-17 04:19:06,美상무 &quot;미국에 투자 안하면 <b>반도체</b> 100% 관세&quot;…한국 등 압박,https://n.news.naver.com/mnews/article/374/0000487015?sid=101,하워드 러트닉 미국 상무장관이 16일(현지시간) 한국 등 주요 <b>반도체</b> 생산국을 향해 미국에 투자하지 않을 경우 '100% <b>반도체</b> 관세'에 직면할 수 있다고 재차 경고했습니다. 블룸버그 통신에 따르면 러트닉 장관은 이날... ,"Sat, 17 Jan 2026 13:14:00 +0900"
2026-01-17 04:19:06,코스피 급등에 시총 순위 재편...'현대차·기아' 존재감 키워,http://www.metroseoul.co.kr/article/20260117500009,"2위는 SK하이닉스(550조원)로 양대 <b>반도체</b> 기업의 합산 시총 비중은 전체의 35.7%를 차지한다. 다음으로는 3위 LG에너지솔루션(91조원), 4위 삼성바이오로직스(90조원), 5위 현대차(85조원), 6위 한화에어로스페이스... ","Sat, 17 Jan 2026 13:14:00 +0900"
2026-01-17 04:19:06,"여한구 &quot;<b>반도체</b> 포고령, 영향 제한적...안심할 단계는 아냐&quot;",https://n.news.naver.com/mnews/article/052/0002302070?sid=101,미국에서 돌아온 여한구 통상교섭본부장이 '<b>반도체</b> 포고령'이 한국 기업에 미치는 영향은 제한적이라고... [기자] 방미 일정을 마친 여한구 산업통상부 통상교섭본부장은 미국의 '<b>반도체</b> 포고령'이 당장 한국 기업에 미치는... ,"Sat, 17 Jan 2026 13:12:00 +0900"
2026-01-17 04:19:06,"한국 <b>반도체</b>, 타이완 수준으로 투자해야?...미 &quot;국가별로 합의&quot;",https://n.news.naver.com/mnews/article/052/0002302069?sid=104,"타이완이 대규모 <b>반도체</b> 설비 투자를 조건으로 미국과 관세 협상을 끝내면서, 우리 정부와 <b>반도체</b> 업계의 긴장감이 커지고 있습니다. 미국은 각국에 부과할 <b>반도체</b> 관세를 국가별로 협상해 결정하겠다는 입장을... ","Sat, 17 Jan 2026 13:10:00 +0900"
2026-01-17 04:19:06,"[아주사설 | 기본·원칙·상식]여론이 먼저 움직였다…AI 시대, 원전은 ...",https://www.ajunews.com/view/20260117125942342,AI와 <b>반도체</b>가 국가 성장 전략의 핵심으로 부상하면서 전력 문제는 더 이상 미룰 수 없는 현실 과제가 됐다.... 김용범 실장은 “AI와 <b>반도체</b>는 전기 먹는 하마”라며 “신규 원자력 발전소 건설은 불가피하다”고 밝혔다.... ,"Sat, 17 Jan 2026 13:08:00 +0900"
2026-01-17 04:19:06,"통상본부장 &quot;美 <b>반도체</b> 포고령, 삼성·SK 영향 제한적...2단계 총력 대응...",https://n.news.naver.com/mnews/article/123/0002375915?sid=100,"여한구 산업통상부 통상교섭본부장은 17일 미국의 '<b>반도체</b> 포고령' 1단계 조치가 한국 메모리 <b>반도체</b> 기업에 미치는 영향은 제한적이라고 선을 그으면서도, 관세 범위가 확대될 '2단계 시나리오'에 대비해 미국과의 고위급... ","Sat, 17 Jan 2026 13:07:00 +0900"
2026-01-17 04:19:06,러트닉 &quot;美에 투자하지 않으면 <b>반도체</b> 100% 관세&quot;…한국 등 압박,https://n.news.naver.com/mnews/article/001/0015852533?sid=104,향후 한국과 협상 예정…작년에 '대만보다 불리하지 않은 조건' 약속 하워드 러트닉 미국 상무장관이 16일(현지시간) 한국 등 주요 <b>반도체</b> 생산국을 향해 미국에 투자하지 않을 경우 '100% <b>반도체</b> 관세'에 직면할 수... ,"Sat, 17 Jan 2026 13:05:00 +0900"
2026-01-17 04:19:06,"여한구 통상본부장 &quot;美 <b>반도체</b> 포고령, 韓 기업 영향 제한적&quot;",https://www.pinpointnews.co.kr/news/articleView.html?idxno=418531,여한구 산업통상부 통상교섭본부장은 미국이 최근 발표한 '<b>반도체</b> 포고령'이 한국 기업에 미치는 영향에... 여 본부장은 당초 전날 귀국 예정이었으나 미국 도널드 트럼프 대통령이 <b>반도체</b>·핵심관련 관련 포고령에... ,"Sat, 17 Jan 2026 13:04:00 +0900"
2026-01-17 04:19:06,아이씨에이치 ·서울전자통신 주가 방긋... 신제품 출시·해외 수주 기대...,https://www.pinpointnews.co.kr/news/articleView.html?idxno=418528,"필옵틱스는 광학장비 시장에서 꾸준한 매출 성장과 수출 증가가 반영되었고, 파크시스템스는 <b>반도체</b> 및... 이들은 <b>반도체</b> 장비 및 전자부품의 꾸준한 수요와 글로벌 공급망 안정화가 긍정적으로 작용했다.... ","Sat, 17 Jan 2026 12:58:00 +0900"
2026-01-17 04:19:06,美 “<b>반도체</b> 시설 40% 내놓거나 관세 100%”…대만 당혹,https://n.news.naver.com/mnews/article/020/0003690142?sid=104,미국이 대만과 무역합의를 체결한 후 대만 <b>반도체</b> 생산의 40%를 미국으로 가져오는 것이 목표라고 밝히자... 미국으로부터 <b>반도체</b> 품목 관세 면제를 약속받았다. 같은 날 하워드 러트닉 미국 상무장관은 CNBC와의... ,"Sat, 17 Jan 2026 12:55:00 +0900"
2026-01-17 04:19:06,스쿠터가 없었다면 좁고 낡은 타이베이 도심은 훨씬 더 끔찍했을 것이다...,https://n.news.naver.com/mnews/article/002/0002423662?sid=104,"반면에 대만경제는 오랫동안 <b>반도체</b>에 올인하고 있다. 도요타 자동차를 조립생산하던 회사가 자체 생산을 시작했지만, 그 비중은 아직 작다. 정책적으로 자가용 구입을 억제하고 있다. 이런 차이는 세금, 보험료, 주차... ","Sat, 17 Jan 2026 12:53:00 +0900"
2026-01-17 04:19:06,"美서 귀국한 통상본부장 &quot;미국 <b>반도체</b> 포고령, 현재는 영향 제한적&quot;",https://n.news.naver.com/mnews/article/008/0005305837?sid=101,미국의 '<b>반도체</b> 포고령'이 한국 기업에 미치는 영향에 대해 &quot;현재 상태로는 당장 그 영향은 제한적이라 본다&quot;고 17일 밝혔다. 뉴스1에 따르면 이날 오전 인천공항에 도착한 여 본부장은 취재진들과 만나 &quot;우리 <b>반도체</b>... ,"Sat, 17 Jan 2026 12:52:00 +0900"
2026-01-17 04:19:06,"김산 무안군수, 청와대 방문…광주 군 공항 이전 연계 <b>반도체</b> 클러스터...",https://www.asiaa.co.kr/news/articleView.html?idxno=237381,인센티브로 <b>반도체</b> 클러스터 조성을 공식 건의했다. 무안군에 따르면 이번 면담에서 김 군수는 군 공항... 특히 <b>반도체</b> 클러스터 조성과 대기업 유치를 핵심 인센티브로 제시했다. 김 군수는 무안국제공항과 KTX 접근성... ,"Sat, 17 Jan 2026 12:34:00 +0900"
2026-01-17 04:19:06,"통상본부장 &quot;미국 <b>반도체</b> 포고령, 한국 영향 제한적&quot;",https://n.news.naver.com/mnews/article/055/0001325190?sid=101,여한구 산업통상부 통상교섭본부장은 미국이 최근 발표한 '<b>반도체</b> 포고령'이 한국 기업에 미치는 영향에 대해 &quot;현재 상태론 당장 그 영향은 제한적이라 본다&quot;고 밝혔습니다. 여 본부장은 방미 일정을 소화하고 오늘 오전... ,"Sat, 17 Jan 2026 12:27:00 +0900"
2026-01-17 04:19:06,"엔비디아 칩 막힌 中, AI 뒤처질까 우려 확산…우회 전략 등 돌파구 탐색",https://www.sentv.co.kr/article/view/sentv202601170020,서울경제티브이 김효진 기자 미국의 대중국 <b>반도체</b> 수출 통제 조치가 본격화되면서 중국 인공지능(AI) 기업들 사이에서 위기감이 커지고 있다. 고성능 AI 칩을 확보하기 어려워진 상황에서 “미국과의 경쟁에서 뒤처질 수... ,"Sat, 17 Jan 2026 12:24:00 +0900"
2026-01-17 04:19:06,"미 “<b>반도체</b> 관세 국가별로 합의할 것”…한, 대만과 동일 적용 아냐",http://www.newstomato.com/ReadNews.aspx?no=1288151&inflow=N,부과할 <b>반도체</b> 관세와 그 면제 기준은 국가별로 협상을 통해 결정하게 된다는 입장을 다시 한번 확인했습니다. 삼성전자가 미국 텍사스주 테일러시에 건설 중인 <b>반도체</b> 파운드리 공장 모습. (사진=삼성전자) 트럼프 행정부... ,"Sat, 17 Jan 2026 12:20:00 +0900"
2026-01-17 04:19:06,"용인특례시, 2025년 지방규제혁신 성과평가 '우수 지자체' 선정",http://www.metroseoul.co.kr/article/20260116500355,높은 <b>반도체</b> 생산시설(팹) 특성을 고려해 건측물 가운데 사다리차가 닿지 않는 44m(6층)를 초과하는 부분에 대해서는 소방관 진입창 설치 면제 등을 중앙정부에 건의해 반영시켰다. 시는 이동·남사읍 첨단시스템<b>반도체</b>... ,"Sat, 17 Jan 2026 12:16:00 +0900"
2026-01-17 04:19:06,"용인시 이상일 시장, &quot;<b>반도체</b> 국가산단 이전은 국가 산업 경쟁력 훼손&quot;",http://www.metroseoul.co.kr/article/20260116500345,"산업인 <b>반도체</b>산업과 국가 발전을 위한 것&quot;이라고 밝혔다. 이날 간담회는 용인상공회의소 주최로 기업인 100여 명이 참석한 가운데, 용인 <b>반도체</b> 국가산업단지 이전 반대와 관련한 대응 방안을 논의하기 위해 마련됐다.... ","Sat, 17 Jan 2026 12:14:00 +0900"
2026-01-17 04:19:06,"SK하이닉스, 올해도 성과급 대박 터진다",http://www.cctimes.kr/news/articleView.html?idxno=886850,<b>반도체</b> 슈퍼사이클(초호황기)로 역대급 실적을 올리면서 초과이익분배금(PS)이 1인당 평균 1억4000만원 수준에 달할 것으로 전망되면서다. 업계는 SK하이닉스가 HBM(고대역폭 메모리)를 필두로 역대급 실적이... ,"Sat, 17 Jan 2026 12:08:00 +0900"
2026-01-17 04:19:06,&quot;<b>반도체</b> 생산 40% 美 이전&quot; 러트닉 발언에… 대만 &quot;계산 근거 불분명&quot;,https://n.news.naver.com/mnews/article/277/0005708094?sid=104,미국이 대만과의 상호관세 합의 이후 대만 <b>반도체</b> 생산능력의 40%를 미국으로 가져가겠다는 목표를 밝히고... 전체 (<b>반도체</b>) 공급망과 생산량의 40%를 미국으로 가져오는 게 목표&quot;라고 한 데 대해 이같이 전했다. 양측은... ,"Sat, 17 Jan 2026 12:06:00 +0900"
2026-01-17 04:19:06,[위클립] 1월 3주,https://www.laborplus.co.kr/news/articleView.html?idxno=40161,13일 경기도 용인시 SK에코플랜트 <b>반도체</b> 클러스터 펩동 건설현장에서 철근 노동자가 쓰러져 병원으로... <b>반도체</b>와 전투기를 달리 취급할 이유가 없다. 금속노련은 금속노조와 힘을 합쳐 방산노동자의 노동3권 보장을 위해... ,"Sat, 17 Jan 2026 12:06:00 +0900"
2026-01-17 04:19:06,"[광주·전남 교육기상도①] 광주시교육청, 학력 향상·미래인프라 '두 바...",https://www.newsworks.co.kr/news/articleView.html?idxno=827528,광주의 <b>반도체</b>·AI 산업과 교육의 연계를 통해 청년 인재 양성 기반을 구축한다는 계획이다. ◆광주시교육청 '성과 중심 정책'…수치로 입증된 효과 이정선 교육감 리더십 아래 광주시교육청이 추진한 정책들은 수치로... ,"Sat, 17 Jan 2026 12:04:00 +0900"
2026-01-17 04:19:06,"[특별 기고] 중국의 희토류 수출 통제, 대만 발언 '보복' 넘어 '예방적 ...",https://n.news.naver.com/mnews/article/586/0000120381?sid=100,"첨단 소재, 정밀화학, <b>반도체</b> 장비처럼 민간 기술과 군사 역량이 깊이 결합된 기정학 환경에서는, 투입... <b>반도체</b> 제조 장비, 첨단 소재·화학, 정밀 부품 분야에서 민간과 군사용 기술을 아우르는 지배적 위치를 차지하고... ","Sat, 17 Jan 2026 12:00:00 +0900"
2026-01-17 04:19:06,방미 귀국 통상본부장 “미국 <b>반도체</b> 포고령 영향 제한적”,https://n.news.naver.com/mnews/article/056/0012107082?sid=101,여 본부장은 미국의 <b>반도체</b> 관세 부과 조치가 우리 기업들에 미치는 영향은 제한적일 거라고 밝혔습니다. 보도에 정재우 기자입니다. [리포트] 미국이 일부 수출용 <b>반도체</b>에 관세를 매기겠다고 하면서 귀국 일정을 하루... ,"Sat, 17 Jan 2026 12:00:00 +0900"
2026-01-17 04:19:06,&quot;올해 AI 전환의 원년&quot;···건설사 생존·성장 AI가 가른다,https://www.seoulfn.com/news/articleView.html?idxno=618617,"안전 관리부터 공정·원가 통제, 의사결정 구조, 나아가 데이터센터·<b>반도체</b> 등 신사업까지 AI를 기업 운영... AI 확산으로 데이터센터와 <b>반도체</b> 인프라 수요가 급증하면서, 건설사들은 해당 분야를 차세대 성장 동력으로... ","Sat, 17 Jan 2026 12:00:00 +0900"
2026-01-17 04:19:06,트럼프가 꺼낸 '카드 금리 10% 상한제'… 배후는 맘디니?,https://www.fortunekorea.co.kr/news/articleView.html?idxno=51373,"그는 정부가 <b>반도체</b> 기업 인텔의 지분을 직접 인수하고 이자율까지 통제하려 드는 상황을 두고, 공화당이 비난해온 맘다니의 사회주의와 트럼프의 정책이 무엇이 다르냐며 &quot;너희 사회주의보다 우리 사회주의가 낫다는... ","Sat, 17 Jan 2026 12:00:00 +0900"
2026-01-17 04:19:06,"IMF, 올해 韓 성장률 전망치 상향조정할까[경제전망대]",https://n.news.naver.com/mnews/article/003/0013715854?sid=101,<b>반도체</b> 슈퍼사이클과 건설투자 등 내수 회복세로 인해 IMF와 한국은행(1.8%)의 전망치를 상회할 수 있을 것으로 내다봤다. 이에 따라 IMF가 이번 보고서에서 한국의 성장률 전망치를 상향조정할지 관심이... ,"Sat, 17 Jan 2026 12:00:00 +0900"
2026-01-17 04:19:06,'<b>반도체</b> 호황' 삼성전자·SK하이닉스 거액 성과급,https://n.news.naver.com/mnews/article/214/0001474931?sid=101,"이른바 '슈퍼 사이클' 진입으로 <b>반도체</b> 업계 호황이 이어지면서, 삼성전자와 SK하이닉스 모두 직원들에게 거액의 성과급을 지급합니다. 삼성전자는 <b>반도체</b> 사업 부문의 경우 작년 연봉의 14% 수준이던 초과이익... ","Sat, 17 Jan 2026 11:59:00 +0900"
2026-01-17 04:19:06,이상일 용인특례시장 &quot;국가산단 지정했다면 진행 상황 점검하고 챙겨 속...,https://www.tournews21.com/news/articleView.html?idxno=126759,산업인 <b>반도체</b>산업의 발전과 국가 발전을 위해 내는 것&quot;이라고 17일 말했다. 16일 용인상공회의소가 개최한 이날 간담회는 기업인 100여 명이 참석한 가운데 <b>반도체</b> 국가산단 이전 반대에 대한 대책 의견을 교환하고자... ,"Sat, 17 Jan 2026 11:56:00 +0900"
2026-01-17 04:19:06,"[1월 셋째 주 세계경제동향 브리핑] 한국 증시는 웃고, 미국 증시는 숨...",https://www.kihoilbo.co.kr/news/articleView.html?idxno=3010394,<b>반도체</b>·금융주를 중심으로 외국인과 기관 매수세가 유입된 것이 지수 상승을 이끌었다. 코스닥 지수도 6.67포인트 상승한 954.59포인트로 마감하며 강세 흐름을 이어갔다. 반면 미국 증시는 숨 고르기에 들어갔다.... ,"Sat, 17 Jan 2026 11:54:00 +0900"
2026-01-17 04:19:06,"美 &quot;<b>반도체</b> 관세, 국가별 협상으로 결정&quot;…대만·한국, 별도 기준일 듯",https://n.news.naver.com/mnews/article/469/0000909515?sid=104,도널드 트럼프 미국 행정부가 추후 각국에 부과할 <b>반도체</b> 관세 및 면제 기준을 국가별 협상을 통해 결정할 방침이라고 밝혔다. 16일(현지시간) 연합뉴스에 따르면 트럼프 행정부 당국자는 '미국이 대만과 합의한 <b>반도체</b>... ,"Sat, 17 Jan 2026 11:51:00 +0900"
2026-01-17 04:19:06,&quot;타이완 <b>반도체</b>산업 40% 미국으로&quot;…타이완 &quot;어떤 계산법?&quot;,https://n.news.naver.com/mnews/article/055/0001325187?sid=104,타이완 <b>반도체</b> 생산능력의 40%를 미국으로 가져가겠다는 목표를 밝힌 것과 관련해 논란이 이어지고 있습니다. 중화권 매체들은 오늘(17일) 협상 타결 후 하워드 러트닉 미 상무장관이 &quot;타이완 전체 (<b>반도체</b>) 공급망과... ,"Sat, 17 Jan 2026 11:40:00 +0900"
2026-01-17 04:19:06,"더 강해지는 트럼프의 '미국 우선주의', 관세·안보 전면 압박에 동맹국...",https://www.pennmike.com/news/articleView.html?idxno=113792,"트럼프 대통령은 최근 <b>반도체</b>, 방위산업, 에너지 등 전략 산업을 중심으로 미국의 이익에 부합하지 않는 공급망에 대해 고율 관세와 제재를 검토하고 있음을 연이어 시사했다. 특히 미국을 거쳐 재수출되는 첨단 제품에... ","Sat, 17 Jan 2026 11:40:00 +0900"
2026-01-17 04:19:06,'미국과 격차 벌어지나'… 대중 수출 규제에 중국 AI 업계 '비관론' 확산,https://www.g-enews.com/view.php?ud=202601171132203536df2f5bc1bc_1,"미국의 대중국 <b>반도체</b> 수출 통제가 장기화되면서 고성능 인공지능(AI) 칩 수급에 어려움을 겪고 있는 중국 AI 기업들 사이에 비관론이 확산되고 있다. 화웨이 등 자국산 <b>반도체</b>로 돌파구를 찾고 있으나, 막대한 자금력과... ","Sat, 17 Jan 2026 11:36:00 +0900"
2026-01-17 04:19:06,"<b>반도체</b> 호황에 역대급 성과급…삼성 <b>반도체</b> '연봉 47%', SK하이닉스 '1.4...",https://n.news.naver.com/mnews/article/448/0000584271?sid=101,<b>반도체</b> 호황에 힘입어 삼성전자·SK하이닉스 모두 직원들에게 역대급 성과급을 지급한다. 삼성전자는 <b>반도체</b> 사업부 성과급을 연봉의 47%까지 끌어올렸고 SK하이닉스는 자사주 옵션을 포함해 1인당 평균 1억4000만 원에... ,"Sat, 17 Jan 2026 11:36:00 +0900"
2026-01-17 04:19:06,&quot;미국 수출규제로 AI칩 수급 어려워&quot;…중국 AI 개발자 '우려 확산',https://n.news.naver.com/mnews/article/057/0001930626?sid=104,미국의 대중국 <b>반도체</b> 수출 통제 조치로 고성능 인공지능(AI) 칩을 구하기 어려워진 중국 AI 기업들이... 보여준 혁신을 설명해준다&quot;고 평가했습니다. #중국 #미국 #AI #인공지능 #<b>반도체</b> #칩 #고성능 #엔비디아 #딥시크 #AI굴기,"Sat, 17 Jan 2026 11:34:00 +0900"
2026-01-17 04:19:06,러트닉 “대만 <b>반도체</b>산업 40% 美로”… 대만 “어떤 계산법이나?”,https://n.news.naver.com/mnews/article/029/0003005368?sid=101,"미국은 대만 <b>반도체</b> 생산능력의 40%를 미국으로 가져가겠다는 목표를 밝히고 있지만, 실현 가능성에... 전체 (<b>반도체</b>) 공급망과 생산량의 40%를 미국으로 가져오는 게 목표”라고 한 데 대해 이같이 전했다. 양측은 앞서... ","Sat, 17 Jan 2026 11:33:00 +0900"
2026-01-17 04:19:06,"집에서 쫓겨난 노인, 지역에서 쫓겨난 주민",https://n.news.naver.com/mnews/article/047/0002501767?sid=100,"통합론자들은 AI, <b>반도체</b> 등 대기업 중심의 '양질의 일자리'를 약속한다. 하지만 '대충통합'을 하면 양질의 일자리가 생긴다는 보장은 없다. 더욱이 고도로 자동화된 첨단 산업은 고용 유발 효과도 낮다. 고용의 80%를... ","Sat, 17 Jan 2026 11:31:00 +0900"
2026-01-17 04:19:06,뉴욕증시 조정에 암호화폐 시장도 주춤…정치 불확실성이 위험자산 짓눌...,http://www.newstown.co.kr/news/articleView.html?idxno=688729,<b>반도체</b> 주가 강세와 같은 일부 호재에도 불구하고 투자자들은 연준의 독립성 침해 우려 및 추가 상승 모멘텀 부족에 더욱 민감하게 반응하고 있다. 전문가들은 정치적 불확실성이 해소되고 기관 자금이 다시... ,"Sat, 17 Jan 2026 11:30:00 +0900"
2026-01-17 04:19:06,"김해시, '고중량물 AMR 시험평가센터' 착공...글로벌 첨단산업 도시 도약",https://www.newsfreezone.co.kr/news/articleView.html?idxno=669791,고중량물 AMR은 40톤 이상의 화물을 자율적으로 운송하는 로봇으로 항만·<b>반도체</b>·항공·조선 등 고부가가치 산업의 핵심 물류 기술로 주목받고 있다. 김해에 들어서는 시험평가센터는 이러한 고중량물 AMR의 성능 검증과... ,"Sat, 17 Jan 2026 11:30:00 +0900"
2026-01-17 04:19:06,엔비디아 H200 중국 수출분에 관세? 트럼프 속셈 [경제용어사전],https://n.news.naver.com/mnews/article/665/0000006598?sid=101,이번엔 <b>반도체</b> 품목관세입니다. 그런데 방식이 좀 이상합니다. 지난 14일(현지시간) 트럼프 대통령은 엔비디아의 인공지능(AI) <b>반도체</b> 'H200'의 대중對中 수출분에 25%의 관세를 부과하는 포고문에 서명했습니다. 관세는... ,"Sat, 17 Jan 2026 11:29:00 +0900"
2026-01-17 04:19:06,"한국투자증권, 손익차등형 '글로벌 AI혁신산업 펀드' 단독 판매",http://www.rightknow.co.kr/news/articleView.html?idxno=33368,"AI <b>반도체</b>, 에너지 인프라, 디지털 금융, 컨슈머 플랫폼, 바이오테크, AI 로보틱스, 우주항공 등 7개 하위 사모펀드에 분산 투자하는 구조로 설계됐다. 이 펀드는 고객을 선순위, 한국투자금융지주를 포함한 계열사를... ","Sat, 17 Jan 2026 11:28:00 +0900"
2026-01-17 04:19:06,&quot;고성능 칩 못 구해&quot;…美 규제에 흔들리는 中 AI,https://n.news.naver.com/mnews/article/215/0001238252?sid=004,미국의 대중국 <b>반도체</b> 수출 규제가 이어지면서 중국 인공지능(AI) 업계 내부에서 기술 경쟁력 약화에 대한 우려가 확산하고 있다. 고성능 AI 칩 확보가 어려워진 상황이 장기화될 경우 미국 기업들과의 격차가 더 벌어질 수... ,"Sat, 17 Jan 2026 11:26:00 +0900"
2026-01-17 04:19:06,&quot;대만 <b>반도체</b>산업 40% 美로&quot; 러트닉 언급에…대만 &quot;어떤 계산법?&quot;,https://n.news.naver.com/mnews/article/001/0015852462?sid=104,"대만 <b>반도체</b> 생산능력의 40%를 미국으로 가져가겠다는 목표를 밝히고 있지만, 실현 가능성에 대해서는... 전체 (<b>반도체</b>) 공급망과 생산량의 40%를 미국으로 가져오는 게 목표&quot;라고 한 데 대해 이같이 전했다. 양측은 앞서... ","Sat, 17 Jan 2026 11:23:00 +0900"
2026-01-17 04:19:06,"순천시, RE100 <b>반도체</b> 국가산단 유치 전담조직 신설",https://www.newscj.com/news/articleView.html?idxno=3364538,전남 순천시가 RE100 <b>반도체</b> 국가산단 유치를 전담할 조직을 신설하고 유치 대응 체계를 강화하고 있다. 시는 RE100 <b>반도체</b> 국가산단 유치를 체계적으로 추진하기 위해 <b>반도체</b> 전담팀을 신설하고 본격 운영에 들어갔다고... ,"Sat, 17 Jan 2026 11:22:00 +0900"
2026-01-17 04:19:06,&quot;美 수출 규제로 고성능 칩 확보 어려워&quot;…中 AI 개발자들 '우려',https://n.news.naver.com/mnews/article/277/0005708083?sid=104,미국의 대중국 <b>반도체</b> 수출 통제 조치로 고성능 인공지능(AI) 칩을 구하기 어려워진 중국 AI 기업들 사이에서... 이는 미국의 대중(對中) 수출 규제로 인해 중국 기업들이 미국 기업과 비교해 첨단 AI <b>반도체</b> 확보에... ,"Sat, 17 Jan 2026 11:22:00 +0900"
2026-01-17 04:19:06,14만전자·75만닉스…<b>반도체</b> 호황 대체 언제까지? [부꾸미],https://n.news.naver.com/mnews/article/008/0005305831?sid=101,미국발 AI(인공지능) 데이터센터 투자 확대가 메모리 <b>반도체</b> 수요 증가와 가격 상승을 이끌면서 이른바... 메모리 <b>반도체</b> 가격 상승과 관련해 &quot;메타와 알파벳 등 미국 빅테크 기업들은 AI 레이스에서 낙오되지 않는 것이 더... ,"Sat, 17 Jan 2026 11:21:00 +0900"
2026-01-17 04:19:06,"[고래사냥] '제일일렉트릭, 차바이오텍, 싸이닉솔루션, 엠오티, 이노와...",https://news.mtn.co.kr/news-detail/2026011623153342075,"AI<b>반도체</b> 화질 개선 솔루션 개발- 차바이오텍, 100억 투자 유치… LG CNS와 AI 협력▶▶▶ 오늘 장 HOT 종목 [제일일렉트릭(199820)]- 김용범 정책실장 “ 신규 원전 건설 불가피”- <b>반도체</b> 수요 폭주와 함께 에너지... ","Sat, 17 Jan 2026 11:10:00 +0900"
