DateTime,Title,Link,Description,PubDate
2026-01-04 04:03:43,"삼성, 사내 기술 전문가 '삼성 명장' 17명 선정…역대 최대",https://n.news.naver.com/mnews/article/011/0004574445?sid=101,"삼성전자에서는 모바일 핵심부품의 신공법을 개발한 이상훈(55) 명장, 식각(에칭) 공정의 양산성 확보 전문가인 <b>반도체</b> 사업부 나민재(53) 명장 등이 선정됐다. 삼성디스플레이에선 기석(52), 이동영(53) 명장 등이... ","Sun, 04 Jan 2026 13:01:00 +0900"
2026-01-04 04:03:43,"삼성, 사내 핵심 전문가 '삼성 명장' 17명 선정…역대 최대 규모",https://n.news.naver.com/mnews/article/014/0005457733?sid=101,"<b>반도체</b>(DS)부문에서는 주요 제품 생산 목표를 달성하고 신설비증후군 제어기술을 개발해 제품 생산성 향상에 기여한 메모리사업부의 나민재 명장을 비롯해 이동우 명장, 파운드리 사업부의 강보승 명장, 글로벌 제조... ","Sun, 04 Jan 2026 13:01:00 +0900"
2026-01-04 04:03:43,"삼성, 올해 '기술 명장' 17명 선발… 역대 최대 규모",https://n.news.naver.com/mnews/article/030/0003386440?sid=105,"삼성전자는 DX(디바이스경험)부문에서 7명, DS(<b>반도체</b>)부문에서 5명을 배출했다. DX부문에서는 △모바일... DS부문은 차세대 <b>반도체</b> 기술 경쟁력 강화에 기여한 인물들이 주를 이뤘다. △HBM(고대역폭메모리) 및 웨이퍼... ","Sun, 04 Jan 2026 13:01:00 +0900"
2026-01-04 04:03:43,"삼성, ‘2026 삼성 명장’ 선정… <b>반도체</b>·모바일 등 분야 전문가 17명 선...",https://n.news.naver.com/mnews/article/366/0001134035?sid=105,"삼성은 제조기술, 설비, 품질, 인프라, 금형, 구매, 계측 등 핵심 기술 분야에서 뛰어난 전문성을 갖춘 인재 17명을 ‘2026 삼성 명장’으로 선정했다고 4일 밝혔다. 올해 선정된 삼성 명장은 총 17명으로, 명장 제도 도입... ","Sun, 04 Jan 2026 13:01:00 +0900"
2026-01-04 04:03:43,“미장만 보지 마세요”...눈길 끄는 中 주식 뭐길래,https://n.news.naver.com/mnews/article/024/0000102533?sid=101,"인공지능(AI)과 <b>반도체</b> 테마가 주를 이룬다. 구글 클라우드, 제미나이 3.0, 텐서처리장치(TPU) 각 분야에서... AI 수요 확대로 호황을 보이는 메모리 <b>반도체</b> 기업 마이크론 또한 유망하다는 평가다. D램과 낸드 가격... ","Sun, 04 Jan 2026 13:01:00 +0900"
2026-01-04 04:03:43,"삼성, 최고 기술인재 '삼성 명장' 17명 선발…사상 최대 규모",https://n.news.naver.com/mnews/article/018/0006194333?sid=101,"<b>반도체</b>(DS)부문에서는 에치(Etch) 공정의 양산성 확보 전문가인 나민재 메모리사업부 명장을 비롯해 이동우 메모리사업부 명장, 강보승 파운드리사업부 명장 등이 포함됐다. 삼성디스플레이에서는 기석 중소형사업부... ","Sun, 04 Jan 2026 13:01:00 +0900"
2026-01-04 04:03:43,"삼성, 최고기술전문가 '2026 삼성 명장' 17명 선정…역대 최대",https://n.news.naver.com/mnews/article/001/0015827660?sid=101,"<b>반도체</b> 사업을 맡고 있는 디바이스솔루션(DS)부문에서는 에치(Etch·식각)공정 양산성 확보 전문가 나민재(53) 명장, CMP설비 전문가 이동우(53) 명장, CVD공정 RF/Plasma 전문가 강보승(51) 명장, 인프라 훅업(Hook-up) 기술... ","Sun, 04 Jan 2026 13:00:00 +0900"
2026-01-04 04:03:43,"삼성SDS, 드디어 구미에 AI 데이터센터 짓는다…구미 첨단 산업 허브로...",https://www.idaegu.com/news/articleView.html?idxno=654837,데이터센터는 구미의 전통적 제조업 기반을 근본적으로 변화시키고 <b>반도체</b> 소재·부품 특화단지와의 시너지 효과를 가져올 것으로 기대된다. 특히 '갤럭시'란 세계적인 스마트폰 제조역량을 갖춘 구미는 <b>반도체</b> 소재... ,"Sun, 04 Jan 2026 13:00:00 +0900"
2026-01-04 04:03:43,삼성증권 &quot;슈퍼리치 2026년 키워드 'K.O.R.E.A.'..코스닥·ETF·AI 선호&quot;,http://www.4th.kr/news/articleView.html?idxno=2104309,"2026년 가장 중요한 화두로 절반에 가까운 48.1%가 'AI 산업의 성장세 지속'을 꼽았으며, 투자 유망 업종 역시 'AI/<b>반도체</b>'가 31.8%로 1위를 차지했다. 이어 '로봇'이 18.0%로 2위에 올라 기술주 중심의 성장을 기대하는... ","Sun, 04 Jan 2026 13:00:00 +0900"
2026-01-04 04:03:43,"삼성, 불황 속에서도 '기술에 베팅'…역대 최대 17명 명장 선발",https://www.straightnews.co.kr/news/articleView.html?idxno=291071,"<b>반도체</b>와 디스플레이, 배터리, 조선 등 전반적인 산업 환경이 녹록지 않은 상황에서도 명장 선발 규모를 사상 최대 수준으로 늘렸다는 점에서 단순한 사내 포상 차원을 넘어선 전략적 메시지로 읽힌다. 삼성은 4일... ","Sun, 04 Jan 2026 13:00:00 +0900"
2026-01-04 04:03:43,"&quot;기술이 경쟁력&quot;…삼성, 기술 인재 17명 '명장' 선정",https://n.news.naver.com/mnews/article/008/0005299991?sid=101,올해는 <b>반도체</b> 사업을 담당하는 삼성전자 DS(디바이스솔루션) 부문에서만 5명의 명장이 배출됐다. 메모리사업부 나민재 명장(53)은 Etch(식각) 공정의 양산성 확보 전문가로 HARC(High Aspect Ratio Contact) 설비 개선 과제를... ,"Sun, 04 Jan 2026 13:00:00 +0900"
2026-01-04 04:03:43,"삼성, ‘2026 삼성 명장’ 17명 선정…기술인재 육성 가속",https://www.seoultimes.news/news/article.html?no=2000088883,"DS부문에서는 메모리·파운드리 공정의 설비 혁신과 수율 향상, 계측 기술 고도화를 통해 <b>반도체</b> 경쟁력을 끌어올린 명장들이 배출됐다. 삼성디스플레이에서는 OLED 증착 공정과 인프라 안전 기술을 선도한 인물이... ","Sun, 04 Jan 2026 13:00:00 +0900"
2026-01-04 04:03:43,"삼성증권, 슈퍼리치 2026년 키워드는 'K.O.R.E.A.'",https://www.businessplus.kr/news/articleView.html?idxno=105146,2026년 가장 중요한 화두로 절반에 가까운 48.1%가 'AI 산업의 성장세 지속'을 꼽았으며 투자 유망 업종 역시 'AI·<b>반도체</b>'가 31.8%로 1위를 차지했다. 이어 '로봇'이 18.0%로 2위에 올라 기술주 중심의 성장을 기대하는... ,"Sun, 04 Jan 2026 12:56:00 +0900"
2026-01-04 04:03:43,"삼성증권 &quot;슈퍼리치들, 2026년 코스피 5,000 시대 연다...국장 '풀매수' ...",https://news.ifm.kr/news/articleView.html?idxno=461506,"가장 유망한 업종으로 'AI/<b>반도체</b>(31.8%)'가 1위를 차지했고, 로봇(18.0%)과 제약/바이오(14.8%)가 뒤를 이었습니다. 투자 방식에서는 개별 종목 발굴 대신 ETF나 ETN을 활용하겠다는 응답(49.1%)이 직접 투자보다 높게... ","Sun, 04 Jan 2026 12:56:00 +0900"
2026-01-04 04:03:43,"슈퍼리치가 본 2026년, 그들의 선택은 'K.O.R.E.A.'",http://www.globalepic.co.kr/view.php?ud=2026010412394099645ebfd494dd_29,"2026년 가장 중요한 화두로 절반에 가까운 48.1%가 'AI 산업의 성장세 지속'을 꼽았으며, 투자 유망 업종 역시 'AI/<b>반도체</b>'가 31.8%로 압도적 1위를 차지했다. 이어 로봇이 18.0%로 2위에 올라 범 AI 테마에 대한 선호도가... ","Sun, 04 Jan 2026 12:46:00 +0900"
2026-01-04 04:03:43,[이런펀드어때요?] 한국투신 'ACE AI<b>반도체</b>포커스 ETF',https://n.news.naver.com/mnews/article/014/0005457723?sid=101,한국투자신탁운용의 'ACE AI<b>반도체</b>포커스 ETF'가 AI<b>반도체</b> 대표 종목에 소수 압축으로 주목받고 있다. AI<b>반도체</b> 및 고성능 메모리<b>반도체</b> 구현을 위한 핵심기술을 보유한 시장 대표 3개 종목에 약 75% 가중치를 부여하는... ,"Sun, 04 Jan 2026 12:45:00 +0900"
2026-01-04 04:03:43,“산업부로 귀순하고 싶어요”…기후부로 간 에너지담당들의 하소연[세...,https://n.news.naver.com/mnews/article/016/0002580622?sid=101,용인<b>반도체</b>클러스터 지방이전 발언 파장 거세 [연합] [헤럴드경제=배문숙 기자]기후에너지환경부가 이재명... 용인<b>반도체</b>클러스터의 지방 이전론을 거론해 지난해 사상 첫 수출액 7000억달러 돌파라는 기록을 세운... ,"Sun, 04 Jan 2026 12:44:00 +0900"
2026-01-04 04:03:43,"이상일 시장 &quot;용인<b>반도체</b> 국가산단, 빨리 진행되지 않았다면 뺏겼을지도...",https://www.webeconomy.co.kr/news/articleView.html?idxno=2045347,이상일 용인특례시장은 용인 이동‧남사읍 첨단시스템<b>반도체</b> 국가산단이 예비타당성 조사 면제와... 이 시장은 &quot;지난해 12월 19일 삼성전자가 첨단시스템<b>반도체</b> 국가산단 조성과 관련해 한국토지주택공사(LH)와... ,"Sun, 04 Jan 2026 12:44:00 +0900"
2026-01-04 04:03:43,김윤 삼양그룹 회장 &quot;고부가 스페셜티 확대·글로벌 진출 속도 내야&quot;,https://n.news.naver.com/mnews/article/011/0004574443?sid=101,"김윤 삼양그룹 회장은 &quot;<b>반도체</b>, 퍼스널케어, 친환경 소재 등 고부가가치의 스페셜티 사업 포트폴리오 확대와 글로벌 진출에 속도를 내야한다&quot;고 말했다. 4일 삼양그룹에 따르면 김 회장은 지난 2일 경기도 성남시 판교... ","Sun, 04 Jan 2026 12:42:00 +0900"
2026-01-04 04:03:43,사상 최고치 랠리 가능할까…'CES·美고용지표' 주목 [주간 증시 전망],https://n.news.naver.com/mnews/article/014/0005457719?sid=101,"삼성전자, SK하이닉스 등 <b>반도체</b> 대형주가 강세를 보이며 지수 상승을 견인했다. 특히 SK하이닉스가 투자경고 대상에서 제외되면서 외국인 매수세가 유입된 점이 주가 상승에 영향을 줬다. 증권가의 관심은 이달 초... ","Sun, 04 Jan 2026 12:41:00 +0900"
2026-01-04 04:03:43,금융 '체질전환' 속도…'생산적 금융'·'디지털 역량' 방점,http://www.metroseoul.co.kr/article/20260104500105,"부동산, 수도권, 예금·대출 등 안정적 수익원에 치중된 금융권의 자금 쏠림을 완화하고, <b>반도체</b>·AI 등 전략산업과 벤처 투자를 활성화 하는 내용이다. 특히 올해부터 본격적으로 운영되는 150조원 규모의 '국민성장펀드... ","Sun, 04 Jan 2026 12:40:00 +0900"
2026-01-04 04:03:43,우주항공·<b>반도체</b> ETF 강세…이차전지는 '우수수' [ETF 스퀘어],https://n.news.naver.com/mnews/article/014/0005457718?sid=101,"주간 상장지수펀드(ETF) 시장은 우주항공과 로봇, <b>반도체</b> 테마 등이 강세를 보인 반면, 팔라듐 등 원자재와... 이어 ‘KODEX 차이나휴머노이드로봇’(11.59%), ‘TIGER <b>반도체</b>TOP10’(11.46%)가 각각 2, 3위에 오르며 관련 테마... ","Sun, 04 Jan 2026 12:39:00 +0900"
2026-01-04 04:03:43,지난해 미·중 수출 줄고 아세안·유럽 등 늘어···지역 '다변화',https://www.seoulfn.com/news/articleView.html?idxno=617432,"국내 최대 수출 시장인 중국의 경우 <b>반도체</b>에서 수출 호조를 보였지만, 석유화학, 무선기기통신, 일반기계 수출 등이 감소해 전체적으로는 1.7% 감소한 1308억달러를 기록했다. 미국 역시 <b>반도체</b> 수출이 두자릿수... ","Sun, 04 Jan 2026 12:38:00 +0900"
2026-01-04 04:03:43,삼성·현대차 등 국내 산업계 실적 시즌 돌입…전자·차 등 실적상승 기...,http://www.metroseoul.co.kr/article/20260104500093,공개 <b>반도체</b> 상승세 속 가전 부문은 관세 등의 영향으로 악화 전망 현대차 이달 중순 이후 실적 공개예정…매출·영업이익 전 분기 대비 소폭 개선 삼성전자 <b>반도체</b> 공장 내부 모습/삼성전자 삼성전자와 LG전자를... ,"Sun, 04 Jan 2026 12:34:00 +0900"
2026-01-04 04:03:43,네번째 도전 ‘광주전남 행정통합’ 이번엔 성사될까,https://n.news.naver.com/mnews/article/020/0003686600?sid=102,"광주와 전남 모두 현재 <b>반도체</b>와 인공지능(AI), 에너지 전환 등 신산업에 열을 올리고 있는데 이러한 신산업 플랫폼을 지역 차원에서 설계·집행할 수 있는 행정 권한을 확보할 수 있게 된다. 재정이나 행정 기능 확대도... ","Sun, 04 Jan 2026 12:33:00 +0900"
2026-01-04 04:03:43,"李대통령, 中 베이징으로 출국…내일 시진핑과 정상회담",https://www.asiatoday.co.kr/view.php?key=20260104010001004,"한한령 이슈, 서해 구조물 관련 문제, 중국에 있는 삼성전자·SK하이닉스 <b>반도체</b> 공장의 장비 반입 이슈 등도 회담 테이블에 오를 가능성이 크다. 중국이 우리 핵추진 잠수함에 대해 불편한 심기를 드러낸 만큼, 이... ","Sun, 04 Jan 2026 12:30:00 +0900"
2026-01-04 04:03:43,AI 패권 전쟁…미·중·EU '3각 경쟁' 본격화,https://n.news.naver.com/mnews/article/422/0000818909?sid=104,시진핑 중국 국가주석의 기조대로 <b>반도체</b> 자립에도 속도를 낼 걸로 보입니다. 중국 당국은 <b>반도체</b> 산업을 지원하기 위해 최대 100조원 규모의 자금 지원을 검토하는 걸로 알려졌습니다. 미국과 중국이 양강을 다투는... ,"Sun, 04 Jan 2026 12:29:00 +0900"
2026-01-04 04:03:43,혼란과 답보의 불확실성 딛고 붉은 말처럼 도약하는 2026년 엮어가야,https://www.siminilbo.co.kr/news/newsview.php?ncode=1160277469993197,특히 주식시장에서 <b>반도체</b>와 비<b>반도체</b> 간 ‘K자 곡선’이 그려지면 문제가 된다. 석유화학 종목 등의 주가가 실적 부진으로 더 빠지면 가계 양극화는 더 심화할 수 있다. 역대 최고를 기록한 지난해 수출에서 15대 주요... ,"Sun, 04 Jan 2026 12:28:00 +0900"
2026-01-04 04:03:43,"삼성전자, 4Q 영업익 사상 첫 20조 돌파할까…'완벽 반등' 시험대",https://www.ebn.co.kr/news/articleView.html?idxno=1693680,"삼성전자가 길었던 '<b>반도체</b> 겨울'을 지나 실적과 기술력에서 동시 반등에 성공할지 업계 이목이 쏠린다.... 이 중 <b>반도체</b>(DS) 부문에서만 약 16조 원 이상의 이익을 거둘 것으로 분석되는데, 이는 전 분기 약 7조 원... ","Sun, 04 Jan 2026 12:24:00 +0900"
2026-01-04 04:03:43,[신년사] 최태원 SK그룹 회장 &quot;AI라는 시대의 흐름 타고 '승풍파랑'의 도...,http://www.wsobi.com/news/articleView.html?idxno=300613,"아울러 &quot;그간 쌓아온 시간과 역량을 토대로 지난해 AI <b>반도체</b> 분야에서 글로벌 시장의 높은 신뢰를 다시 한... 최 회장은 AI라는 거대한 혁신은 <b>반도체</b>만의 과제가 아님을 강조하고 &quot;에너지, 통신, 건설, 바이오 등 SK... ","Sun, 04 Jan 2026 12:22:00 +0900"
2026-01-04 04:03:43,멈춰선 강원특별법 3차 개정안…미래산업 도약 위해 국회 심의 시급,https://n.news.naver.com/mnews/article/014/0005457710?sid=102,특히 <b>반도체</b> 등 강원전략기술 연구개발(R&amp;D) 지원을 비롯해 강원과학기술원 설립 근거 마련 등 인재 양성과 기술 혁신을 위한 핵심 조항들이 대거 포함됐다. 바이오헬스 분야의 도약을 이끌 첨단의료복합단지 조성과... ,"Sun, 04 Jan 2026 12:20:00 +0900"
2026-01-04 04:03:43,"[전문인칼럼]혁신 패권시대, 특구의 비전과 역할",https://www.joongdo.co.kr/web/view.php?key=20260104010000661,"'AI·<b>반도체</b>·에너지·원자재·데이터' 등을 둘러싼 미·중간 경쟁 심화와 동맹의 기술 블록화, 규범·표준 등에서의 경쟁이다. 우리나라에 존재하는 강소특구, 광역특구는 글로벌 혁신특구를 지향하며 '선택과 집중... ","Sun, 04 Jan 2026 12:20:00 +0900"
2026-01-04 04:03:43,&quot;주식에 80% 이상 투자할 것&quot;…30억 '슈퍼리치'들이 꼽은 올해 키워드는,https://n.news.naver.com/mnews/article/277/0005701766?sid=101,"투자 유망 업종 역시 AI·<b>반도체</b>(31.8%)가 1위였고, 로봇(18.0%), 제약·바이오·헬스케어(14.8%), 금융 등 고배당주(12.3%), 조선·방산·원자력(10.4%) 등이 뒤를 이었다. 새해 금융시장을 가장 잘 표현하는 사자성어로는... ","Sun, 04 Jan 2026 12:18:00 +0900"
2026-01-04 04:03:43,국내 주식 '外人' 비중 5년 8개월 만에 최대... 지난달 삼성전자·SK하이...,https://www.getnews.co.kr/news/articleView.html?idxno=855815,"국제금융센터는 작년 12월 외국인 주식·채권 자금이 나란히 유입된 배경과 관련, 메모리 <b>반도체</b> 활황, 상대적 저평가, 기업가치 제고 정책 기대감, 재정 거래 유인 확대 등을 꼽았다. 우선 메모리 <b>반도체</b> 수급... ","Sun, 04 Jan 2026 12:14:00 +0900"
2026-01-04 04:03:43,[속보]&quot;삼성전자·SK하이닉스 사러 왔어요&quot;...‘외국인’의 귀환,https://n.news.naver.com/mnews/article/050/0000100520?sid=101,"메모리 <b>반도체</b> 호황과 정책 기대감이 자금 유입을 불렀다는 분석이다. 국제금융센터는 4일 보고서에서... 국제금융센터는 메모리 <b>반도체</b> 활황, 상대적 저평가, 기업가치 제고 정책, 재정 거래 유인 등을 유입... ","Sun, 04 Jan 2026 12:12:00 +0900"
2026-01-04 04:03:43,"[신년사] 삼성전자, 전영현-노태문 &quot;AI 선도 기업으로 도약하자&quot;",http://www.wsobi.com/news/articleView.html?idxno=300630,"삼성전자의 <b>반도체</b> 사업을 이끄는 전 부회장은 이날 임직원들에게 보낸 신년사를 통해 &quot;삼성전자는 로직부터 메모리, 파운드리, 선단 패키징까지 '원스톱 솔루션'이 가능한 세계 유일의 <b>반도체</b> 회사&quot;라며 &quot;이런 강점을... ","Sun, 04 Jan 2026 12:10:00 +0900"
2026-01-04 04:03:43,삼성SDS AI데이터센터 구미 확정…'<b>반도체</b>·AI·모바일' 잇는 산업 대전...,http://www.hidomin.com/news/articleView.html?idxno=604029,"구미시가 추진해 온 <b>반도체</b> 소재·부품 특화단지 지정 이후 최대 규모의 소프트웨어 인프라 성과로, 하드웨어 중심 산업 구조에 AI 연산과 데이터 기반 역량이 본격 결합하게 됐다. 구미는 삼성전자의 최첨단 <b>반도체</b>... ","Sun, 04 Jan 2026 12:08:00 +0900"
2026-01-04 04:03:43,순천시 시무식 갖고 '남해안남중권 중심도시' 밝혀,http://www.namdonews.com/news/articleView.html?idxno=844213,"노 시장은 또 순천광양 첨단산업단지에 <b>반도체</b> 산업 유치를 위한 아이디어를 언급하고 전남 지역의 풍부한 신재생에너지와 용수, 우수한 인력, 정주 여건을 갖춘 순천이 <b>반도체</b> 산업의 최적지라고 강조했다. 순천시는... ","Sun, 04 Jan 2026 12:08:00 +0900"
2026-01-04 04:03:43,오늘이 제일 싸다… 개인용 컴퓨터 가격도 폭등,https://m.skyedaily.com/news_view.html?ID=294521,스카이데일리 양준규기자 = 2027년까지 <b>반도체</b> 공급 부족… 부품 가격 추가 상승 우려 ▲ AI 열풍이 개인용 컴퓨터 부품 가격 상승으로 번지고 있다. 게티이미지뱅크 인공지능(AI) 열풍에 따른 기업용 <b>반도체</b> 공급 부족의... ,"Sun, 04 Jan 2026 12:06:00 +0900"
2026-01-04 04:03:43,'깐부'에서 AI 동맹으로...현대차그룹·엔비디아 협력 확대,https://www.wolyo.co.kr/news/articleView.html?idxno=306752,"<b>반도체</b> 공급을 넘어 차량과 공장, 로봇을 아우르는 인공지능(AI) 생태계를 함께 구축하는 전략적 동맹으로 협력 수위를 높이는 모습이다. 3일 업계에 따르면 현대차그룹은 차량용 운영체제(ccOS)에 엔비디아의 드라이브... ","Sun, 04 Jan 2026 12:06:00 +0900"
2026-01-04 04:03:43,삼성증권 슈퍼리치의 2026년 키워드는 'K.O.R.E.A.',https://www.thefairnews.co.kr/news/articleView.html?idxno=65328,"2026년 가장 중요한 화두로 절반에 가까운 48.1%가 'AI 산업의 성장세 지속'을 꼽았으며, 투자 유망 업종 역시 'AI/<b>반도체</b>'가 31.8%로 1위를 차지했다. 이어 '로봇'이 18.0%로 2위에 올라 기술주 중심의 성장을 기대하는... ","Sun, 04 Jan 2026 12:06:00 +0900"
2026-01-04 04:03:43,"[신년사] 김윤 삼양 회장 &quot;불확실성 시대, 신성장 동력이 생존 좌우&quot;",https://www.newspim.com/news/view/20260104000063,"<b>반도체</b>, 퍼스널케어, 친환경 소재 등 전략 사업을 중심으로 경쟁력을 고도화하고, 글로벌 시장 진출에 속도를 내야 한다는 메시지다. 단기 성과보다 중장기 성장 기반 구축이 중요하다는 점도 분명히 했다. 신성장 동력... ","Sun, 04 Jan 2026 12:04:00 +0900"
2026-01-04 04:03:43,"[ST] 삼양그룹, '2026년 삼양 뉴 데이 커넥트'로 새해 경영 행보",https://www.startuptoday.co.kr/news/articleView.html?idxno=568472,"김윤 회장은 신년 메시지를 통해 &quot;불확실성이 높은 경영 환경에서는 다양한 상황에서 얼마나 빠르고 유연하게 대응하느냐가 기업의 생존과 성패를 좌우한다&quot;며 &quot;우리 그룹도 Purpose 체계에 입각해 <b>반도체</b>, 퍼스널케어... ","Sun, 04 Jan 2026 12:04:00 +0900"
2026-01-04 04:03:43,고소득 <b>반도체</b> 인력 몰리는 용인 처인구... ‘용인 푸르지오 클루센트’...,https://www.viva100.com/article/20260104500260,이동 · 남사읍 일대에는 삼성전자가 약 450조원을 들여 총 6기의 팹 (Fab · <b>반도체</b> 공장) 을 구축하는 ‘용인 첨단시스템 <b>반도체</b> 국가산업단지’ 가 들어선다. 원삼면 일원에는 SK하이닉스가 약 600조원을 투자해 총 4기의... ,"Sun, 04 Jan 2026 12:04:00 +0900"
2026-01-04 04:03:43,삼성증권 초고액 자산가 &quot;2026년 코스피 4500pt 기대&quot;,http://www.srtimes.kr/news/articleView.html?idxno=193416,"2026년 가장 중요한 화두로 절반에 가까운 48.1%가 'AI 산업의 성장세 지속'을 꼽았으며, 투자 유망 업종 역시 'AI/<b>반도체</b>'가 31.8%로 1위를 차지했다. 이어 '로봇'이 18.0%로 2위에 올라 기술주 중심의 성장을 기대하는... ","Sun, 04 Jan 2026 12:04:00 +0900"
2026-01-04 04:03:43,한국인은 지금 뭘 사고 있나…AI·레버리지에 몰린 해외투자,https://n.news.naver.com/mnews/article/022/0004094923?sid=101,<b>반도체</b> 지수를 하루 수익률 기준으로 3배 추종하는 고위험 레버리지 상품이다. AI와 <b>반도체</b>가 오를 것이라는 확신에 “되면 크게 먹자”는 심리가 반영됐다는 해석이 나온다. 한달 매수결제 규모는 약 24억 달러... ,"Sun, 04 Jan 2026 12:02:00 +0900"
2026-01-04 04:03:43,[신년기획]한국형AI 필승카드- 'AI 로봇 생태계' 만들자,https://n.news.naver.com/mnews/article/030/0003386429?sid=105,"현장경험 풍부…수입의존 약점 AI 학습 정제·공유데이터 부족 <b>반도체</b>·車·배터리·조선 등 기술 검증... <b>반도체</b>, 자동차, 배터리, 조선 등 첨단 로봇 도입 효과가 극명한 산업에서 한국이 세계적 경쟁력을 보유한 만큼 기술... ","Sun, 04 Jan 2026 12:01:00 +0900"
2026-01-04 04:03:43,"[신년기획]한국형AI 필승카드- 中·日·美·獨, 로봇을 국가 전략 산업으...",https://n.news.naver.com/mnews/article/030/0003386419?sid=103,"<b>반도체</b>와 자동차, 디스플레이 산업을 중심으로 로봇 도입이 빠르게 진행된 결과다. 다만 감속기, 서보모터, 고정밀 센서 등 핵심 부품의 해외 의존도가 70% 이상으로, 공급망 리스크가 과제로 지적된다. 하성용... ","Sun, 04 Jan 2026 12:01:00 +0900"
2026-01-04 04:03:43,"[신년기획] 한국형 AI 필승카드- “AI 기지국, 기술자립·표준선점 속도...",https://n.news.naver.com/mnews/article/030/0003386432?sid=105,또한 엔비디아 GPU 기반 AI랜 생태계 의존을 줄이고 기술 주권 확보를 위해선 궁극적으로 국산 AI <b>반도체</b>를 활용한 AI랜 기술 개발도 서둘러야 한다. 업계 관계자는 “연구시험망이 구축되면 해외 플랫폼에 의존하지... ,"Sun, 04 Jan 2026 12:01:00 +0900"
2026-01-04 04:03:43,"[신년기획]인터뷰-조준희 한국AI·SW산업협회장 “제조 강국 韓, 제조AX...",https://n.news.naver.com/mnews/article/030/0003386418?sid=105,"정부와 민간이 공동 투자하는 방식으로 속도를 내야 하고, 에너지 효율이 높은 AI <b>반도체</b> 개발도 병행해야... 우리는 <b>반도체</b>, 자동차, 전자, 디스플레이 같은 세계 최고 수준의 제조 역량을 갖고 있다. 여기에 AI를 결합한... ","Sun, 04 Jan 2026 12:01:00 +0900"
