DateTime,Title,Link,Description,PubDate
2025-04-21 09:25:23,[위클리오늘] '용인 푸르지오 원클러스터 2·3단지' 견본주택 1만2000여명...,http://www.weeklytoday.com/news/articleView.html?idxno=692200,"용인에 조성 중인 <b>반도체</b> 클러스터 개발이 본격화되면서 속도를 내고 있는 데다 단지 내 다양한 교육, 조경... 특히 방문객들은 최근 착공한 SK하이닉스 <b>반도체</b> 클러스터 개발과 추가적인 삼성전자 투자 계획 등 주변... ","Mon, 21 Apr 2025 18:24:00 +0900"
2025-04-21 09:25:23,"기보, 6월 싱가포르에 첫 해외 지점",https://n.news.naver.com/mnews/article/082/0001322278?sid=101,"싱가포르는 연구개발(R＆D) 투자 확대와 글로벌 인재 유입에 힘입어 인공지능(AI), 양자기술, <b>반도체</b>, 생명과학 등 딥테크 메카로 부상했다. 기보는 또 금융 지원 시너지 효과를 극대화하기 위해 지난 18일 부산 본점에서... ","Mon, 21 Apr 2025 18:24:00 +0900"
2025-04-21 09:25:23,시스템대사공학 창시한 이상엽 교수 '창조장',https://n.news.naver.com/mnews/article/011/0004476654?sid=105,D램과 미래 메모리 소자 등 <b>반도체</b> 분야의 세계적 석학인 황철성 서울대 재료공학부 석좌교수는 황조근정훈장을 수훈했다. 인공지능(AI) 인프라 구축과 인재 양성 정책 수립을 지원하고 후학 양성에 앞장선 김두현... ,"Mon, 21 Apr 2025 18:23:00 +0900"
2025-04-21 09:25:23,트럼프 관세에 4월 중순 수출 '뚝',http://www.00news.co.kr/news/articleView.html?idxno=93648,"품목별로 수출은 전년 동기 대비 <b>반도체</b>가 10.7% 늘었으나, 승용차(-6.5%), 석유제품(-22.0%), 자동차부품(-1.7%) 등이 줄었다. <b>반도체</b> 수출 비중은 19.1%로 2.8%포인트 증가했다. 국가별로는 유럽연합(13.8%), 대만(22.0... ","Mon, 21 Apr 2025 18:22:00 +0900"
2025-04-21 09:25:23,'검은<b>반도체</b>' 김 1분기 사상 최대 수출 실적,http://www.jndn.com/article.php?aid=1745227184408215004,K-푸드 열풍을 타고 올해 1분기 국내 김 수출액이 사상 최대를 기록했다. 전남에서도 김 수출이 호조세를 보이고 있으나 다만 원재료인 물김 가격은 최근까지 낮은 수준을 나타내는 중이다. 21일... ,"Mon, 21 Apr 2025 18:22:00 +0900"
2025-04-21 09:25:23,"트럼프식 경제안보 패키지딜, 오히려 기회로 삼자 [왜냐면]",https://n.news.naver.com/mnews/article/028/0002742026?sid=110,"고율 관세, 방위비 분담금 대폭 인상, 미국산 액화천연가스(LNG) 수입 확대, <b>반도체</b> 공급망 재편 등 경제와... <b>반도체</b>, 조선, 원자력 분야는 대표적인 전략 자산이다. 예컨대, 미국 해군은 최근 노후 함정의 개보수와 현대화를... ","Mon, 21 Apr 2025 18:20:00 +0900"
2025-04-21 09:25:23,"음성군, 139억원 투입 건물형 태양광 실증센터 개소...탄소중립 선도 도...",http://www.breaknews.com/1111119,"시스템<b>반도체</b> 산업, 이차전지 산업, 헬스케어 산업)과 지원 분야인 지역기반산업(기후대응농업)을 집중 육성하고 있다. 아래는 위 기사를 '구글 번역'으로 번역한... ","Mon, 21 Apr 2025 18:20:00 +0900"
2025-04-21 09:25:23,"대권 주자들, 잇단 공약 발표…이재명 &quot;상법 개정 재추진&quot;[박지환의 뉴...",https://n.news.naver.com/mnews/article/079/0004016089?sid=100,"특히 인공지능, <b>반도체</b>, 이차전지, 바이오·백신 등 국가전략기술 미래 분야를 키우는 데 집중하겠다고 말했는데요. 그 방안으로는 과학기술 R&amp;D(연구개발) 예산 확대 등을 제안했습니다. 지난 윤석열 정부에서 관련 예산이... ","Mon, 21 Apr 2025 18:20:00 +0900"
2025-04-21 09:25:23,"미래에셋증권, 미국 TLG와 VIP 맞춤형 세미나 'Sage라운드테이블' 개최",http://www.fieldnews.kr/news/articleView.html?idxno=15761,"특히 <b>반도체</b>, 자동차 부품, 2차 전지 밸류체인에 속한 주요 상장사 및 중견 제조기업의 오너와 2세 경영자가 다수 참석한 것으로 전해졌다. 특강에서는 관세와 같은 변수보다 사업에 대한 전략적 의사결정을 통한... ","Mon, 21 Apr 2025 18:20:00 +0900"
2025-04-21 09:25:23,[신간] 대한민국 2025 재계 지도,http://www.popcornnews.net/news/articleView.html?idxno=77978,"여기에 환율 안정, 국내 유동성 흐름의 개선, <b>반도체</b>를 중심으로 한 업황 회복 기대까지 맞물리며, 시장은 점차 '최악은 지났다'는 심리 회복 구간에 진입하고 있다. 이러한 시점에서, 대기업 중심의 분석과 투자 전략은... ","Mon, 21 Apr 2025 18:20:00 +0900"
2025-04-21 09:25:23,"[게시판] 아이스크림에듀, '고창 AI+ 페스타'서 AI 코스웨어 소개 등 단...",https://www.aitimes.com/news/articleView.html?idxno=169816,"국내 AI <b>반도체</b> 전문 리벨리온과의 협업을 통해 건설 현장 특화 대형언어모델(LLM) 기술을 고도화한 결과다. 코오롱글로벌 건설 현장에 최적화된 안전 관제 시스템을 만들기 위해 현장 데이터를 정제, 멀티(시각+언어)... ","Mon, 21 Apr 2025 18:18:00 +0900"
2025-04-21 09:25:23,<b>반도체</b> 산업 특성 반영 지방 투자 촉진 보조금 개선 건의,http://www.gocj.net/news/articleView.html?idxno=139763,간담회에는 대전 기업 아이쓰리시스템㈜이 참여해 안산 기회 발전 특구 내 공동 체육 시설 등 생활 인프라 확충과 <b>반도체</b> 산업 특성을 반영한 지방 투자 촉진 보조금 제도 개선을 건의했다. 또 가업 상속 공제 제도의... ,"Mon, 21 Apr 2025 18:18:00 +0900"
2025-04-21 09:25:23,"[21일 국내증시 마감시황] 쉬어가는 장세, 금융주 실적 발표 앞두고 관...",https://www.getnews.co.kr/news/articleView.html?idxno=817427,"4월 1~20일 수출이 전년 대비 5.2% 감소한 가운데, 주요 10개 수출품 중 <b>반도체</b>를 제외한 품목이 모두 감소했으며 특히 대미 수출이 14.3% 감소해 관세 영향이 가시화됐다. 달러인덱스, 관세전쟁 장기화와 트럼프의 연준... ","Mon, 21 Apr 2025 18:18:00 +0900"
2025-04-21 09:25:23,"임광현 의원, &quot;직업계고 학생 신기술 분야 취업 역량 강화에 앞장&quot;",https://news.unn.net/news/articleView.html?idxno=577936,"(사진=경기도의회)  최근 인공지능(AI)·<b>반도체</b> 등 신기술 분야가 가파르게 성장하고 있는 가운데, 직업계고... 해당 조례안은 △인공지능, <b>반도체</b> 등 신기술 분야 직업능력 함양 지원에 관한 사항 △산업현장 맞춤형 실험... ","Mon, 21 Apr 2025 18:16:00 +0900"
2025-04-21 09:25:23,"대전시-한밭대, <b>반도체</b> 중심 지역혁신 선도",https://www.newsfreezone.co.kr/news/articleView.html?idxno=621954,"대전시와 국립한밭대학교가 대한민국 <b>반도체</b>산업의 미래를 함께 설계한다. 시는 지역의 전략산업인 <b>반도체</b> 분야 혁신을 가속화하기 위해 한밭대학교와 손잡고 국방·우주항공 융합 <b>반도체</b> 육성, 나노·<b>반도체</b>... ","Mon, 21 Apr 2025 18:16:00 +0900"
2025-04-21 09:25:23,"[박영서의 외신 다이제스트] 트럼프, 비관세장벽 정조준",https://n.news.naver.com/mnews/article/029/0002949610?sid=110,<b>반도체</b>와 배터리 같은 전략산업 분야도 영향을 받을 수 있다. 현지 생산 없이 수출 중심 전략을 고수하는 방식은 트럼프가 강조하는 '미국 내 생산' 기조와 충돌할 가능성이 높다. '비관세 장벽'이라는 전장은 그동안 관세... ,"Mon, 21 Apr 2025 18:15:00 +0900"
2025-04-21 09:25:23,"미래에셋증권, VIP 맞춤 세미나 'Sage라운드테이블' 개최",http://www.enewstoday.co.kr/news/articleView.html?idxno=2267306,"특히 <b>반도체</b>, 자동차 부품, 2차 전지 밸류체인에 속한 주요 상장사 및 중견 제조기업의 오너와 2세 경영자가 다수 참석한 것으로 전해졌다. 미래에셋증권 PWM부문 김화중 대표는 &quot;Sage라운드테이블은 고객과의 교류를... ","Mon, 21 Apr 2025 18:15:00 +0900"
2025-04-21 09:25:23,'TK서 4강 티켓을 잡아라' 보수텃밭서 막판 표심 확보나선 국힘 경선 후...,https://n.news.naver.com/mnews/article/088/0000943317?sid=100,"그는 또한 구미와 포항을 중심으로 <b>반도체</b> 및 배터리 산업을 육성하고, 대구와 대전을 양 주축으로 그 사이 인공지능(AI)·<b>반도체</b> 융합단지를, 상주와 김천엔 AI스마트팜 벨트를 조성한다는 신산업 관련 계획도 발표했다.... ","Mon, 21 Apr 2025 18:14:00 +0900"
2025-04-21 09:25:23,"'2025년 과학·정보통신의 날' 기념식…&quot;AI 3강 진입, 반드시 실현&quot;",https://www.korea.kr/news/policyNewsView.do?newsId=148942149&call_from=naver_news,"황조 근정훈장은 ICT의 기반인 <b>반도체</b> 분야의 세계적 석학으로서 D램 및 미래 메모리 소자 연구, 산학 협력... 국내 <b>반도체</b> 제조 기술력 향상에 기여한 도승용 에스케이하이닉스 부사장이 수상하며 공로를 인정받았다.","Mon, 21 Apr 2025 18:14:00 +0900"
2025-04-21 09:25:23,나경원 &quot;TK 신공항 건설 추진…첨단산업 적극 육성”,https://www.asiatoday.co.kr/view.php?key=20250421010012534,"구미의 전자산업 기반을 차세대 <b>반도체</b>, 메타버스, 방위산업 등 첨단 분야로 확장·고도화할 것&quot;이라고 약속했다.아울러 &quot;안동·영주를 중심으로 ''K-바이오·백신 산업 벨트'를 구축하는 등 대한민국 바이오 주권을... ","Mon, 21 Apr 2025 18:14:00 +0900"
2025-04-21 09:25:23,[fn이사람] &quot;관세 탓 증시 회복 지연… 2분기 포폴 중요&quot;,https://n.news.naver.com/mnews/article/014/0005339074?sid=101,"이어 &quot;미국도 6월부터 금리를 내린다는데 이는 국내 전반 재정·통화 정책에 우호적&quot;이라며 &quot;<b>반도체</b> 가격도... 김 센터장은 리스크를 감내할 수 있는 투자자는 국내 <b>반도체</b>·조선·방산·음식료·화장품 등 업종에, 안정적인... ","Mon, 21 Apr 2025 18:13:00 +0900"
2025-04-21 09:25:23,&quot;韓 고질적 관세 통상 리스크···기술 초격차가 유일한 생존 전략&quot;,http://www.enewstoday.co.kr/news/articleView.html?idxno=2267312,박 실장은 &quot;예를 들어 <b>반도체</b>나 자동차 등 산업에서 우리 기업들이 핵심 밸류체인 안에 들어가 있다면 미국도... 이어 &quot;소위 미국에서 <b>반도체</b> 전기공학이나 재료공학 전공한 박사들은 굳이 삼성 안간다&quot;며 &quot;미국 유수의... ,"Mon, 21 Apr 2025 18:12:00 +0900"
2025-04-21 09:25:23,"강민석 LG이노텍 기판소재사업부장, ‘과학기술훈장’ 수상",https://www.kukinews.com/article/view/kuk202504210244,광학 및 <b>반도체</b> 기판 분야에서 국가 과학기술 경쟁력 확보에 기여한 공로를 인정받아 올해 수훈자로 선정됐다. 그는 핵심기술 개발을 통해 LG이노텍의 모바일 카메라 모듈과 통신용 <b>반도체</b> 기판 사업이 글로벌 1위로... ,"Mon, 21 Apr 2025 18:12:00 +0900"
2025-04-21 09:25:23,한미<b>반도체</b> IR 돌연 연기…SK와 갈등 파장,https://n.news.naver.com/mnews/article/009/0005480162?sid=101,"한미<b>반도체</b>가 기업설명회(IR)를 돌연 연기했다. SK하이닉스 경영진이 한미<b>반도체</b>를 방문한 직후 이뤄진 조치로, <b>반도체</b> 업계에서는 TC본더 공급과 관련한 양사의 갈등 관계가 분기점을 맞았다는 평가를 내놓고 있다.... ","Mon, 21 Apr 2025 18:10:00 +0900"
2025-04-21 09:25:23,"강원도, 라이즈(RISE) 수행대학 13곳 선정… 올해 775억원 투입",https://news.unn.net/news/articleView.html?idxno=577935,"육성(<b>반도체</b>, 바이오헬스, 미래에너지, 미래차, 푸드테크, ICT)과 연계해 지역 발전에 시너지를 창출한다는... 주요 단위과제로는 <b>반도체</b>·바이오헬스 등 첨단전략산업 육성, 시·군 특화산업 고도화 및 스케일업... ","Mon, 21 Apr 2025 18:10:00 +0900"
2025-04-21 09:25:23,R&amp;D 예산 확대에 한목소리 &quot;AI·<b>반도체</b> 등 전략기술 발전&quot;,https://n.news.naver.com/mnews/article/011/0004476644?sid=100,21대 대선을 앞두고 정치권에서 인공지능(AI)·<b>반도체</b> 등 R&amp;D 예산 확대에 대한 합의를 이룰 수 있을지... R&amp;D 예산을 대폭 확대해 AI·<b>반도체</b>·2차전지·바이오백신·수소·미래차 등 국가전략기술 미래 분야 육성에... ,"Mon, 21 Apr 2025 18:10:00 +0900"
2025-04-21 09:25:23,"공공연구노조 &quot;R&amp;D 예산, GDP 대비 10% 이상 확대해야&quot;",https://n.news.naver.com/mnews/article/656/0000129469?sid=102,"공공연구노조는 &quot;(예산을 확대해) <b>반도체</b>, 인공지능, 바이오, 로봇 등 다양한 분야에 투자해야 한다&quot;며 &quot;연구 다양성을 확보하면서도 필요한 분야에 집중할 수 있도록 적절하게 분배하고 투명하게 관리할 수 있는... ","Mon, 21 Apr 2025 18:10:00 +0900"
2025-04-21 09:25:23,AI에 진심인 日이시바 … 젠슨황까지 면담,https://n.news.naver.com/mnews/article/009/0005480154?sid=101,21일 일본 총리실은 이시바 총리가 미국 <b>반도체</b> 기업 엔비디아의 젠슨 황 최고경영자(CEO)를 만났다고... 여기에는 엔비디아의 블랙웰 <b>반도체</b>가 탑재된다. 이와 별개로 소프트뱅크그룹은 미국 챗GPT 개발사인 오픈AI와... ,"Mon, 21 Apr 2025 18:07:00 +0900"
2025-04-21 09:25:23,"과학의 날 맞아 이재명 '예산 확대', 안철수 '초격차 전략'",https://www.tjb.co.kr/news05/bodo/view/id/73856,"인공지능과 <b>반도체</b>, 이차전지 등 국가전략기술 분야에 집중적으로 투자하고, 연구자의 자율성을 보장한 연구 환경을 만들겠다고 강조했습니다. 안철수 국민의힘 대선 경선 후보도 자신의 SNS에 AI와 <b>반도체</b> 등 '5대... ","Mon, 21 Apr 2025 18:06:00 +0900"
2025-04-21 09:25:23,"대전시, 한밭대에 <b>반도체</b> '클린룸' 조성...공공팹 구상도",https://www.newspim.com/news/view/20250421001000,"대전시와 국립한밭대학교는 국방·우주항공 융합 <b>반도체</b> 육성, 나노·<b>반도체</b> 국가산업단지 지원 등 협력사업을 본격 추진한다. 대전시와 국립한밭대학교는 21일 시청 응접실에서 대전 <b>반도체</b>산업 혁신생태계 구축을... ","Mon, 21 Apr 2025 18:06:00 +0900"
2025-04-21 09:25:23,"&quot;VIP 맞춤형&quot; 미래에셋증권, ‘Sage라운드테이블’ 개최",https://biz.newdaily.co.kr/site/data/html/2025/04/21/2025042100445.html,"특히 <b>반도체</b>, 자동차 부품, 2차 전지 밸류체인에 속한 주요 상장사 및 중견 제조기업의 오너와 2세 경영자가 다수 참석한 것으로 전해졌다. 특강에서는 관세와 같은 변수보다 사업에 대한 전략적 의사결정을 통한... ","Mon, 21 Apr 2025 18:06:00 +0900"
2025-04-21 09:25:23,美 관세 충격 본격화…4월 對美 수출 14.3% ‘뚝’,https://www.yeongnam.com/web/view.php?key=20250421028561195,"주요 10개 수출품 중 <b>반도체</b>를 제외한 나머지 9개 품목에서 수출이 모두 줄었고, 지역별로는 대미 수출... 이달 20일까지 주요 10개 수출 품목 중 <b>반도체</b>만 전년 동기 대비 10.7% 증가했을 뿐 나머지 9개 품목은 모두... ","Mon, 21 Apr 2025 18:06:00 +0900"
2025-04-21 09:25:23,안철수 &quot;AI 시대 준비된 '경제대통령'…한국을 창업국가로 만들 것&quot;,https://n.news.naver.com/mnews/article/011/0004476636?sid=100,"AI, <b>반도체</b>, 미래 모빌리티, 바이오, K서비스산업을 5대 전략산업으로 육성해 대한민국을 세계에서 가장 역동적이고 강한 나라로 만드는 것이다. 이를 위해 2035년까지 AI 세계 3강 진입, <b>반도체</b> 기술 주권 확보, 연구개발(R... ","Mon, 21 Apr 2025 18:06:00 +0900"
2025-04-21 09:25:23,중·베 수출 감소에 중간재 수출 막히나 우려…7000억 목표 '비상',https://www.ajunews.com/view/20250421152834507,특히 대중 중간재 수출에서 <b>반도체</b>와 디스플레이 관련 품목이 90% 이상을 차지하는 만큼 미국의 고율 관세로 중국의 대미 수출이 줄어들면 중국의 완제품 생산에 필요한 한국의 중간재 수요 역시 감소할 수밖에 없다.... ,"Mon, 21 Apr 2025 18:02:00 +0900"
2025-04-21 09:25:23,"LG이노텍 강민석 기판소재사업부장, 과학기술훈장 수상",https://www.webeconomy.co.kr/news/article.html?no=1185590,"광학 및 <b>반도체</b> 기판 분야 국가 과학기술 경쟁력 확보 기여 LG이노텍(대표 문혁수, 011070)은 강민석... LG이노텍은 &quot;강 부사장이 광학 및 <b>반도체</b> 기판 분야에서 국가 과학기술 경쟁력 확보에 기여한 공로를 인정받아... ","Mon, 21 Apr 2025 18:02:00 +0900"
2025-04-21 09:25:23,"전기연구원 방욱 박사, 과학기술훈장 혁신장 받아",http://www.worktoday.co.kr/news/articleView.html?idxno=67189,방욱 KERI 전력<b>반도체</b>연구단 박사는 지난 35년 간 우리나라에서 불모지나 다름없었던 전력<b>반도체</b> 분야 한 길만 걸어오며 기술 경쟁력 향상을 이끌어 온 공로로 과학기술훈장 혁신장을 받았다. 특히 전기차 전비 10... ,"Mon, 21 Apr 2025 18:02:00 +0900"
2025-04-21 09:25:23,"미래에셋증권, VIP 맞춤형 세미나 'Sage라운드테이블' 개최",https://www.ngetnews.com/news/articleView.html?idxno=524835,"특히 <b>반도체</b>, 자동차 부품, 2차 전지 밸류체인에 속한 주요 상장사와 중견 제조기업의 오너와 2세 경영자가 다수 참석했다. 특강에서는 관세 등 변수보다 사업에 대한 전략적 의사결정을 통한 시장진입 필요성과... ","Mon, 21 Apr 2025 18:02:00 +0900"
2025-04-21 09:25:23,관세 전쟁 격화시 韓 수출 488억弗↓…<b>반도체</b>·이차전지 위태롭다,https://www.ajunews.com/view/20250421144805454,연구기관들은 특히 <b>반도체</b>와 이차전지 등 주력 수출 품목에 영향이 갈 것으로 봤다. 미국은 중국을 대상으로... 주요 수출 품목인 <b>반도체</b>는 대중국 수출 의존도가 높으며 이차전지는 대미국 수출 의존도가 높다.... ,"Mon, 21 Apr 2025 18:02:00 +0900"
2025-04-21 09:25:23,"민주당, 통상안보 TF 첫 회의…국민의힘 &quot;R&amp;D 예산 확대&quot;",https://www.natv.go.kr/natv/news/newsView.do?newsId=510530,특히 AI와 <b>반도체</b> 그리고 바이오 등 12대 전략 기술 연구개발은 5년 내에 10조원 규모로 확대하겠다고 약속했습니다. 권성동 국민의힘 원내대표는 신속한 투자를 위해 그동안 총사업비가 500억원 이상되는 R&amp;D 사업을... ,"Mon, 21 Apr 2025 18:02:00 +0900"
2025-04-21 09:25:23,"다크호스 제주, 도민과 함께하는 분산에너지 특구",http://www.samdailbo.com/news/articleView.html?idxno=245277,"지금 제주도는 해외 수출액 55%가 <b>반도체</b>이고 우주산업을 선도하는 것과 함께 탄소중립 2035 에너지대전환, 全산업 디지털 전환 및 분산에너지 특구, 그리고 이를 통한 일자리 창출지로서 대한민국 탄소중립 미래를... ","Mon, 21 Apr 2025 18:02:00 +0900"
2025-04-21 09:25:23,실리콘밸리 겨냥…이재준 수원시장 '경제자유구역' 유치 사활,https://n.news.naver.com/mnews/article/008/0005183683?sid=102,"시는 경기경제자유구역청 공모에서 '<b>반도체</b>, 바이오, AI 등 첨단산업 R&amp;D의 핵심 거점 조성'을 목표로... 경제자유구역 내 산업용지에는 R&amp;D, <b>반도체</b>, IT(정보통신), BT(생명공학), AI(인공지능) 등 첨단과학연구기업을... ","Mon, 21 Apr 2025 18:01:00 +0900"
2025-04-21 09:25:23,중국 1분기 희토류 수출 급감...세계 자동차 생산 중단 우려도,https://n.news.naver.com/mnews/article/469/0000860702?sid=104,"중국이 미국과의 무역 전쟁 국면에서 '희토류 수출 통제'를 무기로 꺼내 들면서, <b>반도체</b> 등에 사용되는 주요... 안티몬·게르마늄·갈륨은 <b>반도체</b> 제조, 청정에너지, 방위 산업에 필수인 핵심 광물이다. 중국은 이 3종... ","Mon, 21 Apr 2025 18:01:00 +0900"
2025-04-21 09:25:23,한덕수 &quot;24일 밤 한미 2+2 통상협의&quot;...민주 &quot;중차대한 협상 차기 정부로...,http://www.jeollailbo.com/news/articleView.html?idxno=765215,"우리 정부는 트럼프 정부가 예고한 상호관세와 자동차, 철강, <b>반도체</b> 등 품목별 관세 부담 협상에 나설 계획이다. 한 대행은 &quot;정부는 '국익 최우선' 원칙 하에 미국과 차분하고 진지하게 협의하여 양국이 상호 '윈-윈'할 수... ","Mon, 21 Apr 2025 18:00:00 +0900"
2025-04-21 09:25:23,"KERI 박사 4인방, '과학기술진흥 유공자' 나란히 선정",https://www.energy-news.co.kr/news/articleView.html?idxno=212964,KERI 전력<b>반도체</b>연구단 소속의 방욱 박사는 지난 35년간 우리나라에서 불모지나 다름없었던 전력<b>반도체</b> 분야 외길을 걸어오며 기술경쟁력 향상을 이끌어 온 공로로 과학기술훈장 혁신장을 받았다. 특히 전기차 전비 10... ,"Mon, 21 Apr 2025 18:00:00 +0900"
2025-04-21 09:25:23,이재명 &quot;정치 그만두면 주식시장 돌아갈 가능성 99.9%…상법 개정안 재...,https://n.news.naver.com/mnews/article/002/0002384672?sid=100,"특히 인공지능(AI), <b>반도체</b>, 이차전지, 바이오·백신, 수소, 미래차 등 국가전략기술 미래 분야를 키우는 데 집중하겠다&quot;며 &quot;R&amp;D 정책 수립과 기획, 평가에 현장 연구자들의 목소리를 대폭 반영하겠다&quot;고도 했다.","Mon, 21 Apr 2025 17:59:00 +0900"
2025-04-21 09:25:23,관세전쟁 여파… 수출실적 5.2% 감소,https://n.news.naver.com/mnews/article/022/0004029513?sid=101,"주요 10개 수출품목 가운데 <b>반도체</b>를 제외한 9개 품목이 마이너스를 기록했으며, 특히 대미 수출은 큰... 뉴시스 수출을 주요 10대 품목별로 보면 <b>반도체</b>(10.7%) 외 승용차(-6.5%), 철강제품(-8.7%), 석유제품(-22.0... ","Mon, 21 Apr 2025 17:57:00 +0900"
2025-04-21 09:25:23,中 '희토류 카드'로 세계 산업 목줄 쥐었지만…미얀마 리스크에 '흔들',https://n.news.naver.com/mnews/article/011/0004476631?sid=104,중국이 전기차·<b>반도체</b>·방산 핵심 소재인 희토류를 무기화한 수출통제를 본격화하면서 전 세계 산업계에 비상이 걸렸다. 이런 가운데 중국이 의존해온 최대 원료 공급지 미얀마가 내전과 강진으로 흔들리며 중국의... ,"Mon, 21 Apr 2025 17:56:00 +0900"
2025-04-21 09:25:23,세계경제 '풍전등화'…한국경제 '된서리',http://www.newstomato.com/ReadNews.aspx?no=1259748&inflow=N,"더욱이 당초 예고했던 <b>반도체</b>, 의약품 등 품목별 관세 발표도 남아있어 불안감은 여전합니다. 대외 악재 속에 우리나라는 타격이 클 것으로 예상하고 있습니다. 1분기 경제성장률 예측에서 0.1%를 밑돌 가능성이 제기되고... ","Mon, 21 Apr 2025 17:56:00 +0900"
2025-04-21 09:25:23,中 &quot;美와 관세협상 때 피해 입으면 보복&quot;…각국에 으름장,https://n.news.naver.com/mnews/article/015/0005122048?sid=101,군사용으로 전용 가능한 <b>반도체</b> 등 민감 품목의 대중 수출 통제도 강화하기로 했다. 베트남은 미국산 기술이 중국으로 흘러 들어가지 않도록 신고·승인 제도를 도입할 방침이다. 이를 통해 상호관세를 22~28% 이하로... ,"Mon, 21 Apr 2025 17:55:00 +0900"
2025-04-21 09:25:23,4월 1∼20일 수출 5.2% 줄어…대미 수출 14.3% '뚝',https://n.news.naver.com/mnews/article/448/0000522319?sid=101,"대미 수출 감소세가 두드러졌고, 주요 10개 수출품 중 <b>반도체</b>를 제외한 나머지 9개 품목에서 수출이 모두... 이달 20일까지 수출을 주요 10개 품목별로 보면 <b>반도체</b>(10.7%)는 증가했지만 승용차(-6.5%), 석유제품(-22.0... ","Mon, 21 Apr 2025 17:55:00 +0900"
