DateTime,Title,Link,Description,PubDate
2025-02-25 11:47:46,"[객원칼럼]대한민국의 미래, 위기를 기회로 전환하기 위한 여정",https://www.gnnews.co.kr/news/articleView.html?idxno=605466,특히 철강과 <b>반도체</b> 같은 주력 산업은 25%에 달하는 관세 폭탄으로 인해 연간 수천억 원의 경제적 손실이... 특히 자동차와 <b>반도체</b> 산업은 25%에 달하는 관세로 인해 심각한 타격을 받고 있다. 한국의 대미 자동차 수출은 연간... ,"Tue, 25 Feb 2025 20:46:00 +0900"
2025-02-25 11:47:46,최형두 &quot;AI 3대 강국 기반 반드시 만들어 가겠다&quot; 원내대책회의서 강조,https://www.gnnews.co.kr/news/articleView.html?idxno=605484,"국회 과학기술정보방송통신위원회 간사인 최형두(창원 마산합포) 의원은 25일 &quot;대한민국이 <b>반도체</b> AI... 최 의원은 &quot;한·미·일 3국이 <b>반도체</b> AI 컴퓨팅 인프라, 무탄소 전력 에너지원인 SMR 등의 공동개발 협력을 통해서... ","Tue, 25 Feb 2025 20:46:00 +0900"
2025-02-25 11:47:46,"대구정책연구원, 개원 2주년 심포지엄 성황리 개최",http://www.ksmnews.co.kr/news/view.php?idx=526648,"이를 위해서는, ▲ 글로벌 AI 연구거점 설립 ▲ AI로봇 산업 육성 ▲ AI<b>반도체</b>산업 육성 ▲ AI 섬유테크 산업 육성 ▲ 제조업과 서비스업의 AX(AI Transformation) 전환, ▲ AI 분야 맞춤형 인재양성 ▲ 글로벌 AX 혁신클러스터 조성... ","Tue, 25 Feb 2025 20:46:00 +0900"
2025-02-25 11:47:46,"[IT칼럼] '월드 베스트 LLM' 프로젝트, 반드시 성공해야",https://www.newscj.com/news/articleView.html?idxno=3238545,한국이 보유한 엔비디아의 고성능 AI <b>반도체</b> 'H100'은 2000개 수준으로 미국 메타나 마이크로소프트(MS)가... AI와 직결되는 <b>반도체</b> 산업 지원을 위한 <b>반도체</b>특별법도 표류하고 있다. 스타트업은 물론이고 대기업... ,"Tue, 25 Feb 2025 20:42:00 +0900"
2025-02-25 11:47:46,"고려아연, 분야별 전문가 참여 ESG 경영 체계 고도화 매진",https://www.ulsanpress.net/news/articleView.html?idxno=545666,"기후변화 대응 관련해서는 지난 2023년 아연, 은, 동에 이어 지난해 <b>반도체</b>황산이 탄소발자국 인증을 받았는데, 올해부터는 연, 금, 황산니켈 제조용 일반황산의 탄소발자국을 산정해 주요 제품의 원료 채취부터 수송... ","Tue, 25 Feb 2025 20:40:00 +0900"
2025-02-25 11:47:46,"'배터리 동맹' 이재용·정의선, 전기차→로봇 배터리 연합 구축 나선다",https://n.news.naver.com/mnews/article/117/0003916795?sid=103,"이번 MOU는 두 사람이 2020년 5월 전격 회동에 나선 이후 현재까지 <b>반도체</b>, 배터리를 포함한 하드웨어와 커넥티비티 등 소프트웨어 분야로 협업이 이뤄진 결실이다. 양사는 로봇시장 저변 확대를 위한 공동마케팅도... ","Tue, 25 Feb 2025 20:37:00 +0900"
2025-02-25 11:47:46,"“일본 스미토모화학, 한국에서 <b>반도체</b> 소재 포토레지스트 생산”",https://n.news.naver.com/mnews/article/056/0011899904?sid=104,일본 스미토모화학이 그동안 오사카 공장에서만 생산해 왔던 <b>반도체</b> 핵심 소재 포토레지스트를... 니혼게이자이는 “한국에는 최첨단 <b>반도체</b>를 만드는 업체가 있다”며 한국 생산이 현지 수요에 대응하고 생산... ,"Tue, 25 Feb 2025 20:37:00 +0900"
2025-02-25 11:47:46,신규 원전·고준위 방폐장 '주민 의견이 좌우',https://www.mbceg.co.kr/post/123010,국내에서 <b>반도체</b> 산업과 데이터센터 등으로 전력 수요가 크게 늘었기 때문입니다. 이에 따라 한국수력원자력은 올해 하반기쯤 신규 원전 부지 선정 절차를 시작할 전망입니다. 이 과정에서 가장 중요한 게 '주민 수용성... ,"Tue, 25 Feb 2025 20:36:00 +0900"
2025-02-25 11:47:46,대전시 나노·<b>반도체</b> 국가산단 그린벨트 푼다,https://www.ccdailynews.com/news/articleView.html?idxno=2327156,대전시의 나도·<b>반도체</b> 국가산업단지가 개발제한구역(그린벨트)를 해제할 수 있는 지역전략사업의... 유성구 교촌동 일원 530만㎡에 조성되는 산단은 국가첨단기술분야로 지정된 나노·<b>반도체</b> 산업과 신성장산업인... ,"Tue, 25 Feb 2025 20:34:00 +0900"
2025-02-25 11:47:46,"&quot;日스미토모화학, 한국서 <b>반도체</b> 소재 포토레지스트 생산&quot;",https://www.getnews.co.kr/news/articleView.html?idxno=808768,일본 스미토모화학이 그동안 오사카 공장에서만 생산해 왔던 <b>반도체</b> 핵심 소재 포토레지스트를... 닛케이는 &quot;한국에는 최첨단 <b>반도체</b>를 만드는 업체가 있다&quot;며 한국 생산이 현지 수요에 대응하고 생산 거점을... ,"Tue, 25 Feb 2025 20:30:00 +0900"
2025-02-25 11:47:46,"日 스미토모화학, 한국서 <b>반도체</b> 포토레지스트 생산 결정...4800억원 투자",https://www.electimes.com/news/articleView.html?idxno=350989,"연합뉴스에 따르면 일본 스미토모화학이 <b>반도체</b> 핵심 소재인 포토레지스트(감광액)를 한국에서 생산하기로 결정했다. 기존에는 오사카 공장에서만 제조해 왔지만, 한국의 <b>반도체</b> 수요 증가와 생산 거점 다변화를... ","Tue, 25 Feb 2025 20:28:00 +0900"
2025-02-25 11:47:46,"“美, 日·네덜란드에 中 <b>반도체</b> 장비 유지보수 제한하라고 압박”",https://n.news.naver.com/mnews/article/020/0003617595?sid=104,도널드 트럼프 미국 행정부가 동맹국인 일본과 네덜란드에 중국 <b>반도체</b> 산업을 겨냥한 규제에 동참하라며 압박한 것으로 전해졌다. 트럼프 행정부가 인공지능(AI)과 <b>반도체</b> 등 첨단산업에서 중국의 성장과 영향력을... ,"Tue, 25 Feb 2025 20:27:00 +0900"
2025-02-25 11:47:46,"한은, 올 성장률 전망 하향…금리 내려 ‘경기 살리기’",https://n.news.naver.com/mnews/article/032/0003353223?sid=101,"철강, 화학, <b>반도체</b>, 스마트폰 등 한국 대표 제조업은 중국에 빠르게 잠식당하고 있다. 인공지능(AI), 자율주행차, 전기차 등 일부 첨단산업에서는 이미 추월을 당했다는 우려도 나온다. 김학균 신영증권 리서치센터장은... ","Tue, 25 Feb 2025 20:25:00 +0900"
2025-02-25 11:47:46,‘벚꽃 추경’ 멀어지는데…20조 투입해야 성장률 0.2%P ↑,https://n.news.naver.com/mnews/article/032/0003353220?sid=101,"여기에 철강·알루미늄에 이어 <b>반도체</b>·자동차 등 주력 수출 품목에 대한 트럼프 행정부의 관세 부과 압박이 현실화하면서 수출 전망은 더 어둡다. 다만, 추경 편성 방향에 대해 여야 모두 부진한 내수를 살리는 데 방점을... ","Tue, 25 Feb 2025 20:24:00 +0900"
2025-02-25 11:47:46,日스미모토화학 &quot;한국서 <b>반도체</b> 핵심소재 생산&quot;,https://n.news.naver.com/mnews/article/277/0005551954?sid=104,일본 스미모토화학이 오사카 공장에서만 생산하던 <b>반도체</b> 핵심 소재 포토레지스트를 한국에서도... 포토레지스트는 <b>반도체</b> 핵심 소재로 일본 기업의 세계 시장 점유율이 매우 높다. 대형 <b>반도체</b> 업체가 있는... ,"Tue, 25 Feb 2025 20:24:00 +0900"
2025-02-25 11:47:46,여의도 15배 면적 지방 그린벨트 해제 추진,https://daily.hankooki.com/news/articleView.html?idxno=1183837,대전에서는 유성구 나노<b>반도체</b> 국가산단이 지역전략사업으로 선정됐다. 사업비 3조6980억원 규모다. 대구권은 달성 농수산물도매시장 이전(4099억원) 사업이 대상이다. 지역전략사업 15곳 중 10곳이 산업·물류단지 조성... ,"Tue, 25 Feb 2025 20:22:00 +0900"
2025-02-25 11:47:46,"구미시, 국비 9800억 확보 총력…국회의원과 협력 강화",https://n.news.naver.com/mnews/article/277/0005551952?sid=102,국비 확보를 위한 주요 사업으로는 ▲강소형 스마트도시 조성 ▲국립청소년 디지털 통합지원센터 건립 ▲임산부 디지털 헬스케어 플랫폼 구축 ▲<b>반도체</b> 웨이퍼 공정장비용 소재부품 테스트베드 구축 ▲도개지구 풍수해... ,"Tue, 25 Feb 2025 20:17:00 +0900"
2025-02-25 11:47:46,"&quot;일 스미토모화학, 한국서 <b>반도체</b> 소재 포토레지스트 생산&quot;",http://mbnmoney.mbn.co.kr/news/view?news_no=MM1005479695,일본 스미토모화학이 그동안 오사카 공장에서만 생산해 왔던 <b>반도체</b> 핵심 소재 포토레지스트를 한국에서도... 닛케이는 &quot;한국에는 최첨단 <b>반도체</b>를 만드는 업체가 있다&quot;며 한국 생산이 현지 수요에 대응하고 생산... ,"Tue, 25 Feb 2025 20:16:00 +0900"
2025-02-25 11:47:46,최창원 &quot;業의 본질 짚고 해법 찾는 게 리더 역할&quot;,https://n.news.naver.com/mnews/article/015/0005099228?sid=101,"최 의장은 <b>반도체</b>사업 혁신, 배터리 캐즘(일시적 수요 둔화) 극복, 재무 건전성 강화, ‘기본과 원칙’ 리더십 복귀 등을 그룹 당면 과제로 꼽았다. 그가 특히 강조한 건 CEO의 마음가짐이다. 최 의장은 CEO들에게... ","Tue, 25 Feb 2025 20:15:00 +0900"
2025-02-25 11:47:46,&quot;여야 대승적인 합의로 연금개혁 희망&quot;,http://www.kihoilbo.co.kr/news/articleView.html?idxno=1133557,"기호일보 - 아침을 여는 신문, KIHOILBO 최상목 대통령 권한대행은 25일 &quot;<b>반도체</b>특별법, 조세특례제한법, 재건축... 여야정 대표는 지난 20일 국정협의회 '4자 회담'을 개최했지만 추가경정예산(추경)과 <b>반도체</b>법의 '주 52시간... ","Tue, 25 Feb 2025 20:12:00 +0900"
2025-02-25 11:47:46,&quot;국산 AI <b>반도체</b> 상용화 속도…올해 의료·공공 등 AI서비스 실증&quot;,https://n.news.naver.com/mnews/article/031/0000911724?sid=105,AI<b>반도체</b> 팜 실증사업이 올해 실제 고객들이 사용할 수 있는 상용화 단계로 진입한다며 이같이 말했다.... 2023년부터 'AI<b>반도체</b> 팜 구축 및 실증' 사업을 진행해왔다. 이 사업은 국내 데이터센터 시장에서 국산... ,"Tue, 25 Feb 2025 20:12:00 +0900"
2025-02-25 11:47:46,SK '<b>반도체</b> 왕국' 부푼 꿈 안고 첫삽,http://www.kihoilbo.co.kr/news/articleView.html?idxno=1133545,"기호일보 - 아침을 여는 신문, KIHOILBO SK하이닉스가 지난 24일 용인 <b>반도체</b> 클러스터 내 1기 팹(FAB·<b>반도체</b> 생산공장)의 첫 삽을 떴다. SK하이닉스는 당초 3월부터 1기 팹 착공에 들어갈 계획이었으나 용인시가 예정보다... ","Tue, 25 Feb 2025 20:12:00 +0900"
2025-02-25 11:47:46,개발제한구역 해제 기류 속 시흥시 바이오단지는 '찬밥',http://www.kihoilbo.co.kr/news/articleView.html?idxno=1133577,"이들 지역의 GB 해제로 자동차·<b>반도체</b>·수소·이차전지 등 국가 첨단산업을 육성, 지역경제 활성화를 도모한다는 게 국토부 방침이다. 시흥시는 지난해 6월 국가첨단전략산업 바이오 특화단지에 지정됐고, 단지 내... ","Tue, 25 Feb 2025 20:12:00 +0900"
2025-02-25 11:47:46,"&quot;일본 스미토모화학, 한국서 <b>반도체</b> 소재 포토레지스트 생산&quot;",https://n.news.naver.com/mnews/article/014/0005313376?sid=101,일본 스미토모화학이 오사카 공장에서만 생산해 왔던 <b>반도체</b> 핵심 소재 포토레지스트를 한국에서도... 포토레지스트는 <b>반도체</b> 원료인 웨이퍼 위에 뿌리는 감광액이다. 빛을 받아 <b>반도체</b> 회로를 새기는 특수 고분자... ,"Tue, 25 Feb 2025 20:10:00 +0900"
2025-02-25 11:47:46,"SK, 25일 수펙스추구협의회 개최",http://www.lawissue.co.kr/view.php?ud=202502252006038236204ead0791_12,최 의장은 이어 ▲<b>반도체</b> 사업의 지속적인 혁신 ▲배터리 밸류체인 캐즘 극복 ▲재무건전성 지속 강화 ▲리더들의 ‘기본과 원칙’ 리더십 복귀 등을 SK그룹이 직면한 주요 당면 과제로 꼽았다.,"Tue, 25 Feb 2025 20:08:00 +0900"
2025-02-25 11:47:46,"&quot;특공 계급&quot; &quot;귀족노조 패악&quot; 여당, 말끝마다 &quot;민주노총&quot;",http://www.labortoday.co.kr/news/articleView.html?idxno=226458,"담은 <b>반도체</b>특별법 통과와 노동조합 및 노동관계조정법(노조법) 2·3조 개정안 철회를 요구했다. 권 원내대표는 &quot;노란봉투법(노조법 2·3조 개정안)의 최대 수혜자는 민주노총이고, 최대 피해자는 기업&quot;이라며 &quot;법치를... ","Tue, 25 Feb 2025 20:06:00 +0900"
2025-02-25 11:47:46,"구미시, '문화선도산단' 조성 박차…산업·문화·주거 융합 모델 제시",https://n.news.naver.com/mnews/article/277/0005551943?sid=102,"특히 시는 산업단지 내 유휴부지(12만9000㎡)를 활용해 첨단 <b>반도체</b> 연구단지, 청년문화센터, 청년근로자 기숙사 등을 조성할 계획이다. 이를 통해 청년층이 일하고, 머물고, 즐길 수 있는 원스톱 공간을 구축 구미시의... ","Tue, 25 Feb 2025 20:06:00 +0900"
2025-02-25 11:47:46,"생기원, 채소 과일 숙성 촉진하는 '에틸렌 정밀 감지' 기술 개발",https://n.news.naver.com/mnews/article/008/0005158182?sid=105,"<b>반도체</b>식 센서의 경우에도 고온에서 작동해 장기간 사용하기에는 안정성이 낮고, 에틸렌처럼 반응성이 약한... 정영규 수석연구원은 &quot;감지가 어려웠던 에틸렌 가스를 장기간 정확하고 안정적으로 감지할 수 있는 <b>반도체</b>... ","Tue, 25 Feb 2025 20:00:00 +0900"
2025-02-25 11:47:46,"&quot;日스미토모화학, 한국서 <b>반도체</b> 소재 포토레지스트 생산&quot;",https://n.news.naver.com/mnews/article/001/0015233501?sid=104,왔던 <b>반도체</b> 핵심 소재 포토레지스트를 한국에서도 제조하기로 했다고 니혼게이자이신문(닛케이)이 25일... 닛케이는 &quot;한국에는 최첨단 <b>반도체</b>를 만드는 업체가 있다&quot;며 한국 생산이 현지 수요에 대응하고 생산 거점을... ,"Tue, 25 Feb 2025 19:58:00 +0900"
2025-02-25 11:47:46,[사설] 사상 최악 경기침체 금리 인하만 보고 있을건가,https://n.news.naver.com/mnews/article/658/0000098511?sid=110,우리나라 주력 수출 상품인 자동차와 <b>반도체</b> 등에 미국이 10~25%의 높은 관세를 부과할 가능성이 크다. 금통위 금리 하향 조정에 깊은 우려가 담겼다. 시중에 돈을 풀어 민간 소비와 투자를 우선 설려야 한다는 취지다.... ,"Tue, 25 Feb 2025 19:56:00 +0900"
2025-02-25 11:47:46,"정부, 여의도 15배 규모 지방 그린벨트 해제… 15곳 선정",https://www.newscj.com/news/articleView.html?idxno=3238533,"정부는 환경평가 1~2등급지라도 대체지를 지정하면 해제를 허용하는 제도를 도입했으며, 이에 따라 광주 미래차 산업단지, 대전 나노·<b>반도체</b> 산단 등 2곳이 국가전략사업으로 선정됐다. 부산에서는 제2에코델타시티... ","Tue, 25 Feb 2025 19:54:00 +0900"
2025-02-25 11:47:46,'여의도 15배' 지방 그린벨트 푼다…지역전략사업 15곳 선정,https://n.news.naver.com/mnews/article/057/0001873550?sid=101,"국토교통부는 국무회의 심의를 거쳐 그린벨트 해제가 가능한 국가·지역 전략사업지 15곳을 선정해 부산에 첨단사이언스파크, 대전 나노 <b>반도체</b> 우주항공 국가산업단지 등을 만들기로 했다고 밝혔습니다.","Tue, 25 Feb 2025 19:52:00 +0900"
2025-02-25 11:47:46,`로봇 동맹` 맺은 이재용·정의선…전방위 협업,https://n.news.naver.com/mnews/article/029/0002937749?sid=101,"이 회장과 정 회장은 2020년 5월 전격 회동에 나선 이후 현재까지 <b>반도체</b>, 배터리를 포함한 하드웨어와 커넥티비티 등 소프트웨어 분야로 협업 범위를 확장해오고 있다. 특히 양사 모두 로봇을 미래사업으로 낙점한 가운데... ","Tue, 25 Feb 2025 19:48:00 +0900"
2025-02-25 11:47:46,비수도권 그린벨트 ‘대폭’ 푼다...여의도 15배 면적,https://n.news.naver.com/mnews/article/123/0002353711?sid=102,"이번 조처로 부산은 제2에코델타시티와 해운대 첨단사이언스파크, 대전은 나노<b>반도체</b>·우주항공 국가산업단지 조성에 나서게 됐다. 창원권에서는 진해신항 항만배후단지, 의창 도심융합기술단지, 김해 진영 일반산단... ","Tue, 25 Feb 2025 19:46:00 +0900"
2025-02-25 11:47:46,최상목 권한대행 &quot;<b>반도체</b>법 등 민생·경제 법안 처리 기대&quot;,http://www.enewstoday.co.kr/news/articleView.html?idxno=2242117,"최상목 대통령 권한대행 부총리 겸 기획재정부 장관은 25일 &quot;'<b>반도체</b>특별법', '조세특례제한법', '재건축·재개발촉진법' 등 한시가 급한 민생·경제 법안 처리와 추가 재정 투입에 대해 조속히 의미 있는 결과를 기대하며... ","Tue, 25 Feb 2025 19:45:00 +0900"
2025-02-25 11:47:46,"국토부, 비수도권 국가·지역전략사업 15곳 선정",http://www.ikld.kr/news/articleView.html?idxno=308786,"이들 사업의 경우 산업 수요가 충분해 실현가능성이 높고, 자동차‧<b>반도체</b>‧수소‧이차전지 등 국가... 특히 지난 2023년 3월 국토부가 발표한 국가산단 후보지 중에서는 광주 미래차 국가산단, 대전 나노·<b>반도체</b>... ","Tue, 25 Feb 2025 19:44:00 +0900"
2025-02-25 11:47:46,"[산업 이모저모] 현대차·기아-삼성SDI, 로봇 전용 고성능 배터리 공동 ...",https://www.greened.kr/news/articleView.html?idxno=323712,○...AI <b>반도체</b> 스타트업 모빌린트는 딥러닝 알고리즘 연산에 최적화된 온프레미스용 AI <b>반도체</b> 에리스(ARIES)를 탑재한 MLA100(NPU PCIe Card)을 출시하며 글로벌 AI 시장에서 본격적인 도약을 예고했다. MLA100은 모빌린트의... ,"Tue, 25 Feb 2025 19:41:00 +0900"
2025-02-25 11:47:46,"SK C&amp;C, 산업별 맞춤 'AI 랜딩존 서비스'로 기업 AI 전환 가속화",https://www.greened.kr/news/articleView.html?idxno=323710,"실제 사례로, 국내 대표 <b>반도체</b> 소재 기업은 MS 애저 클라우드에서 오픈 AI를 활용한 사내 챗봇 서비스를 구축하며 'AI 랜딩존'의 템플릿과 보안 가이드를 적용해 개발 기간을 30% 이상 단축했다. 또한, 제조·통신... ","Tue, 25 Feb 2025 19:41:00 +0900"
2025-02-25 11:47:46,"[주식마감기사] 신종 코로나 발견? 알리코제약 상한가... 알리코제약, 원...",https://www.ggilbo.com/news/articleView.html?idxno=1076023,이는 삼성전자와의 <b>반도체</b> 사업 협력 기대감과 함께 양자 사업 가시화에 대한 기대감이 반영된 것으로... 신규사업으로 <b>반도체</b> 소재사업(감광제)을 추진하고 있다. 알리코제약은 전 거래일 대비 29.84%(1195원) 오른... ,"Tue, 25 Feb 2025 19:40:00 +0900"
2025-02-25 11:47:46,"차량용 디스플레이 시장 연평균 12% 성장, 삼성·LG 점유율 확대 총력",https://www.greened.kr/news/articleView.html?idxno=323725,또한 BMW그룹 산하 브랜드인 미니에 라운드 OLED 패널을 최초로 공급하기도 했으며 최근 미국 <b>반도체</b> 기업 퀄컴과 차량용 OLED 시장 확대를 위한 업무 협약을 체결했다. 차량용 디스플레이는 보다 고도의 기술이... ,"Tue, 25 Feb 2025 19:40:00 +0900"
2025-02-25 11:47:46,최대한 낮춘 레이턴시로 응답 시간 단축... '지스킬 트라이던트 Z5 네오...,https://www.ilovepc.co.kr/news/articleView.html?idxno=53228,CL26은 <b>반도체</b> 표준 협약 기구(JEDEC)에서 제창한 동일 클럭 기준 공식 레이턴시인 CL48의 절반에 가까운 수치로 CPU와 메모리간 응답 시간을 단축시켜 더 빠르고 쾌적한 컴퓨팅 환경을 보조한다. 지스킬... ,"Tue, 25 Feb 2025 19:38:00 +0900"
2025-02-25 11:47:46,유럽증시 소폭 하락 출발…위험회피 심리 지속,https://news.einfomax.co.kr/news/articleView.html?idxno=4344631,네덜란드 <b>반도체</b> 제조장비 업체인 ASML홀딩스(EUN:ASML) 주가는 개장 초 3% 넘게 내렸다. 이외 다른 기술주들도 매도 우위 분위기다. 독일의 작년 4분기 국내총생산(GDP) 확정치는 전분기 대비 0.2% 감소했다.... ,"Tue, 25 Feb 2025 19:38:00 +0900"
2025-02-25 11:47:46,"애플, 트럼프 관세 압박에 역대 최대 미국 투자",https://www.econovill.com/news/articleView.html?idxno=685083,"미국 내 AI·<b>반도체</b> 투자 확대…공장 신설·제조업 지원 애플은 대만 폭스콘(Foxconn)과 협력해 올해 말부터... 애플은 이번 투자로 추가되는 2만 개의 일자리가 연구개발(R&amp;D), <b>반도체</b> 엔지니어링, 인공지능(AI) 분야에... ","Tue, 25 Feb 2025 19:38:00 +0900"
2025-02-25 11:47:46,"국립목포대, 화합물<b>반도체</b> 기반 차세대 통신산업 육성",http://www.jndn.com/article.php?aid=1740479654404669007,국립목포대학교가 글로벌 계측기기 선도기업인 안리쓰(Anritsu)와 손을 맞잡고 화합물<b>반도체</b> 기반의 차세대 통신 산업 육성에 나선다. 25일 국립목포대에 따르면 국립목포대 화합물<b>반도체</b>센터와 안리쓰는 최근 국방... ,"Tue, 25 Feb 2025 19:38:00 +0900"
2025-02-25 11:47:46,"&quot;상법·노란봉투법? 실천으로 증명하라&quot;…與, 이재명 `중도 보수` 진정성...",https://n.news.naver.com/mnews/article/029/0002937747?sid=100,"권 원내대표는 특히 <b>반도체</b> 연구개발(R&amp;D) 산업 인력의 주52시간 상한제 적용 예외 조항을 담은 '<b>반도체</b> 특별법'에 반대하고 '상법개정안', '노란봉투법'(노동조합법 개정안) 등을 추진하는 민주당의 행보는 중도 보수라고 할... ","Tue, 25 Feb 2025 19:36:00 +0900"
2025-02-25 11:47:46,[이슈플러스] 윤 대통령 탄핵심판 최종 변론...무제한 최후 진술 주목,https://n.news.naver.com/mnews/article/052/0002157903?sid=102,<b>반도체</b>특별법 등도 야당 반대로 무산이 됐다. 또 야당은 간첩 처벌을 위한 형법 개정도 반대를 했다. 이재명 대표를 지키려고 셀프 방탄보호법을 통과시켰다. 이렇게 위헌성 큰 법률을 반복적으로 통과시켰고 또 예산을... ,"Tue, 25 Feb 2025 19:32:00 +0900"
2025-02-25 11:47:46,대덕구 '연축 혁신도시'로 균형발전 이끈다,https://www.cctoday.co.kr/news/articleView.html?idxno=2208410,"바이오·AI·<b>반도체</b> 산업을 중심으로 한 첨단산업 기업 유치, 창업·기술사업화 지원 확대 등 대덕특구를 단순한 연구 공간이 아닌 혁신 산업 클러스터로 발전시키겠다는 전략이다.대덕구가 가진 천혜의 자연환경을 활용한... ","Tue, 25 Feb 2025 19:30:00 +0900"
2025-02-25 11:47:46,"[기획] 중도보수 외치던 이재명, '오락가락 행보'로 혼선 자초하나",http://www.sisafocus.co.kr/news/articleView.html?idxno=334107,"이 같은 모습은 앞서 또 다른 쟁점인 <b>반도체</b>특별법상 주52시간 근로제 예외 적용 문제 때도 보여준 바 있는데, 이 사안에 대해서도 이 대표가 먼저 <b>반도체</b> 연구개발 인력에 대한 주52시간 예외에 대해 전향적 입장을... ","Tue, 25 Feb 2025 19:28:00 +0900"
2025-02-25 11:47:46,"권영세 &quot;이재명, 대통령 돼도 재판 지속해야…상실형 나오면 다시 대선...",https://n.news.naver.com/mnews/article/088/0000932982?sid=100,"그는 이 대표의 <b>반도체</b>특별법의 주 52시간 예외 적용 반대, 상법 개정안 추진 등을 거론하며 &quot;이런 법안에 대해서 밀어붙이면서 친기업적이고 중도 우파라고 얘기하는 것은 말 그대로 언어도단&quot;이라고 강조했다. 또 홍준표... ","Tue, 25 Feb 2025 19:27:00 +0900"
2025-02-25 11:47:46,"“트럼프 관세폭탄 상상초월”…비상등 켜진 한국 경제, 저성장 늪으로",https://n.news.naver.com/mnews/article/009/0005449870?sid=101,상호관세와 <b>반도체</b>·자동차·철강 등 품목별 관세가 어떻게 시행되느냐에 따라 (경제성장률에 미칠) 양방향 리스크가 모두 존재한다”고 설명했다. 한은은 이 같은 통상 환경 악화로 올해 경상수지 흑자 규모가 당초... ,"Tue, 25 Feb 2025 19:25:00 +0900"
