DateTime,Title,Link,Description,PubDate
2026-01-13 05:31:36,"LG이노텍, 광주공장 1000억원 증설…차량 '두뇌' AP모듈 라인 키운다 [반...",https://n.news.naver.com/mnews/article/138/0002215089?sid=105,LG이노텍은 지난해 말부터 글로벌 <b>반도체</b> 기업에 차량 AP모듈을 공급 중이며 추가 고객 확보를 위한 프로모션도 진행하고 있다. 이번 증설을 통해 AP모듈 사업 경쟁력을 끌어올려 우위를 굳힌다는 방침이다.... ,"Tue, 13 Jan 2026 14:30:00 +0900"
2026-01-13 05:31:36,"LG이노텍, 광주 신사업 생산 거점 확대",https://www.newswhoplus.com/news/articleView.html?idxno=51082,"LG이노텍은 지난해 말부터 이미 글로벌 <b>반도체</b> 기업에 차량 AP모듈을 공급하고 있으며, 추가 고객 확보를 위한 프로모션에도 적극 나서고 있다. 이번 투자를 통해 LG이노텍은 차량 AP모듈 사업 경쟁력을 높여 경쟁... ","Tue, 13 Jan 2026 14:30:00 +0900"
2026-01-13 05:31:36,제조기업 10곳 중 8곳 올해 경영전략 &quot;현상 유지·축소&quot;,https://www.pinpointnews.co.kr/news/articleView.html?idxno=416954,"<b>반도체</b> 기업의 47.0%가 '확장 경영'을 선택해 가장 높은 비중을 기록했으며, 제약·바이오(39.5%)와 화장품(39.4%) 업종도 평균을 웃돌았다. 반면 섬유(20.0%)와 철강(17.6%) 업종은 '축소' 응답 비중이 상대적으로 높았다.... ","Tue, 13 Jan 2026 14:30:00 +0900"
2026-01-13 05:31:36,"[종합] 美, 中 의존 탈피 나서…핵심광물·AI 공급망 우방 연대 확대",https://www.ajunews.com/view/20260113135105795,"그러면서 양국은 공급망 안보 강화를 비롯해 신뢰할 수 있는 기술 생태계 구축, 디지털 인프라와 컴퓨팅·<b>반도체</b>, 첨단 제조, 광물 정제·가공, 에너지 분야에서 협력 기회를 모색하기로 했다고 설명했다. 팍스 실리카는 AI... ","Tue, 13 Jan 2026 14:30:00 +0900"
2026-01-13 05:31:36,"SK하이닉스·LG이노텍, '신사업 확대·균형 발전' 두 마리 토끼 잡는다",https://www.techm.kr/news/articleView.html?idxno=148478,P&amp;T 팹은 전공정 팹에서 생산한 <b>반도체</b> 칩을 제품 형태로 완성하고 품질을 검증하는 시설이다. P&amp;T7 팹은 고대역폭메모리(HBM) 등 인공지능(AI) 메모리<b>반도체</b> 제조에 필수인 어드밴스드 패키징 팹이다. 총 19조원을... ,"Tue, 13 Jan 2026 14:30:00 +0900"
2026-01-13 05:31:36,"LG이노텍, 광주 신사업 위한 공장 증축…MOU 체결",https://n.news.naver.com/mnews/article/277/0005706044?sid=101,LG이노텍은 지난해 말부터 이미 글로벌 <b>반도체</b> 기업에 차량 AP모듈을 공급하고 있다. 더불어 추가 고객 확보를 위한 프로모션에도 적극 나서고 있다. 이번 투자를 통해 LG이노텍은 차량 AP모듈 사업 경쟁력을 높여 경쟁... ,"Tue, 13 Jan 2026 14:30:00 +0900"
2026-01-13 05:31:36,"SK하이닉스, 왜 청주에 19조원 쏟나",https://www.newscj.com/news/articleView.html?idxno=3362815,"AI <b>반도체</b> 수요 급증으로 고대역폭 메모리(HBM)가 글로벌 <b>반도체</b> 시장의 핵심 병목으로 떠오른 가운데, 전공정에 이어 후공정까지 선제적으로 확장해 공급 주도권을 공고히 하겠다는 전략으로 풀이된다. 정부의 지역... ","Tue, 13 Jan 2026 14:30:00 +0900"
2026-01-13 05:31:36,"LG이노텍, '지방투자에 진심' ... 광주에 1000억 투자 신사업 공장 증축...",http://www.worktoday.co.kr/news/articleView.html?idxno=79828,"LG이노텍은 지난해 말부터 이미 글로벌 <b>반도체</b> 기업에 차량 AP모듈을 공급하고 있으며, 추가 고객 확보를 위한 프로모션에도 적극 나서고 있다. 이번 투자를 통해 LG이노텍은 차량 AP모듈 사업 경쟁력을 높여 경쟁... ","Tue, 13 Jan 2026 14:30:00 +0900"
2026-01-13 05:31:36,"LG이노텍, 광주공장 증설⋯ &quot;신사업 경쟁력 강화&quot;",https://www.smarttoday.co.kr/ko-kr/articles/100955,"LG이노텍은 지난해 말부터 글로벌 <b>반도체</b> 기업에 차량 AP모듈을 공급하고 있으며, 추가 고객 확보를 위한... 한편, LG이노텍은 ADAS용 부품 및 고부가 <b>반도체</b> 기판 사업, 그리고 로봇∙드론∙우주산업용 부품 등 새롭게... ","Tue, 13 Jan 2026 14:30:00 +0900"
2026-01-13 05:31:36,"LG이노텍, 광주사업장 증축…신사업 강화 박차",http://www.newstomato.com/ReadNews.aspx?no=1287610&inflow=N,"LG이노텍은 지난해 말부터 글로벌 <b>반도체</b> 기업을 대상으로 차량용 AP 모듈을 공급하고 있으며, 이러한 실적을 바탕으로 추가 고객 확보를 위한 투자를 확대하는 것으로 풀이됩니다. 특히 광주사업장은 차량용 통신... ","Tue, 13 Jan 2026 14:30:00 +0900"
2026-01-13 05:31:36,"LG이노텍, ‘지방투자에 진심’⋯광주에 신사업 공장 증축 나선다",https://www.etoday.co.kr/news/view/2544925,"LG이노텍은 지난해 말부터 이미 글로벌 <b>반도체</b> 기업에 차량 AP모듈을 공급하고 있으며, 추가 고객 확보를 위한 프로모션에도 적극 나서고 있다. 이번 투자를 통해 LG이노텍은 차량 AP모듈 사업 경쟁력을 높여 경쟁... ","Tue, 13 Jan 2026 14:30:00 +0900"
2026-01-13 05:31:36,"LG이노텍, 광주에 車 AP모듈 생산라인 증설…12월 준공",http://www.srtimes.kr/news/articleView.html?idxno=194090,"LG이노텍은 지난해 말부터 이미 글로벌 <b>반도체</b> 기업에 차량 AP모듈을 공급하고 있으며, 추가 고객 확보를 위한 프로모션에도 적극 나서고 있다. 이번 투자를 통해 LG이노텍은 차량 AP모듈 사업 경쟁력을 높여... ","Tue, 13 Jan 2026 14:30:00 +0900"
2026-01-13 05:31:36,"LG이노텍, 광주 신사업 공장 증축…&quot;지역 균형 발전 기여&quot;",https://www.financialpost.co.kr/news/articleView.html?idxno=244129,"LG이노텍은 지난해 말부터 이미 글로벌 <b>반도체</b> 기업에 차량 AP모듈을 공급하고 있으며, 추가 고객 확보를 위한 프로모션에도 적극 나서고 있다. 이번 투자를 통해 LG이노텍은 차량 AP모듈 사업 경쟁력을 높여 경쟁... ","Tue, 13 Jan 2026 14:30:00 +0900"
2026-01-13 05:31:36,"LG이노텍, 광주 車<b>반도체</b>공장 1000억원 들여 10만㎡ 규모로 증설",https://www.newsquest.co.kr/news/articleView.html?idxno=260023,"LG이노텍이 광주광역시 차량용 <b>반도체</b> 신사업 공장을 약 10만㎡ 규모로 증축한다. 비수도권 투자를 통해... 차량 AP모듈은 차량의 두뇌 역할을 하는 핵심 <b>반도체</b> 부품으로, 첨단운전자보조시스템과 디지털 콕핏 등 자동차... ","Tue, 13 Jan 2026 14:30:00 +0900"
2026-01-13 05:31:36,"LG이노텍, 광주에 신사업 공장 증축…차량 AP모듈로 미래차 경쟁력 강화",http://www.popcornnews.net/news/articleView.html?idxno=108310,핵심 <b>반도체</b> 부품이다. 해당 모듈은 첨단운전자보조시스템(ADAS)과 디지털 콕핏 등 자동차 전자 시스템을... 글로벌 <b>반도체</b> 기업을 대상으로 차량 AP모듈 공급을 시작한 바 있다. LG이노텍은 이번 광주사업장 증축을 통해... ,"Tue, 13 Jan 2026 14:30:00 +0900"
2026-01-13 05:31:36,"LG이노텍, 1000억 투자 광주 공장 증축…차량 AP모듈 생산",https://n.news.naver.com/mnews/article/421/0008711360?sid=101,"LG이노텍은 지난해 말부터 글로벌 <b>반도체</b> 기업에 차량 AP모듈을 공급하고 있으며, 추가 고객 확보에도 적극적으로 나서고 있다. 이번 투자는 LG이노텍이 신사업 경쟁력 강화에 더해 비수도권∙지방 투자를 통한 지역... ","Tue, 13 Jan 2026 14:30:00 +0900"
2026-01-13 05:31:36,"LG이노텍, 광주에 1000억원 투자…차량용 <b>반도체</b> 부품 생산라인 증설",https://n.news.naver.com/mnews/article/016/0002585107?sid=101,[LG이노텍 제공] [헤럴드경제=김현일 기자] LG이노텍이 약 1000억원을 투자해 광주광역시에 차량용 <b>반도체</b>... LG이노텍은 지난해 말부터 이미 글로벌 <b>반도체</b> 기업에 차량용 AP모듈을 공급하고 있으며 추가 고객 확보를... ,"Tue, 13 Jan 2026 14:30:00 +0900"
2026-01-13 05:31:36,"벤츠는 엔비디아, 폭스바겐은 퀄컴…완성차 'AI 파트너' 경쟁 본격화",https://www.newsway.co.kr/news/view?ud=2026011313552335445,"업계 관계자는 &quot;SDV 시대에는 <b>반도체</b>와 소프트웨어 생태계를 어떻게 강화하느냐에 따라 차량 경쟁력이 좌우될 전망&quot;이라며, &quot;완성차 업체들이 자율주행과 디지털 경험을 분리해 접근하는 흐름은 앞으로 더욱 뚜렷해질... ","Tue, 13 Jan 2026 14:30:00 +0900"
2026-01-13 05:31:36,"LG이노텍, 1000억 투입해 광주공장 증축…차량 AP모듈 라인 구축",https://www.newsworks.co.kr/news/articleView.html?idxno=826830,"LG이노텍은 지난해 말부터 이미 글로벌 <b>반도체</b> 기업에 차량 AP 모듈을 공급하고 있으며, 추가 고객 확보를 위한 프로모션에도 적극 나서고 있다. 이번 투자를 통해 LG이노텍은 차량 AP 모듈 사업 경쟁력을 높여 경쟁... ","Tue, 13 Jan 2026 14:30:00 +0900"
2026-01-13 05:31:36,"삼성운용, KODEX 미국AI<b>반도체</b>TOP3플러스 상장",https://n.news.naver.com/mnews/article/629/0000462066?sid=101,<b>반도체</b> 선두주자 엔비디아·TSMC·브로드컴에 약 62% 집중 투자 삼성자산운용은 미국 AI <b>반도체</b> 선두주자 3개 기업에 집중 투자하는 'KODEX 미국AI<b>반도체</b>TOP3플러스' ETF를 신규 상장한다고 13일 밝혔다. 미국 <b>반도체</b>... ,"Tue, 13 Jan 2026 14:30:00 +0900"
2026-01-13 05:31:36,"LG이노텍, 광주사업장에 차량 AP모듈 생산라인 증설…1000억원 투자",https://www.newsway.co.kr/news/view?ud=2026011308115162271,"LG이노텍은 지난해 말부터 글로벌 <b>반도체</b> 기업에 차량 AP모듈을 공급하고 있으며, 추가 고객 확보를 위한 프로모션에도 적극 나서고 있다. 이번 투자를 통해 LG이노텍은 차량 AP모듈 사업 경쟁력을 높여 경쟁 우위를... ","Tue, 13 Jan 2026 14:30:00 +0900"
2026-01-13 05:31:36,"미래에셋운용, TIGER <b>반도체</b>TOP10 ETF 순자산 3조 돌파…<b>반도체</b> 최초 기...",https://www.news2day.co.kr/article/20260113500183,삼성전자·SK하이닉스 집중 편입 미래에셋자산운용의 TIGER <b>반도체</b>TOP10 ETF가 국내 <b>반도체</b> 테마 ETF(상장지수펀드) 중 처음으로 순자산 3조 원 고지를 넘겼다. 13일 한국거래소에 따르면 지난 12일 기준 해당 ETF... ,"Tue, 13 Jan 2026 14:30:00 +0900"
2026-01-13 05:31:36,"&quot;터질 때도 됐는데..&quot; '바이오 선구자' 서정진의 셀트리온, 주가는 왜?",https://radio.ytn.co.kr/program/?f=2&id=106853&s_mcd=0206&s_hcd=15,"◇조태현: 지난해 말과 새해 첫 주까지 AI <b>반도체</b>가 주도하는 코스피 상승 흐름이 계속 이어지고 있는데요.... 우리가 <b>반도체</b> 얘기 많이 하잖아요? 삼성전자는 메모리를 만들고, TSMC는 주문형 <b>반도체</b>를 만들죠.... ","Tue, 13 Jan 2026 14:30:00 +0900"
2026-01-13 05:31:36,‘지방투자’ 앞장서는 LG이노텍…광주에 신사업 공장 증축,https://www.news2day.co.kr/article/20260113500139,車<b>반도체</b> 부품인 차량 AP모듈 생산라인 증설… 12월 준공 “전략적 요충지…신사업 경쟁력 강화·지역... LG이노텍은 지난해 말부터 이미 글로벌 <b>반도체</b> 기업에 차량 AP모듈을 공급 중이다. 추가 고객 확보를... ,"Tue, 13 Jan 2026 14:30:00 +0900"
2026-01-13 05:31:36,"LG이노텍, 광주에 1000억 투자…'차량 AP모듈' 공장 증축",http://www.datanews.co.kr/news/article.html?no=142775,"실제로 지난해 말부터 글로벌 <b>반도체</b> 기업에 제품 공급을 시작했으며, 이번 투자를 통해 시장 내 경쟁 우위를 확고히 한다는 방침이다. 업계는 이번 투자로 LG이노텍이 신사업 경쟁력 강화는 물론, 비수도권∙지방... ","Tue, 13 Jan 2026 14:30:00 +0900"
2026-01-13 05:31:36,"LG이노텍, 1000억 투자 광주 신사업 공장 증축",http://www.hansbiz.co.kr/news/articleView.html?idxno=808021,"핵심 <b>반도체</b> 부품이다. 첨단운전자보조시스템(ADAS), 디지털 콕핏 등 자동차 전자장치를 통합 제어하는 데 사용된다. LG이노텍은 이미 글로벌 <b>반도체</b> 기업에 차량 AP모듈을 공급 중이며 이번 증설을 통해 생산 역량을... ","Tue, 13 Jan 2026 14:30:00 +0900"
2026-01-13 05:31:36,"삼성자산운용, KODEX 미국AI<b>반도체</b>TOP3플러스 신규 상장",https://www.inthenews.co.kr/news/article.html?no=81868,인더뉴스 박호식 기자ㅣ삼성자산운용은 미국 AI <b>반도체</b> 선두주자 3개 기업에 집중 투자하는 ‘KODEX 미국AI<b>반도체</b>TOP3플러스’ ETF를 신규 상장한다고 13일 밝혔습니다. 미국 <b>반도체</b>산업에 투자하는 ETF들 가운데 미국... ,"Tue, 13 Jan 2026 14:30:00 +0900"
2026-01-13 05:31:36,"LG이노텍, 광주공장 증축…1천억 투자",https://n.news.naver.com/mnews/article/215/0001237743?sid=101,"LG이노텍은 지난해 말부터 이미 글로벌 <b>반도체</b> 기업에 차량 AP모듈을 공급하고 있으며, 추가 고객 확보를 위한 프로모션에도 적극 나서고 있다. 이번 투자로 LG이노텍이 신사업 경쟁력 강화는 물론 비수도권?지방 투자를... ","Tue, 13 Jan 2026 14:30:00 +0900"
2026-01-13 05:31:36,"LG이노텍, 車 AP모듈 생산라인 증설…1000억원 투입",http://www.m-i.kr/news/articleView.html?idxno=1324757,"LG이노텍은 지난해 말부터 이미 글로벌 <b>반도체</b> 기업에 차량 AP모듈을 공급하고 있으며, 추가 고객 확보를 위한 프로모션에도 적극 나서고 있다. 이번 투자를 통해 LG이노텍은 차량 AP모듈 사업 경쟁력을 높여 경쟁... ","Tue, 13 Jan 2026 14:30:00 +0900"
2026-01-13 05:31:36,"&quot;LG이노텍, 광주에 1000억 추가 투자&quot;...車 <b>반도체</b> 모듈 공장 증축",https://n.news.naver.com/mnews/article/014/0005462162?sid=101,LG이노텍은 지난해 말부터 글로벌 <b>반도체</b> 기업에 해당 모듈을 공급 중이며 북미·유럽 완성차업체를 대상으로 신규 고객 확보에도 속도를 내고 있다. 이번 증설은 생산능력 확대와 기술 경쟁력 강화 차원에서... ,"Tue, 13 Jan 2026 14:30:00 +0900"
2026-01-13 05:31:36,"LG이노텍, 전장 신사업 속도 … 광주 공장 증축에 1000억 투입",https://biz.newdaily.co.kr/site/data/html/2026/01/13/2026011300110.html,뉴데일리 윤아름 기자 = LG이노텍이 차량용 <b>반도체</b> 신사업 확대를 위해 광주사업장 증설에 나선다. 약... LG이노텍은 지난해 말부터 글로벌 <b>반도체</b> 기업에 차량 AP모듈을 공급하고 있으며 추가 고객 확보를 위한... ,"Tue, 13 Jan 2026 14:30:00 +0900"
2026-01-13 05:31:36,"LG이노텍, 광주사업장 증축에 1000억원 투자",https://daily.hankooki.com/news/articleView.html?idxno=1321439,"LG이노텍은 지난해 말부터 글로벌 <b>반도체</b> 기업에 차량 AP모듈을 공급하고 있으며, 차별화 기술력과 모빌리티솔루션 사업 역량을 앞세워 시장을 빠르게 선점해 나가고 있다. LG이노텍은 이번 투자를 통해 차량 AP모듈... ","Tue, 13 Jan 2026 14:30:00 +0900"
2026-01-13 05:31:36,"LG이노텍, 광주에 1000억 투자…차량 AP모듈 공장 증축",http://www.shinailbo.co.kr/news/articleView.html?idxno=2176771,특히 지난해 말부터 글로벌 <b>반도체</b> 기업에 차량 AP모듈을 공급하고 있으며 추가 고객 확보를 위한 프로모션에도 적극 나서고 있다. LG이노텍은 이번 투자를 통해 차량 AP모듈 사업 경쟁력을 높여나갈 계획이다. 또한... ,"Tue, 13 Jan 2026 14:30:00 +0900"
2026-01-13 05:31:36,"LG이노텍, 1천억 들여 광주사업장 증축...&quot;차량 AP모듈 생산라인 증설&quot;",https://www.pinpointnews.co.kr/news/articleView.html?idxno=416712,"LG이노텍은 지난해 말부터 이미 글로벌 <b>반도체</b> 기업에 차량 AP모듈을 공급하고 있으며, 추가 고객 확보를 위한 프로모션에도 적극 나서고 있다. 이번 투자를 통해 LG이노텍은 차량 AP모듈 사업 경쟁력을 높여 경쟁... ","Tue, 13 Jan 2026 14:30:00 +0900"
2026-01-13 05:31:36,"LG이노텍, 전장 사업 드라이브…광주에 車두뇌 'AP'모듈 공장 증설",https://weekly.hankooki.com/news/articleView.html?idxno=7144982,지난해 말부터 글로벌 <b>반도체</b> 기업에 차량 AP모듈을 공급하고 있는 것이 대표적이다. 이번 투자로 차량용 AP 모듈 사업 경쟁력 강화는 물론 비수도권·지방 투자를 통한 지역 균형 발전에도 기여할 수 있을 것으로... ,"Tue, 13 Jan 2026 14:30:00 +0900"
2026-01-13 05:31:36,"LG이노텍, 미래 차 '두뇌' 키운다…광주사업장에 1000억원 투자",https://n.news.naver.com/mnews/article/008/0005303930?sid=101,LG이노텍은 지난해 말부터 글로벌 <b>반도체</b> 기업에 차량용 AP 모듈 공급을 시작했다. 향후 차별화된 기술력과 모빌리티솔루션 사업 역량을 앞세워 경쟁 우위를 한층 강화한다는 계획이다. 자율주행과 커넥티드카... ,"Tue, 13 Jan 2026 14:30:00 +0900"
2026-01-13 05:31:36,"LG이노텍, 광주사업장에 차량 AP모듈 생산라인 증설…약 1000억원 투자",https://www.ceoscoredaily.com/page/view/2026011309464750188,"LG이노텍은 지난해 말부터 글로벌 <b>반도체</b> 기업에 차량 AP모듈을 공급하고 있으며, 추가 고객 확보를 위한 프로모션에도 적극 나서고 있다. 이번 투자를 통해 차량 AP모듈 사업 경쟁력을 높여 경쟁 우위를 더욱 확고히... ","Tue, 13 Jan 2026 14:30:00 +0900"
2026-01-13 05:31:36,"LG이노텍, 광주 공장에 AP모듈 생산라인 증설",https://www.pointdaily.co.kr/news/articleView.html?idxno=288432,LG이노텍은 지난해 말부터 이미 글로벌 <b>반도체</b> 기업에 차량 AP모듈을 공급하고 있다. 추가 고객 확보를 위한 프로모션에도 적극 나서고 있다. 이번 투자를 통해 LG이노텍은 차량 AP모듈 사업 경쟁력을 높여 경쟁... ,"Tue, 13 Jan 2026 14:30:00 +0900"
2026-01-13 05:31:36,"LG이노텍, 광주서 신사업 판 키운다…차량 두뇌에 베팅",https://n.news.naver.com/mnews/article/648/0000043495?sid=101,신사업으로 낙점한 차량용 <b>반도체</b> 모듈을 앞세워 모빌리티 솔루션 경쟁력을 끌어올리는 동시에 비수도권... 지난해 차량 AP 모듈 사업에 첫발을 뗀 데 이어 현재 글로벌 <b>반도체</b> 기업을 고객으로 확보하며 양산 공급을... ,"Tue, 13 Jan 2026 14:30:00 +0900"
2026-01-13 05:31:36,"LG이노텍, 광주사업장에 1000억원 투자",https://www.digitaltoday.co.kr/news/articleView.html?idxno=620500,LG이노텍은 지난해 말부터 글로벌 <b>반도체</b> 기업에 차량 AP모듈을 공급하고 있다. LG이노텍 차량용 AP 모듈 제품 [사진: LG이노텍] 자율주행 등 커넥티드카(Connected Car) 발전과 함께 글로벌 차량 AP모듈 시장 규모는... ,"Tue, 13 Jan 2026 14:30:00 +0900"
2026-01-13 05:31:36,"LG이노텍, 광주에 1000억 투자 차량 AP 공장 증축",https://www.pointe.co.kr/news/articleView.html?idxno=67991,"지난해 말부터 글로벌 <b>반도체</b> 기업에 차량 AP모듈을 공급하고 있으며, 추가 고객 확보를 위한 프로모션도... AD/ADAS용 부품과 고부가 <b>반도체</b> 기판 사업, 로봇·드론·우주산업용 부품 등 새롭게 확장하는 신사업을 미래... ","Tue, 13 Jan 2026 14:30:00 +0900"
2026-01-13 05:31:36,장철민 “통합특별시 서울 수준 위상 갖춰야…명칭 대전 반드시 포함”,https://n.news.naver.com/mnews/article/421/0008711363?sid=102,그러면서 &quot;이미 대표 발의한 충청권산업투자공사법이 통합특별법과 함께 통과돼야 한다&quot;며 &quot;용인 <b>반도체</b> 클러스터 수준의 국가산단 조성과 과감한 산업 특례도 필요하다&quot;고 말했다. 이와 함께 &quot;촘촘한 교통망 구축이... ,"Tue, 13 Jan 2026 14:30:00 +0900"
2026-01-13 05:31:36,"LG이노텍, 1000억원 투자해 광주 공장 증설 나선다",https://www.ajunews.com/view/20260113082724480,LG이노텍은 지난해 말부터 이미 글로벌 <b>반도체</b> 기업에 차량 AP모듈을 공급하고 있으며 추가 고객 확보를 위한 프로모션에도 적극 나서고 있다. 이번 투자를 통해 LG이노텍은 차량 AP모듈 사업 경쟁력을 높여 경쟁... ,"Tue, 13 Jan 2026 14:30:00 +0900"
2026-01-13 05:31:36,"LG이노텍, 광주 신사업 공장 증축 나서…12월 완공 예정",https://www.straightnews.co.kr/news/articleView.html?idxno=291840,지난해 말부터 이미 글로벌 <b>반도체</b> 기업에 차량 AP모듈을 공급하고 있으며 추가 고객 확보를 위한 프로모션에도 적극 나서고 있다. 이번 투자를 통해 LG이노텍은 차량 AP모듈 사업 경쟁력을 높여 경쟁 우위를 더욱... ,"Tue, 13 Jan 2026 14:30:00 +0900"
2026-01-13 05:31:36,"LG이노텍, 광주에 1000억원 투자… '미래차 두뇌' AP모듈 생산 확대",https://www.ebn.co.kr/news/articleView.html?idxno=1694853,글로벌 <b>반도체</b> 기업에 제품을 공급하며 시장 선점에 속도를 내고 있다. ■지역 경제 활성화…미래차 산업... 투자를 이어가며 고부가 카메라 모듈 및 <b>반도체</b> 기판(FC-BGA) 등 핵심 사업의 경쟁력을 공고히 하고 있다.,"Tue, 13 Jan 2026 14:30:00 +0900"
2026-01-13 05:31:36,"전장 사업 속도내는 LG이노텍, 광주사업장 증축에 1000억 투자",https://n.news.naver.com/mnews/article/029/0003004586?sid=101,"회사는 지난해 말부터 이미 글로벌 <b>반도체</b> 기업에 차량 AP모듈을 공급하고 있으며, 추가 고객 확보를 위한 프로모션에도 적극 나서고 있다. LG이노텍은 이번 투자를 통해 차량 AP모듈 사업 경쟁력을 높여 경쟁 우위를... ","Tue, 13 Jan 2026 14:30:00 +0900"
2026-01-13 05:31:36,"LG이노텍, 1000억원 투자해 광주에 차량 AP모듈 공장 증축",https://www.ngetnews.com/news/articleView.html?idxno=545352,핵심 <b>반도체</b> 부품이다. 차량 AP모듈은 LG이노텍이 지난해부터 본격적으로 진출한 신사업 분야로... LG이노텍은 이미 글로벌 <b>반도체</b> 기업에 공급을 시작했으며 추가 고객 확보를 위한 글로벌 프로모션도 추진 중이다.... ,"Tue, 13 Jan 2026 14:30:00 +0900"
2026-01-13 05:31:36,"[서울데이터랩]현대모비스 12.18% 상승, 시장 대세 상승 중",https://n.news.naver.com/mnews/article/081/0003608387?sid=101,"시가총액은 530조 7137억원, 외국인비율은 53.79%이며, PER 14.87배, ROE 31.06%로 <b>반도체</b> 주식 중에서도 경쟁력 있는 재무 지표를 나타내고 있다. LG에너지솔루션(373220)은 2.24% 상승하며, 삼성바이오로직스... ","Tue, 13 Jan 2026 14:28:00 +0900"
2026-01-13 05:31:36,연구 성과 재조명에...초전도체주 모비스 신성델타테크 파워로직스 주목...,https://www.pinpointnews.co.kr/news/articleView.html?idxno=416952,"국내외 연구 성과 재조명과 함께 전력 인프라, <b>반도체</b> 장비, 이차전지, 전기차 등으로의 응용 가능성이 다시 부각되면서 관련 종목을 중심으로 매수세가 유입되고 있다. 다만 단기 급등에 따른 부담으로 일부 종목에서는... ","Tue, 13 Jan 2026 14:28:00 +0900"
2026-01-13 05:31:36,&quot;AI 확산 따른 기술 트렌드가 데이터센터 혁신 견인하고 있다&quot;,http://www.energydaily.co.kr/news/articleView.html?idxno=163807,▲AI 및 고성능 컴퓨팅(HPC)으로 가속화되는 초고집적화 ▲전례 없는 속도와 규모로 전개되는 기가와트급 데이터센터 확장 ▲데이터센터를 단일 컴퓨팅 단위로 설계·운영하는 패러다임 전환 ▲다양해지는 <b>반도체</b> 및... ,"Tue, 13 Jan 2026 14:28:00 +0900"
