DateTime,Title,Link,Description,PubDate
2025-09-12 05:21:57,"김동연 &quot;경기북수원 테크노밸리, AI가 열어가는 자족형 15분 도시로 만들...",http://www.suwonilbo.kr/news/articleView.html?idxno=311994,"AI·<b>반도체</b>·바이오 분야 기업관계자 및 돌봄의료 전문가, 지역주민 등 60여 명이 함께한 '경기북수원... 이를 위해 AI에 기반을 둔 IT기업과 <b>반도체</b>, 모빌리티, 바이오·헬스케어 연구소 등 미래 산업을 유치해 과천... ","Fri, 12 Sep 2025 14:20:00 +0900"
2025-09-12 05:21:57,"씨이랩-업스테이지, 'LLM 기반 멀티모달 AI 어플라이언스' 상용화 박차",https://www.epnc.co.kr/news/articleView.html?idxno=322356,또 씨이랩의 AI 영상분석 플랫폼 '엑스아이바(XAIVA)'에 업스테이지의 한국어 특화 모델을 결합해 <b>반도체</b>·바이오·제조 등 산업별 맞춤형 솔루션을 제공할 예정이다. 여기에 씨이랩의 모델 경량화 기술을... ,"Fri, 12 Sep 2025 14:20:00 +0900"
2025-09-12 05:21:57,"씨이랩-업스테이지, LLM 기반 멀티모달 AI 어플라이언스 MOU",https://n.news.naver.com/mnews/article/003/0013478550?sid=101,또 씨이랩의 AI 영상분석 플랫폼 '엑스아이바(XAIVA)'에 업스테이지의 한국어 특화 모델을 결합해 <b>반도체</b>·바이오·제조 등 산업별 맞춤형 솔루션을 제공할 예정이다. 여기에 씨이랩의 모델 경량화 기술을... ,"Fri, 12 Sep 2025 14:19:00 +0900"
2025-09-12 05:21:57,"원자력학회 &quot;이재명 대통령의 에너지정책, 산업 생태계 위험에 빠뜨릴 ...",http://www.e-platform.net/news/articleView.html?idxno=96261,"우리나라 <b>반도체</b>와 AI, 미래차 등 첨단 산업의 운명이 걸린 문제로, 이들 산업은 저렴하고 안정적인 고품질의 전기가 24시간 공급이 이뤄져야 한다. 전력 공급이 조금이라도 흔들린다면 공장은 멈출 우려가 있다. 세계... ","Fri, 12 Sep 2025 14:18:00 +0900"
2025-09-12 05:21:57,SK하이닉스 미래포럼 개최…차세대 AI 전략을 향한 대화와 통찰 이어져,http://www.econonews.co.kr/news/articleView.html?idxno=404403,"미래포럼은 글로벌 AI 시장의 트렌드와 변화를 조망하고 SK하이닉스 <b>반도체</b> 기술의 발전 방향을... 두 번째 아젠다 에서는 인공지능 <b>반도체</b> 스타트업 Rebellions 박성현 대표와 KAIST 유회준 교수, 서울대학교 이재욱... ","Fri, 12 Sep 2025 14:18:00 +0900"
2025-09-12 05:21:57,"&quot;오픈AI·엔비디아, 英에 수십억달러 데이터센터 투자 발표 예정&quot;",https://n.news.naver.com/mnews/article/421/0008482918?sid=104,키어 스타머 영국 총리는 지난 1월 데이터센터와 <b>반도체</b> 투자를 통해 AI를 가속화하겠다는 계획을 발표하면서 'AI 성장 구역'을 만들자고 제안하기도 했다. 이는 데이터센터 건설 승인 절차를 신속하게 하고 전력망 접근을... ,"Fri, 12 Sep 2025 14:18:00 +0900"
2025-09-12 05:21:57,라플라스×ETRI 딥테크 투자 포럼 성황리 개최…&quot;온디바이스 AI 기반 혁...,https://www.eroun.net/news/articleView.html?idxno=63053,"지능형 <b>반도체</b> 기술을 적용한 각 기업의 기술력과 시장성을 직접 확인하고, 글로벌 경쟁력을 갖춘 기업들의 투자 유치가 이뤄지기를 기대한다&quot;라고 말했다. 한편, 라플라스×ETRI 딥테크 투자 포럼은 최근 주목받고... ","Fri, 12 Sep 2025 14:16:00 +0900"
2025-09-12 05:21:57,"SK하이닉스, 세계 첫 HBM4 개발…주도권 확보",https://n.news.naver.com/mnews/article/215/0001223662?sid=101,"HBM은 여러 개의 D램을 수직으로 쌓아 올린 차세대 메모리 <b>반도체</b>입니다. AI 칩의 핵심 부품으로, 기존 D램보다 데이터 처리 속도를 크게 높인 것이 특징입니다. SK하이닉스는 &quot;이번 HBM4로 세계 최고 수준의 데이터... ","Fri, 12 Sep 2025 14:14:00 +0900"
2025-09-12 05:21:57,"SK하이닉스, 미래포럼서 차세대 AI 전략 논의",https://www.smarttoday.co.kr/news/articleView.html?idxno=91100,"미래포럼은 글로벌 AI 시장의 트렌드와 변화를 조망하고 SK하이닉스 <b>반도체</b> 기술의 발전 방향을... 두 번째 아젠다 에서는 인공지능 <b>반도체</b> 스타트업 Rebellions 박성현 대표와 KAIST 유회준 교수, 서울대학교... ","Fri, 12 Sep 2025 14:14:00 +0900"
2025-09-12 05:21:57,"포스코이앤씨, '더샵 오산역아크시티' 10월 공급 예정",https://n.news.naver.com/mnews/article/018/0006113719?sid=101,"특히 용인 <b>반도체</b> 국가산업단지 조성에 따른 <b>반도체</b> 메가 클러스터 수혜도 예상된다. 단지 인근에는 이마트 오산점, 롯데마트 오산점, 롯데백화점 동탄점, CGV 오산중앙점 등 편의시설이 가깝고 오산종합운동장... ","Fri, 12 Sep 2025 14:14:00 +0900"
2025-09-12 05:21:57,북미 수출용 방폭기기 인증 기반 마련,https://www.gasnews.com/news/articleView.html?idxno=121742,"최근 <b>반도체</b>, 전기차, 배터리 등의 생산시설이 미국·북미 지역에서 대거 신·증설되고 있으며, 이에 따라 북미 방폭기기 시장 규모는 2024년 약 28억 달러에 달하고, 앞으로도 지속 성장할 것으로 전망된다. 이에 맞춰... ","Fri, 12 Sep 2025 14:14:00 +0900"
2025-09-12 05:21:57,쇠사슬 묶여 구금된 한국인 본 日 화들짝 &quot;비자 확인하라&quot;,https://n.news.naver.com/mnews/article/011/0004532412?sid=104,니혼게이자이신문도 “이번 사태가 일본 기업에 영향을 미칠 수 있다”며 대만 <b>반도체</b> 파운드리 업체 TSMC가 미국 애리조나주에 건설 중인 공장이 숙련 건설·전기 인력 부족으로 차질을 겪은 사례를 거론했다. 또... ,"Fri, 12 Sep 2025 14:13:00 +0900"
2025-09-12 05:21:57,"제7회 한양백남상, KAIST 김정호 교수ㆍ한양대 박수길 명예교수 선정",https://n.news.naver.com/mnews/article/016/0002528340?sid=102,김정호 교수는 우리나라가 세계 최초로 상용화에 성공한 AI <b>반도체</b>의 핵심 기술인 고대역폭메모리(HBM)의 기본 개념과 구조를 창안하고 설계를 통해 정립한 주역이다. 삼성전자와 SK하이닉스 등 국내 <b>반도체</b>... ,"Fri, 12 Sep 2025 14:13:00 +0900"
2025-09-12 05:21:57,"포스코이앤씨, 오산 세교2지구 '더샵 오산역아크시티' 10월 공급",https://www.topstarnews.net/news/articleView.html?idxno=15803267,"특히 용인 <b>반도체</b> 국가산업단지 조성에 따른 <b>반도체</b> 메가 클러스터 수혜도 기대된다. 단지는 세교2지구의 유일한 주상복합용지에 들어서며, 이마트·롯데마트·CGV 등 생활 편의시설과 오산종합운동장, 스포츠센터 등... ","Fri, 12 Sep 2025 14:12:00 +0900"
2025-09-12 05:21:57,[더벨][글로벌 파이낸스 2025]&quot;자산 리밸런싱 추진 통한 수익 기반 견고...,https://www.thebell.co.kr/free/content/ArticleView.asp?key=202509081351238560105911,"올 상반기에는 글로벌 <b>반도체</b> 소재부품업체 및 미국 스포츠용품 회사 인수금융 2건 (각 4억불, 1억불 규모)을 체결했다. 기업은행 해외지점 최초로 인수금융 주선에 성공한 딜로 홍콩 지점에서는 총 1.3억불 규모로... ","Fri, 12 Sep 2025 14:12:00 +0900"
2025-09-12 05:21:57,"펄어비스, AMD와 전략적 파트너십…'붉은사막' 게이밍 경험 강화",https://n.news.naver.com/mnews/article/119/0003002175?sid=105,펄어비스는 미국 <b>반도체</b> 회사 AMD와 전략적 파트너십을 체결했다고 12일 밝혔다. 양사는 오픈월드 액션 어드벤처 '붉은사막'의 최적화된 게이밍 경험과 성공적인 글로벌 론칭을 위해 협력하기로 했다. 이번 파트너십을... ,"Fri, 12 Sep 2025 14:11:00 +0900"
2025-09-12 05:21:57,"플라즈마텍, 환경부 주관 ‘2025 우수환경산업체’ 선정",https://www.sentv.co.kr/article/view/sentv202509120057,"플라즈마텍의 주력사업은 <b>반도체</b>·디스플레이 제조공정에서 발생하는 고농도 미세먼지를 제거하는 습식... “기존의 <b>반도체</b>·디스플레이 집진 설비를 넘어 사업 아이템을 다양화하고, 신규 거래처를 적극 발굴해 친환경... ","Fri, 12 Sep 2025 14:10:00 +0900"
2025-09-12 05:21:57,"UNIST 2026학년 수시 경쟁률 17.03대 1, 역대 최다 지원",https://n.news.naver.com/mnews/article/003/0013478529?sid=102,"특히 삼성전자와 협력해 운영하는 <b>반도체</b>계약학과는 35명 모집에 2468명이 지원, 70.51대 1이라는 치열한... 이어졌다&quot;며 &quot;<b>반도체</b>계약학과 등 산업 수요 맞춤형 학과 운영과 전국 고교 대상 적극적 홍보가 긍정적... ","Fri, 12 Sep 2025 14:10:00 +0900"
2025-09-12 05:21:57,"김동연 “북수원 TV, 삶터·일터·쉼터+통합돌봄 갖춘 전국 최초 단지 될...",https://n.news.naver.com/mnews/article/081/0003574191?sid=102,"이를 위해 AI에 기반을 둔 IT기업과 <b>반도체</b>, 모빌리티, 바이오·헬스케어 연구소 등 미래 산업을 유치해 과천... 리더인 <b>반도체</b>시스템공학과, <b>반도체</b>융합공학과 학생 21명을 만나 <b>반도체</b> 분야 학생들의 진로·일자리... ","Fri, 12 Sep 2025 14:10:00 +0900"
2025-09-12 05:21:57,"김동연 지사, 일자리·주거·여가 한 번에 해결하는 북수원 테크노밸리...",http://www.consumernews.co.kr/news/articleView.html?idxno=740385,"이어 &quot;북수원 테크노밸리는 주거용지, 상업용지 또 업무용지가 한꺼번에 혼합해서 만들어지는 하이브리드 토지 이용의 가장 좋은 예로 바이오와 <b>반도체</b> 등을 포함한 첨단 기업이 유치되고 레저까지 들어가는 단지가... ","Fri, 12 Sep 2025 14:10:00 +0900"
2025-09-12 05:21:57,내수 회복 조짐 속 수출 '희비'…관세 불확실성 여전,https://www.newspim.com/news/view/20250912000730,"다만 <b>반도체</b>, 자동차 등 주력 수출품목에서의 호조는 이어지는 것으로 파악됐다. 12일 기획재정부의 9월... 15대 주력 수출품목 중 <b>반도체</b>(27%), 선박(12%), 자동차(9%) 등이 수출을 이끌었다. 반면 석유제품(-5... ","Fri, 12 Sep 2025 14:09:00 +0900"
2025-09-12 05:21:57,"SK에코, AI 혁신기술 찾는다 … '콘테크 미트업 데이'",https://biz.newdaily.co.kr/site/data/html/2025/09/12/2025091200132.html,"뉴데일리 나광국 기자 = SK에코플랜트는 인공지능(AI)·로봇·<b>반도체</b> 혁신기술 및 솔루션 오픈 이노베이션... AI·로봇·<b>반도체</b> 분야의 혁신기술을 보유한 기업을 발굴하고 공동연구개발, 자금지원 연계를 통해... ","Fri, 12 Sep 2025 14:08:00 +0900"
2025-09-12 05:21:57,"펄어비스-AMD, '붉은사막' 게이밍 경험 강화 위해 '맞손'",https://www.pinpointnews.co.kr/news/articleView.html?idxno=376283,"사진=펄어비스 펄어비스는 미국 <b>반도체</b> 기업 AMD와 전략적 파트너십을 체결하고, 신작 '붉은사막' 게이밍 경험 최적화에 나선다고 12일 밝혔다. 이번 파트너십을 통해 양사는 AMD의 최신 CPU와 GPU(그래픽처리장치)를... ","Fri, 12 Sep 2025 14:08:00 +0900"
2025-09-12 05:21:57,"알리바바·바이두, 자체 AI 칩으로 모델 훈련 본격화",https://www.topstarnews.net/news/articleView.html?idxno=15803259,중국 기술기업 알리바바와 바이두가 자사 설계로 만든 <b>반도체</b> 칩을 활용해 인공지능(AI) 모델 훈련을... 이번 행보는 그동안 엔비디아 칩에 크게 의존해온 중국 기술업계에서 자립형 AI <b>반도체</b> 생태계 구축을 의미하는... ,"Fri, 12 Sep 2025 14:08:00 +0900"
2025-09-12 05:21:57,"코아시아세미, 지역 기반 AI <b>반도체</b> 생태계 확산 나서",https://www.newspim.com/news/view/20250912000726,코아시아의 자회사인 시스템 <b>반도체</b> 설계 전문기업 코아시아세미(대표이사 신동수)가 광주광역시와 함께 AI(인공지능) <b>반도체</b> 생태계 확산에 나섰다. 이번 광주시와의 협약은 11일에 열린 '모두의 AI 광주' 비전... ,"Fri, 12 Sep 2025 14:07:00 +0900"
2025-09-12 05:21:57,"UNIST, 2026학년도 수시 경쟁률 17.03대 1…<b>반도체</b>학과 70대 1",https://n.news.naver.com/mnews/article/421/0008482888?sid=102,"특히 삼성전자와 협력해 운영하는 <b>반도체</b>계약학과는 35명 모집에 2468명이 지원, 70.51대 1이라는 치열한 경쟁률을 보였다. 수시모집 4개 전형 중 가장 높은 경쟁률을 보인 것은 고른기회전형이다. 40명 모집에... ","Fri, 12 Sep 2025 14:07:00 +0900"
2025-09-12 05:21:57,건설업·수출 부진 속 정부는 &quot;소비쿠폰발 경기회복 신호 세져&quot;,https://n.news.naver.com/mnews/article/014/0005405959?sid=101,"8월 수출은 <b>반도체</b> 호조 등에 힘입어 전년 동월 대비 1.3% 증가했지만, 증가율 자체는 7월(5.8%)보다 크게 낮아졌다. 조 과장은 &quot;수출과 관련한 불확실성이 남아 있어 긍정적으로 표현하지 못하지만, 데이터를 보면 당초... ","Fri, 12 Sep 2025 14:06:00 +0900"
2025-09-12 05:21:57,"경기도 김동연 지사, 북수원 테크노밸리 'AI 기반 자족형 15분 도시' 비전...",http://www.metroseoul.co.kr/article/20250912500185,"AI·<b>반도체</b>·바이오 분야 기업 관계자, 돌봄·의료 전문가, 지역 주민 등 약 60여 명과 함께 계획을 공유했다.... 이를 위해 AI 기반 IT기업, <b>반도체</b>, 모빌리티, 바이오·헬스케어 연구소 등 미래 산업을 유치하고, 과천... ","Fri, 12 Sep 2025 14:06:00 +0900"
2025-09-12 05:21:57,"코스피, 외국인·기관 '쌍끌이 매수'…3390선도 터치",https://n.news.naver.com/mnews/article/018/0006113713?sid=101,적극적인 <b>반도체</b> 순매수에 또다시 코스피가 신고가를 경신했다”고 전했다. 코스피 업종별로는 상승... 특히 SK하이닉스가 세계 최초로 HBM4를 개발했다는 소식에 <b>반도체</b> 주가 강세를 보이고 있는 것으로... ,"Fri, 12 Sep 2025 14:06:00 +0900"
2025-09-12 05:21:57,"램리서치, 첨단 패키징용 증착 장비 '벡터 테오스 3D' 개발",https://n.news.naver.com/mnews/article/030/0003349901?sid=105,램리서치는 첨단 <b>반도체</b> 패키징을 위한 신규 증착장비 '벡터 테오스 3D'를 개발했다고 12일 밝혔다. 신제품은 인공지능(AI) 및 고성능컴퓨팅(HPC)용 <b>반도체</b> 칩 제조를 위한 장비다. 서로 다른 <b>반도체</b>를 연결하는 '이종집적'과... ,"Fri, 12 Sep 2025 14:06:00 +0900"
2025-09-12 05:21:57,"<b>반도체</b> 훈풍 이어진다... 삼성전자·SK하이닉스, 나란히 신고가 [특징주...",https://n.news.naver.com/mnews/article/014/0005405960?sid=101,간밤 뉴욕증시에서 주요 기술주로 구성된 필라델피아<b>반도체</b>지수가 6거래일 연속 상승세를 이어간 영향이 국내 <b>반도체</b>주에도 훈풍으로 작용했다. 또한 미국의 기준금리 인하 기대가 이어지면서 투자 심리가... ,"Fri, 12 Sep 2025 14:06:00 +0900"
2025-09-12 05:21:57,"한국탄소나노산업협회, 첨단 나노소재 석·박사 교육",https://n.news.naver.com/mnews/article/030/0003349899?sid=105,"공동연구개발기관인 세종대 나노신소재공학과, 성균관대 나노과학기술학과, 한림대 <b>반도체</b>디스플레이스쿨 석·박사 과정 학생들을 대상으로 진행됐다. 6월 한국재료연구원에서 진행된 '역량강화 실습프로그램'에는 석... ","Fri, 12 Sep 2025 14:03:00 +0900"
2025-09-12 05:21:57,"펄어비스, AMD와 '붉은사막' 최적화 협력 글로벌 파트너십",http://www.koreastocknews.com/news/articleView.html?idxno=113943,펄어비스가 글로벌 <b>반도체</b> 기업 AMD와 전략적 파트너십을 체결했다. 오픈월드 액션 어드벤처 게임 '붉은사막'의 최적화된 게이밍 경험 제공과 글로벌 동시 출시가 목표다. 양사는 AMD의 최신 CPU·GPU 기술을... ,"Fri, 12 Sep 2025 14:02:00 +0900"
2025-09-12 05:21:57,"서울공대 전기·정보공학부 이철호 교수팀, 차세대 2D <b>반도체</b> 기술 '게이...",https://edu.donga.com/news/articleView.html?idxno=95091,서울대학교 공과대학은 전기·정보공학부 이철호 교수 연구팀이 차세대 <b>반도체</b> 소자로 주목받고 있는... 이번 연구 결과는 <b>반도체</b> 기술 발전을 선도하는 최고 권위의 국제 학술지 '네이처 일렉트로닉스(Nature Electronics... ,"Fri, 12 Sep 2025 14:02:00 +0900"
2025-09-12 05:21:57,정부 &quot;경기 회복에 긍정적 신호 강화...수출은 둔화 우려&quot;,http://www.efnews.co.kr/news/articleView.html?idxno=123239,"8월 수출은 <b>반도체</b> 호조 등으로 전년동월 대비 1.3% 증가했다. 일평균 수출액은 8월 26억달러로 전년동월 대비 5.8% 증가했다. 8월 소비자심리CSI는 111.4로 전월비 +0.6p 상승했고, 기업심리 실적(전산업 CBSI 91.0·전월비 +1.... ","Fri, 12 Sep 2025 14:02:00 +0900"
2025-09-12 05:21:57,"제7회 한양백남상, 김정호 KAIST 교수·박수길 한양대 명예교수 선정",https://n.news.naver.com/mnews/article/030/0003349897?sid=105,"삼성전자·SK하이닉스 등 국내 <b>반도체</b> 산업의 성장을 견인했으며, AI <b>반도체</b> 분야에서 세계적 석학으로 평가받는다. 김 교수는 '차세대 HBM 로드맵(HBM4~HBM8)'을 제시, 국제 표준화 주도 및 기술 주도권 확보에도... ","Fri, 12 Sep 2025 14:02:00 +0900"
2025-09-12 05:21:57,"“겉으론 회복·성장, 실제론 민생 몰락”…李정부 취임 100일에 자료집...",https://www.yeongnam.com/web/view.php?key=20250912021555555,"보고서는 한미정상회담을 &quot;외교적 선언만 있고 실익은 없는 대미외교&quot;라고 평가하며, 확장억제 강화는 선언적 수준에 그쳤고 IRA·<b>반도체</b>법 등 경제 현안은 미해결 상태라고 지적했다. 또한 대중·대러 외교는 &quot;전략... ","Fri, 12 Sep 2025 14:02:00 +0900"
2025-09-12 05:21:57,"포스코이앤씨, '더샵 오산역아크시티' 10월 공급 예정",https://www.startuptoday.co.kr/news/articleView.html?idxno=507953,"특히 용인 <b>반도체</b> 국가산업단지 조성에 따른 <b>반도체</b> 메가 클러스터 수혜도 예상된다. 단지는 세교2지구의 유일한 주상복합용지에 들어서 원스톱 라이프를 누릴 수 있다. 이마트 오산점, 롯데마트 오산점, 롯데백화점... ","Fri, 12 Sep 2025 14:02:00 +0900"
2025-09-12 05:21:57,"포스코이앤씨, '더샵 오산역아크시티' 10월 공급 예정",http://www.newsdream.kr/news/articleView.html?idxno=94816,"특히 용인 <b>반도체</b> 국가산업단지 조성에 따른 <b>반도체</b> 메가 클러스터 수혜도 예상된다. 단지는 세교2지구의 유일한 주상복합용지에 들어서 원스톱 라이프를 누릴 수 있다. 이마트 오산점, 롯데마트 오산점, 롯데백화점... ","Fri, 12 Sep 2025 14:00:00 +0900"
2025-09-12 05:21:57,&quot;역시나 역시네&quot;…시총 1·2위 나란히 '신고가',https://n.news.naver.com/mnews/article/215/0001223659?sid=101,"채민숙 한국투자증권 연구원은 10일 보고서에서 HBM과 디램, 낸드 ASP 및 실적 추정치 상향을 바탕으로 SK하이닉스의 목표주가를 41만원으로 5% 상향 조정하고, <b>반도체</b> 섹터 내 최선호주 의견을 유지했다.","Fri, 12 Sep 2025 13:58:00 +0900"
2025-09-12 05:21:57,"<b>반도체</b> 전쟁의 보이지 않는 무기, 세계에서 가장 순수한 물 만드는 한국...",https://n.news.naver.com/mnews/article/023/0003928837?sid=103,초순수 설비 기업 지앤지인텍 세계는 <b>반도체</b> 전쟁 중이다. 국가 <b>반도체</b> 산업 경쟁력은 삼성이나 하이닉스 같은 일부 제조업체만 잘한다고 완성되지 않는다. 수많은 전후방 관련 업체들이 촘촘히 연결돼 총체적인... ,"Fri, 12 Sep 2025 13:57:00 +0900"
2025-09-12 05:21:57,김동연 &quot;북수원 테크노밸리 2029년 완공 목표…교통 요지될 것&quot;,https://www.joongboo.com/news/articleView.html?idxno=363703233,"이를 위해 AI에 기반을 둔 IT기업과 <b>반도체</b>, 모빌리티, 바이오·헬스케어 연구소 등 미래 산업을 유치해 과천... 이 자리에는 김승원 국회의원, 남경순·박옥분 도의원, AI·<b>반도체</b>·바이오 분야 기업관계자 및 돌봄의료... ","Fri, 12 Sep 2025 13:56:00 +0900"
2025-09-12 05:21:57,"SK하이닉스, AI 시대 기술 난제 해결할 HBM4 세계 최초 양산",http://www.newsroad.co.kr/news/articleView.html?idxno=45634,"또한, 국제<b>반도체</b>표준협의기구 JEDEC의 HBM4 표준 동작 속도인 8Gbps를 뛰어넘는 10Gbps 이상의 동작 속도를 구현했다. SK하이닉스는 HBM4 개발을 위해 자체 어드밴스드 MR-MUF 공정과 10나노급 5세대 D램 기술을 적용, 양산... ","Fri, 12 Sep 2025 13:56:00 +0900"
2025-09-12 05:21:57,"씨이랩-업스테이지, LLM 기반 멀티모달 AI 어플라이언스 상용화 협력",https://n.news.naver.com/mnews/article/092/0002390197?sid=105,"또 씨이랩의 AI 영상분석 플랫폼 ‘엑스아이바(XAIVA)’에 업스테이지의 한국어 특화 모델을 결합해 <b>반도체</b>·바이오·제조 등 산업별 맞춤형 솔루션을 제공한다. 여기에 씨이랩의 모델 경량화 기술을 적용, 저사양... ","Fri, 12 Sep 2025 13:54:00 +0900"
2025-09-12 05:21:57,'기업이 설계하고 학생이 완성한다'…대구대 AI·SW 혁신 교육,https://n.news.naver.com/mnews/article/088/0000969806?sid=102,"모빌리티, <b>반도체</b>) 분야 실무 교육을 통해 산업 현장에 바로 적용 가능한 역량을 키운다. 올해는 네이버 클라우드와의 협약으로 '네이버 클라우드 아카데미(Naver Cloud Academy)'를 교내에 개소했다. 이를 통해 재학생뿐... ","Fri, 12 Sep 2025 13:54:00 +0900"
2025-09-12 05:21:57,"에프앤가이드 지수 추종 ETF, 순자산 25조원 돌파",https://n.news.naver.com/mnews/article/008/0005249652?sid=101,"지난 달는 신한자산운용의 'SOL 한국원자력SMR'과 KB자산운용의 'RISE AI<b>반도체</b>TOP10' ETF가 신규 상장되며 상품 다양성과 투자자 선택권 확대에 기여했다. 두 상품은 9월 들어 각각 43%, 11%의 순자산총액 증가율을... ","Fri, 12 Sep 2025 13:53:00 +0900"
2025-09-12 05:21:57,"SK하이닉스, 세계 최초 HBM4 양산..기술 리더십 공고화",http://www.00news.co.kr/news/articleView.html?idxno=97319,"회사는 또 이 제품에 10Gbps(초당 10기가비트) 이상의 동작 속도를 구현해, HBM4의 JEDEC(국제<b>반도체</b>표준협의기구) 표준 동작 속도인 8Gbps를 크게 뛰어 넘었다. JEDEC는 <b>반도체</b> 기기의 규격을 규정하는 <b>반도체</b> 분야... ","Fri, 12 Sep 2025 13:52:00 +0900"
2025-09-12 05:21:57,"SK에코플랜트, AI∙로봇∙<b>반도체</b> 공모전 개최",https://www.meconomynews.com/news/articleView.html?idxno=119861,"사진=SK에코플랜트 SK에코플랜트는 지난 1일부터 AI∙로봇∙<b>반도체</b> 혁신기술 및 솔루션 오픈 이노베이션... AI·로봇·<b>반도체</b> 분야의 혁신기술을 보유한 기업을 발굴하고 공동연구개발, 자금지원 연계를 통해 사업화까지... ","Fri, 12 Sep 2025 13:52:00 +0900"
2025-09-12 05:21:57,"김동연, 경기북수원 테크노밸리 마스터플랜 현장설명회...&quot;AI가 열어가는...",http://www.newsroad.co.kr/news/articleView.html?idxno=45629,"이 자리에는 김승원 국회의원, 남경순·박옥분 도의원, AI·<b>반도체</b>·바이오 분야 기업관계자 및 돌봄의료... 이를 위해 AI에 기반을 둔 IT기업과 <b>반도체</b>, 모빌리티, 바이오·헬스케어 연구소 등 미래 산업을 유치해 과천... ","Fri, 12 Sep 2025 13:52:00 +0900"
2025-09-12 05:21:57,"공급망 위기, ‘K-소재’ 독립으로 정면 돌파… 존재감 드러내는 한국 ...",https://n.news.naver.com/mnews/article/018/0006113708?sid=101,"최근 미·중 갈등은 <b>반도체</b>와 핵심 광물을 둘러싸고 무역 장벽을 높이며 전 세계 산업에 영향을 주고 있다. 중국이 <b>반도체</b>와 전기차에 필요한 갈륨·게르마늄의 수출을 통제하자, 미국은 첨단 <b>반도체</b> 기술과 장비 수출을... ","Fri, 12 Sep 2025 13:51:00 +0900"
