DateTime,Title,Link,Description,PubDate
2026-02-03 23:46:17,"쏘닉스, 中 뉴소닉과 파운드리 공급계약",https://n.news.naver.com/mnews/article/018/0006212793?sid=101,"이미 쏘닉스는 글로벌 주식시장에서 최상위권 밸류에이션을 보유한 북미 지역 통신<b>반도체</b> 선도 기업인 고객사를 통해 대량 양산·공급중이며, 적용 제품의 확대를 위한 추가 실사를 진행중이다. 또한, 해당... ","Wed, 04 Feb 2026 08:45:00 +0900"
2026-02-03 23:46:17,"한투證 &quot;삼성전기, 日 경쟁사 실적으로 더 공고해진 개선세&quot;",https://n.news.naver.com/mnews/article/421/0008752101?sid=101,"<b>반도체</b> 패키지 기판 경쟁사인 일본 이비덴의 3분기 영업이익은 120억 엔으로 시장 기대치를 소폭 하회했지만, FC-BGA 등이 포함된 전자 부문 매출액은 계절적 비수기임에도 전년 동기 대비 23.8% 증가했다. 박... ","Wed, 04 Feb 2026 08:44:00 +0900"
2026-02-03 23:46:17,"이상일 용인특례시장, 설 앞두고 군부대·소방서 위문 방문",http://www.econonews.co.kr/news/articleView.html?idxno=426139,이 시장은 최근 용인에서 진행 중인 1000조 원 투자 규모의 초대형 <b>반도체</b> 클러스터와 관련한 지방 이전... 용인 <b>반도체</b> 클러스터의 출발점이라고 할 수 있다&quot;며 &quot;삼성이 빠르게 결단해서 일주일 만에 용인에 투자하기로... ,"Wed, 04 Feb 2026 08:44:00 +0900"
2026-02-03 23:46:17,"하나금융, 생산적금융 실행력 강화 시동…One-IB 포럼 열고 KPI 개편",http://www.seoulwire.com/news/articleView.html?idxno=704978,하나증권 리서치센터는 One-IB 체계 개편 방향과 함께 <b>반도체</b>를 국가 안보와 AI 인프라의 핵심 자산으로 규정하고 글로벌 업황 전망과 공급 전략을 공유했다. 그룹은 생산적금융 지원을 위한 조직 체계도 정비했다.... ,"Wed, 04 Feb 2026 08:44:00 +0900"
2026-02-03 23:46:17,"하나금융, 2030년까지 생산적금융 84조원 투입…AI·<b>반도체</b> 지원 '속도'",https://n.news.naver.com/mnews/article/030/0003396142?sid=101,"하나금융그룹이 인공지능(AI)과 <b>반도체</b> 등 국가 첨단 전략 산업을 지원하기 위해 2030년까지 84조원 규모의... 하나증권 리서치센터는 <b>반도체</b>를 국가 안보와 인공지능(AI) 인프라 핵심 자산으로 규정하고, 글로벌 업황... ","Wed, 04 Feb 2026 08:44:00 +0900"
2026-02-03 23:46:17,뉴욕증시 하락 마감…월마트 시총 1조달러 돌파,https://n.news.naver.com/mnews/article/422/0000830077?sid=104,인공지능과 <b>반도체</b> 관련주 투매가 하락세를 이끈 것으로 분석됩니다. 반면 미국 최대 유통업체인 월마트는 성장주와 경기방어주 성격이 동시에 부각되면서 사상 처음으로 시가총액 1조달러를 돌파했습니다.... ,"Wed, 04 Feb 2026 08:44:00 +0900"
2026-02-03 23:46:17,"청주시, SK하이닉스 첨단 패키징 공장 'P&amp;T7' 건축허가",https://n.news.naver.com/mnews/article/001/0015883740?sid=105,<b>반도체</b> 칩을 제품 형태로 완성하고 품질을 최종 검증하는 P&amp;T7은 6개 동(연면적 29만7천여㎡)으로 건립된다. SK하이닉스는 내년 말까지 공사를 완료할 계획이다. 청주시 관계자는 &quot;건축허가 신청 접수 후 4주 만에 신속히... ,"Wed, 04 Feb 2026 08:44:00 +0900"
2026-02-03 23:46:17,"TEL코리아, 세미콘코리아에서 최대 규모 부스 꾸린다",https://www.econovill.com/news/articleView.html?idxno=728286,도쿄일렉트론코리아는 미래 혁신의 중심이 될 <b>반도체</b> 기술이 시작되는 출발점을 의미하는 '모든 시작의... 기술 존에서는 스마트 테이블을 활용해 복잡한 <b>반도체</b> 제조 공정을 직관적으로 이해할 수 있는 체험공간을... ,"Wed, 04 Feb 2026 08:44:00 +0900"
2026-02-03 23:46:17,트럼프 관세에도 美 제조업 후퇴…“황금기? 아직 멀었다”,https://n.news.naver.com/mnews/article/016/0002595506?sid=104,"미 인구조사국은 바이든 행정부 시절 <b>반도체</b>·신재생에너지 투자로 급증했던 제조업 건설 지출이 트럼프... 트럼프 행정부는 일본·한국 등 동맹국으로부터 대규모 미국 투자 약속을 이끌어내고, 애플·<b>반도체</b>·제약... ","Wed, 04 Feb 2026 08:43:00 +0900"
2026-02-03 23:46:17,"AMD, 매출 가이던스 '높은 기대' 충족 실패…시간외서 주가 6% 급락",https://news.einfomax.co.kr/news/articleView.html?idxno=4397122,최진우 특파원 = 미국 <b>반도체</b>업체 AMD(NAS:AMD)가 시장 예상보다 높은 올해 1분기(1~3월) 실적을 전망했음에도 시간외 거래에서 주가는 급락했다. AMD연합뉴스 자료사진 ADM는 3일(현지시간) 뉴욕증시 마감 후 실적... ,"Wed, 04 Feb 2026 08:42:00 +0900"
2026-02-03 23:46:17,"&quot;산업을 알아야 기업을 돕는다&quot;…하나금융, 84조 생산적 금융 '속도전'",https://www.thefairnews.co.kr/news/articleView.html?idxno=68818,"이날 포럼에서는 하나금융연구소와 하나증권 리서치센터가 분석한 에너지, 방위산업, 화학, <b>반도체</b> 등 핵심 산업군에 대한 투자 기회와 대응 전략이 심도 있게 논의됐다. 특히 AI 산업 확산에 따른 전력 수요 급증 대응과... ","Wed, 04 Feb 2026 08:42:00 +0900"
2026-02-03 23:46:17,[증시전망대] 기술주 하락세에 코스피 숨고르기,http://www.newsroad.co.kr/news/articleView.html?idxno=53818,"뉴욕증시에서는 AI와 소프트웨어, <b>반도체</b> 관련주 중심으로 매도세가 나타났다. 특히, 생성형 AI 도구들이... 서상영 미래에셋증권 연구원은 소프트웨어 기업의 수요 감소가 클라우드 기업의 인프라 투자 축소와 <b>반도체</b> 칩... ","Wed, 04 Feb 2026 08:42:00 +0900"
2026-02-03 23:46:17,日 노무라 펀드 “한국 비중 높게 가져가…삼성물산 SK하이닉스 등 관심...,https://www.theguru.co.kr/news/article.html?no=97684,메모리 <b>반도체</b>의 폭발적인 수요 증가와 공급 부족이 맞물리면서 이른바 '메모리 슈퍼 사이클'이 나타났다... 첨단 <b>반도체</b> 제조를 선도하는 기업이 이 성장 기회에서 더 큰 부가가치를 실현할 수 있을 것&quot;이라고... ,"Wed, 04 Feb 2026 08:42:00 +0900"
2026-02-03 23:46:17,프리마켓서 삼전·하닉 2%대 하락…급등 후 차익매물 출회,https://n.news.naver.com/mnews/article/421/0008752094?sid=101,국내 증시가 전날 급등한 가운데 4일 넥스트레이드 프리마켓에선 차익실현 매물 출회로 <b>반도체</b>주... 시가총액 대형주 중에서는 <b>반도체</b>주 위주로 주가가 하락 중이다. 삼성전자(005930)는 전일 대비 3600원(2.15... ,"Wed, 04 Feb 2026 08:42:00 +0900"
2026-02-03 23:46:17,"'딥테크' 베테랑 전면 배치…에이티넘, 3인 각자대표 체제 시동",https://www.smarttoday.co.kr/ko-kr/articles/102744,<b>반도체</b> IP 기업 오픈엣지테크놀로지와 <b>반도체</b> 소재 부품 기업 비씨엔씨 등 기술 난도가 높은 소부장 기업을 발굴해 상장(IPO)까지 이끌며 잭팟을 터뜨렸다. 기술적 해자가 확실한 기업을 선별하는 그의 안목이 입증된... ,"Wed, 04 Feb 2026 08:42:00 +0900"
2026-02-03 23:46:17,"한투운용, 대표지수·AI·원자력 등 국내주식형 ETF 6종 제시",https://www.etoday.co.kr/news/view/2552791,"이번에 제시한 상품은 ACE 200 ETF, ACE 코스닥150 ETF, ACE AI<b>반도체</b>포커스 ETF, ACE 원자력TOP10 ETF, ACE KPOP포커스 ETF, ACE 고배당주 ETF다. 최근 국내 증시는 <b>반도체</b> 업황 개선과 인공지능(AI) 투자 확대를 계기로 기업... ","Wed, 04 Feb 2026 08:42:00 +0900"
2026-02-03 23:46:17,AMD에 투자자 실망...&quot;더 강한 실적 전망 필요&quot;,https://n.news.naver.com/mnews/article/015/0005246475?sid=101,"AI <b>반도체</b> 호황에 따라 AMD가 더욱 공격적인 가이던스를 내놓을 것으로 기대했는데, 투자자들이 실망했다는 얘기다. AMD는 지난해 4분기(10∼12월) 매출이 전년 동기 대비 34% 증가한 102억7000만달러(약 14조9000억원)를... ","Wed, 04 Feb 2026 08:41:00 +0900"
2026-02-03 23:46:17,구윤철 부총리 “우리 기업 AI 주도권 확보하도록 정부 총력 지원”,https://n.news.naver.com/mnews/article/366/0001140356?sid=101,구윤철 부총리 겸 재정경제부 장관이 “우리 기업들이 인공지능(AI)·<b>반도체</b> 등 첨단 산업 분야에서 주도권을 확보할 수 있도록 총력 지원하겠다”고 했다. 구 부총리는 4일 경제관계장관회의 겸 성장전략 태스크포스... ,"Wed, 04 Feb 2026 08:41:00 +0900"
2026-02-03 23:46:17,"용인특례시, 초대형 <b>반도체</b> 프로젝트 맞춰 인프라 확충 ‘전면 가속’",https://n.news.naver.com/mnews/article/029/0003008921?sid=102,"초대형 <b>반도체</b> 프로젝트에 발맞춰 도시 인프라 확충과 시민 삶의 질을 높이는 생활밀착형 행정에 본격적인... 이를 위해 시는 지난 2일 처인구청 대회의실에서 이상일 시장 주재로 현장 간부 공무원 회의를 열고, <b>반도체</b>... ","Wed, 04 Feb 2026 08:41:00 +0900"
2026-02-03 23:46:17,구윤철 &quot;AI 혁명 너무 빨라 현기증 날 정도…첨단분야 총력 지원&quot;,https://news.einfomax.co.kr/news/articleView.html?idxno=4397121,"구 부총리는 4일 정부서울청사에서 열린 '경제관계장관회의 겸 성장전략 태스크포스(TF)'에서 &quot;정부는 우리 기업이 <b>반도체</b>, AI 등 첨단산업 분야에서 주도권을 확보할 수 있도록 총력 지원할 것&quot;이라며 이같이 밝혔다.... ","Wed, 04 Feb 2026 08:40:00 +0900"
2026-02-03 23:46:17,"용인특례시 노사민정협의회, 2026년 1차 본협의회 개최",http://www.m-i.kr/news/articleView.html?idxno=1333295,"이상일 시장은 &quot;용인의 인구가 계속 늘어나고, 초대형 <b>반도체</b> 프로젝트가 진행되며 <b>반도체</b> 관련 기업들이 속속 입주하면서 공사가 많이 진행되고 있어 사업이 원활히 추진되려면 노사가 원만하게 협의‧협력해서 사업이... ","Wed, 04 Feb 2026 08:40:00 +0900"
2026-02-03 23:46:17,"닌텐도 스위치2, 작년 1,700만대 '대박'. 삼성·SK하이닉스도 재미 짭짤",https://www.autodaily.co.kr/news/articleView.html?idxno=541334,"시장 예상치를 크게 웃도는 실적으로, 스위치2의 폭발적인 인기와 함께 관련 <b>반도체</b> 공급사들도... <b>반도체</b> 메모리 분야에서도 SK하이닉스가 스위치2 관련 수혜를 보고 있다. SK하이닉스는 스위치2에 탑재되는 12GB... ","Wed, 04 Feb 2026 08:38:00 +0900"
2026-02-03 23:46:17,"&quot;칩스앤미디어, 라이선스 누적 효과 본격화…로열티 매출 성장 전환 기...",https://www.newspim.com/news/view/20260204000093,"차량용 <b>반도체</b>, AI 엣지 디바이스 등 다양한 응용처에 비디오 코덱 IP를 공급하고 있다. 특히 자동차와 AI 엣지 분야에서 신규 고객사 확보가 이어지며 장기 로열티 기반이 확대되고 있다는 평가다. 차량용 <b>반도체</b>의 경우... ","Wed, 04 Feb 2026 08:38:00 +0900"
2026-02-03 23:46:17,[AI MY 뉴스] 4일 중국증시 '국내외 이슈 반영한 단계별 투자전략',https://www.newspim.com/news/view/20260204000062,"이는 농업 관련주, 신에너지 기업, <b>반도체</b> 자급화 관련 종목들에 긍정적 신호가 될 수 있다. 특히 중국의 에너지 안보 강화 정책은 태양광, 풍력, 원자력 관련 기업들에 호재다. * 금일 주목할 이슈 : [중국증시 데일리... ","Wed, 04 Feb 2026 08:36:00 +0900"
2026-02-03 23:46:17,성장 상방 리스크 커진 한은…한국證 “2월도 기준금리 2.50% 동결 가능성...,https://www.etoday.co.kr/news/view/2552786,"불균형, <b>반도체</b> 경기 등을 근거로 기준금리를 연 2.50%로 동결한 가운데, 2월에도 동결 기조가 이어질 수... 0% 수준) 상향하는 수준에 그칠 수 있다”며 “내수 회복이 여전히 더디고 <b>반도체</b> 경기가 성장에 미치는 고용... ","Wed, 04 Feb 2026 08:36:00 +0900"
2026-02-03 23:46:17,"[금융로드] 하나금융그룹, 생산적 금융 강화 위해 대대적 개편",http://www.newsroad.co.kr/news/articleView.html?idxno=53816,"이번 포럼은 올해 1월 '생산적금융협의회'에 이은 후속 조치로, 에너지, 방위산업, 화학, <b>반도체</b> 등 핵심... <b>반도체</b>를 국가 안보와 AI 인프라의 핵심 자산으로 규정하고, 글로벌 <b>반도체</b> 업황 전망 및 공급 계획을 공유하며... ","Wed, 04 Feb 2026 08:36:00 +0900"
2026-02-03 23:46:17,구윤철 “AI는 신대륙…경제·사회 전반으로 확산해야”,https://n.news.naver.com/mnews/article/011/0004586384?sid=101,그는 이를 위해 정부가 <b>반도체</b>와 AI 등 첨단 산업 분야에서 우리 기업들이 주도권을 확보할 수 있도록 총력 지원하겠다고 밝혔다. 동시에 “경제와 사회의 구석구석까지 AI와 기술 혁신이 뿌리내릴 수 있도록 시스템을... ,"Wed, 04 Feb 2026 08:36:00 +0900"
2026-02-03 23:46:17,&quot;나스닥·M7지수 급락은 칩플레이션 탓…한국증시 안전 지대&quot;,https://news.einfomax.co.kr/news/articleView.html?idxno=4397119,"대만·일본 등 투자 대안 &quot;AI기업 <b>반도체</b> 비용 증가, 연준 금리 인하 빨라질 것&quot; 글로벌 빅테크를 상징하는 '매그니피센트7'(M7) 종목들의 주가가 부진한 배경으로 <b>반도체</b> 가격 급등에 따른 비용 부담이 지목된다. 이에... ","Wed, 04 Feb 2026 08:36:00 +0900"
2026-02-03 23:46:17,하나금융그룹 생산적금융 실행력 강화 본격화... Hana One-IB 마켓포럼 개...,http://www.econonews.co.kr/news/articleView.html?idxno=426136,이어 하나증권 리서치센터는 증권을 중심으로 그룹 IB 실행체계를 개편한 One-IB 취지 및 추진 전략에 대한 소개와 함께 <b>반도체</b>를 국가 안보와 AI 인프라의 핵심 자산으로 규정하고 글로벌 <b>반도체</b> 업황 전망 및 공급 계획을... ,"Wed, 04 Feb 2026 08:36:00 +0900"
2026-02-03 23:46:17,뉴욕증시 급변동…기술주 투매 속 혼조 마감,https://sateconomy.co.kr/news/view/1065569486906102,"인공지능(AI)과 <b>반도체</b>주를 중심으로 고점 부담에 따른 매물이 쏟아진 가운데, 월마트는 경기방어주와... 이날 하락을 주도한 것은 AI와 <b>반도체</b> 관련주였다. 필라델피아 <b>반도체</b>지수는 장중 -4.16%까지 급락한 뒤 -2.07%로... ","Wed, 04 Feb 2026 08:36:00 +0900"
2026-02-03 23:46:17,"부산시, 대학·산업 상생 모델 '부산형 라이즈' 성과 공유",https://www.newspim.com/news/view/20260204000048,"기장 <b>반도체</b> 소부장단지 내 개소한 '필드캠퍼스'는 교육과 산업, 고용, 정주가 연계된 전국 최초의 혁신 사례로 주목받았다. 산업혁신 부문에서는 2100여 개 기업과 상시 협력체계를 구축해 기술개발과 공동연구를... ","Wed, 04 Feb 2026 08:35:00 +0900"
2026-02-03 23:46:17,&quot;美 증시 약세에 국내 증시 숨 고르기…AI 수익성 우려 속 차익실현 경...,https://www.newspim.com/news/view/20260204000076,"이 연구원은 &quot;하이퍼스케일러·소프트웨어·하드웨어 전반에서 <b>반도체</b>를 제외한 AI 수익성 문제는 1분기... 연초 이후 코스피와 코스닥은 각각 25.4%, 23.6% 상승해 주요국 대비 높은 수익률을 기록 중이며, 이는 <b>반도체</b>... ","Wed, 04 Feb 2026 08:35:00 +0900"
2026-02-03 23:46:17,[서학개미 브리핑] 지난달 미 주식 10조 원 순매수 매수 규모 3배 급증,https://n.news.naver.com/mnews/article/374/0000490573?sid=101,"또한, 서학개미들은 <b>반도체</b>와 테슬라를 넘어, '은'이라는 원자재 시장에 몸을 던졌습니다. 지난주 은 가격이... 마이크로소프트와 메타가 AI투자 비용은 늘리면서도 수익 전망은 불투명하게 내놓자, <b>반도체</b> 업황 전체에... ","Wed, 04 Feb 2026 08:35:00 +0900"
2026-02-03 23:46:17,"인텔 CEO, GPU 시장 진출 선언…&quot;1.4나노 파운드리에 고객 관심&quot;",https://www.tfmedia.co.kr/news/article.html?no=201122,&quot;화웨이 공격적 영입에 '충격'…AI 산업 병목은 메모리&quot;  미국의 <b>반도체</b> 제조사 인텔이 엔비디아가... 엔비디아를 비롯한 주요 AI 칩 제조사들은 지금까지 주로 대만 파운드리(<b>반도체</b> 위탁생산) 업체 TSMC에 생산을... ,"Wed, 04 Feb 2026 08:34:00 +0900"
2026-02-03 23:46:17,부산형 라이즈 동행포럼… '국가 균형발전 선도모델 도약',https://www.joongdo.co.kr/web/view.php?key=20260204010001316,"시는 기업 수요에 기반한 맞춤형 인재를 연간 2만 5000여 명 양성했으며, 특히 기장 <b>반도체</b> 소부장단지에 개소한 '필드캠퍼스'는 전국 최초의 현장 밀착형 교육 모델로 주목받았다. 또한 지역 대학들은 2125개 기업과... ","Wed, 04 Feb 2026 08:34:00 +0900"
2026-02-03 23:46:17,구윤철 &quot;AI 신대륙 탐사…시스템 새롭게 바꿔가겠다&quot;,https://n.news.naver.com/mnews/article/001/0015883724?sid=101,"구 부총리는 &quot;우리는 급속도로 진행되는 'AI 혁명의 시대'에 살고 있고, 그 속도가 너무 빨라 현기증이 날 정도&quot;라며 &quot;정부는 우리 기업들이 <b>반도체</b>·AI 등 첨단산업 분야의 주도권을 확보할 수 있도록 총력 지원하겠다&quot;고... ","Wed, 04 Feb 2026 08:34:00 +0900"
2026-02-03 23:46:17,지난해 수출액 175억2000만달러...광주시 전년대비 12.6% 증가,https://www.etoday.co.kr/news/view/2552785,광주지역 수출 증가는 자동차와 <b>반도체</b>산업이 자리했다. 자동차 수출액은 75억1000만달러로 전년 대비 9.1... <b>반도체</b> 수출은 57억5000만달러로 전년 대비 40.2% 급증했다. 글로벌 인공지능(AI) 산업 확산에 따른 고성능... ,"Wed, 04 Feb 2026 08:34:00 +0900"
2026-02-03 23:46:17,"인텔 CEO, GPU 시장 진출 선언…&quot;1.4나노 파운드리에 고객 관심&quot;",https://www.getnews.co.kr/news/articleView.html?idxno=859977,미국의 <b>반도체</b> 제조사 인텔이 엔비디아가 장악한 인공지능(AI)용 그래픽처리장치(GPU) 시장에 본격적으로... 엔비디아를 비롯한 주요 AI 칩 제조사들은 지금까지 주로 대만 파운드리(<b>반도체</b> 위탁생산) 업체 TSMC에 생산을... ,"Wed, 04 Feb 2026 08:34:00 +0900"
2026-02-03 23:46:17,"충청북도, AI 대도약으로 미래 산업 선도",https://www.viva100.com/article/20260203501663,김영환 충청북도지사는 “충청북도는 제조업을 기반으로 <b>반도체</b>·이차전지·바이오 등 미래를 이끌 첨단산업의 탄탄한 기반을 갖춘 지역”이라며 “이러한 산업적 토대 위에 도정 전반의 AI 전환을 속도감 있게... ,"Wed, 04 Feb 2026 08:32:00 +0900"
2026-02-03 23:46:17,"동운아나텍, 글로벌 최초 타액 혈당측정기 연내 상용화될까",https://n.news.naver.com/mnews/article/018/0006212763?sid=101,동운아나텍이 글로벌 최초 침 혈당측정기를 개발할 수 있는 밑바탕에는 독보적인 <b>반도체</b> 기술이 있다. 동운아나텍은 미세전류로 <b>반도체</b> 오토포커스를 제어하는 등의 미세전류 감지 기술을 보유하고 있다.... ,"Wed, 04 Feb 2026 08:32:00 +0900"
2026-02-03 23:46:17,"리사 수 AMD CEO &quot;AIDC 성장, 내년까지 지속…연간 실적 성장세 유지&quot;(종...",https://www.techm.kr/news/articleView.html?idxno=149079,AMD 2025년 4분기 실적발표/사진=AMD 홈페이지 AMD도 인공지능(AI)발 <b>반도체</b> 슈퍼사이클(장기 호황) 궤도에... AMD 2025년 4분기 실적발표/사진=AMD 홈페이지 AI용 <b>반도체</b> 'MI450'은 올 3분기 출시한다. 수 CEO는 &quot;M355는... ,"Wed, 04 Feb 2026 08:32:00 +0900"
2026-02-03 23:46:17,"[더벨][i-point] 지아이에스, 휴머노이드 기반 제조 자동화 '시동'",https://www.thebell.co.kr/free/content/ArticleView.asp?key=202602040820134640102018,<b>반도체</b> 및 자동화 장비 제조 전문기업 지아이에스(GIS)가 K-휴머노이드 연합 선정을 계기로 휴머노이드 기반 제조 자동화 및 스마트팩토리 사업을 본격화한다고 4일 밝혔다. GIS는 앞서 아이엘 및 아이엘로보틱스와... ,"Wed, 04 Feb 2026 08:32:00 +0900"
2026-02-03 23:46:17,인텔 'GPU 시장 진출' 선언…칩 생태계 전반 출사표,https://www.etoday.co.kr/news/view/2552773,이투데이=김준형 기자 | 퀄컴서 GPU 전문가 영입 미국 내 AI 칩 생산 본격화 미국 <b>반도체</b> 제조사 인텔이 현재... 엔비디아를 비롯한 주요 AI 칩 제조사들은 지금까지 주로 대만 파운드리(<b>반도체</b> 위탁생산) 업체 TSMC에... ,"Wed, 04 Feb 2026 08:32:00 +0900"
2026-02-03 23:46:17,"[마켓PRO] Today's Pick : &quot;고영 , 당분간 편안한 증익구간”",https://n.news.naver.com/mnews/article/015/0005246468?sid=101,"<b>반도체</b> 패키징 후공정, SMT 장비 매출 확대와 함께 ‘기타’ 부문 성장 지속 예상. =의료로봇 모멘텀 병행. 뇌수술용 의료로봇 2026년 20대 판매 계획 유지. 미국·일본 중심으로 상반기 수주 및 납품 진행... ","Wed, 04 Feb 2026 08:31:00 +0900"
2026-02-03 23:46:17,"천하람 &quot;李, SNS 부동산 정치는 '개딸용 사이다'... 명청 갈등 속 주도권...",https://radio.ytn.co.kr/program/?f=2&id=107233&s_mcd=0214&s_hcd=01,"개딸 위한 단견 정치 - 다주택자 악마화는 시장 현실과 동떨어진 일 - 코스피 5000 시대, <b>반도체</b> 슈퍼사이클... 지금 <b>반도체</b> 정도 또 현대차 같은 경우에 이제 로보틱스 정도 각광을 받고 있는 거 빼고 우리나라 10대 주력... ","Wed, 04 Feb 2026 08:30:00 +0900"
2026-02-03 23:46:17,[AI의 종목 이야기] 뉴욕증시 시간 외 거래 급등락 종목: SLAB↑·CMG↓,https://www.newspim.com/news/view/20260204000035,<b>반도체</b> 기업 AMD(NASDAQ: AMD)는 약 7% 하락했다. AMD는 1분기 매출을 98억 달러(±3억 달러)로 제시했는데... <b>반도체</b> 설계 업체 실리콘 래보라토리스(NASDAQ: SLAB)는 최대 39% 급등했다. 파이낸셜타임스(FT)는... ,"Wed, 04 Feb 2026 08:30:00 +0900"
2026-02-03 23:46:17,광주 수출 지난해 12.6% 증가…특·광역시 1위 기록,http://www.hansbiz.co.kr/news/articleView.html?idxno=814462,광주지역 수출 증가는 자동차와 <b>반도체</b> 산업이 자리했다. 자동차 수출액은 75억1000만 달러로 전년 대비 9.... <b>반도체</b> 수출은 57억5000만 달러로 전년 대비 40.2% 급증했다. 글로벌 인공지능(AI) 산업 확산에 따른 고성능... ,"Wed, 04 Feb 2026 08:30:00 +0900"
2026-02-03 23:46:17,[증시 포인트] 기술주 변동성 큰 흐름 유의해야,http://www.opinionnews.co.kr/news/articleView.html?idxno=132819,"한 연구원은 이를 언급하면서 &quot;국내 <b>반도체</b>주들의 차익실현 유인을 제공할 것으로 판단된다&quot;고 말했다.... 나오더라도 '<b>반도체</b>, 증권, 방산 등 주도주 중심의 비중 확대 &amp; 조정 시 매수' 전략은 유효한 것은 맞다&quot;고... ","Wed, 04 Feb 2026 08:30:00 +0900"
2026-02-03 23:46:17,[박정식의 국내 주식시황] 인공지능 밸류에이션 및 중동 지정학적 리스...,https://www.newsquest.co.kr/news/articleView.html?idxno=261264,"오늘은 원전, 자동차, <b>반도체</b> 소부장, 스페이스X 테마 쪽으로 수급이 유입되는 모습이다. 전일 상승 이슈는 아래와 같다. ▷美 필라델피아 <b>반도체</b>지수(+1.70%) 반등 및 D램 가격 상승 전망 등에 <b>반도체</b>/ 전력설비/ AI 등... ","Wed, 04 Feb 2026 08:28:00 +0900"
2026-02-03 23:46:17,"삼성전자, 성과급 자사주로 지급…노태문 사장 62억원 수령",https://www.ajunews.com/view/20260204082320620,<b>반도체</b> 사업을 이끄는 전영현 디바이스솔루션(DS)부문장(부회장)은 5135주로 7억8103만원을 수령했다. 2024년 5월 DS부문장에 취임해 근무 일수가 적은 영향이다. 사업지원 태스크포스(TF)를 이끌다가 회장... ,"Wed, 04 Feb 2026 08:28:00 +0900"
