DateTime,Title,Link,Description,PubDate
2025-07-31 12:56:11,쌀·소고기 지켰지만 車 관세 ‘15%’ 아쉽다,http://www.kwangju.co.kr/article.php?aid=1753961700787533005,이번 합의에는 <b>반도체</b>·의약품 등 한국 주력 산업에 대한 ‘최혜국 대우’ 적용과 3500억 달러 규모의 한미... 나머지 2000억 달러는 <b>반도체</b>·원전·이차전지·바이오 등 우리나라 전략 산업 분야에 대해 조성될 예정이다.... ,"Thu, 31 Jul 2025 21:54:00 +0900"
2025-07-31 12:56:11,[이시각헤드라인] 7월 31일 뉴스투나잇,https://n.news.naver.com/mnews/article/422/0000766133?sid=102,"■쌀·소고기 추가개방 없어…<b>반도체</b> 최혜국 대우■ 이번 협상에서 쌀과 소고기 시장은 추가 개방 없이 유지됐고, <b>반도체</b>와 의약품 분야에선 최혜국 대우를 이끌어냈습니다. ■정부 세제개편안…법인세·증권거래세율... ","Thu, 31 Jul 2025 21:53:00 +0900"
2025-07-31 12:56:11,한·미 상호·자동차관세 15% 타결…3500억달러 투자펀드 대가,https://n.news.naver.com/mnews/article/028/0002759036?sid=101,"김 실장은 또 “추후 부과가 예고된 <b>반도체</b>와 의약품 관세도 다른 나라에 비해 불리하지 않은 대우를 받을... 나머지 2천억달러는 <b>반도체</b>, 원전, 2차전지, 바이오 등 첨단 산업 투자에 쓰인다고 밝혔다. 구 부총리는... ","Thu, 31 Jul 2025 21:52:00 +0900"
2025-07-31 12:56:11,김관영 전북지사 &quot;한미 통상 협상 타결 환영…노고에 감사&quot;,https://n.news.naver.com/mnews/article/079/0004051477?sid=102,"또한 <b>반도체</b>, 의약품 등 향후 관세 부과가 예고된 전략 품목에도 '최혜국 대우'가 적용되어 전북 지역... 아울러 3500억 달러 규모의 대미 투자와 에너지 협력이 전북의 주력 산업인 조선, <b>반도체</b>, 바이오 산업의 글로벌... ","Thu, 31 Jul 2025 21:50:00 +0900"
2025-07-31 12:56:11,&quot;상당한 성과 이뤄내...국력 키워야겠단 생각&quot;,https://n.news.naver.com/mnews/article/052/0002227447?sid=100,"앞으로 조성될 3,500억 달러 규모 펀드 역시 조선, <b>반도체</b> 등 분야에서 우리 기업의 미국 진출을 도울 거라며 긍정적으로 내다봤습니다. 다만, 이후 이어진 공개 발언에선 아쉬운 속내도 밝혔습니다. 만족할 정도의 성과는... ","Thu, 31 Jul 2025 21:48:00 +0900"
2025-07-31 12:56:11,이 대통령 “한국형 차세대 전력망 구축 방안 모색”,https://www.naeil.com/news/read/556610?ref=naver,제2의 <b>반도체</b>로” 이재명 대통령은 31일 “첨단 인공지능(AI) 기술을 적극 활용하는 한국형 차세대 전력망... 제2의 <b>반도체</b> 산업으로 만든다는 것이 대통령의 구상”이라며 “전기가 그 자체로 성장산업이 되는 것”이라고... ,"Thu, 31 Jul 2025 21:48:00 +0900"
2025-07-31 12:56:11,"두산, 탄소발자국까지 관리한다! 글로벌 검증 받은 'DOO LCA' 구축",https://www.autodaily.co.kr/news/articleView.html?idxno=534297,"CCL은 인쇄회로기판(PCB)의 핵심소재로서, <b>반도체</b>, 통신장비용 네트워크 보드, 모바일, 웨어러블 기기 등... AI<b>반도체</b> 기업들로부터 많은 관심을 받고 있다. ㈜두산 관계자는 &quot;제품의 탄소발자국을 측정하고 관련... ","Thu, 31 Jul 2025 21:46:00 +0900"
2025-07-31 12:56:11,상호관세 15％ 사수...일등공신은 조선업 협력 '마스가',https://n.news.naver.com/mnews/article/052/0002227444?sid=101,앞으로 관세 부과가 예고된 <b>반도체</b>와 의약품 등은 다른 나라보다 불리하지 않은 최혜국 대우를 약속받았습니다. 다만 철강 관세 50％는 트럼프 대통령이 강경한 입장을 보이면서 협상을 이루지 못했습니다. [윤성혁... ,"Thu, 31 Jul 2025 21:46:00 +0900"
2025-07-31 12:56:11,트럼프의 자평 &quot;관세 덕분에 미국 다시 위대하고 부유해지고 있어&quot;,https://n.news.naver.com/mnews/article/088/0000962283?sid=104,"또 &quot;통상 합의에 포함된 3천500억 달러(488조원) 규모의 펀드는 양국 전략산업 협력의 기반을 공고히 하는 것으로 조선, <b>반도체</b>, 이차전지, 바이오, 에너지 등 우리가 강점을 가진 산업 분야에서 우리 기업들의 적극적인 미국... ","Thu, 31 Jul 2025 21:41:00 +0900"
2025-07-31 12:56:11,EU &quot;8월1일부터 15％ 관세 기대&quot;…美행정명령·공동성명 아직,https://n.news.naver.com/mnews/article/001/0015542479?sid=104,유럽산 의약품·<b>반도체</b> 관세율을 두고는 해석이 계속 분분하다. EU는 미국이 무역확장법 232조에 근거해... 이에 비해 미국은 영세율 유지 여부에 관한 설명 없이 유럽산 의약품·<b>반도체</b>에 대해서는 15％ 관세에... ,"Thu, 31 Jul 2025 21:39:00 +0900"
2025-07-31 12:56:11,"‘제주 제2수출국’ 미국…관세 협상 타결, 제주 영향은?",https://n.news.naver.com/mnews/article/056/0012000490?sid=101,넙치가 가장 많이 수출되고 있는데 <b>반도체</b>를 제외하고는 상위 4개 품목이 농수산물과 식품입니다. 한미 FTA로... [이준명/한국무역협회 제주지부 차장 : &quot;제주가 미국으로 수출하는 품목을 살펴보면 <b>반도체</b>를 제외하고는... ,"Thu, 31 Jul 2025 21:39:00 +0900"
2025-07-31 12:56:11,미국의 15% 관세와 구미산단 기업체,https://www.yeongnam.com/web/view.php?key=20250731026006787,<b>반도체</b>와 전자산업 기업체가 몰려있는 구미국가산업단지 2~3단지 전경. 구미국가산단 수출기업은 미국이... 구미지역 경제계는 미국의 15% 관세 부과에도 구미산단 주력 품목인 <b>반도체</b>와 전자산업에는 큰 영향을 미칠... ,"Thu, 31 Jul 2025 21:38:00 +0900"
2025-07-31 12:56:11,‘쌀·소고기 지켰다’…대구·경북 관세 영향은?,https://n.news.naver.com/mnews/article/056/0012000484?sid=101,"<b>반도체</b>와 이차전지, 바이오 등에 2천억 달러, 우리 돈 278조 원 규모의 대미 투자 펀드를 조성하기로 하면서 사업에 참여할 기회가 커졌기 때문입니다. [양금희/경북도 경제부지사 : &quot;미국에 진출해서 기업이 성장하면 그... ","Thu, 31 Jul 2025 21:38:00 +0900"
2025-07-31 12:56:11,올해 하반기 일자리 전망 <b>반도체</b>만 ‘맑음’…섬유는 감소 지속,https://n.news.naver.com/mnews/article/082/0001338156?sid=101,"올해 하반기엔 <b>반도체</b> 업종 일자리가 증가하고, 섬유 업종 일자리는 감소할 것으로 전망됐다. 한국고용정보원과 한국산업기술진흥원(KIAT)은 31일 기계, 조선, 전자, 섬유, 철강, <b>반도체</b>, 자동차, 디스플레이, 금속가공... ","Thu, 31 Jul 2025 21:38:00 +0900"
2025-07-31 12:56:11,"국정위, 대미 관세협상 영향 논의…&quot;양국 산업 시너지 제고해야&quot;",https://daily.hankooki.com/news/articleView.html?idxno=1251622,"국정위 주형철 기획위원(성장동력TF 팀장)은 &quot;앞으로 대미 투자가 늘어날 것으로 예상되는 만큼, 한미 양국 산업의 시너지 제고를 통해 우리 조선, <b>반도체</b>, 이차전지, 바이오, 에너지 산업이 미국과 더욱 리커플링(recoupling)... ","Thu, 31 Jul 2025 21:36:00 +0900"
2025-07-31 12:56:11,[주요공시] 7월 31일 오후,https://www.ebn.co.kr/news/articleView.html?idxno=1672807,"<b>반도체</b>를 담당하는 DS부문은 매출 27조9000억원, 영업이익 4000억 원을 기록했다. 영업이익은 2조 원대 적자를 기록한 2023년 4분기 이후 가장 낮은 수준이다. 지난해 같은 분기(6조5000억원)와 비교해도 6조 원 넘게... ","Thu, 31 Jul 2025 21:36:00 +0900"
2025-07-31 12:56:11,[미리보는 이데일리 신문] 관세 15%·3500억달러 투자 맞교환,https://n.news.naver.com/mnews/article/018/0006078724?sid=101,"타결 -<b>반도체</b>·의약품 품목관세, 고정밀 지도 반출 압박…”후속조치 마련 시급” -쌀·소고기 지켰지만... ‘당혹’…<b>반도체</b>는 최혜국 대우 ‘촉각’ -“대미 투자 윈윈되려면…국내 공급망 활용도 높이고 美와... ","Thu, 31 Jul 2025 21:35:00 +0900"
2025-07-31 12:56:11,美 &quot;3천500억 달러+α&quot; vs 韓 &quot;사실상 2천억 달러&quot;,https://www.idaegu.co.kr/news/articleView.html?idxno=518517,구윤철 경제부총리 겸 기획재정부 장관은 언론 브리핑에서 트럼프 대통령이 언급한 3천500억 달러는 한국이 주도권을 행사하는 조선 협력 펀드 1천500억 달러와 <b>반도체</b>·원자·에너지·2차전지·바이오 등 경제안보 분야... ,"Thu, 31 Jul 2025 21:34:00 +0900"
2025-07-31 12:56:11,'상호관세율 15%·美에 3500억 달러 투자' 합의,https://www.idaegu.co.kr/news/articleView.html?idxno=518504,한국이 조성하기로 한 3천500억 달러 미국 투자 펀드는 조선업 협력 1천500억 달러와 <b>반도체</b>·원전·2차전지·바이오 등 2천억 달러로 구성돼 있다. 조선업 협력 방안은 이번 협상 과정에서 한국이 미국을 설득했던 가장... ,"Thu, 31 Jul 2025 21:34:00 +0900"
2025-07-31 12:56:11,[한미 관세 타결] 日·EU와 동등한 관세 확보했지만 GDP 대비 부담,https://www.idaegu.co.kr/news/articleView.html?idxno=518505,나머지 2천억달러는 <b>반도체</b>·원전·이차전지·바이오 분야에 대한 투자다. 일본은 '정부계 금융기관이 최대 5천500억달러 규모의 출자·융자·융자보증을 제공'하는 방식의 투자라고 이시바 시게루 총리가 밝힌 바 있다.... ,"Thu, 31 Jul 2025 21:34:00 +0900"
2025-07-31 12:56:11,[한미 관세협상 타결] 김동연 경기지사 긴급회의 &quot;업계 피해 최소화&quot;,https://www.incheonilbo.com/news/articleView.html?idxno=1298110,경기도의 수출 주력 품목인 <b>반도체</b>와 자동차가 미국과의 관세 협상에서 각각 15% 부과로 합의된 가운데... 이 가운데 자동차(18억2800만달러)와 <b>반도체</b>(16억7800만달러)가 절반가량(49.1%)을 차지하고 있다. 같은 기간... ,"Thu, 31 Jul 2025 21:30:00 +0900"
2025-07-31 12:56:11,&quot;광우병시위 사진 꺼내 농축산물 막아…트럼프 대역 두고 연습&quot;(종합),https://n.news.naver.com/mnews/article/421/0008404968?sid=104,"나머지 2000억 달러는 원자력 그리고 <b>반도체</b>, 배터리 등을 중심으로 투자할 것이다. ▶구윤철 참고로 말씀드리면 오늘 트럼프 대통령이 조선업 투자를 빨리해달라는 요청이 있었다. -대미투자 규모 이견이 많았던 걸로... ","Thu, 31 Jul 2025 21:29:00 +0900"
2025-07-31 12:56:11,미국 관세에 '조마조마'..충청권 &quot;한숨 돌렸다&quot;/데스크,https://tjmbc.co.kr/article/Xke89c1cw4F3S--PhQ7,"충남은 2023년 기준 지역내총생산에서 <b>반도체</b>, 디스플레이, 자동차 등 제조업이 차지하는 비중이 48%, 수출 규모는 73%로, 전국 17개 시도 중 울산에 이어 두 번째로 높습니다. 남현우/한국은행 대전세종충남본부 경제조사팀... ","Thu, 31 Jul 2025 21:26:00 +0900"
2025-07-31 12:56:11,"외신 “한미 관세협상 타결, 李대통령 정치적 승리”",https://www.kukinews.com/article/view/kuk202507310250,"다만 제약, <b>반도체</b> 산업에 대한 관세 불확실성이 남아 있다는 점에서 낙관적으로 보기 힘들다는 분석도... 한국에 수십억 달러의 매출을 안겨준 제약과 <b>반도체</b> 산업에 대한 관세를 여전히 고려하고 있다”고 강조했다.","Thu, 31 Jul 2025 21:26:00 +0900"
2025-07-31 12:56:11,"세무사회, 정부 세제개편안에 &quot;조세약자 위한 혁신에 의문&quot;",https://www.tfmedia.co.kr/news/article.html?no=193309,"AI, <b>반도체</b> 등 신산업육성 등 산업정책 목적과 효과성이 명백한 경우를 제외하고는 조세지출 대상에서 원천... 하지만 AI·<b>반도체</b> 등 국가전략기술에 대한 세제지원을 강화해 산업 경쟁력을 도모하기 위한 정책목표 달성을... ","Thu, 31 Jul 2025 21:26:00 +0900"
2025-07-31 12:56:11,"삼성전자, 2Q <b>반도체</b> 영업익 전년 동기比 '반토막'",https://www.idaegu.co.kr/news/articleView.html?idxno=518457,삼성전자 <b>반도체</b> 부문이 6분기 만에 영업이익 최저치를 기록했다. 메모리·비메모리뿐만 아니라 스마트폰... <b>반도체</b> 사업을 담당하는 DS부문은 매출 27조9천억원으로 영업이익 4천억원을 기록했다. 2조원대 적자를... ,"Thu, 31 Jul 2025 21:24:00 +0900"
2025-07-31 12:56:11,경제 6단체 &quot;한미 통상협상 타결 환영&quot;,https://www.idaegu.co.kr/news/articleView.html?idxno=518456,"이어 &quot;이번에 발표된 양국 간 산업 협력 고도화를 위한 펀드는 우리 기업들이 조선, <b>반도체</b>, 이차전지, 바이오... 주력 수출 품목인 자동차 관세도 15%로 낮췄으며 추후 발표될 <b>반도체</b>·의약품 등 품목 관세에 대해서도... ","Thu, 31 Jul 2025 21:24:00 +0900"
2025-07-31 12:56:11,[관세타결] <b>반도체</b>·의약품·자동차·배터리 美 수출 비중 큰 산업계 '안...,http://www.cctimes.kr/news/articleView.html?idxno=858739,"향후 <b>반도체</b>·의약품 등 핵심 품목에 대한 관세 부담 완화 가능성이 커지면서 향후 글로벌 경쟁력에도 긍정적 영향을 줄 것이라는 기대가 나온다. 주력 수출 품목인 자동차 관세도 15%로 낮췄으며, 추후 발표될 <b>반도체</b>... ","Thu, 31 Jul 2025 21:24:00 +0900"
2025-07-31 12:56:11,[관세타결]3500억불 투자 펀드 어떻게?,http://www.cctimes.kr/news/articleView.html?idxno=858742,"김용범 대통령실 정책실장은 31일 브리핑에서 &quot;한미 조선 협력 펀드 1500억달러는 선박 건조, MRO(유지·보수·정비), 조선 기자재 등 조선업 생태계 전반을 포괄한다&quot;며 &quot;조선 외 <b>반도체</b>, 원전, 이차전지, 바이오 등 우리... ","Thu, 31 Jul 2025 21:24:00 +0900"
2025-07-31 12:56:11,김영환 충북도지사·정치권 관세협상 타결 일제히 환영,http://www.cctimes.kr/news/articleView.html?idxno=858743,"이어 &quot;충북은 <b>반도체</b>, 2차전지, 의약품, 자동차부품, 화장품 등 미래 전략산업에 경쟁력을 보유한 지역&quot;이라며 &quot;급변하는 통상 환경에 촉각을 곤두세우고 환율 변동, 원자재 가격 상승, 주요 수출시장 내 규제 변화 등에... ","Thu, 31 Jul 2025 21:24:00 +0900"
2025-07-31 12:56:11,[관세타결] 경제 6단체 &quot;대외 불확실성 해소&quot;,http://www.cctimes.kr/news/articleView.html?idxno=858740,"경제 6단체는 &quot;이번에 발표된 양국 간 산업 협력 고도화를 위한 펀드는 우리 기업들이 조선, <b>반도체</b>, 이차전지, 바이오, 에너지 등 전략산업 분야에서 미국 및 글로벌 시장을 선점하는 데 있어 중요한 전기를 마련할 것... ","Thu, 31 Jul 2025 21:24:00 +0900"
2025-07-31 12:56:11,[관세타결] 큰 고비 넘긴 한국 경제 ... 제조업은 부담 여전,http://www.cctimes.kr/news/articleView.html?idxno=858745,미국은 자동차·철강에 이어 <b>반도체</b>·의약품에 품목별 관세를 추진 중이다. 한국의 주력 수출품 중 하나인 철강에는 이미 50%의 품목별 관세가 부과 중이다. 정치·경제적으로 우월한 힘을 앞세워 자국에 유리한 합의를... ,"Thu, 31 Jul 2025 21:24:00 +0900"
2025-07-31 12:56:11,[사설] 경제 살리겠다며 반기업 법안 추진 웬 말인가,https://www.idaegu.co.kr/news/articleView.html?idxno=518463,"한국경제인협회를 비롯한 경제 8단체는 지난달 24일, 자동차·조선·<b>반도체</b> 등 국내 13개 주요 산업 협회는 지난 30일 경제계가 도저히 감당할 수 없다며 이를 법안의 입법을 재고해 달라는 '벼랑 끝 호소'까지 내놓았다.... ","Thu, 31 Jul 2025 21:24:00 +0900"
2025-07-31 12:56:11,&quot;관세폭탄 피했다&quot; 긍정 전망 속 충북 경제계 우려,http://www.cctimes.kr/news/articleView.html?idxno=858746,<b>반도체</b> 등 제조업에 대한 충격 완화가 기대되지만 수출입 환경 변화가 예상되면서다. 사과 등 품목별 농산물... 최근 미국은 충북 수출을 견인하고 있는 <b>반도체</b>에 대한 품목관세 부과 가능성을 언급하면서 지역경제계가... ,"Thu, 31 Jul 2025 21:24:00 +0900"
2025-07-31 12:56:11,“소나기 피했지만”…한미 FTA 무력화,https://n.news.naver.com/mnews/article/056/0012000476?sid=101,"[김용범/대통령실 정책실장 : &quot;FTA라는 것이 상당히 많이 지금 흔들리고 있는 거죠.&quot;] 이번 타결로 조선업만 긍정 영향, 자동차, <b>반도체</b>, 가전 등 상당수 산업군 전망이 어둡습니다. 특히 철강은 일본제철이 미국 US스틸을... ","Thu, 31 Jul 2025 21:21:00 +0900"
2025-07-31 12:56:11,"삼성SDI, 2분기 매출 3조1794억·영업손실 3978억원 기록..향후 전망 불투...",https://www.dailycar.co.kr/content/news.html?type=view&autoId=58287,"주요 고객사의 신규 스마트폰 출시에 따른 OLED 소재 판매와 <b>반도체</b> 웨이퍼 생산 증가 등이 긍정적으로... 전자재료 부문은 OLED 및 <b>반도체</b> 소재의 수요 증가에 따른 성장세가 이어질 것으로 기대됨에 따라, 신규... ","Thu, 31 Jul 2025 21:20:00 +0900"
2025-07-31 12:56:11,결국 트럼프가 결정했다…남은 의제는?,https://n.news.naver.com/mnews/article/056/0012000474?sid=104,"각각 <b>반도체</b>와 자동차, 조선 등의 우리 주력 기업들을 이끌고 있는 만큼 정·재계 네트워크를 동원해 관련한 투자 카드 등을 제시한 걸로 보입니다. 구체적인 투자 규모 등은 곧 있을 한미 정상회담에서 논의를 거쳐 발표될... ","Thu, 31 Jul 2025 21:17:00 +0900"
2025-07-31 12:56:11,&quot;증시 띄운다며 세금 더 걷나&quot; 반발…'세제 개편안' 보니 (풀영상),https://n.news.naver.com/mnews/article/055/0001280328?sid=101,"세율 인상을 통해서 나중에 세수를 좀 더 확보하려고 하는 것 같습니다.] <b>반도체</b>, 이차전지 등 첨단 산업의 국내 생산에 대해 세액공제를 확대하는 한국판 인플레이션 감축법이, 대통령 공약이었음에도 중장기 과제로... ","Thu, 31 Jul 2025 21:14:00 +0900"
2025-07-31 12:56:11,&quot;증시 활성화한다더니&quot;…세 부담 증가 절반은 대기업 몫,https://n.news.naver.com/mnews/article/055/0001280327?sid=101,"세율 인상을 통해서 나중에 세수를 좀 더 확보하려고 하는 것 같습니다.] <b>반도체</b>, 이차전지 등 첨단 산업의 국내 생산에 대해 세액공제를 확대하는 한국판 인플레이션 감축법이, 대통령 공약이었음에도 중장기 과제로... ","Thu, 31 Jul 2025 21:13:00 +0900"
2025-07-31 12:56:11,‘부자감세’ 원상 복구에도…공약 이행 위한 세수 확보 역부족,https://n.news.naver.com/mnews/article/032/0003386731?sid=101,"이처럼 널뛰기를 한 데는 세율 변화도 있지만, <b>반도체</b>·석유화학 등 수출 비중이 큰 업종의 실적 영향이 컸다고 기재부는 설명했다. 정부는 불필요한 세금 감면 등을 줄이고자 올해 종료 시점이 임박한 조세지출 72개 중... ","Thu, 31 Jul 2025 21:12:00 +0900"
2025-07-31 12:56:11,[송기훈의 팩트언락] 한미 관세협상 타결의 그림자,https://www.newsclaim.co.kr/news/articleView.html?idxno=3047629,"우리 기업들은 이미 미국의 <b>반도체</b>, 배터리 등 핵심 산업에 막대한 투자를 감행해왔다. 이는 미국 경제 안보에 대한 한국의 기여를 명확히 보여주는 증거다. 그런데도 경제 규모를 무시한 채 또 다시 과도한 투자 요구를... ","Thu, 31 Jul 2025 21:12:00 +0900"
2025-07-31 12:56:11,‘마스가’ 조선 협력 카드 통했다,https://n.news.naver.com/mnews/article/056/0012000472?sid=101,"단기적으로 대규모 대출을 일으켜서 (투자)해라라고 했을 땐 기업에 부담이 (됩니다).&quot;] 한편, 정부는 미국이 관세 부과를 예고한 <b>반도체</b>와 의약품에서도 다른 나라보다 불리하지 않은 최혜국 대우를 약속했다고... ","Thu, 31 Jul 2025 21:12:00 +0900"
2025-07-31 12:56:11,"국정기획위 &quot;대미 관세협상 타결, 국내산업 경쟁력 강화 기회로 삼아야...",http://www.g-enews.com/ko-kr/news/article/news_all/20250731210743634878e43e3ead_1/article.html,"주형철 국정기획위 기획위원(성장동력TF 팀장)은 &quot;향후 대미 투자가 늘어날 것으로 예상되는 만큼, 한미 양국 산업이 리커플링(recoupling) 되면서 조선, <b>반도체</b>, 이차전지, 바이오, 에너지 등 주요 산업의 경쟁력을 한 단계... ","Thu, 31 Jul 2025 21:10:00 +0900"
2025-07-31 12:56:11,"한미 관세협상 타결에도...'매파 연준'에 원·달러 환율, 3.9원 오른 1387...",https://www.betanews.net/article/view/beta202507310094,"아울러 한국은 조선업 협력 펀드 1천500억달러, <b>반도체</b>, 원전, 이차전지, 바이오 등 대미 투자 펀드 2천억달러 등 총 3천500억달러 규모 펀드를 조성하기로 했다. 국내 농축산물 시장은 추가 개방하지 않기로... ","Thu, 31 Jul 2025 21:10:00 +0900"
2025-07-31 12:56:11,대통령실 &quot;전남권을 차세대 전력망 혁신 기지로&quot;,https://www.ebn.co.kr/news/articleView.html?idxno=1672806,정부는 이를 통해 전력 강국으로서의 위상을 확고히 하고 관련 기술과 상품을 수출해 에너지 산업을 제2의 <b>반도체</b> 산업으로 육성한다는 구상이다. 이재명 대통령은 '에너지 고속도로' 사업에도 속도를 낼 것을 주문했다.... ,"Thu, 31 Jul 2025 21:10:00 +0900"
2025-07-31 12:56:11,"삼성SDI, 2분기 영업손실 3천978억",http://www.ujeil.com/news/articleView.html?idxno=371339,주요 고객사의 신규 스마트폰 출시에 따른 유기발광다이오드(OLED) 소재 판매와 <b>반도체</b> 웨이퍼 생산 증가... 및 <b>반도체</b> 소재 성장세에 적극 대응한다. 삼성SDI는 &quot;어려운 시장 여건 속에서도 핵심 사업 전략들을... ,"Thu, 31 Jul 2025 21:10:00 +0900"
2025-07-31 12:56:11,한미 관세 타결...차 부품 '안도' VS 철강 '암울',https://www.tbc.co.kr/news/view?pno=20250731160223AE08421&id=197853,그런 게 지금 발생될까 봐 가장 우려를 하고 있고요.&quot; 수출 외에도 대미 투자의 상당 부분이 포항과 구미의 미래 먹거리인 이차전지와 <b>반도체</b>가 포함될 것으로 보여 지역의 신성장 산업 육성 차질도 우려됩니다. TBC... ,"Thu, 31 Jul 2025 21:06:00 +0900"
2025-07-31 12:56:11,"[EBN 오늘(31일) 이슈 종합]한화 김승연 회장의 꿈 美필리조선소, 삼성전...",https://www.ebn.co.kr/news/articleView.html?idxno=1672805,◆[삼성전자 2Q] 고전 속 영업익 4.7조…&quot;하반기 'AI·2나노'로 반전 시동&quot; 삼성전자가 올해 2분기 <b>반도체</b> 사업을 총괄하는 디바이스솔루션(DS) 부문과 디바이스경험(DX) 부문의 실적 악화로 인해 시장의 눈높이를 하회하는... ,"Thu, 31 Jul 2025 21:06:00 +0900"
2025-07-31 12:56:11,관세 타결 충북 영향은..&quot;의미 있는 진전&quot;,http://news.mbccb.co.kr/home/sub.php?menukey=61&mod=view&RECEIVE_DATE=20250731&SEQUENCE=4366,"이차전지나 <b>반도체</b> 같은 주력 산업에 미칠 영향이 매우 크기 때문인데요. 충청북도는 일단 경제 안정성을... 충북 대미 수출의 절반가량이 이차전지와 <b>반도체</b>, 자동차 부품이기 때문입니다. 일단 자동차 부품의 경우 25가... ","Thu, 31 Jul 2025 21:04:00 +0900"
2025-07-31 12:56:11,조선 “美 수출 확대 기대”- 자동차 “가격 경쟁력 약화 우려”,http://www.knnews.co.kr/news/articleView.php?idxno=1466836,"한미 관세 협상이 타결된 31일 창원시 진해구 부산신항 인근 물류창고에 컨테이너가 쌓여 있다./김승권 기자/ 특히 “양국 간 산업협력 고도화를 위한 펀드는 우리 기업들이 조선, <b>반도체</b>, 이차전지 등 전략산업 분야에서... ","Thu, 31 Jul 2025 21:04:00 +0900"
