DateTime,Title,Link,Description,PubDate
2025-07-01 05:51:59,"[단독] 삼성, 상반기 中 특허 3933건 확보...디엔에프·시메이시 협업 결...",https://www.theguru.co.kr/news/article.html?no=88852,"전고체 배터리, 확장현실(XR), 차세대 <b>반도체</b> 패키징 등 핵심 분야를 중심으로 특허 포트폴리오를... 주요 소재부터 <b>반도체</b>와 <b>반도체</b> 제조 장비까지 다양한 분야에 걸쳐 기술 협력을 추진하고 있다. '몰리브덴... ","Tue, 01 Jul 2025 14:50:00 +0900"
2025-07-01 05:51:59,"페덱스, 한국-대만 직항 노선 도입… &quot;항공 네트워크 강화&quot;",https://www.ebn.co.kr/news/articleView.html?idxno=1668843,"교육은 <b>반도체</b> 산업을 중심으로 견조한 흐름을 이어가고 있다. 글로벌 인공지능(AI) 개발 수요가 급증하는 가운데, 한국은 대만의 다섯 번째로 큰 수출시장이자 네 번째로 큰 수입국으로 자리하고 있다. 양국 모두 <b>반도체</b>... ","Tue, 01 Jul 2025 14:50:00 +0900"
2025-07-01 05:51:59,"숙명여대, 마이크로소프트와 정보보안 인재 양성과정 3년 연속 운영",https://news.unn.net/news/articleView.html?idxno=580683,"더불어 제약 QA/QC(품질 부서), <b>반도체</b> 공정, 생성형 AI 활용 등 다양한 특화 프로그램도 제공할 예정이다. 손서희 숙명여대 대학일자리플러스센터장은 &quot;생성형 AI, 클라우드, IoT 등 혁신 기술이 발전할수록 사이버 보안의... ","Tue, 01 Jul 2025 14:50:00 +0900"
2025-07-01 05:51:59,"미중 관세전쟁에도 '투톱' <b>반도체</b>·자동차 선전에…6월 수출, 전년比 4....",https://www.getnews.co.kr/news/articleView.html?idxno=829047,"지난달 수출이  역대 최대 실적을 기록한 <b>반도체</b>와 자동차의 선전에 힘입어 작년보다 4.3% 늘어나며 한달 만에 반등에 성공했다. 특히, <b>반도체</b>와 자동차의 선전은 미국과 중국의 관세전쟁과 중동 리스크라는... ","Tue, 01 Jul 2025 14:50:00 +0900"
2025-07-01 05:51:59,이재준 수원시장 &quot;'모두의 AI' 추진하겠다&quot;...인공지능 시민청ㆍ산업청...,http://www.paxetv.com/news/articleView.html?idxno=237532,"강연 주제는 △모두의 AI, 수원에서 시작합니다 △미래도시 수원, AI Agent 활용 △AWS 클라우드의 진화와 AI 미래 : 공공사업을 중심으로 △AI <b>반도체</b> 시대, 수원 기업의 글로벌 성장 스토리였습니다. 강연에 앞서 AI 관련... ","Tue, 01 Jul 2025 14:50:00 +0900"
2025-07-01 05:51:59,"리노공업, 5년째 이익률 40%…&quot;AP 전쟁 수혜&quot;",https://n.news.naver.com/mnews/article/215/0001214706?sid=101,"AP 개발에 필수적인 <b>반도체</b> 부품을 만드는 국내 회사들도 다시 조명받는 모습입니다. 산업부 김대연 기자 나와 있습니다. 김 기자, 최근 <b>반도체</b> 부품 업체인 리노공업의 주가가 크게 올랐는데, 어떤 제품을 만드는... ","Tue, 01 Jul 2025 14:48:00 +0900"
2025-07-01 05:51:59,"세종대, <b>반도체</b> 첨단패키징 전문 인력 양성 거점 대학 선정",https://www.pinpointnews.co.kr/news/articleView.html?idxno=356084,제공=세종대 세종대학교(총장 엄종화)가 과학기술정보통신부와 한국연구재단이 추진하는 '<b>반도체</b> 첨단패키징 전문인력 양성' 사업에 최종 선정됐다. 세종대는 이번 사업을 통해 국내 <b>반도체</b> 후공정 경쟁력 강화를 위한... ,"Tue, 01 Jul 2025 14:48:00 +0900"
2025-07-01 05:51:59,"한화 협동로봇 HCR-14, 세계 최초 클린룸 클래스1 인증 획득",http://www.seoulwire.com/news/articleView.html?idxno=658336,"이번 인증으로 HCR-14는 <b>반도체</b>와 정밀광학, 바이오 등 높은 청정도가 요구되는 생산 환경에서도 사용할 수 있게 됐다. 한화로보틱스 관계자는 &quot;청정한 작업 환경을 필요로 하는 고부가 가치 산업 전반에서 경쟁력을... ","Tue, 01 Jul 2025 14:48:00 +0900"
2025-07-01 05:51:59,"삼성 파운드리, 협력사 행사 개최…규모 축소",https://n.news.naver.com/mnews/article/215/0001214705?sid=101,"삼성전자가 올해 파운드리(<b>반도체</b> 위탁생산) 고객·협력사 대상 행사 규모를 대폭 축소해 개최했다.... SFF는 <b>반도체</b> 공정 기술 로드맵을 소개하고 파운드리 사업 경쟁력을 알리기 위한 자리로, 'SFF 2023'과 'SFF 2024'에는... ","Tue, 01 Jul 2025 14:47:00 +0900"
2025-07-01 05:51:59,"부산테크노파크, '기업성장 투자연계포럼' 성공적 개최",https://daily.hankooki.com/news/articleView.html?idxno=1237017,"저소음, 저비용 유지관리 특성으로 신재생 에너지, <b>반도체</b> 등 다양한 분야 진출 가능성을 확보했으며, 해외시장 진입도 본격화됐다. ㈜아이키는 세계 최초 뼈성장 촉진 임플란트를 개발해 의료기기 시장에서 주목받고... ","Tue, 01 Jul 2025 14:46:00 +0900"
2025-07-01 05:51:59,"정명근 화성특례시장, '민선8기 3주년' 시정 브리핑 실시",https://www.gukjenews.com/news/articleView.html?idxno=3313621,"통해 <b>반도체</b> 등 미래산업 인재 양성 기반을 마련했다. 교통 분야에서는 GTX-A 동탄-수서 구간 우선 개통... 특히, 자율주행 리빙랩 실증도시 조성과 AI 첨단산업 투자유치, <b>반도체</b>클러스터 고도화, 친환경 산업단지 조성... ","Tue, 01 Jul 2025 14:46:00 +0900"
2025-07-01 05:51:59,6월 수출 반등 성공...<b>반도체</b> '사상 최대' 실적,https://n.news.naver.com/mnews/article/052/0002213196?sid=101,특히 <b>반도체</b>는 사상 최대 실적을 달성했고 관세 직격탄을 맞은 자동차도 역대 6월 중 최대실적을 기록한... 세부적으로 살펴보면 <b>반도체</b>와 선박 그리고 자동차 수출 실적이 인상적인데요. 먼저 <b>반도체</b> 수출액은... ,"Tue, 01 Jul 2025 14:45:00 +0900"
2025-07-01 05:51:59,'수출의 힘' 살아났다…<b>반도체</b> 견인에 6월 역대급 실적,https://m.sports.naver.com/general/article/450/0000133886,,"Tue, 01 Jul 2025 14:45:00 +0900"
2025-07-01 05:51:59,살아나는 <b>반도체</b>...분야별 분산 투자 가능한 글로벌 <b>반도체</b> ETF는?,https://n.news.naver.com/mnews/article/008/0005215373?sid=101,엔비디아 등 주요 <b>반도체</b> 기업들이 인공지능(AI) 데이터센터 확장과 고성능 그래픽 처리 장치(GPU) 수요 증가로 실적 강세를 보이면서 <b>반도체</b> 테마 상장지수펀드(ETF)가 반등한다. 세계 정세 안정화에 따라 글로벌... ,"Tue, 01 Jul 2025 14:45:00 +0900"
2025-07-01 05:51:59,"폐기되던 바이오디젤 부산물, 고순도 화학원료로 바꾼다",https://www.e-science.co.kr/news/articleView.html?idxno=107398,전극 표면 재구성은 산화물<b>반도체</b>인 구리 텅스텐 산화물(CuWO4) 전극 표면에 저원자가 상태의 구리와 텅스텐으로 구성된 약 3nm 두께의 비정질 층을 형성하는 방식으로 진행했다. 이렇게 개발된 전극 촉매(R-CuWO4)는... ,"Tue, 01 Jul 2025 14:44:00 +0900"
2025-07-01 05:51:59,"이철우 경북도지사, 경북의 성과와 미래 비전 발표",http://www.sisafocus.co.kr/news/articleView.html?idxno=342020,"그러나 규제 혁파와 신성장 산업 육성에 주력한 결과, 블루밸리 산단은 이차전지 기업들로 채워졌고, 구미는 <b>반도체</b> 특화단지로 탈바꿈해 분양률 90%를 넘어서는 성과를 거뒀다. 이 지사는 &quot;소득 2배, 생산 3배를 실현한... ","Tue, 01 Jul 2025 14:44:00 +0900"
2025-07-01 05:51:59,"[위클리오늘] 강원도, 지역인재육성지원 사업 공모 선정",http://www.weeklytoday.com/news/articleView.html?idxno=707002,"도는 이번 공모사업을 강원라이즈(RISE)와 연계하여 강원특별자치도교육청, 강원라이즈(RISE)센터, 가톨릭관동대학교, 한라대학교, 한림대학교 등과 협력해 바이오, 에이아이(AI) <b>반도체</b>, 미래 모빌리티, 첨단 식품... ","Tue, 01 Jul 2025 14:44:00 +0900"
2025-07-01 05:51:59,"<b>반도체</b> 수출 '역대 최대'…&quot;D램 수요, 하반기도 강력&quot;",https://n.news.naver.com/mnews/article/215/0001214702?sid=101,우리나라 <b>반도체</b> 수출이 사상 최대를 기록했습니다. HBM을 비롯한 고부가 D램 수요가 크게 늘면서 수출량이 증가했습니다. 자세한 내용 산업부 홍헌표 기자와 알아보겠습니다. <b>반도체</b> 수출이 사상 최고치를... ,"Tue, 01 Jul 2025 14:43:00 +0900"
2025-07-01 05:51:59,"이철우 도지사, “경북의 성과와 더 큰 발전 방향”을 제시하다.",https://www.dnews.co.kr/uhtml/view.jsp?idxno=202507011430564500013,"그 결과 블루밸리 산단은 이차전지 기업으로 가득 채우고, 구미는 <b>반도체</b>특화단지로 거듭나 분양률 90%가 넘는 성과를 거두게 됐다. 전국 최다로 유치한 규제자유특구와 국가첨단전략산업 특화단지, 국가산단 등은... ","Tue, 01 Jul 2025 14:42:00 +0900"
2025-07-01 05:51:59,6월 수출 4.3% 증가… <b>반도체</b>·자동차 호조에 한 달 만에 증가세,https://it.chosun.com/news/articleView.html?idxno=2023092143410,<b>반도체</b>가 사상 최대 실적을 기록하고 자동차 수출도 6월 기준 역대 최대치를 경신하며 전체 수출을... 품목별로는 최대 수출 품목인 <b>반도체</b>가 149억7000만달러(약 20조2529억원)로 전년 대비 11.6% 증가하며 사상... ,"Tue, 01 Jul 2025 14:42:00 +0900"
2025-07-01 05:51:59,"단국대, 암·치매 조기진단 바이오마커 기술 이전 계약 체결",http://www.kihoilbo.co.kr/news/articleView.html?idxno=1150156,이번에 이전된 기술은 이승기·박재형(융합<b>반도체</b>공학과) 교수가 개발한 광섬유 다발을 이용한 디지털 국소화 표면 플라즈몬 공명 센서와 제작 방법 외 4건이다. 기술 이전료는 1억 원이며 지난해에 이어 누적 기술... ,"Tue, 01 Jul 2025 14:40:00 +0900"
2025-07-01 05:51:59,"미 관세에도 6월 수출 4.3% 증가…<b>반도체</b>, 149.7억달러 '역대 최대'",https://www.epnc.co.kr/news/articleView.html?idxno=318694,미국 트럼프 행정부가 부과한 관세 영향 속에서도 <b>반도체</b>와 자동차 수출 호조 덕분에 6월 수출은 작년보다 4.3% 증가했다. 특히 <b>반도체</b>는 149억7천만달러로 사상 최대 실적 기록을 다시 썼다. 산업통상자원부가... ,"Tue, 01 Jul 2025 14:40:00 +0900"
2025-07-01 05:51:59,KDI &quot;美中 교역 의존도 심화…무역 구조 다변화해야&quot;,https://www.asiatoday.co.kr/view.php?key=20250701010000529,"특히 2010년대 이후 우리나라는 제조업 전반에서 대중국 순수입이 증가하고 자동차·<b>반도체</b> 등 소수 품목... 정성훈 KDI 선임연구위원은 &quot;산업 규모가 가장 큰 화학, 석유제품, 1차금속, 전자·<b>반도체</b> 업종에서 중국의... ","Tue, 01 Jul 2025 14:40:00 +0900"
2025-07-01 05:51:59,서울시민이면 누구나…SKY대학 강의가 공짜,https://n.news.naver.com/mnews/article/662/0000072084?sid=103,"예를 들어 연세대는 시스템 <b>반도체</b> 분야 교수가 참여해 ‘<b>반도체</b> 뉴스’라는 주제로 일상 속 디지털 기술을 쉽고 흥미롭게 풀어낸다. 홍익대는 미술·디자인 전공 교수가 다빈치, 고흐, 피카소 등 유명 화가들의 시선을... ","Tue, 01 Jul 2025 14:40:00 +0900"
2025-07-01 05:51:59,"경기도, 여주 가남에 27만여㎡ 규모 산단 클러스터 조성 추진",https://n.news.naver.com/mnews/article/002/0002395305?sid=102,가남 산단 클러스터는 <b>반도체</b> 소부장 중심의 산단으로 조성된다. 제반 행정절차를 마치고 연말부터 산단 클러스터 조성에 들어가 이르면 2027년 조성을 완료할 계획이다. 산단 조성으로 <b>반도체</b> 산업 등을 중심으로... ,"Tue, 01 Jul 2025 14:39:00 +0900"
2025-07-01 05:51:59,정명근 시장 &quot;화성형 기본 사회 완성해 나갈 것&quot;,https://n.news.naver.com/mnews/article/011/0004503623?sid=102,"또한 삼성전자, 현대·기아차, 한미약품 등 4600개의 첨단산업 기업이 화성에 둥지를 틀 수 있도록 산업 인프라를 강화했으며, KAIST 사이언스 허브와 홍익대 4차산업혁명캠퍼스 유치를 통해 <b>반도체</b> 등 미래산업 인재 양성... ","Tue, 01 Jul 2025 14:39:00 +0900"
2025-07-01 05:51:59,[AT 산업 단신] LG·LG전자·한화로보틱스·로보락,https://www.asiatime.co.kr/article/20250701500270,"업계에선 세계 최초 성과로 <b>반도체</b>와 바이오 등 엄격한 제조 환경을 요구하는 첨단 산업에서의 입지가... 이번 인증으로 HCR-14는 <b>반도체</b>와 정밀광학, 바이오 등 높은 청정도가 요구되는 생산 환경에서도 사용할... ","Tue, 01 Jul 2025 14:38:00 +0900"
2025-07-01 05:51:59,"경기도, 김승원 도당 위원장 만났다... '미래성장 3대 프로젝트'ㆍ'경기...",http://www.paxetv.com/news/articleView.html?idxno=237528,도가 중점적으로 추진 중인 '미래성장 3대 프로젝트'는 △K-<b>반도체</b> 메가클러스터 구축 △기후테크 클러스터 조성 및 RE100 전환 △AI 컴퓨팅센터 민간유치 및 AI 선도사업 특구 지정입니다. '국민체감정책'에는 어르신 돌봄... ,"Tue, 01 Jul 2025 14:38:00 +0900"
2025-07-01 05:51:59,"감사원, 4차 산업혁명 대응점검...&quot;인력공급 과다산정, 수급차질 우려&quot;",https://www.ajunews.com/view/20250701134934451,"산업부, <b>반도체</b> 산업 인력수요 전망시 퇴직자 대체 수요 누락 교육부, 인력공급 확대 방안 마련...사업과 무관한 인력 대책 포함 아주경제=박자연 기자 naturepark127@ajunews.com 감사원 전경 [사진=연합뉴스]. 정부가 <b>반도체</b>... ","Tue, 01 Jul 2025 14:38:00 +0900"
2025-07-01 05:51:59,"한미<b>반도체</b>, 3거래일 연속 하락에 4% 낙폭…9만8000원선 밑으로",http://www.econonews.co.kr/news/articleView.html?idxno=394244,한미<b>반도체</b>가 가파른 하락세다. 한미<b>반도체</b>는 1일 코스피 시장에서 오후 2시34분 현재 전 거래일보다 4.22%(4300원) 하락한 9만7700원에 거래되고 있다. 이 회사는 23일을 제외하고 18일부터 26일까지 7% 미만의... ,"Tue, 01 Jul 2025 14:38:00 +0900"
2025-07-01 05:51:59,트럼프도 '관심' 보이는 韓美 조선 협력 이슈 끌고 나간다…정부 '제조...,https://www.thepublic.kr/news/articleView.html?idxno=268511,"이어 &quot;특히 인공지능(AI), <b>반도체</b>, 바이오, 전기차, 배터리, 조선, 군수, 원자력 등 다양한 제조 분야에서... 예상되는 <b>반도체</b> 등 품목 관세를 철폐하거나 최소화하는 것을 목표로 협상을 진행 중이다. 한미 양국은 미국의... ","Tue, 01 Jul 2025 14:38:00 +0900"
2025-07-01 05:51:59,"“자국산업 운명 달렸다”...韓∙日∙EU, 상호·품목 관세 연계 협상 난...",https://n.news.naver.com/mnews/article/016/0002493139?sid=104,"등 <b>반도체</b> 관세 타격 가능성…면제는 미지수” 도널드 트럼프 미국 대통령이 27일(현지시간) 워싱턴 DC... 25~50%에 육박한 자동차, 철강 등 각종 품목관세에 예고된 의약품·<b>반도체</b> 관세까지 고려하면서 주요국은 미국과... ","Tue, 01 Jul 2025 14:37:00 +0900"
2025-07-01 05:51:59,정명근 화성시장 “시민의 더 나은 삶이 시정 최종 목표”...취임 3주년...,https://www.kukinews.com/article/view/kuk202507010152,"통해 <b>반도체</b> 등 미래산업 인재 양성 기반을 마련했다고 자평했다. 이와 함께 교통 분야에서는 GTX-A 동탄... 특히 자율주행 리빙랩 실증도시 조성, AI 첨단산업 투자유치, <b>반도체</b> 클러스터 고도화, 친환경 산업단지 조성... ","Tue, 01 Jul 2025 14:36:00 +0900"
2025-07-01 05:51:59,여주에 수도권 규제 뚫은 첫 대규모 산단 조성…축구장 38개 규모,https://n.news.naver.com/mnews/article/028/0002753742?sid=102,"산단에는 <b>반도체</b> 소부장(소재·부품·장비기업) 관련 업종 중심으로 입주하게 된다. 산단이 완공되면, <b>반도체</b> 산업 등을 중심으로 직접고용 859명, 간접고용 383명 등 모두 1242명의 고용 창출이 기대된다고 시는 전망했다.... ","Tue, 01 Jul 2025 14:36:00 +0900"
2025-07-01 05:51:59,"SK하이닉스, HBM 주도권 강화 &quot;AI 메모리 왕좌 굳힌다&quot;",https://www.mediapen.com/news/view/1027170,"SK하이닉스가 고대역폭메모리(HBM) 시장에서 압도적 기술력을 바탕으로 글로벌 1위 입지를 굳히며 AI <b>반도체</b> 중심의 미래 전략에 속도를 내고 있다. AI <b>반도체</b> 시장 확대에 따라 HBM 수요가 급증하는 가운데, 차세대... ","Tue, 01 Jul 2025 14:36:00 +0900"
2025-07-01 05:51:59,[새얼굴] 이성호 평택시 부시장,https://www.incheonilbo.com/news/articleView.html?idxno=1294616,"▲ 이성호 평택시 부시장 &quot;평택시가 앞장서 추진하고 있는 <b>반도체</b>와 수소산업 발전에 보탬이 될 수 있도록... 있는 <b>반도체</b>, 수소산업 등과 일맥상통하고 있는 만큼 보탬이 될 수 있도록 최선을 다하겠다&quot;고 말했다. /평택=글... ","Tue, 01 Jul 2025 14:36:00 +0900"
2025-07-01 05:51:59,"충남도, 대규모 수출상담회 천안서 개최",https://www.ggilbo.com/news/articleView.html?idxno=1098282,"김태흠 지사는 &quot;충남은 대한민국 수출 2위로, <b>반도체</b>·자동차 등 첨단 제품은 물론 식품과 화장품, 소비재, 산업재 부문에서도 글로벌 경쟁력을 갖고 있다&quot;며 &quot;더 많은 기업들이 충남과 대한민국 경제의 지평을 넓히고... ","Tue, 01 Jul 2025 14:36:00 +0900"
2025-07-01 05:51:59,"페덱스, 한국-대만 신규 노선 도입… “항공 네트워크 강화”",http://www.globalepic.co.kr/view.php?ud=202507011140302554ac3d53c8ec_29,"박원빈 페덱스코리아 지사장은 “이번 직항 노선은 전자제품, <b>반도체</b>, K-컬처 기반 이커머스 상품 등을... 한국과 대만 간 교육은 <b>반도체</b> 산업을 중심으로 견조한 흐름을 이어가고 있다. 글로벌 인공지능(AI) 개발... ","Tue, 01 Jul 2025 14:36:00 +0900"
2025-07-01 05:51:59,"코스닥, 외형 넘은 다음 숙제는 '정체성 재정립'…시장 구조와 자본기능...",https://www.ezyeconomy.com/news/articleView.html?idxno=216270,"문 이사는 &quot;알테오젠과 리가켐바이오 등 바이오텍 기업들도 상장 이후 수년 간 기술 이전과 투자 유치를 반복하며 성장했다&quot;며 &quot;바이오뿐 아니라 AI, <b>반도체</b> 등 딥테크 전반에서 같은 구조가 반복되고 있다&quot;고 말했다.... ","Tue, 01 Jul 2025 14:34:00 +0900"
2025-07-01 05:51:59,"윤희성 수은 행장 &quot;수출금융 확대하고, 신성장 산업 육성할 것&quot;",https://n.news.naver.com/mnews/article/003/0013336208?sid=101,"이어 &quot;AI, <b>반도체</b>, 방산, 바이오 등과 글로벌 사우스를 비롯해 신흥시장 진출에 필요한 맞춤형 금융을 설계해 긴 호흡으로 신성장 산업을 발굴·육성해 신시장 수요를 창출하겠다&quot;고 했다. 이를 위해 윤 행장은 수은만이... ","Tue, 01 Jul 2025 14:34:00 +0900"
2025-07-01 05:51:59,"코리아써키트, FC-BGA 선제 투자 결실…글로벌 고객사 주문 '물꼬'",https://www.pointe.co.kr/news/articleView.html?idxno=48223,최근 실적 개선은 시스템 <b>반도체</b>용 고부가가치 기판인 FC-BGA 시장 반등 때문으로 보인다. FC-BGA는 <b>반도체</b>칩과 기판을 연결한 <b>반도체</b> 패키지 기판으로 각종 비메모리 <b>반도체</b>를 만들 때 탑재된다. 코리아써키트는 미국... ,"Tue, 01 Jul 2025 14:34:00 +0900"
2025-07-01 05:51:59,"한미<b>반도체</b>, TC본더 생산능력 2조원까지 확대 추진",https://www.joongangenews.com/news/articleView.html?idxno=430777,|중앙이코노미뉴스 이상민 기자|출처=한미<b>반도체</b>  한미<b>반도체</b>가 고대역폭메모리(HBM) 제조 핵심 장비인 TC본더의 생산능력을 내년까지 2조원 규모로 확대하겠다는 계획을 밝혔다. 회사는 6월 30일 '기업가치 제고... ,"Tue, 01 Jul 2025 14:34:00 +0900"
2025-07-01 05:51:59,"[기획] 구미시, 혁신으로 쏘아 올린 ‘새 희망’, 성과로 이뤄가는 ‘구...",http://www.shinailbo.co.kr/news/articleView.html?idxno=2076522,"우선 <b>반도체</b> 소재·부품 특화단지(2023.7.), 방산혁신 클러스터(2023.4.), 기회발전특구(2024.6.)는 물론 기업하기... 특히 문화산단(2025.3, 2.705억원) 선정은 <b>반도체</b>, 방위산업, 이차전지·로봇·AI 등 첨단전략산업 육성... ","Tue, 01 Jul 2025 14:34:00 +0900"
2025-07-01 05:51:59,윤희성 수출입은행장 “통상질서 재편 위기…정책금융 프론티어로 도약...,https://www.ceoscoredaily.com/page/view/2025070114313766011,"또 AI, <b>반도체</b>, 방산, 바이오 등 첨단 전략산업과 글로벌 사우스를 비롯한 신흥시장 진출에 필요한 맞춤형 금융을 설계하고 제공한다. 특히 수은의 개발금융기관(DFI) 기능과 자본시장 업무를 강화해 정책금융의 실행... ","Tue, 01 Jul 2025 14:34:00 +0900"
2025-07-01 05:51:59,"[모빌리티핫이슈] BYD 빛과 그림자…테슬라 주가, 올라도 불안한 이유",https://www.digitaltoday.co.kr/news/articleView.html?idxno=574083,"⦁ 인텔, 차량용 <b>반도체</b> 사업 철수…AI·데이터센터 집중 ⦁ 닛산, 위기 모드 돌입…대규모 감원·공급업체... …전기차, 정속 주행보다 가속이 유리 인텔이 자동차용 <b>반도체</b> 사업을 종료하고, 데이터센터와 AI 칩 개발에... ","Tue, 01 Jul 2025 14:34:00 +0900"
2025-07-01 05:51:59,"이동재 SK키파운드리 대표, SK파워텍 대표 겸임",http://www.srtimes.kr/news/articleView.html?idxno=180027,대표를 거쳐 2022년부터 SK키파운드리의 대표직을 맡고 있다. SK파워텍은 SiC 기반 전력<b>반도체</b> 설계·제조사다. SK키파운드리는 차세대 화합물 <b>반도체</b> 사업 경쟁력을 강화하기 위해 SK파워텍을 인수하게 됐다.,"Tue, 01 Jul 2025 14:34:00 +0900"
2025-07-01 05:51:59,"경기도, ‘미래성장 3대 프로젝트’ 등 주요 도정 국정과제 건의",https://n.news.naver.com/mnews/article/629/0000403389?sid=102,도는 ‘미래성장 3대 프로젝트’로 △K-<b>반도체</b> 메가클러스터 구축 △기후테크 클러스터 조성과 RE100 전환 △AI 컴퓨팅센터 민간유치와 AI 선도사업 특구 지정 등을 추진하고 있다. 또 ‘국민체감정책’에는 △어르신 돌봄... ,"Tue, 01 Jul 2025 14:32:00 +0900"
2025-07-01 05:51:59,"[더벨]NH프리미어블루, 퓨리오사AI 신주에 VVIP 자금 투입",https://www.thebell.co.kr/free/content/ArticleView.asp?key=202506261500200680105456,퓨리오사AI는 데이터센터 서버용 AI <b>반도체</b>를 개발하는 팹리스 기업이다. 삼성전자와 AMD에서... 레니게이드는 AI 추론 작업에 특화된 2세대 AI <b>반도체</b>다. 기존 GPU 대비 전력 소비는 25% 수준에 불과하면서도 성능... ,"Tue, 01 Jul 2025 14:32:00 +0900"
2025-07-01 05:51:59,"삼성 파운드리 포럼, 규모 줄이고 비공개로 전환…&quot;내실 다지기&quot;",https://n.news.naver.com/mnews/article/008/0005215363?sid=101,삼성전자가 해마다 파운드리(<b>반도체</b> 위탁생산) 고객·협력사를 대상으로 개최하는 포럼의 규모를 올해 축소하고 비공개로 전환했다. 파운드리 사업 부진을 고려해 '내실 다지기'에 주력하는 것으로 보인다. 삼성전자는... ,"Tue, 01 Jul 2025 14:32:00 +0900"
2025-07-01 05:51:59,"한국 6월 수출, <b>반도체</b>·자동차 호조로 역대 최고 기록 달성",https://www.gokorea.kr/news/articleView.html?idxno=831348,주요 품목 중 하나인 <b>반도체</b>는 149억7천만달러로 11.6% 증가하며 역대 최고치를 경신했다. 고대역폭 메모리... 비에너지 수입은 <b>반도체</b> 장비 증가로 7.9% 상승했다. 이로써 6월 무역수지는 90억8천만달러 흑자를... ,"Tue, 01 Jul 2025 14:30:00 +0900"
