DateTime,Title,Link,Description,PubDate
2025-08-03 15:26:12,"[정철근의 시시각각] 기업 부르는 미국, 기업 내쫓는 한국",https://n.news.naver.com/mnews/article/025/0003459614?sid=110,"배터리에 530억 달러, <b>반도체</b>에 430억 달러, 자동차에 250억 달러를 투자했다. 이로 인해 일자리 83만 개가... 이번 관세 협상으로 미국에 투자를 약속한 금액은 조선업에 1500억 달러, <b>반도체</b>·원전·배터리·바이오 등에... ","Mon, 04 Aug 2025 00:24:00 +0900"
2025-08-03 15:26:12,"첨단산업 투자 보험사, 자본규제 허들 낮춰준다",https://n.news.naver.com/mnews/article/025/0003459608?sid=101,"인공지능(AI)·<b>반도체</b> 등 첨단 산업 투자에 쓰이는 정책 펀드에 보험사 자금을 더 많이 보탤 수 있게 하기 위해서다. 최근 유럽연합(EU)이 보험사 정책 프로그램 투자를 촉진하기 위해 관련 규제를 완화하고 있는 만큼, 이를... ","Mon, 04 Aug 2025 00:18:00 +0900"
2025-08-03 15:26:12,"[사설] 맥킨지 &quot;韓, 더 뜨거워진 냄비 속 개구리&quot;…살 길은 기업 야성 회...",https://n.news.naver.com/mnews/article/015/0005166287?sid=110,"창업 세대와 2, 3세대 기업가들은 남다른 의지와 혜안으로 세계를 호령하는 오늘의 <b>반도체</b>·자동차·조선·석유화학·철강을 일궈냈다. 다음 스텝으로 전진해야 할 시점이지만 상황은 악화 중이다. 지난 10여 년간 혁신을... ","Mon, 04 Aug 2025 00:13:00 +0900"
2025-08-03 15:26:12,[시론] 중국 치둥시에서 본 韓 위기와 희망,https://n.news.naver.com/mnews/article/015/0005166286?sid=110,"최근 중국 장쑤성 치둥시에서 열린 ‘한·중 양국 무역문화융합산업회의’에 참석해 ‘<b>반도체</b>와 AI, 한·중... 특히 <b>반도체</b> 패권이 미래 도시 전략의 성패를 좌우한다는 점을 거듭 강조했다. 행사뿐만 아니라 치둥시... ","Mon, 04 Aug 2025 00:12:00 +0900"
2025-08-03 15:26:12,"철강업계 위기 극복, 초당적 힘 모은다",https://www.kyongbuk.co.kr/news/articleView.html?idxno=4048523,지난해 기준 철강의 수출액은 332억 달러로 <b>반도체</b>(1419억 달러)보다 낮지만 전후방 산업에 유발한 생산액을 표현한 생산유발계수는 2021년 기준 1.9로 <b>반도체</b>(1.3)보다 높다. 'K스틸법' 발의를 주도한 국회철강포럼은 여야... ,"Mon, 04 Aug 2025 00:10:00 +0900"
2025-08-03 15:26:12,"경기주택도시공사(GH), '전략사업본부장·균형발전본부장' 신규 임명",https://www.cstimes.com/news/articleView.html?idxno=660041,"김상철 신임 전략사업본부장은 참여정부 시절 대통령 비서실에서 국정과제 홍보 및 기획 업무를 수행했으며 문재인 정부에서는 산업통상자원부장관 정책보좌관으로 활동하며 용인 <b>반도체</b> 클러스터 선정, 에너지산업... ","Mon, 04 Aug 2025 00:06:00 +0900"
2025-08-03 15:26:12,뉴욕증시 &quot;엉터리 고용통계 충격&quot; 비트코인 달러환율 '대란&quot; ..연준 FOMC...,http://www.g-enews.com/ko-kr/news/article/news_all/202508022051008984906806b77b_1/article.html,"<b>반도체</b>주들도 대부분 하락 마감했다. 미 <b>반도체</b> 기업 브로드컴은 전날 대비 1.72%, 세계 최대 파운드리(<b>반도체</b> 위탁생산) 업체 대만 TSMC 주가는 2.65% 각각 하락했다. <b>반도체</b> 관련주로 구성된 필라델피아 <b>반도체</b> 지수도... ","Mon, 04 Aug 2025 00:06:00 +0900"
2025-08-03 15:26:12,[사설] 농산물·대미 투자 ‘디테일’ 韓美 이견 조율해 국익 지켜야,https://n.news.naver.com/mnews/article/011/0004516818?sid=110,"<b>반도체</b>·의약품 품목관세, 방위비 분담금 및 국방비 증액, 주한미군 역할 조정 등도 양국 간 현안으로 남아 있다. 우리 정부는 동맹의 균열이 없도록 하면서 국익을 지키는 방향으로 무역 쟁점의 디테일을 둘러싼 이견을... ","Mon, 04 Aug 2025 00:06:00 +0900"
2025-08-03 15:26:12,"제조에 R&amp;D까지… 용인, <b>반도체</b> 중심 첨단기업도시 급부상",https://n.news.naver.com/mnews/article/005/0001793631?sid=102,SK하이닉스가 오는 2027년 첫 번째 팹(Fab) 가동을 목표로 초대형 건설공사를 진행 중인 용인<b>반도체</b>클러스터 때문이다. 이처럼 SK하이닉스가 122조원을 투자하는 원삼면 용인<b>반도체</b>클러스터와 이동·남사읍에 삼성전자가... ,"Mon, 04 Aug 2025 00:06:00 +0900"
2025-08-03 15:26:12,차세대전력망 구축에 ‘에너지수도 전남’ 탄력,http://www.kwangju.co.kr/article.php?aid=1754233200787585074,이재명 정부는 에너지 산업을 제2의 <b>반도체</b>로 키우겠다는 방침 아래 재생에너지 산업 확충에 전력을 다하고 있다. 얼마 전에는 재생에너지로만 가동하는 RE100 산단 조성을 발표했는데 전남 서남권을 최적의 후보지로... ,"Mon, 04 Aug 2025 00:06:00 +0900"
2025-08-03 15:26:12,김진태 지사 “규제 풀고 산업 키우고 도민 삶 높여” 자부…강원도 변...,https://n.news.naver.com/mnews/article/087/0001133781?sid=100,"전무했던 <b>반도체</b>를 비롯해 바이오, 수소, 미래차, K-연어, 방위, 기후테크 등 7대 미래산업 생태계를 빈틈없이 조성 중이다. <b>반도체</b> 산업의 경우 불모지에서 3년 만에 2,320억원 규모의 10개 사업을 추진 중이다. 바이오... ","Mon, 04 Aug 2025 00:02:00 +0900"
2025-08-03 15:26:12,울산 대미수출 관세 연 33억달러 더 부담,https://www.ksilbo.co.kr/news/articleView.html?idxno=1033505,"품목별로는 <b>반도체</b>(147억1000만달러·31.6%)가 큰 폭으로 올랐고, 울산 주력산업인 자동차(58억3000만달러·8.8%), 선박(22억4000만달러·107.6%)이 증가세를 이끌었다. 특히 <b>반도체</b>는 메모리 가격 상승과 고부가가치 제품... ","Mon, 04 Aug 2025 00:02:00 +0900"
2025-08-03 15:26:12,경기주택도시공사 사장 인사청문회 9월에 열린다… 이달 중 인사청문 요...,https://www.joongboo.com/news/articleView.html?idxno=363699688,"김 본부장은 참여정부 시절 대통령 비서실에서 국정 과제 홍보와 기획 업무를 수행했고, 문재인 정부에선 용인 <b>반도체</b> 클러스터 선정과 에너지산업 융복합단지 조성 등에 참여했다. 오 본부장은 제8·9대 경기도의원을... ","Mon, 04 Aug 2025 00:02:00 +0900"
2025-08-03 15:26:12,"[TF미래전략포럼] &quot;AI 도입 격차, 기업 생존 가르고 국가 미래 결정&quot;",https://n.news.naver.com/mnews/article/629/0000413283?sid=101,"TF미래전략포럼 연사 전기정 LG AI연구원 프로덕트 부문장 인터뷰 글로벌 AI·<b>반도체</b> 패권 전쟁이 벌어지고... 이 시점에 맞춰 AI와 <b>반도체</b>, 기후에너지 전문가를 만나 3대 핵심 분야 미래전략에 대해 들어봤습니다. 이번... ","Mon, 04 Aug 2025 00:01:00 +0900"
2025-08-03 15:26:12,"8월 4일, 강원도의 행정적 정체성이 시작된 날",https://n.news.naver.com/mnews/article/087/0001133759?sid=100,"■ 2023년 6월 11일 특별자치도로 전환=2023년 6월 11일 출범한 강원특별자치도는 규제 완화와 자율 행정을 기반으로 <b>반도체</b>·바이오 등 미래산업을 육성 중이다. 접경지역 개발, 교통망 확충 등 해결해야 할 과제도 많다.... ","Mon, 04 Aug 2025 00:01:00 +0900"
2025-08-03 15:26:12,[인터뷰 上] &quot;금리·물가·환율 읽어라&quot;...IBK 영스타 PB가 짚은 투자 전...,https://n.news.naver.com/mnews/article/629/0000413284?sid=101,"있다&quot;며 &quot;특히 <b>반도체</b>·소부장(소재, 부품, 장비) 업종은 글로벌 AI<b>반도체</b> 수요 증가와 고대역폭메모리(HBM) 상업화 확대로 긍정적 흐름이 예상된다&quot;고 설명했다. 아울러 &quot;이러한 수요 확대에 대응하기 위해 이재명 정부는... ","Mon, 04 Aug 2025 00:01:00 +0900"
2025-08-03 15:26:12,실리콘밸리에 우리도 '기술대사'를 두자 [신기욱의 글로벌 인사이트],https://n.news.naver.com/mnews/article/469/0000879636?sid=110,"한국은 <b>반도체</b>, 디스플레이 등에서 뛰어난 기술을 갖고 있지만, 글로벌 차원의 기술 정책이나 국제적 규범을 만드는 데의 참여도는 약해 이를 보완해야 한다. 기술대사직에는 외교관 등 정통 관료보다는 기술분야를 잘... ","Mon, 04 Aug 2025 00:01:00 +0900"
2025-08-03 15:26:12,"비트코인, 이미 성숙 단계?... '이제는 전략의 싸움' 분석 등장",https://www.tokenpost.kr/news/cryptocurrency/273014,"2025년 7월 기준, 전체 암호화폐 시가총액은 4조 달러(약 5,560조 원)를 넘긴 수준이었지만, 이는 세계 최대 <b>반도체</b> 기업 엔비디아($NVDA)의 시총 하나보다도 낮다. 금의 시가총액은 무려 22조 5,000억 달러(약 31경 2,750조 원)로... ","Sun, 03 Aug 2025 23:36:00 +0900"
2025-08-03 15:26:12,"[박근종 칼럼] 팹리스 스타트업 적극 지원, <b>반도체</b> 생태계 확장 AI 3대 강...",https://www.mhns.co.kr/news/articleView.html?idxno=720538,"한국 <b>반도체</b> 수출은 지난 10년간 연평균 9.5%의 속도로 성장하였으나, 같은 기간 동안 메모리 수출이 시스템 <b>반도체</b> 수출보다 2배 빠르게 확대되며 메모리 중심의 수출구조가 고착화하고 있다. 세계적으로 인공지능(AI)... ","Sun, 03 Aug 2025 23:36:00 +0900"
2025-08-03 15:26:12,"중기중앙회, '한·일 중기 포럼' 11월 개최…&quot;양국 협력 통한 대응 모색...",http://www.econonews.co.kr/news/articleView.html?idxno=398942,"김기문 중기중앙회장은 &quot;보호무역주의와 AI, <b>반도체</b> 등 글로벌 기술패권 경쟁이 심화되고 있고, 한일 양국은 저출산·고령화 등 유사한 경제적, 사회적 문제를 직면하고 있다&quot;면서 &quot;양국 기업간 협력 통해 실질적 대응... ","Sun, 03 Aug 2025 23:26:00 +0900"
2025-08-03 15:26:12,"경기주택도시공사, 전략·균형발전 본부장 인사 단행",https://www.startuptoday.co.kr/news/articleView.html?idxno=488521,"김상철 전략사업본부장은 참여정부 대통령 비서실에서 국정과제 홍보 및 기획 업무를 수행했으며, 문재인 정부 당시 산업통상자원부장관 정책보좌관으로 재임하며 용인 <b>반도체</b> 클러스터 선정과 에너지산업 융복합단지... ","Sun, 03 Aug 2025 23:20:00 +0900"
2025-08-03 15:26:12,구윤철 &quot;통상 환경 근본적 변화…수출 다변화 지원에 만전&quot;,https://www.asiatoday.co.kr/view.php?key=20250803010000972,강조했다.<b>반도체</b>·의약품과 관련해 &quot;다른 나라와 같은 최혜국 대우를 받도록 약속받았다&quot;며 &quot;<b>반도체</b>나 의약품에 품목 관세가 부과되는 경우 일본과 EU 수준으로 받을 수 있을 것으로 보고 있다&quot;고 설명했다.3500억달러 투자... ,"Sun, 03 Aug 2025 23:12:00 +0900"
2025-08-03 15:26:12,[이종호칼럼] 국가 경쟁력 특화 ‘강점 AI’ 추진해야,https://n.news.naver.com/mnews/article/022/0004056962?sid=110,"우리는 의료, 고대역폭메모리(HBM) 등 <b>반도체</b>, 가전 및 휴대폰, 자동차 등에서 강국이다. 이들 강점을 AI와 결합해 특화 AI를 만들면 소위 ‘강점’ AI로 글로벌 경쟁력을 높여 큰 부가가치를 창출할 수 있을 것이다. 이와... ","Sun, 03 Aug 2025 23:06:00 +0900"
2025-08-03 15:26:12,‘李정부 출범 57일째’ 관세협상 타결 숨은 공신은?…‘여한구號’ 대...,https://n.news.naver.com/mnews/article/016/0002508979?sid=101,"항공과장·전자부품과장·<b>반도체</b> 디스플레이과장 등 주요 보직을 거쳤다. 자동차과장시절에는 한국GM... 김 과장은 무역안보정책과장 때는 미국의 대중국 <b>반도체</b> 장비 수출통제에 대응했고, FTA상품과장 때는... ","Sun, 03 Aug 2025 22:56:00 +0900"
2025-08-03 15:26:12,[박대석칼럼] '투키디데스 함정'이 현실로 다가오는 시그널들,https://www.fntoday.co.kr/news/articleView.html?idxno=359301,"<b>반도체</b>, 인공지능, 우주항공 등 핵심 분야의 상당 부분이 군사 용도와 직간접적으로 연결되어 있다. 이는 경제적 수익 창출보다는 전략적 목적에 치중한 투자 패턴을 보여준다. 이러한 막대한 군사투자는 '매몰비용의... ","Sun, 03 Aug 2025 22:26:00 +0900"
2025-08-03 15:26:12,"김영환, 대통령 간담회서 &quot;관세협상 타결, 충북 첨단산업 숨통&quot;",https://www.ccdailynews.com/news/articleView.html?idxno=2359450,"김 지사는 &quot;이는 도내 첨단산업 수출 경쟁력 유지를 위한 결정적 전환점이 될 것&quot;이라며 &quot;충북에서 생산하는 <b>반도체</b>, 자동차, 신재생에너지 산업은 수출 의존도가 매우 높은 만큼 관세 장벽 완화는 결정적 지원이 된다&quot;고... ","Sun, 03 Aug 2025 22:18:00 +0900"
2025-08-03 15:26:12,한미 관세 합의 이후에도 쟁점조항 불거져 '논란' 확산,https://www.ccdailynews.com/news/articleView.html?idxno=2359478,"나머지 2000억 달라도 &quot;조선 분야 외에 <b>반도체</b> 원전 이차전지 바이오 등 우리 기업들이 경쟁력을 보유한 분야에 대한 대미투자 펀드로 조성되는 것이며, 우리 기업이 전략적 파트너로 참여하게 될 가능성이 매우 높고... ","Sun, 03 Aug 2025 22:16:00 +0900"
2025-08-03 15:26:12,"강원자치도, 의료 AI <b>반도체</b> 전문인력 양성…219억원 투자",https://www.newspim.com/news/view/20250803000205,"(AI) <b>반도체</b> 전문인력 양성 오프라인 교육을 오는 4일 시작한다고 3일 밝혔다. 이 교육은 연세대학교 미래캠퍼스에서 실시되며, 2024년부터 2028년까지 219억 원 규모로 '의료 인공지능(AI) <b>반도체</b> 전문인력 양성센터 구축... ","Sun, 03 Aug 2025 22:16:00 +0900"
2025-08-03 15:26:12,"李 정부 첫 세제개편안, 미래산업·민생 살리고 세입기반 늘린다",https://www.ulsanpress.net/news/articleView.html?idxno=556290,"정부는 <b>반도체</b>와 더불어 생성형 AI, 에이전트 AI, 고효율 AI 컴퓨팅 등 인공지능 분야를 국가전략기술로 새롭게 지정하며, 연구개발과 시설투자에 대해 최대 50%의 세액공제를 적용하기로 했다. 또한 웹툰 등 K-콘텐츠... ","Sun, 03 Aug 2025 21:43:00 +0900"
2025-08-03 15:26:12,"조선·<b>반도체</b>·자동차, 7월 수출 역대 최대실적 견인",https://www.ulsanpress.net/news/articleView.html?idxno=556249,"주요 수출 품목 가운데 <b>반도체</b>는 147억1,000만달러로 전년 대비 31.6% 증가하며 역대 7월 중 최대 실적을 달성했다. 메모리 <b>반도체</b> 가격이 상승세를 이어가고, HBM과 DDR5 등 고부가가치 제품의 견조한 수요가... ","Sun, 03 Aug 2025 21:42:00 +0900"
2025-08-03 15:26:12,[AI야! 나랑 놀자!] K-팝 다음은 'K-AI'… 기술로 세상을 감동시킬 차례,https://www.idaegu.co.kr/news/articleView.html?idxno=518626,"<b>반도체</b>, 스마트폰, 초고속 인터넷으로 디지털 혁명을 이끌며, '정보(Information) 기술'의 전성기를 누렸다.... 하지만, 우리에겐 세계 최고 수준의 <b>반도체</b> 기술, 5G 인프라, 그리고 무엇보다 K-Culture라는 독특한... ","Sun, 03 Aug 2025 21:34:00 +0900"
2025-08-03 15:26:12,"GH, 전략사업본부장·균형발전본부장 신규 임명",http://www.globalepic.co.kr/view.php?ud=2025080320513863315f69d33b22_29,"김상철 신임 전략사업본부장은 참여정부 시절 대통령 비서실에서 국정과제 홍보 및 기획 업무를 수행했으며, 문재인 정부에서는 산업통상자원부장관 정책보좌관으로 활동하며 용인 <b>반도체</b> 클러스터 선정, 에너지산업... ","Sun, 03 Aug 2025 21:34:00 +0900"
2025-08-03 15:26:12,구미 강소연구개발특구 '최우수 특구' 선정,https://www.idaegu.co.kr/news/articleView.html?idxno=518631,"2단계 사업에서는 ICT 기반의 스마트제조 시스템을 중심으로 로봇, 방산, <b>반도체</b>, 가상융합 등 전략산업 분야를 집중 지원하며, 이를 통해 지역 딥테크 산업의 글로벌 경쟁력을 강화한다는 계획이다.","Sun, 03 Aug 2025 21:34:00 +0900"
2025-08-03 15:26:12,"GH, 전략사업본부장·균형발전본부장 신규 임명",https://www.pointdaily.co.kr/news/articleView.html?idxno=261923,"김상철 신임 전략사업본부장은 참여정부 시절 대통령 비서실에서 국정과제 홍보 및 기획 업무를 수행했으며, 문재인 정부에서는 산업통상자원부장관 정책보좌관으로 활동하며 용인 <b>반도체</b> 클러스터 선정, 에너지산업... ","Sun, 03 Aug 2025 21:34:00 +0900"
2025-08-03 15:26:12,"GH, 전략사업본부장·균형발전본부장 신규 임명",https://www.thereport.co.kr/news/articleView.html?idxno=68480,"김상철 신임 전략사업본부장은 참여정부 시절 대통령 비서실에서 국정과제 홍보·기획 업무를 수행했으며, 문재인 정부에서는 산업통상자원부장관 정책보좌관으로 활동하며 용인 <b>반도체</b> 클러스터 선정, 에너지산업... ","Sun, 03 Aug 2025 21:26:00 +0900"
2025-08-03 15:26:12,[미리보는 이데일리 신문]휴머노이드 상용화 치고 나가는 中,https://n.news.naver.com/mnews/article/018/0006080854?sid=102,"대응해야 -<b>반도체</b> 등 품목관세 부과땐 수출 ‘먹구름’ -“한미 조선협력, 초격차 경쟁력 확보 기회” △종합 -“‘5000피’ 가자더니 증세…어느 바보가 국장하나” 부글 -美, 물가 뛰고 고용부진 ‘쇼크’…고관세발... ","Sun, 03 Aug 2025 21:24:00 +0900"
2025-08-03 15:26:12,"구미 강소연구개발특구, 2년 연속 '최우수 특구' 선정",https://n.news.naver.com/mnews/article/031/0000954111?sid=102,"새 사업에서는 ICT 기반 스마트제조 시스템을 중심으로 로봇, 방산, <b>반도체</b>, 가상융합 등 첨단 산업 분야에 대한 집중 지원이 이뤄질 예정이다. 김장호 구미시장은 &quot;이번 수상은 금오공대와 구미시, 특구 기업 간 긴밀한... ","Sun, 03 Aug 2025 21:22:00 +0900"
2025-08-03 15:26:12,"'한미 관세 협상 타결'… 미래에셋자산운용, 수혜 TIGER ETF 4종·투자 전...",https://www.s-journal.co.kr/news/articleView.html?idxno=32091,"미래에셋자산운용은 한미 관세 협상 타결에 따라 수혜가 기대되는 '조선', '<b>반도체</b>', '2차전지', '방산... 대미 투자 펀드 나머지 2000억달러는 <b>반도체</b>, 배터리, 바이오, 원자력 등 전략산업에 투입되는 가운데 'TIGER... ","Sun, 03 Aug 2025 21:12:00 +0900"
2025-08-03 15:26:12,일본삼성 운 띄운 이재용·수소 도원결의 정의선…총수가 직접 ‘공급망...,https://n.news.naver.com/mnews/article/009/0005535485?sid=101,"<b>반도체</b>·디스플레이 장비, 정밀 부품, 배터리 소재, 모빌리티 등 미래 산업의 설계도를 함께 그릴 ‘기술... 최태원 SK그룹 회장도 <b>반도체</b>, 에너지, 인공지능(AI) 분야를 중심으로 일본과 협력을 강화하며 두세 달에 한 번씩... ","Sun, 03 Aug 2025 21:10:00 +0900"
2025-08-03 15:26:12,LG화학 미공장 건설에 10억달러 보증…대미 투자펀드 시동?,https://n.news.naver.com/mnews/article/056/0012001686?sid=101,"조선 산업과 함께 <b>반도체</b>, 이차 전지, 원전 등을 언급하며 우리 기업에도 기회가 될 수 있다고 강조했습니다. 미국 측이 수익의 90% 가져간다고 주장하는 것에 대해서는 미국 내 재투자 개념으로 이해하고 있다고 재차... ","Sun, 03 Aug 2025 21:08:00 +0900"
2025-08-03 15:26:12,"구윤철 &quot;車관세 15%, 미국의 마지노선…12.5% 못 얻어내 아쉽다&quot;",https://n.news.naver.com/mnews/article/082/0001338430?sid=101,그 밖에 <b>반도체</b>·의약품에는 &quot;다른 나라와 같은 최혜국 대우를 받도록 약속받았다&quot;며 &quot;<b>반도체</b>나 의약품에 품목 관세가 부과되는 경우 일본과 EU 수준으로 받을 수 있을 것으로 보고 있다&quot;고 설명했다. 쌀·쇠고기 개방... ,"Sun, 03 Aug 2025 21:05:00 +0900"
2025-08-03 15:26:12,姜시장 “AI산업·군사시설 이전·양궁대회 참석해달라” 金지사 “여수...,http://www.kjdaily.com/article.php?aid=1754221613661189002,이어 “광주는 연 4천여명의 AI·<b>반도체</b> 인재를 육성하고 있고 이러한 인재 양성을 기반으로 299개 AI기업과 협약을 체결했다”며 “이 중 158개 기업이 광주에 사무실을 개소해 637명이 근무 중”이라고 설명했다. 강... ,"Sun, 03 Aug 2025 21:04:00 +0900"
2025-08-03 15:26:12,"'뻥튀기 상장' 의혹 파두…검찰, 본격 수사 착수",https://n.news.naver.com/mnews/article/015/0005166273?sid=102,<b>반도체</b> 설계 업체 파두의 '뻥튀기 상장' 의혹을 수사하는 검찰이 최근 핵심 거래처인 SK하이닉스 본사를 통해 관련 자료를 확보한 것으로 알려졌다. 금융감독원이 사건을 검찰에 송치한 지 약 7개월 만이다.... ,"Sun, 03 Aug 2025 21:04:00 +0900"
2025-08-03 15:26:12,"경기주택도시공사, 김상철과 오완석 신임 본부장에 8월 4일자로 임명",https://www.viva100.com/article/20250803500582,김상철 신임 전략사업본부장은 대통령 비서실과 산업통상자원부에서의 경력을 통해 용인 <b>반도체</b> 클러스터 선정과 에너지산업 융복합단지 조성 등 주요 정책에 참여했다. 그는 GH의 전략사업본부를 이끌며 신규사업... ,"Sun, 03 Aug 2025 21:04:00 +0900"
2025-08-03 15:26:12,‘분산에너지·RE100’ 전남 산업생태계 대전환 이끈다,http://www.kjdaily.com/article.php?aid=1754221606661188002,"김영록 전남지사는 “이재명 대통령의 구상대로 에너지 산업을 ‘제2의 <b>반도체</b> 산업’으로 키워나가고, 진짜 대한민국의 눈부신 번영을 전남이 주도하는 시대를 열겠다”며 “차세대 전력망 혁신기지 전남에서... ","Sun, 03 Aug 2025 21:02:00 +0900"
2025-08-03 15:26:12,"삼성전자, 임원들에 자사주로 성과급 지급… 513억원 규모",https://n.news.naver.com/mnews/article/469/0000879625?sid=101,"<b>반도체</b> 사업을 담당하는 디바이스솔루션(DS)부문에서는 김용관 전략담당 사장이 6,349주(4억4,696만 원), 박용인 시스템LSI사업부장(사장)이 6,220주(4억3,788만 원), 한진만 파운드리사업부장(사장)은 3,116주(2억1... ","Sun, 03 Aug 2025 21:01:00 +0900"
2025-08-03 15:26:12,"도, 의료 AI <b>반도체</b> 오프라인 실습 교육 시작",https://www.g1tv.co.kr/news?mid=1_207_6&newsid=331470,"강원자치도가 의료 AI <b>반도체</b> 전문인력 양성을 위한 오프라인 실습 교육을 시작합니다. 이번 교육은 의료 AI <b>반도체</b>에 관심 있는 대학생과 직장인, 일반인을 대상으로, 내일(4일)부터 닷새간 연세대 미래캠퍼스에서 실습... ","Sun, 03 Aug 2025 20:59:00 +0900"
2025-08-03 15:26:12,"무보, LG화학 미 공장 10억달러 보증",https://n.news.naver.com/mnews/article/032/0003387115?sid=101,"앞서 한·미는 관세 협상을 통해 2000억달러 규모의 투자 펀드를 조성해 <b>반도체</b>, 원전, 2차전지, 바이오 등 한국 기업들의 대미 투자에 활용하기로 했다. 이와 관련해 김용범 대통령실 정책실장은 지난달 31일 브리핑에서... ","Sun, 03 Aug 2025 20:58:00 +0900"
2025-08-03 15:26:12,"검찰, '뻥튀기 상장 의혹' 파두 본격 수사 착수…SK하이닉스 자료 확보",https://n.news.naver.com/mnews/article/421/0008408513?sid=102,<b>반도체</b> 설계 업체 파두의 '뻥튀기 상장' 의혹을 수사하는 검찰이 최근 핵심 거래처인 SK하이닉스 본사에서 관련 자료를 확보하는 등 수사에 착수했다. 서울남부지검 금융증권범죄합동수사부는 지난달 초 SK하이닉스... ,"Sun, 03 Aug 2025 20:56:00 +0900"
2025-08-03 15:26:12,전남도 ‘에너지 수도 조성’ 탄력 받는다,http://www.kwangju.co.kr/article.php?aid=1754219100787596277,김영록 전남도지사는 “차세대 전력망 혁신기지와 함께 대한민국 에너지 대전환의 새 역사를 전남도에서 시작할 것”이라며 에너지 산업을 ‘제2의 <b>반도체</b> 산업’으로 성장시켜나가겠다고 밝혔다. 정부가 발표한... ,"Sun, 03 Aug 2025 20:46:00 +0900"
