DateTime,Title,Link,Description,PubDate
2025-07-20 20:27:43,"[사설] 노란봉투법, 법인세… 재계 숨죽이는데 성장 가능하겠나",https://n.news.naver.com/mnews/article/081/0003559321?sid=110,"수출 둔화와 <b>반도체</b> 업황 부진 등에 따른 기업실적 악화가 가장 큰 요인이다. 구 장관은 “경제협력개발기구... 미국, 일본처럼 국내생산 촉진세제 도입, <b>반도체</b> 등 전략산업에 대한 파격적 세제 지원도 속도를 내야 할... ","Mon, 21 Jul 2025 05:16:00 +0900"
2025-07-20 20:27:43,최태원 회장 “韓 제조업 ‘노화 단계’… AI 통해 재건 못 하면 10년 내...,https://n.news.naver.com/mnews/article/081/0003559277?sid=101,최 회장은 오는 10월 말 경주 아시아태평양경제협력체(APEC) 정상회의와 관련해 “관세 문제 해결이나 AI·<b>반도체</b>·조선 등 산업 협력 관련 계약이 많이 체결되길 기대한다”면서 ﻿충실한 준비를 해야 한다고 당부했다.,"Mon, 21 Jul 2025 05:03:00 +0900"
2025-07-20 20:27:43,조선업 호황 실감 못하는 청년들 “재하청 일했더니 일당 고작 5만원”...,https://n.news.naver.com/mnews/article/081/0003559256?sid=102,박봉·고용 불안으로 젊은층 기피 원·하청 양분된 이중구조가 문제 <b>반도체</b> 공장·석화 공단으로 이직... 조선업 종사자들과 거제 주민들은 젊은 기술자들이 거제를 떠나 <b>반도체</b> 공장이나 석유화학 공단이 있는 경기... ,"Mon, 21 Jul 2025 05:02:00 +0900"
2025-07-20 20:27:43,삼성 <b>반도체</b> '1등 DNA' 재시동…차세대 ‘HBM4’ 양산 속도 [ET의 칩스토...,https://www.etoday.co.kr/news/view/2489127,이투데이=박민웅 기자 | 글로벌 기술 패권 경쟁 속 <b>반도체</b>의 가치는 ‘핵무기’와 동급으로 불립니다. 국가 안보 핵심 자산이자 국력과 직결된 전략 산업이죠. 첨단 <b>반도체</b> 기술의 지배력은 글로벌 기술 패권과 군사... ,"Mon, 21 Jul 2025 05:02:00 +0900"
2025-07-20 20:27:43,엇갈리는 <b>반도체</b> 투심…BofA는 SK하닉 목표가 40만원으로 상향 [이런국장...,https://n.news.naver.com/mnews/article/011/0004511373?sid=101,"HBM 공급 과잉을 우려한 골드만삭스의 전망과 달리, BofA는 신규 그래픽처리장치(GPU)와 주문형<b>반도체</b>(ASIC)... AI <b>반도체</b> 판매 재개가 논의되고 있고, 엔비디아 외 고객사의 HBM 수요 비중도 올해 34%에서 내년 44%로... ","Mon, 21 Jul 2025 05:01:00 +0900"
2025-07-20 20:27:43,[사설]노란봉투법에 법인세 인상까지…기업주도 성장 맞나,https://n.news.naver.com/mnews/article/018/0006069418?sid=110,하지만 지난해 법인세 급감은 2023년 <b>반도체</b> 업황이 극도로 부진한 탓이 크다. 가뜩이나 힘든 마당에 세율까지 오르면 기업들로선 엎친 데 덮친 격이다. 김영훈 고용노동부 장관 후보자는 청문회에서 노란봉투법을 곧바로... ,"Mon, 21 Jul 2025 05:01:00 +0900"
2025-07-20 20:27:43,[목멱칼럼]관세전쟁 피난처 될 CPTPP,https://n.news.naver.com/mnews/article/018/0006069419?sid=110,"특히 <b>반도체</b> 및 주요 광물 분야에서의 협력 필요성을 역설하고 있다. 지난 5월 말 열린 한일경제인회의에서 양국 경제인들은 인공지능(AI), <b>반도체</b>를 비롯한 경제 협력을 확대하고 한국의 CPTPP 가입을 위해 협력하기로... ","Mon, 21 Jul 2025 05:01:00 +0900"
2025-07-20 20:27:43,[경기 시·군 리더의 힘]정장선 시장 “평택의 혁신에는 끝이 없다”…...,https://n.news.naver.com/mnews/article/030/0003333297?sid=105,"“평택은 <b>반도체</b>, 수소, 미래차, 인공지능(AI) 등 미래 전략산업을 집적해 산업 혁신과 삶의 질을 함께 높이는... 평택시는 삼성전자 평택캠퍼스 추가 FAB 신설, 국가첨단전략산업 <b>반도체</b> 특화단지 지정 등 미래 핵심산업을... ","Mon, 21 Jul 2025 05:01:00 +0900"
2025-07-20 20:27:43,구글이 은행되는 시대…지니어스 법안 통과의 '무서운' 의미[경제적본능...,https://n.news.naver.com/mnews/article/079/0004047021?sid=101,"투자, <b>반도체</b> 수출 제한, 관세 확대 등을 통해 생산성 향상을 꾀하며 공격적인 성장 전략을 취하고 있는 것 -스테이블코인은 그 연장선상에서 타국의 가치를 흡수하는 수단, 일종의 금융 침략 무기 트럼프의 관세정책과... ","Mon, 21 Jul 2025 05:01:00 +0900"
2025-07-20 20:27:43,‘수출 의존국’의 숙명…한국 경제의 구조적 한계와 극복 과제 [K-5000 ...,https://www.etoday.co.kr/news/view/2489307,"<b>반도체</b>, 자동차, 석유화학 등 특정 품목에 지나치게 의존하는 수출 구조는 글로벌 경기 둔화나 공급망 충격에 민감하게 흔들리는 구조적 한계를 노출하고 있다. 한국은 경제 규모 대비 수출액이 주요국과 비교했을... ","Mon, 21 Jul 2025 05:00:00 +0900"
2025-07-20 20:27:43,<b>반도체</b>를 버렸다? 벼렸다…LG그룹 '복수혈전 26년',https://n.news.naver.com/mnews/article/025/0003456454?sid=105,"1999년 ‘<b>반도체</b> 빅딜’이 몰고 온 변화 경제+ <b>반도체</b> 산업에는 기술 뿐 아니라 사람과 권력, 시대가 얽혀 있다. 순간의 결정이 이후 산업 지형을 크게 바꾸는데, 결정 이면에는 정치권의 입김, 시장 사이클, 오너의... ","Mon, 21 Jul 2025 05:00:00 +0900"
2025-07-20 20:27:43,"[사설] 국민의힘 당 대표 선거, 인적 청산 아닌 정체성 쇄신 경쟁이어야",https://n.news.naver.com/mnews/article/088/0000960006?sid=110,"당 정체성 쇄신을 위해서는 당헌·당규 개정을 통해 당 운영 투명성과 공정성 확보, 100% 상향식 공천제 도입, 당원소환제(당 소속 공직자나 당직자 해임 요구 제도) 도입, 당 소속 의원 여론 정기 평가와 상벌, AI·<b>반도체</b>... ","Mon, 21 Jul 2025 05:00:00 +0900"
2025-07-20 20:27:43,[주간경제전망] 미 경기선행지수 등 발표… 테슬라·인텔 성적표 공개,https://n.news.naver.com/mnews/article/417/0001090312?sid=101,"지난 10일까지는 <b>반도체</b>와 자동차, 선박 수출 호조에 힘입어 전년 대비 9.5% 증가했다. 이날 일본 증시는 바다의 날을 맞아 휴장이다. 22일 화요일에는 한국은행이 지난달 생산자물가를 발표한다. 소비자물가지수는... ","Mon, 21 Jul 2025 05:00:00 +0900"
2025-07-20 20:27:43,"‘AI 꿈 실현한 엔비디아, 4조 달러로 성장하며 세상을 새롭게’",http://www.g-enews.com/ko-kr/news/article/news_all/202507201805014585fbbec65dfb_1/article.html,"최근 인공지능(AI) <b>반도체</b> 기업 엔비디아(Nvidia)가 시가총액 4조 달러(약 5570조 원)를 넘어서 세계에서 가장... 그 결과 엔비디아 <b>반도체</b>는 챗GPT 같은 대형 AI 모델뿐 아니라, 고객 상담·의료 영상 등 다양한 산업의... ","Mon, 21 Jul 2025 04:56:00 +0900"
2025-07-20 20:27:43,"&quot;트럼프·시진핑, 10월 경주 APEC 계기 정상회담 가능성&quot;",https://n.news.naver.com/mnews/article/277/0005625189?sid=104,"(EAS) 외교장관회의·아세안 지역안보포럼(ARF) 외교장관회의를 계기로 회담을 갖고 정상회담 개최 의지를 확인했다. 미·중 정상회담이 성사될 경우 관세, 펜타닐, 희토류, <b>반도체</b> 등 핵심 현안이 논의될 것으로 보인다.","Mon, 21 Jul 2025 04:20:00 +0900"
2025-07-20 20:27:43,녹록지 않은 세입여건…'尹정부 감세정책' 하나둘 되돌리나,https://n.news.naver.com/mnews/article/008/0005224243?sid=101,그러나 이재명 정부에서 <b>반도체</b> 생산세액공제 등을 추진하고 있다는 점에서 정책 엇박자를 우려하는 시선도 있다. 이 대통령의 공약인 생산세액공제는 국내에서 생산·판매된 <b>반도체</b> 등의 물량에 맞춰 법인세를... ,"Mon, 21 Jul 2025 04:10:00 +0900"
2025-07-20 20:27:43,"[초점] 트럼프, 중국과 관계 개선 시도…방중 검토에 기술 규제 완화까...",http://www.g-enews.com/ko-kr/news/article/news_all/2025072022123783329a1f309431_1/article.html,이 과정에서 미국 정부는 인공지능(AI) <b>반도체</b> 수출 규제를 일부 철회하는 등 중국이 민감하게 반응해온 분야에서 양보한 조짐도 나타났다. 트럼프 행정부는 최근 미국 <b>반도체</b> 기업 엔비디아가 중국에 고사양 AI <b>반도체</b> 'H20... ,"Mon, 21 Jul 2025 04:02:00 +0900"
2025-07-20 20:27:43,IT 매체 &quot;엔비디아 AI 칩 'H20' 중국 수출 재개에도 공급은 제한적&quot;,https://n.news.naver.com/mnews/article/214/0001437597?sid=104,보도에 따르면 미국 정부가 지난 4월 H20 칩의 중국 판매를 금지하면서 엔비디아는 중국 고객들의 주문을 취소하고 세계 최대 <b>반도체</b> 위탁생산 업체인 대만 TSMC에 예약했던 생산 용량도 포기했습니다. 이에 대해 젠슨... ,"Mon, 21 Jul 2025 03:59:00 +0900"
2025-07-20 20:27:43,&quot;엔비디아 AI 칩 H20 중국 수출 재개에도 '공급 제한적'&quot;,https://n.news.naver.com/mnews/article/001/0015518839?sid=104,보도에 따르면 미국 정부가 지난 4월 H20 칩의 중국 판매를 금지하면서 엔비디아는 중국 고객들의 주문을 취소하고 세계 최대 파운드리(<b>반도체</b> 위탁생산) 업체 대만 TSMC에 예약했던 생산 용량도 포기했다. TSMC는... ,"Mon, 21 Jul 2025 03:27:00 +0900"
2025-07-20 20:27:43,"전석훈, 'AI 도의원' 선언…경기도 첨단산업 판 바꾼다",https://n.news.naver.com/mnews/article/030/0003333295?sid=105,"“경기도가 초연결·초융합·초지능 혁신 생태계를 바탕으로 인공지능(AI), 바이오, <b>반도체</b> 등 첨단산업의... 전 부위원장은 “미래과학협력위원회의 핵심 역할은 경기도가 AI, 바이오, <b>반도체</b> 등 미래 핵심 산업에서... ","Mon, 21 Jul 2025 03:04:00 +0900"
2025-07-20 20:27:43,"최태원 “韓제조업 10년 잃고 노화, AI로 일으켜 세워야”",https://n.news.naver.com/mnews/article/020/0003649219?sid=101,최 회장은 “지금의 사태에 이를 것이라고 10년 전부터 많은 사람들이 경고했지만 불행히도 잘 받아들여지지 않았다”며 “이제 석유화학은 중국의 경쟁 상대가 안 되고 <b>반도체</b>도 미국의 제재가 오히려 중국의 추격을... ,"Mon, 21 Jul 2025 03:03:00 +0900"
2025-07-20 20:27:43,막오른 ‘2나노 전쟁’… 삼성전자 “반격 기회” 총력전,https://n.news.naver.com/mnews/article/020/0003649201?sid=101,"삼성전자와 대만 TSMC 모두 올해 하반기 2nm(나노미터·1nm는 10억분의 1m) <b>반도체</b> 생산계획을 밝히고, 일본 라피더스도 2나노 시제품 제작에 성공함에 따라 글로벌 <b>반도체</b> 기업들의 ‘2나노’ 전쟁에 본격적인 막이... ","Mon, 21 Jul 2025 03:02:00 +0900"
2025-07-20 20:27:43,"“상속-증여세 40%로 인하”… 경총, 정부에 건의안 제출",https://n.news.naver.com/mnews/article/020/0003649199?sid=101,"경총은 우선 <b>반도체</b>, 인공지능(AI) 등 첨단 기술에 투자하는 기업들에 현금으로 세금을 돌려주는 ‘세액공제 직접 환급제’ 도입을 요청했다. 경총은 “기업들이 대규모 투자를 단행해도, 그해 영업 적자가 나 납부할... ","Mon, 21 Jul 2025 03:02:00 +0900"
2025-07-20 20:27:43,"[DBR]中企 해외 진출, ‘경쟁자와의 협력’이 안전판",https://n.news.naver.com/mnews/article/020/0003649169?sid=101,"2000년대 초반까지 소니와 삼성은 TV, 오디오, <b>반도체</b> 등 전자제품 전반에 걸쳐 치열하게 경쟁해 왔다. 특허 분쟁이나 기술 유출 논란으로 긴장감이 고조되기도 했지만 2004년 두 기업은 뜻밖에 손을 잡고 LCD 합작사 ‘S... ","Mon, 21 Jul 2025 03:01:00 +0900"
2025-07-20 20:27:43,[‘보험인의 행복한 책 읽기’]美·中 기술패권전쟁 시대 생존 전략,http://www.insnews.co.kr/design_php/news_view.php?num=84763&firstsec=5&secondsec=58,미·중 갈등과 무역 전쟁 등으로 인해 한국과 중국이 거리를 두지만 여전히 ‘<b>반도체</b>’라는 공통의 자녀... 미국은 첨단 <b>반도체</b> 기술은 세계 최고지만 생산공장이 없고 중국은 공장을 갖췄으나 기술력이 부족하다. 반면... ,"Mon, 21 Jul 2025 02:08:00 +0900"
2025-07-20 20:27:43,"&quot;트럼프-시진핑, 경주 APEC 정상회의 전후로 회담 가능성 커&quot;(종합)",https://n.news.naver.com/mnews/article/001/0015518833?sid=104,"이처럼 트럼프 대통령과 시 주석이 올해 APEC 정상회담을 계기로 만나게 된다면 관세뿐 아니라 펜타닐, 희토류, <b>반도체</b> 등 미중간 갈등 요인이 된 각종 이슈에 대해 논의할 것으로 예상되며 정상간 모종의 합의가... ","Mon, 21 Jul 2025 01:40:00 +0900"
2025-07-20 20:27:43,미 대중국 AI칩 수출 재개에...K-<b>반도체</b> '숨통',https://n.news.naver.com/mnews/article/052/0002221981?sid=101,우리 <b>반도체</b> 업체들도 일단 한숨 돌릴 수 있게 됐습니다. 하지만 또 언제 터질지 모르는 미중 갈등에 우리 기업들만 노심초사하는 건 여전하다는 한계도 뚜렷합니다. 박기완 기자가 보도합니다. [기자] 미국이 <b>반도체</b>... ,"Mon, 21 Jul 2025 01:10:00 +0900"
2025-07-20 20:27:43,“새로운 시각” 좋지만 이해관계 조율 정치력도 필요하다 [최수문 선임...,https://n.news.naver.com/mnews/article/011/0004511367?sid=103,"길-관광은 <b>반도체</b> 산업 이후의 새로운 국가 성장동력’이 관심을 모으고 있다. 책은 최 후보자를 비롯해 당시 장수청 미국 퍼듀대 호텔관광대 교수, 최규완 경희대 호텔관광대 교수, 이수진 야놀자 대표, 배보찬 야놀자... ","Mon, 21 Jul 2025 01:08:00 +0900"
2025-07-20 20:27:43,“韓 제조업 잃어버린 10년… AI로 일으키지 못하면 대부분 퇴출”,https://n.news.naver.com/mnews/article/023/0003918251?sid=101,"최 회장은 “한국이 석유화학 등에서 이제 중동이나 인도, 중국의 경쟁 상대가 되지 않는다”면서 “<b>반도체</b>도 우리가 생각하는 것보다 중국의 추격 속도가 상당히 빠르다”고 털어놨다. “미국이 수출을 제한하는 바람에... ","Mon, 21 Jul 2025 00:33:00 +0900"
2025-07-20 20:27:43,[중국 전기차 곡소리 ①] 보조금이 낳은 착각,https://www.news2day.co.kr/article/20250721500001,"중국 정부는 전기차를 단순한 탈탄소 수단이 아닌, <b>반도체</b>와 배터리, AI, 스마트제조 등 첨단기술의 집약체로 인식하며, ‘메이드 인 차이나 2025’ 전략의 핵심 산업으로 육성했다. CATL과 BYD 등 배터리 대기업은... ","Mon, 21 Jul 2025 00:30:00 +0900"
2025-07-20 20:27:43,"[김동호의 시선] 기업가정신, 한국은 식고 중국은 뜨겁다",https://n.news.naver.com/mnews/article/025/0003456419?sid=110,화웨이는 스마트폰은 물론 전기차·<b>반도체</b>·클라우드·인공지능(AI)까지 영역을 넓히고 있다. 한국에선 중국의 진전을 보고도 위기감이 없다. 중국에선 기술자가 영웅 대접을 받으며 매년 500만 명의 과학기술 인재를... ,"Mon, 21 Jul 2025 00:26:00 +0900"
2025-07-20 20:27:43,"“이젠 성과 보여야”… ‘정중동’ 이재용, 시동은 언제?",https://n.news.naver.com/mnews/article/005/0001790877?sid=101,주력인 <b>반도체</b>의 경쟁력도 예전 같지 않다. 재계 관계자는 “이제는 족쇄가 해소된 만큼 이 회장이 경영 리더십을 입증하려면 실적을 보여주는 수밖에 없다. 부담이 결코 작지 않을 것”이라고 말했다. 또 다른 재계... ,"Mon, 21 Jul 2025 00:23:00 +0900"
2025-07-20 20:27:43,세제 개편 앞두고… 경총 “상속·증여세 40%로 낮춰달라”,https://n.news.naver.com/mnews/article/005/0001790875?sid=101,"한국경영자총협회(경총)가 정부에 <b>반도체</b> 같은 첨단산업이나 문화·콘텐츠 산업 등 유망산업에 대한 과감한... 거론하며 <b>반도체</b>, AI, 미래차 등 첨단기술에 투자하는 기업들이 영업 적자가 발생하더라도 투자에 대한 세제... ","Mon, 21 Jul 2025 00:16:00 +0900"
2025-07-20 20:27:43,[중국읽기] 휴머노이드는 뭘 먹고 자라나,https://n.news.naver.com/mnews/article/025/0003456408?sid=110,"자동차·<b>반도체</b> 등 제조 공장에 배치되기 시작했다는 게 이 회사 설명이다. 자체 개발한 로봇 두뇌인... 이 회사는 자동차, <b>반도체</b>, 공항 등의 분야에서 여러 회사와 협력 계약을 맺고 로봇을 훈련시키고 있다. 올해 두... ","Mon, 21 Jul 2025 00:14:00 +0900"
2025-07-20 20:27:43,[사설] &quot;쌀·소고기 양보 말라&quot;는 與 의원들…전체 국익도 고려해야,https://n.news.naver.com/mnews/article/015/0005160314?sid=110,자동차(25%)와 철강(50%)에 이어 <b>반도체</b>와 의약품도 품목별 관세가 예고된 상태다. 만약 이 관세율이 그대로 유지된다면 거대 시장인 미국 수출은 큰 차질을 빚을 수밖에 없다. 그렇다고 생명줄이나 마찬가지인 수출을... ,"Mon, 21 Jul 2025 00:11:00 +0900"
2025-07-20 20:27:43,농협은행 '강원형 전략산업 투자펀드' 20억원 출자,https://n.news.naver.com/mnews/article/654/0000132478?sid=101,"강원형 전략산업 투자펀드는 <b>반도체</b>, 바이오·헬스, 미래에너지 등 7대 미래산업을 중심으로 도내 중소·벤처·창업기업의 성장을 돕고 첨단산업 생태계를 조성하는 것을 목표로 한다. 이번 농업은행의 참여로 모(母)... ","Mon, 21 Jul 2025 00:10:00 +0900"
2025-07-20 20:27:43,"[김한진의 마켓 나우] 주식시장에서 변하는 것, 변하지 않는 것",https://n.news.naver.com/mnews/article/025/0003456403?sid=110,"수년 전, 4차 산업혁명의 큰 흐름을 제대로 읽고 인공지능(AI), 클라우드 서비스, 고대역폭 <b>반도체</b>, 그에 따른 전력 수요까지 간파했다면 변화무쌍했던 증시환경 속에서도 우리의 주식계좌는 두둑해져 있을 것이다. 그뿐이... ","Mon, 21 Jul 2025 00:08:00 +0900"
2025-07-20 20:27:43,"유효준 의원 &quot;경기국제공항, '혈세낭비' 용인경전철과 닮은 꼴&quot;",https://www.thereport.co.kr/news/articleView.html?idxno=67696,<b>반도체</b>처럼 첨단 수출품이 항공 운송을 통해 나간다고 하지만 그 비중은 전체 항공화물의 0.05%에도 미치지 못한다는 설명이다. 유 의원은 여객운송 측면에서도 &quot;현재 수요 예측은 예견되는 탄소세와 지속가능항공유(SAF)... ,"Mon, 21 Jul 2025 00:04:00 +0900"
2025-07-20 20:27:43,"[사설]'AI-<b>반도체</b> 전문가' 1만명 양성, 기대가 크다",https://n.news.naver.com/mnews/article/087/0001130861?sid=110,"강원특별자치도가 인공지능(AI)과 <b>반도체</b> 분야의 융합 전문인력 1만명 양성이라는 대규모 계획을 내걸고... 국가적으로도 AI와 <b>반도체</b> 분야 인력난은 심각한 수준이다. 한국<b>반도체</b>산업협회는 2031년까지 약 5만4,000명의... ","Mon, 21 Jul 2025 00:01:00 +0900"
2025-07-20 20:27:43,[사설] “10년 후 한국 제조업 퇴출” 섬뜩한 경고,https://n.news.naver.com/mnews/article/023/0003918239?sid=110,<b>반도체</b>·석유화학 등 한국의 주력 업종을 이끄는 재계 2위 SK그룹 총수의 진단이어서 더 뼈아프게 들린다.... 산업연구원에 따르면 한국은 13개 주요 제조 업종 중 <b>반도체</b> 하나를 빼고 12개 전 업종에서 중국에 뒤졌다.... ,"Mon, 21 Jul 2025 00:01:00 +0900"
2025-07-20 20:27:43,"한국경영자총협회, &quot;<b>반도체</b>·AI·미래차 등 전략산업 직접 보조금 지급...",http://www.econonews.co.kr/news/articleView.html?idxno=397015,"한국경영자총협회(경총)는 20일 <b>반도체</b>, AI, 미래차 등 일부 전략산업에 대해 직접 보조금을 지급할 것을... 현행 조세특례제한법상 전기차 배터리를 비롯해 <b>반도체</b>, 바이오 등 국가 전략 기술에 해당하는 업종에 속한... ","Sun, 20 Jul 2025 23:50:00 +0900"
2025-07-20 20:27:43,[농정춘추] 트럼프 무역전쟁에 대항할 농업 협상 카드,http://www.ikpnews.net/news/articleView.html?idxno=67803,"자동차, <b>반도체</b>, 세탁기, 냉장고 등은 이미 현대·삼성·SK 등 대기업별로 수백억달러씩을 대미 직접 투자해 현지생산을 확대한다고 하니 트럼프 관세 도발을 알아서 피해갈 것이다. 이에 총 100억달러 정도에 불과한... ","Sun, 20 Jul 2025 22:56:00 +0900"
2025-07-20 20:27:43,"협동 로봇 시장, 바닥 찍고 새로운 성장 사이클 진입",https://www.irobotnews.com/news/articleView.html?idxno=41321,"그러나 2024년 하반기부터 <b>반도체</b>와 전자 부문이 회복세를 보였으며, 자동차 산업의 견조한 수요도 협동 로봇 시장의 하방 압력을 일부 상쇄했다. 인터랙트 애널리시스는 협동로봇 시장이 2025년부터 가속화 단계에... ","Sun, 20 Jul 2025 22:54:00 +0900"
2025-07-20 20:27:43,[하승수 칼럼] 지역부터 정치ㆍ사회대개혁을,http://www.mygoyang.com/news/articleView.html?idxno=84979,"<b>반도체</b> 공장은 수도권에 짓고, 전기는 비수도권 지역에서 생산해서 끌고 가려고 한다. 서울 강남에는 송전탑은 고사하고 전봇대도 찾아보기 어려운데, 비수도권에는 어마어마한 송전탑을 세운다고 한다. 그러면서 비수도권... ","Sun, 20 Jul 2025 22:48:00 +0900"
2025-07-20 20:27:43,"엔카닷컴, 우수 인재 채용 위해 '2025 첨단산업·디지털 인재 취업박람...",https://www.econovill.com/news/articleView.html?idxno=704242,'2025 첨단산업 디지털 인재 취업박람회'는 대한상공회의소의 첨단산업·디지털 선도기업 아카데미 수료자를 대상으로 한 취업 지원 프로그램으로 인공지능(AI)·소프트웨어·<b>반도체</b> 등 첨단산업을 선도하는 국내 대표... ,"Sun, 20 Jul 2025 22:02:00 +0900"
2025-07-20 20:27:43,"위성락, 11일 만에 또 방미…“관세 몇퍼센트 내리는 게 목표”",https://n.news.naver.com/mnews/article/028/0002757010?sid=100,"트럼프 대통령이 합의를 이끌어낸 영국, 베트남, 인도네시아 등에 견줘 <b>반도체</b>·조선·배터리·에너지·인공지능(AI) 등에서 미국과 협력할 분야가 많다는 점을 강점으로 내세울 것으로 보인다. 다만 미국이 강하게 요구하는... ","Sun, 20 Jul 2025 21:58:00 +0900"
2025-07-20 20:27:43,현대청운고 '양자 얽힘' 특강,https://www.ulsanpress.net/news/articleView.html?idxno=555341,울산대학교(총장 오연천) 신소재·<b>반도체</b>융합학부 임지순 석좌교수가 지난 17일 울산 동구에 위치한 현대청운고등학교에서 고등학생들을 대상으로 과학특강을 열었다. 이번 특강은 한국과학기술한림원이 주관하는... ,"Sun, 20 Jul 2025 21:42:00 +0900"
2025-07-20 20:27:43,&quot;기업 혁신·경제활력 위한 세제 개편 필요&quot;,https://www.idaegu.co.kr/news/articleView.html?idxno=517162,"<b>반도체</b>, 인공지능(AI), 미래차 등 첨단 기술에 투자하는 기업들이 당해 영업 적자가 발생하더라도 투자에 대한 세제 지원을 적시에 받을 수 있도록 '세액공제 직접 환급제'를 도입해야 한다고 요청했다. 기업들이 경쟁력... ","Sun, 20 Jul 2025 21:34:00 +0900"
2025-07-20 20:27:43,"경북대, 과기부 ‘오픈랩 사업’ 5년 연속 선정",https://www.ksmnews.co.kr/news/view.php?idx=552457,"경북대가 구성한 오픈랩은 총 8개로, △이차전지 진단기술 고도화 오픈랩 △<b>반도체</b> 기반 바이오센서 오픈랩 △탄소기반 유/무기 하이브리드 부품 소재 사업화 오픈랩 △미래모빌리티 오픈랩 △지속가능 에너지 공정... ","Sun, 20 Jul 2025 21:20:00 +0900"
2025-07-20 20:27:43,"구미시, 로봇ㆍ배터리ㆍ첨단소재 신산업 삼각축 구축",https://www.ksmnews.co.kr/news/view.php?idx=552568,"구미시는 소재·부품 산업을 국가경쟁력의 핵심으로 보고, <b>반도체</b>, 이차전지, 방산, 항공, 우주 등 전략산업에 대응 가능한 기술 기반을 단계적으로 구축하고 있다.지난 1월 준공한 <b>반도체</b>·이차전지부품용 인조흑연... ","Sun, 20 Jul 2025 21:14:00 +0900"
