DateTime,Title,Link,Description,PubDate
2025-09-11 04:48:31,"DB하이텍, 내달 650V GaN HEMT 공정 MPW 지원",https://n.news.naver.com/mnews/article/030/0003349486?sid=105,MPW는 여러 고객이 각각 설계한 <b>반도체</b>를 하나의 웨이퍼 위에 통합해 소량 생산하는 방식이다.... 이번에 개발한 650V E-Mode GaN HEMT는 질화갈륨(GaN) 소재의 <b>반도체</b>다. 기존 규소(Si) 기반의 <b>반도체</b>에 비해 고전압... ,"Thu, 11 Sep 2025 13:47:00 +0900"
2025-09-11 04:48:31,日닛케이 장중 역대 최고치⋯1년새 44%↑,https://www.etoday.co.kr/news/view/2505591,효과가 일본에 상륙했다&quot;라며 &quot;이런 기대감으로 일본 첨단기술 관련 종목이 상승을 주도했다&quot;고 분석했다. 이어 &quot;영국 <b>반도체</b> 설계 대기업을 산하에 둔 소프트뱅크그룹에도 구매 주문이 몰려 들어갔다&quot;고 해설했다.,"Thu, 11 Sep 2025 13:46:00 +0900"
2025-09-11 04:48:31,"&quot;31만닉스네&quot;…SK하이닉스, 8거래일 연속 상승[핫스탁]",https://www.widedaily.com/news/articleView.html?idxno=277794,따라 <b>반도체</b> 투자심리가 개선된 영향으로 진단된다. 미국 도널드 트럼프 행정부가 SK하이닉스와 삼성전자 등에 대해 미국산 <b>반도체</b> 제조 장비의 중국 공장 반출을 허용하는 방안을 검토한다는 보도가 나온 점도... ,"Thu, 11 Sep 2025 13:46:00 +0900"
2025-09-11 04:48:31,"아이브이웍스, 레이저 증폭기용 8인치 GaN on SiC 웨이퍼 개발",https://n.news.naver.com/mnews/article/030/0003349485?sid=105,"요청으로 8인치 개발에도 성공, 이번에 첫 공급했다. 노영균 아이브이웍스 대표는 “세계에서 경쟁할 수 있는 소재가 될 것”이라며 “성과를 기반으로 국방<b>반도체</b> 공급망 경쟁력 제고에 기여하겠다”고 밝혔다.","Thu, 11 Sep 2025 13:46:00 +0900"
2025-09-11 04:48:31,"기보, 인공지능(AI) 산업 육성 위해 연내 1800억원 신규보증 공급",https://www.ibabynews.com/news/articleView.html?idxno=139091,"또한 '<b>반도체</b>산업 영위기업 특례보증'을 통해 팹리스 등 <b>반도체</b> 분야의 우수 기술기업을 대상으로 R&amp;D, 장비 국산화 등 핵심 분야 자금 조달을 지원하며, ▲최대 200억원 보증한도 ▲보증비율 상향(최대 95%) ▲보증료... ","Thu, 11 Sep 2025 13:44:00 +0900"
2025-09-11 04:48:31,"&quot;李대통령·정청래·김어준 3통 분립 시대 열렸구나&quot;…장동혁, 취임 100일...",https://n.news.naver.com/mnews/article/119/0003001577?sid=100,"장 대표는 &quot;지금도 (미국) 조지아주 사태와 관련해서 국민들은 아무 것도 알지 못하고, (한미) 관세 협상에서 어떤 일이 있었는지 알지 못하지만 (이 대통령이) 돌아오자마자 <b>반도체</b> 규제 강화 소식은 들었다&quot;며 &quot;이재명... ","Thu, 11 Sep 2025 13:43:00 +0900"
2025-09-11 04:48:31,추경 등 정책효과에 경기 회복 긍정적 신호,https://www.sisamagazine.co.kr/news/articleView.html?idxno=517722,"7월 수출은 <b>반도체</b> 업황 호조로 전년 같은 달보다 5.9% 증가했다. 일평균 수출액은 24억 3000만 달러로 전년보다 5.9% 증가했다. 15대 주력 수출품목 중 <b>반도체</b>·자동차 등 증가, 석유제품·화학 등은 감소, 지역별로는 미국... ","Thu, 11 Sep 2025 13:43:00 +0900"
2025-09-11 04:48:31,일본 기술주 중심 상승세…소프트뱅크 9%↑ [Asia오전],https://n.news.naver.com/mnews/article/008/0005249114?sid=101,"간밤 뉴욕증시 기술주 상승 흐름을 이어받아 도쿄증시에서도 소프트뱅크그룹과 어드반테스트 등 인공지능(AI), <b>반도체</b> 관련주가 큰 폭의 오름세를 보인다. 소프트뱅크그룹은 상승폭이 9%를 넘었다. 소프트뱅크는... ","Thu, 11 Sep 2025 13:42:00 +0900"
2025-09-11 04:48:31,"기보, '6대 성장엔진' AI 중점 지원…1800억원 신규보증 공급",https://daily.hankooki.com/news/articleView.html?idxno=1269674,"'<b>반도체</b>산업 영위기업 특례보증'을 통해 팹리스 등 <b>반도체</b> 분야의 우수 기술기업을 대상으로 R&amp;D, 장비 국산화 등 핵심 분야 자금 조달을 지원하며 ▲최대 200억원 보증한도 ▲보증비율 상향(최대 95%) ▲보증료 감면... ","Thu, 11 Sep 2025 13:42:00 +0900"
2025-09-11 04:48:31,"한은, 기준금리 2.5% 동결…가계부채·환율 불안에 신중 기조",https://www.sisamagazine.co.kr/news/articleView.html?idxno=517721,"국내 경제는 건설투자 부진이 이어졌지만, 소비가 회복세를 보이고 <b>반도체</b> 수출이 예상보다 늘어나면서 성장 흐름이 개선됐다. 한은은 올해 실질 국내총생산(GDP) 성장률을 기존 0.8%에서 0.9%로 0.1%포인트 올려 잡았다.... ","Thu, 11 Sep 2025 13:41:00 +0900"
2025-09-11 04:48:31,"[시장 따라잡기] '새 역사' 코스피, 장중·종가 모두 사상 최고치 경신",https://n.news.naver.com/mnews/article/374/0000462650?sid=101,1% 폭등…다우 제외 랠리 - 오라클 폭등에 엔비디아 등 AI <b>반도체</b> 동반 급등 - 나스닥·S&amp;P500 사상 최고 경신…다우 0.48%↓ - '오라클의 미라클' 피해 간 다우…애플 급락 영향 Q. 지금 이재명 대통령 취임 100일 기자회견을... ,"Thu, 11 Sep 2025 13:40:00 +0900"
2025-09-11 04:48:31,대만 발전소 화재로 전력수급 비상…TSMC 피해 가능성,https://n.news.naver.com/mnews/article/079/0004065147?sid=104,파운드리(<b>반도체</b> 위탁생산) 기업 TSMC의 공장 가동에 차질이 우려된다고 대만 언론들이 전했다. 11일... 그러나 전력 소모가 큰 인공지능(AI)과 <b>반도체</b> 산업의 폭풍성장으로 전력 부족 우려가 커지고 있다. 대만은... ,"Thu, 11 Sep 2025 13:40:00 +0900"
2025-09-11 04:48:31,"코스피, 이틀 연속 사상 최고치 경신…정책 기대감에 3340선 돌파",https://www.newswhoplus.com/news/articleView.html?idxno=40036,"정부의 증시 활성화 정책 기대감과 미국 증시 호조, <b>반도체</b>·2차전지 등 기술주의 강세가 맞물리면서... 크게 상향하면서 국내 <b>반도체</b>주와 AI 관련 종목에도 매수세가 몰렸다. 코스닥 역시 소폭 오르며 830선을 유지했다.","Thu, 11 Sep 2025 13:40:00 +0900"
2025-09-11 04:48:31,"기보, ‘인공지능(AI) 산업 육성’ 연내 1800억 원 신규보증 공급",https://n.news.naver.com/mnews/article/082/0001344354?sid=102,"또한 ‘<b>반도체</b>산업 영위기업 특례보증’을 통해 팹리스 등 <b>반도체</b> 분야의 우수 기술기업을 대상으로 R&amp;D, 장비 국산화 등 핵심 분야 자금 조달을 지원하며, △최대 200억 원 보증한도 △보증비율 상향(최대 95... ","Thu, 11 Sep 2025 13:38:00 +0900"
2025-09-11 04:48:31,<b>반도체</b> 클러스터 현장 간담회 참석하는 김민석 총리,https://n.news.naver.com/mnews/article/003/0013475919?sid=101,청사사진기자단 = 김민석 국무총리가 11일 오전 경기 용인시 처인구 <b>반도체</b> 클러스터에서 열린 현장 간담회에 참석하고 있다. 2025.09.11 photo.newsis.com,"Thu, 11 Sep 2025 13:37:00 +0900"
2025-09-11 04:48:31,현장 간담회 참석자들과 인사하는 김민석 총리,https://n.news.naver.com/mnews/article/003/0013475918?sid=101,청사사진기자단 = 김민석 국무총리가 11일 오전 경기 용인시 처인구 <b>반도체</b> 클러스터에서 열린 현장 간담회에서 참석자들과 인사하고 있다. 2025.09.11 photo.newsis.com,"Thu, 11 Sep 2025 13:37:00 +0900"
2025-09-11 04:48:31,"김민석 총리, <b>반도체</b> 클러스터 공사현장 방문",https://n.news.naver.com/mnews/article/003/0013475894?sid=101,청사사진기자단 = 김민석 국무총리가 11일 오전 경기 용인시 처인구 <b>반도체</b> 클러스터 공사현장을 방문해 현황보고를 마친 후 기념촬영장으로 이동하고 있다. 2025.09.11 photo.newsis.com,"Thu, 11 Sep 2025 13:36:00 +0900"
2025-09-11 04:48:31,"김민석 총리, <b>반도체</b> 클러스터 현장 간담회",https://n.news.naver.com/mnews/article/003/0013475913?sid=101,청사사진기자단 = 김민석 국무총리가 11일 오전 경기 용인시 처인구 <b>반도체</b> 클러스터에서 열린 현장 간담회에서 모두발언을 하고 있다. 2025.09.11 photo.newsis.com,"Thu, 11 Sep 2025 13:36:00 +0900"
2025-09-11 04:48:31,현황 보고 받는 김민석 총리,https://n.news.naver.com/mnews/article/003/0013475911?sid=101,"청사사진기자단 = 김민석 국무총리가 11일 오전 경기 용인시 처인구 <b>반도체</b> 클러스터 공사 현장을 방문, 현황을 보고 받고 있다. 2025.09.11 photo.newsis.com","Thu, 11 Sep 2025 13:36:00 +0900"
2025-09-11 04:48:31,<b>반도체</b> 클러스터 공사현장 찾은 김민석 총리,https://n.news.naver.com/mnews/article/003/0013475903?sid=101,청사사진기자단 = 김민석 국무총리가 11일 오전 경기 용인시 처인구 <b>반도체</b> 클러스터 공사현장에서 곽노정 SK하이닉스 CEO 등 관계자들과 기념촬영을 하고 있다. 2025.09.11 photo.newsis.com,"Thu, 11 Sep 2025 13:36:00 +0900"
2025-09-11 04:48:31,"김민석 총리, <b>반도체</b> 클러스터 현장 간담회",https://n.news.naver.com/mnews/article/003/0013475920?sid=101,청사사진기자단 = 김민석 국무총리가 11일 오전 경기 용인시 처인구 <b>반도체</b> 클러스터에서 열린 현장 간담회에서 모두발언을 하고 있다. 2025.09.11 photo.newsis.com,"Thu, 11 Sep 2025 13:36:00 +0900"
2025-09-11 04:48:31,"김민석 총리, <b>반도체</b> 클러스터 현장 간담회",https://n.news.naver.com/mnews/article/003/0013475924?sid=101,청사사진기자단 = 김민석 국무총리가 11일 오전 경기 용인시 처인구 <b>반도체</b> 클러스터에서 열린 현장 간담회에서 모두발언을 하고 있다. 2025.09.11 photo.newsis.com,"Thu, 11 Sep 2025 13:36:00 +0900"
2025-09-11 04:48:31,용인 <b>반도체</b> 클러스터 공사 현장 방문한 김민석 총리,https://n.news.naver.com/mnews/article/003/0013475902?sid=101,"청사사진기자단 = 김민석 국무총리가 11일 오전 경기 용인시 처인구 <b>반도체</b> 클러스터 공사 현장을 방문, 관계자들과 인사하고 있다. 2025.09.11 photo.newsis.com","Thu, 11 Sep 2025 13:36:00 +0900"
2025-09-11 04:48:31,"신용보증기금, 'AI 생태계 활성화를 위한 현장 간담회' 개최",http://www.smedaily.co.kr/news/articleView.html?idxno=337552,"참석자들은 AI 3대 강국의 실현을 위해 전력, <b>반도체</b>, AI 원천기술, AI 활용 서비스 등 AI 생태계가 함께 성장해야 한다는 점에 공감했으며, AI 산업의 리스크를 정부와 정책기관이 분담해 기업 경쟁력을 강화해야 한다는... ","Thu, 11 Sep 2025 13:36:00 +0900"
2025-09-11 04:48:31,용인 <b>반도체</b> 클러스터 건설 현장,https://n.news.naver.com/mnews/article/003/0013475908?sid=101,청사사진기자단 = 11일 오전 경기 용인시 처인구 <b>반도체</b> 클러스터 건설 현장. 2025.09.11. photo@newsis.com,"Thu, 11 Sep 2025 13:36:00 +0900"
2025-09-11 04:48:31,"김민석 총리, <b>반도체</b> 클러스터 현장 간담회",https://n.news.naver.com/mnews/article/003/0013475907?sid=101,청사사진기자단 = 김민석 국무총리가 11일 오전 경기 용인시 처인구 <b>반도체</b> 클러스터에서 열린 현장 간담회에서 모두발언을 하고 있다. 2025.09.11 photo.newsis.com,"Thu, 11 Sep 2025 13:36:00 +0900"
2025-09-11 04:48:31,"용인특례시, ‘2025 용인 <b>반도체</b> 컨퍼런스’ 개최",https://www.nspna.com/news/?mode=view&newsid=776512,용인미디어센터서 <b>반도체</b> 중심도시 도약 전략 공유…산·학·연·관 전문가 한자리에 경기 용인특례시(시장 이상일)는 재단법인 용인시정연구원과 함께 18일 오후 2시 용인미디어센터에서 ‘2025 용인 <b>반도체</b> 컨퍼런스’를... ,"Thu, 11 Sep 2025 13:36:00 +0900"
2025-09-11 04:48:31,<b>반도체</b> 클러스터 공사현장 찾은 김민석 총리,https://n.news.naver.com/mnews/article/003/0013475909?sid=101,청사사진기자단 = 김민석 국무총리가 11일 오전 경기 용인시 처인구 <b>반도체</b> 클러스터 공사현장에서 곽노정 SK하이닉스 CEO 등 관계자들과 기념촬영을 하고 있다. 2025.09.11 photo.newsis.com,"Thu, 11 Sep 2025 13:36:00 +0900"
2025-09-11 04:48:31,<b>반도체</b> 클러스터 공사현장 찾은 김민석 총리,https://n.news.naver.com/mnews/article/003/0013475910?sid=101,청사사진기자단 = 김민석 국무총리가 11일 오전 경기 용인시 처인구 <b>반도체</b> 클러스터 공사현장에서 곽노정 SK하이닉스 CEO 등 관계자들과 기념촬영을 하고 있다. 2025.09.11 photo.newsis.com,"Thu, 11 Sep 2025 13:36:00 +0900"
2025-09-11 04:48:31,"김민석 총리, <b>반도체</b> 클러스터 공사현장 방문",https://n.news.naver.com/mnews/article/003/0013475905?sid=101,청사사진기자단 = 김민석 국무총리가 11일 오전 경기 용인시 처인구 <b>반도체</b> 클러스터 공사현장을 방문해 현황보고를 받고 있다. 2025.09.11 photo.newsis.com,"Thu, 11 Sep 2025 13:36:00 +0900"
2025-09-11 04:48:31,<b>반도체</b> 클러스터 공사현장 찾은 김민석 총리,https://n.news.naver.com/mnews/article/003/0013475898?sid=101,청사사진기자단 = 김민석 국무총리가 11일 오전 경기 용인시 처인구 <b>반도체</b> 클러스터 공사현장에서 곽노정 SK하이닉스 CEO 등 관계자들과 기념촬영을 하고 있다. 2025.09.11 photo.newsis.com,"Thu, 11 Sep 2025 13:36:00 +0900"
2025-09-11 04:48:31,<b>반도체</b> 클러스터 공사현장 찾은 김민석 총리,https://n.news.naver.com/mnews/article/003/0013475899?sid=101,청사사진기자단 = 김민석 국무총리가 11일 오전 경기 용인시 처인구 <b>반도체</b> 클러스터 공사현장에서 곽노정 SK하이닉스 CEO 등 관계자들과 기념촬영을 하고 있다. 2025.09.11 photo.newsis.com,"Thu, 11 Sep 2025 13:36:00 +0900"
2025-09-11 04:48:31,<b>반도체</b> 클러스터 공사현장 찾은 김민석 총리,https://n.news.naver.com/mnews/article/003/0013475906?sid=101,청사사진기자단 = 김민석 국무총리가 11일 오전 경기 용인시 처인구 <b>반도체</b> 클러스터 공사현장에서 관계자들과 기념촬영을 마치고 이동하고 있다. 2025.09.11 photo.newsis.com,"Thu, 11 Sep 2025 13:36:00 +0900"
2025-09-11 04:48:31,"메모리, 현물시장 불안정 '가격은 오르고 거래량 감소'",https://n.news.naver.com/mnews/article/123/0002367953?sid=004,"메모리 <b>반도체</b> 현물 시장에서 디램(DRAM)과 낸드(NAND) 모두 공급업체들이 가격 인상을 시도하고 있으나, 수요 측의 반발이 뚜렷해 시장의 균형은 여전히 불안정한 모습이다. 트렌드포스(TrendForce)의 최근 보고서에... ","Thu, 11 Sep 2025 13:35:00 +0900"
2025-09-11 04:48:31,"IP서비스 역할 정립, 업계가 나섰다...KAIPS, 정책과제 취합·선별 착수",http://www.boannews.com/media/view.asp?idx=139208&kind=,"이번 회의에서는 AI디지털 혁신과 <b>반도체</b>, 바이오, 배터리 등 전략산업 초격차 확보를 비롯해 미래 신산업(우주양자기술첨단소재 등) 집중 육성, 스타트업벤처 지원, 투자 확대, 중소기업 소상공인 지원 등 새정부의... ","Thu, 11 Sep 2025 13:34:00 +0900"
2025-09-11 04:48:31,"모레, 'AI 인프라 서밋 2025'서 AMD 기반 분산 추론 시스템 공개",https://n.news.naver.com/mnews/article/030/0003349472?sid=105,"또 텐스토렌트 하드웨어에 모레의 소프트웨어(SW)를 결합한 차세대 AI <b>반도체</b> 시스템을 처음 선보이고, 엔비디아 대비 뛰어난 가격 경쟁력을 갖춘 다양한 대안도 제시했다. 모레는 이번 행사에서 딥러닝 추론 SW... ","Thu, 11 Sep 2025 13:34:00 +0900"
2025-09-11 04:48:31,"용인특례시, ‘2025 용인 <b>반도체</b> 컨퍼런스’ 개최",https://www.kgnews.co.kr/news/article.html?no=864257,"용인특례시는 재단법인 용인시정연구원과 함께 오는 18일 오후 2시 용인미디어센터에서 ‘2025 용인 <b>반도체</b> 컨퍼런스’를 연다고 11일 밝혔다. 시는 <b>반도체</b> 산업의 글로벌 경쟁력 강화 방안을 모색하고, 산·학·연·관... ","Thu, 11 Sep 2025 13:32:00 +0900"
2025-09-11 04:48:31,"포스코에 매각설 나온 HMM, 최원혁 리더십 주목",https://www.s-journal.co.kr/news/articleView.html?idxno=33482,산업은행은 AI·<b>반도체</b> 등 첨단산업 지원 재원 마련을 위해 HMM 지분 매각 필요성을 강조하고 있다. 공적자금 회수와 산업 구조 재배치라는 정책 명분이 맞물리며 민영화 추진에 힘이 실리고 있다. 매각 속도와 방식은... ,"Thu, 11 Sep 2025 13:32:00 +0900"
2025-09-11 04:48:31,"정부, 일부 규제 대폭 완화해 '<b>반도체</b> 클러스터' 조성 앞당긴다",https://www.asiatoday.co.kr/view.php?key=20250911010006398,규모의 <b>반도체</b> 클러스터 조성 시기를 앞당기기 위해 규제 개선에 나선다. 소방·에너지·건설 관련 규제를 완화함으로써 공장 건설기간을 2개월가량 단축하고 비용을 절감할 계획이다. 김 총리는 11일 용인 <b>반도체</b>... ,"Thu, 11 Sep 2025 13:28:00 +0900"
2025-09-11 04:48:31,李대통령 “대주주 기준 10억 고집 안해”…코스피 상승 흐름,https://n.news.naver.com/mnews/article/018/0006112777?sid=101,"간밤 뉴욕증시에서 오라클 주가가 급등하면서 국내 <b>반도체</b>주에 대한 투자심리를 자극한 것으로 풀이된다. 삼성전자는 전 거래일 대비 200원(0.28%) 오른 7만 2800원, SK하이닉스는 5750원(1.89%) 오른 30만 9750원에... ","Thu, 11 Sep 2025 13:28:00 +0900"
2025-09-11 04:48:31,"신보, 'AI 생태계 활성화를 위한 현장 간담회' 개최",https://www.lcnews.co.kr/news/articleView.html?idxno=110900,"참석자들은 AI 3대 강국의 실현을 위해 전력, <b>반도체</b>, AI 원천기술, AI 활용 서비스 등 AI 생태계가 함께 성장해야 한다는 점에 공감했으며, AI 산업의 리스크를 정부와 정책기관이 분담해 기업 경쟁력을 강화해야 한다는... ","Thu, 11 Sep 2025 13:28:00 +0900"
2025-09-11 04:48:31,"[뉴스분석] 경기도-여당 협력, '원팀' 구호 넘어 정치·정책 동력으로",https://www.asiatime.co.kr/article/20250911500202,"경기도는 이미 <b>반도체</b>·기후경제·AI를 묶은 '미래성장 3대 프로젝트', 주한미군 반환공여구역 개발, 지역거점 혁신 클러스터 구축 등을 통해 국가 전략 산업의 전면에 서 있다. 사실상 '국가 정책 실험실'로서 경기도가 가진... ","Thu, 11 Sep 2025 13:26:00 +0900"
2025-09-11 04:48:31,"산업통상자원부-중국 상무부, 서울서 제2차 수출통제 대화 개최",https://www.newscammp.co.kr/news/articleView.html?idxno=4932,"산업부는 이를 통해 희토류와 핵심광물 등 수급 애로가 발생했을 때 적극적으로 문제를 해결하며 자동차, 전자, <b>반도체</b> 업계의 공급망 안정에 기여해 왔다. 이번 대화는 지난해 7월 베이징에서 열린 1차 회의 이후 1년여... ","Thu, 11 Sep 2025 13:26:00 +0900"
2025-09-11 04:48:31,"용인특례시, '2025 용인 <b>반도체</b> 컨퍼런스' 개최",https://www.pointdaily.co.kr/news/articleView.html?idxno=269071,'2025 용인 <b>반도체</b> 컨퍼런스' 포스터. 용인특례시는 재단법인 용인시정연구원과 함께 18일 오후 2시 용인미디어센터에서 '2025 용인 <b>반도체</b> 컨퍼런스'를 연다고 11일 밝혔다. 시는 <b>반도체</b> 산업의 글로벌 경쟁력 강화 방안을... ,"Thu, 11 Sep 2025 13:26:00 +0900"
2025-09-11 04:48:31,"김민석 총리, 용인 <b>반도체</b> 클러스터에서 현장 점검",https://www.cbci.co.kr/news/articleView.html?idxno=521379,"김민석 국무총리 / 자료사진 김민석 국무총리가 11일 오전 경기도 용인시 처인구에 위치한 <b>반도체</b> 클러스터 공사 현장을 방문했다. 이번 방문은 <b>반도체</b> 산업의 중요성을 강조하고, 관련 사업의 진행 상황을 점검하기 위한... ","Thu, 11 Sep 2025 13:26:00 +0900"
2025-09-11 04:48:31,"신보, ‘AI 생태계 활성화를 위한 현장 간담회’ 개최",https://www.kbsm.net/news/view.php?idx=489523,"신보는 AI 산업 현장의 애로사항과 건의사항을 직접 청취하며 실질적이고 효과적인 지원 방안을 모색했다.참석자들은 전력, <b>반도체</b>, AI 원천기술, AI 활용 서비스 등 AI 생태계 전반의 동반 성장이 필요하다는 데... ","Thu, 11 Sep 2025 13:26:00 +0900"
2025-09-11 04:48:31,"에이엘티, 천병태 대표 자사주 2억원 매입",https://www.widedaily.com/news/articleView.html?idxno=277775,"비메모리 <b>반도체</b> 후공정 테스트 전문기업 에이엘티는 주주가치 제고 및 주가 안정화를 위해 천병태... 에이엘티는 비메모리 <b>반도체</b>, 특히 시스템 <b>반도체</b> 후공정 분야에서 독보적인 기술력과 노하우를 기반으로 안정적인... ","Thu, 11 Sep 2025 13:26:00 +0900"
2025-09-11 04:48:31,"삼성SDS, 국가AI컴퓨팅센터 '검토 중'...&quot;정부 AI 사업에 기여하겠다&quot;",https://www.greened.kr/news/articleView.html?idxno=330995,"데이터센터 구축·운영 기업, AI <b>반도체</b> 기업, 클라우드 서비스 기업 등이 함께 컨소시엄을 구성하도록... 업계에서는 공공지분 51% 유지, 공공출자금 매수청구권, 국산 AI <b>반도체</b> 의무 도입(2030년까지 50%) 등이 과도한... ","Thu, 11 Sep 2025 13:22:00 +0900"
2025-09-11 04:48:31,"日 닛케이, 사상 최고치 경신…소프트뱅크 주가 신기록(상보)",https://news.einfomax.co.kr/news/articleView.html?idxno=4374077,니혼게이자이신문은 &quot;미국 기업 오라클과 엔비디아의 분기 실적 발표 이후 AI용 <b>반도체</b>와 광섬유의 전체 시장 규모(TAM)가 기존 예상보다 클 것이라는 전망이 확산되고 있다&quot;고 분석했다. 토픽스 지수도 오전... ,"Thu, 11 Sep 2025 13:22:00 +0900"
2025-09-11 04:48:31,SEMI &quot;2분기 실리콘 웨이퍼 출하량 증가…긍정적 모멘텀&quot;,https://www.econovill.com/news/articleView.html?idxno=710967,<b>반도체</b> 제조 핵심 소재인 실리콘 웨이퍼 출하량이 글로벌 불확실성 속에도 상승세를 보였다. 11일 국제<b>반도체</b>장비재료협회(SEMI)에 따르면 2분기 전 세계 실리콘 웨이퍼 출하량은 33억2700만in²(제곱인치)를 기록했다.... ,"Thu, 11 Sep 2025 13:22:00 +0900"
