DateTime,Title,Link,Description,PubDate
2025-07-25 05:32:27,日 <b>반도체</b> 희망 '라피더스'도 삼성 자리 넘본다. 2nm공정 30여개 기업과...,https://www.autodaily.co.kr/news/articleView.html?idxno=534031,일본 정부의 전폭적인 지원을 받고있는 일본 <b>반도체</b>의 희망 '라피더스(Rapidus)'가 지난 4월에 시험 생산 라인을 가동한 지 불과 3개월 만에 2nm 시제품을 시연하는 등 파운드리업계의 새로운 강자로 떠오르고 있다.... ,"Fri, 25 Jul 2025 14:30:00 +0900"
2025-07-25 05:32:27,산업장관-러트닉 80분 회담…마지막 1주일 '고비',https://n.news.naver.com/mnews/article/215/0001217646?sid=101,"양측의 만남은 약 80분간 진행된 것으로 알려졌는데요, 김 장관은 조선과 <b>반도체</b>, 배터리 등 전략 제조업 분야 협력을 강조했고, 이를 바탕으로 자동차 등 품목별 관세, 상호관세 완화가 필요하다는 점을 강하게... ","Fri, 25 Jul 2025 14:30:00 +0900"
2025-07-25 05:32:27,"&quot;가만 있으면 절반은 가는데&quot; 테슬라 10년만 최악의 성적표, 입지 좁아진...",https://radio.ytn.co.kr/program/?f=2&id=103989&s_mcd=0206&s_hcd=15,예를 들어서 지금 보면 가장 큰 문제가 되는 게 역시 <b>반도체</b>라든가 자동차라든가 이런 수많은 기업들이 아마... 별로 오른 적도 없고 그다음에 예를 들면 <b>반도체</b> 하나만 하더라도 관세 부과한다고 해도 어차피 미국에도... ,"Fri, 25 Jul 2025 14:30:00 +0900"
2025-07-25 05:32:27,"김정관·여한구, 美러트닉과 80분 협상···조선·<b>반도체</b> 등 제조업 협...",https://www.thepublic.kr/news/articleView.html?idxno=271225,"김 장관은 80분 간 진행된 회담에서 조선·<b>반도체</b>·배터리 등 전략 제조업 분야에서의 양국 간 협력 강화 방안을 소개하고, 자동차 등 품목별 관세 및 상호관세 완화가 필요하다는 점을 강하게 요청했다. 산업부는 김... ","Fri, 25 Jul 2025 14:30:00 +0900"
2025-07-25 05:32:27,"평택시, 브레인시티 핵심 시설 추진 간담회",https://gg.newdaily.co.kr/site/data/html/2025/07/25/2025072500180.html,김경수 KAIST 대외부총장은 “평택 인공지능(AI)<b>반도체</b>혁신캠퍼스를 통해 글로벌 AI <b>반도체</b>시장을 선도할 수 있도록 최선을 다하겠다”고 말했다. 한상욱 아주대의료원장은 “의정사태와 건설 경기 악화로 다소... ,"Fri, 25 Jul 2025 14:28:00 +0900"
2025-07-25 05:32:27,[취재노트] 사법 리스크 벗은 이재용 회장…'뉴삼성' 향한 4가지 시험대,https://www.newsworks.co.kr/news/articleView.html?idxno=804829,"삼성전자는 스마트폰을 제외한 <b>반도체</b>, 가전 등 주력 사업이 최근 고전을 면치 못하고 있다. 특히 '<b>반도체</b> 초격차' 위상이 흔들리는 지금, 이를 회복하는 것이 최우선 과제다. 최근 몇 건의 M&amp;A가 있었지만, 본원적 경쟁력을... ","Fri, 25 Jul 2025 14:28:00 +0900"
2025-07-25 05:32:27,은 가격 올해만 35% 상승…금·비트코인 상승률 제쳐,https://n.news.naver.com/mnews/article/449/0000315957?sid=101,"또 은의 산업재로서 수요가 폭증하기도 했는데 금속 중 전기 전도성이 가장 높은 만큼 전기차와 태양광 패널, <b>반도체</b> 등 신성장 산업에 필수적으로 쓰이게 됩니다. 매년 은 시장 보고서를 발간하는 실버 인스티튜트에... ","Fri, 25 Jul 2025 14:28:00 +0900"
2025-07-25 05:32:27,HBM4·5用 '2세대 하이브리드 본딩'...글로벌 장비업계 새 격전지 되다,http://www.seouleconews.com/news/articleView.html?idxno=85141,한미<b>반도체</b> HBM4용 'TC 본더 4'. 연합뉴스  고대역폭메모리(HBM) 시장 확대에 따라 글로벌 <b>반도체</b> 장비업체들이 하이브리드 본더 사업강화에 나서고 있다. 네덜란드의 베시(BESI)와 싱가포르의 ASMPT는 하반기부터 관련장비... ,"Fri, 25 Jul 2025 14:26:00 +0900"
2025-07-25 05:32:27,"산업부 김정관 장관, 美 상무장관과 관세 협상…&quot;내달 1일 전 타결 목표...",https://www.ntoday.co.kr/news/articleView.html?idxno=117913,25일 산업통상자원부에 따르면 김 장관은 조선·<b>반도체</b>·배터리 등 전략 제조업 분야에서 양국 간 협력 강화 방안을 소개하고 이를 감안해 자동차 등 품목별 관세 및 상호관세 완화가 필요하다는 점을 강하게 요청했다.... ,"Fri, 25 Jul 2025 14:26:00 +0900"
2025-07-25 05:32:27,"제주<b>반도체</b>, 장중 하락세 속 15,180원 유지",https://www.stardailynews.co.kr/news/articleView.html?idxno=495474,"2025년 7월 25일 오후 2시 23분 기준, 시스템<b>반도체</b> 전문 기업 제주<b>반도체</b>(080220)가 전일 대비 10원 하락한 15,180원에 거래되고 있다. 시초가는 15,200원이었으며, 고가는 15,280원, 저가는 15,070원을 기록해 장 내내... ","Fri, 25 Jul 2025 14:26:00 +0900"
2025-07-25 05:32:27,"&quot;있어서 안 될 시장이 존재&quot;…中, 엔비디아칩 밀수 정황",https://n.news.naver.com/mnews/article/018/0006074055?sid=101,"황 CEO는 전날인 베이징 당국자들과의 회동 이후, “중국의 거대한 <b>반도체</b> 시장을 위해 최선을 다하고 있다”고 밝혔다. (사진= AFP) 미국 정부가 수출을 금지한 엔비디아의 첨단 인공지능(AI) 칩 수리에 대한 수요가... ","Fri, 25 Jul 2025 14:26:00 +0900"
2025-07-25 05:32:27,[포토] &quot;IBK창공 마포 15기 IR 데이' 성료,http://www.newsprime.co.kr/news/article.html?no=697656,발표에 나선 기업들은 △<b>반도체</b> 부품 △친환경 소재 △외식 자동화 △우주 광통신 등 다양한 분야에서 실질적인 문제 해결력을 강조했다. 이번 IR을 통해 참여 스타트업들은 후속 투자와 사업 연계 가능성을... ,"Fri, 25 Jul 2025 14:24:00 +0900"
2025-07-25 05:32:27,2026 수시 대학별 특징: 서울시립대·성균관대·숙명여대,https://edu.chosun.com/site/data/html_dir/2025/07/25/2025072580140.html,"또한 인문과학계열은 언어형만 실시하고, 자연계열 중 <b>반도체</b>시스템공, 의예 등 9개 학과는 수리형만 실시된다. 수능최저는 의예과를 제외하면 논술유형과 상관없이 국, 수, 영, 탐1, 탐2 중 3개 합 5~6으로 동일하다. 단... ","Fri, 25 Jul 2025 14:24:00 +0900"
2025-07-25 05:32:27,"[재계는 지금] 삼성전자, '갤럭시Z 7·​워치8' 국내 출시 外",https://dealsite.co.kr/articles/145279,"권석준 성균관대 교수는 &quot;중국은 파운드리, GPU, 공정장비까지 <b>반도체</b> 전 영역을 아우르며 AI 생태계로... 그는 한국의 강점으로 ▲세계적 <b>반도체</b> 생태계 ▲제조업 기반의 디지털 수요 ▲정부의 전략 기획 역량 ▲우수한... ","Fri, 25 Jul 2025 14:24:00 +0900"
2025-07-25 05:32:27,"아이에스티이 주가 불기둥... <b>반도체</b> 장비 국산화 선도, 수소에너지로 ...",https://www.pinpointnews.co.kr/news/articleView.html?idxno=363027,"국내 <b>반도체</b> 장비기업 아이에스티이 주가가 크게 오르고 있다. 25일 한국거래소에 따르면 이날 오후 2시 12분... 기존 <b>반도체</b> 클린룸 장비 제조 기술을 바탕으로 디스플레이, 자동차, 에너지 산업까지 사업영역을... ","Fri, 25 Jul 2025 14:22:00 +0900"
2025-07-25 05:32:27,"김정관 산업장관, 미 상무장관과 협상…관세 완화 필요성 강력 요청",https://www.korea.kr/news/policyNewsView.do?newsId=148946606&call_from=naver_news,"김 장관은 조선·<b>반도체</b>·배터리 등 전략 제조업 분야에서 양국 협력 강화방안을 소개하고, 이를 감안해 자동차 등 품목별 관세와 상호관세 완화가 필요하다는 점을 강력하게 요청했다. 김 장관은 &quot;우리 기업이... ","Fri, 25 Jul 2025 14:21:00 +0900"
2025-07-25 05:32:27,"넥스트칩, 로봇 분야 전담 조직 강화",https://www.newspim.com/news/view/20250725000553,차량용 <b>반도체</b> 전문기업 넥스트칩이 로봇 분야 전담 조직을 강화하고 로봇 시장 진출에 박차를 가한다고 25일 밝혔다. 넥스트칩은 차량용 <b>반도체</b> 개발을 통해 축적한 영상 처리 및 전송 기술력을 바탕으로 급성장하는... ,"Fri, 25 Jul 2025 14:20:00 +0900"
2025-07-25 05:32:27,"한미<b>반도체</b>, '하이브리드 본더' 개발에 1000억 투자",https://n.news.naver.com/mnews/article/011/0004513529?sid=101,한미<b>반도체</b>(042700)는 하이브리드 본딩 기술에 1000억 원을 투자한다고 25일 밝혔다. 이를 통해 2027년 말 하이브리드 본더 장비를 출시할 계획이다. 한미<b>반도체</b>는 내년 하반기 완공을 목표로 인천 서구 주안... ,"Fri, 25 Jul 2025 14:20:00 +0900"
2025-07-25 05:32:27,"SK하이닉스 HBM 사업 놓고 엇갈린 해외증권사 전망, 'HBM 경쟁심화 vs 여...",https://www.businesspost.co.kr/BP?command=article_view&num=404986,25일 <b>반도체</b> 업계 취재를 종합하면 해외 증권사들이 SK하이닉스 HBM 전망과 관련해 다양한 분석을 내놓고 있다. 미국 씨티은행과 골드만삭스는 SK하이닉스의 목표 주가를 낮춰 잡았다. 씨티은행은 기존 43만... ,"Fri, 25 Jul 2025 14:20:00 +0900"
2025-07-25 05:32:27,[한미 관세협상] '2+2 담판' 미뤄졌지만…전문가 &quot;조급할 필요 없어&quot;,https://www.newspim.com/news/view/20250725000538,"김 장관은 조선·<b>반도체</b>·배터리 등 전략 제조업 분야의 한미 협력 강화 방안을 설명하고, 자동차 등 품목별 관세 및 상호관세 완화가 필요하다는 점을 요청한 것으로 알려졌다. 김 장관은 23일(현지시각) 크리스 라이트... ","Fri, 25 Jul 2025 14:19:00 +0900"
2025-07-25 05:32:27,트럼프 &quot;돈 낸 국가에 관세 혜택&quot;…투자 앞세운 新통상론에 세계 긴장,https://www.polinews.co.kr/news/articleView.html?idxno=702080,"한국은 현재 미국과의 무역 협상에서 자동차 관세, 전기차 보조금, <b>반도체</b> 공급망 협력 등 주요 현안을 다루고 있다. 일본보다 유리한 조건을 확보하지 못할 경우 미국 내 한국산 자동차의 가격경쟁력이 저하될 가능성이... ","Fri, 25 Jul 2025 14:18:00 +0900"
2025-07-25 05:32:27,첨단 소재 글로벌 2개사 6000만 달러 유치 [힘쎈충남 브리핑],https://www.kukinews.com/article/view/kuk202507250107,"이 기업은 첨단 소재에 대한 전문성을 바탕으로 글로벌 공급망을 보유하고 있으며, <b>반도체</b>·디스플레이·배터리·우주항공 등 핵심 산업에 필수적인 고순도 희귀가스 공급망을 지속적으로 확장하고 있다. 도와 두... ","Fri, 25 Jul 2025 14:16:00 +0900"
2025-07-25 05:32:27,"李 대통령 만난 재계, 대미 추가 투자 고심...137조원 +α 불가피",https://www.newspim.com/news/view/20250725000562,"규모의 <b>반도체</b> 공장을 짓고 있는데, 현지에 제2공장 등 기존 투자의 2~3배에 달하는 추가 투자를 저울질하고 있다. SK그룹은 배터리 자회사인 SK온과 SK하이닉스의 <b>반도체</b> 후공정 투자 등 다양한 분야의 미국 내 투자... ","Fri, 25 Jul 2025 14:16:00 +0900"
2025-07-25 05:32:27,日 대미투자 760조원 현실성 있나…&quot;선거 공약 같은 모호한 말&quot;,https://n.news.naver.com/mnews/article/003/0013385052?sid=104,"백악관은 설명자료에서 대미 투자가 에너지 인프라, <b>반도체</b>, 핵심 광물, 의약품, 조선 등 미국이 추진하는... 여기에 더해 일본은 트럼프 행정부가 발표 예고한 <b>반도체</b>, 의약품 등 품목 관세에 대해서도 다른 나라보다... ","Fri, 25 Jul 2025 14:14:00 +0900"
2025-07-25 05:32:27,[기고]&quot;대한민국 기술사업화 근본부터 뜯어고쳐라&quot;,https://n.news.naver.com/mnews/article/092/0002383540?sid=105,"<b>반도체</b>나 AI는 기술은 3개월마다 달라진다. 고급인력은 해외로 눈을 돌리고, 기술은 엄청난 속도로 변하고 있다. 대한민국의 과학기술 R&amp;D 정책, 이대로 좋은가? 미래 더 나은 대한민국을 위해서라면 R&amp;D 및 교육체계... ","Fri, 25 Jul 2025 14:14:00 +0900"
2025-07-25 05:32:27,"모빌린트, 코오롱베니트 AI 얼라이언스와 MOU 체결",http://www.boannews.com/media/view.asp?idx=138354&kind=,AI <b>반도체</b> 전문기업 모빌린트(대표 신동주)가 코오롱베니트와 전략적 업무협약(MOU)을 체결하고... 모빌린트는 이번 협약을 계기로 자사의 초저전력고성능AI <b>반도체</b> 기술을 더 빠르고 폭넓게 확산시키는 한편... ,"Fri, 25 Jul 2025 14:14:00 +0900"
2025-07-25 05:32:27,"인하공전, 산업전환 공동훈련센터 성과 평가서 '최우수'",https://n.news.naver.com/mnews/article/003/0013385049?sid=102,"수도권 서북부 자동차 산업 밀집 지역을 기반으로 완성차 및 부품 기업과의 긴밀한 협력 관계를 유지하며, ▲전기차 ▲하이브리드카 ▲자율주행 ▲차량용 <b>반도체</b> ▲차량 통신 기술 등 산업 수요 기반 교육과정을 운영하고... ","Fri, 25 Jul 2025 14:12:00 +0900"
2025-07-25 05:32:27,"노무라 &quot;삼성전자 HBM4 원가, SK하이닉스보다 30% 더 높아&quot;",https://www.businesspost.co.kr/BP?command=article_view&num=404987,<b>반도체</b> 위탁생산) 인력도 메모리 사업부로 배치했던 것으로 전해졌다. 현재 삼성전자의 1c D램의 테스트 수율(정상품 비율)은 양산성이 확보된 65%에 달한 것으로 전해졌다. 다만 일각에서는 삼성전자 <b>반도체</b>의... ,"Fri, 25 Jul 2025 14:10:00 +0900"
2025-07-25 05:32:27,[2025 세제개편안] 법인세 최고세율 24→25%…尹 감세 '원상 복귀' 예고,https://www.newspim.com/news/view/20250725000486,여기에 더해 인공지능(AI)·<b>반도체</b> 등 국가 전략 산업에 대한 재정투자 수요도 커져 세입 확충이 시급한 과제가 됐다는 분석이다. 앞서 구 부총리는 지난 17일 국회 기획재정위원회 인사청문회에서 '법인세율을 원상복구... ,"Fri, 25 Jul 2025 14:07:00 +0900"
2025-07-25 05:32:27,"디노티시아, 한국어 기반 LLM 'DNA 2.0' 공개",https://www.datanet.co.kr/news/articleView.html?idxno=203979,"장기기억 인공지능(AI) 및 <b>반도체</b> 통합 솔루션 전문기업 디노티시아(대표 정무경)는 고성능 거대언어모델(LLM) 'DNA 2.0'을 발표했다. 'DNA 2.0'은 사용자의 명령을 이해하고, 검색·요약·계산 등의 작업을 수행할 수... ","Fri, 25 Jul 2025 14:06:00 +0900"
2025-07-25 05:32:27,"미 상무 “한국, 미일 합의에 욕 했을 것”…산업장관과 1시간 여 회담",https://n.news.naver.com/mnews/article/056/0011996385?sid=104,"조선과 <b>반도체</b>, 배터리 등 전략 산업 분야와 에너지 분야 협력 강화 방안 등이 논의된 걸로 보입니다. 정부 관계자는 구체적인 협상 내용은 일괄 타결에 앞서 공개하기 어렵다며 추가 협상 일정 등도 아직은 정해지지... ","Fri, 25 Jul 2025 14:06:00 +0900"
2025-07-25 05:32:27,"AI 프로젝트 추진하는 臺, 2024년까지 5100억 달러 규모 노린다",https://www.hellot.net/news/article.html?no=103649,"‘10대 AI 인프라 프로젝트’ 가동...글로벌 AI 거점 구축 목표 정보통신기술(ICT)·<b>반도체</b> 역량 통한... 수준의 <b>반도체</b> 제조 역량을 활용해, 글로벌 AI 영향력 있는 국가이자 '스마트 기술 섬(Smart Technology... ","Fri, 25 Jul 2025 14:06:00 +0900"
2025-07-25 05:32:27,"원자력학회 &quot;SMR 특별법, 미래 여는 초석...조속 제정 촉구&quot;",https://n.news.naver.com/mnews/article/014/0005382525?sid=105,"학회는 &quot;최근 여야에서 3건의 SMR 특별법안이 발의된 것은 매우 고무적인 일&quot;이라며 &quot;SMR 특별법이 제정되면 SMR 기술 개발과 실증을 앞당기고 2030년대 글로벌 시장을 선점할 수 있고, SMR을 <b>반도체</b>, 자동차를 잇는 차세대... ","Fri, 25 Jul 2025 14:05:00 +0900"
2025-07-25 05:32:27,"[주간 기업동향] 삼성 이재용 회장, 李대통령과 만찬…관세·AI 투자 논...",https://www.banronbodo.com/news/articleView.html?idxno=30633,"AI <b>반도체</b> 및 데이터센터 협력 방안을 논의한 것으로 알려졌다. 21일 재계에 따르면, 최 회장은 지난주 미국... 업계에선 이번 만남에서 오픈AI가 브로드컴과 함께 추진 중인 맞춤형 AI <b>반도체</b> 개발 사업과 관련해... ","Fri, 25 Jul 2025 14:04:00 +0900"
2025-07-25 05:32:27,"[금융 이모저모] KB금융, 15년간 FTSE4Good 편입…CDP 리더십 A등급도 동...",https://www.greened.kr/news/articleView.html?idxno=329183,"전력공급) △엔비디아(<b>반도체</b> 에너지 효율화 개선) △버티브 홀딩스(데이터센터 전력 및 냉각 시스템)가 있다. 또한, 빠르게 변화하는 블록체인 및 가상자산 시장에도 대응하고 있다. 재생에너지 기반의 블록체인... ","Fri, 25 Jul 2025 14:03:00 +0900"
2025-07-25 05:32:27,"한미<b>반도체</b>, 하이브리드 본더 개발에 1000억원 투자",https://n.news.naver.com/mnews/article/018/0006074015?sid=101,고대역폭 메모리(HBM)용 TC본더 세계 1위 기업인 한미<b>반도체</b>(042700)는 하이브리드 본딩 기술에 1000억원을 투자한다고 25일 밝혔다. 한미<b>반도체</b>의 하이브리드 본더 공장 조감도.(사진=한미<b>반도체</b>) 한미<b>반도체</b>는... ,"Fri, 25 Jul 2025 14:03:00 +0900"
2025-07-25 05:32:27,[직설] 2+2 통상협의 돌연 취소에 코스피 주춤?…관세 협의 시장 상황은...,https://n.news.naver.com/mnews/article/374/0000453878?sid=101,우리나라 수출에서 있어서 자동차만큼 <b>반도체</b>도 중요한 비중을 차지하고 하고 있습니다. 그런데 트럼프 대통령은 <b>반도체</b> 관세도 예고를 한 상황인데요. 그런데 AI 패권을 내세운 트럼프 대통령 입장에선 <b>반도체</b> 공급도... ,"Fri, 25 Jul 2025 14:03:00 +0900"
2025-07-25 05:32:27,"신한운용, ‘글로벌탄소중립솔루션 펀드’ 환매주기 ‘8→4’ 영업일 단...",https://www.news2day.co.kr/article/20250725500157,엔비디아(<b>반도체</b> 에너지 효율화 개선) △ 버티브 홀딩스(데이터센터 전력 및 냉각 시스템)다. 또한 빠르게 변화하는 블록체인 및 가상자산 시장에도 대응하고 있다. 재생에너지 기반의 블록체인 채굴 산업과 탄소중립... ,"Fri, 25 Jul 2025 14:02:00 +0900"
2025-07-25 05:32:27,"김태흠 지사, 프랑스 에어리퀴드 글로벌 CEO 만나 '충남 세일즈'",https://www.newscj.com/news/articleView.html?idxno=3297934,"에어리퀴드는 산업 및 의료용 기초·특수가스 글로벌 선도 기업으로, 첨단 소재에 대한 전문성을 바탕으로 글로벌 공급망을 보유하고 있으며, <b>반도체</b>·디스플레이·배터리·우주항공 등 핵심 산업에 필수적인 고순도... ","Fri, 25 Jul 2025 14:00:00 +0900"
2025-07-25 05:32:27,이재명 대통령이 이재용 삼성전자 회장과 만난 속사정,https://www.m-joongang.com/news/articleView.html?idxno=401431,삼성전자는 370억 달러(약 53조원) 규모의 <b>반도체</b> 파운드리 공장을 미국에 짓기로 발표한 상황이다. 현대차... 이밖에 SK그룹도 <b>반도체</b> D램 세계 1위로 올라선 SK하이닉스가 38억 달러 규모의 미국 투자를 확정한 가운데... ,"Fri, 25 Jul 2025 14:00:00 +0900"
2025-07-25 05:32:27,새만금국가산단 입주 기업들.. RE100 산단 지정 정부 호소,https://www.gukjenews.com/news/articleView.html?idxno=3334492,<b>반도체</b> 산업 위기 극복을 위한  추가 건의사항으로  세액공제 대신 현금 환급 방식 조속 시행과 공공폐수처리시설 신설계획을 새만금 MP에 반영해 줄 것을 강력 요청했다. 대표단은 세액공제 대신 현금 환급에 대해... ,"Fri, 25 Jul 2025 14:00:00 +0900"
2025-07-25 05:32:27,“2분기 벤처 거래 60%가 하드테크··· 벤처 시장 AI 프리미엄 최고조...,https://www.cio.com/article/4028589/2분기-벤처-거래-60가-하드테크···-벤처-시장-ai-프리미.html,"하드 테크는 물리적 제품이나 인프라에 적용되는 난이도 높은 과학기술 중심의 산업을 의미하며, 재료공학, 양자물리, 우주항공, 로보틱스, <b>반도체</b>, 나노기술, 에너지 공학 등이 여기에 속한다. 이러한... ","Fri, 25 Jul 2025 14:00:00 +0900"
2025-07-25 05:32:27,"'미래차 인재 요람' 인하공전, 산업전환 훈련 최우수기관 선정",https://n.news.naver.com/mnews/article/008/0005226946?sid=102,"현재 △전기차 △하이브리드카 △자율주행 △차량용 <b>반도체</b> △차량 통신 기술 등 산업 수요에 기반한 교육과정을 운영 중이다. 김종우 센터장은 &quot;급속한 기술 변화와 친환경 정책 확산 속에서 재직자의 직무 전환, 산업... ","Fri, 25 Jul 2025 14:00:00 +0900"
2025-07-25 05:32:27,"넥스트칩, 로봇 분야 전담 조직 강화...현대차 로봇 탑재 등 성과 가시화",https://n.news.naver.com/mnews/article/008/0005226942?sid=101,차량용 <b>반도체</b> 전문기업 넥스트칩이 로봇 분야 전담 조직을 강화하고 로봇 시장 진출에 박차를 가한다고 25일 밝혔다. 넥스트칩은 차량용 <b>반도체</b> 개발을 통해 축적한 영상 처리 및 전송 기술력을 바탕으로 급성장하는... ,"Fri, 25 Jul 2025 13:59:00 +0900"
2025-07-25 05:32:27,"&quot;4일이면 됩니다&quot; 신한운용, 국내 공모펀드 중 최단 환매주기 자신",https://n.news.naver.com/mnews/article/417/0001091495?sid=101,"전력공급) ▲엔비디아(<b>반도체</b> 에너지 효율화 개선) ▲버티브 홀딩스(데이터센터 전력 및 냉각 시스템)가 있다. 또한, 블록체인 및 가상자산 시장에도 대응한다. 재생에너지 기반의 블록체인 채굴 산업과 탄소중립... ","Fri, 25 Jul 2025 13:58:00 +0900"
2025-07-25 05:32:27,최종현학술원 포럼서 외교안보 전문가들 &quot;새로운 국가 전략 필요&quot; 한목...,http://www.dailypop.kr/news/articleView.html?idxno=89907,"공정장비까지 <b>반도체</b> 전 영역을 아우르며 AI 생태계로 고속도로를 구축하고 있다&quot;며 &quot;한국은 제조업 기반의 AI 전략으로 대응해야 한다&quot;고 강조했다. 권 교수는 &quot;화웨이, 딥시크, 알리바바 등 중국 핵심 기업들이 <b>반도체</b>부터... ","Fri, 25 Jul 2025 13:56:00 +0900"
2025-07-25 05:32:27,지식 노동자의 흥망성쇠,https://newscham.net/articles/113738,"선전의 폭스콘 공장에서 일하는 <b>반도체</b> 노동자부터, 베를린의 지니어스바 직원, 쿠퍼티노 애플 본사의 기술 노동자에 이르기까지, 이들을 연결하는 망은 점점 더 균질화되고 있다. 저임금 노동자와 고임금 노동자의... ","Fri, 25 Jul 2025 13:54:00 +0900"
2025-07-25 05:32:27,"김정관 산업장관, 美 러트닉과 관세 협상…‘8월1일 이전 타결 의지 재...",https://www.kukinews.com/article/view/kuk202507250100,"이 자리에서 김 장관은 조선·<b>반도체</b>·배터리 등 전략 제조업 분야에서 양국 간 협력 강화 방안을 소개하고, 이를 감안해 자동차 등 품목별 관세 및 상호관세 완화가 필요하다는 점을 강하게 요청했다. 다만 양국 장관은 약... ","Fri, 25 Jul 2025 13:54:00 +0900"
2025-07-25 05:32:27,"넥스트칩, 로봇 분야 전담 조직 강화…현대차 로봇 탑재 등 성과",https://n.news.naver.com/mnews/article/003/0013384972?sid=101,차량용 <b>반도체</b> 전문기업 넥스트칩은 로봇 분야 전담 조직을 강화하고 로봇 시장 진출에 박차를 가한다고 25일 밝혔다. 넥스트칩은 차량용 <b>반도체</b> 개발을 통해 축적한 영상 처리 및 전송 기술력을 바탕으로 급성장하는... ,"Fri, 25 Jul 2025 13:52:00 +0900"
2025-07-25 05:32:27,"김정관, 러트닉에 ‘조선·<b>반도체</b>·배터리 협력’ 내놓고 관세인하 요청",https://n.news.naver.com/mnews/article/020/0003650405?sid=101,"김 장관은 이날 회담에서 조선·<b>반도체</b>·배터리 등 전략 제조업 분야에서 양국 간 협력 강화 방안을 소개하고, 이를 고려해 자동차 등 품목별 관세 및 상호관세 완화가 필요하다는 점을 강하게 요청했다. 이어 산업부는 김... ","Fri, 25 Jul 2025 13:51:00 +0900"
