DateTime,Title,Link,Description,PubDate
2025-04-10 22:47:35,“코스피 2400선 이하에서는 적극 매수”,https://n.news.naver.com/mnews/article/018/0005984916?sid=101,"특히 코스피는 2,400선 이하에서 매수 전략이 유효하며, <b>반도체</b>, 제약, 2차전지 업종이 중단기적으로 유망할... 그는 “<b>반도체</b> 업종은 미중 갈등의 반사이익을 받을 가능성이 높고, 제약과 2차전지 업종은 중단기적인 가격... ","Fri, 11 Apr 2025 07:45:00 +0900"
2025-04-10 22:47:35,"뉴욕증시, 미중 갈등 격화에 하루 만에 급락…나스닥 4.3%↓",https://www.newstof.com/news/articleView.html?idxno=27570,"<b>반도체</b> 기업들도 일제히 하락 마감했다. 브로드컴은 6.4%, AMD는 8.41% 떨어졌다. 마이클 가펜 모건스탠리 수석 이코노미스트는 &quot;관세 유예가 시장에 일시적 안도감을 줬지만, 전반적인 불확실성을 해소하진 못했다... ","Fri, 11 Apr 2025 07:44:00 +0900"
2025-04-10 22:47:35,4개월에 걸친 심사…&quot;우리는 졸업하면 삼성전자에 입사한다&quot;,https://www.yeongnam.com/web/view.php?key=20250411010001000,"정성창 교장은 &quot;앞으로도 학생 개개인의 적성과 역량에 따라 <b>반도체</b>, 로봇, 연구개발, 공공서비스 등 다양한 분야에서 취업을 폭넓게 지원할 것&quot;이라고 말했다.한편 구미전자공고는 5월17일 학교 융합전자관 5층... ","Fri, 11 Apr 2025 07:42:00 +0900"
2025-04-10 22:47:35,"뉴욕증시, 다우지수·셰브론·엔비디아·애플·나이키 '다시 추락'",http://www.choicenews.co.kr/news/articleView.html?idxno=145605,"이날 AI<b>반도체</b> 대장주 엔비디아의 주가도 107.57 달러로 5.91%나 떨어지며 다우존스 지수를 압박했다. 셰브론, 디즈니, 엔비디아 또한 전일 급등했다가 이날엔 다시 곤두박질 쳤다. 여기에다 중국 비중이 높은 애플의... ","Fri, 11 Apr 2025 07:42:00 +0900"
2025-04-10 22:47:35,"[이슈+] BGF그룹, 경영승계 플랜은",http://www.biztribune.co.kr/news/articleView.html?idxno=332454,"KNW는 전자부품소재와 자동차부품소재, <b>반도체</b>소재 등을 영위하는 곳으로 <b>반도체</b> 특수가스를 생산하는 <b>반도체</b>소재사업 부문이 핵심이다. 하지만 해당 사업부가 BGF에코머티리얼즈가 인수한 이후 매출이 급격히... ","Fri, 11 Apr 2025 07:42:00 +0900"
2025-04-10 22:47:35,"&quot;사이버 위협 취약한 해상풍력발전소, 포티넷 솔루션으로 보호&quot;",https://www.datanet.co.kr/news/articleView.html?idxno=201207,"혹독한 산업 환경을 위한 네트워크 보안 제품이 다양한 폼팩터로 제공돼 선박, 변전소, 전기차 충전소, <b>반도체</b> 제조공정 등 다양한 환경에 최적화된 제품을 선택할 수 있다. 원격 산업현장을 위한 SD-브랜치 솔루션을... ","Fri, 11 Apr 2025 07:36:00 +0900"
2025-04-10 22:47:35,[마켓 프리뷰] '트럼프 풋' 국내 증시 급등…'불안한 상승세' 언제까지...,https://n.news.naver.com/mnews/article/374/0000434567?sid=104,06 마감 - 2300선 '붕괴' 하루만에 2400 중반까지 회복 성공 - 상호관세 직격타 <b>반도체</b>·방산·전력기기 등... 87% 상승 - 필라델피아 <b>반도체</b> 지수 18.73%↑…나스닥 12%대↑ - 전문가들 &quot;협상의 여지가 어디까지 열릴지 관거&quot; Q.... ,"Fri, 11 Apr 2025 07:33:00 +0900"
2025-04-10 22:47:35,트럼프코스터 탄 美증시 ‘현기증’…매그니피센트7 또 미끄러졌다 [투...,https://n.news.naver.com/mnews/article/016/0002455705?sid=101,이날 <b>반도체</b> 관련 종목으로 구성된 필라델피아 <b>반도체</b> 지수는 7.97% 폭락했다. 다우존스30 산업평균지수는 전일 대비 2160.28포인트(5.23%) 빠진 38448.17에 거래됐다. S&amp;P500 지수는 전일 대비 전장보다 325.29포인트(5.96... ,"Fri, 11 Apr 2025 07:33:00 +0900"
2025-04-10 22:47:35,"미·중 관세전쟁 격화로 기술주 급락, 애플 4.2%↓·테슬라 7.2%↓",http://www.newsroad.co.kr/news/articleView.html?idxno=38086,"<b>반도체</b> 관련주 역시 급락하며 필라델피아 <b>반도체</b> 지수는 7.97% 하락했다. 이러한 상황은 기술주들이 관세전쟁의 직접적인 타격을 받고 있음을 시사한다. 트럼프 대통령의 발언에도 불구하고 시장의 불안감은 여전하며, 미... ","Fri, 11 Apr 2025 07:32:00 +0900"
2025-04-10 22:47:35,"[더벨]에이엘티, 삼성전자 출신 이은철 사장 영입 '<b>반도체</b> 역량 강화'",https://www.thebell.co.kr/free/content/ArticleView.asp?key=202504081539396680108918,"<b>반도체</b> 후공정 사업을 주력으로 삼고 있는 에이엘티는 시장 확장을 꾀하고 있다. 지난해 4월 신공장 부지를 매입한 뒤 메모리 컨트롤러(M/C), 이미지센서(CIS), 애플리케이션프로세서(AP) 등 시스템 <b>반도체</b> 웨이퍼 테스트... ","Fri, 11 Apr 2025 07:32:00 +0900"
2025-04-10 22:47:35,"&quot;트럼프 증시 최후 방어선은 S&amp;P500지수 5,000선&quot;",https://news.einfomax.co.kr/news/articleView.html?idxno=4350861,"다만 JP모건 트레이더들은 &quot;이번 조치가 미국의 목표를 중국으로 제한한 듯 보이나, <b>반도체</b>·의약품 등에 대한 관세는 아직 발표되지 않았다&quot;며 &quot;경제적으로 실질적 변화를 불러온 것은 아니다&quot;라고 평했다.... ","Fri, 11 Apr 2025 07:30:00 +0900"
2025-04-10 22:47:35,"트럼프, 젠슨 황 만찬 뒤 '엔비디아 칩' 中 수출길 터줘",https://www.newswhoplus.com/news/articleView.html?idxno=24752,◇ '규제 대신 투자'…정치와 기술 거래 H20은 미국 정부의 <b>반도체</b> 수출 규정 범위 내에서 중국에... 당초 미국은 안보를 명분으로 최첨단 <b>반도체</b>의 중국 수출을 규제해 왔다. 그러나 이번 트럼프 전 대통령의 결정은... ,"Fri, 11 Apr 2025 07:30:00 +0900"
2025-04-10 22:47:35,"호서대, <b>반도체</b> 패키지 LAB 구축-전용 클린룸, <b>반도체</b> VR교육실 등 갖춰",https://www.joongdo.co.kr/web/view.php?key=20250411010003996,"호서대학교(총장 강일구)는 9일, <b>반도체</b> 패키지 공정실습 교육과 산학협력 지원을 위한 <b>반도체</b> 패키지 LAB을 개소하고 본격적인 전문 인재 양성에 나섰다. (사진은 개소식 후 기념촬영 모습) 이번에 구축된 <b>반도체</b>... ","Fri, 11 Apr 2025 07:26:00 +0900"
2025-04-10 22:47:35,몸푸는 국민의힘 ‘4대천왕’…한동훈에 나경원까지 대권 도전장,https://n.news.naver.com/mnews/article/009/0005474580?sid=100,"한 전 대표는 “로봇·<b>반도체</b>·에너지·바이오를 포함한 초격차 5대 사업 분야, ‘빅 파이브’를 집중 육성하겠다”며 “고착된 양극화를 넘어 노력하면 누구나 중산층이 될 수 있는 ‘성장하는 중산층의 시대를 열 것’... ","Fri, 11 Apr 2025 07:25:00 +0900"
2025-04-10 22:47:35,"용인특례시 용인시노사민정협의회, 2025 제1차 본협의회 개최",https://www.pointdaily.co.kr/news/articleView.html?idxno=241859,"이상일 용인시장은 &quot;용인시는 다른 지자체의 본보기가 될 수 있을 정도로 활발하게 또 원만하게 노사민정이 소통하며 해야 할 일을 하고 있다고 생각한다&quot;며 &quot;용인엔 초대형 <b>반도체</b>프로젝트가 진행되고 있고, 많은 기업이... ","Fri, 11 Apr 2025 07:24:00 +0900"
2025-04-10 22:47:35,美 관세에 대응할 韓 비장의 카드는 조선·LNG…비관세 장벽 개선도 협...,https://n.news.naver.com/mnews/article/009/0005474577?sid=101,"韓 “모든 협상 진전 보여서 관세 부담에서 벗어나도록” 산업부, 품목관세 대책 고심 <b>반도체</b> 업계 지원책 곧... 정부는 상호관세뿐 아니라 철강·자동차·<b>반도체</b> 등 품목 관세에 대한 대응책도 고심 중이다. 철강과 자동차... ","Fri, 11 Apr 2025 07:24:00 +0900"
2025-04-10 22:47:35,"증시 폭락에 꿈쩍 않던 트럼프, 채권엔 반응…왜? [홍길용의 화식열전]",https://n.news.naver.com/mnews/article/016/0002455697?sid=101,"2022년 폭락하던 미국 증시에 구원투수로 등장한 것은 재정지출과 인공지능(AI), <b>반도체</b>였다. 고금리에도 미국 증시는 급 반등한다. 미국 국채 금리 급등이나. 주식과 채권 가격 동시 급락이 처음은 아니다. 이번이 다른... ","Fri, 11 Apr 2025 07:22:00 +0900"
2025-04-10 22:47:35,美증시 나스닥100 '다시 출렁'...WBD · <b>반도체</b>주 '비명',http://www.choicenews.co.kr/news/articleView.html?idxno=145604,반면 <b>반도체</b>기업 마이크로칩 테크놀러지(MCHP) 주가는 38.81 달러로 13.56%나 추락하며 나스닥100 종목 중 낙폭이 가장 컸다. 역시 <b>반도체</b> 기업인 마벨 테크놀로지 그룹(MRVL) 주가도 52.87 달러로 13.27%나 곤두박질 치며... ,"Fri, 11 Apr 2025 07:16:00 +0900"
2025-04-10 22:47:35,"[SK 중복상장 리스크] 숨 고르는 SK, 최태원 역할론 '대두'…'오너 프리...",https://dealsite.co.kr/articles/139714,앞서 최 회장은 지난해 미국 현지를 방문해 ▲엔비디아 ▲마이크로소프트 ▲아마존 ▲인텔 ▲오픈AI 등 글로벌 빅테크 수장들과 조우하고 AI 및 <b>반도체</b> 협력 방안을 다각 논의했다. 아울러 글로벌 <b>반도체</b> 파운드리... ,"Fri, 11 Apr 2025 07:14:00 +0900"
2025-04-10 22:47:35,삼성전자 ‘<b>반도체</b> R&amp;D’ 6개월 특별연장근로 인가...지침 시행 후 첫 사...,https://n.news.naver.com/mnews/article/016/0002455693?sid=101,"고용부, 9일 삼성전자 특별연장 근로신청 인가 <b>반도체</b> 생산공정 현장 ［헤럴드경제DB］ 삼성전자가 한 번에 최대 6개월까지 가능한 특별연장 근로를 인가받았다. 정부가 지난달 <b>반도체</b> 연구개발직 특별연장 근로를 한... ","Fri, 11 Apr 2025 07:13:00 +0900"
2025-04-10 22:47:35,"[미 증시 브리핑] '급등 역사' 썼던 뉴욕증시, 하루 만에 다시 급락",https://n.news.naver.com/mnews/article/374/0000434565?sid=104,"그런데 오늘 다시 미중 간 관세경쟁이 격화되면서 공급망에 대한 우려로 <b>반도체</b>주가 크게 빠지자, 마이크로칩도 어제의 상승분을 토해냈습니다. 이어서 서학개미 브리핑입니다. 배팅에 성공했단 자신감 덕분일까요.... ","Fri, 11 Apr 2025 07:12:00 +0900"
2025-04-10 22:47:35,"[N2 모닝 경제 브리핑-4월 11일] 美 증시, 여전한 관세공포…나스닥 4.31...",https://www.news2day.co.kr/article/20250410500248,"주요 <b>반도체</b> 종목을 편입한 필라델피아<b>반도체</b>지수는 전장 대비 337.15포인트(7.97%) 폭락한 43,893.30을 기록했다. 한편 뉴욕상업거래소(NYMEX)에서 5월물 미국 서부텍사스산원유(WTI)는 전장보다 2.28달러(3.66... ","Fri, 11 Apr 2025 07:10:00 +0900"
2025-04-10 22:47:35,"&quot;관세 90일 유예&quot; 트럼프 입에 안전자산 금도, 위험자산 주식도 '출렁'",https://n.news.naver.com/mnews/article/421/0008186577?sid=101,"<b>반도체</b> 관세리스크에 지난 1주일 사이 약 13%, 22% 내린 삼성전자와 SK하이닉스도 하루 만에 6.42%, 11.03% 올랐다. 관세 영향권에 있는 현대차·기아도 최근 연일 하락했으나 이날 5%대 올랐다. 2차전지주도 에코프로머티... ","Fri, 11 Apr 2025 07:10:00 +0900"
2025-04-10 22:47:35,'미·중 관세전쟁 영향' 애플 주가 4.2%↓·테슬라 7.2%↓...리플(엑스알...,https://www.cbci.co.kr/news/articleView.html?idxno=495801,"<b>반도체</b> 관련주 역시 하락세를 면치 못했다. 브로드컴 주가는 6.94%, TSMC는 4.80% 내렸고, 퀄컴과 AMD도 각각 6.40%와 8.41% 하락했다. <b>반도체</b> 관련 종목으로 구성된 필라델피아 <b>반도체</b> 지수는 전날 18.73% 폭등한 후 이날 7.97... ","Fri, 11 Apr 2025 07:08:00 +0900"
2025-04-10 22:47:35,'<b>반도체</b> 특별연장근로' 특례 1호는 삼성전자,https://n.news.naver.com/mnews/article/374/0000434561?sid=101,정부가 지난달 <b>반도체</b> 연구개발직 특별연장 근로를 한 번에 최대 6개월까지 허용하는 지침을 시행한 후... 노동부 관계자는 &quot;삼성전자 한 곳이 특별연장 근로를 신청해서 인가를 받았으며 다른 <b>반도체</b> 기업도 신청 준비를... ,"Fri, 11 Apr 2025 07:07:00 +0900"
2025-04-10 22:47:35,美 증시 급락…中 갈등 재점화에 기술·제약·자동차株 동반 추락,https://www.tokenpost.kr/news/market/236967,가장 큰 충격을 받은 분야는 제약과 <b>반도체</b> 종목이었다. 찰스리버 래버러토리(CRL)는 바클레이즈가 해당... <b>반도체</b> 업종 전반에 다시 타격이 가해진 셈이다. 중국이 미국산 콘텐츠 수입을 제한하겠다고 발표하자... ,"Fri, 11 Apr 2025 07:06:00 +0900"
2025-04-10 22:47:35,[경제와 세상] 'Peak Korea'의 어두운 그림자,https://www.yeongnam.com/web/view.php?key=20250411010000985,"트럼프 대통령이 한국에 부과한 25%의 상호관세는 <b>반도체</b>, 자동차, 배터리 등 핵심 먹거리 산업뿐 아니라 전 산업에 타격을 입힐 가능성이 커지면서, 수출 중심의 우리 경제를 뿌리째 흔들고 있다. 그간 줄 탄핵과 대통령... ","Fri, 11 Apr 2025 07:06:00 +0900"
2025-04-10 22:47:35,"[2024년 귀속 법인세 분석] 2차전지·소부장 피엔티, 2차전지 침체 속 '매...",https://n.news.naver.com/mnews/article/123/0002356780?sid=101,"<b>반도체</b> 및 디스플레이 업황 부진에도 고순도 과산화수소 등 핵심 제품군의 안정적 매출이 뒷받침됐다. 코스모신소재는 매출액 5697억원(전년 대비 -9.5%), 영업이익 250억원(전년 323억원 대비 -22.6%)을 기록했다.... ","Fri, 11 Apr 2025 07:03:00 +0900"
2025-04-10 22:47:35,"[2024년 귀속 법인세 분석] IT·전자·플랫폼 SK하이닉스, HBM 호황에 실...",https://n.news.naver.com/mnews/article/123/0002356779?sid=101,"또한 전년 적자 기조에서 벗어나 <b>반도체</b> 경기 반등과 HBM 수요 급증에 힘입어 실적이 대폭 개선되면서... <b>반도체</b> 업황 회복과 AI 및 데이터센터 수요 증가에 힘입어 실적이 개선됐으며, 특히 D램과 NAND 플래시... ","Fri, 11 Apr 2025 07:02:00 +0900"
2025-04-10 22:47:35,[미국증시 뉴스브리핑] 美中 무역전쟁 격화에 나스닥 4.3% 급락... <b>반도체</b>...,https://www.tokenpost.kr/news/market/236964,특히 중국과의 무역 의존도가 높은 <b>반도체</b> 업종이 큰 폭으로 하락했다. 중국 수입품에 145% 관세... <b>반도체</b> 업종 '직격탄' 도널드 트럼프 대통령이 중국산 수입품에 125% 관세를 부과하겠다고 발표하면서 미-중... ,"Fri, 11 Apr 2025 07:02:00 +0900"
2025-04-10 22:47:35,“한국인이 가장 많이 놀러옵니다”...‘절친’ 하자고 손내미는 필리핀,https://n.news.naver.com/mnews/article/009/0005474570?sid=102,"고 보좌관은 “재생에너지, 핵심 광물, 전기차, <b>반도체</b> 등 분야에서 한국의 기술력과 필리핀의 풍부한 자원은 상호 보완적 관계를 이룰 수 있다”며 “이러한 구조적 강점을 바탕으로 협력을 한층 강화해 시너지 효과를... ","Fri, 11 Apr 2025 07:01:00 +0900"
2025-04-10 22:47:35,[인터뷰] 김문수 &quot;난 왼쪽·오른쪽 다해본 중도…이재명과 가장 달라&quot;,https://n.news.naver.com/mnews/article/001/0015323741?sid=100,"세계적인 <b>반도체</b>, 인공지능(AI) 선도 기업이 나와야 하는데 그러려면 기업 창업, 성장 등을 지원해야 한다. -- 개헌에 대한 입장은. ▲ 지금 헌법이 1987년 이후 38년 동안 잘 해왔다고 본다. 국민들의 개헌 요구가 있다면... ","Fri, 11 Apr 2025 07:01:00 +0900"
2025-04-10 22:47:35,"뉴욕증시, 미·중 관세전쟁 본격화로 하락…엔비디아 5.9%·테슬라 7.2%↓",https://n.news.naver.com/mnews/article/629/0000381088?sid=101,"<b>반도체</b>주도 급락했다. 인텔이 7.66%, 브로드컴이 6.94%, 마이크론이 10.04% 떨어졌다. 이날 발표된 경제 지표는 호조를 보였지만 시장 분위기를 반전시키지는 못했다. 미 노동부는 3월 소비자물가지수(CPI)가 전년 동기... ","Fri, 11 Apr 2025 07:00:00 +0900"
2025-04-10 22:47:35,[경제인칼럼] 시장에서 기술사업화 돼 돈이 되는 특허,https://n.news.naver.com/mnews/article/656/0000128277?sid=110,"통신 표준화에 참여해 획득한 ETRI의 표준특허, 바이오 신약 개발용 한미약품의 물질특허, <b>반도체</b> 생산에... 쓰이는 <b>반도체</b> 배치회로 설계(IP) 기술, 실증(PoC) 기술 등은 특허보다는 비밀유지, 리드타임 단축, 비즈니스... ","Fri, 11 Apr 2025 07:00:00 +0900"
2025-04-10 22:47:35,'수출 타격' 기업에 35조 풀지만…은행 건전성 우려 '딜레마',https://n.news.naver.com/mnews/article/003/0013177493?sid=101,수 있도록 은행 자본규제 관련 인센티브 부여 방안을 검토해달라&quot;고 밝힌 바 있다. 일각에서는 관세 피해가 클 것으로 예상되는 자동차·<b>반도체</b> 협력업체 등 대출에 대한 위험가중치를 차등화하는 방안 등이 거론되고 있다．,"Fri, 11 Apr 2025 07:00:00 +0900"
2025-04-10 22:47:35,"'中 관세율 145%' 충격 … 뉴욕증시, 반등 하루 만에 급락",https://www.newdaily.co.kr/site/data/html/2025/04/11/2025041100021.html,"테슬라는 7.22%, 인공지능(AI) <b>반도체</b> 대표주 엔비디아는 5.91% 급락했고, 애플(−4.23%), 메타(−6.74%), 아마존(−5.17%) 등 대형 기술주들도 줄줄이 하락했다. 국제유가가 다시 하락세로 전환하면서 엑손모빌(−5.55... ","Fri, 11 Apr 2025 06:58:00 +0900"
2025-04-10 22:47:35,빅5운용사 연금 ETF 전략 &lt;⑤ 신한자산운용 SOL&gt;,http://www.globalepic.co.kr/view.php?ud=2025041106462648255ebfd494dd_29,"신한자산운용 김정현 ETF사업본부장은 &quot;AI 소프트웨어 산업은 특정 기업의 지배력이 큰 <b>반도체</b> 산업과는 달리 다양한 분야에서 다양한 기업들이 각자만의 경쟁력으로 가치를 창출하고 경쟁하는 시장&quot;이라며, &quot;향후... ","Fri, 11 Apr 2025 06:58:00 +0900"
2025-04-10 22:47:35,[창간 10주년 특별기획] 기업이 뛴다 - 보험,http://www.hansbiz.co.kr/news/articleView.html?idxno=743604,"<b>반도체</b>, 2차전지, 금융, 유통, 바이오헬스 등 주력 산업부터 AI, 로봇 산업까지 폭넓은 산업 분야를 아우르며, 대한민국 경제의 활력과 가능성을 확인하고, 미래를 향한 희망을 함께 나누고자 합니다. 6개월에 걸친 연중... ","Fri, 11 Apr 2025 06:56:00 +0900"
2025-04-10 22:47:35,"美증시 폭등 하루만에 급락…테슬라 7%, 엔비디아 6% ‘뚝’",https://n.news.naver.com/mnews/article/020/0003627603?sid=104,"23%, 아마존 5.17% 엔비디아 5.91%, 테슬라 7.22%, AMD 8.41% 등으로 내렸다. 브로드컴 6.94%, 인텔 7.66%, 마이크론 10.04% 등 <b>반도체</b>주도 급락했다. <b>반도체</b>주가 일제히 폭락함에 따라 <b>반도체</b> 지수도 8% 가까이 떨어지며 마감했다.","Fri, 11 Apr 2025 06:55:00 +0900"
2025-04-10 22:47:35,[스타트경제] 참모진도 몰랐던 관세 유예...트럼프가 갑자기 마음을 바...,https://n.news.naver.com/mnews/article/052/0002178624?sid=104,일부 AI <b>반도체</b>나 이런 하이테크 쪽은 강하지만 예를 들어 하다못해 화장지도 미국 내에서 다 충당하기 어려운 상황이고요. 그게 가능할까? 그런 것은 산업구조가 완전히 변해야 하고 그것은 1~2년에 걸쳐서 되는 게 아니고... ,"Fri, 11 Apr 2025 06:55:00 +0900"
2025-04-10 22:47:35,롤러코스터 장세에 곳곳서 이상징후…시세 왜곡 유의,https://n.news.naver.com/mnews/article/277/0005576320?sid=101,"SK하이닉스 외에도 퀄리타스<b>반도체</b>, 클래시스, 한화오션, 하이비젼시스템, 세아제강지주 등이 프리마켓 개장 직후 상한가를 찍은 뒤 이내 반락했다. 최근 글로벌 증시 변동성이 확대되면서 프리마켓의 시초가 왜곡... ","Fri, 11 Apr 2025 06:50:00 +0900"
2025-04-10 22:47:35,[사모펀드 인맥 대해부④]투자시장 주역으로 떠오르는 '삼성맨',https://n.news.naver.com/mnews/article/277/0005576323?sid=101,"그는 세계 최초로 16MB, 256MB 디램(DRAM) 개발을 이끌며 삼성 <b>반도체</b>를 지금의 자리에 있게 한 인물로... 현재 스카이레이크는 진 회장의 과거 경력을 살려 국내 미래 먹거리를 책임질 AI <b>반도체</b>, 이차전지 등 기술 기업들을... ","Fri, 11 Apr 2025 06:50:00 +0900"
2025-04-10 22:47:35,"10일만에 돌아선 외국인, 뭐 샀나 보니",https://n.news.naver.com/mnews/article/277/0005576319?sid=101,<b>반도체</b>와 자동차는 엇갈린 흐름을 보였다. SK하이닉스와 현대차(137억원)를 순매수한 반면 삼성전자와... 메리트와 <b>반도체</b> 업황 개선 기대에도 불구하고 성장 등 거시여건 부진으로 보합세가 예상된다&quot;고 말했다.,"Fri, 11 Apr 2025 06:50:00 +0900"
2025-04-10 22:47:35,관세유예 효과 '딱 하루'...빅테크 주가 또 하락,https://n.news.naver.com/mnews/article/215/0001205370?sid=101,"<b>반도체</b> 관련주도 전날 폭등했다가 이날은 모두 하락 마감했다. 미 <b>반도체</b> 기업 브로드컴 주가는 6.94%, 세계 최대 파운드리(<b>반도체</b> 위탁생산) 업체 TSMC는 4.80% 내렸다. 퀄컴과 AMD 주가도 각각 6.40%와 8.41% 떨어졌다.... ","Fri, 11 Apr 2025 06:49:00 +0900"
2025-04-10 22:47:35,[주식동향] 상호관세 유예에 <b>반도체</b>株 '훨훨'…삼전·하이닉스 바닥 쳤...,http://www.namdonews.com/news/articleView.html?idxno=815981,미국 트럼프 행정부가 국가별 상호관세 부과를 90일간 유예한다고 밝히며 관세전쟁 우려가 누그러지자 10일 <b>반도체</b>주가 급등했다. <b>반도체</b> 업황 개선 흐름 등을 고려하면 최근의 주가 낙폭이 과도했다는 평가가... ,"Fri, 11 Apr 2025 06:42:00 +0900"
2025-04-10 22:47:35,트럼프 &quot;의약품에 25% 수입 관세 부과&quot; 다시 주장,http://www.medisobizanews.com/news/articleView.html?idxno=124721,"트럼프가 지난주 발표한 행정명령에서 1962년 미국 무역법 232조를 들어 수입이 국가안보에 미치는 효과를 조사할 수 있는 대상으로 목재, <b>반도체</b> 등과 함께 의약품을 꼽았다. 상무부가 주도하는 조사는 발표 후 270일... ","Fri, 11 Apr 2025 06:36:00 +0900"
2025-04-10 22:47:35,"구글 클라우드 CEO &quot;보안 통제 기능, 로컬 시장에서 강점&quot;",https://n.news.naver.com/mnews/article/001/0015323713?sid=105,"쿠리안 CEO는 &quot;<b>반도체</b> 설계 등 고도의 기밀 워크로드(처리량)를 운영하는 삼성전자, 철강업체 포스코, 현대자동차, LG 등 많은 기업이 구글 클라우드의 기술을 활용하고 있다&quot;고 전했다.","Fri, 11 Apr 2025 06:33:00 +0900"
2025-04-10 22:47:35,"백악관 &quot;중국관세 145%&quot;, 미국주가 다시 급락",http://www.viewsnnews.com/article?q=226426,"<b>반도체</b> 관련주도 급락해 브로드컴은 6.94%, TSMC는 4.80% 내렸다. 퀄컴과 AMD 주가도 각각 6.40%와 8.41% 떨어졌다. <b>반도체</b> 관련 종목으로 구성된 필라델피아 <b>반도체</b> 지수는 7.97% 폭락했다. '공포지수'인... ","Fri, 11 Apr 2025 06:32:00 +0900"
2025-04-10 22:47:35,"&quot;대한민국의 뿌리를 말하다&quot; 이장호 감독, 영화 '하보우만의 약속' 시사...",https://www.thepublic.kr/news/articleView.html?idxno=258087,"철강, 중화학, <b>반도체</b> 산업 등 대한민국이 세계 경제 10위권 대국으로 성장하는 기반 역시 그의 결단과 추진력에서 비롯되었음을 보여준다. ​영화는 단순한 역사 회상이 아니라, 오늘날의 위기 상황 속에서 왜 다시... ","Fri, 11 Apr 2025 06:32:00 +0900"
2025-04-10 22:47:35,한국 주식 팔아치우더니…돌아온 외국인들 쓸어담은 종목 [종목+],https://n.news.naver.com/mnews/article/015/0005117866?sid=101,"현물주식 매수 상위엔 한화에어로스페이스(방산), HD현대중공업(조선), SK하이닉스(<b>반도체</b>), HD현대일렉트릭(전력기기) 등 주도업종 대장주가 이름을 올렸다. 대부분 한국 주식시장의 ‘트럼프 트레이드’(트럼프 수혜... ","Fri, 11 Apr 2025 06:31:00 +0900"
