DateTime,Title,Link,Description,PubDate
2025-02-28 09:23:07,"이상일 용인특례시장, 베트남 다낭시와 우호 결연 모색",http://www.breaknews.com/1096691,"이 시장은 “용인특례시는 대한민국에서 <b>반도체</b>를 가장 먼저 시작한 곳이고 초대형 <b>반도체</b> 프로젝트가 세 군데에서 진행되고 있고, 삼성전자와 SK하이닉스가 대규모... ","Fri, 28 Feb 2025 18:22:00 +0900"
2025-02-28 09:23:07,"트럼프가 불러낸 '검은 금요일'… 코스피 와르르, 환율 껑충",https://n.news.naver.com/mnews/article/469/0000851476?sid=101,"여기에 엔비디아가 호실적에도 불구하고 8%대 폭락하고 미국 필라델피아 <b>반도체</b>지수가 6% 이상 떨어진 후폭풍도 국내 <b>반도체</b> 기업 주가에 악영향을 줬다. 대표적으로 SK하이닉스는 4.52% 하락한 19만200원, 삼성전자는... ","Fri, 28 Feb 2025 18:22:00 +0900"
2025-02-28 09:23:07,"'창립 20주년' 유니버설로봇, 협동로봇 판매 10만대 돌파",https://n.news.naver.com/mnews/article/092/0002365058?sid=105,"2015년 미국 <b>반도체</b> 장비 업체인 테라다인에 인수됐고, 국내에도 2016년 지사를 설립한 뒤 매출이 지속 성장해 지난해 역대 최대를 기록했다. 유니버설로봇 협동로봇 (사진=유니버설로봇)","Fri, 28 Feb 2025 18:19:00 +0900"
2025-02-28 09:23:07,"전남대, 창업중심대학 선정…5년간 365억 지원",http://www.newskr.kr/news/articleView.html?idxno=98171,"특히 창업밸리, 인공지능 집적단지 등 우수한 창업 기반 시설을 보유하고 있는 만큼 인공지능·에너지·자동차·<b>반도체</b> 등 주요 산업과 연계해 기술창업을 한층 고도화하고, 지역 산업 기반의 혁신 창업 생태계를... ","Fri, 28 Feb 2025 18:18:00 +0900"
2025-02-28 09:23:07,[책마을] '트럼프 2.0 시대' 미국 주식 투자법,https://n.news.naver.com/mnews/article/015/0005100707?sid=103,"테슬라, 리비안 등 전기차 기업과 엔비디아, 마이크론 등 <b>반도체</b> 기업, 팰런티어, 시스코시스템스, 슈퍼마이크로 등 인공지능(AI) 관련 기업에 관한 내용이 풍부하다. 산업 전문가 5명을 인터뷰해 미국 기업 현장의... ","Fri, 28 Feb 2025 18:18:00 +0900"
2025-02-28 09:23:07,"[E-로컬뉴스] 영진전문대, 계명대, 대구대, 계명문화대, 영남대 소식 등",https://www.ekn.kr/web/view.php?key=20250228020331489,"또한, 교육부의 혁신융합대학사업에서 지능형 로봇, 인공지능, <b>반도체</b> 소부장(소재·부품·장비) 등 전국 전문대학 중 유일하게 3개 분야에 선정되며 '글로벌 영진'이라는 대학 비전 실현을 앞당기고 있다. 한편, 이... ","Fri, 28 Feb 2025 18:18:00 +0900"
2025-02-28 09:23:07,"'계엄 석 달' 개미들은 출국, 기관은 입국…ETF 수익률은 어땠나",https://www.ajunews.com/view/20250228162902993,엔비디아 폭락으로 인한 <b>반도체</b>주 하락도 이날 증시 급락에 영향을 미쳤다. 우지연 DS투자증권 연구원은 “한국 증시는 이전과 달리 관세에 대한 내성이 약화한 것으로 판단한다”며 “차주부터 미국 정부의... ,"Fri, 28 Feb 2025 18:14:00 +0900"
2025-02-28 09:23:07,[인사] 특허청,https://www.tfmedia.co.kr/news/article.html?no=179612,바이오의약심사팀장 이진용 ▲ 헬스케어데이터심사팀장 최진호 ▲ <b>반도체</b>제조공정심사과장 정재훈 ▲ <b>반도체</b>설계심사과장 장현근 ▲ 전문서비스상표심사과장 심봉수 ◇ 과장급 승진 파견 ▲ 서울중앙지방검찰청 이보경,"Fri, 28 Feb 2025 18:14:00 +0900"
2025-02-28 09:23:07,"崔, 마은혁 임명 안했다고…국정협의회 보이콧한 野",https://n.news.naver.com/mnews/article/015/0005100699?sid=100,"이에 추가경정예산 편성, 국민연금 모수개혁, <b>반도체</b> 주 52시간제 특례 등 주요 현안 논의가 모두 무산됐다.... <b>반도체</b>업종 주 52시간제 적용 예외, 자동조정장치 도입을 전제고 한 연금 개혁 필요성도 주장할 예정이었다.... ","Fri, 28 Feb 2025 18:13:00 +0900"
2025-02-28 09:23:07,"검색상위종목, <b>반도체</b>·방산株 조정…레인보우로보틱스 12% 급락",https://www.job-post.co.kr/news/articleView.html?idxno=130782,"52% 하락하며 <b>반도체</b> 업종의 전반적인 약세를 반영했다. 출처 : 네이버증권 검색상위종목 이날 가장... 전반적으로 이날 검색상위종목 증시는 <b>반도체</b>, 방산 및 일부 대형 기술주의 조정이 두드러졌으며... ","Fri, 28 Feb 2025 18:12:00 +0900"
2025-02-28 09:23:07,"피아이이, <b>반도체</b> 검사 혁신… AI 접목한 초음파 시스템 선보여",https://www.job-post.co.kr/news/articleView.html?idxno=130770,피아이이(PIE)가 비파괴 초음파 검사 전문 기업 오랩스와 함께 '세미콘 코리아 2025'에 참가해 <b>반도체</b> 검사 혁신 기술을 선보였다. 출처 : 피아이이 국내 최대 <b>반도체</b> 산업 전시회인 세미콘 코리아는 지난 19일부터... ,"Fri, 28 Feb 2025 18:12:00 +0900"
2025-02-28 09:23:07,"나경원‧주호영 등 與 의원 76명, 헌재에 '윤 대통령 탄핵심판 공정한 ...",https://www.thepublic.kr/news/articleView.html?idxno=252385,"대통령의 핵심 공약인 <b>반도체</b>특별법을 비롯한 각종 민생법안들과 인구부 신설을 포함한 정부조직법 개정안마저 저지하며, 다수 의회권력으로 대통령과 정부가 제대로 일할 수 없도록 국정을 완전히 마비시켰습니다.... ","Fri, 28 Feb 2025 18:10:00 +0900"
2025-02-28 09:23:07,美정치권 &quot;고려아연 경영권 분쟁 우려... 경제안보 위협&quot;,https://www.meconomynews.com/news/articleView.html?idxno=108730,"인터넷 캡처 &quot;중국은 이미 방산과 <b>반도체</b>에 필수적인 안티모니, 인듐, 비스무트. 텔루륨 등 중요한 광물의... 방산과 <b>반도체</b> 핵심 소재인 안티모니, 인듐, 비스무트, 텔루륨 등의 미국 수출을 금지했다&quot;며 &quot;고려아연이... ","Fri, 28 Feb 2025 18:10:00 +0900"
2025-02-28 09:23:07,'검은 금요일'...트럼프 관세 우려에 코스피 3.4% 폭락,https://www.delighti.co.kr/news/articleView.html?idxno=92714,"한지영 키움증권 연구원은 &quot;트럼프의 관세 불안, 엔비디아 등 미국 <b>반도체</b>지수 폭락, 국내 연휴기간 중... 시가총액 상위 종목 중 삼성전자(-3.20%), SK하이닉스(-4.52%) 등 <b>반도체</b>주가 일제히 내렸으며... ","Fri, 28 Feb 2025 18:08:00 +0900"
2025-02-28 09:23:07,"커지는 '마은혁 미임명' 여파...野 국정협 불참 압박, 崔 고심 커질 듯",https://www.etoday.co.kr/news/view/2449169,"여야 합의가 시급한 <b>반도체</b>특별법과 추가경정예산(추경), 연금개혁 논의는 또다시 표류가 불가피할 전망이다.... 이날 여·야·정은 두 번째 국정협의회를 열고 <b>반도체</b> 특별법, 추경, 연금개혁 등 현안을 논의할 예정이었다.... ","Fri, 28 Feb 2025 18:08:00 +0900"
2025-02-28 09:23:07,"외국인, 이번 주 SK하이닉스·삼성전자 대거 매도",https://n.news.naver.com/mnews/article/037/0000035815?sid=101,<b>반도체</b>주 동반 부진… 美 AI 기술주 하락 영향 이번 주 국내 증시에서는 <b>반도체</b> 대장주인 SK하이닉스와 삼성전자가 부진했다. SK하이닉스는 2월 24일 20만2500원으로 장을 시작했으나 28일 약 6.07% 하락한... ,"Fri, 28 Feb 2025 18:08:00 +0900"
2025-02-28 09:23:07,3월1일 인사,https://n.news.naver.com/mnews/article/028/0002733525?sid=102,방규철 △<b>반도체</b>과 문경준 △입지총괄과 신현우 △유통물류과 김애경 △미주통상과 정지선 △아주〃 이라노... 양인수 △<b>반도체</b>제조공정 정재훈 △〃설계 장현근 △전문서비스상표 심봉수 &lt;승진 파견... ,"Fri, 28 Feb 2025 18:06:00 +0900"
2025-02-28 09:23:07,美 추가관세 예고에 … 中 &quot;필요한 조치할것&quot;,https://n.news.naver.com/mnews/article/009/0005451809?sid=101,"같은 날 중국 상무부는 <b>반도체</b> 산업에 주로 쓰이는 텅스텐·텔루륨 등 핵심광물에 대한 수출 통제 조치를 발표했고, 국가시장감독총국은 반독점법 위반 혐의로 미국 대표 정보기술(IT) 기업인 구글에 대한 조사를... ","Fri, 28 Feb 2025 18:05:00 +0900"
2025-02-28 09:23:07,"日닛케이지수, 美기술주 하락·트럼프 관세에 2.9% 급락",https://n.news.naver.com/mnews/article/374/0000427732?sid=104,"특히 어드반테스트(-8.78%), 도쿄일렉트론(-4.45%), 소프트뱅크그룹(-6.07%) 등 <b>반도체</b> 관련주 주가가 크게 떨어졌습니다. 닛케이는 27일(현지시간) 미국 주식시장에서 기술주가 큰 폭으로 하락하고 도널드 트럼프 미국... ","Fri, 28 Feb 2025 18:05:00 +0900"
2025-02-28 09:23:07,"경기 동부권 과학고 탄생, 이천시 과학 교육 중심지로 도약",https://ilyo.co.kr/?ac=article_view&entry_id=488013,"이천시가 <b>반도체</b> 도시임을 입증해 내겠다”고 말했다. 한편, 그동안 교육 소외 지역이었던 경기 동부권은 이번 권역 최초 특목고인 ‘이천 과학고’ 유치로 교육 불균형이 해소될 것으로 전망된다. 유인선 경인본부 기자","Fri, 28 Feb 2025 18:04:00 +0900"
2025-02-28 09:23:07,"[연재] NZSI INDEX 2월 26일 : 1,074.29 (▽0.29%) 발표, 투자자를 위한 투...",http://www.livesnews.com/news/article.html?no=48611,"나스닥이 상승 전환한 것은 AI 및 <b>반도체</b> 업종 일부가 회복세를 보인 것이 주요 원인으로 작용했다. 최근 연속 하락했던 엔비디아와 AMD, 브로드컴 등이 저가 매수세 유입과 함께 반등을 시도하며 기술주 투자 심리가... ","Fri, 28 Feb 2025 18:04:00 +0900"
2025-02-28 09:23:07,조여오는 美관세 공포에 2530대 '와르르'…환율 1460원대 '비명',https://n.news.naver.com/mnews/article/374/0000427731?sid=101,엔비디아 실적이 나온 이후 성장에 대한 정체 우려들이 불거지면서 전 세계 금융시장에 부담을 주고 있는 부분들이 아닐까 (생각합니다.).] AI <b>반도체</b> 대표기업인 엔비디아발 쇼크로 미국 필라델피아<b>반도체</b>지수는 6.1... ,"Fri, 28 Feb 2025 18:03:00 +0900"
2025-02-28 09:23:07,"엔비디아, AI업계 핵심 경쟁자로 화웨이 지목",https://n.news.naver.com/mnews/article/022/0004015113?sid=104,"EPA연합뉴스 특히 전체 5개 부문 가운데 <b>반도체</b>와 클라우드 서비스, 컴퓨팅 처리, 네트워킹 제품 등 4개... 이에 따라 첨단 5G <b>반도체</b>부터 구글의 안드로이드 운영체제에 이르기까지 미국 업체들이 가진 기술을 원활히... ","Fri, 28 Feb 2025 18:02:00 +0900"
2025-02-28 09:23:07,"[과학게시판] GIST, 상대론적 레이저과학 연구단 개소식 外",https://n.news.naver.com/mnews/article/366/0001057653?sid=105,"■국립과천과학관은 ‘현대 전자 문명의 기반, <b>반도체</b>’ 전시회를 새로 개관한다고 밝혔다. 이 전시는 <b>반도체</b>의 개념부터 제조 공정 그리고 응용까지 <b>반도체</b> 분야의 폭넓은 내용을 다룬다. 한국나노기술원이 기증한... ","Fri, 28 Feb 2025 18:02:00 +0900"
2025-02-28 09:23:07,"KTC, 평택시와 신성장 사업 협력 강화",https://www.electimes.com/news/articleView.html?idxno=351240,"한국기계전기전자시험연구원(원장 안성일, 이하 KTC)이 평택시(시장 정장선)와 <b>반도체</b>·미래자동차 등 신성장 사업 분야의 협력 방안을 논의했다. KTC는 지난 27일 군포 본원에서 평택시와 업무협력 회의를 열고, <b>반도체</b>... ","Fri, 28 Feb 2025 18:02:00 +0900"
2025-02-28 09:23:07,"민주, 마은혁 임명 미룬다고 …'협치의 場' 깼다",https://n.news.naver.com/mnews/article/009/0005451800?sid=100,민주 국정協 25분전 돌연 거부 헌재 판결 후 최상목 고심하자 박찬대 &quot;최 대행과 대화 못해&quot; 연금·추경·<b>반도체</b>... 연금개혁·<b>반도체</b>특별법·추가경정예산안 협의가 줄줄이 미뤄지며 &quot;야당이 민생을 내팽개쳤다&quot;는 지적까지... ,"Fri, 28 Feb 2025 18:02:00 +0900"
2025-02-28 09:23:07,선별복지 카드로 차별화하는 與 &quot;취약층에 25만~50만원 선불카드&quot;,https://n.news.naver.com/mnews/article/009/0005451802?sid=100,&quot;부자들까지 주는 건 비효율&quot; 野 전국민 지원금과 차별화 권영세 &quot;주52시간 특례 빼면 '<b>반도체</b>보통법' 그쳐... 또 국민의힘은 주52시간 근무제 예외 조항으로 논의가 답보 상태인 <b>반도체</b>특별법 처리와 관련해 야당을 거듭... ,"Fri, 28 Feb 2025 18:02:00 +0900"
2025-02-28 09:23:07,"문재인 “중국, 미국 다음 중요한 나라…혐중정서 자극 행태 우려”",https://n.news.naver.com/mnews/article/022/0004015118?sid=100,"뉴시스 윤석열 대통령은 지난 25일 탄핵심판 최후 진술에서 “<b>반도체</b>, 디스플레이 등 기술 유출 피해가 수십조 원에 달하는데, 3분의 2가 중국으로 유출된다”고 지적하고, 야당을 비판하면서는 “190석에 달하는... ","Fri, 28 Feb 2025 18:02:00 +0900"
2025-02-28 09:23:07,"“추가 관세 10%에 10% 더” 트럼프 으름장, 느긋한 중국 움직일까",https://n.news.naver.com/mnews/article/469/0000851468?sid=104,전날 장 마감 뒤 발표된 인공지능(AI) <b>반도체</b> 대장주 엔비디아의 분기 실적에서 향후 이익 전망치가 시장 기대에 미달한다는 평가가 나온 상태였다. 영국 파이낸셜타임스(FT)는 “핵심 무역 파트너들에 대한 트럼프의... ,"Fri, 28 Feb 2025 18:01:00 +0900"
2025-02-28 09:23:07,민주당·한경협 10년만에 회동 재계 환영 &quot;발전적 대화 기대&quot;,https://n.news.naver.com/mnews/article/009/0005451797?sid=101,<b>반도체</b> 특별법에 '주 52시간 근로제한 예외' 조항을 명시하는 것을 두고도 양측은 의견을 나눌 것으로 전망된다. 민주당 대표와 한경협 회장의 만남이 성사된 것은 약 10년 만이다. 2015년 9월 문재인 당시 민주당 대표는... ,"Fri, 28 Feb 2025 18:01:00 +0900"
2025-02-28 09:23:07,"민주, 여·야·정 25분 전 ‘불참’ 통보…“최상목 상대로 인정 못해”",https://n.news.naver.com/mnews/article/025/0003423949?sid=100,"연금개혁과 <b>반도체</b>법, 추가경정예산안 등 민생 의제를 논의하기 위해 출범한 여·야·정 국정협의회의 28일 2차 회의가 무산됐다. 최상목 대통령 권한대행이 마은혁 헌법재판관 후보자를 임명하지 않은 걸 문제 삼으면서... ","Fri, 28 Feb 2025 18:00:00 +0900"
2025-02-28 09:23:07,빅테크 성장 둔화에 관세충격까지…세계증시 첩첩산중,https://n.news.naver.com/mnews/article/009/0005451782?sid=101,아시아 증시 '검은 금요일' 中에 추가관세 10% 계획 나와 <b>반도체</b> 업종 우려커져 줄하락 엔비디아 실적 전망... 연초부터 반복된 관세 강공책에 이미 시장에 면역이 생겼지만 엔비디아 등 미국 <b>반도체</b>주의 하락 영향이... ,"Fri, 28 Feb 2025 18:00:00 +0900"
2025-02-28 09:23:07,트럼프 관세 쓰나미 여파 미국·아시아 증시 폭락,https://daily.hankooki.com/news/articleView.html?idxno=1185426,"작년 4분기 실적 발표 후 첫 거래일에 8.48% 급락했으며, 그 충격으로 이날 아시아 <b>반도체</b>주들도 동반 급락했다. 삼성전자(-3.20%)·SK하이닉스(-4.52%)·한미<b>반도체</b>(-6.50%)를 비롯해 일본 도쿄일렉트론(-4.45... ","Fri, 28 Feb 2025 18:00:00 +0900"
2025-02-28 09:23:07,'경기형 과학고' 유치 성공…불평등·경쟁 심화 우려 여전,https://www.incheonilbo.com/news/articleView.html?idxno=1280554,"시흥은 서울대와 연계해 바이오·생명과학 분야 특화, 이천은 <b>반도체</b> 분야, 부천고는 로봇 분야... 이천시 관계자는 &quot;<b>반도체</b> 특화 교육과정에서 우수한 평가를 받았다&quot;며 &quot;교육청에서 과학고 선정 관련 고시를 내리면 TF팀을... ","Fri, 28 Feb 2025 18:00:00 +0900"
2025-02-28 09:23:07,[연합뉴스 이 시각 헤드라인] - 18:00,https://n.news.naver.com/mnews/article/001/0015240410?sid=100,"여·야·정은 지난 20일에 이어 이날 두 번째 국정협의회를 열고 연금개혁과 <b>반도체</b> 특별법, 추가경정예산(추경) 등 현안을 논의할 예정이었으나, 더불어민주당이 참석을 보류하면서 열리지 못했다. 민주당... ","Fri, 28 Feb 2025 18:00:00 +0900"
2025-02-28 09:23:07,"MS·아마존·엔비디아, 트럼프에 칩 수출 규제 개정 촉구",https://www.aitimes.com/news/articleView.html?idxno=168400,"우선 한국, 일본, 대만, 영국, 프랑스, 독일, 캐나다 등 1단계 그룹에 속한 동맹국들은 AI <b>반도체</b>를 자유롭게... 그는 &quot;트럼프 행정부가 어떻게 결정할지는 모르겠지만, 동맹국에 대한 <b>반도체</b> 수출 제한은 문제가 될 수 있다... ","Fri, 28 Feb 2025 18:00:00 +0900"
2025-02-28 09:23:07,한국이 우크라이나 전쟁 종전 협상에 관심을 가져야 하는 이유,https://www.bbc.com/korean/articles/c3e44yk714ko?xtor=AL-73-%5Bpartner%5D-%5Bnaver%5D-%5Bheadline%5D-%5Bkorean%5D-%5Bbizdev%5D-%5Bisapi%5D,"그동안 러우 전쟁 발발 이후 급등하는 물가와 러시아로의 수출 금지 등 각종 조치로 인해 중단됐던 한국 <b>반도체</b>, 자동차, 전자 기업들의 현지 사업 재개도 이루어질 수 있다. 현대차는 우크라이나 전쟁과 국제사회의 러시아... ","Fri, 28 Feb 2025 18:00:00 +0900"
2025-02-28 09:23:07,아슬아슬 국정협의회 결국 무산…野 ‘마은혁 임명’ 연계에 재가동 불...,https://n.news.naver.com/mnews/article/081/0003521793?sid=100,"이날 여야정은 국민연금 모수개혁과 <b>반도체</b> 특별법, 추가경정예산(추경), 행정안전·국방 장관 임명 등을 논의하겠다고 했으나 실무협의에서도 아무런 진전이 없었다. 마 후보자 임명 갈등과 별개로 ‘2차 빈손 회동’이... ","Fri, 28 Feb 2025 17:59:00 +0900"
2025-02-28 09:23:07,여야정 2차 국정협의회 무산…'마은혁 임명 여부' 공방,http://tbs.seoul.kr/news/newsView.do?typ_800=9&idx_800=3531949&seq_800=20524810,"여야정은 지난 20일에 이어 오늘 두 번째 국정협의회를 열고 연금개혁과 <b>반도체</b> 특별법, 추가경정예산 등 현안을 논의할 예정이었습니다. 하지만 더불어민주당이 최상목 대통령 권한대행의 마은혁 헌법재판관 임명 보류를... ","Fri, 28 Feb 2025 17:58:00 +0900"
2025-02-28 09:23:07,관세 급발진·엔비디아·S공포 '3중 쇼크'…외국인 1.5조 패닉셀,https://n.news.naver.com/mnews/article/015/0005100682?sid=101,인공지능(AI) 대장주 엔비디아 주가까지 흔들리며 <b>반도체</b> 등 수출 기업이 시가총액 상위주에 포진한 국내... “인공지능(AI) <b>반도체</b> 관련 주가가 더 올라가기 어려운 것 아니냐”는 해석이 설득력을 얻는 모양새다.... ,"Fri, 28 Feb 2025 17:58:00 +0900"
2025-02-28 09:23:07,[정용석의 서울시평] 이재명 프랑스 르 펭에게서 이미지 세탁 배워야,https://www.ilyoseoul.co.kr/news/articleView.html?idxno=499310,그는 또 <b>반도체</b> 특별법의 주 52시간 예외적용 특례 조항이 필요한 것처럼 얘기하더니 얼마 못 가 &quot;장시간 노동과 노동착취로 국제경쟁력을 확보하겠다는 것은 형용 모순&quot;이라고 바꿨다. 이 대표가 좌•우 양다리 걸치는... ,"Fri, 28 Feb 2025 17:58:00 +0900"
2025-02-28 09:23:07,[기획연재; 한국 <b>반도체</b>의 전설과 한계] 삼성전자의 최근 위기상황과 극...,https://www.ilyoseoul.co.kr/news/articleView.html?idxno=499264,"3각 <b>반도체</b> 동맹 셋째, &lt;삼성전자&gt;가 패키징(Packaging, 집적회로와 전자기기를 연결하고 고온, 고습... 초소형 <b>반도체</b> 수요가 폭증하고 있다. 따라서 최고의 성능을 선보이고 높은 부가가치를 발휘할 수 있도록... ","Fri, 28 Feb 2025 17:58:00 +0900"
2025-02-28 09:23:07,"[올댓차이나] 검색업체 바이두, CATL과 자율운전·자동차 디지털 제휴",https://n.news.naver.com/mnews/article/003/0013094971?sid=104,"바이두는 또한 자체적으로 제어할 가능한 AI 능력으로 <b>반도체</b>칩, 애플리케이션, 플랫폼에 이르는 부문에서 CATL의 디지털 구축을 전면적으로 지원할 계획이라고 설명했다. 앞서 바이두는 인터넷기업에서 AI 퍼스트... ","Fri, 28 Feb 2025 17:58:00 +0900"
2025-02-28 09:23:07,트럼프 관세 폭주…코스피 2600 붕괴,https://n.news.naver.com/mnews/article/015/0005100681?sid=101,미국 뉴욕증시 대장주인 엔비디아 주가가 이익률 축소 전망에 약세를 나타낸 것도 <b>반도체</b>가 이끄는 아시아... 인공지능(AI) 대장주 엔비디아 주가까지 흔들리며 <b>반도체</b> 등 수출 기업이 시가총액 상위주에 포진한 국내... ,"Fri, 28 Feb 2025 17:57:00 +0900"
2025-02-28 09:23:07,'마은혁 논란'에 등돌린 여야정…'<b>반도체</b>·연금·추경' 표류하나,https://n.news.naver.com/mnews/article/001/0015240407?sid=100,"이날 협의회에서 여야정은 <b>반도체</b> 특별법, 국민연금 개혁, 추가경정예산안 편성 등을 테이블에 올려놓고... 여야정이 <b>반도체</b> 특별법, 연금 개혁, 추경에 머리를 맞대자는 취지였다. 그러나 협의회에 참여한 여야의 셈법이... ","Fri, 28 Feb 2025 17:57:00 +0900"
2025-02-28 09:23:07,[종합] 국정협의회 2차 회의 무산...우원식 &quot;협의 중단 안돼&quot;,https://www.ajunews.com/view/20250228171322026,"[사진=연합뉴스] <b>반도체</b>특별법, 연금개혁, 추가경정예산(추경) 등 논의하려 한 여야정 국정협의회 2차 회의가 28일 무산됐다. 더불어민주당이 마은혁 헌법재판관 임명을 보류한 최상목 대통령 권한대행을 두고 &quot;헌법상... ","Fri, 28 Feb 2025 17:56:00 +0900"
2025-02-28 09:23:07,"조태열 장관, 경제안보 자문위원 위촉 &quot;불확실성 증대&quot;",https://www.ajunews.com/view/20250228174637054,"자문위원회는 위원장인 허윤 서강대 국제대학원 교수를 비롯해 관세, <b>반도체</b>, 에너지, 핵심광물 등 분야의 업계·학계 전문가 16명으로 구성됐다. 위원들은 향후 2년간 활동한다. 위촉식에 이은 올해 첫 회의에서 강인선... ","Fri, 28 Feb 2025 17:54:00 +0900"
2025-02-28 09:23:07,"조태열, 경제안보외교 자문위 위촉…'트럼프 대응' 제언 당부",https://n.news.naver.com/mnews/article/421/0008105091?sid=100,"28일 외교부에 따르면 자문위원회는 관세, <b>반도체</b>, 에너지, 핵심광물 등 다양한 분야의 업계, 학계 및 전문가 16명으로 구성돼 있다. 위원들은 앞으로 2년간 활동할 예정이다. 이날 조 장관은 &quot;경제안보외교 환경의... ","Fri, 28 Feb 2025 17:54:00 +0900"
2025-02-28 09:23:07,중국 부품 들여와 한국산 둔갑해 수출 … 美 '관세폭탄' 타깃됐다,https://n.news.naver.com/mnews/article/009/0005451757?sid=101,"한국에 대한 중국의 직접투자에서 2차전지, 태양광, <b>반도체</b> 등 미국으로부터 규제를 받고 있는 첨단산업... 최근 <b>반도체</b>, 로봇, 전기차 등 첨단산업 분야에서 중국의 기술굴기가 돋보이는 가운데 한국이 중국의 하도급... ","Fri, 28 Feb 2025 17:53:00 +0900"
2025-02-28 09:23:07,"영진전문대학교, ‘한국에서 가장 존경받는 전문대학’ 1위 인증패 수여...",https://www.nspna.com/news/?mode=view&newsid=742612,"또한 교육부의 혁신융합대학사업에서 지능형 로봇, 인공지능, <b>반도체</b> 소부장(소재·부품·장비) 등 전국 전문대학 중 유일하게 3개 분야에 선정되며 ‘글로벌 영진’이라는 대학 비전 실현을 앞당기고 있다. 최재영... ","Fri, 28 Feb 2025 17:52:00 +0900"
