DateTime,Title,Link,Description,PubDate
2025-10-19 04:49:24,"고려아연, 전략광물 '갈륨' 공장 신설키로",https://www.goodkyung.com/news/articleView.html?idxno=274518,"갈륨은 <b>반도체</b>와 LED, 고속 집적회로 등 주요 첨단산업에서 필수적으로 쓰인다. 이에 우리나라 정부는... 인듐은 <b>반도체</b>와 재생에너지 등 주요 첨단산업에 쓰이는 희소금속으로 최근 5년간 가격이 약 2배 상승했다.... ","Sun, 19 Oct 2025 13:48:00 +0900"
2025-10-19 04:49:24,엔비디아 젠슨 황 방한 확정…경주 APEC 참석,https://n.news.naver.com/mnews/article/056/0012049401?sid=101,"국내 <b>반도체</b>·메모리 업계 핵심 리더들과 만나 고대역폭 메모리(HBM) 공급, AI·메모리 분야 협력 등을 논의할 전망입니다. 삼성전자·SK하이닉스의 <b>반도체</b> 생산 라인을 방문할 수 있다는 관측도 나옵니다. 앞서 이... ","Sun, 19 Oct 2025 13:45:00 +0900"
2025-10-19 04:49:24,"대한상의, APEC CEO 서밋 개최…경주에 글로벌 리더 1700명 집결",http://www.m-i.kr/news/articleView.html?idxno=1292703,30일에는 각국 정상 연설과 함께 △소버린 AI 전략 △아태 디지털 시장 성장 △AI <b>반도체</b> 메가 인프라 프로젝트 △친환경 공급망 구축 △미래 모빌리티 및 자율주행 생태계 △디지털 화폐와 국제 금융시장 전망 등을... ,"Sun, 19 Oct 2025 13:44:00 +0900"
2025-10-19 04:49:24,"韓 기업 총수들, 트럼프와 '7시간 골프 회동'…한미 협상 막판 변수로",https://n.news.naver.com/mnews/article/008/0005264864?sid=101,업계에서는 이들 기업이 <b>반도체</b>·배터리·자동차·조선 등 각 분야에서 미국에 대규모 투자를 진행하는 만큼 우호적인 분위기 속에서 투자와 관세 등 폭넓은 대화가 이뤄졌을 것으로 보인다. 트럼프 대통령이 한국... ,"Sun, 19 Oct 2025 13:41:00 +0900"
2025-10-19 04:49:24,4분기 제조업 매출둔화 전망…무선통신 외 전부문 '부정적',https://n.news.naver.com/mnews/article/001/0015686631?sid=101,"4분기 매출 전망 BSI를 업종별로 보면 무선통신기기(102)만 기준선을 넘긴 가운데 <b>반도체</b>(98), 디스플레이(96), 자동차(87), 조선(97), 일반기계(91), 정유(84), 철강(83) 등 전 업종에서 매출이 감소할 것으로 예상됐다.... ","Sun, 19 Oct 2025 13:41:00 +0900"
2025-10-19 04:49:24,"코트라, 일본서 '한일 첨단산업 투자 설명회'",https://n.news.naver.com/mnews/article/001/0015686629?sid=101,<b>반도체</b> 초미세 공정 장비 전문 제조사인 도쿄일렉트론도 한국 사업에 관해 소개했다 김태형 코트라 인베스트코리아 대표는 &quot;불확실한 글로벌 통상 환경 속에서 한일 양국은 상호 보완이 가능한 적격 파트너&quot;라며 &quot;이번... ,"Sun, 19 Oct 2025 13:40:00 +0900"
2025-10-19 04:49:24,"고려아연, 전략광물 '갈륨' 공장 신설…557억원 투자",http://www.srtimes.kr/news/articleView.html?idxno=187715,"갈륨은 <b>반도체</b>와 LED, 고속 집적회로 등 주요 첨단산업에서 필수적으로 쓰인다. 이에 우리나라 정부는... 인듐은 <b>반도체</b>와 재생에너지 등 주요 첨단산업에 쓰이는 희소금속으로 최근 5년간 가격이 약 2배 상승했다.... ","Sun, 19 Oct 2025 13:40:00 +0900"
2025-10-19 04:49:24,<b>반도체</b>發 '불장'덕에 ETF 수익률 40%...뭐 샀나 보니,https://n.news.naver.com/mnews/article/008/0005264863?sid=101,"국내 <b>반도체</b> 투자자의 상승세가 이어질 전망이다. 연금투자형 1위는 동탄창투(18.65%)로 전체 13위, 글로벌형 1위인 호동이(16.53%)는 전체 17위였다. 추석 이후 매매가 집중된 종목은 단연 <b>반도체</b>·양자컴퓨터... ","Sun, 19 Oct 2025 13:40:00 +0900"
2025-10-19 04:49:24,중국의 새로운 자신감과 아시아 쇼크의 위험,https://www.koreaittimes.com/news/articleView.html?idxno=146668,"한국의 <b>반도체</b> 제조사, 말레이시아의 부품 공급업체, 싱가포르의 물류 허브 모두 압박을 받는다.... 12월 1일 발효 예정인 중국의 새로운 수출 통제 제도는 전 세계 청정 에너지 및 <b>반도체</b> 생산에 병목 현상을 초래할... ","Sun, 19 Oct 2025 13:36:00 +0900"
2025-10-19 04:49:24,"[시론] 美中의 줄서기 강요, 국력이 답이다",https://www.kbsm.net/news/view.php?idx=493584,"한국도 <b>반도체</b>, 배터리 소재, 초대형 선박 등에서 독보적 기술력을 구축해야 한다. 내수시장 확대와 공급망 다원화 확보도 과제다. 미·중 양국이 한국 없이는 곤란한 영역을 만드는 것, 그것이 한국의 유일한 힘이다. 연합","Sun, 19 Oct 2025 13:36:00 +0900"
2025-10-19 04:49:24,"고려대, 수소결합 인공시냅스 개발",http://www.m-i.kr/news/articleView.html?idxno=1292695,심재원 교수는 &quot;이번 연구를 통해 수소결합 활용 페로브스카이트 인공시냅스의 불안정성과 비선형성 문제를 근본적으로 해결했다&quot;며 &quot;초저전력·고신뢰 인공시냅스를 구현함으로써 차세대 뇌 모사형 <b>반도체</b> 기술 실현... ,"Sun, 19 Oct 2025 13:36:00 +0900"
2025-10-19 04:49:24,"4대 그룹 총수, 트럼프와 골프 회동…관세·美투자 논의 주목",https://news.mtn.co.kr/news-detail/2025101913305168644,"특히 회동에 참석한 한국 기업 총수들이 <b>반도체</b>, 자동차, 배터리, 전자, 조선 등의 각 분야를 이끄는 만큼 미국과의 협력을 통해 시너지를 낼 수 있는 방안 등을 논의했을 것이라는 관측이 나온다. 이충우... ","Sun, 19 Oct 2025 13:34:00 +0900"
2025-10-19 04:49:24,"고려아연, 전략광물 '갈륨' 공장 신설 나서…'글로벌 전략광물 허브' 도...",https://sports.hankooki.com/news/articleView.html?idxno=6913269,"갈륨은 <b>반도체</b>와 LED, 고속 집적회로 등 주요 첨단산업에서 필수적으로 쓰인다. 이에 우리나라 정부는... 기대된다&quot;며 &quot;인듐은 <b>반도체</b>와 재생에너지 등 주요 첨단산업에 쓰이는 희소금속으로 최근 5년간 가격이 약 2배... ","Sun, 19 Oct 2025 13:34:00 +0900"
2025-10-19 04:49:24,엔비디아 젠슨 황 방한…APEC서 이재용·최태원과 AI·<b>반도체</b> 협력 논의,https://n.news.naver.com/mnews/article/654/0000146714?sid=101,주요 <b>반도체</b> 업계 인사들과 고대역폭 메모리(HBM) 공급 및 AI·메모리 협력 방안 등을 논의할 것으로 예상된다. 일각에서는 황 CEO가 삼성전자와 SK하이닉스의 <b>반도체</b> 생산라인을 직접 방문할 가능성도 제기되고... ,"Sun, 19 Oct 2025 13:34:00 +0900"
2025-10-19 04:49:24,실적 부진 전망에 캄보디아 사태까지…‘날개 잃은’ 항공株,https://n.news.naver.com/mnews/article/018/0006141599?sid=101,그는 “최근 <b>반도체</b> 업황 개선에 힘입어 항공화물 부문 턴어라운드 속도가 빨라지고 있다는 점에 주목해야 한다”고 덧붙였다. 대형항공사(FSC)인 대한항공이 중장기적으로 수혜를 볼 가능성도 제기된다. 양승윤... ,"Sun, 19 Oct 2025 13:33:00 +0900"
2025-10-19 04:49:24,“주변에서 취직했다는 얘기를 못 들었어요”… 청년 고용률 17개월째 ...,https://n.news.naver.com/mnews/article/022/0004075993?sid=102,"그나마 한국 경제를 이끄는 <b>반도체</b> 산업은 자본 집약적이라 일자리 창출 효과가 크지 않다. 코로나19 팬데믹 이후 플랫폼 산업이 급격히 성장했지만, 배달 라이더 등 고용 안정성이 떨어지는 단순 일자리 공급이 늘었다.... ","Sun, 19 Oct 2025 13:32:00 +0900"
2025-10-19 04:49:24,"고려아연, 中 통제하는 갈륨 생산 나선다...희토류 자립 속도",https://www.ajunews.com/view/20251019132256283,"2028년 이후 연 15톤 생산 목표 <b>반도체</b>, LED 등 생산에 필수 인듐 생산량도 확대 아주경제=강일용 기자 zero... 갈륨은 <b>반도체</b>와 LED, 고속 집적회로 등 주요 첨단산업에서 필수적으로 쓰인다. 한국 정부는... ","Sun, 19 Oct 2025 13:32:00 +0900"
2025-10-19 04:49:24,"포항-수원컨벤션센터, MICE 산업 상생 협력 맞손",https://www.newsfreezone.co.kr/news/articleView.html?idxno=652557,이번 협약은 철강과 <b>반도체</b>로 상징되는 두 도시의 컨벤션센터가 MICE 분야에서 손을 잡았다는 점에서 특별한 의미를 지닌다. 수원컨벤션센터는 삼성전자를 중심으로 한 IT·<b>반도체</b> 산업 클러스터에... ,"Sun, 19 Oct 2025 13:30:00 +0900"
2025-10-19 04:49:24,"[사설] 한미 관세협상 급물살, 그 배경과 향후 전망",http://www.chungnamilbo.co.kr/news/articleView.html?idxno=854245,"특히 조선업은 1500억 달러 규모의 협력 펀드 조성으로 신규 수주 확대가 예상되며, <b>반도체</b>·배터리 분야에서도 미국 내 생산 확대와 기술제휴가 점쳐진다. 반면에 미중 간 무역 갈등이 심화될 경우 한국의 성장률이 최대 0.... ","Sun, 19 Oct 2025 13:30:00 +0900"
2025-10-19 04:49:24,[아침시평] 글로벌 IT기업에게 광주공군기지 땅을 공짜로,http://www.mdilbo.com/detail/lBZuon/748911,전문가들의 주장에 귀 기울이자면 AI의 활용이 구체화 될수록 메모리건 비메모리건 <b>반도체</b> 칩의 글로벌 수요는 폭발한다고 한다. GPU를 만드는 엔비디아나 AMD는 주식시장의 최강자다. 광주는 도시의 미래 먹거리로 AI를... ,"Sun, 19 Oct 2025 13:28:00 +0900"
2025-10-19 04:49:24,"젠슨 황, 경주 APEC 찾는다..최태원·이재용 만남도 관심",http://kpenews.com/View.aspx?No=3819253,"특히 황 CEO는 APEC에서 최태원 SK그룹 회장과 이재용 삼성전자 회장 등 국내 <b>반도체</b>·메모리 업계 핵심 리더들과 만나 고대역폭 메모리(HBM) 공급, AI·메모리 분야 협력 등을 논의할 예정이다. 아울러 올해 APEC... ","Sun, 19 Oct 2025 13:28:00 +0900"
2025-10-19 04:49:24,"“AI와 초격차 기술의 미래 논의”…글로벌 CEO 1700명, 경주 집결한다",https://www.kgnews.co.kr/news/article.html?no=869573,30일에는 ‘소버린 AI 전략’과 ‘AI <b>반도체</b> 메가 인프라 프로젝트’가 주요 세션으로 다뤄질 예정이다. 공식 행사 외에도 ‘퓨처테크 포럼(Future Tech Forum)’이 열려 AI·방산·조선·디지털자산 등 첨단 산업의... ,"Sun, 19 Oct 2025 13:28:00 +0900"
2025-10-19 04:49:24,"20일부터 中 20기 4중전회, 경제 등 중대 현안 논의",https://www.asiatoday.co.kr/view.php?key=20251019010006124,"동시에 향후의 산업 구조를 AI(인공지능), <b>반도체</b>를 핵심으로 하는 ICT(정보통신기술) 분야 위주로 완전히 개편하는 방향의 토의 역시 활발하게 이어갈 것으로 보인다. 이달 말 경주에서 열리는 아시아태평양경제협력체... ","Sun, 19 Oct 2025 13:28:00 +0900"
2025-10-19 04:49:24,"고려아연, 전략 광물 ‘갈륨’ 공장 세운다… 2028년부터 年15.5t 생산",https://n.news.naver.com/mnews/article/366/0001115611?sid=101,"갈륨은 <b>반도체</b> 핵심 원료로, 중국이 글로벌 시장을 완전히 장악하고 있다. 이번 투자 결정으로 국내 자원... 갈륨은 <b>반도체</b>를 비롯해 태양광 패널, 레이저, 야간 고글, 발광다이오드(LED), 고속집적회로 등 첨단 산업의... ","Sun, 19 Oct 2025 13:26:00 +0900"
2025-10-19 04:49:24,제주 9월 수출 188.2% 증가… 역대 최고 월간 증가율,http://www.samdailbo.com/news/articleView.html?idxno=253692,"이 같은 역대 최고 월간 증가율 기록은 <b>반도체</b> 수출이 이끌었다. 지난달 제주 <b>반도체</b> 수출은 전년 도우얼 대비 246.1% 급증한 2850만 달러로, 전체 제주 수출액의 74.8%를 차지했다. 주요 수출국인 홍콩으로 <b>반도체</b>... ","Sun, 19 Oct 2025 13:26:00 +0900"
2025-10-19 04:49:24,"이재용·최태원·정의선·구광모, 트럼프와 7시간 골프 외교…'빅딜·관...",https://n.news.naver.com/mnews/article/030/0003360325?sid=105,<b>반도체</b>·자동차·배터리·조선 등에서 글로벌 경쟁력을 보유한 기업인들인 만큼 적극적인 대미 투자와 협력 방안 등을 논의했을 가능성이 나온다. 이날 백악관 풀기자단에 따르면 트럼프 대통령은 경찰 통제 아래 오전 9시... ,"Sun, 19 Oct 2025 13:25:00 +0900"
2025-10-19 04:49:24,"엔비디아·TSMC, 미국 공장서 최초로 '블랙웰' 칩 웨이퍼 제작",https://www.aitimes.com/news/articleView.html?idxno=203263,"이는 첨단 인공지능(AI) 칩 생산을 미국 본토에서 실현한 첫 사례로, AI <b>반도체</b>의 공급망 재편과 미국의 <b>반도체</b> 주권 강화라는 상징적 전환점으로 평가된다. 엔비디아와 TSMC는 18일(현지시간) 미국 애리조나 피닉스... ","Sun, 19 Oct 2025 13:24:00 +0900"
2025-10-19 04:49:24,미국 소비둔화 감지될까 주목…中 3분기 GDP도 관심 [뉴욕·상하이 증시...,https://n.news.naver.com/mnews/article/015/0005198760?sid=104,다만 이들 기업들은 현재 증시의 핵심 테마인 인공지능(AI)과 <b>반도체</b> 산업에서 해당 기업들의 사업 영역은 조금 떨어져 있다. 이 때문에 이 기업들이 호실적을 내더라도 전체 증시가 민감하게 움직일 가능성은 작다.... ,"Sun, 19 Oct 2025 13:23:00 +0900"
2025-10-19 04:49:24,젠슨 황 등 글로벌 리더 1700명 경주 집결…APEC CEO 서밋 28일 개최,https://n.news.naver.com/mnews/article/029/0002987860?sid=101,이어 △소버린 AI 전략 △아태 디지털 시장 성장 △AI <b>반도체</b> 메가 인프라 프로젝트 △친환경 공급망 구축 △미래 모빌리티 및 자율주행 생태계 △디지털 화폐와 국제 금융시장 전망 등이 논의된다. 마지막 날인... ,"Sun, 19 Oct 2025 13:18:00 +0900"
2025-10-19 04:49:24,"고려아연, 中 독점 ‘갈륨’ 생산 나선다…557억 투자로 자원 안보 강화",https://www.ekn.kr/web/view.php?key=20251019024227381,최근 중국이 <b>반도체</b>·LED 등 첨단 산업의 필수 소재인 갈륨을 무기화하며 수출 통제에 나서자 자체 기술로 국내 공급망을 구축해 자원 안보 강화의 선봉에 서겠다는 전략이다. 고려아연(회장 최윤범)은 2027년 12월까지... ,"Sun, 19 Oct 2025 13:18:00 +0900"
2025-10-19 04:49:24,구윤철 “AI 대전환으로 저성장 돌파”…국제무대서 ‘한국형 성장모델...,https://www.kgnews.co.kr/news/article.html?no=869570,"구 부총리는 또 IMF 크리스탈리나 게오르기에바 총재와 만나 “전 국민 AI 교육, 데이터 축적, <b>반도체</b>·SMR(소형모듈원자로)·그린수소 등 첨단기술 투자 병행을 통해 민관협력 생태계를 조성하고 있다”고 소개했다.... ","Sun, 19 Oct 2025 13:18:00 +0900"
2025-10-19 04:49:24,젠슨 황 등 글로벌 리더 1700명 경주에 총집결…APEC CEO 서밋 28일 개최,https://n.news.naver.com/mnews/article/016/0002543910?sid=101,이어 ▷소버린 AI 전략 ▷ 아태 디지털 시장 성장 ▷AI <b>반도체</b> 메가 인프라 프로젝트▷ 친환경 공급망 구축 ▷미래 모빌리티 및 자율주행 생태계 ▷ 디지털 화폐와 국제 금융시장 전망 등이 논의된다. 마지막 날인... ,"Sun, 19 Oct 2025 13:17:00 +0900"
2025-10-19 04:49:24,외환시장 불안과 집값 상승세 영향 기준금리 동결 전망,https://m.skyedaily.com/news_view.html?ID=288121,"또한 “내수 심리 회복과 <b>반도체</b> 중심의 수출 경기 호조, 주식시장 강세 지속 등이 금리 인하를 지연시키는 요인으로 작용할 것”이라고 덧붙였다. 이어 “추가 인하 시점은 내년 1분기로 지연될 가능성이 높으며, 정부의... ","Sun, 19 Oct 2025 13:16:00 +0900"
2025-10-19 04:49:24,'10만전자·50만닉스' 보인다…&quot;시총 1000조 기대감&quot;,https://n.news.naver.com/mnews/article/215/0001227517?sid=101,최근 한 달간 두 종목의 상승률은 코스피 상위권에 오르며 <b>반도체</b>주의 위력을 다시 입증했다. 19일... 최근 미국발 기술주 훈풍에 힘입어 국내 <b>반도체</b> 대형주가 급등한 데 따른 현상으로 분석된다. 삼성전자는... ,"Sun, 19 Oct 2025 13:16:00 +0900"
2025-10-19 04:49:24,"코트라 인재 유치 사절단, 싱가포르 첨단인재 유치",https://n.news.naver.com/mnews/article/277/0005666362?sid=101,"케이테크패스는 <b>반도체</b>·디스플레이·이차전지·바이오·로봇·AI 등 첨단산업 해외 인재에게 최상급 비자(F-2)와 정착 지원 서비스를 제공하는 제도로, 올해 4월부터 시행했다. 강상엽 코트라 부사장 겸... ","Sun, 19 Oct 2025 13:14:00 +0900"
2025-10-19 04:49:24,"“우리쌀이 지닌 맛과 멋, 이천 쌀문화축제서 즐겨요”",https://n.news.naver.com/mnews/article/662/0000080085?sid=103,"또 SK하이닉스와 함께하는 ‘산업의 쌀, <b>반도체</b> 주제관’을 새롭게 마련해 쌀과 <b>반도체</b>가 모두 미래를 책임지는 자원이라는 공통점을 조명한다. 친환경 운영도 눈에 띈다. 다회용기 전면 도입으로 쓰레기 발생을... ","Sun, 19 Oct 2025 13:13:00 +0900"
2025-10-19 04:49:24,검은<b>반도체</b> 육성 '10년 로드맵 수립' 속도,http://www.cctimes.kr/news/articleView.html?idxno=870700,▲ 충남도 김산업 육성 발전 계획 수립 연구용역 중간보고회 사진-충남도 제공 충남도가 체계적인 김산업 육성을 위한 '10년 로드맵' 수립에 속도를 내고 있다. 도는 17일 도청 중회의실에서 '충청남도 김산업 육성 발전... ,"Sun, 19 Oct 2025 13:13:00 +0900"
2025-10-19 04:49:24,"中 독점 깨는 고려아연, 전략광물 '갈륨' 생산 착수",https://n.news.naver.com/mnews/article/293/0000073728?sid=101,"갈륨은 <b>반도체</b>, LED, 고속 집적회로 등 첨단산업에 필요한 필수 소재다. 기존 실리콘보다 전력 효율이 높고 속도가 빨라 차세대 <b>반도체</b> 재료로 주목받고 있다. 정부는 갈륨을 '자원안보특별법'에서 지정한 핵심광물 33종... ","Sun, 19 Oct 2025 13:13:00 +0900"
2025-10-19 04:49:24,"고려아연, 중국 수출통제 맞서 '갈륨' 생산 나선다",https://www.straightnews.co.kr/news/articleView.html?idxno=284093,"갈륨은 <b>반도체</b>, LED, 고속 집적회로 등 첨단산업에 필수 소재로, 한국 정부가 자원안보특별법상 '핵심광물... 인듐은 <b>반도체</b>와 재생에너지 산업에 쓰이는 희소금속으로, 최근 5년간 가격이 두 배 이상 상승했다.... ","Sun, 19 Oct 2025 13:12:00 +0900"
2025-10-19 04:49:24,"고려아연, 557억 투자 갈륨공장 신설…&quot;자원안보 강화&quot;",https://www.asiatoday.co.kr/view.php?key=20251019010006111,"<b>반도체</b> 및 LED 등 첨단산업 필수 소재지 생산량 1위 中서 수출 금지…수급에 비상 고려아연이 중국 수출규제... 갈륨은 <b>반도체</b>와 LED, 고속 집적회로 등 주요 첨단산업에서 필수적으로 쓰인다. 우리나라 정부는... ","Sun, 19 Oct 2025 13:10:00 +0900"
2025-10-19 04:49:24,"고려아연, 전략광물 '갈륨' 공장 신설… &quot;대한민국 유일 공급망 넘어 글...",https://www.eroun.net/news/articleView.html?idxno=65131,"◆ &quot;중국 98.7% 점유 시장에 도전&quot;… 자원 안보 강화 갈륨은 <b>반도체</b>, LED, 고속 집적회로 등 첨단산업의 핵심... 인듐은 <b>반도체</b> 및 재생에너지 산업의 필수 소재로, 최근 5년간 가격이 두 배가량 상승했다. 현재 고려아연은... ","Sun, 19 Oct 2025 13:10:00 +0900"
2025-10-19 04:49:24,"엔비디아 젠슨 황, APEC CEO 서밋 위해 방한 확정",https://n.news.naver.com/mnews/article/052/0002261338?sid=101,또 최태원 SK그룹 회장과 이재용 삼성전자 회장 등 국내 <b>반도체</b> 업계 핵심 관계자들과 만나 협력을 논의할 전망입니다. 대한상공회의소가 주관하는 APEC CEO 서밋은 오는 31일 개막하는 APEC 정상회의의 공식... ,"Sun, 19 Oct 2025 13:08:00 +0900"
2025-10-19 04:49:24,"韓·日, 첨단산업 소부장 투자협력 시동",http://www.m-i.kr/news/articleView.html?idxno=1292685,산업부와 코트라는 <b>반도체</b>·미래차·배터리·인공지능(AI) 분야 일본 핵심 소부장 기업에 대한 투자유치를... <b>반도체</b> 초미세공정 장비 전문 제조사 도쿄일렉트론은 한국 내 사업에 대해 소개했다. 이 회사는 고객사와의... ,"Sun, 19 Oct 2025 13:08:00 +0900"
2025-10-19 04:49:24,"코트라, 日 첨단기업 투자설명회…삼성전자 출격",https://n.news.naver.com/mnews/article/277/0005666360?sid=101,산업부와 코트라는 <b>반도체</b>·미래차·배터리·인공지능(AI) 분야 일본 핵심 소부장 기업에 대한 투자 유치를 확대해 국내 공급망 안정성과 산업 경쟁력을 높이기 위해 행사를 마련했다. 설명회엔 양국 <b>반도체</b> 산업을... ,"Sun, 19 Oct 2025 13:07:00 +0900"
2025-10-19 04:49:24,엔비디아 젠슨 황 방한 확정…경주 APEC 참석,https://n.news.naver.com/mnews/article/374/0000469185?sid=101,"국내 <b>반도체</b>·메모리 업계 핵심 리더들과 만나 고대역폭 메모리(HBM) 공급, AI·메모리 분야 협력 등을 논의할 전망입니다. 이 과정에서 삼성전자·SK하이닉스의 <b>반도체</b> 생산 라인을 방문할 수 있다는 관측도... ","Sun, 19 Oct 2025 13:07:00 +0900"
2025-10-19 04:49:24,"[스트레이트뉴스 여론조사] 인공지능, 국민 10명 중 7~8명 긍정 평가 &quot;AI...",https://www.straightnews.co.kr/news/articleView.html?idxno=284059,"이는 우리 국민의 <b>반도체</b>와 이동통신, IT 등에 대한 기술 자신감이 상당히 높아진 결과에 따르나, 응답자의 AI 이해 수준별 분석에서는 매우 다른 결이 드러났다. AI를 &quot;매우 잘 알고 있다&quot;고 응답한 집단에서는 미국(42.... ","Sun, 19 Oct 2025 13:06:00 +0900"
2025-10-19 04:49:24,"삼성전자·SK하이닉스 '신고가 행진'… 기술주 훈풍에 시총 1,000조 원 시...",https://www.tokenpost.kr/news/market/295727,"증권업계는 앞으로도 <b>반도체</b> 업종에 대한 긍정적 시각을 유지하고 있다. KB증권은 글로벌 기업 간 인공지능(AI) 분야 협력이 확대되면서 <b>반도체</b> 수요가 지속 확대될 것으로 내다봤고, SK하이닉스와 삼성전자가... ","Sun, 19 Oct 2025 13:06:00 +0900"
2025-10-19 04:49:24,"IMF총재 &quot;한국 경제·재정정책방향, 권고방안과 부합&quot;",https://n.news.naver.com/mnews/article/374/0000469184?sid=101,<b>반도체</b>·소형모듈원자로(SMR)·그린수소 초혁신기술에 과감한 투자와 민관 협력 생태계 조성을 통해 AI 기반의 새로운 성장동력을 창출해 나가고 있다고도 강조했습니다. 구 부총리는 국제신용평가사 피치와의... ,"Sun, 19 Oct 2025 13:05:00 +0900"
2025-10-19 04:49:24,"고려아연, 中 통제 '갈륨' 직접 캔다… 557억 투자해 공장 신설",https://www.financialpost.co.kr/news/articleView.html?idxno=235048,"갈륨은 <b>반도체</b>와 LED, 고속 집적회로 등 주요 첨단 산업에서 필수적으로 쓰인다. 이에 우리나라 정부는... 인듐은 <b>반도체</b>와 재생 에너지 등 주요 첨단 산업에 쓰이는 희소금속으로 최근 5년간 가격이 약 2배 상승했다.... ","Sun, 19 Oct 2025 13:04:00 +0900"
2025-10-19 04:49:24,"젠슨 황, APEC CEO 서밋 참석한다…&quot;AI 비전 공유&quot;",https://www.newspim.com/news/view/20251019000082,"황 CEO의 방한은 한국이 <b>반도체</b>와 AI 기술에서 차지하는 전략적 중요성을 반영한 것으로 풀이된다. 엔비디아는 글로벌 AI 컴퓨팅 시장의 핵심 플레이어로서 삼성전자, SK하이닉스 등 국내 <b>반도체</b> 기업들과의 협력... ","Sun, 19 Oct 2025 13:03:00 +0900"
