DateTime,Title,Link,Description,PubDate
2025-07-09 23:49:16,"[이넷뉴스 브랜드평판] 삼성전기, 전자장비 상장기업 7월 1위... LG이노텍...",https://www.enetnews.co.kr/news/articleView.html?idxno=39870,"아이티엠<b>반도체</b>, 에스에이엠티, 세코닉스, 뉴프렉스, 한울<b>반도체</b>, 브이원텍, 삼진엘앤디, 유니온바이오메트릭스, 유일에너테크, 대동전자, 파나케이아, 소니드, 옵트론텍, 현우산업, 카스, 슈프리마에이치큐... ","Thu, 10 Jul 2025 08:46:00 +0900"
2025-07-09 23:49:16,"GH, 중단됐던 '제3판교 테크노밸리' 민간사업자 공모 재추진",http://www.joygm.com/news/articleView.html?idxno=214519,이와 함께 경기도는 제3판교 TV 내 팹리스 클러스터를 조성해 국공립 및 해외 연구소와 첨단<b>반도체</b> 산업과의 협업을 통해 첨단기술 실용화를 확대할 계획이다. 제3판교 테크노밸리는 성남금토 공공주택지구 내... ,"Thu, 10 Jul 2025 08:46:00 +0900"
2025-07-09 23:49:16,"부산시, 기장군에 114만㎡ 규모 신규 산업단지 조성",http://www.metroseoul.co.kr/article/20250709500488,"새 산업단지는 기장군 장안읍 기룡리, 오리, 좌동리 일원에 약 114만㎡ 규모로 조성되며 이차전지와 전력 <b>반도체</b> 등 산업용지 확보를 목적으로 한다. 이번 산업단지의 특징은 주거, 교육, 문화, 상업시설이 어우러진... ","Thu, 10 Jul 2025 08:42:00 +0900"
2025-07-09 23:49:16,[서울데이터랩]미국 증시 지수 종합,https://n.news.naver.com/mnews/article/081/0003556513?sid=101,"나스닥 100 지수는 162.66포인트(0.72%) 상승하며 22,864.91에 마감했고, 필라델피아 <b>반도체</b> 지수는 24.78포인트(0.44%) 오른 5,665.99를 기록하며 보합을 유지했다. 한편, 시카고옵션거래소(CBOE)에서... ","Thu, 10 Jul 2025 08:39:00 +0900"
2025-07-09 23:49:16,"엔비디아, 전 세계 최초 시총 4조 달러 돌파…AI 패권 '정점' 찍었다",https://n.news.naver.com/mnews/article/243/0000081017?sid=101,인공지능(AI) <b>반도체</b>의 절대 강자 엔비디아가 9일(현지시간) 세계 최초로 장중 시가총액 4조 달러(약 5502조 원)를 돌파하며 글로벌 증시의 새 이정표를 세웠다. 이날 엔비디아 주가는 장중 한때 전날보다 약 2.5% 오른... ,"Thu, 10 Jul 2025 08:36:00 +0900"
2025-07-09 23:49:16,"[글로벌마켓 모닝 브리핑] 엔비디아, 세계 첫 시총 4조 달러…S&amp;P·나스...",https://www.etoday.co.kr/news/view/2486435,인공지능(AI) <b>반도체</b> 기업 엔비디아가 장중 세계 최초로 시총 4조 달러대에 올랐다. 엔비디아 주식은 AI 확산에 따른 <b>반도체</b> 수요 확대 기대감에 매수세가 이어지고 있다. 영국 파이낸셜타임스(FT)가 “중국용으로... ,"Thu, 10 Jul 2025 08:36:00 +0900"
2025-07-09 23:49:16,"&quot;산학협력, 이제는 기부로&quot;…경일대와 ㈜솔라라이트의 지속적 동행",https://n.news.naver.com/mnews/article/088/0000958161?sid=102,"이차전지 및 태양광 에너지 솔루션 전문 기업인 ㈜솔라라이트는 경일대의 조기취업형 계약학과인 스마트전력인프라학과 및 G-<b>반도체</b>공정설비학과의 협약기업으로, 활발한 산학협력과 취업 연계를 이어오고 있다. 또한... ","Thu, 10 Jul 2025 08:36:00 +0900"
2025-07-09 23:49:16,[정의선 AI 승부수上] 車·로봇·공장 넘나드는 전방위 첨단 혁신,https://www.seoulfn.com/news/articleView.html?idxno=600290,동시에 생성형 AI를 위한 시스템<b>반도체</b>(SoC)를 넣어 연산 성능을 끌어올렸다. 그룹은 AI 미래 전략을 뒷받침할 이 플랫폼을 내년부터 전 차종에 순차 적용한다는 방침이다. 이러한 기술 체계는 자동차를 넘어 로보틱스... ,"Thu, 10 Jul 2025 08:36:00 +0900"
2025-07-09 23:49:16,"비트코인, 사상 최고가 돌파…엔비디아 시총 4조달러 영향",https://n.news.naver.com/mnews/article/656/0000139503?sid=101,"특히 인공지능(AI) <b>반도체</b> 기업 엔비디아의 시가총액이 장중 4조 달러를 넘어서며 기술주 중심의 나스닥 지수가 0.94% 오르는 등, 시장 전반의 위험자산 선호 분위기가 비트코인 급등을 견인했다. 미 경제매체 CNBC는... ","Thu, 10 Jul 2025 08:36:00 +0900"
2025-07-09 23:49:16,"연고점 갈아치운 코스피, 美기술주 훈풍 힘 받을까…“하반기 3550까지 ...",https://n.news.naver.com/mnews/article/016/0002497397?sid=101,"다만 삼성전자(-1.63%) 등 <b>반도체</b>주와 LG에너지솔루션(-0.65%), 현대차(-0.71%) 등 이차전지·자동차주는... 간밤 엔비디아(1.8%)가 장 한때 시총 4조달러를 넘어서고, 필라델피아 <b>반도체</b> 지수(0.44%)가 강세를 보인 점은... ","Thu, 10 Jul 2025 08:35:00 +0900"
2025-07-09 23:49:16,[오늘의 브릿지경제 1면] “5년 내 <b>반도체</b> 패권 주인 가려진다…韓 적기...,https://www.viva100.com/article/20250709501543,◆“5년 내 <b>반도체</b> 패권 주인 가려진다…韓 적기 공급 역량에 사활 걸어야” 인공지능(AI) 시대 개막과 함께 <b>반도체</b> 산업의 지각변동이 시작됐다. 모바일 중심이던 <b>반도체</b> 수요가 AI·데이터센터로 이동하면서 글로벌... ,"Thu, 10 Jul 2025 08:32:00 +0900"
2025-07-09 23:49:16,[크립토 브리핑] 엔비디아 시총 첫 4조달러 돌파...비트코인 사상 최고...,https://www.techm.kr/news/articleView.html?idxno=141954,7월 10일 비트코인 시세 / 사진=코인마켓캡 제공 <b>반도체</b> 기업 엔비디아가 시가총액 4조 달러를 돌파하며... 이날 시장의 주인공은 <b>반도체</b> 기업 엔비디아였다. 엔비디아는 전 세계 기업 중 처음으로 시가총액 4조... ,"Thu, 10 Jul 2025 08:32:00 +0900"
2025-07-09 23:49:16,"에이루트 자회사, 전력<b>반도체</b> 핵심장비 독점 공급 지위 확보",https://www.etoday.co.kr/news/view/2486431,이투데이=정수천 기자 | 에이루트는 <b>반도체</b> 장비 전문 자회사 앤에스알시(NSRC)가 중국 <b>반도체</b> 제조사 A사와 장비 독점 공급을 전제로 한 양해각서(MOU)를 체결하고 공급을 준비 중이라고 10일 밝혔다. 앤에스알시는... ,"Thu, 10 Jul 2025 08:32:00 +0900"
2025-07-09 23:49:16,&quot;관세 1년 유예&quot; 발표에 한숨돌린 K바이오,https://n.news.naver.com/mnews/article/011/0004507320?sid=103,"트럼프 대통령은 8일(현지 시간) 백악관에서 주재한 내각회의에서 “의약품, <b>반도체</b>, 그리고 몇 가지 다른 분야에 대해 발표가 있을 것”이라며 “의약품의 경우 1년 또는 1년 반의 기간을 줄 텐데 이 기간 내 (미국으로)... ","Thu, 10 Jul 2025 08:31:00 +0900"
2025-07-09 23:49:16,기술탈취 당해도 中企 10곳 중 4곳 대응 못해…&quot;K디스커버리 도입 서둘...,https://n.news.naver.com/mnews/article/018/0006061653?sid=101,신상곤 특허청 산업재산보호협력국장은 “한국형 증거수집제도 도입에 대해 <b>반도체</b> 소부장(소재·부품·장비) 업계가 반대한 쟁점 중 하나가 조사 대상에서 법률자문서의 제외 여부”라며 “미국에서 제출되지 않는... ,"Thu, 10 Jul 2025 08:30:00 +0900"
2025-07-09 23:49:16,[어제장 오늘장] 자사주 취득 소각 의무화 법안 발의…지주사 관련주↑,https://n.news.naver.com/mnews/article/374/0000450720?sid=101,"관세 불확실성에 <b>반도체</b>, 자동차 대표주들이 부진한 흐름을 나타냈습니다. KB금융도 전 거래일 급등에 따른 피로감으로 하락했습니다. 10위권 내에선 방산주, 한화에어로스페이스가 가장 크게 오르며 10위를... ","Thu, 10 Jul 2025 08:29:00 +0900"
2025-07-09 23:49:16,부산 기장군에 동부산 이파크 산단 조성,https://n.news.naver.com/mnews/article/056/0011986413?sid=101,"부산시는 기장군 장안읍 일대 114만 제곱미터의 땅에 이차전지와 전력 <b>반도체</b> 업체 등이 입주할 산업단지를 조성하고 인근 27만 제곱미터의 땅에는 주거와 교육, 문화, 상업시설을 갖춘 지원단지를 조성할 예정입니다.... ","Thu, 10 Jul 2025 08:28:00 +0900"
2025-07-09 23:49:16,"에이루트 子, 전력<b>반도체</b> 핵심장비 독점 공급 지위 확보",https://n.news.naver.com/mnews/article/018/0006061650?sid=101,에이루트(096690)는 <b>반도체</b> 장비 전문 자회사 앤에스알시(NSRC)가 중국 <b>반도체</b> 제조사 A사와 장비 독점 공급을 전제로 한 양해각서(MOU)를 체결하고 공급을 준비 중이라고 10일 밝혔다. 앤에스알시는 하반기부터 순차적으로... ,"Thu, 10 Jul 2025 08:28:00 +0900"
2025-07-09 23:49:16,"에이루트 &quot;앤에스알시, 中 <b>반도체</b> 제조사에 장비 독점 공급 양해각서 체...",https://www.newspim.com/news/view/20250710000072,에이루트는 <b>반도체</b> 장비 전문 자회사 앤에스알시(NSRC)가 중국 <b>반도체</b> 제조사 A사와 장비 독점 공급을 전제로 한 양해각서(MOU)를 체결하고 공급을 준비 중이라고 10일 밝혔다. 앤에스알시는 하반기부터 순차적으로 장비... ,"Thu, 10 Jul 2025 08:27:00 +0900"
2025-07-09 23:49:16,"[상반기 결산] 펀드시장, MMF·채권형 펀드가 주도",https://www.kfenews.co.kr/news/articleView.html?idxno=641425,"국내 인덱스 주식형 펀드는 AI, 고배당, 방산, 삼성그룹주 등 테마형 상품으로 구성된 '인덱스기타' 유형을 중심으로 2조9607억원 증가했고, 코스피200 유형과 <b>반도체</b>·2차전지 섹터 ETF도 각각 7136억원, 3157억원씩... ","Thu, 10 Jul 2025 08:26:00 +0900"
2025-07-09 23:49:16,"포스코그룹, 벤처 육성 진심…지주사 CVC 투자 톱",http://www.datanews.co.kr/news/article.html?no=139546,"시스템<b>반도체</b>, 미래모빌리티, 사이버보안 등 미래 유망 분야에도 적극적으로 투자하고 있다. CJ그룹의... 두산인베스트먼트는 2023년 7월 설립 후 로봇, 자동화, <b>반도체</b>, AI, 그린에너지 관련 벤처기업에 투자하고... ","Thu, 10 Jul 2025 08:26:00 +0900"
2025-07-09 23:49:16,"에이루트 자회사, 中<b>반도체</b> 기업과 전력<b>반도체</b> 핵심장비 공급 MOU",https://n.news.naver.com/mnews/article/003/0013353742?sid=101,에이루트는 <b>반도체</b> 장비 전문 자회사 앤에스알시(NSRC)가 중국 <b>반도체</b> 제조사 A사와 장비 독점 공급을 전제로 한 양해각서(MOU)를 체결하고 공급을 준비 중이라고 10일 밝혔다. 앤에스알시는 하반기부터 순차적으로 장비... ,"Thu, 10 Jul 2025 08:26:00 +0900"
2025-07-09 23:49:16,&quot;제2경찰학교 아산 유치...주력산업 고도화&quot;/투데이,https://tjmbc.co.kr/article/WAhT4sGjaWx5oRYO3MdOds,"아산은 현대차, 삼성<b>반도체</b>, 삼성디스플레이 입지하고 있다. 주력산업의 고도화에도 노력 중. 아산시의 신산업으로 바이오헬스 산업 노력. 관련 공공기관도 유치 국가 공모사업 2천억 이상 R&amp;D 투자, 공공기관도 이전.... ","Thu, 10 Jul 2025 08:26:00 +0900"
2025-07-09 23:49:16,"美 엔비디아, 역사상 처음으로 장중 시총 4조달러 돌파",https://n.news.naver.com/mnews/article/119/0002977556?sid=104,엔비디아는 지난 2023년 6월 13일 <b>반도체</b> 기업 중 최초로 1조 달러를 돌파했으며 지난해 2월 23일에는 2조... 올해 초만 해도 중국의 생성형 AI ‘딥시크’ 출범과 도널드 트럼프 대통령의 <b>반도체</b> 수출 제한 정책 등... ,"Thu, 10 Jul 2025 08:24:00 +0900"
2025-07-09 23:49:16,[뉴욕증시] 엔비디아 시총 4조달러 돌파에 S&amp;P500·나스닥 또다시 '사상...,http://www.shinailbo.co.kr/news/articleView.html?idxno=2081088,미국 증시는 엔비디아 등 <b>반도체</b>주 강세에 힘입어 일제히 상승 마감했다. 9일(현지시각)... 엔비디아 주가가 강세를 보이면서 △브로드컴(2.24%) △TSMC(1.75%) 등 <b>반도체</b> 종목도 동반 강세를 보였다. 이밖에도... ,"Thu, 10 Jul 2025 08:22:00 +0900"
2025-07-09 23:49:16,"엔비디아, 사상 첫 시총 4조달러 돌파…월가 분위기는[오늘M7]",https://n.news.naver.com/mnews/article/018/0006061639?sid=101,그는 “엔비디아를 포함한 빅테크뿐 아니라 AI 열풍이 <b>반도체</b> 후발주자들이나 스타트업 등에도 영향을 미치기 시작했다”며 “사이버보안 기업들이나 빅데이터 기업들이 잘하고 있다. 이 모든 기업들이 AI 테마의... ,"Thu, 10 Jul 2025 08:21:00 +0900"
2025-07-09 23:49:16,"[단독] 뉴럴링크, 美 플로리다 병원서 척추 손상 환자 뇌에 칩 이식",https://www.theguru.co.kr/news/article.html?no=89174,N1 임플란트는 <b>반도체</b> 등으로 구성된 하우징과 머리카락보다 얇은 64개의 전극 실 부분으로 구성된다. 하우징 부분은 두개골에 부착되며 실 부분이 뇌에 연결돼 전기 신호를 감지하는 역할을 한다. 5번째 임상... ,"Thu, 10 Jul 2025 08:20:00 +0900"
2025-07-09 23:49:16,"[ANDA 포커스] 제이앤티씨, 'HDD 플래터' 품질테스트 완료…&quot;신사업 매출...",https://www.newspim.com/news/view/20250707000048,"일본 업체들이 사실상 독점해 온 HDD 플래터 시장에 뛰어들며, <b>반도체</b>용 유리기판과 함께 '투트랙' 형태의... HDD 플래터와 함께 <b>반도체</b>용 유리기판 사업도 본격화한다. AI <b>반도체</b> 수요 증가에 대응하기 위해 지난해부터... ","Thu, 10 Jul 2025 08:20:00 +0900"
2025-07-09 23:49:16,[ESG 돋보기-SK하이닉스] ‘윤리경영’ 고삐…경·중징계 4년 내 최대치...,https://www.fetv.co.kr/news/article.html?no=196214,한편 SK하이닉스는 올해 미국 에티스피어(Ethisphere)가 선정하는 ‘World’s Most Ethical Companies’에 국내 <b>반도체</b> 업계 최초로 선정됐다. 지난해 임직원 윤리교육 이수율도 99.6%를 기록했다. 윤리제보·상담 건수 역시... ,"Thu, 10 Jul 2025 08:20:00 +0900"
2025-07-09 23:49:16,"엔비디아, 시총 4조 달러 첫 돌파…&quot;MS·애플 넘었다&quot;",https://n.news.naver.com/mnews/article/092/0002381450?sid=105,대표적인 인공지능(AI) <b>반도체</b> 기업 엔비디아가 사상 최초로 시가총액 4조 달러를 달성했다고 CNBC 등 외신들이 9일(현지시간) 보도했다. 이날 엔비디아 주가는 장중 2% 이상 상승하며 시총 4조 달러를 돌파했다. 이후... ,"Thu, 10 Jul 2025 08:19:00 +0900"
2025-07-09 23:49:16,"김해시, 물류로봇 실증지원센터 건립 본격화…산업 경쟁력 강화",https://www.newspim.com/news/view/20250710000058,"등 산업 경쟁력 강화와 외국 물류로봇의 국내시장 잠식 대응에 나선다는 방침이다. 센터 인근에는 한국로봇리퍼브센터, 스마트 센싱 유닛 실증센터, 전력<b>반도체</b> 토탈솔루션센터 등이 위치해 연계 시너지 효과도 기대된다.","Thu, 10 Jul 2025 08:19:00 +0900"
2025-07-09 23:49:16,"[더벨][thebell interview] &quot;자산아닌 사람, WM 핵심은 신뢰&quot;",https://www.thebell.co.kr/free/content/ArticleView.asp?key=202507031337407320102395,지난해 AI와 <b>반도체</b> 섹터가 급등했을 때도 고객 포트폴리오의 큰 틀은 유지됐다. 단기적인 유행에 따라 흔들리기보다 기존 전략의 흐름을 존중하는 쪽을 택했다. 다만 미국 <b>반도체</b> ETF나 AI 특화 상품은 일부 비중만... ,"Thu, 10 Jul 2025 08:18:00 +0900"
2025-07-09 23:49:16,"트럼프 미 대통령 , 브라질 50% 등 8개국에 상호관세 추가 서한",http://www.breaknews.com/1131700,앞서 전날 트럼프 대통령은 수입산 구리에 50% 관세를 부과하겠다고 발표한 가운데 이르면 오는 7월말 <b>반도체</b>·의약품에도 고율 관세를 도입할 계획이라고 밝힌 바... ,"Thu, 10 Jul 2025 08:16:00 +0900"
2025-07-09 23:49:16,"LG전자, 中 HVAC 공세 대응책...현지 맞춤 완결 전략",https://n.news.naver.com/mnews/article/031/0000947430?sid=101,최근 고효율 인버터 냉난방기와 자체 생산한 <b>반도체</b>를 적용한 스마트 HVAC 시스템을 선보이며 기술력 확보에 나섰다. 미디아(Midea)는 유럽과 북미 등 주요 시장에서 R290 냉매 기반 히트펌프 저소음 냉방기 등을 통해... ,"Thu, 10 Jul 2025 08:14:00 +0900"
2025-07-09 23:49:16,"비트코인, 사상 첫 11만2000달러 돌파",https://n.news.naver.com/mnews/article/366/0001091328?sid=101,"66% 오른 2.41달러, 솔라나는 4.16% 상승한 157.8달러를 각각 기록 중이다. 이날 비트코인 상승은 인공지능(AI) <b>반도체</b> 기업 엔비디아가 역대 최대 시가총액인 4조달러(약 5500조원)를 돌파한데 따른 것으로 풀이된다.","Thu, 10 Jul 2025 08:14:00 +0900"
2025-07-09 23:49:16,[굿모닝 증시]美증시 기술주 중심 반등…韓증시도 체질 개선중,https://n.news.naver.com/mnews/article/277/0005620358?sid=101,"국내 증시와 밀접한 MSCI 한국 증시 상장지수펀드(ETF)는 보합권이었고, 필라델피아 <b>반도체</b>지수는 0.44% 올랐다. 한지영 키움증권 연구원은 &quot;전날 한국 증시의 시총 상위 10개 종목 중 8개가 다 하락 마감했지만, 조선과... ","Thu, 10 Jul 2025 08:13:00 +0900"
2025-07-09 23:49:16,[굿모닝 마켓] 위험 선호 심리 회복…비트코인 사상 최고치 경신,https://n.news.naver.com/mnews/article/374/0000450714?sid=101,"시총 6위부터도 보면 메타는 최대 안경 제조업체인 에실로룩소티카 지분 약 3%를 인수했다는 소식이 나온 후 스마트안경 개발에 박차를 가할 것이라는 기대감에 1.68% 올랐고, 브로드컴도 <b>반도체</b>주가 강세를 보이면서 2... ","Thu, 10 Jul 2025 08:12:00 +0900"
2025-07-09 23:49:16,"비트코인, 11만2000달러 첫 돌파…사상 최고가 경신",https://n.news.naver.com/mnews/article/654/0000130697?sid=101,이날 비트코인 상승은 인공지능(AI) <b>반도체</b> 기업 엔비디아의 장중 시가총액(시총) 4조 달러(약 5500조 원) 돌파 등 미국 증시의 기술주 랠리와 흐름을 같이했다. 미국 경제 매체 CNBC는 &quot;기관 투자자들은 비트코인을... ,"Thu, 10 Jul 2025 08:11:00 +0900"
2025-07-09 23:49:16,"AI 열풍 탄 엔비디아, 시총 4조 달러 돌파…연말까지 상승 여력 있다?",https://www.tokenpost.kr/news/market/265349,"AI <b>반도체</b> 시장의 선두주자인 엔비디아(NVDA)가 사상 처음으로 시가총액 4조 달러(약 5,760조 원)를 넘어섰다. AI... AI <b>반도체</b> 수요가 글로벌 빅테크의 인프라 경쟁과 맞물리면서, 엔비디아는 그 중심에 서 있다. 경쟁사들이... ","Thu, 10 Jul 2025 08:10:00 +0900"
2025-07-09 23:49:16,[Who Is ?] 단우영 해성디에스 부회장,https://www.businesspost.co.kr/BP?command=article_view&num=402744,&lt;해성그룹&gt; △해성디에스의 사업 구조 해성디에스는 해성그룹이 2014년 삼성테크윈 <b>반도체</b> 부품사업부 지분을 인수해 설립한 기업이다. 해성디에스는 <b>반도체</b> 재료사업을 하고 있다. 구체적으로는 <b>반도체</b>를... ,"Thu, 10 Jul 2025 08:10:00 +0900"
2025-07-09 23:49:16,"[증시전망대] 코스피, 3년 10개월 만에 최고치 경신…외국인·기관 투자...",http://www.newsroad.co.kr/news/articleView.html?idxno=42268,"간밤 뉴욕증시에서 엔비디아가 시총 4조 달러를 넘어서며 필라델피아 <b>반도체</b> 지수가 강세를 보였고, 이는 <b>반도체</b>주에 긍정적인 영향을 미칠 수 있다. 또한, 비트코인 가격이 사상 최고치를 기록하면서 관련 종목의... ","Thu, 10 Jul 2025 08:10:00 +0900"
2025-07-09 23:49:16,[Who Is ?] 정수홍 에스앤에스텍 대표이사,https://www.businesspost.co.kr/BP?command=article_view&num=402745,"경북대 산업대학원에서 <b>반도체</b>공학으로 석사학위를 받았다. 한국전자기술연구소에서 직장생활을 시작해 삼성<b>반도체</b>, 한려개발, 한국듀폰, 아남<b>반도체</b> 등에서 연구원과 공장장, 부사장으로 일했다. 1995년 피케이엘... ","Thu, 10 Jul 2025 08:10:00 +0900"
2025-07-09 23:49:16,[GAM]서클 이을 美 IPO 블록버스터 ② 거대 AI 칩과 데이터 플랫폼,https://www.newspim.com/news/view/20250709000933,"AI <b>반도체</b> 칩을 생산하는 업체는 웨이퍼 전체를 하나의 칩으로 제작하는 기술로 관심을 모은다. 엔비디아(NVDA)를 포함한 기존 <b>반도체</b> 업체들은 웨이퍼를 잘라 여러 개의 작은 칩, 소위 다이로 만드는 반면... ","Thu, 10 Jul 2025 08:02:00 +0900"
2025-07-09 23:49:16,"[마켓뷰] 코스피, 상승 추세는 확인…'큰손' 외인·기관 투심 향방은",https://n.news.naver.com/mnews/article/001/0015498306?sid=101,"63%) 등 <b>반도체</b>주와 LG에너지솔루션(-0.65%), 현대차(-0.71%) 등 이차전지·자동차주는 전반적으로 힘을 쓰지... 간밤 엔비디아(1.8%)가 장 한때 시총 4조달러를 넘어서고, 필라델피아 <b>반도체</b> 지수(0.44%)가 강세를 보인 점은... ","Thu, 10 Jul 2025 08:01:00 +0900"
2025-07-09 23:49:16,[주요 신문 사설](10일 조간),https://n.news.naver.com/mnews/article/001/0015498300?sid=110,"부른다 <b>반도체</b> 위협 직면, 골든타임 5년 남았다는 경고 ▲ 한국경제 = 윤희숙 혁신위원장 '경제는 국민의힘' 입증에 사활 걸어야 개인회생 1년 졸업·전세사기 일괄 구제 … 무너지는 '자기 책임' 원칙 자사주 소각 의무화는... ","Thu, 10 Jul 2025 08:00:00 +0900"
2025-07-09 23:49:16,[전국 주요 신문 톱뉴스](10일 조간),https://n.news.naver.com/mnews/article/001/0015498301?sid=102,"K<b>반도체</b> &quot;관세, 올 것이 왔다&quot; 초긴장 ▲ 대한경제 = 건설현장 118년만의 폭염… '셧다운' 위기... 브릿지경제 = &quot;K<b>반도체</b>, AI 데이터센터發 큰 기회 온다&quot; ▲ 서울경제 = 中企 R&amp;D 8조 썼는데 … 고용 '역주행' ▲ 아시아타임즈... ","Thu, 10 Jul 2025 08:00:00 +0900"
2025-07-09 23:49:16,"바람 불자 돈 들어온다…해상풍력 '제로'→세계 5위 된 대만, 비결은",https://n.news.naver.com/mnews/article/008/0005219520?sid=101,"트럼프가 막아도 구글이 산다…TSMC 위해 해상풍력 늘리는 대만 &quot;TSMC와 같은 <b>반도체</b> 기업에게 녹색 에너지... 구글 외에 미디어텍, UMC, 원동통신, 타이완모바일 등 대만 <b>반도체</b>, 통신사들도 같은 발전단지의 전력을 사는... ","Thu, 10 Jul 2025 08:00:00 +0900"
2025-07-09 23:49:16,&quot;인문학 외면? 우리도 배우고 싶어요&quot; 시민강좌 줄줄이 마감,https://n.news.naver.com/mnews/article/469/0000875142?sid=102,"진흥원은 지지부지(知之不知) 조선 사람(고려대), 인문학 명저 읽기(이화여대), 색으로 보는 세상(홍익대), 디지털 네이티브와 함께하는 슬기로운 부모생활(중앙대), <b>반도체</b> 뉴스이해하기(연세대), 예술인문학(성균관대)... ","Thu, 10 Jul 2025 08:00:00 +0900"
2025-07-09 23:49:16,美 ‘25% 관세 부과’ 예고…농업계 ‘불똥 튈라’,https://n.news.naver.com/mnews/article/662/0000072718?sid=102,트럼프 대통령은 8일(현지시각) 백악관 내각회의에서 “의약품·<b>반도체</b> 등 다양한 분야에 대해 (관세 부과를) 조만간 발표할 것”이라며 “한국은 (주한미군 주둔 비용을) 너무 적게 지불하고 있다”고 언급했다. 서진교... ,"Thu, 10 Jul 2025 08:00:00 +0900"
2025-07-09 23:49:16,"“은행 기업대출 비중 높여야” 당국, 예대율 조정 검토…'자사주 소각...",https://n.news.naver.com/mnews/article/011/0004507305?sid=101,"구리는 전기차, 데이터센터, <b>반도체</b> 등 핵심 산업에 필수적인 원자재로, 관세 부과는 글로벌 공급망 변화와 가격 상승을 의미합니다. 원자재 관련 펀드나 ETF를 통해 간접 투자할 수 있으며, 전체 포트폴리오의 5-10... ","Thu, 10 Jul 2025 07:59:00 +0900"
