DateTime,Title,Link,Description,PubDate
2026-01-26 19:28:50,"돌아온 천스닥, 외인·기관 쌍끌이… 정책 뒷심에 3000 갈까",https://n.news.naver.com/mnews/article/008/0005309708?sid=101,"허재환 유진투자증권 연구원은 &quot;코스피 5000에 다가갈수록 <b>반도체</b> 이외 업종과 코스닥 시장에 대한 관심이 높아질 것&quot;이라며 &quot;최근 한 달 동안 <b>반도체</b> 이외에도 상사자본재, 조선, 증권, 유틸리티업종의 올해... ","Tue, 27 Jan 2026 04:18:00 +0900"
2026-01-26 19:28:50,"&quot;피지컬AI로 제조원가 80% 절감&quot; 과기부, 사전검증 성과 공유",https://n.news.naver.com/mnews/article/008/0005309709?sid=105,"배경훈 부총리 겸 과기정통부 장관은 이날 행사에 참석해 &quot;우리나라가 보유한 제조현장, <b>반도체</b>·모빌리티·로봇 등 피지컬AI 최적화 산업기반을 현장에서 실증해 독자적인 기술을 확보해야 한다&quot;며 &quot;현장실증으로... ","Tue, 27 Jan 2026 04:18:00 +0900"
2026-01-26 19:28:50,엔비디아 의존도 줄이기 나선 MS…첫 상용화 AI칩 '마이아200' 공개,https://n.news.naver.com/mnews/article/374/0000488750?sid=104,자체 <b>반도체</b> 중 가장 성능이 뛰어나다&quot;고 강조했습니다. 사티아 나델라 최고경영자(CEO)는 &quot;업계 최고의 추론 효율성을 위해 설계된 이 제품은 현존 시스템 대비 달러당 성능이 30% 높다&quot;고 설명했습니다. 이 칩은... ,"Tue, 27 Jan 2026 04:18:00 +0900"
2026-01-26 19:28:50,은 가격 10% 넘게 폭등 &quot;전인미답의 영역으로 진입&quot;,https://n.news.naver.com/mnews/article/014/0005468563?sid=101,"<b>반도체</b> 등 산업 핵심 기초소재 ‘가난한 자들의 금’이라는 별명이 있는 은과 금은 성격이 조금 다르다. 금은 산업 기초소재보다는 귀금속에 가깝지만 은의 성격은 산업 핵심 기초소재 역할이 크다. <b>반도체</b>, 배터리... ","Tue, 27 Jan 2026 04:07:00 +0900"
2026-01-26 19:28:50,최태원 &quot;AI칩 임팩트는 서곡일 뿐&quot; 시총 2000조 향하는 기술리더십,https://n.news.naver.com/mnews/article/008/0005309697?sid=101,&quot;지금까지 AI(인공지능)<b>반도체</b>가 만든 임팩트는 서곡에 불과합니다.&quot; 최태원 SK그룹 회장이 본 시가총액 560조원의 SK하이닉스는 단순한 '메모리<b>반도체</b> 제조사'의 성공이 아니다. AI라는 거대한 흐름의 길목을 지키고... ,"Tue, 27 Jan 2026 04:07:00 +0900"
2026-01-26 19:28:50,"삼성, 갤럭시A57에 중국 CSOT 패널 첫 도입...메모리값 폭등에 원가 절감...",https://www.g-enews.com/view.php?ud=202601261745409752fbbec65dfb_1,디지타임스는 26일(현지시각) 보도에서 메모리 <b>반도체</b> 가격 상승이 전자기기 제조업체들을 압박하고... 회사는 소재 대체와 포토마스크(<b>반도체</b> 회로 제작용 원판) 사용 축소 등으로 원가를 낮출 계획이다.... ,"Tue, 27 Jan 2026 04:06:00 +0900"
2026-01-26 19:28:50,[공뉴스 브리핑] RISE 한계 지적…&quot;초광역 거버넌스·재정 체계 구축 시...,https://www.bzeronews.com/news/articleView.html?idxno=809709,8% 증가…전국 평균보다 1%포인트 높아 <b>반도체</b> 수요가 견인…&quot;품목 다변화 중요&quot; –&quot;서울 쓰레기 안 받겠다&quot;…충청권 반입 잇달아 중단 [한국경제] 충북 이어 충남도 제동…주민 반발 확산 서울시 '쓰레기 감량' 캠페인... ,"Tue, 27 Jan 2026 04:02:00 +0900"
2026-01-26 19:28:50,[출근길 포인트] '원전 건설 불가피론' 선회한 이재명 정부...&quot;대형 원전...,https://www.pointdaily.co.kr/news/articleView.html?idxno=290203,"<b>반도체</b> 공장과 AI 데이터센터는 '전기 먹는 하마'로 불릴 만큼 막대한 전력을 소비한다. 특히 데이터센터 한... ◇ 세미파이브-사피엔<b>반도체</b>, 차세대 마이크로 디스플레이 핵심 'CMOS 백플레인' 기술 MOU 글로벌 AI 맞춤형... ","Tue, 27 Jan 2026 04:00:00 +0900"
2026-01-26 19:28:50,"[황제주를 찾아서(下)] AI 미래 부상한 로봇주, 현대차 로봇 대장주 우뚝",https://www.pointdaily.co.kr/news/articleView.html?idxno=290199,글로벌 인공지능(AI) 산업 발달 기대감이 <b>반도체</b>주와 연관 산업 기업들의 가치를 키우며 국내... AI 산업의 수혜주로 지목 됐던 <b>반도체</b>주에 이어 로봇 산업이 새로운 주요 AI 관련주로 부상함에 따라 로봇 자회사를... ,"Tue, 27 Jan 2026 04:00:00 +0900"
2026-01-26 19:28:50,"미 상무부, 희토류 업체 USA 레어어스에 지분 투자",https://n.news.naver.com/mnews/article/014/0005468561?sid=101,"희토류는 방산, 로봇, 전기차, <b>반도체</b> 등 전략 산업에 필수적인 영구자석의 핵심 원재료다. 트럼프... USAR이 생산한 희토류나 자석을 구매할 <b>반도체</b> 제조사(엔드 유저), 또는 그 중간 단계 업체로부터 희토류나... ","Tue, 27 Jan 2026 03:35:00 +0900"
2026-01-26 19:28:50,"MS, 첫 상용화 AI칩 '마이아200' 공개…엔비디아 의존 탈피 시동",https://www.tfmedia.co.kr/news/article.html?no=200780,자체 <b>반도체</b> 중 가장 성능이 뛰어나다&quot;고 강조했다. 사티아 나델라 최고경영자(CEO)는 &quot;업계 최고의 추론 효율성을 위해 설계된 이 제품은 현존 시스템 대비 달러당 성능이 30% 높다&quot;고 설명했다. 이 칩은 오픈AI의... ,"Tue, 27 Jan 2026 03:32:00 +0900"
2026-01-26 19:28:50,AI 가로막는 전력 부족… &quot;에너지 효율이 <b>반도체</b> 생존 결정&quot;,https://www.g-enews.com/view.php?ud=20260126173511298fbbec65dfb_1,"AI 가로막는 전력 부족… &quot;에너지 효율이 <b>반도체</b> 생존 결정“ 전 세계에서 AI 학습과 추론을 위한... 시장 조사기관들은 2026년 글로벌 <b>반도체</b> 시장이 사상 처음으로 1조 달러(약 1,350조 원) 규모에 이를 것으로 보고 있지만... ","Tue, 27 Jan 2026 03:26:00 +0900"
2026-01-26 19:28:50,"MS, 첫 상용화 AI칩 '마이아200' 공개…엔비디아 의존 탈피 시동",https://n.news.naver.com/mnews/article/001/0015867952?sid=104,자체 <b>반도체</b> 중 가장 성능이 뛰어나다&quot;고 강조했다. 사티아 나델라 최고경영자(CEO)는 &quot;업계 최고의 추론 효율성을 위해 설계된 이 제품은 현존 시스템 대비 달러당 성능이 30% 높다&quot;고 설명했다. 이 칩은 오픈AI의... ,"Tue, 27 Jan 2026 03:22:00 +0900"
2026-01-26 19:28:50,2026년 ‘로봇 대공습’ 시작…테슬라 옵티머스 1분기 수만 대 양산,https://www.g-enews.com/view.php?ud=202601261722264049fbbec65dfb_1,"K-<b>반도체</b>·배터리, 로봇을 ‘움직이는 데이터센터’로 기대 휴머노이드 로봇 1대에는 스마트폰이나 PC보다 훨씬 많은 5,000개 이상의 <b>반도체</b>가 탑재된다. 모건스탠리는 이를 &quot;움직이는 데이터센터&quot;라고 정의하며... ","Tue, 27 Jan 2026 03:06:00 +0900"
2026-01-26 19:28:50,"백현종 경기도의회 대표의원, '용인 <b>반도체</b> 프로젝트 지키기' 챌린지 동...",https://n.news.naver.com/mnews/article/030/0003393408?sid=105,경기도의회 국민의힘은 백현종 대표의원(구리1)이 최근 '용인 <b>반도체</b> 프로젝트 지키기 챌린지'에 참여했다고 27일 밝혔다. 이번 참여는 허원 도의회 건설교통위원장(이천2)의 지목으로 이뤄졌다. '용인 <b>반도체</b> 프로젝트... ,"Tue, 27 Jan 2026 03:03:00 +0900"
2026-01-26 19:28:50,AI 데이터센터가 메모리 싹쓸이…가격 상승 2027년까지 간다,https://n.news.naver.com/mnews/article/014/0005468560?sid=101,메모리 <b>반도체</b> 가격 상승과 공급 부족이 2027년까지 이어질 수 있다는 전망이 나왔다. AI 데이터센터 투자... 사신 가지(Sassine Ghazi) 시놉시스(Synopsys) 최고경영자(CEO)는 최근 CNBC와 인터뷰에서 메모리 중심의 <b>반도체</b>... ,"Tue, 27 Jan 2026 03:00:00 +0900"
2026-01-26 19:28:50,"엔비디아, 애플 제치고 올해 TSMC 최대 고객 부상 전망",https://n.news.naver.com/mnews/article/293/0000078434?sid=105,26일(이하 현지시간) 경제전문 매체 CNBC에 따르면 기술 컨설팅업체 크리에이티브스트래티지스는 올해 TSMC 파운드리(<b>반도체</b> 위탁생산) 전체 매출의 약 22%에 해당되는 330억달러(약 47조5000억원)가 엔비디아에서... ,"Tue, 27 Jan 2026 02:43:00 +0900"
2026-01-26 19:28:50,"광주전남 통합, &quot;지역 산업 확장과 양질의 일자리 창출 기폭제&quot;",https://www.pointdaily.co.kr/news/articleView.html?idxno=290272,"이날 행사에는 강기정 시장을 포함해 인공지능(AI), <b>반도체</b>, 에너지 등 미래 전략 산업 관계자와 농민단체 등 100여 명이 머리를 맞댔다. 참석한 경제단체와 산업계 관계자들은 광역경제권 형성에 따른 투자 유치 여건 개선에... ","Tue, 27 Jan 2026 02:40:00 +0900"
2026-01-26 19:28:50,"젠슨 황 “클로드는 놀라운 도약”…엔비디아, 앤트로픽 AI 기술 공개 지...",https://www.g-enews.com/view.php?ud=2026012622250980109a1f309431_1,"그는 AI 생태계를 에너지, <b>반도체</b>, 클라우드 인프라, AI 모델, 애플리케이션 등 5단계 구조로 설명하며 “이... 특히 <b>반도체</b>와 AI 인프라를 동시에 주도하는 엔비디아 수장이 특정 AI 모델을 공개적으로 높이 평가했다는... ","Tue, 27 Jan 2026 02:00:00 +0900"
2026-01-26 19:28:50,"김보라 안성시장, 김윤덕 국토부 장관에 JTX 신속 추진 강력 촉구...공동...",https://www.ekn.kr/web/view.php?key=20260126024182615,"중부권 광역급행철도는 서울 잠실에서 출발해 안성과 청주공항 등을 연결하는 사업으로 안성의 경우, <b>반도체</b> 등 산업 경쟁력 증진과 수도권·충청권 간 물류 강화, 일자리 창출, 인구 증가, 이동 편의성 증진, 정주여건... ","Tue, 27 Jan 2026 01:40:00 +0900"
2026-01-26 19:28:50,이광재·이동훈 “연기금 투자로 코스닥 3000 만들자”,http://www.newstomato.com/ReadNews.aspx?no=1289169&inflow=N,"셋째, AI와 HBM(고대역폭메모리)가 이끄는 업사이클에서 소부장(소재·부품·장비) 기업 실적은 6~12개월 후행할 수밖에 없고, 마지막으로 <b>반도체</b>나 AI, 그리고 조선, 방산 같은 전략산업 공급망이 재편되면서 글로벌 자금이... ","Tue, 27 Jan 2026 01:34:00 +0900"
2026-01-26 19:28:50,"[AI의 종목 이야기] MSFT, 차세대 AI 칩 공개하며 엔비디아에 도전장",https://www.newspim.com/news/view/20260127000011,"엔비디아가 이달 초 공개한 차세대 주력 칩 '베라 루빈(Vera Rubin)'과 마찬가지로, 마이크로소프트의 '마이아 200'은 대만 <b>반도체</b> 제조업체(TSMC)가 3나노미터 공정 기술을 활용해 생산한다. 이 칩은 고대역폭 메모리... ","Tue, 27 Jan 2026 01:27:00 +0900"
2026-01-26 19:28:50,[사설] ‘실용’ 택한 신규 원전 건설… 넘어야 할 산 많다,https://n.news.naver.com/mnews/article/005/0001828528?sid=110,"AI 데이터센터 확대, 용인 <b>반도체</b> 클러스터 조성 등으로 전력 수요는 기하급수적으로 늘어날 전망이다. 태양광, 풍력 등 재생에너지만으로는 대응하기 어렵다. 그런데도 우여곡절이 많았다. 김성환 기후에너지부 장관은... ","Tue, 27 Jan 2026 01:21:00 +0900"
2026-01-26 19:28:50,"[사설] 국내 주식 비중 늘린 국민연금, 노후자금 원칙 지켜야",https://n.news.naver.com/mnews/article/005/0001828526?sid=110,"한국 증시는 <b>반도체</b> 등 특정 산업 의존도가 높고 변동성도 큰 편이어서, 장기적으로는 위험 관리 측면에서 부담이 커질 수 있다. 단순히 증시를 떠받치거나 정책 효과를 노린다는 인상으로 국내 주식 비중을 늘리는 것은... ","Tue, 27 Jan 2026 01:11:00 +0900"
2026-01-26 19:28:50,“만년 2위는 어떻게 1등이 됐나”… SK하이닉스의 HBM 성공기 출간,https://n.news.naver.com/mnews/article/005/0001828525?sid=101,"“지금까지의 인공지능(AI) <b>반도체</b> 임팩트는 서곡에 불과합니다.” SK하이닉스가 고대역폭메모리(HBM)를 선봉으로 한 메모리 <b>반도체</b> 분야에서 거침없이 질주할 수 있었던 배경과 20년 도전의 역사, 최태원(사진) SK그룹... ","Tue, 27 Jan 2026 01:10:00 +0900"
2026-01-26 19:28:50,"기업이 자금 쏟는 美, 국가가 끌고가는 中… AI 전략도 ‘각자의 길’",https://n.news.naver.com/mnews/article/023/0003955389?sid=105,미국의 <b>반도체</b> 제재라는 제약 속에서 국가 차원에서 기업을 뒷받침하며 가성비와 현장 적용이라는 철저한... 실용형 AI 생태계 구축을 위해 AI와 <b>반도체</b> 분야에 1000억위안(약 21조원) 규모를 투자하는 국가 주도 펀드를... ,"Tue, 27 Jan 2026 00:58:00 +0900"
2026-01-26 19:28:50,증시서도 맞붙는 美·中… AI 기술전쟁이 자본전쟁으로,https://n.news.naver.com/mnews/article/023/0003955391?sid=105,SCMP에 따르면 알리바바와 바이두는 각각 <b>반도체</b> 사업부를 떼어내 홍콩 증시에 상장한다는 계획이다.... AI <b>반도체</b> 빅리그가 형성되며 투자 매력도가 높아질 것이라는 분석이 나온다. ◇미·중 자본 시장 경쟁 본격화... ,"Tue, 27 Jan 2026 00:58:00 +0900"
2026-01-26 19:28:50,“소버린 AI에 건다” 세계 각국이 경쟁,https://n.news.naver.com/mnews/article/023/0003955393?sid=105,"세계 최대 <b>반도체</b> 장비 업체인 네덜란드 ASML이 지난해 미스트랄의 최대 주주로 올라선 것도, 유럽 차원의 AI 생태계 구축 전략에 힘을 싣는 상징적 행보로 평가된다. 중동은 석유에서 나오는 압도적인 자금력으로... ","Tue, 27 Jan 2026 00:58:00 +0900"
2026-01-26 19:28:50,삼성-LG ‘노트북 대전’… 더 스마트해졌지만 가격 크게 올라,https://n.news.naver.com/mnews/article/005/0001828515?sid=101,다만 메모리 <b>반도체</b>와 중앙처리장치(CPU) 가격 급등 여파로 소비자 부담은 대폭 늘었다. 삼성전자는... 업계 관계자는 “최근 메모리 <b>반도체</b>에 CPU 가격이 크게 오르면서 이를 사용하는 노트북 가격도 인상된 것”... ,"Tue, 27 Jan 2026 00:42:00 +0900"
2026-01-26 19:28:50,[돋을새김] 문제는 성장하기 싫은 환경,https://n.news.naver.com/mnews/article/005/0001828513?sid=110,"전 세계적인 AI 붐에 올라탄 <b>반도체</b>와 조선·방산 등 수출 대기업들의 선전이 주가를 견인했지만, 이 기운이... 점에서 ‘<b>반도체</b> 착시’라는 말도 나온다. 전교 1·2등의 압도적 성적이 평균점수를 끌어올렸지만, 대다수... ","Tue, 27 Jan 2026 00:39:00 +0900"
2026-01-26 19:28:50,달리는 코스닥… 제약·바이오가 이끌고 정책이 밀고,https://n.news.naver.com/mnews/article/023/0003955338?sid=101,"코스피 시장에 퍼진 삼성전자·SK하이닉스 등 인공지능(AI) <b>반도체</b> 열풍이 코스닥 시장으로 옮겨붙은 점도 호재다. 이오테크닉스, 티에프이 등 상대적으로 저평가됐던 코스닥 내 HBM(고대역폭 메모리) 장비·부품 기업... ","Tue, 27 Jan 2026 00:37:00 +0900"
2026-01-26 19:28:50,칩플레이션에 ‘램테크족’까지 등장,https://n.news.naver.com/mnews/article/023/0003955333?sid=101,고환율과 <b>반도체</b> 가격 급등이 맞물리면서 이른바 ‘칩플레이션(chipflation)’이 일상 깊숙이 파고들고 있다. 일부에선 메모리 <b>반도체</b>를 재테크 수단으로 보는 ‘램테크(램+재테크)’ 현상까지 나타나고 있다.... ,"Tue, 27 Jan 2026 00:35:00 +0900"
2026-01-26 19:28:50,"AI가 <b>반도체</b> 기판 불량 검사, 132개도 30초면 끝",https://n.news.naver.com/mnews/article/023/0003955329?sid=101,태블릿PC 같은 휴대용 전자기기에 들어갈 <b>반도체</b> 기판(Package Substrate) 스트립(strip)에 대한 불량 검사가 한창이었다. 스트립이란 엄지손톱보다 작은 <b>반도체</b> 기판 여러 개가 판 초콜릿처럼 붙어 있는 형태다. 작은... ,"Tue, 27 Jan 2026 00:34:00 +0900"
2026-01-26 19:28:50,삼성전자에 노조원 과반 ‘단일 노조’ 탄생 초읽기,https://n.news.naver.com/mnews/article/023/0003955331?sid=105,초기업 노조 조합원들은 삼성전자의 사상 최대 <b>반도체</b> 실적에 대한 인센티브가 적다는 인식을 갖고 있다. 경쟁사인 SK하이닉스가 영업이익의 10%를 성과급 재원으로 삼아 1인당 평균 1억원 이상의 인센티브를 지급하는... ,"Tue, 27 Jan 2026 00:34:00 +0900"
2026-01-26 19:28:50,한발 늦었던 삼성 HBM 이번엔 치고 나간다,https://n.news.naver.com/mnews/article/020/0003692520?sid=101,"(AI) <b>반도체</b>에 탑재되는 고대역폭메모리(HBM) 6세대 HBM4 양산에 돌입한다. HBM 4, 5세대에서 경쟁사에 밀려 고전했지만 6세대에서 ‘초격차’ 승부수를 던지며 판 뒤집기에 나섰다는 평가가 나온다. 26일 <b>반도체</b>... ","Tue, 27 Jan 2026 00:31:00 +0900"
2026-01-26 19:28:50,SK하이닉스 성공담 책으로 출간… 최태원 “지금까진 서곡에 불과”,https://n.news.naver.com/mnews/article/020/0003692507?sid=101,슈퍼 모멘텀은 하이닉스<b>반도체</b>가 SK그룹에 편입된 뒤 고대역폭메모리(HBM) 분야에서 주도권을 확보하기까지... 여기서 최 회장은 “지금까지 AI <b>반도체</b>가 만든 임팩트는 서곡에 불과하다”고 말했다. 저자들은... ,"Tue, 27 Jan 2026 00:31:00 +0900"
2026-01-26 19:28:50,엔비디아의 ‘고객 락인’…코어위브에 20억달러 투자,https://n.news.naver.com/mnews/article/014/0005468556?sid=101,AI <b>반도체</b> 시장을 쥔 엔비디아가 이제는 칩 판매를 넘어 고객사의 데이터센터 확장까지 직접 밀어주는 구조다. 엔비디아는 코어위브 주식 20억달러어치를 주당 87.20달러에 매입했다고 밝혔다. 젠슨 황 엔비디아... ,"Tue, 27 Jan 2026 00:28:00 +0900"
2026-01-26 19:28:50,"시스템<b>반도체</b> 관련주, '껑충껑충' 지니틱스·디아이·리노공업·고영·하...",http://www.finomy.com/news/articleView.html?idxno=248436,"현대경제신문 홍미경 기자 | 시스템<b>반도체</b> 관련주 관련주들이 전 거래일 대비 3.53% 상승으로 장을 마감했다. 26일 한국거래소에 따르면 지니틱스, 디아이, 리노공업, 고영, 하나마이크론, 에스앤에스텍, SFA<b>반도체</b>... ","Tue, 27 Jan 2026 00:20:00 +0900"
2026-01-26 19:28:50,"[사설] 탈원전 폐기 다행, 낡은 운동권 이념이 미래 발목 안 돼",https://n.news.naver.com/mnews/article/023/0003955324?sid=110,AI 데이터센터와 <b>반도체</b> 클러스터가 사용할 전력 폭증을 감안하면 이번 2기 건설은 첫걸음일 뿐이다. 더 큰 문제는 시간이 없다는 사실이다. 원전 1기를 짓는 데 평균 14년이 걸린다. 지금 삽을 떠도 전기 생산은 2040년은... ,"Tue, 27 Jan 2026 00:20:00 +0900"
2026-01-26 19:28:50,강남·용산·서초 땅값 최대폭 상승… 수도권 3% 이상 올라,https://n.news.naver.com/mnews/article/005/0001828497?sid=101,"이 곳은 <b>반도체</b> 클러스터 호재와 신규택지 조성 소식에 연간 지가 상승률이 2023년(6.66%)과 2024년(5.87%) 모두 5%를 상회했지만, 지난해에는 서울 재건축 호재에 순위가 밀려났다. 한편 지난해 부속토지를 제외한... ","Tue, 27 Jan 2026 00:17:00 +0900"
2026-01-26 19:28:50,"엔비디아, 코어위브에 2조 8,800억 원 투자…AI 클라우드 동맹 본격화",https://www.tokenpost.kr/news/ai/326540,"추천 과정: 7단계 The Macro Master AI, <b>반도체</b>, 디지털 자산 시장의 구조적 장기 변화 속에서 투자자는 '나무'가 아니라 '숲'을 볼 수 있어야 합니다. 글로벌 유동성과 비트코인 사이클 분석, 실전 Case Study까지... ","Tue, 27 Jan 2026 00:16:00 +0900"
2026-01-26 19:28:50,"의료기기 관련주, '봄날의 햇살' 리브스메드·엘앤씨바이오·리가켐바이...",http://www.finomy.com/news/articleView.html?idxno=248434,이번 협약을 통해 양사는 자율주행로봇(AMR) 기반 모바일 매니퓰레이션 로봇과 <b>반도체</b> 이송로봇 분야에서 기술 협력을 강화할 계획이다. 티로보틱스는 이번 제휴를 통해 유아이봇이 보유한 중국 내 <b>반도체</b> 기업... ,"Tue, 27 Jan 2026 00:16:00 +0900"
2026-01-26 19:28:50,"2차전지 소재·부품 관련주, '덩실덩실' 쎄노텍·에코프로·에코프로비...",http://www.finomy.com/news/articleView.html?idxno=248432,"아이티엠<b>반도체</b>, 이닉스, 에스코넥, 글로벌에스엠, 조광페인트, 율촌화학, 황금에스티, 코이즈, 켐트로스... 전방 <b>반도체</b> 산업의 회복으로 글리콜에테르 수요 증가가 기대되는 가운데 고부가제품 비중 확대... ","Tue, 27 Jan 2026 00:10:00 +0900"
2026-01-26 19:28:50,"음성군, 올해 첫 공감 토크콘서트 시동…감곡면 소통행보 시작",https://www.webeconomy.co.kr/news/articleView.html?idxno=2058678,"상우산단은 시스템<b>반도체</b> 산업 육성을 목표로 DB하이텍 등 기업 유치가 진행된다. 공동주택과 도시개발사업, 국민체육센터와 파크골프장 조성, 감곡119안전센터 이전, 도시침수 대응사업, 교통안전 강화 등도 추진된다. 조... ","Tue, 27 Jan 2026 00:10:00 +0900"
2026-01-26 19:28:50,"삼성전자·SK하이닉스 실적발표일 D-2, 공개시간과 예상 성적표",https://www.gukjenews.com/news/articleView.html?idxno=3490012,<b>반도체</b>(DS) 부문에서만 16조 원 안팎의 이익을 거둔 것으로 추정된다. SK하이닉스 역시 HBM 판매 호조와 고용량 서버용 D램 수요에 힘입어 사상 최대 실적이 예상된다. SK하이닉스의 작년 4분기 실적 컨센서스(증권사... ,"Tue, 27 Jan 2026 00:10:00 +0900"
2026-01-26 19:28:50,"로봇·산업용·협동로봇 관련주, '싱글벙글' 와이투솔루션·에스피지·아...",http://www.finomy.com/news/articleView.html?idxno=248433,"기업으로, <b>반도체</b>·디스플레이·스마트팩토리 등 다양한 산업 분야에 제품을 공급하고 있다. 반기보고서에 따르면 2025년 2분기 매출은 로봇모션제어기 1798억원, 에너지제어장치 1188억원 수준을 기록했다. 특히 <b>반도체</b>... ","Tue, 27 Jan 2026 00:10:00 +0900"
2026-01-26 19:28:50,4년만에 '천스닥'에 최고치까지…올해 첫 '사이트카',https://n.news.naver.com/mnews/article/055/0001327640?sid=101,<b>반도체</b>와 자동차 등 코스피 대형주에 쏠렸던 관심이 바이오와 2차전지 등 그동안 소외됐던 코스닥 중소형... 코스피가 <b>반도체</b> 등의 견고한 실적을 바탕으로 오른 만큼 코스닥 역시 기대감뿐 아니라 실제 실적이 추가... ,"Tue, 27 Jan 2026 00:09:00 +0900"
2026-01-26 19:28:50,원전 건설 재점화'불씨' 여전한 삼척,https://n.news.naver.com/mnews/article/654/0000163537?sid=102,그간 신중론을 보이며 공론화 과정을 거쳐 온 정부가 환경단체 등의 비판이 예상되는 상황에서도 신규 건설로 선회한 것은 데이터센터·<b>반도체</b> 공장 등 AI 산업 및 전기차 등에 필요한 막대한 전력 수요를 고려한 것으로... ,"Tue, 27 Jan 2026 00:09:00 +0900"
2026-01-26 19:28:50,"원주시, ‘EUV 방사광가속기’ 중심 첨단산업 생태계 구축 시동",https://n.news.naver.com/mnews/article/087/0001170160?sid=102,"특히 원주미래산업진흥원이 컨트롤타워 역할을 맡아 <b>반도체</b>·인공지능(AI)·바이오 산업의 전략기획과 국비 컨소시엄 구성을 주도하게 된다. 시는 이번 협약을 토대로 <b>반도체</b>, 바이오, 소재 등 신산업 분야의 핵심... ","Tue, 27 Jan 2026 00:08:00 +0900"
2026-01-26 19:28:50,[취재수첩] 점유율 50% 붕괴 직전에 선 국산 전기차,https://n.news.naver.com/mnews/article/015/0005242428?sid=110,"철강, 배터리, <b>반도체</b> 등 3만 개에 달하는 부품이 들어가는 만큼 자동차 공장이 문을 닫으면 그 파급 효과는 한반도 전체로 퍼져나간다. 미국과 EU가 자국에서 고용을 창출하고 투자를 늘리는 기업을 보호하기 위해 팔을... ","Tue, 27 Jan 2026 00:07:00 +0900"
