DateTime,Title,Link,Description,PubDate
2025-03-05 22:47:57,[시간외 특징주] 디케이락 주가 훨훨...고품질 피팅 및 밸브 제품 수요...,https://www.pinpointnews.co.kr/news/articleView.html?idxno=325962,"47개국 117개의 대리점을 통해 글로벌 시장을 적극 공략하고 있다. 디케이락은 석유·천연가스 산업 외에도 조선, 해양플랜트, 원자력발전, <b>반도체</b> 등 다양한 산업 분야에 고품질 피팅 및 밸브 제품을 공급하고 있다.","Thu, 06 Mar 2025 07:46:00 +0900"
2025-03-05 22:47:57,"'<b>반도체</b> 스토리지' 엠디바이스, 코스닥 데뷔[오늘 상장]",https://n.news.naver.com/mnews/article/018/0005956476?sid=101,<b>반도체</b> 스토리지 전문기업 엠디바이스가 오늘(6일)코스닥 시장에 상장한다. 조호경 엠디바이스 대표이사. 엠디바이스는 지난달 24~25일 진행한 일반청약에서 1696.19대 1의 경쟁률을 기록했고 증거금으로 약... ,"Thu, 06 Mar 2025 07:45:00 +0900"
2025-03-05 22:47:57,"한겨레 &quot;尹, 모든 게 북한 공작? 히틀러 선동 교본 떠올라&quot;",https://n.news.naver.com/mnews/article/006/0000128855?sid=102,조선·<b>반도체</b>·에너지 분야에서도 원전 동맹과 같은 상생 모델을 만들 수 있다면 트럼프 파고를 헤쳐가는 돌파구가 될 수 있다&quot;고 했다. 한국 정치의 불안정성은 변수다. 동아일보는 사설 &lt;트럼프 &quot;韓 안보 돕는데 관세는 4배... ,"Thu, 06 Mar 2025 07:42:00 +0900"
2025-03-05 22:47:57,"`<b>반도체</b>법 수혜` 美 의원들, 트럼프 법 폐기에 반발",https://n.news.naver.com/mnews/article/029/0002939323?sid=104,미국에 <b>반도체</b> 공장을 짓는 기업들에 보조금을 주는 <b>반도체</b>법을 도널드 트럼프 대통령이 폐기하겠다고 하자 해당 지역구를 가진 의원들이 반발하고 나섰다. 블룸버그통신의 5일(현지시간) 보도에 따르면 상원의 척 슈머... ,"Thu, 06 Mar 2025 07:42:00 +0900"
2025-03-05 22:47:57,"트럼프발 무역 장벽 넘는다…경기도, 10일 미국 통상환경조사단 파견",https://www.kpinews.kr/newsView/1065566109703578,"경기도는 자동차 부품 뿐만 아니라 <b>반도체</b> 산업 분야 등 대미 수출 규모가 큰 주요 업종에 대한 통상환경조사단 파견도 추가 검토하는 한편, 미국 관세 동향 등을 예의 주시하며 다각적 통상·수출 전략을 지속적으로... ","Thu, 06 Mar 2025 07:40:00 +0900"
2025-03-05 22:47:57,또 다른 황유미를 원하는가,http://www.labortoday.co.kr/news/articleView.html?idxno=226597,그로부터 10년 후인 2007년 삼성은 휴대전화와 <b>반도체</b>를 비롯해 첨단기술로 초국적 기업이 됐지만 황상기씨는 딸을 잃었다. 황씨의 딸 유미씨는 삼성전자 기흥공장의 <b>반도체</b>라인에서 일하던 생산직 노동자였다. 2003년 딸이... ,"Thu, 06 Mar 2025 07:36:00 +0900"
2025-03-05 22:47:57,트럼프 &quot;한국 관세 4배 높다…알래스카 가스관 투자&quot;,https://n.news.naver.com/mnews/article/448/0000511983?sid=101,우리가 한국에 군사적으로나 여러 방면에서 엄청난 도움을 주고 있음에도 불구하고요.&quot; 우리 기업인 삼성전자와 SK하이닉스 등 <b>반도체</b> 시설 투자에 보조금을 지급하는 '<b>반도체</b>법'도 폐지하겠다고 했습니다. 트럼프는 또... ,"Thu, 06 Mar 2025 07:34:00 +0900"
2025-03-05 22:47:57,"<b>반도체</b> 연구, 中 논문 美 두 배 넘어...&quot;양과 질 모두 선도&quot;",http://www.g-enews.com/ko-kr/news/article/news_all/2025030520315522570c8c1c064d_1/article.html,중국 학자들이 <b>반도체</b> 연구 논문 발표에서 양적·질적으로 미국을 크게 앞서고 있다는 연구 결과가 발표됐다. 미국의 제재에도 불구하고 중국이 <b>반도체</b> 기술 분야의 주도권을 잡아가고 있다는 신호로 해석된다고 5일... ,"Thu, 06 Mar 2025 07:34:00 +0900"
2025-03-05 22:47:57,"<b>반도체</b>를 '야구'에 빗댄 K-칩 수장…&quot;팀 코리아, 美·日 약점 찾아 혁신...",https://n.news.naver.com/mnews/article/011/0004457843?sid=101,송재혁 삼성전자(005930) <b>반도체</b>(DS) 부문 최고기술책임자(CTO)가 한국<b>반도체</b>산업협회의 새로운 수장으로 선출됐다. 송 사장은 국내 <b>반도체</b> 생태계의 끈끈한 협력이 있다면 미국·중국·일본 등 <b>반도체</b> 강국들의 약점을... ,"Thu, 06 Mar 2025 07:34:00 +0900"
2025-03-05 22:47:57,"뉴욕증시, 트럼프 유화 제스처에 반등…나스닥 1.46%↑ 마감",https://n.news.naver.com/mnews/article/055/0001237403?sid=104,"인공지능(AI) 및 <b>반도체</b> 관련주가 집중된 필라델피아 <b>반도체</b>지수는 2% 상승했습니다. 지수 구성 종목 30개 중 하나를 제외한 나머지가 모두 올랐습니다. 엔비디아는 1.13%, TSMC는 2.38%, 브로드컴은 2.19% 올랐고 ASML은 4... ","Thu, 06 Mar 2025 07:32:00 +0900"
2025-03-05 22:47:57,"코트라, 印서 韓 소부장 기업 지원…“<b>반도체</b> 관련 수요 지속 발굴”",https://n.news.naver.com/mnews/article/016/0002437704?sid=101,"5~7일 ‘인도 암다바드 <b>반도체</b> 글로벌 파트너링’ 개최 10개 국내기업 참가, 수출 상담 진행 ‘비전 서밋... 암다바드 <b>반도체</b> 글로벌 파트너링 사업’을 개최한다고 밝혔다. 이번 행사는 지속적으로 성장하는 인도 <b>반도체</b>... ","Thu, 06 Mar 2025 07:31:00 +0900"
2025-03-05 22:47:57,[출근길 포인트] '총성없는 무역전쟁'에 <b>반도체</b>·바이오·방산·로봇·AI...,https://www.pointdaily.co.kr/news/articleView.html?idxno=235780,"정부가 <b>반도체</b>와 배터리, 인공지능(AI) 등 첨단전략산업에서 경쟁력을 강화할 수 있도록 100조원 규모의 첨단전략산업기금을 신설한다. SK하이닉스의 용인 <b>반도체</b> 클러스터 1기 팹의 착공 현장. 사진=SK하이닉스... ","Thu, 06 Mar 2025 07:30:00 +0900"
2025-03-05 22:47:57,[연합뉴스 이 시각 헤드라인] - 07:30,https://n.news.naver.com/mnews/article/001/0015248237?sid=100,"전문보기: https://www.yna.co.kr/view/AKR20250305154300530 ■ 정부 뺀 여야협의체 개최…<b>반도체</b>법·연금·추경논의 여야는 6일 정부를 뺀 가운데 국회에서 국정협의회를 열어 <b>반도체</b> 특별법, 연금 개혁, 추가경정예산안... ","Thu, 06 Mar 2025 07:30:00 +0900"
2025-03-05 22:47:57,"아세안, 중국 수출 급증과 글로벌 리스크 사이 균형점 모색해야",http://www.g-enews.com/ko-kr/news/article/news_all/2025030520194652510c8c1c064d_1/article.html,"아세안 경제의 주요 분야인 석유화학, 전기기계, <b>반도체</b> 부문이 모두 위험에 처해 있다. 화학 부문은 인도네시아 GDP의 약 10%, 말레이시아의 7%, 태국의 5%를 차지하며, <b>반도체</b>는 싱가포르 GDP의 약 7%, 말레이시아의 25%를... ","Thu, 06 Mar 2025 07:30:00 +0900"
2025-03-05 22:47:57,"엔비디아 1.13% 상승, <b>반도체</b>지수 2.09% 급등(종합)",https://n.news.naver.com/mnews/article/421/0008112917?sid=104,트럼프 행정부가 자동차 관세를 한 달 유예하자 미증시의 3대 지수가 일제히 랠리함에 따라 <b>반도체</b>주도 인텔을 제외하고 모두 상승했다. 이에 따라 <b>반도체</b>지수가 2% 이상 급등했다. 5일(현지시간) 뉴욕증시에서... ,"Thu, 06 Mar 2025 07:29:00 +0900"
2025-03-05 22:47:57,트럼프 관세 유화책에 뉴욕증시 상승…나스닥 1.5%↑,http://www.smedaily.co.kr/news/articleView.html?idxno=319127,"AI(인공지능) 및 <b>반도체</b> 관련주가 집중된 필라델피아 <b>반도체</b>지수는 2% 상승했다. 지수 구성 종목 30개 중 하나를 제외한 나머지가 모두 올랐다. 엔비디아는 1.13%, TSMC는 2.38%, 브로드컴은 2.19% 올랐고 ASML은 4% 이상... ","Thu, 06 Mar 2025 07:28:00 +0900"
2025-03-05 22:47:57,3월 6일 '뉴스 퍼레이드' 오프닝,https://n.news.naver.com/mnews/article/448/0000511982?sid=102,"연금개혁과 <b>반도체</b>, 추경 등을 논의할 전망입니다. 4. 지난해 우리나라 1인당 국민총소득이 3만6600달러를 기록했습니다. 2027년 4만 달러에 진입할 것으로 전망되는데, 체감 소득 수준 상승은 미미하다는 반응입니다.","Thu, 06 Mar 2025 07:27:00 +0900"
2025-03-05 22:47:57,"<b>반도체</b>법 수혜 지역 미 의원들, 트럼프 폐기 촉구에 반발",https://n.news.naver.com/mnews/article/052/0002161392?sid=104,도널드 트럼프 미국 대통령이 관세 압박으로 해외 <b>반도체</b> 기업을 유치하겠다며 보조금을 없앨 것을 촉구한 가운데 <b>반도체</b>법 수혜 지역 의원들이 법안 폐기 움직임에 반발하고 있습니다. 척 슈머 민주당 상원 원내대표는... ,"Thu, 06 Mar 2025 07:26:00 +0900"
2025-03-05 22:47:57,"경기도, 美 한국차 거점 조지아에 '통상환경조사단' 파견",https://n.news.naver.com/mnews/article/018/0005956466?sid=100,"한편, 경기도는 자동차 부품 뿐만 아니라 <b>반도체</b> 산업 분야 등 대미 수출 규모가 큰 주요 업종에 대한 통상환경조사단 파견도 추가 검토하는 한편, 미국 관세 동향 등을 예의주시하며 다각적 통상·수출 전략을... ","Thu, 06 Mar 2025 07:25:00 +0900"
2025-03-05 22:47:57,‘최상목 제외’ 국정협의회 개최…연금개혁 등 현안 논의,https://n.news.naver.com/mnews/article/032/0003354932?sid=100,여야는 연금 자동조정장치 도입과 <b>반도체</b> 특별법 주52시간 예외 조항 등을 놓고 견해차를 좁히지 못하고 있어 이날 국정협의회에서 뾰족한 결론을 낼 수 있을지도 미지수다. 한편 국회 행정안전위원회는 이날 김대웅... ,"Thu, 06 Mar 2025 07:25:00 +0900"
2025-03-05 22:47:57,"[오늘의 글로벌마켓] 뉴욕증시, 자동차 등 관세 유예 발표에 저가 매수...",http://www.opinionnews.co.kr/news/articleView.html?idxno=113687,"이 여파로 인해 브로드컴 등 여타 <b>반도체</b> 업종은 시간 외 거래에서 약세를 기록하고 있다. 이날 발표된 민간 고용 지표는 예상치를 크게 밑돌았다. ADP 전미 고용보고서에 따르면, 지난 달 민간 고용은 전월대비... ","Thu, 06 Mar 2025 07:24:00 +0900"
2025-03-05 22:47:57,트럼프 관세 완화 제스처에 사흘만에 반등…<b>반도체</b>지수 2%↑ [뉴욕증시 ...,https://n.news.naver.com/mnews/article/015/0005102635?sid=101,"인공지능(AI) 및 <b>반도체</b> 관련주가 집중된 필라델피아 <b>반도체</b>지수는 2.09% 상승했다. 엔비디아는 1.13%, TSMC는 2.38%, 브로드컴은 2.19% 올랐고 ASML은 4% 이상 상승했다. 중국 관련주도 강세를 보였다. 주식예탁증서(ADR)... ","Thu, 06 Mar 2025 07:24:00 +0900"
2025-03-05 22:47:57,"[굿모닝오늘] 여야, 최상목 대행 제외 국정협의회 개최 / 행안위, 김대웅...",https://n.news.naver.com/mnews/article/057/0001874927?sid=102,"------------ 권성동 국민의힘 원내대표와 박찬대 더불어민주당 원내대표가 오늘(6일) 우원식 국회의장 주재로 국정협의회를 열고 <b>반도체</b>특별법과 연금 개혁, 추경 등 주요 현안을 논의합니다. 마은혁 헌법재판관 임명 문제로... ","Thu, 06 Mar 2025 07:24:00 +0900"
2025-03-05 22:47:57,미국 <b>반도체</b>법 폐기 논란 속 정치권의 입장 차이,https://www.jemin.com/news/articleView.html?idxno=789628,사진출처: 연합뉴스 트럼프 대통령이 <b>반도체</b>법 폐지를 주장하면서 의회 내에서 다양한 의견이... <b>반도체</b>법은 5년간 총 527억 달러를 투입해 미국 <b>반도체</b> 산업을 지원하는 내용을 담고 있다. 특히... ,"Thu, 06 Mar 2025 07:24:00 +0900"
2025-03-05 22:47:57,"코트라, ‘외국인투자가이드 2025’ 발간…“투자 지원 정보 총망라”",https://n.news.naver.com/mnews/article/016/0002437702?sid=101,"특히 이번 가이드에는 <b>반도체</b>·이차전지 등 첨단기술의 소재·부품·장비 투자 지원을 위한 국가전략기술 및 신성장·원천기술의 범위 확대, 외국인 투자 관련 현금보조 지원한도 및 국비분담비율 상향, 해외 유망... ","Thu, 06 Mar 2025 07:23:00 +0900"
2025-03-05 22:47:57,LS 구자은 회장 &quot;투자 축소 없어…공장 완공되면 캐즘 없어진다&quot;,https://www.delighti.co.kr/news/articleView.html?idxno=92860,구 회장은 2023년 LS 사업의 큰 축으로 배터리·전기차·<b>반도체</b> 관련 사업 등 미래 성장 분야에서 성과를 창출한다는 내용을 포함한 '비전 2030'을 발표한 바 있다. 구자균 LS일렉트릭 회장은 &quot;초고압 변압기 다음으로 배전... ,"Thu, 06 Mar 2025 07:22:00 +0900"
2025-03-05 22:47:57,이복현의 김건희 손절? 이제서야 삼부토건 의혹 들여다 본다: 슬로우레...,https://slownews.kr/130426,"<b>반도체</b>법 폐기, 삼성전자 어쩌나. “한국 관세는 미국보다 네 배 높다.”미국 수입품 실효 관세율은 0.79%.<b>반도체</b>법 폐지, 삼성전자 어쩌나.알래스카 가스관이라는 닭갈비.1인당 국민소득, 2021년이 피크였나.일본이 더 안... ","Thu, 06 Mar 2025 07:22:00 +0900"
2025-03-05 22:47:57,“<b>반도체</b> 호조 알겠는데 당장 밥상물가는”…수출지표 좋아도 서민 부담...,https://n.news.naver.com/mnews/article/009/0005454099?sid=101,작년 종합물가지수 4.1% 급등 외환위기 이후 최대폭 올라 <b>반도체</b> 가격 상승 영향 “올해 물가 수입품... 다만 내수 물가 상승 영향이 컸던 외환위기 때와 달리 <b>반도체</b> 가격 상승 등 국내 수출품 가격 상승이 견인한... ,"Thu, 06 Mar 2025 07:18:00 +0900"
2025-03-05 22:47:57,[더벨][인터배터리 2025]구동휘 LS엠앤엠 대표 &quot;가장 중요한 이슈 IPO&quot;,https://www.thebell.co.kr/free/content/ArticleView.asp?key=202503051538207960108573,"전기·전력·소재 외에도 전기차, <b>반도체</b>, 이차전지를 신성장 동력으로 삼고 있다. 현재 LS엠앤엠(옛 LS니꼬동제련)이 이차전지 사업의 선봉 역할을 맡고 있다. LS엠앤엠은 소재 원료와 리사이클링 사업을 담당할... ","Thu, 06 Mar 2025 07:18:00 +0900"
2025-03-05 22:47:57,"[공모주 진단] '주가 상승' 아이에스티이, 스톡옵션 줄매도 '솔솔'",https://dealsite.co.kr/articles/137535,아이에스티이는 <b>반도체</b> 장비 전문 제조사다. 지난해 말 계엄·탄핵 등 불확실성이 커지자 상장을... 아이에스티이는 <b>반도체</b>용 '풉 클리너(FOUP Cleaner)'를 주력으로 생산하는 기업이다. 풉 클리너는 <b>반도체</b> 보관 장비인... ,"Thu, 06 Mar 2025 07:16:00 +0900"
2025-03-05 22:47:57,"공화 “트럼프 외교정책, 미국 이익 보호”…민주 “동맹 관계 훼손 위...",https://www.voakorea.com/a/7999311.html,미국의 <b>반도체</b> 지원법(CHIPS and Science Act)에 대해 부정적인 입장을 표명한 것과 관련해... 전임 바이든 행정부가 제정한 <b>반도체</b> 지원법은 미국에 투자한 <b>반도체</b> 기업에 대해 520억 달러... ,"Thu, 06 Mar 2025 07:16:00 +0900"
2025-03-05 22:47:57,"[증시전략] 국제유가, 무역전쟁 속 6개월래 최저…어디까지 떨어질까",https://n.news.naver.com/mnews/article/374/0000428325?sid=104,"42거래일 연속 순매수 기록 - 외인 2245억원 순매도…지난달 20일부터 연일 매도 - 트럼프 대통령 '<b>반도체</b>법' 폐지 언급에도 SK하이닉스 상승 - 트럼프 &quot;美 가스관사업 韓 참여 희망&quot;…철강·강관주↑ - 젤렌스키, 광물협정... ","Thu, 06 Mar 2025 07:16:00 +0900"
2025-03-05 22:47:57,[트럼프 관세 파장] 의약품 관세 25% 현실화 확률은,https://dealsite.co.kr/articles/137597,"그는 <b>반도체</b>, 자동차, 제약 등 주요산업에 고율 관세를 적용하겠다고 예고한 가운데 이달 12일부터 철강... 자동차, <b>반도체</b>, 의약품으로 관세 범위를 확대하겠다고 밝혔다. 한국무역협회에 따르면 지난해 한국의 대미... ","Thu, 06 Mar 2025 07:14:00 +0900"
2025-03-05 22:47:57,"[핀셋+] [테스] 실적 성장세 가속…올해, 낸드 투자 확대 변수",https://dealsite.co.kr/articles/137698,D램·낸드 전환투자 효과에 순이익 26배↑…매출 구조도 다변화 <b>반도체</b> 장비업체 테스가 지난해 업황... 이는 <b>반도체</b> 업황 회복과 주요 고객사들의 설비 투자 확대가 맞물린 결과로 해석된다. 특히 D램과 낸드 등 메모리... ,"Thu, 06 Mar 2025 07:14:00 +0900"
2025-03-05 22:47:57,"뉴욕증시, 트럼프 車관세 유예에 사흘만 반등…나스닥 1.46%↑",https://n.news.naver.com/mnews/article/123/0002354246?sid=104,"마이크로소프트(MS)는 3.19%, 엔비디아는 1.13%, 메타와 테슬라는 각각 2.57%, 2.6% 상승 마감했다. <b>반도체</b> 제조업체 인텔은 트럼프가 <b>반도체</b> 산업에 대한 보조금을 폐지하자는 발언을 한 뒤 2.4% 하락했다.","Thu, 06 Mar 2025 07:14:00 +0900"
2025-03-05 22:47:57,"대전보건환경연, 전국 최초 AI 기반 '대전식품검사봇' 도입",https://daily.hankooki.com/news/articleView.html?idxno=1187012,대전식품검사봇은 대전시 <b>반도체</b>바이오산업과에서 주관하는 'AI 데이터 지원사업'에 선정돼 대전정보문화산업진흥원과 ㈜그린다AI의 협업을 통해 개발됐다. 앞서 연구원은 관내 식품 제조·가공 및 즉석판매제조·일부... ,"Thu, 06 Mar 2025 07:14:00 +0900"
2025-03-05 22:47:57,"'트럼프 관세 파고 넘어라'…경기도, 통상환경조사단 파견",https://n.news.naver.com/mnews/article/277/0005555955?sid=102,"경기도는 자동차 부품뿐만 아니라 <b>반도체</b> 산업 분야 등 대미 수출 규모가 큰 주요 업종에 대한 통상환경조사단 파견도 추가 검토하는 한편, 미국 관세 동향 등을 예의주시하며 다각적 통상·수출 전략을 지속적으로... ","Thu, 06 Mar 2025 07:11:00 +0900"
2025-03-05 22:47:57,자동차 관세 유예에 엔비디아 덩달아 1.13% 상승,http://www.queen.co.kr/news/articleView.html?idxno=429414,엔비디아 일일 주가추이 - 야후 파이낸스 갈무리 트럼프 행정부가 자동차 관세를 한 달 유예하자 <b>반도체</b>주인 엔비디아도 덩달아 1% 이상 상승했다. 5일(현지시간) 뉴욕증시에서 엔비디아는 1.13% 상승한 117.30달러를... ,"Thu, 06 Mar 2025 07:10:00 +0900"
2025-03-05 22:47:57,'트럼프 그럴줄 알았어'…車관세 한달 면제에 뉴욕증시↑[월스트리트in...,https://n.news.naver.com/mnews/article/018/0005956464?sid=101,미국 내 파운드리(<b>반도체</b> 수탁생산) 공장 확대에 나서고 있는 인텔은 트럼프 대통령이 <b>반도체</b>법을 폐기해야한다고 말한 게 영향을 미치면서 2.44% 흘러내렸다. 달러 대비 유로화 환율 추이 (그래픽=마켓워치) 달러화... ,"Thu, 06 Mar 2025 07:10:00 +0900"
2025-03-05 22:47:57,민생지원 추경 합의되나?...오늘 여야협의회 결과 주목,https://n.news.naver.com/mnews/article/661/0000051597?sid=100,"추경과 <b>반도체</b>특별법, 연금개혁 등을 논의할 예정입니다. 그런데 주요 안건 쟁점에서 여야 입장이 평행선을... <b>반도체</b>특별법도 국민의힘은 주52시간 예외조항 포함을 주장하는 반면, 믽주당은 이를 제외한 특별법을... ","Thu, 06 Mar 2025 07:09:00 +0900"
2025-03-05 22:47:57,‘관세폭탄 투척→유예’ 트럼프 전술에 美 뉴욕증시 화색…사흘 만에...,https://n.news.naver.com/mnews/article/016/0002437695?sid=101,"인공지능(AI) 및 <b>반도체</b> 관련주가 집중된 필라델피아 <b>반도체</b>지수는 2% 상승했다. 지수 구성 종목 30개 중 하나를 제외한 나머지가 모두 올랐다. 엔비디아는 1.13%, TSMC는 2.38%, 브로드컴은 2.19% 올랐고 ASML은 4% 이상... ","Thu, 06 Mar 2025 07:08:00 +0900"
2025-03-05 22:47:57,"[상보]미국증시, 트럼프 캐나다-멕시코 관세 완화 다우-나스닥-S&amp;P-반도...",https://www.socialvalue.kr/news/view/1065562191390804,"필라델피아 <b>반도체</b>지수는 전장보다 96.29포인트(2.09%) 급등한 4,700.79를 마크하며 장을 마쳤다. 주요 종목으로는 마이크로소프트가 3.1% 상승한 것을 비롯해 엔비디아 1.1%, 아마존닷컴 2.2%, 메타 2.5%, 구글의 알파벳 1.2... ","Thu, 06 Mar 2025 07:08:00 +0900"
2025-03-05 22:47:57,"베트남 총리, 한국 기업에 <b>반도체</b> · AI 등 투자 확대 요청",https://n.news.naver.com/mnews/article/055/0001237389?sid=104,"▲ 베트남 총리, 한국 기업들과 간담회 베트남 총리가 현지 진출 한국 기업들과 만나 <b>반도체</b>·인공지능(AI) 등... 고태연 하노이 코참 회장은 <b>반도체</b>·AI 등 첨단기술 산업 투자 확대를 위한 법·제도·정책 개선, 수출입 물류... ","Thu, 06 Mar 2025 07:06:00 +0900"
2025-03-05 22:47:57,[AM-PM] 여야 국정협의회 오늘 개최…연금·<b>반도체</b>법 논의 外,https://n.news.naver.com/mnews/article/422/0000718740?sid=102,"개최…연금·<b>반도체</b>법 논의 (국회) 민생 현안 논의를 위한 '여야 국정협의회'가 오늘 국회에서 열립니다. 여야 원내대표와 원내수석부대표, 정책위의장이 참석하는 '3+3' 형식으로 추경과 연금개혁, <b>반도체</b>특별법 등... ","Thu, 06 Mar 2025 07:06:00 +0900"
2025-03-05 22:47:57,용인시민 10명 중 9명 &quot;생활환경 만족한다&quot;,https://n.news.naver.com/mnews/article/018/0005956461?sid=100,"이 밖에 용인특례시 하면 가장 먼저 떠오르는 이미지를 묻는 질문에는 응답자의 32.8%가 ‘인구 110만 특례시’를 꼽았고, ‘살기좋은 주거도시’(17.5%), ‘경제발달 <b>반도체</b> 선도 도시’(15.8%) 순으로 높게 나타났다.... ","Thu, 06 Mar 2025 07:05:00 +0900"
2025-03-05 22:47:57,[스타트경제] 한국 콕 집은 트럼프...신원식 &quot;좋은 결말 있을 것&quot;,https://n.news.naver.com/mnews/article/052/0002161395?sid=101,"우리는 쿼터가 있어서 무관세 부분이 있었는데 이 부분 없앤다고 보시면 될 것 같고 자동차, <b>반도체</b> 다... 어제도 <b>반도체</b>법 폐기도 언급을 했는데 이러다가 보조금 못 받게 되는 상황이 오는 것 아니냐, 이런 우려에... ","Thu, 06 Mar 2025 07:03:00 +0900"
2025-03-05 22:47:57,[천지일보 이슈종합] 李체포안 檢내통‧50조 첨단전략산업기금‧트럼프...,https://www.newscj.com/news/articleView.html?idxno=3241778,"<b>반도체</b>와 배터리, 인공지능(AI) 등 첨단전략산업에서 경쟁력을 강화할 수 있도록 정부가 50조원 규모의... ◆50조 규모 '첨단전략산업기금' 신설한다… <b>반도체</b>·AI·배터리 집중☞ <b>반도체</b>와 배터리, 인공지능(AI) 등... ","Thu, 06 Mar 2025 07:02:00 +0900"
2025-03-05 22:47:57,'캐즘·중 약진'에 배터리 위기…&quot;신기술로 돌파&quot;,https://n.news.naver.com/mnews/article/055/0001237387?sid=101,"정부는 50조 원 규모의 첨단전략산업기금을 만들어 배터리와 <b>반도체</b>, 로봇 등 10개 분야 기업을 집중 지원하기로 했습니다. (영상취재 : 양지훈, 영상편집 : 안여진, 디자인 : 강경림·방민주)","Thu, 06 Mar 2025 07:02:00 +0900"
2025-03-05 22:47:57,트럼프 “군사 지원 하는데도 미국의 4배 관세”…안보실장 “좋은 결말...,https://n.news.naver.com/mnews/article/056/0011905450?sid=104,&quot;] 그러나 삼성전자와 SK하이닉스 등 이미 투자를 약속한 <b>반도체</b> 회사에 보조금을 주는 <b>반도체</b>법은 폐지하겠다고 공언했습니다. 트럼프 대통령이 한국을 군사적으로 지원하고 있다고 거론한 것도 심상치 않습니다. 관세... ,"Thu, 06 Mar 2025 07:02:00 +0900"
2025-03-05 22:47:57,김종혁 &quot;비명계가 한동훈과 내통했나? 李 자당 명예훼손&quot; [한판승부],https://n.news.naver.com/mnews/article/079/0003998728?sid=100,근데 이분 얘기 들어보면 미국의 세계적인 <b>반도체</b> 기업 엔비디아가 그냥 만들어졌습니까? 그거는 민간... 11년 전에 <b>반도체</b> 산업에 대한 전망이 나온 기사가 있었는데 그중에 보면은 엔비디아는 곧 없어진다고 대부분이... ,"Thu, 06 Mar 2025 07:01:00 +0900"
