DateTime,Title,Link,Description,PubDate
2026-04-05 03:20:17,"삼성 오너 일가, 12조원 상속세 납부 마무리…‘뉴삼성’ 본격 시동",https://www.seoultimes.news/news/article.html?no=2000094841,"그동안 상속세 부담과 지배구조 정비에 집중했던 경영 환경에서 벗어나 <b>반도체</b>, 인공지능(AI), 바이오 등 미래 성장 사업에 대한 투자와 사업 재편이 한층 속도를 낼 것이라는 전망이다. 특히 이재용 회장이 사법... ","Sun, 05 Apr 2026 12:16:00 +0900"
2026-04-05 03:20:17,"장성민 “‘폭풍우’ 남말하는 李, 무능위기 사과부터…‘추경 도파민...",https://n.news.naver.com/mnews/article/029/0003019937?sid=100,<b>반도체</b>·자동차 등 수출 경제 조건은 단군이래 호조건이지만 대통령의 대미외교 실패와 이란 사태 초기 대응 실패가 주요 요인”이라고 꼬집었다. 그러면서 “이 대통령은 이 점을 솔직히 인정하고 대국민 사과문을... ,"Sun, 05 Apr 2026 12:13:00 +0900"
2026-04-05 03:20:17,"[재계핫이슈] 잘나가는 <b>반도체</b> 방산, 노란봉투법으로 '우회파업' 공포",https://www.pennmike.com/news/articleView.html?idxno=118138,"한국경제를 떠받치고 있는 핵심 산업, <b>반도체</b>와 방위산업체들이 지난달 시행에 들어간 노란봉투법 때문에... <b>반도체</b> 생산을 위한 소부장(소재 부품 장비) 업체 및 방위산업체의 수많은 부품 납품업체, 파견근로자들의... ","Sun, 05 Apr 2026 12:12:00 +0900"
2026-04-05 03:20:17,"산업부, 중견기업 10곳 월드클래스 기업으로 성장 지원",https://n.news.naver.com/mnews/article/666/0000101964?sid=100,올해는 ▲<b>반도체</b>·디스플레이(코미코·원익홀딩스) ▲첨단바이오(삼진제약·휴메딕스) ▲미래모빌리티(새한산업·카이엠·진합) ▲핵심소재(네추럴웨이) ▲첨단제조(세아메카닉스) ▲에너지신산업(한중엔시에스) 등... ,"Sun, 05 Apr 2026 12:06:00 +0900"
2026-04-05 03:20:17,7000억 넘은 韓 수출...이젠 ‘일본의 벽’ 넘본다,https://www.ekn.kr/web/view.php?key=20260405024324366,지난해 한국 수출액이 <b>반도체</b> 슈퍼사이클(초호황기) 영향으로 7000억달러를 돌파하며 일본과의 격차를... 한국 수출 호조의 핵심 동력은 <b>반도체</b>다. 지난해 하반기부터 본격화된 <b>반도체</b> '슈퍼사이클'이 올해까지... ,"Sun, 05 Apr 2026 12:04:00 +0900"
2026-04-05 03:20:17,삼성전자·SK하이닉스 합쳐 연간 최대 500조원 영업이익 시대 열리나,https://n.news.naver.com/mnews/article/023/0003968908?sid=105,세계 <b>반도체</b> 업체들의 주가가 큰 변동을 보이고 있다. 하지만 올 1분기 사업을 마무리한 <b>반도체</b> 업체들은 무척이나 침착하다. 요동치는 주가와는 달리 콘크리트 같은 굳건한 호실적이 전망되기 때문이다. 증권... ,"Sun, 05 Apr 2026 12:01:00 +0900"
2026-04-05 03:20:17,35조 순매도에 외국인 비중 '뚝'…어닝시즌 앞두고 복귀 주목,https://www.ajunews.com/view/20260405115213202,이재원 유안타증권 연구원은 &quot;지난달 18일 이후 11거래일 연속 대형주 위주 순매수를 이어가던 외국인이 3일 <b>반도체</b> 중심 대형주 순매수로 전환하며 지수 반등을 견인했다&quot;며 &quot;1분기 잠정실적 발표를 앞둔 삼성전자에... ,"Sun, 05 Apr 2026 12:00:00 +0900"
2026-04-05 03:20:17,'K-<b>반도체</b>' 호황에 작년 수출 7000억달러 돌파…올해 '일본의 벽' 넘나,https://n.news.naver.com/mnews/article/421/0008870537?sid=101,지난해 한국 수출이 <b>반도체</b> 호황에 힘입어 일본과의 격차를 크게 좁히며 사상 처음으로 7000억 달러를... <b>반도체</b> 업황 개선에 따른 '슈퍼사이클'이 본격화되면서 수출을 끌어올리고 있다. 올해 1월 수출은 658억... ,"Sun, 05 Apr 2026 11:59:00 +0900"
2026-04-05 03:20:17,"장동혁 &quot;이진숙, 국회 와서 싸운다면 엄청난 힘 될 것&quot;",https://n.news.naver.com/mnews/article/119/0003077167?sid=100,"이어 &quot;경기도는 지금 <b>반도체</b>가 큰 화두EK. 양향자 최고위원도 전문가이긴 하지만, <b>반도체</b> 전문가인 기업인을 모셔와 경선을 한다면 경기지사 선거 국면을 <b>반도체</b> 이슈로 끌고 갈 수 있다고 생각했다&quot;라며 &quot;추미애 (민주당... ","Sun, 05 Apr 2026 11:56:00 +0900"
2026-04-05 03:20:17,"우리은행, 두산그룹 에너지 등 미래전략산업에 금융지원",https://n.news.naver.com/mnews/article/009/0005661087?sid=101,"양사 금융지원 업무협약 백년기업이란 공통점도 우리은행과 두산그룹이 에너지·스마트머신·<b>반도체</b> 등... 노용필 우리은행 대기업영업전략부장은 “두산그룹은 에너지, 스마트머신, <b>반도체</b> 및 첨단소재 부문에서 글로벌... ","Sun, 05 Apr 2026 11:47:00 +0900"
2026-04-05 03:20:17,"삼성·현대차 공장 덮친 '호르무즈 청구서'… 동남아 K-제조벨트, 전기...",https://www.g-enews.com/view.php?ud=202604051059408238fbbec65dfb_1,<b>반도체</b>·디스플레이·배터리처럼 미세 공정이 필요한 품목은 단순 원가 문제를 넘어 제품 품질까지 흔들릴 수 있다. 이 때문에 전압 불안정이 에너지 비용보다 더 무서운 변수라는 게 업계의 공통된 인식이다. 이... ,"Sun, 05 Apr 2026 11:44:00 +0900"
2026-04-05 03:20:17,"우리은행, 두산그룹과 맞손…“미래성장동력 육성 지원”",https://www.sentv.co.kr/article/view/sentv202604050029,"에너지·스마트머신·<b>반도체</b> 및 첨단소재 등 미래성장동력 분야에서 글로벌 경쟁력을 갖춘 두산그룹과의... 노용필 우리은행 대기업영업전략부 부장은 “두산그룹은 에너지, 스마트머신, <b>반도체</b> 및 첨단소재 부문에서... ","Sun, 05 Apr 2026 11:44:00 +0900"
2026-04-05 03:20:17,"우리은행, 두산그룹과 미래전략산업 금융지원 협약",https://n.news.naver.com/mnews/article/082/0001374378?sid=101,"우리은행이 두산그룹과 손잡고 에너지, 스마트머신, <b>반도체</b>, 첨단소재 등 미래전략산업 분야에 대한 금융지원에 나선다. 우리은행은 지난 3일 서울 중구 본점에서 두산그룹과 '국가 미래전략산업 생태계 구축 및 성장을... ","Sun, 05 Apr 2026 11:43:00 +0900"
2026-04-05 03:20:17,"항공업계, '성수기' 1분기 실적 선방…&quot;진짜 위기는 2분기부터&quot;",https://n.news.naver.com/mnews/article/055/0001345960?sid=101,화물 부문도 <b>반도체</b> 등 고단가 수요가 증가세를 보이며 수익성이 높아졌을 것으로 분석됐습니다. 특히 중동 전쟁 이후 항공 화물 운임이 오르는 점도 수익 개선에 영향을 미칠 수 있습니다. 글로벌 항공 화물 운임... ,"Sun, 05 Apr 2026 11:41:00 +0900"
2026-04-05 03:20:17,삼성家 12조 상속세 이달 완납…이재용 ‘뉴삼성’ 본격 시동,https://www.news2day.co.kr/article/20260405500020,"5년 분납 마무리…재무 부담 해소 <b>반도체</b>·AI 등 미래사업 투자 가속화 이재용 삼성전자 회장이 지난 2월 4일... 그동안 세금 부담과 지배구조 정비에 집중됐던 경영 환경에서 벗어나 <b>반도체</b>, 인공지능(AI), 바이오 등 미래... ","Sun, 05 Apr 2026 11:40:00 +0900"
2026-04-05 03:20:17,"청와대 행정관 출신 손화정, &quot;영종 바이오 특화단지에서 국가산단으로 ...",https://www.jeonmae.co.kr/news/articleView.html?idxno=1245147,손 예비보는 &quot;용인 <b>반도체</b> 특화단지 역시 수도권임에도 국가산단으로 지정된 선례가 있다&quot;며 &quot;영종 바이오 역시 국가 전략 산업이라는 점에서 충분히 예외 적용이 가능한 사안&quot;이라고 설명했다. 다만 &quot;대선 공약이 곧바로... ,"Sun, 05 Apr 2026 11:40:00 +0900"
2026-04-05 03:20:17,"삼성전자, 1분기 영업이익 40조 넘을까…<b>반도체</b> 슈퍼사이클로 '역대 최...",https://www.newspim.com/news/view/20260405000042,<b>반도체</b> 슈퍼사이클에 힘입어 DS(디바이스솔루션) 부문이 실적을 견인하며 영업이익 40조원 돌파... 사진은 삼성전자 사옥 모습 [사진=뉴스핌DB] 올해 초 30조원대 초반 수준이었던 영업이익 전망치가 <b>반도체</b> 수출... ,"Sun, 05 Apr 2026 11:38:00 +0900"
2026-04-05 03:20:17,"우리은행, 두산그룹과 미래전략산업 협력 강화",https://www.viva100.com/article/20260405500358,"우리은행은 두산그룹과 에너지, 스마트머신, <b>반도체</b>, 첨단소재 등 미래전략산업 분야에서 전략적 협력을 강화한다고 5일 밝혔다. 이를 위해 우리은행은 지난 3일 서울 중구 본점에서 두산그룹과 ‘국가 미래전략산업... ","Sun, 05 Apr 2026 11:38:00 +0900"
2026-04-05 03:20:17,"‘30억 이상’ 부자들, 방산株 털고 삼성전자로 갈아탔다",https://www.ekn.kr/web/view.php?key=20260405028414354,"줄이고 <b>반도체</b> 대표주를 대거 사들인 것으로 나타났다. 미국-이란 전쟁이 시작된 뒤 급등한 방산 업종에서 차익을 실현하고, 삼성전자와 SK하이닉스 등 대형 <b>반도체</b>주와 증시 상승에 베팅하는 상품으로 자금을... ","Sun, 05 Apr 2026 11:38:00 +0900"
2026-04-05 03:20:17,삼성家 12조 상속세 이달 완납…이재용 '뉴삼성' 본격화,https://www.newsway.co.kr/news/view?ud=2026040511352885630,"벗어나 <b>반도체</b>와 인공지능(AI), 바이오 등 미래 사업 중심의 투자와 사업 재편 논의에 속도가 붙을 것이라는 전망이 나온다. 특히 이재용 회장이 지난해 사법 리스크 부담을 덜어낸 데 이어 <b>반도체</b> 사업을 중심으로 실적... ","Sun, 05 Apr 2026 11:36:00 +0900"
2026-04-05 03:20:17,초과 세수에도 '한은 마통' 17조 쓴 정부…13조 못 갚아 이자만 77억,https://n.news.naver.com/mnews/article/421/0008870522?sid=101,올해 역시 <b>반도체</b> 경기 호황과 증시 호조 등에 따른 25조 2000억 원 규모의 초과세수가 발생할 것으로 전망됐다. 정부의 일시 차입이 매년 반복돼 온 만큼 보다 정교한 재정 운영이 필요하다는 지적이 제기된다.... ,"Sun, 05 Apr 2026 11:34:00 +0900"
2026-04-05 03:20:17,[ZD브리핑] 삼성전자 잠정실적 발표...기아 CEO 인베스터 데이 개최,https://n.news.naver.com/mnews/article/092/0002417470?sid=105,"<b>반도체</b> 사업부는 분위기가 좋지만, 메모리 가격 상승이 완제품 제조원가 부담으로 이어지는 스마트폰 사업부와 TV 사업부는 다를 수밖에 없습니다. 지난주에는 중국 TCL과 일본 소니가 TV 합작사 설립을 위한 최종계약을... ","Sun, 05 Apr 2026 11:34:00 +0900"
2026-04-05 03:20:17,"[박진우의 도쿄포인트] 에너지 불안 속 한일 협력, 현실적 논의가 필요...",https://www.pointe.co.kr/news/articleView.html?idxno=77630,"자동차, <b>반도체</b>, 철강, 석유화학 같은 주요 산업도 에너지 가격에 민감해 충격은 더 크게 나타날 수 있다. 이런... 특히 <b>반도체</b>, 자동차, 철강, 화학 산업은 에너지 가격 변화에 민감하다. 두 나라가 어떤 분야가 더 취약한지... ","Sun, 05 Apr 2026 11:32:00 +0900"
2026-04-05 03:20:17,"“팔만큼 팔았나, 슬슬 돌아오는 분위기”…코스피 외국인 비중 36.2% 최...",https://n.news.naver.com/mnews/article/009/0005661081?sid=101,"그동안 외국인은 글로벌 포트폴리오 재조정과 <b>반도체</b> 업종 비중 축소, 원·달러 환율 급등 영향으로 국내 증시에서 자금을 빼왔다. 그러나 전쟁이 정점을 통과했다는 인식이 확산되면서 위험자산 선호 회복 기대도... ","Sun, 05 Apr 2026 11:30:00 +0900"
2026-04-05 03:20:17,국힘 경기지사 공천 난항…장동혁 구인 나섰지만 '실패',https://n.news.naver.com/mnews/article/421/0008870516?sid=162,"장동혁 대표는 5일 매일신문 유튜브에 출연해 &quot;경기도는 지금 <b>반도체</b>가 큰 화두&quot;라며 &quot;양향자 최고위원도 전문가이긴 하지만, <b>반도체</b> 전문가인 기업인을 모셔와 경선을 한다면 경기지사 선거 국면을 <b>반도체</b> 이슈로 끌고 갈... ","Sun, 05 Apr 2026 11:27:00 +0900"
2026-04-05 03:20:17,이란전쟁 후 예상실적 59% 하락한 ‘이 기업’…<b>반도체</b>·정유주는↑,https://n.news.naver.com/mnews/article/021/0002782322?sid=101,"반면 국제유가 급등에 정유주 실적 눈높이는 줄줄이 올라갔고, 지정학적 리스크가 없는 <b>반도체</b>주... 시가총액 상위 기업 중에서는 <b>반도체</b> 기업의 실적 눈높이가 대폭 상향됐다. 삼성전자의 올해 영업이익 추정치는... ","Sun, 05 Apr 2026 11:24:00 +0900"
2026-04-05 03:20:17,"강원도, 금융위원회와 찾아가는 국민성장펀드 간담회",https://www.jeonmae.co.kr/news/articleView.html?idxno=1245125,"인공지능, <b>반도체</b>, 이차전지, 바이오, 미래차 등 첨단 산업과 인프라 사업에 집중 투입될 예정이다. 지역... 도는 바이오헬스와 <b>반도체</b> 등 7대 미래산업 육성 경험을 토대로 국민성장펀드와 연계한 투자 유치 확대에 나설... ","Sun, 05 Apr 2026 11:22:00 +0900"
2026-04-05 03:20:17,"떠나는 외국인, 코스피 비중 36%대로 뚝…어닝시즌 시작에 복귀?",https://n.news.naver.com/mnews/article/055/0001345954?sid=101,외국인 투자자는 그간 글로벌 포트폴리오의 재조정 등으로 <b>반도체</b>를 중심으로 국내 주식에 대한 포지션을 축소해왔습니다. 그러입니다 전쟁 발발로 원/달러 환율까지 급등하자 외국인 투자자는 국내 증시 이탈을... ,"Sun, 05 Apr 2026 11:22:00 +0900"
2026-04-05 03:20:17,"‘유럽판 챗GPT’ 미스트랄 AI, 삼성과 회동…메모리 협력 논의",http://www.newstomato.com/ReadNews.aspx?no=1296722&inflow=N,AI <b>반도체</b> 공급 및 기술 협력 방안을 논의한 것으로 알려졌습니다. 미스트랄 AI는 구글 딥마인드와 메타 등... 이번 방문은 자사 모델 운영과 AI 인프라 구축에 필요한 <b>반도체</b> 경쟁력 확보 차원으로 풀이됩니다.... ,"Sun, 05 Apr 2026 11:20:00 +0900"
2026-04-05 03:20:17,삼성가 '12조 상속세' 이달 마침표…<b>반도체</b>·AI 투자 속도 낼까,https://n.news.naver.com/mnews/article/022/0004118314?sid=101,"그동안 상속세 부담과 지배구조 정비에 집중했던 경영 환경에서 벗어나 <b>반도체</b>와 인공지능(AI), 바이오 등 미래 사업 투자와 사업 재편에 보다 속도를 낼 수 있을 것 이라는 전망이다. 특히 이재용 회장이 지난해 사법... ","Sun, 05 Apr 2026 11:19:00 +0900"
2026-04-05 03:20:17,"원자력연-벡스코, 수입의존 '유체 이송 펌프' 기술이전",https://www.kukinews.com/article/view/kuk202604050024,㈜벡스코가 <b>반도체</b>·디스플레이 공정 핵심 장비 기술을 이전받으며 고부가가치 진공장비 시장에 진출할 전망이다. 한국원자력연구원(이하 원자력연)은 <b>반도체</b>와 디스플레이 공정의 핵심인 ‘고효율 가압·진공 유체이송... ,"Sun, 05 Apr 2026 11:18:00 +0900"
2026-04-05 03:20:17,삼성가 12조 상속세 이달 완납…이재용 ‘뉴삼성’ 본격화,http://www.newstomato.com/ReadNews.aspx?no=1296721&inflow=N,"(AI)·바이오·<b>반도체</b> 등 미래 사업 투자와 사업 재편에 집중할 수 있다는 분석입니다. 특히 이재용 회장이 지난해 사법 리스크에서 벗어난 이후 <b>반도체</b>를 중심으로 실적 개선 흐름이 이어지는 가운데, 상속세 납부까지... ","Sun, 05 Apr 2026 11:18:00 +0900"
2026-04-05 03:20:17,"&quot;안녕, K-라드큐브&quot;…끝내 교신 불발 '아르테미스 위성', &quot;의미 있다&quot;",https://n.news.naver.com/mnews/article/008/0005339880?sid=105,위성 내부에는 삼성전자와 SK하이닉스의 성능 측정용 <b>반도체</b>도 실려 있었다. 치명적인 우주방사선 환경이 신체와 기기에 미치는 영향을 분석하기 위해서다. K-라드큐브는 오리온 우주선 발사 후 약 5시간28분29초 만인... ,"Sun, 05 Apr 2026 11:18:00 +0900"
2026-04-05 03:20:17,"한국 수출, 일본 넘어설까···<b>반도체</b> 호황에 올해 골든타임",https://www.ziksir.com/news/articleView.html?idxno=129740,[연합뉴스]  지난해 한국 수출이 <b>반도체</b> 초호황에 힘입어 일본을 턱밑까지 추격한 것으로 나타났다.... 한국 수출 호조의 일등 공신은 단연 <b>반도체</b>다. 지난해 하반기부터 본격화된 <b>반도체</b> 슈퍼 사이클이 올해도... ,"Sun, 05 Apr 2026 11:18:00 +0900"
2026-04-05 03:20:17,[주간증시전망] 호르무즈 봉쇄에 갇힌 코스피…협상 타결이 변곡점,https://www.viva100.com/article/20260405500169,경우 <b>반도체</b> 중심의 투자 심리 개선으로 이어질 가능성이 있다는 관측이다. 실제로 한국의 3월 수출은 전년 대비 48.3% 증가하며 역대 최고 수준을 기록했고 <b>반도체</b> 수출도 151% 증가하는 등 AI 투자 확대 수혜가 확인되고... ,"Sun, 05 Apr 2026 11:16:00 +0900"
2026-04-05 03:20:17,"이재용, 상속세 족쇄 풀고 '뉴삼성' 시동...모레 1분기 실적 발표",https://n.news.naver.com/mnews/article/052/0002336522?sid=101,"[기자] 네, 증권가에서는 <b>반도체</b> 호황 영향으로 삼성전자 1분기 영업이익이 40조 원을 넘어설 것으로 보고 있습니다. 지난해 연간 영업이익 43조 6천억 원이었는데 한 분기 만에 1년 치 영업이익을 뛰어넘을 가능성까지... ","Sun, 05 Apr 2026 11:15:00 +0900"
2026-04-05 03:20:17,"장동혁 &quot;이진숙, 국회서 李정부와 싸워야…전재수·정원오, 부도덕에 무...",https://n.news.naver.com/mnews/article/088/0001004126?sid=100,"저는 개인적으로는 그래도 우리, 경기도는 지금 <b>반도체</b>가 사실 큰 화두지 않습니까? 우리 양향자 최고도 <b>반도체</b> 전문가이기는 한데 그분 한 분보다 그래도 <b>반도체</b> 전문가인 기업인을 모셔 와서 경선한다면 뭔가 <b>반도체</b>를... ","Sun, 05 Apr 2026 11:15:00 +0900"
2026-04-05 03:20:17,"‘<b>반도체</b> 부활 vs 체질 개선’⋯ 7일, 삼성·LG 1Q 성적표 나온다",https://www.viva100.com/article/20260405500277,"삼성전자는 <b>반도체</b> 사업의 폭발적이 회복세에 힘입어 ‘어닝 서프라이즈’가, LG전자는 가전 수요... 삼성전자는 이번에도 <b>반도체</b>가 실적을 견인했다. 지난해 말부터 <b>반도체</b>를 담당하는 DS부문이 부진을 딛고... ","Sun, 05 Apr 2026 11:14:00 +0900"
2026-04-05 03:20:17,"산업부, 월드클래스 플러스 10곳 선정…최대 4년간 50억 지원",https://n.news.naver.com/mnews/article/016/0002624809?sid=101,올해는 ▷<b>반도체</b>·디스플레이(코미코·원익홀딩스) ▷ 첨단바이오(삼진제약·휴메딕스) ▷ 미래모빌리티(새한산업·카이엠·진합) ▷ 핵심소재(네추럴웨이) ▷첨단제조(세아메카닉스) ▷에너지신산업(한중엔시에스) 등... ,"Sun, 05 Apr 2026 11:13:00 +0900"
2026-04-05 03:20:17,급락장 속 2차전지 ‘역주행’…ETF 주간수익률 상위권 휩쓸어[펀드와치...,https://n.news.naver.com/mnews/article/018/0006250404?sid=101,"주 초반에는 코스피와 함께 중동 리스크, <b>반도체</b> 투심 악화 영향을 받았고, 지난 2일에는 도널드 트럼프 대통령의 대국민 연설이 중동 전쟁 조기종식 기대를 꺾으면서 매도 사이드카가 발동됐다. 해외 주식형... ","Sun, 05 Apr 2026 11:13:00 +0900"
2026-04-05 03:20:17,미국-이란 협상시일 6일 임박…&quot;시장 남아있어라&quot; 증시 대응 방법은,https://news.einfomax.co.kr/news/articleView.html?idxno=4407765,AI <b>반도체</b> 밸류체인과 헬스케어에 무게를 두는 선별적 포지셔닝이 유효하다&quot;고 조언했다. 노동길 신한투자증권 연구원은 전쟁이 장기화할 경우와 4월 중 전황이 진정될 경우에 각기 다른 전략을 구사해야 한다고 제언했다.... ,"Sun, 05 Apr 2026 11:10:00 +0900"
2026-04-05 03:20:17,[강성원의 현장톡(TALK)] 고덕 알파탄약고 이전…정장선 시장이 완성한...,http://www.fieldnews.kr/news/articleView.html?idxno=27738,△평택호 관광단지 개발 △브레인시티 일반산업단지 조성 △국제학교·카이스트·아주대병원 유치 △대중교통 체계 개편 △국가 <b>반도체</b> 특화단지 지정 △광역급행철도(GTX)-A·C 노선 연장 확정 △평택역 복합광장 착공... ,"Sun, 05 Apr 2026 11:08:00 +0900"
2026-04-05 03:20:17,중견기업 월드클래스 기업으로 키운다,https://n.news.naver.com/mnews/article/138/0002223327?sid=004,"올해는 <b>반도체</b>·디스플레이, 미래모빌리티, 바이오, 에너지저장장치(ESS) 등 첨단 산업 및 미래 먹거리 분야 10개 기업을 선정해 지원할 방침이다. 특히 올해부터는 지역 균형 발전을 위해 지역 소재 중견기업에 대한... ","Sun, 05 Apr 2026 11:06:00 +0900"
2026-04-05 03:20:17,"전쟁에도 <b>반도체</b>로 간다…30억 자산가, 방산 팔고 삼성전자 쓸어담았다",https://www.ebn.co.kr/news/articleView.html?idxno=1704460,"아니라, <b>반도체</b>로 자금이 몰린 것이다. 특히 30억원 이상 자산을 운용하는 고액 자산가들의 선택은 더욱 뚜렷했다. 이들은 방산과 원전주를 정리하고, 삼성전자와 SK하이닉스를 중심으로 한 <b>반도체</b> 비중을 빠르게... ","Sun, 05 Apr 2026 11:06:00 +0900"
2026-04-05 03:20:17,美 아르테미스 2호 탑재 'K-라드큐브' 이틀째 교신 실패,https://n.news.naver.com/mnews/article/421/0008870494?sid=105,"지구를 둘러싼 밴앨런 복사대에서 우주 방사선을 고도별로 정밀 측정하는 것이 목표였다. 부탑재체로는 지구 고궤도 방사선 환경에서의 동작 검증을 위해 삼성전자, SK하이닉스의 <b>반도체</b>가 탑재됐다.","Sun, 05 Apr 2026 11:05:00 +0900"
2026-04-05 03:20:17,"삼성家, '12조 상속세' 납부 이달 마무리 수순",https://n.news.naver.com/mnews/article/277/0005745098?sid=101,"그간 경영 환경에 부담으로 작용했던 상속세와 지배구조 정비에 마침표를 찍고, 첨단 <b>반도체</b>·인공지능(AI), 바이오 등 미래 먹거리 발굴에 총력을 기울일 수 있을 것이란 관측이다. 특히 이재용 회장이 지난해 사법... ","Sun, 05 Apr 2026 11:02:00 +0900"
2026-04-05 03:20:17,"시야가 곧 자산…AI 스마트글래스, 1인칭 데이터 전쟁 시작",http://www.metroseoul.co.kr/article/20260405500103,"이들은 확장현실(XR) 플랫폼을 중심으로 하드웨어와 운영체제, <b>반도체</b>를 결합한 생태계 확장을 시도 중이다. 특히 삼성전자는 구글, 아이웨어 브랜드 젠틀몬스터와 협력해 디자인과 실용성을 모두 잡은 AI... ","Sun, 05 Apr 2026 11:02:00 +0900"
2026-04-05 03:20:17,"산업부, 中企 10곳 월드클래스 기업으로 키운다",https://n.news.naver.com/mnews/article/018/0006250401?sid=101,"올해는 <b>반도체</b>·디스플레이, 미래모빌리티, 바이오, 에너지저장장치(ESS) 등 분야의 10개 기업을 선정해 첨단산업 분야의 초격차 기술 확보를 지원한다. R&amp;D부터 금융·수출·컨설팅·인력·법률 등 기업 성장과 세계시장... ","Sun, 05 Apr 2026 11:02:00 +0900"
2026-04-05 03:20:17,"<b>반도체</b>·디스플레이 등 집중 지원...산업부, 중견기업 10곳 '월드클래스...",https://www.ajunews.com/view/20260405100741151,"<b>반도체</b>·바이오·미래모빌리티 등 첨단 분야를 중심으로 유망 기업을 선별해 연구개발부터 해외 진출까지... 올해는 <b>반도체</b>･디스플레이, 미래모빌리티, 바이오, 에너지저장장치(ESS) 등 분야의 10개 기업이 새롭게... ","Sun, 05 Apr 2026 11:02:00 +0900"
2026-04-05 03:20:17,"산업부, 중견기업 10곳 월드클래스 기업으로 육성",https://n.news.naver.com/mnews/article/119/0003077147?sid=101,"올해는 <b>반도체</b>·디스플레이, 미래모빌리티, 바이오, 에너지저장장치(ESS) 등 분야의 10개 기업을 선정해 첨단산업 분야의 초격차 기술 확보를 지원한다. 또 바이오, ESS 등 미래 먹거리 분야의 세계시장 선점도 지원해 나갈... ","Sun, 05 Apr 2026 11:01:00 +0900"
