DateTime,Title,Link,Description,PubDate
2025-10-08 05:22:50,"한국, 36년 만에 미 수입시장 10위로 '추락'…트럼프 관세 직격",https://n.news.naver.com/mnews/article/119/0003010948?sid=101,특히 파운드리(<b>반도체</b> 수탁생산) 부분에서 한국과 경쟁하는 대만의 경우 순위가 지난해 8위(3.6%)에서 올해... 수출품인 <b>반도체</b>의 경우 별도의 품목 관세 부과 대상이기 때문에 아직 수출에 직접적인 영향을 받지 않고... ,"Wed, 08 Oct 2025 14:22:00 +0900"
2025-10-08 05:22:50,"100% 자회사 품은 원익피앤이, 글로벌 전력장비 강자로 도약 예고",https://www.pinpointnews.co.kr/news/articleView.html?idxno=383298,"원익피앤이는 2차전지 테스트 장비, ESS용 전력변환장치, <b>반도체</b>·디스플레이 장비용 전원공급시스템(PSU) 등 다양한 산업에 진출해 있다. 전기차 충전 인프라 확대와 함께 배터리 관리 및 전력제어 기술 수요가 커지면서... ","Wed, 08 Oct 2025 14:20:00 +0900"
2025-10-08 05:22:50,"경북도, 국가 자동차산업 핵심 성장축 자리매김…모든 역량 집중",https://ilyo.co.kr/?ac=article_view&entry_id=500929,"여기에 <b>반도체</b>사 연계를 통한 전자제어장치(ECU) 개발 개방형 연구 공간 구축, 전자제어 하드웨어/소프트웨어 개발과 검증 장비구축, 산업육성과 제품화 지원 프로그램 운영을 통해 국내 전자제어 산업의 경쟁력을 한층... ","Wed, 08 Oct 2025 14:18:00 +0900"
2025-10-08 05:22:50,"대만 총통 &quot;트럼프, 中 침공 막으면 노벨평화상 확실&quot;",https://n.news.naver.com/mnews/article/014/0005416902?sid=104,한편 라이칭더는 트럼프 정부의 대만 <b>반도체</b> 공장 이전 요구에 대해 &quot;전체 <b>반도체</b> 생태계 이익의 80%가량은 미국으로 간다&quot;면서 &quot;미국이 여전히 이 생태계의 리더&quot;라고 평가했다. 라이칭더는 대만 대표 <b>반도체</b> 업체 TSMC의... ,"Wed, 08 Oct 2025 14:17:00 +0900"
2025-10-08 05:22:50,"WTO, 내년 세계 무역성장률 0.5%로 하향…트럼프 관세전쟁 여파",https://www.tfmedia.co.kr/news/article.html?no=196283,"올해 상반기 세계 상품 무역 규모는 작년 같은 기간보다 4.9% 증가했다. 이는 관세 발효 전 수출입 증가, <b>반도체</b> 등 인공지능(AI) 수요 확대 등에 따른 것으로 WTO는 분석했다. 미국 뉴저지 항구 포트 저지 터미널 [AFP/연합]","Wed, 08 Oct 2025 14:08:00 +0900"
2025-10-08 05:22:50,"'11만전자·50만닉스' 현실로?…삼성·SK, 3Q 동반 호실적 예고",https://n.news.naver.com/mnews/article/648/0000040550?sid=101,"글로벌 AI 투자 확대와 메모리 호황, 공격적 증설이 맞물리면서 <b>반도체</b> 슈퍼사이클의 '연장전'에 힘이 실리는 모양새다. 업계 관계자는 &quot;이번 호황은 단기 반짝이 아니라 AI 확산이라는 구조적 변화에 기반한 것... ","Wed, 08 Oct 2025 14:00:00 +0900"
2025-10-08 05:22:50,"퀄컴, '아두이노' 인수…로보틱스 생태계 확장 노리나",https://www.itbiznews.com/news/articleView.html?idxno=182853,[사진=로이터] 팹리스 <b>반도체</b> 기업 퀄컴테크날러지스가 아두이노(Arduino)를 인수한다. 아두이노는 시제품... 개발한 <b>반도체</b>는 대량 판매되는 특성으로 소규모 기업(스타트업)과 개발자의 접근이 어려웠다. 특히나 젠슨... ,"Wed, 08 Oct 2025 14:00:00 +0900"
2025-10-08 05:22:50,"퀄컴, 이탈리아 아두이노 인수 … 로보틱스 사업 대폭 강화",https://www.gokorea.kr/news/articleView.html?idxno=842334,"미국 <b>반도체</b> 대기업인 퀄컴이 이탈리아의 하드웨어 제조업체 아두이노를 인수하기로 결정했다고 7일 발표했다. 아두이노는 저비용 회로 기판을 생산하며 로보틱스 연구 및 시제품 제작에 널리 쓰이는 회사로, 이번 인수를... ","Wed, 08 Oct 2025 13:54:00 +0900"
2025-10-08 05:22:50,'코스닥 상장 도전' CMTX  &quot;램리서치 상대 특허분쟁 유리한 국면&quot;,http://www.thelec.kr/news/articleView.html?idxno=41898,CMTX (자료=구글맵) 코스닥 상장에 도전하는 <b>반도체</b> 식각 부품업체 CMTX가 &quot;램리서치 상대 특허분쟁이... CMTX는 이달 초 금융위원회에 제출한 증권신고서에서 &quot;램리서치가 지난해 10월 CMTX가 제조·판매하는 <b>반도체</b>... ,"Wed, 08 Oct 2025 13:52:00 +0900"
2025-10-08 05:22:50,WTO 2025년 세계 무역 성장률 전망 하향…&quot;관세전쟁 여파&quot;,https://n.news.naver.com/mnews/article/656/0000150488?sid=102,"9% 증가했다. WTO는 이에 대해 각국이 미국발 관세 인상에 대해 즉각적인 보복을 자제했고, <b>반도체</b> 등 인공지능(AI) 관련 수요 증가가 수출입 증가에 영향을 미쳤다고 분석했다.","Wed, 08 Oct 2025 13:40:00 +0900"
2025-10-08 05:22:50,"상아프론테크, '슈퍼엔지니어링 플라스틱'으로 산업 경계 허문다",https://www.pinpointnews.co.kr/news/articleView.html?idxno=383291,"2차전지·자동차·의료기기·<b>반도체</b>·프린터 등 다방면에 걸친 산업소재를 생산하며 기술 중심의 성장 전략을... 이 소재는 일반 플라스틱보다 내열성·내화학성·내마모성이 탁월해, 항공·자동차·의료·<b>반도체</b> 등 극한... ","Wed, 08 Oct 2025 13:38:00 +0900"
2025-10-08 05:22:50,"퀄컴, '개발자 요람' 아두이노 품었다…차세대 로보틱스 승부수",https://n.news.naver.com/mnews/article/015/0005194375?sid=104,미국 <b>반도체</b> 기업 퀄컴이 이탈리아 하드웨어 기업 아두이노를 인수한다고 7일(현지시간) 밝혔다. 퀄컴은 아두이노가 독립 자회사 형태로 운영될 것이라고 전했다. 인수 금액 등 구체적인 거래 조건은 공개되지 않았다.... ,"Wed, 08 Oct 2025 13:32:00 +0900"
2025-10-08 05:22:50,"[연재] NZSI INDEX 9월 26일 : 1358.52 (▽0.27%) 발표, 한국 증시 폭락, 자...",https://www.livesnews.com/news/article.html?no=55148,"<b>반도체</b>, 2차전지, 방산, AI 등 글로벌 경쟁력을 가진 산업이 여전히 존재하고, 기업의 실적도 회복세를 보이고 있다. 지금의 하락은 체계가 흔들린 것이 아니라 심리가 흔들린 것이다. 그러나 바로 그 심리의 틈을 자본은... ","Wed, 08 Oct 2025 13:32:00 +0900"
2025-10-08 05:22:50,"WTO, 내년 세계 무역성장률 1.8%→0.5% 하향… &quot;관세 전쟁 여파&quot;",https://n.news.naver.com/mnews/article/008/0005260486?sid=104,"특히 <b>반도체</b>, 서버, 통신 장비 등 AI 관련 상품이 상반기 전체 무역 증가의 절반 가까이 견인하며, 금액 기준 전년 동기 대비 20% 증가했다. 응고지 오콘조이웰라 WTO 사무총장은 &quot;관세 변화에 대한 각국의 측정된 대응, AI... ","Wed, 08 Oct 2025 13:24:00 +0900"
2025-10-08 05:22:50,대내외 불확실성에 빨라진 '인사 시계'…4대그룹 '인사태풍' 11월 유력,https://n.news.naver.com/mnews/article/119/0003010940?sid=101,<b>반도체</b> 사업을 담당하는 디바이스솔루(DS)부문의 경우 지난해 사업부장을 대거 교체하며 과감한 쇄신을 단행한 만큼 올해는 사업부장 라인에 큰 변화가 없을 것이라는 관측이 우세하다. 지난 3월 고(故) 한종희 대표이사... ,"Wed, 08 Oct 2025 13:18:00 +0900"
2025-10-08 05:22:50,[자막뉴스] &quot;나라 팔아먹는 수준&quot; 미국 충격 발언에 타이완 '쑥대밭',https://n.news.naver.com/mnews/article/052/0002256836?sid=104,"미국 내 <b>반도체</b> 생산을 늘리는 게 목표라면서 타이완 정부에 50대 50으로 생산을 나누는 방안을 제안했다고 밝혔습니다. 타이완 TSMC가 230조 원 규모의 대미 투자 계획을 발표했지만, 그걸로는 부족하다는 겁니다. <b>반도체</b>... ","Wed, 08 Oct 2025 13:18:00 +0900"
2025-10-08 05:22:50,젠슨 황이 말한 '행동하는 AI'…한국 제조업의 새 엔진 된다,http://www.thelec.kr/news/articleView.html?idxno=41894,"전문가들은 피지컬AI가 한국 제조업의 '두 번째 <b>반도체</b>'가 될 것으로 본다. 정부는 제조기업의 AI 보급률을 현재 4%에서 2030년까지 40%로 끌어올리겠다는 목표를 제시했다. 산업 현장의 자동화, AI가 직접 판단하고... ","Wed, 08 Oct 2025 13:08:00 +0900"
2025-10-08 05:22:50,불확실성 고조된 4대그룹…내달 ‘인사태풍’ 예의주시,https://n.news.naver.com/mnews/article/243/0000086090?sid=101,<b>반도체</b> 사업을 담당하는 디바이스솔루(DS)부문의 경우 지난해 사업부장을 대거 교체하며 과감한 쇄신을 단행한 만큼 올해는 사업부장 라인에 큰 변화가 없을 것이라는 관측이 우세하다. 디바이스경험(DX)부문장... ,"Wed, 08 Oct 2025 13:02:00 +0900"
2025-10-08 05:22:50,<b>반도체</b>·디스플레이 기술 中에 또 털렸다…연이은 기술 유출에 '골머리...,https://n.news.naver.com/mnews/article/011/0004541346?sid=101,글로벌 공급망의 핵심 품목인 <b>반도체</b>를 중심으로 디스플레이와 이차전지 등까지 유출대상 산업군도... “디스플레이가 <b>반도체</b> 다음으로 인력 등 부분에서 정보가 나가는 경우가 많기 때문에 정부가 나쁜 방향으로... ,"Wed, 08 Oct 2025 13:01:00 +0900"
2025-10-08 05:22:50,올해 127% 오른 SK하이닉스…‘주당 56만 원’ 전망도 나왔다 [이런국장...,https://n.news.naver.com/mnews/article/011/0004541347?sid=101,메모리 <b>반도체</b> 호황 사이클이 본격화할 것이란 전망에 힘입어 SK하이닉스(000660) 주가가 올 들어 두 배... SK하이닉스 주가의 가파른 상승은 고대역폭메모리(HBM) 중심의 인공지능(AI) 메모리 <b>반도체</b> 판매 호조에... ,"Wed, 08 Oct 2025 13:01:00 +0900"
2025-10-08 05:22:50,"[칼럼] <b>반도체</b> 주도 코스피 3,500 돌파, 증시 새 지평 넘어 구조 개혁 서...",https://www.jeonmae.co.kr/news/articleView.html?idxno=1191130,"함께 <b>반도체</b>주(株)를 이끄는 SK하이닉스도 사상 처음으로 9.86% 급등하며 전 거래일 대비 9.86%(3만 5,500원)... K<b>반도체</b>였다. 대한민국 국가 대표 <b>반도체</b> 기업인 삼성전자와 SK하이닉스가 미국 오픈AI와 손잡고 미국... ","Wed, 08 Oct 2025 13:00:00 +0900"
2025-10-08 05:22:50,AI투자 확산·정책 모멘텀 영향…증시 상승세 지속 전망[주간 증시 전망...,https://n.news.naver.com/mnews/article/014/0005416878?sid=101,"AI 관련 모멘텀은 <b>반도체</b> 업종 강세로 이어지고 있다. 오픈AI의 데이터센터 확충과 AI 인프라 투자 확대가 본격화되면서 고성능 메모리 수요가 늘고, <b>반도체</b> 공급망 전반에 대한 기대가 커지고 있다. 특히 SK하이닉스의... ","Wed, 08 Oct 2025 12:59:00 +0900"
2025-10-08 05:22:50,AI <b>반도체</b> ETF 초강세…수익률 상위 톱10 싹쓸이[ETF 스퀘어],https://n.news.naver.com/mnews/article/014/0005416877?sid=101,국내 상장지수펀드(ETF) 시장에서 인공지능(AI) <b>반도체</b> 테마가 압도적인 강세를 보였다. 상승률 상위 10개 ETF가 모두 <b>반도체</b>·AI 관련 상품으로 채워지며 테마 쏠림이 두드러졌다. 반면 미국 원유 생산 증가가... ,"Wed, 08 Oct 2025 12:56:00 +0900"
2025-10-08 05:22:50,"WTO, 내년 세계 무역성장률 1.8%→0.5% 하향…관세 영향",https://n.news.naver.com/mnews/article/003/0013525263?sid=104,"특히 <b>반도체</b>, 서버, 통신 장비 등 AI 관련 상품이 상반기 전체 무역 증가의 절반 가까이 견인하며, 금액 기준 전년 동기 대비 20% 증가했다. 응고지 오콘조이웰라 WTO 사무총장은 &quot;관세 변화에 대한 각국의 측정된 대응, AI... ","Wed, 08 Oct 2025 12:53:00 +0900"
2025-10-08 05:22:50,"[미국 증시 브리핑 · 10월 7일] 미국 증시, 다우존스·나스닥·S&amp;P 500 하...",http://www.newsbrite.net/news/articleView.html?idxno=193806,"<b>반도체</b> 지수는 각각 1.48%, 0.55%, 2.06% 하락했다. 다우운송 지수는 15,655.69포인트로 마감하며 234.67포인트 떨어졌고, 나스닥 100 지수는 24,840.23포인트로 138.33포인트 하락했다. 필라델피아 <b>반도체</b> 지수는... ","Wed, 08 Oct 2025 12:42:00 +0900"
2025-10-08 05:22:50,“AI 로봇이 일자리를 빼앗는다”..세계경제포럼이 분석한 ‘피지컬 AI’...,https://www.dailycar.co.kr/content/news.html?type=view&autoId=59361,"한국도 2025년 출범한 K-Humanoid Alliance를 통해 2028년까지 자체 휴머노이드 로봇 개발과 AI <b>반도체</b>, 로봇 기술 강화에 나서고 있다. 이런 상황에서 세계경제포럼(World Economic Forum)이 글로벌 컨설팅 회사인... ","Wed, 08 Oct 2025 12:42:00 +0900"
2025-10-08 05:22:50,"저스템, HBM용 초고집적 스택 장비 개발…글로벌 시장 공략",https://www.pinpointnews.co.kr/news/articleView.html?idxno=383283,<b>반도체</b> 장비 전문기업 저스템 주가가 강세를 보이고 있다. 8일 한국거래소에 따르면 전 거래일 12.95% 상승 1만... 저스템은 <b>반도체</b> 제조 과정에서 발생하는 불량률을 낮추고 생산 효율을 높이는 수율 향상 장비를 주력으로... ,"Wed, 08 Oct 2025 12:30:00 +0900"
2025-10-08 05:22:50,손범규 &quot;냉장고는 놔두고 철강부터 챙겨야&quot;,https://www.gukjenews.com/news/articleView.html?idxno=3396462,"손 대변인은 &quot;철강은 <b>반도체</b>·자동차와 함께 대한민국의 핵심 수출 품목&quot;이라며 &quot;대통령은 예능 프로그램에서 웃고 떠들 시간이 아니라, 국제 관세 협상에 직접 나서야 할 때&quot;라고 강조했다. 이어 &quot;국가정보자원관리원 참사... ","Wed, 08 Oct 2025 12:28:00 +0900"
2025-10-08 05:22:50,"WTO, 내년 세계 무역성장률 0.5%로 하향…트럼프 '관세 전쟁' 여파",https://n.news.naver.com/mnews/article/119/0003010935?sid=101,"특히 올해 상반기 세계 상품 무역 규모는 지난해 같은 기간보다 4.9% 증가했다. 관세 발효 전 수출입 증가, <b>반도체</b> 등 인공지능(AI) 수요 확대 등에 따른 것이라고 WTO는 분석했다.","Wed, 08 Oct 2025 12:25:00 +0900"
2025-10-08 05:22:50,한국 '트럼프 관세' 영향…미 수입 시장서 7→10위,https://www.econovill.com/news/articleView.html?idxno=714052,특히 파운드리(<b>반도체</b> 수탁생산) 부분에서 한국과 경쟁하는 대만의 경우 순위가 작년 8위(3.6%)에서 올해 1... 수출품인 <b>반도체</b>의 경우 별도의 품목 관세 부과 대상이기 때문에 아직 수출에 직접적인 영향을 받지 않고... ,"Wed, 08 Oct 2025 12:24:00 +0900"
2025-10-08 05:22:50,"타이거일렉, 첨단 <b>반도체</b> 검사용 PCB로 글로벌 시장 공략",https://www.pinpointnews.co.kr/news/articleView.html?idxno=383282,<b>반도체</b> 검사 공정용 PCB 전문기업으로 입지를 공고히 하면서 주가에 훈풍을 불어 넣고 있는 것으로... 이를 통해 글로벌 <b>반도체</b> 제조사들의 품질 검증과 생산 효율 향상에 기여하고 있다. 타이거일렉의 PCB는 단순한... ,"Wed, 08 Oct 2025 12:22:00 +0900"
2025-10-08 05:22:50,"이미지스, 터치·햅틱 IC 설계로 모바일 시장 공략 강화",https://www.pinpointnews.co.kr/news/articleView.html?idxno=383281,"<b>반도체</b> 설계 전문 팹리스 기업 이미지스 주가가 크게 오르고 있다. 8일 한국거래소에 따르면 전 거래일 7.96% 올라 1166원에 거래를 마감했다. 이미지스는 생산라인 없이 설계 기술 중심으로 <b>반도체</b>를 개발하고, 이를... ","Wed, 08 Oct 2025 12:14:00 +0900"
2025-10-08 05:22:50,"조수연 &quot;검찰청 졸속 폐지, 신뢰회복 해답 아냐&quot;",http://www.dtnews24.com/news/articleView.html?idxno=799173,기존에 추진했던 나노·<b>반도체</b> 국가산단 조성 등 대형사업의 중단·축소 위험이 (내년 선거의) 가장 큰 위험요소가 될 것이다. 이재명 정부에서 적극 지원해 주면 좋겠다.&quot; - 당 지지도 등을 고려하면 국민의힘이 불리한... ,"Wed, 08 Oct 2025 12:04:00 +0900"
2025-10-08 05:22:50,韓 '트럼프 관세' 영향 컸다,http://www.smedaily.co.kr/news/articleView.html?idxno=340063,"<b>반도체</b> 파운드리 부분에서 한국과 경쟁중인 대만의 경우 순위가 지난해 8위(3.6%)에서 올해 7월까지 5위(4.9... 대만은 미국과의 무역 합의가 완료되지 않아 20%의 상호관세를 적용받고 있지만, 주력 수출품인 <b>반도체</b>의... ","Wed, 08 Oct 2025 12:04:00 +0900"
2025-10-08 05:22:50,"극심한 불확실성 직면 삼성•SK•현대차•LG , 신상필벌 조기 인사태풍...",https://www.viva100.com/article/20251008500068,"<b>반도체</b> 사업을 담당하는 디바이스솔루션(DS) 부문은 지난해 대규모 쇄신을 거친 만큼 올해는 큰 변동이 없을 것이라는 관측이 우세하다. 반면, 고(故) 한종희 부회장 별세로 직무대행을 맡았던 노태문 사장은 이번 인사를... ","Wed, 08 Oct 2025 12:02:00 +0900"
2025-10-08 05:22:50,대규모 경상흑자에도…&quot;대미투자 불확실성에 외화 유출 압력↑&quot;,https://www.ajunews.com/view/20251002193714356,글로벌 투자은행은 향후에도 <b>반도체</b> 수출 호조에 의한 대규모 경상수지 흑자 기조가 유지될 걸로 전망했다. 특히 글로벌 <b>반도체</b> 경기 호조의 수혜가 이어지고 국내 기업들의 수출 다변화 노력이 성과를 나타내면서... ,"Wed, 08 Oct 2025 12:00:00 +0900"
2025-10-08 05:22:50,"HBM4 전쟁, 장비업체들로 확산…국내 4개사 출사표",https://n.news.naver.com/mnews/article/119/0003010928?sid=101,"경쟁이 <b>반도체</b> 제조사에서 패키징 장비업체로 번지고 있다. 차세대 HBM 공정에 투입되는 '하이브리드 본더' 개발을 두고 국내 장비업계의 판도 변화가 예고된다. 8일 업계에 따르면 한미<b>반도체</b>, 한화세미텍, 세메스... ","Wed, 08 Oct 2025 12:00:00 +0900"
2025-10-08 05:22:50,삼성·SK HBM 점유율 80%…한국의 저력 어디서 나오나,http://www.seoulwire.com/news/articleView.html?idxno=673861,이는 국제<b>반도체</b>표준협의기구 JEDEC의 HBM4 표준 동작 속도인 8Gbps를 크게 뛰어넘은 수치다. LS증권은... 지난해 9월 미국 투자은행(IB) 모건스탠리는 HBM만으로는 <b>반도체</b> 시장 호황을 이끌 수 없다는 내용의 '<b>반도체</b>... ,"Wed, 08 Oct 2025 12:00:00 +0900"
2025-10-08 05:22:50,"평택시, 하반기 적극행정 우수공무원 선발 시상",https://www.jeonmae.co.kr/news/articleView.html?idxno=1191128,"이번 수상에는 우수상을 받은 '운전면허 갱신 원스톱 처리', '삼성 <b>반도체</b> 전력 위기 해소' 등 시민 불편 최소화와 지역 현안 해결 성과 사례를 포함, 시민 체감도가 높은 다양한 정책 추진 사례들이 선정됐다. 정장선... ","Wed, 08 Oct 2025 11:58:00 +0900"
2025-10-08 05:22:50,"고속·대용량·다기능 PCB 선도…대덕전자, 첨단 기판 시장 점유율 확대",https://www.pinpointnews.co.kr/news/articleView.html?idxno=383279,"대덕전자는 비메모리·메모리 <b>반도체</b>용 패키지 기판과 AI 서버, 네트워크, 검사 장비 등 다양한 전자기기에 적용되는 MLB 를 주력으로 생산해 세계적 <b>반도체</b> 제조사와 IT기업에 공급, 실적개선 기대감이 주가에... ","Wed, 08 Oct 2025 11:56:00 +0900"
2025-10-08 05:22:50,젠슨 황 “H-1B 비자 전액 지원 유지”,https://n.news.naver.com/mnews/article/009/0005570071?sid=105,H-1B 비자는 미국 기업이 해외 인재를 채용할 때 주로 사용하는 전문직 취업비자로 실리콘밸리 주요 기술기업들이 인공지능(AI)·<b>반도체</b> 인력을 유치하는 핵심 통로로 꼽힌다. 엔비디아는 올해 약 1500건의 H-1B 비자를... ,"Wed, 08 Oct 2025 11:52:00 +0900"
2025-10-08 05:22:50,"큐알티, 고객 맞춤형 시험 솔루션으로 <b>반도체</b> 신뢰성 검증 선도",https://www.pinpointnews.co.kr/news/articleView.html?idxno=383278,<b>반도체</b> 신뢰성 평가·분석 전문기업 큐알티 주가가 환호하고 있다. 8일 한국거래소에 따르면 전 거래일 8.40% 올라 1만 8460원에 거래를 마감했다. 큐알티가 국내 시장에서 독보적인 위치를 차지해 글로벌 <b>반도체</b> 기업들의... ,"Wed, 08 Oct 2025 11:46:00 +0900"
2025-10-08 05:22:50,"경북도, 1800개 부품기업과 손잡고 '미래차 중심지' 도약 선언",https://www.kyongbuk.co.kr/news/articleView.html?idxno=4053629,경산에서는 자동차의 두뇌 역할을 하는 전자제어장치(ECU) 연구공간과 검증 장비를 구축해 <b>반도체</b> 연계형 부품 개발을 지원한다. 김천에서는 내연기관 차량을 전기차로 바꾸는 기술과 튜닝 안전검사 실증을 통해 국내... ,"Wed, 08 Oct 2025 11:44:00 +0900"
2025-10-08 05:22:50,"WTO, 내년 세계 무역성장률 0.5%로 하향…트럼프 관세전쟁 여파",https://n.news.naver.com/mnews/article/448/0000562111?sid=104,"특히 올해 상반기 세계 상품 무역 규모는 작년 같은 기간보다 4.9% 증가했다. 이는 관세 발효 전 수출입 증가, <b>반도체</b> 등 인공지능(AI) 수요 확대 등에 따른 것으로 WTO는 분석했다.","Wed, 08 Oct 2025 11:43:00 +0900"
2025-10-08 05:22:50,"머스크 xAI, 엔비디아 참여 속 자금 조달 최대 200억 달러로 확대",https://www.newspim.com/news/view/20251008000040,"이번 주 초에는 오픈AI가 AMD <b>반도체</b>를 향후 수년간 사용하는 계약을 체결했으며, 메타플랫폼스도 최근 몇 달 사이 290억 달러 규모 데이터센터 금융 계약을 포함한 여러 건의 대형 자금 조달을 진행했다. 오라클... ","Wed, 08 Oct 2025 11:40:00 +0900"
2025-10-08 05:22:50,"관세 영향…한국, 미 수입시장 세 계단↓ 10위·88년 이후 최저",https://n.news.naver.com/mnews/article/437/0000459646?sid=101,"대만 역시 20% 상호관세를 받고 있지만, 주력 수출품인 <b>반도체</b>가 별도 분류로 관세 부과에서 제외돼 상대적으로 영향이 적었습니다. 반면 한국은 자동차, 철강, 기계 등 주력 품목이 고율 관세 대상에 포함돼 타격이... ","Wed, 08 Oct 2025 11:36:00 +0900"
2025-10-08 05:22:50,"한국, '트럼프 관세' 직격탄…미 수입시장서 7→10위 하락",https://n.news.naver.com/mnews/article/082/0001348091?sid=101,특히 파운드리(<b>반도체</b> 수탁생산) 부분에서 한국과 경쟁하는 대만의 경우 순위가 작년 8위(3.6%)에서 올해 1... 수출품인 <b>반도체</b>의 경우 별도의 품목 관세 부과 대상이기 때문에 아직 수출에 직접적인 영향을 받지 않고... ,"Wed, 08 Oct 2025 11:36:00 +0900"
2025-10-08 05:22:50,클라우드와 엣지 시대의 AI <b>반도체</b> 혁신과 지속가능성,http://www.ifs.or.kr/bbs/board.php?bo_table=News&wr_id=55291,AI 시대의 도래와 컴퓨팅 환경의 확장 인공지능(AI) 시대의 도래와 함께 AI <b>반도체</b>는 디지털 인프라의 핵심으로 부상했다. AI <b>반도체</b>의 정의는 조사기관마다 다소 차이가 있으나... ,"Wed, 08 Oct 2025 11:36:00 +0900"
2025-10-08 05:22:50,"<b>반도체</b> 장비 국산화·첨단화…피에스케이, 기술 혁신으로 성장 견인",https://www.pinpointnews.co.kr/news/articleView.html?idxno=383276,"<b>반도체</b> 제조용 장비 전문기업 피에스케이 주가가 강세를 보이고 있다. 8일 한국거래소에 따르면, 전 거래일... 국내외 시장에서 입지를 넓히며 첨단 <b>반도체</b> 장비 전문기업으로 자리매김하고 있다. 2019년... ","Wed, 08 Oct 2025 11:34:00 +0900"
2025-10-08 05:22:50,"WTO, 내년 세계 무역성장률 1.8%→0.5% 대폭 하향 조정",https://weeklytrade.co.kr/news/view.html?section=1&category=136&item=&no=96824,"특히 올해 상반기 세계 상품 무역 규모는 작년 같은 기간보다 4.9% 증가했다.이는 관세 발효 전 수출입 증가, <b>반도체</b> 등 인공지능(AI) 수요 확대 등에 따른 것으로 WTO는 분석했다.이용석 기자","Wed, 08 Oct 2025 11:30:00 +0900"
