DateTime,Title,Link,Description,PubDate
2025-10-31 08:31:56,"SK그룹, 엔비디아 기반 '제조 AI 클라우드' 구축…생태계 활성화",https://www.100ssd.co.kr/news/articleView.html?idxno=202388,"및 <b>반도체</b> 협력과 국내 제조 AI 생태계 발전 방향에 대해 의견을 나눴다. 엔비디아 옴니버스 기반 제조 AI... 용인<b>반도체</b>클러스터에서 활용할 수 있도록 SK텔레콤이 구축과 운영, 서비스를 맡게 된다. SK는 국내... ","Fri, 31 Oct 2025 17:30:00 +0900"
2025-10-31 08:31:56,김해~밀양 등 4개 고속도로 예타 통과…영호남·수도권 교통망 강화,https://n.news.naver.com/mnews/article/421/0008577730?sid=101,"확장 시 지정체 해소(LOS E→C~D)와 함께 세종 행정수도, 대전 나노·<b>반도체</b> 국가산단, 세종 스마트 국가산단 등 대규모 개발계획의 교통수요에 능동적으로 대응할 수 있게 됐다. 무주~대구 고속도로, 동서 간 고속교통축... ","Fri, 31 Oct 2025 17:30:00 +0900"
2025-10-31 08:31:56,"엔비디아, SK그룹과 AI 팩토리 구축···국내 제조·디지털 가속화",https://www.ziksir.com/news/articleView.html?idxno=110267,"엔비디아가 SK그룹과 협력해 <b>반도체</b> 연구, 개발, 생산을 가속화하고, 디지털 트윈, AI 에이전트 개발을 지원하는 클라우드 인프라 마련을 위한 AI 팩토리를 구축한다. [엔비디아]  엔비디아가 SK그룹과 협력해 <b>반도체</b>... ","Fri, 31 Oct 2025 17:30:00 +0900"
2025-10-31 08:31:56,김해~밀양 등 4개 고속도로 사업 예타 통과 및 대상 선정...교통 정체 해...,https://n.news.naver.com/mnews/article/014/0005427912?sid=101,"확장 시 정체 해소와 함께 세종 행정수도, 대전 나노·<b>반도체</b> 국가산단, 세종 스마트 국가산단 등 대규모 개발계획의 교통수요에 능동적으로 대응할 수 있을 것으로 관측된다. 또 대전·세종 간 통근·경제·문화 활동의... ","Fri, 31 Oct 2025 17:30:00 +0900"
2025-10-31 08:31:56,"[퇴근길포인트] 李대통령, 젠슨 황에 &quot;한국 AI강국 되로록 역할 해달라...",https://www.pointdaily.co.kr/news/articleView.html?idxno=277476,<b>반도체</b>에도 대만과 비교해 불리하지 않은 수준의 관세를 적용하기로 했다. 한국의 대미 투자금 3500억 달러 중 2000억 달러를 연 200억 달러 한도로 분할 투자하기로도 했다. 이 대통령은 기업인들의 노고를 언급하며 &quot;경제... ,"Fri, 31 Oct 2025 17:30:00 +0900"
2025-10-31 08:31:56,엔비디아 &quot;한국 정부·기업과 AI 인프라·생태계 구축 나선다&quot;,https://www.datanet.co.kr/news/articleView.html?idxno=206470,"자동차, <b>반도체</b>, 전자제품으로 세계에 영감을 주었듯 이제는 인텔리전스라는 새로운 수출품을 생산하며... 정교한 <b>반도체</b> 제조 공정의 속도와 수율을 개선하는 디지털 트윈을 구축한다. 또 엔비디아 코스모스... ","Fri, 31 Oct 2025 17:30:00 +0900"
2025-10-31 08:31:56,"이재명 대통령, 경주 APEC서 글로벌 경제·AI 구상 총집결…IMF·엔비디아...",https://www.eroun.net/news/articleView.html?idxno=66056,"또한 이 대통령은 글로벌 무역 둔화, <b>반도체</b> 수요 조정, 지정학적 리스크, 고령화, 잠재성장률 둔화 등... 삼성전자는 엔비디아의 Omniverse, cuLitho, Isaac Sim 등의 기술을 적용한 <b>반도체</b> AI 팩토리를 구축하고, SK그룹은 RTX... ","Fri, 31 Oct 2025 17:30:00 +0900"
2025-10-31 08:31:56,"[경주 APEC] 엔비디아, 경주 입성···젠슨 황 &quot;삼성전자와 함께 한국 A...",https://www.ajunews.com/view/20251031170701679,[사진=연합뉴스] 젠슨 황 엔비디아 최고경영자(CEO)가 &quot;삼성전자는 <b>반도체</b> 제조에 있어서 첫 번째 파트너&quot;라며 &quot;향후 파트너십을 엄청나게 확장해 나갈 것&quot;이라고 강조했다. 젠슨 황 CEO는 31일 경북 경주에서 열린... ,"Fri, 31 Oct 2025 17:30:00 +0900"
2025-10-31 08:31:56,"두산테스나, 신임 CEO에 '재무·전략통' 김윤건 대표 선임",https://www.sisajournal-e.com/news/articleView.html?idxno=416566,<b>반도체</b> 테스트 사업의 내실 강화와 중장기 성장 전략을 병행하기 위한 인사로 풀이된다. 두산테스나는 31일 이사회를 열고 김윤건 CFO를 신임 CEO로 선임했다고 밝혔다. 김 대표는 CEO와 CFO직을 겸직하며 회사의 경영... ,"Fri, 31 Oct 2025 17:30:00 +0900"
2025-10-31 08:31:56,"제주<b>반도체</b> 주가 10월 31일 20,550원 강보합세 마감",https://www.job-post.co.kr/news/articleView.html?idxno=186410,"제주<b>반도체</b>는 지난 종가 대비 0.49% 상승한 20,550원에 거래를 마감했다. 이는 지난 종가 20,450원보다 100원 오른 금액이다. 출처 : 네이버페이 증권 시가 20,350원으로 시작한 제주<b>반도체</b>는 하루동안 고가 20... ","Fri, 31 Oct 2025 17:30:00 +0900"
2025-10-31 08:31:56,"iM금융, 5년간 생산적금융에 45조 공급",https://www.fetv.co.kr/news/article.html?no=204543,대구시와 경북도가 추진하는 미래모빌리티·로봇·헬스케어·<b>반도체</b>·ABB 등 5대 신산업과 이차전지·소부장·에너지·바이오·방위산업 등 전략산업을 적극 지원한다. 또한 혁신기업 성장 단계별 지원 플랫폼인 피움랩... ,"Fri, 31 Oct 2025 17:30:00 +0900"
2025-10-31 08:31:56,"삼성전자, 엔비디아와 '<b>반도체</b> AI 팩토리' 구축…<b>반도체</b> 시장 새로운 패...",http://www.metroseoul.co.kr/article/20251031500230,삼성전자가 엔비디아와 함께 <b>반도체</b> 제조의 새로운 변화를 이끌어 낸다. 삼성전자는 엔비디아와의 전략적 협력을 통해 <b>반도체</b> 제조의 새로운 패러다임을 제시할 '<b>반도체</b> AI 팩토리'를 구축한다고 31일 밝혔다.... ,"Fri, 31 Oct 2025 17:30:00 +0900"
2025-10-31 08:31:56,평택에 문 연 신상 호텔 ‘코트야드 메리어트 평택’ 투숙기,http://digitalchosun.dizzo.com/site/data/html_dir/2025/10/31/2025103180212.html,"평택제천고속도로를 달리는 차량 소리와 인근 삼성 <b>반도체</b> 공장의 풍경 속에서, 이 호텔은 과거와 현재, 한국과 세계를 연결하는 독특한 공간으로 자리하고 있었다. 평택이 국제 도시로 성장하는 과정에서 코트야드... ","Fri, 31 Oct 2025 17:30:00 +0900"
2025-10-31 08:31:56,[ETF줍줍] 힌국투자신탁·한화자산·신한자산운용 외,http://www.newsprime.co.kr/news/article.html?no=709909,AI <b>반도체</b> 1위 기업인 엔비디아는 2분기 실적이 시장 전망을 상회하는 등 기대에 상회하는 성과를... ◆한화운용 'PLUS ETF' 국내·해외 ETF 수익률 1위 한화자산운용의 'PLUS K방산'과 'PLUS 글로벌HBM<b>반도체</b>' ETF가 각각... ,"Fri, 31 Oct 2025 17:30:00 +0900"
2025-10-31 08:31:56,"현대차그룹, 엔비디아와 AI 기반 모빌리티 설루션 강화",http://www.metroseoul.co.kr/article/20251031500232,"우선 양사는 모빌리티 설루션, 차세대 스마트 팩토리, 온디바이스 <b>반도체</b> 혁신을 위한 AI 역량을 함께 높이고 미래 경쟁력 강화에 나선다. 이와 관련 현대차그룹과 엔비디아는 5만 장의 블랙웰 GPU를 활용해 통합 AI... ","Fri, 31 Oct 2025 17:30:00 +0900"
2025-10-31 08:31:56,"부산 수출, 9월 들어 한 달 만에 반등…“실물 중심 회복세 뚜렷”",https://www.cnbnews.com/news/article.html?no=758432,자동차 수출도 <b>반도체</b> 수급 정상화와 신차 선적 확대로 49.1% 늘었다. 전기·전자제품은 IT 경기 저점 통과에 따른 부품·소재 수요 회복과 희토류·핵심소재 관련 리스크에 대비한 선제 출하가 겹쳐 36.8% 증가했다. 화장품... ,"Fri, 31 Oct 2025 17:30:00 +0900"
2025-10-31 08:31:56,"팀네이버, 엔비디아와 손잡고 대한민국 제조산업 AI 전환 본격화",http://www.finomy.com/news/articleView.html?idxno=242069,"이를 통해 <b>반도체</b>·조선·에너지 등 국가 주력 산업 중심으로 AI 인프라를 구축하고, 산업 현장에 특화된 AI 솔루션을 제공할 계획이다. '피지컬 AI 플랫폼'은 현실 산업 환경을 가상 공간에서 정밀하게 재현하고, AI가... ","Fri, 31 Oct 2025 17:30:00 +0900"
2025-10-31 08:31:56,최태원 &quot;제조AI에 스타트업 인센티브&quot; 정의선 &quot;피지컬 AI 활성화&quot;,https://n.news.naver.com/mnews/article/421/0008577727?sid=100,"이 회장은 &quot;삼성과 엔비디아는 25년 넘게 같이 일을 하고 있는데, 엔비디아의 생성형 AI는 물론 옴니버스, <b>반도체</b>, AI 팩토리, 로보틱스, AI 램 네트워크를 비롯해 다양한 분야로 협력을 확대할 계획&quot;이라며 &quot;이 자리를... ","Fri, 31 Oct 2025 17:29:00 +0900"
2025-10-31 08:31:56,"삼성전자, 엔비디아와 전략적 협력...HBM4 공급 확대와 GPU 5만 개 투입,...",https://www.aitimes.kr/news/articleView.html?idxno=37003,"통해 <b>반도체</b> 제조의 새 시대를 열 '<b>반도체</b> AI 팩토리'를 구축한다고 31일, 밝혔다. 메모리, 시스템 <b>반도체</b>, 파운드리를 아우르는 업계 최대 제조 역량을 가진 삼성전자와 엔비디아의 GPU 기반 AI 기술이 만나 '업계 최고... ","Fri, 31 Oct 2025 17:28:00 +0900"
2025-10-31 08:31:56,"한투운용, ACE 엔비디아채권혼합 ETF 순자산 2500억 돌파",https://n.news.naver.com/mnews/article/009/0005582688?sid=101,남용수 한국투자신탁운용 ETF운용본부장은 “글로벌 AI <b>반도체</b> 1위 기업인 엔비디아는 2분기 실적이 시장 전망을 상회하는 등 기대를 뛰어넘는 성과를 보이고 있다”며 “ACE 엔비디아채권혼합 ETF는 퇴직연금... ,"Fri, 31 Oct 2025 17:28:00 +0900"
2025-10-31 08:31:56,"거침없는 코스피 4100 돌파, 삼성전자 11만 원 코앞",https://n.news.naver.com/mnews/article/037/0000037174?sid=101,"이를 <b>반도체</b> 공장에 설치해 설계부터 생산까지 전 과정이 AI로 구동되는 '<b>반도체</b> AI 팩토리'를 구축하기로 했다. 나아가 AI 모델부터 휴머노이드 로봇, 피지컬 AI 기반 지능형 기지국까지 협력 범위를 전방위로... ","Fri, 31 Oct 2025 17:28:00 +0900"
2025-10-31 08:31:56,"'2025 APEC CEO 서밋' 성황리 폐막…최태원 회장, 담론 넘어 실천의 '3C' ...",https://www.smarttoday.co.kr/news/articleView.html?idxno=95092,"청정에너지, <b>반도체</b>, 수소, 원자력 등 미래산업 분야에서 더 많은 비즈니스 기회가 생겨날 것에 대한 기대가 담겨있다. 마지막으로 '미래에 대한 실천 약속(Commit to Tomorrow)'을 다짐했다. AI 혁신, 에너지 전환... ","Fri, 31 Oct 2025 17:28:00 +0900"
2025-10-31 08:31:56,"에이아이비즈, 美 ‘테크크런치 디스럽트’서 <b>반도체</b> AI 진단 기술 공개",https://n.news.naver.com/mnews/article/008/0005271702?sid=101,2025)'에서 <b>반도체</b> 공정 이상 진단 기술을 선보였다고 31일 밝혔다. 이 행사는 전 세계 혁신 스타트업과... 회사는 <b>반도체</b> 제조 공정 내 이상 신호를 실시간 감지하고 원인을 분석하는 AI 솔루션 '더치보이(DutchBoy)... ,"Fri, 31 Oct 2025 17:28:00 +0900"
2025-10-31 08:31:56,"[APEC 2025] 젠슨 황 &quot;韓, SW·제조·AI 역량 갖춰…많은 친구들 있어&quot;",https://n.news.naver.com/mnews/article/119/0003019484?sid=101,"삼성전자는 엔비디아와 손잡고 <b>반도체</b> AI 팩토리 구축 프로젝트를 본격화한다. 약 5만 개의 GPU를 기반으로 <b>반도체</b> 제조 전 과정의 디지털 트윈(Digital Twin)을 구현하고, 공정 효율을 극대화하는 지능형 제조 혁신... ","Fri, 31 Oct 2025 17:28:00 +0900"
2025-10-31 08:31:56,최윤범 고려아연 회장 “중장기 전략광물 공급망 리스크 해소”… APEC서...,https://n.news.naver.com/mnews/article/020/0003671247?sid=101,"맷 가먼 아마존웹서비스(AWS) CEO를 비롯해 김정관 산업통상자원부 장관, 이재용 삼성전자 회장, 정기선 HD현대 회장, 김동관 한화 부회장 등이 참석해 전략광물·에너지·<b>반도체</b>·방산 분야 협력 방안을 집중 논의했다. 최... ","Fri, 31 Oct 2025 17:27:00 +0900"
2025-10-31 08:31:56,中·네덜란드 '넥스페리아 갈등'…글로벌 車업계 생산중단 공포,https://n.news.naver.com/mnews/article/015/0005205296?sid=104,차량용 <b>반도체</b> 회사 넥스페리아가 ‘뜨거운 감자’다. 네덜란드 정부가 넥스페리아 모회사인 중국 윙테크의 경영권을 박탈하자 중국이 넥스페리아의 중국 자회사 수출을 막으면서다. 차량용 <b>반도체</b> 공급에 차질이 생겨... ,"Fri, 31 Oct 2025 17:27:00 +0900"
2025-10-31 08:31:56,"삼성전자, 엔비디아와 ‘<b>반도체</b> 특화 AI 팩토리’ 구축…HBM4 출격 준비...",https://n.news.naver.com/mnews/article/025/0003479563?sid=101,"삼성전자가 엔비디아와 손잡고 인공지능(AI) 기술을 활용한 <b>반도체</b> 제조 혁신에 나선다. 엔비디아의 그래픽처리장치(GPU)로 업계 최대 규모 ‘<b>반도체</b> AI 팩토리’를 구축하고, 고대역폭메모리(HBM) 공급에 이어... ","Fri, 31 Oct 2025 17:27:00 +0900"
2025-10-31 08:31:56,정의선 &quot;관세에 감사&quot;... 이 대통령 &quot;현대차 잘돼야 한국이 잘된다&quot;,https://n.news.naver.com/mnews/article/469/0000895040?sid=100,"투자하고, 미국이 25%의 자동차 관세를 15%로 낮추기로 합의했다. <b>반도체</b>의 경우 우리와 경쟁국인 대만에 불리하지 않은 수준의 관세를 적용받기로 했다. 자동차는 현대차그룹, <b>반도체</b>는 삼성전자와 SK그룹의 주력 상품이다.","Fri, 31 Oct 2025 17:27:00 +0900"
2025-10-31 08:31:56,[현장연결] 젠슨 황 만난 이 대통령…&quot;AI 사업하기 가장 좋은 나라&quot;,https://n.news.naver.com/mnews/article/422/0000796863?sid=100,"제조업, <b>반도체</b>, 가전까지 많은 발표할 것&quot; &quot;한국의 AI 여정에 함께 하게 될 것…기대 크다&quot; &quot;어제 도착한 후부터 무엇을 발표할 거냐는 질문 받아&quot; &quot;답변은 제가 아니라 대통령께서 내일 발표할 것&quot; &quot;앞으로 한국에 굉장히... ","Fri, 31 Oct 2025 17:26:00 +0900"
2025-10-31 08:31:56,젠슨 황 손잡은 SK 최태원 회장...엔비디아 기반 제조 AI 클라우드 구축,https://www.job-post.co.kr/news/articleView.html?idxno=186401,"최태원 SK그룹 회장은 지난해 4월 24일(현지 시간) 미국 실리콘밸리를 찾아 미국 <b>반도체</b> 기업 엔비디아의... 및 <b>반도체</b> 협력과 국내 제조 AI 생태계 발전 방향에 대해 의견을 나눴다. 제조 AI는 자동차, 로봇 등 물리적... ","Fri, 31 Oct 2025 17:26:00 +0900"
2025-10-31 08:31:56,'깐부 동맹이 현실로'...<b>반도체</b> AI 팩토리 구축한 삼성전자·엔비디아,https://www.job-post.co.kr/news/articleView.html?idxno=186387,출처: 연합뉴스TV 캡처 삼성전자와 엔비디아가 업계 최대 수준의 '<b>반도체</b> 인공지능(AI) 팩토리'를 공동 구축한다. <b>반도체</b> 제조 과정에서 생성되는 데이터를 실시간으로 학습·판단하는 지능형 제조 혁신 플랫폼을... ,"Fri, 31 Oct 2025 17:26:00 +0900"
2025-10-31 08:31:56,국힘 &quot;한미 관세 협상 불확실성 여전…합의문 공개해야&quot;,https://www.obsnews.co.kr/news/articleView.html?idxno=1502301,"김 의장은 &quot;협상 발표문에는 대미 투자 프로젝트의 선정 기준, 투자금 회수 구조, 수익 배분 방식 등 핵심 내용이 빠져있다&quot;며 &quot;특히 자동차 관세의 명확한 인하 시점과 소급 적용 여부가 확정되지 않았고 <b>반도체</b> 품목 관세에... ","Fri, 31 Oct 2025 17:26:00 +0900"
2025-10-31 08:31:56,‘14조 규모’ GPU 공급 약속한 젠슨 황…“韓 ‘AI주권국’될 것”(종합...,https://n.news.naver.com/mnews/article/018/0006153016?sid=101,황 CEO는 또 “SK그룹은 HBM(고대역폭 메모리) 기반 <b>반도체</b> 연구·생산을 위한 산업용 클라우드 인프라를... 황 CEO는 또 기존 <b>반도체</b> 발전의 원리인 ‘무어의 법칙’이 한계에 도달했다고 진단했다. 그는 “무어의... ,"Fri, 31 Oct 2025 17:25:00 +0900"
2025-10-31 08:31:56,"이재용, 李대통령에 &quot;韓 글로벌 선도강국 되도록 삼성도 노력&quot;",https://n.news.naver.com/mnews/article/656/0000153666?sid=101,"이 회장은 &quot;삼성은 엔비디아의 생성형 AI는 물론, 옴니버스와 <b>반도체</b>, AI 팩토리, 로보틱스, AI-RAN 네트워크를 비롯해 다양한 분야로 협력을 확대할 계획&quot;이라고 설명했다. 최태원 SK그룹 회장은 &quot;건의를 하나 드리면... ","Fri, 31 Oct 2025 17:25:00 +0900"
2025-10-31 08:31:56,"현대엔지니어링, 기업형 민간임대주택 '힐스테이트 용인포레' 공급",http://www.m-i.kr/news/articleView.html?idxno=1297918,"여기에 용인역삼도시개발, SK하이닉스 <b>반도체</b> 클러스터 및 용인 첨단 시스템<b>반도체</b> 국가산업단지 등 대규모 개발 호재도 예정돼 있어 미래가치가 높다는 평가다. 힐스테이트 용인포레의 정식 사용 승인은 주출입도로... ","Fri, 31 Oct 2025 17:24:00 +0900"
2025-10-31 08:31:56,"[APEC 2025]삼성전자-엔비디아, 업계 최고 수준 ‘<b>반도체</b> AI 팩토리’ 구...",https://www.inthenews.co.kr/news/article.html?no=78746,"통해 '<b>반도체</b> AI 팩토리'를 구축한다고 밝혔습니다. 삼성전자는 종합<b>반도체</b> 기업으로서의 역량과 엔비디아의 GPU 기반  AI 기술의 시너지를 통해 업계 최고 수준의 '<b>반도체</b> AI 팩토리'를 구축, <b>반도체</b>를 비롯한 글로벌... ","Fri, 31 Oct 2025 17:24:00 +0900"
2025-10-31 08:31:56,"삼성전자, HBM4 납품도 유력…내년 메모리 왕좌 되찾는다",https://n.news.naver.com/mnews/article/015/0005205290?sid=101,삼성전자의 HBM4 공급 가시화는 SK하이닉스를 따라잡는 것을 넘어 메모리 <b>반도체</b> 왕좌를 되찾기 위한 신호탄이 될 것이라는 분석이다. 삼성 전략의 핵심에는 SK하이닉스보다 한 세대 앞선 D램 공정을 도입한 기술적... ,"Fri, 31 Oct 2025 17:24:00 +0900"
2025-10-31 08:31:56,"이 대통령, 젠슨 황 접견…&quot;아·태지역 'AI 수도' 함께 만들어가자&quot;",https://www.korea.kr/news/policyNewsView.do?newsId=148953630&call_from=naver_news,SK 및 삼성전자는 엔비디아의 GPU를 이용해 <b>반도체</b> 생산 공정 개선을 위한 디지털 트윈 구축 등 피지컬 AI에 적극 투자한다. HBM 공급 확대 등 우리 기업과 엔비디아의 파트너십을 강화하기 위한 방안도 논의됐다. 이재명... ,"Fri, 31 Oct 2025 17:23:00 +0900"
2025-10-31 08:31:56,"미중 수출통제 유예에…네덜란드, 넥스페리아 문제 '난처'(종합)",https://n.news.naver.com/mnews/article/001/0015716549?sid=104,발맞춰 <b>반도체</b> 기업 넥스페리아에 개입한 네덜란드 정부가 난처한 처지에 놓이게 됐다는 평가가 나온다.... <b>반도체</b>업계 매체 이트렌드닷컴의 장궈빈 창업자는 &quot;중국이 미국 정책에 (희토류라는) 효과적인 대응 수단을... ,"Fri, 31 Oct 2025 17:23:00 +0900"
2025-10-31 08:31:56,"네이버, 엔비디아와 산업현장용 AI 플랫폼 만든다",https://n.news.naver.com/mnews/article/011/0004550412?sid=105,두 회사가 함께 개발할 피지컬 AI 플랫폼은 <b>반도체</b>나 조선·에너지 등 우리나라 주력산업 현장에 적용하는 것을 목표로 한다. 이 플랫폼을 기반으로 조선소 등 현장에서 AI 로봇 등이 작동하는 구조다. 이해진 네이버... ,"Fri, 31 Oct 2025 17:23:00 +0900"
2025-10-31 08:31:56,최태원 “AI 양극화 격차 좁히자”…CEO 서밋 폐막 [경주 APEC],https://www.etoday.co.kr/news/view/2520940,"그는 “두 번째는 ‘구체적 가치(Concrete value)’로, 청정에너지·<b>반도체</b>·수소·원자력 산업 같은 분야에서 새로운 기회를 만들어야 한다”며 “마지막은 ‘실행(Commit)’으로, APEC은 단순한 토론의 장이 아니라... ","Fri, 31 Oct 2025 17:22:00 +0900"
2025-10-31 08:31:56,[증시리뷰] 지수 고공행진 때 개인은 ‘팔자’…“11월엔 중소형주 노려...,https://www.ekn.kr/web/view.php?key=20251031024032151,<b>반도체</b>와 이차전지 업종에 집중적으로 투자한 외국인과 기관 투자자 수익은 개인보다 훨씬 높았다.... 반면 외국인과 기관은 <b>반도체</b> 관련 대형주를 중심으로 꾸준히 사들여 지수를 4000선까지 밀어 올렸다. 이달... ,"Fri, 31 Oct 2025 17:22:00 +0900"
2025-10-31 08:31:56,"팀네이버, 엔비디아와 대한민국 제조산업 AI 전환",http://www.newsprime.co.kr/news/article.html?no=709902,"<b>반도체</b>·조선·에너지 등 국가 주력 산업을 중심으로 AI 인프라를 구축해 산업 현장의 AI 활용을 지원할 계획이다. 네이버클라우드는 이를 통해 조선, 에너지 등 주요 산업별 특화 AI 적용 모델을 발굴하고 확산을 주도해... ","Fri, 31 Oct 2025 17:22:00 +0900"
2025-10-31 08:31:56,'엔비디아 깐부'에 삼성·현대차 급등...코스닥 900선 탈환,https://news.ifm.kr/news/articleView.html?idxno=456186,"8%) 등 비만치료제 관련주가 강세를 보였습니다. 미국 빅테크의 공격적인 AI 투자가 재확인되면서 국내 <b>반도체</b>, 전력기기 등 AI 인프라 관련주의 강세가 이어질 것이란 전망이 나옵니다.","Fri, 31 Oct 2025 17:22:00 +0900"
2025-10-31 08:31:56,[31일 마감]젠슨 황이 불러온 AI 밸류체인 강세... 코스닥 900선 회복,http://www.globalepic.co.kr/view.php?ud=2025103117163929465ebfd494dd_29,"신한투자증권 강진혁 애널리스트는 &quot;미국 빅테크 실적 발표 후 공통적으로 AI CapEx의 공격적인 상향이 나타났다&quot;며 &quot;국내 <b>반도체</b>, 전력기기 등 AI 인프라 관련 종목들의 강세가 이어질 수 있는 환경&quot;이라고... ","Fri, 31 Oct 2025 17:22:00 +0900"
2025-10-31 08:31:56,"[속보] 시진핑-다카이치, 경주서 중일 정상회담 시작",https://n.news.naver.com/mnews/article/025/0003479561?sid=104,"추진 필요성에 대한 인식을 공유하고 양국 간 주요 현안을 논의할 것으로 전망된다. 또 희토류를 비롯한 자원 및 <b>반도체</b> 장비 수출, 중국의 일본산 수산물 수입 재개 이행, 대만 문제 등이 의제로 다뤄질 것으로 보인다.","Fri, 31 Oct 2025 17:22:00 +0900"
2025-10-31 08:31:56,파죽지세 K<b>반도체</b>…초호황에 엔비디아 '깐부 동맹'까지,https://www.kpinews.kr/newsView/1065594864386311,[뉴시스] <b>반도체</b> 기업들은 순풍에 돛을 단 격이다. 슈퍼 사이클(초호황기)에 진입했다는 평가 속에서 '큰... 한국 공급용이므로 삼성전자와 SK하이닉스의 <b>반도체</b>가 들어갈 가능성이 높고 그만큼 매출 확대 기회가... ,"Fri, 31 Oct 2025 17:21:00 +0900"
2025-10-31 08:31:56,관세협상 타결 이후 한미 엇박자? 대통령실 “팩트시트 거의 마무리”,https://vop.co.kr/A00001682052.html,"김 정책실장은 한미 관세협상 합의안을 발표하며 <b>반도체</b> 품목 관세의 경우 경쟁국인 대만에 비해 불리하지 않도록 관세를 적용받기로 미국과 합의했다고 밝혔는데, 하워드 러트닉 미국 상무장관이 <b>반도체</b> 관세는 이번... ","Fri, 31 Oct 2025 17:20:00 +0900"
2025-10-31 08:31:56,대통령실 '엔비디아 협력'과 'K엔비디아 양성' 투트랙 간다,https://n.news.naver.com/mnews/article/018/0006152998?sid=100,"하 수석은 “그와 별개로 2년 후, 5년 후, 10년 후를 봤을 때 국내의 NPU 혹은 AI <b>반도체</b> 내재화 역량을 키우는 ‘투 트랙’으로 진행된다고 보면 된다”며 “앞으로 서비스나 산업에서 AI를 운영하기 위한 NPU가 굉장히... ","Fri, 31 Oct 2025 17:20:00 +0900"
2025-10-31 08:31:56,"HLB생활건강 ‘미인실록’, APEC 전시장서 관람객 호응",http://www.lawissue.co.kr/view.php?ud=202510311717434564f4ab64559d_12,"APEC 경제전시장은 경주엑스포대공원에서 '과거와 현재, 대한민국이 이끄는 새로운 미래'라는 주제로 ▲대한민국 산업역사관 ▲첨단미래산업관(2차전지·모빌리티, <b>반도체</b>, 조선해양, 화장품·바이오, 웹툰·드라마... ","Fri, 31 Oct 2025 17:20:00 +0900"
