DateTime,Title,Link,Description,PubDate
2026-04-13 08:24:41,"“공작기계, 미래 첨단산업 경쟁력과 직결...AI 전환 흐름서 주도권 확...",https://n.news.naver.com/mnews/article/011/0004610199?sid=101,공작기계가 <b>반도체</b>·우주항공·방산 등 첨단산업의 기술 주권과 공급망 안보를 좌우하는 핵심 요소라는... 분야를 <b>반도체</b>·디스플레이·자동차와 함께 국가핵심기술로 지정해 관리하고 있다. 김 회장은 AI 데이터센터... ,"Mon, 13 Apr 2026 17:23:00 +0900"
2026-04-13 08:24:41,"[공매도 브리핑] 4월 13일 거래대금 2조 2,203억…한진칼·한세실업 상위",https://www.topstarnews.net/news/articleView.html?idxno=16033667,"공매도 잔고금액(T-2 기준) 상위 종목은 코스피에서 현대차 1조 6,783억 원, 한미<b>반도체</b> 1조 6,434억 원, LG에너지솔루션 1조 2,784억 원 순이다. 코스닥에서는 에코프로 9,747억 원, 에코프로비엠 5,378억 원, HLB 4... ","Mon, 13 Apr 2026 17:22:00 +0900"
2026-04-13 08:24:41,"두산 전자BG, 공격적 투자…AI <b>반도체</b> '호황' 올라탄다",https://www.asiatoday.co.kr/view.php?key=20260413010003916,두산이 <b>반도체</b> 호황에 대응해 주요 소재 '동박적층판(CCL)' 사업에 공격적인 투자를 이어가고 있다. 생산능력 확대와 가동률 제고를 병행하며 고부가가치 제품 중심의 시장 선점에 속도를 높이고 있다. <b>반도체</b>... ,"Mon, 13 Apr 2026 17:22:00 +0900"
2026-04-13 08:24:41,"기본소득당 용혜인 대표, 새만금 <b>반도체</b> 특구·군산 전기차 유치 공약",http://www.jeollailbo.com/news/articleView.html?idxno=797416,핵심 공약은 ▲새만금 국가 <b>반도체</b> 특구 지정 ▲군산 전기차 완성차 기업 유치(연 20만대 생산)... <b>반도체</b> 공약의 핵심은 용인 메가 클러스터의 후공정을 새만금으로 분산하는 구상이다. 용 대표는 &quot;전 공정·R&amp;D는 용인... ,"Mon, 13 Apr 2026 17:22:00 +0900"
2026-04-13 08:24:41,"LG화학, 범용 덜고 첨단 채운다…체질개선 ‘고삐’",https://www.sentv.co.kr/article/view/sentv202604130155,"이렇게 확보한 재원은 <b>반도체</b>와 전장, 차세대 디스플레이 등 전자소재 핵심 사업 확장에 집중 투입할 예정입니다. 이를 통해 현재 1조 원 수준인 전자소재 매출을 오는 2030년까지 2조 원으로 두 배 이상 끌어올린다는... ","Mon, 13 Apr 2026 17:22:00 +0900"
2026-04-13 08:24:41,"삼성물산, 대치동서 마수걸이 수주…올해 목표 7.7조 속도",https://www.sentv.co.kr/article/view/sentv202604130149,삼성물산은 최근 삼성전자의 <b>반도체</b> 공장 등 하이테크 공사 물량 감소로 실적이 둔화한 상황. 이에 따라 정비사업 확대가 실적 방어를 위한 핵심 축으로 부상하고 있습니다. 올해 정비사업 첫 단추를 꿴 삼성물산이... ,"Mon, 13 Apr 2026 17:22:00 +0900"
2026-04-13 08:24:41,[시황분석] 유가 100달러 재돌파에도…SK하이닉스가 지켜낸 코스피,https://news.ifm.kr/news/articleView.html?idxno=468871,증시는 <b>반도체</b>와 일부 실적 기대주를 중심으로 하방을 방어했습니다. 한국거래소에 따르면 오늘(13일)... 1~10일 <b>반도체</b> 수출이 전년 동기 대비 152.5% 급증한 점도 투자심리를 떠받쳤습니다. 여기에 샌디스크가 국내... ,"Mon, 13 Apr 2026 17:22:00 +0900"
2026-04-13 08:24:41,국제유가 다시 100달러 위로…호르무즈 ‘이중 봉쇄’에 공급망 리스크...,https://n.news.naver.com/mnews/article/020/0003711949?sid=104,"돌파하고, <b>반도체</b> 산업에 사용되는 헬륨·브롬 등 원자재 수급 우려도 커지고 있다. 정부와 업계는... <b>반도체</b>와 배터리 등 첨단 산업에 필수적인 헬륨과 브롬 수급 불안도 크다. 이들 품목은 중동 의존도가 높고 대체... ","Mon, 13 Apr 2026 17:21:00 +0900"
2026-04-13 08:24:41,"억소리 나는 성과급…SK하이닉스, 생산직 직원 채용 시작",https://weekly.hankooki.com/news/articleView.html?idxno=7159673,"인공지능(AI) <b>반도체</b> 슈퍼사이클(초호황기)에 힘입어 D램, 낸드플래시 등 메모리 제품 수요가 늘면서... 인공지능(AI) <b>반도체</b> 슈퍼사이클(초호황기)에 힘입어 D램, 낸드플래시 등 메모리 제품 수요가 늘면서 생산능력... ","Mon, 13 Apr 2026 17:20:00 +0900"
2026-04-13 08:24:41,저수익 사업 정리로 '칼 빼든' LG화학…사업 포트폴리오 재편 속도,https://www.kfenews.co.kr/news/articleView.html?idxno=656820,LG화학은 ▲방열 접착제 ▲모터 ▲전력 <b>반도체</b> ▲통신·센서 등 다양한 영역에서 솔루션을 제공하며 전장 시스템·소재 기업들과의 공동 개발도 이어가고 있다. 김 CEO는 &quot;첨단소재 사업의 경우 글로벌 전기차 수요... ,"Mon, 13 Apr 2026 17:20:00 +0900"
2026-04-13 08:24:41,"봉쇄된 이란 항구...코스피, 5800선 턱걸이",https://www.ntoday.co.kr/news/articleView.html?idxno=126521,"이날 국내 <b>반도체</b> 대장주는 혼조세를 보였다. 삼성전자는 2.43% 내렸고, SK하이닉스는 1.27% 올랐다. 코스닥는 전 거래일보다 6.22포인트(-0.57%) 내린 1099.85에 거래를 마감했다. 개인은 2639억원 순매수했고, 외국인과... ","Mon, 13 Apr 2026 17:20:00 +0900"
2026-04-13 08:24:41,"현대모비스, 미래 신성장 사업 '박차'…&quot;車<b>반도체</b>·로봇부품 '투트랙' 승...",https://n.news.naver.com/mnews/article/003/0013884915?sid=101,현대모비스가 차량용 <b>반도체</b>와 로보틱스 핵심부품을 차세대 성장 사업으로 육성한다. 기존 자동차 부품... 13일 업계에 따르면 현대모비스는 신성장 아이템으로 차량용 <b>반도체</b>와 로보틱스 핵심부품을 낙점했다.... ,"Mon, 13 Apr 2026 17:19:00 +0900"
2026-04-13 08:24:41,"국민의힘 전남광주특별시장 경선, 안태욱 vs 이정현 구도",http://www.ttlnews.com/news/articleView.html?idxno=3098667,"첫째, 아시아문화중심도시조성에관한특별법 기반 문화예술 및 관광산업 육성, 둘째, AI·로봇·<b>반도체</b>·미래차 등 첨단과학기술융복합산업 인프라 구축, 셋째, 서비스산업 육성을 통한 지역경제 활성화, 넷째, AI농업과... ","Mon, 13 Apr 2026 17:18:00 +0900"
2026-04-13 08:24:41,"한솔테크닉스, '900억 베팅' <b>반도체</b> 프로브카드' 유증으로 승부수",https://www.megaeconomy.co.kr/news/newsview.php?ncode=1065600801610701,윌테크놀러지는 해당 분야에서 국내 1위 경쟁력을 보유한 <b>반도체</b> 프로브카드 제조기업으로 독보적 기술력과 시장지위를 통해 안정적인 성장세를 이어오고 있다. 프로브카드는 <b>반도체</b> 칩의 동작 성능을 검사하는... ,"Mon, 13 Apr 2026 17:18:00 +0900"
2026-04-13 08:24:41,전력기기 3대장 주가 쾌속 질주…수출 호조 속 '슈퍼 사이클' 기대,https://www.g-enews.com/view.php?ud=202604131649116108edf69f862c_1,"한국은 글로벌 시장을 휩쓸고 있는 변압기 외에도, 5년 만에 1위를 탈환한 고대역폭메모리(HBM) 등 메모리 <b>반도체</b>와 K-뷰티 열풍을 탄 마스크팩 등이 세계 1위에 신규 등극했다. 특히 글로벌 시장 주요 경쟁국인 일본의... ","Mon, 13 Apr 2026 17:18:00 +0900"
2026-04-13 08:24:41,자통당 &quot;李대통령 '선택적 인권' 외교 갈등 자초&quot;...SNS 발언 '맹폭',https://www.thepublic.kr/news/articleView.html?idxno=300959,이 대변인은 &quot;이스라엘은 <b>반도체</b> 공정에 필요한 브롬 공급국이자 첨단 기술 협력국&quot;이라며 &quot;외교 갈등이 공급망과 기술 협력에 부정적 영향을 미쳐서는 안 된다&quot;고 밝혔다. 아울러 &quot;현지 교민 사회에서도 이번 사안을 두고... ,"Mon, 13 Apr 2026 17:18:00 +0900"
2026-04-13 08:24:41,"SK하이닉스, 오늘부터 '킹산직' 뽑는다…고졸·초대졸자 대상",https://n.news.naver.com/mnews/article/003/0013884901?sid=101,고대역폭메모리(HBM) 등 인공지능(AI) <b>반도체</b> 수요가 확대되며 인력 확보에 속도를 내는 모습이다. 13일... 모집 직무는 설비 유지보수 및 라인 운영을 담당하는 '메인트(Maintenance)'와 <b>반도체</b> 장비 운영 및 품질 검사... ,"Mon, 13 Apr 2026 17:16:00 +0900"
2026-04-13 08:24:41,"협상 결렬 불구… 코스피 5800선 방어, 엇갈린 <b>반도체</b> 대장주",https://it.chosun.com/news/articleView.html?idxno=2023092160293,국내 대표 <b>반도체</b>주인 삼성전자와 SK하이닉스의 주가 흐름은 엇갈렸다. 삼성전자는 전 거래일보다 5000원(2.43%) 내린 20만1000원을 기록했다. 반면 SK하이닉스는 다음 주 발표되는 실적 발표 기대감에 1만3000원(1.... ,"Mon, 13 Apr 2026 17:16:00 +0900"
2026-04-13 08:24:41,원강수 원주시장 예비후보 등록 &quot;준비된 경험과 확실한 비전&quot;,https://n.news.naver.com/mnews/article/001/0016018994?sid=162,태장동 호국 보훈공원 참배를 시작으로 한국<b>반도체</b>교육원 공사 현장과 부론일반산업단지 공사 현장을 방문하며 본격적인 선거 운동에 돌입했다. 그는 &quot;15년 숙원이었던 부론일반산업단지 정상화를 시작으로... ,"Mon, 13 Apr 2026 17:15:00 +0900"
2026-04-13 08:24:41,"[기업] &quot;<b>반도체</b> 초호황에 성과급 7억?&quot; SK하이닉스, 생산직 채용 접수",https://n.news.naver.com/mnews/article/052/0002340166?sid=101,"SK하이닉스가 인공지능 <b>반도체</b> 수요에 대응하기 위해 전임직, 생산직 직원 채용에 나섭니다. SK하이닉스는 채용 홈페이지에 생산직 채용 공고를 내고 오는 22일까지 접수를 받고 있습니다. <b>반도체</b> 제조 장비 유지 보수와... ","Mon, 13 Apr 2026 17:14:00 +0900"
2026-04-13 08:24:41,삼성전자 노사 첨예한 '성과급' 대립…'40조' 노조 요구에 골머리,https://www.kfenews.co.kr/news/articleView.html?idxno=656816,이번 최대 실적은 인공지능(AI)·데이터센터 열풍에 따른 고대역폭메모리(HBM) 등 메모리<b>반도체</b> 초호황기가... AI 붐으로 <b>반도체</b> 시장의 슈퍼사이클이 시작되며 실적이 상승세를 탄 만큼 삼성전자는 AI <b>반도체</b> 경쟁에서... ,"Mon, 13 Apr 2026 17:14:00 +0900"
2026-04-13 08:24:41,'아파트 한 채 값 성과급'…삼전·SK하닉에 직장인들 &quot;너무 부러워&quot;(종합...,https://n.news.naver.com/mnews/article/003/0013884894?sid=101,박윤서 인턴 기자 = 국내 <b>반도체</b> 양대 산맥인 삼성전자와 SK하이닉스의 역대급 성과급 전망치가 공개되며... 특히 노조 가입자의 80%가 집중된 <b>반도체</b>(DS) 부문 인력 7만 7000여 명을 기준으로 삼으면 1인당 평균 수령액은... ,"Mon, 13 Apr 2026 17:14:00 +0900"
2026-04-13 08:24:41,"㈜해성기공, 한기대 2년 연속 발전기금 2000만 원 쾌척",http://www.dtnews24.com/news/articleView.html?idxno=810346,"특히, 송도 동북아무역센터, 인천국제공항, 삼성전자 평택 <b>반도체</b>공장, 카자흐스탄 아부다비 플라자 등 국내외 대형 프로젝트에서 고난도 구조물 공사를 성공적으로 수행했으며, 삼성물산과 롯데건설, SK에코플랜트... ","Mon, 13 Apr 2026 17:14:00 +0900"
2026-04-13 08:24:41,"전기연, 창원특례시와 ‘개방형 제2캠퍼스’ 조성 추진",http://amenews.kr/news/view.php?idx=66321,"한국전기연구원(KERI)이 인공지능(AI), 전력<b>반도체</b> 등 국가 전략기술의 연구, 실증, 인재 양성을 추진하는... 제2캠퍼스는 AI와 전력<b>반도체</b> 등 국가 전략기술의 연구 협업부터 실증·인증, 인재 양성까지 아우르는 핵심... ","Mon, 13 Apr 2026 17:14:00 +0900"
2026-04-13 08:24:41,"미래에셋증권, '미래에셋 차이나데이 2026' 열어",http://www.enewstoday.co.kr/news/articleView.html?idxno=2418203,"해당 행사에는 빅테크, AI, BCI, <b>반도체</b>, 자율주행, 소비자 기술, AR 등 중국 차세대 산업을 이끄는 대표... MiniMax △AI <b>반도체</b> 설계 기업 Biren Technology △3D 프린팅 기술 기업 Creality △360도 액션 카메라 기업 Insta360... ","Mon, 13 Apr 2026 17:13:00 +0900"
2026-04-13 08:24:41,'수도권 대전' 국힘 주자 누가 나오나…'부울경' 민심은 어디로?,https://n.news.naver.com/mnews/article/088/0001005377?sid=162,오히려 <b>반도체</b> 전문가로 꼽히는 양 최고위원이 가장 경쟁력을 보일 것이라는 관측도 제기된다. 박수민 의원·오세훈 서울시장·윤희숙 전 의원 3파전으로 치러지고 있는 국민의힘 서울시장 경선 결과는 오는 18일에 나올... ,"Mon, 13 Apr 2026 17:12:00 +0900"
2026-04-13 08:24:41,"전기연구원, 창원특례시와 '개방형 제2캠퍼스' 조성 추진",http://www.epj.co.kr/news/articleView.html?idxno=38361,"제2캠퍼스는 AI와 전력<b>반도체</b> 등 국가 전략기술의 연구 협업부터 실증·인증, 인재 양성까지 아우르는 핵심 인프라로 기능할 예정이다. 이번 협약을 통해 양측은 창원시 관내에 전기연구원 개방형 제2캠퍼스를 조성하기... ","Mon, 13 Apr 2026 17:12:00 +0900"
2026-04-13 08:24:41,"전기연구원, 창원시와 '개방형 제2캠퍼스' 조성 추진",https://www.electimes.com/news/articleView.html?idxno=366989,"제2캠퍼스는 AI와 전력<b>반도체</b> 등 국가 전략기술의 연구 협업부터 실증·인증, 인재 양성까지 아우르는 핵심 인프라로 기능할 예정이다. 이번 협약을 통해 양측은 창원시 관내에 KERI 개방형 제2캠퍼스를 조성하기 위한... ","Mon, 13 Apr 2026 17:12:00 +0900"
2026-04-13 08:24:41,원강수 원주시장 예비후보 등록…‘지난 4년 성과 평가받는다’,https://www.kukinews.com/article/view/kuk202604130167,선관위 예비후보 등록을 마친 원 시장은 한국<b>반도체</b>교육원과 부론일반산업단지를 방문해 그동안 내세운 경제도시 현장을 점검하는 등 첫 일정을 소화했다. 앞서 그는 원주시청 전 부서 공직자들을 만나 기존 주요 사업의... ,"Mon, 13 Apr 2026 17:12:00 +0900"
2026-04-13 08:24:41,양승조 예비후보 “기본소득·노동 동시 승부”…충남형 ‘기본사회’...,https://n.news.naver.com/mnews/article/002/0002437045?sid=102,"충남 주도의 산업혁신 투자기금을 조성해 <b>반도체</b>·미래차 등 5대 첨단산업에 투자하고, 수익을 도민에게 배당하는 구조다. 재생에너지 전환 과정에서도 주민참여와 이익공유제를 도입해 지역 환원 구조를 강화한다.... ","Mon, 13 Apr 2026 17:12:00 +0900"
2026-04-13 08:24:41,"[POP!IT] LG전자, '사내 1% 전문가' 연구‧전문위원 선발 外",http://www.popcornnews.net/news/articleView.html?idxno=118132,회사는 이번 전시를 통해 일본 내 '임베디드 IoT'와 로봇 중심의 피지컬 AI 수요 확대에 대응하는 에지 AI <b>반도체</b> 경쟁력을 강조했다. 특히 일본 유통사와 업계 관계자들이 부스를 찾아 DX-M1의 전력 대비 성능과... ,"Mon, 13 Apr 2026 17:12:00 +0900"
2026-04-13 08:24:41,"[6·3지선 구미] 김장호 예비후보, 산동·양포 복합스포츠문화타운 조성...",https://www.kyongbuk.co.kr/news/articleView.html?idxno=4069882,"한편 김 예비후보는 민선 8기 구미시장 재임 기간 동안 방산혁신클러스터, <b>반도체</b> 특화단지, 기회발전특구 등 6대 국책사업을 유치하고, 삼성SDS AI데이터센터 등 총 16조 원 규모의 투자 유치를 이끌어낸 바 있다. 아울러... ","Mon, 13 Apr 2026 17:12:00 +0900"
2026-04-13 08:24:41,삼성전자 노조 &quot;성과급 40조원 달라&quot;...배당 4배 달해 주주들 '반발',https://www.banronbodo.com/news/articleView.html?idxno=32101,"13일 관련 업계에 따르면 삼성전자 노조가 연간 <b>반도체</b> 영업이익을 270조원으로 가정, 40조5000억원을 성과급... 요구가 현실화하면 지난해 400만 주주가 받은 배당의 4배를 7만7000여 명의 <b>반도체</b> 직원들이 성과급으로... ","Mon, 13 Apr 2026 17:12:00 +0900"
2026-04-13 08:24:41,서희철 &quot;신계룡-북천안 송전선로 전면 재검토해야&quot;,https://n.news.naver.com/mnews/article/047/0002511870?sid=162,이어 &quot;용인 <b>반도체</b> 산업단지와 같은 대규모 전력 수요를 위해 전국이 부담을 떠안는 구조는 더 이상 지속 가능하지 않다&quot;며 &quot;지역에서는 에너지 분권과 산업 재배치를 요구하는 목소리가 높아지고 있다&quot;고 덧붙였다.... ,"Mon, 13 Apr 2026 17:11:00 +0900"
2026-04-13 08:24:41,"中, 희토류 이어 황산 수출 제한 … 반도제·배터리 생산 제동걸리나",https://biz.newdaily.co.kr/site/data/html/2026/04/13/2026041300325.html,"황산은 <b>반도체</b>와 배터리 등의 생산에 필수적인 기초소재로, 중동 전쟁 여파로 이미 공급난을 겪고 있는 원자재 시장에 또 다른 충격을 줄 수 있다는 우려가 커지고 있다. 중국은 세계 최대 황산 생산국이다. 중국의 잇따른... ","Mon, 13 Apr 2026 17:10:00 +0900"
2026-04-13 08:24:41,[파워인터뷰] LS증권 염승환 이사 &quot;전쟁보다 중요한 건 방향…시장은 우...,http://www.paxetv.com/news/articleView.html?idxno=269410,▶ 가장 괜찮게 보는 건 역시 <b>반도체</b>고요. 왜냐하면 <b>반도체</b>가 앞으로 AI 때문에 성장하는 것도 굉장히 긍정적이지만 숫자가 좋아요. 이번 1분기에 삼성전자가 57조 다들 깜짝 놀랐죠. 이게 끝이 아니고 1분기가 올해 영업이익... ,"Mon, 13 Apr 2026 17:10:00 +0900"
2026-04-13 08:24:41,'종전협상 결렬' 불확실성 확대→공매도 잔고 16조 '사상 최고',https://n.news.naver.com/mnews/article/079/0004136211?sid=101,"한미<b>반도체</b>(1조 6434억원)와 LG에너지솔루션(1조 2784억원), 미래에셋증권(8441억원), HD현대중공업(6968억원) 등이 뒤이었다. 시가총액 대비 공매도 잔고 비중은 한미<b>반도체</b>가 6.15% 가장 높았고, 이어 코오롱인더(5.51%)와... ","Mon, 13 Apr 2026 17:09:00 +0900"
2026-04-13 08:24:41,로또보다 SK하이닉스?…성과급 7억 추정에 생산직 채용 '후끈',https://n.news.naver.com/mnews/article/586/0000126777?sid=101,<b>반도체</b> 호황에 인력 확대…&quot;내년 성과급 기대감도 영향&quot; SK하이닉스가 <b>반도체</b> 수요 증가에 대응하기 위해 생산직 직원 채용에 나섰다. 주요 생산 거점인 경기도 이천과 충북 청주를 중심으로 인력 확충에 속도를 내는... ,"Mon, 13 Apr 2026 17:09:00 +0900"
2026-04-13 08:24:41,"아시아 20대 갑부 패밀리…삼성家 3위, 현대家 16위",https://n.news.naver.com/mnews/article/014/0005506926?sid=101,"20대 가문의 기업들이 AI 산업의 핵심 투입재인 금속, <b>반도체</b>, 인프라 등을 공급하며 호황을 누렸고, 그 결과 이들 집안의 자산 총계가 올해 6470억달러(약 956조9000억원)로 전년 대비 16% 뛴 것이다. 이와 관련, 자산... ","Mon, 13 Apr 2026 17:07:00 +0900"
2026-04-13 08:24:41,"김원종 공작기계협회장 &quot;AI와 만난 공작기계, 국가 핵심·첨단 산업으로...",https://www.newsworks.co.kr/news/articleView.html?idxno=837628,"자동차(수요 비중 약 30%), IT·<b>반도체</b>(약 16~20%), 항공우주, 방산, 에너지, 의료까지 금속 정밀 가공이 필요한... <b>반도체</b>, 2차전지, 원전 등 국가 핵심 첨단 산업 모두 공작기계 없이는 성립하지 않는다는 점에서 공작기계... ","Mon, 13 Apr 2026 17:06:00 +0900"
2026-04-13 08:24:41,"'아시아 20대 갑부 패밀리' 순위에 삼성가 3위, 현대가 16위",https://n.news.naver.com/mnews/article/660/0000107316?sid=101,"20대 가문의 기업들이 AI 산업의 핵심 투입재인 금속, <b>반도체</b>, 인프라 등을 공급하며 호황을 누렸고 이들 집안의 자산 총계는 올해 6,470억 달러(약 956조 9천억 원)로 전년 대비 16% 뛰었습니다. 자산 총액과 연간... ","Mon, 13 Apr 2026 17:06:00 +0900"
2026-04-13 08:24:41,"[데일리픽] 넥슨, 코인 사업 발 뺀다…AI 사이버 보안 '초단위' 군비경쟁",https://www.digitaltoday.co.kr/news/articleView.html?idxno=656374,"인텔 웨이퍼 [사진: 인텔] ■ <b>반도체</b> 파운드리 시장, 패키징 비중 커져...적층·칩렛 기술 격전지로 <b>반도체</b> 업계 기술 경쟁 축이 미세공정에서 패키징으로 옮겨가고 있다. 선폭 축소가 물리적 한계에 근접하면서 2.5D·3D... ","Mon, 13 Apr 2026 17:06:00 +0900"
2026-04-13 08:24:41,美 추월한 中 AI 모델 사용량…다음 목표는 수익화,https://www.fortunekorea.co.kr/news/articleView.html?idxno=52169,워싱턴은 중국이 <b>반도체</b> 경쟁에서 한발 뒤처지도록 압박하고 있다. 中빅테크의 부활 지난 3월 스페인 바르셀로나에서 열린 모바일 월드 콩그레스(MWC)에서 사람들이 큐원 부스 앞을 지나가고 있다. [사진=AP/뉴시스]... ,"Mon, 13 Apr 2026 17:06:00 +0900"
2026-04-13 08:24:41,삼전닉스 12조 팔고 방산·에너지 샀다…외국인 '환승 쇼핑',https://n.news.naver.com/mnews/article/018/0006256491?sid=101,<b>반도체</b> 밸류에이션(가치평가) 배수를 직접 끌어내리면서도 한국 시장 자체는 포기하지 않는 이른바... 반면 순매도 상위에는 <b>반도체</b>·자동차 간판주들이 집중됐다. 삼성전자(005930)가 9조944억원 순매도로 압도적... ,"Mon, 13 Apr 2026 17:06:00 +0900"
2026-04-13 08:24:41,"[CEO와칭] 첨단소재 전문가 이영준 대표, 롯데케미칼 고부가 전환 이끈...",http://www.metroseoul.co.kr/article/20260413500429,"그는 기능성 컴파운드와 <b>반도체</b> 공정소재, 그린소재, 기능성 동박, 친환경 에너지 소재 비중을 높여 화학군... ◆수소·<b>반도체</b>·AI 소재까지 확대…미래 성장축 다변화 고부가 사업 확대는 수소와 배터리, <b>반도체</b> 소재... ","Mon, 13 Apr 2026 17:04:00 +0900"
2026-04-13 08:24:41,金총리 &quot;계엄때 제거 리스트 올라&quot;…폴란드 총리 &quot;비슷한 경험&quot;(종합),https://n.news.naver.com/mnews/article/001/0016018970?sid=100,"또 &quot;폴란드산 축산물의 한국 수출 확대, 한국 기업의 폴란드 투자 확대 등을 통해 호혜적 파트너십을 구축해 나가길 기대한다&quot;며 첨단기술, <b>반도체</b>, 사이버·우주 분야로 협력을 확장하길 바란다고 덧붙였다. 투스크 총리는... ","Mon, 13 Apr 2026 17:03:00 +0900"
2026-04-13 08:24:41,"세메스, R&amp;D 1800억 투입…삼성 <b>반도체</b> '장비 내재화' 속도",http://www.thebigdata.co.kr/view.php?ud=2026041315145985070ecbf9426b_23,세메스가 연구개발(R&amp;D) 투자를 확대하며 삼성전자의 <b>반도체</b> 장비 내재화 전략의 핵심 축으로 부상하고... <b>반도체</b> 웨이퍼 표면의 이물질을 제거하는 세정(Clean) 장비와 회로 패턴을 형성하는 식각(Etch) 장비를 주력으로... ,"Mon, 13 Apr 2026 17:02:00 +0900"
2026-04-13 08:24:41,"[마감시황] 美·이란 해상봉쇄 충격, 코스피 출렁…장중 2% 급락 후 5800선...",http://www.kdfnews.com/news/articleView.html?idxno=181819,"종목별로는 <b>반도체</b>·방산·일부 성장주가 방어 역할을 한 반면 경기·에너지 민감 업종이 약세를 보였다. 삼성전자는 2.43% 밀린 20만1000원에 마감했고, SK하이닉스는 하락 출발 후 상승 전환해 1.27% 오른 104만원에... ","Mon, 13 Apr 2026 17:02:00 +0900"
2026-04-13 08:24:41,"IBK기업은행, 10조 투·융자 드라이브…'대출 중심' 탈피 본격화",http://www.wikileaks-kr.org/news/articleView.html?idxno=186235,"중소벤처기업부가 올해 2월 발표한 자료에 따르면 2025년 국내 신규 벤처투자는 13조6000억 원으로 전년 대비 14% 늘었지만, 증가분의 대부분이 하반기에 집중됐고 AI <b>반도체</b>·바이오 등 일부 업종으로의 쏠림 현상도... ","Mon, 13 Apr 2026 17:02:00 +0900"
2026-04-13 08:24:41,"삼성전자 노조 '영업익 15%' 성과급 요구 뭇매, 주주 반발 속 '3각 갈등'...",https://www.businesspost.co.kr/BP?command=article_view&num=435576,"13일 전자 업계 취재를 종합하면 삼성전자 노조가 최근 회사 측에 2026년 <b>반도체</b>(DS)부문 영업이익을 270조... 하지만 글로벌 <b>반도체</b> 패권 전쟁에서 핵심 인재와 자본은 결코 분리될 수 없는 두 수레바퀴로, <b>반도체</b> 산업은... ","Mon, 13 Apr 2026 17:02:00 +0900"
