DateTime,Title,Link,Description,PubDate
2026-03-22 08:42:13,[르포] &quot;칩만 배우는 게 아니었다&quot;…명지대 <b>반도체</b> 특성화대학 가보니,https://www.asiatoday.co.kr/view.php?key=20260322010006518,"<b>반도체</b>공학부 4학년 김지호씨가 모니터에 뜬 스펙트럼 변화를 가리키며 플라즈마(이온화된 기체) 실습... <b>반도체</b> 공정장비의 70% 이상이 진공 상태의 플라즈마를 활용하는 만큼, 학생들이 그 특성을 직접 확인하도록 한... ","Sun, 22 Mar 2026 17:40:00 +0900"
2026-03-22 08:42:13,AI 주도권 잡기 110兆 투입… 삼성 '로봇·6G' 미래사업에 풀악셀,https://www.asiatoday.co.kr/view.php?key=20260323010006552,'포스트 <b>반도체</b>' 키운다 &lt;끝&gt; 첨단로봇·메드테크 등 M&amp;A 정조준 이노X 랩 신설·퀄컴과 로봇 협업 주목... 한동안 부침을 겪었던 <b>반도체</b> 사업의 외형 성장에 따라 큰 폭의 실적 확대와 주가 상승이 이뤄지면서다.... ,"Sun, 22 Mar 2026 17:40:00 +0900"
2026-03-22 08:42:13,"하이퍼엑셀, '생성형 AI 전용 LPU' 승부수… 2세대 팹리스의 역습",https://n.news.naver.com/mnews/article/092/0002415529?sid=105,국내 AI <b>반도체</b> 생태계가 1세대 기업들의 칩 양산 경쟁을 넘어 특정 목적에 최적화된 2세대 기업들의... 국내 AI<b>반도체</b> 5개사와 정부 관계자들이 기념촬영하고 있다.(사진=지디넷코리아) [기회: Opportunity] 추론 중심... ,"Sun, 22 Mar 2026 17:39:00 +0900"
2026-03-22 08:42:13,"퀄리타스<b>반도체</b>, 초고속 인터페이스 IP '국산화' 선봉… 글로벌 팹리스...",https://www.pinpointnews.co.kr/news/articleView.html?idxno=438887,시스템<b>반도체</b> 테마가 20일 인공지능(AI) 확산과 고성능 <b>반도체</b> 수요 증가 기대감에 힘입어 상승 마감했다. 시장에서는 비메모리 <b>반도체</b> 중심의 산업 구조 변화와 설계·패키징 분야 성장성이 부각되며 관련 종목 전반에... ,"Sun, 22 Mar 2026 17:38:00 +0900"
2026-03-22 08:42:13,野 “R&amp;D 분야 근로 유연화 필수”…與 “보상 구조로 대응해야”,https://n.news.naver.com/mnews/article/011/0004602015?sid=100,반면 김 의원은 “정부가 <b>반도체</b> 산업을 중심으로 특별연장근로 인가 기간을 최대 6개월까지 확대하는 등 제도적 보완을 해왔다”며 “단순한 근로시간 문제가 아니라 장기 과제를 수행할 수 있는 R&amp;D 지원 체계와 합당한... ,"Sun, 22 Mar 2026 17:37:00 +0900"
2026-03-22 08:42:13,[매일경제TV] 변동성 장세 '포트폴리오 생존전략',https://m.entertain.naver.com/article/009/0005654077,지난주 국내 증시는 중동발 지정학적 리스크로 인한 에너지 가격의 불확실성과 원화 약세 공포로 출렁였으나 삼성전자와 SK하이닉스를 필두로 한 <b>반도체</b> 섹터의 강력한 주도력에 힘입어 지수 6000선 재탈환을 향한... ,"Sun, 22 Mar 2026 17:36:00 +0900"
2026-03-22 08:42:13,'돌아온 삼성전자' 첫 성적표에 쏠린 눈…영업이익 1위 탈환 전망,https://www.delighti.co.kr/news/articleView.html?idxno=113913,(사진=연합뉴스) 삼성전자 <b>반도체</b>를 향한 글로벌 빅테크들의 러브콜이 이어지는 가운데 내달 발표될... 증권가에서는 <b>반도체</b> 사업을 맡고 있는 디바이스솔루션(DS)부문의 영업이익을 35조∼36조원으로 예상한다.... ,"Sun, 22 Mar 2026 17:36:00 +0900"
2026-03-22 08:42:13,중동전쟁 충격에 증시 출렁…유틸리티·건설 선방,https://www.namdonews.com/news/articleView.html?idxno=904795,건설주는 <b>반도체</b> 등 다른 주력 업종보다 앞선 상승 폭이 크지 않았던 데다 원전 수주 기대가 살아 있다는 점이 버팀목이 됐다. 특히 미국 원전 투자 수혜주로 거론되는 대우건설은 이달 3일부터 20일까지 88.46... ,"Sun, 22 Mar 2026 17:34:00 +0900"
2026-03-22 08:42:13,"&quot;대덕단지 너무 편안, 절박함과 위기 인식 필요&quot; 광폭행보 李 부의장 연...",http://www.hellodd.com/news/articleView.html?idxno=111221,"다만 <b>반도체</b>·배터리 등 우리가 앞서 있는 분야는 굳이 협력하지 않아도 된다고 선을 그었다. ◇ &quot;대덕단지, 편안하고 따뜻한 그 편안함이 문제&quot; 문제는 과학계가 이 전환의 무게를 제대로 받아들이고 있느냐다. 이... ","Sun, 22 Mar 2026 17:34:00 +0900"
2026-03-22 08:42:13,"슈퍼마이크로, AI칩 中 반출 의혹…'대만 커넥션' 흔들리나",https://n.news.naver.com/mnews/article/015/0005265325?sid=104,"엔비디아 생태계에 포함돼 <b>반도체</b>, 서버 등 AI 하드웨어 시장을 장악한 대만계 기업의 지배력이 약화할 것이란 관측도 나온다. 폭스콘, 콴타 등 대만 서버 기업은 엔비디아의 AI 서버를 제조업자개발생산(ODM) 방식으로... ","Sun, 22 Mar 2026 17:33:00 +0900"
2026-03-22 08:42:13,&quot;유시민 작가 '뉴 이재명 발언' 실망스럽다&quot; 김병욱 전 더불어민주당 의...,https://n.news.naver.com/mnews/article/057/0001940962?sid=004,거기다가 주가 조작 세력에 대한 엄단 물론 그 과정에서 <b>반도체</b> 산업이 또 AI로 인해서 메모리칩의 수요가 급증하면서 <b>반도체</b> 기업의 수익이 상승된 부분도 물론 포함되겠죠. 이런 전체적인 주식 시장을 반드시... ,"Sun, 22 Mar 2026 17:32:00 +0900"
2026-03-22 08:42:13,[단독]요소수값 2배 폭등·에틸렌 바닥…‘중동발 공급망 쇼크’ 전 산...,https://n.news.naver.com/mnews/article/020/0003705943?sid=101,<b>반도체</b>와 바이오 등도 이번 전쟁의 영향권에 진입했다. 카타르 액화천연가스(LNG) 시설 피격으로 <b>반도체</b> 필수 냉매인 헬륨 가격은 1주일 새 50% 급등했다. 바이오 업계는 중동 항구 폐쇄와 바이어 계약 취소로 신음하고... ,"Sun, 22 Mar 2026 17:32:00 +0900"
2026-03-22 08:42:13,중동발 인플레 압박…고물가·고금리에 국내 경제 '흔들',https://www.namdonews.com/news/articleView.html?idxno=904788,"고물가와 고금리가 동시에 작용하는 상황에서 내수 회복 흐름이 흔들리고, <b>반도체</b> 중심의 수출 역시 물류... 인공지능 수요 확대에 힘입어 <b>반도체</b> 수출이 증가하고 있지만, 항공 물류 차질로 운임이 상승할 가능성이 있고... ","Sun, 22 Mar 2026 17:32:00 +0900"
2026-03-22 08:42:13,"“용인 <b>반도체</b> 뺏기지 않는다”…이상일 시장, 안호영 의원에 역공",https://n.news.naver.com/mnews/article/030/0003409938?sid=105,이상일 용인특례시장이 더불어민주당 안호영 국회의원의 '용인 <b>반도체</b> 클러스터 전북 이전' 주장과 호남권 정치권의 <b>반도체</b> 분산 배치 움직임을 공개 비판했다. 안 의원이 전북지사 선거 국면에서 용인 <b>반도체</b> 생산시설의... ,"Sun, 22 Mar 2026 17:31:00 +0900"
2026-03-22 08:42:13,시놉시스 &quot;삼성·하이닉스와 HBM 설계 밀착 협업&quot;,https://n.news.naver.com/mnews/article/015/0005265323?sid=105,"시놉시스는 세계 1위 <b>반도체</b> 설계자동화툴(EDA) 기업이다. EDA는 <b>반도체</b> 칩을 설계할 때 꼭 필요한 소프트웨어다. 시놉시스의 고객 리스트에는 삼성전자, SK하이닉스도 올라 있다. 소 사장은 “올 상반기에 두 회사의... ","Sun, 22 Mar 2026 17:31:00 +0900"
2026-03-22 08:42:13,민주당 대전 대덕구청장 예비후보 합동 토론회…산업단지 개선 방점,http://www.chungnamilbo.co.kr/news/articleView.html?idxno=879144,또 &quot;대청댐 수력 발전소를 활용해 RE100을 충족하는 소형 모듈화 데이터센터를 유지하겠다&quot;며 &quot;신대동 중공업지대를 활용한 AI <b>반도체</b> 소부장(소재·부품·장비) 산단도 반드시 유치할 것&quot;이라고 강조했다. 김안태... ,"Sun, 22 Mar 2026 17:30:00 +0900"
2026-03-22 08:42:13,"이재용·곽노정, 中 포럼 2년 연속 출격…'공급망·협력' 승부수",http://www.newsian.co.kr/news/articleView.html?idxno=87521,"특히 <b>반도체</b> 산업이 지정학적 변수에 크게 영향을 받는 만큼, 중국 당국과의 접점을 유지하는 전략적 의미도... 특히 전기차, 인공지능(AI), <b>반도체</b> 등 미래 산업을 중심으로 기업 간 전략적 제휴 논의가 이뤄질 수 있다는... ","Sun, 22 Mar 2026 17:26:00 +0900"
2026-03-22 08:42:13,‘글로벌 CEO 집결’ 中발전포럼 개막… 이재용·곽노정 참석,https://n.news.naver.com/mnews/article/366/0001150602?sid=105,<b>반도체</b> 분야에서는 퀄컴과 브로드컴 등 주요 기업 경영진도 포함됐다. 업계에서는 중국이 미국의 관세 압박 속에서 유럽과 아시아 기업을 중심으로 협력 기반을 확대하려는 흐름으로 보고 있다.,"Sun, 22 Mar 2026 17:24:00 +0900"
2026-03-22 08:42:13,"왈리 라우 슈퍼마이크로 창업자, 사임…엔비디아칩 中 유출 혐의",https://it.chosun.com/news/articleView.html?idxno=2023092159018,"뉴욕 검찰은 전날 슈퍼마이크로의 간부 3명을 첨단 <b>반도체</b> 밀반출 혐의로 기소했다. 이에 슈퍼마이크로는... 해당 소식이 알려지자 슈퍼마이크로의 주가는 33%, 엔비디아는 3% 이상 급락하는 등 <b>반도체</b>주가 일제히... ","Sun, 22 Mar 2026 17:24:00 +0900"
2026-03-22 08:42:13,"코스피 6000선 다시 코앞에...&quot;전형적 버블’ vs “개미 국장行, 더 오른...",https://n.news.naver.com/mnews/article/025/0003510758?sid=101,반대로 국내 증권가는 <b>반도체</b> 실적과 개인 투자자 수급을 근거로 더 오를 수 있다는 전망을 내놓고 있다.... 그 중심에는 코스피를 견인하는 핵심 주체인 ‘<b>반도체</b> 투톱(삼성전자·SK하이닉스)’이 탑승한 ‘<b>반도체</b>... ,"Sun, 22 Mar 2026 17:20:00 +0900"
2026-03-22 08:42:13,[미국 주식 돋보기] 데이터센터 냉각 1위 … 버티브홀딩스 주목,https://n.news.naver.com/mnews/article/009/0005654042?sid=101,최신 AI 가속기(GPU) 등 고성능 <b>반도체</b>가 집적된 AI 서버는 작동하는 과정에서 기존 데이터센터보다 더욱 많은 열이 발생한다. 이 열은 차가운 공기로 식히는 공랭식으로 제어하는 데 한계가 있다. 공랭식보다 냉각... ,"Sun, 22 Mar 2026 17:19:00 +0900"
2026-03-22 08:42:13,[기고] AI 설계하는 나라만 살아남는다,https://n.news.naver.com/mnews/article/009/0005654045?sid=110,<b>반도체</b>와 제조업을 국가 경쟁력의 축으로 삼아온 대한민국에 이는 단순한 기술 유행이 아니라 산업 질서의... 이제 목표는 <b>반도체</b>를 잘 만드는 나라에 머무는 것이 아니라 공장과 조선소와 연구소를 움직이는 산업용... ,"Sun, 22 Mar 2026 17:19:00 +0900"
2026-03-22 08:42:13,韓증시에 드리운 '버블' 그림자…증시과열 경고음,https://www.goodnews1.com/news/articleView.html?idxno=457864,특히 삼성전자와 SK하이닉스 주가를 밀어 올리고 있는 <b>반도체</b> 슈퍼사이클(초호황기)이 아직은 유효한 만큼 코스피 추세 상승이 멈췄다고 보기는 이르다고 주장한다. 나정환 NH투자증권 연구원은 &quot;한국 주식시장은... ,"Sun, 22 Mar 2026 17:16:00 +0900"
2026-03-22 08:42:13,&quot;앤스로픽 상승세 무섭네&quot;…오픈AI 직원 두 배로 늘린다,https://n.news.naver.com/mnews/article/018/0006240428?sid=101,"소비자용 AI 시장에서는 운영체제(OS)와 <b>반도체</b>, 검색 플랫폼과 빅데이터, 자금력까지 갖춘 구글이 ‘제미나이’를 앞세워 오픈AI를 추격하고 있다. 반면 9억명 이상의 챗GPT 사용자 가운데 90%는 무료 고객이다. 오픈AI는... ","Sun, 22 Mar 2026 17:16:00 +0900"
2026-03-22 08:42:13,"&quot;안산의 인구 위기, 카이스트 정신으로 극복하겠다&quot;",https://www.asiatoday.co.kr/view.php?key=20260322010006342,"중소기업이 단계별로 자동화 설비를 도입할 수 있도록 지원하고, &quot;'피지컬 AI <b>반도체</b> 융합 실증허브'를 구축해 기업들이 가상 공간에서 미리 설비를 시험해 볼 수 있도록 하겠다&quot;고 말했다.홍 예비후보는 &quot;산업이 살면 좋은... ","Sun, 22 Mar 2026 17:08:00 +0900"
2026-03-22 08:42:13,이란 전쟁發 '헬륨 쇼크' 칩플레이션 우려 커진다,https://n.news.naver.com/mnews/article/009/0005654025?sid=101,헬륨값 1주일새 40% 급등 국내 사용 65%가 카타르산 <b>반도체</b> 공급망에 '직격탄' 이란 전쟁으로 헬륨 가격이 급등하면서 이를 사용하는 <b>반도체</b> 가격도 덩달아 올라 '칩플레이션'(<b>반도체</b> 가격 상승으로 물가가 상승하는... ,"Sun, 22 Mar 2026 17:06:00 +0900"
2026-03-22 08:42:13,"이재용·곽노정, 중국발전포럼 참석...일본 기업 임원 불참",https://n.news.naver.com/mnews/article/092/0002415528?sid=105,삼성전자와 SK하이닉스는 모두 중국에서 메모리 <b>반도체</b> 공장을 가동 중이다. 미·중 무역분쟁으로... 곽노정 SK하이닉스 사장이 2025년 <b>반도체</b>의 날에서 기자들의 질문에 답하고 있다. (사진=공동기자단),"Sun, 22 Mar 2026 17:04:00 +0900"
2026-03-22 08:42:13,이재용 중국발전포럼 참석…글로벌 CEO들과 협력 논의,https://n.news.naver.com/mnews/article/015/0005265310?sid=101,"삼성은 중국 내에서 시안(<b>반도체</b> 낸드플래시), 쑤저우(<b>반도체</b> 후공정), 톈진(적층세라믹콘덴서·MLCC) 등에서 공장을 가동하고 있다. 이 회장은 포럼 일정 이후 베이징 인근의 주요 파트너사들과 만날 것으로 예상된다.... ","Sun, 22 Mar 2026 17:02:00 +0900"
2026-03-22 08:42:13,"'전쟁 직격탄' 제조업 4월 업황, 11개월 만 최악 전망",https://n.news.naver.com/mnews/article/469/0000920929?sid=101,'슈퍼 사이클' 진입으로 3월 전망치가 1년 9개월 만에 최고치인 178을 기록했던 <b>반도체</b>는 4월 전망치가 147로 31p 급락하면서도 여전히 기준치를 크게 상회했다. 조선업 4월 전망치도 변동이 없이 107p를 유지해... ,"Sun, 22 Mar 2026 17:01:00 +0900"
2026-03-22 08:42:13,"&quot;일극구조, 깨야 산다&quot; 부산찾은 김경수 위원장, 부산 상공인 대상 특강",https://n.news.naver.com/mnews/article/079/0004127638?sid=102,특히 미래 산업 기반 확보를 위한 '부산 첨단 <b>반도체</b> 팹(Fab) 유치'와 생산 거점 조성 등 부산 경제의 체질을 바꿀 수 있는 굵직한 과제들이 논의 테이블에 올랐다. 양재생 부산상의 회장은 인사말을 통해 정부의 과감한... ,"Sun, 22 Mar 2026 17:01:00 +0900"
2026-03-22 08:42:13,"나광국 전남도의원, 무안군수 예비후보 등록…&quot;군민 체감 변화 만들겠다...",https://n.news.naver.com/mnews/article/629/0000483868?sid=102,"특히 공항 소음완충부지 태양광 발전을 통한 기본소득 모델을 추진하고, <b>반도체</b> 기반 RE100 산업단지 유치로 미래 산업 기반을 구축하겠다는 구상이다. 또한 남악·오룡 신도시와 기존 도심을 연계한 스마트도시 전략과... ","Sun, 22 Mar 2026 17:00:00 +0900"
2026-03-22 08:42:13,"삼성·SK, 1분기 '깜짝 실적' 전망…메모리 가격 급등 효과",https://n.news.naver.com/mnews/article/293/0000081349?sid=101,인공지능(AI) <b>반도체</b> 수요 급증에 따른 고대역폭메모리(HBM) 중심의 공급 재편과 범용 메모리 가격 급등이... 이달 기준 메모리 <b>반도체</b> 재고는 1~2주 수준까지 낮아지며 2018년 이후 최저 수준으로 떨어진 상황이다. HBM... ,"Sun, 22 Mar 2026 17:00:00 +0900"
2026-03-22 08:42:13,"[증시 주간 전망대] 호르무즈發 불확실성 지속…주총 시즌, '주주 환원'...",http://www.seoulwire.com/news/articleView.html?idxno=712432,"충분한 <b>반도체</b> 업종을 비롯해 최근 조정 국면에서 낙폭이 큰 섹터를 주목할 필요가 있다고 조언했다. 이경민 연구원은 &quot;밸류에이션 매력이 높고 올해 이익 개선이 예상되는 <b>반도체</b>, 자동차, 조선 등 주도주는 여전히... ","Sun, 22 Mar 2026 17:00:00 +0900"
2026-03-22 08:42:13,"경기도 기초단체장 후보 공천 속도...민주 10곳, 국힘 20곳 심사 일단락",https://www.kgnews.co.kr/news/article.html?no=888439,또 안교재 현 경기도당 AI<b>반도체</b>특별위원장과 이요림 전 한국자유총연맹 수원시지회장 등 2명이 공천을 신청한 경기도 정치 1번지 수원특례시장 후보에 대해서도 장고를 거듭하고 있는 것으로 알려졌다. [ 경기신문... ,"Sun, 22 Mar 2026 17:00:00 +0900"
2026-03-22 08:42:13,머스크 &quot;삼성·TSMC론 부족&quot;…1TW 규모 '테라팹' 구축 계획 선언,https://n.news.naver.com/mnews/article/031/0001015574?sid=105,"초대형 <b>반도체</b> 공장 '테라팹(TERAFAB)' 구축 계획을 발표했다. 머스크 CEO는 21일(현지시간) 미국 텍사스에서... 첨단 <b>반도체</b> 공장 구축에는 최소 300억~450억달러(약 40조~60조원)가 필요하며, 핵심 장비인 극자외선(EUV) 노광... ","Sun, 22 Mar 2026 16:59:00 +0900"
2026-03-22 08:42:13,한동훈 “국힘이 열심히 하는 건 숙청과 징계뿐” 경동시장서 당권파 직...,https://n.news.naver.com/mnews/article/009/0005654021?sid=100,"한 대표는 앞선 7일 부산 북구 구포시장 찾아 코스피가 5000, 6000을 찍은 것은 주가 상승은 <b>반도체</b> 사이클 영향일 뿐 특정 정부 정책의 성과가 아니라는 입장을 밝힌 바 있다. 한 전 대표는 ‘시장 정치’를 강조하며 민심... ","Sun, 22 Mar 2026 16:58:00 +0900"
2026-03-22 08:42:13,"[CEO와칭] '기술'로 정면 돌파…최주선 삼성SDI 사장, 반등 기반 다진다",http://www.metroseoul.co.kr/article/20260322500257,/삼성SDI 최주선 삼성SDI 대표이사 사장은 <b>반도체</b>와 디스플레이를 두루 거친 엔지니어 출신 전문경영인이다.... <b>반도체</b>와 디스플레이에서 기술 중심 경영을 경험한 엔지니어형 CEO가 배터리 사업에서도 반등 공식을... ,"Sun, 22 Mar 2026 16:56:00 +0900"
2026-03-22 08:42:13,이재용·곽노정 베이징 집결…中발전포럼 개막,http://www.metroseoul.co.kr/article/20260322500254,미·중 갈등 속에서도 중국 시장과의 연결고리를 유지하려는 <b>반도체</b> 업계의 전략적 행보로 풀이된다. 22일... 업계에서는 AI <b>반도체</b> 수요 확대와 전장 사업 확장 흐름 속에서 실질적인 협력 논의로 이어질 수 있다는... ,"Sun, 22 Mar 2026 16:52:00 +0900"
2026-03-22 08:42:13,"[기초단체장 도전 경기도의원] 서현옥 전 의원 &quot;평택, 성장 이면의 교통...",https://www.kihoilbo.co.kr/news/articleView.html?idxno=3017020,"<b>반도체</b> 산업 확대, 미군기지 이전, 고덕신도시와 브레인시티 개발 등으로 평택의 도시 규모가 커지는 만큼 이를 뒷받침할 수 있는 생활 인프라 구축의 필요성도 짚었다. 서 전 의원은 &quot;고덕 KTX 경기남부 평택역사 건립 등... ","Sun, 22 Mar 2026 16:52:00 +0900"
2026-03-22 08:42:13,앤디포스 주가 11% 폭등…아이폰 수혜주 다시 불붙었다,https://www.pinpointnews.co.kr/news/articleView.html?idxno=438881,"OLED 패널, 카메라 모듈, <b>반도체</b>, 기판 등 핵심 부품 업체들이 일제히 강세를 보이며 테마 상승을 이끌었다.... 덕산네오룩스, 이녹스첨단소재, 인터플렉스, 아이티엠<b>반도체</b> 등은 OLED 소재와 기판, 보호회로 등 핵심 부품... ","Sun, 22 Mar 2026 16:50:00 +0900"
2026-03-22 08:42:13,[경제 프리즘] 한국경제의 취약성 '가격의 울퉁불퉁함',https://n.news.naver.com/mnews/article/009/0005654014?sid=101,<b>반도체</b> 경기가 살아나고 세계 경제도 완화적 통화 정책에 힘입어 성장세를 보일 것임을 근거로 들었다. 한은은 당시 연평균 유가를 브렌트유 기준으로 배럴당 64달러로 예상했다. 하지만 이 전망은 한 달도 안돼 바꿔야... ,"Sun, 22 Mar 2026 16:50:00 +0900"
2026-03-22 08:42:13,[이번주 증시 예보] 고유가發 경기침체 가늠자 … 美 3월 PMI 24일 발표,https://n.news.naver.com/mnews/article/009/0005654011?sid=101,특히 <b>반도체</b> 수출이 전체의 3분의 1을 넘는 76억달러를 기록하며 176% 급증했다. <b>반도체</b>를 중심으로 한 수출 호조가 중순까지 이어졌는지가 관전 포인트다. 24일에는 S&amp;P글로벌이 발표하는 미국의 3월 제조업·서비스업... ,"Sun, 22 Mar 2026 16:49:00 +0900"
2026-03-22 08:42:13,투자 안전벨트 꽉 매세요 … '버핏 픽' 금융·에너지株 주목,https://n.news.naver.com/mnews/article/009/0005654010?sid=104,메모리 <b>반도체</b>시장을 3곳(삼성전자·SK하이닉스·마이크론)이 나눠 먹는 구조와 유사하다. 무디스는 경제체력이 떨어진 국가나 실적이 형편없는 기업들에 가차 없이 신용등급 하락 통보를 내릴 정도로 막강한 힘을... ,"Sun, 22 Mar 2026 16:49:00 +0900"
2026-03-22 08:42:13,"'6천피' 눈앞인데…韓 증시, 버블 경고 vs 저평가 논쟁 격화",https://www.ccdailynews.com/news/articleView.html?idxno=2404796,특히 <b>반도체</b> 업황 개선 기대가 여전히 유효하다는 점이 근거로 제시된다. 삼성전자와 SK하이닉스를 중심으로 한 '<b>반도체</b> 슈퍼사이클'이 이어지면 코스피 상승 추세도 유지될 수 있다는 전망이다. 밸류에이션 측면에서도... ,"Sun, 22 Mar 2026 16:48:00 +0900"
2026-03-22 08:42:13,중동 긴장 속 국내 제조업 4월 전망 '암울'… PSI 10개월 만에 하락세,https://www.gokorea.kr/news/articleView.html?idxno=861190,"<b>반도체</b>는 '슈퍼사이클'에 대한 기대가 컸던 3월 전망치에서 31포인트 하락한 147을 기록했으나, 여전히 기준치를 넘어서는 지수를 유지하고 있다. 이는 여타 업종과는 달리 상대적으로 안정된 흐름을 보인 것으로... ","Sun, 22 Mar 2026 16:48:00 +0900"
2026-03-22 08:42:13,"경기도, <b>반도체</b> 기반 ‘양자전환’ 기업 지원 나선다",https://www.kgnews.co.kr/news/article.html?no=888418,도·한국나노기술원 ‘2026년도 양자-<b>반도체</b> 융합산업 경쟁력 강화 산업’ 추진 양자-<b>반도체</b> 융합 R&amp;D·양자전환·기업지원데스크 등 지원 경기도가 미래 전략산업의 핵심인 양자 기술과 도내 주력 산업인 <b>반도체</b> 산업의... ,"Sun, 22 Mar 2026 16:46:00 +0900"
2026-03-22 08:42:13,"머스크, AI <b>반도체</b> 자립 ‘테라팹 프로젝트’ 공개…“연봉 3억6000만원...",https://n.news.naver.com/mnews/article/025/0003510748?sid=101,삼성전자 등 기존 <b>반도체</b> 공급망만으로는 향후 AI 칩 수요를 충족할 수 없다는 판단에서다. 다만 실현까지는 적잖은 난관이 예상되는 만큼 국내 <b>반도체</b> 업계는 향후 파장을 예의주시하고 있다. 머스크는 21일(현지시간)... ,"Sun, 22 Mar 2026 16:45:00 +0900"
2026-03-22 08:42:13,조일웅 한화운용 본부장 “알파 없는 액티브 무의미…수익률로 증명할...,https://n.news.naver.com/mnews/article/029/0003017295?sid=101,"그는 “AI는 <b>반도체</b>에만 국한된 것이 아니라 전력, 에너지, 헬스케어 등 여러 산업으로 확산되고 있다”며 “코스닥에도 이러한 변화 속에서 실질적인 수혜를 받을 수 있는 기업들이 존재한다”고 강조했다. 운용 전략은... ","Sun, 22 Mar 2026 16:43:00 +0900"
2026-03-22 08:42:13,중동발 인플레 파고에 고금리 리스크…경기회복 제동 걸리나,https://www.kbsm.net/news/view.php?idx=512715,"고물가와 고금리 부담이 겹치는 '이중고'로 내수 경기 회복 기대가 흔들리고, <b>반도체</b> 중심의 수출 증가세도... 인공지능(AI) 경기 호황에 힘입어 수출을 견인하는 <b>반도체</b>의 경우, 핵심 운송 수단인 항공 물류길이 차질을... ","Sun, 22 Mar 2026 16:42:00 +0900"
2026-03-22 08:42:13,동탄역 초역세권 주거용 오피스텔 '테라스99' 4월 선봬,http://www.srtimes.kr/news/articleView.html?idxno=199191,"삼성전자 화성캠퍼스, 기흥캠퍼스, 동탄테크노밸리, 용인 <b>반도체</b> 메가 클러스터(예정) 등 직주근접이 가능하다. 이와 함께 단지 앞쪽으로는 축구장 12배 규모(8만9000㎡)의 초대형 랜드마크 공원이 2027년 조성될... ","Sun, 22 Mar 2026 16:38:00 +0900"
