DateTime,Title,Link,Description,PubDate
2025-04-23 16:54:35,[전병서칼럼] 신뢰가 깨지면 미국도 흔들린다,https://www.ajunews.com/view/20250421102541202,전병서 필자 주요 이력 ​ ▷칭화대 석사·푸단대 박사 ▷대우경제연구소 수석연구위원 ▷<b>반도체</b>IT 애널리스트 ▷경희대 경영대학원 객원교수 ▷중국경제금융연구소 소장,"Thu, 24 Apr 2025 01:42:00 +0900"
2025-04-23 16:54:35,트럼프 관세 완화 시사에 엔비디아·AMD 등 <b>반도체</b>주 급등,https://www.tokenpost.kr/news/market/240826,"미국 <b>반도체</b>주가 다시 한번 강한 상승세를 보였다. 도널드 트럼프 대통령이 중국에 대한 관세를 대폭... 이 발언이 전해지자 엔비디아(NVDA), 브로드컴(AVGO), AMD(AMD), 인텔(INTC) 등 핵심 <b>반도체</b> 종목들의 주가가 급등했다.... ","Thu, 24 Apr 2025 01:40:00 +0900"
2025-04-23 16:54:35,"[미국증시 뉴스브리핑] 테슬라 주가 6% 급등, 美 증시 반등 주도",https://www.tokenpost.kr/news/market/240822,"엔비디아, 신제품 기대에 4.4% 상승 엔비디아는 4.4% 상승한 103.28달러에 거래되며 AI <b>반도체</b>와 데이터센터 수요 확대 기대감을 반영했다. 넷플릭스, 구독자 증가세에 1.9% 상승 넷플릭스는 광고 기반 요금제와 공유... ","Thu, 24 Apr 2025 01:32:00 +0900"
2025-04-23 16:54:35,"[마켓인사이드] 시간은 중국편이라던 시진핑 뚝심 통했나, 트럼프 유화...",https://www.news2day.co.kr/article/20250424500001,"특히, 기술 안보, <b>반도체</b> 공급망, 희토류 등 전략 분야에서의 대립은 당분간 지속되겠지만, 소비재 및 농산물 등 일부 품목에서의 관세 완화와 시장 개방 협상은 일정한 진전을 이룰 수 있다는 관측이 우세하다. 실제로... ","Thu, 24 Apr 2025 01:22:00 +0900"
2025-04-23 16:54:35,"&quot;배우고, 실습하고, 채용까지&quot; 경기도교육청, '경기 직업교육 채용형 교...",https://www.cstimes.com/news/articleView.html?idxno=643909,직업계고의 <b>반도체</b> 우수 인재를 영입하게 돼 매우 기대가 크다&quot;며 &quot;현장 중심의 실무 교육과 채용형 실습은 학생의 역량을 높이는 좋은 기회가 될 것&quot;이라고 말했다. 경기도교육청은 이번 협업을 통해 <b>반도체</b> 산업 현장에... ,"Thu, 24 Apr 2025 01:14:00 +0900"
2025-04-23 16:54:35,정치 테마주 급등에 대주주 먹튀… 투자자 83% 손해 봤다,https://n.news.naver.com/mnews/article/023/0003901316?sid=101,이 회사 주가는 지난 14일 이재명 전 민주당 대표가 대선 출마 선언 후 첫 공식 일정으로 인공지능(AI) <b>반도체</b> 기업 퓨리오사AI를 방문해 “AI 투자 100조원 시대를 열겠다”고 하자 6470원에서 8410원으로 상한가(30% 상승)... ,"Thu, 24 Apr 2025 01:11:00 +0900"
2025-04-23 16:54:35,[초점] 트럼프 對中 관세 압박에 日 '샌드위치' 처지…24% 관세에 ‘경제...,http://www.g-enews.com/ko-kr/news/article/news_all/2025042317441283359a1f309431_1/article.html,"NYT에 따르면 일본은 미국에 자동차를, 중국에는 <b>반도체</b> 및 <b>반도체</b> 제조 장비를 주로 수출하고 있으며 미국과 중국은 지난 20년간 일본 수출의 1·2위 시장을 번갈아 차지해왔다. 이 때문에 어느 한쪽의 요구에 따라 관계를... ","Thu, 24 Apr 2025 01:02:00 +0900"
2025-04-23 16:54:35,“윤과 거리둘 생각 전혀 없어…반명이면 누구와도 연대 가능”,https://n.news.naver.com/mnews/article/025/0003436286?sid=100,나는 8년 재임 동안 삼성<b>반도체</b> 평택 유치라든가 GTX 추진 등 10배는 더 일했다고 생각한다. 그런데도 기소된 주변 사람이 없다.” 김문수 대선 경선 후보 핵심 공약 ◦ 법인세ㆍ상속세율 인하 ◦ 30대 그룹 공채 부활... ,"Thu, 24 Apr 2025 00:57:00 +0900"
2025-04-23 16:54:35,"SK하이닉스, 차세대 <b>반도체</b> 기술 CXL 고객 인증",https://n.news.naver.com/mnews/article/005/0001772003?sid=101,SK하이닉스가 CXL 2.0 기반 D램 솔루션 CMM-DDR5 96GB 제품의 고객 인증을 완료했다고 23일 밝혔다. CXL은 PCIe 인터페이스에 기반해 데이터를 빠르게 전송하고 메모리를 효율적으로 활용하는 ‘풀링’ 기능을 탑재한... ,"Thu, 24 Apr 2025 00:55:00 +0900"
2025-04-23 16:54:35,"[사설] 美 관세·中 희토류 갑질에 낀 韓, 실사구시 전략 시급",https://n.news.naver.com/mnews/article/022/0004030315?sid=110,"희토류는 <b>반도체</b> 등 첨단산업의 핵심 광물로 중국이 전 세계 생산의 60%, 가공·정제시장의 90%를 차지한다. 당장 우주항공·방산, 이차전지 기업이 타격을 받을 수 있고 자칫 수입 자체까지 막힐 수 있다. 앞서 미국이 중국산... ","Thu, 24 Apr 2025 00:52:00 +0900"
2025-04-23 16:54:35,[세계타워] 추경은 타이밍… 증액보다 속도,https://n.news.naver.com/mnews/article/022/0004030311?sid=110,"또 수출 회복세를 살리기 위한 통상 대응, AI <b>반도체</b> 연구개발, 데이터센터 인프라 구축 등에는 4조4000억원이 배정됐다. 민생 부담을 덜기 위해 소상공인과 저소득층 지원 예산 4조3000억원이 포함됐다. 하나같이 ‘지체... ","Thu, 24 Apr 2025 00:50:00 +0900"
2025-04-23 16:54:35,"“AI 거점 대학 도약”…단국대, 학부에 인공지능학과 신설",https://n.news.naver.com/mnews/article/022/0004030305?sid=102,"안순철 총장은 “융합인재 수요가 급증하고 있다”며 “지리적으로 가까운 판교·광교 테크노밸리와 용인 <b>반도체</b> 국가산단, 플랫폼시티 등과 협력해 AI 거점 대학으로 도약할 것”이라고 말했다.","Thu, 24 Apr 2025 00:41:00 +0900"
2025-04-23 16:54:35,[오늘의 공매도] 4/23 코스피 공매도 TOP 10... 대원전선 거래량 '23만250...,http://www.finomy.com/news/articleView.html?idxno=227098,"한미<b>반도체</b>, SK하이닉스, 대원전선, HMM, 두산에너빌리티, 인스코비, 신원 등이 이름을 올렸다.... 한미<b>반도체</b> 공매도는 30만5907건으로 나타났다. 이날 한미<b>반도체</b> 주가는 전거래일 대비 13.89%(1만400원)... ","Thu, 24 Apr 2025 00:40:00 +0900"
2025-04-23 16:54:35,[정철근의 퍼스펙티브] 대기업 규제·역차별 확 풀어 제조업 생태계 이...,https://n.news.naver.com/mnews/article/025/0003436261?sid=110,이는 <b>반도체</b>의 두배에 이르는 수치다. 미국의 관세 폭탄으로 자동차 수출이 줄어들면 국내 일자리도 그만큼... <b>반도체</b>만이라도 주 52시간제 규제를 제외하는 <b>반도체</b>특별법도 노조와 민주당의 반대로 국회에 묶여있다.... ,"Thu, 24 Apr 2025 00:28:00 +0900"
2025-04-23 16:54:35,[시론] 자유무역과 다자주의 위협하는 트럼프 2기,https://n.news.naver.com/mnews/article/025/0003436257?sid=110,대상에는 <b>반도체</b>·의약품·구리·목재뿐 아니라 핵심광물이나 희토류가 들어간 가공품과 파생상품까지 포함하고 있다. 언제 어떤 품목이 트럼프 정부의 고관세 표적이 될지 오리무중이다. 트럼프 2기 정부는 <b>반도체</b>... ,"Thu, 24 Apr 2025 00:24:00 +0900"
2025-04-23 16:54:35,[양상훈 칼럼] ‘이재명’보다 백 배는 심각한 중국,https://n.news.naver.com/mnews/article/023/0003901267?sid=110,"이재명은 5년 문제이지만 중국은 100년 문제 모든 산업 따라잡혔는데 이제 뭘 먹고 사나 <b>반도체</b>마저... 문제는 <b>반도체</b> 하나를 빼고 12개 업종 모두에서 중국에 뒤졌다는 사실이다. 중국은 자동차, 조선, 일반기계, 건설기계... ","Thu, 24 Apr 2025 00:18:00 +0900"
2025-04-23 16:54:35,"2차전지 소재·부품 관련주, '광대승천' 애경케미칼·대진첨단소재·메...",http://www.finomy.com/news/articleView.html?idxno=227089,국내 <b>반도체</b> 및 이차전지 소재 기업인 켐트로스가 초미세 <b>반도체</b> 공정의 극자외선(EUV) 광원용 소재 양산을 추진한다. 켐트로스는 올해 상반기까지 관련 제조시설 투자를 마치고 하반기부터 국내 고객사에 본격적인... ,"Thu, 24 Apr 2025 00:16:00 +0900"
2025-04-23 16:54:35,[노트북을 열며] 대만 민진당의 ‘원전 제로’ 결말,https://n.news.naver.com/mnews/article/025/0003436250?sid=110,<b>반도체</b>로 흥하던 시절이었다. 이후 잃어버린 30년. 규슈가 명성을 되찾고 있다. 세계 최대 파운드리 TSMC가... 대만에서 가장 전기를 많이 쓰는 TSMC는 내년부터 차세대 <b>반도체</b> 공장도 가동한다. 민진당 정권이 ‘전가의... ,"Thu, 24 Apr 2025 00:14:00 +0900"
2025-04-23 16:54:35,4월 4주차 국내 ESG 핫클립,http://www.impacton.net/news/articleView.html?idxno=14863,"정부, <b>반도체</b> 경쟁력 강화에 33조원 투자…AI·팹리스 기술 집중 지원 정부는 <b>반도체</b> 산업 경쟁력 강화를 위해 올해부터 3년간 총 33조원 규모의 재정을 투입하기로 했다. 지원 분야는 인프라 구축, 소재·부품·장비... ","Thu, 24 Apr 2025 00:08:00 +0900"
2025-04-23 16:54:35,'지역인재 채용' <b>반도체</b> 도시 원주 잰걸음,https://n.news.naver.com/mnews/article/654/0000117794?sid=102,"원주시가 잇단 <b>반도체</b> 기업 유치 성공에 이어 이들 기업의 지역 인재 채용에 나서며 <b>반도체</b> 도시 도약을 향한 행보에 가속을 붙이고 있다. 시는 민선 8기 출범과 동시에 '<b>반도체</b> 도시 도약'을 표방하며 기업 유치, 국내 1호... ","Thu, 24 Apr 2025 00:07:00 +0900"
2025-04-23 16:54:35,"<b>반도체</b> 재료·부품 관련주, '봄꽃 만개' 3S·메가터치... '시들시들' 유...",http://www.finomy.com/news/articleView.html?idxno=227091,<b>반도체</b> 재료·부품 관련주들이 전 거래일 대비 3.22% 상승으로 장을 마감했다. 23일 한국거래소에 따르면... 3S는 경기 안성시에 총 611억원을 투자해 <b>반도체</b> 웨이퍼 캐리어 및 이차전지 시험설비 분야 사업 확장을... ,"Thu, 24 Apr 2025 00:06:00 +0900"
2025-04-23 16:54:35,"[사설] 한미 2+2 통상 협의 돌입, 속도 아니라 국익이 중요하다",https://n.news.naver.com/mnews/article/011/0004477671?sid=110,정부는 조선·에너지·<b>반도체</b> 등 양국이 ‘윈윈’할 수 있는 산업 협력 방안을 제시해 한미 동맹을 실질적으로 격상할 수 있도록 해야 할 것이다. 대미 수출 타격이 현실화하는 만큼 협상이 타결될 때까지 상호관세 유예가... ,"Thu, 24 Apr 2025 00:06:00 +0900"
2025-04-23 16:54:35,4월 4주차 해외 ESG 핫클립,http://www.impacton.net/news/articleView.html?idxno=14860,"중국, <b>반도체</b> 원산지 기준 개정 제안…패키징 여부 무관한 판정 원칙 제시 중국<b>반도체</b>산업협회는 <b>반도체</b> 수입 시 패키징 여부와 관계없이 웨이퍼 가공이 이뤄진 국가를 원산지로 간주해야 한다는 제안을 발표했다.... ","Thu, 24 Apr 2025 00:04:00 +0900"
2025-04-23 16:54:35,“파인세라믹스 산업 상생 협력 모색”…강릉서 국내 주요 기업 한자리...,https://n.news.naver.com/mnews/article/087/0001112773?sid=102,"강원테크노파크 신소재센터와 (사)한국파인세라믹스협의회 공동 주최로 열린 이날 교류회는 <b>반도체</b> 산업의... 김형우 한국전기연구원 차세대<b>반도체</b>연구센터장은 'SiC 전력<b>반도체</b> 소자 기술 및 시장 동향'을, 이기성... ","Thu, 24 Apr 2025 00:02:00 +0900"
2025-04-23 16:54:35,"이재명, '탈원전' 폐기 군불 때나…업계 기대감 솔솔",https://n.news.naver.com/mnews/article/629/0000384622?sid=101,특히 대선 출마 선언 후 첫 공식 일정으로 AI <b>반도체</b> 스타트업을 찾아 'AI 투자 100조원 시대'를 열겠다고 공언한 만큼 문재인 정부의 탈원전 정책을 폐기할 가능성이 제기된다. AI산업 활성화를 위해서는 대규모 전력의... ,"Thu, 24 Apr 2025 00:01:00 +0900"
2025-04-23 16:54:35,&quot;의료 AI <b>반도체</b> 분야 글로벌 인재양성·산업혁신 출발점 제시&quot;,https://n.news.naver.com/mnews/article/087/0001112756?sid=102,의료AI <b>반도체</b> 분야의 글로벌 협력과 혁신을 위한 장이 원주에서 마련된다. 연세대 미래캠퍼스가 오는 29~30일 이틀간 '2025 글로벌 의료 AI &amp; <b>반도체</b> 파트너 서밋(Global Medical AI&amp;Semiconductor Partner Summit)'을 개최한다.... ,"Thu, 24 Apr 2025 00:01:00 +0900"
2025-04-23 16:54:35,미·중 과학기술 역전 시대의 의미 [아침을 열며],https://n.news.naver.com/mnews/article/469/0000861189?sid=110,"미국은 <b>반도체</b>, 인터넷, 모바일, 그리고 인공지능(AI)에 이르는 매 변혁의 최전선에서 최강 지위를 지킬 수... 제조업 기반으로 국부를 일으키고, 산업화를 거쳐 <b>반도체</b>와 모바일, 그리고 AI에 이르기까지 한국은 글로벌... ","Thu, 24 Apr 2025 00:00:00 +0900"
2025-04-23 16:54:35,내수비중 OECD ‘최하위’…관세충격 못 버틴다,https://www.junggi.co.kr/article/articleView.html?no=33868,제조업의 취업유발계수는 2000년 15.4에서 2020년 6.3까지 떨어졌고 특히 <b>반도체</b>·화학 등 수출을 이끄는 산업들은 더욱 낮은 것으로 나타났다. 수출이 잘되더라도 고용을 통한 내국인 소득과 소비 증가가 유발되지... ,"Thu, 24 Apr 2025 00:00:00 +0900"
2025-04-23 16:54:35,"김성태 IBK기업은행장, 안양과천상공회의소에서 중소기업 현장 간담회",https://www.ngonews.kr/news/articleView.html?idxno=205831,"이날 간담회에서 김성태 은행장은 &quot;경제 발전을 주도해 온 전통 제조 기업부터 미래 산업을 선도할 소프트웨어, <b>반도체</b> 기업까지 현장의 다양한 의견을 직접 들을 수 있는 뜻깊은 자리였다&quot;며, &quot;중소기업 위기극복... ","Wed, 23 Apr 2025 23:58:00 +0900"
2025-04-23 16:54:35,"인텔(INTC), 20% 대규모 감원 추진 소식에 주가 급등…CEO 첫 실적 발표...",https://www.tokenpost.kr/news/tech/240781,"파운드리 전환, 고성능 AI칩 개발 등 장기 전략과 함께, 강도 높은 비용 구조 조정이 병행되는 상황에서 인텔이 과연 어떤 성과를 드러낼지는 당분간 금융시장과 <b>반도체</b> 업계에서 큰 화두가 될 전망이다.","Wed, 23 Apr 2025 23:30:00 +0900"
2025-04-23 16:54:35,"[마감] 대법, 이재명 사건 24일 심리 테마주 '급락'...한미<b>반도체</b> '급등...",https://www.asiatime.co.kr/article/20250423500432,"이날 도널드 트럼프 대통령이 중국과의 협상이 순조롭게 진행 중이라고 언급하는 등 미국 정부 주요 인사들이 잇따라 긍정적인 발언을 내놓으면서 <b>반도체</b>주가 강세를 보인 가운데, 한미<b>반도체</b>(14.29%)가 급등해... ","Wed, 23 Apr 2025 23:28:00 +0900"
2025-04-23 16:54:35,국민의힘 2차 경선 4명 압축…찬탄·반탄 구도로,https://www.gnnews.co.kr/news/articleView.html?idxno=608650,한 후보는 수도권 집중 문제 해결을 위해 인공지능(AI)·바이오·에너지·미래차·<b>반도체</b> 등 5대 산업 분야를 중심으로 '5대 메가폴리스'를 조성하겠다고 밝혔다. 홍 후보는 서울 용산에서 대한의사협회 관계자들과 만나... ,"Wed, 23 Apr 2025 23:26:00 +0900"
2025-04-23 16:54:35,“조선·에너지 기술 앞세워 韓이익 최대한 챙겨야…美 싱크탱크들의 조...,https://n.news.naver.com/mnews/article/009/0005481565?sid=100,"그는 “한국은 조선, 에너지 협업, <b>반도체</b>, 우주항공 등 여러 분야에서 미국에 엄청난 배당금을 지급하고... 대만·일본과 <b>반도체</b> 공급망 협력을 강화하는 방안도 고려할 수 있다”고 소개했다. CPTPP는 트럼프 대통령의 관세... ","Wed, 23 Apr 2025 23:19:00 +0900"
2025-04-23 16:54:35,"김성태 IBK기업은행장, 안양과천상공회의소에서 중소기업 현장 간담회 ...",http://www.paxetv.com/news/articleView.html?idxno=230285,"이날 간담회에서 김성태 은행장은 &quot;경제 발전을 주도해 온 전통 제조 기업부터 미래 산업을 선도할 소프트웨어, <b>반도체</b> 기업까지 현장의 다양한 의견을 직접 들을 수 있는 뜻깊은 자리였다&quot;며, &quot;중소기업 위기극복... ","Wed, 23 Apr 2025 23:14:00 +0900"
2025-04-23 16:54:35,"강원대 엄한돈 교수 연구팀, <b>반도체</b> 식각 혁신기술 개발",https://n.news.naver.com/mnews/article/030/0003306410?sid=102,엄한돈 강원대학교 화공·생물공학부 교수가 참여한 공동연구팀이 <b>반도체</b> 제조 공정의 고질적인 한계를... 구현해 <b>반도체</b> 제조의 새로운 패러다임을 제시했다. 건식 식각 기술은 오존을 활용해 기존 산소 기반... ,"Wed, 23 Apr 2025 23:12:00 +0900"
2025-04-23 16:54:35,"[천지일보 사설] 중국의 경제 위협, 단호하고 전략적으로 대응하라",https://www.newscj.com/news/articleView.html?idxno=3261764,"경제적으로는 <b>반도체</b>와 원자재 공급망을 무기화하고, 안보적으로는 동북아 지역에서의 군사적 존재감을 강화하면서 국익에 반하는 강압 외교를 펼치고 있다. 먼저 경제 측면에서 중국은 한국의 핵심 산업인 <b>반도체</b>... ","Wed, 23 Apr 2025 22:56:00 +0900"
2025-04-23 16:54:35,"LG이노텍, 1분기 역대 최대 매출",https://www.gukjenews.com/news/articleView.html?idxno=3258432,"9% 감소했다 회사 관계자는 &quot;계절적 비수기에도 불구하고 고사양 카메라 모듈의 안정적 공급, <b>반도체</b>... 박지환 CFO(전무)는 &quot;FC-BGA(Flip Chip-Ball Grid Array), 차량 AP 모듈을 앞세운 AI·<b>반도체</b>용 부품, 차량용 센싱... ","Wed, 23 Apr 2025 22:46:00 +0900"
2025-04-23 16:54:35,미국 뉴욕증시 장초반 상승 출발…나스닥 급등·테슬라↑·엔비디아↑·...,https://www.topstarnews.net/news/articleView.html?idxno=15646662,"ETF 중에서는 고위험 고수익 전략을 취하는 프로셰어즈 울트라프로 QQQ ETF가 9.14% 급등하며 가장 강한 상승 탄력을 보였고, <b>반도체</b> 레버리지 상품인 디렉션 데일리 세미컨덕터 불 3X 셰어즈 ETF는 무려 13.5% 치솟아... ","Wed, 23 Apr 2025 22:40:00 +0900"
2025-04-23 16:54:35,"충북테크노파크, <b>반도체</b>산업 역량강화 세미나 마무리",http://www.breaknews.com/1111937,"(재)충북테크노파크(이하 충북TP)는 4월 23일, 도내 <b>반도체</b> 기업을 대상으로 개최한 ‘<b>반도체</b>산업 역량강화 세미나’를 성공적으로 마무리했다. 이번 세미나는... ","Wed, 23 Apr 2025 22:40:00 +0900"
2025-04-23 16:54:35,"엔페이즈 에너지, 실적 부진에 관세 악재까지…주가 11% 급락",https://www.tokenpost.kr/news/market/240756,"<b>반도체</b> 기반 태양광 인버터 및 에너지 저장 시스템을 제조하는 엔페이즈는 최근 발표한 1분기 실적에서 시장 기대를 충족시키지 못했고, 향후 실적에 악영향을 미칠 신재생에너지 관련 *관세 이슈*까지 불거지며... ","Wed, 23 Apr 2025 22:38:00 +0900"
2025-04-23 16:54:35,"베트남, 미국과 무역 협상 시작",https://www.tokenpost.kr/news/breaking/240741,"베트남은 <b>반도체</b>, 전자제품 등 첨단 산업 분야에서 주요 파트너가 되는 것을 목표로 미국과 다양한 분야에서 협상을 이어갈 것으로 예상된다. 이번 협상에 대한 구체적인 일정이나 세부 내용은 아직 공개되지 않았다.","Wed, 23 Apr 2025 22:10:00 +0900"
2025-04-23 16:54:35,"김성태 IBK기업은행장, 안양과천상공회의소에서 중소기업 현장 간담회 ...",http://www.newslock.co.kr/news/articleView.html?idxno=107963,"이날 간담회에서 김성태 은행장은 &quot;경제 발전을 주도해 온 전통 제조 기업부터 미래 산업을 선도할 소프트웨어, <b>반도체</b> 기업까지 현장의 다양한 의견을 직접 들을 수 있는 뜻깊은 자리였다&quot;며, &quot;중소기업 위기극복 지원을... ","Wed, 23 Apr 2025 22:04:00 +0900"
2025-04-23 16:54:35,"[영상] 中, 세계 최초 '피코초급' 비휘발성 메모리 개발…플래시·D램 한...",https://www.theguru.co.kr/news/article.html?no=86270,"미중 갈등 속 <b>반도체</b> 기술 패권 경쟁이 격화되는 가운데, 이번 성과가 중국의 <b>반도체</b> 자립 전략에 힘을 실어줄 돌파구가 될 수 있을지 주목됩니다. 자세한 내용은 더구루 홈페이지에서 만나보실 수 있습니다. ◇ 더구루... ","Wed, 23 Apr 2025 22:00:00 +0900"
2025-04-23 16:54:35,TK 공약 쏟아지지만...&quot;차별성 없는 재탕&quot;,https://www.tbc.co.kr/news/view?pno=20250423163551AE04475&id=195069,"&quot;] 안철수 후보는 경북에는 <b>반도체</b>와 배터리, 바이오와 소형 모듈 원자로 SMR 생태계를 구축하고 대구에는 AI와 <b>반도체</b> 융합 단지를 만드는 한편 교통망도 확충하겠다는 10대 공약을 발표했습니다. [안철수 / 국민의힘 대선... ","Wed, 23 Apr 2025 22:00:00 +0900"
2025-04-23 16:54:35,"경기도교육청, <b>반도체</b> 분야 채용연계 교육과정 운영",https://n.news.naver.com/mnews/article/056/0011938043?sid=102,,"Wed, 23 Apr 2025 21:48:00 +0900"
2025-04-23 16:54:35,"코스피, 3주 만에 2천500선 회복…코스닥도 700선 유지",https://www.idaegu.com/news/articleView.html?idxno=635611,"업종별로는 <b>반도체</b>·이차전지·자동차 관련 종목이 강세를 보였다. <b>반도체</b> 관련주는 삼성전자(1.27%), SK하이닉스(4.14%), 한미<b>반도체</b>(14.29%), 디아이(4.40%) 등의 상승이 도드라졌다. LG에너지솔루션(5.12%), 삼성SDI(7.... ","Wed, 23 Apr 2025 21:46:00 +0900"
2025-04-23 16:54:35,디지털·자동화…충북 고용 시장 양극화 뚜렷,https://n.news.naver.com/mnews/article/056/0011937958?sid=101,충북의 경우 제조업 중심으로 발전해 온 데다 이 가운데서도 <b>반도체</b>와 전기·전자 등 장치 산업의 비중이 커 자동화·디지털 시대에 더 민감할 수밖에 없다는 분석입니다. KBS 뉴스 구병회입니다. 촬영기자:박준규/그래픽... ,"Wed, 23 Apr 2025 21:40:00 +0900"
2025-04-23 16:54:35,金 싱크탱크 출범- 洪 현역 40여명- 韓 양향자 합류,https://www.idaegu.co.kr/news/articleView.html?idxno=507747,한 후보는 이날 기자회견에서 &quot;양 후보는 대한민국 <b>반도체</b>와 첨단산업을 발전시켜 이 나라를 우상향하겠다는 의지를 말뿐 아니라 의정·정치 활동을 통해 실천해 오신 분&quot;이라며 &quot;함께 이 나라를 바꾸기로 했다&quot;고 말했다.... ,"Wed, 23 Apr 2025 21:34:00 +0900"
2025-04-23 16:54:35,[신간] TSMC와 트럼프 이펙트 : 대격변 예고,https://www.idaegu.co.kr/news/articleView.html?idxno=507709,콜리 황 지음/ 경이로움/ 360쪽/ 3만원 TSMC는 더이상 단순한 <b>반도체</b> 기업이 아니다. 세계 공급망의 중심에서 기술과 지정학을 동시에 설계하는 전략 플랫폼이 된 TSMC는 트럼프 2.0 시대의 미국 우선주의는 <b>반도체</b>를... ,"Wed, 23 Apr 2025 21:34:00 +0900"
2025-04-23 16:54:35,통상 불확실성에 5월 기업 경기 전망 '흐림',https://www.idaegu.co.kr/news/articleView.html?idxno=507741,"이상호 한경협 경제산업본부장은 &quot;미국발 관세 정책과 주요국의 맞대응으로 국제 교역 불확실성이 커지고 있다&quot;며 &quot;<b>반도체</b>, 석유화학, 자동차, 철강 등 수출 주력 업종에 대한 투자 촉진과 세제 지원으로 기업... ","Wed, 23 Apr 2025 21:34:00 +0900"
