DateTime,Title,Link,Description,PubDate
2025-09-08 09:49:20,"<b>반도체</b> 장비 ASML, 프랑스 AI 스타트업 미스트랄에 15억달러 베팅...왜?",https://www.digitaltoday.co.kr/news/articleView.html?idxno=590387,ASML [사진: 셔터스톡] 네덜란드 <b>반도체</b> 장비 업체 ASML이 프랑스 AI 모델 개발 스타트업 미스트랄에 15억달러를 투자했다고 로이터통신이 8일(현지시간) 보도했다. 이번 투자에서 미스트랄은 회사 가치를 117억달러... ,"Mon, 08 Sep 2025 18:48:00 +0900"
2025-09-08 09:49:20,"구윤철 &quot;기재부 분리, 조율 잘할것… 재정구조 혁신 TF 출범&quot; [정부 조직...",https://n.news.naver.com/mnews/article/014/0005403551?sid=101,기재부가 거시경제 관리(매크로 매니지먼트)에 주력하지만 중장기적으로 '마이크로 타기팅' 차원에서 실리콘카바이드(SiC) 전력<b>반도체</b> 기술 자립률 20% 등 초혁신경제 선도프로젝트를 구체화하겠다는 것이다. 구... ,"Mon, 08 Sep 2025 18:47:00 +0900"
2025-09-08 09:49:20,17년 만에 과기부총리 격상 'AI 컨트롤타워' 명시… AI정책 실행력에 성...,https://n.news.naver.com/mnews/article/014/0005403557?sid=105,"국산 AI <b>반도체</b> 도입 비율을 2023년까지 무리하게 끌어올리도록 한 것도 민간 참여를 막는 요인이었다.... 공공 출자금에 대한 매수청구권(바이백) 조항은 삭제했고, 국산 AI<b>반도체</b> 의무 도입 규정은 단계적 도입... ","Mon, 08 Sep 2025 18:47:00 +0900"
2025-09-08 09:49:20,"LS전선, 국내 최초 MV 내화 케이블 상용화",https://www.koreaittimes.com/news/articleView.html?idxno=145497,"데이터센터와 <b>반도체</b> 공장, 초고층 빌딩, 대형 쇼핑몰 등 다중이용시설의 화재 안전과 현장 작업 인력의... 이번 신제품은 830℃의 고온에서도 전력 공급이 가능해 데이터센터, <b>반도체</b> 공장, 대규모 다중이용시설... ","Mon, 08 Sep 2025 18:42:00 +0900"
2025-09-08 09:49:20,"구글, 'AI 칩' 외부 공급 확대… 엔비디아 독점 체제 균열 신호탄?",https://www.thepublic.kr/news/articleView.html?idxno=275837,알리바바도 최근 독자 AI 칩 개발 사실을 공개하며 중국 내 AI <b>반도체</b> 역량 확대에 합류했다. 미국에서는 AMD가 AI 칩 시장의 또 다른 변수로 꼽힌다. AMD는 'MI 시리즈'를 보유하고 있으며 2023년 말에는 대규모 언어... ,"Mon, 08 Sep 2025 18:42:00 +0900"
2025-09-08 09:49:20,"전북 13개 시군 관통하는 초고압 송전선로 1000여km, 도 대책없나",https://www.jjan.kr/article/20250908580220,"서 의원에 따르면, 송전선로 건설 계획은 전 윤석열 정부가 용인 <b>반도체</b> 클러스터 국가산단 조성을 위해 예비타당성 조사 없이 562조원이라는 천문학적 예산을 투입하며 수립한 제11차 전력수급기본계획에 근거하고... ","Mon, 08 Sep 2025 18:40:00 +0900"
2025-09-08 09:49:20,"이현이, 하와이 여행→子 부상 응급실 行…아찔 사고 [RE:뷰]",https://m.entertain.naver.com/article/213/0001352057,"2012년 <b>반도체</b> 개발 엔지니어 홍성기 씨와 결혼한 이현이는 윤서, 영서 두 아들을 품에 안았다. 이현이 부부는 SBS '동상이몽2 - 너는 내 운명'에 동반 출연해 결혼 생활을 공개하기도 했다. 이현이는 2005년 모델로 데뷔해... ","Mon, 08 Sep 2025 18:38:00 +0900"
2025-09-08 09:49:20,"SK하이닉스, 2분기 eSSD 매출 47%↑…1위 삼성 맹추격",https://www.seoultimes.news/news/article.html?no=2000079857,<b>반도체</b>업계 한 관계자는 “AI 데이터센터 투자가 본격화되면서 eSSD는 필수 인프라로 자리 잡았다”며 “SK하이닉스는 D램·낸드·HBM에 이어 SSD 경쟁력까지 강화하며 글로벌 클라우드 시장에서 입지를 확대할... ,"Mon, 08 Sep 2025 18:38:00 +0900"
2025-09-08 09:49:20,대통령 직속 '국가 AI 전략위원회' 닻 올렸다,http://www.hidomin.com/news/articleView.html?idxno=591854,"아울러 민간에서 우려하는 지분구조(민간 49% → 70%↑)·매수청구권(부과 → 삭제), 국산 AI<b>반도체</b> 도입 의무(부여→조정) 등 공모요건 변경을 통해, 민간 경영 자율성을 보장하고 투자 리스크를 완화하여 새롭게... ","Mon, 08 Sep 2025 18:36:00 +0900"
2025-09-08 09:49:20,주도주 '<b>반도체</b>·방산' 담은 외인 웃고… 팔아치운 개미 울고,https://n.news.naver.com/mnews/article/014/0005403531?sid=101,"9월 들어 외국인이 '<b>반도체</b>·방산' 종목을 사들이며 수익을 챙겼지만, 개인은 같은 종목을 팔아치워 희비가... 증권가에서는 외국인의 매수세를 <b>반도체</b> 업황 개선 기대와 방산 수주 모멘텀에서 해석하고 있다. 메모리... ","Mon, 08 Sep 2025 18:35:00 +0900"
2025-09-08 09:49:20,아이티엠<b>반도체</b> “급속충전 배터리 회로 특허…성장기반 강화”,https://n.news.naver.com/mnews/article/025/0003467608?sid=101,배터리 보호회로 기술 전문업체인 아이티엠<b>반도체</b>(대표 나혁휘)는 ‘배터리 보호회로 패키지 및 제조 방법’... 아이티엠<b>반도체</b>가 이번에 등록한 특허는 배터리 충전·방전 과정에서 발생하는 발열을 효과적으로 제어할... ,"Mon, 08 Sep 2025 18:35:00 +0900"
2025-09-08 09:49:20,'AI월드'기조강연자로 나서는 제리 카플란 스탠퍼드대 교수 [미리보는 ...,https://n.news.naver.com/mnews/article/014/0005403515?sid=101,"전 세계 시장을 선도하고 있는 <b>반도체</b>, 디스플레이, 그 성공모델 속에서 AI 시대 최적의 대응법을 찾을 수... 그는 한국 삼성전자, LG전자 등의 <b>반도체</b>, 디스플레이 성공신화를 대표적인 예로 들었다. &quot;한국은 <b>반도체</b>나 평판... ","Mon, 08 Sep 2025 18:33:00 +0900"
2025-09-08 09:49:20,"ASML, 미스트랄 2조 투자로 최대 주주 등극",https://www.aitimes.com/news/articleView.html?idxno=202195,"네덜란드 <b>반도체</b> 장비 업체 ASML이 프랑스 인공지능(AI) 스타트업 미스트랄의 최대 주주가 될 전망이다.... ASML은 세계 유일의 극자외선(EUV) 리소그래피 장비 공급업체로, TSMC와 삼성 등에 첨단 <b>반도체</b> 생산 장비를... ","Mon, 08 Sep 2025 18:30:00 +0900"
2025-09-08 09:49:20,글로벌 AI 패권 경쟁 치열…&quot;필드로봇 피지컬AI 기술 선점해야 AI 강국&quot;,https://www.goodkyung.com/news/articleView.html?idxno=271873,"한용희 그로쓰리서치 대표는 &quot;피지컬 AI는 산업 구조, 노동 시장, 에너지 인프라까지 바꿀 수 있는 변곡점 기술로 한국 기업들이 AI <b>반도체</b>·배터리·로봇 융합을 통해 글로벌 전략적 파트너로 도약할 기회를 잡아야 한다... ","Mon, 08 Sep 2025 18:30:00 +0900"
2025-09-08 09:49:20,"李정부 '원전주권' 강화 시도…한전, 美에 한국형 도입 요청",https://www.pinpointnews.co.kr/news/articleView.html?idxno=374652,한편 일본 <b>반도체</b> 기업 도시바가 2006년 WEC를 54억달러(당시 약 6조원)에 인수했다. 인수 가격은 당초 예상 매각가격 17억 달러의 3배에 달한 것으로 전해졌다. 그러나 도시바는 2011년 3월 동일본 대지진의 여파로 후쿠시마... ,"Mon, 08 Sep 2025 18:30:00 +0900"
2025-09-08 09:49:20,"삼성·SK하이닉스 VEU 지위 박탈한 美, 중국 반출 연간 허가 검토",https://n.news.naver.com/mnews/article/025/0003467604?sid=101,삼성전자와 SK하이닉스가 미국산 <b>반도체</b> 제조 장비를 중국 내 공장에 반입할 수 있게 될 전망이다. 트럼프... 중국 내 공장에서 상당량의 메모리 <b>반도체</b>를 생산 중인 한국 기업들 입장에서는 운영에 상당한 차질이 빚어질... ,"Mon, 08 Sep 2025 18:29:00 +0900"
2025-09-08 09:49:20,"포항시, 그래핀 등 2차원 소재 응용기술 개발로 세계적 상용화 거점 도...",https://www.nspna.com/news/?mode=view&newsid=775870,"포스텍, 교육부 글로컬랩 ‘초박막 대면적 <b>반도체</b> 소재개발 및 상용화 지원’ 공모 선정 포항시가 그래핀을... 대면적 <b>반도체</b> 소재개발 및 상용화 지원’ 공모에 최종 선정됐다고 8일 밝혔다. 이번 선정으로 포스텍은 향후... ","Mon, 08 Sep 2025 18:28:00 +0900"
2025-09-08 09:49:20,국립창원대 김윤하 대학원생 '이공분야 석사과정생연구장려금지원사업...,http://www.veritas-a.com/news/articleView.html?idxno=571222,지도교수인 서순범 교수(기초과학부 <b>반도체</b>물리학전공)는 &quot;김윤하 학생은 학부연구생 시절부터 이론적 통찰과 실험 설계 능력을 두루 갖추어 왔다&quot;며 &quot;이번 연구 과제를 통해 응집물질 및 양자물성 분야에 의미 있는... ,"Mon, 08 Sep 2025 18:28:00 +0900"
2025-09-08 09:49:20,글로벌 불확실성과 한국의 고민 / 김일태,http://www.kjdaily.com/article.php?aid=1757323465663359028,"불확실성이 국가 상호관세 부과 근거인 국제비상경제권한법의 법적 논란, <b>반도체</b> 보조금 기업의 지분... 미국은 과거 제조업의 영광을 꿈꾸며 중국 견제를 위해 대중국 미국산 부품을 통제하고 <b>반도체</b> 공장을 자국에... ","Mon, 08 Sep 2025 18:28:00 +0900"
2025-09-08 09:49:20,"[재계·산업동향]한화·포스코, 첨단·안전 산업 드라이브…미래 사업 ...",https://www.nspna.com/news/?mode=view&newsid=775875,"고온 830℃에서도 전력 공급이 가능해 AI 데이터센터, <b>반도체</b> 공장, 초고층 빌딩 등 고전력 시설에 최적화됐다. 기존 3단계 시공 대비 설치 효율과 현장 안전성을 높였으며 향후 국내 표준 인증을 거쳐 내수 시장 확산도... ","Mon, 08 Sep 2025 18:28:00 +0900"
2025-09-08 09:49:20,"대전시-KAIST, <b>반도체</b> 인재·산업 동반 도약 본격화",https://daily.hankooki.com/news/articleView.html?idxno=1268074,8일 이장우 시장이  KAIST 전기및전자공학동(E3-2)에서 열린 '<b>반도체</b>공학대학원 첨단장비 개소식'에서 인사말을 하고 있다. 사진=대전시 제공  대전시는 8일 KAIST 전기및전자공학동(E3-2)에서 '<b>반도체</b>공학대학원 첨단장비... ,"Mon, 08 Sep 2025 18:28:00 +0900"
2025-09-08 09:49:20,"&quot;美, 삼성·SK 中 공장에 '미국산 <b>반도체</b> 장비' 매년 허가 검토",https://n.news.naver.com/mnews/article/214/0001447853?sid=104,미국산 <b>반도체</b> 제조장비를 반입할 때 매년 허가받도록 하는 방안을 적극 검토 중인 것으로 전해졌습니다. 블룸버그통신은 현지시간으로 오늘 소식통을 인용해 미국 상무부가 지난주 한국정부에 중국 내 한국 <b>반도체</b>공장에... ,"Mon, 08 Sep 2025 18:27:00 +0900"
2025-09-08 09:49:20,"美, 삼성·하이닉스 中<b>반도체</b> 공장에 장비·부품 공급 승인 검토",https://n.news.naver.com/mnews/article/421/0008473668?sid=104,미국 정부가 삼성전자와 SK하이닉스의 중국 내 <b>반도체</b> 공장에 대한 장비·부품 수출을 연간 승인 방식으로... 미국 바이든 행정부는 2022년부터 중국의 <b>반도체</b>·AI 기술력을 견제하기 위해 광범위한 수출 통제를... ,"Mon, 08 Sep 2025 18:24:00 +0900"
2025-09-08 09:49:20,닻 오른 '국가 인공지능 전략委'… AI 3대 강국 진입 속도낸다,https://n.news.naver.com/mnews/article/014/0005403498?sid=105,신경망처리장치(NPU)를 주축으로 한 국산 AI <b>반도체</b>를 2030년까지 50% 가량 도입하는 방안도 의무화하지 않기로 했다. 국가 AI 컴퓨팅 센터는 2028년까지 첨단 그래픽처리장치(GPU)를 1만5000장 이상 확보한다는 계획이다.,"Mon, 08 Sep 2025 18:24:00 +0900"
2025-09-08 09:49:20,"대전시-KAIST, <b>반도체</b> 인재양성·산업발전 시동",https://www.cctoday.co.kr/news/articleView.html?idxno=2218462,"차세대 <b>반도체</b> 인재 양성과 기술개발을 위한 첨단 연구 기반 구축에 본격 나섰다.시는 8일 KAIST 전기및전자공학동(E3-2)에서 '<b>반도체</b>공학대학원 첨단장비 개소식'을 개최했다.이날 행사에는 이장우 대전시장, 이광형... ","Mon, 08 Sep 2025 18:22:00 +0900"
2025-09-08 09:49:20,"진천군, '25년 생거진천 취업박람회 오는 18일 개최",http://www.breaknews.com/1146106,"특히 진천군의 미래 산업인 식품 바이오, <b>반도체</b>, 의약품·의료기기 등 전략 산업 분야 기업들이 대거 참여해 양질의 일자리 정보를 제공하고 현장 채용 기회를 마련할... ","Mon, 08 Sep 2025 18:22:00 +0900"
2025-09-08 09:49:20,[유미's 픽] 李대통령이 발탁한 국가대표 AI 전문가들…'민간 위원' 구성...,https://n.news.naver.com/mnews/article/092/0002389510?sid=105,백 대표는 AI <b>반도체</b>·엣지 컴퓨팅 등 전략적 산업 생태계 조성에 나설 적합한 전문가로 평가된다. 이 전무는... 인공지능 <b>반도체</b> 기술 확보 등도 다룰 예정&quot;이라고 설명했다. 위원회 분과 중 가장 큰 기대감을 모으고... ,"Mon, 08 Sep 2025 18:21:00 +0900"
2025-09-08 09:49:20,"&quot;단기 수급보다 성장성&quot;…연기금, 삼성전기·현대로템·네이버 담았다",https://n.news.naver.com/mnews/article/011/0004530633?sid=101,"연기금이 대형 <b>반도체</b>주 대신 소부장(소재·부품·장비), 방산, 인공지능(AI) 소프트웨어 등의 종목으로... <b>반도체</b> 소부장, 방산, B2B(기업간거래) AI 소프트웨어 업종의 실적 개선 가능성을 높게 평가하고 투자처로... ","Mon, 08 Sep 2025 18:21:00 +0900"
2025-09-08 09:49:20,"국립창원대 김윤하 대학원생, '이공분야 석사과정생연구장려금지원사업...",https://www.newsgn.com/news/articleView.html?idxno=502940,지도교수인 서순범 교수(기초과학부 <b>반도체</b>물리학전공)는 &quot;김윤하 학생은 학부연구생 시절부터 이론적 통찰과 실험 설계 능력을 두루 갖추어 왔다&quot;며 &quot;이번 연구 과제를 통해 응집물질 및 양자물성 분야에 의미 있는... ,"Mon, 08 Sep 2025 18:20:00 +0900"
2025-09-08 09:49:20,"이동환 고양특례시장, 독일 도시협의회·연방상원 및 IFA 방문",https://ilyo.co.kr/?ac=article_view&entry_id=499306,운영하며 지속가능한 도시 공동체 모델로 자리매김하고 있다. 이동환 시장은 8~9일 독일 드레스덴으로 이동해 바이오 및 <b>반도체</b> 글로벌 기업과 협력 기반 확대 및 투자 유치 방안을 모색할 예정이다. 김영식 경인본부 기자,"Mon, 08 Sep 2025 18:20:00 +0900"
2025-09-08 09:49:20,"쪼개진 원전 사업…건설은 환경부, 수출은 산업부 혼선",https://n.news.naver.com/mnews/article/374/0000461968?sid=101,<b>반도체</b> 클러스터 조성에 악영향을 줄 수 있다는 우려도 나옵니다. [이덕환 / 서강대 화학과 명예교수 : 탈원전 시즌 2라는 비판이 가능합니다. 현대 산업은 에너지 기반의 산업이에요. 안정적인 전력 공급이 필요한 <b>반도체</b>... ,"Mon, 08 Sep 2025 18:19:00 +0900"
2025-09-08 09:49:20,김정관 &quot;에너지 정책 환경부 이관 반대했었다…산업 연계 악화 우려&quot;,https://n.news.naver.com/mnews/article/421/0008473660?sid=101,"이언주 의원은 이날 민주당 최고위원회에서 &quot;인공지능-<b>반도체</b> 배터리 등 전략 산업, 철강, 석유, 화학, 첨단 제조 등 에너지 원가 경쟁력 저하로 어려움을 겪고 있는 산업계와 그로 인해 생존 위기에 처한 노동계, 전문가... ","Mon, 08 Sep 2025 18:14:00 +0900"
2025-09-08 09:49:20,"과기부, 공모 요건 수정해 '국가 AI컴퓨팅 센터' 추진 방안 재공모 요건...",https://www.aitimes.com/news/articleView.html?idxno=202224,"AI<b>반도체</b> 도입 의무('30년까지 50% 도입 부담) 등 공모 요건을 조정했다. 국가 AI컴퓨팅 센터는 민관 합작... 또 국산 AI<b>반도체</b> 활성화, 글로벌 기업 협력 등을 통해 국내 AI 생태계 고도화 및 활성화도 지원할 계획이다.... ","Mon, 08 Sep 2025 18:14:00 +0900"
2025-09-08 09:49:20,"충남대-한국발명진흥회, '<b>반도체</b> 특허 유니버시아드' 개최",https://www.ccdailynews.com/news/articleView.html?idxno=2366485,'SIC 기판 전력<b>반도체</b> 소자' 특허 전략을 발표해 충남대 총장상을 수상했다. 차세대 <b>반도체</b> 기술을 선점하기 위한 지식재산 경연의 장이 충청권에서 펼쳐졌다. 충남대학교 <b>반도체</b>특성화대학사업단과 한국발명진흥회(회장... ,"Mon, 08 Sep 2025 18:14:00 +0900"
2025-09-08 09:49:20,"대전시-KAIST, <b>반도체</b> 연구환경 지원…인재 양성 본격화",https://www.kukinews.com/article/view/kuk202509080229,"대전시와 한국과학기술원(이하 KAIST)은 8일 ‘<b>반도체</b>공학대학원 첨단장비 개소식’을 개최했다고 밝혔다. 이날 행사에는 이장우 대전시장, 이광형 KAIST 총장, 이규봉 산업통상자원부 <b>반도체</b>과장, 민병주... ","Mon, 08 Sep 2025 18:14:00 +0900"
2025-09-08 09:49:20,민간 부담 덜었다…국가AI컴퓨팅센터 구축사업 재공모,https://n.news.naver.com/mnews/article/029/0002980939?sid=105,"국산 AI<b>반도체</b> 활성화, 글로벌 기업 협력 등을 통해 국내 AI 생태계 고도화·활성화도 지원할 방침이다.... 2030년까지 비중 50%로 설정됐던 △국산AI<b>반도체</b> 도입 의무도 삭제하되, 국산 AI<b>반도체</b> 활성화를 위한 민·관... ","Mon, 08 Sep 2025 18:13:00 +0900"
2025-09-08 09:49:20,조현 &quot;투자부문 부담 우려해 정상회담 합의문 미발표&quot;,https://n.news.naver.com/mnews/article/079/0004063921?sid=100,조 장관은 <b>반도체</b> 품목관세가 부과될 때 최혜국 대우가 불확실하다는 지적에 대해서도 &quot;현재로서는 그렇다&quot;고 인정했다. 다만 조 장관은 한미가 검토했던 회담 합의문에 대만 사태 등 한반도 이외 지역으로 주한미군... ,"Mon, 08 Sep 2025 18:11:00 +0900"
2025-09-08 09:49:20,[사설] ‘국가 AI 전략위’ 출범… 골든타임 3년 내 ‘AI 3강’ 결과 내...,https://n.news.naver.com/mnews/article/029/0002980937?sid=110,"반면 한국은 <b>반도체</b>, 통신, 제조업 분야에서 강점을 갖고 있음에도 AI 관련 정책, 연구·개발은 분산돼 있고, 민관 협력은 미흡했다. 이제 희망이 생겼다. 전략위는 정부와 민간, 학계를 망라해 한국의 AI 경쟁력을... ","Mon, 08 Sep 2025 18:11:00 +0900"
2025-09-08 09:49:20,美 비자 리스크에…대미투자 삼성·SK ‘촉각’,https://www.sentv.co.kr/article/view/sentv202509080124,"배터리,  전기차, <b>반도체</b> 등은 공장 건설에 전문 기술이 필요한데 미국 현지에서 숙련된 인력을 구하기 어렵다는 겁니다. 한국 기업들의 대미 투자가 근본적인 위험에 노출됐다는 경고 속 정부 차원의 비자 대책이... ","Mon, 08 Sep 2025 18:10:00 +0900"
2025-09-08 09:49:20,이탈리아-한국 비즈니스 포럼 2025,https://n.news.naver.com/mnews/article/025/0003467596?sid=104,"개회식과 함께 경제 관계 라운드테이블, 분야별 세미나가 열렸고, 인공지능·<b>반도체</b>·로보틱스 등 첨단 기술부터 친환경 산업, 헬스케어, 스마트 모빌리티까지 다양한 의제가 다뤄졌다. 발렌티노 발렌티니... ","Mon, 08 Sep 2025 18:10:00 +0900"
2025-09-08 09:49:20,"삼성디스플레이, 차량용 OLED ‘드라이브’ 띄운다…“車 디스플레이 글...",https://www.ceoscoredaily.com/page/view/2025090817055528182,"지난 2월에는 퀄컴과 협력해 ‘스냅드래곤 콕핏’ 체험 데모 키트에 OLED을 공급하며, 차량용 <b>반도체</b>와 디스플레이 통합 솔루션 확대에 나섰다. 특히 차량용 OLED 시장은 SDV(소프트웨어 중심 차량) 확산으로... ","Mon, 08 Sep 2025 18:10:00 +0900"
2025-09-08 09:49:20,국민의힘 강승규 &quot;해외유출 기술 30%가 <b>반도체</b> 등 국가 핵심&quot;,https://n.news.naver.com/mnews/article/052/0002244263?sid=100,"최근 5년 동안 발생한 기술 해외유출 사건 가운데 30%가 <b>반도체</b>와 디스플레이, 자동차 같은 산업기술보호법상 국가핵심기술인 거로 나타났습니다. 국회 산업통상자원중소벤처기업위원회 소속 국민의힘 강승규... ","Mon, 08 Sep 2025 18:10:00 +0900"
2025-09-08 09:49:20,"[과기원NOW] KAIST <b>반도체</b>공학원, 첨단장비지원센터 개소식 개최 外",https://n.news.naver.com/mnews/article/584/0000034301?sid=105,"■ KAIST <b>반도체</b>공학대학원은 8일 오후 대전 본원에서 이광형 KAIST 총장, 이장우 대전시장 등이 참석한 가운데 <b>반도체</b> 연구를 지원하는 첨단장비센터 개소식을 열었다고 이날 밝혔다. 이번에 도입되는 첨단장비는... ","Mon, 08 Sep 2025 18:09:00 +0900"
2025-09-08 09:49:20,"충북 진천군, 2025 생거진천 취업박람회 18일 개최",https://n.news.naver.com/mnews/article/079/0004063919?sid=102,"이날 행사는 진천군이 충북도, 충북지방중소벤처기업청, 우석대와 함께 주최하는 것으로, 식품 바이오, <b>반도체</b>, 의약품 등 지역 전략산업 분야 기업을 포함한 모두 64개 구인기업이 참여해 양질의 일자리 정보가... ","Mon, 08 Sep 2025 18:08:00 +0900"
2025-09-08 09:49:20,"기존 질서 유지할 능력도, 의지도 보여주지 못한 미국…다시 보는 한미...",https://n.news.naver.com/mnews/article/002/0002405113?sid=100,"한·미 양국은 조선 분야 최대 1500억 달러를 포함하여 에너지, 핵심 광물, 배터리, <b>반도체</b>, 의약품, 퀀텀... 이번 한·미 정상회담을 계기로 개최된 '한·미 비즈니스 라운드 테이블'에서 인공지능, <b>반도체</b> 등 첨단 산업, 조선... ","Mon, 08 Sep 2025 18:08:00 +0900"
2025-09-08 09:49:20,'이탈리아-한국 비즈니스 포럼 2025' 미래 산업 분야 협력 방안 논의,https://www.ziksir.com/news/articleView.html?idxno=103399,"이날 프로그램은 개회식, 양국 경제 관계 라운드테이블, 분야별 세미나 등으로 구성돼 인공지능·<b>반도체</b>·로보틱스 등 첨단 기술에서부터 친환경·헬스케어 산업까지 폭넓은 의제가 다뤄졌다. 발렌티노 발렌티니... ","Mon, 08 Sep 2025 18:06:00 +0900"
2025-09-08 09:49:20,"테슬라 12주만에 순매수…<b>반도체</b> 3배 레버리지, 단타로 수익?[서학픽]",https://n.news.naver.com/mnews/article/008/0005247351?sid=101,서학개미들이 좁은 박스권 하단 부근으로 하락한 <b>반도체</b> 3배 레버리지 ETF(상장지수펀드)를 대거... 반면 8월28일~9월3일 사이엔 ICE <b>반도체</b>지수의 하루 수익률을 3배 추종하는 디렉시온 데일리 세미컨덕터 불 3배 ETF... ,"Mon, 08 Sep 2025 18:05:00 +0900"
2025-09-08 09:49:20,[해법 찾는 美불법취업 사태] 삼성·SK하이닉스는 괜찮나…美 비자 문제...,http://www.g-enews.com/ko-kr/news/article/news_all/2025090815000235366ed0c62d49_1/article.html,대만의 글로벌 파운드리(<b>반도체</b> 수탁생산) 기업 TSMC가 대표적인 경우다. TSMC는 2023년 6월 애리조나주 팹(Fab)... SK하이닉스는 미국 인디애나주 웨스트라파예트에 건설을 추진 중인 <b>반도체</b> 패키징 시설을 올해 안에 착공할... ,"Mon, 08 Sep 2025 18:04:00 +0900"
2025-09-08 09:49:20,&quot;韓 배터리 전문가 불러 미국인 훈련 방안 마련&quot;,https://n.news.naver.com/mnews/article/009/0005555153?sid=101,"트럼프 비자문제 전향적 발언 &quot;내용 이해 … 韓과 관계 좋다&quot; <b>반도체</b>장비 건별 허가 대신 美, 한국에 '연간... 한편 삼성전자와 SK하이닉스의 중국 내 공장에 <b>반도체</b> 장비 반입 포괄허가를 취소한 미국 상무부가 '연간 승인... ","Mon, 08 Sep 2025 18:04:00 +0900"
2025-09-08 09:49:20,"대전시의회, 제290회 임시회에서 108건의 안건 심의",http://www.breaknews.com/1146062,"또, 민생회복을 위한 소비쿠폰 2차 지원과 나노 <b>반도체</b> 국가산업단지 조성 사업이 차질 없이 추진되도록 집행부의 준비를 당부하면서, 시민이 체감할 수 있는... ","Mon, 08 Sep 2025 18:04:00 +0900"
