DateTime,Title,Link,Description,PubDate
2025-03-19 03:35:56,"창원시, 국가 첨단소재 산업의 미래를 열다",http://www.breaknews.com/1101532,"이를 바탕으로 디스플레이, <b>반도체</b>, 국방 등 다양한 산업 분야에서 핵심 금속소재의 상용화를 촉진할 계획이다. 1단계 사업이 마무리됨에 따라 창원시는 첨단소재... ","Wed, 19 Mar 2025 12:34:00 +0900"
2025-03-19 03:35:56,"구미시, 도비 확보·현안 해결 위해 도의원과 '머리 맞대'",https://ilyo.co.kr/?ac=article_view&entry_id=489026,"신설 △첨단<b>반도체</b> 소재·부품 Complex 조성 등 핵심 사업을 설명하고 협력 방안을 논의했다. 또한, △산업단지... 구축 △<b>반도체</b>웨이퍼 공정장비용 소재부품 테스트베드 구축 △간편식 제조·포장 실증지원센터 구축사업... ","Wed, 19 Mar 2025 12:32:00 +0900"
2025-03-19 03:35:56,&quot;올해 근원 경쟁력 반드시 확보&quot; 삼성전자 주주총회,https://n.news.naver.com/mnews/article/014/0005323147?sid=101,<b>반도체</b> 사업을 이끌고 있는 전영현 삼성전자 부회장(DS부문장)은 &quot;고대역폭메모리(HBM)의 과오를 되풀하지 않겠다&quot;며 &quot;빠르면 2분기 HBM 3E 12단 제품이 시장에서 주도적 역할을 할 수 있을 것&quot;이라고 말했다. 이하... ,"Wed, 19 Mar 2025 12:32:00 +0900"
2025-03-19 03:35:56,"삼성전자, DX·DS 부문 사업전략 발표… &quot;AI 차세대 경쟁력 확보&quot;",https://www.newscj.com/news/articleView.html?idxno=3247200,DS의 경우 사업 부문별 특성에 맞게 전략을 수립해 <b>반도체</b> 시장을 주도할 계획이다. 먼저 메모리는 선단... 몰입의 <b>반도체</b> 조직문화를 강화한다. 아울러 주주 가치 제고를 위해 성장성과 수익성 두 가지 축을... ,"Wed, 19 Mar 2025 12:32:00 +0900"
2025-03-19 03:35:56,"&quot;삼성전자, 주가 회복 못해 송구…근원 경쟁력 회복할 것&quot;(종합)",https://n.news.naver.com/mnews/article/018/0005965885?sid=101,<b>반도체</b> 성과에 좌우한다고 봅니다. 주가부진으로 주주들의 심려를 끼쳐드린 점 다시 한 번 송구스럽다.” 19일 경기도 수원 수원컨벤션센터에서 열린 삼성전자 주주총회 주주와의 대화 시간에 전영현 삼성전자 <b>반도체</b>... ,"Wed, 19 Mar 2025 12:31:00 +0900"
2025-03-19 03:35:56,"삼성전기 정기 주총, 장덕현 사장 &quot;경쟁 치열…독하지 않으면 죽는다&quot;(...",https://www.newsway.co.kr/news/view?ud=2025031911331815972,유리기판은 <b>반도체</b> 칩과 <b>반도체</b>기판을 연결해주는 인터포저 및 서브스트레이트에 실리콘 대신 유리를 사용하는 것으로 차세대 소재로 주목받고 있다. 장 사장은 &quot;(삼성전기는) 기판만 하고 인터포저는 안 한다는... ,"Wed, 19 Mar 2025 12:30:00 +0900"
2025-03-19 03:35:56,"엔비디아 주가, GTC 컨퍼런스 후 3.4% 추가 하락… 시장 반응 냉담",https://www.tokenpost.kr/article-229777,올해 들어 엔비디아 주식은 AI 인프라 과잉 투자 우려와 트럼프 행정부의 <b>반도체</b> 수출 규제 불확실성... 투자자들은 향후 몇 주간 AI 칩 시장의 전개와 정부의 <b>반도체</b> 정책 변화를 주시하며 엔비디아의 행보를... ,"Wed, 19 Mar 2025 12:28:00 +0900"
2025-03-19 03:35:56,"[이슈] OCI, 카본케미칼 생산능력 확대…'전도성 카본블랙' 등 고부가가...",http://www.paxetv.com/news/articleView.html?idxno=226572,"특히, 2026년부터 전도성 카본블랙 연간 3만톤 생산을 목표로 전기차·<b>반도체</b> 산업 시장을 적극 공략할... 전도성 카본블랙은 일반 카본블랙보다 전도성이 높은 특수한 종류의 카본블랙으로 이차전지·<b>반도체</b> 공정... ","Wed, 19 Mar 2025 12:28:00 +0900"
2025-03-19 03:35:56,"관세청, 보세가공제도 규제혁신 ‘STAR 전략’ 발표",http://www.movist.com/movist3d/view.asp?type=77&id=atc000000011588,신규 부가가치 창출 분야에선 <b>반도체</b> 등 첨단산업 보세공장의 시제품·연구물품을 연구개발부서로 반출입 시 과세보류 상태로 신속히 이동할 수 있도록 절차를 간소화한다. 거대·중량 산업 유치를 위해 보관기관이... ,"Wed, 19 Mar 2025 12:26:00 +0900"
2025-03-19 03:35:56,장덕현 삼성전기 사장 “<b>반도체</b> 게임체인저 ‘유리 인터포저’ 진출”,https://n.news.naver.com/mnews/article/016/0002444484?sid=105,삼성전기가 <b>반도체</b> 산업의 ‘게임 체인저’로 꼽히는 ‘글래스(유리) 기판’에 이어 ‘글래스 인터포저’... 기존 실리콘 인터포저를 대체할 글래스 인터포저를 개발해 차세대 고성능 <b>반도체</b> 산업을 뒷받침할... ,"Wed, 19 Mar 2025 12:23:00 +0900"
2025-03-19 03:35:56,"SK하이닉스, 세계 최초 ‘HBM4 12단’ 샘플 공급",https://n.news.naver.com/mnews/article/016/0002444483?sid=105,SK하이닉스의 HBM4는 향후 엔비디아의 차세대 AI <b>반도체</b> ‘베라 루빈(Vera Rubin)’에 탑재될 전망이다. 젠슨 황 엔비디아 최고경영자(CEO)는 18일(현지시간) 미국 캘리포니아주 새너제이에서 열린 ‘GTC 2025’... ,"Wed, 19 Mar 2025 12:22:00 +0900"
2025-03-19 03:35:56,[주총 포커스] 한종희 삼성전자 부회장 &quot;기본으로 돌아가 재도약 기틀 ...,https://n.news.naver.com/mnews/article/293/0000065050?sid=101,"한 부회장은 이날 &quot;지난해 <b>반도체</b> 산업의 경쟁 심화, IT 기술 급변 등 경영 여건이 쉽지 않은 가운데서도... 로봇∙메드텍∙차세대 <b>반도체</b> 등 다양한 영역에서 도전을 이어가겠다&quot;고 강조했다. &quot;대형 M&amp;A 미흡 사과…올해... ","Wed, 19 Mar 2025 12:22:00 +0900"
2025-03-19 03:35:56,"숭실대 대학일자리플러스센터, '2025 상반기 채용전략-원포인트 특강'운...",http://www.kyosu.net/news/articleView.html?idxno=132269,"특히, 이번 강연에서는 <b>반도체</b>, 금융, 콘텐츠/미디어, 제약/바이오, 유통/물류, 디스플레이, 뷰티, 에너지/화학, 자동차 등 11개 주요 산업 분야의 전문가들을 초청해 강연을 진행할 예정이다. 숭실대학교... ","Wed, 19 Mar 2025 12:20:00 +0900"
2025-03-19 03:35:56,"삼성전자, AI 혁신·<b>반도체</b> 경쟁력 강화 전략 발표",https://www.newspim.com/news/view/20250319000497,"삼성전자가 AI 혁신과 <b>반도체</b> 경쟁력 강화를 핵심 전략으로 제시했다. 가전 부문은 인공지능(AI) 적용 제품을 확대하고 로봇과 의료, 전장으로 신사업을 확대해 나갈 계획이다. <b>반도체</b> 부문은 고대역폭 메모리(HBM)와... ","Wed, 19 Mar 2025 12:19:00 +0900"
2025-03-19 03:35:56,"삼성전자, 56기 주주총회서 ‘AI·신사업 도전’ 선언… “10조 자사주 ...",https://thecurrents.news/%ec%82%bc%ec%84%b1%ec%a0%84%ec%9e%90-56%ea%b8%b0-%ec%a3%bc%ec%a3%bc%ec%b4%9d%ed%9a%8c%ec%84%9c-ai%c2%b7%ec%8b%a0%ec%82%ac%ec%97%85-%eb%8f%84%ec%a0%84-%ec%84%a0%ec%96%b8/,한종희 부회장 “초격차 기술로 재도약… 로봇·메드텍·차세대 <b>반도체</b> 미래 성장동력 삼겠다” 배당 9.8조... 주주총회 의장을 맡은 삼성전자 한종희 대표이사 부회장은 “지난해 <b>반도체</b> 업황 악화와 기술 변화... ,"Wed, 19 Mar 2025 12:18:00 +0900"
2025-03-19 03:35:56,"이재명-이재용, 삼성 청년 취업 지원 회담…주요 법안 논의 예정",https://www.gokorea.kr/news/articleView.html?idxno=822617,"특히 주 52시간 근로시간제의 예외 조항을 추가로 논의 중인 <b>반도체</b> 특별법과 본회의를 통과한 상법 개정안 등이 다뤄질 것으로 보인다. 이날 민주당에서는 이재명 대표와 함께 진성준 정책위의장, 조승래 수석대변인 등... ","Wed, 19 Mar 2025 12:18:00 +0900"
2025-03-19 03:35:56,"美, 4월 2일 국가별 상호 관세 발표…'더티 15' 언급하며 압박 강화",https://www.econovill.com/news/articleView.html?idxno=688108,"현재까지 한국이 외교 정책상 문제가 있는 국가로 분류된 것은 아니지만, 향후 <b>반도체</b>·첨단 기술 협력 등에서 미국이 추가적인 요구를 할 가능성을 배제할 수 없다. 이처럼 미국의 무역 압박이 단순한 관세 조치에 그치지... ","Wed, 19 Mar 2025 12:18:00 +0900"
2025-03-19 03:35:56,"미국, 국가별 상호관세 산정 중…“협상 통해 안 매길 수도”",https://n.news.naver.com/mnews/article/056/0011914171?sid=104,&quot;] 미국은 상호 관세 부과 뒤 국가 별로 진행할 새 무역 협정 협상에서 미국산 <b>반도체</b>의 대(對)중국 수출 통제도 담기로 했습니다. 중국이 미국산 <b>반도체</b>를 쓰지 못하게 우회 통로까지 차단하려는 겁니다. 러트닉 미국... ,"Wed, 19 Mar 2025 12:15:00 +0900"
2025-03-19 03:35:56,중견련 회장 &quot;트럼프 철강 쿼터제 폐지…민관협력 절실&quot;,https://n.news.naver.com/mnews/article/003/0013128528?sid=101,그러면서 &quot;트럼프 대통령이 취임 첫날 캐나다와 멕시코산 수입품에 25% 관세를 부가하는 행정명령에 서명하고 의회 연설에서 <b>반도체</b>법 폐지 등을 언급하는 등 업계의 불안을 가중해 왔다&quot;며 &quot;지난 12일엔 한국 철강... ,"Wed, 19 Mar 2025 12:15:00 +0900"
2025-03-19 03:35:56,"中 증시 시가총액 역사상 최고치...&quot;미래에셋, 현지 IR 적극 참여&quot;",https://www.newspim.com/news/view/20250319000507,"이 중 <b>반도체</b>, 소프트웨어, AI를 포함한 IT 기업은 3년 연속 시가총액 1위를 차지했으며, 그 비중 역시 2023년 16.2%에서 19.5%까지 증가했다. 첨단 장비, 신재생 에너지 장비, 항공우주를 포함한 공업 기업의 시가총액... ","Wed, 19 Mar 2025 12:15:00 +0900"
2025-03-19 03:35:56,"&quot;<b>반도체</b> 조직문화 강화&quot;…전영현, 주총서 사업전략 발표",https://n.news.naver.com/mnews/article/003/0013128527?sid=101,<b>반도체</b>는 각 사업 부문별 특성에 맞게 전략을 수립해 <b>반도체</b> 시장을 주도할 계획이다. 먼저 메모리는 선단 공정 기반 HBM 적기 개발로 차세대 AI 제품 경쟁력을 확보하고 고성능·고용량 솔리드스테이트드라이브(SSD)... ,"Wed, 19 Mar 2025 12:14:00 +0900"
2025-03-19 03:35:56,"S&amp;P 500, 기술주 급락에 1.1% 하락… 엔비디아·슈퍼마이크로 직격탄",https://www.tokenpost.kr/article-229772,"글로벌 <b>반도체</b> 강자인 엔비디아(NVDA)는 대형 행사에서 차세대 AI 칩을 발표했지만, 웨드부시 애널리스트들은 거시경제적 불확실성이 AI 산업의 단기 성장에 장애물이 될 수 있다고 경고했다. 이러한 분위기로... ","Wed, 19 Mar 2025 12:14:00 +0900"
2025-03-19 03:35:56,&quot;불공정 관행 중단 국가 상호관세 피할 수도&quot;,https://n.news.naver.com/mnews/article/214/0001412485?sid=104,또 중국이 미국산 <b>반도체</b>를 확보하지 못하도록 앞으로 각국과의 무역협정에 우회수출 통제를 포함하려... 미 상부무는 중국이 미국산 <b>반도체</b>를 확보하지 못하도록 앞으로 각국과의 무역협정에서 우회수출 통제를 포함할... ,"Wed, 19 Mar 2025 12:13:00 +0900"
2025-03-19 03:35:56,[주총현장] &quot;하닉 팔고 삼전 샀는데&quot; 질타... 전영현 &quot;하반기 성과&quot;,https://n.news.naver.com/mnews/article/119/0002934737?sid=101,전영현 삼성전자 부회장(DS부문장)이 최근 HBM(고대역폭메모리)와 관련한 삼성 <b>반도체</b> 실적 부진에 대해... AI <b>반도체</b> 제품 베라 루빈과 블랙웰 울트라를 공개했다.다만 이 자리에서 언급될 것으로 예상됐던... ,"Wed, 19 Mar 2025 12:11:00 +0900"
2025-03-19 03:35:56,삼성 <b>반도체</b> 수장 &quot;집중 근무 필수…52시간 규제로 대응 불가능&quot;,https://n.news.naver.com/mnews/article/421/0008138652?sid=101,박기호 박주평 기자 = 삼성전자(005930) <b>반도체</b> 사업 부문을 이끌고 있는 전영현 삼성전자 DS부문장(부회장)은 19일 주 연구·개발 인력의 주 52시간 근무 예외 조항이 담긴 <b>반도체</b>특별법의 처리가 필요하다고 밝혔다. 전... ,"Wed, 19 Mar 2025 12:11:00 +0900"
2025-03-19 03:35:56,[삼성전자 주총] &quot;5만전자 언제 탈출하나&quot;..한종희 &quot;뼈 깎는 노력&quot;,http://www.4th.kr/news/articleView.html?idxno=2081171,한 부회장은 &quot;최근 주가가 주주들의 기대에 미치지 못한 점 사과드린다&quot;며 &quot;당사는 지난해 AI<b>반도체</b>... 로봇∙메드텍∙차세대 <b>반도체</b> 등 다양한 영역에서 새로운 도전을 이어가겠다&quot;며 주주들에게 지지와 응원을... ,"Wed, 19 Mar 2025 12:10:00 +0900"
2025-03-19 03:35:56,"'주총' 삼성전자, '5만전자' 추락에 주주성토 봇물…한종희 &quot;송구하다&quot;",http://www.shinailbo.co.kr/news/articleView.html?idxno=2022925,"AI <b>반도체</b> 시장에 적절하게 대응하지 못했고, 스마트폰, TV, 생활가전 등 주요제품이 압도적인 시장 경쟁력을... 반드시 <b>반도체</b> 분야 인수합병(M&amp;A)에 성과를 내도록 하겠다”고 밝혔다. 이어 “이를 위해 관련 조직을 갖추는... ","Wed, 19 Mar 2025 12:08:00 +0900"
2025-03-19 03:35:56,한종희 삼성 부회장 &quot;주주 중시 경영에 최선...올해 기술 경쟁력 회복해...,http://www.industrynews.co.kr/news/articleView.html?idxno=61366,"한종희 부회장은 지난해 경영성과에 대해 &quot;<b>반도체</b> 산업의 경쟁 심화, IT 기술 급변 등 경영 여건이 쉽지 않은... 한 부회장은 최근 주가가 부진한 원인을 묻는 질문에&quot;지난해 변화하는 AI <b>반도체</b> 시장에 적절히 대응하지... ","Wed, 19 Mar 2025 12:08:00 +0900"
2025-03-19 03:35:56,삼성전자 주총 “재도약 기틀 다질 것”…주가 부진엔 ‘사과’,https://n.news.naver.com/mnews/article/056/0011914166?sid=101,"주주총회 질의응답 시간엔 부진한 주가에 대한 지적이 나왔고, 삼성은 <b>반도체</b> 대응이 적절치 못했다고... [한종희/삼성전자 부회장 : &quot;새로운 성장 동력을 확보할 수 있도록 로봇, 메드텍, 차세대 <b>반도체</b> 등의 영역에서... ","Wed, 19 Mar 2025 12:07:00 +0900"
2025-03-19 03:35:56,"[올댓차이나] 中 증시, 이익확정·지분조정 매물로 반락 개장…창업판 ...",https://n.news.naver.com/mnews/article/003/0013128512?sid=104,"통신주, <b>반도체</b> 관련주, 소프트웨어주가 약세를 면치 못하고 있다. 거리전기는 0.41%, 징둥팡 0.68%, 중국교통건설 0.95%, 중국인수보험 0.28% 내리고 있다. 반면 은행주와 양조주, 석유 관련주, 가전주... ","Wed, 19 Mar 2025 12:06:00 +0900"
2025-03-19 03:35:56,"정부, 철강‧알루미늄 범정부 대응안 발표…수입 검사 강화·적극 협상...",http://www.snmnews.com/news/articleView.html?idxno=549640,"아울러 철강 내수 시장도 건설과 <b>반도체</b>, 가전 등의 주요 수요산업 침체와 중국, 일본, 동남아 등에서의 저가 수입재 범람으로 시황 악화되면서 대형 철강사 공장이 폐쇄 또는 사업 축소, 인력 구조조정이 이뤄지는 등... ","Wed, 19 Mar 2025 12:04:00 +0900"
2025-03-19 03:35:56,"&quot;AI 주도권 이어갈까&quot; 엔비디아, 울트라·루빈 등 AI칩 로드맵 공개",https://www.econovill.com/news/articleView.html?idxno=688106,"우선 '베라 루빈'은 중앙처리장치(CPU) 베라와 그래픽처리장치(GPU) 루빈으로 구성된 AI <b>반도체</b>로, 오는 2026년 하반기 출하를 시작할 예정이다. 암흑물질을 발견한 천문학자 베라 루빈에서 이름을 따왔다. 엔비디아는... ","Wed, 19 Mar 2025 12:04:00 +0900"
2025-03-19 03:35:56,"이재명, 20일 삼성 이재용 만난다… 민주 “청년 일자리·<b>반도체</b>법 논의...",https://n.news.naver.com/mnews/article/022/0004020242?sid=100,이 자리에서는 청년 취업 외에도 트럼프 행정부의 관세 정책 등 통상 문제와 여야가 이견을 보이고 있는 ‘<b>반도체</b> 특별법’ 등에 대한 논의도 이뤄질 것으로 보인다. 황 대변인은 “(<b>반도체</b> 특별법을) 포함해 논의할 수... ,"Wed, 19 Mar 2025 12:04:00 +0900"
2025-03-19 03:35:56,"한종희 부회장, 삼성전자 주총서 &quot;기본으로 돌아가 재도약&quot; 강조",http://www.1conomynews.co.kr/news/articleView.html?idxno=35073,"지난해 경영 성과에 대해 그는 &quot;<b>반도체</b> 산업의 경쟁 심화, IT 기술 급변 등 경영 여건이 쉽지 않은... 무엇보다 &quot;기존 사업은 초격차 기술 리더십으로 재도약의 기틀을 다지고 로봇∙메드텍∙차세대 <b>반도체</b> 등 다양한... ","Wed, 19 Mar 2025 12:04:00 +0900"
2025-03-19 03:35:56,'더티 15' 겨눈 트럼프 행정부…한국 포함 가능성 '촉각',https://n.news.naver.com/mnews/article/001/0015274145?sid=101,"정부 안팎에서는 미국이 4월 2일 각국 맞춤형 상호관세와 더불어 자동차·<b>반도체</b> 등 트럼프 대통령이 따로 언급한 품목에 별도의 관세를 매길 가능성이 높은 것으로 예상한다. 가령 한국에 10%의 상호관세가 매겨지고, 전... ","Wed, 19 Mar 2025 12:03:00 +0900"
2025-03-19 03:35:56,온실가스 다배출 산업 R&amp;D 협의체 출범...반도·체화학 등 17개사 참여,https://www.kukinews.com/article/view/kuk202503190048,"한국<b>반도체</b>산업협회 △한국디스플레이산업협회 △한국금속재료연구조합 등 관련 협회 및 연구조합을 비롯해 17개 기업, 환경기술 전문가 등이 참여한다. 업종별로는 화학 4개사, 시멘트 5개사, <b>반도체</b>·디스플레이 4개사... ","Wed, 19 Mar 2025 12:02:00 +0900"
2025-03-19 03:35:56,"차세대 HBM 전쟁…SK하닉, 삼성 주총날 HBM4 신제품 발표",https://n.news.naver.com/mnews/article/003/0013128500?sid=101,삼성전자와 SK하이닉스 간 인공지능(AI) <b>반도체</b> 주도권을 잡기 위한 '차세대 HBM' 쟁탈전이 치열하다.... 삼성전자 <b>반도체</b> 사업을 담당하는 디바이스솔루션(DS)부문장 전영현 부회장은 이날 주총장에서 직접 마이크를... ,"Wed, 19 Mar 2025 12:02:00 +0900"
2025-03-19 03:35:56,"[위클리오늘] 삼성전자, 제56기 정기 주주총회 개최···사업전략 발표",http://www.weeklytoday.com/news/articleView.html?idxno=685156,"■ DS 부문 각 사업 부문 특성 맞는 전략 수립 DS 각 사업 부문별 특성에 맞게 전략을 수립해 <b>반도체</b> 시장을... 몰입의 <b>반도체</b> 조직문화를 강화한다. 또한, 주주 가치 제고를 위해 성장성과 수익성 두 가지 축을... ","Wed, 19 Mar 2025 12:02:00 +0900"
2025-03-19 03:35:56,[특징주] 심텍·하나마이크론·네오셈 등 SSD株 일제히 상승,https://www.yeongnam.com/web/view.php?key=20250319025530786,"이는 심텍이 <b>반도체</b>용 PCB(인쇄회로기판) 개발 및 양산에 매진, 차별화된 기술력을 보유한 글로벌... PCB 분야에서 독보적인 기술력을 바탕으로 시장을 선도하고 있는 심텍은 첨단 <b>반도체</b> 기술 발전에 발맞춰... ","Wed, 19 Mar 2025 12:00:00 +0900"
2025-03-19 03:35:56,전영현 DS부문장 &quot;삼성전자 주가 부진…초기시장 놓친 HBM 탓&quot;,https://www.asiatoday.co.kr/view.php?key=20250319010009925,AI <b>반도체</b> 시장 초기 대응이 늦었던 HBM이 가장 큰 영향을 미칠 것&quot;이라며 이 같이 말했다.전 부회장은 &quot;향후 <b>반도체</b> 시장에서의 난관을 극복하기 위해 내부 제품 완성도를 강화하고 조직개편을 추진하는 등 전사적... ,"Wed, 19 Mar 2025 12:00:00 +0900"
2025-03-19 03:35:56,"[1.5℃ HOW] 환경부-한국환경산업기술원, 민관 연구개발 협의체 출범",http://www.hansbiz.co.kr/news/articleView.html?idxno=739370,"이번 협의체에는 온실가스 다배출 업종을 대표하는 ▲한국화학산업협회 ▲한국시멘트협회 ▲한국<b>반도체</b>산업협회 ▲한국디스플레이산업협회 ▲한국금속재료연구조합 등 관련 협회 및 연구조합을 비롯해 17개 기업, 환경... ","Wed, 19 Mar 2025 12:00:00 +0900"
2025-03-19 03:35:56,"관세청, 첨단·핵심산업 수출 지원 사활…보세가공 규제 대폭 완화 ‘ST...",https://www.daily365.news/2025/03/19/%ea%b4%80%ec%84%b8%ec%b2%ad-%ec%b2%a8%eb%8b%a8%c2%b7%ed%95%b5%ec%8b%ac%ec%82%b0%ec%97%85-%ec%88%98%ec%b6%9c-%ec%a7%80%ec%9b%90-%ec%82%ac%ed%99%9c%eb%b3%b4%ec%84%b8%ea%b0%80%ea%b3%b5/,"<b>반도체</b>·조선·K-방산 등 전략산업 숨통…R&amp;D·물류·비용 절감으로 수출 경쟁력 강화 산업현장 ‘신발 속 돌멩이’ 빼낸다…자율관리·보관기한 완화로 글로벌 시장 대응력 확대 관세청이 <b>반도체</b>, 조선, 바이오, K-방산... ","Wed, 19 Mar 2025 12:00:00 +0900"
2025-03-19 03:35:56,"[삼성전자 주주간담회 전문] “파운드리, 1nm 차세대 공정 개발할 것”",https://n.news.naver.com/mnews/article/009/0005461259?sid=105,"현재 <b>반도체</b> 산업은 국가 간 패권 경쟁 심화, 모바일 및 PC 고객사의 높은 재고 수준에 따른 수요 부진... 이러한 대외 환경 속에서 2025년 글로벌 <b>반도체</b> 시장은 전년 대비 16% 성장할 것으로 전망됩니다. 특히, AI 및... ","Wed, 19 Mar 2025 11:58:00 +0900"
2025-03-19 03:35:56,"테슬라, 로보택시 첫 승인 획득…트럼프 효과 본격화",https://n.news.naver.com/mnews/article/029/0002942157?sid=103,"최근 현대모비스도 현지 특화된 <b>반도체</b> 설계기술을 개발하고, 해외 우수인재 확보를 위해 실리콘밸리에 전문 연구 거점을 신설한다고 밝힌 바 있다. 실리콘밸리는 전 세계 IT 인재가 모여 있는 곳이기에 인재 발굴 및... ","Wed, 19 Mar 2025 11:58:00 +0900"
2025-03-19 03:35:56,"美 &quot;상호관세, 국가별로 다르게&quot;…한국은?",https://n.news.naver.com/mnews/article/374/0000430459?sid=104,미국산 <b>반도체</b> 확보를 막기 위해 각국과의 무역협정에 우회수출 통제를 포함할 계획&quot;이라고 밝혔습니다. 러트닉 장관은 저비용·고성능 AI모델을 선보인 중국 딥시크가 미국산 <b>반도체</b>를 부적절하게 활용했다고도... ,"Wed, 19 Mar 2025 11:57:00 +0900"
2025-03-19 03:35:56,[뉴스1 PICK]삼성전자 주주총회 개최 &quot;기본으로 돌아가 재도약 할 것&quot;,https://n.news.naver.com/mnews/article/421/0008138580?sid=101,차세대 <b>반도체</b> 영역에서 새로운 도전을 이어가겠다&quot;고 밝혔다. 이어 &quot;어려운 환경일수록 기본으로 돌아가 인재와 기술을 바탕으로 최고 제품과 서비스를 창출해 인류에게 공헌한다는 회사의 경영 철학에 집중하겠다&quot;고... ,"Wed, 19 Mar 2025 11:55:00 +0900"
2025-03-19 03:35:56,모건스탠리 &quot;<b>반도체</b> 전망 긍정적&quot; 선회…삼성전자·SK하이닉스 목표가 ...,https://n.news.naver.com/mnews/article/374/0000430457?sid=104,<b>반도체</b> 업종에 대해 부정적 전망을 고수했던 미국 투자은행 모건스탠리가 장기적 관점에서 더 긍정적... 모건스탠리는 보고서에서 &quot;솔직히 <b>반도체</b> 산업이 바닥을 쳤다고 말할 상황은 아니지만 시장은 빠르게 '계곡'(the... ,"Wed, 19 Mar 2025 11:55:00 +0900"
2025-03-19 03:35:56,"이재명, 내일 이재용과 청년취업 간담회…<b>반도체</b>법 논의 주목",https://n.news.naver.com/mnews/article/001/0015274078?sid=100,"특히 이 자리에서는 청년 취업 지원 방안과 함께 최근 야당 주도로 본회의를 통과한 상법 개정안, 주 52시간 예외 조항을 놓고 논란이 이어지고 있는 <b>반도체</b> 특별법 등 현안이 논의될 것으로 보여 주목된다. 민주당에서는... ","Wed, 19 Mar 2025 11:54:00 +0900"
2025-03-19 03:35:56,"한화세미텍, HBM 본딩장비 시장 진입… 한미<b>반도체</b> 독점구도 흔들릴까",https://www.e-science.co.kr/news/articleView.html?idxno=103228,한미<b>반도체</b>에서 한화세미텍까지 확대하며 시장 판도가 변화하고 있다. 한화세미텍은 18일 SK하이닉스와 210억 원 규모의 HBM용 TC본더 공급 계약을 체결했다고 발표했다. 이는 한미<b>반도체</b>가 독점적으로 공급해온 시장에... ,"Wed, 19 Mar 2025 11:54:00 +0900"
2025-03-19 03:35:56,한종희 삼성전자 부회장 &quot;기존 산업 재도약 기틀 다지고 로봇·메드텍·...,http://www.worktoday.co.kr/news/articleView.html?idxno=65630,"로봇∙메드텍∙차세대 <b>반도체</b> 등 다양한 영역에서 새로운 도전을 이어가겠다&quot;고 말했다. 한 부회장은 19일... 그는 &quot;지난해는 <b>반도체</b> 산업의 경쟁 심화, IT 기술 급변 등 경영 여건이 쉽지 않은 가운데서도 매출 300조원을... ","Wed, 19 Mar 2025 11:54:00 +0900"
