DateTime,Title,Link,Description,PubDate
2025-04-07 06:33:54,미국발 관세 폭격에 중국도 수출통제…정부 &quot;희토류 비축분 충분&quot;,https://n.news.naver.com/mnews/article/008/0005176942?sid=101,"희토류는 미사일, 레이저, 탱크와 같은 차량 탑재 시스템, 군사통신 등 국방 기술에도 활용되기도 하며 컴퓨터, <b>반도체</b>, 스마트폰 등 최첨단 기술에도 쓰인다. 정부는 △네오디뮴 △세륨 △란탄 △디스프로슘 △터븀을... ","Mon, 07 Apr 2025 15:33:00 +0900"
2025-04-07 06:33:54,트럼프 관세폭탄은 피했지만… '정부 대응' 필요한 K바이오,https://n.news.naver.com/mnews/article/417/0001069190?sid=101,"한국은 오는 9일부터 25%의 상호관세율이 부과될 예정이지만 <b>반도체</b>, 목재, 구리, 의약품 등은 이번 상호관세 대상 품목에서 제외됐다. 의약품은 이번 상호관세 대상에서 제외됐으나 향후 품목별 관세가 적용될 가능성이... ","Mon, 07 Apr 2025 15:32:00 +0900"
2025-04-07 06:33:54,"한양대 ERICA, 경기도 5개 대학과 RISE사업 협력체제 구축 나서",http://www.kyosu.net/news/articleView.html?idxno=132965,"이번 협약은 행정적 MOU를 넘어, <b>반도체</b>, AI·빅데이터, 첨단 모빌리티, 바이오, 신재생에너지, 양자, 디지털 전환 등 미래 성장 산업(G7 분야)에 대한 실질적 공동 대응이라는 점에서 큰 의미를 가진다. 참여 대학들은... ","Mon, 07 Apr 2025 15:30:00 +0900"
2025-04-07 06:33:54,"ACM리서치, 중국 고객사로부터 고온 SPM 장비 품질 인증 획득",https://www.epnc.co.kr/news/articleView.html?idxno=314909,비메모리 <b>반도체</b> 제조회사로부터 품질 평가를 받았다고 발표했다. 지금까지 ACM은 13개 고객사에 자사의... David Wang) 박사는 &quot;싱글 웨이퍼 중·고온 SPM 장비는 300mm 웨이퍼 <b>반도체</b> 양산 제조에서 고객의 과제를... ,"Mon, 07 Apr 2025 15:30:00 +0900"
2025-04-07 06:33:54,"SW R&amp;D 허브로 육성…현대모비스, 인도에 통합 R&amp;D센터 개소",https://www.itbiznews.com/news/articleView.html?idxno=165032,올해는 미국 실리콘밸리에 <b>반도체</b> 연구관련 거점을 신설하고 기존 디트로이트 북미연구소와 자율주행 요소기술을 개발한다. 독일 프랑크푸르트 유럽연구소는 자율주행 센서 관련 기술을 개발하고 중국 상해연구소는... ,"Mon, 07 Apr 2025 15:30:00 +0900"
2025-04-07 06:33:54,"김문수, 보수 지지율 선두 속 사퇴 초읽기 … 정년연장·근로시간 등 노...",https://biz.newdaily.co.kr/site/data/html/2025/04/07/2025040700099.html,국내 <b>반도체</b> 산업 경쟁력을 높이기 위한 <b>반도체</b> 특별법의 핵심 쟁점인 '주 52시간 근무제 예외' 조항을 둘러싸고 노사 간 치열한 대립구도가 형성되면서 주무부처인 고용부 수장 역할이 더 커졌다. 그러나 김 장관이... ,"Mon, 07 Apr 2025 15:30:00 +0900"
2025-04-07 06:33:54,"포스코홀딩스, 한국지질자원연구원과 기술 공동개발 MOU 체결",https://www.lcnews.co.kr/news/articleView.html?idxno=98357,"신재생에너지, <b>반도체</b> 등 첨단 산업의 필수 원료로 주목받고 있는 핵심광물 기술 공동개발에 나선다. 포스코홀딩스는 지난 4일 대전 한국지질자원연구원(이하 지질자원연)에서 김기수 포스코홀딩스 미래기술연구원장... ","Mon, 07 Apr 2025 15:30:00 +0900"
2025-04-07 06:33:54,"대만 증시, 35년 만에 최대 하락폭…TSMC·폭스콘도 폭락(종합)",https://n.news.naver.com/mnews/article/018/0005981618?sid=101,대만 증시 시가총액 1위 종목인 세계 최대 파운드리(<b>반도체</b> 위탁생산) 업체 TSMC 주가도 9.98% 하락했다. 세계 최대 전자제품 위탁생산업체인 대만 폭스콘(홍하이 정밀공업)도 9.77% 밀렸다. 지난 2일 트럼프 대통령이... ,"Mon, 07 Apr 2025 15:28:00 +0900"
2025-04-07 06:33:54,베트남 韓기업 '트럼프 관세 폭탄'에 흔들...'삼성·LG 비상',http://www.newsfc.co.kr/news/articleView.html?idxno=70476,"<b>반도체</b>는 제외됐지만, 이를 조립한 스마트폰·가전제품 등 완제품은 관세 적용 대상이다. 삼성전자는 베트남을 글로벌 스마트폰 생산의 50% 이상을 담당하는 핵심 거점으로 운영 중이다. 관세 부과가 지속될 경우 완제품... ","Mon, 07 Apr 2025 15:26:00 +0900"
2025-04-07 06:33:54,"월가, 상호관세發 추가 폭락 대비… 트럼프는 “끝까지 간다”",https://n.news.naver.com/mnews/article/366/0001067401?sid=104,"그러면서 “우리는 우리나라의 비행기를 탈 수 없고, 우리나라의 <b>반도체</b>도 가지고 있지 않다. 이것이 바로 트럼프 대통령이 미국을 위해 고치려고 하는 것”이라고 부연했다. 이어 그는 거듭 “관세는 부과된다”며... ","Mon, 07 Apr 2025 15:25:00 +0900"
2025-04-07 06:33:54,KDI &quot;넉 달째 경기하방 압력 확대…대외 여건 악화&quot;,https://n.news.naver.com/mnews/article/422/0000728666?sid=101,"3월 수출은 3.1% 늘었지만, <b>반도체</b>와 선박을 제외하면 대부분 품목이 부진했습니다. 대중국 수출에선 <b>반도체</b>가 3.5% 감소했고, 대미수출에선 자동차가 9.3% 감소했습니다. 특히 KDI는 4월 미국의 관세 인상 본격화로 수출... ","Mon, 07 Apr 2025 15:25:00 +0900"
2025-04-07 06:33:54,"KDI, 넉 달째 '경기 하방위험 확대' 진단…&quot;대외여건 급격 악화&quot;",http://www.kbsm.net/news/view.php?idx=470456,"설비투자는 <b>반도체</b>를 중심으로 양호한 흐름이 이어지고 있으나, 통상 불확실성 등 수출 여건 악화로 하방 위험이 확대되는 상황이다.건설기성은 1월에 이어 2월에도 큰 폭으로 감소(-21.0%)하면서 부진이 이어졌다.... ","Mon, 07 Apr 2025 15:24:00 +0900"
2025-04-07 06:33:54,"[기고] AI 강국의 길, 규제 덫 끊고 시장 열어야",https://www.meconomynews.com/news/articleView.html?idxno=110732,"한국은 <b>반도체</b>, 초고속 통신망, 뛰어난 개발자와 연구자까지 다 갖췄다. 그런데 왜 이런 결과일까? 답은 간단하다. 기술을 시험하고, 시장에서 돈을 벌 수 있는 '기회의 구조'가 없기 때문이다. 하드웨어, 클라우드... ","Mon, 07 Apr 2025 15:24:00 +0900"
2025-04-07 06:33:54,"인천경제청, 1분기 FDI 신고액 3억961달러 기록…올해 목표 51.6% 수준",https://n.news.naver.com/mnews/article/023/0003898061?sid=102,티오케이첨단재료도 <b>반도체</b> 검사장비 추가 도입과 신검사동 증축을 위해 2450만달러를 투자하겠다고 신고 했다. 지난 2014년 송도에 입주한 헬러만타이툰은 토지 매입 등을 위해 추가로 250만달러를 투자하겠다고... ,"Mon, 07 Apr 2025 15:23:00 +0900"
2025-04-07 06:33:54,"구미시, 탄소소재 기업 성장 동력에 불 붙인다.",https://www.sisamagazine.co.kr/news/articleView.html?idxno=512933,* ▲경북 탄소산업 혁신기술 국가사업화 지원사업 ▲<b>반도체</b>·이차전지부품용 인조흑연 테스트베드 구축사업 ▲방산항공우주용 탄소소재부품 랩팩토리 구축사업 참석 기업들은 지원사업 활용 방안과 신청 절차를... ,"Mon, 07 Apr 2025 15:23:00 +0900"
2025-04-07 06:33:54,"용인시, 반다비 체육센터·백암초 학교복합시설 본격 추진",http://www.newsroad.co.kr/news/articleView.html?idxno=37866,"이에 시는 <b>반도체</b> 중심도시이자 인구 150만 명 대도시로 성장할 용인의 미래상을 설명하고, 학생들을 위한 생존수영 교육에 어려움을 겪고 있는 인접 도시인 이천시와 안성시 초등학교 학생들도 이용할 수 있는 광역... ","Mon, 07 Apr 2025 15:22:00 +0900"
2025-04-07 06:33:54,"KEA, '산자부 출신' 박재영 신임 상근부회장 선임",https://n.news.naver.com/mnews/article/031/0000922471?sid=101,에너지뿐 아니라 시스템<b>반도체</b>·미래차·바이오헬스 등 주요 핵심산업의 경쟁력을 높이기 위한 산업 발전전략을 수립한 인물로 꼽힌다. 박 신임 부회장은 &quot;트럼프 발 미국 우선주의 강화로 급변하는 통상환경과 더불어... ,"Mon, 07 Apr 2025 15:22:00 +0900"
2025-04-07 06:33:54,"현대모비스, 인도 SW 통합연구소 개소",http://www.hansbiz.co.kr/news/articleView.html?idxno=742883,올해에는 미국 실리콘밸리에 <b>반도체</b> 연구관련 거점을 신설할 예정이다. 기존 디트로이트 북미연구소와 자율주행 요소 기술을 중점으로 개발한다는 계획이다. 독일 프랑크푸르트 유럽연구소는 자율주행 센서 관련 기술을... ,"Mon, 07 Apr 2025 15:22:00 +0900"
2025-04-07 06:33:54,"용인시, '용인 <b>반도체</b>클러스터 일반산단' 용수공급시설 점검",http://www.newsroad.co.kr/news/articleView.html?idxno=37868,용인특례시가 내년 원삼면 '용인 <b>반도체</b>클러스터 일반산업단지' 용수공급시설을 현장점검하는 등 인수인계 준비를 하고 있다고 7일 밝혔다. 용인 <b>반도체</b>클러스터 일반산단 용수공급시설은 취수장(여주시)과 가압장... ,"Mon, 07 Apr 2025 15:22:00 +0900"
2025-04-07 06:33:54,조기대선 돌입...국민 통합.정치 개혁의 길로,https://n.news.naver.com/mnews/article/052/0002176658?sid=100,"하루가 급한 추경은 물론 AI 지원을 위한 <b>반도체</b>지원법, 헌재 재판관, 방통위 위원 임명 등 연금개혁법 외에 지난 4달 사이에 합의된 것을 찾아보기 어렵습니다. 정치가 실종되면서 탄핵이 남발되고 민주당도 윤 대통령... ","Mon, 07 Apr 2025 15:21:00 +0900"
2025-04-07 06:33:54,"책 읽고 공부하고&quot;... 대우건설, 교육 특화 '푸르지오 원클러스터' 선봬",http://www.kdfnews.com/news/articleView.html?idxno=153719,"특히 삼성전자와 SK하이닉스의 <b>반도체</b> 클러스터와 인접해 있어 미래가치가 높은 단지로 평가받고 있다. 분양 관계자는 &quot;교육 서비스와 문화시설을 갖춘 명품 아파트로, 용인 <b>반도체</b> 클러스터 개발에 따른 미래가치를... ","Mon, 07 Apr 2025 15:20:00 +0900"
2025-04-07 06:33:54,[의정 리더스] 이선희 경상북도의회 기획경제위원장 &quot;선제적 입법으로 ...,https://www.kyongbuk.co.kr/news/articleView.html?idxno=4037043,"예를 들어, 북부지역은 낙동강 및 백두대간 종합개발을 통한 경제 산업 거점을 형성하고 동해안은 원자력수소 산업벨트 조성과 역사문화 글로벌 도시화, 서부 권은 <b>반도체</b> 및 첨단전략산업벨트 구축 그리고 남부권은 광역... ","Mon, 07 Apr 2025 15:20:00 +0900"
2025-04-07 06:33:54,"'알짜 계열사' 넘겨받은 SK에코플랜트, 금융비용에 순손실 확대",https://n.news.naver.com/mnews/article/293/0000065828?sid=101,SK에코플랜트는 지난해 SK가 소유한 <b>반도체</b> 모듈 회사 에센코어를 보유한 SK S.E.Asia Pte. Ltd.와... 개선됐다&quot;며 &quot;앞으로 <b>반도체</b> 종합 서비스 사업을 통한 수익 창출로 재무건전성을 지속 확보할 계획이다&quot;고 말했다.,"Mon, 07 Apr 2025 15:19:00 +0900"
2025-04-07 06:33:54,주식창 베스트가 말하는 2분기 증시 전망,https://n.news.naver.com/mnews/article/215/0001204840?sid=101,"조선, 방산, <b>반도체</b>입니다. &lt;이헌상 파트너&gt; Q. 2분기 전망 및 전략은? A. 2분기 국내증시는 본격적인 재평가... 바닥에 있는 <b>반도체</b>업종의 업황 회복과 투자 제재 등으로 재평가 시작될 것으로 예상되고, 유망종목은... ","Mon, 07 Apr 2025 15:17:00 +0900"
2025-04-07 06:33:54,"인천경제청, 2025년 1분기 외국인직접투자 3억961만 달러 달성",http://www.m-i.kr/news/articleView.html?idxno=1225791,티오케이첨단재료는 신검사동 증축 투자를 통해 <b>반도체</b> 초미세공정에 적용되는 극자외선(EUV) 포토레지스트에 대한 개발 및 검사가 가능한 장비를 추가 도입하는 등 최첨단 기술개발과 제품생산을 위한 최적의... ,"Mon, 07 Apr 2025 15:16:00 +0900"
2025-04-07 06:33:54,'광주형 라이즈' 참여대학 선정… 지역 17곳 대학 협력,https://news.unn.net/news/articleView.html?idxno=577308,"구체적으로 광주시 주력산업인 모빌리티·에너지·<b>반도체</b>·인공지능 산업에서 △석·박사인력 1,000명 배출... 이들 대학은 지역산업 맞춤형 청년 혁신인재, 모빌리티·에너지·<b>반도체</b>·인공지능 등 첨단산업 분야 석... ","Mon, 07 Apr 2025 15:16:00 +0900"
2025-04-07 06:33:54,"현대모비스, 인도에 2개 연구소 통합…대규모 연구시설 구축",http://www.sisafocus.co.kr/news/articleView.html?idxno=336834,현대모비스는 올해 미국 실리콘밸리에 <b>반도체</b> 연구관련 거점을 신설할 예정이다. 기존 디트로이트 북미연구소와 자율주행 요소기술을 중점으로 개발한다. 독일 프랑크푸르트 유럽연구소는 자율주행 센서 관련 기술을... ,"Mon, 07 Apr 2025 15:16:00 +0900"
2025-04-07 06:33:54,"디지털 서비스 안정성 확보, 6G 시대 준비 '박차'",http://www.koit.co.kr/news/articleView.html?idxno=129501,AI <b>반도체</b> 관련 대학과 기업이 협력을 통해 석·박사 인재를 양성하는 '산학연계 AI<b>반도체</b> 선도기술 인재양성 사업' 신규과제 선정을 추진한다. AI·디지털 분야 석·박사급 인재양성 사업의 연구성과를 공유하는 'ITRC... ,"Mon, 07 Apr 2025 15:16:00 +0900"
2025-04-07 06:33:54,"전남도, 세라믹 산업 생태계 육성 위한 3D 프린팅 기술 개발 본격 추진",https://www.thefairnews.co.kr/news/articleView.html?idxno=44873,"이 기술은 항공우주, 방위산업, 의료, <b>반도체</b> 등 다양한 고부가가치 산업에 적용될 수 있어 큰 기대를 모으고 있다. 곽부영 전남도 기반산업과장은 &quot;이번 사업을 통해 세라믹 3D 프린팅 소재의 국산화를 이루고, 미래... ","Mon, 07 Apr 2025 15:14:00 +0900"
2025-04-07 06:33:54,"SK하이닉스, 올해도 실적 기대감…美 <b>반도체</b> 관세는 '변수'",http://www.seoulfn.com/news/articleView.html?idxno=553670,인공지능(AI) <b>반도체</b> 수요 급증에 힘입어 지난해 사상 최대 실적을 기록한 SK하이닉스가 올해도 호실적을 이어갈 것으로 전망된다. 다만 도널드 트럼프 미국 대통령의 <b>반도체</b> 추가 관세 부과 가능성이 제기되면서... ,"Mon, 07 Apr 2025 15:13:00 +0900"
2025-04-07 06:33:54,"'셋톱박스 갑질' 美 브로드컴, 자진시정안 의견수렴 절차 개시",http://www.newsfc.co.kr/news/articleView.html?idxno=70473,미국 <b>반도체</b> 기업 브로드컴의 공정거래법 위반 혐의와 관련한 자진 시정안에 대한 의견 수렴에 들어갔다. 브로드컴은 국내 셋톱박스 제조사에 자사 <b>반도체</b> 부품만 사용하도록 강요한 혐의를 받아왔다. 공정위는 7일... ,"Mon, 07 Apr 2025 15:12:00 +0900"
2025-04-07 06:33:54,"현대모비스 인도 통합 R&amp;D 센터..글로벌 S/W 연구개발 허브로 육성, 그 ...",https://www.dailycar.co.kr/content/news.html?type=view&autoId=56519,"현대모비스는 올해 미국 실리콘밸리에 <b>반도체</b> 연구관련 거점을 신설할 예정이며, 기존 디트로이트 북미연구소와 자율주행 요소기술을 중점으로 개발한다. 독일 프랑크푸르트 유럽연구소는 자율주행 센서 관련 기술을... ","Mon, 07 Apr 2025 15:12:00 +0900"
2025-04-07 06:33:54,"구미시, 탄소소재 산업 기업지원 사업 설명회 성료…지역 기업 경쟁력 ...",http://www.breaknews.com/1106893,"특히 이날 소개된 주요 사업은 ▲‘경북 탄소산업 혁신기술 국가사업화 지원사업’, ▲‘<b>반도체</b>·이차전지부품용 인조흑연 테스트베드 구축사업’... ","Mon, 07 Apr 2025 15:12:00 +0900"
2025-04-07 06:33:54,[단독]황정훈 더코디 전 대표 &quot;정당한 상여를…횡령 허위 공시&quot;,http://www.ftoday.co.kr/news/articleView.html?idxno=339775,회사는 <b>반도체</b> 장비 사업을 주로 영위하는 가운데 <b>반도체</b> 전공정 부문 사업에 있어서 업황 악화로 수익성을 높이는 데 있어 어려움을 겪었던 것으로 보인다. 황 대표는 지난달 31일 주주총회에 끝난 후 이사회를 통해... ,"Mon, 07 Apr 2025 15:12:00 +0900"
2025-04-07 06:33:54,"PSK홀딩스, 영남권 산불 피해 복구에 1억원 지원…주요 임원진도 동참",https://n.news.naver.com/mnews/article/092/0002369673?sid=105,"<b>반도체</b> 장비 전문기업 PSK홀딩스는 최근 경남 산청, 경북 의성, 울산 울주 등지에서 발생한 대형 산불로... PSK홀딩스는 <b>반도체</b> 장비 업계 내에서 산불 피해 복구를 위한 지원에 선제적으로 나선 기업 중 하나로, <b>반도체</b>... ","Mon, 07 Apr 2025 15:12:00 +0900"
2025-04-07 06:33:54,"현대모비스, 인도에 차량용 소프트웨어 연구거점 통합 개소",https://www.mtnews.net/news/articleView.html?idxno=21449,"현대모비스는 올해 미국 실리콘밸리에 <b>반도체</b> 연구 관련 거점을 신설할 예정이며, 기존 디트로이트 북미연구소와 자율주행 요소기술을 중점으로 개발한다. 독일 프랑크푸르트 유럽연구소는 자율주행 센서 관련 기술을... ","Mon, 07 Apr 2025 15:12:00 +0900"
2025-04-07 06:33:54,[AT 산업 단신] LG전자·LS전선·DB하이텍·태광그룹·로보락,https://www.asiatime.co.kr/article/20250407500319,DB하이텍은 독일에서 열리는 유럽 최대의 전력 <b>반도체</b> 전시회인 'PCIM 2025'에 참가해 유럽 시장을... 전력 <b>반도체</b> 전시회인 'PCIM(Power Conversion and Intelligent Motion) 2025'에 참가해 유럽 시장을 공략한다. 이번 전시에서... ,"Mon, 07 Apr 2025 15:12:00 +0900"
2025-04-07 06:33:54,[상호관세] 삼성·SK하이닉스 등 韓 <b>반도체</b> 영향은?,https://www.fetv.co.kr/news/article.html?no=190227,<b>반도체</b> '개별관세' 25% 예상 &quot;직접 악영향 크지 않을 것&quot; IT 제품 가격 증가·빅테크 기업 투자 악화 등 간접 영향↑ 도널드 트럼프 미국 대통령이 발표한 상호관세가 삼성전자와 SK하이닉스 등 국내 <b>반도체</b> 기업들에게도 큰... ,"Mon, 07 Apr 2025 15:12:00 +0900"
2025-04-07 06:33:54,"용인 백암초 학교복합시설·반다비 체육센터 건립, 행안부 중투 통과",https://n.news.naver.com/mnews/article/002/0002382153?sid=102,"시는 <b>반도체</b> 중심도시이자 인구 150만 명 대도시로 성장할 용인의 미래상을 설명하고, 학생들을 위한 생존수영 교육에 어려움을 겪고 있는 인접 도시인 이천시와 안성시 초등학교 학생들도 이용할 수 있는 광역 거점... ","Mon, 07 Apr 2025 15:11:00 +0900"
2025-04-07 06:33:54,최준용 SK하이닉스 부사장 &quot;HBM4E 적기 공급…리더십 공고히할 것&quot;,https://n.news.naver.com/mnews/article/092/0002369672?sid=105,AI 기술이 눈부시게 진보하면서 <b>반도체</b>에 대한 수요가 그 어느 때보다 많아지고 있다. HBM은 AI 메모리가 가장 필요로 하는 전력 효율성(Power)과 성능(Performance)에 가장 최적화된 제품으로 앞으로도 그 중요성은 더욱... ,"Mon, 07 Apr 2025 15:11:00 +0900"
2025-04-07 06:33:54,"미래에셋자산운용, '글로벌 경영' 주목도 압도…&quot;AI 활용, 글로벌 자산관...",https://www.s-journal.co.kr/news/articleView.html?idxno=28260,"같은 달, 투자 커뮤니티 '팍스넷' 등에는 미래에셋자산운용의 'TIGER 미국필라델피아AI<b>반도체</b>나스닥 ETF'가 누적 순매수 1000억원을 돌파했다는 글이 올라왔다. TIGER 미국필라델피아 AI<b>반도체</b> 나스닥 ETF 주요 투자... ","Mon, 07 Apr 2025 15:08:00 +0900"
2025-04-07 06:33:54,"공매도 재개 첫 주, 외국인 '2차전지·<b>반도체</b>'에 쏠림",http://www.newstomato.com/ReadNews.aspx?no=1258303&inflow=N,<b>반도체</b>와 2차전지 등 대형 성장주는 집중적인 공매도 타깃이 된 반면 방산·조선·화장품 업종은 상대적으로 공매도 영향에서 한 발 비켜선 모습이었습니다. 7일 한국거래소에 따르면 공매도가 재개된 지난달... ,"Mon, 07 Apr 2025 15:08:00 +0900"
2025-04-07 06:33:54,"미국 '관세폭탄'에 중국 희토류 통제로 맞불, 삼성전자·SK하이닉스 반도...",https://www.businesspost.co.kr/BP?command=article_view&num=390280,"미국의 <b>반도체</b> 관세와 중국의 희토류 수출통제 조치로 삼성전자·SK하이닉스의 공급망과 매출 불확실성이... 희토류는 <b>반도체</b> 제조 핵심 원재료인 만큼, 삼성전자와 SK하이닉스의 <b>반도체</b> 공급망 불확실성이 다시 커지고... ","Mon, 07 Apr 2025 15:08:00 +0900"
2025-04-07 06:33:54,"[구미24시] 구미시, 탄소소재 기업 성장 '앞장'…기업지원 사업 설명회",https://n.news.naver.com/mnews/article/586/0000100836?sid=102,주요사업으로는 △경북 탄소산업 혁신기술 국가사업화 지원사업 △<b>반도체</b>·이차전지부품용 인조흑연 테스트베드 구축사업 △방산항공우주용 탄소소재부품 랩팩토리 구축사업 등이다. 참석 기업들은 지원사업 활용... ,"Mon, 07 Apr 2025 15:07:00 +0900"
2025-04-07 06:33:54,"현대모비스, 인도 R&amp;D 센터 개소…글로벌 S/W 기지로 키운다",https://n.news.naver.com/mnews/article/417/0001069176?sid=103,"한편 현대모비스는 국내 마북·의왕연구소를 포함해 독일, 중국, 인도 등 4개국에 해외 R&amp;D 거점을 운영 중이며 올해는 미국 실리콘밸리에 <b>반도체</b> 연구 관련 센터를 신설할 계획이다.","Mon, 07 Apr 2025 15:06:00 +0900"
2025-04-07 06:33:54,광주 RISE 사업 수행 '17개' 대학 선정,http://www.gjdream.com/news/articleView.html?idxno=655535,"광주의 주력산업인 모빌리티·에너지·<b>반도체</b>·인공지능 산업의 △석·박사인력 1000명 배출 △창업기업 3만5000개 달성, 대학 졸업 후 지역 내 기업 또는 기관에 취업하는 △지역 정주 취업률 40%를 핵심 목표로 하고... ","Mon, 07 Apr 2025 15:06:00 +0900"
2025-04-07 06:33:54,"공정위, 브로드컴 갑질 관련 동의의결 의견 수렴…자진시정안·130억 상...",https://ilyo.co.kr/?ac=article_view&entry_id=490214,공정거래위원회가 한국 셋톱박스 제조사 등에 갑질한 <b>반도체</b> 제조사 브로드컴의 잠정 동의의결안 마련에... 공정위는 브로드컴이 유료방송 셋톱박스 시스템<b>반도체</b>를 국내 제조사에 공급하며 벌인 갑질 혐의를 조사한 바... ,"Mon, 07 Apr 2025 15:06:00 +0900"
2025-04-07 06:33:54,"&quot;아이폰16프로 원가 43만원 오른다&quot;…트럼프, 중국 때렸는데 애플이 왜...",https://www.financialpost.co.kr/news/articleView.html?idxno=223819,"통신칩은 미국 퀄컴이 설계하고 삼성전자 파운드리(<b>반도체</b> 위탁생산)에서 제조하는 것으로 전해졌다. D램 메모리는 미국 마이크론에서 공급받지만, 생산은 대만·일본에서 이뤄진다. 낸드 메모리(저장장치)는 일본... ","Mon, 07 Apr 2025 15:06:00 +0900"
2025-04-07 06:33:54,"BGF에코머티리얼즈 M&amp;A '대실소망', 홍석조 차남 홍정혁 승계플랜 삐거...",https://www.businesspost.co.kr/BP?command=article_view&num=390267,"KNW는 전자부품소재와 자동차부품소재, <b>반도체</b>소재 등을 주로 영위한다. BGF에코머티리얼즈는 이 회사를 2023년 8월 635억 원을 들여 인수했다. KNW의 핵심은 <b>반도체</b> 특수가스를 생산하는 <b>반도체</b>소재사업부다.... ","Mon, 07 Apr 2025 15:04:00 +0900"
2025-04-07 06:33:54,"DB하이텍, 유럽 시장 마케팅 강화",https://n.news.naver.com/mnews/article/021/0002701446?sid=101,유럽 최대 <b>반도체</b> 전시회 PCIM 2025 SiC·GaN 개발 현황 공유 및 고객 유치 8인치 파운드리 전문기업 DB하이텍이 내달 6일(현지시간)부터 8일까지 독일 뉘른베르크에서 열리는 유럽 최대의 전력 <b>반도체</b> 전시회인... ,"Mon, 07 Apr 2025 15:03:00 +0900"
