DateTime,Title,Link,Description,PubDate
2026-01-15 14:31:00,"뉴욕증시 프리뷰, 미 주가 선물 TSMC 실적 호조에 반등...엔비디아·마이...",https://www.newspim.com/news/view/20260115001181,파운드리(<b>반도체</b> 위탁생산) 업체 대만 TSMC의 사상 최대 실적 발표에 힘입어 반등했다. 기술주 급락으로 이틀 연속 하락했던 뉴욕 증시가 <b>반도체</b> 업종을 중심으로 분위기 전환을 시도하는 모습이다. 미 동부 시간... ,"Thu, 15 Jan 2026 23:23:00 +0900"
2026-01-15 14:31:00,"환율 불안에 미 구두 개입까지…한은, 금리 인하 종료하나?",https://n.news.naver.com/mnews/article/056/0012106182?sid=101,[앵커] 트럼프 미국 대통령이 <b>반도체</b> 관세 카드를 다시 꺼냈습니다. 구체적으로 어떤 내용입니까? [앵커] 우리 기업에도 여파가 있을 거 같은데요. 어떻게 내다보십니까? [앵커] 미중 갈등에 중일 갈등까지 있어서 대외... ,"Thu, 15 Jan 2026 23:07:00 +0900"
2026-01-15 14:31:00,"광주·전남, ‘행정통합’ 2라운드 돌입… 2월 특별법 국회 통과 총력",http://www.breaknews.com/1177125,특히 산업 분야에서는 AI·<b>반도체</b>·모빌리티 중심의 초광역 산업 육성을 위해 'AI 메가클러스터 조성 특례'를 규정했다. AI 도시 실증지구로 지정될 경우 최대 20년간... ,"Thu, 15 Jan 2026 23:06:00 +0900"
2026-01-15 14:31:00,"한국교통대, 증평군 기업인협의회와 ‘지산학연 협력 교류회’ 진행",http://www.breaknews.com/1177131,"특히, 이번 교류회에서는 지역 산업 경쟁력 강화를 위한 협력 방향을 중심으로 다양한 논의가 이뤄졌으며 바이오, <b>반도체</b>, 이차전지 등 지역 주력 산업의 성장... ","Thu, 15 Jan 2026 23:06:00 +0900"
2026-01-15 14:31:00,용인특례시 법원 판결로 <b>반도체</b> 국가산단 적법성 재확인,http://www.hansbiz.co.kr/news/articleView.html?idxno=809112,"용인특례시(시장 이상일)는 서울행정법원이 일부 환경단체가 제기한 용인 이동·남사읍 첨단시스템<b>반도체</b>... 첨단시스템<b>반도체</b> 국가산업단지 계획 승인 취소 소송을 기각한 것과 관련해, 국가산단 추진의 정당성이... ","Thu, 15 Jan 2026 22:56:00 +0900"
2026-01-15 14:31:00,트럼프 &quot;더 광범위한 <b>반도체</b> 관세 가능&quot;...여한구 귀국 연기,https://n.news.naver.com/mnews/article/052/0002301438?sid=104,트럼프 대통령이 중국에 수출하는 인공지능 <b>반도체</b>에 25% 관세를 부과하면서 그동안 미뤘던 <b>반도체</b> 분야 관세를 대대적으로 도입할 가능성을 공식 천명했습니다. 미국을 방문 중인 통상교섭본부장은 우리나라에 미칠... ,"Thu, 15 Jan 2026 22:55:00 +0900"
2026-01-15 14:31:00,‘AI 열풍’에 돈 쓸어 담은 TSMC… 2025년 매출 177조원 돌파,https://n.news.naver.com/mnews/article/022/0004098016?sid=104,인공지능(AI) 칩 수요가 폭발하면서   세계 최대 파운드리(<b>반도체</b> 수탁생산) 업체인 대만 TSMC의 지난해... 무역정책과 <b>반도체</b>에 관세를 부과하겠다는 위협은 글로벌 칩 산업에 많은 불확실성을 불러일으켰지만... ,"Thu, 15 Jan 2026 22:51:00 +0900"
2026-01-15 14:31:00,[세계와우리] 관세 너머의 리스크,https://n.news.naver.com/mnews/article/022/0004098010?sid=110,경제를 안보로 끌어들인 미국 中 겨냥 환적·원산지 규제 강화 H200 재수출 땐 25% 관세 천명 韓 <b>반도체</b> 기업... 1월14일 트럼프 행정부의 H200 <b>반도체</b> 재수출 25% 관세 포고문이 이를 잘 보여준다. 엔비디아 H200 등 고성능 AI... ,"Thu, 15 Jan 2026 22:50:00 +0900"
2026-01-15 14:31:00,광주·전남 통합 시계 빨라진다…국회서 특별법 집중 논의,https://www.geconomy.co.kr/news/article.html?no=314083,"인공지능과 모빌리티, <b>반도체</b>, 에너지, 문화 분야를 축으로 광역 단위 성장 전략을 세우고, 연구개발 거점과 기반시설, 재생에너지를 유기적으로 연계한 메가클러스터 조성을 핵심 과제로 삼았다. 이를 뒷받침하기 위해... ","Thu, 15 Jan 2026 22:48:00 +0900"
2026-01-15 14:31:00,"이상일 용인시장, 베트남 다낭 하이테크파크 방문…&quot;산업협력 확대&quot;",http://www.newsroad.co.kr/news/articleView.html?idxno=52674,"주요 유치 산업은 <b>반도체</b>와 정보통신기술(ICT), 인공지능(AI), 항공우주 부품 등으로 베트남 정부와 다낭시는... 이 시장은 &quot;용인특례시는 대한민국에서 가장 먼저 <b>반도체</b> 산업이 시작된 도시로, 현재 삼성전자와... ","Thu, 15 Jan 2026 22:42:00 +0900"
2026-01-15 14:31:00,이상일 용인시장 &quot;국가산단 흔드는 시도 이제 멈춰야&quot;,http://www.newsroad.co.kr/news/articleView.html?idxno=52673,이상일 용인특례시장이 용인 첨단시스템<b>반도체</b> 국가산업단지를 둘러싼 소송 결과에 대해 &quot;프로젝트를 흔드는 모든 시도가 멈춰야 한다&quot;고 강조했다. 이 시장은 15일 일부 환경단체가 용인 이동·남사읍 첨단시스템<b>반도체</b>... ,"Thu, 15 Jan 2026 22:42:00 +0900"
2026-01-15 14:31:00,"한국엡손, 고효율 스카라 로봇 3종 출시…자동차 부품·<b>반도체</b> 등 산업...",http://www.econonews.co.kr/news/articleView.html?idxno=423182,천장 설치 전용 스카라 로봇 RS4/S6-C는 360도 전방위 작업이 가능해 공간 효율성과 설계 유연성을 높였다. <b>반도체</b>와 메디컬 등 고정밀 작업이 필요한 소형 부품 핸들링 시장을 타깃으로 하고 있다.,"Thu, 15 Jan 2026 22:40:00 +0900"
2026-01-15 14:31:00,"TSMC, 4분기 순익 35% 급증 '사상 최대'",https://n.news.naver.com/mnews/article/003/0013713715?sid=104,세계 최대 파운드리(<b>반도체</b> 위탁생산) 기업인 대만 TSMC가 인공지능(AI) <b>반도체</b> 수요 호조에 힘입어 지난해 4분기 순이익이 전년 동기 대비 35% 급증해 분기 기준 사상 최대 실적을 기록했다. 15일(현지 시간) CNBC에... ,"Thu, 15 Jan 2026 22:36:00 +0900"
2026-01-15 14:31:00,"제주대, 환경.AI 분야서 잇단 성과.. 세계적 학술지 게재",https://n.news.naver.com/mnews/article/661/0000069293?sid=102,독성을 좌우하는 핵심 요인임을 규명해 국제 학술지에 발표했습니다. 또 배진호 교수팀은 차세대 <b>반도체</b> 기술인 3차원 구조 멤리스터 기반 뉴로모픽 소자를 다룬 리뷰 논문을 세계 최고 수준의 학술지에 게재했습니다.,"Thu, 15 Jan 2026 22:34:00 +0900"
2026-01-15 14:31:00,"화웨이, 작년 중국 스마트폰시장 점유율 1위 복귀",https://n.news.naver.com/mnews/article/056/0012106172?sid=104,"첨단 <b>반도체</b> 확보에 어려움을 겪었지만, 프리미엄 모델 '메이트 80 프로 맥스'에 자체 설계한 국산 칩을 사용하는 방식으로 제재에 대응해왔습니다. IDC 측은 &quot;화웨이의 자체적인 <b>반도체</b> 생산이 계속 개선된 점이... ","Thu, 15 Jan 2026 22:32:00 +0900"
2026-01-15 14:31:00,"용인특례시, <b>반도체</b> 국가산단 적법성 공식확인",http://www.bizwnews.com/news/articleView.html?idxno=121612,용인시 신년 기자회견   사진=오경희 기자 용인 첨단시스템<b>반도체</b> 국가산업단지를 둘러싼 논란에 사법부... 이 같은 판결에 대해 이상일은 즉각 입장을 내고 &quot;이번 판결을 계기로 용인 첨단시스템<b>반도체</b> 국가산단... ,"Thu, 15 Jan 2026 22:26:00 +0900"
2026-01-15 14:31:00,"TSMC, AI 칩 수요 강세에 '깜짝 실적'…올해 82조 통큰 설비투자(종합)",https://n.news.naver.com/mnews/article/018/0006201651?sid=105,세계 최대 파운드리(<b>반도체</b> 수탁생산) 업체인 대만 TSMC가 지난해 4분기 ‘깜짝실적’을 기록했다.... 전체 <b>반도체</b> 수요를 견인하고 있다”며 “2026년이 AI 서버 수요에 있어 또 하나의 도약의 해가 될 것”이라고... ,"Thu, 15 Jan 2026 22:26:00 +0900"
2026-01-15 14:31:00,[미리보는 이데일리 신문]코인거래소 지분축소 채우려는 韓… 바이낸스...,https://n.news.naver.com/mnews/article/018/0006201650?sid=102,부족’ -<b>반도체</b>법·필수의료법 등 줄줄이 표류…한병도 “野와 협상 계속” -토큰증권 시대 열린다... 공모 △Global -트럼프 “<b>반도체</b>에 더 광범위한 관세”…한국에 불똥 우려 -트럼프 예측불가 외교에 시진핑 앞에 줄... ,"Thu, 15 Jan 2026 22:25:00 +0900"
2026-01-15 14:31:00,[EBN 오늘(15일) 이슈 종합] 서울 아파트값 연 8.98% 상승...19년만에 최...,https://www.ebn.co.kr/news/articleView.html?idxno=1695437,"됐다고 15일 밝혔다 ■ 트럼프, <b>반도체</b> 관세 카드 꺼냈다...한국 <b>반도체</b> 업계 '긴장' 도널드 트럼프 미국 대통령이 14일(현지시간) <b>반도체</b> 관세 부과 계획 발표하면서 한국 <b>반도체</b> 기업들에 미칠 영향이 주목되고 있다.","Thu, 15 Jan 2026 22:24:00 +0900"
2026-01-15 14:31:00,"'美제재' 화웨이, 작년 中 스마트폰시장 점유율 1위 복귀",https://n.news.naver.com/mnews/article/001/0015850309?sid=104,"첨단 <b>반도체</b> 확보에 어려움을 겪었지만, 프리미엄 모델 '메이트 80 프로 맥스'에 자체 설계한 국산 칩을 사용하는 방식으로 제재에 대응해왔다. IDC 측은 &quot;화웨이의 자체적인 <b>반도체</b> 생산이 계속 개선된 점이... ","Thu, 15 Jan 2026 22:23:00 +0900"
2026-01-15 14:31:00,TSMC 4분기 영업익 26조원 전년비 33%↑,http://www.4th.kr/news/articleView.html?idxno=2105182,포쓰저널 강민혁 기자 TSMC 분기 실적 추이  대만 <b>반도체</b> 위탁생산 업체인 타이완 <b>반도체</b> 제조(TSMC)가 인공지능(AI) <b>반도체</b> 수요 확대에 힘입어 지난해 4분기 또 한 번 사상 최대 실적을 기록했다. TSMC는 2025년... ,"Thu, 15 Jan 2026 22:22:00 +0900"
2026-01-15 14:31:00,"코스피 5,000 시대, 꿈 아닌 현실로… 4,800선 턱밑 마감에 증권가 전망...",https://www.topstarnews.net/news/articleView.html?idxno=15935812,"특히 <b>반도체</b> 업황의 폭발적 성장과 정부 주도의 기업 밸류업 정책이 맞물리며, 그동안 '박스피'에 갇혀... 이는 <b>반도체</b>를 중심으로 한 상장사들의 이익 개선 속도가 예상을 훨씬 뛰어넘고 있다는 판단에 따른 것이다.... ","Thu, 15 Jan 2026 22:18:00 +0900"
2026-01-15 14:31:00,&quot;삼전·현대차 못 샀는데 어쩌죠&quot;…&quot;아직 싸다&quot; 전문가 찜한 주식 [분석...,https://n.news.naver.com/mnews/article/015/0005237892?sid=101,"코스피지수가 연초부터 <b>반도체</b>, 원자력발전, 조선 등 순환매를 거치며 10거래일 연속 오르는 등 사상 최고가... 연초부터 <b>반도체</b>, 원전, 자동차, 조선 등 대형주들의 본주 가격이 가파르게 오르면서 매수 타이밍을 놓친... ","Thu, 15 Jan 2026 22:01:00 +0900"
2026-01-15 14:31:00,[심층] '삼성닉스' 쏠림 심화… 코스피 상승동력 이면의 그림자,https://www.startuptoday.co.kr/news/articleView.html?idxno=573023,"인공지능(AI) 투자 확산과 <b>반도체</b> 업황 개선 기대가 맞물리면서 지수 전반이 탄력을 받고 있지만, 상승의 동력이 특정 업종과 종목에 과도하게 집중되고 있다는 점은 부담 요인으로 지목된다. 특히 <b>반도체</b> 대형주가... ","Thu, 15 Jan 2026 22:00:00 +0900"
2026-01-15 14:31:00,썩지도 않아 찜찜했던 '프라이팬 코팅'…전기로 분해 길 열렸다,https://n.news.naver.com/mnews/article/123/0002375819?sid=101,"프라이팬 코팅이나 방수 의류, <b>반도체</b> 공정 등에 쓰이지만 자연에서 수백 년간 분해되지 않아 '영구... 울산과학기술원(UNIST)은 김귀용 지구환경도시건설공학과 교수와 김병조 <b>반도체</b>소재·부품대학원 교수 연구팀이... ","Thu, 15 Jan 2026 22:00:00 +0900"
2026-01-15 14:31:00,영월 상동광산 3월 재가동…“광물 산업 가속”,https://n.news.naver.com/mnews/article/056/0012106133?sid=101,"<b>반도체</b> 등 첨단산업 확대로 텅스텐의 가치가 올랐기 때문인데요. 영월군은 텅스텐을 가공하는 국내 첫... 텅스텐이 <b>반도체</b>와 방위 산업에 핵심소재로 쓰이면서 가격이 톤당 6만 7,000달러로 10년 새 6배로 올랐기... ","Thu, 15 Jan 2026 21:59:00 +0900"
2026-01-15 14:31:00,"노관규 순천시장 &quot;통합은 찬성, 순천 불리하면 절대 물러서지 않겠다&quot;",https://www.startuptoday.co.kr/news/articleView.html?idxno=573064,"특히 RE100 기반 <b>반도체</b> 첨단산업단지는 여건상 순천·광양 등 전남 동부권이 가장 경쟁력이 높다며, TF를 넘어선 전담 조직의 즉각적인 편성을 주문했다. 신설 의과대학 문제와 관련해서는 중앙정부의 심의 내용과 지역의... ","Thu, 15 Jan 2026 21:58:00 +0900"
2026-01-15 14:31:00,'AI 수요' TSMC 작년 사상 최대 실적…매출 31.6%↑,https://n.news.naver.com/mnews/article/422/0000823187?sid=104,세계 최대 파운드리(<b>반도체</b> 수탁생산) 업체인 타이완의 TSMC가 인공지능(AI) 칩 수요에 힘입어 지난해... 무역정책과 <b>반도체</b>에 관세를 부과하겠다는 위협은 글로벌 칩 산업에 많은 불확실성을 불러일으켰지만... ,"Thu, 15 Jan 2026 21:58:00 +0900"
2026-01-15 14:31:00,"민주당, 신년 인사회…“지방시대, 지선 필승 결의”",https://n.news.naver.com/mnews/article/056/0012106131?sid=100,"특히, 강원도를 <b>반도체</b>와 수소, 바이오 등 미래 산업의 새로운 거점으로 만들겠다고 약속했습니다. [김민석/국무총리 : &quot;서울에서부터 멀수록 소멸 위기가 있는 것이죠. 혜택을 줄 수 있으면 더 주고, 그리고 가급적 권한을... ","Thu, 15 Jan 2026 21:57:00 +0900"
2026-01-15 14:31:00,광주·전남 행정통합 입법 시동…국회 공청회로 논의 본격화,https://www.geconomy.co.kr/news/article.html?no=314084,"산업 분야에서는 인공지능(AI)·<b>반도체</b>·모빌리티를 중심으로 한 초광역 산업 육성 특례가 핵심이다. 광역 단위 인공지능 메가 클러스터 조성, 인공지능 도시 실증지구 지정과 장기 규제 완화, <b>반도체</b>산업 특화단지 우선... ","Thu, 15 Jan 2026 21:56:00 +0900"
2026-01-15 14:31:00,노관규 순천시장 &quot;치유에서 <b>반도체</b>까지&quot;…2026년 미래 좌우할 시기,https://www.kpinews.kr/newsView/1065617299379910,노관규 순천시장이 &quot;2026년은 순천의 미래를 좌우할 결정적 시기&quot;라며 &quot;치유에서 <b>반도체</b>까지 도시의 판을... 동시에 <b>반도체</b> 산업 유치에도 속도를 낸다. 순천시는 해룡·광양읍 일원의 미래첨단산단을 RE100 국가산단으로... ,"Thu, 15 Jan 2026 21:51:00 +0900"
2026-01-15 14:31:00,"“<b>반도체</b> 남방한계선 깬다”~순천시, ‘RE100 산단’으로 경제 영토 확장...",https://www.wikitree.co.kr/articles/1110370,"[위키트리 광주전남취재본부 노해섭 기자]순천시가 2026년을 대한민국 대도약의 원년으로 선포하고, 수도권에 집중된 <b>반도체</b> 산업 지도를 남부권으로 확장하겠다는 야심 찬 구상을 내놨다. 이른바 ‘<b>반도체</b> 남방한계선’... ","Thu, 15 Jan 2026 21:50:00 +0900"
2026-01-15 14:31:00,"TSMC, 지난해 사상최대 실적···&quot;AI 수요 강세&quot;",https://www.ziksir.com/news/articleView.html?idxno=120105,[AFP 연합뉴스]  세계 최대 파운드리(<b>반도체</b> 위탁생산) 업체인 대만 TSMC가 인공지능(AI) 칩 수요에 힘입어 지난해 역대 최대 실적을 기록했다. 특히 지난해 4분기 순이익이 전년동기대비 35% 증가했다. TSMC에... ,"Thu, 15 Jan 2026 21:46:00 +0900"
2026-01-15 14:31:00,<b>반도체</b> 클러스터 전북 이전 촉구 잇따라…“송전탑 건설 반발 해소”,https://n.news.naver.com/mnews/article/056/0012106061?sid=101,"[앵커] 용인 <b>반도체</b> 클러스터의 전북 이전을 촉구하는 목소리가, 정치권에 이어 시민사회에서도 터져 나왔습니다. 전북에서 만든 전기를 수도권으로 보내지 말고 전북에 <b>반도체</b> 클러스터를 만들면, 송전탑 건설 논란과 주민... ","Thu, 15 Jan 2026 21:44:00 +0900"
2026-01-15 14:31:00,수백 년 안썩는 과불화화합물 전기로 흡착·분해 신기술 개발,https://www.ulsanpress.net/news/articleView.html?idxno=567314,"UNIST 지구환경도시건설공학과 김귀용 교수와 <b>반도체</b>소재·부품대학원 김병조 교수팀은 전도성 고분자를... 과불화화합물은 프라이팬 코팅, 방수 의류 제조, <b>반도체</b> 공정 등에 쓰는 물질로, 자연에서는 거의 분해되지... ","Thu, 15 Jan 2026 21:43:00 +0900"
2026-01-15 14:31:00,국회서 신규 원전 유치 나선 울산 울주 서생주민들,https://www.ulsanpress.net/news/articleView.html?idxno=567265,범대책위는 AI 데이터센터와 <b>반도체</b> 산업 등 국가 전략산업 확대로 울산 전력 수요 급증이 예상되는 가운데 신규 원전을 현실적 대안으로 제시하고 있다. 또 신규 원전 유치 필요성을 강조하는 동시에 서생면 지역 신규... ,"Thu, 15 Jan 2026 21:42:00 +0900"
2026-01-15 14:31:00,"TSMC, AI칩 수요에 작년 ‘사상 최대’…올해 설비투자 82조4000억원",https://www.g-enews.com/view.php?ud=202601152137564031740eacf404_1,세계 최대 파운드리(<b>반도체</b> 수탁생산) 업체인 대만 TSMC가 인공지능(AI) 칩 수요에 힘입어 지난해 역대... 무역정책과 <b>반도체</b>에 관세를 부과하겠다는 위협은 글로벌 칩 산업에 많은 불확실성을 불러일으켰지만... ,"Thu, 15 Jan 2026 21:42:00 +0900"
2026-01-15 14:31:00,순천시 2026년 시정 방향 공개…치유·미래경제 집중,https://www.newscj.com/news/articleView.html?idxno=3364069,"미래경제 분야에서는 문화콘텐츠, 우주방산, 바이오, <b>반도체</b> 산업을 중심으로 한 산업 구조 전환을... 지정해 <b>반도체</b> 산업 유치 가능성을 검토 중이다. 이와 함께 시는 2000억원 규모의 순천사랑 상품권 발행, 소상공인과... ","Thu, 15 Jan 2026 21:40:00 +0900"
2026-01-15 14:31:00,대전충남특별시 특별법 원안 통과 시 연 10조원 재정 확충 전망,https://www.dnews.co.kr/uhtml/view.jsp?idxno=202601152129101870941,"도는 이 재원을 피지컬 AI, 미래 모빌리티, <b>반도체</b>, 바이오헬스, 국방, 디스플레이, 에너지 등 첨단산업 육성과 국내외 기업 투자 유치에 집중 투입할 계획이다. 철도·도로 직접 구축을 통한 교통 개선, 의료·교육... ","Thu, 15 Jan 2026 21:40:00 +0900"
2026-01-15 14:31:00,산업 경제 대전환…부산의 생존 전략은?,https://n.news.naver.com/mnews/article/056/0012106062?sid=101,"&quot;] 부산형 <b>반도체</b> 산업의 경쟁력, 수도권과의 경쟁에 대해 물었습니다. [&quot;충분히 가능한 것이 지금 수도권의 중견 기업들이 부산의 전력 <b>반도체</b> 클러스터(단지)에 많은 관심을 가지고 있고, 또 실제로 내려와 있고 내려오고... ","Thu, 15 Jan 2026 21:40:00 +0900"
2026-01-15 14:31:00,영월 상동광산 3월 재가동…“광물 산업 가속”,https://n.news.naver.com/mnews/article/056/0012106060?sid=101,"<b>반도체</b> 등 첨단산업 확대로 텅스텐의 가치가 올랐기 때문인데요. 영월군은 텅스텐을 가공하는 국내 첫... 텅스텐이 <b>반도체</b>와 방위 산업에 핵심소재로 쓰이면서 가격이 톤당 6만 7,000달러로 10년 새 6배로 올랐기... ","Thu, 15 Jan 2026 21:38:00 +0900"
2026-01-15 14:31:00,"[오늘의 뉴스 종합] '개인정보 유출' 카카오, 151억 과징금 불복 소송 패...",https://www.ajunews.com/view/20260115213307739,美 기여 없는 <b>반도체</b>엔 25% 관세 폭탄···삼성·SK하닉 다시 '예의주시' 트럼프 미국 행정부가 <b>반도체</b> 수입을 국가안보 사안으로 규정하고 25% 관세 부과에 나서자 국내 <b>반도체</b> 업계도 '긴장 모드'에 접어들었다. 글로벌... ,"Thu, 15 Jan 2026 21:36:00 +0900"
2026-01-15 14:31:00,"&quot;K-미래차, AI로 대반격&quot;…현대차·LG·삼성 '드림팀' 떴다",https://www.goodkyung.com/news/articleView.html?idxno=280850,완성차부터 <b>반도체</b>·부품·AI·클라우드·모빌리티 서비스까지 전 주기를 아우르는 구조다. 업계에서는 이를 두고 완성차 중심 수직 계열화에 AI 인프라를 결합한 '한국판 화웨이 모델'로 해석한다. 한 업계 관계자는... ,"Thu, 15 Jan 2026 21:36:00 +0900"
2026-01-15 14:31:00,"민주당, 신년 인사회…“지방시대, 지선 필승 결의”",https://n.news.naver.com/mnews/article/056/0012106058?sid=100,"특히, 강원도를 <b>반도체</b>와 수소, 바이오 등 미래 산업의 새로운 거점으로 만들겠다고 약속했습니다. [김민석/국무총리 : &quot;서울에서부터 멀수록 소멸 위기가 있는 것이죠. 혜택을 줄 수 있으면 더 주고, 그리고 가급적 권한을... ","Thu, 15 Jan 2026 21:35:00 +0900"
2026-01-15 14:31:00,"[정책포커스] 한국은행, '5연속' 기준금리 동결…현재 2.50% 수준 유지",http://www.sisacast.kr/news/articleView.html?idxno=90120,"앞으로 국내경제는 수출이 <b>반도체</b> 경기 호조 등으로 양호한 증가세를 지속하는 가운데 내수도 소비 회복세... 금년 성장률은 지난 11월 전망치(1.8%)에 대체로 부합할 것으로 예상되지만, <b>반도체</b> 경기의 상승세 확대... ","Thu, 15 Jan 2026 21:34:00 +0900"
2026-01-15 14:31:00,"순천시의회, 권역별 균형발전 담보한 행정통합 지지성명 발표",https://www.ngonews.kr/news/articleView.html?idxno=222529,"강형구 의장은 &quot;전남동부권 RE100 <b>반도체</b> 국가산단 조성 등 지역 주도 성장의 연결구조를 통해 국가전략을 선도적으로 완성하고, 미래 성장 산업을 아우르는 지역 균형발전의 신성장 모델을 구축해 어느 한 지역도... ","Thu, 15 Jan 2026 21:32:00 +0900"
2026-01-15 14:31:00,"순천시, 2026년 주요업무 실행계획 보고회 개최",https://www.ngonews.kr/news/articleView.html?idxno=222532,'미래경제 분야'에서는 문화콘텐츠·우주방산·바이오·<b>반도체</b>로 대표되는 신성장 산업을 중심으로 도시의... 시는 현재 순천 해룡․광양읍 일원의 미래첨단산단을 RE100 국가산단으로 지정해 수도권에 집중된 <b>반도체</b>... ,"Thu, 15 Jan 2026 21:32:00 +0900"
2026-01-15 14:31:00,법원 &quot;용인 <b>반도체</b> 클러스터 승인 적법&quot;,https://jtv.co.kr/2021/?c=3/10&uid=2199887,환경단체가 용인 <b>반도체</b> 클러스터 국가산업단지에 대한 승인을 취소해달라며 제기한 소송에서... 이 때문에 최근 전북 정치권을 중심으로 제기된 용인 <b>반도체</b> 클러스터의 새만금 이전론에 대한 동력이 약화될 것이라는... ,"Thu, 15 Jan 2026 21:30:00 +0900"
2026-01-15 14:31:00,"김민석 국무총리, 넥슨 사옥 방문했다...&quot;게임은 미래 산업이자 청년 일...",https://www.mhns.co.kr/news/articleView.html?idxno=736423,김 총리는 그래픽 및 사운드 제작 현장을 둘러본 뒤 &quot;지금까지 <b>반도체</b>나 자동차 공장 등 견학한 것 중 가장 재미있었다&quot;고 전하며 현장 관계자들에게 감사를 표했다. 한편 더불어민주당은 최근 게임 산업에 대한 관심과... ,"Thu, 15 Jan 2026 21:30:00 +0900"
2026-01-15 14:31:00,"조직·재정 등 300개 ‘특례’…광주·전남, 합치면 ‘막강’",https://n.news.naver.com/mnews/article/032/0003421925?sid=100,"인공지능, 에너지, <b>반도체</b>, 모빌리티, 문화 융합 기술 등을 육성하기 위한 각종 특례 조항도 있다. 태양광이나... <b>반도체</b>산업 특화 단지에 대해서도 특별시장이 요청하면 우선 지원하도록 했다. 광주시와 전남도는... ","Thu, 15 Jan 2026 21:29:00 +0900"
