DateTime,Title,Link,Description,PubDate
2025-07-13 05:26:41,코스피 공매도 잔고 ‘9조 원’ 넘어…공매도 재개 이후 최고 수준,https://n.news.naver.com/mnews/article/082/0001335125?sid=101,"코스피 상장 종목 중 시총 대비 공매도 순보유 잔고 비중이 가장 큰 종목은 이차전지 및 <b>반도체</b> 소재 기업 SKC로 그 비중은 5.55%에 달한다. 한미<b>반도체</b>(4.92%), 신성이엔지(3.89%), 호텔신라(3.84%), 두산퓨얼셀(3.44... ","Sun, 13 Jul 2025 14:25:00 +0900"
2025-07-13 05:26:41,코스피 급등하자 '하락' 베팅···공매도 순잔고 9조원 상회 '최대 규모...,https://www.seoulfn.com/news/articleView.html?idxno=600599,"코스피 시장에서 공매도 비중이 가장 높은 곳은 SKC(5.55%), 한미<b>반도체</b>(4.92%), 신성이엔지(3.98%), 호텔신라(3.84%), 동방(3.48%) 등이다. 이들 종목의 주가는 3월 31일 대비 7월 9일까지 한미<b>반도체</b> 39.88%, 신성이엔지... ","Sun, 13 Jul 2025 14:20:00 +0900"
2025-07-13 05:26:41,"경기도, 수출 위기 中企에 기업당 최대 5000만원 지원…900곳 대상",https://n.news.naver.com/mnews/article/119/0002978624?sid=102,경기도가 자동차·<b>반도체</b>·의약품·철강·알루미늄 등 대미 수출 핵심 품목을 중심으로 무역분쟁 피해 가능성이 있는 기업에 최대 5000만원을 지원한다. 도는 트럼프 2기 행정부의 보호무역 강화로 수출 위기에 처한 도내... ,"Sun, 13 Jul 2025 14:17:00 +0900"
2025-07-13 05:26:41,슈퍼개미 5명 중 1명은 다 ‘이것’ 쓴다는데…올해 100% 수익냈다 [K주...,https://n.news.naver.com/mnews/article/009/0005523905?sid=101,"<b>반도체</b>를 필두로 증권, 보험, 이차전지까지 불기둥을 세우고 있습니다. 그중 증권주들의 오름세가 눈에 띄었습니다. 코스피 거래대금이 증가하면서 실적이 개선될 것이라 예상됐고, 밸류업 기조로 큰 폭의 주주환원을... ","Sun, 13 Jul 2025 14:15:00 +0900"
2025-07-13 05:26:41,"경기도, 대미 수출 중소기업에 최대 5000만 원 무역위기 대응 지원",https://n.news.naver.com/mnews/article/030/0003330841?sid=105,"경기도는 자동차, <b>반도체</b>, 의약품, 철강, 알루미늄 등 미국 수출 핵심 품목을 중심으로 무역분쟁 피해가 우려되는 900개 중소기업을 대상으로 총 70억원 규모의 지원사업을 실시한다고 13일 밝혔다. 이 사업은 트럼프 2기... ","Sun, 13 Jul 2025 14:14:00 +0900"
2025-07-13 05:26:41,"(가공)&quot;떠나는 청년인재 막아라&quot; 구미시, 산학연 협력으로 돌파구 모색",https://www.ajunews.com/view/20250713113822769,"하지만 구미에도 <b>반도체</b>, 전자, 기계·부품 등 다양한 분야에서 성장 가능성과 경쟁력을 갖춘 기업들이 다수 존재한다. 문제는 이들 기업의 정보가 청년들에게 제대로 전달되지 않거나, 지역 기업에 대한 막연한 부정적... ","Sun, 13 Jul 2025 14:12:00 +0900"
2025-07-13 05:26:41,정책 모멘텀 속 관세·실적 변수 주목…‘옥석가리기’ 본격화[주간 증...,https://n.news.naver.com/mnews/article/014/0005376096?sid=101,"다만 관세 협상 결과에 따라 자동차, <b>반도체</b> 등 초대형 수출주의 실적과 수급이 달라질 수 있어 주의가 필요하다는 지적이다. 신승진 삼성증권 연구원은 &quot;관세 불확실성으로 코스피 전반의 이익 추정치는 하향되고... ","Sun, 13 Jul 2025 14:12:00 +0900"
2025-07-13 05:26:41,"경기도, 대미 수출 위기 中企 900곳에 최대 5000만원",http://www.shinailbo.co.kr/news/articleView.html?idxno=2082515,"경기도는 자동차, <b>반도체</b>, 의약품, 철강, 알루미늄 등 대미 수출 핵심 품목을 중심으로 무역분쟁 피해 가능성이 있는 기업에 최대 5천만원을 지원한다고 13일 밝혔다. 도는 트럼프 2기 행정부의 보호무역 강화로 수출... ","Sun, 13 Jul 2025 14:08:00 +0900"
2025-07-13 05:26:41,시작된 한미 관세 협상,http://www.kihoilbo.co.kr/news/articleView.html?idxno=1151685,"이미 자동차 및 부품, 철강, 알루미늄 등 일부 품목은 25~50% 수준의 고율 관세가 부과된 상태이며 향후 <b>반도체</b> 등 주력 수출품목으로 확대될 가능성도 배제할 수 없다. 우리나라의 산업통상자원부 본부장 등 실무진이... ","Sun, 13 Jul 2025 13:58:00 +0900"
2025-07-13 05:26:41,"후퇴 반복하던 트럼프, 이번에는 다르다?…외신 “시장 대처 안일”",https://n.news.naver.com/mnews/article/016/0002498697?sid=104,특히 구리·의약품·<b>반도체</b> 등으로 관세전쟁 품목을 확대했다. 8월 1일로 부과 시점을 못 박고 더 이상의 유예는 없다고 강조했다. 다만 이런 경고가 투자심리에 당장은 별다른 영향을 미치지 않은 모양새다. 10일... ,"Sun, 13 Jul 2025 13:58:00 +0900"
2025-07-13 05:26:41,"엔비디아, 시가총액 4조 달러 돌파…관련주 SK하이닉스 '30만원' 안착하...",http://www.g-enews.com/ko-kr/news/article/news_all/20250713133822732edf69f862c_1/article.html,‘AI <b>반도체</b>의 제왕’ 엔비디아가 시가총액 4조 달러를 돌파하면서 SK하이닉스가 주목받고 있다. 13일... SK하이닉스는 AI(인공지능) 가속기에 특화된 메모리 <b>반도체</b>인 HBM(고대역폭메모리)의 최신 고성능 제품을... ,"Sun, 13 Jul 2025 13:56:00 +0900"
2025-07-13 05:26:41,"인천시, 대미 수출 중소기업 경영안정자금 1500억 지원",https://n.news.naver.com/mnews/article/005/0001789344?sid=102,최근 미국 관세 정책이 지속되는 가운데 인천의 주요 수출품인 <b>반도체</b>와 의약품 등 일부 품목에 대한 추가 관세 부과 가능성도 제기되고 있다. 이에 시는 대미 수출 중소기업을 비롯해 관세 영향으로 경영에 어려움을 겪는... ,"Sun, 13 Jul 2025 13:55:00 +0900"
2025-07-13 05:26:41,"한국-캐나다, AI 부문 산업·정책·국제 협력 방안 모색",https://n.news.naver.com/mnews/article/018/0006064491?sid=105,"또한 AI 알고리즘에 강점을 지닌 캐나다와, AI <b>반도체</b> 및 하드웨어 기술에 경쟁력을 갖춘 한국 간 보완적 역량을 결합한 산업 협력의 시너지 창출 필요성에 공감했다. 타마라 모휘니 주한캐나다 대사는 개회사를 통해... ","Sun, 13 Jul 2025 13:53:00 +0900"
2025-07-13 05:26:41,코스피 공매도 잔고 9조 돌파…3개월 새 2배 급증,https://www.sentv.co.kr/article/view/sentv202507130024,"코스피 상장 종목 중 시총 대비 공매도 순보유 잔고 비중이 가장 큰 종목은 이차전지 및 <b>반도체</b> 소재 기업 SKC로 그 비중은 5.55%에 달한다. 한미<b>반도체</b>(4.92%), 신성이엔지(3.89%), 호텔신라(3.84%), 동방(3.48%), 두산퓨얼셀(3.... ","Sun, 13 Jul 2025 13:48:00 +0900"
2025-07-13 05:26:41,[브릿지 칼럼] 아전인수(我田引水) 시장정책,https://www.viva100.com/article/20250707501618,산업혁명을 주창했던 2016년 다보스포럼 이후 주가는 데이터 센터와 서버 수요 관련 <b>반도체</b> 재고 사이클과 생산량 및 가격 추이가 중심을 이룬다. 챗 GPT나 AI의 실제 양적·질적 효과도 <b>반도체</b>와 IT 연관 설비 및 관련 소재... ,"Sun, 13 Jul 2025 13:46:00 +0900"
2025-07-13 05:26:41,"유진선 용인특례시의회의장, 경제위기 극복 지방의회의 연대 강조",https://www.joongdo.co.kr/web/view.php?key=20250713010004387,앞서 유 의장은 &quot;최근 <b>반도체</b> 산업의 침체와 중소기업의 실적 부진 등으로 지역경제가 심각한 어려움에 처해 있다&quot;며 &quot;지방의회가 위기에 공감하고 연대하여 정책 대안을 함께 모색하는 것이 무엇보다 중요하고... ,"Sun, 13 Jul 2025 13:42:00 +0900"
2025-07-13 05:26:41,코스피 공매도 잔고 9조원 돌파…3월 재개 이후 최대치,https://n.news.naver.com/mnews/article/119/0002978616?sid=101,"코스피 상장 종목 중 시총 대비 공매도 순보유 잔고 비중이 가장 큰 종목은 이차전지 및 <b>반도체</b> 소재 기업 SKC로 그 비중은 5.55%에 달한다. 이어 한미<b>반도체</b>(4.92%), 신성이엔지(3.89%), 호텔신라(3.84%), 동방(3.48... ","Sun, 13 Jul 2025 13:37:00 +0900"
2025-07-13 05:26:41,"AI(AGI·ASI)가 바꾸는 세상, 길을 묻다&quot;①&quot;이렇게 짧은 시간, 이렇게 많...",https://www.idaegu.com/news/articleView.html?idxno=642847,"두 나라는 AI <b>반도체</b>, 대형 언어모델(LLM), 자율주행, 로봇 등 핵심 분야에서 초격차를 벌리며 글로벌 표준을... 대형 언어모델, AI <b>반도체</b> 등 핵심 기술 경쟁력과 글로벌 생태계 내 영향력도 제한적이다. 데이터 활용... ","Sun, 13 Jul 2025 13:36:00 +0900"
2025-07-13 05:26:41,"삼성전자, 바닥 다졌나…' 7만전자' 기대감 '솔솔'",http://www.g-enews.com/ko-kr/news/article/news_all/202507131329399616edf69f862c_1/article.html,"시장에서는 실적 부진이 일회성에 가깝다고 보고, 하반기부터는 <b>반도체</b> 업황 회복과 함께 주가가... 박유악 키움증권 연구원은 “자사주 매입 효과와 함께 점진적 저점 상승이 기대된다”며 삼성전자를 <b>반도체</b>업종... ","Sun, 13 Jul 2025 13:34:00 +0900"
2025-07-13 05:26:41,"동서발전, 국내 첫 천연가스 발전 CO₂ 포집해 산업에 활용",http://www.metroseoul.co.kr/article/20250713500110,생산된 액화탄산가스는 △조선업의 용접 공정 △<b>반도체</b> 세정 △드라이아이스 제조 △농업 분야의 광합성 촉진 등 다양한 산업 분야에서 활용될 예정이다. 특히 고순도 탄산가스를 필요로 하는 산업계 수요에 안정적으로... ,"Sun, 13 Jul 2025 13:32:00 +0900"
2025-07-13 05:26:41,코스피 공매도 잔고 9조원 돌파…공매도 재개 이후 최고치,http://www.segyebiz.com/newsView/20250713505238?OutUrl=naver,-단기 조정 전망에 공매도 잔고 최고치 -이차전지·<b>반도체</b> 업종 비중 높아 코스피는 전 거래일(3183.23)보다... 코스피 상장 종목 중 시총 대비 공매도 순보유 잔고 비중이 가장 큰 종목은 이차전지·<b>반도체</b> 소재 기업... ,"Sun, 13 Jul 2025 13:26:00 +0900"
2025-07-13 05:26:41,'타코' 트럼프 이번엔 안 물러서나…&quot;시장 낙관 안일&quot; 경고도,https://n.news.naver.com/mnews/article/001/0015503943?sid=104,또 구리·의약품·<b>반도체</b> 등 품목별로도 관세전쟁을 확대하면서 8월 1일로 부과 시점을 못 박고 더 이상의 유예는 없다고 강조했다. 다만 이런 경고가 투자심리에 당장은 별다른 영향을 미치지 않은 모양새다. 10일... ,"Sun, 13 Jul 2025 13:23:00 +0900"
2025-07-13 05:26:41,"역대 최고가와 격차 '4%'로 좁혔다… 외국인, 돈보따리 행렬",https://n.news.naver.com/mnews/article/008/0005220789?sid=101,인덱스)가 극도의 탐욕 구간에 진입한 만큼 상승 업종 추격 매수보다 리스크 관리와 소외된 저평가주 중심의 순환매 대응이 유효하다&quot;고 했다. 이 연구원은 건강관리·<b>반도체</b>·2차전지 업종을 저평가된 소외주로 꼽았다.,"Sun, 13 Jul 2025 13:22:00 +0900"
2025-07-13 05:26:41,"한남대 화학공학과 김극태교수, '제35회 과학기술우수논문상' 수상",https://www.ggilbo.com/news/articleView.html?idxno=1100549,"김 교수는 화공 전달현상, 결정성장, 고분자 코팅공정, 우주공학, <b>반도체</b> 소재분야 등의 분야에서 활발한 연구를 수행해 오고 있다. 지난 2004년과 2008년 한국결정성장학회에서 학술상을 수상했으며 2021년에는... ","Sun, 13 Jul 2025 13:22:00 +0900"
2025-07-13 05:26:41,"[주간증시전망] 코스피, 기간 조정 국면 전망⋯실적 뒷받침 소외주 ‘주...",https://www.viva100.com/article/20250713500028,"관리와 소외된 저평가주 중심의 순환매 투자를 조언했다. 추천 업종으로는 건강관리와 <b>반도체</b>, 2차전지 업종이 대표적이다. 상법개정안과 관련된 업종인 중소형 지주와 증권 업종에 대한 투자도 유망할 것으로 제시됐다.","Sun, 13 Jul 2025 13:20:00 +0900"
2025-07-13 05:26:41,단통법 폐지·Z시리즈 겹친 7월…번호이동 경쟁 격화,http://www.metroseoul.co.kr/article/20250713500102,"여기에 최근 SK텔레콤이 AI <b>반도체</b>, 초거대 언어모델, 데이터센터 등 차세대 인프라에 막대한 투자를 단행하고 있는 점도 공격적인 마케팅을 제약하는 요인으로 꼽힌다. 또 다른 업계 관계자는 &quot;SK텔레콤 입장에서는... ","Sun, 13 Jul 2025 13:12:00 +0900"
2025-07-13 05:26:41,공매도 잔고 9조 돌파…3월 재개 후 최대치,https://www.ngetnews.com/news/articleView.html?idxno=530798,"이어 한미<b>반도체</b>(4.92%), 신성이엔지(3.89%), 호텔신라(3.84%), 동방(3.48%), 두산퓨얼셀(3.44%), 한화비전(3.41%) 등의 순이었다. 코스닥에서는 제룡전기(4.70%)가 1위를 기록했으며, 브이티(4.67%), 다날(4.52%), 제주<b>반도체</b>(4.34... ","Sun, 13 Jul 2025 13:12:00 +0900"
2025-07-13 05:26:41,"경기도, 대미 수출 중소기업 900곳에 최대 5천만원 지원",http://www.kihoilbo.co.kr/news/articleView.html?idxno=1151666,"기호일보 - 아침을 여는 신문, KIHOILBO 무역 위기 대응 패키지 지원사업 홍보 포스터/경기도 경기도가 자동차, <b>반도체</b>, 의약품, 철강, 알루미늄 등 대미 수출 핵심 품목을 중심으로 무역분쟁 피해 가능성이 있는 기업에 최대... ","Sun, 13 Jul 2025 13:10:00 +0900"
2025-07-13 05:26:41,3분기 제조업 BSI 95...바이오·디스플레이 제외 매출 둔화 전망,https://n.news.naver.com/mnews/article/052/0002218224?sid=101,"하지만 우리나라 주력 산업인 <b>반도체</b>를 비롯해 가전과 자동차, 조선 등 대부분 업종이 기준선인 100에 미치지 못해 실적이 악화할 것으로 전망됐습니다. 이와 함께 제조업체들은 설문조사에서 내수 부진과 누적된... ","Sun, 13 Jul 2025 13:08:00 +0900"
2025-07-13 05:26:41,"김대종 세종대 교수, 자중회 특강",http://www.m-i.kr/news/articleView.html?idxno=1259466,"이날 강연에서 김 교수는 신정부가 육성중인 핵심 산업으로 인공지능(AI), 바이오, <b>반도체</b>, 컨텐츠, 방위산업 등 ABCDEF 신산업을 제시, 중소기업도 미래 산업에 함께 참여하고 준비해야 생존과 성장을 이룰 수 있다고... ","Sun, 13 Jul 2025 13:06:00 +0900"
2025-07-13 05:26:41,"'뉴삼성' 어디로⋯이재용, '등기이사 복귀' 경영 전면 나서야",https://www.asiatime.co.kr/article/20250711500348,<b>반도체</b> 슈퍼사이클을 맞은 2018년 매출과 영업이익 각 243조7700억원·58조8900억원으로 역대급 실적을... 고대역폭 메모리(HBM)와 파운드리(<b>반도체</b> 위탁생산) 부진 영향이 크게 작용했다. 삼성전자의 실적 부진은... ,"Sun, 13 Jul 2025 13:02:00 +0900"
2025-07-13 05:26:41,토트넘 손흥민이 '사우디 PIF 스타디움'서 뛴다?,https://m.sports.naver.com/wfootball/article/025/0003454715,"최근 인공지능(AI) <b>반도체</b> 기업 엔비디아와 협상 중이라는 주장도 나왔지만 토트넘이 부인했다. 토트넘의 다니엘 레비 회장이 연간 2500만 파운드(465억원), 15년간 최대 3억7500만 파운드(6977억원) 규모의 명명권 계약... ","Sun, 13 Jul 2025 13:01:00 +0900"
2025-07-13 05:26:41,[기획] 집을 편집하다…소형가전이 바꾼 집의 풍경,http://www.m-i.kr/news/articleView.html?idxno=1259322,무스 미니 제습기는 <b>반도체</b> 열전소자 기술을 적용해 뜨거운 열풍 없이 쾌적한 제습이 가능하다. 작동 소음은 32dB로 낮췄고 한 달 전기요금 약 1130원으로 사용 부담을 줄였다. 크기는 A4 용지보다 작다. 무스 글라스... ,"Sun, 13 Jul 2025 13:00:00 +0900"
2025-07-13 05:26:41,'고공행진' 코스피에 공매고 잔고도 고점 뚫었다…'131% 급증',http://www.newsprime.co.kr/news/article.html?no=695993,"코스피 상장 종목 중 시총 대비 공매도 순보유 잔고 비중이 가장 큰 종목은 이차전지 및 <b>반도체</b> 소재 기업 SKC로 그 비중은 5.55%에 달한다. 한미<b>반도체</b>(4.92%), 신성이엔지(3.89%), 호텔신라(3.84%), 동방(3.48%), 두산퓨얼셀(3.44... ","Sun, 13 Jul 2025 13:00:00 +0900"
2025-07-13 05:26:41,"인천시, 美 관세 피해 수출기업에 1,500억 긴급 자금 지원",http://www.kihoilbo.co.kr/news/articleView.html?idxno=1151652,"지역 내 관세 직격탄을 맞은 <b>반도체</b>, 의약품 등 주요 수출 품목 기업뿐 아니라 관련 협력업체까지 포함해... 최근 <b>반도체</b>·의약품 등 일부 품목에 대한 추가 관세 부과 가능성이 거론되면서, 지역 수출 기반 자체가 흔들릴... ","Sun, 13 Jul 2025 12:56:00 +0900"
2025-07-13 05:26:41,[기획]하반기 경영 환경 '시계제로'…대외 리스크 확산,http://www.m-i.kr/news/articleView.html?idxno=1259377,트럼프 행정부 시절 감세 정책을 연장하는 동시에 전기차·<b>반도체</b> 산업에 대한 세제 및 보조금 체계를 전면... <b>반도체</b> 부문에선 최대 35% 세액공제 확대가 포함됐지만 미국 내 고용·투자 등 추가 요건이 붙을 가능성이... ,"Sun, 13 Jul 2025 12:56:00 +0900"
2025-07-13 05:26:41,&quot;떠나는 청년인재 막아라&quot;...구미시 산학연 협력으로 돌파구 모색,https://www.kbsm.net/news/view.php?idx=482211,"지역에 남고 싶어도 눈에 띄는 일자리가 없다는 인식 탓에 청년들이 졸업과 동시에 수도권으로 향하는 것이 당연한 선택처럼 굳어져 있다.하지만 구미에도 <b>반도체</b>, 전자, 기계·부품 등 다양한 분야에서 성장가능성과... ","Sun, 13 Jul 2025 12:52:00 +0900"
2025-07-13 05:26:41,"한양대 에리카, 'ICEAS 2025' 탄자니아 개최",http://www.m-i.kr/news/articleView.html?idxno=1259458,사진=한양대 제공 매일일보 = 윤하늘 기자  |  한양대학교 에리카(ERICA)는 이선영 차세대<b>반도체</b>융합공학부 교수가 공동 조직위원장을 맡은 국제학술대회 'ICEAS 2025'가 최근 나흘간 탄자니아 아루샤 SG 프리미엄... ,"Sun, 13 Jul 2025 12:52:00 +0900"
2025-07-13 05:26:41,"&quot;산업 대전환의 전초기지, 전북 피지컬AI가 움직인다&quot;",http://www.jeollailbo.com/news/articleView.html?idxno=772521,"전북이 AI 실증 거점으로 도약할 수 있을지, 그리고 국산 AI <b>반도체</b>와 데이터 주권, 산학연 협력 생태계가... 신성규 부사장은 리벨리온이 국내 유일 AI <b>반도체</b> 유니콘으로, NPU(Neural Processing Unit) 개발에 주력하고 있음을... ","Sun, 13 Jul 2025 12:52:00 +0900"
2025-07-13 05:26:41,"비트코인, 12만 달러 목전…가상자산 '고공행진'",http://www.metroseoul.co.kr/article/20250713500093,"가상자산 가격에 영향력이 큰 AI·<b>반도체</b> 등 주요 기술주가 강세를 나타내고, 가상자산의 제도화 법안으로 평가받는 '지니어스법'도 조만간 미 하원 표결을 앞두고 빠른 통과가 유력해서다. 비트코인이 1BTC당... ","Sun, 13 Jul 2025 12:50:00 +0900"
2025-07-13 05:26:41,"미국 와이오밍 희토류 광산 개장, 중국의 희토류 무기화 중장기 제동 본...",http://www.fntoday.co.kr/news/articleView.html?idxno=357113,"브룩 마인에서 생산되는 희토류는 네오디뮴, 프라세오디뮴, 디스프로슘, 터븀 등 고부가가치 원소와 갈륨, 스칸듐, 저마늄 등 전략 광물을 포함해, 전기차, 풍력터빈, <b>반도체</b>, 군사용 장비 등 미래산업의 성장 기반을... ","Sun, 13 Jul 2025 12:48:00 +0900"
2025-07-13 05:26:41,"한국교통대, 충주여성기업인협회와 'RISE 교류회' 개최",https://www.inews365.com/news/article.html?no=875538,"여성기업인협회 소속 기업 대표와 충주시청 관계자 등 30여명이 참석한 가운데, 충북 RISE 사업 추진 계획 설명과 바이오, 이차전지, <b>반도체</b>, 모빌리티, 승강기 등 전략산업 분야에 대한 기업 수요조사가 진행됐다. 또 'AI... ","Sun, 13 Jul 2025 12:48:00 +0900"
2025-07-13 05:26:41,"“내수 죽고, 재고 넘치고”… 제조업체 절반 이상 ‘경기 나빠질 것’",https://n.news.naver.com/mnews/article/014/0005376065?sid=101,"하지만 주력 산업인 <b>반도체</b>(97)를 비롯해 가전(94), 자동차(91), 조선(97), 일반기계(94), 정유(97), 화학(94), 철강(93) 등 대부분 업종이 기준선에 미치지 못할 것으로 전망됐다. 제조업체들은 경영활동에 영향을 주는... ","Sun, 13 Jul 2025 12:45:00 +0900"
2025-07-13 05:26:41,'RE100 산업단지' 조성 본격화...비싼 전기는?,http://www.biztribune.co.kr/news/articleView.html?idxno=336890,이 흐름을 따라가지 못하면 <b>반도체</b> 등 주력 제품 수출길이 막힐 거라는 우려가 커지고 있다. 이에... 앞서 새 정부는 RE100 산단 조성 공약과 관련해 <b>반도체</b> 클러스터인 수도권과 전남 등 지방에 RE100 산단을 복수로... ,"Sun, 13 Jul 2025 12:42:00 +0900"
2025-07-13 05:26:41,"인사청문 슈퍼위크 시작...여야, 개혁법안 대치 고조",https://n.news.naver.com/mnews/article/052/0002218218?sid=100,"앞으로 AI라든가 <b>반도체</b>, 로봇 이런 것들, 국가 미래사업과 관련해서 국가가 적극 재정을 투입하겠다고 하는 상황에서 그 선장을 기업인들로 했다는 점에서 아무래도 실력과 경험을 갖춘 분들이 장관 후보자에 됐기 때문에... ","Sun, 13 Jul 2025 12:40:00 +0900"
2025-07-13 05:26:41,"광신종건 '아산 신창1차 광신프로그레스'...미달 경력, 입지와 브랜드벽...",https://www.straightnews.co.kr/news/articleView.html?idxno=275886,"아산신창일반산업단지(예정)이 인근에 위치해 있어 자동차 및 <b>반도체</b> 클러스터를 중심으로 인력 수요가 풍부하고, 아산하이테크밸리(예정)에 상당수 기업들이 입주할 예정이라서다. 늑산농공단지 접근성도 좋다.... ","Sun, 13 Jul 2025 12:38:00 +0900"
2025-07-13 05:26:41,"경기도, 수출 위기 중소기업 900개사에 5000만 원 패키지 지원",https://n.news.naver.com/mnews/article/629/0000406848?sid=102,"경기도는 자동차, <b>반도체</b>, 의약품, 철강, 알루미늄 등 대미 수출 핵심 품목을 중심으로 무역분쟁 피해 우려 기업에 최대 5000만 원을 지원한다고 13일 밝혔다. 도는 트럼프 2기 행정부의 보호무역 강화로 수출 위기에 처한... ","Sun, 13 Jul 2025 12:33:00 +0900"
2025-07-13 05:26:41,트럼프발 무역전쟁 확산… 상호관세 이어 품목별 관세까지 융단폭격,https://www.idaegu.com/news/articleView.html?idxno=642822,"구리, <b>반도체</b>, 의약품 등에 대한 품목관세 부과도 이제 초읽기에 들어간 모습이다. 이 같은 트럼프의... 엎친 데 덮친 격으로 트럼프의 관세전쟁은 구리, 의약품, <b>반도체</b> 등 품목별 관세로도 확산하고 있다. 그는 한·일 등... ","Sun, 13 Jul 2025 12:26:00 +0900"
2025-07-13 05:26:41,"&quot;떠나는 청년인재 막아라&quot; 구미시, 산학연 협력으로 돌파구 모색",https://www.dkilbo.com/news/articleView.html?idxno=505041,"하지만 구미에도 <b>반도체</b>, 전자, 기계·부품 등 다양한 분야에서 성장가능성과 경쟁력을 갖춘 기업들이 다수 존재한다. 문제는 이들 기업의 정보가 청년들에게 제대로 전달되지 않거나 지역 기업에 대한 막연한 부정적... ","Sun, 13 Jul 2025 12:20:00 +0900"
2025-07-13 05:26:41,"대만 TSMC, 2분기 역대 최대 매출…&quot;AI <b>반도체</b> 수요 견조&quot;",http://www.econonews.co.kr/news/articleView.html?idxno=396002,세계 최대 파운드리(<b>반도체</b> 위탁생산) 업체인 대만 TSMC가 지난 2분기에도 시장 예상치를 웃도는 매출... TSMC의 2분기 역대 최고 매출은 인공지능(AI) <b>반도체</b> 중심으로 투자 열기가 지속되고 있다는 의미로 해석된다.... ,"Sun, 13 Jul 2025 12:20:00 +0900"
