DateTime,Title,Link,Description,PubDate
2025-11-05 06:54:54,"성하에너지, 태양광산업協 정회원 가입...친환경 혁신 가속",https://www.energy-news.co.kr/news/articleView.html?idxno=219482,"성하에너지는 열전<b>반도체</b>를 활용한 에너지 하베스팅(Energy Harvesting) 및 탄소 온실가스 저감 기술 분야에서... 협회는 이번 성하에너지의 정회원 가입을 통해, 열전<b>반도체</b> 기반의 에너지 하베스팅 기술과 태양광 산업... ","Wed, 05 Nov 2025 15:54:00 +0900"
2025-11-05 06:54:54,"삼성전기, 日 스미토모와 '글라스코어' 합작법인 설립",https://n.news.naver.com/mnews/article/015/0005207368?sid=101,삼성전기가 차세대 <b>반도체</b> 패키지 기판인 글라스 코어(유리기판) 시장 주도권을 잡기 위해 사업화에 속도를... 글라스 코어는 기존 유리기판 대비 열팽창률이 낮고 평탄도가 우수해 고집적·대면적 첨단 <b>반도체</b> 패키지... ,"Wed, 05 Nov 2025 15:53:00 +0900"
2025-11-05 06:54:54,"&quot;재생에너지 확대·첨단산업 발전, HVDC 기반 에너지고속도로 필수&quot;",http://www.e-platform.net/news/articleView.html?idxno=97528,&quot;호남권 대규모 해상풍력 발전단지 확대와 용인 <b>반도체</b> 클러스터에 안정적 전력을 공급하기 위해... 수도권은 <b>반도체</b> 산업으로 인해 전력수요량이 급증하고 있어 이에 대한 대응이 시급하다&quot;며 이같이 밝혔다. 발제에... ,"Wed, 05 Nov 2025 15:52:00 +0900"
2025-11-05 06:54:54,"통상·탄소·수요 복합 위기…K-철강, 고부가·현지화로 돌파구",https://daily.hankooki.com/news/articleView.html?idxno=1292168,철강산업을 <b>반도체</b>·배터리 산업과 같이 국가 전략산업으로 격상해야 한다는 목소리가 크다. 이를 위해 'K-스틸법'(철강산업 특별법)의 신속한 제정을 촉구하고 있다. 수소환원제철과 전기로 확대 등 구조 전환 비용이... ,"Wed, 05 Nov 2025 15:52:00 +0900"
2025-11-05 06:54:54,"한미, 관세협상 팩트시트 발표·MOU 서명 놓고 막판 조율…'디테일' 해소...",https://www.ajunews.com/view/20251105133322556,"관세 인하 시점과 <b>반도체</b> 관세 등 세부 쟁점이 얼마나 조율될지가 관건이다. 5일 관계 부처에 따르면 양국은... 양국은 큰 틀에서 합의했지만, <b>반도체</b>·농산물 등 세부 문안을 두고는 여전히 미묘한 입장차를 보이고 있다.... ","Wed, 05 Nov 2025 15:52:00 +0900"
2025-11-05 06:54:54,‘팩트시트 힘겨루기’…‘관세·원잠’ 두고 한미 막판 조율,https://n.news.naver.com/mnews/article/018/0006156833?sid=100,"<b>반도체</b>의 경우 팩트시트에 합의 내용이 담길 것으로 보인다. 하워드 러트닉 미 상무장관은 SNS(사회관계망서비스)를 통해 “<b>반도체</b> 관세는 협상에 포함되지 않았다”는 언급을 했으나, 김 장관은 “MOU에 명시하지 않았다는... ","Wed, 05 Nov 2025 15:51:00 +0900"
2025-11-05 06:54:54,개미가 간신히 지킨 ‘사천피’…외국인 이틀새 5조 ‘매도 폭탄’,https://n.news.naver.com/mnews/article/029/0002991732?sid=101,"코스피에서는 최근 상승을 주도했던 <b>반도체</b>와 전력기기, 조선, 방산, 지주 등을 중심으로 차익실현 압박이 강화됐다. 이경민 대신증권 연구원은 “특히 코스피는 최근 가격조정 없이 사상 최고치 랠리를 이어오면서... ","Wed, 05 Nov 2025 15:51:00 +0900"
2025-11-05 06:54:54,"“친환경 AI 메모리 입증”…SK하이닉스, HBM 등 제품 15종 ‘친환경 인...",https://www.ceoscoredaily.com/page/view/2025110515491990919,SK는 앞으로도 과학적 근거 기반 탄소 관리 체계를 고도화하며 <b>반도체</b> 산업의 지속가능한 미래를 선도해 나갈 계획이다. 이병기 SK하이닉스 제조기술담당 부사장은 “SK하이닉스는 6대 행동 규범을 바탕으로... ,"Wed, 05 Nov 2025 15:50:00 +0900"
2025-11-05 06:54:54,&quot;K-배터리 초격차 이어간다&quot;… 에너지연 '차세대 이차전지 상용화 지원...,https://www.kukinews.com/article/view/kuk202511050163,아울러 지원센터는 <b>반도체</b>산업의 파운드리처럼 배터리 파일럿 파운드리 역할을 수행한다. 이를 통해 산업계의 투자위험을 최소화하고 산업생태계 혁신을 견인토록 지원할 예정이다. 이창근 에너지연 원장은 “차세대... ,"Wed, 05 Nov 2025 15:50:00 +0900"
2025-11-05 06:54:54,"LG전자, 'AI 기업' 도약 분주…가전 비중 줄이기 속도전",https://www.straightnews.co.kr/news/articleView.html?idxno=285732,스마트팩토리 기술력 확보에 집중하는 한편 최근 미국 <b>반도체</b> 기업 인텔과도 스마트팩토리 협업을 진행할... 향후 인텔 등 <b>반도체</b> 업체에 스마트팩토리 솔루션 공급이 가시화하면 지속적인 수익 창출이 가능할... ,"Wed, 05 Nov 2025 15:50:00 +0900"
2025-11-05 06:54:54,"한미 통상협상 확정 '팩트시트' 발표 임박, 안보 분야포함 막판 '줄다리...",https://www.businesspost.co.kr/BP?command=article_view&num=418632,<b>반도체</b> 관세도 조율하고 있다. 정부는 <b>반도체</b> 관세가 대만과 비교해 불리하지 않은 수준으로 조정됐다고 밝혔지만 미국은 이번 관세협상에서 <b>반도체</b> 관세 문제는 포함되지 않았다고 밝혔다. 한국의 농축산물 시장 개방과... ,"Wed, 05 Nov 2025 15:50:00 +0900"
2025-11-05 06:54:54,'조인트 팩트시트' 공개 임박… 디테일 주목,http://www.shinailbo.co.kr/news/articleView.html?idxno=2141351,"팩트시트에는 자동차·<b>반도체</b> 등에 대한 품목별 관세는 물론 원자력 추진 잠수함(원잠), 국방비 인상 등 안보 관련 사항이 포함된다. 2차 한미정상회담 이후에도 <b>반도체</b>나 농산물 등 세부 품목 관세를 놓고 양국이... ","Wed, 05 Nov 2025 15:50:00 +0900"
2025-11-05 06:54:54,부산시 분산에너지 특화지역 지정 확정,https://n.news.naver.com/mnews/article/008/0005273970?sid=102,<b>반도체</b>·데이터센터 등 첨단산업의 경우 무정전 전력공급을 위해 개별 설비를 설치해야 하나 분산 특구 내 ESS 설치 시 2500억원 규모의 설비 투자비 절감 효과를 기대한다. ESS가 재생에너지의 과잉·과소 공급을 조정해... ,"Wed, 05 Nov 2025 15:49:00 +0900"
2025-11-05 06:54:54,코스피 지수 사이드카 발동에도 4000선 지켰다,https://m.skyedaily.com/news_view.html?ID=289933,여기에 도널드 트럼프 대통령이 엔비디아의 최첨단 AI <b>반도체</b> 수출에 부정적인 입장을 밝힌 것 또한... 반면에 실적 발표에서 엔비디아 최신 AI <b>반도체</b> 6만 개를 확정적으로 공급받는다고 밝힌 네이버는 전일... ,"Wed, 05 Nov 2025 15:48:00 +0900"
2025-11-05 06:54:54,"SKC, 적자 폭 축소…말레이 공장 가동 본격화(종합)",https://n.news.naver.com/mnews/article/018/0006156827?sid=101,"SKC가 이차전지 동박과 <b>반도체</b> 소재 사업 판매량을 늘리며 적자 폭을 줄이는 데 성공했다. 특히 새로운... <b>반도체</b> 소재사업은 매출 645억원, 영업이익 174억원을 기록했다. 테스트 소켓과 장비 사업의 합병으로 시너지가... ","Wed, 05 Nov 2025 15:48:00 +0900"
2025-11-05 06:54:54,"에코프로, 3분기 매출 9597억·영업익 1499억...4개 분기 연속 성장",http://www.sisacast.kr/news/articleView.html?idxno=85099,에코프로에이치엔은 전방 산업 중 석유화학 및 철강 분야의 업황 부진으로 매출과 이익이 줄었지만 향후 <b>반도체</b> 산업 호황으로 케미컬 필터의 판매량이 증가하고 온실가스 저감 사업에 대한 수요가 확대될 것으로... ,"Wed, 05 Nov 2025 15:48:00 +0900"
2025-11-05 06:54:54,"외인, 3거래일간 5조5천억원 매도...기관도 4천억원 매도 개인이 모두 받...",http://www.beyondpost.co.kr/view.php?ud=202511051541261202aaae0046f_30,"특히 삼성전자를 비롯한 아시아 지역의 주요 <b>반도체</b> 종목들이 일제히 급락했다. 삼성전자는 4.1%, SK하이닉스는 1.2% 떨어졌다. 그동안 주가가 많이 오른 두산에너빌리티는 6.6%, 가까이 급락하고 있고 한화오션은 7.... ","Wed, 05 Nov 2025 15:48:00 +0900"
2025-11-05 06:54:54,"성하에너지, 태양광산업협회 정회원 가입",http://www.e2news.com/news/articleView.html?idxno=324713,성하에너지는 열전<b>반도체</b>를 활용한 에너지 하베스팅 및 온실가스 저감기술로 두각을 나타내는 기업이다.... 이상곤 태양광협회 상근부회장은 &quot;성하에너지의 정회훤가입을 계기로 열전<b>반도체</b> 기반 에너지 하베스팅... ,"Wed, 05 Nov 2025 15:48:00 +0900"
2025-11-05 06:54:54,"GIST 김동혁 교수, 과학사 명저 '고독한 아이디어들' 번역 출간",http://www.namdonews.com/news/articleView.html?idxno=838196,"전구·증기기관차·<b>반도체</b>·컴퓨터 등 다양한 발명 사례를 통해 러시아 과학기술의 성공과 좌절의 역사를 짚고, 이를 통해 현대의 과학기술 정책과 연구 생태계가 나아가야 할 방향을 성찰하도록 이끈다.","Wed, 05 Nov 2025 15:48:00 +0900"
2025-11-05 06:54:54,AI <b>반도체</b>칩부터 스마트 고글까지…BIXPO 2025 언팩 신기술 살펴보니,https://www.ajunews.com/view/20251105151934744,추론형 <b>반도체</b> ‘리벨쿼드(REBEL-Quad)’를 소개했다. 지난해 전 세계 AI 서버의 에너지 사용량은 약 30TWh... 이에 리벨리온은 AI 서비스에 특화된 추론형 <b>반도체</b>를 개발했다. 이경재 부사장은 “리벨쿼드를 장착한... ,"Wed, 05 Nov 2025 15:48:00 +0900"
2025-11-05 06:54:54,"[더벨][업스테이지 국가대표AI 연합군]래블업, GPU 효율 극대화…LLM 스...",https://www.thebell.co.kr/free/content/ArticleView.asp?key=202510301706435520103426,인공지능(AI) 개발 작업이 진전될수록 그래픽처리장치(GPU) 같은 <b>반도체</b> 칩을 활용하는 비용이 큰 화두로 떠오르고 있다. 문제는 GPU 값이 매우 비싸다는 점이다. 많게는 수천대의 GPU 서버를 얼마나 효율적으로... ,"Wed, 05 Nov 2025 15:48:00 +0900"
2025-11-05 06:54:54,'AI 버블론'에 韓증시 '휘청'...&quot;단기 조정 후 강세장 재개 전망&quot;,http://www.metroseoul.co.kr/article/20251105500408,"7% 증가했으며, 특히 <b>반도체</b> 업종이 상승률 의 17%포인트를 차지했다. 이경민 대신증권 FICC리서치부장은... 컸던 <b>반도체</b> 중심의 단기 조정으로 볼 수 있다&quot;고 덧붙였다. 이런 가운데 글로벌 대형 투자자들의 '하락 대비... ","Wed, 05 Nov 2025 15:46:00 +0900"
2025-11-05 06:54:54,“개미가 지켰다” 코스피 장중 6% 급락에도 4000선 방어,https://n.news.naver.com/mnews/article/030/0003367233?sid=101,"이 여파로 국내에서는 외국인 매도세가 <b>반도체</b> 등 대형주에 집중됐다. 시가총액 상위 10종목 중 삼성바이오로직스를 제외한 전 종목이 하락했다. 삼성전자는 4.10% 하락했고, SK하이닉스는 1.19% 하락 마감했다.... ","Wed, 05 Nov 2025 15:46:00 +0900"
2025-11-05 06:54:54,"[인터뷰] 정현철 노르마 대표 “한국, 양자컴퓨터 주권 잡아야”",http://digitalchosun.dizzo.com/site/data/html_dir/2025/11/05/2025110580157.html,<b>반도체</b>의 넥스트 스텝인 양자컴퓨터 상용화를 선도하겠습니다.” 양자컴퓨팅 기업 노르마를 이끌고 있는 정현철 대표의 말이다. 그는 <b>반도체</b>가 가지고 있는 성능과 물리적 한계를 뛰어넘는 양자컴퓨터 기술 상용화를... ,"Wed, 05 Nov 2025 15:46:00 +0900"
2025-11-05 06:54:54,"어플라이드, 스타트업 지원 'ASTRA 코리아' 참가 모집",https://n.news.naver.com/mnews/article/030/0003367232?sid=105,ASTRA 코리아 2025는 △<b>반도체</b> 제조 기술 △에너지 효율 컴퓨팅 △<b>반도체</b> 관련 인공지능(AI) 및 생성형 AI 응용 분야에서 혁신을 주도하는 스타트업을 대상으로 진행한다. 아난드 카만나바르 어플라이드 벤처스... ,"Wed, 05 Nov 2025 15:46:00 +0900"
2025-11-05 06:54:54,"SK AI 서밋, 글로벌 AI 플랫폼으로 도약",http://www.newsbrite.net/news/articleView.html?idxno=194369,"이번 행사에는 최태원 SK그룹 회장을 비롯해 벤 만 앤트로픽 공동창업자, 팀 코스타 엔비디아 <b>반도체</b>엔... 특히 최태원 회장은 AI 수요에 대응하기 위한 해법으로 '효율 경쟁'을 강조하며 메모리 <b>반도체</b> 증산과 AI... ","Wed, 05 Nov 2025 15:46:00 +0900"
2025-11-05 06:54:54,"&quot;마지막까지 남을 위해 살던 아버지&quot;... 54세 김익기씨, 뇌사장기기증으...",https://www.insight.co.kr/news/527671,"김 씨는 <b>반도체</b> 업계에서 10여 년간 근무한 후 식당과 카페 등 자영업에 종사했습니다. 바쁜 일상 속에서도 새로운 것을 배우는 것을 좋아했으며, 헌혈과 봉사활동을 통해 지속적으로 사회에 기여했습니다. 김 씨의 아들... ","Wed, 05 Nov 2025 15:46:00 +0900"
2025-11-05 06:54:54,"‘안성 아양 금성백조 예미지’, 선착순 동·호지정 계약 중",https://n.news.naver.com/mnews/article/277/0005675025?sid=101,"뿐만 아니라 <b>반도체</b> 소부장 특화단지로 지정된 동신일반산업단지를 가깝게 두고 있으며, 용인 <b>반도체</b> 클러스터 일반산업단지와 첨단 시스템 <b>반도체</b> 클러스터 국가산업단지도 차량 30분대 거리로 배후 수요 유입이... ","Wed, 05 Nov 2025 15:45:00 +0900"
2025-11-05 06:54:54,"목원대 경영학부, '한반도 평화교류 정책아이디어 경진대회' 유엔한국협...",https://n.news.naver.com/mnews/article/656/0000154296?sid=102,정동진·이상준·양형주 학생은 충남대 <b>반도체</b>융합학과 학생과 한 팀을 이뤄 경영과 기술의 결합을 주제로 한 '플랫폼 KOREA HORIZON 2.0과 남북 과학 해커톤을 통한 남북청년 과학기술 협력방안'을 제안했다. 이들은 &quot;통일을... ,"Wed, 05 Nov 2025 15:45:00 +0900"
2025-11-05 06:54:54,한국 상위 10대 기업 시총 증가율 1위…TSMC 대만이 뒤이어,https://n.news.naver.com/mnews/article/088/0000979517?sid=101,"시총을 책임진 기업은 파운드리(<b>반도체</b> 위탁생산) 업계 1위 TSMC였다. TSMC는 엔비디아, AMD 등 인공지능(AI) 칩 시장을 선도하는 주요 기업들을 고객으로 두고 있다. 특히 TSMC의 올해 10월 말 기준 시총은... ","Wed, 05 Nov 2025 15:45:00 +0900"
2025-11-05 06:54:54,"비쓰비전코리아, 2025 대구국제기계산업대전서 'metriOS 332' 등 정밀 광...",https://kr.aving.net/news/articleView.html?idxno=1805720,"DAMEX 2025에는 공장자동화기기, 스마트공장, 산업용 로봇, 공작기계·설비, 공구·금형, <b>반도체</b> 장비, 제어계측·검사기기, 물류·포장기계, 용접·주조가 출품되며, <b>반도체</b> 장비·디지털전환(DX)·인공지능전환(AX)... ","Wed, 05 Nov 2025 15:44:00 +0900"
2025-11-05 06:54:54,철강업계 구조조정 가능할까…“시작부터 난항 예상”,https://www.mediapen.com/news/view/1055327,"업계에서는 <b>반도체</b>나 자동차, 제약 및 바이오 같은 경우 정부의 노력으로 관세가 줄어드는 등 수출에서 불이익을 당하지 않고 있지만, 철강 산업쪽은 정부의 노력조차 부족했다는 불만이 있다. 철강 제품은 알루미늄 등... ","Wed, 05 Nov 2025 15:44:00 +0900"
2025-11-05 06:54:54,"용인특례시의회 경제환경위원회, 정책협의회 개최",https://www.kgnews.co.kr/news/article.html?no=872672,이날 논의된 주요 안건은 ▲대상별 맞춤형 일자리 지원 ▲체계적인 소상공인 지원 시스템 구축 ▲첨단 시스템<b>반도체</b> 클러스터 국가산업단지 조성 지원 ▲용인<b>반도체</b>클러스터 일반산업단지 조성 사업 ▲지역혁신중심... ,"Wed, 05 Nov 2025 15:44:00 +0900"
2025-11-05 06:54:54,"SKC, 3분기 영업손실 528억원…손익 개선 흐름",http://www.m-i.kr/news/articleView.html?idxno=1299683,"<b>반도체</b> 소재사업은 매출 645억원, 영업이익 174억원을 기록했다. 테스트 소켓과 장비 사업의 합병으로... 영구 전환사채(EB) 발행과 <b>반도체</b> 비주력 사업 매각 등으로 현금 유입을 크게 확대하며 재무건전성 강화에... ","Wed, 05 Nov 2025 15:44:00 +0900"
2025-11-05 06:54:54,"엠아이큐브솔루션, ‘2025년 국가생산성대상’ 산업통상부 장관 표창 수...",https://www.venturesquare.net/1012402,"전기·전자, <b>반도체</b>, 제철·금속, 자동차 등 주요 산업에서 600회 이상의 스마트팩토리·자동화·산업 AI 프로젝트를 수행했으며, 정부 R&amp;D 사업에도 참여해 국가 경쟁력 강화에 기여했다. 박문원 대표는... ","Wed, 05 Nov 2025 15:44:00 +0900"
2025-11-05 06:54:54,"용인시의회 경제환경위, 2026년 주요사업 점검…“미래산업·녹색도시 ...",https://www.etoday.co.kr/news/view/2522496,이투데이=경기인천취재본부 김재학 기자 | <b>반도체</b> 산업단지 조성·소상공인 지원·도시가스 확대 등 중점... 위원들은 각 부서로부터 △대상별 맞춤형 일자리 지원 △소상공인 지원체계 구축 △첨단시스템 <b>반도체</b>... ,"Wed, 05 Nov 2025 15:44:00 +0900"
2025-11-05 06:54:54,호남권 3분기 제조업 생산 소폭 감소…건설경기 부진 지속,https://n.news.naver.com/mnews/article/001/0015726181?sid=101,"모니터링, <b>반도체</b> 생산 늘었지만 조선·자동차 부진 호남 지역의 3분기 경기가 전 분기 대비 소폭 악화한 것으로 나타났다. 5일 한국은행 광주전남·전북·목포본부가 발표한 경제 동향 모니터링 결과에 따르면 <b>반도체</b>와... ","Wed, 05 Nov 2025 15:42:00 +0900"
2025-11-05 06:54:54,"SKC, 3분기 영업손실 528억원…적자폭 11.4% 감소",https://it.chosun.com/news/articleView.html?idxno=2023092150362,"SKC가 3분기 <b>반도체</b> 소재 사업 성장에 힘입어 적자 폭을 줄이고 2년 만에 분기 매출 5000억원을 회복했다.... <b>반도체</b> 소재사업은 매출 645억원, 영업이익 174억원을 올렸다. 테스트 소켓과 장비 사업 합병 효과로 분기... ","Wed, 05 Nov 2025 15:42:00 +0900"
2025-11-05 06:54:54,"어플라이드 머티리얼즈, 스타트업 지원 프로그램 ASTRA 코리아 2025 개최",https://n.news.naver.com/mnews/article/009/0005585090?sid=101,미국 <b>반도체</b> 장비업체 어플라이드 머티어리얼즈와 어플라이드 머티어리얼즈의 벤처투자 조직인... ASTRA 코리아 2025는 ▲<b>반도체</b> 제조 기술 ▲에너지 효율 컴퓨팅 ▲<b>반도체</b> 관련 AI 및 생성형 AI 응용 분야에서 혁신을... ,"Wed, 05 Nov 2025 15:42:00 +0900"
2025-11-05 06:54:54,의대 쏠림에 산업 흔들… 인재 확보 비상,https://m.skyedaily.com/news_view.html?ID=289917,<b>반도체</b>·AI·바이오 등 전략 분야에서 글로벌 경쟁이 심화하는 만큼 인재 확보를 위한 국가 차원의 대응이... 박기범 과학기술정책연구원 선임연구위원은 국내 이공계 기반 약화를 지적하면서도 <b>반도체</b>·AI 분야는 여전히... ,"Wed, 05 Nov 2025 15:42:00 +0900"
2025-11-05 06:54:54,매물폭탄 받아낸 개인 투자자...SK하이닉스 쏠림 심화,https://n.news.naver.com/mnews/article/014/0005430132?sid=101,이경수 하나증권 연구원은 &quot;최근 한국 주식시장 상승의 핵심은 <b>반도체</b> 실적모멘텀 폭증과 배당 최대세율 하향(25%) 기대감&quot;이라면서 &quot;다만 최근 시장 상승 요인에 개인들의 국내 주식 투자 급증도 빼놓을 수 없다&quot;고... ,"Wed, 05 Nov 2025 15:41:00 +0900"
2025-11-05 06:54:54,美기술주 급락 부른 공매도...국장 대차거래잔고도 역대 최고,https://n.news.naver.com/mnews/article/008/0005273965?sid=101,"67%), 한미<b>반도체</b>(4.4%), 코스맥스(4.14%), 코스모신소재(3.94%), 덴티움(3.94%) 순으로 집계됐다. 코스닥에서는... 특히 엘앤에프, 한미<b>반도체</b>, 코스모신소재 등 최근 상승세가 강했던 <b>반도체</b>와 2차전지 업종 중심으로 투자자... ","Wed, 05 Nov 2025 15:41:00 +0900"
2025-11-05 06:54:54,"대구, 11월 11건의 국제행사 잇따라 개최... &quot;글로벌 컨벤션 도시로 도약...",https://kr.aving.net/news/articleView.html?idxno=1805721,"특히, 한국마이크로전자패키징학회가 주최하는 '마이크로전자및패키징국제심포지엄(ISMP 2025)'은 차세대 <b>반도체</b> 패키징 기술을 다루며, 산학연 협력을 통한 첨단 기술 교류의 장이 될 전망이다. 한국관광공사의... ","Wed, 05 Nov 2025 15:40:00 +0900"
2025-11-05 06:54:54,"SKC, 3Q 매출액 5060억 ...전분기比 9%↑",http://www.thevaluenews.co.kr/news/view.php?idx=193638,"<b>반도체</b> 소재사업은 매출액 645억원, 영업이익 174억원이다. 테스트 소켓과 장비 사업의 합병으로 시너지가... 영구 전환사채(EB) 발행과 <b>반도체</b> 비주력 사업 매각 등으로 현금 유입을 확대하며 재무건전성을 강화했다.... ","Wed, 05 Nov 2025 15:40:00 +0900"
2025-11-05 06:54:54,"SKC 3분기 매출 5,060억, 영업손실 528억…글라스기판 본격 상업화 추진",https://www.topstarnews.net/news/articleView.html?idxno=15864684,<b>반도체</b> 소재사업의 분기 최대 매출 달성과 이차전지 소재 성장에 힘입어 전년 동기 대비 매출이 14... <b>반도체</b> 소재사업은 분기 기준 최대인 645억 원의 매출과 174억 원의 영업이익을 거뒀다. 테스트 소켓 사업에서도... ,"Wed, 05 Nov 2025 15:40:00 +0900"
2025-11-05 06:54:54,롤러코스터 뒤 턱걸이…코스피 4004·코스닥 901,https://n.news.naver.com/mnews/article/079/0004082800?sid=101,전날 외국인이 유가증권시장에서 <b>반도체</b>주를 중심으로 차익 실현에 나서며 2조2천억원대 매도 우위를 보이면서 이날도 하방 압력을 받고 있는 것으로 보인다. 이날도 유가증권시장에서 외국인이... ,"Wed, 05 Nov 2025 15:38:00 +0900"
2025-11-05 06:54:54,"미·중·일, 물가 압력 완화…정책·성장 경로 더 갈라졌다",http://www.metroseoul.co.kr/article/20251105500388,"9월 수출은 <b>반도체</b>와 자동차가 호조세를 이어가 (8월 4.1% → 9월 8.3%) 증가세가 확대됐다. 주요국별로는 미국 수출 부진이 지속됐고, 유럽연합(EU)·아세안·대만 등은 양호했다. 수입은 철광석·농산물·의약품 등이... ","Wed, 05 Nov 2025 15:38:00 +0900"
2025-11-05 06:54:54,"'롤러코스터' 코스피, 4000선 마감...외인 2.5조 매도 폭탄",https://www.cstimes.com/news/articleView.html?idxno=676160,그는 &quot;지난달 이후 <b>반도체</b> 등 대형주 폭등에 따른 차익실현의 성격으로 이해하는 게 바람직하다&quot;고 했다. 그간 상승을 주도한 삼성전자와 SK하이닉스 등 <b>반도체</b> 대형주의 밸류에이션(실적 대비 주가 수준)이... ,"Wed, 05 Nov 2025 15:38:00 +0900"
2025-11-05 06:54:54,정책을 시스템으로 바꾼 기업이 시장을 이긴다 [이보형의 퍼블릭 어페어...,https://n.news.naver.com/mnews/article/011/0004552315?sid=110,"<b>반도체</b>특별법 논의 과정에서 이들은 세제 혜택 논란의 한가운데 있었지만 수혜를 기다리지 않았다. 정부가 <b>반도체</b>를 국가전략산업으로 규정하자, 이들은 이를 산업 생태계 전체의 과제로 재해석했다. 인재 양성과 공급망... ","Wed, 05 Nov 2025 15:38:00 +0900"
