DateTime,Title,Link,Description,PubDate
2025-03-12 04:50:06,“일본은 양자 들여 조세회피” 유산취득세 위장분할 ‘주의보’[유산...,https://n.news.naver.com/mnews/article/014/0005319963?sid=101,"<b>반도체</b>, 인공지능 등 첨단산업분야 해외 인재 채용을 위한 유인책으로 세제 혜택이 중요한 상황에서 외국인 상속세 예외조항이 필수적이라는 것이다. 심충진 건국대 교수는 “외국인 우수 기술자가 한국에서 5년을 초과해... ","Wed, 12 Mar 2025 13:49:00 +0900"
2025-03-12 04:50:06,"정부, 특별연장근로 인가제도 특례 시행",http://mbnmoney.mbn.co.kr/news/view?news_no=MM1005492423,정부가 <b>반도체</b>업계를 지원하기 위해 다음 주부터 <b>반도체</b> 연구개발(R&amp;D)에 대한 특별연장근로 인가제도 특례를 시행합니다. 고용노동부는 오늘(12일) 열린 국정현안관계장관회의에서 이 같은 내용을 포함한 '<b>반도체</b>... ,"Wed, 12 Mar 2025 13:48:00 +0900"
2025-03-12 04:50:06,"SK하이닉스, ‘가장 윤리적 기업’ 선정...국내 <b>반도체</b> 기업 중 첫 인증",https://n.news.naver.com/mnews/article/009/0005457398?sid=105,"국내 <b>반도체</b> 기업이 이 상을 받은 것은 이번이 처음이다. ‘세계에서 가장 윤리적인 기업’은 글로벌... 올해는 19개국 44개 산업 분야에서 총 136개 기업이 선정됐으며, <b>반도체</b> 업계에서는 SK하이닉스를 포함해 4개... ","Wed, 12 Mar 2025 13:48:00 +0900"
2025-03-12 04:50:06,"롯데케미칼, '삼성 갤럭시 S25' 재활용 소재 공급",https://www.cstimes.com/news/articleView.html?idxno=636622,롯데케미칼은 삼성전자 디바이스 솔루션(DS) 부문에서 <b>반도체</b> 웨이퍼 이송에 사용되는 웨이퍼 트레이 폐기물을 수거해 플라스틱 원료 중 하나인 'PC'(폴리카보네이트) 소재로 재활용한다. 해당 소재는 다시 삼성전자... ,"Wed, 12 Mar 2025 13:48:00 +0900"
2025-03-12 04:50:06,"[특징주] SK하이닉스, 레거시 수요 개선 전망에 5%대↑",https://www.etoday.co.kr/news/view/2451939,"2분기부터 레거시 디램 가격 하락은 현저히 둔화될 가능성이 크다”며 “SK하이닉스 HBM 시장 주도권은 굳건하고 여전히 주요 그래픽처리장치(GPU), 주문형 <b>반도체</b>(ASIC) 고객들의 최우선 선택지”라고 설명했다.","Wed, 12 Mar 2025 13:48:00 +0900"
2025-03-12 04:50:06,"[특징주] 그린리소스, 中 수출통제 안티모니 가격 두 배 급등 소식에 상...",https://www.etoday.co.kr/news/view/2451940,"인공지능, <b>반도체</b>, 방위 산업 등이 발전하면서 중국 내 안티모니 수요가 폭발적으로 증가하고 있는 것이... 또한 배터리 제조사의 합금 연 제조에도 사용되고, <b>반도체</b> 등 첨단 산업과 자동차 강판, 특수강, 태양 전지 등... ","Wed, 12 Mar 2025 13:48:00 +0900"
2025-03-12 04:50:06,<b>반도체</b>협회 “특별연장근로 제도개선 환영…특별법 통과도 기대”,https://n.news.naver.com/mnews/article/029/0002940675?sid=101,한국<b>반도체</b>산업협회가 12일 성명을 내고 정부의 특별연장근로 제도개선 결정을 환영한다고 밝혔다. 정부는 이날 주 64시간까지 일할 수 있는 특별연장근로를 <b>반도체</b> 연구개발 업종에 한해 기존 3개월에서 6개월 단위로... ,"Wed, 12 Mar 2025 13:47:00 +0900"
2025-03-12 04:50:06,"[오후장 선택과 집중] <b>반도체</b> 검사장비, 스마트팩토리 솔루션 업체'고영...",https://news.mtn.co.kr/news-detail/2025031213091793658,"* 오후장 집중할 종목 : 고영 - <b>반도체</b> 검사장비, 스마트팩토리 솔루션 업체- 뇌수술용 의료로봇, 美 FDA 승인 획득- 매수가 현재가 / 목표가 22,000원 / 손절가 15,200원※ 생방송 '터닝 포인트11'은 매일 오전 10시 53분에... ","Wed, 12 Mar 2025 13:46:00 +0900"
2025-03-12 04:50:06,韓 주식시장 떠나는 외국인들…7개월째 순유출,https://www.fetv.co.kr/news/article.html?no=188426,"한은은 &quot;딥시크 충격에 따른 <b>반도체</b> 업종 투자 심리 위축, 미국 관세 부과 조치 등으로 순유출이 계속되고 있다&quot;고 분석했다. 외국인 채권투자자금은 35억4000만달러(5조1804억원) 순유입을 기록했다. 주식과... ","Wed, 12 Mar 2025 13:46:00 +0900"
2025-03-12 04:50:06,"美, 철강·알루미늄에 25% 관세 부과 시작…韓 첫 영향권",https://n.news.naver.com/mnews/article/003/0013114670?sid=104,"미국은 철강, 알루미늄 관세에 이어 곧 한국의 수출 주력 품목인 자동차와 <b>반도체</b>, 의약품 등에도 관세를 부과하겠다고 예고했다. 내달 2일에는 상호 관세도 부과한다. 한국은 트럼프 행정부 1기 당시 수입산 철강에 25... ","Wed, 12 Mar 2025 13:46:00 +0900"
2025-03-12 04:50:06,"외국인, 2월 한국 주식 2.6조원 팔아…7개월째 순유출",http://www.shinailbo.co.kr/news/articleView.html?idxno=2019219,"한은 관계자는 “딥시크 충격에 따른 <b>반도체</b> 업종 투자 심리 위축, 미국의 관세부과 조치 등으로 순유출이 계속되고 있다”고 분석했다. 반면 외국인 채권투자자금은 단기 차익거래 유인 확대, 중장기 채권 투자... ","Wed, 12 Mar 2025 13:46:00 +0900"
2025-03-12 04:50:06,'2025 차세대 <b>반도체</b> 패키징 산업전(ASPS)' 8월 27일 개최,https://n.news.naver.com/mnews/article/030/0003292436?sid=105,"‘2025 차세대 <b>반도체</b> 패키징 산업전’ 참가업체 모집 경기도와 수원시가 주최하고 수원컨벤션센터, 제이엑스포, 전자신문이 공동 주관하는 <b>반도체</b> 패키징 전문 전시회 '2025 차세대 <b>반도체</b> 패키징 산업전(Advanced... ","Wed, 12 Mar 2025 13:45:00 +0900"
2025-03-12 04:50:06,"SK하이닉스, 글로벌 윤리경영 평가 통과…&quot;윤리적 책임 다할 것&quot;",https://www.ntoday.co.kr/news/articleView.html?idxno=113886,"SK하이닉스는 12일 국내 <b>반도체</b> 기업으로는 처음으로 글로벌 윤리경영 평가기관 에티스피어(Ethisphere)가... 올해는 전 세계 19개국, 44개 산업 분야에서 총 136개 기업이 선정됐으며 <b>반도체</b> 분야에서는 SK하이닉스를... ","Wed, 12 Mar 2025 13:44:00 +0900"
2025-03-12 04:50:06,"한국 정밀화학, 미·일보다 경쟁력 ‘뚝’",https://n.news.naver.com/mnews/article/028/0002735216?sid=101,"<b>반도체</b>·자동차 산업 소재와 화장품·페인트 원료 등을 만드는 국내 정밀 화학 산업 경쟁력이 미국·일본 등 주요국에 견줘 뒤떨어진다는 전문가 진단이 제기됐다. 원료의 국외 의존도 축소, 연구·개발(R&amp;D) 투자 확대 등이... ","Wed, 12 Mar 2025 13:44:00 +0900"
2025-03-12 04:50:06,"현대건설, ‘힐스테이트 용인마크밸리’ 이달 분양..<b>반도체</b>?교통망 호재...",http://kpenews.com/View.aspx?No=3571415,"이 밖에도 경강선 연장 계획과 45번 국도 8차선 확장, 수도권 내륙선 동탄·청주공항 광역 철도, <b>반도체</b>고속도로 등 주요 지역을 연결할 광역 교통망이 형성될 예정이다. 특히 남사지구 일대는 ‘<b>반도체</b> 특화도시’로... ","Wed, 12 Mar 2025 13:44:00 +0900"
2025-03-12 04:50:06,"&quot;<b>반도체</b> 수요 회복 빠르다&quot;…삼성전자 2.8%, SK하이닉스 5.11% 강세 [줍줍...",https://n.news.naver.com/mnews/article/011/0004460403?sid=101,"<b>반도체</b> 수요 회복이 당초 예상보다 빠른 속도로 이뤄질 것이라는 전망이 나오면서 삼성전자(005930)와... 두 종목이 강세를 보이면서 <b>반도체</b> 장비 종목인 리노공업(058470)(+11.11%), HPSP(403870)(10.60%), 원익QnC(074600)(+3.64... ","Wed, 12 Mar 2025 13:43:00 +0900"
2025-03-12 04:50:06,최상목 &quot;<b>반도체</b>법 여야 이견 못좁혀&quot;⋯'특별연장근로' 손질,https://n.news.naver.com/mnews/article/031/0000915382?sid=100,최상목 대통령 권한대행 부총리 겸 기획재정부 장관은 12일 &quot;<b>반도체</b> 산업의 치열한 기술 경쟁에서 앞서 나가기 위해서는 핵심 인력들이 자유롭게 연구할 수 있는 여건이 절실하다&quot;며 '<b>반도체</b> 특별법'에 근로시간 특례... ,"Wed, 12 Mar 2025 13:42:00 +0900"
2025-03-12 04:50:06,"﻿딥엑스, 獨 뉘른베르크에서 15여 곳 글로벌 기업과 협력 결과 공개",http://www.e2news.com/news/articleView.html?idxno=317857,"AI·IoT·에지 컴퓨팅 시장이 본격적으로 성장함에 따라, 두 회사는 차세대 메모리 기술과 AI <b>반도체</b>를 결합해 폭넓은 시장 니즈를 선제적으로 공략할 예정이다. 딥엑스는 사전 샘플 테스트를 통해 저전력, 고성능 및... ","Wed, 12 Mar 2025 13:40:00 +0900"
2025-03-12 04:50:06,"슈나이더 일렉트릭, AW2025서 제조 혁신 솔루션 선보인다",https://n.news.naver.com/mnews/article/030/0003292428?sid=101,"또 배터리, <b>반도체</b>, 자동차 및 디스플레이 등의 핵심 산업군에 유기적으로 적용 가능한 산업 자동화 통합 솔루션과 제조 현장의 효율성을 높여주는 차세대 고성능 HMI 신제품인 'New Advanced HMI GP6000 Series'도 전시했다.... ","Wed, 12 Mar 2025 13:40:00 +0900"
2025-03-12 04:50:06,"딥엑스, 독일 뉘른베르크에서 15여 곳 글로벌 기업과 협력 결과 공개......",https://www.nextdaily.co.kr/news/articleView.html?idxno=236038,"AI·IoT·에지 컴퓨팅 시장이 본격적으로 성장함에 따라, 두 회사는 차세대 메모리 기술과 AI <b>반도체</b>를 결합해 폭넓은 시장 니즈를 선제적으로 공략할 예정이다. 딥엑스는 사전 샘플 테스트를 통해 저전력, 고성능 및... ","Wed, 12 Mar 2025 13:40:00 +0900"
2025-03-12 04:50:06,"디와이디, 타액 기반 당뇨병 진단키트 공개…“1분 만에 당화 알부민 측...",https://n.news.naver.com/mnews/article/277/0005559527?sid=101,"현재 진단키트에 들어가는 핵심 부품인 <b>반도체</b> 웨이퍼 개발을 이미 끝마친 상태로, 제품 양산을 위한... 회사는 지난 달 바이오 <b>반도체</b> 생산기지 구축을 위해 강원특별자치도, 의료기기 제조사 엠아이지(MIJ)와 업무 협약을... ","Wed, 12 Mar 2025 13:40:00 +0900"
2025-03-12 04:50:06,"SK하이닉스, '2025년 세계에서 가장 윤리적인 기업' 선정",http://www.koit.co.kr/news/articleView.html?idxno=128940,[사진=SK하이닉스] SK하이닉스가 국내 <b>반도체</b> 기업 최초로 글로벌 윤리경영 평가기관 에티스피어가 주관하는 '2025년 세계에서 가장 윤리적인 기업'에 선정됐다고 12일 밝혔다. 세계에서 가장 윤리적인 기업은... ,"Wed, 12 Mar 2025 13:40:00 +0900"
2025-03-12 04:50:06,"수원대 대학일자리플러스센터, 거점형 프로그램 운영",http://www.enewstoday.co.kr/news/articleView.html?idxno=2248417,산업분석특강은 △금융 산업 △인공지능(IT) 산업 △항공우주/방위 산업 △바이오·제약 산업 △자동차(배터리) 산업 △미디어·엔터 산업 △<b>반도체</b> 산업 7가지 주제로 진행될 예정이다. 이어 HACCP직무교육은 HACCP개요... ,"Wed, 12 Mar 2025 13:40:00 +0900"
2025-03-12 04:50:06,"외국인, 7개월 연속 ‘셀 코리아’",https://n.news.naver.com/mnews/article/082/0001315682?sid=101,"한은은 “딥시크 충격에 따른 <b>반도체</b> 업종 투자 심리 위축, 미국의 관세부과 조치 등으로 순유출이 계속되고 있다”고 분석했다. 외국인 채권투자자금은 35억 4000만 달러(5조 1804억 원) 순유입을 기록했다. 단기... ","Wed, 12 Mar 2025 13:39:00 +0900"
2025-03-12 04:50:06,"[주가동향] 리노공업, 작년 4분기 호실적에 신규제품 주문 증가...주가 ...",https://n.news.naver.com/mnews/article/123/0002354705?sid=101,1978년 창립한 리노공업은 현재 검사용 프로브와 <b>반도체</b> 검사용 소켓을 제조 및 판매하는 사업과 초음파 진단기 등에 적용되는 의료기기 부품을 제조 및 판매하는 사업을 영위하고 있는 기업이다. <b>반도체</b> 테스트... ,"Wed, 12 Mar 2025 13:39:00 +0900"
2025-03-12 04:50:06,'이것' 없으면 배터리 못 만드는데…90%가 중국산 '어쩌나',https://news.mtn.co.kr/news-detail/2025031117214936344,배터리와 <b>반도체</b> 등 첨단산업에 쓰이는 핵심광물 공급망의 중국 의존도가 여전히 절대적인 것으로... 무수불산은 <b>반도체</b> 세척과 에칭 공정에 필수적인 재료다. 불소계 제품의 핵심 원료로 이차전지 제조나 금속 가공... ,"Wed, 12 Mar 2025 13:38:00 +0900"
2025-03-12 04:50:06,하나증권 '<b>반도체</b> 섹터 투자' ETN 2종 신규 상장 'KRX <b>반도체</b> TR 지수에 ...,https://www.nbnews.kr/news/articleView.html?idxno=106037,하나증권은 국내 <b>반도체</b> 섹터 지수를 추종하는 '하나 <b>반도체</b> ETN'와 '하나 레버리지 <b>반도체</b> ETN'를 신규 상장했다고 12일 밝혔다. [이미지 하나증권] 하나증권은 국내 <b>반도체</b> 섹터 지수를 추종하는 '하나 <b>반도체</b> ETN'와... ,"Wed, 12 Mar 2025 13:38:00 +0900"
2025-03-12 04:50:06,"&quot;고인 배움 의지 잇도록&quot; 영광YKMC, 장학금 1000만 원 호서대 기탁",https://n.news.naver.com/mnews/article/656/0000124408?sid=102,영광와이케이엠씨는 복잡형상 부품 정밀 표면처리와 대면적 복잡형상 정밀가공 기술 등을 바탕으로 <b>반도체</b>·디스플레이 장비 핵심 부품과 표면처리 분야에서 정점을 찍고 우주산업 진출을 준비하고 있다. 장관섭... ,"Wed, 12 Mar 2025 13:38:00 +0900"
2025-03-12 04:50:06,"[종합] 코스피, <b>반도체</b> 강세 힘입어 상승 폭 확대…SK하이닉스 5%↑",https://www.etoday.co.kr/news/view/2451937,이투데이=박정호 기자 | 코스피와 코스닥이 장중 상승 폭을 늘리고 있다. 12일 오후 9시 21분 기준 코스피지수는 전 거래일 대비 36.82포인트(p)(1.45%) 상승한 2574.42에 거래되고 있다. 오전과 달리 개인은... ,"Wed, 12 Mar 2025 13:38:00 +0900"
2025-03-12 04:50:06,"﻿딥엑스, 독일 뉘른베르크에서 15여 곳 글로벌 기업과 협력 결과 공개...",https://www.itbiznews.com/news/articleView.html?idxno=162511,"AI·IoT·에지 컴퓨팅 시장이 본격적으로 성장함에 따라, 두 회사는 차세대 메모리 기술과 AI <b>반도체</b>를 결합해 폭넓은 시장 니즈를 선제적으로 공략할 예정이다. 딥엑스는 사전 샘플 테스트를 통해 저전력, 고성능 및... ","Wed, 12 Mar 2025 13:38:00 +0900"
2025-03-12 04:50:06,"딥엑스, 독일 뉘른베르크에서 15여 곳 글로벌 기업과 협력 결과 공개",https://www.mhns.co.kr/news/articleView.html?idxno=711632,"AI·IoT·에지 컴퓨팅 시장이 본격적으로 성장함에 따라, 두 회사는 차세대 메모리 기술과 AI <b>반도체</b>를 결합해 폭넓은 시장 니즈를 선제적으로 공략할 예정이다. 사전 샘플 테스트를 통해 저전력, 고성능 및 양산... ","Wed, 12 Mar 2025 13:38:00 +0900"
2025-03-12 04:50:06,삼성전자 올해 주총 화두는 '위기돌파'…신사업·M&amp;A 내놓을지 주목,https://www.newsquest.co.kr/news/articleView.html?idxno=241233,차세대 <b>반도체</b> 등 영역에서 새로운 도전을 이어가겠다&quot;고 밝혔다. 삼성전자가 주총 전 이같은 내용을... HBM(고대역폭메모리) 등 최첨단 <b>반도체</b> 개발 현황에 대한 내용도 이번 주총에서 공개될지 기대를 모은다. 삼성전자는... ,"Wed, 12 Mar 2025 13:36:00 +0900"
2025-03-12 04:50:06,"롯데케미칼, '갤럭시 S25'에 재활용 소재 공급… 삼성전자와 자원 선순...",https://www.kgnews.co.kr/news/article.html?no=834764,<b>반도체</b> 웨이퍼 트레이·폐어망 재활용… &quot;환경 보호·기업 사회적 책임 동시 이행&quot; 롯데케미칼이... 롯데케미칼은 <b>반도체</b> 웨이퍼 트레이와 폐어망을 재활용해 만든 플라스틱 소재를 갤럭시 S25 부품에 공급한다.... ,"Wed, 12 Mar 2025 13:36:00 +0900"
2025-03-12 04:50:06,<b>반도체</b> 특별연장근로 특례 이르면 내주 시행…“1회 연장기한 최대 6개...,https://n.news.naver.com/mnews/article/030/0003292422?sid=101,정부가 <b>반도체</b>업계 지원을 위해 이르면 다음주부터 연구개발(R&amp;D)에 대한 특별연장근로인가제도 특례를 시행한다. <b>반도체</b> R&amp;D로 특별연장근로를 신청할 때 1회 최대 인가 기간을 현행 대비 2배로 늘릴 수 있도록 한다.... ,"Wed, 12 Mar 2025 13:35:00 +0900"
2025-03-12 04:50:06,"딥엑스, 독일 뉘른베르크에서 15여 곳 글로벌 기업과 협력 결과 공개",http://www.globalepic.co.kr/view.php?ud=2025031213315727789aeda69934_29,"AI·IoT·에지 컴퓨팅 시장이 본격적으로 성장함에 따라, 두 회사는 차세대 메모리 기술과 AI <b>반도체</b>를 결합해 폭넓은 시장 니즈를 선제적으로 공략할 예정이다. 딥엑스는 사전 샘플 테스트를 통해 저전력, 고성능 및... ","Wed, 12 Mar 2025 13:34:00 +0900"
2025-03-12 04:50:06,<b>반도체</b> 특별연장근로 확대... 경제계 &quot;<b>반도체</b> 특별법도 처리를&quot;,https://n.news.naver.com/mnews/article/119/0002932111?sid=101,정부가 12일 <b>반도체</b> 연구개발(R&amp;D) 인력에 한해 특별연장근로 기간을 현행 3개월에서 6개월로 늘리는 특례를 신설한 것과 관련해 경제계가 환영의 뜻을 밝히고 나섰다. 동시에 경제계는 &quot;<b>반도체</b> 특별법도 조속 처리해달라&quot;고... ,"Wed, 12 Mar 2025 13:34:00 +0900"
2025-03-12 04:50:06,"딥엑스, 독일 뉘른베르크에서 15여 곳 글로벌 기업과 협력 결과 공개",http://www.beyondpost.co.kr/view.php?ud=2025031213323155609aeda69934_30,"AI·IoT·에지 컴퓨팅 시장이 본격적으로 성장함에 따라, 두 회사는 차세대 메모리 기술과 AI <b>반도체</b>를 결합해 폭넓은 시장 니즈를 선제적으로 공략할 예정이다. 딥엑스는 사전 샘플 테스트를 통해 저전력, 고성능 및... ","Wed, 12 Mar 2025 13:34:00 +0900"
2025-03-12 04:50:06,"[재계는 지금] 삼성전자 QLED TV, '무(無) 카드뮴' 퀀텀닷 우수성 인증 ...",https://dealsite.co.kr/articles/138055,"◆SK하이닉스, '2025년 세계에서 가장 윤리적인 기업' 선정 SK하이닉스가 국내 <b>반도체</b> 기업 최초로 글로벌... <b>반도체</b> 분야에서는 SK하이닉스를 포함해 총 4개 기업이 선정됐다. 회사는 이번 수상의 원동력을... ","Wed, 12 Mar 2025 13:34:00 +0900"
2025-03-12 04:50:06,"딥엑스, 독일 뉘른베르크에서 15여 곳 글로벌 기업과 협력 결과 공개",http://www.thepowernews.co.kr/news/articleView.html?idxno=152116,"AI·IoT·에지 컴퓨팅 시장이 본격적으로 성장함에 따라, 두 회사는 차세대 메모리 기술과 AI <b>반도체</b>를 결합해 폭넓은 시장 니즈를 선제적으로 공략할 예정이다. 딥엑스는 사전 샘플 테스트를 통해 저전력, 고성능 및... ","Wed, 12 Mar 2025 13:34:00 +0900"
2025-03-12 04:50:06,경제계 &quot;특별연장근로 특례 환영…<b>반도체</b>특별법도 조속히 통과돼야&quot;,https://news.mtn.co.kr/news-detail/2025031213233886164,/사진=뉴시스국내 경제계가 정부의 <b>반도체</b> 분야 특별연장근로 인가 제도 보완 발표에 환영을 표했다. 아울러 국회에 계류 중인 <b>반도체</b>특별법의 조속한 통과와 근로시간 유연화의 필요성을 강조했다.최상목 대통령... ,"Wed, 12 Mar 2025 13:34:00 +0900"
2025-03-12 04:50:06,<b>반도체</b>법 대신 '특별연장근로' 기간 늘린다…최대 3→6개월로,https://n.news.naver.com/mnews/article/215/0001201542?sid=101,<b>반도체</b> 연구개발(R&amp;D) 인력에 대한 특별연장근로 기간이 3개월에서 6개월로 확대된다. <b>반도체</b> R&amp;D 인력의 주 52시간 근무 예외 조항을 담은 <b>반도체</b>특별법이 여야간 이견에 국회 통과에 난항을 겪자 정부 차원에서 행정적... ,"Wed, 12 Mar 2025 13:32:00 +0900"
2025-03-12 04:50:06,"딥엑스, 독일 뉘른베르크에서 15여 곳 글로벌 기업과 협력 결과 공개…...",https://www.epnc.co.kr/news/articleView.html?idxno=313772,"AI·IoT·에지 컴퓨팅 시장이 본격적으로 성장함에 따라, 두 회사는 차세대 메모리 기술과 AI <b>반도체</b>를 결합해 폭넓은 시장 니즈를 선제적으로 공략할 예정이다. 딥엑스는 사전 샘플 테스트를 통해 저전력, 고성능 및... ","Wed, 12 Mar 2025 13:32:00 +0900"
2025-03-12 04:50:06,"딥엑스, 독일 뉘른베르크에서 15여 곳 글로벌 기업과 협력 결과 공개",https://www.gokorea.kr/news/articleView.html?idxno=822066,"AI·IoT·에지 컴퓨팅 시장이 본격적으로 성장함에 따라, 두 회사는 차세대 메모리 기술과 AI <b>반도체</b>를 결합해 폭넓은 시장 니즈를 선제적으로 공략할 예정이다. 딥엑스는 사전 샘플 테스트를 통해 저전력, 고성능 및... ","Wed, 12 Mar 2025 13:32:00 +0900"
2025-03-12 04:50:06,"트럼프, 전 세계 상대 '관세전쟁' 시작…한국도 처음 대상에 올라",https://n.news.naver.com/mnews/article/055/0001239255?sid=104,특히 트럼프 정부는 <b>반도체</b>·자동차 등 한국의 주력 수출 상품에 대한 품목별 관세도 부과하겠다고 예고하고 있습니다. 미국 내에서 트럼프 대통령의 관세 정책은 경제 불확실성을 키우면서 증시 폭락이라는 결과를... ,"Wed, 12 Mar 2025 13:32:00 +0900"
2025-03-12 04:50:06,"SK하이닉스, 최초로 '세계에서 가장 윤리적인 기업' 선정",http://www.thelec.kr/news/articleView.html?idxno=33606,<b>반도체</b> 분야에서는 SK하이닉스를 비롯 ▲인텔(15회 선정) ▲램리서치(3회 선정) ▲마이크론(3회 선정) 총 4개 기업이 선정됐다. SK하이닉스는 &quot;수년간 회사가 자체적으로 윤리경영 목표를 수립하고 이를 체계적으로... ,"Wed, 12 Mar 2025 13:32:00 +0900"
2025-03-12 04:50:06,특별근로연장 시행령 개정에 산업계 &quot;환영...<b>반도체</b>특별법도 서둘러 논...,https://n.news.naver.com/mnews/article/469/0000853307?sid=101,정부가 <b>반도체</b> 연구개발(R&amp;D) 인력의 '주 64시간 특별 근로' 가능 기간을 현재 3개월에서 6개월로 늘리는 안을 확정한데 대해 산업계는 환영 입장을 냈다. 다만 특별근로연장 특례 신설의 도화선이 된 <b>반도체</b>특별법 개정... ,"Wed, 12 Mar 2025 13:31:00 +0900"
2025-03-12 04:50:06,"딥엑스, 독일 뉘른베르크에서 15여 곳 글로벌 기업과 협력 결과 공개…...",http://www.thebigdata.co.kr/view.php?ud=2025031213295171739aeda69934_23,"AI·IoT·에지 컴퓨팅 시장이 본격적으로 성장함에 따라, 두 회사는 차세대 메모리 기술과 AI <b>반도체</b>를 결합해 폭넓은 시장 니즈를 선제적으로 공략할 예정이다. 딥엑스는 사전 샘플 테스트를 통해 저전력, 고성능 및... ","Wed, 12 Mar 2025 13:30:00 +0900"
2025-03-12 04:50:06,"<b>반도체</b>협회 &quot;특별연장근로 개선 환영, 경쟁력 확보할 것&quot;",http://www.shinailbo.co.kr/news/articleView.html?idxno=2019182,한국<b>반도체</b>산업협회는 12일 ‘정부의 특별연장근로 제도개선 결정’ 관련해 “적극 환영한다”고 밝혔다. 협회는 이날 입장문을 통해 “<b>반도체</b>산업의 연구개발 및 생산 활동이 더욱 유연하게 이뤄질 수 있을 것으로... ,"Wed, 12 Mar 2025 13:30:00 +0900"
2025-03-12 04:50:06,SK하이닉스 '2025년 세계에서 가장 윤리적인 기업' 선정,https://www.pointdaily.co.kr/news/articleView.html?idxno=236608,<b>반도체</b> 분야에서는 SK하이닉스를 포함해 총 4개 기업이 상을 받게 됐다. SK하이닉스는 &quot;수년간 회사가 자체적으로 윤리경영 목표를 수립하고 이를 체계적으로 진단하며 실행해 온 결과를 세계에서 인정받았다&quot;며... ,"Wed, 12 Mar 2025 13:30:00 +0900"
2025-03-12 04:50:06,"SK하이닉스, '2025년 세계에서 가장 윤리적인 기업' 선정",https://www.lcnews.co.kr/news/articleView.html?idxno=96342,SK하이닉스 이천캠퍼스 정문 [사진=SK하이닉스 제공] 라이센스뉴스 = 박창배 기자 | SK하이닉스가 국내 <b>반도체</b>... <b>반도체</b> 분야에서는 SK하이닉스를 포함해 총 4개 기업이 선정됐다. SK하이닉스는 &quot;수년간 회사가 자체적으로... ,"Wed, 12 Mar 2025 13:30:00 +0900"
