DateTime,Title,Link,Description,PubDate
2025-06-19 23:48:02,"&quot;원익머트리얼즈, 올해 실적 '상저하고' 전망&quot;-DB",https://n.news.naver.com/mnews/article/015/0005147121?sid=101,이 증권사 서승연 연구원은 &quot;메모리 <b>반도체</b> 업황이 개선되고 있는 가운데 계절적 성수기인 하반기로 갈수록 <b>반도체</b> 고객사의 가동률은 상승할 것&quot;이라며 &quot;다만 전환투자 후 올 하반기 가동률이 본격 상승할 것으로... ,"Fri, 20 Jun 2025 08:47:00 +0900"
2025-06-19 23:48:02,"한울<b>반도체</b>∙한울소재과학, 고성능 AI 서버 '클라이막스-408' 소개",https://www.cstimes.com/news/articleView.html?idxno=652709,"컨슈머타임스=전은정 기자 | 한울<b>반도체</b>와 한울소재과학은 국산 고성능 인공지능(AI) 서버 '클라이막스... 한울<b>반도체</b>는 한울소재과학, 코코링크와 클라이막스-408을 통해 국방, 정보기관, 정부출연연구소, 대학교... ","Fri, 20 Jun 2025 08:46:00 +0900"
2025-06-19 23:48:02,"경북도, '2.0 대전환' 박차…새 정부 국가정책과 연계",https://n.news.naver.com/mnews/article/003/0013314763?sid=102,"2차전지, <b>반도체</b>, 방위산업, 철강)과 포스트 APEC(새마을 ODA, 문화관광), 사회연대경제(소셜벤처) 등 3대 분야 8개다. 1회는 에너지, 2회는 2차전지에 대해 논의했다. 지난 19일의 3회 세미나에서는 <b>반도체</b> 산업에 대해 안기현... ","Fri, 20 Jun 2025 08:46:00 +0900"
2025-06-19 23:48:02,"특허청, LX 세미콘과 현장소통 간담회 개최",https://www.lcnews.co.kr/news/articleView.html?idxno=103857,특허청 CI 라이센스뉴스 = 김준서 기자 | 특허청(청장 김완기)은 지난 19일 LX세미콘 양재캠퍼스에서 <b>반도체</b> 산업계의 지식재산 경쟁력 강화를 위한 현장소통 간담회를 개최했다고 밝혔다. 이번 간담회는 비메모리 <b>반도체</b>... ,"Fri, 20 Jun 2025 08:44:00 +0900"
2025-06-19 23:48:02,"이상일, 남사초 통학로 점검하고 교통안전 캠페인 동참",https://www.ekn.kr/web/view.php?key=20250620020538451,한편 용인특례시(시장 이상일)는 6월 19일 시청 4층 접견실에서 관내 6개 대학과 '용인시 <b>반도체</b> 인재 양성... 협약에 따라 시와 참여 대학들은 관학협의체를 구성하고 <b>반도체</b> 분야 인재 육성 기반을 마련하기 위해 다양한... ,"Fri, 20 Jun 2025 08:44:00 +0900"
2025-06-19 23:48:02,"삼성전자, 1c DRAM 생산 효율 40% 넘어서",http://www.g-enews.com/ko-kr/news/article/news_all/202506200823384982fbbec65dfb_1/article.html,"따내, <b>반도체</b> 위탁생산 부문의 반등에도 힘이 실리고 있다. 최근 보도에 따르면, 두 부문 모두 삼성전자의 <b>반도체</b> 경쟁력 회복과 시장 점유율 확대에 중요한 전환점으로 꼽힌다. ◇ 1c DRAM 생산 효율 40% 돌파, HBM4 대량... ","Fri, 20 Jun 2025 08:44:00 +0900"
2025-06-19 23:48:02,"한울<b>반도체</b>∙한울소재과학, 국산 고성능 AI 서버 '클라이막스-408' 소개",https://www.newspim.com/news/view/20250620000038,"한울<b>반도체</b>와 한울소재과학은 국산 고성능 인공지능(AI) 서버 '클라이막스(Klimax)-408'과 함께 AI 인프라... 한울<b>반도체</b>, 코코링크, 한울소재과학 로고. [사진=한울소재과학] 한울<b>반도체</b>는 한울소재과학, 코코링크와... ","Fri, 20 Jun 2025 08:43:00 +0900"
2025-06-19 23:48:02,대전 시민이 뽑은 민선 8기 최고 뉴스...&quot;대전 도시철도 2호선 건설 착공...,https://www.gukjenews.com/news/articleView.html?idxno=3303693,이장우 시장은 &quot;지난 3년은 우주·바이오·<b>반도체</b> 등 6대 전략산업 추진과 꿈씨 패밀리 같은 도시 정체성 강화를 통해 대전의 잠재력을 본격적으로 꽃피운 시기였다&quot;며 &quot;민선 8기 후반기에도 시민 체감도가 높은... ,"Fri, 20 Jun 2025 08:42:00 +0900"
2025-06-19 23:48:02,"엔켐 경영진, 자사주 매입 행보…&quot;하반기 성과 자신감&quot;",https://dealsite.co.kr/articles/143359,"AI 데이터센터, <b>반도체</b> 등 전력 수요가 급증하는 산업군의 확장으로 ESS 시장이 급성장하고 있는 가운데, 내년 ESS용 전해액 공급량만 약 6만톤에 이를 것으로 예측된다. 이는 올해 엔켐이 글로벌 시장에 공급을... ","Fri, 20 Jun 2025 08:42:00 +0900"
2025-06-19 23:48:02,"싸이몬, 코스닥 상장 본격화…상장예비심사 신청서 제출",https://n.news.naver.com/mnews/article/003/0013314755?sid=101,"차세대 산업용 오퍼레이팅 터치패널인 HMI는 자동화 및 <b>반도체</b> 장비 분야에 적합한 모니터링 솔루션을... 그 결과 국내 <b>반도체</b> 및 디스플레이, 완성차, 이차전지, 제약바이오 등 각종 산업에 산업자동화 솔루션을... ","Fri, 20 Jun 2025 08:41:00 +0900"
2025-06-19 23:48:02,"싸이몬, 상장예비심사신청서 제출",https://www.newspim.com/news/view/20250620000048,"차세대 산업용 오퍼레이팅 터치패널인 HMI는 자동화 및 <b>반도체</b> 장비 분야에 적합한 모니터링 솔루션을... 그 결과 국내 <b>반도체</b> 및 디스플레이, 완성차, 이차전지, 제약바이오 등 각종 산업에 산업자동화 솔루션을... ","Fri, 20 Jun 2025 08:41:00 +0900"
2025-06-19 23:48:02,"한울<b>반도체</b>∙한울소재과학, 국산 고성능 AI 서버 ‘클라이막스-408’ 소...",https://www.etoday.co.kr/news/view/2480479,"이투데이=김우람 기자 | 한울<b>반도체</b>와 한울소재과학은 국산 고성능 인공지능(AI) 서버 ‘클라이막스... 한울<b>반도체</b>는 한울소재과학, 코코링크와 클라이막스-408을 통해 국방, 정보기관, 정부출연연구소, 대학교... ","Fri, 20 Jun 2025 08:38:00 +0900"
2025-06-19 23:48:02,[기획- 'K-원전' 르네상스 시대 ① ] 중동 이어 유럽도 진출 성공...'글로...,http://www.newsian.co.kr/news/articleView.html?idxno=80327,"대만은 2025년까지 모든 원전을 폐로하기로 계획을 세웠으나 최근 블랙아웃 위험과 <b>반도체</b> 산업 육성을 위한 전력수요를 충족하기 위해, 탈원전에 대한 반대 여론이 형성되면서 고민이 깊어지고 있다. 이탈리아는... ","Fri, 20 Jun 2025 08:38:00 +0900"
2025-06-19 23:48:02,"경기도·차세대융합기술원, 학부모도 함께 배우는 '찾아오는 <b>반도체</b> 교...",https://www.lecturernews.com/news/articleView.html?idxno=180851,경기도와 차세대융합기술원이 19일과 20일 이틀간 차세대융합기술연구원에서 '찾아오는 <b>반도체</b> 교실'을 운영한다고 밝혔다. 이 사업은 도내 중학생과 학부모를 대상으로 <b>반도체</b> 산업에 대한 이해를 높이고 진로 탐색의... ,"Fri, 20 Jun 2025 08:36:00 +0900"
2025-06-19 23:48:02,"Z세대 구직자, '28만회' 조회수... 올 상반기 '화제의 기업' 1위는?",http://www.newsian.co.kr/news/articleView.html?idxno=80336,"업종별로는 <b>반도체</b>, 기계, 전자 등 전통 제조업군은 물론, 제약·바이오, 뷰티 등 신성장 산업군도 높은 비중을 차지해 눈길을 끌었다. 진학사 캐치 김정현 본부장은 &quot;Z세대 구직자는 인지도 외에도, 채용이 활발하거나... ","Fri, 20 Jun 2025 08:34:00 +0900"
2025-06-19 23:48:02,"용인시, 대학과 손잡고 <b>반도체</b> 인재 육성 본격화",https://www.asiatoday.co.kr/view.php?key=20250620010010045,지역 6개 대학과 ‘<b>반도체</b> 인재 양성’ 업무협약 체결 경기 용인특례시는 19일 시청에서 지역 6개 대학과 '용인시 <b>반도체</b> 인재 양성 관학협의체' 구성을 위한 업무협약을 체결했다고 20일 밝혔다.이날 협약식에는 이상일... ,"Fri, 20 Jun 2025 08:34:00 +0900"
2025-06-19 23:48:02,[어제장 오늘장] '고리 1호기' 해체 승인 심사 곧 마무리…관련주 강세,https://n.news.naver.com/mnews/article/374/0000446968?sid=101,"<b>반도체</b>와 통신장비주에 대한 보고서를 가져왔습니다. 대신증권, <b>반도체</b> 섹터에 대한 비중 확대 의견을 유지하며 여전히 삼성전자와 SK하이닉스를 추천했습니다. AI시대 <b>반도체</b> 산업은 가격보다도 품질이 우선시되는... ","Fri, 20 Jun 2025 08:32:00 +0900"
2025-06-19 23:48:02,"[리스트] MVP 상위 20선...LG씨엔에스, 에스앤디 등 - 20일",https://www.itooza.com/common/iview.php?no=2025062008192503217,"한미<b>반도체</b> 등이 포함됐다. 아이투자는 자체 개발한 종목평가 로직 'MVP 점수'에 따라 매일... 4% 18 한미<b>반도체</b> 92,500원 ▲5.7% 87점 70점 97점 93점 64.0 16.9 26.4% 19 피엔케이피부임상연구센타 2... ","Fri, 20 Jun 2025 08:32:00 +0900"
2025-06-19 23:48:02,"한울<b>반도체</b>·한울소재과학, 고성능 AI 서버 '클라이막스-408' 공개",https://n.news.naver.com/mnews/article/003/0013314741?sid=101,"한울<b>반도체</b>와 한울소재과학은 국산 고성능 인공지능(AI) 서버 '클라이막스(Klimax)-408'과 함께 AI 인프라... 한울<b>반도체</b>는 한울소재과학, 코코링크와 클라이막스-408을 통해 국방, 정보기관, 정부출연연구소, 대학교... ","Fri, 20 Jun 2025 08:30:00 +0900"
2025-06-19 23:48:02,"브이엠, 자사주 처분 불발…'위탁 중개업자 문제'",https://www.digitaltoday.co.kr/news/articleView.html?idxno=572058,"<b>반도체</b> 전공정 장비업체 브이엠이 계획했던 자기주식 처분이 불발됐다. 20일 금융감독원 전자공시시스템에 따르면, 브이엠은 전날 공시를 통해 보유 중인 자기주식 164만5411주를 매각하려던 계획이 이행되지 못했다고... ","Fri, 20 Jun 2025 08:30:00 +0900"
2025-06-19 23:48:02,"싸이몬, 상장예비심사신청서 제출...코스닥 상장 본격화",https://www.cstimes.com/news/articleView.html?idxno=652703,"차세대 산업용 오퍼레이팅 터치패널인 HMI는 자동화 및 <b>반도체</b> 장비 분야에 적합한 모니터링 솔루션을... 그 결과 국내 <b>반도체</b> 및 디스플레이, 완성차, 이차전지, 제약바이오 등 각종 산업에 산업자동화 솔루션을... ","Fri, 20 Jun 2025 08:28:00 +0900"
2025-06-19 23:48:02,"딥엑스, 한컴아카데미와 협업… AI <b>반도체</b> 확산 나선다",https://www.ajunews.com/view/20250620082300198,"AI <b>반도체</b> 솔루션을 통해 경쟁력을 확보하고 있다. 이번 협약을 계기로 교육 시장을 포함한 신규 채널 개척에도 나선다. 김종헌 한컴아카데미 대표는 &quot;딥엑스와의 협력을 통해 AI <b>반도체</b> 제품을 보다 널리 알리고, 산업... ","Fri, 20 Jun 2025 08:26:00 +0900"
2025-06-19 23:48:02,"싸이몬, 상장예비심사신청서 제출...코스닥 상장 본격화",https://www.pinpointnews.co.kr/news/articleView.html?idxno=353066,"차세대 산업용 오퍼레이팅 터치패널인 HMI는 자동화 및 <b>반도체</b> 장비 분야에 적합한 모니터링 솔루션을... 그 결과 국내 <b>반도체</b> 및 디스플레이, 완성차, 이차전지, 제약바이오 등 각종 산업에 산업자동화 솔루션을... ","Fri, 20 Jun 2025 08:26:00 +0900"
2025-06-19 23:48:02,"인천폴리텍大, K-직업기술교육 우수성 ‘해외전파’",https://www.joongdo.co.kr/web/view.php?key=20250620010006019,"마그누 차관보 일행은 대학의 디지털융합제어과, <b>반도체</b>공정과를 방문해 실습복을 입고 직접체험도 했다. 또한 대학의 다양한 교육과정과 실습, 졸업 후 취업 연계 등에 대한 자유로운 질의응답 시간을 가졌다.... ","Fri, 20 Jun 2025 08:26:00 +0900"
2025-06-19 23:48:02,"용인시, <b>반도체</b> 지역 인력 양성 위해 관내 6개 대학과 '맞손'",https://www.kpinews.kr/newsView/1065568204105981,대학과 <b>반도체</b> 지역 인력 양성을 위해 맞손을 잡았다. ▲ 용인시청 전경.  [용인시 제공] 20일 용인시에 따르면 지난 19일 시청 4층 접견실에서 이들 6개 대학과 '용인시 <b>반도체</b> 인재 양성 관학협의체' 구성을 위한 업무협약을... ,"Fri, 20 Jun 2025 08:26:00 +0900"
2025-06-19 23:48:02,"한울<b>반도체</b>∙한울소재과학, 국산 고성능 AI서버 ‘클라이막스-408’ 소개",https://n.news.naver.com/mnews/article/014/0005365840?sid=101,"한울<b>반도체</b>와 한울소재과학은 국산 고성능 인공지능(AI) 서버 ‘클라이막스(Klimax)-408’과 함께 AI 인프라... 한울<b>반도체</b>는 한울소재과학, 코코링크와 클라이막스-408을 통해 국방, 정보기관, 정부출연연구소, 대학교... ","Fri, 20 Jun 2025 08:23:00 +0900"
2025-06-19 23:48:02,"美, 日에 의약품·<b>반도체</b> 투자 요구...준비 안 된 카드에 관세 합의 불발",https://www.newspim.com/news/view/20250620000040,일본과 미국 간의 관세 합의가 불발된 이유 중 하나는 일본 정부가 준비하지 않았던 의약품과 <b>반도체</b> 분야에... 및 <b>반도체</b> 분야 투자를 요구했다. 이는 일본 측이 전혀 예상하지 못했던 요구였다. 더구나 의약품 분야의... ,"Fri, 20 Jun 2025 08:23:00 +0900"
2025-06-19 23:48:02,"딥엑스-한컴아카데미, 온디바이스 AI 시장 확산 맞손",http://www.segyebiz.com/newsView/20250620502569?OutUrl=naver,"딥엑스 제공 초저전력 온디바이스 AI <b>반도체</b> 기업 딥엑스는 ICT 교육 전문기관 한컴아카데미와 전략적... AI <b>반도체</b>(DX-M1, DX-H1 등) 공동 유통 및 마케팅, 기술 기반 교육 프로그램 기획, 제품 활용 세미나 및 홍보 활동 등... ","Fri, 20 Jun 2025 08:20:00 +0900"
2025-06-19 23:48:02,중소조선사 美시장 “문 열렸다”…국내 기업 10곳중 6곳 &quot;한일 경협 필...,https://n.news.naver.com/mnews/article/011/0004499282?sid=101,"기업 64% “한일 경협 필요” 유망 분야 <b>반도체</b>·AI 꼽아 - 핵심 요약: 한국경제인협회가 실시한 조사에서... 기업들은 한일이 협력하면 시너지 효과가 클 것으로 기대되는 산업으로 <b>반도체</b>(91점), AI(57점), 자동차(39점)... ","Fri, 20 Jun 2025 08:16:00 +0900"
2025-06-19 23:48:02,"신한투자증권 &quot;다원넥스뷰, 원천기술 확보로 고객사 다변화 주목&quot;",https://www.etoday.co.kr/news/view/2480466,"다원넥스뷰는 레이저를 이용해 접합 공정에 사용되는 장비를 주로 생산하며, <b>반도체</b> 테스트·패키징 공정에 요구되는 부품인 프로브카드 및 기판 제조업체에 공급한다. 남궁현 신한투자증권 선임연구원은 &quot;최근 글로벌... ","Fri, 20 Jun 2025 08:16:00 +0900"
2025-06-19 23:48:02,딥엑스·한컴아카데미 맞손…AI <b>반도체</b> 교육·유통 협력,http://www.srtimes.kr/news/articleView.html?idxno=179273,"AI <b>반도체</b>(DX-M1, DX-H1 등) 공동 유통 및 마케팅, 기술 기반 교육 프로그램 기획, 제품 활용 세미나 및 홍보 활동... 김종헌 한컴아카데미 대표는 &quot;딥엑스와의 협력을 통해 AI <b>반도체</b> 제품을 보다 널리 알리고, 산업 현장에서... ","Fri, 20 Jun 2025 08:14:00 +0900"
2025-06-19 23:48:02,"용인시, 관내 6개 대학과 <b>반도체</b> 인재 양성 위해 힘모은다",https://n.news.naver.com/mnews/article/277/0005610472?sid=102,경기도 용인시가 <b>반도체</b> 분야 인재 양성을 위해 관내 6개 대학과 힘을 모은다. 용인시는 19일 시청 접견실에서 관내 6개 대학과 '용인시 <b>반도체</b> 인재 양성 관학협의체' 구성을 위한 업무협약을 체결했다고 20일 밝혔다.... ,"Fri, 20 Jun 2025 08:13:00 +0900"
2025-06-19 23:48:02,[新정부 ETF 포트폴리오-삼성운용] 이재명 정부發 투자 핵심 동력은?…...,https://www.news2day.co.kr/article/20250619500155,전력난·기후 등 'KODEX' 신재생에너지액티브 'AI강국'공약핵심…KODEX AI<b>반도체</b> ETF 지목... &lt;편집자주&gt; 삼성자산운용은 신정부 정책의 대표 수혜주로 △KODEX 신재생에너지액티브 △KODEX AI<b>반도체</b> △KODEX... ,"Fri, 20 Jun 2025 08:10:00 +0900"
2025-06-19 23:48:02,[Who Is ?] 이석희 SK온 대표이사 사장,https://www.businesspost.co.kr/BP?command=article_view&num=399882,△메모리<b>반도체</b> 기술 고도화 이석희는 SK하이닉스 대표 시절에 SK하이닉스의 메모리<b>반도체</b> 기술을 업계 최고 수준으로 높이기 위해 노력했다. SK하이닉스는 2020년 12월 176단 낸드를 개발했다고 밝혔다. 낸드는 기본... ,"Fri, 20 Jun 2025 08:10:00 +0900"
2025-06-19 23:48:02,안성시 동신 일반산단 농업진흥지역 해제 시민 서명운동 돌입,https://www.onews.tv/news/articleView.html?idxno=248599,"©열린뉴스통신ONA  안성시(시장 김보라)는 19일 동신 일반산업단지의 <b>반도체</b> 소부장 특화단지 성공과... 인근 평택, 용인과 연계한 경기남부 K-<b>반도체</b> 메가클러스터의 중심지로서 안성의 위상을 높이고, 1만6000여명의... ","Fri, 20 Jun 2025 08:10:00 +0900"
2025-06-19 23:48:02,"&quot;삼성전자, 차세대 D램 하반기 증설한다&quot;…‘엔비디아 대항마’ 마벨테...",https://n.news.naver.com/mnews/article/011/0004499281?sid=101,삼성전자 D램 증설에 코스피 PBR 1배 돌파 [AI PRISM x D•LOG] [주요 이슈 브리핑] ■ 삼성전자 <b>반도체</b>... <b>반도체</b> 경쟁력 빠른 회복을 위한 적극적 설비투자로 관련 장비·소재 업체들의 수주 확대가 전망된다. 2. PBR 1배... ,"Fri, 20 Jun 2025 08:08:00 +0900"
2025-06-19 23:48:02,"의정부공고,&quot;국가기술자격 필기면제자 검정&quot; 실시... 11개 직종, 170명 참...",https://www.tournews21.com/news/articleView.html?idxno=106134,"이번 자격 검정에는 ▲환경기능사, ▲자동차정비기능사, ▲자동차보수도장기능사, ▲<b>반도체</b>설비보전기능사... 자동차과, <b>반도체</b>과, 화학시스템공업과)에서 전학년에 걸쳐 해당 전문교과의 이론수업과 실습수업을... ","Fri, 20 Jun 2025 08:06:00 +0900"
2025-06-19 23:48:02,대전 시민이 뽑은 민선 8기 최고 뉴스 '도시철도 2호선 착공',https://www.goodmorningcc.com/news/articleView.html?idxno=424089,이장우 대전시장은 &quot;지난 3년은 우주·바이오·<b>반도체</b> 등 6대 전략산업 추진과 꿈씨 패밀리 같은 도시 정체성 강화를 통해 대전의 잠재력을 본격적으로 꽃피운 시기였다&quot;며 &quot;민선 8기 후반기에도 시민 체감도가 높은... ,"Fri, 20 Jun 2025 08:04:00 +0900"
2025-06-19 23:48:02,"[더벨]나이스플라즈마, '미국 법인' 설립…장비 공급 잘될까",https://www.thebell.co.kr/free/content/ArticleView.asp?key=202506171649297800107280,"나이스플라즈마의 주력인 식각 기술은 <b>반도체</b> 공정 중 특히 높은 기술력을 요한다. 국내 기업 중 <b>반도체</b> 식각 장비 상용화에 성공한 기업은 세메스, 브이엠 두 곳에 불과하다. 19일 업계에 따르면 나이스플라즈마는... ","Fri, 20 Jun 2025 08:02:00 +0900"
2025-06-19 23:48:02,"[더벨][아메리카 블랙홀]'리밸런싱' SK, 미국 <b>반도체</b>·배터리 투자 고심",https://www.thebell.co.kr/free/content/ArticleView.asp?key=202506111625273800105843,"최근 들어 <b>반도체</b>와 배터리가 '캐시카우'로 거듭나면서 현지 고객과의 접점이 많아졌고 이는 생산라인... ◇현지 진출 분야 대외변수 상존, SK실트론 매각 변수 현재 미국 상무부는 '<b>반도체</b>법'에 따라 글로벌 <b>반도체</b>... ","Fri, 20 Jun 2025 08:02:00 +0900"
2025-06-19 23:48:02,올들어 제주 수출액 첫 1억 달러 돌파,https://jejumbc.com/article/in6JL7ZGRC4weBCL9M,"수출액은 1억 574만 달러로 5월 기준으로 사상 처음 1억 달러를 돌파했습니다. 제주지역 수출액은 최근 다섯 달 연속 성장세를 이어가고 있으며, <b>반도체</b>와 항공기 부품, 과일주스 등이 증가한 반면 넙치는 소폭 감소했습니다.","Fri, 20 Jun 2025 08:00:00 +0900"
2025-06-19 23:48:02,[전국 주요 신문 톱뉴스](20일 조간),https://n.news.naver.com/mnews/article/001/0015460196?sid=102,"5조… 전국민 15만~50만원 소비쿠폰 지급 ▲ 이데일리 = 전국민 지원금 10조… 총지출 700조 돌파 ▲ 이투데이 = 개인·소상공인 123만명 채무 22조6000억 구제 ▲ 전자신문 = 삼성전기, 美 마벨에 AI <b>반도체</b> 부품 공급... ","Fri, 20 Jun 2025 08:00:00 +0900"
2025-06-19 23:48:02,"충주시, 한국소재융합연구원과 첨단소재 산업 견인한다",http://www.queen.co.kr/news/articleView.html?idxno=436392,"탄성소재는 <b>반도체</b>, 이차전지, 수소, 항공우주 등 첨단산업에 폭넓게 활용되는 핵심 기초화학소재로 최근에는 순환원료 의무화 등 글로벌 환경규제에 따라 고기능성·친환경 기술개발의 수요가 급증하고 있다. 시는 이번... ","Fri, 20 Jun 2025 08:00:00 +0900"
2025-06-19 23:48:02,"[더벨][ASIC 시대 개막]삼성전자, AI 솔루션 '턴키 서비스'로 승부수",https://www.thebell.co.kr/free/content/ArticleView.asp?key=202506181409137200105973,"삼성전자는 자사의 '인공지능(AI) 솔루션 턴키 서비스'를 앞세워 AI <b>반도체</b> 고객 확보에 힘쓰고 있다. <b>반도체</b> 설계부터 생산, 패키지, 고대역폭메모리(HBM)까지 전 공정을 아우르는 턴키 공급이 가능한 유일한 칩... ","Fri, 20 Jun 2025 07:58:00 +0900"
2025-06-19 23:48:02,"[더벨][FSK L&amp;S는 지금]높아진 SK그룹 매출 의존도, 옅어진 폭스콘 색채",https://www.thebell.co.kr/free/content/ArticleView.asp?key=202506181501102560109330,미국 배터리벨트 진출이나 중국 <b>반도체</b> 물류 확대 등 새로운 성장 동력을 찾고 있긴 하지만 SK그룹 계열사와의 협업을 기반으로 한 것이어서 폭스콘과의 협업 확대로 이어질 가능성은 크지 않다. 외부 수주는... ,"Fri, 20 Jun 2025 07:58:00 +0900"
2025-06-19 23:48:02,"'美 성장 전망치 낮춘' 연준 “트럼프 관세 때문”…코스피, PBR 1배 찍자...",https://n.news.naver.com/mnews/article/011/0004499276?sid=100,<b>반도체</b>주 활황 없이 지수가 상승했고 외국인 지분율이 32%대로 10년 평균 33.2%를 하회하는 점은 긍정적으로 평가된다. 키움증권은 특히 신용거래 융자 잔액 증가 폭이 지수 상승률에 비해 높지 않다는 점에... ,"Fri, 20 Jun 2025 07:58:00 +0900"
2025-06-19 23:48:02,"[이재명 정부 에너지 정책] (4) 에너지 전환의 두 축, 지역 상생과 산업...",https://www.todayenergy.kr/news/articleView.html?idxno=284727,"<b>반도체</b>, 조선업 등 경쟁 우위 산업에서는 '초격차'를 확보하기 위한 노력이 중요하다. 제조 AI 등 산업별... 지원 <b>반도체</b>, 조선 등 경쟁 우위 산업의 초격차 확보 지원 제조 AI 등 산업별 융복합(AI-X)을 통한 경쟁력 제고 중장기... ","Fri, 20 Jun 2025 07:52:00 +0900"
2025-06-19 23:48:02,"삼성, 10나노급 6세대 D램 수율 오르자 '설비 투자' 개시 [biz-플러스]",https://n.news.naver.com/mnews/article/011/0004499272?sid=101,최근 10나노 6세대 D램 재설계라는 파격적인 결단 이후 수율을 크게 개선한 삼성전자가 ‘<b>반도체</b> 초격차’를 회복하기 위해 연구개발(R&amp;D)에 이어 생산 시설 확대도 추진해 주목된다. 19일 <b>반도체</b> 업계에 따르면... ,"Fri, 20 Jun 2025 07:51:00 +0900"
2025-06-19 23:48:02,"&quot;이공계 생애주기별 지원&quot; AI시대 인재 양성 '속도'…내년 최저임금, 차...",https://n.news.naver.com/mnews/article/011/0004499271?sid=100,"기업 56% “한일 경협 필요” 유망 분야 <b>반도체</b>·AI 꼽아 - 핵심 요약: 한국경제인협회가 매출 상위 1000대... 협력하면 시너지 효과가 클 것으로 기대되는 산업으로 <b>반도체</b> 91점, AI 57점, 자동차 39점 순으로 높은 점수를... ","Fri, 20 Jun 2025 07:50:00 +0900"
2025-06-19 23:48:02,"대전시, 민선8기 최고의뉴스 '대전 도시철도 2호선 건설 착공'",http://www.globalepic.co.kr/view.php?ud=20250620070632758547f28d89cf_29,이장우 대전시장은 “지난 3년은 우주·바이오·<b>반도체</b> 등 6대 전략산업 추진과 꿈씨 패밀리 같은 도시 정체성 강화를 통해 대전의 잠재력을 본격적으로 꽃피운 시기였다”며 “민선 8기 후반기에도 시민 체감도가... ,"Fri, 20 Jun 2025 07:38:00 +0900"
