DateTime,Title,Link,Description,PubDate
2025-10-22 18:36:33,"사이먼글로벌 보험세미나, ‘기후변화 등 복합적 리스크 대응 방안’ 모...",https://m.skyedaily.com/news_view.html?ID=288577,타카시 부장은 “대상 업종은 자동차·석유화학·<b>반도체</b> 등 공장과 호텔·상업시설·병원 등 상업시설 전반이며 조사 결과를 토대로 위험의 빈도와 규모를 평가해 보험 인수와 고객 방재 개선에 동시에 쓰이도록 한다”고... ,"Thu, 23 Oct 2025 03:26:00 +0900"
2025-10-22 18:36:33,"유럽증시, 명품 업체 실적 실망에 대체로 하락…로레알·에르메스↓",https://www.newspim.com/news/view/20251023000005,"기업 실적 시즌이 본격화하는 가운데, 프랑스 명품 대기업들의 부진한 분기 실적과 <b>반도체</b> 업종의 약세는... 네덜란드 <b>반도체</b> 장비 업체 ASML과 ST마이크로일렉트로닉스 등 유럽 주요 <b>반도체</b> 관련주가 미국 텍사스... ","Thu, 23 Oct 2025 03:11:00 +0900"
2025-10-22 18:36:33,"[실리콘 디코드] 엔비디아, 800V AI 서버 선언…차세대 전력칩 승부처 '...",https://www.g-enews.com/view.php?ud=202510221754437800fbbec65dfb_1,"전력 <b>반도체</b> 시장 전반에 거대한 파문을 일으키고 있다. 엔비디아의 차세대 AI 시스템 구상을 기술적으로 뒷받침하기 위해, 거의 모든 핵심 전력 <b>반도체</b> 기업들이 엔비디아 공급망에 합류하며 치열한 기술... ","Thu, 23 Oct 2025 03:06:00 +0900"
2025-10-22 18:36:33,"美 ‘희토류 패권’ 손놓은 사이, 中이 장악… 베선트 “25년간 방심”",https://n.news.naver.com/mnews/article/020/0003669137?sid=101,"이 광물은 전기차 모터를 비롯해 <b>반도체</b> 장비, 방산 산업 등에 활용된다. 희토류는 일반 금속 대비 높은 전도성과 자기성을 바탕으로 자동차, 방산, <b>반도체</b>, 디스플레이 등 최첨단 산업에서 두루 쓰인다. 사용하는 양은... ","Thu, 23 Oct 2025 03:04:00 +0900"
2025-10-22 18:36:33,삼성그룹株 전방위 급등…&quot;AI·바이오·조선·배터리 동반 리레이팅 본...,https://www.pointdaily.co.kr/news/articleView.html?idxno=275736,"<b>반도체</b>·바이오·중공업·서비스 등 전 계열에 매수세가 확산되며,  하반기 코스피의 중심축으로... <b>반도체</b> 업황 개선과 AI <b>반도체</b> 수요 확대가 주가를 지지했다. 삼성바이오로직스는 2.53% 오른 117만3000 원을... ","Thu, 23 Oct 2025 03:04:00 +0900"
2025-10-22 18:36:33,中 희토류 통제에 글로벌 車생산 중단 위기 “두달 막히면 전체 붕괴”,https://n.news.naver.com/mnews/article/020/0003669136?sid=101,"아울러 희토류는 각종 전자제품 및 소재에도 활용되고 특히 <b>반도체</b> 업계가 절대적으로 의존하는 첨단 장비에 반드시 필요해 연쇄 타격이 우려된다. ● 각국, 희토류 연대 모색하고 대체재 찾아 나서 각 나라 및 기업들은... ","Thu, 23 Oct 2025 03:04:00 +0900"
2025-10-22 18:36:33,"삼성전자·SK하이닉스, HBM4 실물 국내 첫 공개",https://n.news.naver.com/mnews/article/020/0003669121?sid=101,"22일 삼성전자와 SK하이닉스는 서울 강남구 코엑스에서 열린 국내 최대 규모의 <b>반도체</b> 전시회 ‘SEDEX 2025(<b>반도체</b>대전)’에서 HBM4 실물을 전시장 전면에 내세웠다. HBM4 실물이 일반에 공개된 것은 처음으로, 두... ","Thu, 23 Oct 2025 03:04:00 +0900"
2025-10-22 18:36:33,"&quot;유럽 자동차 업계, 넥스페리아 사태로 며칠 내 생산 차질 우려&quot;",https://n.news.naver.com/mnews/article/052/0002263154?sid=104,"중국 정부가 네덜란드 <b>반도체</b> 업체, 넥스페리아 칩의 수출을 제한하면서 유럽 자동차업계가 며칠 내로 발생할 생산 차질에 대비하고 있다고 블룸버그통신이 보도했습니다. 사안에 정통한 관계자들에 따르면, <b>반도체</b> 부족... ","Thu, 23 Oct 2025 02:17:00 +0900"
2025-10-22 18:36:33,"트럼프 행정부 AI·가상자산 정책보좌관, 가상자산, 3년 내 제도권 완전...",http://www.movist.com/movist3d/view.asp?type=77&id=atc000000012331,클래리티법 통과 시 규제 공백 해소… 화웨이엔 ‘구형 <b>반도체</b>’로 대응해야 도널드 트럼프 행정부의... 화웨이 점유율 빼앗으려면 中에 구형 <b>반도체</b> 수출 필요 색스 보좌관은 미·중 기술패권 경쟁에 대한 견해도... ,"Thu, 23 Oct 2025 01:52:00 +0900"
2025-10-22 18:36:33,中 수출 통제에…폭스바겐 &quot;넥스페리아 사태로 단기 생산 차질 가능&quot;,https://n.news.naver.com/mnews/article/293/0000073917?sid=101,독일 자동차업체 폭스바겐이 네덜란드 기업 넥스페리아가 생산한 <b>반도체</b>에 대한 중국의 수출 제한으로... 앞서 독일 자동차산업협회(VDA)는 최근 넥스페리아를 둘러싼 중국과 네덜란드 간의 분쟁으로 인한 <b>반도체</b> 공급... ,"Thu, 23 Oct 2025 01:41:00 +0900"
2025-10-22 18:36:33,"&quot;유럽 車업계, 수일내 넥스페리아 칩 공급 차질 우려&quot;(종합)",https://n.news.naver.com/mnews/article/001/0015695315?sid=104,"폴크스바겐, 생산 축소 검토…다른 공급업체 물색 중 황정우 기자 김계연 특파원 = 유럽 자동차 업계가 네덜란드 <b>반도체</b> 업체 넥스페리아가 중국에서 생산한 <b>반도체</b>에 대한 중국 정부의 수출 제한 조치로 인해 며칠 내로... ","Thu, 23 Oct 2025 01:28:00 +0900"
2025-10-22 18:36:33,"코트라, APEC 경제전시장 'K-비즈니스 스퀘어' 개관",https://www.cstimes.com/news/articleView.html?idxno=673346,"코트라는 첨단미래산업관에서 한국의 주요 산업인 <b>반도체</b>, 모빌리티, 조선해양을 주제로 전시를 마련했다. 대기업과 스타트업이 함께 참여해 한국의 혁신 기술을 한자리에서 소개하며 관람객은 각 산업의 최신... ","Thu, 23 Oct 2025 01:16:00 +0900"
2025-10-22 18:36:33,"인천시, 국내 최대 <b>반도체</b> 전시회 'SEDEX 2025(<b>반도체</b>대천)' 참가",https://www.cstimes.com/news/articleView.html?idxno=673387,인천시(시장 유정복)는 10월 22일부터 24일까지 서울 코엑스(COEX)에서 열리는 국내 최대 <b>반도체</b> 전문 전시회 'SEDEX 2025(<b>반도체</b>대전)'에 참가해 지역 <b>반도체</b> 기업 홍보와 투자유치를 위한 공동 홍보관을 운영한다.... ,"Thu, 23 Oct 2025 01:16:00 +0900"
2025-10-22 18:36:33,文때 한국에 강경했던 모테기 “양국 관계 중요성 커져”,https://n.news.naver.com/mnews/article/023/0003936266?sid=104,"당시 문재인 대통령과 아베 신조 총리는 과거사 문제, <b>반도체</b> 수출 규제, 노재팬(일본 제품 불매 운동) 등으로 대립했다. 당시 모테기 외무상은 위안부·강제징용 문제와 관련해 한국이 먼저 해법을 제시하라는 입장을... ","Thu, 23 Oct 2025 00:56:00 +0900"
2025-10-22 18:36:33,“편의점·학원 없지만… 이웃·아침이 생겼어요”,https://n.news.naver.com/mnews/article/023/0003936255?sid=102,"오윤정(41·사서)씨는 경기 수원에서 맞벌이하면서 초2 딸, 네 살 아들을 키우다가 남편(<b>반도체</b> 엔지니어)과 같이 휴직하고 장흥에 왔다. 매일 늦게 퇴근하다 ‘아이와 보내는 시간이 너무 적구나’라는 생각이 문득... ","Thu, 23 Oct 2025 00:55:00 +0900"
2025-10-22 18:36:33,"[고래사냥] '싸이버원, 삼성SDI, 덕산테코피아, 뉴프렉스!' 오늘 장 궁금...",https://news.mtn.co.kr/news-detail/2025102300270544492,"▶▶▶ 싹쓰리 Up&amp;Down- 국내 배터리 기업들 미국 출장 재개- 다음 주 조지아 주지사 방한 예정- SK온 CEO “ 안전한 배터리로 ESS 확대”- 삼성SDI &quot;ESS '기저 전원'… 없으면 AI<b>반도체</b>도 못 돌려“- LG엔솔 &quot;ESS, 하나의... ","Thu, 23 Oct 2025 00:42:00 +0900"
2025-10-22 18:36:33,'구글' 검증 가능 양자 우위 세계 최초 달성…슈퍼컴 대비 1만3천배 속도,https://www.topstarnews.net/news/articleView.html?idxno=15848216,"시장에서는 구글의 양자 컴퓨팅 진전이 중장기적으로 <b>반도체</b>, 바이오, 에너지 등 혁신 기술주에 긍정적인 모멘텀을 제공할 수 있을지 관심이 이어질 전망이다. [톱스타뉴스=]","Thu, 23 Oct 2025 00:40:00 +0900"
2025-10-22 18:36:33,김용범 &quot;한미협상 거의 막바지… 남은 쟁점 한두 개&quot;,https://www.newscj.com/news/articleView.html?idxno=3331020,"한미 양국은 최근 수개월간 관세 및 공급망 협력, <b>반도체</b> 투자 조건, IRA(인플레이션 감축법) 관련 세부 조항 등을 중심으로 세부 협상을 이어오고 있다. 이번 회담에서 사실상 최종 타결 여부가 판가름날 전망이다.","Thu, 23 Oct 2025 00:38:00 +0900"
2025-10-22 18:36:33,"LG전자, TI와 손잡고 SDV 핵심 기술 개발",https://n.news.naver.com/mnews/article/023/0003936210?sid=105,LG전자는 주요 <b>반도체</b> 기업들과 협력해 SDV(소프트웨어 중심 차량) 전환에 필요한 핵심 기술을 빠르게 확보하고 있다. LG전자는 미국 <b>반도체</b> 기업 텍사스 인스트루먼트(TI)와 함께 차세대 인캐빈 센싱 솔루션 ‘DIMS’를... ,"Thu, 23 Oct 2025 00:37:00 +0900"
2025-10-22 18:36:33,[사설] 미국·일본·호주 희토류 동맹에 한국도 합류해야,https://n.news.naver.com/mnews/article/025/0003477224?sid=110,<b>반도체</b>·배터리·전기차·첨단무기 등 핵심 산업 전반에 쓰이는 만큼 중국이 생산과 정제를 사실상 독점한... 2019년 한·일 관계 악화 때는 <b>반도체</b> 핵심 소재 등 ‘소·부·장’(소재·부품·장비) 수출 통제를 무기화해 한국을... ,"Thu, 23 Oct 2025 00:30:00 +0900"
2025-10-22 18:36:33,"<b>반도체</b> 장비 관련주, '봄꽃만개' 디아이·한미<b>반도체</b>·고영... '시들시들...",http://www.finomy.com/news/articleView.html?idxno=241384,"<b>반도체</b> 장비 관련주들이 전 거래일 대비 0.22% 하락으로 장을 마감했다. 22일 한국거래소에 따르면 디아이, 로보스타, 한미<b>반도체</b>, 고영은 상승했다. 디아이와 로보스타는 전 거래일 대비 각각 2700원, 1200원 오른... ","Thu, 23 Oct 2025 00:26:00 +0900"
2025-10-22 18:36:33,“불장에 내 계좌만 파랗네”… <b>반도체</b> 안 담은 개미들 소외감,https://n.news.naver.com/mnews/article/005/0001809520?sid=101,현재 시장을 주도하는 <b>반도체</b> 대형주를 보유하고 있지 않다면 상승장의 온기를 누리기 어려운 상황이다. <b>반도체</b> 주도의 코스피 추가 상승에 대한 불신과 덜 오른 종목에 투자하려는 심리가 작용한 것이라는 분석이... ,"Thu, 23 Oct 2025 00:22:00 +0900"
2025-10-22 18:36:33,"삼성그룹 시총 첫 900조 돌파…삼성전자, <b>반도체</b> 회복 기대에 85% 급등",https://www.tokenpost.kr/news/market/296718,"이 같은 기록은 <b>반도체</b> 경기 회복 기대와 글로벌 기술주의 강세 흐름 속에서 삼성전자가 시장에서 다시... 이는 최근 들어 인공지능(AI) 수요와 서버용 고사양 메모리 수요가 되살아나면서, 메모리 <b>반도체</b> 업황 회복... ","Thu, 23 Oct 2025 00:22:00 +0900"
2025-10-22 18:36:33,"지능형로봇·인공지능(AI) 관련주, '웃음' 더블유에스아이·에스투더블...",http://www.finomy.com/news/articleView.html?idxno=241383,"제조용 로봇과 로봇 기반 자동화 시스템을 주력으로 하며, 디스플레이·자동차·2차전지·<b>반도체</b> 등 핵심... 3D 측정 기술을 기반으로 납도포 검사장비, 자동 광학 검사장비(AOI), <b>반도체</b> 후공정 패키징 검사장비 등을... ","Thu, 23 Oct 2025 00:20:00 +0900"
2025-10-22 18:36:33,"[APEC 미중 정상회담 ③] 트럼프가 감춰 놓은 초강경 카드, MS 윈도우 운...",https://www.news2day.co.kr/article/20251023500001,"만약 그럴 경우, 마이크로소프트 운영체제는 엔비디아로 대표되는 AI <b>반도체</b> 칩과는 비교가 안될 정도의... <b>반도체</b>, 전기차 배터리, 군사 장비 등에 필수적인 희토류를 미국 및 동맹국에 대해 강력한 제한을 두는 방법이다.... ","Thu, 23 Oct 2025 00:20:00 +0900"
2025-10-22 18:36:33,"양자암호·양자컴퓨팅 관련주, '어깨춤 으쓱으쓱' 아이윈플러스·아이씨...",http://www.finomy.com/news/articleView.html?idxno=241382,"국내 보안 <b>반도체</b> 전문기업 아이씨티케이가 세계 최초로 PUF(Physically Unclonable Function, 물리적 복제 불가능... 아이씨티케이는 <b>반도체</b> 물리적 특성을 활용해 칩마다 고유의 보안 ID를 생성하는 VIA PUF(Variation-Intrinsic... ","Thu, 23 Oct 2025 00:16:00 +0900"
2025-10-22 18:36:33,중국이 자동운전 분야에서 앞서 나가는 이유 | ‘무리 전략’으로 자동...,http://monthly.chosun.com/client/news/viw.asp?ctcd=B&nNewsNumb=202511100032,기존 자동차가 경주마처럼 ‘잘 달리기’ 위한 기계적 성능에 집중했다면 오늘날 자동차는 SDV(Software Defined Vehicle)라는 개념 아래 고성능 <b>반도체</b> 칩과 운영체제(OS)를 탑재해 각종 소프트웨어로 제어된다. 마치 근육질... ,"Thu, 23 Oct 2025 00:16:00 +0900"
2025-10-22 18:36:33,코스피 랠리에 증권사 CEO 지분가치 급등···미래에셋 부회장 수익률...,https://www.womaneconomy.co.kr/news/articleView.html?idxno=243808,"김지영 교보증권 연구원은 &quot;<b>반도체</b> 업황 개선에 따른 IT 기업의 실적 호조, 정부의 주주환원 확대 분위기가 주식시장의 투자심리에 온기를 주고 있다&quot;며 &quot;물론 미국의 관세정책의 변화 및 APEC 정상회의 등이... ","Thu, 23 Oct 2025 00:14:00 +0900"
2025-10-22 18:36:33,"용인특례시, <b>반도체</b> 일반산단 계획 9차 변경 고시",http://www.newstown.co.kr/news/articleView.html?idxno=662842,용인 <b>반도체</b>클러스터 일반산업단지 조감도. /용인특례시 용인특례시가 처인구 원삼면 일원에서 추진 중인 용인 <b>반도체</b>클러스터 일반산업단지의 '9차 변경 산업단지계획'을 최종 승인·고시했다. 시는 22일 이번... ,"Thu, 23 Oct 2025 00:12:00 +0900"
2025-10-22 18:36:33,"의료기기 관련주, '봄날의 햇살' 로킷헬스케어·티앤알바이오팹·퀀타매...",http://www.finomy.com/news/articleView.html?idxno=241381,이번 협약을 통해 양사는 자율주행로봇(AMR) 기반 모바일 매니퓰레이션 로봇과 <b>반도체</b> 이송로봇 분야에서 기술 협력을 강화할 계획이다. 티로보틱스는 이번 제휴를 통해 유아이봇이 보유한 중국 내 <b>반도체</b> 기업... ,"Thu, 23 Oct 2025 00:10:00 +0900"
2025-10-22 18:36:33,&quot;격투에 자율 주차까지 못 하는게 없네&quot;,https://www.kyongbuk.co.kr/news/articleView.html?idxno=4054778,"미래모빌리티를 비롯해 로봇과 ABB(인공지능·빅데이터·블록체인), <b>반도체</b> 등 대구시가 중점적으로 육성 중인 신산업과 관련된 기업·기관들이 대거 참여했다. 서관에 마련된 로봇 분야 구역에서는 휴머노이드의 화려한... ","Thu, 23 Oct 2025 00:10:00 +0900"
2025-10-22 18:36:33,"[국가AI컴퓨팅센터 유치, 광주 왜 실패했나] (3) 플랜B 가동",http://www.gjdream.com/news/articleView.html?idxno=663072,"이와 함께 국가AI데이터센터의 단계적 업그레이드 및 확장, AI<b>반도체</b> 실증센터 조성, 광주 모빌리티 도시 지정 등도 요구할 계획이다. 광주시 관계자는 &quot;AI연구소만 오면 AI컴퓨팅센터에 상응한다고 봐야한다&quot;며 &quot;국가... ","Thu, 23 Oct 2025 00:10:00 +0900"
2025-10-22 18:36:33,[고재현의 과학 산책] 노벨상과 이민자,https://n.news.naver.com/mnews/article/025/0003477206?sid=110,올해 노벨화학상 수상자 오마르 야기 교수의 삶이 이를 상징한다. 정치가 과학을 지배하며 발전을 저해한 사례는 독일 나치와 스탈린 치하 구소련의 참담한 역사로 충분하다. 고재현 한림대 <b>반도체</b>·디스플레이스쿨 교수,"Thu, 23 Oct 2025 00:08:00 +0900"
2025-10-22 18:36:33,"강원도, <b>반도체</b>대전서 산업육성 정책 홍보",https://n.news.naver.com/mnews/article/654/0000147533?sid=100,"강원도가 22일부터 24일까지 서울 코엑스에서 열리는 '제27회 <b>반도체</b>대전'(SEDEX 2025)에 참가, 강원의 <b>반도체</b> 산업 육성 정책 및 투자환경 홍보에 나선다. 한국<b>반도체</b>산업협회가 주관하는 이 행사는 산업 생태계 협력... ","Thu, 23 Oct 2025 00:08:00 +0900"
2025-10-22 18:36:33,[강익현의 허허실실] 주한미군 복무 연장과 전력보강,https://m.skyedaily.com/news_view.html?ID=288454,"특히 평택은 용인 등과 함께 K-<b>반도체</b> 벨트 내에 있어 안성맞춤이다. 또한, 수만 명의 미군과 그 가족이 2~3년씩 우리 나라에 체류하면서 쌓은 인연은 한·미 관계를 돈독히 하는데 결정적으로 기여할 것이다. 여기에... ","Thu, 23 Oct 2025 00:06:00 +0900"
2025-10-22 18:36:33,"2차전지 관련주, '룰루랄라 콧노래' 코윈테크·세아메카닉스·에이아이...",http://www.finomy.com/news/articleView.html?idxno=241380,"아이티엠<b>반도체</b>, 코칩, 롯데에너지머티리얼즈, 메가터치, 솔루스첨단소재, 제이오 하지만 성일하이텍, 에이치와이티씨, 한울<b>반도체</b>, 글로벌에스엠, 삼진엘앤디, 이랜텍, 하나기술, 피엔티엠에스, 펨트론, 인텍플러스... ","Thu, 23 Oct 2025 00:06:00 +0900"
2025-10-22 18:36:33,제조업 10곳 중 7곳 &quot;영업이익 목표 미달&quot;,http://www.gjdream.com/news/articleView.html?idxno=663068,"내수는 소비 회복이 지연되고 건설경기 부진이 이어졌으며, 수출 역시 <b>반도체</b>를 제외하면 1~9월 누적 기준으로 전년 대비 1.5% 감소했다. 비용 압박도 심화되고 있다. 기업들이 꼽은 주요 애로 요인은 '원자재가 상승'(42.... ","Thu, 23 Oct 2025 00:04:00 +0900"
2025-10-22 18:36:33,[사설] 검찰 개혁이 왜 필요한지 재확인됐다,https://m.skyedaily.com/news_view.html?ID=288491,"주력인 <b>반도체</b> 사업의 영업이익은 처음으로 SK하이닉스에 추월당하며 부진을 면치 못했다. 인공지능(AI) 시대를 맞아 수요가 크게 늘고 있는 고대역폭메모리(HBM)에서는 SK하이닉스를 추격해야 하고, 파운드리(<b>반도체</b>... ","Thu, 23 Oct 2025 00:04:00 +0900"
2025-10-22 18:36:33,"전남, RE100 산업단지로 에너지 전환 선도해야",http://www.gjdream.com/news/articleView.html?idxno=663031,"신규 산단은 설계 단계부터 에너지저장장치(ESS), 가상발전소(VPP) 등 계통 안정화 수단을 반영하고, 데이터센터·<b>반도체</b> 등 전력 다소비 첨단산업 수요 특성을 고려한 맞춤형 인프라를 구축해야 한다고 강조했다.... ","Thu, 23 Oct 2025 00:04:00 +0900"
2025-10-22 18:36:33,"HBM4 실물 동시에 내놨다, 삼성·SK의 ‘<b>반도체</b> 대전’",https://n.news.naver.com/mnews/article/025/0003477197?sid=101,관람객 몰린 ‘<b>반도체</b> 대전’ 삼성전자와 SK하이닉스가 6세대 고대역폭메모리(HBM) 실물을 국내에... 삼성전자와 SK하이닉스는 22일 서울 강남구 코엑스에서 열린 제27회 <b>반도체</b> 대전(SEDEX 2025)에서 HBM4 실물을 나란히... ,"Thu, 23 Oct 2025 00:02:00 +0900"
2025-10-22 18:36:33,현대차그룹 자산 5년새 71조원 이상 늘었다,https://www.ksilbo.co.kr/news/articleView.html?idxno=1039725,SK그룹도 <b>반도체</b> 업체인 SK하이닉스의 기업가치가 급상승하며 2022년 이후 재계 2위 자리를 유지했다. SK의 자산규모는 2019년 225조5260억원에서 2024년말 362조9619억원으로 5년 새 137조4359억원(60.9%) 늘었다.... ,"Thu, 23 Oct 2025 00:02:00 +0900"
2025-10-22 18:36:33,[부산시] 팹리스 생태계 조성 업무협약 체결 외,https://ilyo.co.kr/?ac=article_view&entry_id=501713,이번 협약은 부산 <b>반도체</b> 산업의 취약점인 <b>반도체</b> 설계(팹리스) 역량을 강화해 설계-생산-인증으로 이어지는 <b>반도체</b> 전주기 생태계 완성을 목표로 마련됐다. 특히 비수도권 지자체 최초로 <b>반도체</b> 설계(팹리스) 전문... ,"Thu, 23 Oct 2025 00:02:00 +0900"
2025-10-22 18:36:33,[사설] ‘자원 무기화’ 노골화하는 中…韓은 ‘핵심 광물 자립’ 역주...,https://n.news.naver.com/mnews/article/011/0004546589?sid=110,"이 광물들은 <b>반도체</b>와 2차전지·전기차·휴대폰 등 미래 첨단산업에 들어가는 필수 자원으로 우리에게 매우... <b>반도체</b>용 실리콘은 19.2일, 디스플레이용 스트론튬은 2.7일에 그치고 있어 상황이 특히 심각하다. 미국의... ","Thu, 23 Oct 2025 00:01:00 +0900"
2025-10-22 18:36:33,한국기업 달래러 온 미국 주지사들…대미투자 위축 풀리나,https://n.news.naver.com/mnews/article/025/0003477190?sid=101,"한국 기업들은 바이든 행정부 때 시행한 <b>반도체</b>법(칩스법)·인플레이션감축법(IRA)의 보조금 혜택을 받기 위해 미국에 천문학적 금액을 투자해 공장을 지었으나, 트럼프 정부 들어 불확실성이 커졌다. 재계 관계자는... ","Thu, 23 Oct 2025 00:01:00 +0900"
2025-10-22 18:36:33,"전세계에 알릴 한국 AI 역량, SK가 선봉장",https://n.news.naver.com/mnews/article/025/0003477193?sid=101,SK그룹의 경우 SK하이닉스·SK텔레콤·SK엔무브 등 <b>반도체</b>부터 에너지·서비스까지 AI 역량을 한 자리에 모은 ‘AI 데이터센터 솔루션’을 소개할 예정이다. 행사를 주관한 SK그룹은 AI 경쟁력 강화에 집중해 왔다. 특히... ,"Thu, 23 Oct 2025 00:01:00 +0900"
2025-10-22 18:36:33,"6세대 이후 HBM, 엔비디아의 심상찮은 움직임 [아침을 열며]",https://n.news.naver.com/mnews/article/469/0000893379?sid=110,"AI <b>반도체</b> 기술, 특히 제조 면에서 글로벌 선두에 있다는 것은 유리한 기회를 제공한다. 한국은 하이닉스, 삼성전자 등 메모리 메이커들이 현재 AI <b>반도체</b>에 필수적인 메모리인 LPDDR, GDDR, 그리고 HBM 글로벌 시장에서... ","Thu, 23 Oct 2025 00:00:00 +0900"
2025-10-22 18:36:33,[속보] 테슬라 머스크 &quot;비트코인 대규모 지갑 이동 ... 뉴욕증시 암호화...,https://www.g-enews.com/view.php?ud=202510212018555467906806b77b_1,장 마감 후에는 테슬라와 함께 AI 분야에서 성과를 내는 동시에 양자컴퓨팅에서도 두각을 드러내고 있는 IBM과 <b>반도체</b> 장비회사인 램 리서치 등이 실적을 내놓는다. 미국 공화당 소속 신시아 루미스 상원의원이 소액... ,"Thu, 23 Oct 2025 00:00:00 +0900"
2025-10-22 18:36:33,"&quot;AI컴퓨팅센터 공모, 국가 인프라에 대한 정부 통제력 포기한 셈&quot;",https://www.jnilbo.com/news/articleView.html?idxno=90000010124,의원단은 △AI데이터센터 업그레이드 및 확장 △국가 AI연구소 설립 △AI<b>반도체</b> 실증센터 구축 △광주 모빌리티 도시 지정 등 '광주형 AI 중심도시 완성'을 위한 4대 과제를 제시했다. 광주시와 지역 각계는 전날... ,"Wed, 22 Oct 2025 23:59:00 +0900"
2025-10-22 18:36:33,"원익QnC, 美자회사 642억원 증자...&quot;<b>반도체</b> 세정·코팅 사업 확장&quot;",http://www.thelec.kr/news/articleView.html?idxno=42572,미국 <b>반도체</b> 세정·코팅 사업 확장이 목적이다. 디포지션 소재지는 미국 텍사스주 오스틴이다. 원익QnC의... 내 <b>반도체</b>용 소재·장비부품 세정·코팅 사업 확장을 목표로 투자계획을 수립하고 유상증자를 결정했다... ,"Wed, 22 Oct 2025 23:58:00 +0900"
2025-10-22 18:36:33,"[증권소식] 불법공매도, 주문액 전체 기본과징금 적용/금융위, '회계처...",https://www.asiatime.co.kr/article/20251022500447,"인공지능(AI) <b>반도체</b> 핵심 대형주와 더불어 정책 수혜가 기대되는 방산, 원전, 인프라 관련 종목에 대한 집중적인 투자 등 공격적인 수익 추구 경향이 복합적으로 작용한 결과로 풀이된다. 유정화 삼성증권 SNI... ","Wed, 22 Oct 2025 23:58:00 +0900"
