DateTime,Title,Link,Description,PubDate
2026-07-02 17:17:19,기름값·농산물에 칩플레이션까지… 물가 두 달 연속 3%대,https://n.news.naver.com/mnews/article/005/0001858703?sid=101,<b>반도체</b> 가격 상승에 따른 이른바 ‘칩플레이션’ 조짐도 나타나고 있다. 국가데이터처가 2일 발표한 ‘6월... <b>반도체</b> 가격 상승과 신제품 출시가 맞물린 영향이다. 민경신 재정경제부 물가정책과장은 “<b>반도체</b> 가격... ,"Fri, 03 Jul 2026 02:16:00 +0900"
2026-07-02 17:17:19,서울 집값 숨고르기 속 경기남부 <b>반도체</b>벨트는 ‘후끈’,https://n.news.naver.com/mnews/article/005/0001858701?sid=101,이달 예고된 세제개편안을 앞두고 서울 집값 상승세가 무뎌진 와중에 경기도 남부 ‘<b>반도체</b>벨트’ 안에서 열기가 번져나가는 흐름이 나타났다. 최근 발표된 부동산 규제가 어떻게 영향을 미칠지 주목된다. 2일... ,"Fri, 03 Jul 2026 02:08:00 +0900"
2026-07-02 17:17:19,"&quot;앤트로픽, 삼성전자와 맞춤형 AI 칩 제조 협력 논의&quot;",https://news.einfomax.co.kr/news/articleView.html?idxno=4423166,최근 AI 기업들은 서비스 수요가 급증하면서 <b>반도체</b> 공급원을 다변화하려는 움직임을 보이고 있다. 아울러 AI 기업들이 자사의 모델 구동이 핵심적인 하드웨어를 최적화해 효율성을 높이는 것을 목표로 맞춤형 칩... ,"Fri, 03 Jul 2026 02:06:00 +0900"
2026-07-02 17:17:19,이알라의 가슴에 새겨진 필리핀…기업은 왜 테니스 선수에 투자하는가,http://www.tennispeople.kr/news/articleView.html?idxno=18892,"<b>반도체</b>와 자동차, 조선, IT 등 첨단 산업을 보유한 한국은 세계적인 경제 강국이고, 군사력과 과학기술 경쟁력 역시 필리핀을 크게 앞선다. 하지만 테니스에서는 다른 풍경이 펼쳐진다. 경제 규모가 훨씬 작은 필리핀은... ","Fri, 03 Jul 2026 02:02:00 +0900"
2026-07-02 17:17:19,"유럽증시, 예상보다 부진한 미국 고용지표 소화하며 일제히 상승… 독일...",https://www.newspim.com/news/view/20260703000011,"프랑스 <b>반도체</b> 소재 기업 소이테크(Soitec)는 4.2% 하락했고, 독일 <b>반도체</b> 장비 제조업체 아이스트론(Aixtron)은 약 10% 급락했다. 아시아 증시와 전날 미국 증시에서 인공지능(AI) 관련 종목이 급락한 영향으로 유럽 AI... ","Fri, 03 Jul 2026 02:00:00 +0900"
2026-07-02 17:17:19,국가주도 산업정책 시대가 돌아왔나[MT시평/최준영],https://n.news.naver.com/mnews/article/008/0005380910?sid=110,"호남에 제2의 <b>반도체</b> 생산거점을 짓겠다는 896조원 규모의 투자는 우리가 당연하게 여기던 시대가 끝나고... 미국이 <b>반도체</b>법과 IRA로 맞불을 놓으면서 다시 등장했다. 과거와 달라진 점이라면, 국가가 기업에 자본을 직접... ","Fri, 03 Jul 2026 02:00:00 +0900"
2026-07-02 17:17:19,"[미국 특징주] 루시드, 신임 CFO 선임…2분기 인도량도 예상치 밑돌아",https://www.newspim.com/news/view/20260703000006,"경쟁이 심화되면서 수익성 압박에 직면해 있다. 에어 럭셔리 세단과 그래비티 SUV로 알려진 루시드는 공급업체 납품 차질과 알루미늄, <b>반도체</b> 등 원자재 부족으로 인해 생산 확대에 어려움을 겪어왔다.","Fri, 03 Jul 2026 01:34:00 +0900"
2026-07-02 17:17:19,"OECD, 한국 경제성장률 2.6% 유지... <b>반도체</b> 수출 강세 주목",https://www.tokenpost.kr/news/economy/374646,"6%로 유지하면서, 대내외 충격에도 한국 경제가 소비와 재정, <b>반도체</b> 수출을 바탕으로 회복 흐름을... OECD는 계엄 사태로 위축됐던 소비 심리가 확장 재정과 소비쿠폰 지급 등의 영향으로 되살아났고, <b>반도체</b> 초호황에... ","Fri, 03 Jul 2026 01:24:00 +0900"
2026-07-02 17:17:19,[사설] 호남 <b>반도체</b> 계기로 진영 아닌 국익 우선 정책 추진해야,https://n.news.naver.com/mnews/article/005/0001858693?sid=110,정부가 호남 <b>반도체</b> 클러스터의 연구개발(R&amp;D) 인력 등을 대상으로 주 52시간 근로제를 완화하는 방안을... 주 52시간 근로제 완화는 재계의 숙원이었지만 올 1월 <b>반도체</b> 특별법 입법 과정에서 정부 여당이 노동계 반발을... ,"Fri, 03 Jul 2026 01:21:00 +0900"
2026-07-02 17:17:19,[안성 민선 9기 연속기획①] 기록을 넘어 성과로…민선 9기 김보라 시장...,http://www.newstown.co.kr/news/articleView.html?idxno=708055,"인근 지역은 <b>반도체</b> 산업과 첨단산업 유치, 광역 교통망 확충, 대규모 도시개발 사업을 통해 빠르게 변화하고 있다. 안성이 이러한 흐름 속에서 경쟁력을 유지하려면 산업 전략과 도시 발전 방향을 보다 구체화할 필요가... ","Fri, 03 Jul 2026 01:04:00 +0900"
2026-07-02 17:17:19,클로징,https://n.news.naver.com/mnews/article/055/0001369285?sid=102,초호황에 올라탄 <b>반도체</b>가 이번 실적을 견인했습니다. 하지만 여기에 만족할 수는 없습니다. <b>반도체</b> 초격차를 유지하기 위한 투자와 지원을 이어가되 수출 기반을 다변화해야 합니다. 더 많은 기업이 수출 호황을 누려야... ,"Fri, 03 Jul 2026 01:03:00 +0900"
2026-07-02 17:17:19,"[사설] AI 메가프로젝트, 건설산업 새 성장축 만들 기회다",https://www.dnews.co.kr/uhtml/view.jsp?idxno=202607030043234940797,"<b>반도체</b>와 피지컬 AI, 데이터센터를 국가 신성장동력으로 육성해 1%대 잠재성장률의 늪에서 벗어나겠다는 전략이 깔려 있다. 이는 침체에 빠진 건설산업에 새로운 기회가 될 수 있다. <b>반도체</b> 클러스터와 데이터센터를... ","Fri, 03 Jul 2026 01:00:00 +0900"
2026-07-02 17:17:19,"성수석 이천시장, 제1호 공약 결재…<b>반도체</b> 연구단지 조성 추진 본격 착...",http://www.newstown.co.kr/news/articleView.html?idxno=708047,성수석 이천시장이 민선 9기 제1호 공약인 '15만 평 <b>반도체</b> 연구단지 조성사업' 추진계획을 결재한 뒤 집무실에서 기념촬영을 하고 있다. 이천시는 <b>반도체</b> 연구·실증·창업·인력양성 기능이 결합된 미래형 <b>반도체</b> 혁신 거점... ,"Fri, 03 Jul 2026 01:00:00 +0900"
2026-07-02 17:17:19,“‘빚투 개미’ 3조원 강제청산”…폭등장 뒤 숨은 ‘함정’,https://n.news.naver.com/mnews/article/081/0003657971?sid=101,삼성전자와 SK하이닉스 등 <b>반도체</b> 대형주를 중심으로 자금 쏠림이 심화한 데다 단일 종목 레버리지 상장지수펀드(ETF) 거래가 늘면서 증시 변동성이 확대돼 ‘빚투’ 투자자들의 강제 청산이 급증했다는 분석이다.... ,"Fri, 03 Jul 2026 00:58:00 +0900"
2026-07-02 17:17:19,"<b>반도체</b> 투톱 휘청, 코스피 7700 무너져",https://n.news.naver.com/mnews/article/023/0003985495?sid=101,"삼성전자 -9%, SK하이닉스 -14% 2일 코스피가 미국발(發) <b>반도체</b> 찬바람에 7% 넘게 폭락하며 8000선을 지나... 특히 이날 <b>반도체</b> ‘투 톱’인 삼성전자, SK하이닉스가 각각 9.06%, 14.57% 폭락했다. 이날 코스피 하락세는 앞서... ","Fri, 03 Jul 2026 00:58:00 +0900"
2026-07-02 17:17:19,충남 &quot;202조 투자로 AI·<b>반도체</b> 초격차 생태계 구축&quot;,https://www.webeconomy.co.kr/news/articleView.html?idxno=2220563,"충남이 충청권 392조원 규모의 첨단산업 투자와 연계해 AI·<b>반도체</b> 중심의 미래 산업 생태계 구축에 속도를... 등이 <b>반도체</b>와 디스플레이, 이차전지, 바이오 분야 투자를 추진한다. 삼성전자는 천안·아산에 56조원을... ","Fri, 03 Jul 2026 00:56:00 +0900"
2026-07-02 17:17:19,"오픈AI 5% 지분안, AI 국부펀드 논쟁으로 확산",https://www.g-enews.com/view.php?ud=2026070300472530699a1f309431_1,미국 <b>반도체</b> 산업 지원에 힘을 실었다. 전략 산업에 대해 보조금이나 규제만이 아니라 지분 참여를 통해 정부가 직접 이해관계를 갖는 방식이 부각된 셈이다. AI는 <b>반도체</b> 못지않게 미국의 전략 산업으로 떠올랐다. 기술... ,"Fri, 03 Jul 2026 00:56:00 +0900"
2026-07-02 17:17:19,"이성훈 청와대 국토교통비서관, LH 신임 사장 임명",https://n.news.naver.com/mnews/article/366/0001176392?sid=100,"연초 직무대행을 맡아온 부사장까지 사임하면서 LH는 ‘대대행’ 체제로 운영됐다. 이로 인해 주택 공급 확대 방안, <b>반도체</b> 부지 조성 공사 등에 차질을 빚고 있다는 지적이 나왔었다.","Fri, 03 Jul 2026 00:54:00 +0900"
2026-07-02 17:17:19,"李대통령 “이재용 결단, 故 이병철 회장의 도쿄 선언 떠올라”",https://n.news.naver.com/mnews/article/023/0003985485?sid=100,"도쿄에서 <b>반도체</b> 산업 진출을 선언하셨던 역사적 순간이 떠올랐다”며 “그날의 선견지명이 대한민국을 <b>반도체</b> 강국으로 만들었듯이, 오늘 이 회장님의 결단이 대한민국 첨단 산업의 새로운 도약을 선도할 것이라... ","Fri, 03 Jul 2026 00:53:00 +0900"
2026-07-02 17:17:19,2030 지지율 추락… 이제서야 청년 바라보는 민주당,https://n.news.naver.com/mnews/article/023/0003985483?sid=100,"<b>반도체</b> 특수로 인한 법인세 추가 세수 등을 청년층을 위한 예산으로 활용할 방법을 찾아보라는 지시로 해석됐다. 이 대통령은 “청와대와 정부는 관련 정책과 법령 정비, 예산 배정을 국정의 최우선 순위에 올려놓고... ","Fri, 03 Jul 2026 00:52:00 +0900"
2026-07-02 17:17:19,“강원에 AI 데이터센터 세울 것… GS·SK가 수십조씩 투자”,https://n.news.naver.com/mnews/article/023/0003985482?sid=102,우상호 신임 강원도지사 “최근 ‘호남 <b>반도체</b> 투자’ 얘기가 주목받고 있지만 강원도도 조용히 대기업... 조기에 착공할 수 있게 도울 것이다.” -전임 지사가 추진한 <b>반도체</b> 공장 유치는 어떻게 되나. “삼성 측과... ,"Fri, 03 Jul 2026 00:51:00 +0900"
2026-07-02 17:17:19,"“<b>반도체</b> 포기 안 해, 다이소보다 싼 값에 부지 제공”",https://n.news.naver.com/mnews/article/023/0003985481?sid=102,인터뷰에서 “<b>반도체</b> 투자 유치를 포기하지 않았다”고 말했다. 김 시장은 지난 25일 청와대가 삼성전자·SK하이닉스의 호남 투자 계획을 발표하자 긴급 기자회견을 열고 “<b>반도체</b> 제조 공장을 구미에 달라. 평당... ,"Fri, 03 Jul 2026 00:51:00 +0900"
2026-07-02 17:17:19,“규제 풀고 AI기업 키워… 지방소멸 위기 벗어나겠다”,https://n.news.naver.com/mnews/article/023/0003985480?sid=102,수도권과 경기 용인 <b>반도체</b> 단지 등에 전력을 공급하기 위한 송전선로다. 홍성 군민들은 결사 반대한다. 자연이 훼손되고 주민들의 재산권 침해가 우려된다. 주민 건강 문제도 걱정이다.”,"Fri, 03 Jul 2026 00:51:00 +0900"
2026-07-02 17:17:19,"<b>반도체</b>, 하반기에도 수출 92% 증가 전망",https://n.news.naver.com/mnews/article/005/0001858681?sid=101,"인공지능(AI) 수요 확대, 친환경차 수요 증가 등에 힘입어 올 하반기 국내 산업 중 <b>반도체</b>·디스플레이... <b>반도체</b>는 유일하게 ‘맑음’으로 분류됐다. 글로벌 빅테크의 AI 투자와 온디바이스 AI 확산으로 수요가 급증하고... ","Fri, 03 Jul 2026 00:42:00 +0900"
2026-07-02 17:17:19,"“앤트로픽, 삼성전자와 자제 칩 생산 논의”",https://n.news.naver.com/mnews/article/366/0001176391?sid=105,앤트로픽이 자체 AI <b>반도체</b> 칩 생산을 위한 잠재적 파트너로 삼성전자와 논의를 진행하고 있다고 2일(현지... AI 기업들은 최근 서비스 수요 급증에 따라 <b>반도체</b> 공급원을 다변화에 나서고 있다. 이와 동시에 자체 칩... ,"Fri, 03 Jul 2026 00:40:00 +0900"
2026-07-02 17:17:19,"[사설] 삼성 이어 SK도 상생협약, 협력사도 체질강화 뒷받침해야",https://www.dnews.co.kr/uhtml/view.jsp?idxno=202607030038514310796,삼성전자와 마찬가지로 SK하이닉스 중심의 <b>반도체</b> 생태계 구축 방안도 돋보인다. 현대자동차 LG그룹 등 다른... 조선 자동차 건설 <b>반도체</b> 등 복잡다기한 산업일수록 더욱 그렇다. 소재 부품 장비 등 협력사의 피와 땀... ,"Fri, 03 Jul 2026 00:40:00 +0900"
2026-07-02 17:17:19,화장품 등 소비재株 ‘부활의 노래’,https://n.news.naver.com/mnews/article/023/0003985443?sid=101,"<b>반도체</b> 대안주로 떠올라 <b>반도체</b> 주가가 흔들리자, 그늘에 가려 있던 소비재주(株)가 고개를 들고 있다. 미국 메타발(發) 충격으로 2일 삼성전자·SK하이닉스 등 <b>반도체</b>주가 일제히 하락한 가운데, 국내 화장품주는... ","Fri, 03 Jul 2026 00:36:00 +0900"
2026-07-02 17:17:19,“이재용 결단 보며 이병철 도쿄 선언 그 순간 떠올랐다”,https://n.news.naver.com/mnews/article/025/0003535070?sid=100,3대 메가프로젝트는 수도권이 아닌 지역에 <b>반도체</b>·피지컬 인공지능(AI)·AI 데이터센터 투자를 하는 내용인데... ☞이병철 2·8 도쿄 선언=1983년 2월 8일 이병철 당시 삼성 회장이 일본 도쿄에서 메모리 <b>반도체</b> 진출을 공식... ,"Fri, 03 Jul 2026 00:35:00 +0900"
2026-07-02 17:17:19,"&quot;<b>반도체</b>, 더 필요할까?&quot; 의문에 '삼전닉스' 폭락",https://n.news.naver.com/mnews/article/055/0001369278?sid=101,또다시 <b>반도체</b> 고점론이 불거지며 삼성전자와 SK하이닉스를 비롯한 <b>반도체</b>주가 폭락했습니다. 보도에 민경호 기자입니다. &lt;기자&gt; 연일 신고가를 찍는 <b>반도체</b> 기업들을 보며 꺼림칙했던 것은 &quot;정말 지금 기대하는 것만큼... ,"Fri, 03 Jul 2026 00:34:00 +0900"
2026-07-02 17:17:19,OECD “韓 고령화 대응 중기 재정 건전화 추진해야”,https://n.news.naver.com/mnews/article/023/0003985432?sid=101,OECD는 “올해 초 <b>반도체</b> 등 수출 호조 등으로 회복세 보이던 중 중동 전쟁이 발발했지만 신속한 위기 대응 조치로 부정적 영향 축소가 기대된다”고 밝혔다. 올해 경제성장률과 물가상승률은 각각 2.6%로 전망했다.... ,"Fri, 03 Jul 2026 00:33:00 +0900"
2026-07-02 17:17:19,“사이버 위협 국경 없어… 대응은 나라마다 달라요”,https://n.news.naver.com/mnews/article/023/0003985433?sid=105,"<b>반도체</b>·제조업 글로벌 거점인 탓에 해커와 랜섬웨어 조직의 최우선 표적이 되고 있다. 서 대표는 “올해 상반기 기준, 아시아에서 랜섬웨어 공격을 가장 많이 받은 국가가 대만”이라며 “정부 기관과 글로벌 테크 기업... ","Fri, 03 Jul 2026 00:33:00 +0900"
2026-07-02 17:17:19,해외 우수인재 유치 ‘K-테크패스’ 문턱 낮춘다,https://n.news.naver.com/mnews/article/020/0003731199?sid=101,테크패스는 <b>반도체</b> 등 첨단산업 분야 해외 우수 인재에게 국내 최우수 인재 거주비자(F-2-T)와 세제·주거 지원 등을 제공하는 프로그램이다. 대상자로 선정되면 거주비자를 온라인으로 2주 안에 발급받을 수 있다. 최대... ,"Fri, 03 Jul 2026 00:32:00 +0900"
2026-07-02 17:17:19,"SK, 이달 실트론 매각 여부 결론… AI <b>반도체</b> 호황속 막판 고심",https://n.news.naver.com/mnews/article/020/0003731191?sid=101,"인공지능(AI) <b>반도체</b> 랠리에 따른 웨이퍼 공급 부족 우려가 커진 데다, 앞서 매각한 <b>반도체</b> 관련 기업들의 기업가치 상승 등이 맞물리면서 SK 내부에서는 신중론이 확산하고 있다. 반면 거래를 깰 경우 자본시장에서... ","Fri, 03 Jul 2026 00:31:00 +0900"
2026-07-02 17:17:19,"[단독]기업 대출도 양극화… 대기업 10년만에 최고, 中企 3년째 줄어",https://n.news.naver.com/mnews/article/020/0003731185?sid=101,"<b>반도체</b> 등 수출 대기업의 성장세와 달리 내수 중심의 중소기업과 자영업자는 경영난으로 은행의 대출... 최근 들어서는 미래산업이나 혁신 기업에 자금을 지원하는 ‘생산적 금융’ 기조 강화로 <b>반도체</b>, 인공지능(AI)... ","Fri, 03 Jul 2026 00:31:00 +0900"
2026-07-02 17:17:19,"HD현대일렉 1.1조-효성重 3100억원, 전력기기 수주 잭팟",https://n.news.naver.com/mnews/article/020/0003731183?sid=101,"이번에 준공된 LS일렉트릭 DC팩토리는 <b>반도체</b> 변압기(SST), <b>반도체</b> 차단기(SSCB), ESS 등 LS일렉트릭의 직류 전용 핵심 기기가 대거 적용된 세계 최초 직류 배전 제조 시설이다. 직류 배전 기술은 AI 데이터센터 수요가... ","Fri, 03 Jul 2026 00:31:00 +0900"
2026-07-02 17:17:19,"삼성전기, 유리기판 소재 ‘글라스 코어’ 합작법인 설립",https://n.news.naver.com/mnews/article/020/0003731184?sid=101,유리기판은 기존 플라스틱 기판보다 표면이 평탄하고 열에 의한 변형이 적어 인공지능(AI) 서버와 고성능컴퓨팅(HPC)용 <b>반도체</b> 패키지에 적합한 차세대 기판으로 꼽힌다.,"Fri, 03 Jul 2026 00:31:00 +0900"
2026-07-02 17:17:19,SK “협력사와 상생” 8700억 기술-금융 지원 나서,https://n.news.naver.com/mnews/article/020/0003731197?sid=101,"SK그룹이 협력사에 대한 대금 지급 시기를 앞당기고 <b>반도체</b> 생태계의 경쟁력 강화를 위해 8700억 원 규모의 기술·금융 지원에 나선다. 1차 협력사뿐 아니라 2·3차 협력사까지 대금 지급 조건을 개선하고, <b>반도체</b> 소재... ","Fri, 03 Jul 2026 00:31:00 +0900"
2026-07-02 17:17:19,"김태년 “하반기 메가특구특별법 제정, 인허가 규제완화 준비해야”",https://n.news.naver.com/mnews/article/025/0003535066?sid=100,"칩스3법·<b>반도체</b>특별법·산업안전보건법 개정이 그 일환”이라고 말했다. 이어 “하반기에는... 메가특구특별법은 총 4755조원 규모 투자 계획이 공개된 ‘3대 메가프로젝트’(<b>반도체</b>, 피지컬 AI, AI 데이터센터) 대상 지역에... ","Fri, 03 Jul 2026 00:24:00 +0900"
2026-07-02 17:17:19,민선9기 첫 단추 끼운 경기 시장들…1호 결재·행보에 시정 철학 담았다,https://www.kpinews.kr/newsView/1065623675676271,"떠오른 <b>반도체</b> 산업 육성과 재개발·재건축 현장 방문이 첫 결재와 행보였다. 반면, 무난한 당선이 예상됐던... [용인시 제공] 용인 이상일 &quot;<b>반도체</b> 초격차 확보&quot;…첫 결재부터 <b>반도체</b> 산업 육성 드라이브 이상일 용인시장은... ","Fri, 03 Jul 2026 00:24:00 +0900"
2026-07-02 17:17:19,[양준영 칼럼] <b>반도체</b> 낙관론에 묻히면 안 된다,https://n.news.naver.com/mnews/article/015/0005305820?sid=110,대한민국 경제의 주요 이슈가 <b>반도체</b>라는 거대한 블랙홀로 빨려 들어가는 모습이다. 신기록 행진을 이어가던... 국민 관심사도 온통 <b>반도체</b>다. 증시 향방은 ‘삼전닉스’ 주가 움직임에 저당 잡힌 지 오래다. 엔비디아... ,"Fri, 03 Jul 2026 00:24:00 +0900"
2026-07-02 17:17:19,[사설] 호남 <b>반도체</b> 서두르면서 왜 원전 증설은 멈칫거리나,https://n.news.naver.com/mnews/article/025/0003535065?sid=110,김성환 기후에너지환경부 장관이 호남 <b>반도체</b> 클러스터 건설과 관련해 업계가 요구하고 있는 원전 증설에... 그러면서 김 장관은 호남 <b>반도체</b> 단지가 현재 계획된 팹 4기 수준이 아니라 용인 클러스터급으로 규모가 커질... ,"Fri, 03 Jul 2026 00:24:00 +0900"
2026-07-02 17:17:19,김성환 “호남 <b>반도체</b> 팹 늘면 신규 원전 건설도 고민해봐야”,https://n.news.naver.com/mnews/article/025/0003535064?sid=101,김성환(사진) 기후에너지환경부 장관이 2일 서남권 <b>반도체</b> 클러스터와 관련해 향후 <b>반도체</b> 팹(공장)이 추가로 들어설 경우 신규 원자력발전소 건설을 검토할 수 있다고 밝혔다. 김 장관은 이날 SBS 라디오에 출연해... ,"Fri, 03 Jul 2026 00:23:00 +0900"
2026-07-02 17:17:19,"[사설] 호남 <b>반도체</b> 시동 건 정권, 원전·댐 적대 정책 결별할 각오 섰나",https://n.news.naver.com/mnews/article/023/0003985428?sid=110,호남 <b>반도체</b> 클러스터 조성과 관련해 “향후(전력) 수요가 더 늘어난다면 신규 원전도 검토해야 한다”고 밝혔다. ‘탈원전’을 외치던 주무 부처 장관의 입에서 ‘신규 원전 검토’가 언급된 것은 AI·<b>반도체</b> 시대에... ,"Fri, 03 Jul 2026 00:21:00 +0900"
2026-07-02 17:17:19,[취재수첩] 글로벌 방산 메이저 러브콜 받는 韓 중기,https://n.news.naver.com/mnews/article/015/0005305817?sid=110,"자동차·조선·<b>반도체</b> 산업에서 축적한 생산 역량은 전차, 자주포, 미사일, 함정 등 군수 물자를 빠르게... K방산이 ‘제2 <b>반도체</b>산업’으로 성장하려면 대기업만 앞서나가선 안 된다. 중소·중견 협력사가 함께 공급망에... ","Fri, 03 Jul 2026 00:20:00 +0900"
2026-07-02 17:17:19,"메타발 <b>반도체</b> 공급과잉 공포…하이닉스, 17년 만에 최대폭 하락",https://n.news.naver.com/mnews/article/025/0003535059?sid=101,"도달했으며, <b>반도체</b> 수요가 정점을 찍고 내려오는 ‘피크아웃’의 신호탄으로 해석했다. 1일(현지시간) 뉴욕 증시에서 마이크론(-10.57%)·샌디스크(-10.62%)·AMD(-6.89%)·인텔(-9.03%) 등 주요 <b>반도체</b> 주가 일제히... ","Fri, 03 Jul 2026 00:18:00 +0900"
2026-07-02 17:17:19,"[조윤제 칼럼] <b>반도체</b> 호황, 미래의 자산으로 바꾸자",https://n.news.naver.com/mnews/article/025/0003535058?sid=110,이러한 기류들이 함께 뭉쳐지면서 <b>반도체</b> 수요가 폭증하고 가격이 급등하여 한국과 대만 <b>반도체</b> 기업들은 전례 없는 초호황을 누리고 있다. 구조적 정체를 겪고 있던 한국경제에 예상치 못했던 단비다. 그러나 이것이... ,"Fri, 03 Jul 2026 00:18:00 +0900"
2026-07-02 17:17:19,"[사설] 성장 막고, 시장 왜곡하는 세제부터 바꾸라는 OECD 권고",https://n.news.naver.com/mnews/article/015/0005305813?sid=110,인공지능(AI)과 <b>반도체</b> 메가 프로젝트를 말하면서 기업 성장과 자산 이동을 막는 낡은 세제를 그대로 둘 수는 없다. 정부도 ‘증세냐 감세냐’의 낡은 논쟁에서 벗어나 새로운 정책 로드맵을 제시해야 할 때다.,"Fri, 03 Jul 2026 00:17:00 +0900"
2026-07-02 17:17:19,민형배 특별시장 &quot;<b>반도체</b> 성공 열쇠는 전력&quot;,http://www.hansbiz.co.kr/news/articleView.html?idxno=847994,찾아 <b>반도체</b> 클러스터 조성을 위한 안정적 전력 공급과 전력망 구축 방안을 점검했다. 민 시장은 2일 한국전력공사 본사에서 김재군 전력계통부사장 등 관계자들과 업무공유회를 열고 <b>반도체</b> 산업 전력 공급 대책과 송... ,"Fri, 03 Jul 2026 00:16:00 +0900"
2026-07-02 17:17:19,[박수련의 시시각각] 광주가 ‘<b>반도체</b> 정치’를 넘는 길,https://n.news.naver.com/mnews/article/025/0003535056?sid=110,800조원 규모의 ‘호남 <b>반도체</b>’ 소식에 그는 기뻐서 밤잠을 설쳤다며 “이제 우리 지역 청년들이 고향을... 광주가 <b>반도체</b> 투자 세례를 맞았다. 들뜬 지역 분위기와 달리 광주 밖에선 반론이 거세다. ‘왜 꼭 거기여야... ,"Fri, 03 Jul 2026 00:16:00 +0900"
2026-07-02 17:17:19,"삼성전기, 3191억 투자로 유리기판 시장 선도…글라스 코어 확보 박차",https://www.tokenpost.kr/news/tech/374624,"인공지능 서버와 고성능컴퓨팅용 <b>반도체</b> 시장이 빠르게 커지는 가운데, 차세대 패키지 기판의 주도권을... 첨단 <b>반도체</b> 패키지에 유리한 것으로 평가된다. 특히 인공지능 연산에 쓰이는 고성능 <b>반도체</b>는 발열과 데이터... ","Fri, 03 Jul 2026 00:14:00 +0900"
