DateTime,Title,Link,Description,PubDate
2025-07-24 20:52:25,연일 최고치 경신하는 S&amp;P500·나스닥[뉴욕 is],https://news.mtn.co.kr/news-detail/2025072505330462819,"알파벳은 2분기 순이익과 매출 모두 시장 예상치를 상 산업에 대한 기대감을 키웄고, 그 결과가 <b>반도체</b> 주식 등의 상승으로 이어졌다. 엔비디아(1.73%), 브로드컴(1.77%), 마이크론 테크놀로지(1.73%) AMD(2.19%) 등이... ","Fri, 25 Jul 2025 05:36:00 +0900"
2025-07-24 20:52:25,"정부 협상단, 미국에서 무역 협상...'2+2 협의'는 불투명",https://n.news.naver.com/mnews/article/052/0002224292?sid=104,"조선과 <b>반도체</b>, 배터리 등 전략 산업과 에너지 분야 협력방안과 함께 관세 인하와 관련한 우리 측의 요구를 전달했을 것으로 보입니다. 러트닉 장관은 협상에 앞서 방송 인터뷰에서 우리나라가 협상을 매우 타결하고... ","Fri, 25 Jul 2025 05:35:00 +0900"
2025-07-24 20:52:25,"뉴욕증시, 알파벳 호실적에 강보합 마감…S&amp;P500 또 최고치",https://n.news.naver.com/mnews/article/215/0001217555?sid=104,"<b>반도체</b>주는 엔비디아가 1.73%를 상승한 것을 비롯해 마이크로소프트(MS)와 페이스북 모회사 메타 주가는 각각 0.99%, 0.17% 강세를 나타냈다. 반면 테슬라는 전날 실적 미달로 9.11% 폭락했다.","Fri, 25 Jul 2025 05:33:00 +0900"
2025-07-24 20:52:25,'2+2' 담판 미뤄지고 투자 확대는 미지수…美 관세 협상 가시밭길,https://n.news.naver.com/mnews/article/003/0013383977?sid=101,일본 정부와 금융기관이 출자·융자 등을 통해 <b>반도체</b>·조선·핵심광물·에너지·의약품 등 분야에 투자를 제공하는 방식이다. 또 미국산 에너지 수입을 대폭 확대하고 알래스카 액화천연가스(LNG) 공급계약 체결도 논의... ,"Fri, 25 Jul 2025 05:30:00 +0900"
2025-07-24 20:52:25,"&quot;2027년 영업익 6000억 기대&quot;...OCI, 말레이~일본 '<b>반도체</b> 삼각축' 본격화",https://n.news.naver.com/mnews/article/014/0005382302?sid=101,OCI가 말레이시아와 일본을 잇는 <b>반도체</b>용 폴리실리콘 생산 체계를 통해 중장기 수익 구조 재편에 나선다.... 실적 반등의 핵심 동력으로는 <b>반도체</b>용 폴리실리콘이 지목된다. OCI는 말레이시아 합작법인인... ,"Fri, 25 Jul 2025 05:30:00 +0900"
2025-07-24 20:52:25,브로드컴의 VM웨어 인수에 EU 클라우드 업계 반기… EC 승인 무효 소송 ...,https://www.tokenpost.kr/news/tech/270492,"유럽연합(EU)의 클라우드 기업들을 대표하는 무역단체 CISPE가 <b>반도체</b> 및 소프트웨어 기업 브로드컴(Broadcom)의 VM웨어(VMware) 인수에 대해 법적 대응에 나섰다. 이들은 브뤼셀 소재 EU 일반법원에 제소하며, 유럽연합... ","Fri, 25 Jul 2025 05:20:00 +0900"
2025-07-24 20:52:25,"알파벳 랠리, 다우제외 일제↑ 나스닥-S&amp;P는 또 신고가(상보)",https://n.news.naver.com/mnews/article/421/0008391519?sid=104,"<b>반도체</b>주는 엔비디아가 1.73% 상승하는 등 대부분 랠리, <b>반도체</b>지수도 0.12% 상승, 마감했다. 한편, 트럼프는 제롬 파월 연준 의장과 금리 논쟁을 새로운 차원으로 끌어올렸다. 트럼프는 트집을 잡고 있는 25억 달러 연준... ","Fri, 25 Jul 2025 05:17:00 +0900"
2025-07-24 20:52:25,"[마감]미국증시, 테슬라 8% 급락에도 엔비디아 강세에 나스닥-S&amp;P 최고치...",https://www.socialvalue.kr/news/view/1065556690949323,"필라델피아 <b>반도체</b>지수는 전장보다 6.58포인트(0.12%) 오른 5,644.37을 나타내며 마감했다. 주요 종목으로는 엔비디아가 1.7% 상승한 것을 비롯해 마이크로소프트 0.9%, 아마존닷컴 1.7%, 메타 0.1%, 브로드컴 1.7%, 구글의... ","Fri, 25 Jul 2025 05:16:00 +0900"
2025-07-24 20:52:25,의료 내시경으로 글로벌 문 '노크'하는 태양3C…미리 알아본 이 리포트,https://n.news.naver.com/mnews/article/008/0005226717?sid=101,"그는 &quot;기존의 <b>반도체</b> 정밀 배선 및 내시경 케이블 고집적 설계 기술을 바탕으로 제품 개발을 완료했으며, 현재 미국 컨설팅 업체와 협업해 미국 FDA(식품의약국) 클래스 2(Class II) 등급 승인 절차를 진행 중이다&quot;라고... ","Fri, 25 Jul 2025 05:13:00 +0900"
2025-07-24 20:52:25,"[사설] 2+2 협의 연기로 꼬인 한미 관세협상, 실리 외교 비상",https://n.news.naver.com/mnews/article/082/0001337170?sid=110,"<b>반도체</b>, 배터리, 인공지능 등 우리의 전략 산업을 중심으로 미국과 함께 공급망을 재편하고, 상호 이익을 극대화하는 방안도 필요하다. 미국과의 관세협상이 자칫 꼬인다면 향후 이재명 정부에도 엄청난 부담이 된다.... ","Fri, 25 Jul 2025 05:10:00 +0900"
2025-07-24 20:52:25,"정부 협상단, 미국에서 무역 협상...'2+2 협의'는 불투명",https://n.news.naver.com/mnews/article/052/0002224285?sid=104,"조선, <b>반도체</b>, 배터리 등 전략 산업과 에너지 분야 협력을 방안과 함께 관세 인하와 관련한 우리 측의 요구와 입장을 전달한 것으로 보입니다. 러트닉 장관은 이번 협의에 앞서 방송 인터뷰에서 한국도 협상을 매우... ","Fri, 25 Jul 2025 05:10:00 +0900"
2025-07-24 20:52:25,[속보]나스닥·S&amp;P500 최고치…알파벳 실적 호조에 AI기대감↑,https://n.news.naver.com/mnews/article/018/0006073635?sid=101,"엔비디아(1.73%), 브로드컴(1.77%), 마이크론 테크놀로지(1.73%) AMD(2.19%) 등 <b>반도체</b> 주가도 줄줄이 올랐다. 배어드의 투자 전략가 로스 메이필드는 CNBC에 “거대 기술기업과 인공지능(AI)의 영향력을 고려할 때, 이번... ","Fri, 25 Jul 2025 05:08:00 +0900"
2025-07-24 20:52:25,"[N2 뷰] SK하이닉스, 분기 최대 실적 '고공행진'…HBM 둔화 우려 잠재워",https://www.news2day.co.kr/article/20250724500239,영업이익 9조원대 일궈내 글로벌 빅테크 기업 AI 투자 이어져...<b>반도체</b> '풀인 효과'도 실적에 도움 실적... 특히 분기 영업이익 기준으로 경쟁업체 삼성전자와 비교해 SK하이닉스는 삼성전자 <b>반도체</b> 사업부... ,"Fri, 25 Jul 2025 05:02:00 +0900"
2025-07-24 20:52:25,관세 협상 앞두고 이재용 만난 李대통령… 정부·기업 원팀 속도전,https://n.news.naver.com/mnews/article/081/0003560786?sid=100,삼성전자는 미국 텍사스주 테일러시에 파운드리(<b>반도체</b> 위탁생산) 공장 2곳과 R&amp;D 시설 1곳 등 370억 달러(약 50조 6000억원) 이상 투자를 추진 중이다. 한편 이 대통령은 이날 수석보좌관회의를 주재하며 정책감사나 수사... ,"Fri, 25 Jul 2025 05:02:00 +0900"
2025-07-24 20:52:25,2분기 韓경제 0.6%↑… “올해 1%대 성장 한미관세 협상에 달려”,https://n.news.naver.com/mnews/article/081/0003560802?sid=101,"2분기 수출은 <b>반도체</b>, 석유·화학제품 등이 늘어 4.2% 증가했고, 수입은 원유와 천연가스 등 에너지류를... 설비투자도 <b>반도체</b> 제조용 기계 등 기계류와 선박 등 운송 장비 위주로 1.5% 감소했다. 이동원 한은... ","Fri, 25 Jul 2025 05:02:00 +0900"
2025-07-24 20:52:25,[2분기 GDP] 내수·수출 호조에 성장률 0.6% 반등…연 1% 달성 관세에 달...,https://www.ajunews.com/view/20250724142440344,"수출도 <b>반도체</b>, 석유·화학제품 등이 늘어 4.2% 급등했다. 2020년 3분기(14.6%) 이후 약 5년 만에 최대 폭이다. 수입은 에너지류를 중심으로 3.8% 증가했다. 다만 건설투자와 설비투자는 각각 1.5% 뒷걸음질 치며 성장의... ","Fri, 25 Jul 2025 05:02:00 +0900"
2025-07-24 20:52:25,"글로벌 공급난 속…용인 LNG발전소, 두산 수혜 기대",https://www.ajunews.com/view/20250724140244313,"중인 <b>반도체</b> 클러스터 사업이 순조롭게 진행되는 가운데, 클러스터의 안정적인 전력 공급을 담당할 LNG... 24일 업계에 따르면 한국중부발전과 SK이노베이션의 에너지 자회사 SK E&amp;S는 <b>반도체</b> 클러스터 내에 1080MW 규모의 LNG... ","Fri, 25 Jul 2025 05:02:00 +0900"
2025-07-24 20:52:25,‘수출 질주’ K-푸드·K-뷰티…ETF로 성장세 함께 누려볼까,https://n.news.naver.com/mnews/article/662/0000073970?sid=101,"서울 명동에서 한국 화장품을 구매했다는 할리우드 배우들, ‘불닭볶음면’ 열풍 속에 ‘불닭<b>반도체</b>’ ‘면비디아’(엔비디아에 빗댄 별칭)로 불리며 주가 고공행진을 이어가는 삼양식품이 이를 방증한다.... ","Fri, 25 Jul 2025 05:01:00 +0900"
2025-07-24 20:52:25,日 흔든 트럼프식 협상 기술… ‘관세 인하 1%P당 보상’ 요구했다,https://n.news.naver.com/mnews/article/081/0003560777?sid=104,"트럼프 대통령은 “(관세를) 1% 내리면 쌀 수입을 확대하라”, “<b>반도체</b> 투자액을 늘려라”는 식으로 맞교환 조건을 직접 들이밀며 ‘숫자 거래’를 주도했다. 일본 측 대표인 아카자와 료세이 경제재생상은 사전... ","Fri, 25 Jul 2025 05:01:00 +0900"
2025-07-24 20:52:25,우리는 톤당 8천 원일 때 유럽은 10만 원! 배출권거래제 대폭 손질[기후...,https://n.news.naver.com/mnews/article/079/0004048941?sid=101,"그러다 보니 이른바 탄소를 많이 배출하는 철강, 시멘트, 석유화학, 정유, 또 간접적으로 탄소 배출이 많은 <b>반도체</b>, 디스플레이 산업도 기후 변화 대응이라는 관점에서 보면 다 상당한 리스크를 안고 있는 업종이라고 볼... ","Fri, 25 Jul 2025 05:01:00 +0900"
2025-07-24 20:52:25,美에 쌀 내준 日…한·미 협상 변수되나,https://n.news.naver.com/mnews/article/662/0000073959?sid=102,대신 연료용 옥수수 등의 수입량을 확대하는 대안과 함께 조선·자동차·배터리·<b>반도체</b>·에너지 분야의 대미 투자로 미국을 설득하려는 것으로 전해진다. 구 부총리와 여한구 산업통상자원부 통상교섭본부장은 25일 미국... ,"Fri, 25 Jul 2025 05:00:00 +0900"
2025-07-24 20:52:25,"'메타 인수 거절' 퓨리오사AI, 몸값 1조 됐다…李정부 1호 유니콘",https://n.news.naver.com/mnews/article/008/0005226705?sid=101,24일 벤처투자(VC) 업계에 따르면 AI <b>반도체</b> 스타트업 퓨리오사AI는 최근 1700억원 규모의 시리즈C브릿지... 삼성전자와 미국 <b>반도체</b>기업 AMD 엔지니어 출신인 백준호 대표가 2017년 설립했다. LLM(거대언어모델) 등 초거대... ,"Fri, 25 Jul 2025 05:00:00 +0900"
2025-07-24 20:52:25,“‘10만전자’ 없이 ‘오천피’ 없다”…삼성이 이끈다 [K-5000청사진⑤...,https://www.etoday.co.kr/news/view/2490881,"코스피 시총 15%…외국인 지분율 1년 만에 6%↓ <b>반도체</b> 기술격차 해소, 밸류 재평가ㆍ수급 회복 관건 국내... 코스피 랠리 지속 여부를 둘러싸고 글로벌 <b>반도체</b> 기술력 격차를 좁히려는 삼성전자 행보가 내는 성과에... ","Fri, 25 Jul 2025 05:00:00 +0900"
2025-07-24 20:52:25,‘한국의 TSMC는 가능한가’…삼성 파운드리의 미래와 과제 [K-5000청사진...,https://www.etoday.co.kr/news/view/2490914,산업연구원 보고서에 따르면 2026~2030년 데이터센터 <b>반도체</b> 시장 규모는 700조 원에서 3000조 원대까지... 특히 삼성전자는 AI <b>반도체</b>의 핵심인 고대역폭 메모리(HBM) 기술을 자체 보유하고 있다는 점에서 TSMC와... ,"Fri, 25 Jul 2025 05:00:00 +0900"
2025-07-24 20:52:25,&quot;트럼프 '관세 1%'마다 日에 대가 요구&quot;…美 차업계도 결과 '불만',https://n.news.naver.com/mnews/article/008/0005226699?sid=104,"양측 합의 내용은 남은 상대국들에게 자동차는 물론 <b>반도체</b>와 의약품 등 산업별 품목관세를 낮출 수 있다는... 이것을 줄 수 있나&quot;, &quot;쌀 수입을 더 확대하라&quot;, &quot;<b>반도체</b>에 대한 투자, 지원액도 늘려라&quot; 등을 주문했다고 전했다.","Fri, 25 Jul 2025 04:53:00 +0900"
2025-07-24 20:52:25,"[글로벌 비즈 브리핑] &quot;금리 낮춰라&quot;…트럼프, 연준 직접 찾아간다 外",https://n.news.naver.com/mnews/article/374/0000453735?sid=104,"트럼프 대통령은 “(관세를) 1% 포인트 내린다면 그 대신 이것을 주지 않겠는가”, “쌀 수입을 더 확대해야 한다”, “<b>반도체</b>에 대한 투자, 지원액도 늘려야 할 것”이라고 일본 측에 주문한 것으로 알려졌습니다. 이에... ","Fri, 25 Jul 2025 04:45:00 +0900"
2025-07-24 20:52:25,"2+2 협의 연기됐지만…韓美, 산업장관간 무역협상은 예정대로",https://n.news.naver.com/mnews/article/421/0008391483?sid=101,이번 회담에서는 조선·<b>반도체</b>·배터리 등 산업 협력 관련 논의가 중점적으로 다뤄질 전망이다. 김 장관은 23일 인천국제공항에서 미국으로 출국하며 &quot;현재 미국 관세 조치의 향방을 예측하기 어려운 상황이나 범정부... ,"Fri, 25 Jul 2025 04:44:00 +0900"
2025-07-24 20:52:25,"미국증시 장중..4대지수 '혼조', 테슬라·IBM·인텔·항공주 '추락'",http://www.choicenews.co.kr/news/articleView.html?idxno=151084,같은 시각 주요 <b>반도체</b> 기업 인텔의 주가는 22.74 달러로 3.21%나 하락 중이지만 <b>반도체</b>주 전반의 흐름을 반영하는 VANECK SEMI CONDUCTOR ETF(SMH)는 287.94로 0.46% 상승 중이다. 장중(한국시각 25일 새벽 4시 5분 기준)... ,"Fri, 25 Jul 2025 04:40:00 +0900"
2025-07-24 20:52:25,&quot;트럼프 관세 1%p 깎을 때마다 日에 대가 요구&quot;,https://n.news.naver.com/mnews/article/374/0000453732?sid=104,"트럼프 대통령은 “(관세를) 1% 포인트 내린다면 그 대신 이것을 주지 않겠는가”, “쌀 수입을 더 확대해야 한다”, “<b>반도체</b>에 대한 투자, 지원액도 늘려야 할 것”이라고 일본 측에 주문한 것으로 알려졌습니다. 이에... ","Fri, 25 Jul 2025 04:38:00 +0900"
2025-07-24 20:52:25,"스테이블 코인, 정말 스테이블할까… 안정성 쫓느라 보안 복잡해진 딜레...",https://n.news.naver.com/mnews/article/469/0000878000?sid=105,"편집자주우주, 인공지능, <b>반도체</b>, 바이오, 에너지 등 첨단 기술이 정치와 외교를 움직이고 평범한 일상을 바꿔 놓는다. 기술이 패권이 되고 상식이 되는 시대다. 한국일보는 최신 이슈와 관련된 다양한 기술들의 숨은... ","Fri, 25 Jul 2025 04:31:00 +0900"
2025-07-24 20:52:25,한미 관세협상 최종 담판 진행…얼마짜리 '선물보따리' 준비?,https://n.news.naver.com/mnews/article/008/0005226696?sid=101,"자동차, <b>반도체</b>, 배터리, 조선 등 우리 주력 산업과 관련 있는 기업들이다. 현대차그룹은 지난 3월 210억달러... <b>반도체</b>, 자동차, 배터리 관련 추가 대미 투자도 기대되는 상황이다. 아울러 미국산 제품 구매가 확대돼야... ","Fri, 25 Jul 2025 04:30:00 +0900"
2025-07-24 20:52:25,의대 교수도 <b>반도체</b> 연구원도 미국으로 떠난다… '두뇌 유출' 어쩌나,https://n.news.naver.com/mnews/article/469/0000877993?sid=102,"D씨는 이민 후기 블로그에 &quot;<b>반도체</b> 설계회사에서 10년 넘게 일한 경력과 논문, 특허 등의 실적을 기반으로 이민을 준비했다&quot;고 밝혔다. 컴퓨터공학 박사인 E씨도 대기업 20년 근무 경력을 내세워 올해 5월 미국 영주권을... ","Fri, 25 Jul 2025 04:30:00 +0900"
2025-07-24 20:52:25,"[속보]미국증시, 구글 알파벳 호실적에 나스닥-S&amp;P 신고가 랠리 다우는...",https://www.socialvalue.kr/news/view/1065554004093334,"필라델피아 <b>반도체</b>지수는 전장보다 9포인트(0.17%) 오른 5,647을 나타내고 있다. 주요 종목으로는 엔비디아가 1.5% 상승한 것을 비롯해 마이크로소프트 1.1%, 애플 0.2%, 아마존닷컴 1.5%, 메타 0.6%, 브로드컴 1.8%, 구글의... ","Fri, 25 Jul 2025 04:28:00 +0900"
2025-07-24 20:52:25,'공항 취소' 한미 2+2 관세협상…최종 담판 악재 될까?,https://n.news.naver.com/mnews/article/008/0005226694?sid=101,"김 장관은 하워드 러트닉 상무장관과 만나 자동차, 철강, 배터리, <b>반도체</b>, 조선 등 전략산업 협력과 품목 관세 철폐 방안을 논의한다. 현재 자동차와 철강, 알루미늄에는 최대 25%의 관세가 부과돼 있다. 에너지 협상도 주요... ","Fri, 25 Jul 2025 04:25:00 +0900"
2025-07-24 20:52:25,"“청주공항 신설확장, 경제활성화 마중물로 삼아야”",https://www.dnews.co.kr/uhtml/view.jsp?idxno=202507231618389270829,그는 ”K­컬처 등 풍부한 콘텐츠를 바탕으로 한 관광산업을 미래 신성장 동력산업으로 육성하면 외국인 관광객 5000만명 유치를 통해 <b>반도체</b>에 상응하는 연간 약 1200억 달러의 관광 수입을 기대할 수 있을 것”이라며... ,"Fri, 25 Jul 2025 04:20:00 +0900"
2025-07-24 20:52:25,'제로성장' 멈추고 반등한 韓경제…하반기 전망은,https://n.news.naver.com/mnews/article/008/0005226689?sid=101,민간소비가 반등했고 <b>반도체</b>를 중심으로 수출이 호조를 보이면서 당초 한국은행의 전망치(0.5%)를 소폭... 이동원 한은 경제통계2국장은 &quot;건설투자 부진은 계속됐지만 <b>반도체</b> 수출 호조가 지속되면서 예상보다 양호한... ,"Fri, 25 Jul 2025 04:15:00 +0900"
2025-07-24 20:52:25,&quot;금·비트코인보다 낫다?&quot;…은값 치솟은 이유는,https://n.news.naver.com/mnews/article/003/0013383937?sid=101,"은은 금속 중 전기 전도성이 가장 높아 전기차와 태양광 패널, <b>반도체</b> 등 신성장 산업에 필수적으로 쓰인다. 산업용 수요가 전체 수요의 절반을 차지할 정도다. 매년 은 시장 보고서를 발간하는 실버 인스티튜트(Silver... ","Fri, 25 Jul 2025 04:00:00 +0900"
2025-07-24 20:52:25,"[초점] 라피더스, 2나노 시제품 3개월 만에 완성…일본 <b>반도체</b> 재건 본...",http://www.g-enews.com/ko-kr/news/article/news_all/202507241807219476fbbec65dfb_1/article.html,"일본의 <b>반도체</b> 산업 재건을 목표로 2022년 출범한 라피더스(Rapidus)가 2나노미터(nm) <b>반도체</b> 시제품을 단 3개월 만에 개발했다. 홋카이도 치토세에 있는 공장에서 4월 중순 웨이퍼를 처음 투입한 뒤, 7월 10일 정상 작동을... ","Fri, 25 Jul 2025 03:56:00 +0900"
2025-07-24 20:52:25,"李대통령, 이재용 삼성 회장과 만찬…재계 총수 연쇄회동",http://www.m-i.kr/news/articleView.html?idxno=1264085,삼성전자는 미국 텍사스주 테일러시에 파운드리(<b>반도체</b> 위탁생산) 공장 2곳과 연구개발(R&amp;D) 시설 1곳 등 370억 달러(약 50조6000억원) 이상 투자를 추진 중이다. SK그룹은 <b>반도체</b> 계열사인 SK하이닉스를 통해 38억7000만 달러... ,"Fri, 25 Jul 2025 03:36:00 +0900"
2025-07-24 20:52:25,엔비디아·AMD 수장 &quot;규제 완화하는 트럼프 AI 행동계획 환영&quot;,https://n.news.naver.com/mnews/article/293/0000070239?sid=105,미국 <b>반도체</b> 기업 엔비디아와 AMD가 도널드 트럼프 행정부의 새로운 인공지능(AI) 행동 계획을 공개적으로... 이 계획에는 AI 개발과 활용에 걸림돌이 되는 각종 규제를 완화하고 AI에 필수적인 <b>반도체</b>를 포함한 미국... ,"Fri, 25 Jul 2025 03:36:00 +0900"
2025-07-24 20:52:25,"정부 협상단, 미 상무와 1시간 20분 무역 협상...&quot;심도 있는 협의&quot;",https://n.news.naver.com/mnews/article/052/0002224277?sid=104,"다음 달 1일 상호관세 발효에 앞서 막판 타협점을 찾기 위한 협상 진전 방안과 함께 조선과 <b>반도체</b>, 배터리 등 전략 산업 분야와 에너지 분야 협력 강화 방안 등이 논의된 것으로 보입니다. 정부 관계자는 구체적인 협상... ","Fri, 25 Jul 2025 03:21:00 +0900"
2025-07-24 20:52:25,"김태흠 충남도지사, 에어리퀴드 CEO와 외자유치·그린에너지 협력 논의",https://n.news.naver.com/mnews/article/382/0001212513?sid=102,"에어리퀴드는 산업·의료용 기초 및 특수가스를 공급하는 글로벌 선도기업으로, <b>반도체</b>·디스플레이·배터리·우주항공 등 주요 산업에 고순도 희귀가스를 공급하고 있다. 충남에는 1998년 천안에 첫 공장을 설립한 이후... ","Fri, 25 Jul 2025 03:08:00 +0900"
2025-07-24 20:52:25,"용인시·괴산군, 자매결연 협약…지역 간 상생발전 협력 다짐",https://n.news.naver.com/mnews/article/382/0001212504?sid=102,"이상일 용인특례시장은 “용인시는 초대형 <b>반도체</b> 프로젝트가 진행되는 첨단 도시이자 농업 발전에도 힘을 쏟고 있는 도농복합도시”라며, “유기농 산업 중심지인 괴산군과 기술 및 노하우를 공유하며 함께 성장하는... ","Fri, 25 Jul 2025 03:06:00 +0900"
2025-07-24 20:52:25,"‘15% 관세’ 기준 되나, 日 이어 EU 합의 근접",https://n.news.naver.com/mnews/article/020/0003650335?sid=104,이에 미국이 한국에도 <b>반도체</b>와 자동차 등에 부과된 품목별 관세를 일부 낮춰줄 가능성이 커진 것 아니냐는 분석이 제기된다. 다만 철강은 예외가 될 것으로 보인다. 로이터통신은 미국이 일본산 철강과 마찬가지로... ,"Fri, 25 Jul 2025 03:05:00 +0900"
2025-07-24 20:52:25,"日, 미국쌀 수입 年35만→60만t 늘리고 美자동차 안전검사 면제",https://n.news.naver.com/mnews/article/020/0003650334?sid=104,"이번 투자는 조선, 의약, <b>반도체</b> 등에 적용될 것으로 알려졌으나 자금 조달 계획, 투자처와 방식 등이 불투명하다. 한편 스콧 베선트 미국 재무장관은 23일 폭스뉴스에서 일본의 무역 합의 준수에 대해 “분기별로... ","Fri, 25 Jul 2025 03:05:00 +0900"
2025-07-24 20:52:25,더 세진 상법 추진에… 경제8단체 “경영혼란”,https://n.news.naver.com/mnews/article/020/0003650305?sid=101,"이어 “석유화학, 철강 등 기간산업은 존폐의 갈림길에 서 있고, <b>반도체</b>·이차전지 등 첨단 산업도 중국 등의 추격으로 입지가 흔들리고 있다”며 “이런 상황에서 기업을 더욱 위축시키는 입법은 재고가 필요하다”고... ","Fri, 25 Jul 2025 03:04:00 +0900"
2025-07-24 20:52:25,"李대통령, 이재용과 만찬… “대미 투자 점검”",https://n.news.naver.com/mnews/article/020/0003650313?sid=101,삼성전자는 2026년 가동을 목표로 텍사스주에 370억 달러 규모의 <b>반도체</b> 공장을 짓고 있다. SK하이닉스는 인디애나주에 38억7000만 달러 규모의 고대역폭메모리(HBM) 공장을 짓기로 했다. 현대차는 올 3월 210억 달러를... ,"Fri, 25 Jul 2025 03:04:00 +0900"
2025-07-24 20:52:25,"HBM 날개 단 SK하이닉스, 영업익 9.2조원 ‘분기 역대 최대’",https://n.news.naver.com/mnews/article/020/0003650298?sid=101,SK하이닉스가 2분기(4∼6월) 고대역폭메모리(HBM) 등 인공지능(AI) <b>반도체</b> 수요 확대에 힘입어 분기 기준... SK하이닉스는 AI <b>반도체</b> 시장에서의 주도권을 이어가기 위해 HBM 중심으로 투자도 확대할 방침이다.... ,"Fri, 25 Jul 2025 03:03:00 +0900"
2025-07-24 20:52:25,2분기 GDP 0.6% 성장… “소비-수출 회복에 역성장 탈출”,https://n.news.naver.com/mnews/article/020/0003650276?sid=101,수출의 경우 <b>반도체</b>나 석유화학 제품의 수출이 활기를 보이며 직전 분기 대비 4.2% 늘었다. 의약품은 미국과... 설비투자도 <b>반도체</b> 제조용 기계나 운송장비 등에 대한 투자가 줄면서 1.5% 감소했다. 한국 경제가 2분기... ,"Fri, 25 Jul 2025 03:02:00 +0900"
2025-07-24 20:52:25,"유럽증시, &quot;협상 타결 가시권&quot; 소식에 대부분 올라… 도이체방크 9% 급등",https://www.newspim.com/news/view/20250725000005,프랑스 파리 증시에 상장돼 있는 유럽 최대 <b>반도체</b> 제조업체 ST마이크로일렉트로닉스는 10년 만에 처음으로 분기 손실을 기록했다는 발표와 함께 16.6% 폭락했다. 이 회사 역대 최대 하락률이었다. 프랑스의 석유... ,"Fri, 25 Jul 2025 02:41:00 +0900"
