DateTime,Title,Link,Description,PubDate
2026-07-21 16:50:57,UBS &quot;실적 주도형 상승장 이어진다…연말 S&amp;P500 8100 가능&quot;,https://n.news.naver.com/mnews/article/018/0006334227?sid=101,파커는 “투자자들이 실적 강도를 저평가하고 있다”면서 “수요를 맞추기 위해 수주 잔고를 쌓아두고 있는 <b>반도체</b> 기업이 실적 성장을 이끌면서 S&amp;P500지수는 올해 시장 전망치를 상회하는 28% 이상의 성장률을... ,"Wed, 22 Jul 2026 01:47:00 +0900"
2026-07-21 16:50:57,SK하이닉스 ADR 하루만에 급반등…<b>반도체</b>株 저가매수에 10%↑,https://news.einfomax.co.kr/news/articleView.html?idxno=4426085,필라델피아 <b>반도체</b> 지수 5% 급등 최진우 특파원 = SK하이닉스(NAS:SKHY) 미국 주식예탁증서(ADR) 주가가 <b>반도체</b> 주식 저가 매수에 힘입어 10% 넘게 급등하고 있다. SK하이닉스[연합뉴스 사진 제공] 21일(현지시간)... ,"Wed, 22 Jul 2026 01:36:00 +0900"
2026-07-21 16:50:57,7월 4주 주요 제조업 전망,https://www.laborplus.co.kr/news/articleView.html?idxno=41170,"3주 <b>반도체</b> 가격(DRAM 7월 21일 기준, NAND 7월 6일 기준) - DRAM: DDR4 16Gb(2Gx8) 3200 81.20달러(전주 대비 +0.93%), DDR4... 첨단 공정이 실적 성장을 견인했으며 사업별로는 AI <b>반도체</b>가 포함된 고성능컴퓨팅(HPC) 부문 배출 비중이 66... ","Wed, 22 Jul 2026 01:36:00 +0900"
2026-07-21 16:50:57,삼성자산운용 'THE ACTION BOOK' 발간,http://www.bizwnews.com/news/articleView.html?idxno=141053,김도형 삼성자산운용 ETF컨설팅본부장은 &quot;<b>반도체</b> 기업들을 중심으로 증시변동성이 커지면서 ETF 연금투자자분들의 우려가 높은 상황&quot;이라며 &quot;공급과잉에 대한 우려가 있으나 <b>반도체</b> 기업들의 견조한 실적전망은... ,"Wed, 22 Jul 2026 01:34:00 +0900"
2026-07-21 16:50:57,"한국 증시 급락, 제이피모간과 씨티그룹 엇갈린 전망",https://www.tokenpost.kr/news/market/379943,"올해 외국인의 한국 주식 순매도 가운데 약 90%가 메모리 <b>반도체</b> 종목에 집중됐는데, 최근 관련 종목 비중이... 이 같은 흐름은 앞으로 국내 기업 실적, <b>반도체</b> 업황, 외국인 자금 복귀 여부에 따라 한국 증시에 대한 해외... ","Wed, 22 Jul 2026 01:28:00 +0900"
2026-07-21 16:50:57,[오늘의 경제뉴스] &quot;AI·<b>반도체</b> 매도 끝 보인다&quot; 바닥론 잇따라…근거는...,https://www.newsverse.kr/news/articleView.html?idxno=10982,(사진=UPI/연합뉴스) 인공지능(AI)·<b>반도체</b>주를 덮쳤던 급격한 매도세가 막바지에 접어들었다는 분석이... UBS 트레이딩데스크도 AI·<b>반도체</b> 관련 모멘텀 종목에 대한 매도세가 끝나갈 가능성이 있다며 투자자들에게 관련... ,"Wed, 22 Jul 2026 01:20:00 +0900"
2026-07-21 16:50:57,"&quot;휴머노이드 10억 대 시대, 우리는 무엇을 준비해야 하는가&quot;",https://www.irobotnews.com/news/articleView.html?idxno=47523,"모터, 액추에이터, 감속기, 센서, 배터리, <b>반도체</b>, AI 모델, 데이터, 운영체제, 안전인증까지 모두 연결된 산업 생태계가 필요하다. 우리나라가 제조 강점을 갖고 있다고 해서 휴머노이드 경쟁에서도 자동으로 앞설 수는... ","Wed, 22 Jul 2026 01:16:00 +0900"
2026-07-21 16:50:57,[백광엽 칼럼] '우리 시대의 보너스'에 대하여,https://n.news.naver.com/mnews/article/015/0005312355?sid=110,"<b>반도체</b>발 수백조원의 추가 세수와 수천조원의 초과 이익은 ‘우리 시대의 보너스’다. 산업화에 헌신한... 모두 말렸지만 “내 눈엔 돈이 보여”라며 칠순에 <b>반도체</b>라는 승부수를 던진 이병철, 사재까지 털어 넣은... ","Wed, 22 Jul 2026 01:09:00 +0900"
2026-07-21 16:50:57,[데스크 칼럼] 성큼 다가온 자율주행 시대,https://n.news.naver.com/mnews/article/015/0005312352?sid=110,국내 한 중견 <b>반도체</b> 기업 대표 A씨는 지난해 말 테슬라의 모델X를 구입한 뒤 운전기사를 내보냈다. 최신... <b>반도체</b> 기업 주가를 예로 들어보자. 생성형 인공지능(AI)이 문자와 음성을 처리하는 데 필요한 메모리 <b>반도체</b>보다... ,"Wed, 22 Jul 2026 01:07:00 +0900"
2026-07-21 16:50:57,[사설] 대통령도 'N% 성과급' 쟁의 대상 아니라는데…입법으로 못 박아...,https://n.news.naver.com/mnews/article/015/0005312349?sid=110,‘n% 성과급’과 전남광주 <b>반도체</b> 공장 건설 문제를 거론하면서다. 시행령 등을 통해 적극적으로 교통정리에... 이 대통령의 이번 언급은 <b>반도체</b> 기업 노조가 광주 팹 건설을 쟁의 대상으로 삼으려는 움직임과 무관치 않아... ,"Wed, 22 Jul 2026 01:06:00 +0900"
2026-07-21 16:50:57,[기고] 전력망 위기를 키운 규제의 역설,https://n.news.naver.com/mnews/article/015/0005312347?sid=110,"반면 첨단 <b>반도체</b> 클러스터가 들어설 수도권에선 전력 부족을 호소한다. 이 모순을 해결할 유일한 해법으로 송전탑 추가 건설이 제시되지만, 이는 1차원적인 접근에 불과하다. 현재의 전력망 위기는 설비의 절대적 부족... ","Wed, 22 Jul 2026 01:04:00 +0900"
2026-07-21 16:50:57,"비트코인(BTC), 거래소에서 6.8억 달러 출금...고래들 매도 끝나고 폭등...",http://coinreaders.com/248779,"아시아 <b>반도체</b>주 반등으로 위험자산 투심이 개선되면서 전체 암호화폐 시가총액도 2.27% 증가했다. 거래소 순유출과 고래 매도 감소, 비트코인 현물 ETF 자금 유입이 동시에 확인됐다. [기사 핵심 요약]... ","Wed, 22 Jul 2026 01:02:00 +0900"
2026-07-21 16:50:57,[단독] SK하이닉스의 승부수…인텔 美오하이오 공장 산다,https://n.news.naver.com/mnews/article/025/0003539221?sid=101,SK하이닉스가 인텔의 미국 오하이오주 <b>반도체</b> 공장 부지와 시설을 인수하기로 하고 관련 절차에 돌입했다.... 21일 정보기술(IT) 업계에 따르면 SK하이닉스는 5년 내 미국 현지에서 메모리 <b>반도체</b>를 생산하는 것을... ,"Wed, 22 Jul 2026 01:00:00 +0900"
2026-07-21 16:50:57,"李 “영업이익 배분, 쟁의 대상 아니다”",https://n.news.naver.com/mnews/article/023/0003988898?sid=100,호남<b>반도체</b> 건설 교섭 요구엔 삼성 노조 겨냥 “터무니없어” “불법 동원된 부동산 불로소득 공정... 최근 삼성전자 최대 노조인 초기업 노조가 광주 <b>반도체</b> 팹(fab·공장) 건설 문제를 교섭 의제로 다루겠다고 한 것과... ,"Wed, 22 Jul 2026 00:54:00 +0900"
2026-07-21 16:50:57,"도시까지 지었다, 중국의 ‘AI 인재 가두리’ 전략",https://n.news.naver.com/mnews/article/023/0003988896?sid=104,중국 <b>반도체</b> 산업의 핵심 기업인 화웨이는 상하이·장쑤·저장 세 지역의 경계에 있는 농지에 자사 최대... 중국 <b>반도체</b> 산업의 지휘자 격인 화웨이는 상하이와 장쑤·저장이 만나는 행정 경계에 2024년 10월 자사 최대... ,"Wed, 22 Jul 2026 00:54:00 +0900"
2026-07-21 16:50:57,“레버리지 대책 그걸로 되겠나… 보완책 내야”,https://n.news.naver.com/mnews/article/023/0003988890?sid=101,이날 금융당국은 국내 주식 시장의 출렁임이 커진 원인으로 글로벌 <b>반도체</b> 주식의 주가 변동성을 꼽았다. 이억원 금융위원장은 “글로벌 <b>반도체</b> 종목 자체가 워낙 출렁임이 심하다”며 “우리뿐만 아니라 미국의... ,"Wed, 22 Jul 2026 00:50:00 +0900"
2026-07-21 16:50:57,李대통령 “쟁의 대상 너무 광범위해져” 노동부에 기준 마련 주문,https://n.news.naver.com/mnews/article/023/0003988889?sid=100,"실제로 영업이익 중 일정 비율(N%)을 성과급으로 달라는 요구는 <b>반도체</b>에서 시작해 현재 자동차, 조선... 호남 <b>반도체</b> 클러스터 조성 문제를 다루겠다고 한 것도 거론했다. 이 대통령은 “광주에 공장을 지으면 혹시... ","Wed, 22 Jul 2026 00:50:00 +0900"
2026-07-21 16:50:57,"美 제재도 안 먹혀… 中, 자체 칩만으로 초대형 데이터센터 완공",https://n.news.naver.com/mnews/article/023/0003988886?sid=105,"AI 구동 기술도 美 턱밑 추격 美, 中 AI 사용 전면 금지 검토 미국의 첨단 <b>반도체</b> 수출 규제에도 가성비를... 그동안 중국은 미 정부의 첨단 <b>반도체</b> 수출 금지 조치로 엔비디아의 고성능 칩을 구하지 못해 AI 개발에... ","Wed, 22 Jul 2026 00:48:00 +0900"
2026-07-21 16:50:57,대기업 영업이익 81% 오를 때 고용은 0.2% 증가 그쳐,https://n.news.naver.com/mnews/article/005/0001862334?sid=101,"최근 3년간 <b>반도체</b> 분야를 중심으로 국내 대기업들의 매출과 영업이익이 큰 폭으로 늘었지만, 고용은... 반면 <b>반도체</b> 분야를 포함한 IT·전기·전자 업종은 압도적인 실적 증가에도 불구하고 고용은 소폭 상승하는... ","Wed, 22 Jul 2026 00:43:00 +0900"
2026-07-21 16:50:57,"엔비디아, 루빈 칩 고객 인도 순항",https://www.tokenpost.kr/news/breaking/379933,이언 벅 엔비디아 부사장 겸 총괄매니저는 관련 시스템이 전면 양산 단계에 진입했으며 주요 고객들이 배포를 진행 중이라고 말했다. 이번 공급은 AI <b>반도체</b> 시장 내 엔비디아의 주도권을 강화하는 요인으로 평가된다.,"Wed, 22 Jul 2026 00:42:00 +0900"
2026-07-21 16:50:57,“단기임대 최고 입지는 강남… 외국인 많은 마포도 수요 탄탄”,https://n.news.naver.com/mnews/article/023/0003988859?sid=004,<b>반도체</b>·산업단지 건설 수요를 겨냥한 업무 체류형 시장으로 주차와 세탁·취사시설이 중요하다. 부산 해운대도 관광과 전시·컨벤션 수요를 바탕으로 한 유망지로 꼽힌다. 다만 성수기와 비수기 수요 차이가 크다. ◇매출... ,"Wed, 22 Jul 2026 00:38:00 +0900"
2026-07-21 16:50:57,고점서 40% 빠진 증권주 반등할까,https://n.news.naver.com/mnews/article/023/0003988852?sid=101,까닭은 <b>반도체</b> 종목으로만 뭉칫돈이 쏠렸기 때문이다. 지난 2분기(4~6월) 코스피가 67.8% 급등할 동안 KRX 증권지수는 오히려 10.7% 떨어졌다. 증시 상승을 이끈 자금이 삼성전자와 SK하이닉스 등 일부 <b>반도체</b> 대형주에만... ,"Wed, 22 Jul 2026 00:36:00 +0900"
2026-07-21 16:50:57,"매수·매도 사이드카, 9시 대에 59% 발동",https://n.news.naver.com/mnews/article/023/0003988853?sid=101,"미국 증시 급등, <b>반도체</b>주 랠리, 휴전 기대 같은 호재는 밤사이 뉴욕 시장에서 결정돼 개장과 함께 반영되기 때문이다. 반면 매도 사이드카는 20회 중 11회가 오전 10시 이후, 즉 장중에 발동됐다. 유가 급등이나 전쟁... ","Wed, 22 Jul 2026 00:36:00 +0900"
2026-07-21 16:50:57,AI <b>반도체</b> 이어 AI 인프라 공급… ‘脫엔비디아 전쟁’ 2라운드 돌입,https://n.news.naver.com/mnews/article/023/0003988848?sid=105,"MS, AMD 헬리오스 시스템 도입 인공지능(AI) <b>반도체</b> 시장에서 엔비디아 독주를 깨기 위한 ‘탈(脫)엔비디아 전쟁’이 2라운드에 접어들었다. 그동안 빅테크가 엔비디아를 대체할 개별 고성능 AI 칩 개발을 통해... ","Wed, 22 Jul 2026 00:35:00 +0900"
2026-07-21 16:50:57,칩플레이션발 구독료 인상에 독서 뜬다,https://www.koreadaily.com/article/20260721083210609,기업들은 인공지능(AI) 서버 투자 확대에 따른 메모리 <b>반도체</b> 가격과 부품 조달 비용 상승을 가격 인상의 주요 원인으로 꼽았다. 여기에 전기요금도 2019년 이후 45% 올라 게임기와 가전제품을 사용하는 비용까지... ,"Wed, 22 Jul 2026 00:34:00 +0900"
2026-07-21 16:50:57,독일 기술 없인 첨단 <b>반도체</b> 못 만든다,https://n.news.naver.com/mnews/article/023/0003988842?sid=105,회로 선폭 5나노 이하 첨단 <b>반도체</b> 제조에 필수적인 네덜란드 ASML의 극자외선(EUV) 노광 장비용 레이저... 이 빛이 <b>반도체</b> 웨이퍼 위에 초미세 회로를 새긴다. 삼성전자·SK하이닉스·TSMC 등이 이런 식으로 최첨단... ,"Wed, 22 Jul 2026 00:33:00 +0900"
2026-07-21 16:50:57,“레버리지·인버스 투자 멈춰라” vs “규제로 유동성 줄면 변동성 더...,https://n.news.naver.com/mnews/article/023/0003988845?sid=101,린드 CEO는 SK하이닉스의 ADR 상장으로 회사의 밸류에이션(가치 평가)이 마이크론 등 주요 미국 <b>반도체</b> 기업과 비슷한 수준으로 높아질 수 있다고 했다. 국내 증시를 뒤흔들고 있는 <b>반도체</b>주 ‘피크아웃(고점 통과)... ,"Wed, 22 Jul 2026 00:33:00 +0900"
2026-07-21 16:50:57,‘전력시장 감시-전력망 감독’ 전력감독원 신설,https://n.news.naver.com/mnews/article/020/0003735534?sid=101,정부는 <b>반도체</b>와 인공지능(AI) 등 첨단산업 발전으로 전력 수요가 대폭 늘어나는 가운데 재생에너지를 확대하는 정책을 추진하고 있다. 이로 인해 발전원과 전력소비자가 다양해지면서 현재 방식으로는 전력 계통... ,"Wed, 22 Jul 2026 00:32:00 +0900"
2026-07-21 16:50:57,"AI 데이터센터 시장, 젠슨 황-리사 수 ‘5촌간의 전쟁’ 예고",https://n.news.naver.com/mnews/article/020/0003735529?sid=101,미국 <b>반도체</b> 기업 AMD가 인공지능(AI) 훈련·추론용 랙(서버 장비) 시스템 ‘헬리오스’를 마이크로소프트 등에 공급하며 본격적으로 AI 데이터센터 시장에 뛰어들었다. 그간 엔비디아가 독점하다시피 한 AI... ,"Wed, 22 Jul 2026 00:31:00 +0900"
2026-07-21 16:50:57,"<b>반도체</b> 부지 ‘평당 1000원’ 승부수… “구미의 전성기, 다시 시작”",https://n.news.naver.com/mnews/article/023/0003988834?sid=102,SK실트론·KEC 등 소부장 기업 309곳 밀집 <b>반도체</b> 제조 공장 유치 위해 “평당 1000원” 삼성도 AI 휴머노이드... 하지만 <b>반도체</b>와 방위 산업을 핵심 산업으로 육성하면서 <b>반도체</b> 특화 단지와 방산 혁신 클러스터 지정을... ,"Wed, 22 Jul 2026 00:31:00 +0900"
2026-07-21 16:50:57,"“엔비디아 손절인가”..애플, AI 서버칩 직접 만든다!",https://www.dailycar.co.kr/content/news.html?type=view&autoId=62092,"애플이 인공지능(AI) 경쟁력 강화를 위해 자체 AI 서버용 <b>반도체</b> 개발에 본격 착수했다. <b>반도체</b> 스타트업 인수를 추진하는 한편, 중국 당국으로부터 AI 서비스 출시 승인을 받아 최대 AI 시장 공략에도 나선다. 미국 IT... ","Wed, 22 Jul 2026 00:30:00 +0900"
2026-07-21 16:50:57,&quot;지금이라도 투자 멈춰야&quot;‥李 &quot;신속히 보완&quot;,https://n.news.naver.com/mnews/article/214/0001513024?sid=101,"결국에는 이 변동성들이 줄어들려면 사람들이 삼성전자나 SK하이닉스 <b>반도체</b>(주)를 덜 사야 돼요.&quot; 이재명 대통령은 필요 이상으로 불안정을 키웠다는 비판이 있다며, 추가 대책을 만들라고 지시했습니다. [이재명... ","Wed, 22 Jul 2026 00:29:00 +0900"
2026-07-21 16:50:57,[8·17 전대] 송영길 &quot;'유능한 진보·민심소통·정권재창출 적임자&quot;,https://www.polinews.co.kr/news/articleView.html?idxno=737622,그는 &quot;아시안게임으로 7조 원 규모의 부채와 막대한 이자 부담을 떠안은 인천시를 흑자 구조로 전환했다&quot;며 &quot;삼성바이오와 앰코테크놀로지 등을 유치해 <b>반도체</b>·바이오 산업 기반을 만든 경험이 있다&quot;고 강조했다. 이어... ,"Wed, 22 Jul 2026 00:29:00 +0900"
2026-07-21 16:50:57,[사설] 산업 생태계 망치는 ‘N% 성과급’…주총 승인 의무화해야,https://n.news.naver.com/mnews/article/025/0003539217?sid=110,"더 큰 문제는 한경협의 지적처럼 그 파장이 <b>반도체</b> 업계를 넘어 산업계 전반을 흔들기 시작했다는 것이다. 업종 불문, 이익 규모 불문에다 협력업체 노동자들까지 들썩인다. 급기야 정부 토론회에서 김영훈 고용노동부... ","Wed, 22 Jul 2026 00:24:00 +0900"
2026-07-21 16:50:57,"예스티, 스파터 장비 공급계약 체결→국내 <b>반도체</b> 장비시장 기대감",https://www.topstarnews.net/news/articleView.html?idxno=16141987,"이번 계약을 통해 예스티는 <b>반도체</b>, 디스플레이 장비 분야에서 국내 시장 내 입지를 강조했으며, 한국ULVAC은 계약 상대방으로 최근 매출액이 429,450,393,289원, 주요사업은 <b>반도체</b>, 디스플레이 장비 분야로... ","Wed, 22 Jul 2026 00:24:00 +0900"
2026-07-21 16:50:57,"민형배 인수위 백서 전달, 성장 실현은 이제부터",http://www.kwangju.co.kr/article.php?aid=1784647200801441074,압도적 성장의 핵심인 호남권 <b>반도체</b> 클러스터부터 차질없이 추진해 고향에 정착하는 청년들이 많아지는 실질적인 효과로 나타나야 한다. 지방정부 차원에서 추진하는 ‘기본사회 모델’이 시민들의 삶의 질 개선을... ,"Wed, 22 Jul 2026 00:24:00 +0900"
2026-07-21 16:50:57,"[사설] 李 “이익 배분은 쟁의 대상 아냐” 옳은 말, 후속 조치 서둘러...",https://n.news.naver.com/mnews/article/023/0003988828?sid=110,이 대통령이 ‘호남 <b>반도체</b>’에 반발하는 삼성전자 노조에 대해 “노조 동의 안 하면 못 간다는 식의 주장은 터무니없다”고 지적한 것 역시 적절했다. 기업의 공장 신설이나 투자 지역 결정은 경영진의 고유 권한이다.... ,"Wed, 22 Jul 2026 00:21:00 +0900"
2026-07-21 16:50:57,"UBS &quot;S&amp;P500, 연말 8,100까지 간다&quot;",https://news.einfomax.co.kr/news/articleView.html?idxno=4426081,"위해 주문 잔고를 쌓아가고 있는 <b>반도체</b> 기업들이 견인할 것&quot;이라고 주장했다. 그러면서 파커는 S&amp;P500 지수의 연말 목표치를 기존 7,500에서 8,100으로 상향 조정했다. 내년 말까지는 8,900에 이를 수 있을 것으로 전망했다.","Wed, 22 Jul 2026 00:20:00 +0900"
2026-07-21 16:50:57,"이 대통령 “기업 영업이익 배분, 노동쟁의 대상 아니다”",https://n.news.naver.com/mnews/article/025/0003539211?sid=100,이 대통령은 삼성전자 초기업노조가 최근 광주 군공항 <b>반도체</b> 팹(fab·공장) 건설 관련 노사 교섭을 요구한 걸... 이에 김영훈 고용노동부 장관은 “삼성전자가 광주에 대규모 <b>반도체</b> 공장을 짓기로 한 경영상의 결정 자체를... ,"Wed, 22 Jul 2026 00:19:00 +0900"
2026-07-21 16:50:57,"엔비디아, CPU도 직접 만든다…AMD·인텔 정조준",https://n.news.naver.com/mnews/article/014/0005551029?sid=101,인공지능(AI) <b>반도체</b> 시장을 장악한 엔비디아가 이번에는 중앙처리장치(CPU) 시장에 본격 진출하며 AMD와... 베라는 Arm이 여러 <b>반도체</b> 업체에 제공하는 표준 CPU 설계를 사용하는 대신 코어를 직접 설계한 엔비디아의... ,"Wed, 22 Jul 2026 00:18:00 +0900"
2026-07-21 16:50:57,차별화 전략으로 ‘5극 3특’ 경쟁에서 생존해야,http://www.kwangju.co.kr/article.php?aid=1784646900801440074,"대경권은 미래 모빌리티 부품, 시스템 <b>반도체</b> 소재 부품, 에너지·수소를 희망했는데 전남광주시(서남권)가... 특히 정부가 전남광주에 800조원의 호남권 <b>반도체</b> 클러스터를 선물했다고 생각하는 곳이 많아 이를 빌미로... ","Wed, 22 Jul 2026 00:18:00 +0900"
2026-07-21 16:50:57,‘쟁의 범위’ 지적한 이재명 대통령… 노동계 “노동 기본권 축소” 반...,https://n.news.naver.com/mnews/article/022/0004144839?sid=102,삼성전자 노조가 호남 <b>반도체</b> 투자 계획을 내년 단체교섭 의제로 다루겠다고 한 데 관해서도 “이런 식으로 하면 끝이 없다”며 “일정한 기준을 정해야 한다”고 했다. 그러면서 “법원 판단 이전에 필요하면... ,"Wed, 22 Jul 2026 00:14:00 +0900"
2026-07-21 16:50:57,“투기도 아닌데” 집·논밭 안가리는 재산 건보료…은퇴자 옥죈다 [신...,https://n.news.naver.com/mnews/article/025/0003539207?sid=110,은퇴자 옥죄는 건보료 실태 강남 3구가 총액의 8% 부담 용인·화성 <b>반도체</b> 특구 높아 “시급히 확 줄이거나... <b>반도체</b> 특구로 뜨는 용인·화성(6위)·평택(11위)도 많다. 아파트가 많고 가격이 높은 곳이다. 강남구의 재산... ,"Wed, 22 Jul 2026 00:12:00 +0900"
2026-07-21 16:50:57,"경과원, ‘2026 경기 스타트업 서밋’ 참가 기업 모집… 10월 수원서 개...",https://n.news.naver.com/mnews/article/022/0004144838?sid=102,"8월13일까지 접수…AI·<b>반도체</b>·바이오 등 혁신 기술 기업 대상 전시 부스 무료 제공·국내외 주요 투자사와... 모집 대상은 인공지능(AI), <b>반도체</b>, 바이오, 미래모빌리티 등 딥테크 및 신산업 분야의 창업 7년 이내(신산업... ","Wed, 22 Jul 2026 00:12:00 +0900"
2026-07-21 16:50:57,기술주 폭락장 홀로 뚫었다… 비트코인 7만 달러 대폭등 시동 걸리나,https://www.pinpointnews.co.kr/news/articleView.html?idxno=470179,"21일(현지 시간) 코인텔레그래프 등 가상자산 전문 매체에 따르면, 비트코인은 인공지능(AI) 및 <b>반도체</b> 관련 기술주들의 고평가 논란으로 나스닥 지수가 급락하는 악조건 속에서도 단단한 하방 지지력을 보이며 가상자산과... ","Wed, 22 Jul 2026 00:10:00 +0900"
2026-07-21 16:50:57,"이노비즈협회 강원지회, <b>반도체</b> 인재 현장채용 지원",https://n.news.naver.com/mnews/article/654/0000191488?sid=101,강원형 미래인력양성사업을 통해 양성된 <b>반도체</b> 분야 전문인력과 도내 기업 간 실질적인 채용 연계를... 행사에는 'G-<b>반도체</b> 혁신인재 양성과정' 수료생 12명과 도내 소재·부품 관련 중소기업 5개 업체(인테그리스코리아... ,"Wed, 22 Jul 2026 00:09:00 +0900"
2026-07-21 16:50:57,두 개의 빵과 아무도 먹지 못한 도시,http://www.kwangju.co.kr/article.php?aid=1784646300801437131,"통합특별시는 거대한 미래 산업, 특히 <b>반도체</b> 산업과 같은 초대형 프로젝트에 정책과 예산, 관심을 집중하고 있다. 물론 그것은 필요하다. 도시의 미래를 위해 반드시 준비해야 할 일이다. 그러나 문제는 그 미래가... ","Wed, 22 Jul 2026 00:08:00 +0900"
2026-07-21 16:50:57,[사설] 또 ‘국가역할론’ 띄운 靑…관치로 AI 생태계 못 키운다,https://n.news.naver.com/mnews/article/011/0004643743?sid=110,불명확한 ‘<b>반도체</b> 초과 이윤’ 활용 방안을 논의하는 토론회를 열었다. 20일에는 이재명 대통령이... 데이터센터와 <b>반도체</b> 공정을 원활하게 가동하기 위해 원전 증설 등 안정적 전력원을 확보하는 것이 더 시급한... ,"Wed, 22 Jul 2026 00:06:00 +0900"
2026-07-21 16:50:57,"[사설] 추가세수로 ‘미래대응기금’ 추진, 채무관리는 뒷전인가",https://n.news.naver.com/mnews/article/011/0004643744?sid=110,<b>반도체</b> 호황에 힘입어 국세수입이 500조 원을 돌파할 것이라는 전망이 바탕이 됐다. 당정은 추가 세수를... 더구나 <b>반도체</b> 호황에 기댄 세수 증가가 언제 꺾일지도 알 수 없다. 진정 미래 세대를 위한다면 정치적... ,"Wed, 22 Jul 2026 00:06:00 +0900"
2026-07-21 16:50:57,"<b>반도체</b> 다음은 로봇… 삼성전자, ‘휴머노이드’ 승부수 던졌다",https://n.news.naver.com/mnews/article/005/0001862325?sid=101,이를 통해 <b>반도체</b>·스마트폰·가전 등 서로 다른 제조 현장에서 폭넓은 공정 데이터를 확보할 수 있을 것으로 보인다. 디스플레이·전자부품·배터리·조선·플랜트 등 삼성 계열사의 제조 현장도 로봇의 학습 무대가 될... ,"Wed, 22 Jul 2026 00:03:00 +0900"
